name,badge_1,mrp,discounted_price,discount,rating,rating_count,link
"Tulika Bedsheet Set (Beige, Single Size)",,,"₹1,399",,,,https://www.urbanladder.com/products/tulika-bedsheet-set?sku=HDBLBOCTSBGN253&src=subcat
"Surkh Bedsheet Set (Red, Double Size)",,"₹2,199","₹1,539",30% Off,,,https://www.urbanladder.com/products/surkh-bedsheet-set?sku=HDBLBPCTKBRN293&src=subcat
"Surkh Bedsheet Set (Red, Single Size)",,"₹1,399",₹979,30% Off,,,https://www.urbanladder.com/products/surkh-bedsheet-set?sku=HDBLBPCTKBRN292&src=subcat
"Tulika Bedsheet Set (Beige, Double Size)",,"₹2,299","₹1,839",20% Off,,,https://www.urbanladder.com/products/tulika-bedsheet-set?sku=HDBLBPCTDBGN253&src=subcat
"Tulika Bedsheet Set (Beige, Fitted Size)",,,"₹2,599",,,,https://www.urbanladder.com/products/tulika-bedsheet-set?sku=HDBLBPCTDBGF253&src=subcat
"Aadoo Bedsheet Set (Pink, Double Size)",,"₹2,299","₹1,839",20% Off,,,https://www.urbanladder.com/products/aadoo-bedsheet-set?sku=HDBLBPCTDPKN254&src=subcat
"Aadoo Bedsheet Set (Pink, Single Size)",,,"₹1,399",,,,https://www.urbanladder.com/products/aadoo-bedsheet-set?sku=HDBLBOCTSPKN254&src=subcat
"Surkh Bedsheet Set (Red, King Size)",,"₹2,499","₹1,749",30% Off,,,https://www.urbanladder.com/products/surkh-bedsheet-set?sku=HDBLBPCTKBRN294&src=subcat
Monte  Bedsheet Set (Queen Size),,"₹1,699","₹1,189",30% Off,,,https://www.urbanladder.com/products/monte-bedsheet-set?sku=HDBLBPCTWBLF145&src=subcat
Charley Bedsheet Set (King Size),,"₹1,899","₹1,614",15% Off,,,https://www.urbanladder.com/products/charley-bedsheet-set?sku=HDBLBPCTWBLF208&src=subcat
Penrose Bedsheet Set (Queen Size),,"₹1,699","₹1,359",20% Off,,,https://www.urbanladder.com/products/penrose-bedsheet-set?sku=HDBLBPCTWBLF157&src=subcat
Celine Bedsheet Set (King Size),,"₹1,899","₹1,614",15% Off,,,https://www.urbanladder.com/products/celine-bedsheet-set?sku=HDBLBPCTWBLF205&src=subcat
Planck Bedsheet Set (Queen Size),,"₹1,699","₹1,189",30% Off,,,https://www.urbanladder.com/products/planck-bedsheet-set?sku=HDBLBPCTWBLF154&src=subcat
Gabrielle Bedsheet Set (King Size),,"₹1,899","₹1,614",15% Off,,,https://www.urbanladder.com/products/gabrielle-bedsheet-set?sku=HDBLBPCTWBLF196&src=subcat
"Valerie Bedsheet Set (Yellow, Queen Size)",,"₹1,699","₹1,359",20% Off,,,https://www.urbanladder.com/products/valerie-bedsheet-set?sku=HDBLBPCTWBLF174&src=room
"Dirac Bedsheet Set (White, Queen Size)",New Arrival,,"₹1,699",,,,https://www.urbanladder.com/products/dirac-bedsheet-set?sku=HDBLBPCTWBLF155&src=subcat
"Ember Bedsheet Set (Grey, Queen Size)",New Arrival,,"₹1,699",,,,https://www.urbanladder.com/products/ember-bedsheet-set?sku=HDBLBPCTWBLF180&src=subcat
"Arielle Bedsheet Set (Pink, King Size)",,"₹1,899","₹1,519",20% Off,,,https://www.urbanladder.com/products/arielle-bedsheet-set?sku=HDBLBPCTWBLF195&src=subcat
"Emmeline Bedsheet Set (White, Single Size)",New Arrival,,₹999,,,,https://www.urbanladder.com/products/emmeline-bedsheet-set?sku=HDBLBPCTWBLF222&src=subcat
"Clauser Bedsheet Set (White, Queen Size)",,"₹1,699","₹1,359",20% Off,,,https://www.urbanladder.com/products/clauser-bedsheet-set?sku=HDBLBPCTWBLF172&src=subcat
"Isabelle Bedsheet Set (Grey, Queen Size)",,"₹1,699","₹1,444",15% Off,,,https://www.urbanladder.com/products/isabelle-bedsheet-set?sku=HDBLBPCTWBLF173&src=subcat
"Juliette Bedsheet Set (Peach, Queen Size)",New Arrival,,"₹1,699",,,,https://www.urbanladder.com/products/juliette-bedsheet-set?sku=HDBLBPCTWBLF179&src=subcat
"Vivienne Bedsheet Set (Grey, Queen Size)",,"₹1,699","₹1,189",30% Off,,,https://www.urbanladder.com/products/vivienne-bedsheet-set?sku=HDBLBPCTWBLF193&src=subcat
"Margot Bedsheet Set (Dark Blue, Queen Size)",New Arrival,,"₹1,699",,,,https://www.urbanladder.com/products/margot-bedsheet-set?sku=HDBLBPCTWBLF194&src=subcat
"Luka Bedsheet Set (White, King Size)",New Arrival,,"₹1,999",,,,https://www.urbanladder.com/products/luka-bedsheet-set?sku=HDBLBPCTWBLF143&src=subcat
"Yamin  Bedsheet Set (Grey, Queen Size)",,"₹1,699","₹1,189",30% Off,,,https://www.urbanladder.com/products/yamin-bedsheet-set?sku=HDBLBPCTWBLF148&src=subcat
"Adele Bedsheet Set (Dark Blue, King Size)",New Arrival,,"₹1,899",,,,https://www.urbanladder.com/products/adele-bedsheet-set?sku=HDBLBPCTWBLF221&src=subcat
"Elodie Bedsheet Set (White, Single Size)",,₹999,₹699,30% Off,,,https://www.urbanladder.com/products/elodie-bedsheet-set?sku=HDBLBPCTWBLF228&src=subcat
"Nathalie Bedsheet Set (Pink, Single Size)",New Arrival,,₹999,,,,https://www.urbanladder.com/products/nathalie-bedsheet-set?sku=HDBLBPCTWBLF234&src=subcat
"Nancy Bedsheet Set (Peach, Single Size)",New Arrival,,₹999,,,,https://www.urbanladder.com/products/nancy-bedsheet-set?sku=HDBLBPCTWBLF235&src=subcat
"Adam Bedsheet Set (Yellow, Single Size)",New Arrival,,₹999,,,,https://www.urbanladder.com/products/adam-bedsheet-set?sku=HDBLBPCTWBLF241&src=subcat
"Elaina Bedsheet Set (Teal Blue, Queen Size)",New Arrival,,"₹1,699",,,,https://www.urbanladder.com/products/elaina-bedsheet-set?sku=HDBLBPCTWBLF190&src=subcat
"Arnold Bedsheet Set (White, Queen Size)",New Arrival,,"₹1,699",,,,https://www.urbanladder.com/products/arnold-bedsheet-set?sku=HDBLBPCTWBLF166&src=subcat
"Caroll Bedsheet Set (White, Queen Size)",New Arrival,,"₹1,699",,,,https://www.urbanladder.com/products/caroll-bedsheet-set?sku=HDBLBPCTWBLF171&src=subcat
"Annabelle Bedsheet Set (Pink, Queen Size)",New Arrival,,"₹1,699",,,,https://www.urbanladder.com/products/annabelle-bedsheet-set?sku=HDBLBPCTWBLF178&src=subcat
"Madeleine Bedsheet Set (Grey, King Size)",New Arrival,,"₹1,899",,,,https://www.urbanladder.com/products/madeleine-bedsheet-set?sku=HDBLBPCTWBLF199&src=subcat
"Julian Bedsheet Set (White, Queen Size)",New Arrival,,"₹1,699",,,,https://www.urbanladder.com/products/julian-bedsheet-set?sku=HDBLBPCTWBLF156&src=subcat
"Valerie Bedsheet Set (Yellow, Queen Size)",,"₹1,699","₹1,359",20% Off,,,https://www.urbanladder.com/products/valerie-bedsheet-set?sku=HDBLBPCTWBLF174&src=room
"Dirac Bedsheet Set (White, Queen Size)",New Arrival,,"₹1,699",,,,https://www.urbanladder.com/products/dirac-bedsheet-set?sku=HDBLBPCTWBLF155&src=subcat
"Ember Bedsheet Set (Grey, Queen Size)",New Arrival,,"₹1,699",,,,https://www.urbanladder.com/products/ember-bedsheet-set?sku=HDBLBPCTWBLF180&src=subcat
"Arielle Bedsheet Set (Pink, King Size)",,"₹1,899","₹1,519",20% Off,,,https://www.urbanladder.com/products/arielle-bedsheet-set?sku=HDBLBPCTWBLF195&src=subcat
"Emmeline Bedsheet Set (White, Single Size)",New Arrival,,₹999,,,,https://www.urbanladder.com/products/emmeline-bedsheet-set?sku=HDBLBPCTWBLF222&src=subcat
"Sydney Bedsheet Set (White, Queen Size)",New Arrival,,"₹1,699",,,,https://www.urbanladder.com/products/sydney-bedsheet-set?sku=HDBLBPCTWBLF181&src=subcat
"Almano Bedsheet Set (White, King Size)",,"₹1,999","₹1,399",30% Off,,,https://www.urbanladder.com/products/almano-bedsheet-set?sku=HDBLBPCTWBLF142&src=subcat
"Chanel Bedsheet Set (Grey, Single Size)",,₹999,₹699,30% Off,,,https://www.urbanladder.com/products/chanel-bedsheet-set?sku=HDBLBPCTWBLF223&src=subcat
"Sylvie Bedsheet Set (Yellow, Single Size)",,₹999,₹699,30% Off,,,https://www.urbanladder.com/products/sylvie-bedsheet-set?sku=HDBLBPCTWBLF230&src=subcat
"Christine Bedsheet Set (White, Single Size)",New Arrival,,₹999,,,,https://www.urbanladder.com/products/christine-bedsheet-set?sku=HDBLBPCTWBLF237&src=subcat
"Himalayan Poppies Bedsheet Set (Purple, Double Size, Fitted Bedsheet Type)",,,"₹2,599",,,,https://www.urbanladder.com/products/himalayan-poppies-bedsheet-set?sku=HDBLBPCTDPUN314&src=subcat
"Himalayan Poppies Bedsheet Set (Yellow, Single Size, Regular Bedsheet Type)",,,"₹1,399",,,,https://www.urbanladder.com/products/himalayan-poppies-bedsheet-set?sku=HDBLBOCTSYLN301&src=room
"Saptaparni Bedsheet Set (Green, Single Size, Regular Bedsheet Type)",,,"₹1,399",,,,https://www.urbanladder.com/products/saptaparni-bedsheet-set?sku=HDBLBOCTSGRN304&src=subcat
"Saptaparni Bedsheet Set (Yellow, King Size, Regular Bedsheet Type)",,"₹2,599","₹1,819",30% Off,,,https://www.urbanladder.com/products/saptaparni-bedsheet-set?sku=HDBLBPCTKYLN311&src=subcat
"Saptaparni Bedsheet Set (Yellow, Double Size, Fitted Bedsheet Type)",,,"₹2,599",,,,https://www.urbanladder.com/products/saptaparni-bedsheet-set?sku=HDBLBPCTDYLN315&src=subcat
"Saptaparni Bedsheet Set (Green, King Size, Regular Bedsheet Type)",,,"₹2,599",,,,https://www.urbanladder.com/products/saptaparni-bedsheet-set?sku=HDBLBPCTKGRN312&src=subcat
Lula Bedsheet Set (Double Size),,,"₹2,199",,,,https://www.urbanladder.com/products/lula-bedsheet-set?sku=HDBLBPCTKBLF162&src=subcat
Jay Bedsheet Set (Single Size),,,"₹1,299",,,,https://www.urbanladder.com/products/jay-bedsheet-set?sku=HDBLBPCTKBLF169&src=room
Marion Bedsheet Set (Single Size),,"₹1,599","₹1,279",20% Off,,,https://www.urbanladder.com/products/marion-bedsheet-set?sku=HDBLBPCTKBLF185&src=subcat
Alexis Bedsheet Set (King Size),,,"₹3,299",,,,https://www.urbanladder.com/products/alexis-bedsheet-set?sku=HDBLBPCTKBLF192&src=room
Shelly Bedsheet Set (Double Size),,"₹2,199","₹1,759",20% Off,,,https://www.urbanladder.com/products/shelly-bedsheet-set?sku=HDBLBPCTKBLF166&src=subcat
Poole Bedsheet Set (Single Size),,"₹1,299","₹1,039",20% Off,,,https://www.urbanladder.com/products/poole-bedsheet-set?sku=HDBLBPCTKBLF173&src=subcat
Eula Bedsheet Set (Queen Size),,,"₹1,299",,,,https://www.urbanladder.com/products/eula-bedsheet-set?sku=HDBLBPCTQMLN524&src=subcat
"Saptaparni Bedsheet Set (Green, King Size, Regular Bedsheet Type)",,,"₹2,599",,,,https://www.urbanladder.com/products/saptaparni-bedsheet-set?sku=HDBLBPCTKGRN312&src=subcat
"Himalayan Poppies Bedsheet Set (Yellow, King Size, Regular Bedsheet Type)",,"₹2,599","₹1,819",30% Off,,,https://www.urbanladder.com/products/himalayan-poppies-bedsheet-set?sku=HDBLBPCTKYLN309&src=subcat
"Himalayan Poppies Bedsheet Set (Purple, Single Size, Regular Bedsheet Type)",,,"₹1,399",,,,https://www.urbanladder.com/products/himalayan-poppies-bedsheet-set?sku=HDBLBOCTSPUN302&src=room
Holly Bedsheet Set (Double Size),,,"₹2,699",,,,https://www.urbanladder.com/products/holly-bedsheet-set?sku=HDBLBPCTKBLF194&src=subcat
Todd Bedsheet Set (Double Size),,,"₹2,199",,,,https://www.urbanladder.com/products/todd-bedsheet-set?sku=HDBLBPCTKBLF158&src=subcat
Fox Bedsheet Set (Queen Size),,"₹1,299","₹1,039",20% Off,,,https://www.urbanladder.com/products/fox-bedsheet-set?sku=HDBLBPCTQMLN523&src=subcat
Eula Bedsheet Set (Queen Size),,,"₹1,299",,,,https://www.urbanladder.com/products/eula-bedsheet-set?sku=HDBLBPCTQMLN524&src=subcat
Tara Bedsheet Set (Queen Size),,,"₹1,299",,,,https://www.urbanladder.com/products/tara-bedsheet-set?sku=HDBLBPCTQMLN531&src=subcat
Holly Bedsheet Set (King Size),,,"₹3,299",,,,https://www.urbanladder.com/products/holly-bedsheet-set?sku=HDBLBPCTKBLF196&src=room
Lula Bedsheet Set (King Size),,"₹2,699","₹1,889",30% Off,,,https://www.urbanladder.com/products/lula-bedsheet-set?sku=HDBLBPCTKBLF163&src=subcat
Lance Bedsheet Set (King Size),,"₹2,699","₹2,159",20% Off,,,https://www.urbanladder.com/products/lance-bedsheet-set?sku=HDBLBPCTKBLF151&src=subcat
"Himalayan Poppies Bedsheet Set (Yellow, Double Size, Regular Bedsheet Type)",,,"₹2,299",,,,https://www.urbanladder.com/products/himalayan-poppies-bedsheet-set?sku=HDBLBPCTDYLN305&src=subcat
Juan Bedsheet Set (Queen Size),,,"₹1,299",,,,https://www.urbanladder.com/products/juan-bedsheet-set?sku=HDBLBPCTQMLN522&src=room
"Clauser Bedsheet Set (White, Queen Size)",,"₹1,699","₹1,359",20% Off,,,https://www.urbanladder.com/products/clauser-bedsheet-set?sku=HDBLBPCTWBLF172&src=subcat
"Isabelle Bedsheet Set (Grey, Queen Size)",,"₹1,699","₹1,444",15% Off,,,https://www.urbanladder.com/products/isabelle-bedsheet-set?sku=HDBLBPCTWBLF173&src=subcat
"Juliette Bedsheet Set (Peach, Queen Size)",New Arrival,,"₹1,699",,,,https://www.urbanladder.com/products/juliette-bedsheet-set?sku=HDBLBPCTWBLF179&src=subcat
"Vivienne Bedsheet Set (Grey, Queen Size)",,"₹1,699","₹1,189",30% Off,,,https://www.urbanladder.com/products/vivienne-bedsheet-set?sku=HDBLBPCTWBLF193&src=subcat
"Margot Bedsheet Set (Dark Blue, Queen Size)",New Arrival,,"₹1,699",,,,https://www.urbanladder.com/products/margot-bedsheet-set?sku=HDBLBPCTWBLF194&src=subcat
"Adele Bedsheet Set (Dark Blue, King Size)",New Arrival,,"₹1,899",,,,https://www.urbanladder.com/products/adele-bedsheet-set?sku=HDBLBPCTWBLF221&src=subcat
"Elodie Bedsheet Set (White, Single Size)",,₹999,₹699,30% Off,,,https://www.urbanladder.com/products/elodie-bedsheet-set?sku=HDBLBPCTWBLF228&src=subcat
"Nathalie Bedsheet Set (Pink, Single Size)",New Arrival,,₹999,,,,https://www.urbanladder.com/products/nathalie-bedsheet-set?sku=HDBLBPCTWBLF234&src=subcat
"Nancy Bedsheet Set (Peach, Single Size)",New Arrival,,₹999,,,,https://www.urbanladder.com/products/nancy-bedsheet-set?sku=HDBLBPCTWBLF235&src=subcat
"August Bedsheet Set (Grey, Single Size)",New Arrival,,₹999,,,,https://www.urbanladder.com/products/august-bedsheet-set?sku=HDBLBPCTWBLF242&src=subcat
"Luka Bedsheet Set (White, King Size)",New Arrival,,"₹1,999",,,,https://www.urbanladder.com/products/luka-bedsheet-set?sku=HDBLBPCTWBLF143&src=subcat
"Yamin  Bedsheet Set (Grey, Queen Size)",,"₹1,699","₹1,189",30% Off,,,https://www.urbanladder.com/products/yamin-bedsheet-set?sku=HDBLBPCTWBLF148&src=subcat
"Remy Bedsheet Set (White, King Size)",,"₹1,899","₹1,614",15% Off,,,https://www.urbanladder.com/products/remy-bedsheet-set?sku=HDBLBPCTWBLF207&src=subcat
"Saptaparni Bedsheet Set (Yellow, Single Size, Regular Bedsheet Type)",,,"₹1,399",,,,https://www.urbanladder.com/products/saptaparni-bedsheet-set?sku=HDBLBOCTSYLN303&src=subcat
"Saptaparni Bedsheet Set (Green, Double Size, Fitted Bedsheet Type)",,,"₹2,599",,,,https://www.urbanladder.com/products/saptaparni-bedsheet-set?sku=HDBLBPCTDGRN316&src=subcat
"Dirac Bedsheet Set (White, Queen Size)",New Arrival,,"₹1,699",,,,https://www.urbanladder.com/products/dirac-bedsheet-set?sku=HDBLBPCTWBLF155&src=subcat
"Ember Bedsheet Set (Grey, Queen Size)",New Arrival,,"₹1,699",,,,https://www.urbanladder.com/products/ember-bedsheet-set?sku=HDBLBPCTWBLF180&src=subcat
Ebony Bedsheet Set (Single Size),,,"₹1,299",,,,https://www.urbanladder.com/products/ebony-bedsheet-set?sku=HDBLBPCTKBLF177&src=room
Marion Bedsheet Set (King Size),,,"₹3,299",,,,https://www.urbanladder.com/products/marion-bedsheet-set?sku=HDBLBPCTKBLF188&src=room
Price Bedsheet Set (Single Size),,,"₹1,599",,,,https://www.urbanladder.com/products/price-bedsheet-set?sku=HDBLBPCTKBLF201&src=room
Eula Bedsheet Set (Queen Size),,,"₹1,299",,,,https://www.urbanladder.com/products/eula-bedsheet-set?sku=HDBLBPCTQMLN524&src=subcat
Tara Bedsheet Set (Queen Size),,,"₹1,299",,,,https://www.urbanladder.com/products/tara-bedsheet-set?sku=HDBLBPCTQMLN531&src=subcat
Shelly Bedsheet Set (Double Size),,"₹2,199","₹1,759",20% Off,,,https://www.urbanladder.com/products/shelly-bedsheet-set?sku=HDBLBPCTKBLF166&src=subcat
Poole Bedsheet Set (Single Size),,"₹1,299","₹1,039",20% Off,,,https://www.urbanladder.com/products/poole-bedsheet-set?sku=HDBLBPCTKBLF173&src=subcat
"Himalayan Poppies Bedsheet Set (Purple, Double Size, Regular Bedsheet Type)",,"₹2,299","₹1,609",30% Off,,,https://www.urbanladder.com/products/himalayan-poppies-bedsheet-set?sku=HDBLBPCTDPUN306&src=subcat
"Himalayan Poppies Bedsheet Set (Yellow, Double Size, Fitted Bedsheet Type)",,,"₹2,599",,,,https://www.urbanladder.com/products/himalayan-poppies-bedsheet-set?sku=HDBLBPCTDYLN313&src=subcat
Kelly Bedsheet Set (Single Size),,"₹1,799","₹1,259",30% Off,,,https://www.urbanladder.com/products/kelly-bedsheet-set?sku=HDBLBPCTKBLF213&src=room
