name,badge_1,badge_2,badge_3,mrp,discounted_price,discount,rating,rating_count,link
"Lakme Peach Milk Moisturizer Body Lotion, Lightweight, Non-Sticky, Locks Moisture For 12 Hours, 200 ml  ",Prime Day Deal,Sponsored,,₹310,₹244,Save ₹66 (21%),4.3 out of 5 stars,"11,672",https://www.amazon.in/gp/slredirect/picassoRedirect.html/ref=pa_sp_atf_aps_sr_pg1_1?ie=UTF8&adId=A045158430402FVRUZXJ8&url=%2FLakme-Peach-Milk-Moisturizer-Lotion%2Fdp%2FB00UFF8PZ2%2Fref%3Dsr_1_1_sspa%3Fdchild%3D1%26keywords%3Dmoisturizer%26qid%3D1627317479%26smid%3DAT95IG9ONZD7S%26sr%3D8-1-spons%26psc%3D1&qualifier=1627317479&id=3715452676427602&widgetName=sp_atf
"MCaffeine Naked and Rich Choco Body Lotion | Deep Moisturization | Cocoa, Caramel | Dry Skin | Paraben and Mineral Oil-Free for all skin types | 200 ml  ",Prime Day Deal,Sponsored,,₹395,₹296,Save ₹99 (25%),4.4 out of 5 stars,807,https://www.amazon.in/gp/slredirect/picassoRedirect.html/ref=pa_sp_atf_aps_sr_pg1_1?ie=UTF8&adId=A01983782NOJDJRU94FY6&url=%2FmCaffeine-Moisturization-Caramel-Paraben-Mineral%2Fdp%2FB07YL69GCF%2Fref%3Dsr_1_2_sspa%3Fdchild%3D1%26keywords%3Dmoisturizer%26qid%3D1627317479%26smid%3DA2A53F3N8CEFWW%26sr%3D8-2-spons%26psc%3D1&qualifier=1627317479&id=3715452676427602&widgetName=sp_atf
"Cetaphil Moisturising Lotion, 250ml  ",,Sponsored,,₹885,₹745,Save ₹140 (16%),4.4 out of 5 stars,"5,026",https://www.amazon.in/gp/slredirect/picassoRedirect.html/ref=pa_sp_atf_aps_sr_pg1_1?ie=UTF8&adId=A09199031WGE7W6QW9ULT&url=%2FCetaphil-Moisturising-Lotion-Sensitive-250ml%2Fdp%2FB01IPBVK36%2Fref%3Dsr_1_3_sspa%3Fdchild%3D1%26keywords%3Dmoisturizer%26qid%3D1627317479%26sr%3D8-3-spons%26psc%3D1&qualifier=1627317479&id=3715452676427602&widgetName=sp_atf
"Aveeno Daily Moisturising Lotion, 71 ml  ",,Sponsored,,₹250,₹243,Save ₹7 (3%),4.3 out of 5 stars,851,https://www.amazon.in/gp/slredirect/picassoRedirect.html/ref=pa_sp_atf_aps_sr_pg1_1?ie=UTF8&adId=A01181921U7SY25P25I93&url=%2FAveeno-Daily-Moisturising-Lotion-71%2Fdp%2FB00ET03FMC%2Fref%3Dsr_1_4_sspa%3Fdchild%3D1%26keywords%3Dmoisturizer%26qid%3D1627317479%26sr%3D8-4-spons%26psc%3D1&qualifier=1627317479&id=3715452676427602&widgetName=sp_atf
"Biotique Morning Nectar Flawless Skin moisturizer for All Skin Types, 190ml  ",Amazon's ChoicePrime Day Deal,,,₹280,₹182,Save ₹98 (35%),4.3 out of 5 stars,"18,317",https://www.amazon.in/Biotique-Morning-Nectar-Flawless-Lotion/dp/B006NVDWGE/ref=ice_ac_b_dpb?dchild=1&keywords=moisturizer&qid=1627317479&smid=AT95IG9ONZD7S&sr=8-5
Neutriderm Moisturising Lotion w/Vitamin E - 125 mL  ,,,,,₹850,,4.4 out of 5 stars,"5,783",https://www.amazon.in/Neutriderm-Vitamin-Moisturising-Lotion-125/dp/B00GSXY6DU/ref=sr_1_6?dchild=1&keywords=moisturizer&qid=1627317479&sr=8-6
"NIVEA Soft Light Moisturizer Cream, with Vitamin E & Jojoba Oil for Face, Hands and Body, 300 ml  ",Best sellerPrime Day Deal,,,₹399,₹253,Save ₹146 (37%),4.4 out of 5 stars,"30,123",https://www.amazon.in/gp/bestsellers/beauty/10257749031/ref=sr_bs_6_10257749031_1
"Minimalist Sepicalm 3% Oats Face Moisturizer for Oily, Acne Prone Skin, 50 ml | Overnight Repair Night Cream for Women & Men | Non comedogenic & Fragrance free  ",Prime Day Deal,,,₹349,₹331,Save ₹18 (5%),4.1 out of 5 stars,"1,947",https://www.amazon.in/Minimalist-Moisturizer-Overnight-comedogenic-Fragrance/dp/B08PKFFWTY/ref=sr_1_8?dchild=1&keywords=moisturizer&qid=1627317479&smid=A3OQ22QWZ4ZJKQ&sr=8-8
"NIVEA Body Lotion for Very Dry Skin, Nourishing Body Milk with 2x Almond Oil, For Men & Women, 400 ml  ",Prime Day Deal,,,₹399,₹253,Save ₹146 (37%),4.4 out of 5 stars,"28,121",https://www.amazon.in/Nivea-Nourishing-Lotion-Moisture-Almond/dp/B00IJ72QWQ/ref=sr_1_9?dchild=1&keywords=moisturizer&qid=1627317479&smid=AT95IG9ONZD7S&sr=8-9
"Vaseline Intensive Care 24 hr nourishing Cocoa Glow Body Lotion with Cocoa And Shea Butter, Restores Glow for all skin type - 400 ml  ",Prime Day Deal,,,₹399,₹262,Save ₹137 (34%),4.4 out of 5 stars,"20,468",https://www.amazon.in/Vaseline-Intensive-Care-Cocoa-Lotion/dp/B07W44MH3W/ref=sr_1_10?dchild=1&keywords=moisturizer&qid=1627317479&smid=AT95IG9ONZD7S&sr=8-10
"Mamaearth Oil-Free Moisturizer For Face With Apple Cider Vinegar For Acne Prone Skin, 80 ml  ",Prime Day Deal,,,₹299,₹253,Save ₹46 (15%),4.0 out of 5 stars,"6,770",https://www.amazon.in/Mamaearth-Oil-Free-Moisturizer-Apple-Vinegar/dp/B07STDDDGF/ref=sr_1_11?dchild=1&keywords=moisturizer&qid=1627317479&smid=A61C6NUFGVGS7&sr=8-11
Mamaearth Vitamin C Oil-Free Moisturizer For Face with Vitamin C & Gotu Kola for Skin Illumination – 80 ml  ,Prime Day Deal,,,₹299,₹253,Save ₹46 (15%),4.4 out of 5 stars,68,https://www.amazon.in/Mamaearth-Vitamin-Oil-Free-Moisturizer-Illumination/dp/B096W78HTH/ref=sr_1_12?dchild=1&keywords=moisturizer&qid=1627317479&smid=A61C6NUFGVGS7&sr=8-12
"Lakme Peach Milk Soft Creme Moisturizer, Lightweight Face Cream, Non Sticky, Locks Moisture For 24 Hours For Soft And Glowing Skin, 150 g  ",,,,₹249,₹174,Save ₹75 (30%),4.3 out of 5 stars,"5,853",https://www.amazon.in/Lakm%C3%A9-Peach-Milk-Soft-cr%C3%A8me/dp/B07JBT7ZTT/ref=sr_1_13?dchild=1&keywords=moisturizer&qid=1627317479&sr=8-13
Mamaearth Aqua Glow Gel Face Moisturizer With Himalayan Thermal Water and Hyaluronic Acid for 72 Hours Hydration – 100ml  ,Prime Day Deal,,,₹699,₹593,Save ₹106 (15%),4.8 out of 5 stars,38,https://www.amazon.in/Mamaearth-Moisturizer-Himalayan-Hyaluronic-Hydration/dp/B098P6RN7H/ref=sr_1_14?dchild=1&keywords=moisturizer&qid=1627317479&smid=A61C6NUFGVGS7&sr=8-14
"POND'S Super Light Gel Face Moisturiser with Hyaluronic Acid and Vitamin E, 147 g  ",Prime Day Deal,,,₹299,₹194,Save ₹105 (35%),4.4 out of 5 stars,"16,317",https://www.amazon.in/Ponds-Super-Light-Gel-Moisturiser/dp/B07T8NWDJV/ref=sr_1_15?dchild=1&keywords=moisturizer&qid=1627317479&smid=AT95IG9ONZD7S&sr=8-15
"Vaseline Rose Water Moisturizing Gel, 200 g  ",Limited time deal,,,₹250,₹175,Save ₹75 (30%),4.2 out of 5 stars,598,https://www.amazon.in/Vaseline-Rose-Water-Moisturizing-Gel/dp/B085WK15TF/ref=sr_1_16?dchild=1&keywords=moisturizer&qid=1627317479&sr=8-16
"Parachute Advansed Body Lotion Deep Nourish, 400 ml  ",,,,₹275,₹135,Save ₹140 (51%),4.3 out of 5 stars,"16,883",https://www.amazon.in/Parachute-Advansed-Body-Lotion-Nourish/dp/B00CBRJ34E/ref=sr_1_17?dchild=1&keywords=moisturizer&qid=1627317479&sr=8-17
"Neutrogena Hydro Boost Water Gel, White, 15 g  ",,,,₹370,₹333,Save ₹37 (10%),4.2 out of 5 stars,"1,086",https://www.amazon.in/Neutrogena-Hydro-Boost-Water-White/dp/B08HRCNFCM/ref=sr_1_18?dchild=1&keywords=moisturizer&qid=1627317479&sr=8-18
"Aroma Magic Juniper Berry Oil Free Moisturiser, 100ml  ",,,,₹190,₹154,Save ₹36 (19%),3.9 out of 5 stars,"1,922",https://www.amazon.in/Aroma-Magic-Juniper-Berry-Moisturiser/dp/B06XVQFSS8/ref=sr_1_19?dchild=1&keywords=moisturizer&qid=1627317479&sr=8-19
"NIVEA Men Fresh Face Moisturizer Gel, Non Sticky & Light Moisturization, 30 Ml, 30 ml  ",,,,₹95,₹81,Save ₹14 (15%),3.8 out of 5 stars,13,https://www.amazon.in/NIVEA-Fresh-Moisturizer-Sticky-Moisturization/dp/B08YFB576S/ref=sr_1_20?dchild=1&keywords=moisturizer&qid=1627317479&sr=8-20
"WOW Skin Science Aloe Vera Body Lotion - Ultra Light Hydration - No Mineral Oil, Parabens, Silicones, Color and PG for Skin Combination (300mL)  ",Prime Day Deal,Sponsored,,₹399,₹212,Save ₹187 (47%),4.1 out of 5 stars,"1,373",https://www.amazon.in/gp/slredirect/picassoRedirect.html/ref=pa_sp_mtf_aps_sr_pg1_1?ie=UTF8&adId=A07106943CXUX74VCAAS2&url=%2FWOW-Lotion-Ultra-Light-Hydration%2Fdp%2FB07JZ1XQQB%2Fref%3Dsr_1_21_sspa%3Fdchild%3D1%26keywords%3Dmoisturizer%26qid%3D1627317479%26smid%3DAT95IG9ONZD7S%26sr%3D8-21-spons%26psc%3D1&qualifier=1627317479&id=3715452676427602&widgetName=sp_mtf
Dermafique Dermatologist Tested Intensive Restore Body Serum for Dry Skin (300 ml)  ,,Sponsored,,₹350,₹245,Save ₹105 (30%),4.5 out of 5 stars,458,https://www.amazon.in/gp/slredirect/picassoRedirect.html/ref=pa_sp_mtf_aps_sr_pg1_1?ie=UTF8&adId=A019018323SGEX7WDF7TE&url=%2FDermafique-Intensive-Restore-Serum-300ml%2Fdp%2FB07J9KYL4L%2Fref%3Dsr_1_22_sspa%3Fdchild%3D1%26keywords%3Dmoisturizer%26qid%3D1627317479%26sr%3D8-22-spons%26psc%3D1&qualifier=1627317479&id=3715452676427602&widgetName=sp_mtf
"Enchanteur Charming Perfumed Body Lotion, 500ml, with Aloe Vera & Olive Butter for Satin Smooth Skin  ",,Sponsored,,₹475,₹333,Save ₹142 (30%),4.2 out of 5 stars,687,https://www.amazon.in/gp/slredirect/picassoRedirect.html/ref=pa_sp_mtf_aps_sr_pg1_1?ie=UTF8&adId=A0253373103H44LV78OT3&url=%2FEnchanteur-Charming-Lotion-Women-500ml%2Fdp%2FB01N9ZUAXR%2Fref%3Dsr_1_23_sspa%3Fdchild%3D1%26keywords%3Dmoisturizer%26qid%3D1627317479%26sr%3D8-23-spons%26psc%3D1&qualifier=1627317479&id=3715452676427602&widgetName=sp_mtf
"Santoor, Perfumed Body Lotion for Extra Moisturizing 250ml Combination Buy1 Get1 Free, Sandalwood, 500 ml  ",,Sponsored,,₹378,₹170,Save ₹208 (55%),4.1 out of 5 stars,"1,548",https://www.amazon.in/gp/slredirect/picassoRedirect.html/ref=pa_sp_mtf_aps_sr_pg1_1?ie=UTF8&adId=A081701642BPB56Y7HPQ&url=%2FSantoor-Extra-Moisturising-Lotion-250ml%2Fdp%2FB07HDGHKQ1%2Fref%3Dsr_1_24_sspa%3Fdchild%3D1%26keywords%3Dmoisturizer%26qid%3D1627317479%26sr%3D8-24-spons%26psc%3D1&qualifier=1627317479&id=3715452676427602&widgetName=sp_mtf
Plum Green Tea Oil Free Moisturizer | Contains Niacinamide & Hyaluronic Acid | 100% Fragrance Free | Natural Moisturizers Like Squalane | Oil-free Moisturizer For Daily Use  ,,,,₹470,₹352.50,Save ₹117.50 (25%),4.0 out of 5 stars,277,https://www.amazon.in/Plum-Moisturizer-Niacinamide-Hyaluronic-Moisturizers/dp/B08ZL8YM1B/ref=sr_1_25?dchild=1&keywords=moisturizer&qid=1627317479&sr=8-25
"POND'S Light Moisturiser, Non- Oily With Vitamin E And Glycerine, For Soft And Glowing Skin, 250 ml  ",Prime Day Deal,,,₹299,₹176,Save ₹123 (41%),4.3 out of 5 stars,"10,136",https://www.amazon.in/PONDS-SG_B07KFTCQYD_IN-Ponds-Light-Moisturiser/dp/B07KFTCQYD/ref=sr_1_26?dchild=1&keywords=moisturizer&qid=1627317479&smid=AT95IG9ONZD7S&sr=8-26
The Derma Co 1% Salicylic Acid Oil-Free Face Moisturizer with Oat Extract for Active Acne - 50g(dermaco)  ,Prime Day Deal,,,₹349,₹313,Save ₹36 (10%),,,https://www.amazon.in/Derma-Co-Salicylic-Oil-Free-Moisturizer/dp/B0989V1DQC/ref=sr_1_27?dchild=1&keywords=moisturizer&qid=1627317479&smid=A61C6NUFGVGS7&sr=8-27
"Biotique Bio Morning Nectar Visibly Flawless Skin Moisturizer, 120ml  ",,,,₹199,₹123,Save ₹76 (38%),4.3 out of 5 stars,"1,618",https://www.amazon.in/Biotique-Morning-Nectar-Flawless-Lotion/dp/B00791CORK/ref=sr_1_28?dchild=1&keywords=moisturizer&qid=1627317479&sr=8-28
Vaseline Intensive Care Deep Moisture Body Lotion 600 ml  ,Prime Day Deal,,,₹449,₹314,Save ₹135 (30%),4.5 out of 5 stars,"5,890",https://www.amazon.in/Vaseline-Intensive-Care-Moisture-Lotion/dp/B08M4T5FJG/ref=sr_1_29?dchild=1&keywords=moisturizer&qid=1627317479&smid=AT95IG9ONZD7S&sr=8-29
"Plum Green Tea Mattifying Moisturizer | For Oily, Acne-Prone Skin | With Green Tea Extracts | Lightweight, Matte Formula | Clear, Moisturized Skin | 100% Vegan | 50ml  ",Prime Day Deal,,,₹470,₹329,Save ₹141 (30%),4.1 out of 5 stars,"4,405",https://www.amazon.in/Plum-Green-Mattifying-Moisturizer-50ml/dp/B00OCJ5PUU/ref=sr_1_30?dchild=1&keywords=moisturizer&qid=1627317479&smid=AT95IG9ONZD7S&sr=8-30
"Aveeno Daily Moisturising Lotion, 71 ml  ",,,,₹250,₹243,Save ₹7 (3%),4.3 out of 5 stars,851,https://www.amazon.in/Aveeno-Daily-Moisturising-Lotion-71/dp/B00ET03FMC/ref=sr_1_31?dchild=1&keywords=moisturizer&qid=1627317479&sr=8-31
"UrbanBotanics® Oil Free Moisturizer For Face - Mattifying Moisturiser Face Cream for Oily/Acne Prone/Normal Skin - with Neem & Basil Extract, Face Moisturizer For Women & men - 100ml  ",Prime Day Deal,,,₹349,₹275,Save ₹74 (21%),4.1 out of 5 stars,"2,793",https://www.amazon.in/UrbanBotanics%C2%AE-Neem-Basil-Mattifying-Moisturizer/dp/B07Y3XB8HZ/ref=sr_1_32?dchild=1&keywords=moisturizer&qid=1627317479&smid=A36E8R9V12RTSM&sr=8-32
RE' EQUIL Ceramide & Hyaluronic Acid Moisturiser For Normal to Dry Skin -100 g  ,Prime Day Deal,,,₹350,₹297.50,Save ₹52.50 (15%),4.3 out of 5 stars,704,https://www.amazon.in/RE-EQUIL-Ceramide-Hyaluronic-Moisturiser/dp/B082KWT81N/ref=sr_1_33?dchild=1&keywords=moisturizer&qid=1627317479&smid=A1KX6TOPJZ1Y1F&sr=8-33
"Mamaearth Vitamin C Ultra Light Gel Oil-Free Moisturizer For Face, Body and Hands; with Vitamin C & Aloe Vera Water for Glowing Hydration - 200 ml  ",Prime Day Deal,,,₹349,₹296,Save ₹53 (15%),4.1 out of 5 stars,331,https://www.amazon.in/Mamaearth-Vitamin-Oil-Free-Moisturizer-Hydration/dp/B093H9K16H/ref=sr_1_34?dchild=1&keywords=moisturizer&qid=1627317479&smid=A61C6NUFGVGS7&sr=8-34
Mamaearth Tea Tree Oil-Free Moisturizer For Face For Oily Skin with Tea Tree & Salicylic Acid for Acne & Pimples – 80 ml  ,Prime Day Deal,,,₹299,₹253,Save ₹46 (15%),4.0 out of 5 stars,9,https://www.amazon.in/Mamaearth-Oil-Free-Moisturizer-Salicylic-Pimples/dp/B096W6LRBF/ref=sr_1_35?dchild=1&keywords=moisturizer&qid=1627317479&smid=A61C6NUFGVGS7&sr=8-35
"Neutrogena Combi Skin Moisture For Combination Skin, 118ml  ",,,,₹429,₹360,Save ₹69 (16%),4.1 out of 5 stars,"5,674",https://www.amazon.in/Neutrogena-Oil-Free-Moisture-Combination-Moisturizer/dp/B00027EGI8/ref=sr_1_36?dchild=1&keywords=moisturizer&qid=1627317479&sr=8-36
"Lakme Peach Milk Moisturizer Body Lotion, Lightweight, Non-Sticky, Locks Moisture For 12 Hours, 200 ml  ",Prime Day Deal,,,₹310,₹244,Save ₹66 (21%),4.3 out of 5 stars,"11,672",https://www.amazon.in/Lakme-Peach-Milk-Moisturizer-Lotion/dp/B00UFF8PZ2/ref=sr_1_37?dchild=1&keywords=moisturizer&qid=1627317479&smid=AT95IG9ONZD7S&sr=8-37
"Himalaya Herbals Cocoa Butter Intensive Body Lotion, 400ml  ",Prime Day Deal,,,₹260,₹196,Save ₹64 (25%),4.3 out of 5 stars,"12,211",https://www.amazon.in/Himalaya-Herbals-Butter-Intensive-Lotion/dp/B006G84AA6/ref=sr_1_38?dchild=1&keywords=moisturizer&qid=1627317479&smid=AT95IG9ONZD7S&sr=8-38
"Brinton AcMist Moisturizing Cream Gel for Acne Prone and Oily Skin, Skin Cream, Moisture Cream, Moisturizing Cream, Dry Skin Cream, Skin Care Cream, 50 g  ",,,,₹399,₹336,Save ₹63 (16%),4.3 out of 5 stars,345,https://www.amazon.in/Brinton-AcMist-Moisturizing-Cream-Weight/dp/B07CG4KDGD/ref=sr_1_39?dchild=1&keywords=moisturizer&qid=1627317479&sr=8-39
"Lotus Herbals Cocomoist Cocoa Butter Moisturising Lotion, 170ml  ",,,,₹395,₹256,Save ₹139 (35%),4.4 out of 5 stars,"1,230",https://www.amazon.in/Lotus-Herbals-Cocomoist-Butter-Moisturising/dp/B008TO7DEA/ref=sr_1_40?dchild=1&keywords=moisturizer&qid=1627317479&sr=8-40
"Lotus Herbal Shea Butter and Real Strawberry 24 Hour Moisturiser, 60g  ",,,,₹195,₹156.04,Save ₹38.96 (20%),4.3 out of 5 stars,"1,532",https://www.amazon.in/Lotus-Herbal-Sheamoist-Strawberry-Moisturiser/dp/B00791FL0M/ref=sr_1_41?dchild=1&keywords=moisturizer&qid=1627317479&sr=8-41
"WOW Skin Revive Nectar No Parabens & Mineral Oil Moisturiser, 300mL  ",Prime Day Deal,,,₹499,₹242,Save ₹257 (52%),4.1 out of 5 stars,"1,680",https://www.amazon.in/WOW-Revive-Parabens-Mineral-Moisturiser/dp/B0714CCGMZ/ref=sr_1_42?dchild=1&keywords=moisturizer&qid=1627317479&smid=AT95IG9ONZD7S&sr=8-42
"NIVEA Soft Light Moisturizer Cream, Playful Peach, with Vitamin E & Jojoba Oil for Face, Hands and Body 200 ml  ",,,,₹325,₹243.75,Save ₹81.25 (25%),,,https://www.amazon.in/NIVEA-Moisturizer-Playful-Vitamin-Jojoba/dp/B0991N9YS2/ref=sr_1_43?dchild=1&keywords=moisturizer&qid=1627317479&sr=8-43
"POND'S Super Light Gel Face Moisturiser with Hyaluronic Acid and Vitamin E, 73 g  ",,,,₹150,₹131,Save ₹19 (13%),4.3 out of 5 stars,"4,768",https://www.amazon.in/Ponds-Super-Light-Gel-Moisturiser/dp/B07TG3QC5L/ref=sr_1_44?dchild=1&keywords=moisturizer&qid=1627317479&sr=8-44
"Vaseline Intensive Care Aloe Fresh Body Lotion, with Aloe Extract, Non Greasy, Non Sticky Formula For Hand & Body for Normal Skin 400 ml  ",Prime Day Deal,,,₹385,₹225,Save ₹160 (42%),4.4 out of 5 stars,"10,411",https://www.amazon.in/Vaseline-Intensive-Care-Fresh-Lotion/dp/B07W7D8JY7/ref=sr_1_45?dchild=1&keywords=moisturizer&qid=1627317479&smid=AT95IG9ONZD7S&sr=8-45
"RE' EQUIL Oil Free Moisturiser for Normal, Oily & Combination Skin- 100g  ",Prime Day Deal,,,₹350,₹297.50,Save ₹52.50 (15%),3.9 out of 5 stars,497,https://www.amazon.in/RE-EQUIL-Moisturiser-Normal-Combination/dp/B082NL4SNP/ref=sr_1_46?dchild=1&keywords=moisturizer&qid=1627317479&smid=A1KX6TOPJZ1Y1F&sr=8-46
"VLCC Almond Honey Body Lotion, 350ml Buy 1 Get 1 free  ",,,,₹272,₹179,Save ₹93 (34%),4.1 out of 5 stars,"8,948",https://www.amazon.in/VLCC-Almond-Nourishing-Brightening-Lotion/dp/B077JSDB6V/ref=sr_1_47?dchild=1&keywords=moisturizer&qid=1627317479&sr=8-47
"NIVEA Body Lotion, Aloe Hydration, with Aloe Vera, for Men & Women, 400 ml  ",Prime Day Deal,,,₹425,₹269,Save ₹156 (37%),4.4 out of 5 stars,"8,393",https://www.amazon.in/Nivea-Aloe-Hydration-Lotion-400ml/dp/B079KGC4NZ/ref=sr_1_48?dchild=1&keywords=moisturizer&qid=1627317479&smid=AT95IG9ONZD7S&sr=8-48
"Olay Moisturising Cream, 50g  ",,,,₹275,₹254,Save ₹21 (8%),4.3 out of 5 stars,"2,536",https://www.amazon.in/Olay-Moisturizing-Skin-Cream-50g/dp/B0105ZGLAW/ref=sr_1_49?dchild=1&keywords=moisturizer&qid=1627317479&sr=8-49
"WOW Skin Science Organic Apple Cider Vinegar Face Moisturizer - Oil Free, Quick Absorbing - For Normal/Oily and Acne Prone Skin - No Parabens, Silicones, Mineral Oil, Color, 100 ml  ",Prime Day Deal,,,₹349,₹275,Save ₹74 (21%),4.1 out of 5 stars,"1,282",https://www.amazon.in/WOW-Science-Organic-Vinegar-Moisturizer/dp/B082YZLYBZ/ref=sr_1_50?dchild=1&keywords=moisturizer&qid=1627317479&smid=AT95IG9ONZD7S&sr=8-50
"Mamaearth Ubtan Ultra Light Gel Oil-Free Moisturizer For Face, Body and Hands; with Turmeric & Saffron for Deep Hydration - 200 ml  ",Prime Day Deal,,,₹349,₹296,Save ₹53 (15%),4.2 out of 5 stars,348,https://www.amazon.in/Mamaearth-Oil-Free-Moisturizer-Turmeric-Hydration/dp/B093HB4HVR/ref=sr_1_51?dchild=1&keywords=moisturizer&qid=1627317479&smid=A61C6NUFGVGS7&sr=8-51
"BoroPlus Doodh Kesar Body Lotion with Goodness of Badam and Milk Cream | 24 Hour Moisturisation | For Healthy, Smooth, Glowing, Moisturised and Deeply Nourished Skin | Non Greasy Ayurvedic Body Lotion for All Skin Types, 400ml  ",Prime Day Deal,,,₹275,₹159.50,Save ₹115.50 (42%),4.2 out of 5 stars,"8,866",https://www.amazon.in/BOROPLUS-Doodh-Kesar-Body-Lotion/dp/B07VV5R3FB/ref=sr_1_52?dchild=1&keywords=moisturizer&qid=1627317479&smid=AT95IG9ONZD7S&sr=8-52
"Neutrogena Hydro Boost Hyaluronic Acid Hydrating Water Gel Daily Face Moisturizer For All Skin Types, 50g  ",Prime Day Deal,,,"₹1,000",₹800,Save ₹200 (20%),4.3 out of 5 stars,"3,602",https://www.amazon.in/Neutrogena-Hydro-Boost-Water-Blue/dp/B00BQFTQW6/ref=sr_1_53?dchild=1&keywords=moisturizer&qid=1627317479&smid=AT95IG9ONZD7S&sr=8-53
"NIVEA Soft Light Moisturizer Cream, Playful Peach, with Vitamin E & Jojoba Oil for Face, Hands and Body 100 ml  ",,,,₹199,₹149.25,Save ₹49.75 (25%),,,https://www.amazon.in/NIVEA-Moisturizer-Playful-Vitamin-Jojoba/dp/B0991J5NDK/ref=sr_1_54?dchild=1&keywords=moisturizer&qid=1627317479&sr=8-54
"mCaffeine Oil-Free Coffee Moisturizer | Instant Hydration, Regulates Excess Oil | Hyaluronic Acid, Pro-Vitamin B5 | All Skin Types | Paraben & Cruelty Free | 50 ml  ",Prime Day Deal,,,₹449,₹359,Save ₹90 (20%),4.9 out of 5 stars,228,https://www.amazon.in/mCaffeine-Moisturizer-Hydration-Hyaluronic-Pro-Vitamin/dp/B095P4YVCH/ref=sr_1_55?dchild=1&keywords=moisturizer&qid=1627317479&smid=A2A53F3N8CEFWW&sr=8-55
"The Derma Co Ceramide + HA Intense Face Moisturizer, Dry Skin Moisturiser - 25 gm(dermaco)  ",Prime Day Deal,,,₹149,₹133,Save ₹16 (11%),3.4 out of 5 stars,12,https://www.amazon.in/Derma-Co-Ceramide-Moisturizer-Moisturiser/dp/B095CSJHHT/ref=sr_1_56?dchild=1&keywords=moisturizer&qid=1627317479&smid=A61C6NUFGVGS7&sr=8-56
"Aveeno Skin Relief Lotion For Sensitive Skin, White, 71 g  ",,Sponsored,,₹330,₹297,Save ₹33 (10%),4.3 out of 5 stars,273,https://www.amazon.in/gp/slredirect/picassoRedirect.html/ref=pa_sp_btf_aps_sr_pg1_1?ie=UTF8&adId=A01184723RZ02P8C8W5OI&url=%2FAveeno-Relief-Lotion-Sensitive-White%2Fdp%2FB08HWDK4KH%2Fref%3Dsr_1_57_sspa%3Fdchild%3D1%26keywords%3Dmoisturizer%26qid%3D1627317479%26sr%3D8-57-spons%26psc%3D1&qualifier=1627317479&id=3715452676427602&widgetName=sp_btf
"Yardley London English Rose Moisturising Hand and Body Lotion for Normal Skin, 350ml (Pack of 2)  ",,Sponsored,,₹598,₹328,Save ₹270 (45%),3.9 out of 5 stars,"1,375",https://www.amazon.in/gp/slredirect/picassoRedirect.html/ref=pa_sp_btf_aps_sr_pg1_1?ie=UTF8&adId=A0415575M5XZURKRZV82&url=%2FYardley-London-English-Lotion-350ml%2Fdp%2FB07NPKZNBM%2Fref%3Dsr_1_58_sspa%3Fdchild%3D1%26keywords%3Dmoisturizer%26qid%3D1627317479%26sr%3D8-58-spons%26psc%3D1&qualifier=1627317479&id=3715452676427602&widgetName=sp_btf
"Cetaphil DAM, 100g  ",,Sponsored,,₹435,₹413,Save ₹22 (5%),4.5 out of 5 stars,316,https://www.amazon.in/gp/slredirect/picassoRedirect.html/ref=pa_sp_btf_aps_sr_pg1_1?ie=UTF8&adId=A09195591YNMPBAE7I790&url=%2FCetaphil-DAM-100g%2Fdp%2FB01HMLAYOG%2Fref%3Dsr_1_59_sspa%3Fdchild%3D1%26keywords%3Dmoisturizer%26qid%3D1627317479%26sr%3D8-59-spons%26psc%3D1&qualifier=1627317479&id=3715452676427602&widgetName=sp_btf
"Aveeno Daily Moisturizing Lotion For Normal To Dry Skin With Oats, 354ml  ",Prime Day Deal,Sponsored,,₹950,₹808,Save ₹142 (15%),4.5 out of 5 stars,"2,963",https://www.amazon.in/gp/slredirect/picassoRedirect.html/ref=pa_sp_btf_aps_sr_pg1_1?ie=UTF8&adId=A10484863HAXYMUHZQU76&url=%2FAveeno-Daily-Moisturizing-Lotion-Normal%2Fdp%2FB0105LFXJ6%2Fref%3Dsr_1_60_sspa%3Fdchild%3D1%26keywords%3Dmoisturizer%26qid%3D1627317479%26smid%3DAT95IG9ONZD7S%26sr%3D8-60-spons%26psc%3D1&qualifier=1627317479&id=3715452676427602&widgetName=sp_btf
"Aveeno Soothing and Calming Body Lotion for Normal Skin, White, 354 ml  ",Prime Day Deal,Sponsored,,"₹1,050",₹893,Save ₹157 (15%),4.6 out of 5 stars,243,https://www.amazon.in/gp/slredirect/picassoRedirect.html/ref=pa_sp_atf_next_aps_sr_pg2_1?ie=UTF8&adId=A0751734V4H560F9VB7H&url=%2FAveeno-Soothing-Calming-Lotion-White%2Fdp%2FB00JZE500W%2Fref%3Dsr_1_49_sspa%3Fdchild%3D1%26keywords%3Dmoisturizer%26qid%3D1627317498%26smid%3DAT95IG9ONZD7S%26sr%3D8-49-spons%26psc%3D1&qualifier=1627317498&id=4438641202734519&widgetName=sp_atf_next
ST. D'VENCE Winter Edition Body Lotion with Tea Tree Oil & Shea Butter (Dry Skin) (300 ml)  ,Prime Day Deal,Sponsored,,₹399,₹299,Save ₹100 (25%),4.3 out of 5 stars,"5,244",https://www.amazon.in/gp/slredirect/picassoRedirect.html/ref=pa_sp_atf_next_aps_sr_pg2_1?ie=UTF8&adId=A07417463F5KI1EYFS0RF&url=%2FST-DVENCE-Winter-Lotion-Butter%2Fdp%2FB016ZA76QO%2Fref%3Dsr_1_50_sspa%3Fdchild%3D1%26keywords%3Dmoisturizer%26qid%3D1627317498%26smid%3DAXDZ1KYIDP0BU%26sr%3D8-50-spons%26psc%3D1&qualifier=1627317498&id=4438641202734519&widgetName=sp_atf_next
"Aveeno Skin Relief Moisturizing Lotion, 354 ml  ",,Sponsored,,"₹1,300","₹1,105",Save ₹195 (15%),4.5 out of 5 stars,"2,963",https://www.amazon.in/gp/slredirect/picassoRedirect.html/ref=pa_sp_atf_next_aps_sr_pg2_1?ie=UTF8&adId=A011831627JRLOPO37NKW&url=%2FAveeno-Relief-Moisturizing-Lotion-354ml%2Fdp%2FB01659Y9WO%2Fref%3Dsr_1_51_sspa%3Fdchild%3D1%26keywords%3Dmoisturizer%26qid%3D1627317498%26sr%3D8-51-spons%26psc%3D1&qualifier=1627317498&id=4438641202734519&widgetName=sp_atf_next
"The Moms Co. Natural Body Lotion | Deeply nourishes and moisturizes the skin | Shea Butter, Rosehip Oil, Organic Chamomile and Jojoba Oils  ",,Sponsored,,₹393,₹294.75,Save ₹98.25 (25%),4.2 out of 5 stars,515,https://www.amazon.in/gp/slredirect/picassoRedirect.html/ref=pa_sp_atf_next_aps_sr_pg2_1?ie=UTF8&adId=A02624182LB2TH9U69PJI&url=%2FMoms-Co-Natural-Body-Lotion%2Fdp%2FB077YGRRYV%2Fref%3Dsr_1_52_sspa%3Fdchild%3D1%26keywords%3Dmoisturizer%26qid%3D1627317498%26sr%3D8-52-spons%26psc%3D1&qualifier=1627317498&id=4438641202734519&widgetName=sp_atf_next
"Biotique Bio Wintercherry Lightening And Rejuvenating Body Nourisher, 190ml  ",,,,₹120,₹108,Save ₹12 (10%),4.2 out of 5 stars,"2,144",https://www.amazon.in/Biotique-Wintercherry-Lightening-Rejuvenating-Nourisher/dp/B00791CQKA/ref=sr_1_53?dchild=1&keywords=moisturizer&qid=1627317498&sr=8-53
"Phy Superlight Moisturizer for Acne-Prone Skin with Brightening Lemon Peel & Green Tea extracts - Non-Greasy, Non-Sticky, No Sulphates, Parabens & Silicones | 75 ml  ",,,,₹490,₹367.50,Save ₹122.50 (25%),4.0 out of 5 stars,472,https://www.amazon.in/Phy-Superlight-Moisturizer-Dermat-Tested-Silicone-Free/dp/B07XPBNCST/ref=sr_1_54?dchild=1&keywords=moisturizer&qid=1627317498&sr=8-54
"LAKMÉ 9 to 5 Matte Moist Mattifying Moisturiser, 50 g  ",Prime Day Deal,,,₹349,₹234,Save ₹115 (33%),3.8 out of 5 stars,603,https://www.amazon.in/LAKM%C3%89-Matte-Moist-Mattifying-Moisturiser/dp/B08JW1HLKZ/ref=sr_1_55?dchild=1&keywords=moisturizer&qid=1627317498&smid=AT95IG9ONZD7S&sr=8-55
"Aveeno Daily Moisturizing Lotion For Normal To Dry Skin With Oats, 354ml  ",Prime Day Deal,,,₹950,₹808,Save ₹142 (15%),4.5 out of 5 stars,"2,963",https://www.amazon.in/Aveeno-Daily-Moisturizing-Lotion-Normal/dp/B0105LFXJ6/ref=sr_1_56?dchild=1&keywords=moisturizer&qid=1627317498&smid=AT95IG9ONZD7S&sr=8-56
The Man Company Daily Moisturising Cream With Shea Butter And Vitamin E | Hydrates & Rejuvenates | All Skin Type | 50 gm  ,Prime Day Deal,,,₹349,₹230,Save ₹119 (34%),4.1 out of 5 stars,"2,281",https://www.amazon.in/Man-Company-Daily-Moisturising-butter/dp/B07JNH9W9J/ref=sr_1_57?dchild=1&keywords=moisturizer&qid=1627317498&smid=AT95IG9ONZD7S&sr=8-57
