name,badge_1,badge_2,badge_3,mrp,discounted_price,discount,rating,rating_count,link
"Plum Hello Aloe Caring Day Moisturizer | For Dry, Very Dry Skin | Hydrates the Skin | Aloe Vera | 100% Vegan | Paraben Free | 60ml  ",,,,₹470,₹306,Save ₹164 (35%),4.1 out of 5 stars,441,https://www.amazon.in/Plum-Hello-Aloe-Caring-Moisturizer/dp/B018UA2XLA/ref=sr_1_58?dchild=1&keywords=moisturizer&qid=1627317498&sr=8-58
"KHADI NATURAL Ayurvedic Aloevera Moisturiser, 210ml  ",,,,₹165,₹135,Save ₹30 (18%),4.1 out of 5 stars,277,https://www.amazon.in/Khadi-Natural-Mosturizer-Aloevera-210ml/dp/B00FZH8YII/ref=sr_1_59?dchild=1&keywords=moisturizer&qid=1627317498&sr=8-59
Aroma Magic Juniper Berry Oil Free Moisturiser 200 ml  ,,,,₹320,₹259,Save ₹61 (19%),4.1 out of 5 stars,834,https://www.amazon.in/Aroma-Magic-Juniper-Berry-Moisturiser/dp/B06XW6B2NK/ref=sr_1_60?dchild=1&keywords=moisturizer&qid=1627317498&sr=8-60
Indiabulls Pharmaceuticals Hydravo Skin Renewing Moisturizer (50 g)  ,,,,₹450,₹290,Save ₹160 (36%),4.5 out of 5 stars,137,https://www.amazon.in/Indiabulls-Pharmaceuticals-Hydravo-Renewing-Moisturizer/dp/B07PSMC15K/ref=sr_1_61?dchild=1&keywords=moisturizer&qid=1627317498&sr=8-61
"Aroma Magic Almond Moisturishing Lotion, 200ml  ",Limited time deal,,,₹320,₹211,Save ₹109 (34%),4.3 out of 5 stars,550,https://www.amazon.in/Aroma-Magic-Almond-Moisturishing-Lotion/dp/B00TYLE1C4/ref=sr_1_62?dchild=1&keywords=moisturizer&qid=1627317498&sr=8-62
"Vya Naturals Multi-Peptide Moisturizer for Collagen Boost - Lightweight, Matte Formula with Matrixyl 3000 and Purslane Extract for Firmer, Clear Skin 30g  ",Prime Day Deal,,,₹450,₹350,Save ₹100 (22%),4.4 out of 5 stars,129,https://www.amazon.in/Vya-Naturals-Multi-Peptide-Moisturizer-Collagen/dp/B08THRQ38M/ref=sr_1_63?dchild=1&keywords=moisturizer&qid=1627317498&sr=8-63
"Good Vibes Avocado Moisturizing Face Cream - 50 g - Helps Prevent Loss of Moisture, Maintains Smooth Skin and Rich in Nutrients - Sulfate, Paraben and Cruelty Free  ",,,,₹225,₹195,Save ₹30 (13%),4.0 out of 5 stars,193,https://www.amazon.in/Good-Vibes-Moisturizing-Cream-Avocado/dp/B084GQCLF5/ref=sr_1_64?dchild=1&keywords=moisturizer&qid=1627317498&sr=8-64
"Biotique Bio Morning Nectar Sunscreen Ultra Soothing Face Lotion, SPF 30+, 120ml  ",Prime Day Deal,,,₹199,₹125,Save ₹74 (37%),4.1 out of 5 stars,"6,941",https://www.amazon.in/Biotique-Morning-Nectar-Soothing-Sunscreen/dp/B0054MS8SA/ref=sr_1_65?dchild=1&keywords=moisturizer&qid=1627317498&smid=AT95IG9ONZD7S&sr=8-65
"NIVEA Men Moisturiser, Oil Control Cream, 50ml  ",,,,₹190,₹149.25,Save ₹40.75 (21%),4.1 out of 5 stars,"2,191",https://www.amazon.in/Nivea-Men-Control-Moisturiser-50ml/dp/B00791D1CC/ref=sr_1_66?dchild=1&keywords=moisturizer&qid=1627317498&sr=8-66
"Neutrogena Oil Free Face Moisture SPF 15 For Normal To Oily Skin, 115ml  ",,,,₹525,₹420,Save ₹105 (20%),4.1 out of 5 stars,"2,537",https://www.amazon.in/Neutrogena-Free-Facial-Moisturiser-115ml/dp/B006LXE5OC/ref=sr_1_67?dchild=1&keywords=moisturizer&qid=1627317498&sr=8-67
"Cetaphil Moisturising Cream, 80g  ",,,,₹425,₹396,Save ₹29 (7%),4.4 out of 5 stars,"3,792",https://www.amazon.in/Cetaphil-Moisturising-Cream-80g/dp/B01HMLB0LW/ref=sr_1_68?dchild=1&keywords=moisturizer&qid=1627317498&sr=8-68
"The Face Shop Chia Seed Hydro Lotion enriched with Vitamin B12 for Glowing and Hydrating skin |for All Skin Types| Paraben Free,145ml  ",Prime Day Deal,Sponsored,,"₹1,599","₹1,199",Save ₹400 (25%),4.3 out of 5 stars,242,https://www.amazon.in/gp/slredirect/picassoRedirect.html/ref=pa_sp_mtf_aps_sr_pg2_1?ie=UTF8&adId=A0996457216D1YAMCH3T&url=%2FFace-Shop-enriched-Vitamin-Hydrating%2Fdp%2FB07WZT975L%2Fref%3Dsr_1_69_sspa%3Fdchild%3D1%26keywords%3Dmoisturizer%26qid%3D1627317498%26smid%3DA2RZL45IR5G83S%26sr%3D8-69-spons%26psc%3D1&qualifier=1627317498&id=4438641202734519&widgetName=sp_mtf
"ST. D'VENCE Autumn Edition Body Lotion with Argan Oil and Avocado Butter for Very Dry Skin, 300 ml  ",,Sponsored,,₹499,₹379,Save ₹120 (24%),4.3 out of 5 stars,490,https://www.amazon.in/gp/slredirect/picassoRedirect.html/ref=pa_sp_mtf_aps_sr_pg2_1?ie=UTF8&adId=A074192638IIXVF51M6T6&url=%2FST-DVENCE-Autumn-Lotion-Avocado%2Fdp%2FB0772X7KT6%2Fref%3Dsr_1_70_sspa%3Fdchild%3D1%26keywords%3Dmoisturizer%26qid%3D1627317498%26sr%3D8-70-spons%26psc%3D1&qualifier=1627317498&id=4438641202734519&widgetName=sp_mtf
"KNIGHTSMAN Body Moisturizer, Gentleman Body Moisturizer For Shea Butter & Vitamin E Extracts Body Moisturizer 300ml  ",,Sponsored,,₹499,₹399,Save ₹100 (20%),,,https://www.amazon.in/gp/slredirect/picassoRedirect.html/ref=pa_sp_mtf_aps_sr_pg2_1?ie=UTF8&adId=A071624414Q9I9VG0S8CI&url=%2FKNIGHTSMAN-Moisturizer-Gentleman-Vitamin-Extracts%2Fdp%2FB098LGXJVN%2Fref%3Dsr_1_71_sspa%3Fdchild%3D1%26keywords%3Dmoisturizer%26qid%3D1627317498%26sr%3D8-71-spons%26psc%3D1&qualifier=1627317498&id=4438641202734519&widgetName=sp_mtf
"KNIGHTSMAN Noir Body Moisturizer For Face, For Shea Butter & Vitamin E, Extracts Body Lotion 300ml  ",,Sponsored,,₹499,₹399,Save ₹100 (20%),,,https://www.amazon.in/gp/slredirect/picassoRedirect.html/ref=pa_sp_mtf_aps_sr_pg2_1?ie=UTF8&adId=A0716400T3NNW67UCA6D&url=%2FKNIGHTSMAN-Moisturizer-Butter-Vitamin-Extracts%2Fdp%2FB098LKZ956%2Fref%3Dsr_1_72_sspa%3Fdchild%3D1%26keywords%3Dmoisturizer%26qid%3D1627317498%26sr%3D8-72-spons%26psc%3D1&qualifier=1627317498&id=4438641202734519&widgetName=sp_mtf
"mCaffeine Non-sticky Latte Coffee Moisturizer | Deep Moisturization, Nourishing | Shea Butter, Ceramide | All Skin Types | Paraben & Cruelty Free | 50 ml  ",Prime Day Deal,,,₹449,₹359,Save ₹90 (20%),4.9 out of 5 stars,191,https://www.amazon.in/mCaffeine-Non-sticky-Moisturizer-Moisturization-Nourishing/dp/B095P5PK6B/ref=sr_1_73?dchild=1&keywords=moisturizer&qid=1627317498&smid=A2A53F3N8CEFWW&sr=8-73
IPCA ACNE-OC Advanced Oil Control Moisturizer  ,,,,₹577,₹410,Save ₹167 (29%),4.2 out of 5 stars,30,https://www.amazon.in/IPCA-ACNE-OC-Advanced-Control-Moisturizer/dp/B08PVM965T/ref=sr_1_74?dchild=1&keywords=moisturizer&qid=1627317498&sr=8-74
"Vaseline Lavender Moisturizing Gel, 200 g  ",Limited time deal,,,₹250,₹175,Save ₹75 (30%),4.2 out of 5 stars,371,https://www.amazon.in/Vaseline-Lavender-Moisturizing-Gel-200/dp/B085WKNHD8/ref=sr_1_75?dchild=1&keywords=moisturizer&qid=1627317498&sr=8-75
"Lakme Peach Milk Moisturizer Body Lotion, Lightweight, Non-Sticky, Locks Moisture For 12 Hours, 120 ml  ",,,,₹199,₹149,Save ₹50 (25%),4.4 out of 5 stars,"1,193",https://www.amazon.in/Lakme-Peach-Milk-Moisturizer-Lotion/dp/B00UFF8TEO/ref=sr_1_76?dchild=1&keywords=moisturizer&qid=1627317498&sr=8-76
Lotus Herbals Alphamoist Alpha Hydroxy Skin Renewal Oil Free Moisturizer | 80ml  ,,,,₹295,₹201.34,Save ₹93.66 (32%),4.2 out of 5 stars,"1,582",https://www.amazon.in/Lotus-Herbals-Alphamoist-Hydroxy-Moisturiser/dp/B003TRV2V2/ref=sr_1_77?dchild=1&keywords=moisturizer&qid=1627317498&sr=8-77
ST. D'VENCE Winter Edition Body Lotion with Tea Tree Oil & Shea Butter (Dry Skin) (300 ml)  ,Prime Day Deal,,,₹399,₹299,Save ₹100 (25%),4.3 out of 5 stars,"5,244",https://www.amazon.in/ST-DVENCE-Winter-Lotion-Butter/dp/B016ZA76QO/ref=sr_1_78?dchild=1&keywords=moisturizer&qid=1627317498&smid=AXDZ1KYIDP0BU&sr=8-78
"KHADI NATURAL Sandalwood And Kesar Moisturizer, 210ml  ",,,,₹165,₹140,Save ₹25 (15%),4.0 out of 5 stars,"1,507",https://www.amazon.in/Khadi-Natural-Sandalwood-Kesar-Moisturizer/dp/B00FZH8XGG/ref=sr_1_79?dchild=1&keywords=moisturizer&qid=1627317498&sr=8-79
"Biotique Bio Morning Nectar Flawless Moisturizing Cream for Normal Skin, 50g  ",,,,₹99,₹64,Save ₹35 (35%),4.3 out of 5 stars,118,https://www.amazon.in/Biotique-Morning-Nectar-Flawless-Moisturizing/dp/B082B79D58/ref=sr_1_80?dchild=1&keywords=moisturizer&qid=1627317498&sr=8-80
"NIVEA Men Crème, Dark Spot Reduction, Non Greasy Moisturizer, Cream with UV Protect, 75 ml  ",Prime Day Deal,,,₹199,₹133.38,Save ₹65.62 (33%),4.1 out of 5 stars,"11,071",https://www.amazon.in/Nivea-Dark-Spot-Reduction-Cream/dp/B0183C3F2Q/ref=sr_1_81?dchild=1&keywords=moisturizer&qid=1627317498&smid=AT95IG9ONZD7S&sr=8-81
"mCaffeine Lightweight Cappuccino Coffee Moisturizer | Soothes & Tones Skin | Vitamin E, Almond Milk | All Skin Types | Paraben & Cruelty Free | 50 ml  ",Prime Day Deal,,,₹449,₹359,Save ₹90 (20%),5.0 out of 5 stars,208,https://www.amazon.in/mCaffeine-Lightweight-Cappuccino-Moisturizer-Soothes/dp/B095P2C7VF/ref=sr_1_82?dchild=1&keywords=moisturizer&qid=1627317498&smid=A2A53F3N8CEFWW&sr=8-82
"Aroma Magic Almond Moisturising Lotion, 100ml  ",Prime Day Deal,,,₹190,₹117,Save ₹73 (38%),4.1 out of 5 stars,807,https://www.amazon.in/Aroma-Magic-Almond-Moisturising-Lotion/dp/B00UYZPKX8/ref=sr_1_83?dchild=1&keywords=moisturizer&qid=1627317498&smid=AT95IG9ONZD7S&sr=8-83
"SHYAMOSA Healing Pore Tightening Cucumber, Almond and Aloevera Moisturizer for oily, Acne Prone & Sensitive Skin Rejuvenation Treatment Refining Face Paraben Free – (30g)  ",,,,₹299,₹155,Save ₹144 (48%),4.4 out of 5 stars,30,https://www.amazon.in/SHYAMOSA-Healing-Pore-Tightening-Moisturizer/dp/B08Y5JVPQC/ref=sr_1_84?dchild=1&keywords=moisturizer&qid=1627317498&sr=8-84
"The Derma Co Ceramide + HA Intense Face Moisturizer, Dry Skin Moisturiser - 50 gm(dermaco)  ",Prime Day Deal,,,₹349,₹313,Save ₹36 (10%),3.9 out of 5 stars,177,https://www.amazon.in/Derma-Co-Ceramide-Moisturizer-Moisturiser/dp/B08VRQ2QP8/ref=sr_1_85?dchild=1&keywords=moisturizer&qid=1627317498&smid=A61C6NUFGVGS7&sr=8-85
"Lakme Peach Milk Soft Creme Moisturizer, Lightweight Face Cream, Non Sticky, Locks Moisture For 24 Hours For Soft And Glowing Skin, 250 g  ",Prime Day Deal,,,₹349,₹263,Save ₹86 (25%),4.4 out of 5 stars,"6,600",https://www.amazon.in/Lakme-Peach-Milk-Soft-Creme/dp/B07JVZMKT3/ref=sr_1_86?dchild=1&keywords=moisturizer&qid=1627317498&smid=AT95IG9ONZD7S&sr=8-86
Indiabulls Pharmaceuticals Hydravo Skin Renewing Moisturizer (50 g) Pack of 2  ,,,,₹900,₹547,Save ₹353 (39%),4.6 out of 5 stars,38,https://www.amazon.in/Indiabulls-Pharmaceuticals-Hydravo-Renewing-Moisturizer/dp/B08376RSV9/ref=sr_1_87?dchild=1&keywords=moisturizer&qid=1627317498&sr=8-87
"Neutrogena Norwegian Formula Body Moisturizer For Dry Skin 24 Hour Moisturization , 250ml  ",,,,₹560,₹480,Save ₹80 (14%),4.4 out of 5 stars,"1,105",https://www.amazon.in/Neutrogena-Norwegian-Formula-Moisturizer-250ml/dp/B006LXED4O/ref=sr_1_88?dchild=1&keywords=moisturizer&qid=1627317498&sr=8-88
