name,badge_1,badge_2,badge_3,mrp,discounted_price,discount,rating,rating_count,link
"BRAMHANI ENTERPRISE Plastic Barking, Waging Tail, Walking and Jumping Puppy Baby Toy For Toddlers and Kids Multicolor  ",,,,₹999,₹579,Save ₹420 (42%),2.9 out of 5 stars,27,https://www.amazon.in/BRAMHANI-ENTERPRISE-Plastic-Toddlers-Multicolor/dp/B093FRGMLL/ref=sr_1_51?dchild=1&keywords=baby+toys&qid=1625200440&sr=8-51
"FRNDZMART Baby Teether and Rattle Toy Set of 6 Pieces | Attractive Shapes and Beautiful Colours Gift Set for New Born, Toddlers and Expecting Mothers  ",,,,₹749,₹279,Save ₹470 (63%),,,https://www.amazon.in/FRNDZMART-Attractive-Beautiful-Toddlers-Expecting/dp/B096SGV2GM/ref=sr_1_52?dchild=1&keywords=baby+toys&qid=1625200440&sr=8-52
"Ramakada Lovely Attractive Colorful Toddlers 7 Rattle and 1 Teether Toys Set for Babies pack of 8 Pieces,Non toxic Plastic-Multi color  ",,,,₹999,₹429,Save ₹570 (57%),4.2 out of 5 stars,"1,249",https://www.amazon.in/Ramakada-Attractive-Colorful-Toddlers-Teether/dp/B07RSL1LV8/ref=sr_1_53?dchild=1&keywords=baby+toys&qid=1625200440&sr=8-53
CUBS & HUGS Face Rattle Cum Soft Toy (Squeeze Handle for Squeaky Sound) (Design 1)  ,,,,₹999,₹399,Save ₹600 (60%),4.2 out of 5 stars,93,https://www.amazon.in/CUBS-HUGS-Rattle-Squeeze-Squeaky/dp/B08TGB7MXJ/ref=sr_1_54?dchild=1&keywords=baby+toys&qid=1625200440&sr=8-54
SELLMONK Baby First Block Shape Sorter Colors Toddler ABCD Shape Baby Toys for 1 Year Old Girl (Baby First Block)  ,,,,₹599,₹515,Save ₹84 (14%),4.4 out of 5 stars,6,https://www.amazon.in/SELLMONK-First-Sorter-Colors-Toddler/dp/B091RYT7CD/ref=sr_1_55?dchild=1&keywords=baby+toys&qid=1625200440&sr=8-55
"FunBlast Musical Mobile Phone for Kids, Cartoon Mobile with Light & Sound Toys for Babies | Educational Toys for Kids 3+ Years/Boys/Girls-1 Unit (Random Color)  ",Deal of the Day ,,,₹999,₹379,Save ₹620 (62%),3.8 out of 5 stars,148,https://www.amazon.in/FunBlast-Musical-Cartoon-Educational-Girls-1/dp/B08QZD5P5Z/ref=sr_1_56?dchild=1&keywords=baby+toys&qid=1625200440&sr=8-56
"VEZOL® Big Size Happy Baby Musical Touch Sensors and Laughing Boy Doll for Kids Girls Boys (New Version 2020 Made in India, 35cm Length)  ",Best seller,,,"₹1,299",₹499,Save ₹800 (62%),4.3 out of 5 stars,9,https://www.amazon.in/gp/bestsellers/toys/1378270031/ref=sr_bs_8_1378270031_1
"Toyshine Plastic Concept Musical and 3D Lights Transparent Toy Car for 2 to 5 Year Kids, Multicolor  ",,,,₹999,₹529,Save ₹470 (47%),4.3 out of 5 stars,"1,869",https://www.amazon.in/Toyshine-Concept-Musical-Lights-Transparent/dp/B088ZRY2HF/ref=sr_1_58?dchild=1&keywords=baby+toys&qid=1625200440&sr=8-58
A Baby Cherry Baby Pillow :: Organic Cotton Head Shaping Pillow for Infants and Toddlers (0M to 5 Yr) - Unisex || Washable || 3D Mesh Structure || Prevent Flat Head + Free Pillow Cover (Star)  ,,Sponsored,,₹999,₹639,Save ₹360 (36%),3.9 out of 5 stars,633,https://www.amazon.in/gp/slredirect/picassoRedirect.html/ref=pa_sp_mtf_aps_sr_pg2_1?ie=UTF8&adId=A03077682SVVKQFL3GFXK&url=%2FBaby-Cherry-Pillow-Toddlers-Structure%2Fdp%2FB07R1QQZWG%2Fref%3Dsr_1_59_sspa%3Fdchild%3D1%26keywords%3Dbaby%2Btoys%26qid%3D1625200440%26sr%3D8-59-spons%26psc%3D1&qualifier=1625200440&id=1572192430266671&widgetName=sp_mtf
"Mee Mee Fluoride-Free Strawberry Flavor Toothpaste, 70 g (Pack of 2)  ",,Sponsored,,₹298,₹215,Save ₹83 (28%),4.3 out of 5 stars,"1,037",https://www.amazon.in/gp/slredirect/picassoRedirect.html/ref=pa_sp_mtf_aps_sr_pg2_1?ie=UTF8&adId=A03275901VE463WTIUCG5&url=%2FMee-Fluoride-Free-Toothpaste-Strawberry-Pack%2Fdp%2FB075FTKYC7%2Fref%3Dsr_1_60_sspa%3Fdchild%3D1%26keywords%3Dbaby%2Btoys%26qid%3D1625200440%26sr%3D8-60-spons%26psc%3D1&qualifier=1625200440&id=1572192430266671&widgetName=sp_mtf
"Little Innocents Baby Ball with Baby Rattle and Baby Teethers, Size 11 cm (Multicolour)  ",,Sponsored,,₹620,₹349,Save ₹271 (44%),4.2 out of 5 stars,40,https://www.amazon.in/gp/slredirect/picassoRedirect.html/ref=pa_sp_mtf_aps_sr_pg2_1?ie=UTF8&adId=A09818753AZS8HL4N903X&url=%2FLittle-Innocents%25C2%25AE-Teether-Stuffed-Multicolour%2Fdp%2FB08RB397N6%2Fref%3Dsr_1_61_sspa%3Fdchild%3D1%26keywords%3Dbaby%2Btoys%26qid%3D1625200440%26sr%3D8-61-spons%26psc%3D1%26smid%3DA1721XIG2WQFCJ&qualifier=1625200440&id=1572192430266671&widgetName=sp_mtf
"Prime Deals plastic Colourful and Attractive Funny Cottage Educational Toy, Multicolour, 1 2 3 Year  ",,Sponsored,,,"₹1,498",,4.4 out of 5 stars,77,https://www.amazon.in/gp/slredirect/picassoRedirect.html/ref=pa_sp_mtf_aps_sr_pg2_1?ie=UTF8&adId=A10099021JVM3XY7HVBRT&url=%2FPrime-Deals-Colourful-Attractive-Educational%2Fdp%2FB07W3SYKQZ%2Fref%3Dsr_1_62_sspa%3Fdchild%3D1%26keywords%3Dbaby%2Btoys%26qid%3D1625200440%26sr%3D8-62-spons%26psc%3D1&qualifier=1625200440&id=1572192430266671&widgetName=sp_mtf
Babique Ball Rattle Sound Soft Toy for Kids Baby Boy Girl Birthday (10 cm)  ,Limited time deal,,,₹699,₹115,Save ₹584 (84%),4.0 out of 5 stars,"2,206",https://www.amazon.in/Babique-Ball-Rattle-Sound-Birthday/dp/B08PVYDSX1/ref=sr_1_63?dchild=1&keywords=baby+toys&qid=1625200440&sr=8-63
"Mother's World Kid Caterpillar Soft Toy (Medium, Multicolour)  ",,,,₹399,₹199,Save ₹200 (50%),3.6 out of 5 stars,333,https://www.amazon.in/Mothers-World-Caterpillar-Multicolour-Plush/dp/B07X1YZXNM/ref=sr_1_64?dchild=1&keywords=baby+toys&qid=1625200440&sr=8-64
"Windmill baby Natural Toy Cleaner and Multi Surface Cleaner Spray, USDA Certified, Allergen Free, Fragrance Free - 450ml  ",,,,,₹349,,4.2 out of 5 stars,62,https://www.amazon.in/Windmill-Natural-Certified-Allergen-Fragrance/dp/B08BNR8QMW/ref=sr_1_65?dchild=1&keywords=baby+toys&qid=1625200440&sr=8-65
Samaaya ® Baby's Soft Plush Learn to Sit Stool Training Elephant Cotton Cushion Sofa Seat Safety Chair for Dining (grey)  ,,,,"₹1,299",₹699,Save ₹600 (46%),3.8 out of 5 stars,130,https://www.amazon.in/Samaaya-Cushion-Training-Support-Elephant/dp/B07J5GGM1Q/ref=sr_1_66?dchild=1&keywords=baby+toys&qid=1625200440&sr=8-66
"AK Store Toys Funny Key-Operated Cute Doll Girl and Elephant Drummer Toy with Drumming and Dancing Action for Kids (Plastic,Multi color, Pack of 2)  ",,,,₹999,₹289,Save ₹710 (71%),3.9 out of 5 stars,322,https://www.amazon.in/AK-Store-Key-Operated-Elephant-Multicolor/dp/B082VHS14M/ref=sr_1_67?dchild=1&keywords=baby+toys&qid=1625200440&sr=8-67
BVM GROUP Kids Edition Dog Jumping Toy (Multicolour)  ,,,,₹799,₹530,Save ₹269 (34%),3.3 out of 5 stars,240,https://www.amazon.in/BVM-GROUP-Kids-Jumping-Multicolour/dp/B08TTB2Q3X/ref=sr_1_68?dchild=1&keywords=baby+toys&qid=1625200440&sr=8-68
FI - FLICK IN Baby Press and Go Lovely Little Musical Train Pull Back Car Vehicle Toy Play Set with Music & Flashing Lights for Kids (Pack of 1) (Multicolor)  ,,,Only 2 left in stock.,,₹329,,1.0 out of 5 stars,1,https://www.amazon.in/FI-Musical-Vehicle-Flashing-Multicolor/dp/B08ZDGLDJS/ref=sr_1_69?dchild=1&keywords=baby+toys&qid=1625200440&sr=8-69
Toyshine Musical and Dancing Frog Toy with Lights and Music  ,,,,₹999,₹549,Save ₹450 (45%),4.1 out of 5 stars,"2,502",https://www.amazon.in/Toyshine-Dancing-Flashing-Lights-Action/dp/B071965NCS/ref=sr_1_70?dchild=1&keywords=baby+toys&qid=1625200440&sr=8-70
divine man Educational Piano Keyboard Toy - Baby Musical Toy - Light Up Toy Piano - Crib Music Toy for Babies and Toddlers - Toy Keyboard for Toddlers - Toys for 2 Year Boys and Girls  ,,,,₹999,₹429,Save ₹570 (57%),4.1 out of 5 stars,39,https://www.amazon.in/divine-man-Educational-Piano-Keyboard/dp/B08K3N3QT5/ref=sr_1_71?dchild=1&keywords=baby+toys&qid=1625200440&sr=8-71
"Ramakada 15 Pcs Set of Rattles, Teethers and Animal Shape Bath Toys Non Toxic BPA Free for Babies (Multicolor)  ",,,,₹999,₹699,Save ₹300 (30%),4.2 out of 5 stars,"1,249",https://www.amazon.in/Ramakada-Rattles-Teethers-Animal-Multicolor/dp/B07ZBGBXXH/ref=sr_1_72?dchild=1&keywords=baby+toys&qid=1625200440&sr=8-72
Einstein Box for 1 Year Old Boys/Girls | Gift Toys & Board Books for Kids | Learning and Educational Toys & Games | Pretend Play Set of Animal Masks| Pack of 1 Box Set  ,Deal of the Day ,,,₹999,₹595,Save ₹404 (40%),4.1 out of 5 stars,"1,881",https://www.amazon.in/Einstein-Box-Learning-Educational-Multicolour/dp/B01N5267EI/ref=sr_1_73?dchild=1&keywords=baby+toys&qid=1625200440&sr=8-73
"Hunk Shopper's Baby Kids Water Play Mat Toys Inflatable Tummy Time Leakproof Water Play Mat, Fun Activity Play Center Indoor and Outdoor Water Play Mat for Baby(Regular)  ",,,,₹999,₹599,Save ₹400 (40%),,,https://www.amazon.in/Shoppers-Inflatable-Leakproof-Activity-Outdoor/dp/B097YLK7BB/ref=sr_1_74?dchild=1&keywords=baby+toys&qid=1625200440&sr=8-74
"Royals Hub® Baby Rattle Toys for Kids, Set of 4 Pcs - Colourful Lovely Attractive Rattles and Teether for Babies, Toddlers, Infants & Children Rattles Rattle Toys for Infants  ",,,,,₹248,,4.3 out of 5 stars,77,https://www.amazon.in/Royals-Hub%C2%AE-Baby-Rattle-Toys/dp/B095CCWYR2/ref=sr_1_75?dchild=1&keywords=baby+toys&qid=1625200440&sr=8-75
Baby Station Baby Crib & Stroller Plush Playing Toy Car Hanging Rattles (Elephant)  ,,,,,₹649,,4.6 out of 5 stars,232,https://www.amazon.in/Baby-Station-Stroller-Playing-Elephant/dp/B07D21YNTQ/ref=sr_1_76?dchild=1&keywords=baby+toys&qid=1625200440&sr=8-76
"TIB Elephant Shape Baby Soft Plush Cushion Baby Sofa Seat OR Rocking Chair for Kids (Pink, 0 to 4 Years)  ",Best seller,,,,₹889,,4.0 out of 5 stars,"1,240",https://www.amazon.in/gp/bestsellers/kitchen/5689407031/ref=sr_bs_28_5689407031_1
"famous quality most popular chu chu bath toys (1 set of 12 animals, Multi color)  ",,,,"₹2,999",₹298,"Save ₹2,701 (90%)",4.1 out of 5 stars,61,https://www.amazon.in/Famous-Quality-Popular-Animals-Multicolour/dp/B07FYP1QZH/ref=sr_1_78?dchild=1&keywords=baby+toys&qid=1625200440&sr=8-78
