name,badge_1,badge_2,badge_3,mrp,discounted_price,discount,rating,rating_count,link
Einstein Box | Baby Toys Set of Rattle Toys + High Contrast Books+ High Contrast Flashcards For Infants and Newborns of 0-12 months | Set of Rattle Toys + High Contrast Books+ High Contrast Flashcards| Baby Boys and Girls  ,,Sponsored,,₹999,₹599,Save ₹400 (40%),4.4 out of 5 stars,206,https://www.amazon.in/gp/slredirect/picassoRedirect.html/ref=pa_sp_atf_aps_sr_pg1_1?ie=UTF8&adId=A0437035J701KGCEP5RI&url=%2FEinstein-Box-Contrast-Flashcards-Newborns%2Fdp%2FB09BCQ52R8%2Fref%3Dsr_1_1_sspa%3Fdchild%3D1%26keywords%3Dbaby%2Btoys%26qid%3D1628319047%26sr%3D8-1-spons%26psc%3D1&qualifier=1628319047&id=8105111013683515&widgetName=sp_atf
"Popsugar Baby's Activity Cube Toddler Educational Toy Multipurpose Early Learning Game Play Center, Multicolour  ",Deal of the Day ,Sponsored,,"₹2,899","₹1,909",Save ₹990 (34%),4.6 out of 5 stars,104,https://www.amazon.in/gp/slredirect/picassoRedirect.html/ref=pa_sp_atf_aps_sr_pg1_1?ie=UTF8&adId=A0341561199CM7CICGI42&url=%2FPopsugar-Activity-Educational-Multipurpose-Learning%2Fdp%2FB07QMFL74B%2Fref%3Dsr_1_2_sspa%3Fdchild%3D1%26keywords%3Dbaby%2Btoys%26qid%3D1628319047%26sr%3D8-2-spons%26psc%3D1&qualifier=1628319047&id=8105111013683515&widgetName=sp_atf
"Einstein Box for 3 Year Old Kids | Toys for Kids 3 Years | Baby Boys & Girls, Learning and Educational Gift Pack of Toys, Games and Books, Apron | 3 Years All Toys  ",Deal of the Day ,Sponsored,,₹999,₹585,Save ₹414 (41%),4.0 out of 5 stars,"1,870",https://www.amazon.in/gp/slredirect/picassoRedirect.html/ref=pa_sp_atf_aps_sr_pg1_1?ie=UTF8&adId=A06076522DFPPSBK510XN&url=%2FEinstein-Box-Girls-Learning-Educational%2Fdp%2FB01MQISR84%2Fref%3Dsr_1_3_sspa%3Fdchild%3D1%26keywords%3Dbaby%2Btoys%26qid%3D1628319047%26sr%3D8-3-spons%26psc%3D1&qualifier=1628319047&id=8105111013683515&widgetName=sp_atf
Storio Educational Learning Stacking Multicolour 7 Rings Baby Toys for Toddlers Kids 1 Year Old and Above  ,,Sponsored,,,₹175,,4.3 out of 5 stars,18,https://www.amazon.in/gp/slredirect/picassoRedirect.html/ref=pa_sp_atf_aps_sr_pg1_1?ie=UTF8&adId=A10405342F07ZZ0422J09&url=%2FStorio-Rattles-Dumbbells-Development-Toys%2Fdp%2FB08D8HRTWD%2Fref%3Dsr_1_4_sspa%3Fdchild%3D1%26keywords%3Dbaby%2Btoys%26qid%3D1628319047%26sr%3D8-4-spons%26psc%3D1&qualifier=1628319047&id=8105111013683515&widgetName=sp_atf
"WISHKEY Plastic Bath Toy Set of 14 Pcs Chu Chu Colorful Animal Shape Toy for New Born Babies, Fun Bathtime Buddies for Toddlers (Pack of 14, Multicolor)  ",,,,₹379,₹349,Save ₹30 (8%),4.2 out of 5 stars,"4,240",https://www.amazon.in/Wish-key-Babys-Plastic-Multicolour/dp/B075K56GXY/ref=sr_1_5?dchild=1&keywords=baby+toys&qid=1628319047&sr=8-5
"WISHKEY Plastic Colorful Non Toxic BPA Free 9 Shake & Grab Rattles and 3 Soothing Teethers for Babies & Infants, Early Age Toys for Kids ( Pack of 12, Multicolor)  ",Best seller,,,₹599,₹579,Save ₹20 (3%),4.4 out of 5 stars,"12,705",https://www.amazon.in/gp/bestsellers/toys/1378181031/ref=sr_bs_5_1378181031_1
"WISHKEY Colorful Attractive Plastic Non Toxic Set of 7 Shake & Grab Rattle and 1 Soothing Teether for New Born and Infants (Pack of 8 , Multicolor)  ",Best seller,,,₹599,₹449,Save ₹150 (25%),4.4 out of 5 stars,"12,705",https://www.amazon.in/gp/bestsellers/toys/1378181031/ref=sr_bs_6_1378181031_1
"Storio Colorful Floating Baby Toys Bath Aquatic Animals Chu Chu Toys for Newborn Babies, Kids  ",Best seller,,,,₹291,,4.2 out of 5 stars,"2,625",https://www.amazon.in/gp/bestsellers/toys/1378183031/ref=sr_bs_7_1378183031_1
"Little's Junior Ring (Plastic,Multicolour)  ",Best sellerDeal of the Day ,,,₹225,₹151,Save ₹74 (33%),4.3 out of 5 stars,"20,435",https://www.amazon.in/gp/bestsellers/jewelry/2152567031/ref=sr_bs_8_2152567031_1
Cable World® Kick & Play Musical Keyboard Mat Piano Baby Play Mat Gym & Fitness Rack  ,Best sellerLimited time deal,,,"₹2,599",₹929,"Save ₹1,670 (64%)",3.9 out of 5 stars,"4,840",https://www.amazon.in/gp/bestsellers/baby/1953108031/ref=sr_bs_9_1953108031_1
"Toyshine Dancing Dog with Music, Flashing Lights (Battery Included)- Multi Color  ",Deal of the Day ,,,₹999,₹501,Save ₹498 (50%),4.0 out of 5 stars,"5,847",https://www.amazon.in/Toyshine-Dancing-Flashing-Battery-Included/dp/B085DS2BZ5/ref=sr_1_11?dchild=1&keywords=baby+toys&qid=1628319047&sr=8-11
"Cable World Stunt Tricycle Bump and Go Toy with 4D Lights, Dancing Toy, Battery Operated Toy,Plastic - Multi Color(Pack of 1)  ",Deal of the Day ,,,"₹1,599",₹531,"Save ₹1,068 (67%)",4.5 out of 5 stars,"1,115",https://www.amazon.in/Cable-Tricycle-Dancing-Battery-Operated/dp/B08BJC3HXK/ref=sr_1_12?dchild=1&keywords=baby+toys&qid=1628319047&sr=8-12
"ESTON 1ST EDITION Teddy Bear Soft Toy (Bulldog-29 Cm Parrot- 24 Cm Balloon Teddy- 24 Cm Pikachu-25 Cm Elephant-25 Cm , Mixed Colour)  ",,,,"₹1,199",₹529,Save ₹670 (56%),4.1 out of 5 stars,908,https://www.amazon.in/ESTON-Bulldog-Elephant-Birthday-Valentine/dp/B08L9R6JXX/ref=sr_1_13?dchild=1&keywords=baby+toys&qid=1628319047&sr=8-13
Cable World Colourful Plastic Non Toxic pack of 8 Attractive Rattle for New Borns(Multi color)  ,Deal of the Day ,,,₹999,₹329,Save ₹670 (67%),4.4 out of 5 stars,"3,987",https://www.amazon.in/Cable-World%C2%AE-Colourful-Plastic-Attractive/dp/B083KH2779/ref=sr_1_14?dchild=1&keywords=baby+toys&qid=1628319047&sr=8-14
"FunBlast Musical Mobile Phone for Kids, Mobile with Light & Sound Toys for Babies | Educational Toys for Kids 3+ Years/Boys/Girls-1 Unit (Random Color)  ",Best sellerLimited time deal,,,₹999,₹314,Save ₹685 (69%),3.7 out of 5 stars,869,https://www.amazon.in/gp/bestsellers/toys/1378298031/ref=sr_bs_14_1378298031_1
"famous quality most popular chu chu bath toys (1 set of 12 animals, Multi color)  ",,,,"₹2,299",₹349,"Save ₹1,950 (85%)",3.8 out of 5 stars,140,https://www.amazon.in/Famous-Quality-Popular-Animals-Multicolour/dp/B07FYP1QZH/ref=sr_1_16?dchild=1&keywords=baby+toys&qid=1628319047&sr=8-16
"KLUZIE 100 Pcs Building Blocks Shapes |Puzzles,Skill Development,Hand Eye cordination, Non-Toxic | Brain Building |Creative |Learning |Educational | Toy (100 Pieces)  ",,,,₹500,₹345,Save ₹155 (31%),3.7 out of 5 stars,57,https://www.amazon.in/KLUZIE-Development-cordination-Non-Toxic-Educational/dp/B08X6GWZF7/ref=sr_1_17?dchild=1&keywords=baby+toys&qid=1628319047&sr=8-17
"Little's Soft Plush Baby Ball with Rattle Sound (11 cm), Multi color  ",Best sellerDeal of the Day ,,,₹210,₹110,Save ₹100 (48%),4.0 out of 5 stars,"6,169",https://www.amazon.in/gp/bestsellers/toys/1378178031/ref=sr_bs_17_1378178031_1
Ratna's Junior Smiley Stacking Multicolour 5 Rings for Toddlers  ,Amazon's ChoiceLimited time deal,,,₹150,₹130,Save ₹20 (13%),4.1 out of 5 stars,"8,397",https://www.amazon.in/Toyztrend-Junior-Stacking-Multicolour-Toddlers/dp/B075F7V3J4/ref=ice_ac_b_dpb?dchild=1&keywords=baby+toys&qid=1628319047&smid=AT95IG9ONZD7S&sr=8-19
SaleOn Dancing and Spinning Rolling Doll Tumble Monkey Toy Voice Control Banana Monkey with Musical Toy with Light and Sound Effects and Sensor Mix Colors  ,,,,₹899,₹449,Save ₹450 (50%),4.3 out of 5 stars,323,https://www.amazon.in/SaleOnTM-Dancing-Spinning-Rolling-MixColor/dp/B07WN7XPXC/ref=sr_1_20?dchild=1&keywords=baby+toys&qid=1628319047&sr=8-20
Einstein Box Birthday Gift Set for 1 Year Old Boys and Girls - Set of 3  ,Best sellerDeal of the Day ,Sponsored,,"₹2,997","₹1,749","Save ₹1,248 (42%)",4.1 out of 5 stars,67,https://www.amazon.in/gp/bestsellers/toys/1378460031/ref=sr_bs_20_1378460031_1
"Popsugar - TH1503B 2 in 1 Xylophone and Piano Toy with Colorful Keys for Toddlers and Kids, Blue  ",,Sponsored,,₹999,₹619,Save ₹380 (38%),4.4 out of 5 stars,186,https://www.amazon.in/gp/slredirect/picassoRedirect.html/ref=pa_sp_mtf_aps_sr_pg1_1?ie=UTF8&adId=A00910571WC9RW7UX1EXC&url=%2FPopsugar-Xylophone-Piano-Musical-Mallets%2Fdp%2FB07NLF4L9C%2Fref%3Dsr_1_22_sspa%3Fdchild%3D1%26keywords%3Dbaby%2Btoys%26qid%3D1628319047%26sr%3D8-22-spons%26psc%3D1&qualifier=1628319047&id=8105111013683515&widgetName=sp_mtf
Storio Educational Learning Stacking Multicolour 5 Rings Baby Toys for Toddlers Kids 1 Year Old and Above  ,,Sponsored,,,₹145,,4.2 out of 5 stars,22,https://www.amazon.in/gp/slredirect/picassoRedirect.html/ref=pa_sp_mtf_aps_sr_pg1_1?ie=UTF8&adId=A10406901SD876QPE6BIR&url=%2FStorio-Stability-Stickerless-3x3x3-Speed%2Fdp%2FB08D8HZGL5%2Fref%3Dsr_1_23_sspa%3Fdchild%3D1%26keywords%3Dbaby%2Btoys%26qid%3D1628319047%26sr%3D8-23-spons%26psc%3D1&qualifier=1628319047&id=8105111013683515&widgetName=sp_mtf
Popsugar Unbreakable Happy Engineering Vehicles Including Tractor / Bulldozer / Dumper / Cement Mixer Toy for Kids Multicolor  ,Deal of the Day ,Sponsored,,"₹1,349",₹845,Save ₹504 (37%),4.3 out of 5 stars,980,https://www.amazon.in/gp/slredirect/picassoRedirect.html/ref=pa_sp_mtf_aps_sr_pg1_1?ie=UTF8&adId=A03414052997YP0GRA2DP&url=%2FPopsugar-Engineering-Including-Bulldozer-Multicolor%2Fdp%2FB07QQK46WJ%2Fref%3Dsr_1_24_sspa%3Fdchild%3D1%26keywords%3Dbaby%2Btoys%26qid%3D1628319047%26sr%3D8-24-spons%26psc%3D1&qualifier=1628319047&id=8105111013683515&widgetName=sp_mtf
"SaleOn Pack of 12 Pcs Mix Cute Animals Swimming Water Toys Non-Toxic,BPA Free Colorful Soft Rubber Float Squeeze Sound Squeaky Bathing Toy for Baby Chu Chu Toy Set - Mix Animals ,Multi Color  ",,,,₹899,₹299,Save ₹600 (67%),4.0 out of 5 stars,844,https://www.amazon.in/Animals-Swimming-Non-Toxic-Colorful-Squeeze/dp/B07ZDDHGFT/ref=sr_1_25?dchild=1&keywords=baby+toys&qid=1628319047&sr=8-25
"Webby Soft Animal Plush Elephant Toy 20cm, Grey  ",Limited time deal,,,₹349,₹249,Save ₹100 (29%),4.4 out of 5 stars,123,https://www.amazon.in/Webby-Soft-Animal-Plush-Elephant/dp/B08QX75XNZ/ref=sr_1_26?dchild=1&keywords=baby+toys&qid=1628319047&sr=8-26
Toyshine Dancing Dog with Music Flashing Lights  ,Deal of the Day ,,,₹999,₹449,Save ₹550 (55%),4.0 out of 5 stars,"5,847",https://www.amazon.in/Toyshine-Dancing-Music-Flashing-Lights/dp/B074Y7KQD1/ref=sr_1_27?dchild=1&keywords=baby+toys&qid=1628319047&sr=8-27
"SNOWIE SOFT® 6 Pack Baby Cloth Books, My First Non-Toxic Soft Clothing Books Early Educational Toys Gifts Activity Crinkle Cloth Book for Toddler, Infants (Red-6pcs)  ",,,,₹959,₹729,Save ₹230 (24%),4.0 out of 5 stars,34,https://www.amazon.in/SNOWIE-Non-Toxic-Clothing-Educational-Activity/dp/B08X3C8VQY/ref=sr_1_28?dchild=1&keywords=baby+toys&qid=1628319047&sr=8-28
Einstein Box | Baby Toys Set of Rattle Toys + High Contrast Books+ High Contrast Flashcards For Infants and Newborns of 0-12 months | Set of Rattle Toys + High Contrast Books+ High Contrast Flashcards| Baby Boys and Girls  ,,,,₹999,₹599,Save ₹400 (40%),4.4 out of 5 stars,206,https://www.amazon.in/Einstein-Box-Contrast-Flashcards-Newborns/dp/B09BCQ52R8/ref=sr_1_29?dchild=1&keywords=baby+toys&qid=1628319047&sr=8-29
"Ramakada Lovely Attractive Colorful Toddlers 7 Rattle and 1 Teether Toys Set for Babies pack of 8 Pieces,Non toxic Plastic-Multi color  ",,,,₹999,₹399,Save ₹600 (60%),4.3 out of 5 stars,"1,429",https://www.amazon.in/Ramakada-Attractive-Colorful-Toddlers-Teether/dp/B07RSL1LV8/ref=sr_1_30?dchild=1&keywords=baby+toys&qid=1628319047&sr=8-30
"Babique Unicorn Teddy Bear Plush Soft Toy Cute Kids Birthday Animal Baby Boys/Girls (25 cm, Pink )  ",Best sellerDeal of the Day ,,,₹699,₹169,Save ₹530 (76%),4.0 out of 5 stars,"4,046",https://www.amazon.in/gp/bestsellers/toys/1378449031/ref=sr_bs_30_1378449031_1
Toyshine Push and Shake Wobbling Bell Sounds Roly Poly Tumbler Doll (Multicolour)  ,,,,₹899,₹449,Save ₹450 (50%),4.2 out of 5 stars,"3,389",https://www.amazon.in/Toyshine-Wobbling-Sounds-Tumbler-Multicolour/dp/B073WVT662/ref=sr_1_32?dchild=1&keywords=baby+toys&qid=1628319047&sr=8-32
Styleys Animal Finger Puppets - Set of 10  ,Best seller,,,₹599,₹389,Save ₹210 (35%),3.7 out of 5 stars,"1,854",https://www.amazon.in/gp/bestsellers/toys/1378466031/ref=sr_bs_32_1378466031_1
"Luvlap - 18588 Multi Textured Grab Balls for Baby, Multicolor  ",Deal of the Day ,,,₹599,₹359,Save ₹240 (40%),4.3 out of 5 stars,400,https://www.amazon.in/Luvlap-Multi-Textured-Balls-Multicolor/dp/B07NDD51SN/ref=sr_1_34?dchild=1&keywords=baby+toys&qid=1628319047&sr=8-34
Gifts Online Dancing Dalmatian Dog with Flashing Lights + Music  ,Deal of the Day ,,,₹500,₹374,Save ₹126 (25%),4.1 out of 5 stars,"1,442",https://www.amazon.in/Jiada-Dancing-Dalmatian-Flashing-Lights/dp/B01KQ4EMQM/ref=sr_1_35?dchild=1&keywords=baby+toys&qid=1628319047&sr=8-35
"Little Innocents® Big Size Fibre Filled Stuffed Animal Elephant Baby Soft Toy of Plush Material Hugging Pillow for Toddlers with Small Baby Play Ball (Grey, 60 cm)…  ",,,,"₹1,699",₹699,"Save ₹1,000 (59%)",4.2 out of 5 stars,249,https://www.amazon.in/Little-Innocents%C2%AE-Elephant-Material-Toddlers/dp/B08XC1NJJ5/ref=sr_1_36?dchild=1&keywords=baby+toys&qid=1628319047&sr=8-36
"Pikipo Kitty Face Rattle Cum Soft Toy (Squeeze Handle for Squeaky Sound)-Plush,Red,Pack of 1  ",Limited time deal,,,₹349,₹199,Save ₹150 (43%),4.3 out of 5 stars,"4,638",https://www.amazon.in/Pikipo-Rattle-Squeeze-Handle-Squeaky/dp/B07RYWLT6L/ref=sr_1_37?dchild=1&keywords=baby+toys&qid=1628319047&smid=A27JTVI6M1I68D&sr=8-37
"ButterflyEduFields Magnetic Shapes Puzzles Toys for Kids Boys & Girls - 23 Pieces | Educational Toy Gift for Unlimited Imaginative Fun & Play for Baby, Made in India STEM Toy Prime Day Special Deal Sale  ",Deal of the Day ,,,₹499,₹398,Save ₹101 (20%),4.2 out of 5 stars,"2,239",https://www.amazon.in/ButterflyFields-Magnetic-Shapes-Unlimited-Imaginative/dp/B084BZ2S37/ref=sr_1_38?dchild=1&keywords=baby+toys&qid=1628319047&sr=8-38
Zest 4 Toyz Musical Baby Crawling Toy for Kids with 3D Lights& Music Toys for Babies - Assorted  ,Deal of the Day ,,,₹999,₹415,Save ₹584 (58%),4.1 out of 5 stars,"1,018",https://www.amazon.in/Zest-Toyz-Weeping-Naughty-Crawling/dp/B07TV7BC7X/ref=sr_1_39?dchild=1&keywords=baby+toys&qid=1628319047&sr=8-39
"LONGMIRE Baby and Toddler Plastic First Block Shape, Sorter, Colors, ABCD Shape, Toys for 1 Year Old (Multicolour)  ",,,,₹699,₹499,Save ₹200 (29%),4.0 out of 5 stars,200,https://www.amazon.in/LONGMIRE-Toddler-Plastic-Sorter-Multicolour/dp/B091884VRC/ref=sr_1_40?dchild=1&keywords=baby+toys&qid=1628319047&sr=8-40
SCOOBA Giraffe Animal Soft Toy 30cm Height Single Piece  ,,,,₹999,₹398,Save ₹601 (60%),4.4 out of 5 stars,"1,536",https://www.amazon.in/SCOOBA-Kids-Favourite-Giraffe-Height/dp/B085TBV2Y7/ref=sr_1_41?dchild=1&keywords=baby+toys&qid=1628319047&sr=8-41
"Giggles - Stacking Cubes , Multicolour stacking Blocks with Alphabet, Helps to Sort,Stack and Nest, 12 months & above, Infant and Preschool Toys  ",Deal of the Day ,,,₹175,₹139,Save ₹36 (21%),4.5 out of 5 stars,"4,147",https://www.amazon.in/Funskool-Giggles-Stacking-Cubes-Multi/dp/B00VVQRW2G/ref=sr_1_42?dchild=1&keywords=baby+toys&qid=1628319047&sr=8-42
"wishkey colourful plastic bpa free non toxic pack of 7 musical instruments rattle for new borns,maraca,blowing trumpets, tambourines, castanets- Multi color  ",Best seller,,,₹499,₹379,Save ₹120 (24%),4.4 out of 5 stars,"12,705",https://www.amazon.in/gp/bestsellers/toys/1378181031/ref=sr_bs_42_1378181031_1
"WISHKEY Set of 3 Plastic Non-Toxic Shake and Grab Ball Baby Rattles, Educational and Developmental Toys with Storage Bag for New Born Toddler Kids (Pack of 3, Multicolor)  ",Best seller,,,₹399,₹279,Save ₹120 (30%),4.4 out of 5 stars,"12,705",https://www.amazon.in/gp/bestsellers/toys/1378181031/ref=sr_bs_43_1378181031_1
"Toyshine Concept Musical and 3D Lights Kids Transparent Car, Toy for 2-5 Year Kids Baby Toy (Battery Included)  ",Deal of the Day ,,,₹999,₹493,Save ₹506 (51%),4.3 out of 5 stars,"2,297",https://www.amazon.in/Toyshine-Concept-Musical-Transparent-Included/dp/B08WLWGTWG/ref=sr_1_45?dchild=1&keywords=baby+toys&qid=1628319047&sr=8-45
Hem Jewels Pure Silver Baby Jhunjhuna Rattle Toy Teether for new born baby with Whistle.  ,,,,"₹3,250","₹2,360",Save ₹890 (27%),5.0 out of 5 stars,1,https://www.amazon.in/Hem-Jewels-Jhunjhuna-Teether-Whistle-D4/dp/B08JKKJBR6/ref=sr_1_46?dchild=1&keywords=baby+toys&qid=1628319047&sr=8-46
"MPR Enterprises - Pink, Blue & Yellow Unicorn Stuffed Soft Toy Plush for Kids Baby Boy Girl Birthday Size 26 cm Set of 3  ",,,,₹999,₹449,Save ₹550 (55%),4.5 out of 5 stars,4,https://www.amazon.in/MPR-Enterprises-Unicorn-Stuffed-Birthday/dp/B091Q6P5FJ/ref=sr_1_47?dchild=1&keywords=baby+toys&qid=1628319047&sr=8-47
Future Shop Pack of 4 Elegant Soft Toys Combo Set Penguin/Elephant/Unicorn/Rabbit Toy Animals for You - 28 cm (Multicolor)  ,,,,₹999,₹499,Save ₹500 (50%),4.5 out of 5 stars,22,https://www.amazon.in/Future-Elegant-Penguin-Elephant-Unicorn/dp/B097RZT8K3/ref=sr_1_48?dchild=1&keywords=baby+toys&qid=1628319047&sr=8-48
"Spanking Plastic Flash Drum with 3D Lights and Musical Toys , Multicolour, 2 Year  ",,,,₹499,₹419,Save ₹80 (16%),3.7 out of 5 stars,"2,582",https://www.amazon.in/Zuffon-Kids-Flash-Lights-Musical/dp/B07J5CST1W/ref=sr_1_49?dchild=1&keywords=baby+toys&qid=1628319047&sr=8-49
Toyshine Toys for Baby - 7 Pcs Jumbo Animals Chu Chu Toys Toddler Baby Bathtub Bathing Squeeze Bath Toys Non-Toxic  ,,,,₹799,₹394.68,Save ₹404.32 (51%),4.3 out of 5 stars,67,https://www.amazon.in/Toyshine-Toys-Baby-Animals-Non-Toxic/dp/B08R9QFG2B/ref=sr_1_50?dchild=1&keywords=baby+toys&qid=1628319047&sr=8-50
"Toyshine Pack of 8 Light Colors Rattle Set for New Born Babies, Toy for Babies, Non-Toxic  ",,,,₹899,₹505.08,Save ₹393.92 (44%),4.4 out of 5 stars,79,https://www.amazon.in/Toyshine-Colors-Rattle-Babies-Non-Toxic/dp/B08R9MH683/ref=sr_1_51?dchild=1&keywords=baby+toys&qid=1628319047&sr=8-51
"wirescorts 5 layer ball drop and roll swirling tower for baby and toddler development educational toys | stack, drop and go ball ramp toy set includes 3 spinning acrylic activity balls- Multi color  ",Deal of the Day ,,,₹999,₹566,Save ₹433 (43%),4.4 out of 5 stars,317,https://www.amazon.in/wirescorts-swirling-development-educational-spinning/dp/B08FM7F34J/ref=sr_1_52?dchild=1&keywords=baby+toys&qid=1628319047&sr=8-52
"Fisher-Price Original Rock-a-Stack,Multicolor, Classic stacking toy with 5 colorful rings to grasp, shake, and stack!  ",Deal of the Day ,,,₹299,₹229,Save ₹70 (23%),4.5 out of 5 stars,"6,749",https://www.amazon.in/Fisher-Price-Brilliant-Basics-Rock-a-Stack-Multicolor/dp/B00000IZQP/ref=sr_1_53?dchild=1&keywords=baby+toys&qid=1628319047&sr=8-53
simple days baby rattle wooden musical toys - set of 6- Multi color  ,,,,"₹1,200",₹649,Save ₹551 (46%),4.3 out of 5 stars,285,https://www.amazon.in/Simple-Days-Rattle-Wooden-Musical/dp/B07K7KQ8J3/ref=sr_1_54?dchild=1&keywords=baby+toys&qid=1628319047&sr=8-54
Grizzly Wooden Intellectual Geometric Shape Matching Five Column Blocks Educational & Learning Toys  ,,,,₹500,₹349,Save ₹151 (30%),4.3 out of 5 stars,"1,650",https://www.amazon.in/Grizzly-Geometric-Matching-Educational-Learning/dp/B07GFN2981/ref=sr_1_55?dchild=1&keywords=baby+toys&qid=1628319047&sr=8-55
"HUG 'n' FEEL SOFT TOYS Lion, Soft Toys, Soft Toys Girls, Baby Toys, Toys for 1 Year Old, Birthday Gift for Girls/boy, Baby Toys, Rakhi for Brother/Sister Gift Items, (35cm Lion, Multi-Color)  ",Best sellerDeal of the Day ,,,₹999,₹449,Save ₹550 (55%),3.9 out of 5 stars,100,https://www.amazon.in/gp/bestsellers/toys/1378448031/ref=sr_bs_55_1378448031_1
Toyshine Wooden Angle Geometric Blocks Stacker Shape Sorter Column Puzzle Stacking Set for Kids- B  ,Limited time deal,Sponsored,,₹999,₹399,Save ₹600 (60%),4.6 out of 5 stars,"1,804",https://www.amazon.in/gp/slredirect/picassoRedirect.html/ref=pa_sp_btf_aps_sr_pg1_1?ie=UTF8&adId=A03542736VD7T69NJFB4&url=%2FToyshine-Geometric-Building-Stacker-Stacking%2Fdp%2FB07SYJXQTR%2Fref%3Dsr_1_57_sspa%3Fdchild%3D1%26keywords%3Dbaby%2Btoys%26qid%3D1628319047%26smid%3DA1RDS4H20GYJMB%26sr%3D8-57-spons%26psc%3D1&qualifier=1628319047&id=8105111013683515&widgetName=sp_btf
"Wonder House Books Early Learning ABC Puzzle Box for Preschoolers and Toddlers - Learning Aid & Educational Toy (Jigsaw Puzzle for Kids Age 3 and Above), Multicolor  ",,Sponsored,,₹199,₹179,Save ₹20 (10%),3.8 out of 5 stars,20,https://www.amazon.in/gp/slredirect/picassoRedirect.html/ref=pa_sp_btf_aps_sr_pg1_1?ie=UTF8&adId=A06459171ENIJE5SHKK6O&url=%2FWonder-House-Books-Learning-Preschoolers%2Fdp%2F938993138X%2Fref%3Dsr_1_58_sspa%3Fdchild%3D1%26keywords%3Dbaby%2Btoys%26qid%3D1628319047%26sr%3D8-58-spons%26psc%3D1&qualifier=1628319047&id=8105111013683515&widgetName=sp_btf
"Little's Soft Plush Baby Ball with Rattle Sound (11 cm), Multi color  ",Best sellerDeal of the Day ,Sponsored,,₹210,₹110,Save ₹100 (48%),4.0 out of 5 stars,"6,169",https://www.amazon.in/gp/bestsellers/toys/1378178031/ref=sr_bs_58_1378178031_1
"Little's Junior Ring (Plastic,Multicolour)  ",Best sellerDeal of the Day ,Sponsored,,₹225,₹151,Save ₹74 (33%),4.3 out of 5 stars,"20,435",https://www.amazon.in/gp/bestsellers/jewelry/2152567031/ref=sr_bs_59_2152567031_1
"Popsugar Kids Push and Shake Tumbler Doll with Happy Face and Sounds Toy, (Pink)  ",Deal of the Day ,Sponsored,,₹799,₹610,Save ₹189 (24%),4.2 out of 5 stars,480,https://www.amazon.in/gp/slredirect/picassoRedirect.html/ref=pa_sp_atf_next_aps_sr_pg2_1?ie=UTF8&adId=A01948793OTVVQ46VROV5&url=%2FPopsugar-TH979P-Tumbler-Doll-Pink%2Fdp%2FB07NLG1VKS%2Fref%3Dsr_1_49_sspa%3Fdchild%3D1%26keywords%3Dbaby%2Btoys%26qid%3D1628319076%26sr%3D8-49-spons%26psc%3D1&qualifier=1628319076&id=4371130775612524&widgetName=sp_atf_next
CUBS & HUGS Soft Toys for Babies Face Rattle Girls Toys & Boys Toys (Squeeze Handle for Squeaky Sound)  ,,Sponsored,,₹999,₹399,Save ₹600 (60%),4.2 out of 5 stars,135,https://www.amazon.in/gp/slredirect/picassoRedirect.html/ref=pa_sp_atf_next_aps_sr_pg2_1?ie=UTF8&adId=A00384371VB8QP3NBLCAB&url=%2FCUBS-HUGS-Babies-Squeeze-Squeaky%2Fdp%2FB08TGB7MXJ%2Fref%3Dsr_1_50_sspa%3Fdchild%3D1%26keywords%3Dbaby%2Btoys%26qid%3D1628319076%26sr%3D8-50-spons%26psc%3D1&qualifier=1628319076&id=4371130775612524&widgetName=sp_atf_next
"Popsugar - TH6600W Happy Cow Musical Piano with Music, Animal Sounds and Flashing Lights Toy for Kids, White  ",Deal of the Day ,Sponsored,,"₹1,099",₹649,Save ₹450 (41%),4.3 out of 5 stars,330,https://www.amazon.in/gp/slredirect/picassoRedirect.html/ref=pa_sp_atf_next_aps_sr_pg2_1?ie=UTF8&adId=A049479828QXWL2Z79QQA&url=%2FPopsugar-Musical-Animal-Sounds-Flashing%2Fdp%2FB07QNCLJWR%2Fref%3Dsr_1_51_sspa%3Fdchild%3D1%26keywords%3Dbaby%2Btoys%26qid%3D1628319076%26sr%3D8-51-spons%26psc%3D1&qualifier=1628319076&id=4371130775612524&widgetName=sp_atf_next
"Toyshine Drum Keyboard Musical Toys with Flashing Lights, Animal Sounds and Songs, Multi Color  ",,Sponsored,,₹999,₹559,Save ₹440 (44%),4.2 out of 5 stars,488,https://www.amazon.in/gp/slredirect/picassoRedirect.html/ref=pa_sp_atf_next_aps_sr_pg2_1?ie=UTF8&adId=A09662481DQAOZ92M0CE7&url=%2FToyshine-Sunshine-Keyboard-Musical-Flashing%2Fdp%2FB01MSC4TXQ%2Fref%3Dsr_1_52_sspa%3Fdchild%3D1%26keywords%3Dbaby%2Btoys%26qid%3D1628319076%26sr%3D8-52-spons%26psc%3D1&qualifier=1628319076&id=4371130775612524&widgetName=sp_atf_next
eErlik Colourful Plastic Non Toxic BPA Pack of 8 Attractive Rattle for New Borns and Infants - Multi color  ,,,,₹999,₹379,Save ₹620 (62%),4.4 out of 5 stars,443,https://www.amazon.in/eErlik%C2%AE-Colourful-Plastic-Attractive-Infants/dp/B089FZ41PD/ref=sr_1_53?dchild=1&keywords=baby+toys&qid=1628319076&sr=8-53
"JOY MAKER First's Block Shape, Sorter, Colors,Baby and Toddler, ABCD with Other Shape, Toys for 1 Year Old Girl Boy Kids  ",,,,₹999,₹499,Save ₹500 (50%),,,https://www.amazon.in/JOY-MAKER-Firsts-Sorter-Toddler/dp/B098RB218B/ref=sr_1_54?dchild=1&keywords=baby+toys&qid=1628319076&sr=8-54
"Toyshine Plastic Concept Musical and 3D Lights Transparent Toy Car for 2 to 5 Year Kids, Multicolor  ",Deal of the Day ,,,₹999,₹449,Save ₹550 (55%),4.3 out of 5 stars,"2,297",https://www.amazon.in/Toyshine-Concept-Musical-Lights-Transparent/dp/B088ZRY2HF/ref=sr_1_55?dchild=1&keywords=baby+toys&qid=1628319076&sr=8-55
Jiada Swirl Ball Ramp Educational Toy Puzzle Rolling Ball | ABS Material Non Toxic  ,Deal of the Day ,,,"₹1,500",₹489,"Save ₹1,011 (67%)",4.2 out of 5 stars,727,https://www.amazon.in/Jiada-Educational-Puzzle-Rolling-Material/dp/B07FR8FXNM/ref=sr_1_56?dchild=1&keywords=baby+toys&qid=1628319076&sr=8-56
"RUTV Happy Home Building Construction Blocks for Kids Bricks&Shapes Interlocking Connector,Best Gift Toy,Block Game for Children Baby Boys Baby Girl  ",,,,₹699,₹329,Save ₹370 (53%),5.0 out of 5 stars,6,https://www.amazon.in/RUTV-Building-Construction-Interlocking-Connector/dp/B09924HNWM/ref=sr_1_57?dchild=1&keywords=baby+toys&qid=1628319076&sr=8-57
"EVOHOME® My First Step Baby Kids Activity Walker Baby Walking Support Learning Birthday Walking Toy Walker for Both Boy and Girl, 9 Months -1.5 Year (Yellow Blue)  ",,,,"₹2,499",₹959,"Save ₹1,540 (62%)",2.7 out of 5 stars,8,https://www.amazon.in/EVOHOME%C2%AE-Activity-Walking-Learning-Birthday/dp/B0974HZJQ9/ref=sr_1_58?dchild=1&keywords=baby+toys&qid=1628319076&sr=8-58
SELLMONK Baby First Block Shape Sorter Colors Toddler ABCD Shape Baby Toys for 1 Year Old Girl (Baby First Block)  ,,,,₹799,₹539,Save ₹260 (33%),4.2 out of 5 stars,21,https://www.amazon.in/SELLMONK-First-Sorter-Colors-Toddler/dp/B091RYT7CD/ref=sr_1_59?dchild=1&keywords=baby+toys&qid=1628319076&sr=8-59
Baby Station Baby Crib & Stroller Plush Playing Toy Car Hanging Rattles (Shark)  ,,,,"₹1,199",₹649,Save ₹550 (46%),4.7 out of 5 stars,324,https://www.amazon.in/Baby-Station-Stroller-Playing-Hanging/dp/B07D224XYK/ref=sr_1_60?dchild=1&keywords=baby+toys&qid=1628319076&sr=8-60
