name,badge_1,badge_2,badge_3,mrp,discounted_price,discount,rating,rating_count,link
Einstein Box | Baby Toys Set of Rattle Toys + High Contrast Books+ High Contrast Flashcards For Infants and Newborns of 0-12 months | Set of Rattle Toys + High Contrast Books+ High Contrast Flashcards| Baby Boys and Girls  ,Deal of the Day ,Sponsored,,₹999,₹569,Save ₹430 (43%),4.4 out of 5 stars,177,https://www.amazon.in/gp/slredirect/picassoRedirect.html/ref=pa_sp_atf_aps_sr_pg1_1?ie=UTF8&adId=A04026192YS4HNKWNRHF&url=%2FEinstein-Box-Contrast-Flashcards-Newborns%2Fdp%2FB08LBFRY6J%2Fref%3Dsr_1_1_sspa%3Fdchild%3D1%26keywords%3Dbaby%2Btoys%26qid%3D1625936707%26sr%3D8-1-spons%26psc%3D1&qualifier=1625936707&id=8845170185780963&widgetName=sp_atf
"Little's Soft Plush Baby Ball with Rattle Sound (11 cm), Multi color  ",Kids gift ideas,Sponsored,,₹210,₹159,Save ₹51 (24%),4.0 out of 5 stars,"5,270",https://www.amazon.in/gcx/-/gfhz/events/?ref=kidsguide&categoryId=Kids-hol-gift-guide&subcategoryIds=handpicked&pinnedAsins=B00ADZULW4
"Luvlap Sunshine Baby Walker, Height Adjustable with Light & Music Toys, 6m+ (Pink)  ",,Sponsored,,"₹3,199","₹2,299",Save ₹900 (28%),3.9 out of 5 stars,"3,037",https://www.amazon.in/gp/slredirect/picassoRedirect.html/ref=pa_sp_atf_aps_sr_pg1_1?ie=UTF8&adId=A02915943PFAM72O494PF&url=%2FLuvLap-Baby-Walker-Sunshine-Pink%2Fdp%2FB00IYDEFTC%2Fref%3Dsr_1_3_sspa%3Fdchild%3D1%26keywords%3Dbaby%2Btoys%26qid%3D1625936707%26sr%3D8-3-spons%26psc%3D1&qualifier=1625936707&id=8845170185780963&widgetName=sp_atf
"KWT Baby Kids Water Play Mat Toys Inflatable Tummy Time Leakproof Water Play Mat, Fun Activity Play Center Indoor and Outdoor Water Play Mat for Baby(Regular)  ",,Sponsored,,,₹849,,3.6 out of 5 stars,6,https://www.amazon.in/gp/slredirect/picassoRedirect.html/ref=pa_sp_atf_aps_sr_pg1_1?ie=UTF8&adId=A0957073OEHJPCT62R0V&url=%2FKWT-Inflatable-Leakproof-Activity-Outdoor%2Fdp%2FB096X49FBZ%2Fref%3Dsr_1_4_sspa%3Fdchild%3D1%26keywords%3Dbaby%2Btoys%26qid%3D1625936707%26sr%3D8-4-spons%26psc%3D1&qualifier=1625936707&id=8845170185780963&widgetName=sp_atf
Ratna's Junior Smiley Stacking Multicolour 5 Rings for Toddlers  ,Amazon's Choice,,,₹150,₹138,Save ₹12 (8%),4.1 out of 5 stars,"7,449",https://www.amazon.in/Toyztrend-Junior-Stacking-Multicolour-Toddlers/dp/B075F7V3J4/ref=ice_ac_b_dpb?dchild=1&keywords=baby+toys&qid=1625936707&sr=8-5
Cable World Kick and Play Musical Keyboard Mat Piano Baby Gym and Fitness Rack (Assorted Colour)  ,Kids gift ideasDeal of the Day ,,,,₹949,,3.9 out of 5 stars,"4,291",https://www.amazon.in/gcx/-/gfhz/events/?ref=kidsguide&categoryId=Kids-hol-gift-guide&subcategoryIds=handpicked&pinnedAsins=B07TCPBJK6
BabyGo Rotating Giraffe Musical Rattle Cot Mobile for Cradle and Bed Jhoomer ( No Batteries Needed)  ,Kids gift ideas,,,₹899,₹675,Save ₹224 (25%),4.2 out of 5 stars,"1,946",https://www.amazon.in/gcx/-/gfhz/events/?ref=kidsguide&categoryId=Kids-hol-gift-guide&subcategoryIds=handpicked&pinnedAsins=B07NDWBHW3
"Little's Junior Ring (Plastic,Multicolour)  ",Kids gift ideas,,,₹225,₹159,Save ₹66 (29%),4.3 out of 5 stars,"18,005",https://www.amazon.in/gcx/-/gfhz/events/?ref=kidsguide&categoryId=Kids-hol-gift-guide&subcategoryIds=handpicked&pinnedAsins=B00ADZUNYK
"WISHKEY Plastic Bath Toy Set of 14 Pcs Chu Chu Colorful Animal Shape Toy for New Born Babies, Fun Bathtime Buddies for Toddlers (Pack of 14, Multicolor)  ",Kids gift ideas,,,₹379,₹349,Save ₹30 (8%),4.2 out of 5 stars,"3,758",https://www.amazon.in/gcx/-/gfhz/events/?ref=kidsguide&categoryId=Kids-hol-gift-guide&subcategoryIds=handpicked&pinnedAsins=B075K56GXY
Cable World Colourful Plastic Non Toxic pack of 8 Attractive Rattle for New Borns(Multi color)  ,Kids gift ideasDeal of the Day ,,,,₹349,,4.4 out of 5 stars,"3,462",https://www.amazon.in/gcx/-/gfhz/events/?ref=kidsguide&categoryId=Kids-hol-gift-guide&subcategoryIds=handpicked&pinnedAsins=B083KH2779
"SaleOn Pack of 12 Pcs Mix Cute Animals Swimming Water Toys Non-Toxic,BPA Free Colorful Soft Rubber Float Squeeze Sound Squeaky Bathing Toy for Baby Chu Chu Toy Set - Mix Animals ,Multi Color  ",,,,,₹299,,4.0 out of 5 stars,713,https://www.amazon.in/Animals-Swimming-Non-Toxic-Colorful-Squeeze/dp/B07ZDDHGFT/ref=sr_1_11?dchild=1&keywords=baby+toys&qid=1625936707&sr=8-11
"FunBlast Musical Mobile Phone for Kids, Mobile with Light & Sound Toys for Babies | Educational Toys for Kids 3+ Years/Boys/Girls-1 Unit (Random Color)  ",Kids gift ideasLimited time deal,,,₹999,₹331,Save ₹668 (67%),3.8 out of 5 stars,609,https://www.amazon.in/gcx/-/gfhz/events/?ref=kidsguide&categoryId=Kids-hol-gift-guide&subcategoryIds=handpicked&pinnedAsins=B08PD1WJSZ
"Toyshine Pack of 8 Rattle and Teather Set for New Born Babies, 5 Rattle Set and 3 Teathers, Non-Toxic  ",,,,₹699,₹449,Save ₹250 (36%),4.3 out of 5 stars,337,https://www.amazon.in/Toyshine-Rattle-Teather-Teathers-Non-Toxic/dp/B08PFSCB9Q/ref=sr_1_13?dchild=1&keywords=baby+toys&qid=1625936707&sr=8-13
Toyshine Dancing Dog with Music Flashing Lights  ,,,,₹999,₹529,Save ₹470 (47%),4.0 out of 5 stars,"5,322",https://www.amazon.in/Toyshine-Dancing-Music-Flashing-Lights/dp/B074Y7KQD1/ref=sr_1_14?dchild=1&keywords=baby+toys&qid=1625936707&sr=8-14
"Popsugar - THLL818-1R Mini Laptop with Learning Games, Red  ",,,,₹749,₹309,Save ₹440 (59%),3.3 out of 5 stars,693,https://www.amazon.in/Popsugar-Mini-Laptop-Learning-Games/dp/B07QPG77P8/ref=sr_1_15?dchild=1&keywords=baby+toys&qid=1625936707&sr=8-15
"Little's Soft Plush Baby Ball with Rattle Sound (11 cm), Multi color  ",Kids gift ideas,,,₹210,₹159,Save ₹51 (24%),4.0 out of 5 stars,"5,270",https://www.amazon.in/gcx/-/gfhz/events/?ref=kidsguide&categoryId=Kids-hol-gift-guide&subcategoryIds=handpicked&pinnedAsins=B00ADZULW4
"WISHKEY Colorful Attractive Plastic Non Toxic Set of 7 Shake & Grab Rattle and 1 Soothing Teether for New Born and Infants (Pack of 8 , Multicolor)  ",Kids gift ideas,,,₹599,₹429,Save ₹170 (28%),4.4 out of 5 stars,"11,347",https://www.amazon.in/gcx/-/gfhz/events/?ref=kidsguide&categoryId=Kids-hol-gift-guide&subcategoryIds=handpicked&pinnedAsins=B079VY6STX
Babique Ball Stuffed Soft Toy Plush for Kids Baby Boy Girl Birthday  ,,,,,₹115,,4.0 out of 5 stars,824,https://www.amazon.in/Babique-Penguin-Stuffed-Plush-Birthday/dp/B08LTGRLD2/ref=sr_1_18?dchild=1&keywords=baby+toys&qid=1625936707&sr=8-18
"WISHKEY Plastic Colorful Non Toxic BPA Free 9 Shake & Grab Rattles and 3 Soothing Teethers for Babies & Infants, Early Age Toys for Kids ( Pack of 12, Multicolor)  ",Kids gift ideas,,,₹599,₹569,Save ₹30 (5%),4.4 out of 5 stars,"11,347",https://www.amazon.in/gcx/-/gfhz/events/?ref=kidsguide&categoryId=Kids-hol-gift-guide&subcategoryIds=handpicked&pinnedAsins=B07T7P97G2
"ESTON 1ST EDITION Teddy Bear Soft Toy (Bulldog-29 Cm Parrot- 24 Cm Balloon Teddy- 24 Cm Pikachu-25 Cm Elephant-25 Cm , Mixed Colour)  ",,,,"₹1,199",₹545,Save ₹654 (55%),4.1 out of 5 stars,705,https://www.amazon.in/ESTON-Bulldog-Elephant-Birthday-Valentine/dp/B08L9R6JXX/ref=sr_1_20?dchild=1&keywords=baby+toys&qid=1625936707&sr=8-20
"Little's Baby Pants Diapers with Wetness Indicator and 12 Hours Absorption, Large (L), 9-14 kg, 60 Count  ",,Sponsored,,₹798,₹595,Save ₹203 (25%),4.1 out of 5 stars,"14,845",https://www.amazon.in/gp/slredirect/picassoRedirect.html/ref=pa_sp_mtf_aps_sr_pg1_1?ie=UTF8&adId=A0913703FK32VB9AMMFB&url=%2FLittles-Diapers-Wetness-Indicator-Absorption%2Fdp%2FB08J126QF9%2Fref%3Dsr_1_21_sspa%3Fdchild%3D1%26keywords%3Dbaby%2Btoys%26qid%3D1625936707%26sr%3D8-21-spons%26psc%3D1&qualifier=1625936707&id=8845170185780963&widgetName=sp_mtf
Ardith Double Sided Water Proof Baby Mat Carpet Baby Crawl Play Mat Kids Infant Crawling Play Mat Carpet Baby Gym Water Resistant Baby Play (Standard)  ,,Sponsored,,,₹649,,4.5 out of 5 stars,73,https://www.amazon.in/gp/slredirect/picassoRedirect.html/ref=pa_sp_mtf_aps_sr_pg1_1?ie=UTF8&adId=A0217012UM94CXHPQIN5&url=%2FArdith-Double-Crawling-Resistant-Standard%2Fdp%2FB08M9R9Z7N%2Fref%3Dsr_1_22_sspa%3Fdchild%3D1%26keywords%3Dbaby%2Btoys%26qid%3D1625936707%26sr%3D8-22-spons%26psc%3D1&qualifier=1625936707&id=8845170185780963&widgetName=sp_mtf
"Little's Junior Ring (Plastic,Multicolour)  ",Kids gift ideas,Sponsored,,₹225,₹159,Save ₹66 (29%),4.3 out of 5 stars,"18,005",https://www.amazon.in/gcx/-/gfhz/events/?ref=kidsguide&categoryId=Kids-hol-gift-guide&subcategoryIds=handpicked&pinnedAsins=B00ADZUNYK
Johnson's Baby Care Collection Baby Gift Set with Organic Cotton Baby T-Shirt (7 Pieces)  ,Best seller,Sponsored,,₹340,₹273,Save ₹67 (20%),4.3 out of 5 stars,"8,484",https://www.amazon.in/gp/bestsellers/baby/8360552031/ref=sr_bs_23_8360552031_1
"Storio Colorful Floating Baby Toys Bath Aquatic Animals Chu Chu Toys for Newborn Babies, Kids  ",Best seller,,,,₹291,,4.2 out of 5 stars,"2,171",https://www.amazon.in/gp/bestsellers/toys/1378183031/ref=sr_bs_24_1378183031_1
"RYLAN Baby Kids Water Play Mat Toys Inflatable Tummy Time Leakproof Water Play Mat, Fun Activity Play Center Indoor and Outdoor Water Play Mat for Baby(Regular)  ",,,,,₹949,,3.7 out of 5 stars,14,https://www.amazon.in/Inflatable-Leakproof-Activity-Outdoor-Regular/dp/B096SDRLZ4/ref=sr_1_26?dchild=1&keywords=baby+toys&qid=1625936707&sr=8-26
Tutooze Mickey Shape Soft Plush Cushion Baby Sofa Seat or Rocking Chair for Kids 0 to 4 Years (Red and Black)  ,,,,"₹1,599",₹740,Save ₹859 (54%),3.8 out of 5 stars,62,https://www.amazon.in/Tutooze-Mickey-Shape-Cushion-Rocking/dp/B08ZJKKTP6/ref=sr_1_27?dchild=1&keywords=baby+toys&qid=1625936707&sr=8-27
RVA Pooh Toy Shape Baby Supporting Seat Soft Plush Cushion and Chair for Kids - Yellow (0-4 Years)  ,,,,"₹1,999",₹899,"Save ₹1,100 (55%)",3.0 out of 5 stars,3,https://www.amazon.in/RVA-Shape-Supporting-Plush-Cushion/dp/B08THDLXCT/ref=sr_1_28?dchild=1&keywords=baby+toys&qid=1625936707&sr=8-28
"Soniya Enterprises Pack of 4 Elegant Soft Toys Combo Set Bull Dog , Pink Balloon , Yellow Unicorn , Grey Mother Elephant Special Offers Toy Animals for You - 42 cm (Multicolor) - 42 cm (Multicolor)  ",,,,₹999,₹499,Save ₹500 (50%),2.9 out of 5 stars,5,https://www.amazon.in/Soniya-Enterprises-Elegant-Balloon-Elephant/dp/B092MBB9R7/ref=sr_1_29?dchild=1&keywords=baby+toys&qid=1625936707&sr=8-29
"Toyshine Dancing Dog with Music, Flashing Lights (Battery Included)- Multi Color  ",,,,₹999,₹549,Save ₹450 (45%),4.0 out of 5 stars,"5,322",https://www.amazon.in/Toyshine-Dancing-Flashing-Battery-Included/dp/B085DS2BZ5/ref=sr_1_30?dchild=1&keywords=baby+toys&qid=1625936707&sr=8-30
"Pikipo Kitty Face Rattle Cum Soft Toy (Squeeze Handle for Squeaky Sound)-Plush,Red,Pack of 1  ",Kids gift ideas,,,₹349,₹219,Save ₹130 (37%),4.3 out of 5 stars,"4,353",https://www.amazon.in/gcx/-/gfhz/events/?ref=kidsguide&categoryId=Kids-hol-gift-guide&subcategoryIds=handpicked&pinnedAsins=B07RYWLT6L
"JOY MAKER First's Block Shape, Sorter, Colors,Baby and Toddler, ABCD with Other Shape, Toys for 1 Year Old Girl Boy Kids  ",,,,₹999,₹519,Save ₹480 (48%),,,https://www.amazon.in/JOY-MAKER-Firsts-Sorter-Toddler/dp/B098RB218B/ref=sr_1_32?dchild=1&keywords=baby+toys&qid=1625936707&sr=8-32
"SNOWIE SOFT® 6 Pack Baby Cloth Books, My First Non-Toxic Soft Clothing Books Early Educational Toys Gifts Activity Crinkle Cloth Book for Toddler, Infants (Red-6pcs)  ",Limited time deal,,,₹959,₹619,Save ₹340 (35%),3.6 out of 5 stars,11,https://www.amazon.in/SNOWIE-Non-Toxic-Clothing-Educational-Activity/dp/B08X3C8VQY/ref=sr_1_33?dchild=1&keywords=baby+toys&qid=1625936707&smid=A3LL2A01BH2MDO&sr=8-33
"Spanking Plastic Flash Drum with 3D Lights and Musical Toys , Multicolour, 2 Year  ",Kids gift ideas,,,₹499,₹386,Save ₹113 (23%),3.8 out of 5 stars,"2,181",https://www.amazon.in/gcx/-/gfhz/events/?ref=kidsguide&categoryId=Kids-hol-gift-guide&subcategoryIds=handpicked&pinnedAsins=B07J5CST1W
"Cable World Stunt Tricycle Bump and Go Toy with 4D Lights, Dancing Toy, Battery Operated Toy,Plastic - Multi Color(Pack of 1)  ",Kids gift ideasDeal of the Day ,,,,₹559,,4.6 out of 5 stars,956,https://www.amazon.in/gcx/-/gfhz/events/?ref=kidsguide&categoryId=Kids-hol-gift-guide&subcategoryIds=handpicked&pinnedAsins=B08BJC3HXK
Mallexo Paw Patrol Bath Toys for Kids Set of 3PCs Soft Paw Patrol Toys for Boys and Girls Multi-Color Bath Toys for Baby Girl and Boys ( Chu Chu Toys for Baby )  ,,,,₹799,₹330,Save ₹469 (59%),4.5 out of 5 stars,2,https://www.amazon.in/Mallexo-Patrol-Bath-Girls-Multi-Color/dp/B097LCYM8G/ref=sr_1_36?dchild=1&keywords=baby+toys&qid=1625936707&sr=8-36
"Cable World Plastic Baby Bath Chu Chu Colorful Animal Shape Toy (Multicolor, Multi Design) - Set of 12 Pieces  ",Deal of the Day ,,,,₹279,,4.0 out of 5 stars,451,https://www.amazon.in/cable-world%C2%AE-colorful-animal-design/dp/B08FSTH38J/ref=sr_1_37?dchild=1&keywords=baby+toys&qid=1625936707&sr=8-37
"Future shop Pack of 4 Elegant Soft Toys Combo Set Appu Elephant, Penguin,Turtle,Rabbit Toy Animals for Kids/Girls/Boys - 30 cm (Multicolor)  ",,,,₹999,₹494,Save ₹505 (51%),5.0 out of 5 stars,3,https://www.amazon.in/Future-shop-Elegant-Elephant-Penguin/dp/B097RZ9ZFK/ref=sr_1_38?dchild=1&keywords=baby+toys&qid=1625936707&sr=8-38
"LONGMIRE Baby and Toddler Plastic First Block Shape, Sorter, Colors, ABCD Shape, Toys for 1 Year Old (Multicolour)  ",,,,₹699,₹539,Save ₹160 (23%),4.0 out of 5 stars,123,https://www.amazon.in/LONGMIRE-Toddler-Plastic-Sorter-Multicolour/dp/B091884VRC/ref=sr_1_39?dchild=1&keywords=baby+toys&qid=1625936707&sr=8-39
Zest 4 Toyz Musical Baby Crawling Toy for Kids with 3D Lights& Music Toys for Babies - Assorted  ,Kids gift ideas,,,₹999,₹469,Save ₹530 (53%),4.1 out of 5 stars,895,https://www.amazon.in/gcx/-/gfhz/events/?ref=kidsguide&categoryId=Kids-hol-gift-guide&subcategoryIds=handpicked&pinnedAsins=B07TV7BC7X
"wishkey colourful plastic bpa free non toxic pack of 7 musical instruments rattle for new borns,maraca,blowing trumpets, tambourines, castanets- Multi color  ",Best seller,,,₹499,₹369,Save ₹130 (26%),4.4 out of 5 stars,"11,347",https://www.amazon.in/gp/bestsellers/toys/1378181031/ref=sr_bs_40_1378181031_1
"FALONG Tummy time Baby Water Mat Inflatable Baby Play Mat Activity Center for Infant Baby Toys,Thick, for Play, Toy, Educational Activities Center, for Babies and Children  ",,,,₹799,₹480,Save ₹319 (40%),3.8 out of 5 stars,36,https://www.amazon.in/FALONG-Inflatable-Activity-Educational-Activities/dp/B093WW1Q9V/ref=sr_1_42?dchild=1&keywords=baby+toys&qid=1625936707&sr=8-42
Future Shop Pack of 4 Elegant Soft Toys Combo Set Penguin/Elephant/Unicorn/Rabbit Toy Animals for You - 28 cm (Multicolor)  ,,,Only 2 left in stock.,₹999,₹498,Save ₹501 (50%),,,https://www.amazon.in/Future-Elegant-Penguin-Elephant-Unicorn/dp/B097RZT8K3/ref=sr_1_43?dchild=1&keywords=baby+toys&qid=1625936707&sr=8-43
"Butterfly EduFields Magnetic Shapes Puzzles Toys for Kids Boys & Girls -Pack of 23 Pieces | Educational Foam Toy Gift for Unlimited Imaginative Fun & Play for Baby, Made in India(Multi color)  ",Kids gift ideas,,,₹499,₹419,Save ₹80 (16%),4.2 out of 5 stars,"1,891",https://www.amazon.in/gcx/-/gfhz/events/?ref=kidsguide&categoryId=Kids-hol-gift-guide&subcategoryIds=handpicked&pinnedAsins=B084BZ2S37
Fun4You Unicorn Stuffed Soft Toy Plush for Kids Baby Boy Girl Birthday (25Cm- Pink)  ,,,,₹699,₹210,Save ₹489 (70%),4.5 out of 5 stars,4,https://www.amazon.in/Fun4You-Unicorn-Stuffed-Plush-Birthday/dp/B097HHNK6H/ref=sr_1_45?dchild=1&keywords=baby+toys&qid=1625936707&sr=8-45
Babique Ball Stuffed Soft Toy Plush for Kids Baby Boy Girl Birthday  ,,,,,₹115,,4.2 out of 5 stars,899,https://www.amazon.in/Babique-Unicorn-Stuffed-Plush-Birthday/dp/B08LTGVND9/ref=sr_1_46?dchild=1&keywords=baby+toys&qid=1625936707&sr=8-46
"Fair Plastic Build Up Beakers Stacking and Nesting Toy for Kids, Multicolour - 12 Pieces  ",,,,,₹165,,4.3 out of 5 stars,828,https://www.amazon.in/Fair-Build-Up-Beakers-Stacking/dp/B086968947/ref=sr_1_47?dchild=1&keywords=baby+toys&qid=1625936707&sr=8-47
Toyshine Toys for Baby - 14 Pcs Chu Chu Toys Toddler Baby Bathtub Bathing Squeeze Bath Toys Non-Toxic  ,,,,₹799,₹389,Save ₹410 (51%),4.0 out of 5 stars,55,https://www.amazon.in/Toyshine-Toys-Baby-Toddler-Non-Toxic/dp/B08R6ZTSMW/ref=sr_1_48?dchild=1&keywords=baby+toys&qid=1625936707&sr=8-48
"Ramakada Lovely Attractive Colorful Toddlers 7 Rattle and 1 Teether Toys Set for Babies pack of 8 Pieces,Non toxic Plastic-Multi color  ",,,,₹999,₹399,Save ₹600 (60%),4.3 out of 5 stars,"1,295",https://www.amazon.in/Ramakada-Attractive-Colorful-Toddlers-Teether/dp/B07RSL1LV8/ref=sr_1_49?dchild=1&keywords=baby+toys&qid=1625936707&sr=8-49
"Luvlap - 18588 Multi Textured Grab Balls for Baby, Multicolor  ",Limited time deal,,,₹599,₹411,Save ₹188 (31%),4.3 out of 5 stars,317,https://www.amazon.in/Luvlap-Multi-Textured-Balls-Multicolor/dp/B07NDD51SN/ref=sr_1_50?dchild=1&keywords=baby+toys&qid=1625936707&sr=8-50
SELLMONK Baby First Block Shape Sorter Colors Toddler ABCD Shape Baby Toys for 1 Year Old Girl (Baby First Block)  ,,,,₹799,₹579,Save ₹220 (28%),4.2 out of 5 stars,7,https://www.amazon.in/SELLMONK-First-Sorter-Colors-Toddler/dp/B091RYT7CD/ref=sr_1_51?dchild=1&keywords=baby+toys&qid=1625936707&sr=8-51
Einstein Box | Baby Toys Set of Rattle Toys + High Contrast Books+ High Contrast Flashcards For Infants and Newborns of 0-12 months | Set of Rattle Toys + High Contrast Books+ High Contrast Flashcards| Baby Boys and Girls  ,Deal of the Day ,,,₹999,₹569,Save ₹430 (43%),4.4 out of 5 stars,177,https://www.amazon.in/Einstein-Box-Contrast-Flashcards-Newborns/dp/B08LBFRY6J/ref=sr_1_52?dchild=1&keywords=baby+toys&qid=1625936707&sr=8-52
Samaaya ® Baby's Soft Plush Learn to Sit Stool Training Elephant Cotton Cushion Sofa Seat Safety Chair for Dining (grey)  ,,,,₹999,₹699,Save ₹300 (30%),3.8 out of 5 stars,138,https://www.amazon.in/Samaaya-Cushion-Training-Support-Elephant/dp/B07J5GGM1Q/ref=sr_1_53?dchild=1&keywords=baby+toys&qid=1625936707&sr=8-53
STRUGLE Unbreakable Pull Along Friction Power Toy Vehicle Push and Go Crawling Toys Baby Toddler for Kids Collection of Cars 2-5 Years Old Kids (Police CAR)  ,,,,"₹1,599",₹349,"Save ₹1,250 (78%)",,,https://www.amazon.in/STRUGLE-Unbreakable-Friction-Crawling-Collection/dp/B0987D3SS6/ref=sr_1_54?dchild=1&keywords=baby+toys&qid=1625936707&sr=8-54
SaleOn Dancing and Spinning Rolling Doll Tumble Monkey Toy Voice Control Banana Monkey with Musical Toy with Light and Sound Effects and Sensor Mix Colors  ,,,,,₹449,,4.3 out of 5 stars,236,https://www.amazon.in/SaleOnTM-Dancing-Spinning-Rolling-MixColor/dp/B07WN7XPXC/ref=sr_1_55?dchild=1&keywords=baby+toys&qid=1625936707&sr=8-55
"TUMTUM Colorful Lovely Attractive Rattles Light Music Baby Fun Ball, with Non-Toxic - Baby Ball for Babies, Toddlers, Infants Toys for Children Baby Boys and Girls. (ABS Baby Ball) (Light Music Ball)  ",,,,₹499,₹449,Save ₹50 (10%),4.1 out of 5 stars,14,https://www.amazon.in/TUMTUM-Colorful-Attractive-Rattles-Non-Toxic/dp/B08K7CDL2F/ref=sr_1_56?dchild=1&keywords=baby+toys&qid=1625936707&sr=8-56
Small Baby Toys This Phone is Work in battery's  ,,Sponsored,Only 1 left in stock.,,₹399,,,,https://www.amazon.in/gp/slredirect/picassoRedirect.html/ref=pa_sp_btf_aps_sr_pg1_1?ie=UTF8&adId=A020784016WZYNQCLWB3M&url=%2FSmall-Baby-Toys-Phone-batterys%2Fdp%2FB0915ZF5JJ%2Fref%3Dsr_1_57_sspa%3Fdchild%3D1%26keywords%3Dbaby%2Btoys%26qid%3D1625936707%26sr%3D8-57-spons%26psc%3D1&qualifier=1625936707&id=8845170185780963&widgetName=sp_btf
Aveeno Baby Daily Moisturising Bath for Delicate Skin (354ml)  ,,Sponsored,,₹799,₹687,Save ₹112 (14%),4.4 out of 5 stars,"3,859",https://www.amazon.in/gp/slredirect/picassoRedirect.html/ref=pa_sp_btf_aps_sr_pg1_1?ie=UTF8&adId=A08228011C6H35SJ4ODXH&url=%2FAveeno-Daily-Moisturising-Delicate-354ml%2Fdp%2FB072X5MNF3%2Fref%3Dsr_1_58_sspa%3Fdchild%3D1%26keywords%3Dbaby%2Btoys%26qid%3D1625936707%26sr%3D8-58-spons%26psc%3D1&qualifier=1625936707&id=8845170185780963&widgetName=sp_btf
KWT Double Sided Water Proof Baby Mat Carpet Baby Crawl Play Mat Kids Infant Crawling Play Mat Carpet Baby Gym Water Resistant Baby Play & Crawl Mat(Large Size - 6 Feet X 4 Feet) Playmat for Babies  ,,Sponsored,,,₹649,,4.1 out of 5 stars,267,https://www.amazon.in/gp/slredirect/picassoRedirect.html/ref=pa_sp_btf_aps_sr_pg1_1?ie=UTF8&adId=A0813308SFA8ZJST8FGK&url=%2FKWT-Double-Carpet-Crawling-Resistant%2Fdp%2FB08MKZ72NR%2Fref%3Dsr_1_59_sspa%3Fdchild%3D1%26keywords%3Dbaby%2Btoys%26qid%3D1625936707%26sr%3D8-59-spons%26psc%3D1&qualifier=1625936707&id=8845170185780963&widgetName=sp_btf
Toyshine Push and Shake Wobbling Bell Sounds Roly Poly Tumbler Doll (Multicolour)  ,,Sponsored,,₹899,₹469,Save ₹430 (48%),4.2 out of 5 stars,"3,073",https://www.amazon.in/gp/slredirect/picassoRedirect.html/ref=pa_sp_btf_aps_sr_pg1_1?ie=UTF8&adId=A04475684UUNA686W40M&url=%2FToyshine-Wobbling-Sounds-Tumbler-Multicolour%2Fdp%2FB073WVT662%2Fref%3Dsr_1_60_sspa%3Fdchild%3D1%26keywords%3Dbaby%2Btoys%26qid%3D1625936707%26sr%3D8-60-spons%26psc%3D1&qualifier=1625936707&id=8845170185780963&widgetName=sp_btf
Johnson's Baby Care Collection Baby Gift Set with Organic Cotton Baby Dress (8 Pieces)  ,Best seller,Sponsored,,₹550,₹444,Save ₹106 (19%),4.3 out of 5 stars,"8,484",https://www.amazon.in/gp/bestsellers/baby/8360552031/ref=sr_bs_0_8360552031_1
"RYLAN Baby Kids Water Play Mat Toys Inflatable Tummy Time Leakproof Water Play Mat, Fun Activity Play Center Indoor and Outdoor Water Play Mat for Baby(Regular)  ",,Sponsored,,,₹949,,3.7 out of 5 stars,14,https://www.amazon.in/gp/slredirect/picassoRedirect.html/ref=pa_sp_atf_next_aps_sr_pg2_1?ie=UTF8&adId=A078002015EOFF9IZIA3R&url=%2FInflatable-Leakproof-Activity-Outdoor-Regular%2Fdp%2FB096SDRLZ4%2Fref%3Dsr_1_50_sspa%3Fdchild%3D1%26keywords%3Dbaby%2Btoys%26qid%3D1625936730%26sr%3D8-50-spons%26psc%3D1&qualifier=1625936730&id=5303781726503170&widgetName=sp_atf_next
KACOOL Baby Teether Mitten 2 Pack for 3-6 Month Baby Like Baby Teething Toys Silicone Glove(Blue &Pink)  ,,Sponsored,,₹799,₹569,Save ₹230 (29%),3.6 out of 5 stars,173,https://www.amazon.in/gp/slredirect/picassoRedirect.html/ref=pa_sp_atf_next_aps_sr_pg2_1?ie=UTF8&adId=A03527571QCGJMYD4GQSN&url=%2FKACOOL-Teether-Silicone-Self-Soothing-Teething%2Fdp%2FB085C8MTWT%2Fref%3Dsr_1_51_sspa%3Fdchild%3D1%26keywords%3Dbaby%2Btoys%26qid%3D1625936730%26sr%3D8-51-spons%26psc%3D1&qualifier=1625936730&id=5303781726503170&widgetName=sp_atf_next
"AYSIS Double Sided Water Proof Baby Carpet Mat Crawling Play Mat Carpet Baby Gym Water Resistant (Extra Large Biggest Size - 6.5 Feet X 6 Feet, Assorted Colour) Playmat for Babies  ",Deal of the Day ,Sponsored,,"₹1,799",₹851,Save ₹948 (53%),3.9 out of 5 stars,"1,608",https://www.amazon.in/gp/slredirect/picassoRedirect.html/ref=pa_sp_atf_next_aps_sr_pg2_1?ie=UTF8&adId=A08976571VJ8N944NLOOD&url=%2FAYSIS-Double-Crawling-Resistant-Biggest%2Fdp%2FB08KF591QD%2Fref%3Dsr_1_52_sspa%3Fdchild%3D1%26keywords%3Dbaby%2Btoys%26qid%3D1625936730%26sr%3D8-52-spons%26psc%3D1&qualifier=1625936730&id=5303781726503170&widgetName=sp_atf_next
Tilak Venture® Non Toxic 4 Pcs Rattle Toys and 4 Pcs Set of Squeezy Chu Chu Family Duck Bath Toys Best for 0-12 Months Baby Boys and Girls  ,,,,₹799,₹329,Save ₹470 (59%),,,https://www.amazon.in/Tilak-Venture%C2%AE-Rattle-Squeezy-Family/dp/B097LPGYV6/ref=sr_1_53?dchild=1&keywords=baby+toys&qid=1625936730&sr=8-53
"DEALS INDIA Mother Elephant with 2 Babies Soft Toy- 32 cm, Grey  ",,,,₹699,₹319,Save ₹380 (54%),3.9 out of 5 stars,159,https://www.amazon.in/DEALS-INDIA-Mother-Elephant-Babies/dp/B08GFS5X11/ref=sr_1_54?dchild=1&keywords=baby+toys&qid=1625936730&sr=8-54
"Royals Hub plastic Monkey Dancing And Spinning Rolling Doll (Small, Multicolor)  ",,,,"₹1,999",₹438,"Save ₹1,561 (78%)",4.3 out of 5 stars,289,https://www.amazon.in/Royals-Dancing-Spinning-Rolling-MixColor/dp/B08BTGGCZ4/ref=sr_1_55?dchild=1&keywords=baby+toys&qid=1625936730&sr=8-55
Gifts Online Dancing Dalmatian Dog with Flashing Lights + Music  ,Kids gift ideas,,,₹500,₹374,Save ₹126 (25%),4.1 out of 5 stars,"1,297",https://www.amazon.in/gcx/-/gfhz/events/?ref=kidsguide&categoryId=Kids-hol-gift-guide&subcategoryIds=handpicked&pinnedAsins=B01KQ4EMQM
"famous quality most popular chu chu bath toys (1 set of 12 animals, Multi color)  ",,,,"₹2,999",₹298,"Save ₹2,701 (90%)",4.0 out of 5 stars,72,https://www.amazon.in/Famous-Quality-Popular-Animals-Multicolour/dp/B07FYP1QZH/ref=sr_1_57?dchild=1&keywords=baby+toys&qid=1625936730&sr=8-57
"WISHKEY Set of 3 Plastic Non-Toxic Shake and Grab Ball Baby Rattles, Educational and Developmental Toys with Storage Bag for New Born Toddler Kids (Pack of 3, Multicolor)  ",Best seller,,,₹399,₹279,Save ₹120 (30%),4.4 out of 5 stars,"11,347",https://www.amazon.in/gp/bestsellers/toys/1378181031/ref=sr_bs_9_1378181031_1
"Soniya Enterprises Combo 5 pics Animale Soft Toys Set Elephant 40cm with 2 Baby , Rabbit 30cm , Panda 30cm , Pikachu 30cm , Parrot 35 cm for Kids Playing Soft Toys  ",,,,₹999,₹575,Save ₹424 (42%),3.3 out of 5 stars,32,https://www.amazon.in/Soniya-Enterprises-Animale-Elephant-Pikachu/dp/B092M9J8F1/ref=sr_1_49?dchild=1&keywords=baby+toys&qid=1625936730&sr=8-49
"Fisher-Price Original Rock-a-Stack,Multicolor, Classic stacking toy with 5 colorful rings to grasp, shake, and stack!  ",Kids gift ideas,,,₹299,₹249,Save ₹50 (17%),4.5 out of 5 stars,"6,410",https://www.amazon.in/gcx/-/gfhz/events/?ref=kidsguide&categoryId=Kids-hol-gift-guide&subcategoryIds=handpicked&pinnedAsins=B00000IZQP
eErlik Colourful Plastic Non Toxic BPA Pack of 8 Attractive Rattle for New Borns and Infants - Multi color  ,,,,,₹379,,4.4 out of 5 stars,390,https://www.amazon.in/eErlik%C2%AE-Colourful-Plastic-Attractive-Infants/dp/B089FZ41PD/ref=sr_1_51?dchild=1&keywords=baby+toys&qid=1625936730&sr=8-51
