name,badge_1,badge_2,badge_3,mrp,discounted_price,discount,rating,rating_count,link
Einstein Box | Baby Toys Set of Rattle Toys + High Contrast Books+ High Contrast Flashcards For Infants and Newborns of 0-12 months | Set of Rattle Toys + High Contrast Books+ High Contrast Flashcards| Baby Boys and Girls  ,Deal of the Day ,Sponsored,,₹999,₹569,Save ₹430 (43%),4.4 out of 5 stars,172,https://www.amazon.in/gp/slredirect/picassoRedirect.html/ref=pa_sp_atf_aps_sr_pg1_1?ie=UTF8&adId=A04026192YS4HNKWNRHF&url=%2FEinstein-Box-Contrast-Flashcards-Newborns%2Fdp%2FB08LBFRY6J%2Fref%3Dsr_1_1_sspa%3Fdchild%3D1%26keywords%3Dbaby%2Btoys%26qid%3D1625569850%26sr%3D8-1-spons%26psc%3D1&qualifier=1625569850&id=6058982042374772&widgetName=sp_atf
"Little's Soft Plush Baby Ball with Rattle Sound (11 cm), Multi color  ",Best seller,Sponsored,,₹210,₹165,Save ₹45 (21%),4.0 out of 5 stars,"5,081",https://www.amazon.in/gp/bestsellers/toys/1378178031/ref=sr_bs_1_1378178031_1
"Luvlap Sunshine Baby Walker, Height Adjustable with Light & Music Toys, 6m+ (Pink)  ",,Sponsored,,"₹3,199","₹2,299",Save ₹900 (28%),3.9 out of 5 stars,"2,973",https://www.amazon.in/gp/slredirect/picassoRedirect.html/ref=pa_sp_atf_aps_sr_pg1_1?ie=UTF8&adId=A02915943PFAM72O494PF&url=%2FLuvLap-Baby-Walker-Sunshine-Pink%2Fdp%2FB00IYDEFTC%2Fref%3Dsr_1_3_sspa%3Fdchild%3D1%26keywords%3Dbaby%2Btoys%26qid%3D1625569850%26sr%3D8-3-spons%26psc%3D1&qualifier=1625569850&id=6058982042374772&widgetName=sp_atf
"LuvLap Comfy Baby Walker & Rocker, Height Adjustable with Light & Musical Toys, 6m+ (Blue)  ",,Sponsored,,"₹4,199","₹2,999","Save ₹1,200 (29%)",4.1 out of 5 stars,"2,335",https://www.amazon.in/gp/slredirect/picassoRedirect.html/ref=pa_sp_atf_aps_sr_pg1_1?ie=UTF8&adId=A0291570G7UWELEMNC4G&url=%2FLuvLap-Comfy-Baby-Walker-Rocker%2Fdp%2FB00IHRL8WW%2Fref%3Dsr_1_4_sspa%3Fdchild%3D1%26keywords%3Dbaby%2Btoys%26qid%3D1625569850%26sr%3D8-4-spons%26psc%3D1&qualifier=1625569850&id=6058982042374772&widgetName=sp_atf
"WISHKEY Plastic Bath Toy Set of 14 Pcs Chu Chu Colorful Animal Shape Toy for New Born Babies, Fun Bathtime Buddies for Toddlers (Pack of 14, Multicolor)  ",Best seller,,,₹379,₹349,Save ₹30 (8%),4.2 out of 5 stars,"3,643",https://www.amazon.in/gp/bestsellers/toys/1378183031/ref=sr_bs_4_1378183031_1
"Little's Junior Ring (Plastic,Multicolour)  ",Best seller,,,₹225,₹159,Save ₹66 (29%),4.3 out of 5 stars,"17,520",https://www.amazon.in/gp/bestsellers/toys/1378194031/ref=sr_bs_5_1378194031_1
Ratna's Junior Smiley Stacking Multicolour 5 Rings for Toddlers  ,Amazon's Choice,,,₹150,₹138,Save ₹12 (8%),4.1 out of 5 stars,"7,216",https://www.amazon.in/Toyztrend-Junior-Stacking-Multicolour-Toddlers/dp/B075F7V3J4/ref=ice_ac_b_dpb?dchild=1&keywords=baby+toys&qid=1625569850&sr=8-7
"WISHKEY Plastic Colorful Non Toxic BPA Free 9 Shake & Grab Rattles and 3 Soothing Teethers for Babies & Infants, Early Age Toys for Kids ( Pack of 12, Multicolor)  ",Best seller,,,₹599,₹569,Save ₹30 (5%),4.4 out of 5 stars,"11,042",https://www.amazon.in/gp/bestsellers/toys/1378181031/ref=sr_bs_7_1378181031_1
"WISHKEY Colorful Attractive Plastic Non Toxic Set of 7 Shake & Grab Rattle and 1 Soothing Teether for New Born and Infants (Pack of 8 , Multicolor)  ",Best seller,,,₹599,₹429,Save ₹170 (28%),4.4 out of 5 stars,"11,042",https://www.amazon.in/gp/bestsellers/toys/1378181031/ref=sr_bs_8_1378181031_1
"Toyshine Pack of 8 Rattle and Teather Set for New Born Babies, 5 Rattle Set and 3 Teathers, Non-Toxic  ",,,,₹699,₹399,Save ₹300 (43%),4.3 out of 5 stars,312,https://www.amazon.in/Toyshine-Rattle-Teather-Teathers-Non-Toxic/dp/B08PFSCB9Q/ref=sr_1_10?dchild=1&keywords=baby+toys&qid=1625569850&sr=8-10
Cable World Kick and Play Musical Keyboard Mat Piano Baby Gym and Fitness Rack (Assorted Colour)  ,Best sellerDeal of the Day ,,,,₹949,,3.9 out of 5 stars,"4,181",https://www.amazon.in/gp/bestsellers/baby/1953108031/ref=sr_bs_10_1953108031_1
"Popsugar - THLL818-1R Mini Laptop with Learning Games, Red  ",,,,₹749,₹309,Save ₹440 (59%),3.3 out of 5 stars,649,https://www.amazon.in/Popsugar-Mini-Laptop-Learning-Games/dp/B07QPG77P8/ref=sr_1_12?dchild=1&keywords=baby+toys&qid=1625569850&sr=8-12
Toyshine Dancing Dog with Music Flashing Lights  ,,,,₹999,₹499,Save ₹500 (50%),4.0 out of 5 stars,"5,190",https://www.amazon.in/Toyshine-Dancing-Music-Flashing-Lights/dp/B074Y7KQD1/ref=sr_1_13?dchild=1&keywords=baby+toys&qid=1625569850&sr=8-13
"FunBlast Musical Mobile Phone for Kids, Mobile with Light & Sound Toys for Babies | Educational Toys for Kids 3+ Years/Boys/Girls-1 Unit (Random Color)  ",Best sellerLimited time deal,,,₹999,₹331,Save ₹668 (67%),3.8 out of 5 stars,549,https://www.amazon.in/gp/bestsellers/toys/1378298031/ref=sr_bs_13_1378298031_1
Babique Ball Stuffed Soft Toy Plush for Kids Baby Boy Girl Birthday  ,,,,,₹115,,4.0 out of 5 stars,768,https://www.amazon.in/Babique-Penguin-Stuffed-Plush-Birthday/dp/B08LTGRLD2/ref=sr_1_15?dchild=1&keywords=baby+toys&qid=1625569850&sr=8-15
Cable World Colourful Plastic Non Toxic pack of 8 Attractive Rattle for New Borns(Multi color)  ,Deal of the Day ,,,,₹349,,4.4 out of 5 stars,"3,369",https://www.amazon.in/Cable-World%C2%AE-Colourful-Plastic-Attractive/dp/B083KH2779/ref=sr_1_16?dchild=1&keywords=baby+toys&qid=1625569850&sr=8-16
"ESTON 1ST EDITION Teddy Bear Soft Toy (Bulldog-29 Cm Parrot- 24 Cm Balloon Teddy- 24 Cm Pikachu-25 Cm Elephant-25 Cm , Mixed Colour)  ",,,,"₹1,199",₹545,Save ₹654 (55%),4.1 out of 5 stars,663,https://www.amazon.in/ESTON-Bulldog-Elephant-Birthday-Valentine/dp/B08L9R6JXX/ref=sr_1_17?dchild=1&keywords=baby+toys&qid=1625569850&sr=8-17
BabyGo Rotating Giraffe Musical Rattle Cot Mobile for Cradle and Bed Jhoomer ( No Batteries Needed)  ,,,,₹899,₹675,Save ₹224 (25%),4.2 out of 5 stars,"1,874",https://www.amazon.in/BabyGo-Rotating-Giraffe-Musical-Batteries/dp/B07NDWBHW3/ref=sr_1_18?dchild=1&keywords=baby+toys&qid=1625569850&sr=8-18
"Toyshine Dancing Dog with Music, Flashing Lights (Battery Included)- Multi Color  ",,,,₹999,₹529,Save ₹470 (47%),4.0 out of 5 stars,"5,190",https://www.amazon.in/Toyshine-Dancing-Flashing-Battery-Included/dp/B085DS2BZ5/ref=sr_1_19?dchild=1&keywords=baby+toys&qid=1625569850&sr=8-19
"Spanking Plastic Flash Drum with 3D Lights and Musical Toys , Multicolour, 2 Year  ",,,,₹499,₹386,Save ₹113 (23%),3.8 out of 5 stars,"2,110",https://www.amazon.in/Zuffon-Kids-Flash-Lights-Musical/dp/B07J5CST1W/ref=sr_1_20?dchild=1&keywords=baby+toys&qid=1625569850&sr=8-20
Mee Mee Baby Walker with Adjustable Height and Push Handle Bar (Green)  ,,Sponsored,Only 2 left in stock.,"₹3,499","₹2,799",Save ₹700 (20%),4.1 out of 5 stars,"3,990",https://www.amazon.in/gp/slredirect/picassoRedirect.html/ref=pa_sp_mtf_aps_sr_pg1_1?ie=UTF8&adId=A04962731UCGNOPSCLHNC&url=%2FMee-Walker-Adjustable-Height-Handle%2Fdp%2FB015Z4AI84%2Fref%3Dsr_1_21_sspa%3Fdchild%3D1%26keywords%3Dbaby%2Btoys%26qid%3D1625569850%26sr%3D8-21-spons%26psc%3D1&qualifier=1625569850&id=6058982042374772&widgetName=sp_mtf
"Little's Baby Pants Diapers with Wetness Indicator and 12 Hours Absorption, Large (L), 9-14 kg, 60 Count  ",,Sponsored,,₹798,₹595,Save ₹203 (25%),4.1 out of 5 stars,"14,409",https://www.amazon.in/gp/slredirect/picassoRedirect.html/ref=pa_sp_mtf_aps_sr_pg1_1?ie=UTF8&adId=A0913703FK32VB9AMMFB&url=%2FLittles-Diapers-Wetness-Indicator-Absorption%2Fdp%2FB08J126QF9%2Fref%3Dsr_1_22_sspa%3Fdchild%3D1%26keywords%3Dbaby%2Btoys%26qid%3D1625569850%26sr%3D8-22-spons%26psc%3D1&qualifier=1625569850&id=6058982042374772&widgetName=sp_mtf
Toyshine Push and Shake Wobbling Bell Sounds Roly Poly Tumbler Doll (Multicolour)  ,,Sponsored,,₹899,₹449,Save ₹450 (50%),4.2 out of 5 stars,"3,009",https://www.amazon.in/gp/slredirect/picassoRedirect.html/ref=pa_sp_mtf_aps_sr_pg1_1?ie=UTF8&adId=A04475684UUNA686W40M&url=%2FToyshine-Wobbling-Sounds-Tumbler-Multicolour%2Fdp%2FB073WVT662%2Fref%3Dsr_1_23_sspa%3Fdchild%3D1%26keywords%3Dbaby%2Btoys%26qid%3D1625569850%26sr%3D8-23-spons%26psc%3D1&qualifier=1625569850&id=6058982042374772&widgetName=sp_mtf
Naughty Kidz Baby Food Feeder||Fruit Feeder Pacifier||Fruit Nibbler-Best Toy Fruit Teether||Soft Silicone Fruit Teether for Babies||Fridge & Dishwasher Safe||100% BPA-Free Teether (Green)  ,,Sponsored,,₹359,₹179,Save ₹180 (50%),3.9 out of 5 stars,325,https://www.amazon.in/gp/slredirect/picassoRedirect.html/ref=pa_sp_mtf_aps_sr_pg1_1?ie=UTF8&adId=A0549446QHKS5AA986BH&url=%2FNaughty-Kidz-Pacifier-Nibbler-Best-Dishwasher%2Fdp%2FB084VPHKF9%2Fref%3Dsr_1_24_sspa%3Fdchild%3D1%26keywords%3Dbaby%2Btoys%26qid%3D1625569850%26sr%3D8-24-spons%26psc%3D1%26smid%3DA3L4NKDTQ8DKT7&qualifier=1625569850&id=6058982042374772&widgetName=sp_mtf
Zest 4 Toyz Musical Baby Crawling Toy for Kids with 3D Lights& Music Toys for Babies - Assorted  ,,,,₹999,₹469,Save ₹530 (53%),4.1 out of 5 stars,870,https://www.amazon.in/Zest-Toyz-Weeping-Naughty-Crawling/dp/B07TV7BC7X/ref=sr_1_25?dchild=1&keywords=baby+toys&qid=1625569850&sr=8-25
"SNOWIE SOFT®6 Pack Baby Cloth Books, My First Non-Toxic Soft Clothing Books Early Educational Toys Gifts Activity Crinkle Cloth Book for Toddler, Infants (Red-6pcs)  ",,,,,₹726,,3.9 out of 5 stars,7,https://www.amazon.in/SNOWIE-Non-Toxic-Clothing-Educational-Activity/dp/B08X3C8VQY/ref=sr_1_26?dchild=1&keywords=baby+toys&qid=1625569850&sr=8-26
"Little's Soft Plush Baby Ball with Rattle Sound (11 cm), Multi color  ",Best seller,,,₹210,₹165,Save ₹45 (21%),4.0 out of 5 stars,"5,081",https://www.amazon.in/gp/bestsellers/toys/1378178031/ref=sr_bs_26_1378178031_1
"LONGMIRE Baby and Toddler Plastic First Block Shape, Sorter, Colors, ABCD Shape, Toys for 1 Year Old (Multicolour)  ",,,,₹699,₹529,Save ₹170 (24%),3.9 out of 5 stars,107,https://www.amazon.in/LONGMIRE-Toddler-Plastic-Sorter-Multicolour/dp/B091884VRC/ref=sr_1_28?dchild=1&keywords=baby+toys&qid=1625569850&sr=8-28
Little Innocents® Polyester Fiber Filled Elephant Baby Pillow Cum Soft Toy with Small Baby Ball (Grey)  ,,,,"₹1,699",₹699,"Save ₹1,000 (59%)",4.1 out of 5 stars,127,https://www.amazon.in/Little-Innocents%C2%AE-Polyester-Filled-Elephant/dp/B08XC1NJJ5/ref=sr_1_29?dchild=1&keywords=baby+toys&qid=1625569850&sr=8-29
Toyshine Push and Shake Wobbling Bell Sounds Roly Poly Tumbler Doll (Multicolour)  ,,,,₹899,₹449,Save ₹450 (50%),4.2 out of 5 stars,"3,009",https://www.amazon.in/Toyshine-Wobbling-Sounds-Tumbler-Multicolour/dp/B073WVT662/ref=sr_1_30?dchild=1&keywords=baby+toys&qid=1625569850&sr=8-30
"SaleOn Pack of 12 Pcs Mix Cute Animals Swimming Water Toys Non-Toxic,BPA Free Colorful Soft Rubber Float Squeeze Sound Squeaky Bathing Toy for Baby Chu Chu Toy Set - Mix Animals ,Multi Color  ",,,,,₹299,,4.1 out of 5 stars,690,https://www.amazon.in/Animals-Swimming-Non-Toxic-Colorful-Squeeze/dp/B07ZDDHGFT/ref=sr_1_31?dchild=1&keywords=baby+toys&qid=1625569850&sr=8-31
"Pikipo Kitty Face Rattle Cum Soft Toy (Squeeze Handle for Squeaky Sound)-Plush,Red,Pack of 1  ",,,,₹349,₹219,Save ₹130 (37%),4.3 out of 5 stars,"4,260",https://www.amazon.in/Pikipo-Rattle-Squeeze-Handle-Squeaky/dp/B07RYWLT6L/ref=sr_1_32?dchild=1&keywords=baby+toys&qid=1625569850&sr=8-32
"Butterfly EduFields Magnetic Shapes Puzzles Toys for Kids Boys & Girls -Pack of 23 Pieces | Educational Foam Toy Gift for Unlimited Imaginative Fun & Play for Baby, Made in India(Multi color)  ",,,,₹499,₹419,Save ₹80 (16%),4.2 out of 5 stars,"1,820",https://www.amazon.in/ButterflyFields-Magnetic-Shapes-Unlimited-Imaginative/dp/B084BZ2S37/ref=sr_1_33?dchild=1&keywords=baby+toys&qid=1625569850&sr=8-33
"FALONG Tummy time Baby Water Mat Inflatable Baby Play Mat Activity Center for Infant Baby Toys,Thick, for Play, Toy, Educational Activities Center, for Babies and Children  ",,,,₹799,₹480,Save ₹319 (40%),3.6 out of 5 stars,27,https://www.amazon.in/FALONG-Inflatable-Activity-Educational-Activities/dp/B093WW1Q9V/ref=sr_1_34?dchild=1&keywords=baby+toys&qid=1625569850&sr=8-34
"Toyshine Pack of 8 Light Colors Rattle Set for New Born Babies, Toy for Babies, Non-Toxic  ",,,,₹899,₹529,Save ₹370 (41%),4.4 out of 5 stars,48,https://www.amazon.in/Toyshine-Colors-Rattle-Babies-Non-Toxic/dp/B08R9MH683/ref=sr_1_35?dchild=1&keywords=baby+toys&qid=1625569850&sr=8-35
eErlik Colourful Plastic Non Toxic BPA Pack of 8 Attractive Rattle for New Borns and Infants - Multi color  ,,,,,₹379,,4.4 out of 5 stars,383,https://www.amazon.in/eErlik%C2%AE-Colourful-Plastic-Attractive-Infants/dp/B089FZ41PD/ref=sr_1_36?dchild=1&keywords=baby+toys&qid=1625569850&sr=8-36
"Cable World Stunt Tricycle Bump and Go Toy with 4D Lights, Dancing Toy, Battery Operated Toy,Plastic - Multi Color(Pack of 1)  ",Deal of the Day ,,,,₹559,,4.6 out of 5 stars,926,https://www.amazon.in/Cable-Tricycle-Dancing-Battery-Operated/dp/B08BJC3HXK/ref=sr_1_37?dchild=1&keywords=baby+toys&qid=1625569850&sr=8-37
"TUMTUM Colorful Lovely Attractive Rattles Light Music Baby Fun Ball, with Non-Toxic - Baby Ball for Babies, Toddlers, Infants Toys for Children Baby Boys and Girls. (ABS Baby Ball) (Light Music Ball)  ",,,,₹499,₹449,Save ₹50 (10%),4.3 out of 5 stars,12,https://www.amazon.in/TUMTUM-Colorful-Attractive-Rattles-Non-Toxic/dp/B08K7CDL2F/ref=sr_1_38?dchild=1&keywords=baby+toys&qid=1625569850&sr=8-38
"RYLAN Baby Kids Water Play Mat Toys Inflatable Tummy Time Leakproof Water Play Mat, Fun Activity Play Center Indoor and Outdoor Water Play Mat for Baby(Regular)  ",,,,,₹949,,4.9 out of 5 stars,116,https://www.amazon.in/Inflatable-Leakproof-Activity-Outdoor-Regular/dp/B096SDRLZ4/ref=sr_1_39?dchild=1&keywords=baby+toys&qid=1625569850&sr=8-39
"wirescorts 5 layer ball drop and roll swirling tower for baby and toddler development educational toys | stack, drop and go ball ramp toy set includes 3 spinning acrylic activity balls- Multi color  ",,,,,₹629,,4.4 out of 5 stars,245,https://www.amazon.in/wirescorts-swirling-development-educational-spinning/dp/B08FM7F34J/ref=sr_1_40?dchild=1&keywords=baby+toys&qid=1625569850&sr=8-40
"FunBlast Unbreakable Pull Back Vehicles, Push and go Crawling Toy Car for Kids & Children, Friction Powered car Toy for 3+ Years Old Boys|Girls (Set of 7) - Multi Color  ",Best sellerLimited time deal,,,₹899,₹635,Save ₹264 (29%),4.0 out of 5 stars,"3,179",https://www.amazon.in/gp/bestsellers/toys/1378255031/ref=sr_bs_40_1378255031_1
RVA Pooh Toy Shape Baby Supporting Seat Soft Plush Cushion and Chair for Kids - Yellow (0-4 Years)  ,,,,"₹1,999",₹899,"Save ₹1,100 (55%)",4.0 out of 5 stars,2,https://www.amazon.in/RVA-Shape-Supporting-Plush-Cushion/dp/B08THDLXCT/ref=sr_1_42?dchild=1&keywords=baby+toys&qid=1625569850&sr=8-42
"Soniya Enterprises Combo 5 pics Animale Soft Toys Set Elephant 40cm with 2 Baby , Rabbit 30cm , Panda 30cm , Pikachu 30cm , Parrot 35 cm for Kids Playing Soft Toys  ",,,,₹999,₹575,Save ₹424 (42%),3.3 out of 5 stars,25,https://www.amazon.in/Soniya-Enterprises-Animale-Elephant-Pikachu/dp/B092M9J8F1/ref=sr_1_43?dchild=1&keywords=baby+toys&qid=1625569850&sr=8-43
"Luvlap - 18588 Multi Textured Grab Balls for Baby, Multicolor  ",Limited time deal,,,₹599,₹411,Save ₹188 (31%),4.3 out of 5 stars,295,https://www.amazon.in/Luvlap-Multi-Textured-Balls-Multicolor/dp/B07NDD51SN/ref=sr_1_44?dchild=1&keywords=baby+toys&qid=1625569850&sr=8-44
"Royals Hub plastic Monkey Dancing And Spinning Rolling Doll (Small, Multicolor)  ",,,,"₹1,999",₹438,"Save ₹1,561 (78%)",4.3 out of 5 stars,277,https://www.amazon.in/Royals-Dancing-Spinning-Rolling-MixColor/dp/B08BTGGCZ4/ref=sr_1_45?dchild=1&keywords=baby+toys&qid=1625569850&sr=8-45
Toyshine Toys for Baby - 14 Pcs Chu Chu Toys Toddler Baby Bathtub Bathing Squeeze Bath Toys Non-Toxic  ,,,,₹799,₹389,Save ₹410 (51%),3.9 out of 5 stars,47,https://www.amazon.in/Toyshine-Toys-Baby-Toddler-Non-Toxic/dp/B08R6ZTSMW/ref=sr_1_46?dchild=1&keywords=baby+toys&qid=1625569850&sr=8-46
"wishkey colourful plastic bpa free non toxic pack of 7 musical instruments rattle for new borns,maraca,blowing trumpets, tambourines, castanets- Multi color  ",Best seller,,,₹499,₹369,Save ₹130 (26%),4.4 out of 5 stars,"11,042",https://www.amazon.in/gp/bestsellers/toys/1378181031/ref=sr_bs_46_1378181031_1
"Toyshine Plastic Concept Musical and 3D Lights Transparent Toy Car for 2 to 5 Year Kids, Multicolor  ",,,,₹999,₹529,Save ₹470 (47%),4.3 out of 5 stars,"1,903",https://www.amazon.in/Toyshine-Concept-Musical-Lights-Transparent/dp/B088ZRY2HF/ref=sr_1_48?dchild=1&keywords=baby+toys&qid=1625569850&sr=8-48
"VEZOL® Big Size Happy Baby Musical Touch Sensors and Laughing Boy Doll for Kids Girls Boys (New Version 2020 Made in India, 35cm Length)  ",,,,"₹1,299",₹499,Save ₹800 (62%),3.9 out of 5 stars,14,https://www.amazon.in/VEZOL%C2%AE-Musical-Sensors-Laughing-Version/dp/B0971B84NJ/ref=sr_1_49?dchild=1&keywords=baby+toys&qid=1625569850&sr=8-49
"SaleOn Pack of 14 Pcs chu chu Mix Cute Animals Swimming Water Toys Non-Toxic , BPA Free Colorful Soft Rubber Float Squeeze Sound Squeaky Bathing Toy for Baby Chu Chu Toy Set (1319)Multi color  ",,,,,₹339,,4.2 out of 5 stars,161,https://www.amazon.in/Animals-Swimming-Non-Toxic-Colorful-Squeeze/dp/B082WHR72W/ref=sr_1_50?dchild=1&keywords=baby+toys&qid=1625569850&sr=8-50
"Vibgyor Vibes; 5 PCS Plastic Lovely Colourful Musical Hanging Rattle Toys With Hanging Cartoons For Toddlers/Babies/Infants/Newborns, Multicolor  ",,,,₹650,₹467,Save ₹183 (28%),4.0 out of 5 stars,"2,898",https://www.amazon.in/Vibgyor-Vibes-Colourful-Cartoons-New-Borns/dp/B0756ZB49T/ref=sr_1_51?dchild=1&keywords=baby+toys&qid=1625569850&sr=8-51
Babique Ball Stuffed Soft Toy Plush for Kids Baby Boy Girl Birthday  ,,,,,₹115,,4.1 out of 5 stars,847,https://www.amazon.in/Babique-Unicorn-Stuffed-Plush-Birthday/dp/B08LTGVND9/ref=sr_1_52?dchild=1&keywords=baby+toys&qid=1625569850&sr=8-52
Tickles Grey Mother Elephant with Baby Soft Stuffed Plush Toy for Kids Baby Boys & Girls Birthday Gifts Home Decoration (Color: Grey Size: 41cm)  ,,,,"₹1,398",₹539,Save ₹859 (61%),4.1 out of 5 stars,598,https://www.amazon.in/Tickles-Mother-Elephant-2-Babies/dp/B00EVKLB5I/ref=sr_1_53?dchild=1&keywords=baby+toys&qid=1625569850&sr=8-53
"Little's Baby Soft Ball with Rattle Sound-Plush,Multicolor,Large Size (18 cm)  ",Best seller,,,₹349,₹297,Save ₹52 (15%),4.0 out of 5 stars,"5,081",https://www.amazon.in/gp/bestsellers/toys/1378178031/ref=sr_bs_53_1378178031_1
"Sisliya Sit and Bounce Rubber Hop Ball for Boys Girls Toys, Bouncy Ball with Handles & Pump, Hopper Ball for Races, Work-Out, Jumping & Outdoor Activity  ",,,,₹999,₹499,Save ₹500 (50%),,,https://www.amazon.in/Sisliya-Handles-Work-Out-Jumping-Activity/dp/B09228PHRK/ref=sr_1_55?dchild=1&keywords=baby+toys&qid=1625569850&sr=8-55
Grizzly Wooden Intellectual Geometric Shape Matching Five Column Blocks Educational & Learning Toys  ,,,,₹500,₹427,Save ₹73 (15%),4.3 out of 5 stars,"1,393",https://www.amazon.in/Grizzly-Geometric-Matching-Educational-Learning/dp/B07GFN2981/ref=sr_1_56?dchild=1&keywords=baby+toys&qid=1625569850&sr=8-56
Aveeno Baby Daily Moisturising Bath for Delicate Skin (354ml)  ,,Sponsored,,₹799,₹687,Save ₹112 (14%),4.4 out of 5 stars,"3,758",https://www.amazon.in/gp/slredirect/picassoRedirect.html/ref=pa_sp_btf_aps_sr_pg1_1?ie=UTF8&adId=A08228011C6H35SJ4ODXH&url=%2FAveeno-Daily-Moisturising-Delicate-354ml%2Fdp%2FB072X5MNF3%2Fref%3Dsr_1_57_sspa%3Fdchild%3D1%26keywords%3Dbaby%2Btoys%26qid%3D1625569850%26sr%3D8-57-spons%26psc%3D1&qualifier=1625569850&id=6058982042374772&widgetName=sp_btf
"Little's Junior Ring (Plastic,Multicolour)  ",Best seller,Sponsored,,₹225,₹159,Save ₹66 (29%),4.3 out of 5 stars,"17,520",https://www.amazon.in/gp/bestsellers/toys/1378194031/ref=sr_bs_57_1378194031_1
A Baby Cherry Bamboo Baby Towel 500 GSM (Grey)  ,,Sponsored,,"₹1,599",₹999,Save ₹600 (38%),4.2 out of 5 stars,36,https://www.amazon.in/gp/slredirect/picassoRedirect.html/ref=pa_sp_btf_aps_sr_pg1_1?ie=UTF8&adId=A01301712BDO7P76OBWC0&url=%2FBaby-Cherry-Absorbent-Organic-Toddlers%2Fdp%2FB08HYFNLVT%2Fref%3Dsr_1_59_sspa%3Fdchild%3D1%26keywords%3Dbaby%2Btoys%26qid%3D1625569850%26sr%3D8-59-spons%26psc%3D1&qualifier=1625569850&id=6058982042374772&widgetName=sp_btf
"Mee Mee Fluoride-Free Strawberry Flavor Toothpaste, 70 g (Pack of 2)  ",,Sponsored,,₹298,₹223,Save ₹75 (25%),4.3 out of 5 stars,"1,050",https://www.amazon.in/gp/slredirect/picassoRedirect.html/ref=pa_sp_btf_aps_sr_pg1_1?ie=UTF8&adId=A03275901VE463WTIUCG5&url=%2FMee-Fluoride-Free-Toothpaste-Strawberry-Pack%2Fdp%2FB075FTKYC7%2Fref%3Dsr_1_60_sspa%3Fdchild%3D1%26keywords%3Dbaby%2Btoys%26qid%3D1625569850%26sr%3D8-60-spons%26psc%3D1&qualifier=1625569850&id=6058982042374772&widgetName=sp_btf
"Little's Baby Soft Ball with Rattle Sound-Plush,Multicolor,Large Size (18 cm)  ",Best seller,Sponsored,,₹349,₹297,Save ₹52 (15%),4.0 out of 5 stars,"5,081",https://www.amazon.in/gp/bestsellers/toys/1378178031/ref=sr_bs_0_1378178031_1
Johnson's Baby Care Collection Baby Gift Set with Organic Cotton Baby T-Shirt (7 Pieces)  ,Best seller,Sponsored,,₹340,₹296,Save ₹44 (13%),4.3 out of 5 stars,"8,283",https://www.amazon.in/gp/bestsellers/baby/8360552031/ref=sr_bs_1_8360552031_1
"Toyshine Dancing Dog with Music, Flashing Lights (Battery Included)- Multi Color  ",,Sponsored,,₹999,₹529,Save ₹470 (47%),4.0 out of 5 stars,"5,190",https://www.amazon.in/gp/slredirect/picassoRedirect.html/ref=pa_sp_atf_next_aps_sr_pg2_1?ie=UTF8&adId=A00531743FFL2Q05XUBVS&url=%2FToyshine-Dancing-Flashing-Battery-Included%2Fdp%2FB085DS2BZ5%2Fref%3Dsr_1_51_sspa%3Fdchild%3D1%26keywords%3Dbaby%2Btoys%26qid%3D1625569873%26sr%3D8-51-spons%26psc%3D1&qualifier=1625569873&id=476078376848744&widgetName=sp_atf_next
Jukkre Double Sided Water Proof Baby Mat Carpet Baby Crawl Play Mat Kids Infant Crawling Play Mat Carpet Baby Gym Water Resistant Baby Play & Crawl Playmate for Babies  ,,Sponsored,,"₹1,299",₹599,Save ₹700 (54%),,,https://www.amazon.in/gp/slredirect/picassoRedirect.html/ref=pa_sp_atf_next_aps_sr_pg2_1?ie=UTF8&adId=A012956938GMMEHL06D2&url=%2FJukkre-Double-Crawling-Resistant-Playmate%2Fdp%2FB097TPZ552%2Fref%3Dsr_1_52_sspa%3Fdchild%3D1%26keywords%3Dbaby%2Btoys%26qid%3D1625569873%26sr%3D8-52-spons%26psc%3D1&qualifier=1625569873&id=476078376848744&widgetName=sp_atf_next
Styleys Animal Finger Puppets - Set of 10  ,Best seller,,,₹599,₹389,Save ₹210 (35%),3.7 out of 5 stars,"1,690",https://www.amazon.in/gp/bestsellers/toys/1378466031/ref=sr_bs_4_1378466031_1
"HUG 'N' FEEL SOFT TOYS Mouse Soft Toy | Birthday Gift for Girls/Wife, Boyfriend/Husband, Soft Toys Wedding for Couple Special, Baby Toys Gift Items, Teddy Bear, (Height 52cm)  ",Deal of the Day ,,,₹899,₹539,Save ₹360 (40%),4.1 out of 5 stars,96,https://www.amazon.in/HUG-FEEL-SOFT-TOYS-Boyfriend/dp/B08VGQ3RN2/ref=sr_1_54?dchild=1&keywords=baby+toys&qid=1625569873&sr=8-54
SELLMONK Baby First Block Shape Sorter Colors Toddler ABCD Shape Baby Toys for 1 Year Old Girl (Baby First Block)  ,,,,₹799,₹599,Save ₹200 (25%),4.4 out of 5 stars,6,https://www.amazon.in/SELLMONK-First-Sorter-Colors-Toddler/dp/B091RYT7CD/ref=sr_1_55?dchild=1&keywords=baby+toys&qid=1625569873&sr=8-55
SNOWIE SOFT® 4 pcs/Set Cute Animal Soft Baby Socks Toys Wrist Rattles and Foot Finders for Fun Deerlet 2pcs Waist & 2pcs Sock  ,,,,"₹1,175",₹629,Save ₹546 (46%),,,https://www.amazon.in/SNOWIE-Animal-Rattles-Finders-Deerlet/dp/B096NJ5GRD/ref=sr_1_56?dchild=1&keywords=baby+toys&qid=1625569873&sr=8-56
"WISHKEY Set of 3 Plastic Non-Toxic Shake and Grab Ball Baby Rattles, Educational and Developmental Toys with Storage Bag for New Born Toddler Kids (Pack of 3, Multicolor)  ",Best seller,,,₹399,₹279,Save ₹120 (30%),4.4 out of 5 stars,"11,042",https://www.amazon.in/gp/bestsellers/toys/1378181031/ref=sr_bs_8_1378181031_1
"KWT Baby Kids Water Play Mat Toys Inflatable Tummy Time Leakproof Water Play Mat, Fun Activity Play Center Indoor and Outdoor Water Play Mat for Baby(Regular)  ",,,,,₹849,,4.7 out of 5 stars,87,https://www.amazon.in/KWT-Inflatable-Leakproof-Activity-Outdoor/dp/B096X49FBZ/ref=sr_1_58?dchild=1&keywords=baby+toys&qid=1625569873&sr=8-58
"Fisher-Price Original Rock-a-Stack,Multicolor, Classic stacking toy with 5 colorful rings to grasp, shake, and stack!  ",,,,₹299,₹249,Save ₹50 (17%),4.5 out of 5 stars,"6,344",https://www.amazon.in/Fisher-Price-Brilliant-Basics-Rock-a-Stack-Multicolor/dp/B00000IZQP/ref=sr_1_49?dchild=1&keywords=baby+toys&qid=1625569873&sr=8-49
Gifts Online Dancing Dalmatian Dog with Flashing Lights + Music  ,,,,₹500,₹374,Save ₹126 (25%),4.1 out of 5 stars,"1,258",https://www.amazon.in/Jiada-Dancing-Dalmatian-Flashing-Lights/dp/B01KQ4EMQM/ref=sr_1_50?dchild=1&keywords=baby+toys&qid=1625569873&sr=8-50
"Soniya Enterprises Pack of 4 Elegant Soft Toys Combo Set Bull Dog , Pink Balloon , Yellow Unicorn , Grey Mother Elephant Special Offers Toy Animals for You - 42 cm (Multicolor)  ",,,,₹999,₹575,Save ₹424 (42%),3.3 out of 5 stars,56,https://www.amazon.in/Soniya-Enterprises-Elegant-Balloon-Elephant/dp/B092M917CZ/ref=sr_1_51?dchild=1&keywords=baby+toys&qid=1625569873&sr=8-51
"Prime Deals Drum Keyboard Musical Toys with Flashing Lights - Animal Sounds and Songs, Multi Color  ",,,,,₹649,,4.4 out of 5 stars,191,https://www.amazon.in/Prime-Deals-Keyboard-Musical-Flashing/dp/B08HX4S3V5/ref=sr_1_52?dchild=1&keywords=baby+toys&qid=1625569873&sr=8-52
"BRAMHANI ENTERPRISE Plastic Barking, Waging Tail, Walking and Jumping Puppy Baby Toy For Toddlers and Kids Multicolor  ",,,,₹999,₹575,Save ₹424 (42%),3.0 out of 5 stars,31,https://www.amazon.in/BRAMHANI-ENTERPRISE-Plastic-Toddlers-Multicolor/dp/B093FRGMLL/ref=sr_1_53?dchild=1&keywords=baby+toys&qid=1625569873&sr=8-53
