name,badge_1,badge_2,badge_3,mrp,discounted_price,discount,rating,rating_count,link
"Little's Soft Plush Baby Ball with Rattle Sound (11 cm), Multi color  ",Best seller,Sponsored,,₹210,₹169,Save ₹41 (20%),4.0 out of 5 stars,"4,994",https://www.amazon.in/gp/bestsellers/toys/1378178031/ref=sr_bs_0_1378178031_1
Einstein Box | Baby Toys Set of Rattle Toys + High Contrast Books+ High Contrast Flashcards For Infants and Newborns of 0-12 months | Set of Rattle Toys + High Contrast Books+ High Contrast Flashcards| Baby Boys and Girls  ,Deal of the Day ,Sponsored,,₹999,₹569,Save ₹430 (43%),4.4 out of 5 stars,169,https://www.amazon.in/gp/slredirect/picassoRedirect.html/ref=pa_sp_atf_aps_sr_pg1_1?ie=UTF8&adId=A04026192YS4HNKWNRHF&url=%2FEinstein-Box-Contrast-Flashcards-Newborns%2Fdp%2FB08LBFRY6J%2Fref%3Dsr_1_2_sspa%3Fdchild%3D1%26keywords%3Dbaby%2Btoys%26qid%3D1625200416%26sr%3D8-2-spons%26psc%3D1&qualifier=1625200416&id=1270584512054155&widgetName=sp_atf
"Luvlap Sunshine Baby Walker, Height Adjustable with Light & Music Toys, 6m+ (Pink)  ",,Sponsored,,"₹3,199","₹2,251",Save ₹948 (30%),3.9 out of 5 stars,"2,944",https://www.amazon.in/gp/slredirect/picassoRedirect.html/ref=pa_sp_atf_aps_sr_pg1_1?ie=UTF8&adId=A02915943PFAM72O494PF&url=%2FLuvLap-Baby-Walker-Sunshine-Pink%2Fdp%2FB00IYDEFTC%2Fref%3Dsr_1_3_sspa%3Fdchild%3D1%26keywords%3Dbaby%2Btoys%26qid%3D1625200416%26sr%3D8-3-spons%26psc%3D1&qualifier=1625200416&id=1270584512054155&widgetName=sp_atf
Mee Mee Gentle Baby Bubble Bath (With Cherry Extracts- 500 ml)  ,,Sponsored,,₹299,₹224,Save ₹75 (25%),4.4 out of 5 stars,"2,226",https://www.amazon.in/gp/slredirect/picassoRedirect.html/ref=pa_sp_atf_aps_sr_pg1_1?ie=UTF8&adId=A02890631OSXSWD98FYZ8&url=%2FMee-Gentle-Bubble-White-500ml%2Fdp%2FB07GR317S7%2Fref%3Dsr_1_4_sspa%3Fdchild%3D1%26keywords%3Dbaby%2Btoys%26qid%3D1625200416%26sr%3D8-4-spons%26psc%3D1&qualifier=1625200416&id=1270584512054155&widgetName=sp_atf
"WISHKEY Plastic Bath Toy Set of 14 Pcs Chu Chu Colorful Animal Shape Toy for New Born Babies, Fun Bathtime Buddies for Toddlers (Pack of 14, Multicolor)  ",,,,₹379,₹330,Save ₹49 (13%),4.2 out of 5 stars,"3,593",https://www.amazon.in/Wish-key-Babys-Plastic-Multicolour/dp/B075K56GXY/ref=sr_1_5?dchild=1&keywords=baby+toys&qid=1625200416&sr=8-5
"WISHKEY Plastic Colorful Non Toxic BPA Free 9 Shake & Grab Rattles and 3 Soothing Teethers for Babies & Infants, Early Age Toys for Kids ( Pack of 12, Multicolor)  ",Best seller,,,₹599,₹540,Save ₹59 (10%),4.4 out of 5 stars,"10,890",https://www.amazon.in/gp/bestsellers/toys/1378181031/ref=sr_bs_5_1378181031_1
Ratna's Junior Smiley Stacking Multicolour 5 Rings for Toddlers  ,Best seller,,,₹150,₹138,Save ₹12 (8%),4.1 out of 5 stars,"7,116",https://www.amazon.in/gp/bestsellers/toys/1378324031/ref=sr_bs_6_1378324031_1
"WISHKEY Colorful Attractive Plastic Non Toxic Set of 7 Shake & Grab Rattle and 1 Soothing Teether for New Born and Infants (Pack of 8 , Multicolor)  ",Amazon's Choice,,,₹599,₹409,Save ₹190 (32%),4.4 out of 5 stars,"10,890",https://www.amazon.in/Wishkey-Colourful-Teether-Rattle-Infants/dp/B079VY6STX/ref=ice_ac_b_dpb?dchild=1&keywords=baby+toys&qid=1625200416&sr=8-8
"Toyshine Pack of 8 Rattle and Teather Set for New Born Babies, 5 Rattle Set and 3 Teathers, Non-Toxic  ",,,,₹699,₹399,Save ₹300 (43%),4.3 out of 5 stars,292,https://www.amazon.in/Toyshine-Rattle-Teather-Teathers-Non-Toxic/dp/B08PFSCB9Q/ref=sr_1_9?dchild=1&keywords=baby+toys&qid=1625200416&sr=8-9
BabyGo Rotating Giraffe Musical Rattle Cot Mobile for Cradle and Bed Jhoomer ( No Batteries Needed)  ,,,,₹899,₹675,Save ₹224 (25%),4.2 out of 5 stars,"1,816",https://www.amazon.in/BabyGo-Rotating-Giraffe-Musical-Batteries/dp/B07NDWBHW3/ref=sr_1_10?dchild=1&keywords=baby+toys&qid=1625200416&sr=8-10
"Popsugar - THLL818-1R Mini Laptop with Learning Games, Red  ",,,,₹749,₹309,Save ₹440 (59%),3.3 out of 5 stars,641,https://www.amazon.in/Popsugar-Mini-Laptop-Learning-Games/dp/B07QPG77P8/ref=sr_1_11?dchild=1&keywords=baby+toys&qid=1625200416&sr=8-11
"Little's Junior Ring (Plastic,Multicolour)  ",Best seller,,,₹249,₹123,Save ₹126 (51%),4.3 out of 5 stars,"17,287",https://www.amazon.in/gp/bestsellers/toys/1378194031/ref=sr_bs_11_1378194031_1
Cable World Kick and Play Musical Keyboard Mat Piano Baby Gym and Fitness Rack (Assorted Colour)  ,Best seller,,,,₹999,,3.9 out of 5 stars,"4,135",https://www.amazon.in/gp/bestsellers/baby/1953108031/ref=sr_bs_12_1953108031_1
"FunBlast Musical Mobile Phone for Kids, Mobile with Light & Sound Toys for Babies | Educational Toys for Kids 3+ Years/Boys/Girls-1 Unit (Random Color)  ",Best sellerLimited time deal,,,₹999,₹313,Save ₹686 (69%),3.8 out of 5 stars,526,https://www.amazon.in/gp/bestsellers/toys/1378298031/ref=sr_bs_13_1378298031_1
"ESTON 1ST EDITION Teddy Bear Soft Toy (Bulldog-29 Cm Parrot- 24 Cm Balloon Teddy- 24 Cm Pikachu-25 Cm Elephant-25 Cm , Mixed Colour)  ",,,,"₹1,199",₹545,Save ₹654 (55%),4.1 out of 5 stars,644,https://www.amazon.in/ESTON-Bulldog-Elephant-Birthday-Valentine/dp/B08L9R6JXX/ref=sr_1_15?dchild=1&keywords=baby+toys&qid=1625200416&sr=8-15
Cable World Colourful Plastic Non Toxic pack of 8 Attractive Rattle for New Borns(Multi color)  ,Deal of the Day ,,,,₹349,,4.4 out of 5 stars,"3,311",https://www.amazon.in/Cable-World%C2%AE-Colourful-Plastic-Attractive/dp/B083KH2779/ref=sr_1_16?dchild=1&keywords=baby+toys&qid=1625200416&sr=8-16
Babique Penguin Stuffed Soft Toy Plush for Kids Baby Boy Girl Birthday (Blue 28Cm)  ,Limited time deal,,,₹999,₹175,Save ₹824 (82%),4.0 out of 5 stars,"2,206",https://www.amazon.in/Babique-Penguin-Stuffed-Plush-Birthday/dp/B08LTGRLD2/ref=sr_1_17?dchild=1&keywords=baby+toys&qid=1625200416&sr=8-17
Toyshine Dancing Dog with Music Flashing Lights  ,,,,₹999,₹499,Save ₹500 (50%),4.0 out of 5 stars,"5,130",https://www.amazon.in/Toyshine-Dancing-Music-Flashing-Lights/dp/B074Y7KQD1/ref=sr_1_18?dchild=1&keywords=baby+toys&qid=1625200416&sr=8-18
"LONGMIRE Baby and Toddler Plastic First Block Shape, Sorter, Colors, ABCD Shape, Toys for 1 Year Old (Multicolour)  ",,,,₹699,₹499,Save ₹200 (29%),3.8 out of 5 stars,99,https://www.amazon.in/LONGMIRE-Toddler-Plastic-Sorter-Multicolour/dp/B091884VRC/ref=sr_1_19?dchild=1&keywords=baby+toys&qid=1625200416&sr=8-19
"Butterfly EduFields Magnetic Shapes Puzzles Toys for Kids Boys & Girls -Pack of 23 Pieces | Educational Foam Toy Gift for Unlimited Imaginative Fun & Play for Baby, Made in India(Multi color)  ",,,,₹499,₹419,Save ₹80 (16%),4.2 out of 5 stars,"1,788",https://www.amazon.in/ButterflyFields-Magnetic-Shapes-Unlimited-Imaginative/dp/B084BZ2S37/ref=sr_1_20?dchild=1&keywords=baby+toys&qid=1625200416&sr=8-20
"Hapsters Baby Push Walker with Lights, Music and Adjustable Speed (Blue)  ",,Sponsored,,"₹6,999","₹4,999","Save ₹2,000 (29%)",4.0 out of 5 stars,17,https://www.amazon.in/gp/slredirect/picassoRedirect.html/ref=pa_sp_mtf_aps_sr_pg1_1?ie=UTF8&adId=A0992848IU67IQL0MWLD&url=%2FHapsters-Pallo-Walker-Lights-Adjustable%2Fdp%2FB07ZNLXQ11%2Fref%3Dsr_1_21_sspa%3Fdchild%3D1%26keywords%3Dbaby%2Btoys%26qid%3D1625200416%26sr%3D8-21-spons%26psc%3D1&qualifier=1625200416&id=1270584512054155&widgetName=sp_mtf
Ardith Double Sided Water Proof Baby Mat Carpet Baby Crawl Play Mat Kids Infant Crawling Play Mat Carpet Baby Gym Water Resistant Baby Play (Standard)  ,,Sponsored,,,₹649,,4.5 out of 5 stars,68,https://www.amazon.in/gp/slredirect/picassoRedirect.html/ref=pa_sp_mtf_aps_sr_pg1_1?ie=UTF8&adId=A0217012UM94CXHPQIN5&url=%2FArdith-Double-Crawling-Resistant-Standard%2Fdp%2FB08M9R9Z7N%2Fref%3Dsr_1_22_sspa%3Fdchild%3D1%26keywords%3Dbaby%2Btoys%26qid%3D1625200416%26sr%3D8-22-spons%26psc%3D1&qualifier=1625200416&id=1270584512054155&widgetName=sp_mtf
"Little's Baby Pants Diapers with Wetness Indicator and 12 Hours Absorption, Large (L), 9-14 kg, 60 Count  ",,Sponsored,,₹798,₹596,Save ₹202 (25%),4.1 out of 5 stars,"14,187",https://www.amazon.in/gp/slredirect/picassoRedirect.html/ref=pa_sp_mtf_aps_sr_pg1_1?ie=UTF8&adId=A0913703FK32VB9AMMFB&url=%2FLittles-Diapers-Wetness-Indicator-Absorption%2Fdp%2FB08J126QF9%2Fref%3Dsr_1_23_sspa%3Fdchild%3D1%26keywords%3Dbaby%2Btoys%26qid%3D1625200416%26sr%3D8-23-spons%26psc%3D1&qualifier=1625200416&id=1270584512054155&widgetName=sp_mtf
Toyshine Push and Shake Wobbling Bell Sounds Roly Poly Tumbler Doll (Multicolour)  ,,Sponsored,,₹899,₹449,Save ₹450 (50%),4.2 out of 5 stars,"2,971",https://www.amazon.in/gp/slredirect/picassoRedirect.html/ref=pa_sp_mtf_aps_sr_pg1_1?ie=UTF8&adId=A04475684UUNA686W40M&url=%2FToyshine-Wobbling-Sounds-Tumbler-Multicolour%2Fdp%2FB073WVT662%2Fref%3Dsr_1_24_sspa%3Fdchild%3D1%26keywords%3Dbaby%2Btoys%26qid%3D1625200416%26sr%3D8-24-spons%26psc%3D1&qualifier=1625200416&id=1270584512054155&widgetName=sp_mtf
"Spanking Plastic Flash Drum with 3D Lights and Musical Toys , Multicolour, 2 Year  ",,,,₹499,₹386,Save ₹113 (23%),3.8 out of 5 stars,"2,081",https://www.amazon.in/Zuffon-Kids-Flash-Lights-Musical/dp/B07J5CST1W/ref=sr_1_25?dchild=1&keywords=baby+toys&qid=1625200416&sr=8-25
"FALONG Tummy time Baby Water Mat Inflatable Baby Play Mat Activity Center for Infant Baby Toys,Thick, for Play, Toy, Educational Activities Center, for Babies and Children  ",,,,₹799,₹480,Save ₹319 (40%),3.6 out of 5 stars,24,https://www.amazon.in/FALONG-Inflatable-Activity-Educational-Activities/dp/B093WW1Q9V/ref=sr_1_26?dchild=1&keywords=baby+toys&qid=1625200416&sr=8-26
"SNOWIE SOFT®6 Pack Baby Cloth Books, My First Non-Toxic Soft Clothing Books Early Educational Toys Gifts Activity Crinkle Cloth Book for Toddler, Infants (Red-6pcs)  ",,,,,₹712,,3.9 out of 5 stars,6,https://www.amazon.in/SNOWIE-Non-Toxic-Clothing-Educational-Activity/dp/B08X3C8VQY/ref=sr_1_27?dchild=1&keywords=baby+toys&qid=1625200416&sr=8-27
"Toyshine Dancing Dog with Music, Flashing Lights (Battery Included)- Multi Color  ",,,,₹999,₹529,Save ₹470 (47%),4.0 out of 5 stars,"5,130",https://www.amazon.in/Toyshine-Dancing-Flashing-Battery-Included/dp/B085DS2BZ5/ref=sr_1_28?dchild=1&keywords=baby+toys&qid=1625200416&sr=8-28
Zest 4 Toyz Musical Baby Crawling Toy for Kids with 3D Lights& Music Toys for Babies - Assorted  ,Deal of the Day ,,,₹999,₹444,Save ₹555 (56%),4.1 out of 5 stars,857,https://www.amazon.in/Zest-Toyz-Weeping-Naughty-Crawling/dp/B07TV7BC7X/ref=sr_1_29?dchild=1&keywords=baby+toys&qid=1625200416&sr=8-29
"Little's Soft Plush Baby Ball with Rattle Sound (11 cm), Multi color  ",Best seller,,,₹210,₹169,Save ₹41 (20%),4.0 out of 5 stars,"4,994",https://www.amazon.in/gp/bestsellers/toys/1378178031/ref=sr_bs_29_1378178031_1
Little Innocents® Polyester Fiber Filled Elephant Baby Pillow Cum Soft Toy with Small Baby Ball (Grey)  ,,,,"₹1,699",₹699,"Save ₹1,000 (59%)",4.1 out of 5 stars,115,https://www.amazon.in/Little-Innocents%C2%AE-Polyester-Filled-Elephant/dp/B08XC1NJJ5/ref=sr_1_31?dchild=1&keywords=baby+toys&qid=1625200416&sr=8-31
Babique Unicorn Stuffed Soft Toy Plush for Kids Baby Boy Girl Birthday (25Cm- Pink)  ,Limited time deal,,Only 1 left in stock.,₹699,₹182,Save ₹517 (74%),4.0 out of 5 stars,"2,206",https://www.amazon.in/Babique-Unicorn-Stuffed-Plush-Birthday/dp/B08LTGVND9/ref=sr_1_32?dchild=1&keywords=baby+toys&qid=1625200416&sr=8-32
Toyshine Push and Shake Wobbling Bell Sounds Roly Poly Tumbler Doll (Multicolour)  ,,,,₹899,₹449,Save ₹450 (50%),4.2 out of 5 stars,"2,971",https://www.amazon.in/Toyshine-Wobbling-Sounds-Tumbler-Multicolour/dp/B073WVT662/ref=sr_1_33?dchild=1&keywords=baby+toys&qid=1625200416&sr=8-33
eErlik Colourful Plastic Non Toxic BPA Pack of 8 Attractive Rattle for New Borns and Infants - Multi color  ,,,,,₹379,,4.4 out of 5 stars,379,https://www.amazon.in/eErlik%C2%AE-Colourful-Plastic-Attractive-Infants/dp/B089FZ41PD/ref=sr_1_34?dchild=1&keywords=baby+toys&qid=1625200416&sr=8-34
"TUMTUM Colorful Lovely Attractive Rattles Light Music Baby Fun Ball, with Non-Toxic - Baby Ball for Babies, Toddlers, Infants Toys for Children Baby Boys and Girls. (ABS Baby Ball) (Light Music Ball)  ",,,,₹499,₹399,Save ₹100 (20%),4.2 out of 5 stars,11,https://www.amazon.in/TUMTUM-Colorful-Attractive-Rattles-Non-Toxic/dp/B08K7CDL2F/ref=sr_1_35?dchild=1&keywords=baby+toys&qid=1625200416&sr=8-35
"SaleOn Pack of 12 Pcs Mix Cute Animals Swimming Water Toys Non-Toxic,BPA Free Colorful Soft Rubber Float Squeeze Sound Squeaky Bathing Toy for Baby Chu Chu Toy Set - Mix Animals ,Multi Color  ",,,,,₹299,,4.1 out of 5 stars,680,https://www.amazon.in/Animals-Swimming-Non-Toxic-Colorful-Squeeze/dp/B07ZDDHGFT/ref=sr_1_36?dchild=1&keywords=baby+toys&qid=1625200416&sr=8-36
SCOOBA Giraffe Animal Soft Toy 30cm Height Single Piece  ,,,,₹999,₹398,Save ₹601 (60%),4.4 out of 5 stars,"1,166",https://www.amazon.in/SCOOBA-Kids-Favourite-Giraffe-Height/dp/B085TBV2Y7/ref=sr_1_37?dchild=1&keywords=baby+toys&qid=1625200416&sr=8-37
"RYLAN Baby Kids Water Play Mat Toys Inflatable Tummy Time Leakproof Water Play Mat, Fun Activity Play Center Indoor and Outdoor Water Play Mat for Baby(Regular)  ",,,,,₹949,,4.9 out of 5 stars,117,https://www.amazon.in/Inflatable-Leakproof-Activity-Outdoor-Regular/dp/B096SDRLZ4/ref=sr_1_38?dchild=1&keywords=baby+toys&qid=1625200416&sr=8-38
"Pikipo Kitty Face Rattle Cum Soft Toy (Squeeze Handle for Squeaky Sound)-Plush,Red,Pack of 1  ",Deal of the Day ,,,₹349,₹208,Save ₹141 (40%),4.3 out of 5 stars,"4,205",https://www.amazon.in/Pikipo-Rattle-Squeeze-Handle-Squeaky/dp/B07RYWLT6L/ref=sr_1_39?dchild=1&keywords=baby+toys&qid=1625200416&sr=8-39
"wirescorts 5 layer ball drop and roll swirling tower for baby and toddler development educational toys | stack, drop and go ball ramp toy set includes 3 spinning acrylic activity balls- Multi color  ",Deal of the Day ,,,,₹619,,4.4 out of 5 stars,241,https://www.amazon.in/wirescorts-swirling-development-educational-spinning/dp/B08FM7F34J/ref=sr_1_40?dchild=1&keywords=baby+toys&qid=1625200416&sr=8-40
"FunBlast Unbreakable Pull Back Vehicles, Push and go Crawling Toy Car for Kids & Children, Friction Powered car Toy for 3+ Years Old Boys|Girls (Set of 7) - Multi Color  ",Best sellerLimited time deal,,,₹899,₹601,Save ₹298 (33%),4.0 out of 5 stars,"3,143",https://www.amazon.in/gp/bestsellers/toys/1378255031/ref=sr_bs_40_1378255031_1
"Little's Baby Soft Ball with Rattle Sound-Plush,Multicolor,Large Size (18 cm)  ",Best seller,,,₹349,₹299,Save ₹50 (14%),4.0 out of 5 stars,"4,994",https://www.amazon.in/gp/bestsellers/toys/1378178031/ref=sr_bs_41_1378178031_1
Grizzly Wooden Intellectual Geometric Shape Matching Five Column Blocks Educational & Learning Toys  ,,,,₹500,₹403,Save ₹97 (19%),4.3 out of 5 stars,"1,374",https://www.amazon.in/Grizzly-Geometric-Matching-Educational-Learning/dp/B07GFN2981/ref=sr_1_43?dchild=1&keywords=baby+toys&qid=1625200416&sr=8-43
RVA Pooh Toy Shape Baby Supporting Seat Soft Plush Cushion and Chair for Kids - Yellow (0-4 Years)  ,,,,"₹1,999",₹899,"Save ₹1,100 (55%)",4.0 out of 5 stars,2,https://www.amazon.in/RVA-Shape-Supporting-Plush-Cushion/dp/B08THDLXCT/ref=sr_1_44?dchild=1&keywords=baby+toys&qid=1625200416&sr=8-44
"Cable World Stunt Tricycle Bump and Go Toy with 4D Lights, Dancing Toy, Battery Operated Toy,Plastic - Multi Color(Pack of 1)  ",Deal of the Day ,,,,₹559,,4.6 out of 5 stars,909,https://www.amazon.in/Cable-Tricycle-Dancing-Battery-Operated/dp/B08BJC3HXK/ref=sr_1_45?dchild=1&keywords=baby+toys&qid=1625200416&sr=8-45
"Toyshine Pack of 8 Light Colors Rattle Set for New Born Babies, Toy for Babies, Non-Toxic  ",,,,₹899,₹529,Save ₹370 (41%),4.4 out of 5 stars,48,https://www.amazon.in/Toyshine-Colors-Rattle-Babies-Non-Toxic/dp/B08R9MH683/ref=sr_1_46?dchild=1&keywords=baby+toys&qid=1625200416&sr=8-46
"wishkey colourful plastic bpa free non toxic pack of 7 musical instruments rattle for new borns,maraca,blowing trumpets, tambourines, castanets- Multi color  ",Best seller,,,₹499,₹350,Save ₹149 (30%),4.4 out of 5 stars,"10,890",https://www.amazon.in/gp/bestsellers/toys/1378181031/ref=sr_bs_46_1378181031_1
"Soniya Enterprises Combo 5 pics Animale Soft Toys Set Elephant 40cm with 2 Baby , Rabbit 30cm , Panda 30cm , Pikachu 30cm , Parrot 35 cm for Kids Playing Soft Toys  ",,,,₹999,₹575,Save ₹424 (42%),3.4 out of 5 stars,24,https://www.amazon.in/Soniya-Enterprises-Animale-Elephant-Pikachu/dp/B092M9J8F1/ref=sr_1_48?dchild=1&keywords=baby+toys&qid=1625200416&sr=8-48
"Luvlap - 18588 Multi Textured Grab Balls for Baby, Multicolor  ",Limited time deal,,,₹599,₹411.38,Save ₹187.62 (31%),4.3 out of 5 stars,285,https://www.amazon.in/Luvlap-Multi-Textured-Balls-Multicolor/dp/B07NDD51SN/ref=sr_1_49?dchild=1&keywords=baby+toys&qid=1625200416&sr=8-49
Toyshine Rainbow Stacking Rings - Multicolour  ,,,,₹999,₹399,Save ₹600 (60%),4.1 out of 5 stars,224,https://www.amazon.in/Toyshine-Stacking-Educational-Stimulate-Development/dp/B07D81SD9K/ref=sr_1_50?dchild=1&keywords=baby+toys&qid=1625200416&sr=8-50
DearJoy Fibre Filled Cotton Elephant Shaped Baby Pillow (Grey)  ,,,,₹999,₹649,Save ₹350 (35%),4.0 out of 5 stars,"1,953",https://www.amazon.in/DearJoy-Baby-Elephant-Pillow-Grey/dp/B075VTNC7X/ref=sr_1_51?dchild=1&keywords=baby+toys&qid=1625200416&sr=8-51
simple days baby rattle wooden musical toys - set of 6- Multi color  ,,,,"₹1,200",₹649,Save ₹551 (46%),4.3 out of 5 stars,223,https://www.amazon.in/Simple-Days-Rattle-Wooden-Musical/dp/B07K7KQ8J3/ref=sr_1_52?dchild=1&keywords=baby+toys&qid=1625200416&sr=8-52
"Vibgyor Vibes; 5 PCS Plastic Lovely Colourful Musical Hanging Rattle Toys With Hanging Cartoons For Toddlers/Babies/Infants/Newborns, Multicolor  ",,,,₹650,₹467,Save ₹183 (28%),4.0 out of 5 stars,"2,874",https://www.amazon.in/Vibgyor-Vibes-Colourful-Cartoons-New-Borns/dp/B0756ZB49T/ref=sr_1_53?dchild=1&keywords=baby+toys&qid=1625200416&sr=8-53
"Royals Hub plastic Monkey Dancing And Spinning Rolling Doll (Small, Multicolor)  ",,,,"₹1,999",₹447,"Save ₹1,552 (78%)",4.3 out of 5 stars,272,https://www.amazon.in/Royals-Dancing-Spinning-Rolling-MixColor/dp/B08BTGGCZ4/ref=sr_1_54?dchild=1&keywords=baby+toys&qid=1625200416&sr=8-54
"Prime Deals Drum Keyboard Musical Toys with Flashing Lights - Animal Sounds and Songs, Multi Color  ",,,,,₹649,,4.4 out of 5 stars,186,https://www.amazon.in/Prime-Deals-Keyboard-Musical-Flashing/dp/B08HX4S3V5/ref=sr_1_55?dchild=1&keywords=baby+toys&qid=1625200416&sr=8-55
Toyshine Toys for Baby - 14 Pcs Chu Chu Toys Toddler Baby Bathtub Bathing Squeeze Bath Toys Non-Toxic  ,,,,₹799,₹389,Save ₹410 (51%),3.9 out of 5 stars,45,https://www.amazon.in/Toyshine-Toys-Baby-Toddler-Non-Toxic/dp/B08R6ZTSMW/ref=sr_1_56?dchild=1&keywords=baby+toys&qid=1625200416&sr=8-56
The Moms Co. Baby Suitcase Gift Box with 7 Skin and Hair Care Products (White)  ,,Sponsored,,"₹2,399","₹1,811",Save ₹588 (25%),4.4 out of 5 stars,767,https://www.amazon.in/gp/slredirect/picassoRedirect.html/ref=pa_sp_btf_aps_sr_pg1_1?ie=UTF8&adId=A02638341YCM28AIHCO07&url=%2FMoms-Co-Everything-Baby-Suitcase%2Fdp%2FB07B9TD6RT%2Fref%3Dsr_1_57_sspa%3Fdchild%3D1%26keywords%3Dbaby%2Btoys%26qid%3D1625200416%26sr%3D8-57-spons%26psc%3D1&qualifier=1625200416&id=1270584512054155&widgetName=sp_btf
"Baybee Looey Baby Walker Cum Rocker - Round Kids Walker for Babies Cycle with Music & Light Rattles and Toys Ultra Soft Seat, Push Bar Activity Walker for Kid and Wheel 6 Months to 2 Years-Pink  ",Deal of the Day ,Sponsored,,,"₹2,949",,3.9 out of 5 stars,38,https://www.amazon.in/gp/slredirect/picassoRedirect.html/ref=pa_sp_btf_aps_sr_pg1_1?ie=UTF8&adId=A0461992HC5OQR89FS7&url=%2FBaybee-Looey-Baby-Walker-Rocker%2Fdp%2FB07TVK5DRR%2Fref%3Dsr_1_58_sspa%3Fdchild%3D1%26keywords%3Dbaby%2Btoys%26qid%3D1625200416%26sr%3D8-58-spons%26psc%3D1&qualifier=1625200416&id=1270584512054155&widgetName=sp_btf
"Baybee Cheezy Baby Walker Cum Rocker - Round Kids Walker for Babies Cycle with Music & Light Rattles and Toys Ultra Soft Seat, Push Bar Activity Walker for Kid and Wheel 6 Months to 2 Years (Pink)  ",Deal of the Day ,Sponsored,,,"₹2,949",,3.9 out of 5 stars,243,https://www.amazon.in/gp/slredirect/picassoRedirect.html/ref=pa_sp_btf_aps_sr_pg1_1?ie=UTF8&adId=A04294563QR5RDY27ATKN&url=%2FBaybee-Cheezy-Baby-Walker-Rocker%2Fdp%2FB07TVK5F6B%2Fref%3Dsr_1_59_sspa%3Fdchild%3D1%26keywords%3Dbaby%2Btoys%26qid%3D1625200416%26sr%3D8-59-spons%26psc%3D1&qualifier=1625200416&id=1270584512054155&widgetName=sp_btf
KWT Double Sided Water Proof Baby Mat Carpet Baby Crawl Play Mat Kids Infant Crawling Play Mat Carpet Baby Gym Water Resistant Baby Play & Crawl Mat(Large Size - 6 Feet X 4 Feet) Playmat for Babies-  ,,Sponsored,,,₹649,,4.7 out of 5 stars,84,https://www.amazon.in/gp/slredirect/picassoRedirect.html/ref=pa_sp_btf_aps_sr_pg1_1?ie=UTF8&adId=A08597151LBXBQXE49DB2&url=%2FKWT-Double-Carpet-Crawling-Resistant%2Fdp%2FB09739CXQK%2Fref%3Dsr_1_60_sspa%3Fdchild%3D1%26keywords%3Dbaby%2Btoys%26qid%3D1625200416%26sr%3D8-60-spons%26psc%3D1&qualifier=1625200416&id=1270584512054155&widgetName=sp_btf
"Baybee Looey Baby Walker Cum Rocker - Round Kids Walker for Babies Cycle with Music & Light Rattles and Toys Ultra Soft Seat, Push Bar Activity Walker for Kid and Wheel 6 Months to 2 Years-Blue  ",Deal of the Day ,Sponsored,,,"₹2,949",,3.9 out of 5 stars,38,https://www.amazon.in/gp/slredirect/picassoRedirect.html/ref=pa_sp_atf_next_aps_sr_pg2_1?ie=UTF8&adId=A04622363TL3D5G3OBKDU&url=%2FBaybee-Looey-Baby-Walker-Rocker%2Fdp%2FB07TYQGHYX%2Fref%3Dsr_1_49_sspa%3Fdchild%3D1%26keywords%3Dbaby%2Btoys%26qid%3D1625200440%26sr%3D8-49-spons%26psc%3D1&qualifier=1625200440&id=1572192430266671&widgetName=sp_atf_next
"Little's Baby Soft Ball with Rattle Sound-Plush,Multicolor,Large Size (18 cm)  ",Best seller,Sponsored,,₹349,₹299,Save ₹50 (14%),4.0 out of 5 stars,"4,994",https://www.amazon.in/gp/bestsellers/toys/1378178031/ref=sr_bs_1_1378178031_1
"Baybee Cheezy Baby Walker Cum Rocker - Round Kids Walker for Babies Cycle with Music & Light Rattles and Toys Ultra Soft Seat, Push Bar Activity Walker for Kid and Wheel 6 Months to 2 Years (Green)  ",Deal of the Day ,Sponsored,,,"₹2,949",,3.9 out of 5 stars,243,https://www.amazon.in/gp/slredirect/picassoRedirect.html/ref=pa_sp_atf_next_aps_sr_pg2_1?ie=UTF8&adId=A042973614HTL928EJBUD&url=%2FBaybee-Cheezy-Baby-Walker-Rocker%2Fdp%2FB07VGL8C1M%2Fref%3Dsr_1_51_sspa%3Fdchild%3D1%26keywords%3Dbaby%2Btoys%26qid%3D1625200440%26sr%3D8-51-spons%26psc%3D1&qualifier=1625200440&id=1572192430266671&widgetName=sp_atf_next
"Kidzvilla Silicone Teether Food Feeder Pacifier Toy with Hand-grip for Boys and Girls, 2 Pieces  ",,Sponsored,,₹749,₹285,Save ₹464 (62%),4.0 out of 5 stars,280,https://www.amazon.in/gp/slredirect/picassoRedirect.html/ref=pa_sp_atf_next_aps_sr_pg2_1?ie=UTF8&adId=A09092691KT7SNF0QAQ4T&url=%2FBaby-Fruit-Feeder-Pacifier-Pack%2Fdp%2FB07XMQJR42%2Fref%3Dsr_1_52_sspa%3Fdchild%3D1%26keywords%3Dbaby%2Btoys%26qid%3D1625200440%26sr%3D8-52-spons%26psc%3D1&qualifier=1625200440&id=1572192430266671&widgetName=sp_atf_next
"HUG 'n' FEEL SOFT TOYS 3 Feet Teddy Bear, Baby Toys, Toys for Girls, Birthday Gift for Girls/Wife, Boyfriend/ Husband | Wedding/Anniversary Gift for Couple Special, Soft Toy Gift Item, (3 Feet, Pink)  ",Best seller,,,"₹1,999",₹699,"Save ₹1,300 (65%)",4.1 out of 5 stars,"11,242",https://www.amazon.in/gp/bestsellers/toys/1378446031/ref=sr_bs_4_1378446031_1
"KWT Baby Kids Water Play Mat Toys Inflatable Tummy Time Leakproof Water Play Mat, Fun Activity Play Center Indoor and Outdoor Water Play Mat for Baby(Regular)  ",,,,,₹849,,4.7 out of 5 stars,85,https://www.amazon.in/KWT-Inflatable-Leakproof-Activity-Outdoor/dp/B096X49FBZ/ref=sr_1_54?dchild=1&keywords=baby+toys&qid=1625200440&sr=8-54
"WISHKEY Set of 3 Plastic Non-Toxic Shake and Grab Ball Baby Rattles, Educational and Developmental Toys with Storage Bag for New Born Toddler Kids (Pack of 3, Multicolor)  ",Best seller,,,₹399,₹265,Save ₹134 (34%),4.4 out of 5 stars,"10,890",https://www.amazon.in/gp/bestsellers/toys/1378181031/ref=sr_bs_6_1378181031_1
"Fisher-Price Original Rock-a-Stack,Multicolor, Classic stacking toy with 5 colorful rings to grasp, shake, and stack!  ",,,,₹299,₹249,Save ₹50 (17%),4.5 out of 5 stars,"6,311",https://www.amazon.in/Fisher-Price-Brilliant-Basics-Rock-a-Stack-Multicolor/dp/B00000IZQP/ref=sr_1_56?dchild=1&keywords=baby+toys&qid=1625200440&sr=8-56
"HUG 'N' FEEL SOFT TOYS Mouse Soft Toy | Birthday Gift for Girls/Wife, Boyfriend/Husband, Soft Toys Wedding for Couple Special, Baby Toys Gift Items, Teddy Bear, (Height 52cm)  ",Deal of the Day ,,,₹899,₹539,Save ₹360 (40%),4.1 out of 5 stars,92,https://www.amazon.in/HUG-FEEL-SOFT-TOYS-Boyfriend/dp/B08VGQ3RN2/ref=sr_1_57?dchild=1&keywords=baby+toys&qid=1625200440&sr=8-57
Styleys Animal Finger Puppets - Set of 10  ,Best seller,,,₹599,₹389,Save ₹210 (35%),3.7 out of 5 stars,"1,678",https://www.amazon.in/gp/bestsellers/toys/1378466031/ref=sr_bs_9_1378466031_1
"Soniya Enterprises Pack of 4 Elegant Soft Toys Combo Set Bull Dog , Pink Balloon , Yellow Unicorn , Grey Mother Elephant Special Offers Toy Animals for You - 42 cm (Multicolor)  ",,,,₹999,₹575,Save ₹424 (42%),3.3 out of 5 stars,47,https://www.amazon.in/Soniya-Enterprises-Elegant-Balloon-Elephant/dp/B092M917CZ/ref=sr_1_49?dchild=1&keywords=baby+toys&qid=1625200440&sr=8-49
Gifts Online Dancing Dalmatian Dog with Flashing Lights + Music  ,,,,₹500,₹374,Save ₹126 (25%),4.1 out of 5 stars,"1,239",https://www.amazon.in/Jiada-Dancing-Dalmatian-Flashing-Lights/dp/B01KQ4EMQM/ref=sr_1_50?dchild=1&keywords=baby+toys&qid=1625200440&sr=8-50
