name,badge_1,badge_2,badge_3,mrp,discounted_price,discount,rating,rating_count,link
"Odin birds Pack of 4 Animals Soft Toy Kids (Baby) for Playing Soft Toy Penguin , Elephant ,Rabbit , and Unicorn .All Best Stuff Toys for Kids (Enjoy) Playing Birthday Gift (30cm)  ",,,,₹999,₹499,Save ₹500 (50%),,,https://www.amazon.in/Odin-Animals-Playing-Elephant-Birthday/dp/B09BMHCH7C/ref=sr_1_61?dchild=1&keywords=baby+toys&qid=1628319076&sr=8-61
"Vibgyor Vibes; 5 PCS Plastic Lovely Colourful Musical Hanging Rattle Toys With Hanging Cartoons For Toddlers/Babies/Infants/Newborns, Multicolor  ",Limited time deal,,,₹650,₹459,Save ₹191 (29%),4.0 out of 5 stars,"3,154",https://www.amazon.in/Vibgyor-Vibes-Colourful-Cartoons-New-Borns/dp/B0756ZB49T/ref=sr_1_62?dchild=1&keywords=baby+toys&qid=1628319076&smid=AT95IG9ONZD7S&sr=8-62
Toyshine Toys for Baby - 14 Pcs Chu Chu Toys Toddler Baby Bathtub Bathing Squeeze Bath Toys Non-Toxic  ,,,,₹799,₹357.88,Save ₹441.12 (55%),4.1 out of 5 stars,78,https://www.amazon.in/Toyshine-Toys-Baby-Toddler-Non-Toxic/dp/B08R6ZTSMW/ref=sr_1_63?dchild=1&keywords=baby+toys&qid=1628319076&sr=8-63
Tickles Grey Mother Elephant with Baby Soft Stuffed Plush Toy for Kids Baby Boys & Girls Birthday Gifts Home Decoration (Color: Grey Size: 41cm)  ,,,,"₹1,398",₹539,Save ₹859 (61%),4.1 out of 5 stars,652,https://www.amazon.in/Tickles-Mother-Elephant-2-Babies/dp/B00EVKLB5I/ref=sr_1_64?dchild=1&keywords=baby+toys&qid=1628319076&sr=8-64
"Odin birds Pack of 4 Animals Soft Toy Kids (Baby) for Playing Soft Toy Elephant , Dog ,Unicorn and Rabbit .All Best Stuff Toys for Kids (Enjoy) Playing Birthday Gift (30cm)  ",,,,₹999,₹499,Save ₹500 (50%),,,https://www.amazon.in/Odin-Animals-Playing-Elephant-Birthday/dp/B09BMFXXJG/ref=sr_1_65?dchild=1&keywords=baby+toys&qid=1628319076&sr=8-65
"Royals Hub plastic Monkey Dancing And Spinning Rolling Doll (Small, Multicolor)  ",,,,"₹1,999",₹438,"Save ₹1,561 (78%)",4.2 out of 5 stars,335,https://www.amazon.in/Royals-Dancing-Spinning-Rolling-MixColor/dp/B08BTGGCZ4/ref=sr_1_66?dchild=1&keywords=baby+toys&qid=1628319076&sr=8-66
Silver-Style Fine Silver Rattles for Baby by ACPL  ,Deal of the Day ,,,"₹6,000","₹3,400","Save ₹2,600 (43%)",4.0 out of 5 stars,1,https://www.amazon.in/Silver-Style-Fine-Rattles-Baby/dp/B08HGRW11X/ref=sr_1_67?dchild=1&keywords=baby+toys&qid=1628319076&sr=8-67
"SNAKEZ Char Yar Bath Toys for Kids,New Born Baby Products,Chu Chu Non-Toxic BPA Free Colorful Soft Rubber,Float Squeeze Sound Squeaky Bathing Toy for Baby  ",,,,"₹1,499",₹320,"Save ₹1,179 (79%)",,,https://www.amazon.in/SNAKEZ-Products-Non-Toxic-Colorful-Squeeze/dp/B09B7N526X/ref=sr_1_68?dchild=1&keywords=baby+toys&qid=1628319076&sr=8-68
Webby Foldable Orange and Blue Garden Slide Toy for Kids  ,Deal of the Day ,Sponsored,,"₹2,999","₹1,799","Save ₹1,200 (40%)",,,https://www.amazon.in/gp/slredirect/picassoRedirect.html/ref=pa_sp_mtf_aps_sr_pg2_1?ie=UTF8&adId=A011877816X3FT19UNGJJ&url=%2FWebby-Foldable-Orange-Garden-Slide%2Fdp%2FB099GQKDTT%2Fref%3Dsr_1_69_sspa%3Fdchild%3D1%26keywords%3Dbaby%2Btoys%26qid%3D1628319076%26sr%3D8-69-spons%26psc%3D1%26smid%3DAI6EIWS9V80U8&qualifier=1628319076&id=4371130775612524&widgetName=sp_mtf
Mee Mee Easy to Ride Baby Tricycle with Push Handle (Dark Pink)  ,,Sponsored,,"₹5,799","₹3,880","Save ₹1,919 (33%)",3.7 out of 5 stars,34,https://www.amazon.in/gp/slredirect/picassoRedirect.html/ref=pa_sp_mtf_aps_sr_pg2_1?ie=UTF8&adId=A07489243R2989MBKQD6B&url=%2FMee-Premium-Baby-Tricycle-Adjustable%2Fdp%2FB00NR20WCY%2Fref%3Dsr_1_70_sspa%3Fdchild%3D1%26keywords%3Dbaby%2Btoys%26qid%3D1628319076%26sr%3D8-70-spons%26psc%3D1&qualifier=1628319076&id=4371130775612524&widgetName=sp_mtf
Toyshine Bot Robot Pioneer | Colorful Lights and Music | All Direction Movement | Dancing Robot Toys for Boys and Girls | Orange Color  ,,Sponsored,,₹999,₹749,Save ₹250 (25%),3.9 out of 5 stars,"1,046",https://www.amazon.in/gp/slredirect/picassoRedirect.html/ref=pa_sp_mtf_aps_sr_pg2_1?ie=UTF8&adId=A1011016XX5BZPXB4P3H&url=%2FToyshine-Pioneer-Colorful-Direction-Movement%2Fdp%2FB082BCYZTD%2Fref%3Dsr_1_71_sspa%3Fdchild%3D1%26keywords%3Dbaby%2Btoys%26qid%3D1628319076%26sr%3D8-71-spons%26psc%3D1&qualifier=1628319076&id=4371130775612524&widgetName=sp_mtf
Toyshine Push and Shake Wobbling Bell Sounds Roly Poly Tumbler Doll (Multicolour)  ,,Sponsored,,₹899,₹449,Save ₹450 (50%),4.2 out of 5 stars,"3,389",https://www.amazon.in/gp/slredirect/picassoRedirect.html/ref=pa_sp_mtf_aps_sr_pg2_1?ie=UTF8&adId=A04475684UUNA686W40M&url=%2FToyshine-Wobbling-Sounds-Tumbler-Multicolour%2Fdp%2FB073WVT662%2Fref%3Dsr_1_72_sspa%3Fdchild%3D1%26keywords%3Dbaby%2Btoys%26qid%3D1628319076%26sr%3D8-72-spons%26psc%3D1&qualifier=1628319076&id=4371130775612524&widgetName=sp_mtf
"HUG 'n' FEEL SOFT TOYS mouse, soft toys, birthday gift for girls/wife, boyfriend/husband, soft toys wedding for couple special, baby toys gift items, teddy bear, rakhi for brother/sister (height 52cm)  ",Deal of the Day ,,,₹899,₹539,Save ₹360 (40%),4.1 out of 5 stars,157,https://www.amazon.in/HUG-FEEL-SOFT-TOYS-boyfriend/dp/B08VGQ3RN2/ref=sr_1_73?dchild=1&keywords=baby+toys&qid=1628319076&sr=8-73
"BVM GROUP Attractive Colorful Non Toxic 100% Safe 6 Pieces Rattle Toy Kit Set for New Born Babies, Toddlers, Infants Child Shake & Grab Heavy Plastic Toy with Soft Sound Multicolored (6 Pcs)  ",,,,₹599,₹349,Save ₹250 (42%),,,https://www.amazon.in/BVM-GROUP-Attractive-Colorful-Multicolored/dp/B099QNY93Z/ref=sr_1_74?dchild=1&keywords=baby+toys&qid=1628319076&sr=8-74
CUBS & HUGS Soft Toys for Babies Face Rattle Girls Toys & Boys Toys (Squeeze Handle for Squeaky Sound)  ,,,,₹999,₹399,Save ₹600 (60%),4.2 out of 5 stars,135,https://www.amazon.in/CUBS-HUGS-Babies-Squeeze-Squeaky/dp/B08TGB7MXJ/ref=sr_1_75?dchild=1&keywords=baby+toys&qid=1628319076&sr=8-75
Toyshine Musical and Dancing Frog Toy with Lights and Music  ,Deal of the Day ,,,₹999,₹493,Save ₹506 (51%),4.1 out of 5 stars,"2,714",https://www.amazon.in/Toyshine-Dancing-Flashing-Lights-Action/dp/B071965NCS/ref=sr_1_76?dchild=1&keywords=baby+toys&qid=1628319076&sr=8-76
Vibgyor Vibes™ Lovely Mixed Colourful Chu Chu Squeeze Me Toys. For Baby/Toddler/Infants and newborns. Pack of 14  ,,,,₹550,₹341,Save ₹209 (38%),4.0 out of 5 stars,"3,154",https://www.amazon.in/Vibgyor-Vibes-Toddler-Infant-Colours/dp/B01MDSAXU4/ref=sr_1_77?dchild=1&keywords=baby+toys&qid=1628319076&sr=8-77
"Cable World Plastic Baby Bath Chu Chu Colorful Animal Shape Toy (Multicolor, Multi Design) - Set of 12 Pieces  ",Deal of the Day ,,,₹999,₹249,Save ₹750 (75%),4.0 out of 5 stars,523,https://www.amazon.in/cable-world%C2%AE-colorful-animal-design/dp/B08FSTH38J/ref=sr_1_78?dchild=1&keywords=baby+toys&qid=1628319076&sr=8-78
JVM Chu Chu Duck Family Baby Bathing Toys Set  ,,,,₹499,₹199,Save ₹300 (60%),4.1 out of 5 stars,433,https://www.amazon.in/JVM-Duck-Family-Baby-Bathing/dp/B078QKD6SR/ref=sr_1_79?dchild=1&keywords=baby+toys&qid=1628319076&sr=8-79
"Vazzlox Multicolor Cotton Swing for Kids, Chair Jhula for 1-3 Years Old Babies with Safety Belt, Washable and Folding Jhula, Home & Garden Children Jhula, Baby Swings for Indoor & Outdoor  ",,,,₹999,₹599,Save ₹400 (40%),3.8 out of 5 stars,186,https://www.amazon.in/Vazzlox-Multicolor-Washable-Folding-Children/dp/B08YJC6CJ9/ref=sr_1_80?dchild=1&keywords=baby+toys&qid=1628319076&sr=8-80
"Prime Deals Drum Keyboard Musical Toys with Flashing Lights - Animal Sounds and Songs, Multi Color  ",Deal of the Day ,,,₹999,₹599,Save ₹400 (40%),4.4 out of 5 stars,225,https://www.amazon.in/Prime-Deals-Keyboard-Musical-Flashing/dp/B08HX4S3V5/ref=sr_1_81?dchild=1&keywords=baby+toys&qid=1628319076&sr=8-81
"Future shop Pack of 4 Elegant Soft Toys Combo Set Appu Elephant, Penguin,Turtle,Rabbit Toy Animals for Kids/Girls/Boys - 30 cm (Multicolor)  ",,,,"₹1,999",₹575,"Save ₹1,424 (71%)",4.2 out of 5 stars,24,https://www.amazon.in/Future-shop-Elegant-Elephant-Penguin/dp/B097RZ9ZFK/ref=sr_1_82?dchild=1&keywords=baby+toys&qid=1628319076&sr=8-82
"Soniya Enterprises Pack of 4 Elegant Soft Toys Combo Set Bull Dog , Pink Balloon , Yellow Unicorn , Grey Mother Elephant Special Offers Toy Animals for You - 42 cm (Multicolor)  ",,,,₹999,₹555,Save ₹444 (44%),3.5 out of 5 stars,116,https://www.amazon.in/Soniya-Enterprises-Elegant-Balloon-Elephant/dp/B092M917CZ/ref=sr_1_83?dchild=1&keywords=baby+toys&qid=1628319076&sr=8-83
"DEALS INDIA Mother Elephant with 2 Babies Soft Toy- 32 cm, Grey  ",Deal of the Day ,,,₹699,₹303,Save ₹396 (57%),3.8 out of 5 stars,230,https://www.amazon.in/DEALS-INDIA-Mother-Elephant-Babies/dp/B08GFS5X11/ref=sr_1_84?dchild=1&keywords=baby+toys&qid=1628319076&sr=8-84
"FunBlast Baby's Plush Bathtub Bathing Squeeze Colorful Animal Bath Toys (Multicolor), Pack of 14  ",Deal of the Day ,,,₹699,₹337,Save ₹362 (52%),4.2 out of 5 stars,362,https://www.amazon.in/FunBlast-Bath-Toys-Baby-Colorful/dp/B07W1YZYVY/ref=sr_1_85?dchild=1&keywords=baby+toys&qid=1628319076&sr=8-85
"WONDRBOX Crochet Rattle Soft Toy for Babies, Butterfly , 100% Cotton, BPA Free and Non-Toxic, Handmade by NGO Women  ",,,,₹799,₹499,Save ₹300 (38%),4.2 out of 5 stars,63,https://www.amazon.in/WONDRBOX-Crochet-Butterfly-Non-Toxic-Handmade/dp/B09129G4PN/ref=sr_1_86?dchild=1&keywords=baby+toys&qid=1628319076&sr=8-86
"RYLAN Baby Kids Water Play Mat Toys Inflatable Tummy Time Leakproof Water Play Mat, Fun Activity Play Center Indoor and Outdoor Water Play Mat for Baby.- (Regular-)  ",,,,"₹1,299",₹549,Save ₹750 (58%),4.6 out of 5 stars,76,https://www.amazon.in/Inflatable-Leakproof-Activity-Outdoor-Regular/dp/B099DMWRSS/ref=sr_1_87?dchild=1&keywords=baby+toys&qid=1628319076&sr=8-87
Storio Educational Learning Stacking Multicolour 7 Rings Baby Toys for Toddlers Kids 1 Year Old and Above  ,,,,,₹175,,4.3 out of 5 stars,18,https://www.amazon.in/Storio-Rattles-Dumbbells-Development-Toys/dp/B08D8HRTWD/ref=sr_1_88?dchild=1&keywords=baby+toys&qid=1628319076&sr=8-88
