name,badge_1,badge_2,badge_3,mrp,discounted_price,discount,rating,rating_count,link
"MOM'S HOME Baby's Organic Cotton Soft Full Sleeve Onesie/Bodysuit (Multicolour, 0-3 Months) - Pack of 3  ",,Sponsored,Only 5 left in stock.,"₹1,799",₹679,"Save ₹1,120 (62%)",3.7 out of 5 stars,124,https://www.amazon.in/gp/slredirect/picassoRedirect.html/ref=pa_sp_atf_aps_sr_pg1_1?ie=UTF8&adId=A006490237BXZ931QGVN9&url=%2FMOMS-HOME-Organic-Bodysuit-Multicolour%2Fdp%2FB07MQNYKR4%2Fref%3Dsr_1_1_sspa%3Fdchild%3D1%26keywords%3Donesie%26qid%3D1627013083%26sr%3D8-1-spons%26psc%3D1&qualifier=1627013083&id=2384286479387232&widgetName=sp_atf
MINITATU Girl's Half Sleeves Unisex Bodysuit/Onesies Pack of 5  ,Deal of the Day ,Sponsored,,"₹1,499",₹559,Save ₹940 (63%),3.6 out of 5 stars,30,https://www.amazon.in/gp/slredirect/picassoRedirect.html/ref=pa_sp_atf_aps_sr_pg1_1?ie=UTF8&adId=A01311229ZND9DLBFSJB&url=%2FMINITATU-Sleeves-Bodysuit-Onesies-Peb205864_Multicolor4_18-24%2Fdp%2FB0922NZS9K%2Fref%3Dsr_1_2_sspa%3Fdchild%3D1%26keywords%3Donesie%26qid%3D1627013083%26smid%3DAT95IG9ONZD7S%26sr%3D8-2-spons%26psc%3D1&qualifier=1627013083&id=2384286479387232&widgetName=sp_atf
MINITATU Boy's Half Sleeves Unisex Bodysuit/Onesies Pack of 5  ,Deal of the Day ,Sponsored,,"₹1,499",₹559,Save ₹940 (63%),3.4 out of 5 stars,29,https://www.amazon.in/gp/slredirect/picassoRedirect.html/ref=pa_sp_atf_aps_sr_pg1_1?ie=UTF8&adId=A03518792K3AUD0GX25DH&url=%2FMINITATU-Sleeves-Bodysuit-Onesies-Peb205864_Multicolor3_9-12%2Fdp%2FB0922S58J9%2Fref%3Dsr_1_3_sspa%3Fdchild%3D1%26keywords%3Donesie%26qid%3D1627013083%26smid%3DAT95IG9ONZD7S%26sr%3D8-3-spons%26psc%3D1&qualifier=1627013083&id=2384286479387232&widgetName=sp_atf
"BAZARVILLE Baby Rompers for new born boys, girls and infants, 100% soft organic cotton fabric onesies super comfortable for newborn kids, babies- All Colours - Pack of Three  ",,Sponsored,,"₹1,499",₹930,Save ₹569 (38%),,,https://www.amazon.in/gp/slredirect/picassoRedirect.html/ref=pa_sp_atf_aps_sr_pg1_1?ie=UTF8&adId=A08280443GKGGTEU2WHND&url=%2FRompers-infants-organic-onesies-comfortable%2Fdp%2FB096S4566W%2Fref%3Dsr_1_4_sspa%3Fdchild%3D1%26keywords%3Donesie%26qid%3D1627013083%26sr%3D8-4-spons%26psc%3D1&qualifier=1627013083&id=2384286479387232&widgetName=sp_atf
I Bears Baby Boys and Baby Girls Pure Cotton Half Sleeves Romper Set (Onesies/Bodysuit)  ,,,,₹600,₹599,Save ₹1,4.4 out of 5 stars,410,https://www.amazon.in/Bears-Cotton-Sleeves-Onesies-Jumpsuits/dp/B07MB6H98Z/ref=sr_1_5?dchild=1&keywords=onesie&qid=1627013083&sr=8-5
Kiddeo Baby Boys and Baby Girls Bodysuit (03)(Pack of 5)  ,,,,"₹1,299",₹699,Save ₹600 (46%),4.2 out of 5 stars,798,https://www.amazon.in/Kiddeo-Cotton-Bodysuit-Multicolour-Months/dp/B07PPJ3JQN/ref=sr_1_6?dchild=1&keywords=onesie&qid=1627013083&sr=8-6
MINITATU Girl's Half Sleeves Unisex Bodysuit/Onesies Pack of 5  ,Deal of the Day ,,,"₹1,399",₹529,Save ₹870 (62%),3.6 out of 5 stars,30,https://www.amazon.in/MINITATU-Sleeves-Bodysuit-Onesies-Peb205864_Multicolor6_3-6/dp/B0922RW382/ref=sr_1_7?dchild=1&keywords=onesie&qid=1627013083&smid=AT95IG9ONZD7S&sr=8-7
EIO 100% Cotton Sleep Suit/Onesies/Rompers/Jumpsuit for New Born Boys and Girls Combo Pack  ,,,,"₹1,400",₹649,Save ₹751 (54%),4.1 out of 5 stars,689,https://www.amazon.in/Cotton-Onesies-Rompers-Jumpsuit-Months/dp/B0838HNHJT/ref=sr_1_8?dchild=1&keywords=onesie&qid=1627013083&sr=8-8
"Daddy's Little One Daddy's Little One 100% Hosiery Cotton Unisex Long Sleeve Rompers/Onesies/Sleepsuit/Full Body-Suit for Baby Boy and Girl/Infants Combo Pack of 3 (Red, 0-3 Months)  ",,,Only 2 left in stock.,"₹1,499",₹998,Save ₹501 (33%),3.8 out of 5 stars,5,https://www.amazon.in/Daddys-Little-One-Sleepsuit-Body-Suit/dp/B08LXLPQCR/ref=sr_1_9?dchild=1&keywords=onesie&qid=1627013083&sr=8-9
"Picksparrow PICKSPARROW Soft Cotton Baby Rompers/Onesies/Bodysuits/Newborn Essentials (White, Pack of 2, Front-Open, 0-3 Months)  ",,,,₹749,₹599,Save ₹150 (20%),4.3 out of 5 stars,41,https://www.amazon.in/PICKSPARROW-Rompers-Bodysuits-Essentials-Front-Open/dp/B08HXXGTFT/ref=sr_1_10?dchild=1&keywords=onesie&qid=1627013083&sr=8-10
BUMZEE unisex-baby Bodysuit  ,,,,₹799,₹439,Save ₹360 (45%),4.2 out of 5 stars,13,https://www.amazon.in/Bumzee-Sleeves-Unisex-Bodysuit-Onesies/dp/B08XNQNRGY/ref=sr_1_11?dchild=1&keywords=onesie&qid=1627013083&sr=8-11
Poplins Premium 100% Cotton New Born Baby Unisex Multi-Color Long Sleeve Cotton Sleepsuits Romper Onesies Bodysuit for Baby Boys Baby Girls and Newborns Set of 3  ,,,,"₹1,299",₹649,Save ₹650 (50%),5.0 out of 5 stars,2,https://www.amazon.in/Poplins-Multi-Color-Sleepsuits-Bodysuit-Newborns/dp/B0982D192T/ref=sr_1_12?dchild=1&keywords=onesie&qid=1627013083&sr=8-12
V & V V & V Onesie Romper Baby Boy and Baby Girls Premium Cotton/Onesie Rompers/Newborn Baby Suit Pack of 3  ,,,,₹799,₹589,Save ₹210 (26%),4.5 out of 5 stars,17,https://www.amazon.in/Onesie-Romper-Premium-Rompers-Newborn/dp/B08LVWSK9J/ref=sr_1_13?dchild=1&keywords=onesie&qid=1627013083&sr=8-13
TuddyBuddy 100% Cotton Romper/Bodysuit/Onesies for Baby Boys - Pack of 5 Assorted  ,,,,₹999,₹599,Save ₹400 (40%),4.1 out of 5 stars,180,https://www.amazon.in/TuddyBuddy-Cotton-Romper-Bodysuit-Onesies/dp/B08SW2RL27/ref=sr_1_14?dchild=1&keywords=onesie&qid=1627013083&sr=8-14
Generic 3-Pack Organic Short Sleeve Onesies Bodysuits Plain White Rompers  ,,,Only 1 left in stock.,"₹1,299",₹699,Save ₹600 (46%),,,https://www.amazon.in/3-Pack-Organic-Onesies-Bodysuits-Rompers/dp/B0824M41B7/ref=sr_1_15?dchild=1&keywords=onesie&qid=1627013083&sr=8-15
MA BABY Boys and Baby Girls Printed Cotton Baby Bodysuits Onesie one Piece Romper t Shirt for New Born Infant Toddlers Baby Dress Clothing Set of 4  ,,,,"₹2,500",₹799,"Save ₹1,701 (68%)",4.3 out of 5 stars,74,https://www.amazon.in/MA-Bodysuits-Toddlers-Clothing-Multicolour/dp/B089KSDJ39/ref=sr_1_16?dchild=1&keywords=onesie&qid=1627013083&sr=8-16
MINITATU Girl's Half Sleeves Unisex Bodysuit/Onesies Pack of 5  ,Deal of the Day ,,,"₹1,499",₹559,Save ₹940 (63%),3.6 out of 5 stars,30,https://www.amazon.in/MINITATU-Sleeves-Bodysuit-Onesies-Peb205864_Multicolor4_0-3/dp/B0922V579X/ref=sr_1_17?dchild=1&keywords=onesie&qid=1627013083&smid=AT95IG9ONZD7S&sr=8-17
EIO New-Born Baby Boys and Baby Girls Kids Combo Packs  ,,,,₹999,₹399,Save ₹600 (60%),4.0 out of 5 stars,"1,867",https://www.amazon.in/Newborn-Multi-Color-Jumpsuit-Bodysuit-Outfits/dp/B08PPT1TKM/ref=sr_1_18?dchild=1&keywords=onesie&qid=1627013083&sr=8-18
TuddyBuddy 100% Cotton Multi Color Romper/Bodysuit/Onesies for Baby Boy & Baby Girl - Pack of 5 Bodysuits  ,,,,₹999,₹499,Save ₹500 (50%),4.2 out of 5 stars,564,https://www.amazon.in/TuddyBuddy-Cotton-Romper-Bodysuit-Onesies/dp/B089W79BXT/ref=sr_1_19?dchild=1&keywords=onesie&qid=1627013083&sr=8-19
EIO New Born Baby Multi-Color Long Sleeve Cotton Sleep Suit Romper for Boys and Girls Set of 3  ,,,,"₹1,200",₹649,Save ₹551 (46%),4.1 out of 5 stars,"4,964",https://www.amazon.in/Multi-Color-Sleeve-Cotton-Romper-Months/dp/B07MHHDZP7/ref=sr_1_20?dchild=1&keywords=onesie&qid=1627013083&sr=8-20
Vadmans 100% Hosiery Cotton Unisex Long Sleeve Rompers/Onesies/Sleepsuit/Full Body-Suit for Baby Boy and Girl/Infants Combo Pack of 3  ,,Sponsored,,"₹1,299",₹999,Save ₹300 (23%),4.1 out of 5 stars,347,https://www.amazon.in/gp/slredirect/picassoRedirect.html/ref=pa_sp_mtf_aps_sr_pg1_1?ie=UTF8&adId=A0186218289B0GJD6JNWF&url=%2FVADMANS-Hosiery-Rompers-Sleepsuit-Body-Suit%2Fdp%2FB08HV8QVH9%2Fref%3Dsr_1_21_sspa%3Fdchild%3D1%26keywords%3Donesie%26qid%3D1627013083%26sr%3D8-21-spons%26psc%3D1&qualifier=1627013083&id=2384286479387232&widgetName=sp_mtf
"Tedbae Baby Bodysuit Romper Pure Cotton Ultra Soft Unisex Aquamarine Color, Made of Premium Certified Fabric, Style Name - Bitty Bobo  ",,Sponsored,,₹799,₹549,Save ₹250 (31%),,,https://www.amazon.in/gp/slredirect/picassoRedirect.html/ref=pa_sp_mtf_aps_sr_pg1_1?ie=UTF8&adId=A02208512SOX4XNS7NYS4&url=%2FTedbae-Bodysuit-Aquamarine-Premium-Certified%2Fdp%2FB095K5JJMT%2Fref%3Dsr_1_22_sspa%3Fdchild%3D1%26keywords%3Donesie%26qid%3D1627013083%26sr%3D8-22-spons%26psc%3D1&qualifier=1627013083&id=2384286479387232&widgetName=sp_mtf
minicult Baby Boys Cotton All Over Print Pajama Bottom (Pack of 6)  ,Best seller,Sponsored,,"₹2,999",₹649,"Save ₹2,350 (78%)",4.0 out of 5 stars,"12,327",https://www.amazon.in/gp/bestsellers/apparel/1953178031/ref=sr_bs_22_1953178031_1
Babiano Babiano Baby Sleepsuit/Onesie/Romper/Bodysuit- Lemon Yellow (6-9 Months)  ,,Sponsored,,₹620,₹496,Save ₹124 (20%),,,https://www.amazon.in/gp/slredirect/picassoRedirect.html/ref=pa_sp_mtf_aps_sr_pg1_1?ie=UTF8&adId=A08833131FYZ1QZ6CZ855&url=%2FBabiano-Sleepsuit-Onesie-Romper-Bodysuit%2Fdp%2FB08PW2WRZL%2Fref%3Dsr_1_24_sspa%3Fdchild%3D1%26keywords%3Donesie%26qid%3D1627013083%26sr%3D8-24-spons%26psc%3D1&qualifier=1627013083&id=2384286479387232&widgetName=sp_mtf
Hopscotch Baby Boys and Baby Girls Cotton Half Sleeves Onesies Pack of 3 in Red Color for Ages 0-1 Months (BUV-3437822)  ,,,,₹799,₹575,Save ₹224 (28%),,,https://www.amazon.in/Hopscotch-Cotton-Sleeves-Onesies-BUV-3437822/dp/B08YTLLVTJ/ref=sr_1_25?dchild=1&keywords=onesie&qid=1627013083&sr=8-25
BUMZEE Half Sleeves Unisex Baby Bodysuit/Onesies/Rompers Pack of 3  ,,,,₹799,₹439,Save ₹360 (45%),4.3 out of 5 stars,20,https://www.amazon.in/Bumzee-Sleeves-Unisex-Bodysuit-Onesies/dp/B08XNSL4Y4/ref=sr_1_26?dchild=1&keywords=onesie&qid=1627013083&sr=8-26
BUMZEE unisex-baby Bodysuit  ,,,,₹799,₹439,Save ₹360 (45%),4.0 out of 5 stars,4,https://www.amazon.in/Bumzee-Sleeves-Unisex-Bodysuit-Onesies/dp/B08XNRS46B/ref=sr_1_27?dchild=1&keywords=onesie&qid=1627013083&sr=8-27
"V & V V & V Cotton New Born Baby Unisex Onesie Romper Pack of 5 (0-3 Months, Whtie)  ",,,,"₹1,199",₹769,Save ₹430 (36%),3.9 out of 5 stars,8,https://www.amazon.in/Cotton-Unisex-Onesie-Romper-Months/dp/B08LZK2ZNS/ref=sr_1_28?dchild=1&keywords=onesie&qid=1627013083&sr=8-28
Generic INKWALE Onesie | 12 Months Set Milestone Celebration Superfine Cotton | Export Quality | 40% Transparency Baby Romper  ,,,,"₹3,600","₹2,499","Save ₹1,101 (31%)",4.3 out of 5 stars,16,https://www.amazon.in/INKWALE-Milestone-Celebration-Superfine-Transparency/dp/B08H5M7HKB/ref=sr_1_29?dchild=1&keywords=onesie&qid=1627013083&sr=8-29
Generic Onesie |Panda Deisgned Finest Cotton Romper | 3 to 12 Months Baby rompr  ,,,,₹599,₹399,Save ₹200 (33%),3.0 out of 5 stars,2,https://www.amazon.in/Onesie-Deisgned-Finest-Cotton-Romper/dp/B08FDJZ67C/ref=sr_1_30?dchild=1&keywords=onesie&qid=1627013083&sr=8-30
Generic T-Onesie| Twin Baby Printed Designed 100% Cotton White Romper for Twins 3 Months to 12 Months |Twins Baby Romper  ,,,,₹899,₹649,Save ₹250 (28%),4.4 out of 5 stars,4,https://www.amazon.in/T-Onesie-Printed-Designed-Cotton-Romper/dp/B08H1ZMKQJ/ref=sr_1_31?dchild=1&keywords=onesie&qid=1627013083&sr=8-31
BUMZEE unisex-baby Bodysuit  ,,,,₹799,₹439,Save ₹360 (45%),3.9 out of 5 stars,10,https://www.amazon.in/Bumzee-Sleeves-Unisex-Bodysuit-Onesies/dp/B08XNRQ69W/ref=sr_1_32?dchild=1&keywords=onesie&qid=1627013083&sr=8-32
"MOM'S HOME Baby's Organic Cotton Soft Full Sleeve Onesie/Bodysuit (Multicolour, 0-3 Months) - Pack of 3  ",,,,"₹1,799",₹679,"Save ₹1,120 (62%)",3.7 out of 5 stars,124,https://www.amazon.in/MOMS-HOME-Organic-Bodysuit-Multicolour/dp/B07MQNYKR4/ref=sr_1_33?dchild=1&keywords=onesie&qid=1627013083&sr=8-33
Poplins Premium 100% Cotton New Born Baby Unisex Multi-Color Long Sleeve Cotton Sleepsuits Romper Onesies Bodysuit for Baby Boys Baby Girls and Newborns Set of 3  ,,,,"₹1,499",₹649,Save ₹850 (57%),5.0 out of 5 stars,2,https://www.amazon.in/Poplins-Multi-Color-Sleepsuits-Bodysuit-Newborns/dp/B0982BL3ZK/ref=sr_1_34?dchild=1&keywords=onesie&qid=1627013083&sr=8-34
Hopscotch Baby Boys Cotton Half Sleeves Printed Onesies in White Color  ,,,,,₹799,,,,https://www.amazon.in/Hopscotch-Sleeves-Printed-Onesies-TMN-3366620/dp/B08WKRGLZX/ref=sr_1_35?dchild=1&keywords=onesie&qid=1627013083&sr=8-35
Generic T-Onesie | Mommy Daddy Little Miracle Designed 100% Cotton Baby Romper for 3 Months to 12 Months |Festival Baby Rompers  ,,,,₹899,₹499,Save ₹400 (44%),4.1 out of 5 stars,4,https://www.amazon.in/T-Onesie-Miracle-Designed-Festival-Rompers/dp/B08TX1KLLQ/ref=sr_1_36?dchild=1&keywords=onesie&qid=1627013083&sr=8-36
Hopscotch Baby Boys and Baby Girls Cotton Half Sleeves Onesies Pack of 3 in Navy Color  ,,,,₹799,₹575,Save ₹224 (28%),5.0 out of 5 stars,1,https://www.amazon.in/Hopscotch-Cotton-Sleeves-Onesies-BUV-3445914/dp/B0926XG319/ref=sr_1_37?dchild=1&keywords=onesie&qid=1627013083&sr=8-37
Junior star New Born Baby Half Sleeve/Infant 100% Cotton Rompers for Baby Boy and Girl (Multi Colour)  ,,,,,₹499,,,,https://www.amazon.in/Junior-Infant-Rompers-Onesies-Bodysuit/dp/B0965BYQ3G/ref=sr_1_38?dchild=1&keywords=onesie&qid=1627013083&sr=8-38
BUMZEE unisex-baby Bodysuit  ,,,,₹799,₹439,Save ₹360 (45%),4.3 out of 5 stars,16,https://www.amazon.in/Bumzee-Pink-Yellow-Sleeves-Bodysuit-Onesies/dp/B08XNRXR4N/ref=sr_1_39?dchild=1&keywords=onesie&qid=1627013083&sr=8-39
SOOKSHM Cotton Baby Boy's And Baby Girls's For All Season Body Suit/Onesies/Comfort Fit/ (Multi Color) Combo  ,,,,"₹1,499",₹749,Save ₹750 (50%),,,https://www.amazon.in/SOOKSHM-Cotton-Onesies-Comfort-3-6Months_Multi/dp/B098TF17RW/ref=sr_1_40?dchild=1&keywords=onesie&qid=1627013083&sr=8-40
I Bears Full Sleeves Footed Rompers Sets | Baby Clothes | Baby Boys/Baby Girls | 100% Cotton | Infant Clothes | Overalls | Jumpsuits  ,,,,,₹750,,4.4 out of 5 stars,418,https://www.amazon.in/Bears-Sleeves-Onesies-Overalls-Jumpsuits/dp/B08FZTRVFC/ref=sr_1_41?dchild=1&keywords=onesie&qid=1627013083&sr=8-41
Hopscotch Baby Boys Cotton Half Sleeves Onesies Pack of 3 in Blue Color for Ages 9-12 Months (BUV-3433846)  ,,,,₹799,₹575,Save ₹224 (28%),,,https://www.amazon.in/Hopscotch-Cotton-Sleeves-Onesies-BUV-3433846/dp/B08YTM62DZ/ref=sr_1_42?dchild=1&keywords=onesie&qid=1627013083&sr=8-42
TuddyBuddy 100% Organic Cotton Onesies / Bodysuits / Rompers for Baby  ,,,,₹999,₹399,Save ₹600 (60%),4.6 out of 5 stars,6,https://www.amazon.in/TuddyBuddy-Organic-Onesies-Bodysuits-Rompers/dp/B091Q549NN/ref=sr_1_43?dchild=1&keywords=onesie&qid=1627013083&sr=8-43
MINITATU Boy's Half Sleeves Unisex Bodysuit/Onesies Pack of 5  ,Deal of the Day ,,,"₹1,499",₹579,Save ₹920 (61%),3.4 out of 5 stars,29,https://www.amazon.in/MINITATU-Sleeves-Bodysuit-Onesies-Peb205864_Multicolor1_0-3/dp/B0922TN6YK/ref=sr_1_44?dchild=1&keywords=onesie&qid=1627013083&smid=AT95IG9ONZD7S&sr=8-44
Hopscotch Baby Boys Cotton Short Sleeves Printed Onesies in Green Colour  ,,,,,₹229,,,,https://www.amazon.in/Hopscotch-Sleeves-Printed-Onesies-GII-3561189/dp/B09754L414/ref=sr_1_45?dchild=1&keywords=onesie&qid=1627013083&sr=8-45
TuddyBuddy 100% Organic Cotton Onesies / Bodysuits / Rompers for Baby  ,,,,₹999,₹299,Save ₹700 (70%),4.6 out of 5 stars,6,https://www.amazon.in/TuddyBuddy-Organic-Onesies-Bodysuits-Rompers/dp/B091Q4F7TQ/ref=sr_1_46?dchild=1&keywords=onesie&qid=1627013083&sr=8-46
TuddyBuddy 100% Organic Cotton Onesies / Bodysuits / Rompers for Baby  ,,,,₹999,₹399,Save ₹600 (60%),4.6 out of 5 stars,6,https://www.amazon.in/TuddyBuddy-Organic-Onesies-Bodysuits-Rompers/dp/B091Q3H7X6/ref=sr_1_47?dchild=1&keywords=onesie&qid=1627013083&sr=8-47
Poplins Premium 100% Cotton New Born Baby Unisex Multi-Color Long Sleeve Cotton Sleepsuits Romper Onesies Bodysuit for Baby Boys Baby Girls and Newborns Set of 3  ,,,,"₹1,299",₹649,Save ₹650 (50%),5.0 out of 5 stars,2,https://www.amazon.in/Poplins-Multi-Color-Sleepsuits-Bodysuit-Newborns/dp/B0982B3SWC/ref=sr_1_48?dchild=1&keywords=onesie&qid=1627013083&sr=8-48
EIO New Born Baby Multi-Color Long Sleeve Cotton Sleep Suit Romper for Boys and Girls Set of 3  ,,,,"₹1,200",₹649,Save ₹551 (46%),4.1 out of 5 stars,"4,964",https://www.amazon.in/Multi-Color-Sleeve-Cotton-Romper-Months/dp/B07MZ72W4Y/ref=sr_1_49?dchild=1&keywords=onesie&qid=1627013083&sr=8-49
Generic T-Onesie | Twins Baby Graphic Designed 100% Cotton Romper for 3 Months to 12 Months |  ,,,,₹999,₹699,Save ₹300 (30%),4.3 out of 5 stars,17,https://www.amazon.in/T-Onesie-Graphic-Designed-Cotton-Romper/dp/B07ZB221YB/ref=sr_1_50?dchild=1&keywords=onesie&qid=1627013083&sr=8-50
I Bears Full Sleeves Footed Rompers Sets | Baby Clothes | Baby Boys/Baby Girls | 100% Cotton | Infant Clothes | Overalls | Jumpsuits  ,,,,,₹750,,4.4 out of 5 stars,418,https://www.amazon.in/Bears-Sleeves-Onesies-Overalls-Jumpsuits/dp/B08FZS19GS/ref=sr_1_51?dchild=1&keywords=onesie&qid=1627013083&sr=8-51
YUV YUV Baby Boy's and Girl's Pack of 5 Multi-Coloured 100% Cotton Printed Onesie/Romper - 6 to 9 Months  ,,,,₹999,₹599,Save ₹400 (40%),4.3 out of 5 stars,56,https://www.amazon.in/YUV-Multi-Coloured-Cotton-Printed-Onesie/dp/B08J3MG5T3/ref=sr_1_52?dchild=1&keywords=onesie&qid=1627013083&sr=8-52
Generic T-Onesie |Little Brother Designed 100% White Cotton Romper for 3 Months to 12 Months | Little Brother Romper  ,,,,₹899,₹499,Save ₹400 (44%),5.0 out of 5 stars,2,https://www.amazon.in/T-Onesie-Little-Brother-Designed-Cotton/dp/B08D9HFNQV/ref=sr_1_53?dchild=1&keywords=onesie&qid=1627013083&sr=8-53
Hopscotch Baby Boys and Baby Girls Cotton Pack of 3 Printed Onesies in White Color for Ages 1-3 Months (SIW-3641823/Z)  ,,,,,₹660,,,,https://www.amazon.in/Hopscotch-Cotton-Printed-Onesies-SIW-3641823/dp/B098ZGMB3P/ref=sr_1_54?dchild=1&keywords=onesie&qid=1627013083&sr=8-54
"Magdu New Born Baby Boys & Baby Girls 2 Onesie Romper Bodysuits (0-6 Months, Red and Blue)  ",,,,₹599,₹399,Save ₹200 (33%),,,https://www.amazon.in/Magdu-Onesie-Romper-Bodysuits-Months/dp/B097YGRW31/ref=sr_1_55?dchild=1&keywords=onesie&qid=1627013083&sr=8-55
BUMZEE Half Sleeves Unisex Baby Bodysuit/Onesies/Rompers Pack of 3  ,,,,₹799,₹439,Save ₹360 (45%),4.2 out of 5 stars,27,https://www.amazon.in/Bumzee-Multi-Yellow-Sleeves-Bodysuit-Onesies/dp/B08XNRRHS6/ref=sr_1_56?dchild=1&keywords=onesie&qid=1627013083&sr=8-56
BUMZEE Full Length Printed Baby Footies with Hood Pack of 2  ,,Sponsored,,₹999,₹599,Save ₹400 (40%),3.7 out of 5 stars,205,https://www.amazon.in/gp/slredirect/picassoRedirect.html/ref=pa_sp_btf_aps_sr_pg1_1?ie=UTF8&adId=A0513760C838EBZPQ709&url=%2FBUMZEE-Yellow-Length-Printed-Footies%2Fdp%2FB08NCJQ6DQ%2Fref%3Dsr_1_57_sspa%3Fdchild%3D1%26keywords%3Donesie%26qid%3D1627013083%26sr%3D8-57-spons%26psc%3D1&qualifier=1627013083&id=2384286479387232&widgetName=sp_btf
Pink Kites Baby Boy/ Baby Girl cloths Flannel Jumpsuit Quit Duck Style Clothes for baby Clothing Hooded Romper Outwear - (6months To 15 months)  ,,Sponsored,,"₹1,999",₹999,"Save ₹1,000 (50%)",5.0 out of 5 stars,1,https://www.amazon.in/gp/slredirect/picassoRedirect.html/ref=pa_sp_btf_aps_sr_pg1_1?ie=UTF8&adId=A07203841ZGYXZI0Z2C7J&url=%2FPink-Kites-Flannel-Jumpsuit-Clothing%2Fdp%2FB094NXP2VJ%2Fref%3Dsr_1_58_sspa%3Fdchild%3D1%26keywords%3Donesie%26qid%3D1627013083%26sr%3D8-58-spons%26psc%3D1&qualifier=1627013083&id=2384286479387232&widgetName=sp_btf
Pink Kites Baby Boy/ Baby Girl cloths Flannel Jumpsuit Lion cub Style Clothes for baby Clothing Hooded Romper Outwear - (6months To 15 months)  ,,Sponsored,Only 1 left in stock.,"₹1,999",₹999,"Save ₹1,000 (50%)",3.8 out of 5 stars,5,https://www.amazon.in/gp/slredirect/picassoRedirect.html/ref=pa_sp_btf_aps_sr_pg1_1?ie=UTF8&adId=A07198361I10CQ2J4YE66&url=%2FPink-Kites-Flannel-Jumpsuit-Clothing%2Fdp%2FB094NWPQMG%2Fref%3Dsr_1_59_sspa%3Fdchild%3D1%26keywords%3Donesie%26qid%3D1627013083%26sr%3D8-59-spons%26psc%3D1&qualifier=1627013083&id=2384286479387232&widgetName=sp_btf
Victory Royal Romper for Baby Boy Super Comfortable Bodysuit Pack of 6  ,,Sponsored,,"₹1,999",₹899,"Save ₹1,100 (55%)",4.1 out of 5 stars,54,https://www.amazon.in/gp/slredirect/picassoRedirect.html/ref=pa_sp_btf_aps_sr_pg1_1?ie=UTF8&adId=A08868531H69KQAL8QS2S&url=%2FVictory-Royal-Romper-Comfortable-Bodysuit%2Fdp%2FB08MB9C64R%2Fref%3Dsr_1_60_sspa%3Fdchild%3D1%26keywords%3Donesie%26qid%3D1627013083%26sr%3D8-60-spons%26psc%3D1&qualifier=1627013083&id=2384286479387232&widgetName=sp_btf
Vadmans 100% Hosiery Cotton Unisex Long Sleeve Rompers/Onesies/Sleepsuit/Full Body-Suit for Baby Boy and Girl/Infants Combo Pack of 3  ,,Sponsored,,"₹1,299",₹999,Save ₹300 (23%),4.1 out of 5 stars,347,https://www.amazon.in/gp/slredirect/picassoRedirect.html/ref=pa_sp_atf_next_aps_sr_pg2_1?ie=UTF8&adId=A01861183BGX3A66J78B2&url=%2FVADMANS-Hosiery-Rompers-Sleepsuit-Body-Suit%2Fdp%2FB08HTQYBSH%2Fref%3Dsr_1_49_sspa%3Fdchild%3D1%26keywords%3Donesie%26qid%3D1627013101%26sr%3D8-49-spons%26psc%3D1&qualifier=1627013101&id=5445577068849231&widgetName=sp_atf_next
BUMZEE Full Length Printed Baby Footies Sleepsuit Pack of 3  ,,Sponsored,,"₹1,299",₹689,Save ₹610 (47%),3.8 out of 5 stars,49,https://www.amazon.in/gp/slredirect/picassoRedirect.html/ref=pa_sp_atf_next_aps_sr_pg2_1?ie=UTF8&adId=A0217277J1B7EO0EQ1YQ&url=%2FBUMZEE-Length-Printed-Footies-Sleepsuit%2Fdp%2FB08GCNKX2C%2Fref%3Dsr_1_50_sspa%3Fdchild%3D1%26keywords%3Donesie%26qid%3D1627013101%26sr%3D8-50-spons%26psc%3D1&qualifier=1627013101&id=5445577068849231&widgetName=sp_atf_next
Hopscotch Banming Baby Boys Polycotton Solid Classic Half Sleeves Onesies and Short Set in Green Color  ,,Sponsored,Only 1 left in stock.,"₹1,329",₹902,Save ₹427 (32%),4.1 out of 5 stars,187,https://www.amazon.in/gp/slredirect/picassoRedirect.html/ref=pa_sp_atf_next_aps_sr_pg2_1?ie=UTF8&adId=A0429545EJALT72NBFUA&url=%2FHopscotch-Banming-Polycotton-Classic-BD8-2591605%2Fdp%2FB083KN2X4P%2Fref%3Dsr_1_51_sspa%3Fdchild%3D1%26keywords%3Donesie%26qid%3D1627013101%26sr%3D8-51-spons%26psc%3D1&qualifier=1627013101&id=5445577068849231&widgetName=sp_atf_next
minicult Baby Boys Cotton All Over Print Pajama Bottom (Pack of 6)  ,Best seller,Sponsored,,"₹2,999",₹710,"Save ₹2,289 (76%)",4.0 out of 5 stars,"12,327",https://www.amazon.in/gp/bestsellers/apparel/1953178031/ref=sr_bs_3_1953178031_1
Hopscotch Junior Star 100% Cotton Sleep Suit/Onesies/Rompers/Jumpsuit for New Born Boys and Girls Combo Pack of 3 Multi Colour  ,,,,₹899,₹499,Save ₹400 (44%),,,https://www.amazon.in/Junior-Cotton-Onesies-Rompers-Jumpsuit/dp/B0965CGBFQ/ref=sr_1_53?dchild=1&keywords=onesie&qid=1627013101&sr=8-53
"The Peppy Tend Cute ""Pack My Diapers, I'm Going to Nanu Nani's House"" Printed Unisex-Baby Regular Half Sleeves Onesie  ",,,,₹799,₹495,Save ₹304 (38%),,,https://www.amazon.in/Peppy-Tend-Diapers-Printed-Unisex-Baby/dp/B0972GF3S3/ref=sr_1_54?dchild=1&keywords=onesie&qid=1627013101&sr=8-54
Generic INKWALE Onesie | Animated 12 Months Set Milestone Celebration Superfine Cotton | Export Quality | 100% Cotton Baby Romper  ,,,,"₹2,999","₹2,499",Save ₹500 (17%),,,https://www.amazon.in/INKWALE-Animated-Milestone-Celebration-Superfine/dp/B08V8C9578/ref=sr_1_55?dchild=1&keywords=onesie&qid=1627013101&sr=8-55
TuddyBuddy 100% Organic Cotton Multi Color Sleepsuit/Onesie/Romper for Baby Boy & Baby Girl  ,,,,"₹1,499",₹679,Save ₹820 (55%),4.2 out of 5 stars,271,https://www.amazon.in/TuddyBuddy-Organic-Cotton-Sleepsuit-Sleepsuits/dp/B08T632TQV/ref=sr_1_56?dchild=1&keywords=onesie&qid=1627013101&sr=8-56
I Bears Full Sleeves Footed Rompers Sets | Baby Clothes | Baby Boys/Baby Girls | 100% Cotton | Infant Clothes | Overalls | Jumpsuits  ,,,,,₹570,,4.4 out of 5 stars,418,https://www.amazon.in/Bears-Girls-Onesies-Romper-Bodysuit/dp/B08ZL9LM1Q/ref=sr_1_57?dchild=1&keywords=onesie&qid=1627013101&sr=8-57
Kiddeo Baby Boy's and Baby Girl's Cotton Bodysuits Pack of 5  ,,,,"₹1,299",₹699,Save ₹600 (46%),4.2 out of 5 stars,"4,082",https://www.amazon.in/Kiddeo-Infants-Cotton-Bodysuit-Multicolour/dp/B07B4Z879C/ref=sr_1_58?dchild=1&keywords=onesie&qid=1627013101&sr=8-58
"Candyfloss CandyFloss 100% Cotton Romper/Onesie/Bodysuit for Baby Boys and Girls - Cute Little Bear (Orange, 6-9 Months)  ",,,Only 1 left in stock.,₹699,₹399,Save ₹300 (43%),3.8 out of 5 stars,5,https://www.amazon.in/CandyFloss-Cotton-Romper-Onesie-Bodysuit/dp/B08Z8G6L99/ref=sr_1_49?dchild=1&keywords=onesie&qid=1627013101&sr=8-49
Hopscotch Baby Girls Cotton and Spandex Wing Sleeves Floral Printed Onesies in Beige Color for Ages 6-9 Months (GOE-3466067)  ,,,,₹939,₹777,Save ₹162 (17%),,,https://www.amazon.in/Hopscotch-Spandex-Sleeves-Printed-GOE-3466067/dp/B093FHNHZB/ref=sr_1_50?dchild=1&keywords=onesie&qid=1627013101&sr=8-50
gopuja New Born Baby Multi-Color Long Sleeve Cotton Sleep Suit Romper for Baby Boys and Baby Girls Set of 3 (Rompers)  ,,,,₹799,₹620,Save ₹179 (22%),4.1 out of 5 stars,"1,583",https://www.amazon.in/Gopuja-Multi-Color-Sleeve-Cotton-Rompers/dp/B07K61QFGR/ref=sr_1_51?dchild=1&keywords=onesie&qid=1627013101&sr=8-51
"1ST STEP 1st Step 100% Cotton Unisex Long Sleeve Rompers/Onesies/Sleepsuit/Full Body-Suit for Baby Boy and Girl/Infants (Pack of 3) (Grey, 0-3 Months)  ",,,,₹999,₹799,Save ₹200 (20%),4.4 out of 5 stars,6,https://www.amazon.in/Rompers-Onesies-Sleepsuit-Body-Suit-Infants/dp/B08MBZB1ZB/ref=sr_1_52?dchild=1&keywords=onesie&qid=1627013101&sr=8-52
TuddyBuddy 100% Cotton Romper/Bodysuit/Onesies for Baby Boys - Pack of 5 Assorted  ,,,,₹999,₹499,Save ₹500 (50%),4.1 out of 5 stars,180,https://www.amazon.in/TuddyBuddy-Cotton-Footed-Bodysuit-Onesies/dp/B07PR4TPGC/ref=sr_1_53?dchild=1&keywords=onesie&qid=1627013101&sr=8-53
Generic INKWALE Onesie | numaric 12 Months Set Milestone Celebration Superfine Cotton | Export Quality | 100% Cotton Baby Romper  ,,,,"₹2,999","₹2,499",Save ₹500 (17%),,,https://www.amazon.in/INKWALE-numaric-Milestone-Celebration-Superfine/dp/B08V87FVZW/ref=sr_1_54?dchild=1&keywords=onesie&qid=1627013101&sr=8-54
