name,badge_1,badge_2,badge_3,mrp,discounted_price,discount,rating,rating_count,link
"Tdas Artificial Ivy Garlands Leaves Greenery Hanging Vine Creeper Plants (Green, Pack Of 6 Strings)  ",,Sponsored,,₹990,₹469,Save ₹521 (53%),4.1 out of 5 stars,"1,053",https://www.amazon.in/gp/slredirect/picassoRedirect.html/ref=pa_sp_atf_aps_sr_pg1_1?ie=UTF8&adId=A0846411SAF0HWCQ349C&url=%2FArtificial-Garlands-Greenery-Decoration-Festival%2Fdp%2FB08KF3GJQ7%2Fref%3Dsr_1_1_sspa%3Fdchild%3D1%26keywords%3Dartificial%2Bplants%26qid%3D1627144971%26sr%3D8-1-spons%26psc%3D1&qualifier=1627144971&id=3217744112078401&widgetName=sp_atf
"Electomania Artificial Succulent Plants, Pack of 10 - Artificial Succulents Flocking Plants, DIY Mini Fake Succulents Plant for Garden, Office, Home Decor Decoration Arrangements  ",,Sponsored,,"₹1,999",₹819,"Save ₹1,180 (59%)",4.8 out of 5 stars,7,https://www.amazon.in/gp/slredirect/picassoRedirect.html/ref=pa_sp_atf_aps_sr_pg1_1?ie=UTF8&adId=A003956020NOO5XI9Z3MJ&url=%2FElectomania-Artificial-Succulent-Plants-Pack%2Fdp%2FB096ZZST27%2Fref%3Dsr_1_2_sspa%3Fdchild%3D1%26keywords%3Dartificial%2Bplants%26qid%3D1627144971%26sr%3D8-2-spons%26psc%3D1&qualifier=1627144971&id=3217744112078401&widgetName=sp_atf
WOODZONE Artificial Bonsai Plants with Wooden Pot (Green)  ,,Sponsored,,₹890,₹517,Save ₹373 (42%),3.6 out of 5 stars,221,https://www.amazon.in/gp/slredirect/picassoRedirect.html/ref=pa_sp_atf_aps_sr_pg1_1?ie=UTF8&adId=A02014976QC2CUQGRGW&url=%2FWOODZONE-Artificial-Bonsai-Plants-Wooden%2Fdp%2FB08V1RG1V7%2Fref%3Dsr_1_3_sspa%3Fdchild%3D1%26keywords%3Dartificial%2Bplants%26qid%3D1627144971%26sr%3D8-3-spons%26psc%3D1&qualifier=1627144971&id=3217744112078401&widgetName=sp_atf
"Orbin art Artificial Plant Ashoka Tree Bonsai with Pot for Home and Office Decorative Table top and Garden. ( Small, Green, 1 Piece )..  ",,Sponsored,,"₹1,999",₹599,"Save ₹1,400 (70%)",,,https://www.amazon.in/gp/slredirect/picassoRedirect.html/ref=pa_sp_atf_aps_sr_pg1_1?ie=UTF8&adId=A02618573CLZBI0L51W4I&url=%2FOrbin-Artificial-Ashoka-Decorative-Garden%2Fdp%2FB098BCMDMP%2Fref%3Dsr_1_4_sspa%3Fdchild%3D1%26keywords%3Dartificial%2Bplants%26qid%3D1627144971%26sr%3D8-4-spons%26psc%3D1&qualifier=1627144971&id=3217744112078401&widgetName=sp_atf
"Litleo Bonsai Wild Artificial Plant with Pot (Green, 4 Piece)  ",Best seller,,,₹499,₹399,Save ₹100 (20%),4.1 out of 5 stars,"1,057",https://www.amazon.in/gp/bestsellers/kitchen/1380416031/ref=sr_bs_4_1380416031_1
Heart Home Artificial Plants with Plastic Pot (Green)  ,,,,,₹299,,4.0 out of 5 stars,601,https://www.amazon.in/Heart-Home-Artificial-Plants-Plastic/dp/B08VGMLCVF/ref=sr_1_6?dchild=1&keywords=artificial+plants&qid=1627144971&sr=8-6
"Fancy Mart Plastic & Wood Artificial Bamboo Leaves Plant with Wood Hexagon Pot (20 cm, Green)  ",,,,₹800,₹356,Save ₹444 (56%),4.2 out of 5 stars,"7,296",https://www.amazon.in/Fancy-Mart-Artificial-Hexagun-Pot-0235-888/dp/B01LHNLJT4/ref=sr_1_7?dchild=1&keywords=artificial+plants&qid=1627144971&sr=8-7
"Litleo Mini All Green Different for Home Office Or Decoration Bonsai Wild Artificial Plant with Pot (Set of 4 , 15 cm, Green)  ",,,,₹699,₹380,Save ₹319 (46%),3.5 out of 5 stars,27,https://www.amazon.in/Litleo-Different-Decoration-Artificial-Set/dp/B08ZYW5HXH/ref=sr_1_8?dchild=1&keywords=artificial+plants&qid=1627144971&sr=8-8
Decoratinglives Plastic Artificial Plant with Pot Gift (Green)  ,,,,₹999,₹320,Save ₹679 (68%),3.7 out of 5 stars,972,https://www.amazon.in/HYPERBOLE-Artificial-Plant-Gift-White/dp/B075RJBKPN/ref=sr_1_9?dchild=1&keywords=artificial+plants&qid=1627144971&sr=8-9
"Dekorly Artificial Bonsai Wild Plant with Pot (Yellow, Green, Red, Maroon, Set Of 4)  ",,,,₹999,₹399,Save ₹600 (60%),3.6 out of 5 stars,63,https://www.amazon.in/Dekorly-Artificial-Bonsai-Yellow-Maroon/dp/B08ZYJQXTX/ref=sr_1_10?dchild=1&keywords=artificial+plants&qid=1627144971&sr=8-10
"DecoratingLives Artificial Plant with Plastic Pot (Green, 1 Piece)  ",,,,₹999,₹320,Save ₹679 (68%),3.7 out of 5 stars,"1,375",https://www.amazon.in/DecoratingLives-Artificial-Potted-Plants-Height/dp/B07Y4SKNLR/ref=sr_1_11?dchild=1&keywords=artificial+plants&qid=1627144971&sr=8-11
"Ikea Artificial Plant with Plastic Pot (Off-White, 3 Piece)  ",,,,"₹1,099",₹590,Save ₹509 (46%),3.6 out of 5 stars,"1,711",https://www.amazon.in/Ikea-KNALLA-Artificial-Outdoor-Succulent/dp/B07FYC8PPV/ref=sr_1_12?dchild=1&keywords=artificial+plants&qid=1627144971&sr=8-12
AJSN Artificial Plants with Pots ( Set of 4 ) - Mini Bonsai Plants for Home Office Desktop Decor  ,,,,"₹1,099",₹399,Save ₹700 (64%),5.0 out of 5 stars,5,https://www.amazon.in/AJSN-Artificial-Plants-Pots-Set/dp/B0999JVBDC/ref=sr_1_13?dchild=1&keywords=artificial+plants&qid=1627144971&sr=8-13
WOODZONE Artificial Bonsai Plants with Wooden Pot (Green)  ,,,,₹890,₹517,Save ₹373 (42%),3.6 out of 5 stars,221,https://www.amazon.in/WOODZONE-Artificial-Bonsai-Plants-Wooden/dp/B08V1RG1V7/ref=sr_1_14?dchild=1&keywords=artificial+plants&qid=1627144971&sr=8-14
"Artificial Plants Bonsai with Plastic Pot (Green And White, Set Of 2 )  ",,,,₹650,₹199,Save ₹451 (69%),3.5 out of 5 stars,246,https://www.amazon.in/Artificial-Plants-Bonsai-Green-White/dp/B08MXZPDCZ/ref=sr_1_15?dchild=1&keywords=artificial+plants&qid=1627144971&sr=8-15
"Artificial Succulent Plants with Plastic Pot (Green, 3 Pieces,10 x 5 x 10 cms)  ",,,,₹899,₹399,Save ₹500 (56%),3.3 out of 5 stars,129,https://www.amazon.in/Artificial-Succulent-Plants-Plastic-Pieces/dp/B08RJ57PKL/ref=sr_1_16?dchild=1&keywords=artificial+plants&qid=1627144971&sr=8-16
"Litleo® for Home Office Or Gift Table Top Bonsai , Natural Looking Artificial Plant (Multicolor)  ",,,,₹499,₹249,Save ₹250 (50%),5.0 out of 5 stars,1,https://www.amazon.in/Litleo%C2%AE-Natural-Looking-Artificial-Multicolor/dp/B0926RW49G/ref=sr_1_17?dchild=1&keywords=artificial+plants&qid=1627144971&sr=8-17
HYPERBOLES Artificial Bonsai Plant with Pot - Green - 10 Inch/25 cm  ,,,,₹699,₹249,Save ₹450 (64%),4.2 out of 5 stars,13,https://www.amazon.in/HYPERBOLES-Artificial-Bonsai-Plant-Pot/dp/B0979KGJ9D/ref=sr_1_18?dchild=1&keywords=artificial+plants&qid=1627144971&sr=8-18
"Planters Artificial Plant with Plastic Pot (Green, White, 2 Piece)  ",,,,"₹1,063",₹709,Save ₹354 (33%),4.3 out of 5 stars,581,https://www.amazon.in/PlantersTM-Artificial-Plant-Pots-Set/dp/B07HTCCPWM/ref=sr_1_19?dchild=1&keywords=artificial+plants&qid=1627144971&sr=8-19
"Litleo Artificial Table Top Mini Bonsai with Pot (Green, Set Of 2)  ",,,,₹399,₹199,Save ₹200 (50%),3.5 out of 5 stars,77,https://www.amazon.in/Litleo-Office-Decoration-Birthday-Bonsai/dp/B08KLXFFKB/ref=sr_1_20?dchild=1&keywords=artificial+plants&qid=1627144971&sr=8-20
"Eurotex 30 MM High Density Artificial Grass Carpet Mat for Balcony, Lawn, Door (Natural Green, 4 X 7 feet)  ",,Sponsored,,"₹5,999","₹2,132","Save ₹3,867 (64%)",4.3 out of 5 stars,65,https://www.amazon.in/gp/slredirect/picassoRedirect.html/ref=pa_sp_mtf_aps_sr_pg1_1?ie=UTF8&adId=A0508613242LZPUYQDIXZ&url=%2FEurotex%25C2%25AE-Artificial-Grass-Density-Balcony%2Fdp%2FB07MBBBDZN%2Fref%3Dsr_1_21_sspa%3Fdchild%3D1%26keywords%3Dartificial%2Bplants%26qid%3D1627144971%26sr%3D8-21-spons%26psc%3D1&qualifier=1627144971&id=3217744112078401&widgetName=sp_mtf
"Lilone Artificial Plant with Plastic Pot (Multicolour, 3 Piece)  ",,Sponsored,,"₹1,299",₹989,Save ₹310 (24%),3.8 out of 5 stars,25,https://www.amazon.in/gp/slredirect/picassoRedirect.html/ref=pa_sp_mtf_aps_sr_pg1_1?ie=UTF8&adId=A0305451DPORBRT14QTY&url=%2FLilone-Artificial-Plants-Grass-Decor%2Fdp%2FB084RS4X5S%2Fref%3Dsr_1_22_sspa%3Fdchild%3D1%26keywords%3Dartificial%2Bplants%26qid%3D1627144971%26sr%3D8-22-spons%26psc%3D1&qualifier=1627144971&id=3217744112078401&widgetName=sp_mtf
Golden Cart Artificial Grass for Balcony I Artificial Grass Floor Mat Carpet I Artificial Green Grass Carpet for Balcony Garden Lawn Door I Artificial Grass for Living Room (3.5 x 15 Feet)  ,,Sponsored,,"₹5,513","₹3,674","Save ₹1,839 (33%)",4.0 out of 5 stars,1,https://www.amazon.in/gp/slredirect/picassoRedirect.html/ref=pa_sp_mtf_aps_sr_pg1_1?ie=UTF8&adId=A05990011GUKXOZLC9XVW&url=%2FGolden-Cart-Artificial-Balcony-15%2Fdp%2FB0973GKGG9%2Fref%3Dsr_1_23_sspa%3Fdchild%3D1%26keywords%3Dartificial%2Bplants%26qid%3D1627144971%26sr%3D8-23-spons%26psc%3D1&qualifier=1627144971&id=3217744112078401&widgetName=sp_mtf
CAAJIB Artificial Plant with Ceramic Pot (Red Green)  ,,Sponsored,,"₹1,199",₹649,Save ₹550 (46%),5.0 out of 5 stars,2,https://www.amazon.in/gp/slredirect/picassoRedirect.html/ref=pa_sp_mtf_aps_sr_pg1_1?ie=UTF8&adId=A0333286W8EOTZ17RKPU&url=%2FCAAJIB-Artificial-Plant-Red-Green%2Fdp%2FB08ZN1X6RW%2Fref%3Dsr_1_24_sspa%3Fdchild%3D1%26keywords%3Dartificial%2Bplants%26qid%3D1627144971%26sr%3D8-24-spons%26psc%3D1&qualifier=1627144971&id=3217744112078401&widgetName=sp_mtf
Fake Plants Artificial Mini Plants Plastic Green Grass Small Faux Greenery Potted Plant with White Cement Pots for Home Office Desk Bathroom House Decor (setof1)  ,,,,₹999,₹399.99,Save ₹599.01 (60%),,,https://www.amazon.in/Plants-Artificial-Plastic-Greenery-Bathroom/dp/B099ZCBR93/ref=sr_1_25?dchild=1&keywords=artificial+plants&qid=1627144971&sr=8-25
"DN Enterprises Artificial Wall Hanging Money Plant Small Leaf Bail (6 Strings, 8Ft Tall) | Artificial Money Plant Leaf Creeper | Wall Hanging | Party Office Festival Theme Decorative Plants  ",,,,₹770,₹385,Save ₹385 (50%),,,https://www.amazon.in/Enterprises-Artificial-Money-Plant-Bail/dp/B08W1WM2Y1/ref=sr_1_26?dchild=1&keywords=artificial+plants&qid=1627144971&sr=8-26
"BK MART Artificial Plant with Rubber Pot (Green, Yellow, 1 Piece,50 x 14 x 10 cm)  ",,,,"₹1,599",₹820,Save ₹779 (49%),4.2 out of 5 stars,120,https://www.amazon.in/BK-Leaves-Bonsai-Artificial-Yellow/dp/B085LSFCL7/ref=sr_1_27?dchild=1&keywords=artificial+plants&qid=1627144971&sr=8-27
Reiki Crystal Products Beautiful Artificial Bonsai Plant with Pot | Bonsai Plant & Tree | Bonsai Tree for Indoor Office Home Decor Showpiece Pack 0f 1 pc  ,,,,₹675,₹425,Save ₹250 (37%),3.8 out of 5 stars,19,https://www.amazon.in/Reiki-Crystal-Products-Beautiful-Artificial/dp/B08S7DXN1T/ref=sr_1_28?dchild=1&keywords=artificial+plants&qid=1627144971&sr=8-28
"DecoreBugs Artificial Hanging Plant with Wood Pot (Green, 1 Piece)  ",,,,₹700,₹334,Save ₹366 (52%),4.0 out of 5 stars,447,https://www.amazon.in/DecoreBugs-Artificial-Falling-Hanging-Plastic/dp/B08BCLJMD9/ref=sr_1_29?dchild=1&keywords=artificial+plants&qid=1627144971&sr=8-29
"FLYNGO Artificial Flower Plants with Pot for Home, Office, and Living Room Decoration (Green Common Box)  ",,,,₹999,₹399,Save ₹600 (60%),3.9 out of 5 stars,35,https://www.amazon.in/FLYNGO-Artificial-Flower-Plants-Decoration/dp/B097YN2YZP/ref=sr_1_30?dchild=1&keywords=artificial+plants&qid=1627144971&sr=8-30
"Litleo Artificial Bonsai Wild Plant with Silk and Plastic Pot (Green , Set Of 4)  ",,,,₹699,₹380,Save ₹319 (46%),3.7 out of 5 stars,26,https://www.amazon.in/Litleo-Artificial-Bonsai-Plant-Plastic/dp/B08ZYRH5LW/ref=sr_1_31?dchild=1&keywords=artificial+plants&qid=1627144971&sr=8-31
"Electomania Artificial Succulent Plants, Pack of 10 - Artificial Succulents Flocking Plants, DIY Mini Fake Succulents Plant for Garden, Office, Home Decor Decoration Arrangements  ",,,,"₹1,999",₹819,"Save ₹1,180 (59%)",4.8 out of 5 stars,7,https://www.amazon.in/Electomania-Artificial-Succulent-Plants-Pack/dp/B096ZZST27/ref=sr_1_32?dchild=1&keywords=artificial+plants&qid=1627144971&sr=8-32
YTC Artificial Plants for Home Decor | Pack of 4 | (2 Grass & 2 Green Plant)  ,,,,₹799,₹449,Save ₹350 (44%),3.7 out of 5 stars,23,https://www.amazon.in/YTC-Artificial-Plants-Decor-Grass/dp/B096QC1VRB/ref=sr_1_33?dchild=1&keywords=artificial+plants&qid=1627144971&sr=8-33
DecoreBugs Artificial Bamboo Leaves with Pot (Green)  ,,,,₹910,₹446,Save ₹464 (51%),4.2 out of 5 stars,113,https://www.amazon.in/DecoreBugs-Artificial-Bamboo-Leaves-Green/dp/B08W1VJ7C4/ref=sr_1_34?dchild=1&keywords=artificial+plants&qid=1627144971&sr=8-34
"DecoratingLives Artificial Plant with Plastic Pot (Green, 1 Piece)  ",,,,₹999,₹299,Save ₹700 (70%),3.7 out of 5 stars,"1,357",https://www.amazon.in/DecoratingLives-Artificial-Potted-Plants-Height/dp/B07Y57PYVS/ref=sr_1_35?dchild=1&keywords=artificial+plants&qid=1627144971&sr=8-35
Pindia Miniature Money Plant Green Leaf Artificial Indoor/Outdoor Plant Decorative Plant for Home Office Garden Décor with Pot (Size 9 inchs/ 23 cms)  ,,,,₹774,₹361,Save ₹413 (53%),4.2 out of 5 stars,685,https://www.amazon.in/Pindia-Plastic-Miniature-Artificial-Decorative/dp/B079GZ7TDB/ref=sr_1_36?dchild=1&keywords=artificial+plants&qid=1627144971&sr=8-36
Amputive Artificial Plant with Pot (Set of 3)  ,,,,"₹1,499",₹695,Save ₹804 (54%),4.4 out of 5 stars,37,https://www.amazon.in/Amputive-Artificial-Topiary-Lovely-Decoration-Set/dp/B08RNPRQHR/ref=sr_1_37?dchild=1&keywords=artificial+plants&qid=1627144971&sr=8-37
Sofix Artificial Plant Big Palm Tree (Green)  ,,,,"₹1,999",₹879,"Save ₹1,120 (56%)",4.1 out of 5 stars,309,https://www.amazon.in/Sofix-Indoor-Artificial-Natural-Looking/dp/B07DBLYHDP/ref=sr_1_38?dchild=1&keywords=artificial+plants&qid=1627144971&sr=8-38
"Fourwalls Artificial Croton Plant (Multicolour, 1 Piece)  ",,,,"₹5,000","₹3,365","Save ₹1,635 (33%)",3.7 out of 5 stars,53,https://www.amazon.in/Fourwalls-Decorative-Artificial-Croton-Leaves/dp/B00XMNTXFA/ref=sr_1_39?dchild=1&keywords=artificial+plants&qid=1627144971&sr=8-39
"BS AMOR Artificial Garland Money Plant Leaf Creeper Wall Hanging (Green, 6 Strings/ 6ft)  ",Best seller,,,₹799,₹389,Save ₹410 (51%),4.1 out of 5 stars,"2,484",https://www.amazon.in/gp/bestsellers/kitchen/5229871031/ref=sr_bs_39_5229871031_1
"BK MART Set of 2 Mini Table Flower top Bonsai for Home Shop Office Decoration Gift Bonsai Wild Artificial Plant with Pot (20 cm, Green)  ",,,,₹599,₹325,Save ₹274 (46%),4.8 out of 5 stars,6,https://www.amazon.in/BK-MART-Flower-Decoration-Artificial/dp/B092MY4HHT/ref=sr_1_41?dchild=1&keywords=artificial+plants&qid=1627144971&sr=8-41
"AJSN Artificial Bonsai Plants Set of 2 - Mini Plants Plastic with Pots , for Home Office Desktop Decor  ",,,,₹699,₹249,Save ₹450 (64%),,,https://www.amazon.in/AJSN-Artificial-Bonsai-Plants-Set/dp/B099FGQR8F/ref=sr_1_42?dchild=1&keywords=artificial+plants&qid=1627144971&sr=8-42
"Cinagro Artificial Potted Plant with Pot Indoor/Outdoor Succulent for Home Décor, Living Room, Balcony, Gifting - Small (Pack of 3)  ",Limited time deal,,,₹999,₹698,Save ₹301 (30%),3.5 out of 5 stars,81,https://www.amazon.in/Cinagro-Artificial-Outdoor-Succulent-Balcony/dp/B08GG6GQ75/ref=sr_1_43?dchild=1&keywords=artificial+plants&qid=1627144971&sr=8-43
KUBERAA Areca Palm Live Plant with Pot  ,,,,₹899,₹406,Save ₹493 (55%),,,https://www.amazon.in/KUBERAA-Areca-Palm-Live-Plant/dp/B09368L6SS/ref=sr_1_44?dchild=1&keywords=artificial+plants&qid=1627144971&sr=8-44
"Hanging Artificial Plant with Plastic Pot for Indoor/Outdoor Home Decor (Green,Pack of 1)  ",,,,₹499,₹365,Save ₹134 (27%),4.2 out of 5 stars,273,https://www.amazon.in/Artificial-Plant-Indoor-Outdoor-Decor/dp/B081B1LCFS/ref=sr_1_45?dchild=1&keywords=artificial+plants&qid=1627144971&sr=8-45
"DecoratingLives Artificial Plant with Plastic Pot (Green, 2 Piece)  ",,,,₹999,₹289,Save ₹710 (71%),4.1 out of 5 stars,"2,562",https://www.amazon.in/Hyperboles-Artificial-Plastic-Topiaries-Washroom/dp/B07L1XTPKL/ref=sr_1_46?dchild=1&keywords=artificial+plants&qid=1627144971&sr=8-46
"Fancy Mart Artificial Money Plant in Wood Round Small Pot (20 cm x 20 cm x 30 cm, Green)  ",,,,₹830,₹388,Save ₹442 (53%),3.5 out of 5 stars,81,https://www.amazon.in/Fancymart-Artificial-Money-Plant-pot-1834/dp/B07BN2T3N5/ref=sr_1_47?dchild=1&keywords=artificial+plants&qid=1627144971&sr=8-47
"Synaty Artificial Succulent Faux Plant (Multiple Colors, 8 Pieces) (Spring Green, 8)  ",Limited time deal,,,"₹1,199",₹743,Save ₹456 (38%),4.2 out of 5 stars,27,https://www.amazon.in/Synaty-Artificial-Succulent-Multiple-Colors/dp/B08TVCV5NY/ref=sr_1_48?dchild=1&keywords=artificial+plants&qid=1627144971&smid=A3CM3QZLDU1LQA&sr=8-48
"Samriddhi Artificial Money Plant Creeper/Vine (Green, 3 Pieces)  ",,,,₹599,₹205,Save ₹394 (66%),,,https://www.amazon.in/Samriddhi-Artificial-Money-Creeper-Pieces/dp/B092TRY8BQ/ref=sr_1_49?dchild=1&keywords=artificial+plants&qid=1627144971&sr=8-49
"Fourwalls Miniature PVC Artificial Plant without pot (18 Leaves, 70 cm, Green)  ",,,,"₹1,000",₹640,Save ₹360 (36%),4.0 out of 5 stars,384,https://www.amazon.in/Fourwalls-Artificial-AP-18-R340-1250/dp/B01L74ENQY/ref=sr_1_50?dchild=1&keywords=artificial+plants&qid=1627144971&sr=8-50
"BK MART Set of 2 Table Flower top Bonsai for Home Shop Office Decoration Gift Bonsai Wild Artificial Plant with Pot (20 cm, Multicolor)  ",,,,₹599,₹330,Save ₹269 (45%),4.0 out of 5 stars,1,https://www.amazon.in/BK-MART-Decoration-Artificial-Multicolor/dp/B092RJ527M/ref=sr_1_51?dchild=1&keywords=artificial+plants&qid=1627144971&sr=8-51
"Litleo Great for Home Or Office Decoration or Birthday Gift, Table Top Bonsai Artificial Plant with Wooden Pot Bonsai Artificial Plant with Pot (28 cm, Green)  ",,,,,₹320,,5.0 out of 5 stars,1,https://www.amazon.in/Litleo-Office-Decoration-Birthday-Artificial/dp/B08JLW5SGJ/ref=sr_1_52?dchild=1&keywords=artificial+plants&qid=1627144971&sr=8-52
"Artificial Plants Bonsai with Plastic Pot (Multicolour, Set Of 4,8 x 8 x 15 Cms)  ",,,,₹999,₹499,Save ₹500 (50%),3.9 out of 5 stars,134,https://www.amazon.in/Artificial-Plants-Bonsai-Plastic-Multicolour/dp/B08W4M453N/ref=sr_1_53?dchild=1&keywords=artificial+plants&qid=1627144971&sr=8-53
FancyMart Artificial Rubber Plant Big in Apple Pot (Height 35 cm)  ,,,,₹940,₹449,Save ₹491 (52%),4.1 out of 5 stars,13,https://www.amazon.in/FancyMart-Artificial-Rubber-Plant-Height/dp/B08VYKPYNZ/ref=sr_1_54?dchild=1&keywords=artificial+plants&qid=1627144971&sr=8-54
Artificial Plant with Wooden Pot Home and Office Decor  ,,,,₹299,₹170,Save ₹129 (43%),,,https://www.amazon.in/Artificial-Plant-Wooden-Office-Decor/dp/B09832BVDY/ref=sr_1_55?dchild=1&keywords=artificial+plants&qid=1627144971&sr=8-55
"Fourwalls Artificial Dracaena Floor Plant (Multicolour, 1 Piece)  ",,,,"₹7,000","₹4,233","Save ₹2,767 (40%)",4.8 out of 5 stars,10,https://www.amazon.in/Fourwalls-Polyester-Polyurethane-Artificial-Dracaena/dp/B07HS98M46/ref=sr_1_56?dchild=1&keywords=artificial+plants&qid=1627144971&sr=8-56
"StylishWalls Vertical Garden Artifical Mat with Leaves I Artifical Grass for Wall Decoration I Artificial Grass Tiles for Balcony I Artifical Garden (Dark Green, 60cm x 40cm x 3cm, Pack of 4)  ",,Sponsored,,"₹2,060","₹1,299",Save ₹761 (37%),,,https://www.amazon.in/gp/slredirect/picassoRedirect.html/ref=pa_sp_btf_aps_sr_pg1_1?ie=UTF8&adId=A07368231P309VX8MKXGG&url=%2FStylishWalls-Vertical-Artifical-Decoration-Artificial%2Fdp%2FB0979JLW4D%2Fref%3Dsr_1_57_sspa%3Fdchild%3D1%26keywords%3Dartificial%2Bplants%26qid%3D1627144971%26sr%3D8-57-spons%26psc%3D1&qualifier=1627144971&id=3217744112078401&widgetName=sp_btf
"Chumbak Artificial Cactus (Green, 1 Piece)  ",,Sponsored,,₹795,₹477,Save ₹318 (40%),3.3 out of 5 stars,12,https://www.amazon.in/gp/slredirect/picassoRedirect.html/ref=pa_sp_btf_aps_sr_pg1_1?ie=UTF8&adId=A0815446281X6SY1Q7C7H&url=%2FChumbak-Desert-Cactus-Artificial-Planter%2Fdp%2FB08DV9XBNW%2Fref%3Dsr_1_58_sspa%3Fdchild%3D1%26keywords%3Dartificial%2Bplants%26qid%3D1627144971%26sr%3D8-58-spons%26psc%3D1&qualifier=1627144971&id=3217744112078401&widgetName=sp_btf
"CAAJIB Artificial Flower Plant with Ceramic Pot (Golden, Blue)  ",,Sponsored,,"₹1,999",₹699,"Save ₹1,300 (65%)",4.5 out of 5 stars,2,https://www.amazon.in/gp/slredirect/picassoRedirect.html/ref=pa_sp_btf_aps_sr_pg1_1?ie=UTF8&adId=A00730141VEWAJYX76ZDC&url=%2FCAAJIB-Flower-Ceramic-Pot-Blue%2Fdp%2FB08ZSYN44K%2Fref%3Dsr_1_59_sspa%3Fdchild%3D1%26keywords%3Dartificial%2Bplants%26qid%3D1627144971%26sr%3D8-59-spons%26psc%3D1&qualifier=1627144971&id=3217744112078401&widgetName=sp_btf
"CHETANYA Loomtex High Density Artificial Grass for Balcony, Lawn, Garden, Terrace, Doormat, Runner (2x4 feet,Green)  ",,Sponsored,,"₹2,000",₹499,"Save ₹1,501 (75%)",4.1 out of 5 stars,454,https://www.amazon.in/gp/slredirect/picassoRedirect.html/ref=pa_sp_btf_aps_sr_pg1_1?ie=UTF8&adId=A08004513C2NKX4WTQCNN&url=%2FCHETANYA-Density-Artificial-Carpet-Balcony%2Fdp%2FB07VLNQ8VV%2Fref%3Dsr_1_60_sspa%3Fdchild%3D1%26keywords%3Dartificial%2Bplants%26qid%3D1627144971%26sr%3D8-60-spons%26psc%3D1&qualifier=1627144971&id=3217744112078401&widgetName=sp_btf
WOODZONE Artificial Bonsai Plants with Wooden Pot (Green)  ,,Sponsored,,₹990,₹507,Save ₹483 (49%),3.6 out of 5 stars,221,https://www.amazon.in/gp/slredirect/picassoRedirect.html/ref=pa_sp_atf_next_aps_sr_pg2_1?ie=UTF8&adId=A0296935STALZG3N3CPP&url=%2FWOODZONE-Artificial-Bonsai-Plants-Wooden%2Fdp%2FB08R2SR4DT%2Fref%3Dsr_1_49_sspa%3Fdchild%3D1%26keywords%3Dartificial%2Bplants%26qid%3D1627144988%26sr%3D8-49-spons%26psc%3D1&qualifier=1627144988&id=5708912409297326&widgetName=sp_atf_next
"HABIBI Anti Slip Gel Back High Density Artificial Grass Carpet Mat / Doormat / Floormat for Balcony, Lawn & Garden (4 x 10 FT)  ",,Sponsored,,"₹5,010","₹2,494","Save ₹2,516 (50%)",,,https://www.amazon.in/gp/slredirect/picassoRedirect.html/ref=pa_sp_atf_next_aps_sr_pg2_1?ie=UTF8&adId=A022160634EVZKYX6UP54&url=%2FHABIBI-Density-Artificial-Doormat-Floormat%2Fdp%2FB08HHLZYZL%2Fref%3Dsr_1_50_sspa%3Fdchild%3D1%26keywords%3Dartificial%2Bplants%26qid%3D1627144988%26sr%3D8-50-spons%26psc%3D1&qualifier=1627144988&id=5708912409297326&widgetName=sp_atf_next
"Tdas Artificial Ivy Vine Creeper Plants (Green, Pack of 6)  ",,Sponsored,,₹990,₹469,Save ₹521 (53%),4.1 out of 5 stars,"1,053",https://www.amazon.in/gp/slredirect/picassoRedirect.html/ref=pa_sp_atf_next_aps_sr_pg2_1?ie=UTF8&adId=A0936642117U9WSW7Y88L&url=%2FArtificial-Garlands-Greenery-maindoor-Decoration%2Fdp%2FB07X1FJVD3%2Fref%3Dsr_1_51_sspa%3Fdchild%3D1%26keywords%3Dartificial%2Bplants%26qid%3D1627144988%26sr%3D8-51-spons%26psc%3D1%26smid%3DA1MIIA6575OUWM&qualifier=1627144988&id=5708912409297326&widgetName=sp_atf_next
DESIGN PLAYER Artificial Scented Roses (Red)  ,,Sponsored,,,,,,,https://www.amazon.in/gp/slredirect/picassoRedirect.html/ref=pa_sp_atf_next_aps_sr_pg2_1?ie=UTF8&adId=A08499911KX14W5JFLOT9&url=%2F19-allure-artificial-scented-roses%2Fdp%2FB06XC9T2K2%2Fref%3Dsr_1_52_sspa%3Fdchild%3D1%26keywords%3Dartificial%2Bplants%26qid%3D1627144988%26sr%3D8-52-spons%26psc%3D1&qualifier=1627144988&id=5708912409297326&widgetName=sp_atf_next
"SATYAM KRAFT Artificial Plant Small Palm Leaves for Home Decoration and Craft (Green, 12 Leaves)  ",,,,"₹1,200",₹299,Save ₹901 (75%),3.0 out of 5 stars,1,https://www.amazon.in/SATYAM-KRAFT-Artificial-Leaves-Decoration/dp/B09715KLX8/ref=sr_1_53?dchild=1&keywords=artificial+plants&qid=1627144988&sr=8-53
"Artificial Plants Bonsai For Decorations With Plastic Pot (White;Green, 2 Pieces)  ",,,,₹350,₹179,Save ₹171 (49%),3.2 out of 5 stars,35,https://www.amazon.in/Artificial-Plants-Bonsai-Decorations-Plastic/dp/B08TMW3PN4/ref=sr_1_54?dchild=1&keywords=artificial+plants&qid=1627144988&sr=8-54
"Outgeek Artificial Succulent Plants: Faux Succulents Unpotted Fake Succulent Plants Green, Premium Crafting DIY Floral Decor for Home Garden Office Party (High Realistic), 7 Pieces  ",Limited time deal,,,"₹1,602",₹889,Save ₹713 (45%),4.2 out of 5 stars,314,https://www.amazon.in/Outgeek-Artificial-Succulent-Fashion-Decorative/dp/B082F9N951/ref=sr_1_55?dchild=1&keywords=artificial+plants&qid=1627144988&smid=A30ZC2WP07466W&sr=8-55
"TIED RIBBONS Artificial Fruit Bonsai Tree with Plastic Pot (Multicolour, 1 Pc)  ",,,,₹899,₹379,Save ₹520 (58%),3.8 out of 5 stars,24,https://www.amazon.in/TIED-RIBBONS-Artificial-Plastic-Multicolour/dp/B08L13199H/ref=sr_1_56?dchild=1&keywords=artificial+plants&qid=1627144988&sr=8-56
"Artificial Plants Bonsai Faux Grass Decorations With Plastic Pot (Green;White, 3 Pieces)  ",,,,₹599,₹229,Save ₹370 (62%),3.5 out of 5 stars,75,https://www.amazon.in/Artificial-Plants-Bonsai-Decorations-Plastic/dp/B08T6M99J2/ref=sr_1_57?dchild=1&keywords=artificial+plants&qid=1627144988&sr=8-57
IKEA Artificial Hanging Plant with Pot for Indoor/Outdoor/Home Decor  ,,,,₹899,₹399,Save ₹500 (56%),3.5 out of 5 stars,11,https://www.amazon.in/Artificial-Hanging-Plant-Indoor-Outdoor/dp/B093H4D79X/ref=sr_1_58?dchild=1&keywords=artificial+plants&qid=1627144988&sr=8-58
"Fancy Mart Artificial Plants/Flowers with Wooden Pot (Green, 1 Piece)  ",,,,₹900,₹430,Save ₹470 (52%),4.1 out of 5 stars,612,https://www.amazon.in/Fancy-Mart-Fabric-Plastic-Artificial/dp/B07R4JR8HQ/ref=sr_1_49?dchild=1&keywords=artificial+plants&qid=1627144988&sr=8-49
"Fourwalls Artificial PVC Plant (10 cm x 10 cm x 50 cm, Green)  ",Amazon's Choice,,,"₹1,000",₹480,Save ₹520 (52%),4.4 out of 5 stars,75,https://www.amazon.in/Four-Walls-Artificial-Plant-Green/dp/B07PB91TQG/ref=ice_ac_b_dpb?dchild=1&keywords=artificial+plants&qid=1627144988&sr=8-50
"BK Mart Big Areca Palm Money Plant Tree with 18 Long Leaves Bonsai Artificial Plant with Pot (70 cm, Green, 1 Piece)  ",,,,"₹1,599",₹798,Save ₹801 (50%),4.2 out of 5 stars,25,https://www.amazon.in/BK-Areca-Leaves-Bonsai-Artificial/dp/B085LRQ1LT/ref=sr_1_51?dchild=1&keywords=artificial+plants&qid=1627144988&sr=8-51
"Electomania Artificial Plant (Green, 1 Piece,14 x 10.3 x 6.1 cm)  ",,,,₹599,₹318,Save ₹281 (47%),3.8 out of 5 stars,124,https://www.amazon.in/Electomania-13-Branch-Artificial-Succulent-Office/dp/B07V6TMV8R/ref=sr_1_52?dchild=1&keywords=artificial+plants&qid=1627144988&sr=8-52
