name,badge_1,badge_2,badge_3,mrp,discounted_price,discount,rating,rating_count,link
YTC Artificial Plants for Home Decor | Pack of 4 | (Mahndi Leaf)  ,,Sponsored,,₹799,₹399,Save ₹400 (50%),3.7 out of 5 stars,25,https://www.amazon.in/gp/slredirect/picassoRedirect.html/ref=pa_sp_atf_aps_sr_pg1_1?ie=UTF8&adId=A0557202XS86CMMV4DRN&url=%2FYTC-Artificial-Plants-Decor-Mahndi%2Fdp%2FB096QFT3NL%2Fref%3Dsr_1_1_sspa%3Fdchild%3D1%26keywords%3Dartificial%2Bplants%26qid%3D1627567849%26sr%3D8-1-spons%26psc%3D1&qualifier=1627567849&id=7564575310286118&widgetName=sp_atf
M2 Look Artificial Ivy Garlands Leaves Greenery Hanging Vine Creeper Plants Bunch for Home Wall Main Door Balcony Office Decor (Approx Length 7 ft) -4 Pieces  ,,Sponsored,,₹699,₹299,Save ₹400 (57%),,,https://www.amazon.in/gp/slredirect/picassoRedirect.html/ref=pa_sp_atf_aps_sr_pg1_1?ie=UTF8&adId=A07715682WSID6SODRN1N&url=%2FM2-Look-Artificial-Garlands-Greenery%2Fdp%2FB099PGSHPP%2Fref%3Dsr_1_2_sspa%3Fdchild%3D1%26keywords%3Dartificial%2Bplants%26qid%3D1627567849%26sr%3D8-2-spons%26psc%3D1&qualifier=1627567849&id=7564575310286118&widgetName=sp_atf
"TDas Artificial Ivy Garlands Leaves Greenery Hanging Vine Creeper Plants for Home Decor Door Wall Balcony Decoration Party Festival Craft, Contain 80 Leaves -Each String 6.7 ft ( Pack of 6 Strings)  ",,Sponsored,,₹990,₹469,Save ₹521 (53%),4.1 out of 5 stars,"1,067",https://www.amazon.in/gp/slredirect/picassoRedirect.html/ref=pa_sp_atf_aps_sr_pg1_1?ie=UTF8&adId=A00907711PWKXKZ2SGXWD&url=%2FArtificial-Garlands-Greenery-Decoration-Festival%2Fdp%2FB08KF3GJQ7%2Fref%3Dsr_1_3_sspa%3Fdchild%3D1%26keywords%3Dartificial%2Bplants%26qid%3D1627567849%26sr%3D8-3-spons%26psc%3D1&qualifier=1627567849&id=7564575310286118&widgetName=sp_atf
"Electomania Artificial Succulent Plants, Pack of 10 - Artificial Succulents Flocking Plants, DIY Mini Fake Succulents Plant for Garden, Office, Home Decor Decoration Arrangements  ",,Sponsored,,"₹1,999",₹819,"Save ₹1,180 (59%)",4.5 out of 5 stars,11,https://www.amazon.in/gp/slredirect/picassoRedirect.html/ref=pa_sp_atf_aps_sr_pg1_1?ie=UTF8&adId=A00397163GD5GIN3TUIVC&url=%2FElectomania-Artificial-Succulent-Plants-Pack%2Fdp%2FB096ZZST27%2Fref%3Dsr_1_4_sspa%3Fdchild%3D1%26keywords%3Dartificial%2Bplants%26qid%3D1627567849%26sr%3D8-4-spons%26psc%3D1%26smid%3DA77TG4NKXE13J&qualifier=1627567849&id=7564575310286118&widgetName=sp_atf
"Litleo Bonsai Wild Artificial Plant with Pot (Green, 4 Piece)  ",Best seller,,,₹499,₹399,Save ₹100 (20%),4.1 out of 5 stars,"1,123",https://www.amazon.in/gp/bestsellers/kitchen/1380416031/ref=sr_bs_4_1380416031_1
"Fancy Mart Plastic & Wood Artificial Bamboo Leaves Plant with Wood Hexagon Pot (20 cm, Green)  ",,,,₹800,₹356,Save ₹444 (56%),4.2 out of 5 stars,"7,393",https://www.amazon.in/Fancy-Mart-Artificial-Hexagun-Pot-0235-888/dp/B01LHNLJT4/ref=sr_1_6?dchild=1&keywords=artificial+plants&qid=1627567849&sr=8-6
Heart Home Artificial Plants with Plastic Pot (Green)  ,,,,,₹299,,4.0 out of 5 stars,631,https://www.amazon.in/Heart-Home-Artificial-Plants-Plastic/dp/B08VGMLCVF/ref=sr_1_7?dchild=1&keywords=artificial+plants&qid=1627567849&sr=8-7
"Litleo Mini All Green Different for Home Office Or Decoration Bonsai Wild Artificial Plant with Pot (Set of 4 , 15 cm, Green)  ",,,,₹699,₹380,Save ₹319 (46%),3.5 out of 5 stars,30,https://www.amazon.in/Litleo-Different-Decoration-Artificial-Set/dp/B08ZYW5HXH/ref=sr_1_8?dchild=1&keywords=artificial+plants&qid=1627567849&sr=8-8
"Dekorly Artificial Bonsai Wild Plant with Pot (Yellow, Green, Red, Maroon, Set Of 4)  ",,,,₹999,₹399,Save ₹600 (60%),3.6 out of 5 stars,73,https://www.amazon.in/Dekorly-Artificial-Bonsai-Yellow-Maroon/dp/B08ZYJQXTX/ref=sr_1_9?dchild=1&keywords=artificial+plants&qid=1627567849&sr=8-9
Decoratinglives Plastic Artificial Plant with Pot Gift (Green)  ,,,,₹999,₹299,Save ₹700 (70%),3.7 out of 5 stars,983,https://www.amazon.in/HYPERBOLE-Artificial-Plant-Gift-White/dp/B075RJBKPN/ref=sr_1_10?dchild=1&keywords=artificial+plants&qid=1627567849&sr=8-10
AJSN Artificial Plants with Pots ( Set of 4 ) - Mini Bonsai Plants for Home Office Desktop Decor  ,,,,"₹1,099",₹399,Save ₹700 (64%),5.0 out of 5 stars,8,https://www.amazon.in/AJSN-Artificial-Plants-Pots-Set/dp/B0999JVBDC/ref=sr_1_11?dchild=1&keywords=artificial+plants&qid=1627567849&sr=8-11
"DecoratingLives Artificial Plant with Plastic Pot (Green, 1 Piece)  ",,,,₹999,₹320,Save ₹679 (68%),3.7 out of 5 stars,"1,395",https://www.amazon.in/DecoratingLives-Artificial-Potted-Plants-Height/dp/B07Y4SKNLR/ref=sr_1_12?dchild=1&keywords=artificial+plants&qid=1627567849&sr=8-12
"Planters Artificial Plant with Plastic Pot (Green, White, 2 Piece)  ",,,,"₹1,063",₹709,Save ₹354 (33%),4.3 out of 5 stars,588,https://www.amazon.in/PlantersTM-Artificial-Plant-Pots-Set/dp/B07HTCCPWM/ref=sr_1_13?dchild=1&keywords=artificial+plants&qid=1627567849&sr=8-13
YTC Artificial Plants for Home Decor | Pack of 4 | (2 Grass & 2 Green Plant)  ,,,,₹799,₹399,Save ₹400 (50%),3.7 out of 5 stars,25,https://www.amazon.in/YTC-Artificial-Plants-Decor-Grass/dp/B096QC1VRB/ref=sr_1_14?dchild=1&keywords=artificial+plants&qid=1627567849&sr=8-14
"Artificial Plants Bonsai with Plastic Pot (Green And White, Set Of 2 )  ",,,,₹399,₹149,Save ₹250 (63%),3.5 out of 5 stars,254,https://www.amazon.in/Artificial-Plants-Bonsai-Green-White/dp/B08MXZPDCZ/ref=sr_1_15?dchild=1&keywords=artificial+plants&qid=1627567849&sr=8-15
"Artificial Succulent Plants with Plastic Pot (Green, 3 Pieces,10 x 5 x 10 cms)  ",,,,₹899,₹399,Save ₹500 (56%),3.2 out of 5 stars,141,https://www.amazon.in/Artificial-Succulent-Plants-Plastic-Pieces/dp/B08RJ57PKL/ref=sr_1_16?dchild=1&keywords=artificial+plants&qid=1627567849&sr=8-16
"Litleo Artificial Table Top Mini Bonsai with Pot (Green, Set Of 2)  ",,,,₹399,₹199,Save ₹200 (50%),3.6 out of 5 stars,80,https://www.amazon.in/Litleo-Office-Decoration-Birthday-Bonsai/dp/B08KLXFFKB/ref=sr_1_17?dchild=1&keywords=artificial+plants&qid=1627567849&sr=8-17
HYPERBOLES Artificial Bonsai Plant with Pot - Green - 10 Inch/25 cm (2)  ,,,,₹699,₹249,Save ₹450 (64%),4.3 out of 5 stars,14,https://www.amazon.in/HYPERBOLES-Artificial-Bonsai-Plant-Pot/dp/B0979KGJ9D/ref=sr_1_18?dchild=1&keywords=artificial+plants&qid=1627567849&sr=8-18
Reiki Crystal Products Beautiful Artificial Bonsai Plant with Pot | Bonsai Plant & Tree | Bonsai Tree for Indoor Office Home Decor Showpiece Pack 0f 1 pc  ,,,,₹675,₹425,Save ₹250 (37%),3.8 out of 5 stars,20,https://www.amazon.in/Reiki-Crystal-Products-Beautiful-Artificial/dp/B08S7DXN1T/ref=sr_1_19?dchild=1&keywords=artificial+plants&qid=1627567849&sr=8-19
Realistic Artificial Bamboo & Grass Plant Pot for Home and Decoration ( Set of 6 Small )  ,,,,₹999,₹349,Save ₹650 (65%),1.0 out of 5 stars,1,https://www.amazon.in/Realistic-Artificial-Bamboo-Grass-Decoration/dp/B098LGJYGY/ref=sr_1_20?dchild=1&keywords=artificial+plants&qid=1627567849&sr=8-20
"Xinrub Artificial Bundle Shrubs Daffodils Plants (Yellow, 1 Piece)  ",,Sponsored,Only 1 left in stock.,,₹263.94,,,,https://www.amazon.in/gp/slredirect/picassoRedirect.html/ref=pa_sp_mtf_aps_sr_pg1_1?ie=UTF8&adId=A03369771DY7PVLJEBGQ9&url=%2FXinrub-Artificial-Bundle-Shrubs-Daffodils%2Fdp%2FB089T138Q5%2Fref%3Dsr_1_21_sspa%3Fdchild%3D1%26keywords%3Dartificial%2Bplants%26qid%3D1627567849%26sr%3D8-21-spons%26psc%3D1&qualifier=1627567849&id=7564575310286118&widgetName=sp_mtf
"Eurotex 30 MM High Density Artificial Grass Carpet Mat for Balcony, Lawn, Door (Natural Green, 4 X 7 feet)  ",,Sponsored,,"₹5,999","₹2,132","Save ₹3,867 (64%)",4.4 out of 5 stars,67,https://www.amazon.in/gp/slredirect/picassoRedirect.html/ref=pa_sp_mtf_aps_sr_pg1_1?ie=UTF8&adId=A0508613242LZPUYQDIXZ&url=%2FEurotex%25C2%25AE-Artificial-Grass-Density-Balcony%2Fdp%2FB07MBBBDZN%2Fref%3Dsr_1_22_sspa%3Fdchild%3D1%26keywords%3Dartificial%2Bplants%26qid%3D1627567849%26sr%3D8-22-spons%26psc%3D1&qualifier=1627567849&id=7564575310286118&widgetName=sp_mtf
"Caajib Decor's Artificial Turkish Faux Green Leave Plant in Imported Brazilin Brown Matka for Living Room,Home & Office Decoration  ",,Sponsored,Only 1 left in stock.,₹999,₹599,Save ₹400 (40%),,,https://www.amazon.in/gp/slredirect/picassoRedirect.html/ref=pa_sp_mtf_aps_sr_pg1_1?ie=UTF8&adId=A04000053KAK5G50K8W0D&url=%2FCaajib-Artificial-Turkish-Brazilin-Decoration%2Fdp%2FB098X21NX8%2Fref%3Dsr_1_23_sspa%3Fdchild%3D1%26keywords%3Dartificial%2Bplants%26qid%3D1627567849%26sr%3D8-23-spons%26psc%3D1&qualifier=1627567849&id=7564575310286118&widgetName=sp_mtf
"Artificial Creeper Plants Leaves Greenery Hanging| Height 6.5 Feet (Mix 1, 2)  ",,Sponsored,,₹775,₹199,Save ₹576 (74%),,,https://www.amazon.in/gp/slredirect/picassoRedirect.html/ref=pa_sp_mtf_aps_sr_pg1_1?ie=UTF8&adId=A08683692G9BC2XGEP2SE&url=%2FArtificial-Creeper-Plants-Greenery-Hanging%2Fdp%2FB099QW23C9%2Fref%3Dsr_1_24_sspa%3Fdchild%3D1%26keywords%3Dartificial%2Bplants%26qid%3D1627567849%26sr%3D8-24-spons%26psc%3D1&qualifier=1627567849&id=7564575310286118&widgetName=sp_mtf
"Samriddhi Artificial Money Plant Creeper/Vine (Green, 3 Pieces)  ",,,,₹599,₹205,Save ₹394 (66%),5.0 out of 5 stars,1,https://www.amazon.in/Samriddhi-Artificial-Money-Creeper-Pieces/dp/B092TRY8BQ/ref=sr_1_25?dchild=1&keywords=artificial+plants&qid=1627567849&sr=8-25
"Litleo Artificial Bonsai Wild Plant with Silk and Plastic Pot (Green , Set Of 4)  ",,,,₹699,₹380,Save ₹319 (46%),3.8 out of 5 stars,28,https://www.amazon.in/Litleo-Artificial-Bonsai-Plant-Plastic/dp/B08ZYRH5LW/ref=sr_1_26?dchild=1&keywords=artificial+plants&qid=1627567849&sr=8-26
"DecoratingLives Artificial Plant with Plastic Pot (Green, 1 Piece)  ",,,,₹999,₹299,Save ₹700 (70%),3.7 out of 5 stars,"1,380",https://www.amazon.in/DecoratingLives-Artificial-Potted-Plants-Height/dp/B07Y57PYVS/ref=sr_1_27?dchild=1&keywords=artificial+plants&qid=1627567849&sr=8-27
"Ikea Artificial Plant with Plastic Pot (Off-White, 3 Piece)  ",,,,"₹1,099",₹565,Save ₹534 (49%),3.6 out of 5 stars,"1,722",https://www.amazon.in/Ikea-KNALLA-Artificial-Outdoor-Succulent/dp/B07FYC8PPV/ref=sr_1_28?dchild=1&keywords=artificial+plants&qid=1627567849&sr=8-28
"Dekorly Small Artificial Plants Fake Bonsai Tree, Indoor House Plant for Home Office Decor, 9.5 x 8.5 inch  ",,,,₹999,₹279,Save ₹720 (72%),3.2 out of 5 stars,10,https://www.amazon.in/Dekorly-Artificial-Plants-Bonsai-Indoor/dp/B08Y5YCQ9S/ref=sr_1_29?dchild=1&keywords=artificial+plants&qid=1627567849&sr=8-29
"BS AMOR Artificial Garland Money Plant Leaf Creeper Wall Hanging (Green, 6 Strings/ 6ft)  ",Best seller,,,₹799,₹389,Save ₹410 (51%),4.1 out of 5 stars,"2,552",https://www.amazon.in/gp/bestsellers/kitchen/5229871031/ref=sr_bs_29_5229871031_1
"Cinagro Artificial Potted Plant with Pot Indoor/Outdoor Succulent for Home Décor, Living Room, Balcony, Gifting - Small (Pack of 3)  ",Deal of the Day ,,,₹999,₹663,Save ₹336 (34%),3.5 out of 5 stars,81,https://www.amazon.in/Cinagro-Artificial-Outdoor-Succulent-Balcony/dp/B08GG6GQ75/ref=sr_1_31?dchild=1&keywords=artificial+plants&qid=1627567849&sr=8-31
Sofix Artificial Plant Big Palm Tree (Green)  ,,,,"₹1,999",₹849,"Save ₹1,150 (58%)",4.1 out of 5 stars,313,https://www.amazon.in/Sofix-Indoor-Artificial-Natural-Looking/dp/B07DBLYHDP/ref=sr_1_32?dchild=1&keywords=artificial+plants&qid=1627567849&sr=8-32
"TDas Artificial Ivy Garlands Leaves Greenery Hanging Vine Creeper Plants for Home Decor Door Wall Balcony Decoration Party Festival Craft, Contain 80 Leaves -Each String 6.7 ft ( Pack of 6 Strings)  ",,,,₹990,₹469,Save ₹521 (53%),4.1 out of 5 stars,"1,067",https://www.amazon.in/Artificial-Garlands-Greenery-Decoration-Festival/dp/B08KF3GJQ7/ref=sr_1_33?dchild=1&keywords=artificial+plants&qid=1627567849&sr=8-33
"DecoreBugs Artificial Hanging Plant with Wood Pot (Green, 1 Piece)  ",,,,₹700,₹334,Save ₹366 (52%),4.0 out of 5 stars,462,https://www.amazon.in/DecoreBugs-Artificial-Falling-Hanging-Plastic/dp/B08BCLJMD9/ref=sr_1_34?dchild=1&keywords=artificial+plants&qid=1627567849&sr=8-34
"Electomania Artificial Succulent Plants, Pack of 10 - Artificial Succulents Flocking Plants, DIY Mini Fake Succulents Plant for Garden, Office, Home Decor Decoration Arrangements  ",,,,"₹1,999",₹819,"Save ₹1,180 (59%)",4.5 out of 5 stars,11,https://www.amazon.in/Electomania-Artificial-Succulent-Plants-Pack/dp/B096ZZST27/ref=sr_1_35?dchild=1&keywords=artificial+plants&qid=1627567849&sr=8-35
"Fourwalls Artificial Croton Plant (Multicolour, 1 Piece)  ",,,,"₹5,000","₹3,365","Save ₹1,635 (33%)",3.7 out of 5 stars,53,https://www.amazon.in/Fourwalls-Decorative-Artificial-Croton-Leaves/dp/B00XMNTXFA/ref=sr_1_36?dchild=1&keywords=artificial+plants&qid=1627567849&sr=8-36
"Litleo Great for Home Or Office Decoration or Birthday Gift, Table Top Bonsai Artificial Plant with Wooden Pot Bonsai Artificial Plant with Pot (28 cm, Green)  ",,,,,₹320,,5.0 out of 5 stars,1,https://www.amazon.in/Litleo-Office-Decoration-Birthday-Artificial/dp/B08JLW5SGJ/ref=sr_1_37?dchild=1&keywords=artificial+plants&qid=1627567849&sr=8-37
"BK MART Set of 2 Table Flower top Bonsai for Home Shop Office Decoration Gift Bonsai Wild Artificial Plant with Pot (20 cm, Multicolor)  ",,,,₹599,₹335,Save ₹264 (44%),4.0 out of 5 stars,1,https://www.amazon.in/BK-MART-Decoration-Artificial-Multicolor/dp/B092RJ527M/ref=sr_1_38?dchild=1&keywords=artificial+plants&qid=1627567849&sr=8-38
Amputive Artificial Plant with Pot (Set of 3)  ,,,,"₹1,499",₹695,Save ₹804 (54%),4.2 out of 5 stars,42,https://www.amazon.in/Amputive-Artificial-Topiary-Lovely-Decoration-Set/dp/B08RNPRQHR/ref=sr_1_39?dchild=1&keywords=artificial+plants&qid=1627567849&sr=8-39
"BK MART Set of 2 Mini Table Flower top Bonsai for Home Shop Office Decoration Gift Bonsai Wild Artificial Plant with Pot (20 cm, Green)  ",,,,₹599,₹325,Save ₹274 (46%),4.7 out of 5 stars,7,https://www.amazon.in/BK-MART-Flower-Decoration-Artificial/dp/B092MY4HHT/ref=sr_1_40?dchild=1&keywords=artificial+plants&qid=1627567849&sr=8-40
Pindia Miniature Money Plant Green Leaf Artificial Indoor/Outdoor Plant Decorative Plant for Home Office Garden Décor with Pot (Size 9 inchs/ 23 cms)  ,,,,₹774,₹361,Save ₹413 (53%),4.2 out of 5 stars,694,https://www.amazon.in/Pindia-Plastic-Miniature-Artificial-Decorative/dp/B079GZ7TDB/ref=sr_1_41?dchild=1&keywords=artificial+plants&qid=1627567849&sr=8-41
DecoreBugs Artificial Bamboo Leaves with Pot (Green)  ,,,,₹910,₹446,Save ₹464 (51%),4.2 out of 5 stars,119,https://www.amazon.in/DecoreBugs-Artificial-Bamboo-Leaves-Green/dp/B08W1VJ7C4/ref=sr_1_42?dchild=1&keywords=artificial+plants&qid=1627567849&sr=8-42
"Hanging Artificial Plant with Plastic Pot for Indoor/Outdoor Home Decor (Green,Pack of 1)  ",,,,₹499,₹365,Save ₹134 (27%),4.2 out of 5 stars,277,https://www.amazon.in/Artificial-Plant-Indoor-Outdoor-Decor/dp/B081B1LCFS/ref=sr_1_43?dchild=1&keywords=artificial+plants&qid=1627567849&sr=8-43
"Fancy Mart Artificial Bamboo with Pot (Green, 1 Piece)  ",,,,"₹1,090",₹421,Save ₹669 (61%),4.3 out of 5 stars,703,https://www.amazon.in/Fancy-Mart-Artificial-Bamboo-Height/dp/B07HLYWKYG/ref=sr_1_44?dchild=1&keywords=artificial+plants&qid=1627567849&sr=8-44
KAYKON Artificial Palm Tree Plant (Green)  ,,,,"₹1,999",₹899,"Save ₹1,100 (55%)",4.1 out of 5 stars,108,https://www.amazon.in/Kaykon-Artificial-Plant-Decor-Without/dp/B08KTH1LPB/ref=sr_1_45?dchild=1&keywords=artificial+plants&qid=1627567849&sr=8-45
"FLYNGO Artificial Flower Plants with Pot for Home, Office, and Living Room Decoration (Green Common Box)  ",,,,₹999,₹399,Save ₹600 (60%),3.8 out of 5 stars,42,https://www.amazon.in/FLYNGO-Artificial-Flower-Plants-Decoration/dp/B097YN2YZP/ref=sr_1_46?dchild=1&keywords=artificial+plants&qid=1627567849&sr=8-46
"Fourwalls Miniature PVC Artificial Plant without pot (18 Leaves, 70 cm, Green)  ",,,,"₹1,000",₹599,Save ₹401 (40%),3.9 out of 5 stars,388,https://www.amazon.in/Fourwalls-Artificial-AP-18-R340-1250/dp/B01L74ENQY/ref=sr_1_47?dchild=1&keywords=artificial+plants&qid=1627567849&sr=8-47
"AJSN Artificial Bonsai Plants Set of 2 - Mini Plants Plastic with Pots , for Home Office Desktop Decor  ",,,,₹699,₹249,Save ₹450 (64%),5.0 out of 5 stars,1,https://www.amazon.in/AJSN-Artificial-Bonsai-Plants-Set/dp/B099FGQR8F/ref=sr_1_48?dchild=1&keywords=artificial+plants&qid=1627567849&sr=8-48
"Fourwalls PVC Plastic Artificial Eucalyptus Boxwood Topiary Grass Ball (18 cm Total Diameter, Green)  ",,,,₹600,₹239,Save ₹361 (60%),3.6 out of 5 stars,851,https://www.amazon.in/Fourwalls-Artificial-Topiary-17cm-Green/dp/B00VPYQ5WW/ref=sr_1_49?dchild=1&keywords=artificial+plants&qid=1627567849&sr=8-49
"Fourwalls Artificial Dracaena Floor Plant (Multicolour, 1 Piece)  ",,,,"₹7,000","₹4,233","Save ₹2,767 (40%)",4.8 out of 5 stars,10,https://www.amazon.in/Fourwalls-Polyester-Polyurethane-Artificial-Dracaena/dp/B07HS98M46/ref=sr_1_50?dchild=1&keywords=artificial+plants&qid=1627567849&sr=8-50
Artificial Plant Without Pot Succulent Set of 3  ,,,,₹450,₹330,Save ₹120 (27%),,,https://www.amazon.in/Artificial-Plant-Without-Pot-Succulent/dp/B0994F4NGH/ref=sr_1_51?dchild=1&keywords=artificial+plants&qid=1627567849&sr=8-51
"HabibiGo Artificial Plants Bonsai Poted with Plastic Apple Pot Plastic Faux Green Grass Fake Topiaries Shrubs for Home, Garden and Office Decor (Multicolour, Set of 6, 15 x 15 x 18 Cms)  ",,,,"₹1,699",₹599,"Save ₹1,100 (65%)",5.0 out of 5 stars,2,https://www.amazon.in/HabibiGo-Artificial-Plastic-Topiaries-Multicolour/dp/B098F7RWC9/ref=sr_1_52?dchild=1&keywords=artificial+plants&qid=1627567849&sr=8-52
FancyMart Artificial Rubber Plant Big in Apple Pot (Height 35 cm)  ,,,,₹940,₹449,Save ₹491 (52%),4.1 out of 5 stars,14,https://www.amazon.in/FancyMart-Artificial-Rubber-Plant-Height/dp/B08VYKPYNZ/ref=sr_1_53?dchild=1&keywords=artificial+plants&qid=1627567849&sr=8-53
"TIED RIBBONS Artificial Fruit Bonsai Tree with Plastic Pot (Multicolour, 1 Pc)  ",,,,₹899,₹379,Save ₹520 (58%),3.8 out of 5 stars,24,https://www.amazon.in/TIED-RIBBONS-Artificial-Plastic-Multicolour/dp/B08L13199H/ref=sr_1_54?dchild=1&keywords=artificial+plants&qid=1627567849&sr=8-54
"Artificial Fancy Plant with Fancy Plastic Pot for Home, Party Cum Office Decoration with Height of 11.02 inches/28 cm and Width of 7.8 Inches/20 cm |Green|  ",,,,₹899,₹304,Save ₹595 (66%),,,https://www.amazon.in/Artificial-Plastic-Office-Decoration-Height/dp/B094H647JB/ref=sr_1_55?dchild=1&keywords=artificial+plants&qid=1627567849&sr=8-55
"Artificial Plants Bonsai Faux Grass Decorations With Plastic Pot (Green;White, 3 Pieces)  ",,,,₹599,₹249,Save ₹350 (58%),3.5 out of 5 stars,79,https://www.amazon.in/Artificial-Plants-Bonsai-Decorations-Plastic/dp/B08T6M99J2/ref=sr_1_56?dchild=1&keywords=artificial+plants&qid=1627567849&sr=8-56
CAAJIB Artificial Plant with Ceramic Pot (Red Green)  ,,Sponsored,,"₹1,199",₹649,Save ₹550 (46%),5.0 out of 5 stars,2,https://www.amazon.in/gp/slredirect/picassoRedirect.html/ref=pa_sp_btf_aps_sr_pg1_1?ie=UTF8&adId=A0333286W8EOTZ17RKPU&url=%2FCAAJIB-Artificial-Plant-Red-Green%2Fdp%2FB08ZN1X6RW%2Fref%3Dsr_1_57_sspa%3Fdchild%3D1%26keywords%3Dartificial%2Bplants%26qid%3D1627567849%26sr%3D8-57-spons%26psc%3D1&qualifier=1627567849&id=7564575310286118&widgetName=sp_btf
"F2L Artificial Grass Mat (Green, 1 Piece)  ",,Sponsored,,"₹3,840","₹1,996","Save ₹1,844 (48%)",3.9 out of 5 stars,173,https://www.amazon.in/gp/slredirect/picassoRedirect.html/ref=pa_sp_btf_aps_sr_pg1_1?ie=UTF8&adId=A02730443616P97J2BX60&url=%2FF2L-Artificial-Grass-Green-Piece%2Fdp%2FB08Q8H9GW6%2Fref%3Dsr_1_58_sspa%3Fdchild%3D1%26keywords%3Dartificial%2Bplants%26qid%3D1627567849%26sr%3D8-58-spons%26psc%3D1&qualifier=1627567849&id=7564575310286118&widgetName=sp_btf
"Chumbak Artificial Cactus (Green, 1 Piece)  ",,Sponsored,,₹795,₹557,Save ₹238 (30%),3.3 out of 5 stars,12,https://www.amazon.in/gp/slredirect/picassoRedirect.html/ref=pa_sp_btf_aps_sr_pg1_1?ie=UTF8&adId=A0815446281X6SY1Q7C7H&url=%2FChumbak-Desert-Cactus-Artificial-Planter%2Fdp%2FB08DV9XBNW%2Fref%3Dsr_1_59_sspa%3Fdchild%3D1%26keywords%3Dartificial%2Bplants%26qid%3D1627567849%26sr%3D8-59-spons%26psc%3D1&qualifier=1627567849&id=7564575310286118&widgetName=sp_btf
"CAAJIB Artificial Flower Plant with Ceramic Pot (Golden, Blue)  ",,Sponsored,,"₹1,999",₹699,"Save ₹1,300 (65%)",3.3 out of 5 stars,3,https://www.amazon.in/gp/slredirect/picassoRedirect.html/ref=pa_sp_btf_aps_sr_pg1_1?ie=UTF8&adId=A00730141VEWAJYX76ZDC&url=%2FCAAJIB-Flower-Ceramic-Pot-Blue%2Fdp%2FB08ZSYN44K%2Fref%3Dsr_1_60_sspa%3Fdchild%3D1%26keywords%3Dartificial%2Bplants%26qid%3D1627567849%26sr%3D8-60-spons%26psc%3D1&qualifier=1627567849&id=7564575310286118&widgetName=sp_btf
Mphmi Plant Philodendron Red - Plant  ,,Sponsored,,₹499,₹299,Save ₹200 (40%),,,https://www.amazon.in/gp/slredirect/picassoRedirect.html/ref=pa_sp_atf_next_aps_sr_pg2_1?ie=UTF8&adId=A10457781H0ZW3DLREFF0&url=%2FMphmi-Plant-Philodendron-Red%2Fdp%2FB08ZYPRHD6%2Fref%3Dsr_1_49_sspa%3Fdchild%3D1%26keywords%3Dartificial%2Bplants%26qid%3D1627567873%26sr%3D8-49-spons%26psc%3D1&qualifier=1627567873&id=7483051033045747&widgetName=sp_atf_next
Mphmi Plant Philodendron Congo plant Philodendron Tatei - Plant Philodendron Congo Philodendron Tatei  ,,Sponsored,,₹499,₹299,Save ₹200 (40%),1.0 out of 5 stars,1,https://www.amazon.in/gp/slredirect/picassoRedirect.html/ref=pa_sp_atf_next_aps_sr_pg2_1?ie=UTF8&adId=A037849238CNHF083V2MS&url=%2FMphmi-Plant-Philodendron-Congo-plant%2Fdp%2FB08ZYR2XFP%2Fref%3Dsr_1_50_sspa%3Fdchild%3D1%26keywords%3Dartificial%2Bplants%26qid%3D1627567873%26sr%3D8-50-spons%26psc%3D1&qualifier=1627567873&id=7483051033045747&widgetName=sp_atf_next
Mphmi Loving Touch - Air Plant  ,,Sponsored,,₹499,₹299,Save ₹200 (40%),,,https://www.amazon.in/gp/slredirect/picassoRedirect.html/ref=pa_sp_atf_next_aps_sr_pg2_1?ie=UTF8&adId=A05739692E1ZDND4HA3SW&url=%2FMphmi-Loving-Touch-Air-Plant%2Fdp%2FB08SXP4V9P%2Fref%3Dsr_1_51_sspa%3Fdchild%3D1%26keywords%3Dartificial%2Bplants%26qid%3D1627567873%26sr%3D8-51-spons%26psc%3D1&qualifier=1627567873&id=7483051033045747&widgetName=sp_atf_next
"Artificial Creeper Plants Leaves Greenery Hanging| Height 6.5 Feet (Mix 11, 2)  ",,Sponsored,,₹775,₹220,Save ₹555 (72%),,,https://www.amazon.in/gp/slredirect/picassoRedirect.html/ref=pa_sp_atf_next_aps_sr_pg2_1?ie=UTF8&adId=A086849330HE8RN2UXX4P&url=%2FArtificial-Creeper-Plants-Greenery-Hanging%2Fdp%2FB099QVVTR3%2Fref%3Dsr_1_52_sspa%3Fdchild%3D1%26keywords%3Dartificial%2Bplants%26qid%3D1627567873%26sr%3D8-52-spons%26psc%3D1&qualifier=1627567873&id=7483051033045747&widgetName=sp_atf_next
Artificial Plant with Wooden Pot Home and Office Decor  ,,,,₹299,₹170,Save ₹129 (43%),,,https://www.amazon.in/Artificial-Plant-Wooden-Office-Decor/dp/B09832BVDY/ref=sr_1_53?dchild=1&keywords=artificial+plants&qid=1627567873&sr=8-53
"BK Mart Big Areca Palm Money Plant Tree with 18 Long Leaves Bonsai Artificial Plant with Pot (70 cm, Green, 1 Piece)  ",,,,"₹1,599",₹810,Save ₹789 (49%),4.2 out of 5 stars,25,https://www.amazon.in/BK-Areca-Leaves-Bonsai-Artificial/dp/B085LRQ1LT/ref=sr_1_54?dchild=1&keywords=artificial+plants&qid=1627567873&sr=8-54
"MTBRO Artificial Grass for Dogs, Professional Potty Training Grass, Super Soft and Durable Outdoor Grass Mat, Realistic Artificial Turf Rug for Patio, Easy Clean, 3 Feet X 5 Feet  ",,,,"₹2,990","₹2,490",Save ₹500 (17%),4.2 out of 5 stars,47,https://www.amazon.in/MTBRO-Artificial-Professional-Training-Realistic/dp/B07TDFDNQP/ref=sr_1_55?dchild=1&keywords=artificial+plants&qid=1627567873&sr=8-55
Beautiful Artificial Grass with Square Shape Pot | Bonsai Plant & Tree | Bonsai Tree for Indoor Office Home Decor Showpiece Pack 0f 2 pc(Off White)  ,,,,₹399,₹189,Save ₹210 (53%),,,https://www.amazon.in/Beautiful-Artificial-Square-Bonsai-Showpiece/dp/B09B2S6N6G/ref=sr_1_56?dchild=1&keywords=artificial+plants&qid=1627567873&sr=8-56
"Fancy Mart Fabric, Wood & Plastic Artificial Round Plant (26 cm x 26 cm x 33 cm, Green)  ",,,,"₹1,165",₹488,Save ₹677 (58%),4.0 out of 5 stars,214,https://www.amazon.in/Fancy-Mart-Plastic-Artificial-pot-1833/dp/B07C8HFMNM/ref=sr_1_57?dchild=1&keywords=artificial+plants&qid=1627567873&sr=8-57
HYPERBOLES Artificial Bonsai Plant with Pot - 6 Inch/15 cm  ,,,,₹699,₹198,Save ₹501 (72%),4.2 out of 5 stars,6,https://www.amazon.in/HYPERBOLES-Artificial-Bonsai-Plant-Pot/dp/B0979H3R45/ref=sr_1_58?dchild=1&keywords=artificial+plants&qid=1627567873&sr=8-58
Chumbak Artificial Plant with Planter (Purple)  ,,,,"₹2,495","₹1,747",Save ₹748 (30%),5.0 out of 5 stars,1,https://www.amazon.in/Chumbak-Snake-Artificial-Plant-Planter/dp/B08DVC5GJJ/ref=sr_1_59?dchild=1&keywords=artificial+plants&qid=1627567873&sr=8-59
"PolliNation Decorative Purple Bonsai Artificial Plant with White Pot (Purple, Pack of 1, 20 cm)  ",,,,"₹1,000",₹296,Save ₹704 (70%),3.7 out of 5 stars,19,https://www.amazon.in/PolliNation-Decorative-Purple-Bonsai-Artificial/dp/B08WQVWKWJ/ref=sr_1_60?dchild=1&keywords=artificial+plants&qid=1627567873&sr=8-60
Fourwalls Artificial Eucaluptus Plant with Wood Pot (Green)  ,,,,"₹1,000",₹407,Save ₹593 (59%),4.4 out of 5 stars,5,https://www.amazon.in/Fourwalls-Artificial-Eucaluptus-Leaves-Hexagon/dp/B08KG7WG6N/ref=sr_1_61?dchild=1&keywords=artificial+plants&qid=1627567873&sr=8-61
"Outgeek Artificial Succulent Plants: Faux Succulents Unpotted Fake Succulent Plants Green, Premium Crafting DIY Floral Decor for Home Garden Office Party (High Realistic), 7 Pieces  ",,,,"₹1,602",₹899,Save ₹703 (44%),4.2 out of 5 stars,321,https://www.amazon.in/Outgeek-Artificial-Succulent-Fashion-Decorative/dp/B082F9N951/ref=sr_1_62?dchild=1&keywords=artificial+plants&qid=1627567873&sr=8-62
