name,badge_1,badge_2,badge_3,mrp,discounted_price,discount,rating,rating_count,link
Men's Solid Plain Jogger Pant,BUY 1 GET 1,,,1299,₹1099,,,,
Desert Beige Cotton Jogger Pants,BUY 2 GET 1,,,1699,₹999,,,,
Jet Black Casual Jogger Pants,BUY 2 GET 1,,,,₹899,,,,
Men's Cargo Zipper Joggers,BUY 1 GET 1,,,1899,₹1449,,,,
Pageant Blue Basic Jogger Pants,BUY 2 GET 1,,,1299,₹799,,,,
Plain Cut and Sew Joggers,BUY 1 GET 1,,,1599,₹1199,,,,
Black Basic Jogger Pants,,,,1299,₹999,,,,
Plain  Casual Color Block Jogger Pant,BUY 1 GET 1,,,1399,₹1099,,,,
Dark Olive Cotton Jogger Pants,BUY 2 GET 1,,,1699,₹999,,,,
Care Free Cargo Joggers Pants,,COLOR OF THE MONTH,,1599,₹749,,,,
Retro Red Side Panel Joggers,,,,1499,₹799,,,,
Sky Blue Cotton Jogger Pants,BUY 2 GET 1,,,1699,₹999,,,,
Jet Black Cotton Jogger Pants,BUY 1 GET 1,,,1699,₹1299,,,,
Pageant Blue Men's Drop Crotch Joggers,BUY 1 GET 1,,,1299,₹1199,,,,
Navy Blue Casual Jogger Pants,BUY 2 GET 1,,,,₹899,,,,
Re - Imagined Side Panel Joggers,BUY 2 GET 1,,,1599,₹899,,,,
Color Don't Bother AOP Joggers,BUY 2 GET 1,,,1499,₹899,,,,
Sage Green Cotton Jogger Pants,,,,1699,₹1049,,,,
Plain Cargo Zipper joggers,BUY 1 GET 1,,,1899,₹1449,,,,
Jet Black Plus Size Casual Jogger Pants,,,,1299,₹999,,,,
Atlantic Deep Men's Core Joggers,,,,1299,₹849,,,,
Men's True Indigo Joggers with Side Tape,,,,1999,₹899,,,,
Men's Drop Crotch Plain Joggers Pant,,,,1299,₹849,,,,
Wine Red Cotton Jogger Pants,BUY 2 GET 1,,,1699,₹999,,,,
Navy Blue Cotton Joggers Pants,BUY 1 GET 1,,,1699,₹1249,,,,
Coca-Cola Color Block Jogger,BUY 2 GET 1,,FEW LEFT,,₹799,,,,
Meteor Grey Men's Plain Casual Jogger With Elastic at Ankle,BUY 2 GET 1,,,1399,₹1049,,,,
Men's True Indigo Joggers,,,,1499,₹799,,,,
Dark Forest Green Zipper Jogger,BUY 2 GET 1,,,1299,₹799,,,,
Pageant Blue Men's Core Joggers,,,,1299,₹849,,,,
Men's Melange Joggers,,,,1149,₹499,,,,
Men's Melange Joggers,,,,1149,₹499,,,,
Navy Blue Plus Size Casual Jogger Pants,,,,1299,₹999,,,,
Dark Forest Green Casual Jogger Pants,BUY 2 GET 1,,,,₹899,,,,
Charcoal Grey Cotton Joggers Pants,BUY 2 GET 1,,,1699,₹999,,,,
Dark Grey Plus Size Casual Jogger Pants,BUY 2 GET 1,,,1299,₹899,,,,
Black Men's Plain Casual Jogger With Elastic at Ankle,BUY 2 GET 1,,,1399,₹1049,,,,
Beach Blue Color Block Joggers,,,,1299,₹799,,,,
Men's Cut and Sew Joggers,,,,1599,₹1199,,,,
Peageant Blue Men's Plain Casual Jogger With Elastic at Ankle,BUY 2 GET 1,,,1399,₹1049,,,,
Black Pride Basic Joggers's,,,FEW LEFT,1399,₹899,,,,
Fugazee Grey Ombre Distressed Joggers,,,,1999,₹800,,,,
Plain Badge Joggers,BUY 1 GET 1,,FEW LEFT,1399,₹1099,,,,
Mickey Silhouette AOP Joggers (DL),,,,1399,₹799,,,,
Sky Blue Casual Jogger Pants With Zipper,,,,1299,₹499,,,,
Status Quo White Track,BUY 1 GET 1,,,1499,₹999,,,,
Hashtag Blue Sport Trim Jogger,BUY 2 GET 1,,,1949,₹899,,,,
KKR Logo 2.0 Basic Casual Joggers,BUY 1 GET 1,,,1499,₹1399,,,,
Badass Number Sports Trim Joggers,BUY 2 GET 1,,FEW LEFT,1599,₹899,,,,
Dark Maroon Jogger Pants,,,,1299,₹499,,,,
Kkr Est 2008 Joggers,BUY 1 GET 1,,,1499,₹1399,,,,
Black-Neon Lime Reflector Jogger,BUY 2 GET 1,,,1699,₹899,,,,
Superman Casual Badge Jogger Pants,BUY 2 GET 1,,,1399,₹899,,,,
White Pride Side Panel Jogger's,,,FEW LEFT,1399,₹899,,,,
Retro Red Sports Trim Joggers,,,,1499,₹799,,,,
Status Quo Men's Anthra Melange Joggers,BUY 1 GET 1,,FEW LEFT,699,₹599,,,,
Superman minimal (SML) AOP Jogger Pants,,,,1399,₹799,,,,
Pageant Blue Drop Crotch Joggers Pant,BUY 2 GET 1,,,1299,₹899,,,,
Men's Cut and Sew Joggers,BUY 2 GET 1,,,1599,₹1049,,,,
Black Camo Neon Stripe Casual Jogger,,,,1499,₹799,,,,
Men's Cargo Zipper Joggers,,,,1899,₹1799,,,,
Coca-Cola Color Block Jogger,BUY 2 GET 1,,,,₹899,,,,
Dark Grey Casual Jogger Pant,BUY 2 GET 1,,,999,₹799,,,,
Fugazee Grey Nylon Cargo Pocket Trackpant,,,,1999,₹1199,,,,
Black Men's Drop Crotch Joggers,,,,1299,₹849,,,,
Status Quo Men's Grey Melange Joggers,BUY 1 GET 1,,FEW LEFT,699,₹599,,,,
Dark Red Plus Size Casual Jogger Pants,,,,1299,₹999,,,,
Fugazee Black Patched Distressed Joggers,,,,1999,₹1000,,,,
Campus Sutra Men Stylish Evening & Sports Trackpant,,,,1799,₹1079,,,,
Dark Navy Chino Joggers,,,,1499,₹999,,,,
Plain Casual Colour Block Jogger Pant,BUY 1 GET 1,,FEW LEFT,1399,₹1099,,,,
Status Quo Navy Plain Joggers,BUY 1 GET 1,,,1599,₹999,,,,
Dark Navy-Neon Green Reflector Jogger,BUY 2 GET 1,,,1699,₹849,,,,
Men's Marble Effect Tye N Dye print Joggers,,,FEW LEFT,1499,₹899,,,,
Fugazee Black Rainbow Reflective Jogger,,,,1599,₹1119,,,,
Moss Green Casual Jogger Pant,BUY 2 GET 1,,FEW LEFT,999,₹899,,,,
Royal Logo Side Tape Casual Joggers,,,,1499,₹799,,,,
Status Quo Black Plain Joggers,BUY 1 GET 1,,FEW LEFT,1599,₹999,,,,
Beach Blue Color Block Joggers,,,,1399,₹799,,,,
Fugazee White Crime Scene Joggers,,,FEW LEFT,1599,₹1039,,,,
Arcade Green Side Panel Casual Jogger,,,,1099,₹999,,,,
Campus Sutra Men Stylish Striped Casual & Evening Trackpants,,,,1799,₹899,,,,
Men's Melange Zipper Joggers,BUY 1 GET 1,,,1249,₹999,,,,
Jet Black Diagonal Pocket Joggers,BUY 2 GET 1,,,1399,₹999,,,,
Men's Melange Joggers,BUY 2 GET 1,,,1149,₹799,,,,
India ink Casual Jogger Pant,BUY 1 GET 1,,,1399,₹999,,,,
Men's Melange Joggers,BUY 2 GET 1,LAST SIZES LEFT - SPECIAL PRICE,,1149,₹899,,,,
Jet Black Casual Jogger Pants With Zipper,BUY 2 GET 1,,,1299,₹999,,,,
Dark Maroon Casual Jogger Pant,BUY 2 GET 1,,,999,₹899,,,,
Fugazee Black And Rose Velour Trackpant,,,FEW LEFT,1999,₹1299,,,,
Men's Melange Zipper Joggers,BUY 1 GET 1,,,1249,₹999,,,,
Arcade Green Color Bloack Jogger,,,,1099,₹599,,,,
Orange Rush Side Panel Jogger,,,,1099,₹599,,,,
Jet Black Men's Ottoman Panel Jogger,BUY 1 GET 1,,FEW LEFT,1399,₹1099,,,,
Cherry Red Color Block Joggers,,LAST SIZES LEFT - SPECIAL PRICE,,1099,₹799,,,,
Fugazee Black Nylon Zipped Cargo Pocket Trackpant,,,,1999,₹1099,,,,
Fugazee Black Reflective Cargo Taped Joggers,,,,1699,₹1104,,,,
Sky Blue Casual Jogger Pant,BUY 2 GET 1,,,999,₹899,,,,
Men's Cut and Sew Joggers,,,,1599,₹1499,,,,
Dark Grey Jogger Pants With Zipper,BUY 2 GET 1,,,1299,₹999,,,,
