name,badge_1,mrp,discounted_price,discount,rating,rating_count,link
MAX Solid Shirt Dress,,"₹ 1,199",,,,,https://www.maxfashion.in/in/en/SHOP-Max-Green-MAX-Solid-Shirt-Dress/p/1000009267430-Green-Green
MAX Textured Lace A-Line Dress,New,"₹ 1,399",,,,,https://www.maxfashion.in/in/en/SHOP-Max-Black-MAX-Textured-Lace-A-Line-Dress/p/1000009881301-Black-Black
MAX Floral Print Wrap Dress,New,"₹ 1,199",,,,,https://www.maxfashion.in/in/en/SHOP-Max-Beige-MAX-Floral-Print-Wrap-Dress/p/1000009966265-Beige-Ivory
MAX Floral Print Three-Quarter Sleeves Maxi Dress,New,"₹ 1,299",,,,,https://www.maxfashion.in/in/en/SHOP-Max-Blue-MAX-Floral-Print-Three-Quarter-Sleeves-Maxi-Dress/p/1000009966397-Green-Green
MAX Solid Shirt Dress with Sash Tie-Up,,₹ 999,,,,,https://www.maxfashion.in/in/en/SHOP-Max-Red-MAX-Solid-Shirt-Dress-with-Sash-Tie-Up/p/1000009741892-Yellow-Gold
MAX Polka Dot Print Sleeveless Midi Dress,New,"₹ 1,299",,,,,https://www.maxfashion.in/in/en/SHOP-Max-Peach-MAX-Polka-Dot-Print-Sleeveless-Midi-Dress/p/1000010086489-Multicolour-M
MAX Solid Shirt Dress,New,"₹ 1,199",,,,,https://www.maxfashion.in/in/en/SHOP-Max-Pink-MAX-Solid-Shirt-Dress/p/1000009965481-Pink-Pink
MAX Solid Sheath Dress with Cap Sleeves,New,"₹ 1,199",,,,,https://www.maxfashion.in/in/en/SHOP-Max-Black-MAX-Solid-Sheath-Dress-with-Cap-Sleeves/p/1000009881288-Black-Black
MAX Floral Print Sheath Dress with Ruched Sleeves,,₹ 999,,,,,https://www.maxfashion.in/in/en/SHOP-Max-Green-MAX-Floral-Print-Sheath-Dress-with-Ruched-Sleeves/p/1000009733036-Green-Green
MAX Leaf Print V-neck Fit and Flare Dress,Buy 3 at 40% Off,₹ 899,,,,,https://www.maxfashion.in/in/en/SHOP-Max-Beige-MAX-Leaf-Print-V-neck-Fit-and-Flare-Dress/p/1000009223364-Beige-Ivory
MAX Printed Short Sleeves A-line Dress,New,"₹ 1,199",,,,,https://www.maxfashion.in/in/en/SHOP-Max-Blue-MAX-Printed-Short-Sleeves-A-line-Dress/p/1000009966368-Blue-Blue
MAX Polka Dot Print Asymmetric Dress,New,"₹ 1,199",,,,,https://www.maxfashion.in/in/en/SHOP-Max-White-MAX-Polka-Dot-Print-Asymmetric-Dress/p/1000009966339-Beige-Ivory
MAX Solid Knee-Length Dress with Knot Detail,New,"₹ 1,299",,,,,https://www.maxfashion.in/in/en/SHOP-Max-Pink-MAX-Solid-Knee-Length-Dress-with-Knot-Detail/p/1000009881464-Pink-Pink
MAX Ribbed Sheath Dress with Surplice Neck,Buy 3 at 40% Off,"₹ 1,299",,,,,https://www.maxfashion.in/in/en/SHOP-Max-Black-MAX-Ribbed-Sheath-Dress-with-Surplice-Neck/p/1000009229272-Black-Black
MAX Striped A-line Dress,New,"₹ 1,399",,,,,https://www.maxfashion.in/in/en/SHOP-Max-White-MAX-Striped-A-line-Dress/p/1000010208581-Beige-Ivory
MAX Striped Sleeveless A-line Dress,New,₹ 999,,,,,https://www.maxfashion.in/in/en/SHOP-Max-Beige-MAX-Striped-Sleeveless-A-line-Dress/p/1000010078053-Beige-Cream
MAX Solid Three-quarter Sleeves Shift Dress,,"₹ 1,199",,,,,https://www.maxfashion.in/in/en/SHOP-Max-Blue-MAX-Solid-Three-quarter-Sleeves-Shift-Dress/p/1000009697196-Blue-Darkblue
MAX Floral Print A-line Dress,New,₹ 899,,,,,https://www.maxfashion.in/in/en/SHOP-Max-Yellow-MAX-Floral-Print-A-line-Dress/p/1000010031015-Multicolour-Flp
MAX Solid A-line Dress,New,"₹ 1,299",,,,,https://www.maxfashion.in/in/en/SHOP-Max-Brown-MAX-Solid-A-line-Dress/p/1000010092354-Brown-Brown
MAX Printed A-Line Dress,New,"₹ 1,199",,,,,https://www.maxfashion.in/in/en/SHOP-Max-Red-MAX-Printed-A-Line-Dress/p/1000009966324-Red-Red
MAX Solid Three-Quarter Sleeves A-line Dress,,"₹ 1,299",,,,,https://www.maxfashion.in/in/en/SHOP-Max-Blue-MAX-Solid-Three-Quarter-Sleeves-A-line-Dress/p/1000009316505-Blue-Lightblue
MAX Floral Print Sleeveless Midi Dress,,"₹ 1,199",,,,,https://www.maxfashion.in/in/en/SHOP-Max-Beige-MAX-Floral-Print-Sleeveless-Midi-Dress/p/1000009044905-Beige-Ivory
MAX Animal Print Three-quarter Sleeves Sheath Dress,,"₹ 1,399",,,,,https://www.maxfashion.in/in/en/SHOP-Max-Black-MAX-Animal-Print-Three-quarter-Sleeves-Sheath-Dress/p/1000009719105-Black-Black
MAX Striped V-neck Sleeveless A-line Dress,,"₹ 1,299",,,,,https://www.maxfashion.in/in/en/SHOP-Max-Pink-MAX-Striped-V-neck-Sleeveless-A-line-Dress/p/1000009719118-Pink-Blush
MAX Ribbed Sheath Dress with Belted Waist,,"₹ 1,299",,,,,https://www.maxfashion.in/in/en/SHOP-Max-Red-MAX-Ribbed-Sheath-Dress-with-Belted-Waist/p/1000009718966-Yellow-Gold
MAX Solid Midi Dress,Buy 3 at 40% Off,"₹ 1,299",,,,,https://www.maxfashion.in/in/en/SHOP-Max-Green-MAX-Solid-Midi-Dress/p/1000009342179-Green-Sage
MAX Striped Shirt Dress,,"₹ 1,199",,,,,https://www.maxfashion.in/in/en/SHOP-Max-Yellow-MAX-Striped-Shirt-Dress/p/1000008924108-Yellow-Sand
MAX Floral Print Asymmetric Dress,New,"₹ 1,199",,,,,https://www.maxfashion.in/in/en/SHOP-Max-Green-MAX-Floral-Print-Asymmetric-Dress/p/1000009966339-Green-Green
MAX Solid Sleeveless Sheath Dress with Tie-Up,,"₹ 1,199",,,,,https://www.maxfashion.in/in/en/SHOP-Max-Black-MAX-Solid-Sleeveless-Sheath-Dress-with-Tie-Up/p/1000009718953-Black-Black
MAX Solid Three-quarter Sleeves Midi Dress,,₹ 999,,,,,https://www.maxfashion.in/in/en/SHOP-Max-Yellow-MAX-Solid-Three-quarter-Sleeves-Midi-Dress/p/1000009741732-Yellow-Yellow
MAX Floral Print Short Sleeves A-line Dress,,₹ 899,,,,,https://www.maxfashion.in/in/en/SHOP-Max-Blue-MAX-Floral-Print-Short-Sleeves-A-line-Dress/p/1000009796258-Blue-Blue
MAX Floral Embroidered A-Line Dress,,"₹ 1,049",,,,,https://www.maxfashion.in/in/en/SHOP-Max-Yellow-MAX-Floral-Embroidered-A-Line-Dress/p/1000010086255-Yellow-Yellow
MAX Floral Print A-Line Dress,,"₹ 1,199",,,,,https://www.maxfashion.in/in/en/SHOP-Max-Beige-MAX-Floral-Print-A-Line-Dress/p/1000009965466-Beige-Ivory
MAX Floral Printed A-Line Dress,,"₹ 1,299",,,,,https://www.maxfashion.in/in/en/SHOP-Max-Blue-MAX-Floral-Printed-A-Line-Dress/p/1000009966499-Blue-Blue
MAX Striped A-Line Dress,New,₹ 999,,,,,https://www.maxfashion.in/in/en/SHOP-Max-Multicolour-MAX-Striped-A-Line-Dress/p/1000009876321-Beige-Ivory
MAX Roll-Up Sleeves Shift Dress,,₹ 999,,,,,https://www.maxfashion.in/in/en/SHOP-Max-Orange-MAX-Roll-Up-Sleeves-Shift-Dress/p/1000009044935-Orange-Rust
MAX Printed Three-Quarter Sleeves A-line Dress,New,"₹ 1,199",,,,,https://www.maxfashion.in/in/en/SHOP-Max-Blue-MAX-Printed-Three-Quarter-Sleeves-A-line-Dress/p/1000009965511-Blue-Blue
MAX Striped Tie-Up Waist Sheath Dress,Buy 3 at 40% Off,"₹ 1,199",,,,,https://www.maxfashion.in/in/en/SHOP-Max-Peach-MAX-Striped-Tie-Up-Waist-Sheath-Dress/p/1000009009100-Brown-Brown
MAX Striped Midi Dress with Belt,Buy 3 at 40% Off,₹ 999,,,,,https://www.maxfashion.in/in/en/SHOP-Max-Red-MAX-Striped-Midi-Dress-with-Belt/p/1000009223591-Red-Maroon
MAX Sleeveless Lace Fit & Flare Dress,Buy 3 at 40% Off,"₹ 1,299",,,,,https://www.maxfashion.in/in/en/SHOP-Max-Blue-MAX-Sleeveless-Lace-Fit-%26-Flare-Dress/p/1000008522589-Blue-Navy
MAX Striped Shirt Midi Dress,Buy 3 at 40% Off,"₹ 1,299",,,,,https://www.maxfashion.in/in/en/SHOP-Max-Green-MAX-Striped-Shirt-Midi-Dress/p/1000008924034-Green-Oliveg
MAX Dyed Midi Shirt Dress,Buy 3 at 40% Off,"₹ 1,299",,,,,https://www.maxfashion.in/in/en/SHOP-Max-Beige-MAX-Dyed-Midi-Shirt-Dress/p/1000008924019-Beige-Ivory
MAX Floral Print Midi Dress,,"₹ 1,199",,,,,https://www.maxfashion.in/in/en/SHOP-Max-Blue-MAX-Floral-Print-Midi-Dress/p/1000008885763-Blue-Blue
MAX A-line Dress with Lace Insets,Buy 3 at 40% Off,₹ 999,,,,,https://www.maxfashion.in/in/en/SHOP-Max-Blue-MAX-A-line-Dress-with-Lace-Insets/p/1000008695160-Blue-Navy
MAX Floral Print Short Sleeves A-line Dress,,₹ 999,,,,,https://www.maxfashion.in/in/en/SHOP-Max-Green-MAX-Floral-Print-Short-Sleeves-A-line-Dress/p/1000009799995-Green-Green
MAX Lace Overlay A-line Dress,Buy 3 at 40% Off,"₹ 1,399",,,,,https://www.maxfashion.in/in/en/SHOP-Max-Beige-MAX-Lace-Overlay-A-line-Dress/p/1000009229402-Beige-Beige
MAX Ribbed Sheath Dress with Belted Waist,,"₹ 1,299",,,,,https://www.maxfashion.in/in/en/SHOP-Max-Red-MAX-Ribbed-Sheath-Dress-with-Belted-Waist/p/1000009718966-Red-Maroon
MAX Striped Short Sleeves A-line Dress,Buy 3 at 40% Off,₹ 999,,,,,https://www.maxfashion.in/in/en/SHOP-Max-Green-MAX-Striped-Short-Sleeves-A-line-Dress/p/1000008443589-Red-Red
MAX Polka Dot Print Midi Dress,New,"₹ 1,299",,,,,https://www.maxfashion.in/in/en/SHOP-Max-Blue-MAX-Polka-Dot-Print-Midi-Dress/p/1000009899684-Blue-LightBlue
MAX Floral Print Fit and Flare Dress with Flutter Sleeves,,₹ 999,,,,,https://www.maxfashion.in/in/en/SHOP-Max-Yellow-MAX-Floral-Print-Fit-and-Flare-Dress-with-Flutter-Sleeves/p/1000009796245-Yellow-Yellow
MAX Floral Print Midi Dress,,"₹ 1,199",,,,,https://www.maxfashion.in/in/en/SHOP-Max-Blue-MAX-Floral-Print-Midi-Dress/p/1000008885763-Pink-Pink
MAX Solid A-line Dress with Asymmetrical Placket,Buy 3 at 40% Off,₹ 999,,,,,https://www.maxfashion.in/in/en/SHOP-Max-Red-MAX-Solid-A-line-Dress-with-Asymmetrical-Placket/p/1000008484386-Red-Red
MAX Solid Dress with Belt,Buy 3 at 40% Off,₹ 899,,,,,https://www.maxfashion.in/in/en/SHOP-Max-Pink-MAX-Solid-Dress-with-Belt/p/1000008596692-Pink-Pink
MAX Checked Sheath Dress with Slits,Buy 3 at 40% Off,"₹ 1,399",,,,,https://www.maxfashion.in/in/en/SHOP-Max-Blue-MAX-Checked-Sheath-Dress-with-Slits/p/1000009229389-Blue-Navy
MAX Printed Maxi Dress,New,"₹ 1,299",,,,,https://www.maxfashion.in/in/en/SHOP-Max-Blue-MAX-Printed-Maxi-Dress/p/1000008855746-Blue-Indigo
MAX Solid Sheath Dress with Sash Tie-Up,,"₹ 1,199",,,,,https://www.maxfashion.in/in/en/SHOP-Max-Pink-MAX-Solid-Sheath-Dress-with-Sash-Tie-Up/p/1000009706617-Pink-Blush
MAX Floral Print A-line Dress,New,₹ 799,,,,,https://www.maxfashion.in/in/en/SHOP-Max-Blue-MAX-Floral-Print-A-line-Dress/p/1000010031544-Purple-Lilac
MAX Floral Print A-Line Dress,New,"₹ 1,199",,,,,https://www.maxfashion.in/in/en/SHOP-Max-Beige-MAX-Floral-Print-A-Line-Dress/p/1000009965451-Beige-Ivory
MAX Floral Print A-line Dress,New,₹ 899,,,,,https://www.maxfashion.in/in/en/SHOP-Max-Black-MAX-Floral-Print-A-line-Dress/p/1000010031621-Black-Black
MAX Solid Shirt Dress with Belt,,"₹ 1,199",,,,,https://www.maxfashion.in/in/en/SHOP-Max-Green-MAX-Solid-Shirt-Dress-with-Belt/p/1000009733882-Orange-Rust
MAX Polka Dot Print A-line Dress,,"₹ 1,299",,,,,https://www.maxfashion.in/in/en/SHOP-Max-Blue-MAX-Polka-Dot-Print-A-line-Dress/p/1000009830164-Blue-Blue
MAX Solid Wrap Midi Dress,Buy 3 at 40% Off,"₹ 1,199",,,,,https://www.maxfashion.in/in/en/SHOP-Max-Brown-MAX-Solid-Wrap-Midi-Dress/p/1000008695333-Pink-Blush
MAX Printed Midi Dress,Buy 3 at 40% Off,"₹ 1,299",,,,,https://www.maxfashion.in/in/en/SHOP-Max-Black-MAX-Printed-Midi-Dress/p/1000008438080-Black-Black
MAX Floral Print Three-Quarter Sleeves Midi Dress,Buy 3 at 40% Off,"₹ 1,299",,,,,https://www.maxfashion.in/in/en/SHOP-Max-Pink-MAX-Floral-Print-Three-Quarter-Sleeves-Midi-Dress/p/1000009342166-Pink-Peach
MAX Printed Pinafore Dress with Textured T-shirt,Buy 3 at 40% Off,"₹ 1,399",,,,,https://www.maxfashion.in/in/en/SHOP-Max-Brown-MAX-Printed-Pinafore-Dress-with-Textured-T-shirt/p/1000009223578-Brown-Brown
MAX Off-Shoulder Empire-Waist Dress,New,₹ 899,,,,,https://www.maxfashion.in/in/en/SHOP-Max-Multicolour-MAX-Off-Shoulder-Empire-Waist-Dress/p/1000010031582-Multicolour-M
MAX Floral Lace High-Low Fit & Flare Dress,Buy 3 at 40% Off,"₹ 1,199",,,,,https://www.maxfashion.in/in/en/SHOP-Max-Blue-MAX-Floral-Lace-High-Low-Fit-%26-Flare-Dress/p/1000008695147-Blue-Navy
MAX Solid Short Sleeves A-line Dress,Buy 3 at 40% Off,₹ 999,,,,,https://www.maxfashion.in/in/en/SHOP-Max-Yellow-MAX-Solid-Short-Sleeves-A-line-Dress/p/1000008884936-Yellow-Yellow
MAX Solid Corduroy Pinafore Dress,,"₹ 1,199",,,,,https://www.maxfashion.in/in/en/SHOP-Max-Green-MAX-Solid-Corduroy-Pinafore-Dress/p/1000009697209-Green-Oliveg
MAX Polka Dot Print Short Sleeves A-line Dress,,"₹ 1,199",,,,,https://www.maxfashion.in/in/en/SHOP-Max-Peach-MAX-Polka-Dot-Print-Short-Sleeves-A-line-Dress/p/1000008884907-Yellow-Gold
MAX Polka Dot Print Eco Liva Midi Dress,Buy 3 at 40% Off,₹ 999,,,,,https://www.maxfashion.in/in/en/SHOP-Max-Peach-MAX-Polka-Dot-Print-Eco-Liva-Midi-Dress/p/1000008689731-Brown-Brown
MAX Striped Midi Dress,Buy 3 at 40% Off,"₹ 1,199",,,,,https://www.maxfashion.in/in/en/SHOP-Max-Multicolour-MAX-Striped-Midi-Dress/p/1000008695303-Beige-Ivory
MAX Textured Fit and Flare Dress,Buy 3 at 40% Off,"₹ 1,299",,,,,https://www.maxfashion.in/in/en/SHOP-Max-Blue-MAX-Textured-Fit-and-Flare-Dress/p/1000008941945-Blue-Midblue
MAX Solid Shirt Dress with Belt,,"₹ 1,199",,,,,https://www.maxfashion.in/in/en/SHOP-Max-Green-MAX-Solid-Shirt-Dress-with-Belt/p/1000009733882-Green-Oliveg
MAX Printed Cap Sleeves A-line Dress,New,"₹ 1,199",,,,,https://www.maxfashion.in/in/en/SHOP-Max-Beige-MAX-Printed-Cap-Sleeves-A-line-Dress/p/1000010019330-Beige-Beige
MAX Striped Eco Liva Collared Dress,,₹ 799,,,,,https://www.maxfashion.in/in/en/SHOP-Max-Multicolour-MAX-Striped-Eco-Liva-Collared-Dress/p/1000008689590-Multicolour-M
MAX Striped Midi Dress with Cap Sleeves,Buy 3 at 40% Off,"₹ 1,199",,,,,https://www.maxfashion.in/in/en/SHOP-Max-Blue-MAX-Striped-Midi-Dress-with-Cap-Sleeves/p/1000008867242-Blue-Navy
MAX Striped Shirt Midi Dress,Buy 3 at 40% Off,"₹ 1,299",,,,,https://www.maxfashion.in/in/en/SHOP-Max-Green-MAX-Striped-Shirt-Midi-Dress/p/1000008924034-Red-Maroon
MAX Floral Print Shirt Dress,Buy 3 at 40% Off,"₹ 1,199",,,,,https://www.maxfashion.in/in/en/SHOP-Max-Beige-MAX-Floral-Print-Shirt-Dress/p/1000008515265-Beige-Ivory
MAX Solid Midi Dress,Buy 3 at 40% Off,"₹ 1,199",,,,,https://www.maxfashion.in/in/en/SHOP-Max-Black-MAX-Solid-Midi-Dress/p/1000008695273-Black-Black
MAX Animal Print Mini Dress,Buy 3 at 40% Off,₹ 999,,,,,https://www.maxfashion.in/in/en/SHOP-Max-Beige-MAX-Animal-Print-Mini-Dress/p/1000008443627-Beige-Beige
MAX Striped Shirt Style Dress,Buy 3 at 40% Off,"₹ 1,199",,,,,https://www.maxfashion.in/in/en/SHOP-Max-Blue-MAX-Striped-Shirt-Style-Dress/p/1000008516005-Green-Oliveg
MAX Printed A-line Dress,Buy 3 at 40% Off,₹ 999,,,,,https://www.maxfashion.in/in/en/SHOP-Max-Black-MAX-Printed-A-line-Dress/p/1000008695288-Black-Black
MAX Striped Short Sleeves T-shirt Dress,Buy 3 at 40% Off,₹ 999,,,,,https://www.maxfashion.in/in/en/SHOP-Max-Blue-MAX-Striped-Short-Sleeves-T-shirt-Dress/p/1000008443524-Blue-Navy
MAX Striped Shirt Dress with Sash Tie-Up,Buy 3 at 40% Off,₹ 999,,,,,https://www.maxfashion.in/in/en/SHOP-Max-Blue-MAX-Striped-Shirt-Dress-with-Sash-Tie-Up/p/1000008884847-Blue-Lightblue
MAX Textured Midi Dress,New,"₹ 1,299",,,,,https://www.maxfashion.in/in/en/SHOP-Max-Green-MAX-Textured-Midi-Dress/p/1000010019345-Green-Green
MAX Floral Print Three-quarter Sleeves Midi Dress,,"₹ 1,199",,,,,https://www.maxfashion.in/in/en/SHOP-Max-Red-MAX-Floral-Print-Three-quarter-Sleeves-Midi-Dress/p/1000009741936-Red-Red
MAX Typographic Print Colourblocked Jersey dress,Buy 3 at 40% Off,₹ 599,,,,,https://www.maxfashion.in/in/en/SHOP-Max-Black-MAX-Typographic-Print-Colourblocked-Jersey-dress/p/1000008945853-Black-Black
MAX Solid Maxi Denim Dress,Buy 3 at 40% Off,"₹ 1,299",,,,,https://www.maxfashion.in/in/en/SHOP-Max-Blue-MAX-Solid-Maxi-Denim-Dress/p/1000009316492-Blue-Darkblue
MAX Striped Shirt Dress,New,₹ 999,,,,,https://www.maxfashion.in/in/en/SHOP-Max-Pink-MAX-Striped-Shirt-Dress/p/1000010031658-Pink-Pink
MAX Printed Three-Quarter Sleeves Midi Dress,New,₹ 999,,,,,https://www.maxfashion.in/in/en/SHOP-Max-White-MAX-Printed-Three-Quarter-Sleeves-Midi-Dress/p/1000010092309-White-White
MAX Solid Midi Dress,Buy 3 at 40% Off,"₹ 1,199",,,,,https://www.maxfashion.in/in/en/SHOP-Max-Black-MAX-Solid-Midi-Dress/p/1000008438050-Black-Black
MAX Checked V-neck Midi Dress,,"₹ 1,399",,,,,https://www.maxfashion.in/in/en/SHOP-Max-Black-MAX-Checked-V-neck-Midi-Dress/p/1000009342508-Black-Black
MAX Floral Print Wrap Dress with Surplice Neck,Buy 3 at 40% Off,₹ 899,,,,,https://www.maxfashion.in/in/en/SHOP-Max-Green-MAX-Floral-Print-Wrap-Dress-with-Surplice-Neck/p/1000008689463-Green-Green
MAX Striped Button-Down A-line Maxi Dress,,"₹ 1,199",,,,,https://www.maxfashion.in/in/en/SHOP-Max-Beige-MAX-Striped-Button-Down-A-line-Maxi-Dress/p/1000008884862-Beige-Ivory
MAX Polka Dot Print Asymmetric Dress,New,"₹ 1,199",,,,,https://www.maxfashion.in/in/en/SHOP-Max-Yellow-MAX-Polka-Dot-Print-Asymmetric-Dress/p/1000009966250-Yellow-Yellow
MAX Solid A-line Dress with Tie-Up Detail,Buy 3 at 40% Off,"₹ 1,199",,,,,https://www.maxfashion.in/in/en/SHOP-Max-Blue-MAX-Solid-A-line-Dress-with-Tie-Up-Detail/p/1000008547709-Pink-Pink
MAX Floral Printed Midi Dress,,"₹ 1,199",,,,,https://www.maxfashion.in/in/en/SHOP-Max-Multicolour-MAX-Floral-Printed-Midi-Dress/p/1000009826058-Beige-Ivory
MAX Off-Shoulder Empire-Waist Dress,,₹ 999,,,,,https://www.maxfashion.in/in/en/SHOP-Max-Multicolour-MAX-Off-Shoulder-Empire-Waist-Dress/p/1000009733907-Beige-Cream
MAX Printed Sleeveless A-Line Dress,New,₹ 999,,,,,https://www.maxfashion.in/in/en/SHOP-Max-Pink-MAX-Printed-Sleeveless-A-Line-Dress/p/1000010078066-Pink-Pink
