name,badge_1,badge_2,badge_3,mrp,discounted_price,discount,rating,rating_count,link
"BRANDONN New Born Premium Hooded All Season Wrapper Cum Baby Bath Towel Cum Baby Blanket for Babies |Pack of 2 |Yellow Tiger, Pink White  ",,,,"₹1,499",₹499,"Save ₹1,000 (67%)",3.4 out of 5 stars,18,https://www.amazon.in/BRANDONN-Premium-Hooded-Wrapper-Blanket/dp/B08PS3TYVZ/ref=sr_1_53?dchild=1&keywords=baby+towels&qid=1626888520&sr=8-53
Mom's Pride® Baby Cotton Washcloths | Napkin Hankies Soft Cotton Face Towels Pack of 8 (Assorted Color)  ,,,,₹399,₹199,Save ₹200 (50%),5.0 out of 5 stars,1,https://www.amazon.in/Moms-Pride%C2%AE-Washcloths-Hankies-Assorted/dp/B08CH65G85/ref=sr_1_54?dchild=1&keywords=baby+towels&qid=1626888520&sr=8-54
BRANDONN Baby's Tiger and Dog Design Hooded Wrapper Cum Baby Bath Towel ( Yellow and Blue ) - Pack of 2  ,,,,"₹1,499",₹499,"Save ₹1,000 (67%)",3.6 out of 5 stars,8,https://www.amazon.in/BRANDONN-Design-Hooded-Wrapper-Yellow/dp/B08PSRJPTN/ref=sr_1_55?dchild=1&keywords=baby+towels&qid=1626888520&sr=8-55
"MY NEWBORN Baby 3 in1 Baby Blanket Bath Towel Robe for boy, Girl Pink, Yellow - Pack of 2  ",,,,"₹1,800",₹474,"Save ₹1,326 (74%)",4.2 out of 5 stars,228,https://www.amazon.in/MY-NEWBORN-Blanket-Wrapper-Yellow/dp/B08LF28122/ref=sr_1_56?dchild=1&keywords=baby+towels&qid=1626888520&sr=8-56
"First Kick New Born Baby Blanket Pack of Super Soft Bathrobe Baby Wrapper Cum Baby Bath Towel for Baby Boys, Baby Girls, Babies (80cm x 80cm, 0-6 Months)  ",,,,₹999,₹349,Save ₹650 (65%),4.3 out of 5 stars,58,https://www.amazon.in/First-Kick-Blanket-Bathrobe-Wrapper/dp/B0913GML13/ref=sr_1_57?dchild=1&keywords=baby+towels&qid=1626888520&sr=8-57
BRANDONN Newborn 3-in-1 Animal Wrapper Baby Bath Towel (Hot Pink)  ,Deal of the Day ,,,₹999,₹331,Save ₹668 (67%),4.0 out of 5 stars,113,https://www.amazon.in/BRANDONN-Newborn-Wrapper-Blanket-Bathgown/dp/B07QXGJQBR/ref=sr_1_58?dchild=1&keywords=baby+towels&qid=1626888520&sr=8-58
"COMFORT WEAVE 100% Cotton Soft Baby Hooded Towels (Pack of 2 - Orange :: Yellow, Size - 28"" X 28"")  ",,Sponsored,,₹499,₹399,Save ₹100 (20%),4.2 out of 5 stars,42,https://www.amazon.in/gp/slredirect/picassoRedirect.html/ref=pa_sp_mtf_aps_sr_pg2_1?ie=UTF8&adId=A033065720RN02O6TVLD8&url=%2FCOMFORT-WEAVE-Cotton-Hooded-Towels%2Fdp%2FB08QRGVKSL%2Fref%3Dsr_1_59_sspa%3Fdchild%3D1%26keywords%3Dbaby%2Btowels%26qid%3D1626888520%26sr%3D8-59-spons%26psc%3D1&qualifier=1626888520&id=6805726633231576&widgetName=sp_mtf
"The Baby Atelier 100% Organic Green Checks Hooded Towel Set, White, Small (BABY18061)  ",,Sponsored,Only 2 left in stock.,,"₹1,300",,,,https://www.amazon.in/gp/slredirect/picassoRedirect.html/ref=pa_sp_mtf_aps_sr_pg2_1?ie=UTF8&adId=A02847212MYVCH4GUTNQE&url=%2FBaby-Atelier-Organic-Checks-Hooded%2Fdp%2FB08FB3HJHJ%2Fref%3Dsr_1_60_sspa%3Fdchild%3D1%26keywords%3Dbaby%2Btowels%26qid%3D1626888520%26sr%3D8-60-spons%26psc%3D1&qualifier=1626888520&id=6805726633231576&widgetName=sp_mtf
"Uber World Baby Kids Toddlers Cotton Towel One Sided Terry Absorbent Cute Bunny Super Soft, 89 by 50.8 CMS,Yellow, Pack of 1  ",,Sponsored,,₹399,₹349,Save ₹50 (13%),,,https://www.amazon.in/gp/slredirect/picassoRedirect.html/ref=pa_sp_mtf_aps_sr_pg2_1?ie=UTF8&adId=A06845453AS2B2MK9IG5A&url=%2FUber-World-Toddlers-Cotton-Absorbent%2Fdp%2FB098LQLDPH%2Fref%3Dsr_1_61_sspa%3Fdchild%3D1%26keywords%3Dbaby%2Btowels%26qid%3D1626888520%26sr%3D8-61-spons%26psc%3D1&qualifier=1626888520&id=6805726633231576&widgetName=sp_mtf
The Baby Atelier 100% Organic Red Floral Junior Towel  ,,Sponsored,,"₹1,200","₹1,199",Save ₹1,5.0 out of 5 stars,1,https://www.amazon.in/gp/slredirect/picassoRedirect.html/ref=pa_sp_mtf_aps_sr_pg2_1?ie=UTF8&adId=A02852451K1OZF68LRTJL&url=%2FBaby-Atelier-Organic-Floral-Junior%2Fdp%2FB08FB7SN1B%2Fref%3Dsr_1_62_sspa%3Fdchild%3D1%26keywords%3Dbaby%2Btowels%26qid%3D1626888520%26sr%3D8-62-spons%26psc%3D1&qualifier=1626888520&id=6805726633231576&widgetName=sp_mtf
"LITTLELAND Ultra Soft Premium Hooded Kids and Baby Bath Towel, 100% Cotton, 450 GSM,(Pink, Owl)  ",,,,₹999,₹799,Save ₹200 (20%),3.3 out of 5 stars,7,https://www.amazon.in/LITTLELAND-Ultra-Premium-Hooded-Cotton/dp/B092FQK9QB/ref=sr_1_63?dchild=1&keywords=baby+towels&qid=1626888520&sr=8-63
Sanvi Towel/Bath Towel / 100% Cotton Washcloth for New Born Baby/Infants/Toddlers (0-12 Months) Small (46 cm * 84 cm) (Colours & Prints Vary) (Pack of 1)  ,,,,₹499,₹225,Save ₹274 (55%),3.7 out of 5 stars,16,https://www.amazon.in/Sanvi-Washcloth-Infants-Toddlers-Colours/dp/B096QPQPF5/ref=sr_1_64?dchild=1&keywords=baby+towels&qid=1626888520&sr=8-64
"MY NEWBORN Baby Blanket Wrapper Towel Fleece for boy, Girl 0-3 Month-Combo of 2 Pink,Green  ",Deal of the Day ,,,₹800,₹255,Save ₹545 (68%),3.6 out of 5 stars,64,https://www.amazon.in/My-Newborn-Blanket-Wrapper-Babies-Combo/dp/B07KH12H3M/ref=sr_1_65?dchild=1&keywords=baby+towels&qid=1626888520&sr=8-65
MY NEWBORN Baby Hooded Towel Wrapper Blanket Fleece (35X25 Inches) -Combo of 2 Pc  ,Deal of the Day ,,,₹800,₹284,Save ₹516 (65%),3.9 out of 5 stars,51,https://www.amazon.in/My-Newborn-Wrapping-Sheet-Blanket/dp/B01NAWRWNM/ref=sr_1_66?dchild=1&keywords=baby+towels&qid=1626888520&sr=8-66
"THE LITTLE LOOKERS® Towel/Bath Towel / 100% Cotton Washcloth for New Born Baby/Infants/Toddlers in Random Prints (Lemon, Pack of 1(48X84Cm))  ",,,,₹299,₹225,Save ₹74 (25%),4.1 out of 5 stars,448,https://www.amazon.in/LITTLE-LOOKERS%C2%AE-Washcloth-Small-48x90-Multicolur/dp/B08D8G785P/ref=sr_1_67?dchild=1&keywords=baby+towels&qid=1626888520&sr=8-67
BabyButtons Cotton Washcloths Napkin Hankies Soft Nappies Face Towels Unisex | Gift Pack of 8  ,,,,,₹299,,4.1 out of 5 stars,589,https://www.amazon.in/BabyButtons-Cotton-Washcloths-Hankies-Assorted/dp/B07TP9J2BQ/ref=sr_1_68?dchild=1&keywords=baby+towels&qid=1626888520&sr=8-68
"CUTEABLY Cotton Napkins (Set of 10, Multicolour)  ",,,,₹799,₹299,Save ₹500 (63%),3.8 out of 5 stars,58,https://www.amazon.in/CuteablyTM-Washable-Reuseable-Printed-Napkins/dp/B07X5KNL8W/ref=sr_1_69?dchild=1&keywords=baby+towels&qid=1626888520&sr=8-69
"WONDERCHILD Premium Super Soft Baby Face Towels for Baby Boys and Girls, Reusable, Super Absorbent Knit Terry Cotton Baby Towels 0-18 Months, 6 Pieces  ",,,,₹845,₹395,Save ₹450 (53%),,,https://www.amazon.in/WONDERCHILD-Premium-Towels-Reusable-Absorbent/dp/B094DQWBDV/ref=sr_1_70?dchild=1&keywords=baby+towels&qid=1626888520&sr=8-70
"SOFTSPUN Microfiber Baby Face & Bath Towel Set of 3 Pieces, 40x40, 40x60 Cms & 60x120 Cms, 340 GSM (Yellow). Super Soft & Comfortable for Newborn Babies, Quick Drying, Ultra Absorbent in Large Size.  ",,,,₹699,₹449,Save ₹250 (36%),3.8 out of 5 stars,57,https://www.amazon.in/SOFTSPUN-MICROFIBER-BABY-CARE-TOWEL/dp/B01AIE95U8/ref=sr_1_71?dchild=1&keywords=baby+towels&qid=1626888520&sr=8-71
Mom's Darling Baby Bed Protector Waterproof Plastic Sheets with Towel | Urine Matress Protector Sheets | Baby Diaper Changing Sheet(0-12 Months) | Pack of 2 Piece | (L-76 cm - W-51CM) | Multicolor  ,,,,₹999,₹360,Save ₹639 (64%),,,https://www.amazon.in/Moms-Darling-Protector-Waterproof-Changing/dp/B097LPL5S6/ref=sr_1_72?dchild=1&keywords=baby+towels&qid=1626888520&sr=8-72
Mom's Darling Baby Blankets New Born Combo Pack of Hooded Teddy Face Wrapper Towel Cum Baby Blanket for Babies (Pack of 5 Multicolored Blankets)  ,,,,₹899,₹399,Save ₹500 (56%),,,https://www.amazon.in/Moms-Darling-Blankets-Wrapper-Multicolored/dp/B095N4TZ9B/ref=sr_1_73?dchild=1&keywords=baby+towels&qid=1626888520&sr=8-73
"Mee Mee Soft Absorbent Baby Towel | 100% Cotton Soft | Easy to Wrap Baby Completely (Without Hood, White)  ",,,,₹349,₹279,Save ₹70 (20%),3.8 out of 5 stars,173,https://www.amazon.in/Mee-Soft-Absorbent-Towel-White/dp/B07C5WZG2Z/ref=sr_1_74?dchild=1&keywords=baby+towels&qid=1626888520&sr=8-74
"MY NEWBORN Baby Blanket Wrapper Bath Towel- Pack of 2 Katty, GreenPuppy  ",,,,"₹1,800",₹474,"Save ₹1,326 (74%)",4.1 out of 5 stars,94,https://www.amazon.in/My-NewBorn-Hooded-Blanket-Wrapper-Combo/dp/B07MLLLB39/ref=sr_1_75?dchild=1&keywords=baby+towels&qid=1626888520&sr=8-75
Towel Baby boy ( Multicolour)  ,,,,"₹1,099",₹325,Save ₹774 (70%),,,https://www.amazon.in/PASA-Towel-Baby-boy-Multicolour/dp/B09816LDF1/ref=sr_1_76?dchild=1&keywords=baby+towels&qid=1626888520&sr=8-76
CATCUB Ultra Soft Cotton Baby Hooded Towel Combo - Pack of 2 (Blue & Green)  ,,,,₹899,₹379,Save ₹520 (58%),4.3 out of 5 stars,133,https://www.amazon.in/CATCUB-Ultra-Cotton-Hooded-Towel/dp/B08349K4VJ/ref=sr_1_77?dchild=1&keywords=baby+towels&qid=1626888520&sr=8-77
"COMFORT WEAVE 100% Cotton Soft Baby Hooded Towels (Pack of 2 - Orange :: Yellow, Size - 28"" X 28"")  ",,,,₹499,₹399,Save ₹100 (20%),4.2 out of 5 stars,42,https://www.amazon.in/COMFORT-WEAVE-Cotton-Hooded-Towels/dp/B08QRGVKSL/ref=sr_1_78?dchild=1&keywords=baby+towels&qid=1626888520&sr=8-78
