name,badge_1,badge_2,badge_3,mrp,discounted_price,discount,rating,rating_count,link
"Amazon Brand - Solimo Baby Towel/ Wrapper, Pack of 6  ",,Sponsored,,"₹1,500",₹838,Save ₹662 (44%),4.4 out of 5 stars,6,https://www.amazon.in/gp/slredirect/picassoRedirect.html/ref=pa_sp_atf_aps_sr_pg1_1?ie=UTF8&adId=A03248072UW04D0THKQ37&url=%2FAmazon-Brand-Solimo-Hooded-Wrapper%2Fdp%2FB08HD5LHS3%2Fref%3Dsr_1_1_sspa%3Fdchild%3D1%26keywords%3Dbaby%2Btowels%26qid%3D1626888503%26sr%3D8-1-spons%26psc%3D1&qualifier=1626888503&id=5426074873882338&widgetName=sp_atf
"Amazon Brand - Solimo Baby Towel/ Wrapper, Pack of 6  ",,Sponsored,,"₹1,500",₹651,Save ₹849 (57%),2.7 out of 5 stars,3,https://www.amazon.in/gp/slredirect/picassoRedirect.html/ref=pa_sp_atf_aps_sr_pg1_1?ie=UTF8&adId=A03263791N0SBL8J3EKOS&url=%2FAmazon-Brand-Solimo-Hooded-Wrapper%2Fdp%2FB08HD3ZM1T%2Fref%3Dsr_1_2_sspa%3Fdchild%3D1%26keywords%3Dbaby%2Btowels%26qid%3D1626888503%26sr%3D8-2-spons%26psc%3D1&qualifier=1626888503&id=5426074873882338&widgetName=sp_atf
Amazon Brand - Solimo Easy-Dry Hooded Baby Towel / Wrapper  ,,Sponsored,,₹900,₹310,Save ₹590 (66%),4.3 out of 5 stars,6,https://www.amazon.in/gp/slredirect/picassoRedirect.html/ref=pa_sp_atf_aps_sr_pg1_1?ie=UTF8&adId=A0325699BH56A8PYYCMQ&url=%2FAmazon-Brand-Solimo-Easy-Dry-Wrapper%2Fdp%2FB08HD45XYL%2Fref%3Dsr_1_3_sspa%3Fdchild%3D1%26keywords%3Dbaby%2Btowels%26qid%3D1626888503%26sr%3D8-3-spons%26psc%3D1&qualifier=1626888503&id=5426074873882338&widgetName=sp_atf
Amazon Brand - Solimo Easy-Dry Hooded Baby Towel / Wrapper  ,,Sponsored,,₹900,₹336,Save ₹564 (63%),4.0 out of 5 stars,5,https://www.amazon.in/gp/slredirect/picassoRedirect.html/ref=pa_sp_atf_aps_sr_pg1_1?ie=UTF8&adId=A03259431TKRUILOD83I6&url=%2FAmazon-Brand-Solimo-Easy-Dry-Wrapper%2Fdp%2FB08HD44TB7%2Fref%3Dsr_1_4_sspa%3Fdchild%3D1%26keywords%3Dbaby%2Btowels%26qid%3D1626888503%26sr%3D8-4-spons%26psc%3D1&qualifier=1626888503&id=5426074873882338&widgetName=sp_atf
My Newborn Baby Ultrasoft Towel for All Seasons- 112cm x 56 cm (Pack of 2 Pcs- Pink and Sky)  ,,,,₹600,₹425,Save ₹175 (29%),4.2 out of 5 stars,359,https://www.amazon.in/Newborn-Ultrasoft-Towel-Seasons-112cm/dp/B07TYWKMQT/ref=sr_1_5?dchild=1&keywords=baby+towels&qid=1626888503&sr=8-5
Mee Mee Soft Absorbent Baby Towel (Pink)  ,,,,₹449,₹362,Save ₹87 (19%),4.4 out of 5 stars,141,https://www.amazon.in/Mee-Soft-Absorbent-Baby-Towel/dp/B07LBQ517M/ref=sr_1_6?dchild=1&keywords=baby+towels&qid=1626888503&sr=8-6
Billy Bum Washcloth for New Born 100% Hosiery Cotton/Reusable Extra Soft Face Towels washcloth for Babies (7 pieces) Color may vary (Pack of 1)  ,Best seller,,,,₹199,,3.8 out of 5 stars,"1,488",https://www.amazon.in/gp/bestsellers/baby/1953127031/ref=sr_bs_6_1953127031_1
"BRANDONN Fleece Single Newborn 3-in-1 Rabbit Wrapper Baby Bath Towel (Pink), 1 Piece  ",Deal of the Day ,,,₹999,₹329,Save ₹670 (67%),4.1 out of 5 stars,835,https://www.amazon.in/BRANDONN-Newborn-Wrapper-Blanket-Bathgown/dp/B07QZNY1HR/ref=sr_1_8?dchild=1&keywords=baby+towels&qid=1626888503&sr=8-8
Brandonn New Born Baby Blanket Cum Baby Bath Towel Cum Baby Bath Robe Combo Pack of 2  ,,,,"₹1,499",₹499,"Save ₹1,000 (67%)",4.1 out of 5 stars,152,https://www.amazon.in/BRANDONN-Ultra-Luxury-Hooded-Fleece/dp/B07NBZNSLD/ref=sr_1_9?dchild=1&keywords=baby+towels&qid=1626888503&sr=8-9
"linenaffairs Organic Cotton Baby Muslin Washcloth 250 GSM (Set Of 10, Random Colors)  ",Amazon's Choice,,,₹399,₹250,Save ₹149 (37%),4.1 out of 5 stars,"1,673",https://www.amazon.in/Swaddle-wrap-New-Born-Blankets/dp/B07W933M9J/ref=ice_ac_b_dpb?dchild=1&keywords=baby+towels&qid=1626888503&sr=8-10
"THE LITTLE LOOKERS® Towel/Bath Towel / 100% Cotton Washcloth for New Born Baby/Infants/Toddlers in Random Prints (Pink & Blue, Pack of 2(48X84Cm))  ",,,,₹499,₹399,Save ₹100 (20%),4.1 out of 5 stars,448,https://www.amazon.in/LITTLE-Washcloth-Small-48x90-Multicolur-Pack/dp/B08D8H6YRZ/ref=sr_1_11?dchild=1&keywords=baby+towels&qid=1626888503&sr=8-11
"Brandonn Premium Hooded Blanket Cum Wrapping Sheet for Babies (Multicolor, 3 Pieces, 26inchx29inch)  ",Deal of the Day ,,,₹799,₹329,Save ₹470 (59%),3.6 out of 5 stars,"2,044",https://www.amazon.in/Brandonn-Premium-Wrapping-Multicolor-27inchx30inch/dp/B01C9OACJS/ref=sr_1_12?dchild=1&keywords=baby+towels&qid=1626888503&sr=8-12
Mee Mee Soft Absorbent Baby Towel (Blue)  ,,,,₹449,₹344,Save ₹105 (23%),4.3 out of 5 stars,131,https://www.amazon.in/Mee-Soft-Absorbent-Baby-Towel/dp/B07LBQ9N6L/ref=sr_1_13?dchild=1&keywords=baby+towels&qid=1626888503&sr=8-13
"First Kick New Born Baby Blanket Pack of Super Soft Bathrobe Baby Wrapper Cum Baby Bath Towel for Baby Boys, Baby Girls, Babies (80cm x 80cm, 0-6 Months)  ",,,,₹999,₹349,Save ₹650 (65%),4.3 out of 5 stars,58,https://www.amazon.in/First-Kick-Blanket-Bathrobe-Wrapper/dp/B0914W6TZ7/ref=sr_1_14?dchild=1&keywords=baby+towels&qid=1626888503&sr=8-14
DALUCI Fleece Baby Blankets New Born Hooded Wrapper 3-in-1 Cum Baby Bath Towel (Pink Rabbit)  ,,,,₹999,₹319,Save ₹680 (68%),4.3 out of 5 stars,7,https://www.amazon.in/DALUCI-Fleece-Blankets-Hooded-Wrapper/dp/B08ZDKF1YS/ref=sr_1_15?dchild=1&keywords=baby+towels&qid=1626888503&sr=8-15
"Cotton Bath Towel (Set of 1, Multicolour)  ",,,,₹999,₹599,Save ₹400 (40%),3.9 out of 5 stars,7,https://www.amazon.in/Drying-Absorbent-Animal-Printed-Assorted/dp/B08QS2Q4TG/ref=sr_1_16?dchild=1&keywords=baby+towels&qid=1626888503&sr=8-16
Adriel 8-Piece Gerber Hosiery Soft Cotton Newborn Face Towels (Multicolour)  ,,,,₹199,₹146,Save ₹53 (27%),3.6 out of 5 stars,"1,691",https://www.amazon.in/Adriel-8-Piece-Hosiery-Newborn-Multicolour/dp/B072V8STVH/ref=sr_1_17?dchild=1&keywords=baby+towels&qid=1626888503&sr=8-17
"First Kick New Born Baby Blanket Pack of Super Soft Bathrobe Baby Wrapper Cum Baby Bath Towel for Baby Boys, Baby Girls, Babies (80cm x 80cm, 0-6 Months)  ",,,,₹999,₹349,Save ₹650 (65%),4.3 out of 5 stars,58,https://www.amazon.in/First-Kick-Blanket-Bathrobe-Wrapper/dp/B09134JRY7/ref=sr_1_18?dchild=1&keywords=baby+towels&qid=1626888503&sr=8-18
"LuvLap Premium Baby Washcloth for New Born, 100% Hosiery Cotton Cloth, Washable, Reusable, Absorbent, Extra Soft Face Towels/Washcloth for Babies, 7 Pcs, Cactus, Baloon Print  ",,,,₹210,₹174,Save ₹36 (17%),4.0 out of 5 stars,79,https://www.amazon.in/Premium-Washcloth-Washable-Reusable-Absorbent/dp/B091L8J6GF/ref=sr_1_19?dchild=1&keywords=baby+towels&qid=1626888503&sr=8-19
"BeyBee Bed Protector Sheet (Small (50cm X 70cm), Salmon Rose)  ",Best seller,,,₹199,₹139,Save ₹60 (30%),4.3 out of 5 stars,"19,594",https://www.amazon.in/gp/bestsellers/baby/1953382031/ref=sr_bs_19_1953382031_1
"DOTMOM Bamboo Hooded Towel 500 GSM (Pack of 1, Grey)  ",,Sponsored,,"₹3,299","₹1,599","Save ₹1,700 (52%)",4.5 out of 5 stars,2,https://www.amazon.in/gp/slredirect/picassoRedirect.html/ref=pa_sp_mtf_aps_sr_pg1_1?ie=UTF8&adId=A013702820WA4AZEZEBIO&url=%2FDOTMOM-Bamboo-Hooded-Towel-Pack%2Fdp%2FB094JXH6P2%2Fref%3Dsr_1_21_sspa%3Fdchild%3D1%26keywords%3Dbaby%2Btowels%26qid%3D1626888503%26sr%3D8-21-spons%26psc%3D1&qualifier=1626888503&id=5426074873882338&widgetName=sp_mtf
Petit Clouds Monogram Hooded Towel- 100% Pure Organic Cotton. 550 GSM. Extra Soft & Highly Absorbent. 75 cm X 75 cm  ,,Sponsored,,"₹1,650","₹1,450",Save ₹200 (12%),,,https://www.amazon.in/gp/slredirect/picassoRedirect.html/ref=pa_sp_mtf_aps_sr_pg1_1?ie=UTF8&adId=A02921853086AL4KIYQ3E&url=%2FPetit-Clouds-Monogram-Organic-Absorbent%2Fdp%2FB08NK6XBWT%2Fref%3Dsr_1_22_sspa%3Fdchild%3D1%26keywords%3Dbaby%2Btowels%26qid%3D1626888503%26sr%3D8-22-spons%26psc%3D1&qualifier=1626888503&id=5426074873882338&widgetName=sp_mtf
A Baby Cherry - Organic Bamboo Hooded Baby Towel || Ultra Absorbent & Ultra Soft || Organic Cotton Towel for Infants & Toddlers ||Perfect Baby Shower Gift || 500 GSM (Grey)  ,,Sponsored,,"₹1,599",₹999,Save ₹600 (38%),4.2 out of 5 stars,43,https://www.amazon.in/gp/slredirect/picassoRedirect.html/ref=pa_sp_mtf_aps_sr_pg1_1?ie=UTF8&adId=A03534883GEC39M0Y1GR1&url=%2FBaby-Cherry-Absorbent-Organic-Toddlers%2Fdp%2FB08HYFNLVT%2Fref%3Dsr_1_23_sspa%3Fdchild%3D1%26keywords%3Dbaby%2Btowels%26qid%3D1626888503%26sr%3D8-23-spons%26psc%3D1&qualifier=1626888503&id=5426074873882338&widgetName=sp_mtf
"Karthi’s StarBaby Soft Jacquard 100% Cotton Hooded Towel, Wrapper, Swaddle Cloth -Pack of 2 (Pink & Yellow)  ",,Sponsored,,,,,,,https://www.amazon.in/gp/slredirect/picassoRedirect.html/ref=pa_sp_mtf_aps_sr_pg1_1?ie=UTF8&adId=A008697321V0RF6S1KZN9&url=%2FKarthis-StarBaby-Jacquard-Wrapper-Swaddle%2Fdp%2FB095KQX8RN%2Fref%3Dsr_1_24_sspa%3Fdchild%3D1%26keywords%3Dbaby%2Btowels%26qid%3D1626888503%26sr%3D8-24-spons%26psc%3D1&qualifier=1626888503&id=5426074873882338&widgetName=sp_mtf
"LuvLap Premium Baby Washcloth for New Born, 100% Hosiery Cotton Cloth, Washable, Reusable, Absorbent, Extra Soft Face Towels/Washcloth for Babies, 7 Pcs, Animal, Numbers Print  ",,,,₹210,₹174,Save ₹36 (17%),4.0 out of 5 stars,79,https://www.amazon.in/Premium-Washcloth-Washable-Reusable-Absorbent/dp/B091MC38LJ/ref=sr_1_25?dchild=1&keywords=baby+towels&qid=1626888503&sr=8-25
Sathiyas 100% Soft Cotton Baby Hooded Towels - Pack of 2 (Orange || Blue1)  ,,,,₹898,₹449,Save ₹449 (50%),4.1 out of 5 stars,"1,857",https://www.amazon.in/Sathiyas-100-Cotton-Hooded-Towels/dp/B07372YF88/ref=sr_1_26?dchild=1&keywords=baby+towels&qid=1626888503&sr=8-26
"MY NEWBORN Baby Blanket Soft Wrapper Towel - Combo of 3, Sky Blue, 0-3 Months  ",Limited time deal,,,"₹1,700",₹339,"Save ₹1,361 (80%)",3.8 out of 5 stars,"1,787",https://www.amazon.in/My-Newborn-Fleece-Hooded-Blanket/dp/B073FNS9LW/ref=sr_1_27?dchild=1&keywords=baby+towels&qid=1626888503&sr=8-27
Billy Bum Washcloth for New Born 100% Hosiery Cotton/Reusable Extra Soft Face Towels washcloth for Babies (7 pieces) Color may vary (Pack of 1)  ,Best seller,,,,₹199,,4.1 out of 5 stars,"2,044",https://www.amazon.in/gp/bestsellers/baby/1953127031/ref=sr_bs_27_1953127031_1
My Newborn Baby Blanket Wrapper Hooded Sleeping Bag -Pink  ,Deal of the Day ,,,₹900,₹299,Save ₹601 (67%),4.2 out of 5 stars,64,https://www.amazon.in/Newborn-Blanket-Wrapper-Hooded-Sleeping/dp/B08RWBS4KM/ref=sr_1_29?dchild=1&keywords=baby+towels&qid=1626888503&sr=8-29
"BRANDONN Fleece Single Hooded Wrapper Towel, Blue , 1 Towel  ",,,,₹999,₹331,Save ₹668 (67%),4.1 out of 5 stars,344,https://www.amazon.in/BRANDONN-Ultra-Luxury-Hooded-Fleece/dp/B07NBQCVZR/ref=sr_1_30?dchild=1&keywords=baby+towels&qid=1626888503&sr=8-30
"Teri Beri Cotton Bath Towel (Set Of 2, Multicolour)  ",,,,₹500,₹399,Save ₹101 (20%),3.5 out of 5 stars,130,https://www.amazon.in/Teri-Beri-Cotton-Towel-Multicolour/dp/B08QGPP71W/ref=sr_1_31?dchild=1&keywords=baby+towels&qid=1626888503&sr=8-31
"BRANDONN Fleece Single Wrapper Blanket, Multicolour, Single, Pack of 1  ",Deal of the Day ,,,₹999,₹312,Save ₹687 (69%),4.2 out of 5 stars,"2,443",https://www.amazon.in/BRANDONN-Newborn-Wrapper-Blanket-Bathgown/dp/B075ZBR5K4/ref=sr_1_32?dchild=1&keywords=baby+towels&qid=1626888503&sr=8-32
"BRANDONN Baby Boy's and Girl's Terry Cotton Baby Bath Towel Cum Baby Wrapper Towel (White, Blue, 0-2 Years) - Combo of 2  ",Deal of the Day ,,,₹599,₹331,Save ₹268 (45%),3.6 out of 5 stars,130,https://www.amazon.in/BRANDONN-Girls-Terry-Cotton-Wrapper/dp/B08X1BSNDT/ref=sr_1_33?dchild=1&keywords=baby+towels&qid=1626888503&sr=8-33
Uber World Baby Bath Towels Super Soft Flannel Fleece 260 GSM Size - 120 x 60 cms Muti-Color Pack of 3  ,,,,₹999,₹699,Save ₹300 (30%),3.7 out of 5 stars,151,https://www.amazon.in/Uber-World-Towel-Sherin-Polywool/dp/B0814FMW2L/ref=sr_1_34?dchild=1&keywords=baby+towels&qid=1626888503&sr=8-34
"BRANDONN Baby Boy's And Girl's Terry Cotton Bath Towel (Blue And Mango, 0-2 Years) - Pack of 2  ",Deal of the Day ,,,₹999,₹331,Save ₹668 (67%),3.7 out of 5 stars,398,https://www.amazon.in/BRANDONN-Girls-Terry-Cotton-Towel/dp/B06ZXZ44XM/ref=sr_1_35?dchild=1&keywords=baby+towels&qid=1626888503&sr=8-35
"Brandonn Premium Quality Rainbow A/C Baby Blanket Cum Baby Wrapper (Multicolor, Pack of 4, 4 Pieces)  ",Deal of the Day ,,,"₹1,600",₹331,"Save ₹1,269 (79%)",3.8 out of 5 stars,"1,619",https://www.amazon.in/Brandonn-Premium-Quality-Rainbow-Multicolor/dp/B06W2L53DC/ref=sr_1_36?dchild=1&keywords=baby+towels&qid=1626888503&sr=8-36
"Mom's Darling Baby Bed Protector Waterproof Plastic Sheets with Towel, Urine Matress Protector Sheets, Baby Diaper Changing Sheet(0-12 Months)/Pack of 3 Piece/(L-61 cm - W-46CM)/Multicolor.  ",,,,₹899,₹360,Save ₹539 (60%),3.0 out of 5 stars,2,https://www.amazon.in/Moms-Darling-Protector-Waterproof-Changing/dp/B0968JWB2Y/ref=sr_1_37?dchild=1&keywords=baby+towels&qid=1626888503&sr=8-37
"BRANDONN Fleece Single Baby Blanket Cum Bath Towel, White, Pack of 1  ",Deal of the Day ,,,₹999,₹312,Save ₹687 (69%),4.1 out of 5 stars,215,https://www.amazon.in/BRANDONN-Newborn-Designer-Ultrasoft-Blanket/dp/B07CKKJ8F7/ref=sr_1_38?dchild=1&keywords=baby+towels&qid=1626888503&sr=8-38
"FDSHIP Baby Square Cotton Organic Bamboo Absorbent Reusable Face Towels, 10x10 Inches/0-18 Months (Multicolour) - Pack of 5  ",,,,"₹1,000",₹415,Save ₹585 (59%),4.2 out of 5 stars,117,https://www.amazon.in/FDSHIP-Organic-Absorbent-Reusable-Multicolour/dp/B07S6H53ZT/ref=sr_1_39?dchild=1&keywords=baby+towels&qid=1626888503&sr=8-39
"Trance Home Linen® Super Soft 100% Cotton Malmal Swaddle Cloth |Baby Blanket |Swaddle Wrap |Baby Shower Gift Set (100 x 100 cm , Multi_Nursery Design - Pack of 3)  ",,,,₹799,₹499,Save ₹300 (38%),4.0 out of 5 stars,119,https://www.amazon.in/Trance-Home-Swaddle-Blanket-Multi_Nursery/dp/B08Y6JPZC5/ref=sr_1_40?dchild=1&keywords=baby+towels&qid=1626888503&sr=8-40
"MOM CARE Cotton Face Towels (Set Of 5, White)  ",Deal of the Day ,,,"₹1,500",₹689,Save ₹811 (54%),4.4 out of 5 stars,550,https://www.amazon.in/Newborn-Hankies-Organic-Reusable-Toddlers/dp/B088ZXBB8B/ref=sr_1_41?dchild=1&keywords=baby+towels&qid=1626888503&sr=8-41
"LuvLap Premium Baby Washcloths, 7 Pcs, Giraffe Print  ",,,,₹210,₹174,Save ₹36 (17%),4.0 out of 5 stars,79,https://www.amazon.in/LuvLap-Premium-Washcloths-Giraffe-Print/dp/B091M4RYFW/ref=sr_1_42?dchild=1&keywords=baby+towels&qid=1626888503&sr=8-42
CATCUB Ultra Soft Cotton Baby Hooded Towel Combo - Pack of 2 (Blue & Pink)  ,,,,₹899,₹379,Save ₹520 (58%),4.3 out of 5 stars,133,https://www.amazon.in/CATCUB-Ultra-Cotton-Hooded-Towel/dp/B0834BD4ND/ref=sr_1_43?dchild=1&keywords=baby+towels&qid=1626888503&sr=8-43
Mee Mee Soft Absorbent Organic Baby Towel | Bamboo Cotton Baby Towel (White)  ,,,,₹699,₹525,Save ₹174 (25%),4.0 out of 5 stars,3,https://www.amazon.in/Mee-Absorbent-Organic-Bamboo-Cotton/dp/B091Z55ZYJ/ref=sr_1_44?dchild=1&keywords=baby+towels&qid=1626888503&sr=8-44
My Newborn Baby Ultrasoft Towel for All Seasons- 112cm x 56 cm (2 pcs-Yellow and Pink)  ,,,,₹600,₹425,Save ₹175 (29%),4.2 out of 5 stars,359,https://www.amazon.in/Newborn-Ultrasoft-Towel-Seasons-pcs-Yellow/dp/B07TXVM9VV/ref=sr_1_45?dchild=1&keywords=baby+towels&qid=1626888503&sr=8-45
"MY NEWBORN Baby Bath towel Wrapper with cartoon hood Blue, pink -Pack of 2  ",,,,"₹1,800",₹470,"Save ₹1,330 (74%)",4.1 out of 5 stars,210,https://www.amazon.in/My-NewBorn-Hooded-Wrapper-Multicolour/dp/B07P28FXQV/ref=sr_1_46?dchild=1&keywords=baby+towels&qid=1626888503&sr=8-46
"BRANDONN Fleece Bath Towel (Pack of 2, Pink, Yellow)  ",Deal of the Day ,,,"₹1,499",₹521,Save ₹978 (65%),4.2 out of 5 stars,207,https://www.amazon.in/Brandonn-Hooded-Wrapper-Blanket-PinkWhite/dp/B08CDZMNFN/ref=sr_1_47?dchild=1&keywords=baby+towels&qid=1626888503&sr=8-47
MY NEWBORN Baby Blanket Sleeping Bag Towel Wrapper-Set of 2 Pc  ,Best seller,,,"₹1,800",₹502,"Save ₹1,298 (72%)",4.3 out of 5 stars,"2,223",https://www.amazon.in/gp/bestsellers/baby/1953389031/ref=sr_bs_47_1953389031_1
"BRANDONN Fleece Single Hooded Wrapper Bath Towel, Blue , 1 Towel  ",Deal of the Day ,,,₹999,₹312,Save ₹687 (69%),4.3 out of 5 stars,60,https://www.amazon.in/BRANDONN-Newborn-Wrapper-Blanket-Bathgown/dp/B07QVHBH6F/ref=sr_1_49?dchild=1&keywords=baby+towels&qid=1626888503&sr=8-49
"Uber World Baby Kids Toddlers Cotton Towel One Sided Terry Absorbent Cute Bunny Super Soft, 89 by 50.8 CMS,Sky Blue, Pack of 1  ",,,,₹399,₹349,Save ₹50 (13%),,,https://www.amazon.in/Uber-World-Toddlers-Cotton-Absorbent/dp/B098LRHYQ6/ref=sr_1_50?dchild=1&keywords=baby+towels&qid=1626888503&sr=8-50
MY NEWBORN Baby Blanket Wrapper Soft Towel with Hood-Pink Katty  ,,,,₹900,₹308,Save ₹592 (66%),3.7 out of 5 stars,11,https://www.amazon.in/MY-NEWBORN-Blanket-Wrapper-Hood-Pink/dp/B0967JXFPM/ref=sr_1_51?dchild=1&keywords=baby+towels&qid=1626888503&sr=8-51
"BRANDONN New Born Baby Blanket Pack of Super Soft Bathrobe Baby Wrapper Cum Baby Bath Towel for Baby Boys, Baby Girls, Babies (80cm x 80cm, 0-6 Months)  ",Deal of the Day ,,,₹999,₹312,Save ₹687 (69%),3.9 out of 5 stars,13,https://www.amazon.in/BRANDONN-Blanket-Bathrobe-Wrapper-Babies/dp/B092M8X7BX/ref=sr_1_52?dchild=1&keywords=baby+towels&qid=1626888503&sr=8-52
"Amazon Brand - Solimo Baby Towel/ Wrapper, Pack of 6  ",,,,"₹1,500",₹651,Save ₹849 (57%),2.7 out of 5 stars,3,https://www.amazon.in/Amazon-Brand-Solimo-Hooded-Wrapper/dp/B08HD3ZM1T/ref=sr_1_53?dchild=1&keywords=baby+towels&qid=1626888503&sr=8-53
"Amazon Brand - Solimo Hooded Baby Towel/ Wrapper, Pack of 2  ",,,,₹900,₹531,Save ₹369 (41%),4.1 out of 5 stars,13,https://www.amazon.in/Amazon-Brand-Solimo-Hooded-Wrapper/dp/B08HD457C7/ref=sr_1_54?dchild=1&keywords=baby+towels&qid=1626888503&sr=8-54
Sanvi Towel/Bath Towel / 100% Cotton Washcloth for New Born Baby/Infants/Toddlers (0-12 Months) Small (46 cm * 84 cm) (Colours & Prints Vary) (Pack of 2)  ,,,,₹499,₹337,Save ₹162 (32%),3.7 out of 5 stars,16,https://www.amazon.in/Sanvi-Washcloth-Infants-Toddlers-Colours/dp/B09528XLV3/ref=sr_1_55?dchild=1&keywords=baby+towels&qid=1626888503&sr=8-55
MY NEWBORN Baby Blanket Wrapper Fleece Towels-Gift Hamper Pack of 5  ,,,,"₹2,500",₹569,"Save ₹1,931 (77%)",3.8 out of 5 stars,41,https://www.amazon.in/MY-NEWBORN-Blanket-Wrapper-Towels-Value/dp/B08ZYV338T/ref=sr_1_56?dchild=1&keywords=baby+towels&qid=1626888503&sr=8-56
"Amazon Brand - Solimo Baby Towel/ Wrapper, Pack of 6  ",,Sponsored,,"₹1,500","₹1,065",Save ₹435 (29%),4.0 out of 5 stars,26,https://www.amazon.in/gp/slredirect/picassoRedirect.html/ref=pa_sp_btf_aps_sr_pg1_1?ie=UTF8&adId=A0577395SK6XGPXOGYO0&url=%2FAmazon-Brand-Solimo-Towel-Wrapper%2Fdp%2FB08HD46ZQD%2Fref%3Dsr_1_57_sspa%3Fdchild%3D1%26keywords%3Dbaby%2Btowels%26qid%3D1626888503%26sr%3D8-57-spons%26psc%3D1&qualifier=1626888503&id=5426074873882338&widgetName=sp_btf
Amazon Brand - Solimo Easy-Dry Hooded Baby Towel / Wrapper  ,,Sponsored,,₹900,₹418,Save ₹482 (54%),4.4 out of 5 stars,4,https://www.amazon.in/gp/slredirect/picassoRedirect.html/ref=pa_sp_btf_aps_sr_pg1_1?ie=UTF8&adId=A03249631UK2VXMSOUZOH&url=%2FAmazon-Brand-Solimo-Easy-Dry-Wrapper%2Fdp%2FB08HD59LTY%2Fref%3Dsr_1_58_sspa%3Fdchild%3D1%26keywords%3Dbaby%2Btowels%26qid%3D1626888503%26sr%3D8-58-spons%26psc%3D1&qualifier=1626888503&id=5426074873882338&widgetName=sp_btf
"Quick Dry SilQ Baby Bath Towels for Newborn Babies, Combo of 2, Pink - White, 60 cm x 90 cm | Ultra Soft & Fast Drying Towel for Toddlers & Kids - Perfect Newborn or Baby Shower Gift Pack  ",,Sponsored,,,₹598,,3.9 out of 5 stars,308,https://www.amazon.in/gp/slredirect/picassoRedirect.html/ref=pa_sp_btf_aps_sr_pg1_1?ie=UTF8&adId=A080464635DU517IRWDUR&url=%2FQuick-Towels-Newborn-Babies-Combo%2Fdp%2FB08L4T6XJ9%2Fref%3Dsr_1_59_sspa%3Fdchild%3D1%26keywords%3Dbaby%2Btowels%26qid%3D1626888503%26sr%3D8-59-spons%26psc%3D1&qualifier=1626888503&id=5426074873882338&widgetName=sp_btf
"MOM CARE Cotton Bath Towel (Set of 1, Multicolour)  ",Deal of the Day ,Sponsored,,₹800,₹489,Save ₹311 (39%),4.0 out of 5 stars,9,https://www.amazon.in/gp/slredirect/picassoRedirect.html/ref=pa_sp_btf_aps_sr_pg1_1?ie=UTF8&adId=A04312323KW1TLMMK9UO6&url=%2FMOM-CARE-Wrappers-Reusable-Toddlers%2Fdp%2FB08P5H5CB1%2Fref%3Dsr_1_60_sspa%3Fdchild%3D1%26keywords%3Dbaby%2Btowels%26qid%3D1626888503%26sr%3D8-60-spons%26psc%3D1&qualifier=1626888503&id=5426074873882338&widgetName=sp_btf
"Karthi’s StarBaby Soft Jacquard 100% Cotton Hooded Towel, Wrapper, Swaddle Cloth -Pack of 2 (Pink & Orange)  ",,Sponsored,,,,,,,https://www.amazon.in/gp/slredirect/picassoRedirect.html/ref=pa_sp_atf_next_aps_sr_pg2_1?ie=UTF8&adId=A008730927HB4V96R7NQ8&url=%2FKarthis-StarBaby-Jacquard-Wrapper-Swaddle%2Fdp%2FB095KN9WF1%2Fref%3Dsr_1_49_sspa%3Fdchild%3D1%26keywords%3Dbaby%2Btowels%26qid%3D1626888520%26sr%3D8-49-spons%26psc%3D1&qualifier=1626888520&id=6805726633231576&widgetName=sp_atf_next
DOTMOM Premium Ultra Soft 100% Organic Bamboo 3 in 1 Baby Hooded Bath Towel (White)  ,,Sponsored,,"₹2,999","₹1,299","Save ₹1,700 (57%)",4.5 out of 5 stars,75,https://www.amazon.in/gp/slredirect/picassoRedirect.html/ref=pa_sp_atf_next_aps_sr_pg2_1?ie=UTF8&adId=A08762971CLN4U1HHYFQZ&url=%2FDOTMOM-Premium-Organic-Bamboo-Hooded%2Fdp%2FB084RLL8FF%2Fref%3Dsr_1_50_sspa%3Fdchild%3D1%26keywords%3Dbaby%2Btowels%26qid%3D1626888520%26sr%3D8-50-spons%26psc%3D1&qualifier=1626888520&id=6805726633231576&widgetName=sp_atf_next
Petit Clouds - Freddy Hooded Towel-Baby Blue- 100% Pure Organic Cotton.550 GSM. Extra Soft & Highly Absorbent. 75 cm X 75 cm  ,,Sponsored,,,"₹1,650",,,,https://www.amazon.in/gp/slredirect/picassoRedirect.html/ref=pa_sp_atf_next_aps_sr_pg2_1?ie=UTF8&adId=A02922413OGF3AF0QGUCG&url=%2FPetit-Clouds-Towel-Baby-Cotton-550-Absorbent%2Fdp%2FB08NK6CYFL%2Fref%3Dsr_1_51_sspa%3Fdchild%3D1%26keywords%3Dbaby%2Btowels%26qid%3D1626888520%26sr%3D8-51-spons%26psc%3D1&qualifier=1626888520&id=6805726633231576&widgetName=sp_atf_next
"LITTLELAND Ultra Soft Premium Hooded Kids and Baby Bath Towel, 100% Cotton, 450 GSM, (Blue, Shark)  ",,Sponsored,,₹999,₹799,Save ₹200 (20%),3.3 out of 5 stars,7,https://www.amazon.in/gp/slredirect/picassoRedirect.html/ref=pa_sp_atf_next_aps_sr_pg2_1?ie=UTF8&adId=A02583212FNATIUJ7SISZ&url=%2FLITTLELAND-Ultra-Premium-Hooded-Cotton%2Fdp%2FB092G1SRPW%2Fref%3Dsr_1_52_sspa%3Fdchild%3D1%26keywords%3Dbaby%2Btowels%26qid%3D1626888520%26sr%3D8-52-spons%26psc%3D1&qualifier=1626888520&id=6805726633231576&widgetName=sp_atf_next
"MOM CARE Face Towels for Newborn Baby, Muslin Cloth for Babies Extra Soft Hankies Organic Cotton Reusable Napkin Ideal for Infants Toddlers (Pack of 3) White  ",Deal of the Day ,,,₹900,₹489,Save ₹411 (46%),4.4 out of 5 stars,550,https://www.amazon.in/Newborn-Hankies-Organic-Reusable-Toddlers/dp/B088X1TXHF/ref=sr_1_53?dchild=1&keywords=baby+towels&qid=1626888520&sr=8-53
"LazyToddler Cotton Swaddle wrap Useful as Blanket and Towel, Made up of Organic Muslin for New Born Baby Set of 3 (Size 100cm X 100cm) (Fox-Tringle- Rainbow Design )  ",,,,₹999,₹699,Save ₹300 (30%),4.7 out of 5 stars,9,https://www.amazon.in/LazyToddler-Swaddle-Blanket-Organic-Fox-Tringle/dp/B0912YFX5F/ref=sr_1_54?dchild=1&keywords=baby+towels&qid=1626888520&sr=8-54
MY NEWBORN Baby Towel Bathrobe Hooded Blanket Wrapper - Pink Katty  ,,,,₹900,₹312,Save ₹588 (65%),4.1 out of 5 stars,622,https://www.amazon.in/My-Newborn-Premium-Quality-Hooded/dp/B07BPFM4NS/ref=sr_1_55?dchild=1&keywords=baby+towels&qid=1626888520&sr=8-55
"LuvLap 100% Cotton Muslin Baby Swaddles, Stars White Print, 0-18M+, Pack of 3  ",,,,₹839,₹549,Save ₹290 (35%),4.5 out of 5 stars,641,https://www.amazon.in/LuvLap-100-Cotton-Muslin-Swaddles/dp/B07Y1X2V11/ref=sr_1_56?dchild=1&keywords=baby+towels&qid=1626888520&sr=8-56
MY NEWBORN Fleece Baby Blanket Wrapper for Babies -Combo of 5 Pc  ,Limited time deal,,,"₹2,000",₹399,"Save ₹1,601 (80%)",4.0 out of 5 stars,553,https://www.amazon.in/My-Newborn-Wrapper-Blanket-Multicolor/dp/B01MEF6IVM/ref=sr_1_57?dchild=1&keywords=baby+towels&qid=1626888520&sr=8-57
"Beautiq Baby Collections Multipurpose Baby Hooded Wrapper,Towel,Blanket,Swaddle Cloth - Pure Cotton for Baby's Care - for Born Baby (0 to 9 Months) Whale Beach Design  ",,,,₹500,₹299,Save ₹201 (40%),3.0 out of 5 stars,1,https://www.amazon.in/Beautiq-Baby-Collections-Multipurpose-Wrapper/dp/B098214LMM/ref=sr_1_58?dchild=1&keywords=baby+towels&qid=1626888520&sr=8-58
"Trance Home Linen® Super Soft 100% Cotton Malmal Face Towels for Newborn Baby | Wash Cloth for Babies | Extra Soft Hankies | Cotton Reusable Napkins | Ideal for Infants Toddlers ( Small 40 x 40 cm , Nursery Designs - Pack of 10 )  ",,,Only 2 left in stock.,₹499,₹299,Save ₹200 (40%),4.0 out of 5 stars,119,https://www.amazon.in/Trance-Home-Newborn-Reusable-Toddlers/dp/B08ZJD97JK/ref=sr_1_49?dchild=1&keywords=baby+towels&qid=1626888520&sr=8-49
"First Kick New Born Baby Blanket Pack of Super Soft Bathrobe Baby Wrapper Cum Baby Bath Towel for Baby Boys, Baby Girls, Babies (80cm x 80cm, 0-6 Months)  ",,,,₹999,₹349,Save ₹650 (65%),4.2 out of 5 stars,29,https://www.amazon.in/First-Kick-Blanket-Bathrobe-Wrapper/dp/B0913BWGWX/ref=sr_1_50?dchild=1&keywords=baby+towels&qid=1626888520&sr=8-50
Koochie-Koo Muslin 100% Cotton Baby Reusable Extra Soft 6 Layer Washcloths/Napkins/Hankey/Towel – Random Print (25 * 50/3)  ,Best seller,,,"₹1,099",₹499,Save ₹600 (55%),4.4 out of 5 stars,9,https://www.amazon.in/gp/bestsellers/baby/1953388031/ref=sr_bs_2_1953388031_1
"MY NEWBORN Baby Bath Towel Hooded Wrapper Yellow, Pink- Pack of 2  ",,,,"₹1,800",₹474,"Save ₹1,326 (74%)",3.9 out of 5 stars,24,https://www.amazon.in/MY-NEWBORN-Hooded-Wrapper-Yellow/dp/B091B8RDC9/ref=sr_1_52?dchild=1&keywords=baby+towels&qid=1626888520&sr=8-52
