name,badge_1,badge_2,badge_3,mrp,discounted_price,discount,rating,rating_count,link
Vinod Furniture Wooden Solid Sheesham Wood Dining Table 4 Seater | Dining Table Set with 3 Chairs & 1 Bench | Home Dining Room Furniture Teak Wood Dining Table 4 Seater | Honey Finish  ,,Sponsored,,,,,4.3 out of 5 stars,65,https://www.amazon.in/gp/slredirect/picassoRedirect.html/ref=pa_sp_atf_aps_sr_pg1_1?ie=UTF8&adId=A026888430BG4H7UJ5UQX&url=%2FVinod-Furniture-Wooden-Sheesham-Dining%2Fdp%2FB08BX5DFF1%2Fref%3Dsr_1_1_sspa%3Fdchild%3D1%26keywords%3Ddining%2Bset%26qid%3D1628354753%26sr%3D8-1-spons%26psc%3D1&qualifier=1628354753&id=5522207872016623&widgetName=sp_atf
@home by Nilkamal Peak Four Seater Dining Table Set (Cappucino)  ,Deal of the Day ,Sponsored,,"₹34,500","₹17,999","Save ₹16,501 (48%)",3.3 out of 5 stars,76,https://www.amazon.in/gp/slredirect/picassoRedirect.html/ref=pa_sp_atf_aps_sr_pg1_1?ie=UTF8&adId=A06907223FWIOOHDMBUII&url=%2Fhome-Nilkamal-Seater-Dining-Cappucino%2Fdp%2FB01IPD1GXI%2Fref%3Dsr_1_2_sspa%3Fdchild%3D1%26keywords%3Ddining%2Bset%26qid%3D1628354753%26sr%3D8-2-spons%26psc%3D1&qualifier=1628354753&id=5522207872016623&widgetName=sp_atf
@home by Nilkamal Janet 4 Seater Dining Table Set (Clear)  ,,Sponsored,,"₹32,500","₹16,499","Save ₹16,001 (49%)",3.9 out of 5 stars,19,https://www.amazon.in/gp/slredirect/picassoRedirect.html/ref=pa_sp_atf_aps_sr_pg1_1?ie=UTF8&adId=A0808104E76ZI1A5C4ZC&url=%2Fhome-Nilkamal-Janet-Seater-Dining%2Fdp%2FB07ND55DWB%2Fref%3Dsr_1_3_sspa%3Fdchild%3D1%26keywords%3Ddining%2Bset%26qid%3D1628354753%26sr%3D8-3-spons%26psc%3D1&qualifier=1628354753&id=5522207872016623&widgetName=sp_atf
Vinod Furniture Sheesham Teak Wood Wooden Dining Table 4 Seater Wood Dining Set | 4 Seater Dining Table Set | Living Room | Dining Room Furniture | Wooden Dining 4 Chairs |Brown Provincial Teak  ,,Sponsored,,,,,3.5 out of 5 stars,3,https://www.amazon.in/gp/slredirect/picassoRedirect.html/ref=pa_sp_atf_aps_sr_pg1_1?ie=UTF8&adId=A026832836Y9W5NG18YDG&url=%2FVinod-Furniture-Sheesham-Wooden-Provincial%2Fdp%2FB08KL1ZNV2%2Fref%3Dsr_1_4_sspa%3Fdchild%3D1%26keywords%3Ddining%2Bset%26qid%3D1628354753%26sr%3D8-4-spons%26psc%3D1&qualifier=1628354753&id=5522207872016623&widgetName=sp_atf
Royaloak Milan Four Seater Dining Table Set (Black)  ,Amazon's ChoiceLimited time deal,,,"₹19,230","₹14,999","Save ₹4,231 (22%)",4.0 out of 5 stars,325,https://www.amazon.in/Royaloak-Milan-Seater-Dining-Table/dp/B016WO17MC/ref=ice_ac_b_dpb?dchild=1&keywords=dining+set&qid=1628354753&smid=AT95IG9ONZD7S&sr=8-5
"Custom Decor Six Seater Dining Table Set (Brown) (6 Seater Dining Table, Honey Teak with Foster Chair)  ",Deal of the Day ,,,"₹49,999","₹28,499","Save ₹21,500 (43%)",4.3 out of 5 stars,43,https://www.amazon.in/Custom-Decor-Seater-Dining-Foster/dp/B07GYR3TCL/ref=sr_1_6?dchild=1&keywords=dining+set&qid=1628354753&sr=8-6
Home Centre Diana 6-Seater Dining Table with 4 Chairs and 1 Big Bench (Walnut)  ,Best sellerDeal of the Day ,,,"₹49,875","₹19,949","Save ₹29,926 (60%)",3.9 out of 5 stars,88,https://www.amazon.in/gp/bestsellers/kitchen/5689415031/ref=sr_bs_6_5689415031_1
KendalWood™ Furniture  Sheesham Wood Dining Table(57x35 inch) with 6 Chairs | 6 Seater Dining Set | Wooden Dining Table with Chair - Dining Room Furniture ( Natural Teak Finish with Cushion)  ,,,,"₹50,000","₹31,999","Save ₹18,001 (36%)",3.7 out of 5 stars,23,https://www.amazon.in/KendalWoodTM-Furniture-Sheesham-Dining-Chairs-Seater/dp/B08J473KSS/ref=sr_1_8?dchild=1&keywords=dining+set&qid=1628354753&sr=8-8
Porash Furniture CNC Cuting Sheesham Wood Dining Table 4 Seater Set | Wooden 4 Seater Dining Furniture | 4 Chairs with Cushion Teak Wood Dining Table Set Furniture for Living Room (Honey Finish)  ,,,,"₹25,299","₹17,499","Save ₹7,800 (31%)",4.5 out of 5 stars,7,https://www.amazon.in/Porash-Furniture-Cuting-Sheesham-Cushion/dp/B08X3CVSTZ/ref=sr_1_9?dchild=1&keywords=dining+set&qid=1628354753&sr=8-9
Royaloak Coco Dining Table Set with 4 Chairs (Walnut)  ,Deal of the Day ,,,"₹30,750","₹18,499","Save ₹12,251 (40%)",3.5 out of 5 stars,104,https://www.amazon.in/Royaloak-Dining-Table-Chairs-Walnut/dp/B015XPTES0/ref=sr_1_10?dchild=1&keywords=dining+set&qid=1628354753&sr=8-10
Home Centre Montoya 4 Seater Dining Table Set with Chair  ,Deal of the Day ,,,"₹37,150","₹19,689","Save ₹17,461 (47%)",4.0 out of 5 stars,204,https://www.amazon.in/Home-Centre-Montoya-Seater-Dining/dp/B07W56B6J6/ref=sr_1_11?dchild=1&keywords=dining+set&qid=1628354753&sr=8-11
KendalWood™ Furniture Sheesham Wood CNC Cuting Dining Table with 4 Chairs with 1 Bench|6 Seater Dining Set- Dining Room Furniture (Finish Color:-Honey Teak with Cream Cushion)  ,,,,"₹40,000","₹29,999","Save ₹10,001 (25%)",3.4 out of 5 stars,43,https://www.amazon.in/KendalWood-Furniture-Sheesham-Cuting-Cushion/dp/B088PNKQ44/ref=sr_1_12?dchild=1&keywords=dining+set&qid=1628354753&sr=8-12
Stream Furniture Solid Wood 4 Seater Dining Table Set with 3 Chairs and 1 Bench for Living Room | Home & Office Furniture | Hotel & Dinner Restaurant | Honey Finish  ,,,,"₹20,000","₹17,199","Save ₹2,801 (14%)",4.5 out of 5 stars,10,https://www.amazon.in/Stream-Furniture-Seater-Dining-Restaurant/dp/B08W3GZCWG/ref=sr_1_13?dchild=1&keywords=dining+set&qid=1628354753&sr=8-13
"MV Furniture Dining Table with Chairs & Chusion | Dining Room Furniture | 6 Seater Dining Set, Teak Finish | 6 Chairs + Blue Cushions| Wood Type : Sheesham Wood  ",,,,"₹45,799","₹28,567","Save ₹17,232 (38%)",4.8 out of 5 stars,10,https://www.amazon.in/MV-Furniture-Dining-Chusion-Cushions/dp/B0848XNL4H/ref=sr_1_14?dchild=1&keywords=dining+set&qid=1628354753&sr=8-14
"Mamta Decoration Sheesham Wood Dining Set for Living Room (4 Seater, 4 Chair & Table (Brown)  ",Deal of the Day ,,,"₹21,839","₹15,499","Save ₹6,340 (29%)",4.2 out of 5 stars,395,https://www.amazon.in/Decoration-Sheesham-Dining-Living-Seater/dp/B07M72H4TF/ref=sr_1_15?dchild=1&keywords=dining+set&qid=1628354753&sr=8-15
Furinno Sheesham Wood 4 Seater Dining Table Set with Chairs for Home Living Room Hall (Warm Chestnut Finish)  ,,,,"₹29,999","₹20,212","Save ₹9,787 (33%)",3.5 out of 5 stars,27,https://www.amazon.in/Furinno-Sheesham-Seater-Dining-Chestnut/dp/B08HPZPFNJ/ref=sr_1_16?dchild=1&keywords=dining+set&qid=1628354753&sr=8-16
Mamta Decoration Sheesham Wood 4 Seater Dining Table with 3 Chairs and 1 Bench for Living Room  ,Deal of the Day ,,,"₹31,199","₹17,249","Save ₹13,950 (45%)",4.3 out of 5 stars,160,https://www.amazon.in/Decoration-Sheesham-Seater-Dining-Chairs/dp/B07N8Z2KD1/ref=sr_1_17?dchild=1&keywords=dining+set&qid=1628354753&sr=8-17
OAKNEST Supreme Oak with Marina Dining Room Set for Indoor and Outdoor (Count : 5; Color: Mehandi Green)  ,,,,"₹9,525","₹7,500","Save ₹2,025 (21%)",3.5 out of 5 stars,4,https://www.amazon.in/OAKNEST-Supreme-Marina-Dining-Outdoor/dp/B095YYK4SF/ref=sr_1_18?dchild=1&keywords=dining+set&qid=1628354753&sr=8-18
"Stream Furniture Sheesham Wood Dining Table with Chairs | Dining Room Furniture (4 Seater Dining Set, Teak Finish)  ",,,,"₹30,000","₹17,199","Save ₹12,801 (43%)",,,https://www.amazon.in/Stream-Furniture-Sheesham-Dining-Chairs/dp/B09BCMKL2F/ref=sr_1_19?dchild=1&keywords=dining+set&qid=1628354753&sr=8-19
OAKNEST Supreme Web with Marina Dining Room Set for Indoor and Outdoor Use (Color: Jet Black | Count: 5)  ,,,,"₹12,325","₹9,000","Save ₹3,325 (27%)",,,https://www.amazon.in/OAKNEST-Supreme-Marina-Dining-Outdoor/dp/B096GC2C6P/ref=sr_1_20?dchild=1&keywords=dining+set&qid=1628354753&sr=8-20
TG Furniture Solid Sheesham Wood Armania 6 Seater Dining Table Set with 4 Cushion Chair and Bench for Dining Room Home and Office (Natural Finish)  ,,Sponsored,,"₹57,598","₹39,499","Save ₹18,099 (31%)",5.0 out of 5 stars,1,https://www.amazon.in/gp/slredirect/picassoRedirect.html/ref=pa_sp_mtf_aps_sr_pg1_1?ie=UTF8&adId=A09633591BW1BQ5B946TA&url=%2FTG-Furniture-Sheesham-Armania-Cushion%2Fdp%2FB085C4QTHH%2Fref%3Dsr_1_21_sspa%3Fdchild%3D1%26keywords%3Ddining%2Bset%26qid%3D1628354753%26sr%3D8-21-spons%26psc%3D1&qualifier=1628354753&id=5522207872016623&widgetName=sp_mtf
KendalWood™ Furniture  Sheesham Wood Dining Table(57x35 inch) with 6 Chairs | 6 Seater Dining Set | Wooden Dining Table with Chair - Dining Room Furniture ( Natural Teak Finish with Cushion)  ,,Sponsored,,"₹50,000","₹31,999","Save ₹18,001 (36%)",3.7 out of 5 stars,23,https://www.amazon.in/gp/slredirect/picassoRedirect.html/ref=pa_sp_mtf_aps_sr_pg1_1?ie=UTF8&adId=A0798721AIY8YC915FHI&url=%2FKendalWoodTM-Furniture-Sheesham-Dining-Chairs-Seater%2Fdp%2FB08J473KSS%2Fref%3Dsr_1_22_sspa%3Fdchild%3D1%26keywords%3Ddining%2Bset%26qid%3D1628354753%26sr%3D8-22-spons%26psc%3D1&qualifier=1628354753&id=5522207872016623&widgetName=sp_mtf
KendalWood™ Furniture Sheesham Wood CNC Cuting Dining Table with 4 Chairs with 1 Bench|6 Seater Dining Set- Dining Room Furniture (Finish Color:-Honey Teak with Cream Cushion)  ,,Sponsored,,"₹40,000","₹29,999","Save ₹10,001 (25%)",3.4 out of 5 stars,43,https://www.amazon.in/gp/slredirect/picassoRedirect.html/ref=pa_sp_mtf_aps_sr_pg1_1?ie=UTF8&adId=A055950837CNN8OLFYQCY&url=%2FKendalWood-Furniture-Sheesham-Cuting-Cushion%2Fdp%2FB088PNKQ44%2Fref%3Dsr_1_23_sspa%3Fdchild%3D1%26keywords%3Ddining%2Bset%26qid%3D1628354753%26sr%3D8-23-spons%26psc%3D1&qualifier=1628354753&id=5522207872016623&widgetName=sp_mtf
"KendalWood™ Furniture Sheesham Wood Dining Table (57x35 Inch) with 4 Chairs, 1 Bench |6 Seater Dining Set ( Finish Color :- Honey Finish with Cream Cushions)  ",,Sponsored,,"₹40,000","₹28,999","Save ₹11,001 (28%)",3.5 out of 5 stars,13,https://www.amazon.in/gp/slredirect/picassoRedirect.html/ref=pa_sp_mtf_aps_sr_pg1_1?ie=UTF8&adId=A05596642LI43CVVWBLB2&url=%2FKendalWood-Furniture-Sheesham-Dining-Chairs%2Fdp%2FB088PPNFD4%2Fref%3Dsr_1_24_sspa%3Fdchild%3D1%26keywords%3Ddining%2Bset%26qid%3D1628354753%26sr%3D8-24-spons%26psc%3D1&qualifier=1628354753&id=5522207872016623&widgetName=sp_mtf
Ramdoot Furniture Solid Sheesham Teak Wood Wooden Dining Table 4 Seater | Dining Table Set with 3 Chairs & 1 Bench | Home Dining Room Set Furniture Wooden Dining Table 4 Seater | Teak Finish  ,,,,,,,4.6 out of 5 stars,51,https://www.amazon.in/Ramdoot-Furniture-Wooden-Sheesham-Dining/dp/B084L7TT4L/ref=sr_1_25?dchild=1&keywords=dining+set&qid=1628354753&sr=8-25
Stream Furniture Dining Table 4 Seater Set with Chairs | Dining Table Sets | 4 Seater Dining Table Wooden | Dining Room Furniture Sets | Sheesham Wood 4 Seater Dining Table | Mahogany Finish  ,,,,"₹30,000","₹20,989","Save ₹9,011 (30%)",,,https://www.amazon.in/Stream-Furniture-Dining-Sheesham-Mahogany/dp/B097DCNKJ3/ref=sr_1_26?dchild=1&keywords=dining+set&qid=1628354753&sr=8-26
"Sheesham Wood Dining Set for Living Room (4 Seater, 4 Chair & Table (Brown)  ",,,,"₹29,999","₹16,000","Save ₹13,999 (47%)",,,https://www.amazon.in/Sheesham-Wood-Dining-Living-Seater/dp/B098MVZY2G/ref=sr_1_27?dchild=1&keywords=dining+set&qid=1628354753&sr=8-27
Art Window Solid Wooden Bamboo 2 Seater Dining Table Set with 2 Round Stool & 1 Large Round Stool for Dining Room Wooden Dining for Living Room(Walnut Burn)  ,,,,"₹7,999","₹3,549","Save ₹4,450 (56%)",5.0 out of 5 stars,2,https://www.amazon.in/Window-Wooden-Bamboo-Seater-Dining/dp/B08TRFTSY8/ref=sr_1_28?dchild=1&keywords=dining+set&qid=1628354753&sr=8-28
KendalWood™ Furniture Sheesham Wood Dining Table(57x35 Inch) with 6 Chairs | 6 Seater Dining Set | Wooden Dining Table with Chair - Dining Room Furniture ( Honey Finish with Cream Cushions)  ,,,,"₹40,000","₹31,999","Save ₹8,001 (20%)",5.0 out of 5 stars,1,https://www.amazon.in/KendalWoodTM-Furniture-Sheesham-Dining-Chairs/dp/B08R3DHYLM/ref=sr_1_29?dchild=1&keywords=dining+set&qid=1628354753&sr=8-29
Douceur Furnitures - Pure Sheesham Wood Dinning Table 6 Seater | Wooden Dining Table with 6 Chairs - Honey Finish  ,,,,"₹55,999","₹29,959","Save ₹26,040 (47%)",5.0 out of 5 stars,6,https://www.amazon.in/Douceur-Furnitures-Sheesham-Dinning-Seater/dp/B096VKJV2B/ref=sr_1_30?dchild=1&keywords=dining+set&qid=1628354753&sr=8-30
"DriftingWood Wooden Dining Table 6 Seater | Six Seater Dinning Table with 6 Chairs for Restaurant | Dining Room Sets | Sheesham Wood, Dark Walnut  ",,,,,,,3.9 out of 5 stars,88,https://www.amazon.in/DriftingWood-Wooden-Dinning-Restaurant-Sheesham/dp/B08S7H2TMP/ref=sr_1_31?dchild=1&keywords=dining+set&qid=1628354753&sr=8-31
"Hariom Handicraft Kendal Wood Furniture Sheesham Dining Table with 6 Chairs, 6 Seater Set, Room (Teak Finish_1)  ",,,,"₹60,000","₹36,999","Save ₹23,001 (38%)",4.1 out of 5 stars,20,https://www.amazon.in/Hariom-Handicraft-Furniture-Sheesham-Finish_1/dp/B081LDT3PS/ref=sr_1_32?dchild=1&keywords=dining+set&qid=1628354753&sr=8-32
OdiSri 6-Seater Dining Set Solid German Beech Wood 6 Chairs and Large 36x72 Live Edge Table - Santa Fe II  ,,,,,"₹1,18,728",,,,https://www.amazon.in/OdiSri-6-Seater-Dining-German-Chairs/dp/B08RWF6HG2/ref=sr_1_33?dchild=1&keywords=dining+set&qid=1628354753&sr=8-33
Stream Furniture Sheesham Wood Dining Table 6 Seater / 6 Seater Dining Set with Chairs for Dining Room Walnut Color  ,,,,"₹45,000","₹33,485","Save ₹11,515 (26%)",5.0 out of 5 stars,1,https://www.amazon.in/Stream-Furniture-Sheesham-Dining-Seater/dp/B096RTZD55/ref=sr_1_34?dchild=1&keywords=dining+set&qid=1628354753&sr=8-34
Vinod Furniture Wooden Solid Sheesham Wood Dining Table 4 Seater | Dining Table Set with 3 Chairs & 1 Bench | Home Dining Room Furniture Teak Wood Dining Table 4 Seater | Honey Finish  ,,,,,,,4.3 out of 5 stars,65,https://www.amazon.in/Vinod-Furniture-Wooden-Sheesham-Dining/dp/B08BX5DFF1/ref=sr_1_35?dchild=1&keywords=dining+set&qid=1628354753&sr=8-35
Shree Jeen Mata Enterprises Wooden Solid Sheesham Wood Dining Table 4 Seater | Dining Table Set with 3 Chairs & 1 Bench | Home Dining Room Furniture Teak Wood Dining Table 4 Seater | Honey Finish  ,,,,"₹49,999","₹15,999","Save ₹34,000 (68%)",4.5 out of 5 stars,138,https://www.amazon.in/Shree-Jeen-Mata-Enterprises-Sheesham/dp/B07L2GJV95/ref=sr_1_36?dchild=1&keywords=dining+set&qid=1628354753&sr=8-36
Eagle Furniture Wooden Solid Sheesham Wood Dining Table 4 Seater Dining Table Set with 3 Chairs & 1 Bench Dining Room Furniture Wood Dining Table 4 Seater | Honey Finish  ,Limited time deal,,,"₹37,999","₹17,249","Save ₹20,750 (55%)",4.5 out of 5 stars,69,https://www.amazon.in/Eagle-Furniture-Wooden-Sheesham-Dining/dp/B08FMMWC2F/ref=sr_1_37?dchild=1&keywords=dining+set&qid=1628354753&smid=A2YTBE5677NOQC&sr=8-37
Kawachi Fold Down 3 Seater Wall Mounted Folding Breakfast Dining Table Perfect Addition to Kitchen & Dining Room Brown  ,,,,"₹6,200","₹2,999","Save ₹3,201 (52%)",,,https://www.amazon.in/Kawachi-Mounted-Folding-Breakfast-Addition/dp/B08YRQTBYF/ref=sr_1_38?dchild=1&keywords=dining+set&qid=1628354753&sr=8-38
"Custom Decor Solid Wood CNC 4 Seater Dining Set in Provincial Teak Finish Dining Set and Chairs (4 Seater Dining Table, 4 Seater with Printed Cushion| Honey Finish with Bench)  ",,,,,,,4.1 out of 5 stars,78,https://www.amazon.in/Custom-Decor-Provincial-Printed-Cushion/dp/B096JXYMY6/ref=sr_1_39?dchild=1&keywords=dining+set&qid=1628354753&sr=8-39
MV Furniture Sheesham Wood Mahogany Finish Modern 6 Seater Dining Table with Chair Set (Brown )  ,,,,"₹40,000","₹28,899","Save ₹11,101 (28%)",2.4 out of 5 stars,3,https://www.amazon.in/MV-Furniture-Sheesham-Seater-Dining/dp/B083JCGYNF/ref=sr_1_40?dchild=1&keywords=dining+set&qid=1628354753&sr=8-40
LowCost Furniture Solid Wooden 4 Seater Dining Set | Dining Table 4 Seater with Chairs | Dining Table 4 Seater Wooden | Finish Color - Teak  ,,,,,,,,,https://www.amazon.in/LowCost-Furniture-Wooden-Seater-Dining/dp/B09348PG1T/ref=sr_1_41?dchild=1&keywords=dining+set&qid=1628354753&sr=8-41
KendalWood™ Furniture  Solid Wood Dining Table with 4 Chairs | 4 Seater Dining Set | Wooden Dining Table with Chair - Dining Room Furniture ( Teak Finish with Cream Cushion)  ,,,,"₹30,000","₹19,999","Save ₹10,001 (33%)",3.5 out of 5 stars,15,https://www.amazon.in/KendalWoodTM-Furniture-Solid-Dining-Chairs-Seater/dp/B08MYMBN55/ref=sr_1_42?dchild=1&keywords=dining+set&qid=1628354753&sr=8-42
Porash Furniture Sheesham Wood 2 Seater Dining Table with 2 Chairs for Restaurant Wooden Dinner Table Set for Dinner Room Living Room Home Hall (Walnut Finish)  ,,,,"₹35,999","₹20,999","Save ₹15,000 (42%)",,,https://www.amazon.in/Porash-Furniture-Sheesham-Seater-Restaurant/dp/B09B6DQHGF/ref=sr_1_43?dchild=1&keywords=dining+set&qid=1628354753&sr=8-43
KM Decor Sheesham Wood Dining Table 6 Seater Set | 6 Seater Dining Table with Chairs for Living Room  ,,,,"₹42,500","₹28,599","Save ₹13,901 (33%)",4.2 out of 5 stars,27,https://www.amazon.in/KM-Decor-Sheesham-Dining-Seater/dp/B081PZZCC5/ref=sr_1_44?dchild=1&keywords=dining+set&qid=1628354753&sr=8-44
sarswati furniture sheesham wood standard dining table 6 seater | wooden dinning room furniture | 4 chair & 2 seater bench with cushions | 1 table | balcony dining set | honey finish  ,,,,,,,3.3 out of 5 stars,20,https://www.amazon.in/Sarswati-Furniture-Sheesham-Dinning-Cushions/dp/B07XQHXRJG/ref=sr_1_45?dchild=1&keywords=dining+set&qid=1628354753&sr=8-45
KendalWood™ Furniture  Sheesham Wood Dining Table(57x35) with 6 Chairs | 6 Seater Dining Set | Wooden Dining Table with Chair - Dining Room Furniture (Teak Finish with Cream Cushion)  ,,,,"₹50,000","₹28,999","Save ₹21,001 (42%)",4.2 out of 5 stars,4,https://www.amazon.in/KendalWoodTM-Furniture-Sheesham-Dining-Chairs-Seater/dp/B08KTND1KK/ref=sr_1_46?dchild=1&keywords=dining+set&qid=1628354753&sr=8-46
"Shreya Decor Wooden Dining Table 4 Seater | Four Seater Dinning Table with Chairs | Dining Room Sets | Sheesham Wood, (Finish-Honey, with White Cousion)  ",,,,"₹29,999","₹16,999","Save ₹13,000 (43%)",,,https://www.amazon.in/Shreya-Decor-Dinning-Sheesham-Finish-Honey/dp/B09B7QPGFQ/ref=sr_1_47?dchild=1&keywords=dining+set&qid=1628354753&sr=8-47
Ikiriya Sheesham Wood Compact 4 Seat Dining Table Set - Cushioned Chairs - (Teak Finish ; Ivory Velvet)  ,,,,"₹36,600","₹20,000","Save ₹16,600 (45%)",,,https://www.amazon.in/Ikiriya-Sheesham-Compact-Dining-Table/dp/B08KJ4XZFB/ref=sr_1_48?dchild=1&keywords=dining+set&qid=1628354753&sr=8-48
DK Craft Wooden Solid Sheesham Wood Dining Table 4 Seater | Dining Table Set with 2 Chairs & 1 Bench | Home Dining Room Furniture Teak Wood Dining Table 4 Seater | Walnut Finish  ,,,,"₹31,299","₹15,998","Save ₹15,301 (49%)",,,https://www.amazon.in/DK-Craft-Dining-Table-Furniture/dp/B097S8DC4F/ref=sr_1_49?dchild=1&keywords=dining+set&qid=1628354753&sr=8-49
Corazzin Furniture Sheesham Wood 4 Seater Dining Table Set with Chairs (Walnut Finish)  ,,,,"₹45,999","₹24,999","Save ₹21,000 (46%)",2.9 out of 5 stars,2,https://www.amazon.in/Corazzin-Furniture-Sheesham-Seater-Dining/dp/B08HKF85GK/ref=sr_1_50?dchild=1&keywords=dining+set&qid=1628354753&sr=8-50
Pranjal Wood Decor Sheesham Wood 4 Seater Dining Table Set | Solid Wood Dining Set for Kitchen | Sheesham Wood Dining Table for Hall in Teak Finish  ,,,,"₹31,999","₹23,999","Save ₹8,000 (25%)",,,https://www.amazon.in/Pranjal-Sheesham-Seater-Dining-Kitchen/dp/B099Z7PFSS/ref=sr_1_51?dchild=1&keywords=dining+set&qid=1628354753&sr=8-51
"Eagle Furniture Solid Wood 6 Seater Dining Set in Provincial Teak Finish (Medium 3, Brown 3)  ",,,,"₹89,999","₹34,990","Save ₹55,009 (61%)",,,https://www.amazon.in/Eagle-Furniture-Seater-Dining-Provincial/dp/B098TLY17Z/ref=sr_1_52?dchild=1&keywords=dining+set&qid=1628354753&sr=8-52
Ikiriya Columbus Rosewood 4 Seater Dining Table Set in Teak Finish; 1 Yr. Warranty  ,,,,"₹39,000","₹23,999","Save ₹15,001 (38%)",,,https://www.amazon.in/Ikiriya-Columbus-Rosewood-Seater-Warranty/dp/B09B5Z9CSH/ref=sr_1_53?dchild=1&keywords=dining+set&qid=1628354753&sr=8-53
"Porash Furniture Dining Table 4 Seater | Dining Table Set with 3 Chairs & 1 Bench | Solid Sheesham Wood,Teak Finish  ",,,,"₹27,999","₹16,399","Save ₹11,600 (41%)",,,https://www.amazon.in/Porash-Furniture-Dining-Seater-Sheesham/dp/B096XYB53R/ref=sr_1_54?dchild=1&keywords=dining+set&qid=1628354753&sr=8-54
"KendalWood™ Furniture Sheesham Wood CNC Cuting Dining Table with Chairs & | Dining Room Furniture 4 Seater Dining Set, (Finish Color;-Honey Teak Finish)  ",,,,"₹25,000","₹19,999","Save ₹5,001 (20%)",4.7 out of 5 stars,4,https://www.amazon.in/KendalWoodTM-Furniture-Sheesham-Cuting-Dining/dp/B08DVDJ2HR/ref=sr_1_55?dchild=1&keywords=dining+set&qid=1628354753&sr=8-55
Furniseworld Sheesham Wood 6 Seater Dining Table Set for Living Room Dining Table with 6 Chairs Furniture for Home (Maple Finish)  ,,,,,,,4.4 out of 5 stars,19,https://www.amazon.in/Furniseworld-Sheesham-Furniture-Dining-Finish/dp/B07P8G4M2W/ref=sr_1_56?dchild=1&keywords=dining+set&qid=1628354753&sr=8-56
TG Furniture Sheesham Wood Round G-Oval 4 Seater Dining Table Set Solid Wood Dinning Room Furniture for Living Room Home Kitchen (Natural Glossy Finish)  ,,Sponsored,,"₹29,999","₹20,999","Save ₹9,000 (30%)",4.2 out of 5 stars,8,https://www.amazon.in/gp/slredirect/picassoRedirect.html/ref=pa_sp_btf_aps_sr_pg1_1?ie=UTF8&adId=A03832593I66XQ0PCPW7J&url=%2FTG-Furniture-G-Oval-Seater-Sheesham%2Fdp%2FB0867SPTR2%2Fref%3Dsr_1_57_sspa%3Fdchild%3D1%26keywords%3Ddining%2Bset%26qid%3D1628354753%26sr%3D8-57-spons%26psc%3D1&qualifier=1628354753&id=5522207872016623&widgetName=sp_btf
Deko-Style Wooden Dining Table Set | 4 Seater Dining Table with Chairs | Sheesham Wooden Dining Set | Dining Set with 4 Chairs | Without Cushions | Dining Table Small Size | Honey Teak Finish  ,,Sponsored,,"₹29,999","₹16,999","Save ₹13,000 (43%)",5.0 out of 5 stars,1,https://www.amazon.in/gp/slredirect/picassoRedirect.html/ref=pa_sp_btf_aps_sr_pg1_1?ie=UTF8&adId=A03632103GDIB2PYONLE6&url=%2FDeko-Style-Wooden-Sheesham-Without-Cushions%2Fdp%2FB0967P6G8F%2Fref%3Dsr_1_58_sspa%3Fdchild%3D1%26keywords%3Ddining%2Bset%26qid%3D1628354753%26sr%3D8-58-spons%26psc%3D1&qualifier=1628354753&id=5522207872016623&widgetName=sp_btf
Vinod Furniture Wooden Solid Sheesham Wood Dining Table 4 Seater | Dining Table Set with 3 Chairs & 1 Bench | Home Dining Room Furniture Teak Wood Dining Table 4 Seater | (Walnut Finish)  ,,Sponsored,,,,,5.0 out of 5 stars,3,https://www.amazon.in/gp/slredirect/picassoRedirect.html/ref=pa_sp_btf_aps_sr_pg1_1?ie=UTF8&adId=A0268484LI10HWAN67LS&url=%2FVinod-Furniture-Wooden-Sheesham-Dining%2Fdp%2FB08F5275MC%2Fref%3Dsr_1_59_sspa%3Fdchild%3D1%26keywords%3Ddining%2Bset%26qid%3D1628354753%26sr%3D8-59-spons%26psc%3D1&qualifier=1628354753&id=5522207872016623&widgetName=sp_btf
Porash Furniture Sheesham Wood Dining Table 6 Seater / 6 Seater Dining Set with Chairs for Dining Room Walnut Color  ,,Sponsored,,"₹45,000","₹32,699","Save ₹12,301 (27%)",,,https://www.amazon.in/gp/slredirect/picassoRedirect.html/ref=pa_sp_btf_aps_sr_pg1_1?ie=UTF8&adId=A09025451UGFDWQ5DRB5Y&url=%2FPorash-Furniture-Sheesham-Dining-Seater%2Fdp%2FB097F5C5CZ%2Fref%3Dsr_1_60_sspa%3Fdchild%3D1%26keywords%3Ddining%2Bset%26qid%3D1628354753%26sr%3D8-60-spons%26psc%3D1&qualifier=1628354753&id=5522207872016623&widgetName=sp_btf
Vinod Furniture Sheesham Wooden Wood 4 Seater Dining Table Set with 4 Chair for Dining Room Wooden Dining Chairs Set of 4 Living Room Furniture Teak Wood Dining Table 4 Seater(Walnut Finish)  ,,Sponsored,,,,,4.3 out of 5 stars,65,https://www.amazon.in/gp/slredirect/picassoRedirect.html/ref=pa_sp_atf_next_aps_sr_pg2_1?ie=UTF8&adId=A02686402MXOCZPHR7F27&url=%2FVinod-Furniture-Sheesham-Wooden-Seater%2Fdp%2FB08GK8Y8NL%2Fref%3Dsr_1_49_sspa%3Fdchild%3D1%26keywords%3Ddining%2Bset%26qid%3D1628354775%26sr%3D8-49-spons%26psc%3D1&qualifier=1628354775&id=3316985470922835&widgetName=sp_atf_next
Eagle Furniture Wooden Solid Sheesham Wood Dining Table 4 Seater Dining Table Set with 4 Chairs Dining Room Furniture Wood Dining Table 4 Seater | Honey Finish  ,,Sponsored,,"₹39,599","₹17,599","Save ₹22,000 (56%)",4.5 out of 5 stars,69,https://www.amazon.in/gp/slredirect/picassoRedirect.html/ref=pa_sp_atf_next_aps_sr_pg2_1?ie=UTF8&adId=A08853202P15TC7H0CUL&url=%2FEagle-Furniture-Wooden-Sheesham-Dining%2Fdp%2FB0992BZ9GG%2Fref%3Dsr_1_50_sspa%3Fdchild%3D1%26keywords%3Ddining%2Bset%26qid%3D1628354775%26sr%3D8-50-spons%26psc%3D1&qualifier=1628354775&id=3316985470922835&widgetName=sp_atf_next
Woodstage Sheesham Wood Dining Table Set with 6 Chairs Wooden Dining Set 6 Seater Furniture for Living Room Dining Room Home (Provincial Teak Finish)  ,,Sponsored,,"₹58,332","₹35,897","Save ₹22,435 (38%)",,,https://www.amazon.in/gp/slredirect/picassoRedirect.html/ref=pa_sp_atf_next_aps_sr_pg2_1?ie=UTF8&adId=A04145093S3RBCB1LZVQK&url=%2FWoodstage-Sheesham-Dining-Funiture-Provincial%2Fdp%2FB08KGM83TF%2Fref%3Dsr_1_51_sspa%3Fdchild%3D1%26keywords%3Ddining%2Bset%26qid%3D1628354775%26sr%3D8-51-spons%26psc%3D1&qualifier=1628354775&id=3316985470922835&widgetName=sp_atf_next
TG Furniture Solid Sheesham Wood 6 Seater Dining Table Set with 4 Cushion Chairs and 1 Bench for Dining Room Home Office Wooden Living Room Furniture (Walnut Finish)  ,,Sponsored,,"₹63,199","₹39,499","Save ₹23,700 (38%)",,,https://www.amazon.in/gp/slredirect/picassoRedirect.html/ref=pa_sp_atf_next_aps_sr_pg2_1?ie=UTF8&adId=A011212739IYXLONYBGNK&url=%2FTG-Furniture-Sheesham-Seater-Cushion%2Fdp%2FB099FDTKPB%2Fref%3Dsr_1_52_sspa%3Fdchild%3D1%26keywords%3Ddining%2Bset%26qid%3D1628354775%26sr%3D8-52-spons%26psc%3D1&qualifier=1628354775&id=3316985470922835&widgetName=sp_atf_next
Home Centre Montoya 6 Seater Dining Table Set with Chair and Bench  ,Deal of the Day ,,,"₹49,100","₹26,023","Save ₹23,077 (47%)",3.4 out of 5 stars,54,https://www.amazon.in/Home-Centre-Montoya-Seater-Dining/dp/B07W3LL7PM/ref=sr_1_53?dchild=1&keywords=dining+set&qid=1628354775&sr=8-53
