name,badge_1,badge_2,badge_3,mrp,discounted_price,discount,rating,rating_count,link
Krishna Wood Decor Wooden Solid Sheesham Teak Wood Dining Chair Set of 2 Living Room | 2 Chair dining table set wood Office Chair | Dining Room Set | Dining Chairs Set of 2 | Study table Chairs Set |Set of 2 | Teak Finish  ,,Sponsored,,"₹11,665","₹6,999","Save ₹4,666 (40%)",5.0 out of 5 stars,13,https://www.amazon.in/gp/slredirect/picassoRedirect.html/ref=pa_sp_atf_aps_sr_pg1_1?ie=UTF8&adId=A023508726HPSWCWMEAPX&url=%2FKrishna-Wood-Decor-Sheesham-Dinning%2Fdp%2FB07N8TLTN8%2Fref%3Dsr_1_1_sspa%3Fdchild%3D1%26keywords%3Ddining%2Bset%26qid%3D1624810189%26sr%3D8-1-spons%26psc%3D1&qualifier=1624810189&id=4616828144897095&widgetName=sp_atf
S. Brother Helios Nora Regina Glass 4-Seater Dining Table Set with 4 Chairs  ,,,,,,,,,https://www.amazon.in/Brother-Helios-Regina-4-Seater-Dining/dp/B097TKPLGF/ref=sr_1_2?dchild=1&keywords=dining+set&qid=1624810189&sr=8-2
DK Craft Sheesham Wood 4 Seater Dining Table Set with 4 Chair & Bench for Living Room 5 Piece Wooden Dining Room Sets for Home Kitchen Modern Dining Room Furniture (Honey Brown)  ,,,,"₹49,999","₹19,799","Save ₹30,200 (60%)",,,https://www.amazon.in/DK-Craft-Dining-Table-Furniture/dp/B097S85MWT/ref=sr_1_3?dchild=1&keywords=dining+set&qid=1624810189&sr=8-3
S.Brother Helios Nora Regina Glass 4-Seater Dining Table Set with 4 Chairs  ,,,,,,,,,https://www.amazon.in/S-Brother-Helios-Regina-4-Seater-Dining/dp/B097TNLV92/ref=sr_1_4?dchild=1&keywords=dining+set&qid=1624810189&sr=8-4
S.Brothers Helio Nora Regina Glass 4-Seater Dining Table Set with 4 Chairs  ,,,,,,,,,https://www.amazon.in/S-Brothers-Regina-4-Seater-Dining-Chairs/dp/B097Y167CN/ref=sr_1_5?dchild=1&keywords=dining+set&qid=1624810189&sr=8-5
Home Centre Helios Fairmount 4-Seater Dining Table Set with 4 Chairs  ,,,,"₹28,900","₹14,450","Save ₹14,450 (50%)",,,https://www.amazon.in/Home-Centre-Helios-Fairmount-4-Seater/dp/B096R4V59P/ref=sr_1_6?dchild=1&keywords=dining+set&qid=1624810189&sr=8-6
Mallikarjun Furnitures 6 Seater Sheesham Wood Dining Table Set with Chairs (Walnut Finish)  ,,,,,,,,,https://www.amazon.in/Mallikarjun-Furnitures-Seater-Sheesham-Dining/dp/B097TVHSCD/ref=sr_1_7?dchild=1&keywords=dining+set&qid=1624810189&sr=8-7
OAKNEST Supreme Web with Marina Dining Room Set for Indoor and Outdoor Use (Color: Jet Black | Count: 5)  ,,,,"₹12,325","₹9,000","Save ₹3,325 (27%)",,,https://www.amazon.in/OAKNEST-Supreme-Marina-Dining-Outdoor/dp/B096GC2C6P/ref=sr_1_8?dchild=1&keywords=dining+set&qid=1624810189&sr=8-8
Vishwakarma Antique Sheesham Solid Wood 4 Seater Dining Set in Honey Oak Finish  ,,,,,,,,,https://www.amazon.in/Vishwakarma-Antique-Sheesham-Seater-Dining/dp/B0975XNH9T/ref=sr_1_9?dchild=1&keywords=dining+set&qid=1624810189&sr=8-9
KK HANDYCRAFT NAT Dining Table Set with 4 Chairs and 1 Bench - Teak Finish  ,,,,,,,,,https://www.amazon.in/HANDYCRAFT-Dining-Table-Chairs-Bench/dp/B091M9J7H3/ref=sr_1_10?dchild=1&keywords=dining+set&qid=1624810189&sr=8-10
Custom Decor Sheesham Wood 4 Seater Dining Table Set with Chairs for Living Room (Honey Teak Brown)  ,,,,"₹29,999","₹17,999","Save ₹12,000 (40%)",3.8 out of 5 stars,15,https://www.amazon.in/Custom-Decor-Sheesham-Seater-Dining/dp/B07SDNQQW3/ref=sr_1_11?dchild=1&keywords=dining+set&qid=1624810189&sr=8-11
Furinno Sheesham Wood 4 Seater Dining Table Set with Chairs for Home Living Room Hall (Warm Chestnut Finish)  ,,,,"₹29,999","₹20,212","Save ₹9,787 (33%)",3.8 out of 5 stars,25,https://www.amazon.in/Furinno-Sheesham-Seater-Dining-Chestnut/dp/B08HPZPFNJ/ref=sr_1_12?dchild=1&keywords=dining+set&qid=1624810189&sr=8-12
S Brother Helios Nora Regina Glass 4-Seater Dining Table Set with 4 Chairs  ,,,,,,,,,https://www.amazon.in/Brother-Helios-Regina-4-Seater-Dining/dp/B097TJK6NT/ref=sr_1_13?dchild=1&keywords=dining+set&qid=1624810189&sr=8-13
Home Centre Savoy Rubber Wood 6 Seater Dining Set with 4 Chairs and 1 Bench  ,,,,"₹74,918","₹44,950","Save ₹29,968 (40%)",,,https://www.amazon.in/Home-Centre-Rubber-Seater-Dining/dp/B096R3BQLG/ref=sr_1_14?dchild=1&keywords=dining+set&qid=1624810189&sr=8-14
Home Centre Helios Newark 6-Seater Dining Table Set with 6 Chairs  ,,,,"₹51,048","₹25,950","Save ₹25,098 (49%)",,,https://www.amazon.in/Home-Centre-Helios-Newark-6-Seater/dp/B096R39F7S/ref=sr_1_15?dchild=1&keywords=dining+set&qid=1624810189&sr=8-15
S.Brothers Helios Nora Regina Glass 4-Seater Dining Table Set with 4 Chairs  ,,,,,,,,,https://www.amazon.in/S-Brothers-Helios-Regina-4-Seater-Dining/dp/B097XXYJCY/ref=sr_1_16?dchild=1&keywords=dining+set&qid=1624810189&sr=8-16
Home Centre Helios Nora Regina Glass 4-Seater Dining Table Set with 4 Chairs  ,,,,"₹39,900","₹12,950","Save ₹26,950 (68%)",,,https://www.amazon.in/Home-Centre-Helios-Regina-4-Seater/dp/B096R379PL/ref=sr_1_17?dchild=1&keywords=dining+set&qid=1624810189&sr=8-17
Furinno Sheesham Wood 4 Seater Dining Table for Living Room Home Hall Hotel Dinner Restaurant Wooden Dining Table Dining Room Set Dining Table with 4 Chairs Furniture for Home (Teak Finish)  ,,Sponsored,,"₹24,158","₹19,792","Save ₹4,366 (18%)",2.9 out of 5 stars,2,https://www.amazon.in/gp/slredirect/picassoRedirect.html/ref=pa_sp_mtf_aps_sr_pg1_1?ie=UTF8&adId=A008206136M3LP8IA6LZ4&url=%2FFurinno-Sheesham-Seater-Restaurant-Furniture%2Fdp%2FB0842QTG1G%2Fref%3Dsr_1_18_sspa%3Fdchild%3D1%26keywords%3Ddining%2Bset%26qid%3D1624810189%26sr%3D8-18-spons%26psc%3D1%26smid%3DA10QTIOC0L3QEQ&qualifier=1624810189&id=4616828144897095&widgetName=sp_mtf
HomeTown Compact Solid Wood Four Seater Dining Set in Walnut Colour  ,,,,"₹50,000","₹22,989","Save ₹27,011 (54%)",3.4 out of 5 stars,26,https://www.amazon.in/HomeTown-Compact-Seater-Dining-Walnut/dp/B013GEQODI/ref=sr_1_19?dchild=1&keywords=dining+set&qid=1624810189&sr=8-19
Ruchika Handicraft Sheesham Wood Rectangle 6 Seater Dining Table Set with 6 Cushion Chair for Dining Room Hall Home Office (Honey Finish)  ,,,,,,,,,https://www.amazon.in/Ruchika-Handicraft-Sheesham-Rectangle-Cushion/dp/B097HSM1KT/ref=sr_1_20?dchild=1&keywords=dining+set&qid=1624810189&sr=8-20
Vishwakarma Antique Sheesham Solid Wood 6 Seater Dining Set in Honey Oak Finish  ,,,,,,,,,https://www.amazon.in/Vishwakarma-Antique-Sheesham-Seater-Dining/dp/B0975YQ84J/ref=sr_1_21?dchild=1&keywords=dining+set&qid=1624810189&sr=8-21
"Ramwood Furniture Wooden Dining Table 6 Seater | Six Seater Dinning Table with 6 Chairs for Home & Restaurant | Dining Room Set | Sheesham Wood, Walnut Finish  ",,,,"₹41,699","₹25,999","Save ₹15,700 (38%)",,,https://www.amazon.in/Ramwood-Furniture-Dinning-Restaurant-Sheesham/dp/B096FJLLKS/ref=sr_1_22?dchild=1&keywords=dining+set&qid=1624810189&sr=8-22
DK Craft Solid Sheesham Wood Dining Table with 4 Chair for Living Room Wooden 4 Seater Dining Table Set for Home Dining Room Restaurant Dinner Table Set with Chairs (Teak Finish)  ,,,,"₹49,999","₹17,799","Save ₹32,200 (64%)",,,https://www.amazon.in/DK-Craft-Dining-Table-Restaurant/dp/B097S8N3L3/ref=sr_1_23?dchild=1&keywords=dining+set&qid=1624810189&sr=8-23
Handicrafts Gallery Round Dining Table 4 Seater | Round Table with 4 Chairs Set | Round Dining Table 4 Seater Wooden | 4 Seater Dining Table Set Wood Dining Sets  ,,,,"₹25,549","₹15,999","Save ₹9,550 (37%)",,,https://www.amazon.in/Handicrafts-Gallery-Dining-Seater-Chairs/dp/B097MT7NP2/ref=sr_1_24?dchild=1&keywords=dining+set&qid=1624810189&sr=8-24
Porash Furniture CNC Cuting Sheesham Wood Dining Table 4 Seater Set | Wooden 4 Seater Dining Furniture | 4 Chairs with Cushion Teak Wood Dining Table Set Furniture for Living Room (Honey Finish)  ,,,,"₹25,299","₹16,999","Save ₹8,300 (33%)",4.4 out of 5 stars,4,https://www.amazon.in/Porash-Furniture-Cuting-Sheesham-Cushion/dp/B08X3CVSTZ/ref=sr_1_25?dchild=1&keywords=dining+set&qid=1624810189&sr=8-25
"AD Planet Solid Wood Dining Table 6 Seater | Six Seater Dininng Table with 6 Chairs | Dining Room Sets for Home & Restaurant | Solid Wood, Honey Brown  ",,,,"₹70,998","₹42,599","Save ₹28,399 (40%)",,,https://www.amazon.in/AD-Planet-Dining-Dininng-Restaurant/dp/B097XLW76C/ref=sr_1_26?dchild=1&keywords=dining+set&qid=1624810189&sr=8-26
"Ananya Interiors Solid Sheesham Wood 4 Seater Dining Table Set (Urban, Design III)  ",,,,"₹25,000","₹16,999","Save ₹8,001 (32%)",,,https://www.amazon.in/Ananya-Interiors-Sheesham-Seater-Dining/dp/B097HQH596/ref=sr_1_27?dchild=1&keywords=dining+set&qid=1624810189&sr=8-27
Aarsun Teak Wood 10 Seater Royal Dining Set | Handcrafted Wooden Dining Furniture  ,,,,,,,,,https://www.amazon.in/Aarsun-Seater-Dining-Handcrafted-Furniture/dp/B08CSPG9XP/ref=sr_1_28?dchild=1&keywords=dining+set&qid=1624810189&sr=8-28
"Custom Decor Six Seater Dining Table Set (Brown) (6 Seater Dining Table, Honey Teak with Foster Chair)  ",Limited time deal,,,"₹49,999","₹28,025","Save ₹21,974 (44%)",4.3 out of 5 stars,37,https://www.amazon.in/Custom-Decor-Seater-Dining-Foster/dp/B07GYR3TCL/ref=sr_1_29?dchild=1&keywords=dining+set&qid=1624810189&smid=A2YO9BKHR2O0F8&sr=8-29
"DriftingWood Dining Table 6 Seater | Six Seater Dinning Table with Chairs | Dining Room Sets | Sheesham Wood, Honey Finish  ",,,,,,,4.0 out of 5 stars,70,https://www.amazon.in/DriftingWood-Sheesham-Seater-Dining-Living/dp/B07N5F8864/ref=sr_1_30?dchild=1&keywords=dining+set&qid=1624810189&sr=8-30
"Mamta Decoration Sheesham Wood Dining Set for Living Room (4 Seater, 4 Chair & Table (Brown)  ",,,,"₹21,839","₹16,009","Save ₹5,830 (27%)",4.2 out of 5 stars,382,https://www.amazon.in/Decoration-Sheesham-Dining-Living-Seater/dp/B07M72H4TF/ref=sr_1_31?dchild=1&keywords=dining+set&qid=1624810189&sr=8-31
Porash Furniture Sheesham Wood Wooden Dining Set 4 Seater | Dining Table Set with 4 Chairs (Warm Chestnut Finish)  ,,,,"₹30,599","₹16,999","Save ₹13,600 (44%)",,,https://www.amazon.in/Porash-Furniture-Sheesham-Wooden-Chestnut/dp/B08L855DMG/ref=sr_1_32?dchild=1&keywords=dining+set&qid=1624810189&sr=8-32
LowCost Furniture Solid Wooden 4 Seater Dining Set | Dining Table 4 Seater with Chairs | Dining Table 4 Seater Wooden | Finish Color - Teak  ,,,,"₹44,000","₹19,000","Save ₹25,000 (57%)",,,https://www.amazon.in/LowCost-Furniture-Wooden-Seater-Dining/dp/B09348PG1T/ref=sr_1_33?dchild=1&keywords=dining+set&qid=1624810189&sr=8-33
"Ramwood Furniture Dining Table 4 Seater | Four Seater Dinning Table with 4 Chairs for Home & Restaurant | Dining Room Sets | Sheesham Wood, Mahogany Finish  ",,,,"₹38,399","₹22,999","Save ₹15,400 (40%)",,,https://www.amazon.in/Ramwood-Furniture-Restaurant-Sheesham-Mahogany/dp/B096B1T9PM/ref=sr_1_34?dchild=1&keywords=dining+set&qid=1624810189&sr=8-34
Furniseworld Sheesham Wood 6 Seater Dining Table Set for Living Room Dining Table with 6 Chairs Furniture for Home (Maple Finish)  ,,,,"₹44,599","₹26,494","Save ₹18,105 (41%)",4.4 out of 5 stars,17,https://www.amazon.in/Furniseworld-Sheesham-Furniture-Dining-Finish/dp/B07P8G4M2W/ref=sr_1_35?dchild=1&keywords=dining+set&qid=1624810189&sr=8-35
Ramdoot Furniture Solid Sheesham Teak Wood Wooden Dining Table 4 Seater | Dining Table Set with 3 Chairs & 1 Bench | Home Dining Room Set Furniture Wooden Dining Table 4 Seater | Teak Finish  ,,,,"₹39,999","₹16,599","Save ₹23,400 (59%)",4.6 out of 5 stars,48,https://www.amazon.in/Ramdoot-Furniture-Wooden-Sheesham-Dining/dp/B084L7TT4L/ref=sr_1_36?dchild=1&keywords=dining+set&qid=1624810189&sr=8-36
Corazzin Furniture Sheesham Wood 6 Seater Dining Table Set with Chairs for Living Room (Mahogany Finish)  ,,,Only 1 left in stock.,"₹45,999","₹25,999","Save ₹20,000 (43%)",,,https://www.amazon.in/Corazzin-Furniture-Sheesham-Seater-Mahogany/dp/B08HSFK1XF/ref=sr_1_37?dchild=1&keywords=dining+set&qid=1624810189&sr=8-37
KendalWood™ Furniture  Sheesham Wood Dining Table with 3 Chairs 1 Banch  | 4 Seater Dining Set | Wooden Dining Table with Chair - Dining Room Furniture ( Finish Color :- Honey Finish)  ,,,,"₹35,000","₹17,899","Save ₹17,101 (49%)",1.0 out of 5 stars,1,https://www.amazon.in/KendalWoodTM-Furniture-Sheesham-Dining-Chairs-Seater/dp/B08T9X9XZ8/ref=sr_1_38?dchild=1&keywords=dining+set&qid=1624810189&sr=8-38
Solid Sheesham Teak Wood 4 Seater Dining Table with Cream Cushion Chairs Set for Dining Room Furniture | Dining Table 4 Seater with Chairs | Wooden Dining Table 4 Seater | Walnut Brown  ,,,,"₹29,999","₹23,999","Save ₹6,000 (20%)",,,https://www.amazon.in/Sheesham-Seater-Dining-Cushion-Furniture/dp/B097KSCBXK/ref=sr_1_39?dchild=1&keywords=dining+set&qid=1624810189&sr=8-39
HomeTown Corona Metal And Glass Four Seater Dining Set in White Colour  ,,,,"₹39,900","₹14,985","Save ₹24,915 (62%)",4.2 out of 5 stars,27,https://www.amazon.in/HomeTown-Corona-Four-Seater-Dining/dp/B07DPMVTQK/ref=sr_1_40?dchild=1&keywords=dining+set&qid=1624810189&sr=8-40
Classic Furniture Dining Table and Set of 4 Chairs  ,,,,,,,,,https://www.amazon.in/Classic-Furniture-Dining-Table-Chairs/dp/B093LPGKXM/ref=sr_1_41?dchild=1&keywords=dining+set&qid=1624810189&sr=8-41
8Reactive Wooden Art Solid Sheesham Wood Dining Table with 4 Chair for Living Room Wooden 4 Seater Dining Table Set for Home Dining Room Restaurant Dinner Table Set with Chairs (Natural Brown)  ,,,,"₹49,999","₹35,799","Save ₹14,200 (28%)",,,https://www.amazon.in/8Reactive-Wooden-Art-Dining-Table/dp/B097S93RWS/ref=sr_1_42?dchild=1&keywords=dining+set&qid=1624810189&sr=8-42
8Reactive Wooden Art Solid Sheesham Wood Dining Table with 4 Chair for Living Room Wooden 4 Seater Dining Table Set for Home Dining Room Restaurant Dinner Table Set with Chairs (Teak Finish)  ,,,,"₹49,999","₹35,799","Save ₹14,200 (28%)",,,https://www.amazon.in/8Reactive-Wooden-Art-Dining-Table/dp/B097S8LJ81/ref=sr_1_43?dchild=1&keywords=dining+set&qid=1624810189&sr=8-43
DK Craft Solid Sheesham Wood Wooden Dining Table with 4 Chairs | 4 Seater Dining Set | Wooden Dining Table with Chair - Dining Room Furniture | Teak Finish  ,,,,"₹49,999","₹18,799","Save ₹31,200 (62%)",,,https://www.amazon.in/DK-Craft-Sheesham-Dining-Table/dp/B097S7RHD6/ref=sr_1_44?dchild=1&keywords=dining+set&qid=1624810189&sr=8-44
DK Craft Sheesham Wood CNC Cuting Dining Room Furniture Solid Wooden 6 Seater Dining Table Home Dining Living Room |Solid Wood Dining Table Set (Walnut)  ,,,,"₹49,999","₹34,799","Save ₹15,200 (30%)",,,https://www.amazon.in/DK-Craft-Dining-Furniture-Table/dp/B097S75VNC/ref=sr_1_45?dchild=1&keywords=dining+set&qid=1624810189&sr=8-45
DK Craft Sheesham Wood 6 Seater Dining Table Set with 4 Chair & 1 Bench for Living Room 6 Piece Wooden Dining Room Sets for Home Kitchen Modern Dining Room Furniture (Walnut Finish)  ,,,,"₹49,999","₹35,799","Save ₹14,200 (28%)",,,https://www.amazon.in/DK-Craft-Dining-Table-Furniture/dp/B097S6C738/ref=sr_1_46?dchild=1&keywords=dining+set&qid=1624810189&sr=8-46
DK Craft Solid Sheesham Wood Dining Table with 2 Cushioned Chair for Living Room Wooden 2 Seater Dining Table Set for Home Dining Room Restaurant Dinner Table Set with Chairs (Rustic Teak Finish)  ,,,,"₹49,999","₹14,799","Save ₹35,200 (70%)",,,https://www.amazon.in/DK-Craft-Dining-Table-Restaurant/dp/B097S5KMYR/ref=sr_1_47?dchild=1&keywords=dining+set&qid=1624810189&sr=8-47
Aarsun Teak Wood 10 Seater Antique Gold Dining Set  ,,,,,,,,,https://www.amazon.in/Aarsun-Teak-Seater-Antique-Dining/dp/B08CV8X9VF/ref=sr_1_48?dchild=1&keywords=dining+set&qid=1624810189&sr=8-48
"Monika Wood Furniture Wooden Dining Chairs Only Wooden Dining Room Furniture with Cushions Sheesham Wood, Set of 2, Honey Oak Finish  ",,,,"₹12,499","₹6,834","Save ₹5,665 (45%)",4.9 out of 5 stars,14,https://www.amazon.in/Monika-Wood-Furniture-Cushions-Sheesham/dp/B089W86CNG/ref=sr_1_49?dchild=1&keywords=dining+set&qid=1624810189&sr=8-49
HomeTown Artois Solid Wood Six Seater Dining Set in Antique Cherry Colour  ,,,,"₹58,600","₹20,999","Save ₹37,601 (64%)",,,https://www.amazon.in/HomeTown-Artois-Seater-Dining-Antique/dp/B08379FJYM/ref=sr_1_50?dchild=1&keywords=dining+set&qid=1624810189&sr=8-50
Cizen Sheesham Wood Wooden Dining Set 4 Seater | Dining Table with 4 Chairs | Dining Room Furniture | Gray Cushions | Natural Honey Finish  ,,,,,"₹14,999",,3.6 out of 5 stars,29,https://www.amazon.in/Cizen-Sheesham-Furniture-Cushions-Natural/dp/B07W3G7RK7/ref=sr_1_49?dchild=1&keywords=dining+set&qid=1624810210&sr=8-49
Home Centre Veda Sheesham 4-Seater Dining Table Set with 4 Chairs  ,,,,"₹88,950","₹53,370","Save ₹35,580 (40%)",,,https://www.amazon.in/Home-Centre-Sheesham-4-Seater-Dining/dp/B0952CZ88M/ref=sr_1_50?dchild=1&keywords=dining+set&qid=1624810210&sr=8-50
Home Centre Veda Sheesham 6-Seater Dining Table Set with 6 Chairs  ,,,,"₹1,21,750","₹73,050","Save ₹48,700 (40%)",,,https://www.amazon.in/Home-Centre-Sheesham-6-Seater-Dining/dp/B0952CR23T/ref=sr_1_51?dchild=1&keywords=dining+set&qid=1624810210&sr=8-51
Stream Furniture Eight Seater Dining Table Set (Honey Finish)  ,,,,"₹60,000","₹43,499","Save ₹16,501 (28%)",,,https://www.amazon.in/Stream-Furniture-Seater-Dining-Finish/dp/B097DDY176/ref=sr_1_52?dchild=1&keywords=dining+set&qid=1624810210&sr=8-52
"Krishna Wood Decor Sheesham Wood Dining Table with Chairs | Dining Set Furniture | Balcony | Living Room (Sheesham Wood Dining Table with 4 Chairs, Mahogany Finish)  ",,,,"₹39,999","₹22,999","Save ₹17,000 (43%)",5.0 out of 5 stars,20,https://www.amazon.in/Krishna-Wood-Decor-Sheesham-Furniture/dp/B08BLTPW6M/ref=sr_1_53?dchild=1&keywords=dining+set&qid=1624810210&sr=8-53
OAKNEST Supreme Oak with Marina Dining Room Set for Indoor and Outdoor (Count : 5; Color: Globus Brown)  ,,,Only 1 left in stock.,"₹9,525","₹7,500","Save ₹2,025 (21%)",5.0 out of 5 stars,1,https://www.amazon.in/OAKNEST-Supreme-Marina-Dining-Outdoor/dp/B095YXSQX2/ref=sr_1_54?dchild=1&keywords=dining+set&qid=1624810210&sr=8-54
S Brothers Helios Nora Regina Glass 4-Seater Dining Table Set with 4 Chairs  ,,,,,,,,,https://www.amazon.in/Brothers-Helios-Regina-4-Seater-Dining/dp/B097TH55BC/ref=sr_1_55?dchild=1&keywords=dining+set&qid=1624810210&sr=8-55
"Custom Decor Solid Wood CNC 4 Seater Dining Set in Provincial Teak Finish Dining Set and Chairs (4 Seater Dining Table, 4 Seater with Printed Cushion| Honey Finish with Bench)  ",Best seller,,,"₹30,000","₹18,999","Save ₹11,001 (37%)",4.4 out of 5 stars,45,https://www.amazon.in/gp/bestsellers/kitchen/5689415031/ref=sr_bs_7_5689415031_1
DK Craft Wooden Solid Sheesham Wood Dining Table 4 Seater | Dining Table Set with 2 Chairs & 1 Bench | Home Dining Room Furniture Teak Wood Dining Table 4 Seater | Walnut Finish  ,,,,"₹49,999","₹17,799","Save ₹32,200 (64%)",,,https://www.amazon.in/DK-Craft-Dining-Table-Furniture/dp/B097S8DC4F/ref=sr_1_57?dchild=1&keywords=dining+set&qid=1624810210&sr=8-57
Mamta Decoration Sheesham Wooden 4 Seater Dining Table Set for Home Dining Room Furniture Mahogany Finish  ,,,,"₹27,902","₹16,894","Save ₹11,008 (39%)",4.2 out of 5 stars,27,https://www.amazon.in/Decoration-Sheesham-Wooden-Furniture-Mahogany/dp/B07MVD85SN/ref=sr_1_58?dchild=1&keywords=dining+set&qid=1624810210&sr=8-58
Home Centre Diana Beechwood Veneer Finish 4-Seater Dining Table with 4 Chairs (Walnut)  ,,,,"₹37,800","₹16,300","Save ₹21,500 (57%)",3.9 out of 5 stars,67,https://www.amazon.in/Home-Centre-Beechwood-Veneer-4-Seater/dp/B08L6LV582/ref=sr_1_49?dchild=1&keywords=dining+set&qid=1624810210&sr=8-49
RK WOOD Dining Table 4 Seater with Chair | 4 Seater Dining Table Sets Wooden | Dining Room Sets | Dining Table Sets | Furniture Sheesham Wood Dining Square Table | Honey Finish  ,,,,"₹39,999","₹16,999","Save ₹23,000 (58%)",,,https://www.amazon.in/RK-WOOD-Dining-Furniture-Sheesham/dp/B08ZLX1MT7/ref=sr_1_50?dchild=1&keywords=dining+set&qid=1624810210&sr=8-50
DK Craft Solid Sheesham Wood Dining Table with 4 Chair for Living Room Wooden 4 Seater Dining Table Set for Home Dining Room Restaurant Dinner Table Set with Chairs (Natural Brown)  ,,,,"₹49,999","₹17,799","Save ₹32,200 (64%)",,,https://www.amazon.in/DK-Craft-Dining-Table-Restaurant/dp/B097S7LP1W/ref=sr_1_51?dchild=1&keywords=dining+set&qid=1624810210&sr=8-51
"Shreya Decor Wooden Dining Table 4 Seater | Four Seater Dinning Table with Chairs | Dining Room Sets | Sheesham Wood, (Finish-Honey, with White Cousion)  ",,,,"₹39,999","₹18,499","Save ₹21,500 (54%)",,,https://www.amazon.in/Shreya-Decor-Dinning-Sheesham-Finish-Honey/dp/B0975LZVXL/ref=sr_1_52?dchild=1&keywords=dining+set&qid=1624810210&sr=8-52
"Monika Wood Furniture Wood Wooden Dining Chairs Only | Wooden Dinning Chairs | Dining Room Furniture with Cushions | Sheesham Wood, Set of 6, Teak Finish  ",,,,"₹33,399","₹22,048","Save ₹11,351 (34%)",5.0 out of 5 stars,3,https://www.amazon.in/Monika-Wood-Furniture-Cushions-Sheesham/dp/B08FT3CYNH/ref=sr_1_53?dchild=1&keywords=dining+set&qid=1624810210&sr=8-53
The kashth Wooden Dining Set 4 Seater | Dining Table with 4 Chairs | Dining Room Furniture | Gray Cushions | Natural Honey Finish (Medium)  ,,,,,,,,,https://www.amazon.in/kashth-Wooden-Furniture-Cushions-Natural/dp/B096NDT58C/ref=sr_1_54?dchild=1&keywords=dining+set&qid=1624810210&sr=8-54
"KendalWood™ Furniture Sheesham Wood  CNC Cutting Dining Table with 4 Chairs, | 4 Seater Dining Set  (Finish Color:- Honey Finish with Cream Cushions)  ",,,,"₹23,000","₹19,999","Save ₹3,001 (13%)",4.1 out of 5 stars,12,https://www.amazon.in/KendalWoodTM-Furniture-Sheesham-Cutting-Dining/dp/B08F7CCGDQ/ref=sr_1_55?dchild=1&keywords=dining+set&qid=1624810210&sr=8-55
CIZEN Sheesham Wood Dining Set 6 Seater | for Home & Dining Room | Wooden Dinning Table with 6 Curver Back Chairs | Dining Room Set | Natural Brown  ,,,,,"₹25,999",,,,https://www.amazon.in/CIZEN-Sheesham-Dining-Dinning-Natural/dp/B07R16KLGP/ref=sr_1_56?dchild=1&keywords=dining+set&qid=1624810210&sr=8-56
CasaCraft by Pepperfry - Fumio 4 Seater Dining Set in Walnut & Grey Finish  ,,,,"₹39,999","₹25,397","Save ₹14,602 (37%)",,,https://www.amazon.in/CasaCraft-Pepperfry-Seater-Dining-Walnut/dp/B08YK7W3R8/ref=sr_1_57?dchild=1&keywords=dining+set&qid=1624810210&sr=8-57
"Porash Furniture Dining Table 4 Seater | Dining Table Set with 3 Chairs & 1 Bench | Solid Sheesham Wood,Teak Finish  ",,,,"₹27,999","₹16,399","Save ₹11,600 (41%)",,,https://www.amazon.in/Porash-Furniture-Dining-Seater-Sheesham/dp/B096XYB53R/ref=sr_1_58?dchild=1&keywords=dining+set&qid=1624810210&sr=8-58
MV Furniture Dining Table with 6 Chairs with 1 Table|6 Seater Dining Set- Dining Room Furniture (Provincial Teak Finish) | Wood Type :- Sheesham Wood  ,,,,"₹50,000","₹27,959","Save ₹22,041 (44%)",5.0 out of 5 stars,4,https://www.amazon.in/MV-Furniture-Dining-Chairs-Provincial/dp/B0845NQPQS/ref=sr_1_59?dchild=1&keywords=dining+set&qid=1624810210&sr=8-59
Deko Style Wood Dining Table 4 Seater Set with Chairs | Dining Table Sets | 4 Seater Dining Table Wooden | Dining Room Furniture Sets | Sheesham Wood 4 Seater Dining Table | Mahogany Finish  ,,,,"₹59,999","₹21,999","Save ₹38,000 (63%)",,,https://www.amazon.in/Deko-Style-Furniture-Sheesham-Mahogany/dp/B0967PMFS9/ref=sr_1_60?dchild=1&keywords=dining+set&qid=1624810210&sr=8-60
Royaloak Milan Four Seater Dining Table Set (Black)  ,Deal of the Day ,,,"₹19,230","₹15,549","Save ₹3,681 (19%)",3.9 out of 5 stars,312,https://www.amazon.in/Royaloak-Milan-Seater-Dining-Table/dp/B016WO17MC/ref=sr_1_61?dchild=1&keywords=dining+set&qid=1624810210&sr=8-61
NO BEAR Sheesham Wood Wooden Dining Set 4 Seater | Dining Table with 4 Chairs | Dining Room Furniture | Gray Cushions | Natural Honey Finish (Medium)  ,,,,"₹24,999","₹16,999","Save ₹8,000 (32%)",,,https://www.amazon.in/NO-BEAR-Sheesham-Furniture-Cushions/dp/B0926NMLG7/ref=sr_1_62?dchild=1&keywords=dining+set&qid=1624810210&sr=8-62
"JS Home Décor Sheesham Wood Dining Set for Living Room (4 Seater, Walnut Brown)  ",,,,"₹15,999","₹10,999","Save ₹5,000 (31%)",5.0 out of 5 stars,5,https://www.amazon.in/Js-Home-D%C3%A9cor-Sheesham-Cushion/dp/B077FRDSP1/ref=sr_1_63?dchild=1&keywords=dining+set&qid=1624810210&sr=8-63
"Hariom Handicraft KendalWood Furniture Sheesham Wood Dining Table with 6 Chairs, 1 Table, 6 Seater Dining Set -Dining Room Furniture (Finish Color -Honey)  ",,,,"₹50,000","₹36,999","Save ₹13,001 (26%)",3.4 out of 5 stars,8,https://www.amazon.in/Hariom-Handicraft-KendalWood-Furniture-Sheesham/dp/B081GXGF1N/ref=sr_1_64?dchild=1&keywords=dining+set&qid=1624810210&sr=8-64
"Chetan Interiors Solid Sheesham Wood 4 Seater Dining Table Set (Pure Sheesham Wood) (Urban, Walnut)  ",,,,"₹24,999","₹16,999","Save ₹8,000 (32%)",5.0 out of 5 stars,8,https://www.amazon.in/Chetan-Interiors-Sheesham-Seater-Dining/dp/B097HRVX83/ref=sr_1_65?dchild=1&keywords=dining+set&qid=1624810210&sr=8-65
RK WOOD Dining Table 6 Seater Set with 6 Chairs | Dining Table Sets | 6 Seater Dining Table Wooden | Sheesham Wood Dining Table Furniture | Dining Room Sets | Rectangle Brown Finish  ,,,,"₹69,999","₹44,999","Save ₹25,000 (36%)",,,https://www.amazon.in/RK-WOOD-Sheesham-Furniture-Rectangle/dp/B091NQHY1Y/ref=sr_1_66?dchild=1&keywords=dining+set&qid=1624810210&sr=8-66
"Ramwood Furniture Dining Table 6 Seater | Six Seater Dinning Table with 4 Chairs & 1 Bench for Home & Restaurant | Dining Room Sets | Sheesham Wood, Natural Honey Finish  ",,,,"₹71,699","₹40,999","Save ₹30,700 (43%)",,,https://www.amazon.in/Ramwood-Furniture-Dinning-Restaurant-Sheesham/dp/B096B26H94/ref=sr_1_67?dchild=1&keywords=dining+set&qid=1624810210&sr=8-67
KendalWood™ Furniture Sheesham Wood CNC Cuting Dining Table with 4 Chairs with 1 Bench|6 Seater Dining Set- Dining Room Furniture (Finish Color:-Honey Teak with Cream Cushion)  ,,,,"₹40,000","₹29,999","Save ₹10,001 (25%)",3.6 out of 5 stars,35,https://www.amazon.in/KendalWood-Furniture-Sheesham-Cuting-Cushion/dp/B088PNKQ44/ref=sr_1_68?dchild=1&keywords=dining+set&qid=1624810210&sr=8-68
