name,badge_1,badge_2,badge_3,mrp,discounted_price,discount,rating,rating_count,link
Home Centre Regina 4-Seater Dining Table with 4 Chairs (Black)  ,,Sponsored,,"₹37,375","₹15,450","Save ₹21,925 (59%)",4.6 out of 5 stars,3,https://www.amazon.in/gp/slredirect/picassoRedirect.html/ref=pa_sp_atf_aps_sr_pg1_1?ie=UTF8&adId=A0904408ONLNWVTY7EQM&url=%2FHome-Centre-Regina-4-Seater-Dining%2Fdp%2FB08L6MNH8P%2Fref%3Dsr_1_1_sspa%3Fdchild%3D1%26keywords%3Ddining%2Bset%26qid%3D1625496068%26sr%3D8-1-spons%26psc%3D1&qualifier=1625496068&id=515582370135819&widgetName=sp_atf
OAKNEST Supreme Oak with Marina Dining Room Set for Indoor and Outdoor (Count : 5; Color: Globus Brown)  ,,Sponsored,,"₹9,525","₹7,500","Save ₹2,025 (21%)",5.0 out of 5 stars,1,https://www.amazon.in/gp/slredirect/picassoRedirect.html/ref=pa_sp_atf_aps_sr_pg1_1?ie=UTF8&adId=A02426192J67CG1WBVY1J&url=%2FOAKNEST-Supreme-Marina-Dining-Outdoor%2Fdp%2FB095YXSQX2%2Fref%3Dsr_1_2_sspa%3Fdchild%3D1%26keywords%3Ddining%2Bset%26qid%3D1625496068%26sr%3D8-2-spons%26psc%3D1&qualifier=1625496068&id=515582370135819&widgetName=sp_atf
Custom Decor CNC Cuting Sheesham Wood Dining Table 4 Seater | Wooden Dining Room Furniture | 4 Chairs with Cushion | Honey Teak Brown Finish  ,Best seller,,,"₹30,000","₹18,499","Save ₹11,501 (38%)",4.4 out of 5 stars,46,https://www.amazon.in/gp/bestsellers/kitchen/5689415031/ref=sr_bs_2_5689415031_1
Royaloak Milan Four Seater Dining Table Set (Black)  ,,,,"₹19,230","₹16,190","Save ₹3,040 (16%)",3.9 out of 5 stars,315,https://www.amazon.in/Royaloak-Milan-Seater-Dining-Table/dp/B016WO17MC/ref=sr_1_4?dchild=1&keywords=dining+set&qid=1625496068&sr=8-4
Home Centre Helios Nora Regina Glass 4-Seater Dining Table Set with 4 Chairs  ,,,,"₹39,900","₹12,950","Save ₹26,950 (68%)",,,https://www.amazon.in/Home-Centre-Helios-Regina-4-Seater/dp/B096R379PL/ref=sr_1_5?dchild=1&keywords=dining+set&qid=1625496068&sr=8-5
KendalWood™ Furniture Sheesham Wood CNC Cuting Dining Table with 4 Chairs with 1 Bench|6 Seater Dining Set- Dining Room Furniture (Finish Color:-Honey Teak with Cream Cushion)  ,,,,"₹40,000","₹29,999","Save ₹10,001 (25%)",3.5 out of 5 stars,36,https://www.amazon.in/KendalWood-Furniture-Sheesham-Cuting-Cushion/dp/B088PNKQ44/ref=sr_1_6?dchild=1&keywords=dining+set&qid=1625496068&sr=8-6
OAKNEST Supreme Oak with Marina Dining Room Set for Indoor and Outdoor (Count : 5; Color: Globus Brown)  ,,,,"₹9,525","₹7,500","Save ₹2,025 (21%)",5.0 out of 5 stars,1,https://www.amazon.in/OAKNEST-Supreme-Marina-Dining-Outdoor/dp/B095YXSQX2/ref=sr_1_7?dchild=1&keywords=dining+set&qid=1625496068&sr=8-7
Sarswati Furniture Sheesham Wood Dining Table 6 Seater | Wooden Dinning Room Furniture | 4 Chair & 2 Seater Bench | 1 Table | Balcony Dining Set | Provincial Teak Finish  ,,,,,,,5.0 out of 5 stars,2,https://www.amazon.in/Sarswati-Furniture-Sheesham-Dinning-Provincial/dp/B07Y9CSFSD/ref=sr_1_8?dchild=1&keywords=dining+set&qid=1625496068&sr=8-8
Stream Furniture Solid Wood 4 Seater Dining Table Set with 3 Chairs and 1 Bench for Living Room | Home & Office Furniture | Hotel & Dinner Restaurant | Honey Finish  ,,,,"₹20,000","₹16,999","Save ₹3,001 (15%)",4.5 out of 5 stars,8,https://www.amazon.in/Stream-Furniture-Seater-Dining-Restaurant/dp/B08W3GZCWG/ref=sr_1_9?dchild=1&keywords=dining+set&qid=1625496068&sr=8-9
OAKNEST Supreme Web with Marina Dining Room Set for Indoor and Outdoor Use (Color: Jet Black | Count: 5)  ,,,Only 2 left in stock.,"₹12,325","₹9,000","Save ₹3,325 (27%)",,,https://www.amazon.in/OAKNEST-Supreme-Marina-Dining-Outdoor/dp/B096GC2C6P/ref=sr_1_10?dchild=1&keywords=dining+set&qid=1625496068&sr=8-10
"Hariom Handicraft Kendal Wood Furniture Sheesham Dining Table with 6 Chairs, 6 Seater Set, Room (Teak Finish_1)  ",,,,"₹60,000","₹36,999","Save ₹23,001 (38%)",4.0 out of 5 stars,15,https://www.amazon.in/Hariom-Handicraft-Furniture-Sheesham-Finish_1/dp/B081LDT3PS/ref=sr_1_11?dchild=1&keywords=dining+set&qid=1625496068&sr=8-11
"Mamta Decoration Sheesham Wood Dining Set for Living Room (4 Seater, 4 Chair & Table (Brown)  ",,,,"₹21,839","₹16,009","Save ₹5,830 (27%)",4.2 out of 5 stars,386,https://www.amazon.in/Decoration-Sheesham-Dining-Living-Seater/dp/B07M72H4TF/ref=sr_1_12?dchild=1&keywords=dining+set&qid=1625496068&sr=8-12
Furinno Sheesham Wood 4 Seater Dining Table Set with Chairs for Home Living Room Hall (Warm Chestnut Finish)  ,Limited time deal,,,"₹29,999","₹18,199","Save ₹11,800 (39%)",3.7 out of 5 stars,25,https://www.amazon.in/Furinno-Sheesham-Seater-Dining-Chestnut/dp/B08HPZPFNJ/ref=sr_1_13?dchild=1&keywords=dining+set&qid=1625496068&sr=8-13
Daintree Sheesham Wood Dining Table with 4 Chair for Dining Room Wooden 4 Seater Dining Room Set for Home & Living Room Furniture (Brown Finish)  ,,,,"₹25,999","₹16,999","Save ₹9,000 (35%)",4.6 out of 5 stars,31,https://www.amazon.in/Daintree-Sheesham-Dining-Wooden-Furniture/dp/B08GSR6WXN/ref=sr_1_14?dchild=1&keywords=dining+set&qid=1625496068&sr=8-14
Douceur Furnitures Solid Sheesham Wooden Furniture Sheesham Wood Natural Teak Finish 4 Seater Dining Table Set with Chairs with Grey Cushions  ,,,,"₹31,999","₹17,498","Save ₹14,501 (45%)",4.4 out of 5 stars,38,https://www.amazon.in/Douceur-Furnitures-Sheesham-Furniture-Cushions/dp/B08GWQTCQC/ref=sr_1_15?dchild=1&keywords=dining+set&qid=1625496068&sr=8-15
"Porash Furniture Dining Table 4 Seater | Dining Table Set with 3 Chairs & 1 Bench | Solid Sheesham Wood,Teak Finish  ",,,,,,,,,https://www.amazon.in/Porash-Furniture-Dining-Seater-Sheesham/dp/B096XYB53R/ref=sr_1_16?dchild=1&keywords=dining+set&qid=1625496068&sr=8-16
MV Furniture Dining Table with 6 Chairs with 1 Table|6 Seater Dining Set- Dining Room Furniture (Provincial Teak Finish) | Wood Type :- Sheesham Wood  ,,,,"₹50,000","₹27,959","Save ₹22,041 (44%)",5.0 out of 5 stars,4,https://www.amazon.in/MV-Furniture-Dining-Chairs-Provincial/dp/B0845NQPQS/ref=sr_1_17?dchild=1&keywords=dining+set&qid=1625496068&sr=8-17
MV Furniture Dining Table 6 Seater | Wooden Dining Room Furniture with Cushions & Teak Finish | Wood Type :- Sheesham Wood  ,,,,"₹40,000","₹27,459","Save ₹12,541 (31%)",4.8 out of 5 stars,5,https://www.amazon.in/MV-Furniture-Dining-Seater-Cushions/dp/B0845PMCYS/ref=sr_1_18?dchild=1&keywords=dining+set&qid=1625496068&sr=8-18
Home Centre Diana 6-Seater Dining Table with 4 Chairs and 1 Big Bench (Walnut)  ,,,,"₹49,875","₹21,950","Save ₹27,925 (56%)",3.9 out of 5 stars,72,https://www.amazon.in/Home-Centre-6-Seater-Dining-Chairs/dp/B08JYNQG4J/ref=sr_1_19?dchild=1&keywords=dining+set&qid=1625496068&sr=8-19
Porash Furniture CNC Cuting Sheesham Wood Dining Table 4 Seater Set | Wooden 4 Seater Dining Furniture | 4 Chairs with Cushion Teak Wood Dining Table Set Furniture for Living Room (Honey Finish)  ,,,,,,,4.3 out of 5 stars,5,https://www.amazon.in/Porash-Furniture-Cuting-Sheesham-Cushion/dp/B08X3CVSTZ/ref=sr_1_20?dchild=1&keywords=dining+set&qid=1625496068&sr=8-20
Cizen Sheesham Wood Wooden Dining Set 4 Seater | Dining Table with 4 Chairs | Dining Room Furniture | Gray Cushions | Natural Honey Finish  ,,,,,,,3.6 out of 5 stars,29,https://www.amazon.in/Cizen-Sheesham-Furniture-Cushions-Natural/dp/B07W3G7RK7/ref=sr_1_21?dchild=1&keywords=dining+set&qid=1625496068&sr=8-21
"MV Furniture Dining Table with Chairs & Chusion | Dining Room Furniture | 6 Seater Dining Set, Teak Finish | 6 Chairs + Blue Cushions| Wood Type : Sheesham Wood  ",,,,"₹45,799","₹27,959","Save ₹17,840 (39%)",4.8 out of 5 stars,9,https://www.amazon.in/MV-Furniture-Dining-Chusion-Cushions/dp/B0848XNL4H/ref=sr_1_22?dchild=1&keywords=dining+set&qid=1625496068&sr=8-22
@home by Nilkamal Peak 1 + 4 + Bench Dining Set (Cappucino)  ,Limited time deal,,,"₹49,400","₹21,799","Save ₹27,601 (56%)",2.6 out of 5 stars,3,https://www.amazon.in/home-Nilkamal-Peak-Dining-Cappucino/dp/B07VQSD7SD/ref=sr_1_23?dchild=1&keywords=dining+set&qid=1625496068&sr=8-23
HomeTown Ronald Solid Wood Four Seater Dining Set in cappuccino Colour  ,,,,,,,3.0 out of 5 stars,21,https://www.amazon.in/HomeTown-Ronald-Seater-Dining-cappuccino/dp/B07M8T1JF5/ref=sr_1_24?dchild=1&keywords=dining+set&qid=1625496068&sr=8-24
HomeTown Corona Metal And Glass Four Seater Dining Set in White Colour  ,,,,"₹39,900","₹14,985","Save ₹24,915 (62%)",4.2 out of 5 stars,27,https://www.amazon.in/HomeTown-Corona-Four-Seater-Dining/dp/B07DPMVTQK/ref=sr_1_25?dchild=1&keywords=dining+set&qid=1625496068&sr=8-25
"Custom Decor Six Seater Dining Table Set (Brown) (6 Seater Dining Table, Honey Teak with Foster Chair)  ",,,,"₹49,999","₹29,999","Save ₹20,000 (40%)",4.3 out of 5 stars,38,https://www.amazon.in/Custom-Decor-Seater-Dining-Foster/dp/B07GYR3TCL/ref=sr_1_26?dchild=1&keywords=dining+set&qid=1625496068&sr=8-26
Stream Furniture Sheesham Wood Dining Table 6 Seater / 6 Seater Dining Set with Chairs for Dining Room Walnut Color  ,,,,"₹45,000","₹33,731","Save ₹11,269 (25%)",,,https://www.amazon.in/Stream-Furniture-Sheesham-Dining-Seater/dp/B096RTZD55/ref=sr_1_27?dchild=1&keywords=dining+set&qid=1625496068&sr=8-27
Chetan Interiors Solid Sheesham Wood Bar Dining Table 2 Seater Set Solid Wooden 2 Seater Bar Dining Table with Bar Chairs Set 2 Home Living Room Dining Room Teak Wood Furniture Dining Table  ,,,,"₹17,000","₹14,000","Save ₹3,000 (18%)",5.0 out of 5 stars,1,https://www.amazon.in/Chetan-Interiors-Sheesham-Dining-Furniture/dp/B08BYR8BSF/ref=sr_1_28?dchild=1&keywords=dining+set&qid=1625496068&sr=8-28
KendalWood™ Furniture Sheesham Wood Dining Table(45x30 inch)  with Two Chair |  Two Seater Dining Set |  (Finish Color:- Natural  Finish with Cream Cushions)  ,,,,"₹14,000","₹12,999","Save ₹1,001 (7%)",4.6 out of 5 stars,3,https://www.amazon.in/KendalWoodTM-Furniture-Sheesham-Dining-Seater/dp/B08F7K1N4V/ref=sr_1_29?dchild=1&keywords=dining+set&qid=1625496068&sr=8-29
KendalWood™ Furniture  Sheesham Wood Dining Table(57x35 inch) with 6 Chairs | 6 Seater Dining Set | Wooden Dining Table with Chair - Dining Room Furniture ( Natural Teak Finish with Cushion)  ,,,,"₹50,000","₹32,999","Save ₹17,001 (34%)",3.7 out of 5 stars,19,https://www.amazon.in/KendalWoodTM-Furniture-Sheesham-Dining-Chairs-Seater/dp/B08J473KSS/ref=sr_1_30?dchild=1&keywords=dining+set&qid=1625496068&sr=8-30
Furniture Mart Solid Wooden Sheesham Wood 2 Seater Dining Table Set with 2 Chair for Dining Room Wooden Dining Chairs Set of 2 Living Room Furniture Teak Wood Dining Table 2 Seater - Teak Finish  ,,,,"₹24,999","₹12,498","Save ₹12,501 (50%)",5.0 out of 5 stars,1,https://www.amazon.in/Furniture-Mart-Wooden-Sheesham-Seater/dp/B094Y9DKH6/ref=sr_1_31?dchild=1&keywords=dining+set&qid=1625496068&sr=8-31
AL Aayat Furniture's Sheesham Wood CNC Cuting Dining Table with 2 Chairs with 1 Bench | 4 Seater Dining Set- Dining Room Furniture (Honey Finish with Cream Cushion)  ,,,,"₹30,000","₹15,999","Save ₹14,001 (47%)",4.5 out of 5 stars,2,https://www.amazon.in/Aayat-Furnitures-Sheesham-Furniture-Cushion/dp/B08Q87XGFW/ref=sr_1_32?dchild=1&keywords=dining+set&qid=1625496068&sr=8-32
Home Centre Montoya 4 Seater Dining Table Set with Chair and Bench  ,,,Only 2 left in stock.,"₹40,000","₹19,770","Save ₹20,230 (51%)",4.1 out of 5 stars,195,https://www.amazon.in/Home-Centre-Montoya-Seater-Dining/dp/B07W668SGM/ref=sr_1_33?dchild=1&keywords=dining+set&qid=1625496068&sr=8-33
"KendalWood™ Furniture Sheesham Wood Dining Table(57x35) with 6 Chairs,| 6 Seater Dining Set | Wooden Dining Table with Chair - Dining Room Furniture (Finish Color:- Honey Finish with Cream Cushions)  ",,,,"₹40,000","₹28,999","Save ₹11,001 (28%)",3.5 out of 5 stars,9,https://www.amazon.in/KendalWoodTM-Furniture-Sheesham-Dining-Chairs/dp/B08GJJH443/ref=sr_1_34?dchild=1&keywords=dining+set&qid=1625496068&sr=8-34
Credenza Solid Sheesham Wood Wooden Dining Table with 4 Chairs | 4 Seater Dining Set | Wooden Dining Table with Chair - Dining Room Furniture | Mahogany  ,,,,"₹30,000","₹20,998","Save ₹9,002 (30%)",4.1 out of 5 stars,8,https://www.amazon.in/Credenza-Sheesham-Wooden-Dining-Chairs/dp/B08PNQDF6J/ref=sr_1_35?dchild=1&keywords=dining+set&qid=1625496068&sr=8-35
Amazon Brand - Solimo Clara 4 Seater Sheesham Wood Dining Table Set with Chairs (Walnut Finish)  ,,,,"₹36,999","₹22,999","Save ₹14,000 (38%)",4.1 out of 5 stars,17,https://www.amazon.in/Amazon-Brand-Solimo-Seater-Sheesham/dp/B083SWXZBZ/ref=sr_1_36?dchild=1&keywords=dining+set&qid=1625496068&sr=8-36
Furinno Sheesham Wood 6 Seater Dining Table Set for Living Room Dining Room Home Hall Hotel Dinner Restaurant Wooden Dining Table with 4 Chairs & 1 Bench Furniture for Home (Honey Finish)  ,,,Only 1 left in stock.,"₹44,784","₹27,990","Save ₹16,794 (38%)",,,https://www.amazon.in/Furinno-Sheesham-Seater-Restaurant-Furniture/dp/B08LYM5BD2/ref=sr_1_37?dchild=1&keywords=dining+set&qid=1625496068&sr=8-37
Smilemindia Plastic 4 Seater Dining Set (Finish Color - Brown)  ,,,,"₹18,000","₹11,500","Save ₹6,500 (36%)",5.0 out of 5 stars,1,https://www.amazon.in/Smilemindia-Plastic-Seater-Dining-Finish/dp/B0924LFTJK/ref=sr_1_38?dchild=1&keywords=dining+set&qid=1625496068&sr=8-38
LowCost Furniture Solid Wooden 4 Seater Dining Set | Dining Table 4 Seater with Chairs | Dining Table 4 Seater Wooden | Finish Color - Teak  ,,,,"₹44,000","₹19,000","Save ₹25,000 (57%)",,,https://www.amazon.in/LowCost-Furniture-Wooden-Seater-Dining/dp/B09348PG1T/ref=sr_1_39?dchild=1&keywords=dining+set&qid=1625496068&sr=8-39
Custom Decor Sheesham Wood 4 Seater Dining Table Set with Chairs for Living Room (Honey Teak Brown)  ,,,,"₹29,999","₹18,999","Save ₹11,000 (37%)",3.8 out of 5 stars,15,https://www.amazon.in/Custom-Decor-Sheesham-Seater-Dining/dp/B07SDNQQW3/ref=sr_1_40?dchild=1&keywords=dining+set&qid=1625496068&sr=8-40
Hariom Handicraft Sheesham Wood Wooden Dining Table Set with 8 Chairs | Home and Living Room | Chestnut Finish  ,,,,"₹60,000","₹36,999","Save ₹23,001 (38%)",5.0 out of 5 stars,1,https://www.amazon.in/Hariom-Handicraft-Sheesham-Wooden-Chestnut/dp/B07G16BLV4/ref=sr_1_41?dchild=1&keywords=dining+set&qid=1625496068&sr=8-41
Corazzin Furniture Sheesham Wood 4 Seater Dining Table Set for Livinig Room- Warm Chestnut  ,,,Only 2 left in stock.,"₹25,598","₹18,999","Save ₹6,599 (26%)",4.4 out of 5 stars,32,https://www.amazon.in/Corazzin-Furniture-Sheesham-Livinig-Chestnut/dp/B07PFN1JPH/ref=sr_1_42?dchild=1&keywords=dining+set&qid=1625496068&sr=8-42
Amazon Brand - Solimo Clara 6 Seater Sheesham Wood Dining Table Set with Chairs (Walnut Finish)  ,,,,"₹58,999","₹34,999","Save ₹24,000 (41%)",3.0 out of 5 stars,3,https://www.amazon.in/Amazon-Brand-Solimo-Seater-Sheesham/dp/B083SYCS14/ref=sr_1_43?dchild=1&keywords=dining+set&qid=1625496068&sr=8-43
FURNIZY Solid Sheesham Wood Dining Chair Set with Cushion Wooden Furniture for Living Room Dinning Room Home Multipurpose Chairs Set of 2 for Study Room (Rustic Teak Finish)  ,,,,"₹11,198","₹7,199","Save ₹3,999 (36%)",,,https://www.amazon.in/FURNIZY-Sheesham-Cushion-Furniture-Multipurpose/dp/B08Y8VXYJD/ref=sr_1_44?dchild=1&keywords=dining+set&qid=1625496068&sr=8-44
Chetan Interiors Solid Sheesham Wood Bar Dining Table 2 Seater Set - Solid Sheesham Wood Dining Set with 2 Chairs (Desing I)  ,,,,"₹20,000","₹15,699","Save ₹4,301 (22%)",,,https://www.amazon.in/Chetan-Interiors-Sheesham-Dining-Seater/dp/B09881Z7VH/ref=sr_1_45?dchild=1&keywords=dining+set&qid=1625496068&sr=8-45
MV Furniture Solid Sheesham Wood Dining Table 6 Seater Set Dinning Room Furniture with 4 Chairs and 1 Bench Solid Wooden 6 Seater Dining Table with Cushion Teak Finish -  ,,,,"₹50,000","₹27,895","Save ₹22,105 (44%)",5.0 out of 5 stars,2,https://www.amazon.in/MV-Furniture-Sheesham-Dinning-Cushion/dp/B0846352B9/ref=sr_1_46?dchild=1&keywords=dining+set&qid=1625496068&sr=8-46
Home Centre Montoya 6 Seater Dining Table Set with Chair and Bench  ,,,,"₹63,200","₹29,460","Save ₹33,740 (53%)",3.4 out of 5 stars,50,https://www.amazon.in/Home-Centre-Montoya-Seater-Dining/dp/B07W3LL7PM/ref=sr_1_47?dchild=1&keywords=dining+set&qid=1625496068&sr=8-47
KendalWood™ Furniture Solid (Sheesham) Wood Dining Table with 6 Chairs | 6 Seater Dining Set (Finish Color: -Walnut Finish with Cream Cushion)  ,,,,"₹50,000","₹36,999","Save ₹13,001 (26%)",3.0 out of 5 stars,17,https://www.amazon.in/KendalWoodTM-Furniture-Sheesham-Dining-Chairs/dp/B08KSD2T5P/ref=sr_1_48?dchild=1&keywords=dining+set&qid=1625496068&sr=8-48
"DriftingWood Dining Table 6 Seater | Six Seater Dinning Table with Chairs | Dining Room Sets | Sheesham Wood, Honey Finish  ",,,,,,,4.0 out of 5 stars,76,https://www.amazon.in/DriftingWood-Sheesham-Seater-Dining-Living/dp/B07N5F8864/ref=sr_1_49?dchild=1&keywords=dining+set&qid=1625496068&sr=8-49
KendalWood™ Furniture  Sheesham Wood Dining Table with 3 Chairs 1 Banch  | 4 Seater Dining Set | Wooden Dining Table with Chair - Dining Room Furniture ( Finish Color :- Walnut Finish)  ,,,,"₹35,000","₹17,899","Save ₹17,101 (49%)",,,https://www.amazon.in/KendalWoodTM-Furniture-Sheesham-Dining-Chairs-Seater/dp/B08Z8BZMTT/ref=sr_1_50?dchild=1&keywords=dining+set&qid=1625496068&sr=8-50
OAKNEST Supreme Oak with Marina Dining Room Set for Indoor and Outdoor (Count : 5; Color: Jet Black)  ,,Sponsored,,"₹9,525","₹7,500","Save ₹2,025 (21%)",5.0 out of 5 stars,1,https://www.amazon.in/gp/slredirect/picassoRedirect.html/ref=pa_sp_atf_next_aps_sr_pg2_1?ie=UTF8&adId=A02424632U9ZIBNMEV3UX&url=%2FOAKNEST-Supreme-Marina-Dining-Outdoor%2Fdp%2FB095YXT6WQ%2Fref%3Dsr_1_49_sspa%3Fdchild%3D1%26keywords%3Ddining%2Bset%26qid%3D1625496089%26sr%3D8-49-spons%26psc%3D1&qualifier=1625496089&id=8625098867887516&widgetName=sp_atf_next
KendalWood™ Furniture  Solid Wood Dining Table with 4 Chairs | 4 Seater Dining Set | Wooden Dining Table with Chair - Dining Room Furniture ( Teak Finish with Cream Cushion)  ,,,,"₹30,000","₹19,999","Save ₹10,001 (33%)",3.5 out of 5 stars,13,https://www.amazon.in/KendalWoodTM-Furniture-Solid-Dining-Chairs-Seater/dp/B08MYMBN55/ref=sr_1_50?dchild=1&keywords=dining+set&qid=1625496089&sr=8-50
Amazon Brand - Solimo Karen Solid Sheesham Wood 4 Seater Dining Table with Chairs (Teak Finish)  ,,,,"₹41,000","₹23,499","Save ₹17,501 (43%)",4.7 out of 5 stars,5,https://www.amazon.in/Amazon-Brand-Solimo-Sheesham-Seater/dp/B085ZKX1TB/ref=sr_1_51?dchild=1&keywords=dining+set&qid=1625496089&sr=8-51
Corazzin Furniture Sheesham Wood 6 Seater Dining Table Set with Chairs for Living Room (Mahogany Finish)  ,,,Only 1 left in stock.,"₹45,999","₹25,999","Save ₹20,000 (43%)",,,https://www.amazon.in/Corazzin-Furniture-Sheesham-Seater-Mahogany/dp/B08HSFK1XF/ref=sr_1_52?dchild=1&keywords=dining+set&qid=1625496089&sr=8-52
Handwoody SheeshamWood Dining Table 4 Seater/Dining Table Set with Chairs in Natural Brown Finish  ,,,,"₹29,599","₹19,999","Save ₹9,600 (32%)",4.6 out of 5 stars,3,https://www.amazon.in/Handwoody-SheeshamWood-Dining-Seater-Natural/dp/B08RCRX8LG/ref=sr_1_53?dchild=1&keywords=dining+set&qid=1625496089&sr=8-53
Eagle Furniture Wooden Solid Sheesham Wood Dining Table 4 Seater Dining Table Set with 3 Chairs & 1 Bench Dining Room Furniture Wood Dining Table 4 Seater | Honey Finish  ,,,,"₹37,999","₹18,199","Save ₹19,800 (52%)",4.5 out of 5 stars,58,https://www.amazon.in/Eagle-Furniture-Wooden-Sheesham-Dining/dp/B08FMMWC2F/ref=sr_1_54?dchild=1&keywords=dining+set&qid=1625496089&sr=8-54
Furniturewallet Sheesham Wood Dining Table 6 Seater / 6 Seater Dining Set with Chairs for Dining Room Honey Color  ,,,,"₹42,599","₹32,999","Save ₹9,600 (23%)",4.6 out of 5 stars,24,https://www.amazon.in/Furniturewallet-Sheesham-Dining-Seater-Chairs/dp/B08KX38XYS/ref=sr_1_55?dchild=1&keywords=dining+set&qid=1625496089&sr=8-55
Art Window Solid Wooden Bamboo 2 Seater Dining Table Set with 2 Round Stool & 1 Large Round Stool for Dining Room Wooden Dining for Living Room(Walnut Burn)  ,,,,"₹7,999","₹3,549","Save ₹4,450 (56%)",5.0 out of 5 stars,1,https://www.amazon.in/Window-Wooden-Bamboo-Seater-Dining/dp/B08TRFTSY8/ref=sr_1_56?dchild=1&keywords=dining+set&qid=1625496089&sr=8-56
Furinno Sheesham Wood 6 Seater Wooden Dining Table with 6 Chairs Home and Living Room Hall (Teak Finish)  ,Limited time deal,,,"₹50,999","₹25,899","Save ₹25,100 (49%)",3.2 out of 5 stars,25,https://www.amazon.in/Furinno-Sheesham-Seater-Wooden-Dining/dp/B0837SYCCC/ref=sr_1_57?dchild=1&keywords=dining+set&qid=1625496089&sr=8-57
Royal Oak Geneva Dining Set with 6 Chairs (Black)  ,,,Only 2 left in stock.,"₹35,370","₹25,855","Save ₹9,515 (27%)",3.1 out of 5 stars,39,https://www.amazon.in/Royal-Geneva-Dining-Chairs-Black/dp/B015XPTEGW/ref=sr_1_58?dchild=1&keywords=dining+set&qid=1625496089&sr=8-58
Krishna Wood Decor Solid Sheesham Teak Wood Round Dining Table 4 Seater with Chairs Sets | Round Dining Table 4 Seater Wooden | Dining Table 4 Seater Set | Dining Room Sets Furniture | Walnut Finish  ,,,,"₹89,999","₹22,999","Save ₹67,000 (74%)",,,https://www.amazon.in/Krishna-Wood-Decor-Sheesham-Furniture/dp/B096SMDTR9/ref=sr_1_49?dchild=1&keywords=dining+set&qid=1625496089&sr=8-49
Ramdoot Furniture Solid Sheesham Teak Wood Wooden Dining Table 4 Seater | Dining Table Set with 3 Chairs & 1 Bench | Home Dining Room Set Furniture Wooden Dining Table 4 Seater | Teak Finish  ,,,,"₹39,999","₹16,599","Save ₹23,400 (59%)",4.6 out of 5 stars,49,https://www.amazon.in/Ramdoot-Furniture-Wooden-Sheesham-Dining/dp/B084L7TT4L/ref=sr_1_50?dchild=1&keywords=dining+set&qid=1625496089&sr=8-50
HomeTown Compact Solid Wood Four Seater Dining Set in Walnut Colour  ,,,,"₹50,000","₹22,989","Save ₹27,011 (54%)",3.4 out of 5 stars,26,https://www.amazon.in/HomeTown-Compact-Seater-Dining-Walnut/dp/B013GEQODI/ref=sr_1_51?dchild=1&keywords=dining+set&qid=1625496089&sr=8-51
KendalWood™ Furniture Sheesham Wood Wooden Dining Set 4 Seater | Dining Table Set with 4 Chairs (Finish Color :-Warm Chestnut Finish with Cushion)  ,,,,"₹35,000","₹18,999","Save ₹16,001 (46%)",,,https://www.amazon.in/KendalWoodTM-Furniture-Sheesham-Wooden-Dining/dp/B095Y685SY/ref=sr_1_52?dchild=1&keywords=dining+set&qid=1625496089&sr=8-52
"KendalWood™ Furniture Sheesham Wood Dining Table with 4 Poster Chairs, 1 Bench |6 Seater Dining Set |  Dining Room Furniture (Finish Color:-Walnut Finish with Cream Cushions)  ",,,Only 1 left in stock.,"₹50,000","₹35,499","Save ₹14,501 (29%)",5.0 out of 5 stars,1,https://www.amazon.in/KendalWoodTM-Furniture-Sheesham-Dining-Poster/dp/B08F5NHD3F/ref=sr_1_53?dchild=1&keywords=dining+set&qid=1625496089&sr=8-53
Home Centre Oxville 6 Seater Dining Table Set with Chair and Bench  ,,,Only 1 left in stock.,"₹1,17,400","₹86,380","Save ₹31,020 (26%)",1.0 out of 5 stars,1,https://www.amazon.in/Home-Centre-Oxville-Seater-Dining/dp/B07W428MM8/ref=sr_1_54?dchild=1&keywords=dining+set&qid=1625496089&sr=8-54
Porash Furniture Sheesham Wood Wooden Dining Set 4 Seater | Dining Table Set with 4 Chairs (Warm Chestnut Finish)  ,,,,,,,,,https://www.amazon.in/Porash-Furniture-Sheesham-Wooden-Chestnut/dp/B08L855DMG/ref=sr_1_55?dchild=1&keywords=dining+set&qid=1625496089&sr=8-55
Furinno Solid Sheesham Wood 6 Seater Dining Table Set with Six Chair for Living Room 7 Piece Wooden Dining Room Sets for Home Kitchen Modern Dining Room Furniture (Teak Finish)  ,,,,"₹55,000","₹38,999","Save ₹16,001 (29%)",,,https://www.amazon.in/Furinno-Sheesham-Seater-Kitchen-Furniture/dp/B093XYH9TN/ref=sr_1_56?dchild=1&keywords=dining+set&qid=1625496089&sr=8-56
NO BEAR Sheesham Wood Wooden Dining Set 4 Seater | Dining Table with 4 Chairs | Dining Room Furniture | Gray Cushions | Natural Honey Finish (Medium)  ,,,,"₹24,999","₹16,999","Save ₹8,000 (32%)",,,https://www.amazon.in/NO-BEAR-Sheesham-Furniture-Cushions/dp/B0926NMLG7/ref=sr_1_57?dchild=1&keywords=dining+set&qid=1625496089&sr=8-57
Home Centre Regina 4-Seater Dining Table with 4 Chairs (Black)  ,,,,"₹37,375","₹15,450","Save ₹21,925 (59%)",4.6 out of 5 stars,3,https://www.amazon.in/Home-Centre-Regina-4-Seater-Dining/dp/B08L6MNH8P/ref=sr_1_58?dchild=1&keywords=dining+set&qid=1625496089&sr=8-58
"Krishna Wood Decor Sheesham Wood Dining Table with Chairs | Dining Set Furniture | Balcony | Living Room (Sheesham Wood Dining Table with 4 Chairs, Mahogany Finish)  ",,,,"₹39,999","₹22,999","Save ₹17,000 (43%)",5.0 out of 5 stars,20,https://www.amazon.in/Krishna-Wood-Decor-Sheesham-Furniture/dp/B08BLTPW6M/ref=sr_1_59?dchild=1&keywords=dining+set&qid=1625496089&sr=8-59
Douceur Furnitures Solid Sheesham Wood Dining Table Set with 6 Chairs for Dining Room with Cushions |Finish- Chestnut | Wood Type :- Sheesham Wood  ,,,,"₹41,999","₹26,957","Save ₹15,042 (36%)",3.8 out of 5 stars,34,https://www.amazon.in/Douceur-Furnitures-Sheesham-Furniture-Cushions/dp/B08HCTY3HX/ref=sr_1_60?dchild=1&keywords=dining+set&qid=1625496089&sr=8-60
FURNIZY Solid Sheesham Wood 6 Seater Dining Table Set with 6 Cushion Chairs for Living Dining Room Hall Home Office Wooden Dinning Furniture (Honey Finish)  ,,,,"₹39,999","₹27,999","Save ₹12,000 (30%)",,,https://www.amazon.in/FURNIZY-Sheesham-Cushion-Dinning-Furniture/dp/B0968J9K58/ref=sr_1_61?dchild=1&keywords=dining+set&qid=1625496089&sr=8-61
Induscraft Sheesham Wood Imperia 4 Seater Dining Set  ,Limited time deal,,Only 2 left in stock.,"₹41,533","₹18,599","Save ₹22,934 (55%)",,,https://www.amazon.in/Induscraft-Sheesham-Imperia-Seater-Dining/dp/B07YG171BS/ref=sr_1_62?dchild=1&keywords=dining+set&qid=1625496089&sr=8-62
"DK Craft Sheesham Wood 4 Seater Dining Table Set with 4 Chair for Dining Room (Teak Finish) Solid Wood 4 Seater Dining Set (Finish Color -Teak Finish, Pre-Assembled)  ",,,,"₹49,999","₹20,799","Save ₹29,200 (58%)",,,https://www.amazon.in/DK-Craft-Dining-Table-Pre-Assembled/dp/B097S7N26F/ref=sr_1_63?dchild=1&keywords=dining+set&qid=1625496089&sr=8-63
