name,badge_1,badge_2,badge_3,mrp,discounted_price,discount,rating,rating_count,link
FURNIZY Solid Sheesham Wood Dining Chair Set with Cushion Wooden Furniture for Living Room Dinning Room Home Multipurpose Chairs Set of 2 for Study Room (Rustic Teak Finish)  ,,,Only 1 left in stock.,"₹11,198","₹7,199","Save ₹3,999 (36%)",,,https://www.amazon.in/FURNIZY-Sheesham-Cushion-Furniture-Multipurpose/dp/B08Y8VXYJD/ref=sr_1_49?dchild=1&keywords=dining+set&qid=1625756796&sr=8-49
"KendalWood Furniture Sheesham Wood CNC Cuting Dining Table with Chairs & | Dining Room Furniture 4 Seater Dining Set, (Finish Color:-Walnut Finish)  ",,,,"₹25,000","₹19,999","Save ₹5,001 (20%)",,,https://www.amazon.in/KendalWood-Furniture-Sheesham-Cuting-Dining/dp/B08KSDKRTM/ref=sr_1_50?dchild=1&keywords=dining+set&qid=1625756796&sr=8-50
FURNIZY Sheesham Wood 4 Seater Dining Table Set with Chair for Living Room 5 Piece Wooden Dining Room Sets for Home Kitchen Modern Dining Room Furniture (Walnut Finish)  ,,,,"₹29,189","₹22,494","Save ₹6,695 (23%)",3.7 out of 5 stars,4,https://www.amazon.in/FURNIZY-Sheesham-Seater-Kitchen-Furniture/dp/B08LK81YDW/ref=sr_1_51?dchild=1&keywords=dining+set&qid=1625756796&sr=8-51
"Ramwood Furniture Dining Table 4 Seater | Four Seater Dinning Table with 4 Chairs for Home & Restaurant | Dining Room Sets | Sheesham Wood, Mahogany Finish  ",,,,"₹38,399","₹22,999","Save ₹15,400 (40%)",,,https://www.amazon.in/Ramwood-Furniture-Restaurant-Sheesham-Mahogany/dp/B096B1T9PM/ref=sr_1_52?dchild=1&keywords=dining+set&qid=1625756796&sr=8-52
Furniture Mart Solid Wooden Sheesham Wood 2 Seater Dining Table Set with 2 Chair for Dining Room Wooden Dining Chairs Set of 2 Living Room Furniture Teak Wood Dining Table 2 Seater - Teak Finish  ,,,,"₹24,999","₹12,498","Save ₹12,501 (50%)",5.0 out of 5 stars,1,https://www.amazon.in/Furniture-Mart-Wooden-Sheesham-Seater/dp/B094Y9DKH6/ref=sr_1_53?dchild=1&keywords=dining+set&qid=1625756796&sr=8-53
8Reactive Wooden Art Solid Sheesham Wood Dining Table with 4 Chair for Living Room Wooden 4 Seater Dining Table Set for Home Dining Room Restaurant Dinner Table Set with Chairs (Teak Finish)  ,,,,"₹49,999","₹35,799","Save ₹14,200 (28%)",,,https://www.amazon.in/8Reactive-Wooden-Art-Dining-Table/dp/B097S8LJ81/ref=sr_1_54?dchild=1&keywords=dining+set&qid=1625756796&sr=8-54
DK Craft Sheesham Wood 6 Seater Dining Table Set with 6 Chair for Living Room 7 Piece Wooden Dining Room Sets for Home Kitchen Modern Dining Room Furniture (Teak Finish)  ,,,,"₹49,999","₹35,799","Save ₹14,200 (28%)",,,https://www.amazon.in/DK-Craft-Dining-Table-Furniture/dp/B097S5GB73/ref=sr_1_55?dchild=1&keywords=dining+set&qid=1625756796&sr=8-55
HomeTown Corona Metal And Glass Four Seater Dining Set in White Colour  ,,,,"₹39,900","₹14,985","Save ₹24,915 (62%)",4.2 out of 5 stars,27,https://www.amazon.in/HomeTown-Corona-Four-Seater-Dining/dp/B07DPMVTQK/ref=sr_1_56?dchild=1&keywords=dining+set&qid=1625756796&sr=8-56
Smilemindia Plastic 4 Seater Dining Set (Finish Color - Orange)  ,,,,"₹18,000","₹11,500","Save ₹6,500 (36%)",5.0 out of 5 stars,2,https://www.amazon.in/Smilemindia-Plastic-Seater-Dining-Finish/dp/B0922RSFWG/ref=sr_1_57?dchild=1&keywords=dining+set&qid=1625756796&sr=8-57
"KendalWood™ Furniture Sheesham Wood Dining Table(57x35) with 6 Chairs,| 6 Seater Dining Set | Wooden Dining Table with Chair - Dining Room Furniture (Finish Color:- Honey Finish with Cream Cushions)  ",,,,"₹40,000","₹28,999","Save ₹11,001 (28%)",3.5 out of 5 stars,9,https://www.amazon.in/KendalWoodTM-Furniture-Sheesham-Dining-Chairs/dp/B08GJJH443/ref=sr_1_58?dchild=1&keywords=dining+set&qid=1625756796&sr=8-58
Credenza Solid Sheesham Wood Wooden Dining Table with 4 Chairs | 4 Seater Dining Set | Wooden Dining Table with Chair - Dining Room Furniture | Mahogany  ,,,,"₹30,000","₹20,998","Save ₹9,002 (30%)",4.1 out of 5 stars,8,https://www.amazon.in/Credenza-Sheesham-Wooden-Dining-Chairs/dp/B08PNQDF6J/ref=sr_1_59?dchild=1&keywords=dining+set&qid=1625756796&sr=8-59
Smilemindia Plastic 4 Seater Dining Set (Finish Color - Light Brown)  ,,,,"₹18,000","₹11,500","Save ₹6,500 (36%)",,,https://www.amazon.in/Smilemindia-Plastic-Seater-Dining-Finish/dp/B09299S91Q/ref=sr_1_60?dchild=1&keywords=dining+set&qid=1625756796&sr=8-60
"Ramwood Furniture Dining Table 6 Seater | Six Seater Dinning Table with 4 Chairs & 1 Bench for Home & Restaurant | Dining Room Sets | Sheesham Wood, Provincial Teak Finish  ",,,,"₹49,999","₹29,999","Save ₹20,000 (40%)",,,https://www.amazon.in/Ramwood-Furniture-Restaurant-Sheesham-Provincial/dp/B0969ZZ8C4/ref=sr_1_61?dchild=1&keywords=dining+set&qid=1625756796&sr=8-61
Stream Furniture Premium Dining Room Furniture Wooden Dining Table with 6 Chairs Solid Wood 6 Seater Dining Set (Finish Color - Natural Finish)  ,,,,"₹32,000","₹30,499","Save ₹1,501 (5%)",,,https://www.amazon.in/Stream-Furniture-Premium-Dining-Wooden/dp/B08W3F8QL5/ref=sr_1_62?dchild=1&keywords=dining+set&qid=1625756796&sr=8-62
"Mamta Decoration Sheesham Wood Dining Set for Living Room (4 Seater, 4 Chair & Table (Brown)  ",,,,"₹21,839","₹16,009","Save ₹5,830 (27%)",4.2 out of 5 stars,388,https://www.amazon.in/Decoration-Sheesham-Dining-Living-Seater/dp/B07M72H4TF/ref=sr_1_63?dchild=1&keywords=dining+set&qid=1625756796&sr=8-63
Naaz Handicraft Dining Table Set in 6 Chairs |Teak Wood for Royal Dining Rooms | Furniture Saharanpur  ,,,,"₹2,50,000","₹1,40,000","Save ₹1,10,000 (44%)",,,https://www.amazon.in/Handicraft-Dining-Chairs-Furniture-Saharanpur/dp/B091QC31ZQ/ref=sr_1_64?dchild=1&keywords=dining+set&qid=1625756796&sr=8-64
Home Centre Savoy Rubber Wood 6 Seater Dining Set with 4 Chairs and 1 Bench  ,,,,"₹74,918","₹44,960","Save ₹29,958 (40%)",,,https://www.amazon.in/Home-Centre-Rubber-Seater-Dining/dp/B096R3BQLG/ref=sr_1_65?dchild=1&keywords=dining+set&qid=1625756796&sr=8-65
KendalWood™ Furniture  Sheesham Wood Dining Table(57x35) with 6 Chairs | 6 Seater Dining Set | Wooden Dining Table with Chair - Dining Room Furniture (Teak Finish with Cream Cushion)  ,,,,"₹50,000","₹28,999","Save ₹21,001 (42%)",4.3 out of 5 stars,3,https://www.amazon.in/KendalWoodTM-Furniture-Sheesham-Dining-Chairs-Seater/dp/B08KTND1KK/ref=sr_1_66?dchild=1&keywords=dining+set&qid=1625756796&sr=8-66
"Chetan Interiors Solid Sheesham Wood 4 Seater Dining Table Set (Pure Sheesham Wood) (3 Chairs with 1 Bench, Honey)  ",,,,"₹25,000","₹18,499","Save ₹6,501 (26%)",4.9 out of 5 stars,11,https://www.amazon.in/Chetan-Interiors-Sheesham-Seater-Dining/dp/B09123J6KJ/ref=sr_1_67?dchild=1&keywords=dining+set&qid=1625756796&sr=8-67
World Cup Model Dining with Glass & GULI Model Chair Set || 100% Teak Wood Finish (Non PLY Product)|| Full Dining Set with 12 mm Black Glass  ,,,,,,,,,https://www.amazon.in/World-Model-Dining-Finish-Product/dp/B08RS54SCV/ref=sr_1_68?dchild=1&keywords=dining+set&qid=1625756796&sr=8-68
Naaz Handicraft Sheesham Teak Finish 6 Seater Dining Table Set | Standard Size  ,,,,"₹1,49,999","₹1,35,000","Save ₹14,999 (10%)",,,https://www.amazon.in/Handicraft-Sheesham-Finish-Seater-Standard/dp/B08RC4JBJK/ref=sr_1_69?dchild=1&keywords=dining+set&qid=1625756796&sr=8-69
Ruchika Handicraft Sheesham Wood Rectangle 6 Seater Dining Table Set with 6 Cushion Chair for Dining Room Hall Home Office (Honey Finish)  ,,,,,,,,,https://www.amazon.in/Ruchika-Handicraft-Sheesham-Rectangle-Cushion/dp/B097HSM1KT/ref=sr_1_70?dchild=1&keywords=dining+set&qid=1625756796&sr=8-70
Handwoody SheeshamWood Dining Table 4 Seater/Dining Table Set with Chairs in Natural Brown Finish  ,,,,"₹29,599","₹19,999","Save ₹9,600 (32%)",4.6 out of 5 stars,3,https://www.amazon.in/Handwoody-SheeshamWood-Dining-Seater-Natural/dp/B08RCRX8LG/ref=sr_1_71?dchild=1&keywords=dining+set&qid=1625756796&sr=8-71
Corazzin Furniture Sheesham Wood 6 Seater Dining Table Set with Chairs for Living Room (Mahogany Finish)  ,,,Only 1 left in stock.,"₹45,999","₹25,999","Save ₹20,000 (43%)",,,https://www.amazon.in/Corazzin-Furniture-Sheesham-Seater-Mahogany/dp/B08HSFK1XF/ref=sr_1_72?dchild=1&keywords=dining+set&qid=1625756796&sr=8-72
Krishna Wood Decor Solid Sheesham Teak Wood Round Dining Table 4 Seater with Chairs Sets | Round Dining Table 4 Seater Wooden | Dining Table 4 Seater Set | Dining Room Sets Furniture | Walnut Finish  ,,,,"₹89,999","₹22,999","Save ₹67,000 (74%)",,,https://www.amazon.in/Krishna-Wood-Decor-Sheesham-Furniture/dp/B096SMDTR9/ref=sr_1_73?dchild=1&keywords=dining+set&qid=1625756796&sr=8-73
OAKNEST Supreme Web with Marina Dining Room Set for Indoor and Outdoor Use (Color: Jet Black | Count: 5)  ,,,Only 2 left in stock.,"₹12,325","₹9,000","Save ₹3,325 (27%)",,,https://www.amazon.in/OAKNEST-Supreme-Marina-Dining-Outdoor/dp/B096GC2C6P/ref=sr_1_74?dchild=1&keywords=dining+set&qid=1625756796&sr=8-74
Natural Finish Wood Dining Table 6 Seater Set with Chairs | Dining Table Sets | 6 Seater Dining Table Wooden | Dining Room Furniture Sets | Sheesham Wood | Walnut Finish  ,,,,"₹59,999","₹27,999","Save ₹32,000 (53%)",,,https://www.amazon.in/Natural-Finish-Dining-Furniture-Sheesham/dp/B094GZZ398/ref=sr_1_75?dchild=1&keywords=dining+set&qid=1625756796&sr=8-75
BSR Arts Sheesham Wooden Dining Table | Dining Table 6 Seater | Dining Table Set with 4 Chairs & Bench | Home Dining Room Furniture | Natural Teak Finish  ,,,,,,,5.0 out of 5 stars,1,https://www.amazon.in/Sheesham-Wooden-Dining-Furniture-Natural/dp/B08NXQG4B6/ref=sr_1_76?dchild=1&keywords=dining+set&qid=1625756796&sr=8-76
OAKWAY Helsinki White and Pink Stripes 6s Dining Set  ,,,,,,,,,https://www.amazon.in/OAKWAY-Helsinki-White-Stripes-Dining/dp/B094N76BV5/ref=sr_1_77?dchild=1&keywords=dining+set&qid=1625756796&sr=8-77
Credenza Solid Wood Dining Table 8 Seater with Chair | Dining Room Furniture | Dining Table 8 Seater Set Wooden | Dining Table Set | Sheesham Wood | Teak Finish  ,,,,"₹89,999","₹42,999","Save ₹47,000 (52%)",,,https://www.amazon.in/Credenza-Dining-Seater-Furniture-Sheesham/dp/B098NLHJ6G/ref=sr_1_78?dchild=1&keywords=dining+set&qid=1625756796&sr=8-78
KendalWood™ Furniture Solid (Sheesham) Wood Dining Table with 6 Chairs | 6 Seater Dining Set (Finish Color: -Walnut Finish with Cream Cushion)  ,,,,"₹50,000","₹36,999","Save ₹13,001 (26%)",3.0 out of 5 stars,17,https://www.amazon.in/KendalWoodTM-Furniture-Sheesham-Dining-Chairs/dp/B08KSD2T5P/ref=sr_1_79?dchild=1&keywords=dining+set&qid=1625756796&sr=8-79
OAKWAY Helensinki White and Blue 6s Dining Set  ,,,,,,,,,https://www.amazon.in/OAKWAY-Helensinki-White-Blue-Dining/dp/B094N1YMJ6/ref=sr_1_80?dchild=1&keywords=dining+set&qid=1625756796&sr=8-80
Custom Decor Sheesham Wood 4 Seater Dining Table Set with Chairs for Living Room (Honey Teak Brown)  ,,,,"₹29,999","₹18,999","Save ₹11,000 (37%)",3.8 out of 5 stars,15,https://www.amazon.in/Custom-Decor-Sheesham-Seater-Dining/dp/B07SDNQQW3/ref=sr_1_81?dchild=1&keywords=dining+set&qid=1625756796&sr=8-81
