name,badge_1,badge_2,badge_3,mrp,discounted_price,discount,rating,rating_count,link
"Livshine Plastic Chair for Home, Office and Garden Set of 2 (2231, Dark Brown)  ",,,,"₹2,999","₹1,989","Save ₹1,010 (34%)",3.2 out of 5 stars,5,https://www.amazon.in/Livshine-Plastic-Chair-Office-Garden/dp/B08Y5VDP8V/ref=sr_1_58?dchild=1&keywords=chair&qid=1625239136&sr=8-58
"AmazonBasics Reception Chair, Black  ",,Sponsored,,"₹16,000","₹9,699","Save ₹6,301 (39%)",4.2 out of 5 stars,184,https://www.amazon.in/gp/slredirect/picassoRedirect.html/ref=pa_sp_mtf_aps_sr_pg2_1?ie=UTF8&adId=A0647072399752FG2T6CK&url=%2FAmazonBasics-GF-80635G-Reception-Chair-Black%2Fdp%2FB072Y6Y96S%2Fref%3Dsr_1_59_sspa%3Fdchild%3D1%26keywords%3Dchair%26qid%3D1625239136%26sr%3D8-59-spons%26psc%3D1&qualifier=1625239136&id=5411803984445365&widgetName=sp_mtf
Dratal Sun Lounger Folding Garden Chairs Armchair Office Chair Adjustable Folding Chair Siesta Gravity Outside Chairs  ,,Sponsored,,"₹9,999","₹4,999","Save ₹5,000 (50%)",,,https://www.amazon.in/gp/slredirect/picassoRedirect.html/ref=pa_sp_mtf_aps_sr_pg2_1?ie=UTF8&adId=A002215839L5BCZ2JF6MM&url=%2FDratal-Lounger-Folding-Armchair-Adjustable%2Fdp%2FB0965H3NWG%2Fref%3Dsr_1_60_sspa%3Fdchild%3D1%26keywords%3Dchair%26qid%3D1625239136%26sr%3D8-60-spons%26psc%3D1&qualifier=1625239136&id=5411803984445365&widgetName=sp_mtf
Everest Titan Series Outdoor Plastic Chair - Brown (Set of 2 pieces)  ,,Sponsored,,"₹2,399","₹1,485",Save ₹914 (38%),4.1 out of 5 stars,12,https://www.amazon.in/gp/slredirect/picassoRedirect.html/ref=pa_sp_mtf_aps_sr_pg2_1?ie=UTF8&adId=A03838463STEIY8ZYGMFE&url=%2FEverest-Titan-Outdoor-Plastic-Chair%2Fdp%2FB08KNPF22Z%2Fref%3Dsr_1_61_sspa%3Fdchild%3D1%26keywords%3Dchair%26qid%3D1625239136%26sr%3D8-61-spons%26psc%3D1%26smid%3DAVTAFXONSE1L9&qualifier=1625239136&id=5411803984445365&widgetName=sp_mtf
"SAARTHI Rajasthani Dhola Maru Handmade Wooden Ethinic Antique Designer Folding Chairs and Table Set for Home| Decor| Office| Garden| Outdoor| Indoor| Balcony| Launge| Lawn| Cafe| Bar| Living Room| Bedroom Room| Childern Room Decor| Outdoor Sitting , Multicolour - Set of 3  ",,Sponsored,Only 2 left in stock.,"₹9,999","₹4,895","Save ₹5,104 (51%)",4.1 out of 5 stars,59,https://www.amazon.in/gp/slredirect/picassoRedirect.html/ref=pa_sp_mtf_aps_sr_pg2_1?ie=UTF8&adId=A05486952UV38C0CU2GBQ&url=%2FSAARTHI-Rajasthani-Handmade-Folding-Multicolour%2Fdp%2FB078KLD39Y%2Fref%3Dsr_1_62_sspa%3Fdchild%3D1%26keywords%3Dchair%26qid%3D1625239136%26sr%3D8-62-spons%26psc%3D1&qualifier=1625239136&id=5411803984445365&widgetName=sp_mtf
Nilkamal Novella Chair (Black)  ,,,,,,,4.2 out of 5 stars,242,https://www.amazon.in/Nilkamal-NS09SSIBK-Novella-Chair-Black/dp/B014899LS0/ref=sr_1_63?dchild=1&keywords=chair&qid=1625239136&sr=8-63
Boxo Unbreakable Made Smooth Finishing to Avoid Scratches Chair for Kids Boys and Girls (Brown Chair) Pack of 1  ,,,,₹699,₹498,Save ₹201 (29%),,,https://www.amazon.in/Boxo-Unbreakable-Smooth-Finishing-Scratches/dp/B096844YNF/ref=sr_1_64?dchild=1&keywords=chair&qid=1625239136&sr=8-64
"AVRO Plastic Chairs |9100 Single Chair | Matt and Gloss Pattern | Plastic Chairs for Home, Living Room| Bearing Capacity up to 200Kg | Strong and Sturdy Structure | 1 Year Guarantee, Brown  ",,,,₹999,₹699,Save ₹300 (30%),3.8 out of 5 stars,5,https://www.amazon.in/AVRO-Plastic-Capacity-Structure-Guarantee/dp/B08Y6VHFQK/ref=sr_1_65?dchild=1&keywords=chair&qid=1625239136&sr=8-65
"Padam Shree Plastic Chair for Home, Garden, Office & Restaurants (1 Chair, Dark Brown)  ",,,,"₹1,999",₹999,"Save ₹1,000 (50%)",1.0 out of 5 stars,1,https://www.amazon.in/Padam-Shree-Plastic-Garden-Restaurants/dp/B08PBRFGB9/ref=sr_1_66?dchild=1&keywords=chair&qid=1625239136&sr=8-66
DRODRM Multicolor Steel Folding Chair  ,,,,"₹1,800",₹899,Save ₹901 (50%),4.2 out of 5 stars,44,https://www.amazon.in/DRODRM-Chair-Portable-Foldable-Camping/dp/B089NS6HC1/ref=sr_1_67?dchild=1&keywords=chair&qid=1625239136&sr=8-67
Lion Cotton Chair (Others)  ,,,,"₹2,999","₹1,799","Save ₹1,200 (40%)",4.0 out of 5 stars,72,https://www.amazon.in/Lion-Industries-Furniture-Folding-Reading/dp/B08KGRWJFM/ref=sr_1_68?dchild=1&keywords=chair&qid=1625239136&sr=8-68
"Supreme Cambridge Plastic Chairs for Home, Outdoor & Garden (Set of 2, Brown)  ",,,,"₹6,800","₹4,599","Save ₹2,201 (32%)",4.5 out of 5 stars,377,https://www.amazon.in/Supreme-Cambridge-Plastic-Outdoor-Chair/dp/B07FRJGS1Y/ref=sr_1_69?dchild=1&keywords=chair&qid=1625239136&sr=8-69
Diya Seating Solutions Beeta Cushion with Arm Chair (Size : 850mmX520mmX480mm) (Brown)  ,,,,"₹2,199","₹1,949",Save ₹250 (11%),5.0 out of 5 stars,1,https://www.amazon.in/Seating-Solutions-Beeta-Cushion-Chair/dp/B09431HMX2/ref=sr_1_70?dchild=1&keywords=chair&qid=1625239136&sr=8-70
"ANJWAR Plastic Strong and Sturdy Structure Indoor/Outdoor Tub Chairs for Home, Living Room - Bearing Capacity Up to 200 Kg (Set of 2, Yellow)  ",,,,"₹4,359","₹2,692","Save ₹1,667 (38%)",4.4 out of 5 stars,3,https://www.amazon.in/ANJWAR-Plastic-Strong-Structure-Outdoor/dp/B091HYB68K/ref=sr_1_71?dchild=1&keywords=chair&qid=1625239136&sr=8-71
IYB- 18-inch Seating Height Strong Heavy Duty Folding Chair with Seat and Back Cushion for Office Home Garden Breakfast Padded Yellow - 1P  ,,,Only 2 left in stock.,,"₹1,520",,,,https://www.amazon.in/18-inch-Seating-Folding-Cushion-Breakfast/dp/B096VDF2XP/ref=sr_1_72?dchild=1&keywords=chair&qid=1625239136&sr=8-72
EASYDAY N Type Comfortable Visitor/Study Metal Chair with Cushion (Black)  ,,,,"₹2,999","₹1,799","Save ₹1,200 (40%)",3.8 out of 5 stars,16,https://www.amazon.in/Easyday-Comfortable-Visitor-Cushion-Certified/dp/B085VXW6P3/ref=sr_1_73?dchild=1&keywords=chair&qid=1625239136&sr=8-73
OAKNEST Supreme Kent Mid Back Modern Plastic Chair with Arm (Color: Mehandi Green | Count: 2)  ,,,,"₹3,500","₹3,000",Save ₹500 (14%),4.7 out of 5 stars,5,https://www.amazon.in/OAKNEST-Supreme-Kent-Modern-Plastic/dp/B09474FXGK/ref=sr_1_74?dchild=1&keywords=chair&qid=1625239136&sr=8-74
"Italica Work from Home Chair Spine Care 2109 (Matte Finish, White)  ",,,Only 1 left in stock.,"₹2,099","₹1,769",Save ₹330 (16%),5.0 out of 5 stars,5,https://www.amazon.in/Italica-Spine-Care-2109-Finish/dp/B088TPNTTZ/ref=sr_1_75?dchild=1&keywords=chair&qid=1625239136&sr=8-75
"ANJWAR Plastic Arm Rest Chair ( Pink, Rosewood, 2 Pieces)  ",,,,"₹4,359","₹2,647","Save ₹1,712 (39%)",4.1 out of 5 stars,93,https://www.amazon.in/ANJWAR-Complimentary-Cushions-Standard-Rosewood/dp/B085WBGZW5/ref=sr_1_76?dchild=1&keywords=chair&qid=1625239136&sr=8-76
Cello Comfort Relax Plastic Chair (Color: Brown; Qnt: 1 Pcs.)  ,,,,"₹2,999","₹1,599","Save ₹1,400 (47%)",,,https://www.amazon.in/Cello-Comfort-Relax-Plastic-Chair/dp/B097K72H5C/ref=sr_1_77?dchild=1&keywords=chair&qid=1625239136&sr=8-77
"Nemi Agency Nilkamal Plastic Premium Mystique/Rosa Chair (Brown), Set of 2  ",,,,"₹4,999","₹2,347","Save ₹2,652 (53%)",4.3 out of 5 stars,8,https://www.amazon.in/Nilkamal-Plastic-Premium-Mystique-Brown/dp/B08R21QH9J/ref=sr_1_78?dchild=1&keywords=chair&qid=1625239136&sr=8-78
