name,badge_1,badge_2,badge_3,mrp,discounted_price,discount,rating,rating_count,link
"Friends of Meditation Iyengar Yoga Chair | Backless Yoga Chair for Holding, Alignment and Flexibility | Capacity : 100kgs | Comes with Free Yoga Book (112 Ways of Using The Backless Chair)  ",,,,"₹3,499","₹2,499","Save ₹1,000 (29%)",5.0 out of 5 stars,1,https://www.amazon.in/Friends-Meditation-Backless-Alignment-Flexibility/dp/B099K1QXYC/ref=sr_1_56?dchild=1&keywords=chair&qid=1628529437&sr=8-56
"AmazonBasics Zero Gravity Textilene Fabric and Steel Portable Reclining Lounge Chair, Red  ",Deal of the Day ,,,"₹6,000","₹3,549","Save ₹2,451 (41%)",4.3 out of 5 stars,"2,350",https://www.amazon.in/AmazonBasics-Zero-Gravity-Chair-Burgundy/dp/B071V85DLN/ref=sr_1_57?dchild=1&keywords=chair&qid=1628529437&sr=8-57
"Binani Futura Heavy Duty Structure Plastic Chair for Home, Office, Garden and Restaurents (Brown, Set of 2)  ",,,,"₹2,499","₹1,499","Save ₹1,000 (40%)",3.8 out of 5 stars,24,https://www.amazon.in/Binani-Futura-Structure-Plastic-Restaurents/dp/B084R97R52/ref=sr_1_58?dchild=1&keywords=chair&qid=1628529437&sr=8-58
AVRO FURNITURE 2581 Plastic Modern Ergonomic Chairs (Beige) - Set of 2 Pieces  ,Limited time deal,Sponsored,,"₹2,499","₹1,609",Save ₹890 (36%),3.8 out of 5 stars,762,https://www.amazon.in/gp/slredirect/picassoRedirect.html/ref=pa_sp_mtf_aps_sr_pg2_1?ie=UTF8&adId=A014321324Q9SQWBLSMUY&url=%2FAVRO-FURNITURE-2581-Capacity-Structure%2Fdp%2FB08DY8DQHZ%2Fref%3Dsr_1_59_sspa%3Fdchild%3D1%26keywords%3Dchair%26qid%3D1628529437%26smid%3DAT95IG9ONZD7S%26sr%3D8-59-spons%26psc%3D1&qualifier=1628529437&id=2121949448488651&widgetName=sp_mtf
Petals Royal Black Color Plastic Arm Chair for Home and Garden Set of Six  ,,Sponsored,,"₹12,999","₹7,019","Save ₹5,980 (46%)",4.5 out of 5 stars,91,https://www.amazon.in/gp/slredirect/picassoRedirect.html/ref=pa_sp_mtf_aps_sr_pg2_1?ie=UTF8&adId=A022131326KU71PP9RPRJ&url=%2FPetals-Royal-Black-Plastic-Garden%2Fdp%2FB08C6W2T94%2Fref%3Dsr_1_60_sspa%3Fdchild%3D1%26keywords%3Dchair%26qid%3D1628529437%26sr%3D8-60-spons%26psc%3D1&qualifier=1628529437&id=2121949448488651&widgetName=sp_mtf
RedOAK Barson-Blue Patchwork Fabric Accent Chair  ,,Sponsored,,"₹7,434","₹4,460","Save ₹2,974 (40%)",4.3 out of 5 stars,4,https://www.amazon.in/gp/slredirect/picassoRedirect.html/ref=pa_sp_mtf_aps_sr_pg2_1?ie=UTF8&adId=A05292003TVD3C40O1VTW&url=%2FRedOAK-Barson-Blue-Patchwork-Fabric-Accent%2Fdp%2FB083RLZLGJ%2Fref%3Dsr_1_61_sspa%3Fdchild%3D1%26keywords%3Dchair%26qid%3D1628529437%26sr%3D8-61-spons%26psc%3D1&qualifier=1628529437&id=2121949448488651&widgetName=sp_mtf
Detec� Cafe Plastic Chair | Black Color  ,,Sponsored,,,,,,,https://www.amazon.in/gp/slredirect/picassoRedirect.html/ref=pa_sp_mtf_aps_sr_pg2_1?ie=UTF8&adId=A068735327DAUEGV892J5&url=%2FDetec%25EF%25BF%25BD-Plastic-Chair-Black-Color%2Fdp%2FB093Q7G877%2Fref%3Dsr_1_62_sspa%3Fdchild%3D1%26keywords%3Dchair%26qid%3D1628529437%26sr%3D8-62-spons%26psc%3D1&qualifier=1628529437&id=2121949448488651&widgetName=sp_mtf
Nilkamal Plastic Ergonomic Chair (Brown)  ,,,,"₹3,000","₹2,589",Save ₹411 (14%),4.1 out of 5 stars,364,https://www.amazon.in/Nilkamal-Plastic-Gloss-Finish-Biscuit/dp/B07TSF62S9/ref=sr_1_63?dchild=1&keywords=chair&qid=1628529437&sr=8-63
"AVRO FURNITURE 9100 Plastic Chairs, Set of 4, Matt and Gloss Pattern, Plastic Chairs for Home, Living Room, Bearing Capacity up to 200Kg, Strong and Sturdy Structure,Brown  ",,,,"₹3,200","₹2,599",Save ₹601 (19%),3.7 out of 5 stars,604,https://www.amazon.in/AVRO-Plastic-Capacity-Structure-Guarantee/dp/B081PY3RXV/ref=sr_1_64?dchild=1&keywords=chair&qid=1628529437&sr=8-64
Streetup India Folding Stool Chair for Home/Study Chair and Restaurant/Cafe Chair Black (Without Foot Rest)  ,,,,"₹3,499","₹1,899","Save ₹1,600 (46%)",3.8 out of 5 stars,8,https://www.amazon.in/Streetup-India-Folding-Restaurant-Without/dp/B0923G9XW8/ref=sr_1_65?dchild=1&keywords=chair&qid=1628529437&sr=8-65
"Lion Iron Chair with pad (, Multicolour)  ",,,,"₹2,999","₹1,799","Save ₹1,200 (40%)",3.7 out of 5 stars,131,https://www.amazon.in/Lion-Industries-Folding-Strong-Reading/dp/B08F5CZ5QF/ref=sr_1_66?dchild=1&keywords=chair&qid=1628529437&sr=8-66
Home Centre Emma Solid Metal Folding Chair - White  ,,,,,"₹1,795",,4.1 out of 5 stars,51,https://www.amazon.in/Home-Centre-Solid-Folding-Chair/dp/B089G7ZK3J/ref=sr_1_67?dchild=1&keywords=chair&qid=1628529437&sr=8-67
"Ikea ADDE Polypropylene plastic Chair, Black  ",,,,,,,4.1 out of 5 stars,7,https://www.amazon.in/Ikea-Polypropylene-plastic-Chair-Black/dp/B08SR3DVPS/ref=sr_1_68?dchild=1&keywords=chair&qid=1628529437&sr=8-68
pranjals house Wood Chairs and Table Cum Stool (Multicolor)  ,,,,"₹7,999","₹4,499","Save ₹3,500 (44%)",4.2 out of 5 stars,19,https://www.amazon.in/pranjals-house-Chairs-Table-Multicolor/dp/B08WX37LP9/ref=sr_1_69?dchild=1&keywords=chair&qid=1628529437&sr=8-69
Bharat Sales Vinyl Adjustable Height Control Chair (Brown)  ,,,,₹999,₹549,Save ₹450 (45%),3.1 out of 5 stars,27,https://www.amazon.in/Bharat-Sales-Adjustable-Height-Control/dp/B08VJ68429/ref=sr_1_70?dchild=1&keywords=chair&qid=1628529437&sr=8-70
"Ash & Roh® - Outdoor/Indoor Garden Mini Folding Chair Sun-Lounger Reclining Chair Soft Balcony,Beach Chairs (Mini Folding Chair)  ",,,,"₹1,299",₹599,Save ₹700 (54%),3.1 out of 5 stars,4,https://www.amazon.in/Ash-Roh%C2%AE-Outdoor-Sun-Lounger-Reclining/dp/B0974QNC11/ref=sr_1_71?dchild=1&keywords=chair&qid=1628529437&sr=8-71
Streetup India Iyengar Iron Chair (Grey)  ,,,,"₹3,499","₹2,099","Save ₹1,400 (40%)",4.2 out of 5 stars,34,https://www.amazon.in/Streetup-India-Iyengar-Backless-Meditation/dp/B08DBJQP9Q/ref=sr_1_72?dchild=1&keywords=chair&qid=1628529437&sr=8-72
Ikea Modern Folding Chair (Silver)  ,,,,"₹1,799","₹1,380",Save ₹419 (23%),4.4 out of 5 stars,124,https://www.amazon.in/Ikea-Nisse-Folding-Chair-Silver-Colour/dp/B07T7GFWZ4/ref=sr_1_73?dchild=1&keywords=chair&qid=1628529437&sr=8-73
OAKNEST Cello Jordan Plastic Chair with Armrest for Home & Office Purpose (Count : 2 Pc | Color : Rosewood)  ,,,,"₹3,500","₹2,600",Save ₹900 (26%),4.5 out of 5 stars,2,https://www.amazon.in/OAKNEST-Jordan-Plastic-Armrest-Purpose/dp/B0993WDKZ6/ref=sr_1_74?dchild=1&keywords=chair&qid=1628529437&sr=8-74
Nemi Agency Nilkamal Plastic Premium Mystique Brown Chair (Set of 2)  ,,,,"₹2,999","₹2,339",Save ₹660 (22%),4.2 out of 5 stars,8,https://www.amazon.in/Nemi-Agency-Nilkamal-Plastic-Mystique/dp/B095P2HJGP/ref=sr_1_75?dchild=1&keywords=chair&qid=1628529437&sr=8-75
"Supreme Futura Plastic Chairs for Home and Office (Set of 2, Champange)  ",Limited time deal,,,"₹2,600","₹1,659",Save ₹941 (36%),3.6 out of 5 stars,102,https://www.amazon.in/Supreme-Futura-Plastic-Chair-Champange/dp/B07MFQPL9M/ref=sr_1_76?dchild=1&keywords=chair&qid=1628529437&smid=AT95IG9ONZD7S&sr=8-76
Home Centre Metal Ergonomic Mid Back Without Cushion Chair (Black)  ,Limited time deal,,,,"₹2,249",,4.5 out of 5 stars,119,https://www.amazon.in/Home-Centre-Design-Folding-Chair/dp/B07TD59R6B/ref=sr_1_77?dchild=1&keywords=chair&qid=1628529437&smid=AT95IG9ONZD7S&sr=8-77
"ANJWAR Plastic Arm Rest Chair ( Pink, Rosewood, 2 Pieces)  ",,,,"₹4,359","₹2,647","Save ₹1,712 (39%)",3.9 out of 5 stars,138,https://www.amazon.in/ANJWAR-Complimentary-Cushions-Standard-Rosewood/dp/B085WBGZW5/ref=sr_1_78?dchild=1&keywords=chair&qid=1628529437&sr=8-78
