name,badge_1,badge_2,badge_3,mrp,discounted_price,discount,rating,rating_count,link
Vivan Interio Chrome Base Mid Back Mesh Revolving Office Chair (Black)  ,,Sponsored,,"₹7,999","₹3,699","Save ₹4,300 (54%)",,,https://www.amazon.in/gp/slredirect/picassoRedirect.html/ref=pa_sp_atf_aps_sr_pg1_1?ie=UTF8&adId=A02087171BJI63WNDQL1Y&url=%2FVivan-Interio-Chrome-Revolving-Office%2Fdp%2FB0994VFCQ6%2Fref%3Dsr_1_1_sspa%3Fdchild%3D1%26keywords%3Dchair%26qid%3D1628529418%26sr%3D8-1-spons%26psc%3D1&qualifier=1628529418&id=4904346028030431&widgetName=sp_atf
"AmazonBasics Steel Zero Gravity Reclining Lounge Portable Chair, Black  ",Limited time deal,Sponsored,,"₹6,000","₹3,549","Save ₹2,451 (41%)",4.3 out of 5 stars,"4,140",https://www.amazon.in/gp/slredirect/picassoRedirect.html/ref=pa_sp_atf_aps_sr_pg1_1?ie=UTF8&adId=A08773332Y83H4IK1FMJ0&url=%2FAmazonBasics-Gravity-Reclining-Lounge-Portable%2Fdp%2FB071173FS8%2Fref%3Dsr_1_2_sspa%3Fdchild%3D1%26keywords%3Dchair%26qid%3D1628529418%26smid%3DAT95IG9ONZD7S%26sr%3D8-2-spons%26psc%3D1&qualifier=1628529418&id=4904346028030431&widgetName=sp_atf
"AmazonBasics Metal, Leather Guest Chair, Black  ",Best sellerDeal of the Day ,Sponsored,,"₹11,000","₹5,899","Save ₹5,101 (46%)",4.3 out of 5 stars,"2,988",https://www.amazon.in/gp/bestsellers/kitchen/5689414031/ref=sr_bs_2_5689414031_1
"AmazonBasics Zero Gravity Portable Textilene Fabric and Steel Reclining Lounge Chair, Blue  ",Amazon's ChoiceDeal of the Day ,Sponsored,,"₹6,000","₹3,549","Save ₹2,451 (41%)",4.2 out of 5 stars,"2,540",https://www.amazon.in/gp/slredirect/picassoRedirect.html/ref=pa_sp_atf_aps_sr_pg1_1?ie=UTF8&adId=A07662712Z4PID7IAJM1G&url=%2FAmazonBasics-Zero-Gravity-Chair-Blue%2Fdp%2FB071NHHWCN%2Fref%3Dice_ac_b_dpb_sspa%3Fdchild%3D1%26keywords%3Dchair%26qid%3D1628529418%26sr%3D8-4-spons%26psc%3D1&qualifier=1628529418&id=4904346028030431&widgetName=sp_atf
"AVRO FURNITURE 7756 Plastic Chair | Set of 2 | Matt and Gloss Pattern | for Dining Room, Bedroom, Kitchen, Living Room | Bearing Capacity up to 150Kg | Strong & Sturdy Structure  ",Best sellerLimited time deal,,,"₹2,499","₹1,369","Save ₹1,130 (45%)",3.6 out of 5 stars,"1,476",https://www.amazon.in/gp/bestsellers/kitchen/5689449031/ref=sr_bs_4_5689449031_1
Nilkamal European Plastic Chair (Brown)  ,,,,"₹3,499","₹3,198",Save ₹301 (9%),3.8 out of 5 stars,564,https://www.amazon.in/Nilkamal-Back-Plastic-Chair-Brown/dp/B07V87LYYW/ref=sr_1_6?dchild=1&keywords=chair&qid=1628529418&sr=8-6
"Ikea Modern Chair (Steel , White)  ",Best seller,,,"₹1,999","₹1,240",Save ₹759 (38%),4.2 out of 5 stars,585,https://www.amazon.in/gp/bestsellers/kitchen/5689456031/ref=sr_bs_6_5689456031_1
"MALI ENTERPRISES Plastic Chair (Black,4)  ",,,,"₹9,999","₹2,299","Save ₹7,700 (77%)",3.9 out of 5 stars,30,https://www.amazon.in/MALI-ENTERPRISES-Plastic-Chair-Black/dp/B08VS3NQJR/ref=sr_1_8?dchild=1&keywords=chair&qid=1628529418&sr=8-8
"Plastic Chair, Brown Color, Matt and Gloss Pattern, Chair for Home, Living Room, Bearing Capacity Upto 200 Kg, Strong and Sturdy Structure (Brown, Eezy Set of 2)  ",,,,"₹3,999","₹1,249","Save ₹2,750 (69%)",5.0 out of 5 stars,2,https://www.amazon.in/Plastic-Pattern-Bearing-Capacity-Structure/dp/B09BBDWP7Y/ref=sr_1_9?dchild=1&keywords=chair&qid=1628529418&sr=8-9
Chetan Plast Virgn Plastic Toofan Chair Set of 1 Matt and Gloss Pattern for Dining Room Bedroom Kitchen Living Room Bearing Capacity up to 3.500 Kg Strong & Sturdy Structure Color Multicolour  ,,,,"₹1,599","₹1,099",Save ₹500 (31%),4.2 out of 5 stars,8,https://www.amazon.in/Chetan-Plast-Capacity-Structure-Multicolour/dp/B098J87HCF/ref=sr_1_10?dchild=1&keywords=chair&qid=1628529418&sr=8-10
"Supreme Futura Plastic Chairs for Home and Office (Set of 2, Brown)  ",Limited time deal,,,"₹2,600","₹1,739",Save ₹861 (33%),4.0 out of 5 stars,229,https://www.amazon.in/Supreme-Futura-Stacking-Chair-Brown/dp/B07MBQX6MZ/ref=sr_1_11?dchild=1&keywords=chair&qid=1628529418&smid=AT95IG9ONZD7S&sr=8-11
"Supreme Futura Plastic Chairs for Home and Office (Set of 2, Wenge)  ",Limited time deal,,,"₹2,199","₹1,659",Save ₹540 (25%),4.0 out of 5 stars,387,https://www.amazon.in/Supreme-Futura-Plastic-Chair-wenge/dp/B07MC4NK1H/ref=sr_1_12?dchild=1&keywords=chair&qid=1628529418&smid=AT95IG9ONZD7S&sr=8-12
"Supreme Futura Plastic Chairs for Home and Office (Set of 2, Mehandi Green)  ",,,,"₹2,600","₹1,784",Save ₹816 (31%),3.9 out of 5 stars,218,https://www.amazon.in/Supreme-Futura-Plastic-Chair-Mehandi/dp/B07M7DR71L/ref=sr_1_13?dchild=1&keywords=chair&qid=1628529418&sr=8-13
"Nilkamal CHR 2225 Plastic Chair, Weather Brown, Set of 2  ",,,,"₹3,999","₹2,570","Save ₹1,429 (36%)",5.0 out of 5 stars,1,https://www.amazon.in/Nilkamal-Plastic-Chair-Weather-Brown/dp/B09922FL53/ref=sr_1_14?dchild=1&keywords=chair&qid=1628529418&sr=8-14
RW REST WELL N Type Comfortable Visitor/Study Black Metal Chair with Cushion | ISO Certified Company  ,,,,"₹2,999","₹1,799","Save ₹1,200 (40%)",3.9 out of 5 stars,190,https://www.amazon.in/RW-REST-WELL-Comfortable-Certified/dp/B085VY23MQ/ref=sr_1_15?dchild=1&keywords=chair&qid=1628529418&sr=8-15
AVRO 9100 Sturdy Plastic Chair Pettern Set of 4  ,,,,"₹4,999","₹2,360","Save ₹2,639 (53%)",3.4 out of 5 stars,10,https://www.amazon.in/AVRO-Sturdy-Plastic-Chair-Pettern/dp/B0968D5D4K/ref=sr_1_16?dchild=1&keywords=chair&qid=1628529418&sr=8-16
"Supreme Futura Plastic Chair (Wenge, Dcd)  ",,,,"₹1,199",₹950,Save ₹249 (21%),4.4 out of 5 stars,30,https://www.amazon.in/Supreme-Futura-Plastic-Chair-Wenge/dp/B08PSVX2YF/ref=sr_1_17?dchild=1&keywords=chair&qid=1628529418&sr=8-17
"Arofur Plastic Chair for Dining Room, Bedroom, Kitchen, Living Room, Bearing (1, Metallic Brown)  ",,,,"₹4,499",₹799,"Save ₹3,700 (82%)",4.7 out of 5 stars,4,https://www.amazon.in/Plastic-Bedroom-Kitchen-Bearing-Metallic/dp/B098TMGQ4J/ref=sr_1_18?dchild=1&keywords=chair&qid=1628529418&sr=8-18
"Chetan Plast Plastic Futura Chair | Set of 1| Glossy Finish | for Dining Room, Bedroom, Kitchen, Living Room Bearing Capacity up to 3.00 Kg Approx, Strong & Study Structure Multicolor  ",,,,"₹1,099",₹840,Save ₹259 (24%),2.6 out of 5 stars,8,https://www.amazon.in/Chetan-Plast-Capacity-Structure-Multicolor/dp/B09814JRG6/ref=sr_1_19?dchild=1&keywords=chair&qid=1628529418&sr=8-19
Nilkamal EEZY PCH Mid Back Plastic Chair -Set of 2  ,,,,"₹2,200","₹1,699",Save ₹501 (23%),3.6 out of 5 stars,16,https://www.amazon.in/Nemi-Agency-Plastic-EEZY-Chair/dp/B08R7L9761/ref=sr_1_20?dchild=1&keywords=chair&qid=1628529418&sr=8-20
"tied ribbons standard designer dsw chair for home, living room,cafe, bed room, office, side chair, accent chair (white)  ",,Sponsored,,"₹7,999","₹4,199","Save ₹3,800 (48%)",4.5 out of 5 stars,20,https://www.amazon.in/gp/slredirect/picassoRedirect.html/ref=pa_sp_mtf_aps_sr_pg1_1?ie=UTF8&adId=A077549634U2ZB49XKLQH&url=%2FTIED-RIBBONS-Designer-Living-Office%2Fdp%2FB082HLLCS1%2Fref%3Dsr_1_21_sspa%3Fdchild%3D1%26keywords%3Dchair%26qid%3D1628529418%26sr%3D8-21-spons%26psc%3D1&qualifier=1628529418&id=4904346028030431&widgetName=sp_mtf
SHINE WOOD ART Rosewood Modern Ergonomic Rocking Chair (Dark Brown)  ,,Sponsored,,"₹29,999","₹17,999","Save ₹12,000 (40%)",4.2 out of 5 stars,45,https://www.amazon.in/gp/slredirect/picassoRedirect.html/ref=pa_sp_mtf_aps_sr_pg1_1?ie=UTF8&adId=A036414213LMM2LK1Z4EG&url=%2FSHINE-WOOD-ART-Rosewood-Ergonomic%2Fdp%2FB08N8FH6ZF%2Fref%3Dsr_1_22_sspa%3Fdchild%3D1%26keywords%3Dchair%26qid%3D1628529418%26sr%3D8-22-spons%26psc%3D1&qualifier=1628529418&id=4904346028030431&widgetName=sp_mtf
AASALIYA Solid Wood Upholstered Arm Chair for Living Room High Back Wing Chair Cushioned Lounge Chair Single Seater Sofa - Yellow  ,Deal of the Day ,Sponsored,,"₹31,999","₹14,724","Save ₹17,275 (54%)",,,https://www.amazon.in/gp/slredirect/picassoRedirect.html/ref=pa_sp_mtf_aps_sr_pg1_1?ie=UTF8&adId=A1002808QSL6180OBNAP&url=%2FAASALIYA-Upholstered-Living-Cushioned-Lounge%2Fdp%2FB09B2PCPXW%2Fref%3Dsr_1_23_sspa%3Fdchild%3D1%26keywords%3Dchair%26qid%3D1628529418%26sr%3D8-23-spons%26psc%3D1&qualifier=1628529418&id=4904346028030431&widgetName=sp_mtf
"All INDIA HANDICRAFTS Cane Bamboo Chair for Outdoor/Indoor/Furnishing/Color: Multicolor, Size : Small  ",,Sponsored,,"₹2,500","₹1,400","Save ₹1,100 (44%)",3.7 out of 5 stars,12,https://www.amazon.in/gp/slredirect/picassoRedirect.html/ref=pa_sp_mtf_aps_sr_pg1_1?ie=UTF8&adId=A082229822P8PGMF5QJ0G&url=%2FAll-INDIA-HANDICRAFTS-Outdoor-Furnishing%2Fdp%2FB07J1LZJDN%2Fref%3Dsr_1_24_sspa%3Fdchild%3D1%26keywords%3Dchair%26qid%3D1628529418%26sr%3D8-24-spons%26psc%3D1&qualifier=1628529418&id=4904346028030431&widgetName=sp_mtf
"Ikea Italian Chair (Wood , Black)  ",,,,"₹1,599","₹1,350",Save ₹249 (16%),4.1 out of 5 stars,999,https://www.amazon.in/Ikea-Chair-Black-Indoor-Outdoor/dp/B07FVPYYZ9/ref=sr_1_25?dchild=1&keywords=chair&qid=1628529418&sr=8-25
AVRO 9100 Sturdy Plastic Chair Pettern Set of 2  ,,,,"₹2,999","₹1,100","Save ₹1,899 (63%)",3.6 out of 5 stars,25,https://www.amazon.in/AVRO-Sturdy-Plastic-Chair-Pettern/dp/B0968BMJFL/ref=sr_1_26?dchild=1&keywords=chair&qid=1628529418&sr=8-26
Nilkamal Plastic Ergonomic Chair (Brown)  ,,,,,,,3.4 out of 5 stars,440,https://www.amazon.in/Nilkamal-2155-Plastic-Chair-Brown/dp/B07LB2XBHS/ref=sr_1_27?dchild=1&keywords=chair&qid=1628529418&sr=8-27
"Highway Plastic Moulded Chair - Without arms - Without Cushion - Single Moulded Piece - Stackable, Waterproof, Weatherproof - Seats 1 Person - PVC (Polyvinyl Chloride)  ",,,,₹999,₹549,Save ₹450 (45%),2.9 out of 5 stars,3,https://www.amazon.in/Highway-Plastic-Moulded-Chair-Weatherproof/dp/B0971JBCVD/ref=sr_1_28?dchild=1&keywords=chair&qid=1628529418&sr=8-28
Nilkamal Plastic Premium Mystique/Rosa Brown Chair 1 Piece  ,,,,"₹1,999","₹1,215",Save ₹784 (39%),3.6 out of 5 stars,7,https://www.amazon.in/Nilkamal-Plastic-Premium-Mystique-Brown/dp/B08Y73L725/ref=sr_1_29?dchild=1&keywords=chair&qid=1628529418&sr=8-29
MBTC Clark Seat and Back Cushion Folding Chair  ,Best sellerLimited time deal,,,"₹2,499","₹1,476","Save ₹1,023 (41%)",4.0 out of 5 stars,345,https://www.amazon.in/gp/bestsellers/kitchen/5689451031/ref=sr_bs_29_5689451031_1
Padam Shree Well Comfortable Multi Purpose with a Leather Cushion Steel Chair Size (15 X 15 INCHES) Black  ,,,,"₹2,899","₹1,299","Save ₹1,600 (55%)",3.7 out of 5 stars,23,https://www.amazon.in/Padam-Shree-Comfortable-Purpose-Leather/dp/B08PBQV95Q/ref=sr_1_31?dchild=1&keywords=chair&qid=1628529418&sr=8-31
Bharat Sales Modern Plastic Chair ( Brown)  ,,,,₹999,₹549,Save ₹450 (45%),3.4 out of 5 stars,150,https://www.amazon.in/Bharat-Sales-oppo-102-Plastic/dp/B08LBPPKKH/ref=sr_1_32?dchild=1&keywords=chair&qid=1628529418&sr=8-32
ORANGE INDIA Wooden Folding Chair 12 inch/Baby Chair  ,,,,"₹1,299",₹499,Save ₹800 (62%),,,https://www.amazon.in/ORANGE-INDIA-Wooden-Folding-Chair/dp/B08HHPQVR9/ref=sr_1_33?dchild=1&keywords=chair&qid=1628529418&sr=8-33
"AVRO FURNITURE, 2581 Plastic Chairs, Set of 2 Pcs, Plastic Modern Ergonomic Chair Without Cushion, 200 kilograms (Orange), 2 Pieces  ",Limited time deal,,,"₹2,499","₹1,609",Save ₹890 (36%),3.8 out of 5 stars,762,https://www.amazon.in/AVRO-FURNITURE-2581-Capacity-Structure/dp/B08DY7DKZD/ref=sr_1_34?dchild=1&keywords=chair&qid=1628529418&smid=AT95IG9ONZD7S&sr=8-34
Furniture Dealz Plastic Arm Rest Chair  ,,,,"₹1,999","₹1,547",Save ₹452 (23%),4.1 out of 5 stars,195,https://www.amazon.in/Furniture-Dealz-Comfort-Standard-Rosewood/dp/B07S24Z7S1/ref=sr_1_35?dchild=1&keywords=chair&qid=1628529418&sr=8-35
Nilkamal 2060 MBG Plastic Outdoor Beige Chair  ,,,,"₹2,999","₹1,699","Save ₹1,300 (43%)",3.7 out of 5 stars,24,https://www.amazon.in/Nilkamal-2060-MBG-Plastic-Outdoor/dp/B08XJXHDGV/ref=sr_1_36?dchild=1&keywords=chair&qid=1628529418&sr=8-36
DRIMA Outdoor Portable Folding Stool Camping Hiking Fishing Picnic Chair Seat Table Chair Round Foldable Plastic for Kids Adults Home Office Garden Travelling Campy (Multicolour) (Round Stool)  ,,,,"₹1,199",₹699,Save ₹500 (42%),,,https://www.amazon.in/DRIMA-Portable-Foldable-Travelling-Multicolour/dp/B099ZXTNYX/ref=sr_1_37?dchild=1&keywords=chair&qid=1628529418&sr=8-37
Nilkamal Eeezy Plastic Chair (Brown)  ,,,,"₹1,500",₹960,Save ₹540 (36%),4.1 out of 5 stars,69,https://www.amazon.in/Nilkamal-EEEZY-Chair-Dark-Brown/dp/B08F4BZD58/ref=sr_1_38?dchild=1&keywords=chair&qid=1628529418&sr=8-38
"ANJWAR Polypropylene Arm Rest Chair (Pink, Rose, 2 Pieces)  ",,,,"₹4,359","₹2,647","Save ₹1,712 (39%)",4.0 out of 5 stars,178,https://www.amazon.in/ANJWAR-Arm_Rest-Chair-Polypropylene-Pieces/dp/B08LDFKPSJ/ref=sr_1_39?dchild=1&keywords=chair&qid=1628529418&sr=8-39
"ANJWAR Indoor/Outdoor Bearing Capacity up to 200Kg, Strong and Sturdy Structure Tub Modern Plastic Chairs Arm Rest for Home, Living Room (Rosewood) - Set of 2  ",,,,"₹4,359","₹2,649","Save ₹1,710 (39%)",4.3 out of 5 stars,20,https://www.amazon.in/ANJWAR-Outdoor-Capacity-Structure-Rosewood/dp/B091GDTF6C/ref=sr_1_40?dchild=1&keywords=chair&qid=1628529418&sr=8-40
"AVRO Plastic Chairs |9100 Single Chair | Matt and Gloss Pattern | Plastic Chairs for Home, Living Room| Bearing Capacity up to 200Kg | Strong and Sturdy Structure | 1 Year Guarantee, Brown  ",,,,"₹1,200",₹699,Save ₹501 (42%),4.0 out of 5 stars,6,https://www.amazon.in/AVRO-Plastic-Capacity-Structure-Guarantee/dp/B093DSWZ94/ref=sr_1_41?dchild=1&keywords=chair&qid=1628529418&sr=8-41
"Supreme Ornate Lacquered Finish Plastic Chairs with Cushion (Red/Black, Set of 1)  ",,,,"₹3,499","₹2,750",Save ₹749 (21%),3.8 out of 5 stars,65,https://www.amazon.in/Supreme-Ornate-Lacquered-Plastic-Cushion/dp/B084GRHPL2/ref=sr_1_42?dchild=1&keywords=chair&qid=1628529418&sr=8-42
"AmazonBasics Zero Gravity Portable Textilene Fabric and Steel Reclining Lounge Chair, Blue  ",Amazon's ChoiceDeal of the Day ,,,"₹6,000","₹3,549","Save ₹2,451 (41%)",4.2 out of 5 stars,"2,540",https://www.amazon.in/AmazonBasics-Zero-Gravity-Chair-Blue/dp/B071NHHWCN/ref=ice_ac_b_dpb?dchild=1&keywords=chair&qid=1628529418&sr=8-43
ART AND CRAFT INDIA Wooden Small Chair for Kids Furnished and Fold Wood Chair Children Folding Chair Outdoor Small Chair Antique Fishing Chair Household Children's Chair- Brown  ,,,,₹999,₹550,Save ₹449 (45%),2.3 out of 5 stars,5,https://www.amazon.in/ART-CRAFT-INDIA-Furnished-Household/dp/B08S6W5NQF/ref=sr_1_44?dchild=1&keywords=chair&qid=1628529418&sr=8-44
"OAKNEST Supreme Cambridge Outdoor/Indoor Plastic Chair (Count:2 pc, Color: Jet Black)  ",,,,"₹6,400","₹4,600","Save ₹1,800 (28%)",4.2 out of 5 stars,50,https://www.amazon.in/OAKNEST-Supreme-Cambridge-Outdoor-Plastic/dp/B08XNY8S46/ref=sr_1_45?dchild=1&keywords=chair&qid=1628529418&sr=8-45
MBTC Classic Folding Chair in Black  ,Deal of the Day ,,,"₹2,399","₹1,369","Save ₹1,030 (43%)",4.1 out of 5 stars,147,https://www.amazon.in/MBTC-Classic-Folding-Chair-Black/dp/B07BZD6XNH/ref=sr_1_46?dchild=1&keywords=chair&qid=1628529418&sr=8-46
"AmazonBasics Metal, Leather Guest Chair, Black  ",Best sellerDeal of the Day ,,,"₹11,000","₹5,899","Save ₹5,101 (46%)",4.3 out of 5 stars,"2,988",https://www.amazon.in/gp/bestsellers/kitchen/5689414031/ref=sr_bs_46_5689414031_1
Nilkamal High Gloss Finish Mid Back Plastic Chair (Brown and Biscuit) - Set of 2  ,,,,"₹4,999","₹2,599","Save ₹2,400 (48%)",,,https://www.amazon.in/Nilkamal-Gloss-Finish-Plastic-Biscuit/dp/B09927ZFVC/ref=sr_1_48?dchild=1&keywords=chair&qid=1628529418&sr=8-48
"Ikea Nisse Folding Chair (Polypropylene , Black)  ",,,,"₹1,799","₹1,380",Save ₹419 (23%),4.3 out of 5 stars,114,https://www.amazon.in/Ikea-Nisse-Plastic-Folding-Chair/dp/B07SKRD9Q3/ref=sr_1_49?dchild=1&keywords=chair&qid=1628529418&sr=8-49
"MBTC Mavic Wrought Iron Folding Study Chair with Cushion & Adjustable Writing Pad - (Black, for All Age)  ",Deal of the Day ,,,"₹6,990","₹2,647","Save ₹4,343 (62%)",4.2 out of 5 stars,146,https://www.amazon.in/MBTC-Folding-Cushion-Adjustable-Writing/dp/B08P5XGFT6/ref=sr_1_50?dchild=1&keywords=chair&qid=1628529418&sr=8-50
"AmazonBasics Steel Zero Gravity Reclining Lounge Portable Chair, Black  ",Limited time deal,,,"₹6,000","₹3,549","Save ₹2,451 (41%)",4.3 out of 5 stars,"4,140",https://www.amazon.in/AmazonBasics-Gravity-Reclining-Lounge-Portable/dp/B071173FS8/ref=sr_1_51?dchild=1&keywords=chair&qid=1628529418&smid=AT95IG9ONZD7S&sr=8-51
Nilkamal Plastic Chair Rosa Set of 2 (Red)  ,,,,,"₹2,200",,4.3 out of 5 stars,216,https://www.amazon.in/Nilkamal-Plastic-Chair-Rosa-Set/dp/B07RM1SDLS/ref=sr_1_52?dchild=1&keywords=chair&qid=1628529418&sr=8-52
winifred Steel Chair Hotel Restaurant Dining with Black Cushion Leather  ,,,,"₹3,200","₹1,299","Save ₹1,901 (59%)",,,https://www.amazon.in/winifred-Restaurant-Dining-Cushion-Leather/dp/B09BX73KT7/ref=sr_1_53?dchild=1&keywords=chair&qid=1628529418&sr=8-53
Indian Armar I8202 Folding Chair with Back Support in Comfortable Cushion (Black Color)  ,,,,"₹3,499","₹1,449","Save ₹2,050 (59%)",5.0 out of 5 stars,1,https://www.amazon.in/Indian-Folding-Support-Comfortable-Cushion/dp/B096XCMHNC/ref=sr_1_54?dchild=1&keywords=chair&qid=1628529418&sr=8-54
Plastic Contemporary & Modern Ergonomic Chair (Black)  ,,,,"₹2,000","₹1,853",Save ₹147 (7%),4.1 out of 5 stars,37,https://www.amazon.in/Cello-Decent-Delux-Chair-Black/dp/B07YLM7LHR/ref=sr_1_55?dchild=1&keywords=chair&qid=1628529418&sr=8-55
ANMOL Jordan Comfortable Plastic Arm Back Rest Chair Weight Bearing Capacity 200 kg (Brown)  ,,,,"₹1,299","₹1,145",Save ₹154 (12%),4.5 out of 5 stars,151,https://www.amazon.in/Anmol-Plastic-Texas-Comfortable-Brown_Set/dp/B07K271M9H/ref=sr_1_56?dchild=1&keywords=chair&qid=1628529418&sr=8-56
AVRO FURNITURE 2581 Plastic Modern Ergonomic Chair (Orange) - Set of 4 Pieces  ,Deal of the Day ,Sponsored,,"₹3,999","₹3,129",Save ₹870 (22%),3.8 out of 5 stars,762,https://www.amazon.in/gp/slredirect/picassoRedirect.html/ref=pa_sp_btf_aps_sr_pg1_1?ie=UTF8&adId=A104495139AHX3GGPTU6P&url=%2FAVRO-FURNITURE-2581-Capacity-Structure%2Fdp%2FB08DYB18GJ%2Fref%3Dsr_1_57_sspa%3Fdchild%3D1%26keywords%3Dchair%26qid%3D1628529418%26sr%3D8-57-spons%26psc%3D1&qualifier=1628529418&id=4904346028030431&widgetName=sp_btf
"Cello Jordan Plastic High Back Armchair, Set of 4(Rose Wood)  ",,Sponsored,,"₹5,000","₹4,899",Save ₹101 (2%),4.0 out of 5 stars,85,https://www.amazon.in/gp/slredirect/picassoRedirect.html/ref=pa_sp_btf_aps_sr_pg1_1?ie=UTF8&adId=A0628719WUPQZJFAI11J&url=%2FCello-Jordan-Chairs-Rose-Wood%2Fdp%2FB01I3R2HZC%2Fref%3Dsr_1_58_sspa%3Fdchild%3D1%26keywords%3Dchair%26qid%3D1628529418%26sr%3D8-58-spons%26psc%3D1&qualifier=1628529418&id=4904346028030431&widgetName=sp_btf
TIED RIBBONS Designer DSW Chair for Living Room Garden Patio Café Home Side Chair Office Accent Chair - (Yellow Set of 1)  ,,Sponsored,,"₹5,999","₹3,299","Save ₹2,700 (45%)",3.9 out of 5 stars,8,https://www.amazon.in/gp/slredirect/picassoRedirect.html/ref=pa_sp_btf_aps_sr_pg1_1?ie=UTF8&adId=A07755521RP7D2T1ECB99&url=%2FTIED-RIBBONS-Designer-Outdoor-Balcony%2Fdp%2FB082HLYSNF%2Fref%3Dsr_1_59_sspa%3Fdchild%3D1%26keywords%3Dchair%26qid%3D1628529418%26sr%3D8-59-spons%26psc%3D1&qualifier=1628529418&id=4904346028030431&widgetName=sp_btf
AASALIYA Art Solid Wood Upholstered Arm Chair for Living Room High Back Wing Chair Cushioned Lounge Chair Single Seater Sofa -Yellow  ,,Sponsored,,"₹25,999","₹16,992","Save ₹9,007 (35%)",,,https://www.amazon.in/gp/slredirect/picassoRedirect.html/ref=pa_sp_btf_aps_sr_pg1_1?ie=UTF8&adId=A10022283JKRJA1QJ1I74&url=%2FAASALIYA-Art-Upholstered-Cushioned-Yellow%2Fdp%2FB09B19YNT5%2Fref%3Dsr_1_60_sspa%3Fdchild%3D1%26keywords%3Dchair%26qid%3D1628529418%26sr%3D8-60-spons%26psc%3D1&qualifier=1628529418&id=4904346028030431&widgetName=sp_btf
Globel Interiors India Sheesham Wood Traditional Arm Rest Chair ( Brown)  ,,Sponsored,,"₹19,999","₹12,499.99","Save ₹7,499.01 (37%)",4.5 out of 5 stars,48,https://www.amazon.in/gp/slredirect/picassoRedirect.html/ref=pa_sp_atf_next_aps_sr_pg2_1?ie=UTF8&adId=A01887961S1LDC5X3081B&url=%2FGlobel-Interiors-India-Rocking-grandpaa%2Fdp%2FB08FCLLJ3X%2Fref%3Dsr_1_49_sspa%3Fdchild%3D1%26keywords%3Dchair%26qid%3D1628529437%26sr%3D8-49-spons%26psc%3D1&qualifier=1628529437&id=2121949448488651&widgetName=sp_atf_next
"TIED RIBBONS Designer DSW Accent Chair for Bed Room Office Café Home Living Room Side Chair (Yellow, 81 cm X 40 cm)  ",,Sponsored,,"₹4,999","₹2,299","Save ₹2,700 (54%)",3.5 out of 5 stars,10,https://www.amazon.in/gp/slredirect/picassoRedirect.html/ref=pa_sp_atf_next_aps_sr_pg2_1?ie=UTF8&adId=A0775952QKI3ZIWVZQHA&url=%2FTIED-RIBBONS-Designer-Office-Living%2Fdp%2FB07H7N667F%2Fref%3Dsr_1_50_sspa%3Fdchild%3D1%26keywords%3Dchair%26qid%3D1628529437%26sr%3D8-50-spons%26psc%3D1&qualifier=1628529437&id=2121949448488651&widgetName=sp_atf_next
"TIED RIBBONS Designer DSW Side Chair for Cafe, Office, Home, Living Room, Bed Room, Side Chair, Accent Chair (Brown)  ",,Sponsored,,"₹7,999","₹4,199","Save ₹3,800 (48%)",3.4 out of 5 stars,9,https://www.amazon.in/gp/slredirect/picassoRedirect.html/ref=pa_sp_atf_next_aps_sr_pg2_1?ie=UTF8&adId=A07753401SAFNDDRC7H6Y&url=%2FTIED-RIBBONS-Designer-Office-Living%2Fdp%2FB07T7HC4WV%2Fref%3Dsr_1_51_sspa%3Fdchild%3D1%26keywords%3Dchair%26qid%3D1628529437%26sr%3D8-51-spons%26psc%3D1&qualifier=1628529437&id=2121949448488651&widgetName=sp_atf_next
"TIED RIBBONS Designer DSW Chair for Office, Home, Living Room, Office, Side Chair, Accent Chair (Blue, 81 cm X 40 cm)  ",,Sponsored,,"₹4,999","₹2,299","Save ₹2,700 (54%)",5.0 out of 5 stars,1,https://www.amazon.in/gp/slredirect/picassoRedirect.html/ref=pa_sp_atf_next_aps_sr_pg2_1?ie=UTF8&adId=A0776052U7L6S6IJE2&url=%2FTIED-RIBBONS-Designer-Office-Living%2Fdp%2FB08YYKHLYF%2Fref%3Dsr_1_52_sspa%3Fdchild%3D1%26keywords%3Dchair%26qid%3D1628529437%26sr%3D8-52-spons%26psc%3D1&qualifier=1628529437&id=2121949448488651&widgetName=sp_atf_next
PS PARVESH SMART Web Chair Heavy Duty Plastic Chair for Home and Garden (Green)  ,,,,"₹6,000","₹1,299","Save ₹4,701 (78%)",3.4 out of 5 stars,97,https://www.amazon.in/PS-PARVESH-SMART-Plastic-Garden/dp/B08NFGL5GF/ref=sr_1_53?dchild=1&keywords=chair&qid=1628529437&sr=8-53
Lion Industries Seating Furniture Folding Cotton Chair with Strong Square Handle + Free 6mm pad for Laptop and Reading (Multicolour) Specially Made for Childers Age of (4 to 16 Age)  ,,,,"₹1,999","₹1,399",Save ₹600 (30%),3.9 out of 5 stars,6,https://www.amazon.in/Lion-Industries-Furniture-Multicolour-Specially/dp/B097KJP11Q/ref=sr_1_54?dchild=1&keywords=chair&qid=1628529437&sr=8-54
Nilkamal Mystique Black Premium Chair (Pack of 2)  ,,,,"₹2,999","₹2,299",Save ₹700 (23%),4.1 out of 5 stars,10,https://www.amazon.in/Nilkamal-Mystique-Black-Premium-Chair/dp/B095P35YG7/ref=sr_1_55?dchild=1&keywords=chair&qid=1628529437&sr=8-55
RW REST WELL S-Model Black Study/Visitor Chair (Made in India)  ,,,,"₹3,000","₹1,699","Save ₹1,301 (43%)",3.7 out of 5 stars,198,https://www.amazon.in/RW-Rest-S-Model-Metal-Chair/dp/B07DMGBB1K/ref=sr_1_56?dchild=1&keywords=chair&qid=1628529437&sr=8-56
Nilkamal Weekender Relaxing Brown Chair Set of 1  ,,,,"₹1,999","₹1,490",Save ₹509 (25%),3.6 out of 5 stars,16,https://www.amazon.in/Nilkamal-Weekender-Relaxing-Brown-Chair/dp/B08W3DWV5F/ref=sr_1_57?dchild=1&keywords=chair&qid=1628529437&sr=8-57
"TIED RIBBONS Designer DSW Chair for Office, Home, Living Room, Office, Side Chair, Accent Chair (Blue, 81 cm X 40 cm)  ",,,,"₹4,999","₹2,299","Save ₹2,700 (54%)",5.0 out of 5 stars,1,https://www.amazon.in/TIED-RIBBONS-Designer-Office-Living/dp/B08YYKHLYF/ref=sr_1_58?dchild=1&keywords=chair&qid=1628529437&sr=8-58
"AVRO Plastic Chairs | Set of 2 | | Matt and Gloss Pattern | Plastic Chairs for Home, Living Room| Bearing Capacity up to 200Kg | Strong and Sturdy Structure | 1 Year Guarantee, Brown  ",,,,"₹2,000","₹1,690",Save ₹310 (16%),3.9 out of 5 stars,660,https://www.amazon.in/AVRO-9100-Capacity-Structure-Guarantee/dp/B081PWNSVN/ref=sr_1_49?dchild=1&keywords=chair&qid=1628529437&sr=8-49
"Nilkamal Set of 2 CHR2051 Plastic Chair, Marble Beige  ",Deal of the Day ,,,"₹1,800","₹1,709",Save ₹91 (5%),4.0 out of 5 stars,115,https://www.amazon.in/Nilkamal-CHR2051-Plastic-Chair-Marble/dp/B07X88H9MJ/ref=sr_1_50?dchild=1&keywords=chair&qid=1628529437&sr=8-50
"Livshine Plastic Chair for Home, Office and Garden Set of 2 (Royal King, Wooden)  ",,,,"₹4,999","₹1,549","Save ₹3,450 (69%)",5.0 out of 5 stars,1,https://www.amazon.in/Livshine-Plastic-Office-Garden-Wooden/dp/B0949JYHG6/ref=sr_1_51?dchild=1&keywords=chair&qid=1628529437&sr=8-51
"GTB BT-221 Folding Chair with Foam , Black  ",,,,"₹2,999","₹1,615","Save ₹1,384 (46%)",4.1 out of 5 stars,284,https://www.amazon.in/GTB-Folding-Chair-FOAM-BT-221-Black/dp/B07T4SP6B4/ref=sr_1_52?dchild=1&keywords=chair&qid=1628529437&sr=8-52
"ANMOL Plastic Moulded Fortuner Heavy Structure Antique Chair with Arm Rest for Home, Office, Restaurants (Brown, Weight Capacity 200kgs)  ",,,,"₹1,399","₹1,145",Save ₹254 (18%),4.6 out of 5 stars,62,https://www.amazon.in/Fortuner-Structure-Warranty-Restaurants-Capacity/dp/B08JSP4CHY/ref=sr_1_53?dchild=1&keywords=chair&qid=1628529437&sr=8-53
"Nilkamal Eeezy Baby Chair Gem (Standard, Green) Set of 2  ",,,,"₹1,399",₹999,Save ₹400 (29%),4.0 out of 5 stars,63,https://www.amazon.in/Nilkamal-Eeezy-Chair-Standard-Green/dp/B088MJGTJL/ref=sr_1_54?dchild=1&keywords=chair&qid=1628529437&sr=8-54
"Ikea ADDE Chair, Black,(Pack of 2)  ",,,,"₹2,999","₹2,850",Save ₹149 (5%),3.6 out of 5 stars,6,https://www.amazon.in/Ikea-ADDE-Chair-Black-Pack/dp/B08T1FZRK6/ref=sr_1_55?dchild=1&keywords=chair&qid=1628529437&sr=8-55
