name,badge_1,badge_2,badge_3,mrp,discounted_price,discount,rating,rating_count,link
CasaCraft by Pepperfry - Linda Lounge Chair in Black and White Colour  ,,Sponsored,,"₹51,999","₹30,597","Save ₹21,402 (41%)",,,https://www.amazon.in/gp/slredirect/picassoRedirect.html/ref=pa_sp_atf_aps_sr_pg1_1?ie=UTF8&adId=A08043321LV9A7JB83WW0&url=%2FCasaCraft-Pepperfry-Linda-Lounge-Colour%2Fdp%2FB08YJVVSJB%2Fref%3Dsr_1_1_sspa%3Fdchild%3D1%26keywords%3Dchair%26qid%3D1625239112%26sr%3D8-1-spons%26psc%3D1&qualifier=1625239112&id=8818592064495706&widgetName=sp_atf
Woodsworth by Pepperfry - Tucson Solid Wood Rocking Chair in Honey Oak Finish  ,,Sponsored,,"₹37,999","₹19,248","Save ₹18,751 (49%)",,,https://www.amazon.in/gp/slredirect/picassoRedirect.html/ref=pa_sp_atf_aps_sr_pg1_1?ie=UTF8&adId=A02712563CKHYXGZOOQTC&url=%2FWoodsworth-Pepperfry-Tucson-Rocking-Finish%2Fdp%2FB08YJC8MT9%2Fref%3Dsr_1_2_sspa%3Fdchild%3D1%26keywords%3Dchair%26qid%3D1625239112%26sr%3D8-2-spons%26psc%3D1&qualifier=1625239112&id=8818592064495706&widgetName=sp_atf
"AmazonBasics Steel Zero Gravity Reclining Lounge Portable Chair, Black  ",,Sponsored,,"₹6,000","₹4,099","Save ₹1,901 (32%)",4.3 out of 5 stars,"3,883",https://www.amazon.in/gp/slredirect/picassoRedirect.html/ref=pa_sp_atf_aps_sr_pg1_1?ie=UTF8&adId=A08773332Y83H4IK1FMJ0&url=%2FAmazonBasics-Gravity-Reclining-Lounge-Portable%2Fdp%2FB071173FS8%2Fref%3Dsr_1_3_sspa%3Fdchild%3D1%26keywords%3Dchair%26qid%3D1625239112%26sr%3D8-3-spons%26psc%3D1&qualifier=1625239112&id=8818592064495706&widgetName=sp_atf
Streetup India Iyengar Yoga Chair (Backless) Meditation Chair for Yoga (Black)  ,,Sponsored,,"₹3,499","₹2,499","Save ₹1,000 (29%)",4.7 out of 5 stars,8,https://www.amazon.in/gp/slredirect/picassoRedirect.html/ref=pa_sp_atf_aps_sr_pg1_1?ie=UTF8&adId=A049987038PHWG5PAD0J2&url=%2FStreetup-India-Backless-Chair-Meditation%2Fdp%2FB08BK3HJ61%2Fref%3Dsr_1_4_sspa%3Fdchild%3D1%26keywords%3Dchair%26qid%3D1625239112%26sr%3D8-4-spons%26psc%3D1&qualifier=1625239112&id=8818592064495706&widgetName=sp_atf
AVRO 9100 Sturdy Plastic Chair Pettern Set of 2  ,,,,"₹1,699","₹1,320",Save ₹379 (22%),,,https://www.amazon.in/AVRO-Sturdy-Plastic-Chair-Pettern/dp/B0968BMJFL/ref=sr_1_5?dchild=1&keywords=chair&qid=1625239112&sr=8-5
"AVRO FURNITURE 7756 Plastic Chair | Set of 2 | Matt and Gloss Pattern | for Dining Room, Bedroom, Kitchen, Living Room | Bearing Capacity up to 150Kg | Strong & Sturdy Structure  ",,,,"₹2,499","₹1,499","Save ₹1,000 (40%)",3.6 out of 5 stars,"1,291",https://www.amazon.in/AVRO-FURNITURE-Capacity-Structure-Guarantee/dp/B07Y2VF1GR/ref=sr_1_6?dchild=1&keywords=chair&qid=1625239112&sr=8-6
AVRO 9100 Sturdy Plastic Chair Pettern Set of 4  ,,,,"₹4,999","₹2,350","Save ₹2,649 (53%)",,,https://www.amazon.in/AVRO-Sturdy-Plastic-Chair-Pettern/dp/B0968D5D4K/ref=sr_1_7?dchild=1&keywords=chair&qid=1625239112&sr=8-7
Nilkamal Plastic Chair Rosa Set of 2 (Red)  ,,,,,,,4.3 out of 5 stars,196,https://www.amazon.in/Nilkamal-Plastic-Chair-Rosa-Set/dp/B07RM1SDLS/ref=sr_1_8?dchild=1&keywords=chair&qid=1625239112&sr=8-8
"AVRO FURNITURE, 2581 Plastic Chairs, Set of 2 Pcs, Plastic Modern Ergonomic Chair Without Cushion, 200 kilograms (Orange), 2 Pieces  ",Best seller,,,"₹2,499","₹1,699",Save ₹800 (32%),3.8 out of 5 stars,587,https://www.amazon.in/gp/bestsellers/kitchen/5689449031/ref=sr_bs_8_5689449031_1
"ANJWAR Indoor/Outdoor Bearing Capacity up to 200Kg, Strong and Sturdy Structure Tub Modern Plastic Chairs Arm Rest for Home, Living Room (Rosewood) - Set of 2  ",,,,"₹4,359","₹2,649","Save ₹1,710 (39%)",4.2 out of 5 stars,8,https://www.amazon.in/ANJWAR-Outdoor-Capacity-Structure-Rosewood/dp/B091GDTF6C/ref=sr_1_10?dchild=1&keywords=chair&qid=1625239112&sr=8-10
"Bharat Sales Matt and Gloss Pattern Plastic Chair for Dining Room, Bedroom, Kitchen, Living Room, Bearing Capacity up to 150Kg (Assorted Colour)  ",,,,₹999,₹849,Save ₹150 (15%),3.4 out of 5 stars,26,https://www.amazon.in/Bharat-Sales-Plastic-Capacity-Structure/dp/B08LBS9SRT/ref=sr_1_11?dchild=1&keywords=chair&qid=1625239112&sr=8-11
"Ikea Modern Chair (Steel , White)  ",Best seller,,,"₹1,999","₹1,200",Save ₹799 (40%),4.2 out of 5 stars,"1,422",https://www.amazon.in/gp/bestsellers/kitchen/5689456031/ref=sr_bs_11_5689456031_1
Home Centre Emma Solid Metal Folding Chair - White  ,,,,,₹995,,3.9 out of 5 stars,36,https://www.amazon.in/Home-Centre-Solid-Folding-Chair/dp/B089G7ZK3J/ref=sr_1_13?dchild=1&keywords=chair&qid=1625239112&sr=8-13
"Supreme Futura Plastic Chair (Wenge, Dcd)  ",,,,"₹2,000",₹950,"Save ₹1,050 (53%)",4.3 out of 5 stars,19,https://www.amazon.in/Supreme-Futura-Plastic-Chair-Wenge/dp/B08PSVX2YF/ref=sr_1_14?dchild=1&keywords=chair&qid=1625239112&sr=8-14
"Supreme Futura Plastic Chairs for Home and Office (Set of 2, Brown)  ",,,,"₹2,400","₹1,700",Save ₹700 (29%),4.0 out of 5 stars,200,https://www.amazon.in/Supreme-Futura-Stacking-Chair-Brown/dp/B07MBQX6MZ/ref=sr_1_15?dchild=1&keywords=chair&qid=1625239112&sr=8-15
"ZOTZIT Portable Folding Chair with Arm Rest Cup Holder and Carrying and Perfect Storage Bag(Material-Polyester, Alloy Steel,Multicolor,1 Piece)  ",,,,"₹1,800",₹899,Save ₹901 (50%),4.1 out of 5 stars,47,https://www.amazon.in/ZOTZIT-Portable-Folding-Carrying-Multicolor/dp/B089NTD8V4/ref=sr_1_16?dchild=1&keywords=chair&qid=1625239112&sr=8-16
"COIRFIT SMART HOMES Premium Multipurpose Seat and Back Cushion Folding Chair, Black, 18.9 * 15.75 * 35.43 inches  ",,,,,,,3.8 out of 5 stars,11,https://www.amazon.in/COIRFIT-SMART-HOMES-Premium-Multipurpose/dp/B08R7L85XC/ref=sr_1_17?dchild=1&keywords=chair&qid=1625239112&sr=8-17
Nilkamal 2060 MBG Plastic Outdoor Beige Chair  ,,,,"₹1,945","₹1,680",Save ₹265 (14%),3.6 out of 5 stars,15,https://www.amazon.in/Nilkamal-2060-MBG-Plastic-Outdoor/dp/B08XJXHDGV/ref=sr_1_18?dchild=1&keywords=chair&qid=1625239112&sr=8-18
"Supreme Ornate Lacquered Finish Plastic Chairs with Cushion (Red/Black, Set of 1)  ",,,,"₹2,999","₹2,850",Save ₹149 (5%),3.7 out of 5 stars,46,https://www.amazon.in/Supreme-Ornate-Lacquered-Plastic-Cushion/dp/B084GRHPL2/ref=sr_1_19?dchild=1&keywords=chair&qid=1625239112&sr=8-19
Bharat Sales Vinyl Adjustable Height Control Chair (Brown)  ,,,,₹999,₹579,Save ₹420 (42%),2.4 out of 5 stars,12,https://www.amazon.in/Bharat-Sales-Adjustable-Height-Control/dp/B08VJ68429/ref=sr_1_20?dchild=1&keywords=chair&qid=1625239112&sr=8-20
"Gracious Mart - Folding Relax Lounge Chair for Outdoor, Indoor Lounge Easy Chair & Bed - [Recliner | Pack of 1]  ",,Sponsored,,"₹4,999","₹3,029","Save ₹1,970 (39%)",4.2 out of 5 stars,6,https://www.amazon.in/gp/slredirect/picassoRedirect.html/ref=pa_sp_mtf_aps_sr_pg1_1?ie=UTF8&adId=A051480223MFDZSL4RY1A&url=%2FGracious-Mart-Folding-Outdoor-Recliner%2Fdp%2FB084L8LYZJ%2Fref%3Dsr_1_21_sspa%3Fdchild%3D1%26keywords%3Dchair%26qid%3D1625239112%26sr%3D8-21-spons%26psc%3D1&qualifier=1625239112&id=8818592064495706&widgetName=sp_mtf
NEOSAFE Stainless Steel Commode Chair (Grey)  ,,Sponsored,,"₹4,200","₹1,980","Save ₹2,220 (53%)",,,https://www.amazon.in/gp/slredirect/picassoRedirect.html/ref=pa_sp_mtf_aps_sr_pg1_1?ie=UTF8&adId=A1015992NV0O85S6JACG&url=%2FNEOSAFE-Stainless-Steel-Commode-Chair%2Fdp%2FB08ZCRQGGF%2Fref%3Dsr_1_22_sspa%3Fdchild%3D1%26keywords%3Dchair%26qid%3D1625239112%26sr%3D8-22-spons%26psc%3D1&qualifier=1625239112&id=8818592064495706&widgetName=sp_mtf
"tied ribbons standard designer dsw chair for home, living room,cafe, bed room, office, side chair, accent chair (white)  ",,Sponsored,,"₹7,999","₹4,199","Save ₹3,800 (48%)",4.4 out of 5 stars,13,https://www.amazon.in/gp/slredirect/picassoRedirect.html/ref=pa_sp_mtf_aps_sr_pg1_1?ie=UTF8&adId=A077549634U2ZB49XKLQH&url=%2FTIED-RIBBONS-Designer-Living-Office%2Fdp%2FB082HLLCS1%2Fref%3Dsr_1_23_sspa%3Fdchild%3D1%26keywords%3Dchair%26qid%3D1625239112%26sr%3D8-23-spons%26psc%3D1&qualifier=1625239112&id=8818592064495706&widgetName=sp_mtf
"AmazonBasics Zero Gravity Portable Textilene Fabric and Steel Reclining Lounge Chair, Blue  ",Amazon's Choice,Sponsored,,"₹6,000","₹4,099","Save ₹1,901 (32%)",4.3 out of 5 stars,"2,437",https://www.amazon.in/gp/slredirect/picassoRedirect.html/ref=pa_sp_mtf_aps_sr_pg1_1?ie=UTF8&adId=A07662712Z4PID7IAJM1G&url=%2FAmazonBasics-Zero-Gravity-Chair-Blue%2Fdp%2FB071NHHWCN%2Fref%3Dice_ac_b_dpb_sspa%3Fdchild%3D1%26keywords%3Dchair%26qid%3D1625239112%26sr%3D8-24-spons%26psc%3D1&qualifier=1625239112&id=8818592064495706&widgetName=sp_mtf
Amazon Brand - Solimo Tigris Plastic Chair Set of 4 (Red)  ,,,,"₹6,000","₹2,799","Save ₹3,201 (53%)",,,https://www.amazon.in/Amazon-Brand-Solimo-Tigris-Plastic/dp/B08F8NCD1T/ref=sr_1_25?dchild=1&keywords=chair&qid=1625239112&sr=8-25
MBTC Clark Seat and Back Cushion Folding Chair  ,,,,"₹2,499","₹1,519",Save ₹980 (39%),3.9 out of 5 stars,320,https://www.amazon.in/MBTC-Clark-Cushion-Folding-Chair/dp/B078NZ49DX/ref=sr_1_26?dchild=1&keywords=chair&qid=1625239112&sr=8-26
"AmazonBasics Zero Gravity Textilene Fabric and Steel Portable Reclining Lounge Chair, Red  ",,,,"₹6,000","₹4,099","Save ₹1,901 (32%)",4.3 out of 5 stars,"2,155",https://www.amazon.in/AmazonBasics-Zero-Gravity-Chair-Burgundy/dp/B071V85DLN/ref=sr_1_27?dchild=1&keywords=chair&qid=1625239112&sr=8-27
Ikea Modern Folding Chair (Silver)  ,,,,"₹2,500","₹1,390","Save ₹1,110 (44%)",4.4 out of 5 stars,105,https://www.amazon.in/Ikea-Nisse-Folding-Chair-Silver-Colour/dp/B07T7GFWZ4/ref=sr_1_28?dchild=1&keywords=chair&qid=1625239112&sr=8-28
"Bharat Sales Plastic Strong & Sturdy Structure Matt and Gloss Pattern Chair for Dining Room, Bedroom, Kitchen, Living Room, Bearing Capacity up to 150Kg  ",,,,"₹1,499","₹1,099",Save ₹400 (27%),3.9 out of 5 stars,21,https://www.amazon.in/Bharat-Sales-Comfortable-Plastic-Signet/dp/B0855SGCV3/ref=sr_1_29?dchild=1&keywords=chair&qid=1625239112&sr=8-29
"MyCrystal Bamboo Lightweight and Ecofriendly Cane Chair with Cushion for Kids and Adults (Brown, Medium )  ",,,,"₹3,999","₹2,699","Save ₹1,300 (33%)",3.8 out of 5 stars,34,https://www.amazon.in/MyCrystal-Lightweight-Ecofriendly-Chair-Cushion/dp/B08QRG934M/ref=sr_1_30?dchild=1&keywords=chair&qid=1625239112&sr=8-30
"AVRO FURNITURE 9100 Plastic Chairs, Set of 4, Matt and Gloss Pattern, Plastic Chairs for Home, Living Room, Bearing Capacity up to 200Kg, Strong and Sturdy Structure,Brown  ",,,,"₹3,999","₹2,599","Save ₹1,400 (35%)",3.7 out of 5 stars,542,https://www.amazon.in/AVRO-Plastic-Capacity-Structure-Guarantee/dp/B081PY3RXV/ref=sr_1_31?dchild=1&keywords=chair&qid=1625239112&sr=8-31
"Portable Seating Chair Multipurpose Wooden and Iron Folding Chair for Home and Office Use,  ",,,,"₹1,499",₹720,Save ₹779 (52%),3.4 out of 5 stars,37,https://www.amazon.in/Portable-Seating-Multipurpose-Wooden-Folding/dp/B07CWWJVB7/ref=sr_1_32?dchild=1&keywords=chair&qid=1625239112&sr=8-32
Home Centre Emma Solid Folding Chair  ,,,Only 2 left in stock.,,₹995,,4.0 out of 5 stars,6,https://www.amazon.in/Home-Centre-Solid-Folding-Chair/dp/B089GBLPCT/ref=sr_1_33?dchild=1&keywords=chair&qid=1625239112&sr=8-33
"Azad Furniture Modern Plastic Chair with Arm (Cream, Set of 2)  ",,,,"₹5,000","₹1,399.99","Save ₹3,600.01 (72%)",,,https://www.amazon.in/Furniture-Modern-Plastic-Chair-Cream/dp/B0964C49K3/ref=sr_1_34?dchild=1&keywords=chair&qid=1625239112&sr=8-34
"MBTC Mavic Wrought Iron Folding Study Chair with Cushion & Adjustable Writing Pad - (Black, for All Age)  ",Best seller,,,"₹6,990","₹3,146","Save ₹3,844 (55%)",4.3 out of 5 stars,103,https://www.amazon.in/gp/bestsellers/kitchen/5689451031/ref=sr_bs_34_5689451031_1
"FurniPure Calibre Folding Study Chair with Adjustable Writing Pad, Cup Holder, Bag Holder (Black)  ",Limited time deal,,,"₹5,072","₹2,990","Save ₹2,082 (41%)",3.6 out of 5 stars,45,https://www.amazon.in/FurniPure-Calibre-Folding-Adjustable-Writing/dp/B08W8NLV2V/ref=sr_1_36?dchild=1&keywords=chair&qid=1625239112&smid=AGQM1FGDTU6LE&sr=8-36
"Ikea Adde Chair Pack of (1, White)  ",,,,"₹9,999","₹1,250","Save ₹8,749 (87%)",1.0 out of 5 stars,1,https://www.amazon.in/Ikea-Adde-Chair-Pack-White/dp/B0942VJM49/ref=sr_1_37?dchild=1&keywords=chair&qid=1625239112&sr=8-37
"Nilkamal Weekender Relaxing Chair, Brown  ",,,,"₹1,890","₹1,480",Save ₹410 (22%),4.0 out of 5 stars,503,https://www.amazon.in/Nilkamal-Weekender-Relaxing-Chair-Brown/dp/B0751DHPGX/ref=sr_1_38?dchild=1&keywords=chair&qid=1625239112&sr=8-38
"OAKNEST Supreme Cambridge Outdoor/Indoor Plastic Chair (Count:2 pc, Color: Jet Black)  ",,,,"₹6,400","₹4,600","Save ₹1,800 (28%)",4.2 out of 5 stars,24,https://www.amazon.in/OAKNEST-Supreme-Cambridge-Outdoor-Plastic/dp/B08XNY8S46/ref=sr_1_39?dchild=1&keywords=chair&qid=1625239112&sr=8-39
"AVRO Plastic Chairs | Set of 2 | | Matt and Gloss Pattern | Plastic Chairs for Home, Living Room| Bearing Capacity up to 200Kg | Strong and Sturdy Structure | 1 Year Guarantee, Brown  ",,,,"₹2,499","₹1,499","Save ₹1,000 (40%)",4.0 out of 5 stars,530,https://www.amazon.in/AVRO-9100-Capacity-Structure-Guarantee/dp/B081PWNSVN/ref=sr_1_40?dchild=1&keywords=chair&qid=1625239112&sr=8-40
"AmazonBasics Metal, Leather Guest Chair, Black  ",Best seller,,,"₹11,000","₹7,239","Save ₹3,761 (34%)",4.4 out of 5 stars,"2,949",https://www.amazon.in/gp/bestsellers/kitchen/5689414031/ref=sr_bs_40_5689414031_1
Nilkamal Mystique Premium Chair (Pack of 2)  ,,,,"₹2,999","₹2,399",Save ₹600 (20%),4.0 out of 5 stars,1,https://www.amazon.in/Nilkamal-Mystique-Premium-Chair-Pack/dp/B095P35YG7/ref=sr_1_42?dchild=1&keywords=chair&qid=1625239112&sr=8-42
"COIRFIT SMART HOMES Contemporary Arm Rest Folding Chair (Stainless Steel,Black,1 Piece), 17 * 17 * 34 inches  ",,,,"₹3,998","₹1,517","Save ₹2,481 (62%)",3.9 out of 5 stars,8,https://www.amazon.in/COIRFIT-SMART-HOMES-Contemporary-Stainless/dp/B08R7KKSL9/ref=sr_1_43?dchild=1&keywords=chair&qid=1625239112&sr=8-43
Nilkamal Weekender Relaxing Brown Chair Set of 1  ,,,,"₹1,999","₹1,484",Save ₹515 (26%),3.8 out of 5 stars,8,https://www.amazon.in/Nilkamal-Weekender-Relaxing-Brown-Chair/dp/B08W3DWV5F/ref=sr_1_44?dchild=1&keywords=chair&qid=1625239112&sr=8-44
"Ikea Nisse Steel, Epoxy powder coating Folding Chair, Green  ",,,,"₹1,999","₹1,390",Save ₹609 (30%),4.0 out of 5 stars,23,https://www.amazon.in/Ikea-Nisse-Folding-Chair-Green/dp/B08LBGHRDW/ref=sr_1_45?dchild=1&keywords=chair&qid=1625239112&sr=8-45
"Nemi Agency NILKAMAL CHR 2225 Plastic Chair, Weather Brown, Set of 2  ",,,,"₹3,999","₹2,575","Save ₹1,424 (36%)",3.9 out of 5 stars,38,https://www.amazon.in/Nemi-Agency-NILKAMAL-2225-Plastic/dp/B08KSZJX4G/ref=sr_1_46?dchild=1&keywords=chair&qid=1625239112&sr=8-46
"Nilkamal Mystique Chair, Set of 2 (Charcoal Grey)  ",,,,"₹3,000","₹2,009",Save ₹991 (33%),4.2 out of 5 stars,"2,950",https://www.amazon.in/Nilkamal-Mystique-Chair-Charcoal-Grey/dp/B06ZZ7NBNS/ref=sr_1_47?dchild=1&keywords=chair&qid=1625239112&sr=8-47
"Nilkamal Plastic Chair 2060, MBG Pack of 2  ",,,,"₹2,500","₹1,799",Save ₹701 (28%),,,https://www.amazon.in/Nilkamal-Plastic-Chair-2060-Pack/dp/B097YCZTNT/ref=sr_1_48?dchild=1&keywords=chair&qid=1625239112&sr=8-48
Lion metal Chair ( Green)  ,,,,"₹2,999","₹1,799","Save ₹1,200 (40%)",3.8 out of 5 stars,157,https://www.amazon.in/Lion-Industries-Folding-Strong-Square/dp/B08F4F8KC6/ref=sr_1_49?dchild=1&keywords=chair&qid=1625239112&sr=8-49
G2J Brothers Polyester Portable Foldable Camping Big Chair with Carry Bag for Travelling (Multicolour )  ,,,,"₹1,545","₹1,019",Save ₹526 (34%),4.3 out of 5 stars,19,https://www.amazon.in/G2J-Brothers%C2%AE-Portable-Foldable-Travelling/dp/B08K964K3D/ref=sr_1_50?dchild=1&keywords=chair&qid=1625239112&sr=8-50
"Nilkamal Eeezy Baby Chair Gem (Standard, Green) Set of 2  ",,,,,,,3.8 out of 5 stars,50,https://www.amazon.in/Nilkamal-Eeezy-Chair-Standard-Green/dp/B088MJGTJL/ref=sr_1_51?dchild=1&keywords=chair&qid=1625239112&sr=8-51
Nilkamal Mid Back Plastic Chair -Set of 2  ,,,,"₹2,500","₹1,799",Save ₹701 (28%),4.0 out of 5 stars,863,https://www.amazon.in/Nilkamal-Back-Plastic-Chair-Set/dp/B07J6BK43Y/ref=sr_1_52?dchild=1&keywords=chair&qid=1625239112&sr=8-52
Beyond Collection (Baby Small Chair) Furnished and Fold Wood Chair Children Folding Chair Outdoor Portable Small Chair Fishing Stool Household Children's Stool Leisure Chair (24 x 12 x 12)  ,,,,₹999,₹440,Save ₹559 (56%),,,https://www.amazon.in/Collection-Furnished-Children-Household-Childrens/dp/B08YRKDDN8/ref=sr_1_53?dchild=1&keywords=chair&qid=1625239112&sr=8-53
Restomatt Mistique Plastic Armchair (Black)  ,,,,"₹2,000","₹1,100",Save ₹900 (45%),3.5 out of 5 stars,34,https://www.amazon.in/Restomatt-Mistique-Armchair-Plastic-Black/dp/B08NJK1DRF/ref=sr_1_54?dchild=1&keywords=chair&qid=1625239112&sr=8-54
OAKNEST Supreme Futura Stacking Designer Plastic Chair for Home&Office (Color: Wenge | Count: 2 Pc)  ,,,,"₹2,400","₹1,900",Save ₹500 (21%),2.9 out of 5 stars,6,https://www.amazon.in/OAKNEST-Supreme-Futura-Stacking-Designer/dp/B093DV2XDT/ref=sr_1_55?dchild=1&keywords=chair&qid=1625239112&sr=8-55
"AmazonBasics Steel Zero Gravity Reclining Lounge Portable Chair, Black  ",,,,"₹6,000","₹4,099","Save ₹1,901 (32%)",4.3 out of 5 stars,"3,883",https://www.amazon.in/AmazonBasics-Gravity-Reclining-Lounge-Portable/dp/B071173FS8/ref=sr_1_56?dchild=1&keywords=chair&qid=1625239112&sr=8-56
TIED RIBBONS Designer DSW Chair for Living Room Garden Patio Café Home Side Chair Office Accent Chair - (Yellow Set of 1)  ,,Sponsored,,"₹5,999","₹3,349","Save ₹2,650 (44%)",3.4 out of 5 stars,4,https://www.amazon.in/gp/slredirect/picassoRedirect.html/ref=pa_sp_btf_aps_sr_pg1_1?ie=UTF8&adId=A07755521RP7D2T1ECB99&url=%2FTIED-RIBBONS-Designer-Outdoor-Balcony%2Fdp%2FB082HLYSNF%2Fref%3Dsr_1_57_sspa%3Fdchild%3D1%26keywords%3Dchair%26qid%3D1625239112%26sr%3D8-57-spons%26psc%3D1&qualifier=1625239112&id=8818592064495706&widgetName=sp_btf
"TIED RIBBONS Designer DSW Side Chair for Cafe, Office, Home, Living Room, Bed Room, Side Chair, Accent Chair (Brown)  ",,Sponsored,Only 2 left in stock.,"₹7,999","₹4,199","Save ₹3,800 (48%)",3.1 out of 5 stars,6,https://www.amazon.in/gp/slredirect/picassoRedirect.html/ref=pa_sp_btf_aps_sr_pg1_1?ie=UTF8&adId=A07753401SAFNDDRC7H6Y&url=%2FTIED-RIBBONS-Designer-Office-Living%2Fdp%2FB07T7HC4WV%2Fref%3Dsr_1_58_sspa%3Fdchild%3D1%26keywords%3Dchair%26qid%3D1625239112%26sr%3D8-58-spons%26psc%3D1&qualifier=1625239112&id=8818592064495706&widgetName=sp_btf
India Armar Alloy Steel Folding Chair (Purple)  ,,Sponsored,,"₹3,499","₹1,599","Save ₹1,900 (54%)",4.6 out of 5 stars,12,https://www.amazon.in/gp/slredirect/picassoRedirect.html/ref=pa_sp_btf_aps_sr_pg1_1?ie=UTF8&adId=A0628886F990TCD3WM1P&url=%2FIndia-Armar-Alloy-Folding-Purple%2Fdp%2FB08Y2DWNG8%2Fref%3Dsr_1_59_sspa%3Fdchild%3D1%26keywords%3Dchair%26qid%3D1625239112%26sr%3D8-59-spons%26psc%3D1&qualifier=1625239112&id=8818592064495706&widgetName=sp_btf
"TIED RIBBONS Designer DSW Chair for Office, Home, Living Room, Office, Side Chair, Accent Chair (Blue, 81 cm X 40 cm)  ",,Sponsored,,"₹4,999","₹2,699","Save ₹2,300 (46%)",5.0 out of 5 stars,1,https://www.amazon.in/gp/slredirect/picassoRedirect.html/ref=pa_sp_btf_aps_sr_pg1_1?ie=UTF8&adId=A0776052U7L6S6IJE2&url=%2FTIED-RIBBONS-Designer-Office-Living%2Fdp%2FB08YYKHLYF%2Fref%3Dsr_1_60_sspa%3Fdchild%3D1%26keywords%3Dchair%26qid%3D1625239112%26sr%3D8-60-spons%26psc%3D1&qualifier=1625239112&id=8818592064495706&widgetName=sp_btf
"TIED RIBBONS Designer DSW Chair for Bed Room, café, Bed Room, Home, Living Room, Side Chair, Accent Chair (White, 81 cm X 40 cm)  ",,Sponsored,,"₹4,999","₹2,699","Save ₹2,300 (46%)",3.8 out of 5 stars,15,https://www.amazon.in/gp/slredirect/picassoRedirect.html/ref=pa_sp_atf_next_aps_sr_pg2_1?ie=UTF8&adId=A07760763CBIBJ6JP7KV6&url=%2FTIED-RIBBONS-Designer-Living-Accent%2Fdp%2FB07H7LVNMR%2Fref%3Dsr_1_49_sspa%3Fdchild%3D1%26keywords%3Dchair%26qid%3D1625239136%26sr%3D8-49-spons%26psc%3D1&qualifier=1625239136&id=5411803984445365&widgetName=sp_atf_next
"TIED RIBBONS Designer DSW Chair for Office, Bed Room,Cafe, Home, Living Room, Side Chair, Accent Chair (Black)  ",,Sponsored,,"₹7,999","₹4,199","Save ₹3,800 (48%)",3.7 out of 5 stars,5,https://www.amazon.in/gp/slredirect/picassoRedirect.html/ref=pa_sp_atf_next_aps_sr_pg2_1?ie=UTF8&adId=A0677013209RTT0WML005&url=%2FTIED-RIBBONS-Designer-Office-Living%2Fdp%2FB082HLW1W9%2Fref%3Dsr_1_50_sspa%3Fdchild%3D1%26keywords%3Dchair%26qid%3D1625239136%26sr%3D8-50-spons%26psc%3D1&qualifier=1625239136&id=5411803984445365&widgetName=sp_atf_next
Econiture Recycled Plastic Multipurpose Moveable Portable Folding Stool (Multicolor)  ,,Sponsored,,"₹13,000","₹9,700","Save ₹3,300 (25%)",,,https://www.amazon.in/gp/slredirect/picassoRedirect.html/ref=pa_sp_atf_next_aps_sr_pg2_1?ie=UTF8&adId=A02655033QY6Y7OXJ9Y9E&url=%2FEconiture-Recycled-Multipurpose-Moveable-Multicolor%2Fdp%2FB08L6DB7XS%2Fref%3Dsr_1_51_sspa%3Fdchild%3D1%26keywords%3Dchair%26qid%3D1625239136%26sr%3D8-51-spons%26psc%3D1&qualifier=1625239136&id=5411803984445365&widgetName=sp_atf_next
"TIED RIBBONS Designer DSW Accent Chair for Bed Room Office Café Home Living Room Side Chair (Yellow, 81 cm X 40 cm)  ",,Sponsored,,"₹4,999","₹2,699","Save ₹2,300 (46%)",3.7 out of 5 stars,8,https://www.amazon.in/gp/slredirect/picassoRedirect.html/ref=pa_sp_atf_next_aps_sr_pg2_1?ie=UTF8&adId=A0775952QKI3ZIWVZQHA&url=%2FTIED-RIBBONS-Designer-Office-Living%2Fdp%2FB07H7N667F%2Fref%3Dsr_1_52_sspa%3Fdchild%3D1%26keywords%3Dchair%26qid%3D1625239136%26sr%3D8-52-spons%26psc%3D1&qualifier=1625239136&id=5411803984445365&widgetName=sp_atf_next
Ikea Adde Plastic Chair (White)  ,,,,"₹16,480","₹1,250","Save ₹15,230 (92%)",4.0 out of 5 stars,74,https://www.amazon.in/Ikea-Chair-White-Indoor-Outdoor/dp/B017P6J6TM/ref=sr_1_53?dchild=1&keywords=chair&qid=1625239136&sr=8-53
ART AND CRAFT INDIA Wooden Small Chair for Kids Furnished and Fold Wood Chair Children Folding Chair Outdoor Small Chair Antique Fishing Chair Household Children's Chair- Brown  ,,,,₹999,₹505,Save ₹494 (49%),1.0 out of 5 stars,1,https://www.amazon.in/ART-CRAFT-INDIA-Furnished-Household/dp/B08S6W5NQF/ref=sr_1_54?dchild=1&keywords=chair&qid=1625239136&sr=8-54
"Ikea ADDE Polypropylene plastic Chair, Black  ",,,,"₹1,499","₹1,249",Save ₹250 (17%),3.9 out of 5 stars,6,https://www.amazon.in/Ikea-Polypropylene-plastic-Chair-Black/dp/B08SR3DVPS/ref=sr_1_55?dchild=1&keywords=chair&qid=1625239136&sr=8-55
"ANMOL Plastic Moulded Mistique Keya Ergonomic Chair with Comfort Rest Back and Arm Rest (Brown, Weight Bearing Capacity 150 kg) - Pack of 2  ",,,Only 1 left in stock.,"₹1,999","₹1,695",Save ₹304 (15%),4.2 out of 5 stars,24,https://www.amazon.in/Moulded-Mistique-Comfort-Bearing-Capacity/dp/B08MCBR3Y4/ref=sr_1_56?dchild=1&keywords=chair&qid=1625239136&sr=8-56
"AmazonBasics Zero Gravity Portable Textilene Fabric and Steel Reclining Lounge Chair, Blue  ",Amazon's Choice,,,"₹6,000","₹4,099","Save ₹1,901 (32%)",4.3 out of 5 stars,"2,437",https://www.amazon.in/AmazonBasics-Zero-Gravity-Chair-Blue/dp/B071NHHWCN/ref=ice_ac_b_dpb?dchild=1&keywords=chair&qid=1625239136&sr=8-57
Nilkamal EEZY PCH Mid Back Plastic Chair -Set of 2  ,,,Only 2 left in stock.,"₹2,999","₹1,895","Save ₹1,104 (37%)",3.4 out of 5 stars,14,https://www.amazon.in/Nemi-Agency-Plastic-EEZY-Chair/dp/B08R7L9761/ref=sr_1_58?dchild=1&keywords=chair&qid=1625239136&sr=8-58
"My Art Design - Faux Leather White Chair for Cafe, Office, Hotel, Home, Living Room, Dining Room, Bed Room, Side Chair, Accent Chair Modern & Designer Chair  ",,,,"₹7,999","₹3,899","Save ₹4,100 (51%)",,,https://www.amazon.in/My-Art-Design-Leather-Designer/dp/B097VH4H38/ref=sr_1_49?dchild=1&keywords=chair&qid=1625239136&sr=8-49
GTB BT-222 Folding Engineered Wood Chair with Foam (Black)  ,,,,"₹1,999","₹1,479",Save ₹520 (26%),4.4 out of 5 stars,14,https://www.amazon.in/GTB-BT-222-Folding-Engineered-Chair/dp/B08RB5K7H8/ref=sr_1_50?dchild=1&keywords=chair&qid=1625239136&sr=8-50
Streetup India Iyengar Iron Chair (Grey)  ,,,,"₹3,499","₹2,250","Save ₹1,249 (36%)",4.2 out of 5 stars,27,https://www.amazon.in/Streetup-India-Iyengar-Backless-Meditation/dp/B08DBJQP9Q/ref=sr_1_51?dchild=1&keywords=chair&qid=1625239136&sr=8-51
Lion Cotton Chair (Multicolour)  ,,,,"₹2,999","₹1,799","Save ₹1,200 (40%)",3.7 out of 5 stars,86,https://www.amazon.in/Lion-Industries-Furniture-Folding-Multicolour/dp/B08KGJYKHP/ref=sr_1_52?dchild=1&keywords=chair&qid=1625239136&sr=8-52
NILKAMAL EEEZY Chair in RDB Colour (Ratan Dark Beige) (1 Peice)  ,,,,,,,4.0 out of 5 stars,199,https://www.amazon.in/NILKAMAL-EEEZY-Chair-Colour-Ratan/dp/B07LCNWYHJ/ref=sr_1_53?dchild=1&keywords=chair&qid=1625239136&sr=8-53
Bharat Sales Corp. Plastic Arm Baby Chair for Home and Garden Single Chair  ,,,,₹999,₹549,Save ₹450 (45%),3.1 out of 5 stars,19,https://www.amazon.in/Bharat-Sales-Plastic-Garden-Single/dp/B08BL8G2J9/ref=sr_1_54?dchild=1&keywords=chair&qid=1625239136&sr=8-54
AVON FURNITURE 9955 Plastic Chair (W-Brown)  ,,,,"₹1,999","₹1,100",Save ₹899 (45%),3.8 out of 5 stars,145,https://www.amazon.in/AVON-Furniture-Plastic-Chair-W-Brown/dp/B079FSPQJM/ref=sr_1_55?dchild=1&keywords=chair&qid=1625239136&sr=8-55
Supreme Futura Chair (Color: Mehandi Green; Qnt: 02 pcs.)  ,,,Only 1 left in stock.,"₹5,999","₹1,899","Save ₹4,100 (68%)",,,https://www.amazon.in/Supreme-Futura-Chair-Color-Mehandi/dp/B097GXBBD6/ref=sr_1_56?dchild=1&keywords=chair&qid=1625239136&sr=8-56
Online Cane Seller Wooden Bamboo Cane Dining Chair ArmRest Chairs for Home | Office | Balcony | Garden | Livingroom | Indoor & Outdoor Chair for Adults | Medium Size.  ,,,,"₹3,999","₹2,199","Save ₹1,800 (45%)",,,https://www.amazon.in/Online-ArmRest-Balcony-Livingroom-Outdoor/dp/B097PVQ5KM/ref=sr_1_57?dchild=1&keywords=chair&qid=1625239136&sr=8-57
