name,badge_1,badge_2,badge_3,mrp,discounted_price,discount,rating,rating_count,link
"Neutrogena Oil Free Eye Makeup Remover, 162ml  ",,,,,,,4.5 out of 5 stars,"16,948",https://www.amazon.in/Neutrogena-Free-Makeup-Remover-162ml/dp/B000NWAOHE/ref=sr_1_56?dchild=1&keywords=makeup+removers&qid=1626846200&sr=8-56
"Tulips 50 Round Facial Cotton Pads in a Ziplock Bag (Pack of 3); Made from 100% Pure Soft Cotton, Best for Applying & Removing Makeup, safe for sensitive Skin  ",,,,₹240,₹179,Save ₹61 (25%),4.5 out of 5 stars,"1,886",https://www.amazon.in/Tulips-Cotton-Pads-50S-Pack/dp/B013PQ7OLI/ref=sr_1_57?dchild=1&keywords=makeup+removers&qid=1626846200&sr=8-57
"Dermafique Micellar Water Makeup Cleanser, Blue, 150ml  ",,,,₹399,₹283,Save ₹116 (29%),4.1 out of 5 stars,100,https://www.amazon.in/Dermafique-Micellar-Water-Makeup-Cleanser/dp/B07DF3MJFG/ref=sr_1_58?dchild=1&keywords=makeup+removers&qid=1626846200&sr=8-58
Fixderma Cleansing Milk 500 Ml Purifies & Nourishes The Skin By Deep Cleansing  ,,Sponsored,,,₹615,,4.7 out of 5 stars,4,https://www.amazon.in/gp/slredirect/picassoRedirect.html/ref=pa_sp_mtf_aps_sr_pg2_1?ie=UTF8&adId=A05728741KWL7KKLVUSZ9&url=%2FFixderma-Cleansing-Milk-Purifies-Nourishes%2Fdp%2FB089RKGSRY%2Fref%3Dsr_1_59_sspa%3Fdchild%3D1%26keywords%3Dmakeup%2Bremovers%26qid%3D1626846200%26sr%3D8-59-spons%26psc%3D1&qualifier=1626846200&id=6500651424053839&widgetName=sp_mtf
"Lotus Herbals Lemonpure Turmeric And Lemon Cleansing Milk, 170ml  ",Limited time deal,Sponsored,,₹375,₹270,Save ₹105 (28%),4.3 out of 5 stars,"1,243",https://www.amazon.in/gp/slredirect/picassoRedirect.html/ref=pa_sp_mtf_aps_sr_pg2_1?ie=UTF8&adId=A02458881Q0C3GB1SVYVC&url=%2FLotus-Herbals-Lemonpure-Turmeric-Cleansing%2Fdp%2FB006QKBHZ0%2Fref%3Dsr_1_60_sspa%3Fdchild%3D1%26keywords%3Dmakeup%2Bremovers%26qid%3D1626846200%26smid%3DAT95IG9ONZD7S%26sr%3D8-60-spons%26psc%3D1&qualifier=1626846200&id=6500651424053839&widgetName=sp_mtf
Inveda Anti Pigmentation Skin Care Kit  ,,Sponsored,,"₹1,345",₹795,Save ₹550 (41%),3.5 out of 5 stars,19,https://www.amazon.in/gp/slredirect/picassoRedirect.html/ref=pa_sp_mtf_aps_sr_pg2_1?ie=UTF8&adId=A08069811BMZZPIFHIP2&url=%2FINVEDA-Anti-Pigmentation-Skin-Care%2Fdp%2FB07WCFYKP7%2Fref%3Dsr_1_61_sspa%3Fdchild%3D1%26keywords%3Dmakeup%2Bremovers%26qid%3D1626846200%26sr%3D8-61-spons%26psc%3D1&qualifier=1626846200&id=6500651424053839&widgetName=sp_mtf
"Kosmoderma Cleanser, for Hydrating & Purifying Skin, Daily Gentle Acne Care, for All Skin Types, 100 ml  ",,Sponsored,,,₹400,,4.3 out of 5 stars,28,https://www.amazon.in/gp/slredirect/picassoRedirect.html/ref=pa_sp_mtf_aps_sr_pg2_1?ie=UTF8&adId=A01935833NBAFNCPP7UAK&url=%2FKosmoderma-Cleanser-Balance-Transparent-Extracts-Aqueous%2Fdp%2FB00YX7WGEE%2Fref%3Dsr_1_62_sspa%3Fdchild%3D1%26keywords%3Dmakeup%2Bremovers%26qid%3D1626846200%26sr%3D8-62-spons%26psc%3D1&qualifier=1626846200&id=6500651424053839&widgetName=sp_mtf
"Blue Heaven Makeup Remover Cleansing Wipes, Pack of 30  ",,,,₹150,₹140,Save ₹10 (7%),,,https://www.amazon.in/Blue-Heaven-Makeup-Remover-Cleansing/dp/B08L391XDF/ref=sr_1_63?dchild=1&keywords=makeup+removers&qid=1626846200&sr=8-63
"Disposable Compressed Portable Facial Sponge Stick, Facial Tissues, Wet Wipes For Makeup Remover Yellow, Pack of 1 (12 Sticks)  ",,,,,,,,,https://www.amazon.in/Disposable-Compressed-Portable-Tissues-Remover/dp/B09436MXM5/ref=sr_1_64?dchild=1&keywords=makeup+removers&qid=1626846200&sr=8-64
"Prima Donna Round Cotton Pads, Pack of 2 (200 Piece)  ",Best seller,,,₹198,₹175,Save ₹23 (12%),4.5 out of 5 stars,"8,950",https://www.amazon.in/gp/bestsellers/beauty/1374457031/ref=sr_bs_16_1374457031_1
L'Oreal Skin Perfection Micellar Gel Eye Make Up Remover (125 ml)  ,,,,₹995,₹740,Save ₹255 (26%),,,https://www.amazon.in/LOreal-Perfection-Micellar-Remover-125ml/dp/B071R3LJ3H/ref=sr_1_66?dchild=1&keywords=makeup+removers&qid=1626846200&sr=8-66
Bella Vita Organic Oil Infused Ayurvedic Micellar Water 225 ml Makeup Remover For Light & Heavy Waterproof Makeup Removal  ,,,,₹399,₹199,Save ₹200 (50%),3.9 out of 5 stars,147,https://www.amazon.in/Bella-Vita-Organic-Ayurvedic-Waterproof/dp/B0843F9MRD/ref=sr_1_67?dchild=1&keywords=makeup+removers&qid=1626846200&sr=8-67
Amazon Brand - Solimo Makeup Removal Wipes - 30 wipes/pack (Pack of 4)  ,,,,₹300,₹218,Save ₹82 (27%),4.1 out of 5 stars,81,https://www.amazon.in/Amazon-Brand-Solimo-Makeup-Removal/dp/B08CHY15PR/ref=sr_1_68?dchild=1&keywords=makeup+removers&qid=1626846200&sr=8-68
"Swiss Beauty Soft Clear Remover MakeUp + Cleanses and Soothes, Face MakeUp, Shade-01, 215ml  ",,,,₹299,₹269,Save ₹30 (10%),,,https://www.amazon.in/Swiss-beauty-Makeup-remover-SB-12/dp/B07SPLFBNS/ref=sr_1_69?dchild=1&keywords=makeup+removers&qid=1626846200&sr=8-69
Oriflame The 1 Waterproof Eye Make-Up Remover  ,,,,₹429,₹290,Save ₹139 (32%),4.3 out of 5 stars,7,https://www.amazon.in/ONE-Waterproof-Eye-Make-Up-Remover/dp/B01DC0BE1S/ref=sr_1_70?dchild=1&keywords=makeup+removers&qid=1626846200&sr=8-70
Good Vibes Orange Blossom Skin Brightening Makeup Cleansing Lotion - 120 ml - Skin Soothing and Hydrating - Paraben and Cruelty Free  ,,,,₹199,₹139,Save ₹60 (30%),4.3 out of 5 stars,12,https://www.amazon.in/Good-Vibes-Blossom-Brightening-Cleansing/dp/B084GQVNH5/ref=sr_1_71?dchild=1&keywords=makeup+removers&qid=1626846200&sr=8-71
"GINNI CLEA Wet Wipes, Cleansing & Makeup Remover Wipes, Wet Tissues for Face Moisturizing With Orange Freshness (60 Wipes)  ",,,,₹180,₹155,Save ₹25 (14%),,,https://www.amazon.in/GINNI-Cleansing-Remover-Moisturizing-Freshness/dp/B098TMVVMG/ref=sr_1_72?dchild=1&keywords=makeup+removers&qid=1626846200&sr=8-72
"HKM Tulips 50 Pieces Round Facial Remover pads/Makeup Remover Cotton Pads, Safe For Sensitive Skin (Pack of 3)  ",,,,₹360,₹179,Save ₹181 (50%),,,https://www.amazon.in/HKM-Tulips-Facial-Removing-sensitive/dp/B08LZML5KB/ref=sr_1_73?dchild=1&keywords=makeup+removers&qid=1626846200&sr=8-73
"THB Absorbent Pure Cotton Wool Roll For Makeup Remover | Surgical | First Aid | Saloon I Beuaty and Baby Care, Pure Cotton (THB-4X100GRAM)  ",,,,₹400,₹260,Save ₹140 (35%),4.5 out of 5 stars,5,https://www.amazon.in/Absorbent-Cotton-Remover-Surgical-THB-4X100GRAM/dp/B098PG7M57/ref=sr_1_74?dchild=1&keywords=makeup+removers&qid=1626846200&sr=8-74
"GINNI CLEA Wet Wipes, Cleansing & Makeup Remover Wipes, Wet Tissues for Face Moisturizing With Cucumber Freshness (60 Wipes)  ",,,,₹180,₹155,Save ₹25 (14%),,,https://www.amazon.in/GINNI-Cleansing-Moisturizing-Cucumber-Freshness/dp/B0957RQWQ8/ref=sr_1_75?dchild=1&keywords=makeup+removers&qid=1626846200&sr=8-75
"Lacto Calamine Daily Cleansing Face Wipes with Aloe Vera, Cucumber and Vitamin E (25 wipes) Pack of 2  ",,,,₹300,₹158,Save ₹142 (47%),4.4 out of 5 stars,"1,212",https://www.amazon.in/Lacto-Calamine-Cleansing-Cucumber-Vitamin/dp/B089R9SBPJ/ref=sr_1_76?dchild=1&keywords=makeup+removers&qid=1626846200&sr=8-76
"Lotus Herbals Makeup Remover, 50g  ",Limited time deal,,,₹375,₹300,Save ₹75 (20%),3.9 out of 5 stars,14,https://www.amazon.in/Lotus-Herbals-Makeup-Remover-50g/dp/B01CP9JIPG/ref=sr_1_77?dchild=1&keywords=makeup+removers&qid=1626846200&smid=AT95IG9ONZD7S&sr=8-77
"Milagro Beauty Reusable Multi-functional Makeup Remover Pad Pro, Single Unit  ",,,,,₹750,,4.6 out of 5 stars,10,https://www.amazon.in/Milagro-Beauty-Reusable-Multi-functional-Remover/dp/B08X7DM689/ref=sr_1_78?dchild=1&keywords=makeup+removers&qid=1626846200&sr=8-78
