name,badge_1,badge_2,badge_3,mrp,discounted_price,discount,rating,rating_count,link
"Simple Kind To Skin Micellar Cleansing Water Micellar Water For Sensitive Skin No Added Perfume, No Harsh Chemicals, No Artificial Color, No Alcohol And Parabens, 200 ml  ",Deal of the Day ,Sponsored,,₹375,₹318.75,Save ₹56.25 (15%),4.4 out of 5 stars,526,https://www.amazon.in/gp/slredirect/picassoRedirect.html/ref=pa_sp_atf_aps_sr_pg1_1?ie=UTF8&adId=A04541993KAGVJW86KQ89&url=%2FSimple-Micellar-Cleansing-Water-200Ml%2Fdp%2FB00X3OQ6N0%2Fref%3Dsr_1_1_sspa%3Fdchild%3D1%26keywords%3Dmakeup%2Bremovers%26qid%3D1626846178%26sr%3D8-1-spons%26psc%3D1&qualifier=1626846178&id=6300318730677534&widgetName=sp_atf
"Garnier Skin Naturals, Micellar Cleansing Water, 125ml  ",Amazon's Choice,Sponsored,,₹175,₹139,Save ₹36 (21%),4.4 out of 5 stars,"11,223",https://www.amazon.in/gp/slredirect/picassoRedirect.html/ref=pa_sp_atf_aps_sr_pg1_1?ie=UTF8&adId=A07676903CL7SG2XA9V56&url=%2FGarnier-Naturals-Micellar-Cleansing-Water%2Fdp%2FB06ZZ5XVR7%2Fref%3Dice_ac_b_dpb_sspa%3Fdchild%3D1%26keywords%3Dmakeup%2Bremovers%26qid%3D1626846178%26sr%3D8-2-spons%26psc%3D1&qualifier=1626846178&id=6300318730677534&widgetName=sp_atf
"Garnier Skin Naturals, Micellar Oil-Infused Cleansing Water, 400ml  ",Best seller,Sponsored,,₹399,₹259,Save ₹140 (35%),4.5 out of 5 stars,"4,596",https://www.amazon.in/gp/bestsellers/beauty/1374387031/ref=sr_bs_2_1374387031_1
"Coccoon Silk Appeal Cleansing Rich Oil For Makeup Removal, Cleansing Clogged Pores, Clearing Makeup Residue, Brightens & Replenishes Your Skin, 100Ml  ",,Sponsored,,₹950,₹617,Save ₹333 (35%),4.2 out of 5 stars,51,https://www.amazon.in/gp/slredirect/picassoRedirect.html/ref=pa_sp_atf_aps_sr_pg1_1?ie=UTF8&adId=A00372633V89RL0SJMWBQ&url=%2FCoccoon-Appeal-Cleansing-Phytosqualane-Macadamia%2Fdp%2FB0822R3WMW%2Fref%3Dsr_1_4_sspa%3Fdchild%3D1%26keywords%3Dmakeup%2Bremovers%26qid%3D1626846178%26sr%3D8-4-spons%26psc%3D1&qualifier=1626846178&id=6300318730677534&widgetName=sp_atf
"Garnier Skin Naturals, Micellar Cleansing Water, 125ml  ",Amazon's Choice,,,₹175,₹139,Save ₹36 (21%),4.4 out of 5 stars,"11,223",https://www.amazon.in/Garnier-Naturals-Micellar-Cleansing-Water/dp/B06ZZ5XVR7/ref=ice_ac_b_dpb?dchild=1&keywords=makeup+removers&qid=1626846178&sr=8-5
"Garnier Skin Naturals, Micellar Oil-Infused Cleansing Water, 125ml  ",Best seller,,,₹225,₹146,Save ₹79 (35%),4.5 out of 5 stars,"4,596",https://www.amazon.in/gp/bestsellers/beauty/1374387031/ref=sr_bs_5_1374387031_1
"Blue Heaven Bi-Phase Makeup Remover + Micellar Cleansing Water, Clear, 125 ml  ",,,,₹150,₹97,Save ₹53 (35%),4.3 out of 5 stars,629,https://www.amazon.in/Blue-Heaven-Bi-Phase-Micellar-Cleansing/dp/B07Z6MHXBJ/ref=sr_1_7?dchild=1&keywords=makeup+removers&qid=1626846178&sr=8-7
Colorbar Cosmetics On The Go Makeup Remover Wipes (10 Pieces)  ,,,,₹95,₹90,Save ₹5 (5%),4.1 out of 5 stars,211,https://www.amazon.in/Colorbar-Cosmetics-Makeup-Remover-Pieces/dp/B07P22K1XL/ref=sr_1_8?dchild=1&keywords=makeup+removers&qid=1626846178&sr=8-8
Blue Heaven Makeup Remover Cleansing Wipes (30 Count)  ,,,,₹150,₹97,Save ₹53 (35%),4.3 out of 5 stars,560,https://www.amazon.in/Blue-Heaven-Makeup-Remover-Cleansing/dp/B0757P7P72/ref=sr_1_9?dchild=1&keywords=makeup+removers&qid=1626846178&sr=8-9
"L'Oreal Paris Dermo Expertise Lip and Eye Make-Up Remover, 125ml  ",,,,,₹390,,4.3 out of 5 stars,472,https://www.amazon.in/LOreal-Paris-Expertise-Make-Up-Remover/dp/B0068ZXZA8/ref=sr_1_10?dchild=1&keywords=makeup+removers&qid=1626846178&sr=8-10
"Lakmé 9To5 Naturale Gel Makeup Remover, 50 g  ",,,Only 1 left in stock.,,₹175,,4.4 out of 5 stars,261,https://www.amazon.in/Lakme-9To5-Naturale-Makeup-Remover/dp/B07YVHVL4V/ref=sr_1_11?dchild=1&keywords=makeup+removers&qid=1626846178&sr=8-11
"Lakmé Absolute Bi Phased Makeup Remover, 60ml  ",,,,₹300,₹228,Save ₹72 (24%),4.2 out of 5 stars,923,https://www.amazon.in/Lakme-Absolute-Phased-Makeup-Remover/dp/B00CWAI2SS/ref=sr_1_12?dchild=1&keywords=makeup+removers&qid=1626846178&sr=8-12
Sanas 2 Piece Reusable Makeup Removal Pads 2pc Microfiber Sponge Pads For Deep Cleansing Facial Make up Remover Wipes For Mascara Eye Shadow Exfoliating Facial Sponge – 2 Piece  ,,,,₹500,₹285,Save ₹215 (43%),3.9 out of 5 stars,35,https://www.amazon.in/Sanas-Makeup-Pads-Microfiber-Remover/dp/B08QVYCXJV/ref=sr_1_13?dchild=1&keywords=makeup+removers&qid=1626846178&sr=8-13
"Biotique Bio Almond Oil Soothing Face and Eye Makeup Cleanser, 120ml  ",,,,₹175,₹130,Save ₹45 (26%),4.1 out of 5 stars,520,https://www.amazon.in/Biotique-Almond-Soothing-Makeup-Cleanser/dp/B000VL1Z0M/ref=sr_1_14?dchild=1&keywords=makeup+removers&qid=1626846178&sr=8-14
MINISO Thick & Normal Combo Cotton Pads 75PCS+400PCS Makeup Remover Cosmetic  ,,,,₹150,₹140,Save ₹10 (7%),4.3 out of 5 stars,222,https://www.amazon.in/MINISO-Normal-Cotton-Remover-Cosmetic/dp/B07C7RCT8L/ref=sr_1_15?dchild=1&keywords=makeup+removers&qid=1626846178&sr=8-15
REHTRAD Pack of 2 Reusable Makeup Remover Cotton pads，Cotton Pads for Face Cleansing Removes Heavy Eyeshadow and Makeup，Double Sided Makeup Remover pads（Black and White）  ,,,,₹999,₹289,Save ₹710 (71%),4.4 out of 5 stars,46,https://www.amazon.in/REHTRAD-pads%EF%BC%8CCotton-Cleansing-Makeup%EF%BC%8CDouble-pads%EF%BC%88Black/dp/B08ZRW2PC6/ref=sr_1_16?dchild=1&keywords=makeup+removers&qid=1626846178&sr=8-16
"Colorbar Remover Wipes, 30 Wipes (150mmx200mm)  ",,,,₹250,₹225,Save ₹25 (10%),4.4 out of 5 stars,160,https://www.amazon.in/Colorbar-Remover-Wipes-30-150mmx200mm/dp/B0783PPLWY/ref=sr_1_17?dchild=1&keywords=makeup+removers&qid=1626846178&sr=8-17
Earth Rhythm Reusable Multi-functional Makeup Removal Facial Cleansing Pads (Pack of 2)  ,Deal of the Day ,,,₹350,₹286.65,Save ₹63.35 (18%),4.1 out of 5 stars,109,https://www.amazon.in/Earth-Rhythm-Reusable-Multi-functional-Cleansing/dp/B08W1ZZX83/ref=sr_1_18?dchild=1&keywords=makeup+removers&qid=1626846178&sr=8-18
3pcs Makeup Remover Cloth Towels Facial Puffs Washable Face Cleansing Plush Makeup Remover Pads (White + Coffee + Black)  ,,,,"₹1,402.82",₹402.82,"Save ₹1,000 (71%)",,,https://www.amazon.in/Makeup-Remover-Towels-Washable-Cleansing/dp/B07SKSV1L4/ref=sr_1_19?dchild=1&keywords=makeup+removers&qid=1626846178&sr=8-19
Microfiber Facial Cleansing Makeup Remover Wash Cloth Towels(Color May Vary)  ,,,,₹599,₹274,Save ₹325 (54%),3.4 out of 5 stars,42,https://www.amazon.in/Ear-Lobe-Accessories-Cleansing-Remover/dp/B07MGBTPYB/ref=sr_1_20?dchild=1&keywords=makeup+removers&qid=1626846178&sr=8-20
"LAKMÉ Gentle & Soft Deep Pore Cleanser For Soft And Glowing Skin, 120ml  ",,Sponsored,,₹249,₹186.75,Save ₹62.25 (25%),4.2 out of 5 stars,"1,870",https://www.amazon.in/gp/slredirect/picassoRedirect.html/ref=pa_sp_mtf_aps_sr_pg1_1?ie=UTF8&adId=A054984618VLCU0SP4337&url=%2FLakme-Gentle-Soft-Deep-Cleanser%2Fdp%2FB00G96JORE%2Fref%3Dsr_1_21_sspa%3Fdchild%3D1%26keywords%3Dmakeup%2Bremovers%26qid%3D1626846178%26sr%3D8-21-spons%26psc%3D1&qualifier=1626846178&id=6300318730677534&widgetName=sp_mtf
"Bioderma Sensibio H2O Daily Soothing Cleanser, Make up Pollution & Impurities Remover Face Eyes Sensitive skin, 500ml  ",,Sponsored,,,"₹1,695",,4.7 out of 5 stars,"15,162",https://www.amazon.in/gp/slredirect/picassoRedirect.html/ref=pa_sp_mtf_aps_sr_pg1_1?ie=UTF8&adId=A00411893Q27O2CSUMTNH&url=%2FBioderma-Sensibio-Crealine-Solution-Sensitive%2Fdp%2FB002XZLAWM%2Fref%3Dsr_1_22_sspa%3Fdchild%3D1%26keywords%3Dmakeup%2Bremovers%26qid%3D1626846178%26sr%3D8-22-spons%26psc%3D1&qualifier=1626846178&id=6300318730677534&widgetName=sp_mtf
"Neutrogena Deep Clean Foaming Cleanser For Normal To Oily Skin, 100g  ",,Sponsored,,,₹219,,4.3 out of 5 stars,"3,705",https://www.amazon.in/gp/slredirect/picassoRedirect.html/ref=pa_sp_mtf_aps_sr_pg1_1?ie=UTF8&adId=A05204912V0R6E1B1L5FV&url=%2FNeutrogena-Deep-Clean-Foaming-Cleanser%2Fdp%2FB006LXDPOI%2Fref%3Dsr_1_23_sspa%3Fdchild%3D1%26keywords%3Dmakeup%2Bremovers%26qid%3D1626846178%26sr%3D8-23-spons%26psc%3D1&qualifier=1626846178&id=6300318730677534&widgetName=sp_mtf
"Neutrogena Deep Clean Facial Cleanser For Normal To Oily Skin, 200ml  ",,Sponsored,,₹399,₹396,Save ₹3 (1%),4.3 out of 5 stars,"4,408",https://www.amazon.in/gp/slredirect/picassoRedirect.html/ref=pa_sp_mtf_aps_sr_pg1_1?ie=UTF8&adId=A08586501G06K1L02H9YG&url=%2FNeutrogena-Clean-Facial-Cleanser-200ml%2Fdp%2FB006LXDQRY%2Fref%3Dsr_1_24_sspa%3Fdchild%3D1%26keywords%3Dmakeup%2Bremovers%26qid%3D1626846178%26sr%3D8-24-spons%26psc%3D1&qualifier=1626846178&id=6300318730677534&widgetName=sp_mtf
Soapworks Reusable Multi-functional Makeup Removal Facial Cleansing Pads (Pack of 2)  ,,,,₹350,₹315,Save ₹35 (10%),4.3 out of 5 stars,289,https://www.amazon.in/Soapworks-Reusable-Multi-functional-Removal-Cleansing/dp/B08941LC7K/ref=sr_1_25?dchild=1&keywords=makeup+removers&qid=1626846178&sr=8-25
"Lakmé Nail Color Remover, 27ml  ",,,,₹90,₹85.50,Save ₹4.50 (5%),4.4 out of 5 stars,"6,245",https://www.amazon.in/Lakme-Nail-Color-Remover-27ml/dp/B006LXBF0E/ref=sr_1_26?dchild=1&keywords=makeup+removers&qid=1626846178&sr=8-26
"Colorbar Nail Polish Remover, 110ml  ",Best seller,,,₹125,₹100,Save ₹25 (20%),4.5 out of 5 stars,"12,238",https://www.amazon.in/gp/bestsellers/beauty/1374401031/ref=sr_bs_26_1374401031_1
GUBB Non-Woven Cotton Pads For Face Cleansing Makeup Remover Wipes For Women & Men  ,,,,₹159,₹155,Save ₹4 (3%),4.3 out of 5 stars,174,https://www.amazon.in/GUBB-Non-Woven-Cotton-Cleansing-Removal/dp/B07MZ4YSV4/ref=sr_1_28?dchild=1&keywords=makeup+removers&qid=1626846178&sr=8-28
MINISO Makeup Remover Pads (White)  ,,,,₹200,₹180,Save ₹20 (10%),4.1 out of 5 stars,"1,507",https://www.amazon.in/MINISO-Makeup-Remover-Cotton-Cleansing/dp/B084KY9LVY/ref=sr_1_29?dchild=1&keywords=makeup+removers&qid=1626846178&sr=8-29
VBA Reusable Makeup Remover Cotton pads，Cotton Pads for Face Cleansing Removes Heavy Eyeshadow and Makeup Double Sided Clean Sponge  ,,,,₹499,₹190,Save ₹309 (62%),5.0 out of 5 stars,1,https://www.amazon.in/VBA-Reusable-pads%EF%BC%8CCotton-Cleansing-Eyeshadow/dp/B098N9GGR2/ref=sr_1_30?dchild=1&keywords=makeup+removers&qid=1626846178&sr=8-30
"Neutrogena Makeup Remover Towelettes 25 Wipes, White, 205 g  ",Best seller,,,₹450,₹325,Save ₹125 (28%),4.6 out of 5 stars,90,https://www.amazon.in/gp/bestsellers/beauty/26292590031/ref=sr_bs_30_26292590031_1
"Bioderma Sensibio H2O Daily Soothing Cleanser, Make up Pollution & Impurities Remover Face Eyes Sensitive skin, 100ml  ",,,,,₹395,,4.6 out of 5 stars,"1,693",https://www.amazon.in/Bioderma-B006RBR7NO-Sensibio-H2O-100ml/dp/B006RBR7NO/ref=sr_1_32?dchild=1&keywords=makeup+removers&qid=1626846178&sr=8-32
RIXTEC Face Cleaning Makeup Remover sponge Facial Sponges Soft Pad Puff for Women and Girls (Multi-color) (pack of 2)  ,,,,₹499,₹158,Save ₹341 (68%),4.9 out of 5 stars,10,https://www.amazon.in/RIXTEC-Cleaning-Remover-Sponges-Multi-color/dp/B08XXVW8MG/ref=sr_1_33?dchild=1&keywords=makeup+removers&qid=1626846178&sr=8-33
"Revlon Eye and Lip Make Up Remover, 60ml  ",,,Only 2 left in stock.,₹350,₹340,Save ₹10 (3%),3.9 out of 5 stars,69,https://www.amazon.in/Revlon-Eye-Make-Remover-60ml/dp/B006LXDI2C/ref=sr_1_34?dchild=1&keywords=makeup+removers&qid=1626846178&sr=8-34
Colorbar Xpert Micellar Bi Phase Makeup Remover-Combo (Pack of 2)  ,,,,₹399,₹391,Save ₹8 (2%),4.0 out of 5 stars,26,https://www.amazon.in/Colorbar-Xpert-Micellar-Makeup-Remover-Combo/dp/B08555C5SG/ref=sr_1_35?dchild=1&keywords=makeup+removers&qid=1626846178&sr=8-35
FACES Hydro Makeup Remover (100ml)  ,,,,₹479,₹359,Save ₹120 (25%),4.4 out of 5 stars,53,https://www.amazon.in/FACES-Hydro-Makeup-Remover-100ml/dp/B00SUNL89G/ref=sr_1_36?dchild=1&keywords=makeup+removers&qid=1626846178&sr=8-36
Yoana Makeup Remover Cotton Pads Facial Cleansing Wipes 500 Thin 60 Thick Tissues (560 Tissues)  ,,,,₹599,₹259,Save ₹340 (57%),,,https://www.amazon.in/Yoana-Makeup-Remover-Cleansing-Tissues/dp/B094NRN9XH/ref=sr_1_37?dchild=1&keywords=makeup+removers&qid=1626846178&sr=8-37
"Colorbar Cosmetics Xpert Micellar Bi Phase Makeup Remover, 150 ml  ",,,,₹399,₹310,Save ₹89 (22%),4.4 out of 5 stars,12,https://www.amazon.in/Colorbar-Cosmetics-Micellar-Makeup-Remover/dp/B07LCC1T46/ref=sr_1_38?dchild=1&keywords=makeup+removers&qid=1626846178&sr=8-38
"Kaya Clinic Hydra Cleanse Makeup Remover, Removes Waterproof makeup, Alcohol-free, Non-sticky & Moisturizing 100ml  ",,,,₹280,₹196,Save ₹84 (30%),4.1 out of 5 stars,59,https://www.amazon.in/Kaya-Skin-Clinic-Cleanse-Remover/dp/B01FK7RI6Q/ref=sr_1_39?dchild=1&keywords=makeup+removers&qid=1626846178&sr=8-39
FACES Fresh Clean Glow Makeup Remover Wipes (30 Count)  ,,,,₹299,₹239,Save ₹60 (20%),4.4 out of 5 stars,103,https://www.amazon.in/FACES-Fresh-Clean-Makeup-Remover/dp/B076Q4F2FF/ref=sr_1_40?dchild=1&keywords=makeup+removers&qid=1626846178&sr=8-40
akiiko Reusable Makeup Remover Pads/Facial Cleansing Pads (Pack of 6)  ,,,,₹399,₹299,Save ₹100 (25%),4.1 out of 5 stars,26,https://www.amazon.in/akiiko-Reusable-Makeup-Remover-Cleansing/dp/B08TTNZZBL/ref=sr_1_41?dchild=1&keywords=makeup+removers&qid=1626846178&sr=8-41
RIXTEC Facial Wash Pad Makeup Remover Cleaning Sponge Puff Exfoliator Scrub: 4 Pieces  ,,,,₹499,₹188,Save ₹311 (62%),,,https://www.amazon.in/RIXTEC-Facial-Remover-Cleaning-Exfoliator/dp/B08XXVV6T7/ref=sr_1_42?dchild=1&keywords=makeup+removers&qid=1626846178&sr=8-42
Mamaearth Micellar water foaming makeup remover with rose water and glycolic acid for daily face wash and make up cleansing - 150ml  ,Limited time deal,,,₹399,₹358,Save ₹41 (10%),4.3 out of 5 stars,703,https://www.amazon.in/Mamaearth-Micellar-foaming-glycolic-cleansing/dp/B08G1X5HV8/ref=sr_1_43?dchild=1&keywords=makeup+removers&qid=1626846178&smid=A61C6NUFGVGS7&sr=8-43
"Simple Kind To Skin Micellar Cleansing Water Micellar Water For Sensitive Skin No Added Perfume, No Harsh Chemicals, No Artificial Color, No Alcohol And Parabens, 200 ml  ",Deal of the Day ,,,₹375,₹318.75,Save ₹56.25 (15%),4.4 out of 5 stars,526,https://www.amazon.in/Simple-Micellar-Cleansing-Water-200Ml/dp/B00X3OQ6N0/ref=sr_1_44?dchild=1&keywords=makeup+removers&qid=1626846178&sr=8-44
Push Down Empty Lockable Pump Dispenser Bottle for Nail Polish and Makeup Remover-Nail Polish Dispenser-Nail polish Remover Pump  ,,,,₹499,₹180,Save ₹319 (64%),5.0 out of 5 stars,2,https://www.amazon.in/Lockable-Dispenser-Remover-Nail-Dispenser-Nail-Remover/dp/B096RP79FK/ref=sr_1_45?dchild=1&keywords=makeup+removers&qid=1626846178&sr=8-45
"GINNI CLEA Cleansing & Makeup Remover Wipes Wet Wipes for Face Moisturizing - (all variants) (Pack of 7, 70 wipes)  ",,,,₹210,₹209,Save ₹1,4.2 out of 5 stars,27,https://www.amazon.in/GINNI-Cleansing-Makeup-Remover-Moisturizing/dp/B08CVBRPY4/ref=sr_1_46?dchild=1&keywords=makeup+removers&qid=1626846178&sr=8-46
Maybelline Makeup Remover  ,,,,₹230,₹220,Save ₹10 (4%),4.1 out of 5 stars,22,https://www.amazon.in/Maybelline-G0508604-Makeup-Remover/dp/B0079Z72I2/ref=sr_1_47?dchild=1&keywords=makeup+removers&qid=1626846178&sr=8-47
"Swiss Beauty MakeUp Remover, Shade-01, Face MakeUp, 50ml  ",,,,,₹169,,4.6 out of 5 stars,7,https://www.amazon.in/Swiss-Beauty-Makeup-Remover-50/dp/B07SPLDQJB/ref=sr_1_48?dchild=1&keywords=makeup+removers&qid=1626846178&sr=8-48
VINAURA (1pc) Clean Make Up Remover Towel / Sponge / Cloth / Pad / Wipes (Reusable) Chemical Free 100% Skin Friendly | Sweat Absorbent Microfiber Make up Cleansing Cloth Sponge | Reusable upto 1000 times | Remove make up instantly with just water | Make-up Removal Pad Wipe  ,,,,₹500,₹449,Save ₹51 (10%),4.7 out of 5 stars,5,https://www.amazon.in/VINAURA-Absorbent-Microfiber-Cleansing-instantly/dp/B08W5CJHNQ/ref=sr_1_49?dchild=1&keywords=makeup+removers&qid=1626846178&sr=8-49
MAYCREATE® Makeup Remover Pads 4PCS Set Reusable Rounds Soft Facial Cleaning Puffs Towels Double-Side Washable Make Up Removing Cloth Microfiber Multi-function (4Pcs Cleansing Puff Set) (Multi)  ,,,,₹794,₹399,Save ₹395 (50%),3.0 out of 5 stars,1,https://www.amazon.in/MAYCREATE%C2%AE-Double-Side-Microfiber-Multi-function-Cleansing/dp/B094XMK4BZ/ref=sr_1_50?dchild=1&keywords=makeup+removers&qid=1626846178&sr=8-50
Aaranyaa Makeup Remover Non Alcoholic - 100 ml  ,,,,₹325,₹260,Save ₹65 (20%),4.7 out of 5 stars,23,https://www.amazon.in/Aaranyaa-Alcohol-Remover-Powerful-antioxidant/dp/B07GQRW83W/ref=sr_1_51?dchild=1&keywords=makeup+removers&qid=1626846178&sr=8-51
ayushicreationa Facial Cleansing Sponges Round Makeup Face Wash Sponge Stick Reusable Facial Remover Pads Beauty Tools for Women Multicolor (12 PCS)  ,,,,₹599,₹199,Save ₹400 (67%),4.3 out of 5 stars,3,https://www.amazon.in/ayushicreationa-Cleansing-Sponges-Reusable-Multicolor/dp/B08SLZNH92/ref=sr_1_52?dchild=1&keywords=makeup+removers&qid=1626846178&sr=8-52
COLORESSENCE Makeup Melt Remover Oil Free Face & Eye Cleanser Formula - 200 ml  ,,,,₹250,₹229,Save ₹21 (8%),,,https://www.amazon.in/COLORESSENCE-Makeup-Remover-Cleanser-Formula/dp/B093FWTZP5/ref=sr_1_53?dchild=1&keywords=makeup+removers&qid=1626846178&sr=8-53
"L'Oreal Paris Women's Dermo-Expertise Gentle Lip and Eye Make-up Remover 125 ml with Extra Ayur Sunscreen, 50 ml  ",,,,,,,4.5 out of 5 stars,26,https://www.amazon.in/LOreal-Dermo-Expertise-Make-up-Remover-Sunscreen/dp/B01GCSBUFC/ref=sr_1_54?dchild=1&keywords=makeup+removers&qid=1626846178&sr=8-54
Rufiys Eyebrow Razor Facial Hair Remover Eyebrow Trimmer Sharp Mini Makeup Shaper Shaver For Women and Men (Pack of 3 Pcs)  ,,,,₹599,₹99,Save ₹500 (83%),,,https://www.amazon.in/Rufiys-Eyebrow-Facial-Remover-Trimmer/dp/B091NTJJ6G/ref=sr_1_55?dchild=1&keywords=makeup+removers&qid=1626846178&sr=8-55
"HipHop Instant MakeUp Remover Wipes - Micellar Water, 30 wipes (Pack of 2)  ",,,,₹260,₹224,Save ₹36 (14%),3.6 out of 5 stars,19,https://www.amazon.in/HipHop-Instant-Remover-Wipes-wipes/dp/B07BZLNBYJ/ref=sr_1_56?dchild=1&keywords=makeup+removers&qid=1626846178&sr=8-56
"StBotanica Vitamin C Micellar Cleansing Water With Mineral Extracts, 150 ml (STBOT675)  ",,Sponsored,,,₹339,,4.3 out of 5 stars,66,https://www.amazon.in/gp/slredirect/picassoRedirect.html/ref=pa_sp_btf_aps_sr_pg1_1?ie=UTF8&adId=A05213832OPBYU3F9RCEY&url=%2FStBotanica-Vitamin-Micellar-Cleansing-Extracts%2Fdp%2FB082X5MRFT%2Fref%3Dsr_1_57_sspa%3Fdchild%3D1%26keywords%3Dmakeup%2Bremovers%26qid%3D1626846178%26sr%3D8-57-spons%26psc%3D1&qualifier=1626846178&id=6300318730677534&widgetName=sp_btf
"Bioderma Sebium Gel Moussant Purifying Cleansing Foaming Gel Combination To Oily Skin, 200ml  ",,Sponsored,,,"₹1,575",,4.4 out of 5 stars,"1,984",https://www.amazon.in/gp/slredirect/picassoRedirect.html/ref=pa_sp_btf_aps_sr_pg1_1?ie=UTF8&adId=A06387393RTDNXOWGVV4A&url=%2FBioderma-Sebium-Purifying-Cleansing-Foaming%2Fdp%2FB000TUNMW4%2Fref%3Dsr_1_58_sspa%3Fdchild%3D1%26keywords%3Dmakeup%2Bremovers%26qid%3D1626846178%26sr%3D8-58-spons%26psc%3D1&qualifier=1626846178&id=6300318730677534&widgetName=sp_btf
"Bioderma Sebium Gel Moussant Purifying Cleansing Foaming Gel Combination To Oily Skin, 100ml  ",,Sponsored,,,₹840,,4.3 out of 5 stars,130,https://www.amazon.in/gp/slredirect/picassoRedirect.html/ref=pa_sp_btf_aps_sr_pg1_1?ie=UTF8&adId=A06388635IH467LONW4B&url=%2FBioderma-Sebium-Gel-Moussant-100ml%2Fdp%2FB06XJ15M82%2Fref%3Dsr_1_59_sspa%3Fdchild%3D1%26keywords%3Dmakeup%2Bremovers%26qid%3D1626846178%26sr%3D8-59-spons%26psc%3D1&qualifier=1626846178&id=6300318730677534&widgetName=sp_btf
Palmer's Coconut Monoï Facial Cleansing Balm  ,,Sponsored,,₹740,₹489,Save ₹251 (34%),4.4 out of 5 stars,682,https://www.amazon.in/gp/slredirect/picassoRedirect.html/ref=pa_sp_btf_aps_sr_pg1_1?ie=UTF8&adId=A02708743QP5EZ6MBUORY&url=%2FPalmer-Coconut-Formula-Cleansing-Balm%2Fdp%2FB07953SZND%2Fref%3Dsr_1_60_sspa%3Fdchild%3D1%26keywords%3Dmakeup%2Bremovers%26qid%3D1626846178%26sr%3D8-60-spons%26psc%3D1%26smid%3DAG3I8C4CSTRKE&qualifier=1626846178&id=6300318730677534&widgetName=sp_btf
"Garnier Skin Naturals, Micellar Oil-Infused Cleansing Water, 125ml  ",Best seller,Sponsored,,₹225,₹146,Save ₹79 (35%),4.5 out of 5 stars,"4,596",https://www.amazon.in/gp/bestsellers/beauty/1374387031/ref=sr_bs_0_1374387031_1
The Tribe Concepts Face Brightening Daily Cleanser  ,,Sponsored,,,₹549,,4.1 out of 5 stars,407,https://www.amazon.in/gp/slredirect/picassoRedirect.html/ref=pa_sp_atf_next_aps_sr_pg2_1?ie=UTF8&adId=A043956336L2UCLJ1BH22&url=%2FTribe-Concepts-Brightening-Daily-Cleanser%2Fdp%2FB08CKD5PB7%2Fref%3Dsr_1_50_sspa%3Fdchild%3D1%26keywords%3Dmakeup%2Bremovers%26qid%3D1626846200%26sr%3D8-50-spons%26psc%3D1&qualifier=1626846200&id=6500651424053839&widgetName=sp_atf_next
"Dot & Key Deep Pore Clean Milky Foam Cleanser, 120 ml, face wash for clean, milky bright skin  ",,Sponsored,,,₹395,,,,https://www.amazon.in/gp/slredirect/picassoRedirect.html/ref=pa_sp_atf_next_aps_sr_pg2_1?ie=UTF8&adId=A0635329VQ7B801Y8JE5&url=%2FDot-Key-Clean-Cleanser-bright%2Fdp%2FB097HD6ZPR%2Fref%3Dsr_1_51_sspa%3Fdchild%3D1%26keywords%3Dmakeup%2Bremovers%26qid%3D1626846200%26sr%3D8-51-spons%26psc%3D1&qualifier=1626846200&id=6500651424053839&widgetName=sp_atf_next
"Forest Essentials Delicate Facial Cleanser, Saffron and Neem, 50ml  ",,Sponsored,,,₹350,,4.3 out of 5 stars,"1,038",https://www.amazon.in/gp/slredirect/picassoRedirect.html/ref=pa_sp_atf_next_aps_sr_pg2_1?ie=UTF8&adId=A10234091LO3TSIJN454&url=%2FForest-Essentials-Delicate-Cleanser-Saffron%2Fdp%2FB009VELS34%2Fref%3Dsr_1_52_sspa%3Fdchild%3D1%26keywords%3Dmakeup%2Bremovers%26qid%3D1626846200%26sr%3D8-52-spons%26psc%3D1&qualifier=1626846200&id=6500651424053839&widgetName=sp_atf_next
Rebelle (Pack of 3) Bamboo Charcoal Cotton Reusable Makeup Remover | Facial Cleansing Remover Pads  ,Deal of the Day ,,,₹330,₹264,Save ₹66 (20%),,,https://www.amazon.in/Rebelle-Charcoal-Reusable-Remover-Cleansing/dp/B096K9GXHW/ref=sr_1_53?dchild=1&keywords=makeup+removers&qid=1626846200&sr=8-53
"Sweetpea® Cotton Pads For Face Cleansing, Makeup Remover Cotton Pads Embossed - 100 Pieces  ",,,,₹299,₹199,Save ₹100 (33%),5.0 out of 5 stars,1,https://www.amazon.in/Sweetpea%C2%AE-Cotton-Cleansing-Remover-Embossed/dp/B08ZNDP6XN/ref=sr_1_54?dchild=1&keywords=makeup+removers&qid=1626846200&sr=8-54
"GINNI CLEA Cleansing & Make-up Remover Wipes (Rose,Lemon,Aloevera,Antiacne,Cucumber,Orange) (pack of 6) (10 wipes per pack)  ",,,,₹180,₹155,Save ₹25 (14%),4.3 out of 5 stars,134,https://www.amazon.in/GINNI-Cleansing-Aloevera-Antiacne-Cucumber/dp/B01CI9CDH8/ref=sr_1_55?dchild=1&keywords=makeup+removers&qid=1626846200&sr=8-55
"VEGA Cotton Ball for Eye, Face Makeup and Nail Paint Remover (Pack Of 50)  ",,,,,₹70,,4.2 out of 5 stars,"1,406",https://www.amazon.in/Vega-Cotton-Ball-Pack-50/dp/B00R2MP7QG/ref=sr_1_56?dchild=1&keywords=makeup+removers&qid=1626846200&sr=8-56
ayushicreationa 2 PCS Face Cleaning Sponge with Headband Face Cleaning Makeup Remover Facial Sponges Soft Pad Puff  ,,,,₹399,₹171,Save ₹228 (57%),3.1 out of 5 stars,10,https://www.amazon.in/ayushicreationa-Cleaning-Headband-Remover-Sponges/dp/B08SL6R71Q/ref=sr_1_57?dchild=1&keywords=makeup+removers&qid=1626846200&sr=8-57
ETSAP Facial Wash Pad Makeup Remover Cleaning Sponge Puff Exfoliator Scrub: 4 Pieces  ,,,,₹499,₹188,Save ₹311 (62%),,,https://www.amazon.in/ETSAP-Facial-Remover-Cleaning-Exfoliator/dp/B08YFPFKMX/ref=sr_1_58?dchild=1&keywords=makeup+removers&qid=1626846200&sr=8-58
HEALLILY 3Pcs Makeup Removing Cloths Reusable Makeup Remover Towels Reusable Microfiber Cleansing Towels Reusable Facial Cleansing Towels  ,,,,"₹1,577.86",₹841.53,Save ₹736.33 (47%),,,https://www.amazon.in/HEALLILY-Removing-Reusable-Microfiber-Cleansing/dp/B098Q2TV2D/ref=sr_1_49?dchild=1&keywords=makeup+removers&qid=1626846200&sr=8-49
Nyamah Sales Facial Cleaning Wash Pad Puff Makeup Remover Sponge Face Washing Soft Brush for Women Multi-color Medium Size (2 PCS Face Cleaning Brush with Headband)  ,,,,₹399,₹149,Save ₹250 (63%),3.9 out of 5 stars,11,https://www.amazon.in/Nyamah-Sales-Cleaning-Multi-color-Headband/dp/B08R59VGX8/ref=sr_1_50?dchild=1&keywords=makeup+removers&qid=1626846200&sr=8-50
"GINNI CLEA Wet Wipes, Cleansing & Makeup Remover Wipes, Wet Tissues for Face Moisturizing With Strawberry Fragrance (60 Wipes)  ",,,,₹180,₹155,Save ₹25 (14%),5.0 out of 5 stars,1,https://www.amazon.in/GINNI-Cleansing-Moisturizing-Strawberry-Fragrance/dp/B0998ZZ2G8/ref=sr_1_51?dchild=1&keywords=makeup+removers&qid=1626846200&sr=8-51
"Swiss Beauty Cleansing MakeUp Remover, Face MakeUp, Shade-02, 150ml  ",,,,₹399,₹279,Save ₹120 (30%),3.9 out of 5 stars,7,https://www.amazon.in/Beauty-Cleansing-MakeUp-Remover-Shade-02/dp/B087RN7832/ref=sr_1_52?dchild=1&keywords=makeup+removers&qid=1626846200&sr=8-52
"Inatur Make - Up Remover Cleansing Face Wipes, Daily Cleansing Facial Towelettes to Remove Waterproof Make up and Mascara Jojoba Oil, Micellar Deep Cleans, Natural, No artificial Chemicals, 30 Wipes  ",,,,₹310,₹290,Save ₹20 (6%),4.1 out of 5 stars,8,https://www.amazon.in/Inatur-Jojoba-Oil-Micellar-Make/dp/B0811ZVY58/ref=sr_1_53?dchild=1&keywords=makeup+removers&qid=1626846200&sr=8-53
MINISO Pink Cotton Pads 180 Sheets Soft for Cleaning Wiping Makeup Remover  ,,,,₹150,₹140,Save ₹10 (7%),4.5 out of 5 stars,364,https://www.amazon.in/MINISO-Cotton-Sheets-Cleaning-Remover/dp/B08C2WFR9R/ref=sr_1_54?dchild=1&keywords=makeup+removers&qid=1626846200&sr=8-54
"Glam 21 Fresh Natural Eye,Lip&Face Makeup Remover MR102  ",,,,₹299,₹210,Save ₹89 (30%),5.0 out of 5 stars,1,https://www.amazon.in/Glam-21-Natural-Makeup-Remover/dp/B08JJ68WYP/ref=sr_1_55?dchild=1&keywords=makeup+removers&qid=1626846200&sr=8-55
