name,badge_1,badge_2,badge_3,badge_4,mrp,discounted_price,discount,rating,rating_count,link
Abelya Denim Blue Jackets Pack of 2,,,,,"Rs. 2,199",Rs.  725,67% Off,3.9000000000000004,(15),https://www.snapdeal.com/product/abelya-denim-blue-jackets/645628648256#bcrumbSearch:women%20jackets
Abelya Cotton Blend Black Jackets,,,,,"Rs. 1,299",Rs.  419,68% Off,4.1,(14),https://www.snapdeal.com/product/abelya-cotton-blend-black-jackets/640893854607#bcrumbSearch:women%20jackets
Abelya Denim Blue Jackets,,,,,"Rs. 1,499",Rs.  419,72% Off,4.1,(110),https://www.snapdeal.com/product/abelya-denim-blue-jackets/641222021478#bcrumbSearch:women%20jackets
Abelya Denim Blue Jackets,,,,,Rs. 999,Rs.  419,58% Off,4.6000000000000005,(9),https://www.snapdeal.com/product/abelya-denim-blue-jackets/650405348211#bcrumbSearch:women%20jackets
Ammi Jaan Denim Blue Jackets and Jegging Pack of 2,,,,,"Rs. 1,999",Rs.  675,66% Off,,,https://www.snapdeal.com/product/ammi-jaan-denim-blue-jackets/650259602967#bcrumbSearch:women%20jackets
SELFYS Cotton Blue Hooded Jackets,,,,,Rs. 999,Rs.  439,56% Off,3.5999999999999996,(9),https://www.snapdeal.com/product/selfys-cotton-blue-hooded-jackets/673757152542#bcrumbSearch:women%20jackets
SELFYS Cotton Beige Hooded Jackets,,,,,Rs. 999,Rs.  575,42% Off,5.0,(1),https://www.snapdeal.com/product/selfys-cotton-beige-hooded-jackets/681515434755#bcrumbSearch:women%20jackets
Abelya Denim Blue Jackets,,,,,"Rs. 2,199",Rs.  749,66% Off,5.0,(1),https://www.snapdeal.com/product/abelya-denim-blue-jackets/654079890218#bcrumbSearch:women%20jackets
Ayrin Denim Blue Jackets,,,,,"Rs. 1,199",Rs.  439,63% Off,4.200000000000001,(10),https://www.snapdeal.com/product/ayrin-denim-blue-jackets/682238859320#bcrumbSearch:women%20jackets
Oxolloxo Polyester Blend Red Jackets,,,,,"Rs. 2,499","Rs.  1,124",55% Off,,,https://www.snapdeal.com/product/oxolloxo-polyester-blend-red-jackets/679222380598#bcrumbSearch:women%20jackets
Abelya Denim Blue Jackets,,,,,"Rs. 1,499",Rs.  419,72% Off,4.200000000000001,(61),https://www.snapdeal.com/product/abelya-denim-blue-jackets/640478719103#bcrumbSearch:women%20jackets
JUNEBERRY Cotton Blend Multi Color Hooded Jackets,,,,,"Rs. 1,699",Rs.  849,50% Off,3.7,(65),https://www.snapdeal.com/product/juneberry-cotton-blend-multi-color/671893489865#bcrumbSearch:women%20jackets
retrobella Denim Yellow Jackets,,,,,"Rs. 1,499",Rs.  549,63% Off,4.5,(22),https://www.snapdeal.com/product/retrobella-denim-yellow-jackets/651847813826#bcrumbSearch:women%20jackets
retrobella Cotton Blend Brown Jackets,,,,,"Rs. 1,999",Rs.  575,71% Off,,,https://www.snapdeal.com/product/retrobella-cotton-blend-brown-jackets/662758378950#bcrumbSearch:women%20jackets
BuyNewTrend Cotton Blend Black Hooded Jackets,,,,,"Rs. 1,499",Rs.  389,74% Off,3.0,(3),https://www.snapdeal.com/product/buynewtrend-cotton-blend-black-hooded/685047200924#bcrumbSearch:women%20jackets
retrobella Denim White Jackets,,,,,"Rs. 1,499",Rs.  549,63% Off,4.4,(15),https://www.snapdeal.com/product/retrobella-denim-white-jackets/640527236699#bcrumbSearch:women%20jackets
Abelya Cotton Blend White Jackets,,,,,"Rs. 2,199",Rs.  469,79% Off,4.1,(18),https://www.snapdeal.com/product/abelya-cotton-blend-white-jackets/655277113435#bcrumbSearch:women%20jackets
Abelya Denim Blue Jackets,,,,,"Rs. 1,499",Rs.  449,70% Off,4.4,(13),https://www.snapdeal.com/product/abelya-denim-blue-jackets/667356209899#bcrumbSearch:women%20jackets
BuyNewTrend Denim Blue Jackets,,,,,"Rs. 1,499",Rs.  519,65% Off,,,https://www.snapdeal.com/product/buynewtrend-denim-blue-jackets/624444045308#bcrumbSearch:women%20jackets
BuyNewTrend Denim Blue Jackets,,,,,"Rs. 1,499",Rs.  389,74% Off,4.6000000000000005,(9),https://www.snapdeal.com/product/buynewtrend-denim-blue-jackets/638577580753#bcrumbSearch:women%20jackets
Abelya Cotton Blend Maroon Jackets,,,,,"Rs. 1,299",Rs.  419,68% Off,3.5999999999999996,(14),https://www.snapdeal.com/product/abelya-cotton-blend-maroon-jackets/660467565105
BuyNewTrend Denim Blue Hooded Jackets,,,,,"Rs. 1,499",Rs.  499,67% Off,4.699999999999999,(3),https://www.snapdeal.com/product/buynewtrend-denim-blue-hooded-jackets/632273532465
retrobella Denim Green Jackets,,,,,"Rs. 1,499",Rs.  549,63% Off,4.3,(12),https://www.snapdeal.com/product/retrobella-denim-green-jackets/679950487734
Uzmano Denim Blue Jackets,,,,,Rs. 798,Rs.  359,55% Off,3.0,(1),https://www.snapdeal.com/product/uzmano-denim-blue-jackets/632922277478
Hangup Polyester Blend Navy Ethnic Jacket,,2 left!,,,"Rs. 1,999",Rs.  898,55% Off,,,https://www.snapdeal.com/product/hangup-polyester-blend-navy-ethnic/634222197979
JUNEBERRY Cotton Blend Green Jackets,,,,,"Rs. 1,499",Rs.  699,53% Off,5.0,(3),https://www.snapdeal.com/product/juneberry-cotton-blend-green-jackets/657022776361
Abelya Denim Blue Jackets,,,,,"Rs. 1,499",Rs.  419,72% Off,4.0,(3),https://www.snapdeal.com/product/abelya-denim-blue-jackets/649858655187
retrobella Cotton Blend Green Jackets,,,,,"Rs. 1,999",Rs.  549,73% Off,4.1,(15),https://www.snapdeal.com/product/retrobella-cotton-blend-green-jackets/626418943055
retrobella Cotton Blend Pink Jackets,,,,,"Rs. 1,999",Rs.  549,73% Off,4.200000000000001,(27),https://www.snapdeal.com/product/retrobella-cotton-blend-pink-jackets/677389643345
retrobella Cotton Blend Green Jackets,,,,,"Rs. 1,999",Rs.  575,71% Off,,,https://www.snapdeal.com/product/retrobella-cotton-blend-green-jackets/647210061479
Trufit Black Cotton Hooded,,1 left!,,,"Rs. 2,895","Rs.  1,599",45% Off,3.1,(7),https://www.snapdeal.com/product/trufit-cotton-jacket/184027195
Ammi Jaan Denim Blue Jackets,,,,,"Rs. 1,299",Rs.  399,69% Off,3.9000000000000004,(15),https://www.snapdeal.com/product/ammi-jaan-denim-blue-jackets/643825643036
BuyNewTrend Denim Blue Jackets,,,,,"Rs. 1,499",Rs.  399,73% Off,5.0,(2),https://www.snapdeal.com/product/buynewtrend-denim-blue-jackets/681535877609
The Dry State Cotton Off White Jackets,,,,,"Rs. 1,799",Rs.  799,56% Off,,,https://www.snapdeal.com/product/the-dry-state-cotton-off/629793109760
Bfly Black Fleece Zippered,,7 left!,,,Rs. 993,Rs.  469,53% Off,3.8,(44),https://www.snapdeal.com/product/bfly-black-cotton-blend-jackets/635761186343
SWANGIYA Cotton Blend Navy Hooded Jackets,,5 left!,,,"Rs. 1,250",Rs.  625,50% Off,3.0,(1),https://www.snapdeal.com/product/swangiya-cotton-blend-navy-hooded/679721400520
Trufit Black Polyester Blend Long Jackets,,4 left!,,,"Rs. 1,995","Rs.  1,199",40% Off,4.1,(12),https://www.snapdeal.com/product/trufit-black-polyester-blend-long/682015941936
SWANGIYA Cotton Blend Black Hooded Jackets,,5 left!,,,"Rs. 1,250",Rs.  625,50% Off,3.299999999999999,(4),https://www.snapdeal.com/product/swangiya-cotton-blend-black-hooded/644513450685
retrobella Denim Black Jackets,,,,,"Rs. 1,999",Rs.  575,71% Off,,,https://www.snapdeal.com/product/retrobella-denim-black-jackets/642068011570
END EDGE Nylon Red Parka Jackets,,,,,"Rs. 3,599","Rs.  1,299",64% Off,4.699999999999999,(13),https://www.snapdeal.com/product/end-edge-nylon-rust-jackets/644223754009
END EDGE Nylon Red Parka Jackets,,,,,"Rs. 3,599","Rs.  1,299",64% Off,4.699999999999999,(13),https://www.snapdeal.com/product/end-edge-nylon-rust-jackets/644223754009
EBABES Acrylic Tan Parka Jackets,,,,,"Rs. 2,999","Rs.  1,399",53% Off,,,https://www.snapdeal.com/product/ebabes-acrylic-tan-parka-jackets/686703089441
BuyNewTrend Denim Black Jackets,,,,,"Rs. 1,499",Rs.  399,73% Off,4.5,(2),https://www.snapdeal.com/product/buynewtrend-denim-black-jackets/631307923905
Alif Ecom Denim Blue Jackets,,,,,"Rs. 1,499",Rs.  575,62% Off,4.3,(33),https://www.snapdeal.com/product/alif-ecom-denim-blue-jackets/681629989198
Trufit Multi Color Polyester Blend Reversible Jackets,,,,,"Rs. 2,995","Rs.  2,104",30% Off,4.3,(34),https://www.snapdeal.com/product/trufit-multi-color-polyester-blend/653051447632
Voom Denim Green Jackets,,,,,Rs. 999,Rs.  419,58% Off,4.5,(2),https://www.snapdeal.com/product/voom-denim-green-jackets/629405482900
retrobella Denim Black Jackets,,,,,"Rs. 1,999",Rs.  575,71% Off,,,https://www.snapdeal.com/product/retrobella-denim-black-jackets/642068011570
The Dry State Polyester Green Bomber Jackets,,2 left!,,,"Rs. 2,399","Rs.  1,199",50% Off,3.0,(4),https://www.snapdeal.com/product/the-dry-state-polyester-green/633167601626
END EDGE Nylon Peach Jackets,,,,,"Rs. 3,599","Rs.  1,299",64% Off,5.0,(1),https://www.snapdeal.com/product/end-edge-nylon-peach-jackets/636368169266
retrobella Denim Blue Jackets,,,,,"Rs. 1,499",Rs.  549,63% Off,3.5,(11),https://www.snapdeal.com/product/retrobella-denim-blue-jackets/683914691118
BuyNewTrend Denim Blue Jackets,,,,,"Rs. 1,499",Rs.  489,67% Off,3.9000000000000004,(30),https://www.snapdeal.com/product/buynewtrend-denim-blue-jackets/657204721371
Dolce Crudo Cotton Multi Color Jackets,,,,,"Rs. 2,199",Rs.  875,60% Off,,,https://www.snapdeal.com/product/dolce-crudo-cotton-multi-color/663687786930
BFLY Fleece Parka Jackets,,5 left!,,,"Rs. 1,400",Rs.  599,57% Off,4.0,(12),https://www.snapdeal.com/product/bfly-black-cotton-blend-jackets/641430556158
END EDGE Nylon Pink Parka Jackets,,,,,"Rs. 3,099","Rs.  1,299",58% Off,4.3,(20),https://www.snapdeal.com/product/end-edge-nylon-pink-jackets/656669769134
Trufit Yellow Cotton Hooded,,1 left!,,,"Rs. 3,345","Rs.  1,699",49% Off,4.5,(11),https://www.snapdeal.com/product/trufit-yellow-cotton-hooded/632046280114
Hangup Silk Grey Ethnic Jacket,,4 left!,,,"Rs. 2,499",Rs.  898,64% Off,,,https://www.snapdeal.com/product/hangup-silk-grey-ethnic-jacket/638327575969
Trufit Polyester Blend Parka Jackets,,4 left!,,,"Rs. 2,395","Rs.  1,899",21% Off,5.0,(1),https://www.snapdeal.com/product/trufit-polyester-blend-parka-jackets/677488806019
MDS Jeans Denim Blue Jackets,,,,,"Rs. 1,499",Rs.  499,67% Off,4.1,(16),https://www.snapdeal.com/product/mds-jeans-denim-blue-jackets/673235613223
Dolce Crudo Cotton Navy Jackets,,,,,"Rs. 2,499",Rs.  875,65% Off,5.0,(1),https://www.snapdeal.com/product/dolce-crudo-cotton-navy-jackets/633833915347
END EDGE Nylon Orange Hooded Jackets,,,,,"Rs. 3,599","Rs.  1,299",64% Off,4.3,(23),https://www.snapdeal.com/product/end-edge-nylon-orange-jackets/638910243059
Oxolloxo Polyester Blend Navy Jackets,,2 left!,,,"Rs. 2,899","Rs.  1,304",55% Off,,,https://www.snapdeal.com/product/oxolloxo-polyester-blend-navy-jackets/660535815393
Trufit Green Polyester Blend Hooded,,1 left!,,,"Rs. 2,395","Rs.  1,649",31% Off,4.1,(10),https://www.snapdeal.com/product/trufit-green-polyester-blend-hooded/672461686694
Ayrin Denim Blue Jackets,,,,,"Rs. 1,299",Rs.  469,64% Off,2.5,(2),https://www.snapdeal.com/product/ayrin-denim-blue-jackets/685384916577
BuyNewTrend Denim Black Jackets,,,,,"Rs. 1,499",Rs.  399,73% Off,2.0,(2),https://www.snapdeal.com/product/buynewtrend-denim-black-jackets/618938966492
Crimsoune Club Pu Leather Tan Jackets,,2 left!,,,"Rs. 3,699","Rs.  1,249",66% Off,1.0,(1),https://www.snapdeal.com/product/crimsoune-club-pu-leather-tan/654567138609
Snugg Fit Denim Blue Jackets,,5 left!,,,"Rs. 1,999",Rs.  899,55% Off,,,https://www.snapdeal.com/product/snugg-fit-denim-blue-jackets/661229488134
URVI TRADERS Denim Black Ethnic Jacket,,,,,"Rs. 1,499",Rs.  449,70% Off,,,https://www.snapdeal.com/product/urvi-traders-denim-black-ethnic/639341637567
Ammi Jaan Denim Blue Jackets,,,,,"Rs. 1,599",Rs.  675,58% Off,,,https://www.snapdeal.com/product/ammi-jaan-denim-blue-jackets/627612497416
fabGlobal Rayon Maroon Reversible Jackets,,5 left!,,,"Rs. 3,499","Rs.  1,299",63% Off,,,https://www.snapdeal.com/product/fabglobal-rayon-maroon-reversible-jackets/628728127975
STC Denim Navy Jackets,,,,,"Rs. 1,299",Rs.  599,54% Off,,,https://www.snapdeal.com/product/stc-denim-navy-jackets/653040109087
Zisim Denim Blue Jackets,,,,,"Rs. 1,299",Rs.  439,66% Off,,,https://www.snapdeal.com/product/zisim-denim-blue-jackets/625668039036
LAZIE N FAB Polyester Blend Peach Jackets,,,,,"Rs. 2,239","Rs.  1,199",46% Off,,,https://www.snapdeal.com/product/lazie-n-fab-polyester-blend/659373889846
LAZIE N FAB Polyester Blend Navy Quilted/Padded Jackets,,3 left!,,,"Rs. 4,499","Rs.  1,099",76% Off,,,https://www.snapdeal.com/product/lazie-n-fab-polyester-blend/618955032955
Cherokee Cotton Blue Jackets,,1 left!,,,"Rs. 1,199",Rs.  840,30% Off,,,https://www.snapdeal.com/product/cherokee-cotton-blue-jackets/665002350701
Trufit Polyester Blend Black Reversible Jackets,,,,,"Rs. 2,595","Rs.  1,549",40% Off,,,https://www.snapdeal.com/product/trufit-polyester-blend-quiltted-jackets/644412816626
Oxolloxo Cotton Blue Bomber Jackets,,,,,"Rs. 1,899",Rs.  949,50% Off,,,https://www.snapdeal.com/product/oxolloxo-cotton-blue-bomber-jackets/631435302255
kotty Denim Blue Jackets,,1 left!,,,"Rs. 2,999","Rs.  1,303",57% Off,,,https://www.snapdeal.com/product/kotty-denim-blue-jackets/635799418246
STC Cotton Blend Maroon Jackets,,,,,"Rs. 1,299",Rs.  600,54% Off,,,https://www.snapdeal.com/product/stc-denim-maroon-jackets/666291830693
BuyNewTrend Denim Blue Jackets,,,,,"Rs. 1,499",Rs.  549,63% Off,,,https://www.snapdeal.com/product/buynewtrend-denim-blue-jackets/676961826814
Zisim Denim Blue Jackets,,,,,"Rs. 1,299",Rs.  429,67% Off,,,https://www.snapdeal.com/product/zisim-denim-blue-jackets/651531318620
Trufit Polyester Blend White Reversible Jackets,,1 left!,,,"Rs. 1,995","Rs.  1,349",32% Off,,,https://www.snapdeal.com/product/trufit-polyester-blend-reversible-jackets/642803679361
BuyNewTrend Denim Blue Jackets,,,,,"Rs. 1,499",Rs.  549,63% Off,,,https://www.snapdeal.com/product/buynewtrend-denim-blue-jackets/648988465470
retrobella Cotton Blend Maroon Jackets,,,,,"Rs. 1,999",Rs.  649,68% Off,,,https://www.snapdeal.com/product/retrobella-cotton-blend-maroon-jackets/646023091005
kotty Denim Blue Jackets,,,,,"Rs. 2,999","Rs.  1,299",57% Off,,,https://www.snapdeal.com/product/kotty-denim-blue-jackets/665014731296
Dolce Crudo Cotton Blue Hooded Jackets,,1 left!,,,"Rs. 2,499",Rs.  875,65% Off,,,https://www.snapdeal.com/product/dolce-crudo-cotton-blue-hooded/681595191027
Monte Carlo Woollen Yellow Jackets,,2 left!,,,"Rs. 4,185","Rs.  4,185",,,,https://www.snapdeal.com/product/monte-carlo-woollen-yellow-jackets/670427738767
BuyNewTrend Cotton Blend Multi Color Bomber Jackets,,1 left!,,,"Rs. 1,499",Rs.  775,48% Off,,,https://www.snapdeal.com/product/buynewtrend-cotton-blend-multi-color/678629821634
Raj Cotton Black Ethnic Jacket,,5 left!,,,"Rs. 2,500","Rs.  1,188",52% Off,,,https://www.snapdeal.com/product/raj-cotton-black-ethnic-jacket/677043898029
Raj Cotton Yellow Ethnic Jacket,,5 left!,,,"Rs. 2,500","Rs.  1,174",53% Off,,,https://www.snapdeal.com/product/raj-cotton-yellow-ethnic-jacket/638828146762
Globus Cotton Black Jackets,,,,,"Rs. 1,899",Rs.  949,50% Off,,,https://www.snapdeal.com/product/globus-cotton-black-jackets/679036401344
EBABES Acrylic Black Parka Jackets,,,,,"Rs. 2,999","Rs.  1,399",53% Off,,,https://www.snapdeal.com/product/ebabes-acrylic-black-parka-jackets/666155601964
retrobella Cotton Blend Peach Jackets,,,,,"Rs. 1,999",Rs.  650,67% Off,,,https://www.snapdeal.com/product/retrobella-cotton-blend-peach-jackets/666695061820
guti Poly Cotton Off White Jackets,,,,,"Rs. 2,999","Rs.  1,099",63% Off,,,https://www.snapdeal.com/product/guti-poly-cotton-off-white/676767549139
retrobella Cotton Blend Maroon Jackets,,,,,"Rs. 1,999",Rs.  575,71% Off,,,https://www.snapdeal.com/product/retrobella-cotton-blend-maroon-jackets/650639198074
Monte Carlo Cotton Blend Maroon Jackets,,,,,"Rs. 3,010","Rs.  2,257",25% Off,,,https://www.snapdeal.com/product/monte-carlo-cotton-blend-maroon/666885777274
OVERS Cotton Blend Blue Jackets,,,,,"Rs. 2,999","Rs.  1,099",63% Off,,,https://www.snapdeal.com/product/overs-cotton-blend-blue-jackets/629612833625
SELFYS Cotton Black Jackets,,3 left!,,,"Rs. 1,998","Rs.  1,004",50% Off,,,https://www.snapdeal.com/product/selfys-cotton-black-jackets/646163797974
Mustard Black Cotton Jackets,,1 left!,,,"Rs. 1,599","Rs.  1,214",24% Off,,,https://www.snapdeal.com/product/mustard-black-cotton-jackets/665603154903
Trufit Cotton Black Reversible Jackets,,7 left!,,,"Rs. 3,995","Rs.  2,322",42% Off,,,https://www.snapdeal.com/product/trufit-cotton-bomber-jackets/675790293739
Trufit Gray Polyester Blend Bomber Jackets,,1 left!,,,"Rs. 1,695",Rs.  899,47% Off,,,https://www.snapdeal.com/product/trufit-gray-polyester-blend-bomber/664427982880
