name,badge_1,badge_2,badge_3,mrp,discounted_price,discount,rating,rating_count,link
"Homesake Metal Light Lamps, Beige  ",,Sponsored,,"₹5,000","₹1,599","Save ₹3,401 (68%)",4.5 out of 5 stars,10,https://www.amazon.in/gp/slredirect/picassoRedirect.html/ref=pa_sp_atf_aps_sr_pg1_1?ie=UTF8&adId=A06297621O2LCO0WBNBJ9&url=%2FHomesake-Metal-Light-Lamps-Beige%2Fdp%2FB0936GHJHY%2Fref%3Dsr_1_1_sspa%3Fdchild%3D1%26keywords%3Dtable%2Blamp%26qid%3D1625720266%26sr%3D8-1-spons%26psc%3D1&qualifier=1625720266&id=8887809395581975&widgetName=sp_atf
"Natural Himalayan Pink Rock Salt Stone Lamp 5KG - Original Air Purifier Table Lamp for Home Decor, Gifts  ",,Sponsored,,"₹2,000","₹1,345",Save ₹655 (33%),,,https://www.amazon.in/gp/slredirect/picassoRedirect.html/ref=pa_sp_atf_aps_sr_pg1_1?ie=UTF8&adId=A1003912A1EWXJBTWP4C&url=%2FNatural-Himalayan-Pink-Rock-Stone%2Fdp%2FB0973HQCKN%2Fref%3Dsr_1_2_sspa%3Fdchild%3D1%26keywords%3Dtable%2Blamp%26qid%3D1625720266%26sr%3D8-2-spons%26psc%3D1&qualifier=1625720266&id=8887809395581975&widgetName=sp_atf
"OPPLE 3W Reading Light LED Rechargeable Light with Flicker Free Desk Book Lamp (Natural Light, 4000K,White)  ",,Sponsored,,"₹1,455","₹1,129",Save ₹326 (22%),4.3 out of 5 stars,"1,501",https://www.amazon.in/gp/slredirect/picassoRedirect.html/ref=pa_sp_atf_aps_sr_pg1_1?ie=UTF8&adId=A060686410NF3B109JPZ2&url=%2FReading-Rechargeable-Children-Protection-Student%2Fdp%2FB07P4F5BBM%2Fref%3Dsr_1_3_sspa%3Fdchild%3D1%26keywords%3Dtable%2Blamp%26qid%3D1625720266%26sr%3D8-3-spons%26psc%3D1&qualifier=1625720266&id=8887809395581975&widgetName=sp_atf
"Hopdezyo Wooden Floor Lamp with Shade, Standard Size Metal Base Decorative Lamp for Bedroom, Living Room, Office & Home Decor Items (Jute, Tripod)  ",,Sponsored,,"₹6,000","₹1,240","Save ₹4,760 (79%)",,,https://www.amazon.in/gp/slredirect/picassoRedirect.html/ref=pa_sp_atf_aps_sr_pg1_1?ie=UTF8&adId=A06049923VIUN6MP7LRCA&url=%2FHopdezyo-Wooden-Standard-Decorative-Bedroom%2Fdp%2FB0987RGVC8%2Fref%3Dsr_1_4_sspa%3Fdchild%3D1%26keywords%3Dtable%2Blamp%26qid%3D1625720266%26sr%3D8-4-spons%26psc%3D1&qualifier=1625720266&id=8887809395581975&widgetName=sp_atf
"Syska SSK-TL-8602L EASYGLOW 4W LED Table lamp with 3 Stage Dimming Light(White,Pack of 1)  ",Limited time deal,,,₹899,₹639,Save ₹260 (29%),4.4 out of 5 stars,81,https://www.amazon.in/Syska-SSK-TL-8602L-EASYGLOW-Table-Dimming/dp/B08BKWMMBP/ref=sr_1_5?dchild=1&keywords=table+lamp&qid=1625720266&smid=AT95IG9ONZD7S&sr=8-5
RYLAN Rechargeable LED Touch On/Off Switch Desk Lamp Children Eye Protection Student Study Reading Dimmer Rechargeable Led Table Lamps USB Charging Touch Dimmer(Desk Lights for Study)*  ,,,,,₹549,,4.8 out of 5 stars,81,https://www.amazon.in/Rechargeable-Desk-Children-Protection-Charging/dp/B098M93SQM/ref=sr_1_6?dchild=1&keywords=table+lamp&qid=1625720266&sr=8-6
RUCON™ Study lamp Rechargeable Led Touch On Off Switch Student Study Reading Dimmer Led Table Lamps White Desk Light lamp  ,,,,₹999,₹415,Save ₹584 (58%),4.2 out of 5 stars,18,https://www.amazon.in/RUCONTM-Rechargeable-Switch-Student-Reading/dp/B097T6GSTG/ref=sr_1_7?dchild=1&keywords=table+lamp&qid=1625720266&sr=8-7
PRIMESKY® Study lamp Rechargeable Led Touch On Off Switch Student Study Reading Dimmer Led Table Lamps White Desk Light lamp  ,,,,₹999,₹489,Save ₹510 (51%),4.3 out of 5 stars,155,https://www.amazon.in/PRIMESKY%C2%AE-Rechargeable-Switch-Student-Reading/dp/B0966KGV2T/ref=sr_1_8?dchild=1&keywords=table+lamp&qid=1625720266&sr=8-8
"ESN 999 Plastic Table Lamp With Attached Pen Stand, Black  ",,,,₹899,₹297,Save ₹602 (67%),4.1 out of 5 stars,270,https://www.amazon.in/ESN-999-Plastic-Table-Attached/dp/B08WCM9Q2H/ref=sr_1_9?dchild=1&keywords=table+lamp&qid=1625720266&sr=8-9
"Wipro Garnet ABS 6w Led Table Lamp - 3 Grade Dimming and Color Changing (Cool Day Light/Neutral White/Warm White), Pack of 1  ",,,,"₹1,500","₹1,319",Save ₹181 (12%),4.5 out of 5 stars,"10,405",https://www.amazon.in/Wipro-Garnet-dimming-Changing-Neutral/dp/B07C9KQ7KR/ref=sr_1_10?dchild=1&keywords=table+lamp&qid=1625720266&sr=8-10
Wooum Rechargeable led Touch On Off Switch Desk Table Lamp with Mobile Holder Touch Switch 3 Modes LED Lights Stundent Eye Protection (White)  ,,,,,₹599,,3.9 out of 5 stars,"1,362",https://www.amazon.in/SaleOnTM-Rechargeable-Children-Protection-Charging/dp/B07MBQGWBN/ref=sr_1_11?dchild=1&keywords=table+lamp&qid=1625720266&sr=8-11
"PHILIPS Plastic LED Desk light, White,Pack of 1  ",,,,"₹1,200","₹1,149",Save ₹51 (4%),4.4 out of 5 stars,"8,616",https://www.amazon.in/Philips-61013-Breeze-5-Watt-light/dp/B016VYB624/ref=sr_1_12?dchild=1&keywords=table+lamp&qid=1625720266&sr=8-12
Oblivion Portable LED Reading Light Adjustable Dimmable Touch Control Desk Lamp  ,,,,₹349,₹220,Save ₹129 (37%),,,https://www.amazon.in/Oblivion-Portable-Reading-Adjustable-Dimmable/dp/B096BDWQPC/ref=sr_1_13?dchild=1&keywords=table+lamp&qid=1625720266&sr=8-13
THAAM™ Rechargeable Desk Study Table Lamp || Adjustable Brightness with Touch Sensor Dimmer for Eye Protection || Super Capacity Light with USB Charging Cable and Classy Look  ,,,,₹999,₹499,Save ₹500 (50%),5.0 out of 5 stars,4,https://www.amazon.in/Rechargeable-Adjustable-Brightness-Protection-Capacity/dp/B097S223HZ/ref=sr_1_14?dchild=1&keywords=table+lamp&qid=1625720266&sr=8-14
"Priza Plastic Table Lamp, Multicolour, Pack of 1  ",,,,"₹1,399",₹630,Save ₹769 (55%),4.1 out of 5 stars,107,https://www.amazon.in/Priza-Bedroom-Charging-Control-Brightness/dp/B08Q8RLRQ9/ref=sr_1_15?dchild=1&keywords=table+lamp&qid=1625720266&sr=8-15
"Pick Ur Needs LED Touch On/Off Study Table Lamp - Children Eye Protection Student Study Reading Dimmer Rechargeable Led Table Lamps USB Charging (Pack of 1, White) (New 5 in 1)  ",,,,"₹1,260",₹699,Save ₹561 (45%),4.1 out of 5 stars,"1,396",https://www.amazon.in/Pick-Ur-Rechargeable-Children-Protection/dp/B08L4335ZX/ref=sr_1_16?dchild=1&keywords=table+lamp&qid=1625720266&sr=8-16
D-tone® 20 LED Touch Table Lamp + 8 LED with 3 Grade Dimming (Cool Day/Neutral/Warm-Yellow) with Drawers/Pen-Phone Holder/Rechargeable 2500mAh Battery (12Hrs Operating Time)  ,,,,"₹1,500",₹689,Save ₹811 (54%),4.5 out of 5 stars,2,https://www.amazon.in/D-tone%C2%AE-Warm-Yellow-Pen-Phone-Rechargeable-Operating/dp/B096XVNBBR/ref=sr_1_17?dchild=1&keywords=table+lamp&qid=1625720266&sr=8-17
"ESN 999 Table Lamp, Red, Pack of 1  ",,,,₹899,₹305,Save ₹594 (66%),4.0 out of 5 stars,"1,991",https://www.amazon.in/ESN-999-Flexible-Electric-Attached/dp/B07QC5YT69/ref=sr_1_18?dchild=1&keywords=table+lamp&qid=1625720266&sr=8-18
"ESN 999 Metal Table Lamp, Black, Pack of 1  ",,,,₹899,₹305,Save ₹594 (66%),4.0 out of 5 stars,"2,229",https://www.amazon.in/ESN-999-Flexible-Electric-Attached/dp/B07PDQMZ7G/ref=sr_1_19?dchild=1&keywords=table+lamp&qid=1625720266&sr=8-19
Hopesmile® Night lamp Star Lights Projector Rotating Romantic Moon 360 Degree and Home Decoration Room Birthday Gifts for Kids Girls 4 6 7 8 5 Years Old Bedroom Table with USB Cable  ,,,,₹699,₹429,Save ₹270 (39%),5.0 out of 5 stars,3,https://www.amazon.in/Hopesmile%C2%AE-Projector-Rotating-Romantic-Decoration/dp/B097R18Q8S/ref=sr_1_20?dchild=1&keywords=table+lamp&qid=1625720266&sr=8-20
"RUilY Heng Balance Table Lamp, ABS PP, White, Pack of 1  ",,Sponsored,,"₹5,000","₹2,699","Save ₹2,301 (46%)",4.5 out of 5 stars,227,https://www.amazon.in/gp/slredirect/picassoRedirect.html/ref=pa_sp_mtf_aps_sr_pg1_1?ie=UTF8&adId=A03038292PQMUSPQVWJFG&url=%2FRUilY-Balance-Magnetic-Bedroom-Wyoming%2Fdp%2FB08FY7RKTT%2Fref%3Dsr_1_21_sspa%3Fdchild%3D1%26keywords%3Dtable%2Blamp%26qid%3D1625720266%26sr%3D8-21-spons%26psc%3D1&qualifier=1625720266&id=8887809395581975&widgetName=sp_mtf
XERGY Touch Sensor Bedside Lamp Smart LED Table Lamp Night Light Desk Lamps Portable Dimmable Color Changing RGB  ,,Sponsored,,"₹2,999","₹1,499","Save ₹1,500 (50%)",4.0 out of 5 stars,1,https://www.amazon.in/gp/slredirect/picassoRedirect.html/ref=pa_sp_mtf_aps_sr_pg1_1?ie=UTF8&adId=A045131526A5N5Q9M9T83&url=%2FXERGY-Bedside-Portable-Dimmable-Changing%2Fdp%2FB0922SZG6B%2Fref%3Dsr_1_22_sspa%3Fdchild%3D1%26keywords%3Dtable%2Blamp%26qid%3D1625720266%26sr%3D8-22-spons%26psc%3D1&qualifier=1625720266&id=8887809395581975&widgetName=sp_mtf
"ExclusiveLane Mango Wood, Cambric Cotton Table Lamp for Living Room Bedroom Bedside Lamp, Brown, Off-White, 1 Piece  ",,Sponsored,,"₹2,435","₹1,826",Save ₹609 (25%),4.4 out of 5 stars,"1,165",https://www.amazon.in/gp/slredirect/picassoRedirect.html/ref=pa_sp_mtf_aps_sr_pg1_1?ie=UTF8&adId=A05969112EOXFX9E1EOS1&url=%2FExclusiveLane-Starlight-Decorative-Bedroom-Decoration%2Fdp%2FB085W5TQ9L%2Fref%3Dsr_1_23_sspa%3Fdchild%3D1%26keywords%3Dtable%2Blamp%26qid%3D1625720266%26sr%3D8-23-spons%26psc%3D1&qualifier=1625720266&id=8887809395581975&widgetName=sp_mtf
"The Light Store Glass, Alloy Steel Table Lamp, Gold  ",,Sponsored,,,,,,,https://www.amazon.in/gp/slredirect/picassoRedirect.html/ref=pa_sp_mtf_aps_sr_pg1_1?ie=UTF8&adId=A03020091PL4UQ1L1IAEC&url=%2FIlluminations-Luxurious-Light-Restaurant-decoration%2Fdp%2FB079P5RKY9%2Fref%3Dsr_1_24_sspa%3Fdchild%3D1%26keywords%3Dtable%2Blamp%26qid%3D1625720266%26sr%3D8-24-spons%26psc%3D1&qualifier=1625720266&id=8887809395581975&widgetName=sp_mtf
"KWT Rechargeable LED Touch On/Off Switch Desk Lamp Children Eye Protection Student Study Reading Dimmer Rechargeable Led Table Lamps USB Charging Touch Dimmer, Desk Lights for Study (White)  ",,,,,₹499,,5.0 out of 5 stars,70,https://www.amazon.in/KWT-Rechargeable-Children-Protection-Charging/dp/B097HCT5CN/ref=sr_1_25?dchild=1&keywords=table+lamp&qid=1625720266&sr=8-25
ZENSTOE™ Rechargeable LED Touch On/Off Switch Desk Table Lamp USB Charging Student Study Reading Touch Dimmer for Eye Protection (White)  ,,,,₹799,₹399,Save ₹400 (50%),,,https://www.amazon.in/ZENSTOETM-Rechargeable-Charging-Student-Protection/dp/B098HXKZHW/ref=sr_1_26?dchild=1&keywords=table+lamp&qid=1625720266&sr=8-26
Eleven Mart® Rechargeable LED Touch On/Off Switch Desk Lamp Children Eye Protection Student Study Reading Dimmer Rechargeable Led Table Lamps USB Charging Touch Dimmer (Desk Light)  ,,,,"₹1,999",₹499,"Save ₹1,500 (75%)",,,https://www.amazon.in/Eleven-Rechargeable-Children-Protection-Charging/dp/B098L9ZF7T/ref=sr_1_27?dchild=1&keywords=table+lamp&qid=1625720266&sr=8-27
"ESN 999 Aluminium Lamp, Black  ",,,,₹899,₹525,Save ₹374 (42%),4.1 out of 5 stars,339,https://www.amazon.in/ESN-999-Electric-Flexible-Office/dp/B08DBHJ7GQ/ref=sr_1_28?dchild=1&keywords=table+lamp&qid=1625720266&sr=8-28
Krishn Kunj LED Rechargeable Desk Lamp Dimmable Eye Care Study Book Light Pencil Cup Foldable Light USB Charging 360° Flexible Gooseneck Night Light for Room Bedroom (Desk Lamp)  ,,,,"₹1,499",₹499,"Save ₹1,000 (67%)",3.8 out of 5 stars,138,https://www.amazon.in/Krishn-Kunj-Rechargeable-Dimmable-Gooseneck/dp/B08W59Q5KN/ref=sr_1_29?dchild=1&keywords=table+lamp&qid=1625720266&sr=8-29
Bulfyss USB Flexible Reading LED Light Clip-on Beside Bed Table Desk Lamp (Black).  ,,,,₹999,₹499,Save ₹500 (50%),4.4 out of 5 stars,87,https://www.amazon.in/Bulfyss-Flexible-Reading-Light-Beside/dp/B0941YXMNR/ref=sr_1_30?dchild=1&keywords=table+lamp&qid=1625720266&sr=8-30
"ESN 999 Plastic Rechargeable Touch Dimmer LED Table Lamp , White  ",,,,₹999,₹369,Save ₹630 (63%),3.8 out of 5 stars,49,https://www.amazon.in/ESN-999-RL9999-Rechargeable-Dimmer/dp/B07N2K4DQ8/ref=sr_1_31?dchild=1&keywords=table+lamp&qid=1625720266&sr=8-31
"Wipro 6W LED Table Lamp-3 Grade Dimming and Ambience Lighting (6 color options,White,Pack of 1)  ",,,,"₹2,250","₹1,449",Save ₹801 (36%),4.3 out of 5 stars,"2,547",https://www.amazon.in/Wipro-6W-Deco-Table-Lamp/dp/B07TQTSQZ9/ref=sr_1_32?dchild=1&keywords=table+lamp&qid=1625720266&sr=8-32
Homenique Orange Flower Shade Traditional Farmhouse Table Lamps with Fabric Shade for Living Room Bedroom House Bedside Nightstand Home Office (Bulb not Included)  ,,,,₹980,₹540,Save ₹440 (45%),4.4 out of 5 stars,6,https://www.amazon.in/Homenique-Traditional-Farmhouse-Table-Nightstand/dp/B091182B6Q/ref=sr_1_33?dchild=1&keywords=table+lamp&qid=1625720266&sr=8-33
Shop Cart Rechargeable LED Touch On/Off Switch Desk Table Lamp USB Charging Student Study Reading Touch Dimmer for Eye Protection (White)  ,,,,₹999,₹399,Save ₹600 (60%),1.0 out of 5 stars,2,https://www.amazon.in/Shop-Cart-Rechargeable-Charging-Protection/dp/B096MPBQBD/ref=sr_1_34?dchild=1&keywords=table+lamp&qid=1625720266&sr=8-34
SaleOn Rechargeable Desk/Study Lamp Touch On/Off Switch Desk Table Lamp with Mobile Holder Office Desk lamp Touch Dimmer Childeren Eye Safety Protection (White)  ,,,,,₹599,,4.1 out of 5 stars,"1,137",https://www.amazon.in/SaleOnTM-Rechargeable-Children-Protection-Charging/dp/B07MFB17DV/ref=sr_1_35?dchild=1&keywords=table+lamp&qid=1625720266&sr=8-35
"Finate LED Desk Lamp Dimmable Table Lamp for Study with Pen & Mobile Phone Holder, Storage Case, Adjustable Gooseneck, Rechargeable  ",,,,"₹1,299",₹699,Save ₹600 (46%),4.7 out of 5 stars,8,https://www.amazon.in/Finate-Dimmable-Adjustable-Gooseneck-Rechargeable/dp/B0924KQGDJ/ref=sr_1_36?dchild=1&keywords=table+lamp&qid=1625720266&sr=8-36
"EDGE Plastic Desk/Table Lamp, White  ",,,,₹899,₹499,Save ₹400 (44%),4.0 out of 5 stars,101,https://www.amazon.in/EDGE-Plastic-Desk-Table-White/dp/B0913JPYN1/ref=sr_1_37?dchild=1&keywords=table+lamp&qid=1625720266&sr=8-37
"MEELANA Rechargeable LED Touch On/Off Switch Desk Lamp Children Eye Protection Student Study Reading Dimmer Rechargeable Led Table Lamps USB Charging Touch Dimmer(Desk Lights for Study,White)  ",,,,₹999,₹448,Save ₹551 (55%),4.2 out of 5 stars,14,https://www.amazon.in/MEELANA-Rechargeable-Children-Protection-Charging/dp/B0979N6KJW/ref=sr_1_38?dchild=1&keywords=table+lamp&qid=1625720266&sr=8-38
CHRYSOLITE Rechargeable LED Touch On/Off Switch Desk Lamp Children Eye Protection Student Study Reading Dimmer Rechargeable Led Table Lamps USB Charging Touch Dimmer(Desk Lights for Study)  ,,,,"₹1,599",₹499,"Save ₹1,100 (69%)",5.0 out of 5 stars,1,https://www.amazon.in/CHRYSOLITE-Rechargeable-Desk-Lamp-Protection/dp/B094H3VTX2/ref=sr_1_39?dchild=1&keywords=table+lamp&qid=1625720266&sr=8-39
"OPPLE 3W Reading Light LED Rechargeable Light with Flicker Free Desk Book Lamp (Natural Light, 4000K,White)  ",,,,"₹1,455","₹1,129",Save ₹326 (22%),4.3 out of 5 stars,"1,501",https://www.amazon.in/Reading-Rechargeable-Children-Protection-Student/dp/B07P4F5BBM/ref=sr_1_40?dchild=1&keywords=table+lamp&qid=1625720266&sr=8-40
FIGMENT LED Touch On/Off Switch Desk Lamp Children Eye Protection Student Study Reading Dimmer Rechargeable Led Table Lamps USB Charging Touch Dimmer(Desk Lights for Study) (Off White)  ,,,,,₹549,,5.0 out of 5 stars,60,https://www.amazon.in/FIGMENT-Children-Protection-Rechargeable-Charging/dp/B096NZYRGS/ref=sr_1_41?dchild=1&keywords=table+lamp&qid=1625720266&sr=8-41
BillieJean Matte Black Reading And Studying Table Lamp  ,,,,,₹699,,4.2 out of 5 stars,"1,035",https://www.amazon.in/Wemex-Billie-Reading-Study-Table/dp/B01D2SCZKO/ref=sr_1_42?dchild=1&keywords=table+lamp&qid=1625720266&sr=8-42
"TUCASA Metal Table Lamp , Off White,Pack of 1  ",,,,"₹1,799",₹709,"Save ₹1,090 (61%)",3.9 out of 5 stars,"1,317",https://www.amazon.in/Tucasa-LG-200-Conical-Shade-Table/dp/B00R4C5EVW/ref=sr_1_43?dchild=1&keywords=table+lamp&qid=1625720266&sr=8-43
"VRCT Khadi Shade and Beautiful Table Lamp for Bedroom and Drawing Room (Black,Pack of 1)  ",,,,"₹1,500",₹562,Save ₹938 (63%),3.8 out of 5 stars,204,https://www.amazon.in/VRCT-Khadi-Beautiful-Bedroom-Drawing/dp/B08G8TNB82/ref=sr_1_44?dchild=1&keywords=table+lamp&qid=1625720266&sr=8-44
"SAVAN Plastic Table Lamp, White  ",,,,"₹1,998",₹399,"Save ₹1,599 (80%)",,,https://www.amazon.in/SAVAN-Plastic-Table-Lamp-White/dp/B08T9QL4Q3/ref=sr_1_45?dchild=1&keywords=table+lamp&qid=1625720266&sr=8-45
WEABLE Rechargeable LED Touch On/Off Switch Desk Lamp Children Eye Protection Student Study Reading Dimmer Rechargeable Led Table Lamps USB Charging Touch Dimmer(Desk Lights for Study)(White)  ,,,,"₹1,399",₹499,Save ₹900 (64%),5.0 out of 5 stars,3,https://www.amazon.in/Rechargeable-Children-Protection-Student-Charging/dp/B098MCCRP2/ref=sr_1_46?dchild=1&keywords=table+lamp&qid=1625720266&sr=8-46
"PHILIPS Plastic Table Lamp, White  ",,,,"₹1,499","₹1,209",Save ₹290 (19%),,,https://www.amazon.in/PHILIPS-Plastic-Table-Lamp-White/dp/B096XSGV54/ref=sr_1_47?dchild=1&keywords=table+lamp&qid=1625720266&sr=8-47
"tu casa Metal-Iron Lamp, White,Pack of 1  ",,,,"₹1,350",₹677,Save ₹673 (50%),4.1 out of 5 stars,67,https://www.amazon.in/casa-Ntu-275-Cotton-type-b-22-Included/dp/B08D3ZZNHV/ref=sr_1_48?dchild=1&keywords=table+lamp&qid=1625720266&sr=8-48
D-tone® 20 SMD LED White Light Touch Table Lamp + 3 Grade Dimming (Cool Day/Neutral/Warm-White) with Touch Control/Eyes-Friendly/Rechargeable (1500mAh Battery)  ,,,,"₹1,500",₹399,"Save ₹1,101 (73%)",,,https://www.amazon.in/D-tone%C2%AE-Dimming-Warm-White-Eyes-Friendly-Rechargeable/dp/B0983MDB7G/ref=sr_1_49?dchild=1&keywords=table+lamp&qid=1625720266&sr=8-49
TRUESHOP LED Study Table Lamp with Touch Rechargeable Control Light Touch On/Off Switch Desk Lamp Children Eye Protection Student Study Reading Dimmer LED USB Charging Table Desk Lamp (White)  ,,,,,,,,,https://www.amazon.in/TRUESHOP-Rechargeable-Children-Protection-Charging/dp/B0957QB89N/ref=sr_1_50?dchild=1&keywords=table+lamp&qid=1625720266&sr=8-50
"TRINETRA LED Touch On/Off Switch Desk Lamp/Student Study Reading Dimmer Rechargeable Led Table Lamp(White,Pack of 1)  ",,,,₹999,₹439,Save ₹560 (56%),3.6 out of 5 stars,500,https://www.amazon.in/TRINETRA-Plastic-Table-white-Cable/dp/B08KGV8LRH/ref=sr_1_51?dchild=1&keywords=table+lamp&qid=1625720266&sr=8-51
Azacus Rechargeable LED Touch On/Off Switch Desk Lamp Children Eye Protection Student Study Reading Dimmer Rechargeable Led Table Lamp  ,,,,"₹1,099",₹645,Save ₹454 (41%),4.1 out of 5 stars,336,https://www.amazon.in/Azacus-Rechargeable-Desk-Protection-Light/dp/B07NGG8NCG/ref=sr_1_52?dchild=1&keywords=table+lamp&qid=1625720266&sr=8-52
4 Bulbs LED Vanity Lamp Beauty Makeup Light led Vanity Light Kit Bathroom Mirror Wall Lamp Battery Lampara For Dressing Table  ,,,,₹599,₹399,Save ₹200 (33%),5.0 out of 5 stars,2,https://www.amazon.in/Light-Bathroom-Mirror-Battery-Dressing/dp/B096B2YYWT/ref=sr_1_53?dchild=1&keywords=table+lamp&qid=1625720266&sr=8-53
"zsquarehp Glass Table Lamp, Multicolour, Pack of 1  ",,,,"₹1,299",₹378,Save ₹921 (71%),4.0 out of 5 stars,547,https://www.amazon.in/ZSQUAREHP-Mosaic-Style-Shaped-Multicolour/dp/B07YXG5C7N/ref=sr_1_54?dchild=1&keywords=table+lamp&qid=1625720266&sr=8-54
KAVANA™ Table Lamp for Study Rechargeable /Study Lamp for Study Desk lamp for Study Led Touch Children Dimmer Usb Charging  ,,,,₹699,₹449,Save ₹250 (36%),4.1 out of 5 stars,150,https://www.amazon.in/KAVANATM-Rechargeable-lamp-Children-Charging/dp/B08VD4P7MP/ref=sr_1_55?dchild=1&keywords=table+lamp&qid=1625720266&sr=8-55
"VEHTRI Plastic Desk Lamp, White  ",,,,"₹1,299",₹419,Save ₹880 (68%),4.1 out of 5 stars,23,https://www.amazon.in/VEHTRI-Plastic-Desk-Lamp-White/dp/B0928JJ618/ref=sr_1_56?dchild=1&keywords=table+lamp&qid=1625720266&sr=8-56
"ExclusiveLane Mango Wood Table Lamps, Light Green and Off White, 1 Base, 1 Shade  ",,Sponsored,,"₹1,625",₹999,Save ₹626 (39%),4.1 out of 5 stars,154,https://www.amazon.in/gp/slredirect/picassoRedirect.html/ref=pa_sp_btf_aps_sr_pg1_1?ie=UTF8&adId=A05961753PIZDO6XLR117&url=%2FExclusiveLane-Wooden-Decorative-Living-Table%2Fdp%2FB00G9TESJA%2Fref%3Dsr_1_57_sspa%3Fdchild%3D1%26keywords%3Dtable%2Blamp%26qid%3D1625720266%26sr%3D8-57-spons%26psc%3D1&qualifier=1625720266&id=8887809395581975&widgetName=sp_btf
"ExclusiveLane Mango Wood, Linen Fibre Table Lamp for Living Room Bedroom Bedside Lamp, Brown, Off-White, 1 Piece  ",,Sponsored,,"₹1,810","₹1,358",Save ₹452 (25%),4.2 out of 5 stars,33,https://www.amazon.in/gp/slredirect/picassoRedirect.html/ref=pa_sp_btf_aps_sr_pg1_1?ie=UTF8&adId=A05965751Y9WDD1CWEAYQ&url=%2FExclusiveLane-Decorative-Bedroom-Decoration-Bedside%2Fdp%2FB085W6DWWK%2Fref%3Dsr_1_58_sspa%3Fdchild%3D1%26keywords%3Dtable%2Blamp%26qid%3D1625720266%26sr%3D8-58-spons%26psc%3D1&qualifier=1625720266&id=8887809395581975&widgetName=sp_btf
KAPOOR E-ILLUMINATIONS Groove Hersey Pure Brass Table Lamp  ,,Sponsored,,,,,,,https://www.amazon.in/gp/slredirect/picassoRedirect.html/ref=pa_sp_btf_aps_sr_pg1_1?ie=UTF8&adId=A0302745XHUARY3PUN3J&url=%2FKAPOOR-ILLUMINATIONS-Groove-Hersey-Brass%2Fdp%2FB085FRFFZQ%2Fref%3Dsr_1_59_sspa%3Fdchild%3D1%26keywords%3Dtable%2Blamp%26qid%3D1625720266%26sr%3D8-59-spons%26psc%3D1&qualifier=1625720266&id=8887809395581975&widgetName=sp_btf
"OPPLE 5W Led Desk Lamp, Flicker Free Table Lamp, Study Lamps, Rechargable & Long Battery Backup, 3 Levels Brightness Mode, Touch Control (White, Pack of 1)  ",,Sponsored,,"₹1,500","₹1,499",Save ₹1,4.4 out of 5 stars,759,https://www.amazon.in/gp/slredirect/picassoRedirect.html/ref=pa_sp_btf_aps_sr_pg1_1?ie=UTF8&adId=A0570988ZZ8GGL7XD7O9&url=%2FReading-Rechargeable-Children-Protection-Student%2Fdp%2FB07NYVY9S8%2Fref%3Dsr_1_60_sspa%3Fdchild%3D1%26keywords%3Dtable%2Blamp%26qid%3D1625720266%26sr%3D8-60-spons%26psc%3D1&qualifier=1625720266&id=8887809395581975&widgetName=sp_btf
"Homesake Table Lamp Farmhouse Night Light Lamps for Bedroom, Table Light Decoration Bedside Living Room, Hall Lighting, Home Decor Items with Light Bulb, Diamond, Jute  ",,Sponsored,,"₹5,000","₹1,599","Save ₹3,401 (68%)",4.5 out of 5 stars,10,https://www.amazon.in/gp/slredirect/picassoRedirect.html/ref=pa_sp_atf_next_aps_sr_pg2_1?ie=UTF8&adId=A07374731SO3RBGVZ7BN5&url=%2FHomesake-Farmhouse-Bedroom-Decoration-Lighting%2Fdp%2FB0936NL6P8%2Fref%3Dsr_1_49_sspa%3Fdchild%3D1%26keywords%3Dtable%2Blamp%26qid%3D1625720288%26sr%3D8-49-spons%26psc%3D1&qualifier=1625720288&id=2646153739525307&widgetName=sp_atf_next
"Hopdezyo Wooden Floor Lamp with Jute Shade, Standard Size Metal Base Decorative Tripod Lamp for Bedroom, Living Room, Office & Home Decor Items (Bulb Included)  ",,Sponsored,,"₹6,000","₹1,240","Save ₹4,760 (79%)",5.0 out of 5 stars,1,https://www.amazon.in/gp/slredirect/picassoRedirect.html/ref=pa_sp_atf_next_aps_sr_pg2_1?ie=UTF8&adId=A09235391WY18B4OSKUKT&url=%2FHopdezyo-Standard-Decorative-Bedroom-Included%2Fdp%2FB09774F1LG%2Fref%3Dsr_1_50_sspa%3Fdchild%3D1%26keywords%3Dtable%2Blamp%26qid%3D1625720288%26sr%3D8-50-spons%26psc%3D1&qualifier=1625720288&id=2646153739525307&widgetName=sp_atf_next
"Wipro Garnet ABS 6w Led Table Lamp - 3 Grade Dimming and Color Changing (Cool Day Light/Neutral White/Warm White), Pack of 1  ",,Sponsored,,"₹1,500","₹1,319",Save ₹181 (12%),4.5 out of 5 stars,"10,405",https://www.amazon.in/gp/slredirect/picassoRedirect.html/ref=pa_sp_atf_next_aps_sr_pg2_1?ie=UTF8&adId=A0760026O88ADXT8P3LO&url=%2FWipro-Garnet-dimming-Changing-Neutral%2Fdp%2FB07C9KQ7KR%2Fref%3Dsr_1_51_sspa%3Fdchild%3D1%26keywords%3Dtable%2Blamp%26qid%3D1625720288%26sr%3D8-51-spons%26psc%3D1&qualifier=1625720288&id=2646153739525307&widgetName=sp_atf_next
"RUilY ABS,PP Balance Lamp, Black, Pack of 1  ",,Sponsored,,"₹5,000","₹2,499","Save ₹2,501 (50%)",4.5 out of 5 stars,227,https://www.amazon.in/gp/slredirect/picassoRedirect.html/ref=pa_sp_atf_next_aps_sr_pg2_1?ie=UTF8&adId=A047759315XI2L2YAJTVY&url=%2FRUilY%25C2%25AE-Balance-Magnetic-Bedroom-Office%2Fdp%2FB083NTMHRT%2Fref%3Dsr_1_52_sspa%3Fdchild%3D1%26keywords%3Dtable%2Blamp%26qid%3D1625720288%26sr%3D8-52-spons%26psc%3D1&qualifier=1625720288&id=2646153739525307&widgetName=sp_atf_next
"Pick Ur Needs® Chargeable Desk Lamp With Organizer, Phone Holder, Night Light, Pin Stand Table Lamp for Dorm Room Study Desk, 2200mAh Battery Operated (Pen + Mobile + Drewer + Rounded)( Color - White )  ",,,,"₹1,295",₹699,Save ₹596 (46%),4.2 out of 5 stars,210,https://www.amazon.in/Pick-Ur-Chargeable-Organizer-Operated/dp/B08VH9Q933/ref=sr_1_53?dchild=1&keywords=table+lamp&qid=1625720288&sr=8-53
"Home Centre Ceramic Table Lamp, Peach, 1 Piece  ",,,,,₹499,,4.1 out of 5 stars,27,https://www.amazon.in/Home-Centre-Ambrose-Corienth-Solid/dp/B08BQVC1YK/ref=sr_1_54?dchild=1&keywords=table+lamp&qid=1625720288&sr=8-54
"CREATIVE COLLECTION LED Desk Lamp with Flexible Goose Neck, Battery Operated Table Lamp for Study, Office, Bedroom  ",,,,₹599,₹499,Save ₹100 (17%),,,https://www.amazon.in/CREATIVE-COLLECTION-Flexible-Battery-Operated/dp/B09794GZ1Z/ref=sr_1_55?dchild=1&keywords=table+lamp&qid=1625720288&sr=8-55
"Portable Flexible USB LED Light Lamp, Multicolour, Small (USB-LED-LAMP)(Pack of 1)  ",Best seller,,,,₹39,,3.9 out of 5 stars,672,https://www.amazon.in/gp/bestsellers/kitchen/1380508031/ref=sr_bs_7_1380508031_1
"ESN 999 Plastic Table Lamp, Black  ",,,,₹899,₹349,Save ₹550 (61%),3.9 out of 5 stars,966,https://www.amazon.in/ESN-999-pp-1269-5-Watt-Table/dp/B01FXQVTJ6/ref=sr_1_57?dchild=1&keywords=table+lamp&qid=1625720288&sr=8-57
"G-KAMP JAPAN® Cute Cartoon LED Reading Light Pen Holder Pencil Sharpener Eye Protection Night Light for Student Study Office Mini Table Lamp (Piggy Blue, Pack of 1)  ",,,,₹999,₹499,Save ₹500 (50%),4.1 out of 5 stars,7,https://www.amazon.in/G-KAMP-Cartoon-Reading-Sharpener-Protection/dp/B096RSD5WB/ref=sr_1_58?dchild=1&keywords=table+lamp&qid=1625720288&sr=8-58
Azacus Rechargeable Led Study lamp Touch on/Off Switch Children Eye Protection Student Study Reading dimmer Table Lamps USB Charging Touch dimmer  ,,,,"₹1,499",₹625,Save ₹874 (58%),4.0 out of 5 stars,61,https://www.amazon.in/Azacus-Plastic-Shades-Control-Advanced/dp/B07P8RV5DS/ref=sr_1_49?dchild=1&keywords=table+lamp&qid=1625720288&sr=8-49
