name,badge_1,badge_2,badge_3,mrp,discounted_price,discount,rating,rating_count,link
"Wipro Garnet ABS 6w Led Table Lamp - 3 Grade Dimming and Color Changing (Cool Day Light/Neutral White/Warm White), Pack of 1  ",,Sponsored,,"₹1,500","₹1,331",Save ₹169 (11%),4.5 out of 5 stars,"10,758",https://www.amazon.in/gp/slredirect/picassoRedirect.html/ref=pa_sp_atf_aps_sr_pg1_1?ie=UTF8&adId=A0760026O88ADXT8P3LO&url=%2FWipro-Garnet-dimming-Changing-Neutral%2Fdp%2FB07C9KQ7KR%2Fref%3Dsr_1_1_sspa%3Fdchild%3D1%26keywords%3Dtable%2Blamp%26qid%3D1626667705%26sr%3D8-1-spons%26psc%3D1&qualifier=1626667705&id=192831797163896&widgetName=sp_atf
"Wipro 5W LED Table Lamp with Smooth Dimming, Use as Emergency Light with Power Bank or with Laptop USB Port  ",,Sponsored,,"₹1,290",₹619,Save ₹671 (52%),4.2 out of 5 stars,184,https://www.amazon.in/gp/slredirect/picassoRedirect.html/ref=pa_sp_atf_aps_sr_pg1_1?ie=UTF8&adId=A073758513DV3RB5CK5O1&url=%2FWipro-Table-Dimmable-Feature-White%2Fdp%2FB08LLY5R9T%2Fref%3Dsr_1_2_sspa%3Fdchild%3D1%26keywords%3Dtable%2Blamp%26qid%3D1626667705%26sr%3D8-2-spons%26psc%3D1&qualifier=1626667705&id=192831797163896&widgetName=sp_atf
Azacus Rechargeable LED Touch On/Off Switch Desk Lamp Children Eye Protection Student Study Reading Dimmer Rechargeable Led Table Lamp  ,,Sponsored,,"₹1,099",₹645,Save ₹454 (41%),4.2 out of 5 stars,361,https://www.amazon.in/gp/slredirect/picassoRedirect.html/ref=pa_sp_atf_aps_sr_pg1_1?ie=UTF8&adId=A027016439QVJ0WK0F6Y6&url=%2FAzacus-Rechargeable-Desk-Protection-Light%2Fdp%2FB07NGG8NCG%2Fref%3Dsr_1_3_sspa%3Fdchild%3D1%26keywords%3Dtable%2Blamp%26qid%3D1626667705%26sr%3D8-3-spons%26psc%3D1&qualifier=1626667705&id=192831797163896&widgetName=sp_atf
Azacus Study Lamp Rechargeable LED Touch On/Off Switch Desk Lamp Children Eye Protection Student Study Reading Dimmer Rechargeable Led Table Lamps USB Charging Touch Dimmer  ,,Sponsored,,"₹1,499",₹599,Save ₹900 (60%),4.7 out of 5 stars,5,https://www.amazon.in/gp/slredirect/picassoRedirect.html/ref=pa_sp_atf_aps_sr_pg1_1?ie=UTF8&adId=A00125846FKM0CM4FU6W&url=%2FAzacus-Study-Light-Shades-Control%2Fdp%2FB07P9SZBCX%2Fref%3Dsr_1_4_sspa%3Fdchild%3D1%26keywords%3Dtable%2Blamp%26qid%3D1626667705%26sr%3D8-4-spons%26psc%3D1&qualifier=1626667705&id=192831797163896&widgetName=sp_atf
"Wipro Garnet ABS 6w Led Table Lamp - 3 Grade Dimming and Color Changing (Cool Day Light/Neutral White/Warm White), Pack of 1  ",,,,"₹1,500","₹1,331",Save ₹169 (11%),4.5 out of 5 stars,"10,758",https://www.amazon.in/Wipro-Garnet-dimming-Changing-Neutral/dp/B07C9KQ7KR/ref=sr_1_5?dchild=1&keywords=table+lamp&qid=1626667705&sr=8-5
PRIMESKY® Study lamp Rechargeable Led Touch On Off Switch Student Study Reading Dimmer Led Table Lamps White Desk Light lamp  ,Amazon's Choice,,,₹999,₹498,Save ₹501 (50%),4.2 out of 5 stars,225,https://www.amazon.in/PRIMESKY%C2%AE-Rechargeable-Switch-Student-Reading/dp/B0966KGV2T/ref=ice_ac_b_dpb?dchild=1&keywords=table+lamp&qid=1626667705&sr=8-6
"PHILIPS Plastic LED Desk light, White,Pack of 1  ",,,,"₹1,200",₹679,Save ₹521 (43%),4.4 out of 5 stars,"8,961",https://www.amazon.in/Philips-61013-Breeze-5-Watt-light/dp/B016VYB624/ref=sr_1_7?dchild=1&keywords=table+lamp&qid=1626667705&sr=8-7
Wooum Rechargeable led Touch On Off Switch Desk Table Lamp with Mobile Holder Touch Switch 3 Modes LED Lights Stundent Eye Protection (White)  ,,,,"₹1,499",₹599,Save ₹900 (60%),3.9 out of 5 stars,"1,441",https://www.amazon.in/SaleOnTM-Rechargeable-Children-Protection-Charging/dp/B07MBQGWBN/ref=sr_1_8?dchild=1&keywords=table+lamp&qid=1626667705&sr=8-8
"Wipro 5W LED Table Lamp with Smooth Dimming, Use as Emergency Light with Power Bank or with Laptop USB Port  ",,,,"₹1,290",₹619,Save ₹671 (52%),4.2 out of 5 stars,184,https://www.amazon.in/Wipro-Table-Dimmable-Feature-White/dp/B08LLY5R9T/ref=sr_1_9?dchild=1&keywords=table+lamp&qid=1626667705&sr=8-9
"ESN 999 Plastic Table Lamp With Attached Pen Stand, Black  ",,,,₹899,₹304,Save ₹595 (66%),4.1 out of 5 stars,321,https://www.amazon.in/ESN-999-Plastic-Table-Attached/dp/B08WCM9Q2H/ref=sr_1_10?dchild=1&keywords=table+lamp&qid=1626667705&sr=8-10
Pick Ur Needs® Touch On/Off Study Table Lamp (Color White)  ,,,,"₹1,260",₹699,Save ₹561 (45%),4.1 out of 5 stars,"1,490",https://www.amazon.in/Pick-Ur-Rechargeable-Children-Protection/dp/B08L4335ZX/ref=sr_1_11?dchild=1&keywords=table+lamp&qid=1626667705&sr=8-11
RUCON™ Study lamp Rechargeable Led Touch On Off Switch Student Study Reading Dimmer Led Table Lamps White Desk Light lamp  ,,,,₹999,₹425,Save ₹574 (57%),4.1 out of 5 stars,59,https://www.amazon.in/RUCONTM-Rechargeable-Switch-Student-Reading/dp/B097T6GSTG/ref=sr_1_12?dchild=1&keywords=table+lamp&qid=1626667705&sr=8-12
"Priza Plastic Table Lamp, Multicolour, Pack of 1  ",,,,"₹1,299",₹649,Save ₹650 (50%),4.1 out of 5 stars,143,https://www.amazon.in/Priza-Bedroom-Charging-Control-Brightness/dp/B08Q8RLRQ9/ref=sr_1_13?dchild=1&keywords=table+lamp&qid=1626667705&sr=8-13
D-tone® 20 LED Touch Table Lamp + 8 LED with 3 Grade Dimming (Cool Day/Neutral/Warm-Yellow) with Drawers/Pen-Phone Holder/Rechargeable 2500mAh Battery (12Hrs Operating Time)  ,,,,"₹1,500",₹639,Save ₹861 (57%),4.4 out of 5 stars,14,https://www.amazon.in/D-tone%C2%AE-Warm-Yellow-Pen-Phone-Rechargeable-Operating/dp/B096XVNBBR/ref=sr_1_14?dchild=1&keywords=table+lamp&qid=1626667705&sr=8-14
"ESN 999 Metal Table Lamp, Black, Pack of 1  ",,,,₹899,₹305,Save ₹594 (66%),4.0 out of 5 stars,"2,324",https://www.amazon.in/ESN-999-Flexible-Electric-Attached/dp/B07PDQMZ7G/ref=sr_1_15?dchild=1&keywords=table+lamp&qid=1626667705&sr=8-15
"KWT Rechargeable LED Touch On/Off Switch Desk Lamp Children Eye Protection Student Study Reading Dimmer Rechargeable Led Table Lamps USB Charging Touch Dimmer, Desk Lights for Study (White)  ",,,,₹999,₹549,Save ₹450 (45%),5.0 out of 5 stars,85,https://www.amazon.in/KWT-Rechargeable-Children-Protection-Charging/dp/B097HCT5CN/ref=sr_1_16?dchild=1&keywords=table+lamp&qid=1626667705&sr=8-16
RYLAN Rechargeable LED Touch On/Off Switch Desk Lamp Children Eye Protection Student Study Reading Dimmer Rechargeable Led Table Lamps USB Charging Touch Dimmer(Desk Lights for Study)*  ,,,,"₹1,299",₹549,Save ₹750 (58%),4.9 out of 5 stars,37,https://www.amazon.in/Rechargeable-Desk-Children-Protection-Charging/dp/B098M93SQM/ref=sr_1_17?dchild=1&keywords=table+lamp&qid=1626667705&sr=8-17
ZENSTOE™ Rechargeable LED Touch On/Off Switch Desk Table Lamp USB Charging Student Study Reading Touch Dimmer for Eye Protection (White)  ,,,,₹799,₹444,Save ₹355 (44%),2.0 out of 5 stars,2,https://www.amazon.in/ZENSTOETM-Rechargeable-Charging-Student-Protection/dp/B098HXKZHW/ref=sr_1_18?dchild=1&keywords=table+lamp&qid=1626667705&sr=8-18
"J S Mart Rechargeable Touch On Off Switch dimmer led Desk Light or lamp for Study, Desk Light for Reading, for Laptop,Computer Table Multi Color Pack of 1  ",,,,₹999,₹449,Save ₹550 (55%),5.0 out of 5 stars,6,https://www.amazon.in/Rechargeable-Switch-dimmer-Reading-Computer/dp/B0986ZH7S1/ref=sr_1_19?dchild=1&keywords=table+lamp&qid=1626667705&sr=8-19
Oblivion Portable LED Reading Light Adjustable Dimmable Touch Control Desk Lamp  ,,,,₹349,₹220,Save ₹129 (37%),3.0 out of 5 stars,1,https://www.amazon.in/Oblivion-Portable-Reading-Adjustable-Dimmable/dp/B096BDWQPC/ref=sr_1_20?dchild=1&keywords=table+lamp&qid=1626667705&sr=8-20
"Wooden Basket Himalayan Rock Salt Lamp for Positive Energy, Vastu, Healing, Harmony, Purification, Best Wellness  ",,Sponsored,,"₹2,000","₹1,345",Save ₹655 (33%),,,https://www.amazon.in/gp/slredirect/picassoRedirect.html/ref=pa_sp_mtf_aps_sr_pg1_1?ie=UTF8&adId=A10042241ZUWBG99LHGOO&url=%2FHimalayan-Positive-Healing-Purification-Wellness%2Fdp%2FB0974Z8LD9%2Fref%3Dsr_1_21_sspa%3Fdchild%3D1%26keywords%3Dtable%2Blamp%26qid%3D1626667705%26sr%3D8-21-spons%26psc%3D1&qualifier=1626667705&id=192831797163896&widgetName=sp_mtf
"RUilY ABS,PP Balance Lamp, Black, Pack of 1  ",,Sponsored,,"₹5,000","₹2,499","Save ₹2,501 (50%)",4.4 out of 5 stars,236,https://www.amazon.in/gp/slredirect/picassoRedirect.html/ref=pa_sp_mtf_aps_sr_pg1_1?ie=UTF8&adId=A047759315XI2L2YAJTVY&url=%2FRUilY%25C2%25AE-Balance-Magnetic-Bedroom-Office%2Fdp%2FB083NTMHRT%2Fref%3Dsr_1_22_sspa%3Fdchild%3D1%26keywords%3Dtable%2Blamp%26qid%3D1626667705%26sr%3D8-22-spons%26psc%3D1&qualifier=1626667705&id=192831797163896&widgetName=sp_mtf
Azacus Rechargeable Led Study lamp Touch on/Off Switch Children Eye Protection Student Study Reading dimmer Table Lamps USB Charging Touch dimmer  ,,Sponsored,,"₹1,499",₹649,Save ₹850 (57%),4.0 out of 5 stars,72,https://www.amazon.in/gp/slredirect/picassoRedirect.html/ref=pa_sp_mtf_aps_sr_pg1_1?ie=UTF8&adId=A0324411E99N4J9BU5FP&url=%2FAzacus-Plastic-Shades-Control-Advanced%2Fdp%2FB07P8RV5DS%2Fref%3Dsr_1_23_sspa%3Fdchild%3D1%26keywords%3Dtable%2Blamp%26qid%3D1626667705%26sr%3D8-23-spons%26psc%3D1&qualifier=1626667705&id=192831797163896&widgetName=sp_mtf
"Pink Himalayan Rock Salt Lamp (3-5Kg) with Wooden Base and Bulb, for Home Decor and Gifting by HaveRaw  ",,Sponsored,,"₹2,799","₹2,499",Save ₹300 (11%),,,https://www.amazon.in/gp/slredirect/picassoRedirect.html/ref=pa_sp_mtf_aps_sr_pg1_1?ie=UTF8&adId=A06469292A3PPA8L1PIPF&url=%2FHimalayan-3-5Kg-Wooden-Gifting-HaveRaw%2Fdp%2FB093LDP9H5%2Fref%3Dsr_1_24_sspa%3Fdchild%3D1%26keywords%3Dtable%2Blamp%26qid%3D1626667705%26sr%3D8-24-spons%26psc%3D1&qualifier=1626667705&id=192831797163896&widgetName=sp_mtf
"VRCT Khadi Shade and Beautiful Table Lamp for Bedroom and Drawing Room (Black,Pack of 1)  ",,,,"₹1,900",₹575,"Save ₹1,325 (70%)",3.8 out of 5 stars,219,https://www.amazon.in/VRCT-Khadi-Beautiful-Bedroom-Drawing/dp/B08G8TNB82/ref=sr_1_25?dchild=1&keywords=table+lamp&qid=1626667705&sr=8-25
"E-COSMOS for Portable Flexible USB LED Light Lamp, Multicolour, Small (USB-LED-LAMP)  ",Best seller,,,,₹39,,3.9 out of 5 stars,"1,202",https://www.amazon.in/gp/bestsellers/industrial/7355875031/ref=sr_bs_25_7355875031_1
Paxmore Rechargeable Desk/Study Lamp Touch On/Off Switch Desk Table Lamp/Mobile Holder Office Desk lamp Touch Dimmer Children Eye Safety Protection - White  ,,,,₹999,₹675,Save ₹324 (32%),4.2 out of 5 stars,"1,671",https://www.amazon.in/PaxMore-Rechargeable-Children-Protection-Charging/dp/B08DNS7Y9J/ref=sr_1_27?dchild=1&keywords=table+lamp&qid=1626667705&sr=8-27
"ESN 999 Table Lamp, Red, Pack of 1  ",,,,₹899,₹305,Save ₹594 (66%),4.0 out of 5 stars,"2,084",https://www.amazon.in/ESN-999-Flexible-Electric-Attached/dp/B07QC5YT69/ref=sr_1_28?dchild=1&keywords=table+lamp&qid=1626667705&sr=8-28
D-tone® 19 LED Touch Table Lamp with Rechargeable 1200mAh Battery (12Hrs Operating Time)  ,,,,"₹1,250",₹529,Save ₹721 (58%),5.0 out of 5 stars,3,https://www.amazon.in/D-tone%C2%AE-Rechargeable-1200mAh-Battery-Operating/dp/B09736J4YQ/ref=sr_1_29?dchild=1&keywords=table+lamp&qid=1626667705&sr=8-29
"ESN 999 Aluminium Lamp, Black  ",,,,₹899,₹525,Save ₹374 (42%),4.0 out of 5 stars,366,https://www.amazon.in/ESN-999-Electric-Flexible-Office/dp/B08DBHJ7GQ/ref=sr_1_30?dchild=1&keywords=table+lamp&qid=1626667705&sr=8-30
"EDGE Plastic Desk/Table Lamp, White  ",,,,₹899,₹379,Save ₹520 (58%),3.9 out of 5 stars,134,https://www.amazon.in/EDGE-Plastic-Desk-Table-White/dp/B0913JPYN1/ref=sr_1_31?dchild=1&keywords=table+lamp&qid=1626667705&sr=8-31
"Wipro 6W LED Table Lamp-3 Grade Dimming and Ambience Lighting (6 color options,White,Pack of 1)  ",,,,"₹2,250","₹1,449",Save ₹801 (36%),4.3 out of 5 stars,"2,672",https://www.amazon.in/Wipro-6W-Deco-Table-Lamp/dp/B07TQTSQZ9/ref=sr_1_32?dchild=1&keywords=table+lamp&qid=1626667705&sr=8-32
Bulfyss USB Flexible Reading LED Light Clip-on Beside Bed Table Desk Lamp (Black).  ,,,,₹999,₹499,Save ₹500 (50%),4.2 out of 5 stars,108,https://www.amazon.in/Bulfyss-Flexible-Reading-Light-Beside/dp/B0941YXMNR/ref=sr_1_33?dchild=1&keywords=table+lamp&qid=1626667705&sr=8-33
KAVANA Rechargeable Desk/Study Lamp Touch On/Off Switch Desk Table Lamp with Mobile Holder Office Desk lamp Touch Dimmer Childeren Eye Safety Protection (White) (Desk 9998)  ,,,,₹999,₹599,Save ₹400 (40%),5.0 out of 5 stars,1,https://www.amazon.in/KAVANA-Rechargeable-Switch-Childeren-Protection/dp/B096Y6F5XZ/ref=sr_1_34?dchild=1&keywords=table+lamp&qid=1626667705&sr=8-34
"SAVAN Plastic Table Lamp, White  ",,,,"₹1,998",₹399,"Save ₹1,599 (80%)",3.0 out of 5 stars,1,https://www.amazon.in/SAVAN-Plastic-Table-Lamp-White/dp/B08T9QL4Q3/ref=sr_1_35?dchild=1&keywords=table+lamp&qid=1626667705&sr=8-35
SaleOn Rechargeable Desk/Study Lamp Touch On/Off Switch Desk Table Lamp with Mobile Holder Office Desk lamp Touch Dimmer Childeren Eye Safety Protection (White)  ,,,,"₹1,499",₹599,Save ₹900 (60%),4.1 out of 5 stars,"1,194",https://www.amazon.in/SaleOnTM-Rechargeable-Children-Protection-Charging/dp/B07MFB17DV/ref=sr_1_36?dchild=1&keywords=table+lamp&qid=1626667705&sr=8-36
TECHTOP Smart Study Desk/Table Led lamp with Touch Rechargeable Control Light Touch On/Off Switch Desk Lamp Children Eye Protection Student Study Reading Dimmer  ,,,,₹899,₹369,Save ₹530 (59%),5.0 out of 5 stars,1,https://www.amazon.in/TECHTOP-Rechargeable-Control-Children-Protection/dp/B098WPD1MZ/ref=sr_1_37?dchild=1&keywords=table+lamp&qid=1626667705&sr=8-37
"TUCASA Metal Table Lamp , Off White,Pack of 1  ",,,,"₹1,799",₹709,"Save ₹1,090 (61%)",3.9 out of 5 stars,"1,368",https://www.amazon.in/Tucasa-LG-200-Conical-Shade-Table/dp/B00R4C5EVW/ref=sr_1_38?dchild=1&keywords=table+lamp&qid=1626667705&sr=8-38
BillieJean Matte Black Reading And Studying Table Lamp  ,,,,₹999,₹699,Save ₹300 (30%),4.2 out of 5 stars,"1,080",https://www.amazon.in/Wemex-Billie-Reading-Study-Table/dp/B01D2SCZKO/ref=sr_1_39?dchild=1&keywords=table+lamp&qid=1626667705&sr=8-39
Table Lamp/Study Lamp (White)  ,,,,₹999,₹325,Save ₹674 (67%),,,https://www.amazon.in/Table-Lamp-Study-White/dp/B098DN5NSK/ref=sr_1_40?dchild=1&keywords=table+lamp&qid=1626667705&sr=8-40
Eleven Mart® Rechargeable LED Touch On/Off Switch Desk Lamp Children Eye Protection Student Study Reading Dimmer Rechargeable Led Table Lamps USB Charging Touch Dimmer (Desk Light)  ,,,,₹999,₹445,Save ₹554 (55%),5.0 out of 5 stars,32,https://www.amazon.in/Eleven-Rechargeable-Children-Protection-Charging/dp/B098L9ZF7T/ref=sr_1_41?dchild=1&keywords=table+lamp&qid=1626667705&sr=8-41
"Pick Ur Needs® Chargeable Desk Lamp With Organizer, Phone Holder, Night Light, Pin Stand Table Lamp for Dorm Room Study Desk, 2200mAh Battery Operated (Pen + Mobile + Drewer + Rounded)( Color - White )  ",,,,"₹1,295",₹699,Save ₹596 (46%),4.2 out of 5 stars,249,https://www.amazon.in/Pick-Ur-Chargeable-Organizer-Operated/dp/B08VH9Q933/ref=sr_1_42?dchild=1&keywords=table+lamp&qid=1626667705&sr=8-42
"Home Centre Ceramic Table Lamp, Peach, 1 Piece  ",,,Only 1 left in stock.,,₹499,,4.1 out of 5 stars,31,https://www.amazon.in/Home-Centre-Ambrose-Corienth-Solid/dp/B08BQVC1YK/ref=sr_1_43?dchild=1&keywords=table+lamp&qid=1626667705&sr=8-43
"TRINETRA LED Touch On/Off Switch Desk Lamp/Student Study Reading Dimmer Rechargeable Led Table Lamp(White,Pack of 1)  ",,,,₹999,₹399,Save ₹600 (60%),3.6 out of 5 stars,544,https://www.amazon.in/TRINETRA-Plastic-Table-white-Cable/dp/B08KGV8LRH/ref=sr_1_44?dchild=1&keywords=table+lamp&qid=1626667705&sr=8-44
TECHTOP Student Study Desk/Table Lamp Led lamp with Touch Rechargeable Control Light Touch On/Off Switch Desk Lamp Children Eye Protection Student Study Reading Dimmer  ,,,,₹899,₹369,Save ₹530 (59%),,,https://www.amazon.in/TECHTOP-Student-Rechargeable-Children-Protection/dp/B098ZCMYM2/ref=sr_1_45?dchild=1&keywords=table+lamp&qid=1626667705&sr=8-45
"tu casa Metal Iron Table Lamp, White, Off White  ",,,,"₹1,150",₹744,Save ₹406 (35%),3.7 out of 5 stars,80,https://www.amazon.in/Ntu-42-Cotton-casa-Holder-Included/dp/B08D44Q3QB/ref=sr_1_46?dchild=1&keywords=table+lamp&qid=1626667705&sr=8-46
KBZONE Rechargeable LED Touch On/Off Switch Desk Lamp Children Eye Protection Student Study Reading Dimmer Rechargeable Led Table Lamps USB Charging Touch Dimmer(Desk Lights for Study)  ,,,,"₹1,299",₹429,Save ₹870 (67%),,,https://www.amazon.in/KBZONE-Rechargeable-Children-Protection-Charging/dp/B0999HYWX4/ref=sr_1_47?dchild=1&keywords=table+lamp&qid=1626667705&sr=8-47
Azacus Rechargeable LED Touch On/Off Switch Desk Lamp Children Eye Protection Student Study Reading Dimmer Rechargeable Led Table Lamp  ,,,,"₹1,099",₹645,Save ₹454 (41%),4.2 out of 5 stars,361,https://www.amazon.in/Azacus-Rechargeable-Desk-Protection-Light/dp/B07NGG8NCG/ref=sr_1_48?dchild=1&keywords=table+lamp&qid=1626667705&sr=8-48
MEELANA Study lamp Rechargeable Led Touch On Off Switch Student Study Reading Dimmer Led Table Lamps (White Desk Light lamp)  ,,,,₹999,₹438,Save ₹561 (56%),3.1 out of 5 stars,21,https://www.amazon.in/MEELANA-Rechargeable-Switch-Student-Reading/dp/B0979N6KJW/ref=sr_1_49?dchild=1&keywords=table+lamp&qid=1626667705&sr=8-49
Anand Souvenir Rechargeable Led Study Table Lamp/Desk Lamp Dimmer Modes with Clip Stand 360° Flexible Night Study Lamp for Bedroom and Office  ,,,,₹999,₹549,Save ₹450 (45%),3.8 out of 5 stars,268,https://www.amazon.in/Anand-Souvenir-Children-Protection-Non-Rechargeable/dp/B08BYFWBZM/ref=sr_1_50?dchild=1&keywords=table+lamp&qid=1626667705&sr=8-50
Spectrum Multi-Function Lithium Battery led Table lamp with Pen Holder Blue (Multicolor)  ,,,,₹999,₹732,Save ₹267 (27%),3.9 out of 5 stars,34,https://www.amazon.in/Spectrum-Multi-Function-Lithium-Battery-Multicolor/dp/B08G4VFKN9/ref=sr_1_51?dchild=1&keywords=table+lamp&qid=1626667705&sr=8-51
"OPPLE 3W Reading Light LED Rechargeable Light with Flicker Free Desk Book Lamp (Natural Light, 4000K,White)  ",,,,"₹1,455","₹1,299",Save ₹156 (11%),4.3 out of 5 stars,"1,601",https://www.amazon.in/Reading-Rechargeable-Children-Protection-Student/dp/B07P4F5BBM/ref=sr_1_52?dchild=1&keywords=table+lamp&qid=1626667705&sr=8-52
KAVANA™ Table Lamp for Study Rechargeable /Study Lamp for Study Desk lamp for Study Led Touch Children Dimmer Usb Charging  ,,,,₹699,₹449,Save ₹250 (36%),4.1 out of 5 stars,168,https://www.amazon.in/KAVANATM-Rechargeable-lamp-Children-Charging/dp/B08VD4P7MP/ref=sr_1_53?dchild=1&keywords=table+lamp&qid=1626667705&sr=8-53
BELLADOR™ Combo { 1 Desk Light & 2 USB Light } Rechargeable LED Touch On/Off Switch Desk Lamp Children Eye Protection Student Study Reading Dimmer Rechargeable Led Table Lamps USB Charging Touch Dimme  ,,,,₹699,₹449,Save ₹250 (36%),,,https://www.amazon.in/BELLADORTM-Rechargeable-Children-Protection-Charging/dp/B097RYTR5W/ref=sr_1_54?dchild=1&keywords=table+lamp&qid=1626667705&sr=8-54
Garth Portable LED Reading Light Adjustable Dimmable Touch Control Desk Lamp  ,,,,₹299,₹189,Save ₹110 (37%),,,https://www.amazon.in/Garth-Portable-Reading-Adjustable-Dimmable/dp/B098XN4QCR/ref=sr_1_55?dchild=1&keywords=table+lamp&qid=1626667705&sr=8-55
Damarion Rechargeable LED Touch On/Off Switch Desk Lamp Children Eye Protection Student Study Reading Dimmer Rechargeable Led Table Lamps USB Charging Touch Dimmer(Pack of 1)(Medium)  ,,,,₹999,₹449,Save ₹550 (55%),5.0 out of 5 stars,1,https://www.amazon.in/Damarion-Rechargeable-Children-Protection-Charging/dp/B098LP3HW8/ref=sr_1_56?dchild=1&keywords=table+lamp&qid=1626667705&sr=8-56
"Homesake Ceramic Table Lamp with Shade, Off-White  ",Best seller,Sponsored,,"₹2,800","₹1,850",Save ₹950 (34%),4.5 out of 5 stars,414,https://www.amazon.in/gp/bestsellers/kitchen/1380486031/ref=sr_bs_56_1380486031_1
"@home By Nilkamal Venus Mango Wood 14 inch Table Lamp for Home Decoration Without Bulb (Beige, Brown), Medium, (15 cm x 15 cm x 36.5 cm)  ",,Sponsored,,"₹1,999",₹874,"Save ₹1,125 (56%)",4.3 out of 5 stars,24,https://www.amazon.in/gp/slredirect/picassoRedirect.html/ref=pa_sp_btf_aps_sr_pg1_1?ie=UTF8&adId=A00040573PGCBH0GDN3ER&url=%2Fhome-Nilkamal-Decoration-Without-Medium%2Fdp%2FB08XXZKZ5M%2Fref%3Dsr_1_58_sspa%3Fdchild%3D1%26keywords%3Dtable%2Blamp%26qid%3D1626667705%26sr%3D8-58-spons%26psc%3D1&qualifier=1626667705&id=192831797163896&widgetName=sp_btf
"OPPLE 3W Reading Light LED Rechargeable Light with Flicker Free Desk Book Lamp (Natural Light, 4000K,White)  ",,Sponsored,,"₹1,455","₹1,299",Save ₹156 (11%),4.3 out of 5 stars,"1,601",https://www.amazon.in/gp/slredirect/picassoRedirect.html/ref=pa_sp_btf_aps_sr_pg1_1?ie=UTF8&adId=A07287343740XUNQ1A2X3&url=%2FReading-Rechargeable-Children-Protection-Student%2Fdp%2FB07P4F5BBM%2Fref%3Dsr_1_59_sspa%3Fdchild%3D1%26keywords%3Dtable%2Blamp%26qid%3D1626667705%26sr%3D8-59-spons%26psc%3D1&qualifier=1626667705&id=192831797163896&widgetName=sp_btf
Wipro Prism Rechargeable LED Torch Cum Lantern  ,,Sponsored,,₹990,₹549,Save ₹441 (45%),4.2 out of 5 stars,"2,208",https://www.amazon.in/gp/slredirect/picassoRedirect.html/ref=pa_sp_btf_aps_sr_pg1_1?ie=UTF8&adId=A07596262NN0MHS19D2K4&url=%2FWipro-Prism-Rechargeable-Torch-Lantern%2Fdp%2FB07TBD9NQZ%2Fref%3Dsr_1_60_sspa%3Fdchild%3D1%26keywords%3Dtable%2Blamp%26qid%3D1626667705%26sr%3D8-60-spons%26psc%3D1&qualifier=1626667705&id=192831797163896&widgetName=sp_btf
"Azacus Rechargeable Study Lamp with Eye Care Light & Stationary Pen, Pencil, Mobile Holder  ",,Sponsored,,"₹1,249",₹699,Save ₹550 (44%),4.4 out of 5 stars,64,https://www.amazon.in/gp/slredirect/picassoRedirect.html/ref=pa_sp_atf_next_aps_sr_pg2_1?ie=UTF8&adId=A017316512RRLS6002RYY&url=%2FAzacus-Rechargeable-Stationary-Pencil-Mobile%2Fdp%2FB08XQJ87GF%2Fref%3Dsr_1_49_sspa%3Fdchild%3D1%26keywords%3Dtable%2Blamp%26qid%3D1626667727%26sr%3D8-49-spons%26psc%3D1&qualifier=1626667727&id=3146706471729146&widgetName=sp_atf_next
"The Light Store Glass, Alloy Steel Table Lamp, Gold  ",,Sponsored,,,,,,,https://www.amazon.in/gp/slredirect/picassoRedirect.html/ref=pa_sp_atf_next_aps_sr_pg2_1?ie=UTF8&adId=A03020091PL4UQ1L1IAEC&url=%2FIlluminations-Luxurious-Light-Restaurant-decoration%2Fdp%2FB079P5RKY9%2Fref%3Dsr_1_50_sspa%3Fdchild%3D1%26keywords%3Dtable%2Blamp%26qid%3D1626667727%26sr%3D8-50-spons%26psc%3D1&qualifier=1626667727&id=3146706471729146&widgetName=sp_atf_next
Metal Table Lamp with Brown Jute Shade  ,,Sponsored,,"₹1,500","₹1,099",Save ₹401 (27%),,,https://www.amazon.in/gp/slredirect/picassoRedirect.html/ref=pa_sp_atf_next_aps_sr_pg2_1?ie=UTF8&adId=A040745033O9QS42OZHIU&url=%2FMetal-Table-Lamp-Brown-Shade%2Fdp%2FB08LZ84LKB%2Fref%3Dsr_1_51_sspa%3Fdchild%3D1%26keywords%3Dtable%2Blamp%26qid%3D1626667727%26sr%3D8-51-spons%26psc%3D1&qualifier=1626667727&id=3146706471729146&widgetName=sp_atf_next
"Wipro 6W LED Table Lamp-3 Grade Dimming and Ambience Lighting (6 color options,White,Pack of 1)  ",,Sponsored,,"₹2,250","₹1,449",Save ₹801 (36%),4.3 out of 5 stars,"2,672",https://www.amazon.in/gp/slredirect/picassoRedirect.html/ref=pa_sp_atf_next_aps_sr_pg2_1?ie=UTF8&adId=A07598701ZASNX1A7XAUT&url=%2FWipro-6W-Deco-Table-Lamp%2Fdp%2FB07TQTSQZ9%2Fref%3Dsr_1_52_sspa%3Fdchild%3D1%26keywords%3Dtable%2Blamp%26qid%3D1626667727%26sr%3D8-52-spons%26psc%3D1&qualifier=1626667727&id=3146706471729146&widgetName=sp_atf_next
Attractive Craft Store Himalayan Rock Salt Lamp in Natural Shape (2-3 KG) for Positive Energy or Vastu or Fengshui or Healing or Peace or Harmony or Purification  ,,,,"₹1,800",₹779,"Save ₹1,021 (57%)",4.2 out of 5 stars,18,https://www.amazon.in/Attractive-Himalayan-Positive-Fengshui-Purification/dp/B0917NY7T9/ref=sr_1_53?dchild=1&keywords=table+lamp&qid=1626667727&sr=8-53
"Bajaj Acrylonitrile Butadiene Styrene Lamp, White,Pack of 1 With 10 Units of Transparent Pouches  ",,,,"₹1,190",₹817,Save ₹373 (31%),4.4 out of 5 stars,395,https://www.amazon.in/Bajaj-Softlite-Mini-Rechargable-Table/dp/B0866HY6B3/ref=sr_1_54?dchild=1&keywords=table+lamp&qid=1626667727&sr=8-54
"zsquarehp Glass Table Lamp, Multicolour, Pack of 1  ",,,,"₹1,299",₹378,Save ₹921 (71%),4.0 out of 5 stars,569,https://www.amazon.in/ZSQUAREHP-Mosaic-Style-Shaped-Multicolour/dp/B07YXG5C7N/ref=sr_1_55?dchild=1&keywords=table+lamp&qid=1626667727&sr=8-55
"Royal Fancy Mushroom Shaped Glass Table lamp (Multicolour, Bulb not Included)  ",,,Only 1 left in stock.,₹699,₹330,Save ₹369 (53%),3.4 out of 5 stars,6,https://www.amazon.in/Mushroom-Bedside-Decoration-Multicolour-Included/dp/B08KWRK1NH/ref=sr_1_56?dchild=1&keywords=table+lamp&qid=1626667727&sr=8-56
"hayden Plastic Desk Lamp With Pen/Phone Holder, Multicolour,Pack of 1  ",,,,₹999,₹789,Save ₹210 (21%),4.2 out of 5 stars,788,https://www.amazon.in/Rechargeable-Control-360%C2%B0Flexible-Charging-Students/dp/B08M679DY7/ref=sr_1_57?dchild=1&keywords=table+lamp&qid=1626667727&sr=8-57
D-tone® 20 SMD LED Light Touch Table Lamp + 3 Grade Dimming (Cool Day/Neutral/Warm) with Touch Control/Eyes-Friendly/Rechargeable (1500mAh Battery-Buckethead)  ,,,,"₹1,000",₹399,Save ₹601 (60%),,,https://www.amazon.in/D-tone%C2%AE-Dimming-Eyes-Friendly-Rechargeable-Battery-Buckethead/dp/B0983TLTNM/ref=sr_1_58?dchild=1&keywords=table+lamp&qid=1626667727&sr=8-58
"DIVING DEEP Vintage Style Round Doctor Flexible with Branded 9W LED Bulb Table Lamp  (48 cm, Black)  ",,,,"₹1,999",₹699,"Save ₹1,300 (65%)",3.2 out of 5 stars,2,https://www.amazon.in/DIVING-DEEP-Vintage-Flexible-Branded/dp/B0947F6CPS/ref=sr_1_49?dchild=1&keywords=table+lamp&qid=1626667727&sr=8-49
Ultimate Kitchen Ceramic White Rechargeable Led Touch On Off Switch Desk Lamp Children Eye Protection Student Study Reading Dimmer Rechargeable Led Table Lamps  ,,,,"₹1,037",₹385,Save ₹652 (63%),3.0 out of 5 stars,9,https://www.amazon.in/Ultimate-Kitchen-Rechargeable-Children-Protection/dp/B0922Y517P/ref=sr_1_50?dchild=1&keywords=table+lamp&qid=1626667727&sr=8-50
