name,badge_1,badge_2,badge_3,mrp,discounted_price,discount,rating,rating_count,link
"Wipro 5W LED Table Lamp with Smooth Dimming, Use as Emergency Light with Power Bank or with Laptop USB Port  ",,Sponsored,,"₹1,290",₹762,Save ₹528 (41%),4.2 out of 5 stars,242,https://www.amazon.in/gp/slredirect/picassoRedirect.html/ref=pa_sp_atf_aps_sr_pg1_1?ie=UTF8&adId=A0254446VZUMPIVKLRPM&url=%2FWipro-Table-Dimmable-Feature-White%2Fdp%2FB08LLY5R9T%2Fref%3Dsr_1_1_sspa%3Fdchild%3D1%26keywords%3Dtable%2Blamp%26qid%3D1627533814%26sr%3D8-1-spons%26psc%3D1&qualifier=1627533814&id=6689880087670693&widgetName=sp_atf
"Wipro Garnet ABS 6w Led Table Lamp - 3 Grade Dimming and Color Changing (Cool Day Light/Neutral White/Warm White), Pack of 1  ",Deal of the Day ,Sponsored,,"₹1,500","₹1,299",Save ₹201 (13%),4.5 out of 5 stars,"11,017",https://www.amazon.in/gp/slredirect/picassoRedirect.html/ref=pa_sp_atf_aps_sr_pg1_1?ie=UTF8&adId=A06290761JCEEI0GBQOHM&url=%2FWipro-Garnet-dimming-Changing-Neutral%2Fdp%2FB07C9KQ7KR%2Fref%3Dsr_1_2_sspa%3Fdchild%3D1%26keywords%3Dtable%2Blamp%26qid%3D1627533814%26sr%3D8-2-spons%26psc%3D1&qualifier=1627533814&id=6689880087670693&widgetName=sp_atf
"Wipro 6W LED Table Lamp-3 Grade Dimming and Ambience Lighting (6 color options,White,Pack of 1)  ",Limited time deal,Sponsored,,"₹2,250","₹1,449",Save ₹801 (36%),4.4 out of 5 stars,"2,746",https://www.amazon.in/gp/slredirect/picassoRedirect.html/ref=pa_sp_atf_aps_sr_pg1_1?ie=UTF8&adId=A06292321CP1ZT65UON39&url=%2FWipro-6W-Deco-Table-Lamp%2Fdp%2FB07TQTSQZ9%2Fref%3Dsr_1_3_sspa%3Fdchild%3D1%26keywords%3Dtable%2Blamp%26qid%3D1627533814%26smid%3DAT95IG9ONZD7S%26sr%3D8-3-spons%26psc%3D1&qualifier=1627533814&id=6689880087670693&widgetName=sp_atf
"Azacus Chargeable Desk Lamp With Organizer, Phone Holder, Night Light, Pin Stand Table Lamp for Dorm Room Study Desk, 2200mAh Rechargeable Battery Operated (Pen + Mobile + Drawer + Night Light)( Color - White )  ",,Sponsored,,"₹1,299",₹699,Save ₹600 (46%),4.2 out of 5 stars,103,https://www.amazon.in/gp/slredirect/picassoRedirect.html/ref=pa_sp_atf_aps_sr_pg1_1?ie=UTF8&adId=A01730419PVORMXGQ9NU&url=%2FAzacus-Chargeable-Organizer-Rechargeable-Operated%2Fdp%2FB08XQMWX9C%2Fref%3Dsr_1_4_sspa%3Fdchild%3D1%26keywords%3Dtable%2Blamp%26qid%3D1627533814%26sr%3D8-4-spons%26psc%3D1&qualifier=1627533814&id=6689880087670693&widgetName=sp_atf
"Wipro Garnet ABS 6w Led Table Lamp - 3 Grade Dimming and Color Changing (Cool Day Light/Neutral White/Warm White), Pack of 1  ",Deal of the Day ,,,"₹1,500","₹1,299",Save ₹201 (13%),4.5 out of 5 stars,"11,017",https://www.amazon.in/Wipro-Garnet-dimming-Changing-Neutral/dp/B07C9KQ7KR/ref=sr_1_5?dchild=1&keywords=table+lamp&qid=1627533814&sr=8-5
"SaleOn Touch Desk lamp LED Touch On Off Switch Student Study Reading Dimmer Rechargeable Led Table Lamps Eye Protection Lamp ( White,Pack of 1 )  ",Amazon's Choice,,,"₹1,499",₹639,Save ₹860 (57%),4.2 out of 5 stars,774,https://www.amazon.in/SaleON-Switch-Student-Reading-Rechargeable/dp/B07ZP7PF8P/ref=ice_ac_b_dpb?dchild=1&keywords=table+lamp&qid=1627533814&sr=8-6
PRIMESKY® Study lamp Rechargeable Led Touch On Off Switch Student Study Reading Dimmer Led Table Lamps White Desk Light lamp  ,,,,₹999,₹498,Save ₹501 (50%),4.2 out of 5 stars,310,https://www.amazon.in/PRIMESKY%C2%AE-Rechargeable-Switch-Student-Reading/dp/B0966KGV2T/ref=sr_1_7?dchild=1&keywords=table+lamp&qid=1627533814&sr=8-7
"Wipro 5W LED Table Lamp with Smooth Dimming, Use as Emergency Light with Power Bank or with Laptop USB Port  ",,,,"₹1,290",₹762,Save ₹528 (41%),4.2 out of 5 stars,242,https://www.amazon.in/Wipro-Table-Dimmable-Feature-White/dp/B08LLY5R9T/ref=sr_1_8?dchild=1&keywords=table+lamp&qid=1627533814&sr=8-8
Philips Air LED Table Lamp/Desk Light (Black)  ,,,,"₹1,200",₹997,Save ₹203 (17%),4.4 out of 5 stars,"9,206",https://www.amazon.in/Philips-61013-Air-5-Watt-Desklight/dp/B016VYAWA6/ref=sr_1_9?dchild=1&keywords=table+lamp&qid=1627533814&sr=8-9
"ESN 999 Plastic Table Lamp With Attached Pen Stand, Black  ",,,,₹899,₹298,Save ₹601 (67%),4.1 out of 5 stars,369,https://www.amazon.in/ESN-999-Plastic-Table-Attached/dp/B08WCM9Q2H/ref=sr_1_10?dchild=1&keywords=table+lamp&qid=1627533814&sr=8-10
D-tone® 20 LED Touch Table Lamp + 8 LED with 3 Grade Dimming (Yellow) with Drawers/Pen-Phone Holder/Rechargeable 2500mAh Battery (12Hrs Operating Time)  ,,,,"₹1,500",₹689,Save ₹811 (54%),4.6 out of 5 stars,22,https://www.amazon.in/D-tone%C2%AE-Dimming-Pen-Phone-Rechargeable-Operating/dp/B096XVNBBR/ref=sr_1_11?dchild=1&keywords=table+lamp&qid=1627533814&sr=8-11
Pick Ur Needs® Rechargeable LED Touch On/Off Switch Desk Light Children Eye Protection Student Study Reading Dimmer Rechargeable Led Study Table Lamps USB Charging Touch (Color White) 5 in 1  ,,,,"₹1,260",₹699,Save ₹561 (45%),4.1 out of 5 stars,"1,555",https://www.amazon.in/Pick-Ur-Rechargeable-Children-Protection/dp/B08L4335ZX/ref=sr_1_12?dchild=1&keywords=table+lamp&qid=1627533814&sr=8-12
RUCON™ Study lamp Rechargeable Led Touch On Off Switch Student Study Reading Dimmer Led Table Lamps White Desk Light lamp  ,,,,₹999,₹425,Save ₹574 (57%),3.9 out of 5 stars,77,https://www.amazon.in/RUCONTM-Rechargeable-Switch-Student-Reading/dp/B097T6GSTG/ref=sr_1_13?dchild=1&keywords=table+lamp&qid=1627533814&sr=8-13
"Azacus Chargeable Desk Lamp With Organizer, Phone Holder, Night Light, Pin Stand Table Lamp for Dorm Room Study Desk, 2200mAh Rechargeable Battery Operated (Pen + Mobile + Drawer + Night Light)( Color - White )  ",,,,"₹1,299",₹699,Save ₹600 (46%),4.2 out of 5 stars,103,https://www.amazon.in/Azacus-Chargeable-Organizer-Rechargeable-Operated/dp/B08XQMWX9C/ref=sr_1_14?dchild=1&keywords=table+lamp&qid=1627533814&sr=8-14
TECHTOP Smart Study Desk/Table Led lamp with Touch Rechargeable Control Light Touch On/Off Switch Desk Lamp Children Eye Protection Student Study Reading Dimmer  ,,,,₹899,₹379,Save ₹520 (58%),5.0 out of 5 stars,4,https://www.amazon.in/TECHTOP-Rechargeable-Control-Children-Protection/dp/B098WPD1MZ/ref=sr_1_15?dchild=1&keywords=table+lamp&qid=1627533814&sr=8-15
RYLAN Rechargeable LED Touch On/Off Switch Desk Lamp Children Eye Protection Student Study Reading Dimmer Rechargeable Led Table Lamps USB Charging Touch Dimmer(Desk Lights for Study)*  ,,,,"₹1,299",₹549,Save ₹750 (58%),4.8 out of 5 stars,72,https://www.amazon.in/Rechargeable-Desk-Children-Protection-Charging/dp/B098M93SQM/ref=sr_1_16?dchild=1&keywords=table+lamp&qid=1627533814&sr=8-16
"Bajaj Acrylonitrile Butadiene Styrene Lamp, White  ",Limited time deal,,,"₹1,190",₹809,Save ₹381 (32%),4.3 out of 5 stars,414,https://www.amazon.in/Bajaj-Softlite-Mini-Rechargable-Table/dp/B0866HY6B3/ref=sr_1_17?dchild=1&keywords=table+lamp&qid=1627533814&smid=AT95IG9ONZD7S&sr=8-17
"E-COSMOS for Portable Flexible USB LED Light Lamp, Multicolour, Small (USB-LED-LAMP)  ",Best seller,,,,₹39,,3.9 out of 5 stars,"1,656",https://www.amazon.in/gp/bestsellers/kitchen/1380508031/ref=sr_bs_17_1380508031_1
Unique Home Ceramic White Rechargeable Led Touch On Off Switch Desk Lamp Children Eye Protection Student Study Reading Dimmer Rechargeable Led Table Lamps  ,,,,"₹1,000",₹349,Save ₹651 (65%),,,https://www.amazon.in/Unique-Home-Rechargeable-Children-Protection/dp/B099NQ2FPV/ref=sr_1_19?dchild=1&keywords=table+lamp&qid=1627533814&sr=8-19
Eleven Mart® Rechargeable LED Touch On/Off Switch Desk Lamp Children Eye Protection Student Study Reading Dimmer Rechargeable Led Table Lamps USB Charging Touch Dimmer (Desk Light)  ,,,,"₹1,999",₹445,"Save ₹1,554 (78%)",4.7 out of 5 stars,53,https://www.amazon.in/Eleven-Rechargeable-Children-Protection-Charging/dp/B098L9ZF7T/ref=sr_1_20?dchild=1&keywords=table+lamp&qid=1627533814&sr=8-20
"ExclusiveLane Mango Wood, Linen Fibre Table Lamp for Living Room Bedroom Bedside Lamp, Brown, Off-White, 1 Piece  ",,Sponsored,,"₹1,810","₹1,395",Save ₹415 (23%),4.3 out of 5 stars,41,https://www.amazon.in/gp/slredirect/picassoRedirect.html/ref=pa_sp_mtf_aps_sr_pg1_1?ie=UTF8&adId=A01524861DOD8K56ZYI6F&url=%2FExclusiveLane-Decorative-Bedroom-Decoration-Bedside%2Fdp%2FB085W6DWWK%2Fref%3Dsr_1_21_sspa%3Fdchild%3D1%26keywords%3Dtable%2Blamp%26qid%3D1627533814%26sr%3D8-21-spons%26psc%3D1&qualifier=1627533814&id=6689880087670693&widgetName=sp_mtf
"LED Touch On/Off Switch Desk Lamp with USB Charging Touch Dimmer(White,Pack of 1)  ",,Sponsored,,₹799,₹369,Save ₹430 (54%),3.2 out of 5 stars,123,https://www.amazon.in/gp/slredirect/picassoRedirect.html/ref=pa_sp_mtf_aps_sr_pg1_1?ie=UTF8&adId=A008498612ZSG4RLZ03PG&url=%2FTouch-Switch-Lamp-Charging-Dimmer%2Fdp%2FB08NPDVLQD%2Fref%3Dsr_1_22_sspa%3Fdchild%3D1%26keywords%3Dtable%2Blamp%26qid%3D1627533814%26sr%3D8-22-spons%26psc%3D1%26smid%3DA1HMD2TKMYB73T&qualifier=1627533814&id=6689880087670693&widgetName=sp_mtf
"ExclusiveLane Mango Wood Base, Cambric Cotton Shade Table Lamp for Living Room Bedroom Bedside Lamp (Off-White, Turquoise Base, Cream Shade, 1 Piece)  ",,Sponsored,,"₹1,999","₹1,525",Save ₹474 (24%),4.4 out of 5 stars,"1,216",https://www.amazon.in/gp/slredirect/picassoRedirect.html/ref=pa_sp_mtf_aps_sr_pg1_1?ie=UTF8&adId=A01527303Q4C50S9FYF01&url=%2FExclusiveLane-Faraday-Decorative-Bedroom-Decoration%2Fdp%2FB085W5XTBW%2Fref%3Dsr_1_23_sspa%3Fdchild%3D1%26keywords%3Dtable%2Blamp%26qid%3D1627533814%26sr%3D8-23-spons%26psc%3D1&qualifier=1627533814&id=6689880087670693&widgetName=sp_mtf
"Homesake Ceramic Table Lamp with Shade, Off-White  ",,Sponsored,,"₹2,800","₹1,850",Save ₹950 (34%),4.5 out of 5 stars,431,https://www.amazon.in/gp/slredirect/picassoRedirect.html/ref=pa_sp_mtf_aps_sr_pg1_1?ie=UTF8&adId=A05457311WQ707E0UZ9HC&url=%2FHomesake-Ceramic-Shaped-White-Table%2Fdp%2FB07G9YNDNP%2Fref%3Dsr_1_24_sspa%3Fdchild%3D1%26keywords%3Dtable%2Blamp%26qid%3D1627533814%26sr%3D8-24-spons%26psc%3D1&qualifier=1627533814&id=6689880087670693&widgetName=sp_mtf
"Wipro 6W LED Table Lamp-3 Grade Dimming and Ambience Lighting (6 color options,White,Pack of 1)  ",Limited time deal,,,"₹2,250","₹1,449",Save ₹801 (36%),4.4 out of 5 stars,"2,746",https://www.amazon.in/Wipro-6W-Deco-Table-Lamp/dp/B07TQTSQZ9/ref=sr_1_25?dchild=1&keywords=table+lamp&qid=1627533814&smid=AT95IG9ONZD7S&sr=8-25
Tu Casa LG-200 - Black Metal Table Lamp with Cotton Fabric Conical Shape- Shade Color (Off White).Holder Type- B-22 (Brass)-(Bulb NOT INCLUDED8  ,,,,"₹1,799",₹705,"Save ₹1,094 (61%)",3.9 out of 5 stars,"1,399",https://www.amazon.in/Tucasa-LG-200-Conical-Shade-Table/dp/B00R4C5EVW/ref=sr_1_26?dchild=1&keywords=table+lamp&qid=1627533814&sr=8-26
"KWT Rechargeable LED Touch On/Off Switch Desk Lamp Children Eye Protection Student Study Reading Dimmer Rechargeable Led Table Lamps USB Charging Touch Dimmer, Desk Lights for Study (White)  ",,,,₹999,₹549,Save ₹450 (45%),4.5 out of 5 stars,88,https://www.amazon.in/KWT-Rechargeable-Children-Protection-Charging/dp/B097HCT5CN/ref=sr_1_27?dchild=1&keywords=table+lamp&qid=1627533814&sr=8-27
Paxmore Rechargeable Desk/Study Lamp Touch On/Off Switch Desk Table Lamp/Mobile Holder Office Desk lamp Touch Dimmer Children Eye Safety Protection - White  ,,,,₹999,₹675,Save ₹324 (32%),4.2 out of 5 stars,"1,716",https://www.amazon.in/PaxMore-Rechargeable-Children-Protection-Charging/dp/B08DNS7Y9J/ref=sr_1_28?dchild=1&keywords=table+lamp&qid=1627533814&sr=8-28
D-tone® 19 LED Touch Table Lamp with Rechargeable 1200mAh Battery (12Hrs Operating Time)  ,,,,"₹1,250",₹549,Save ₹701 (56%),4.8 out of 5 stars,7,https://www.amazon.in/D-tone%C2%AE-Rechargeable-1200mAh-Battery-Operating/dp/B09736J4YQ/ref=sr_1_29?dchild=1&keywords=table+lamp&qid=1627533814&sr=8-29
"EDGE Plastic Desk/Table Lamp, White  ",,,,₹899,₹369,Save ₹530 (59%),3.9 out of 5 stars,150,https://www.amazon.in/EDGE-Plastic-Desk-Table-White/dp/B0913JPYN1/ref=sr_1_30?dchild=1&keywords=table+lamp&qid=1627533814&sr=8-30
"ESN 999 Aluminium Lamp, Black  ",,,,₹899,₹525,Save ₹374 (42%),4.0 out of 5 stars,402,https://www.amazon.in/ESN-999-Electric-Flexible-Office/dp/B08DBHJ7GQ/ref=sr_1_31?dchild=1&keywords=table+lamp&qid=1627533814&sr=8-31
Table Lamp/Study Lamp (White)  ,,,,₹999,₹325,Save ₹674 (67%),4.0 out of 5 stars,3,https://www.amazon.in/Table-Lamp-Study-White/dp/B098DN5NSK/ref=sr_1_32?dchild=1&keywords=table+lamp&qid=1627533814&sr=8-32
"Home Centre Ceramic Table Lamp, Peach, 1 Piece  ",,,,,₹499,,4.1 out of 5 stars,35,https://www.amazon.in/Home-Centre-Ambrose-Corienth-Solid/dp/B08BQVC1YK/ref=sr_1_33?dchild=1&keywords=table+lamp&qid=1627533814&sr=8-33
Azacus rechargeable Led study lamp touch on/off switch children eye protection student study reading dimmer table lamps usb charging touch dimmer (Pen Holder + Mobile Stand + Study Lamp + Night Light + USB Charging + Dimmable Light)  ,,,,"₹1,499",₹675,Save ₹824 (55%),4.0 out of 5 stars,80,https://www.amazon.in/Azacus-Plastic-Shades-Control-Advanced/dp/B07P8RV5DS/ref=sr_1_34?dchild=1&keywords=table+lamp&qid=1627533814&sr=8-34
"wipro Re-Chargeable LED Table Lamp, White, Standard (E10013)  ",,,,"₹1,090",₹649,Save ₹441 (40%),,,https://www.amazon.in/wipro-Re-Chargeable-Table-Standard-E10013/dp/B094JTNRJY/ref=sr_1_35?dchild=1&keywords=table+lamp&qid=1627533814&sr=8-35
"ESN 999 Metal Table Lamp, Black, Pack of 1  ",,,,₹899,₹305,Save ₹594 (66%),4.0 out of 5 stars,"2,406",https://www.amazon.in/ESN-999-Flexible-Electric-Attached/dp/B07PDQMZ7G/ref=sr_1_36?dchild=1&keywords=table+lamp&qid=1627533814&sr=8-36
Bulfyss USB Flexible Reading LED Light Clip-on Beside Bed Table Desk Lamp (Black).  ,,,,₹999,₹499,Save ₹500 (50%),4.1 out of 5 stars,129,https://www.amazon.in/Bulfyss-Flexible-Reading-Light-Beside/dp/B0941YXMNR/ref=sr_1_37?dchild=1&keywords=table+lamp&qid=1627533814&sr=8-37
"Azacus Chargeable Desk Lamp With Organiser, Phone Holder, Night Light, Pin Stand Table Lamp for Dorm Room Study Desk, 2200mAh Rechargeable Battery Operated (Pen+Mobile+Drawer+Night Light+Eye Care)( Colour - White )  ",,,,"₹1,249",₹699,Save ₹550 (44%),4.4 out of 5 stars,68,https://www.amazon.in/Azacus-Chargeable-Organiser-Rechargeable-Operated/dp/B08XQJ87GF/ref=sr_1_38?dchild=1&keywords=table+lamp&qid=1627533814&sr=8-38
WEABLE Rechargeable LED Touch On/Off Switch Desk Lamp Children Eye Protection Student Study Reading Dimmer Led Table Lamps USB Charging Touch Dimmer  ,,,,"₹1,399",₹469,Save ₹930 (66%),3.5 out of 5 stars,5,https://www.amazon.in/Rechargeable-Children-Protection-Student-Charging/dp/B097YK8XTN/ref=sr_1_39?dchild=1&keywords=table+lamp&qid=1627533814&sr=8-39
"VRCT Khadi Shade and Beautiful Table Lamp for Bedroom and Drawing Room (Black,Pack of 1)  ",,,,"₹1,500",₹575,Save ₹925 (62%),3.8 out of 5 stars,233,https://www.amazon.in/VRCT-Khadi-Beautiful-Bedroom-Drawing/dp/B08G8TNB82/ref=sr_1_40?dchild=1&keywords=table+lamp&qid=1627533814&sr=8-40
Diving Deep Table Lamp with 9W LED Bulb Table Lamp Study Lamp Adjustable Table Lamp Round Doctor Flexible Lamp Bulb Adjustable Electric lamp (Red)  ,,,,₹999,₹325,Save ₹674 (67%),2.0 out of 5 stars,1,https://www.amazon.in/Diving-Adjustable-Doctor-Flexible-Electric/dp/B099NWXLPB/ref=sr_1_41?dchild=1&keywords=table+lamp&qid=1627533814&sr=8-41
Spectrum Multi-Function Lithium Battery led Table lamp with Pen Holder Blue (Multicolor)  ,,,,₹999,₹749,Save ₹250 (25%),4.0 out of 5 stars,36,https://www.amazon.in/Spectrum-Multi-Function-Lithium-Battery-Multicolor/dp/B08G4VFKN9/ref=sr_1_42?dchild=1&keywords=table+lamp&qid=1627533814&sr=8-42
krit enterprise Study lamp Rechargeable Led Touch On Off Switch Student Study Reading Dimmer Led Table Lamps White Desk Light lamp  ,,,,"₹1,099",₹294,Save ₹805 (73%),,,https://www.amazon.in/krit-enterprise-Rechargeable-Student-Reading/dp/B09B5BD4XQ/ref=sr_1_43?dchild=1&keywords=table+lamp&qid=1627533814&sr=8-43
TECHTOP Student Study Desk/Table Lamp Led lamp with Touch Rechargeable Control Light Touch On/Off Switch Desk Lamp Children Eye Protection Student Study Reading Dimmer  ,,,,₹899,₹389,Save ₹510 (57%),,,https://www.amazon.in/TECHTOP-Student-Rechargeable-Children-Protection/dp/B098ZCMYM2/ref=sr_1_44?dchild=1&keywords=table+lamp&qid=1627533814&sr=8-44
Azacus 360 Adjustable Study Lamp for Student with 3 Different Lights and Touch Control ON-Off & Brightness Adjustments (Pen Stand+Mobile Stand+Drawer+Night Light) (Warm Yellow Colour for Study at Night)  ,,,,"₹1,299",₹685,Save ₹614 (47%),4.6 out of 5 stars,16,https://www.amazon.in/Azacus-Adjustable-Different-Brightness-Adjustments/dp/B08YZ1RRHV/ref=sr_1_45?dchild=1&keywords=table+lamp&qid=1627533814&sr=8-45
KAVANA Rechargeable Desk/Study Lamp Touch On/Off Switch Desk Table Lamp with Mobile Holder Office Desk lamp Touch Dimmer Childeren Eye Safety Protection (White) (Desk 9998)  ,,,,₹999,₹599,Save ₹400 (40%),4.7 out of 5 stars,4,https://www.amazon.in/KAVANA-Rechargeable-Switch-Childeren-Protection/dp/B096Y6F5XZ/ref=sr_1_46?dchild=1&keywords=table+lamp&qid=1627533814&sr=8-46
Astrometric Clip Flexible Desk Lamp with USB Led Table Lamp Eye Protection 14 LEDs for Bedside Book Reading Study Office Work Kids Night Light Study Lamp  ,,,,₹999,₹499,Save ₹500 (50%),,,https://www.amazon.in/Astrometric-Flexible-Protection-Bedside-Reading/dp/B099FD5DJ2/ref=sr_1_47?dchild=1&keywords=table+lamp&qid=1627533814&sr=8-47
PVM Study lamp Rechargeable Led Touch On Off Switch Student Study Reading Dimmer Led Table Lamps White Desk Light lamp  ,,,,₹699,₹399,Save ₹300 (43%),5.0 out of 5 stars,1,https://www.amazon.in/Rechargeable-Switch-Student-Reading-Dimmer/dp/B09926RTJG/ref=sr_1_48?dchild=1&keywords=table+lamp&qid=1627533814&sr=8-48
"ESN 999 Table Lamp, Red, Pack of 1  ",,,,₹899,₹305,Save ₹594 (66%),4.0 out of 5 stars,"2,154",https://www.amazon.in/ESN-999-Flexible-Electric-Attached/dp/B07QC5YT69/ref=sr_1_49?dchild=1&keywords=table+lamp&qid=1627533814&sr=8-49
J S MART Rechargeable LED Touch On/Off Switch Desk Lamp Children Eye Protection Student Study Reading Dimmer Rechargeable Led Table Lamps USB Charging Touch Dimmer(Desk Lights for Study-)  ,,,,₹938,₹429,Save ₹509 (54%),5.0 out of 5 stars,1,https://www.amazon.in/Rechargeable-Children-Protection-Student-Charging/dp/B097NBGJV1/ref=sr_1_50?dchild=1&keywords=table+lamp&qid=1627533814&sr=8-50
"Pick Ur Needs® Chargeable Desk Lamp With Organizer, Phone Holder, Night Light, Pin Stand Table Lamp for Dorm Room Study Desk, 2200mAh Battery Operated (Pen + Mobile + Drewer + Rounded)( Color - White )  ",,,,"₹1,295",₹699,Save ₹596 (46%),4.2 out of 5 stars,268,https://www.amazon.in/Pick-Ur-Chargeable-Organizer-Operated/dp/B08VH9Q933/ref=sr_1_51?dchild=1&keywords=table+lamp&qid=1627533814&sr=8-51
DONNYMOCK Rechargeable LED Touch On/Off Switch Desk Lamp Children Eye Protection Student Study Reading Dimmer Rechargeable Led Table Lamps USB Charging Touch Dimmer(Desk Lights for Study+)  ,,,,₹599,₹420,Save ₹179 (30%),5.0 out of 5 stars,1,https://www.amazon.in/DONNYMOCK-Rechargeable-Children-Protection-Charging/dp/B09816NF35/ref=sr_1_52?dchild=1&keywords=table+lamp&qid=1627533814&sr=8-52
"Home Centre Ceramic Table Lamp, Purple, 1 Piece  ",,,,,₹499,,4.3 out of 5 stars,38,https://www.amazon.in/Home-Centre-Ambrose-Corienth-Purple/dp/B089ZCZZLW/ref=sr_1_53?dchild=1&keywords=table+lamp&qid=1627533814&sr=8-53
"TECHTOP Home,Office, Student Study Desk/Table Led lamp Rechargeable with Touch Control Light Touch On/Off Switch Desk Lamp Children Eye Protection Student Study Reading Dimmer  ",,,,₹899,₹369,Save ₹530 (59%),,,https://www.amazon.in/TECHTOP-Student-Rechargeable-Children-Protection/dp/B099DQ43W5/ref=sr_1_54?dchild=1&keywords=table+lamp&qid=1627533814&sr=8-54
BillieJean Matte Black Reading And Studying Table Lamp  ,,,,₹999,₹699,Save ₹300 (30%),4.2 out of 5 stars,"1,097",https://www.amazon.in/Wemex-Billie-Reading-Study-Table/dp/B01D2SCZKO/ref=sr_1_55?dchild=1&keywords=table+lamp&qid=1627533814&sr=8-55
"Ventuos- Floor Lamp USB Battery-Operated Desk Lamp Pearl Tree Table Lamp Bonsai Tree LED Lights Lamps for Bedroom Home,Office Decor Floor Lamps for Living Room Adjustable Lamp with 36 LED Beads  ",,,,"₹1,349","₹1,299",Save ₹50 (4%),,,https://www.amazon.in/Ventuos-Battery-Operated-Bonsai-Bedroom-Adjustable/dp/B09B516D6Y/ref=sr_1_56?dchild=1&keywords=table+lamp&qid=1627533814&sr=8-56
"ExclusiveLane 14 Inch Wooden Home Decorative Bedroom Living Room Bedside Table Lamps for Home Decoration (12.7 cm x 12.7 cm x 35.6 cm, Green & Off White, Without Bulb) (EL-003-003)  ",,Sponsored,,"₹1,625","₹1,049",Save ₹576 (35%),4.1 out of 5 stars,157,https://www.amazon.in/gp/slredirect/picassoRedirect.html/ref=pa_sp_btf_aps_sr_pg1_1?ie=UTF8&adId=A0152150QBDUVWRNK7PB&url=%2FExclusiveLane-Wooden-Decorative-Living-Table%2Fdp%2FB00G9TESJA%2Fref%3Dsr_1_57_sspa%3Fdchild%3D1%26keywords%3Dtable%2Blamp%26qid%3D1627533814%26sr%3D8-57-spons%26psc%3D1&qualifier=1627533814&id=6689880087670693&widgetName=sp_btf
"RUilY ABS,PP Balance Lamp, Black, Pack of 1  ",,Sponsored,,"₹5,000","₹2,499","Save ₹2,501 (50%)",4.4 out of 5 stars,241,https://www.amazon.in/gp/slredirect/picassoRedirect.html/ref=pa_sp_btf_aps_sr_pg1_1?ie=UTF8&adId=A047759315XI2L2YAJTVY&url=%2FRUilY%25C2%25AE-Balance-Magnetic-Bedroom-Office%2Fdp%2FB083NTMHRT%2Fref%3Dsr_1_58_sspa%3Fdchild%3D1%26keywords%3Dtable%2Blamp%26qid%3D1627533814%26sr%3D8-58-spons%26psc%3D1&qualifier=1627533814&id=6689880087670693&widgetName=sp_btf
"OPPLE 3W Reading Light LED Rechargeable Light with Flicker Free Desk Book Lamp (Natural Light, 4000K,White)  ",,Sponsored,,"₹1,455","₹1,299",Save ₹156 (11%),4.3 out of 5 stars,"1,698",https://www.amazon.in/gp/slredirect/picassoRedirect.html/ref=pa_sp_btf_aps_sr_pg1_1?ie=UTF8&adId=A060686410NF3B109JPZ2&url=%2FReading-Rechargeable-Children-Protection-Student%2Fdp%2FB07P4F5BBM%2Fref%3Dsr_1_59_sspa%3Fdchild%3D1%26keywords%3Dtable%2Blamp%26qid%3D1627533814%26sr%3D8-59-spons%26psc%3D1&qualifier=1627533814&id=6689880087670693&widgetName=sp_btf
"ExclusiveLane Mango Wood Base, Cotton Print Shade Table Lamps, Dark Brown, Light Brown, 1 Piece  ",,Sponsored,,"₹2,095","₹1,549",Save ₹546 (26%),4.1 out of 5 stars,17,https://www.amazon.in/gp/slredirect/picassoRedirect.html/ref=pa_sp_btf_aps_sr_pg1_1?ie=UTF8&adId=A01524303DI7K92DOOJ7G&url=%2FExclusiveLane-Moroccan-Decorative-Bedroom-Decoration%2Fdp%2FB085W51JYX%2Fref%3Dsr_1_60_sspa%3Fdchild%3D1%26keywords%3Dtable%2Blamp%26qid%3D1627533814%26sr%3D8-60-spons%26psc%3D1&qualifier=1627533814&id=6689880087670693&widgetName=sp_btf
"ExclusiveLane Mango Wood Table Lamps, Off-White, Maroon and Cream  ",,Sponsored,Only 2 left in stock.,"₹1,625","₹1,049",Save ₹576 (35%),4.1 out of 5 stars,157,https://www.amazon.in/gp/slredirect/picassoRedirect.html/ref=pa_sp_atf_next_aps_sr_pg2_1?ie=UTF8&adId=A015175013VOVUVEW4F9T&url=%2FExclusiveLane-Wooden-Decorative-Bedside-Table%2Fdp%2FB00G9TFEU2%2Fref%3Dsr_1_49_sspa%3Fdchild%3D1%26keywords%3Dtable%2Blamp%26qid%3D1627533837%26sr%3D8-49-spons%26psc%3D1&qualifier=1627533837&id=7376142415668290&widgetName=sp_atf_next
"ExclusiveLane Sheesham Wood and Cotton, Polyvinyl Table Lamp for Living Room Bedroom Bedside Lamp, Brown and Off White, 1 Lamp  ",Deal of the Day ,Sponsored,,"₹1,749","₹1,099",Save ₹650 (37%),4.4 out of 5 stars,"1,216",https://www.amazon.in/gp/slredirect/picassoRedirect.html/ref=pa_sp_atf_next_aps_sr_pg2_1?ie=UTF8&adId=A015304225HJBXSCJZBE0&url=%2FExclusiveLane-Sheesham-Decorative-Bedroom-Study%2Fdp%2FB00G9TFSAS%2Fref%3Dsr_1_50_sspa%3Fdchild%3D1%26keywords%3Dtable%2Blamp%26qid%3D1627533837%26sr%3D8-50-spons%26psc%3D1&qualifier=1627533837&id=7376142415668290&widgetName=sp_atf_next
Wipro Symphony 6-Watt Rechargeable LED Table Lamp (White)  ,,Sponsored,,"₹1,500","₹1,399",Save ₹101 (7%),4.1 out of 5 stars,"1,323",https://www.amazon.in/gp/slredirect/picassoRedirect.html/ref=pa_sp_atf_next_aps_sr_pg2_1?ie=UTF8&adId=A02543221ZK1CMVH85U3C&url=%2FWipro-Symphony-6-Watt-Rechargeable-Table%2Fdp%2FB07DYFBMCQ%2Fref%3Dsr_1_51_sspa%3Fdchild%3D1%26keywords%3Dtable%2Blamp%26qid%3D1627533837%26sr%3D8-51-spons%26psc%3D1&qualifier=1627533837&id=7376142415668290&widgetName=sp_atf_next
"wipro Re-Chargeable LED Table Lamp, White, Standard (E10013)  ",,Sponsored,,"₹1,090",₹649,Save ₹441 (40%),,,https://www.amazon.in/gp/slredirect/picassoRedirect.html/ref=pa_sp_atf_next_aps_sr_pg2_1?ie=UTF8&adId=A02541662YMF18CJPX4HU&url=%2Fwipro-Re-Chargeable-Table-Standard-E10013%2Fdp%2FB094JTNRJY%2Fref%3Dsr_1_52_sspa%3Fdchild%3D1%26keywords%3Dtable%2Blamp%26qid%3D1627533837%26sr%3D8-52-spons%26psc%3D1&qualifier=1627533837&id=7376142415668290&widgetName=sp_atf_next
Azacus Rechargeable LED Touch On/Off Switch Desk Lamp Children Eye Protection Student Study Reading Dimmer Rechargeable Led Table Lamp (Pen Holder + Mobile Stand + Study Lamp + Night Light + USB Charging + Dimmable Light)  ,,,,"₹1,099",₹675,Save ₹424 (39%),4.2 out of 5 stars,376,https://www.amazon.in/Azacus-Rechargeable-Desk-Protection-Light/dp/B07NGG8NCG/ref=sr_1_53?dchild=1&keywords=table+lamp&qid=1627533837&sr=8-53
THAAM™ Rechargeable Desk Study Table Lamp || Adjustable Brightness with Touch Sensor Dimmer for Eye Protection || Super Capacity Light with USB Charging Cable and Classy Look  ,,,Only 2 left in stock.,₹999,₹499,Save ₹500 (50%),4.5 out of 5 stars,10,https://www.amazon.in/Rechargeable-Adjustable-Brightness-Protection-Capacity/dp/B097S223HZ/ref=sr_1_54?dchild=1&keywords=table+lamp&qid=1627533837&sr=8-54
Wipro Symphony 6-Watt Rechargeable LED Table Lamp (White)  ,,,,"₹1,500","₹1,399",Save ₹101 (7%),4.1 out of 5 stars,"1,323",https://www.amazon.in/Wipro-Symphony-6-Watt-Rechargeable-Table/dp/B07DYFBMCQ/ref=sr_1_55?dchild=1&keywords=table+lamp&qid=1627533837&sr=8-55
