name,badge_1,badge_2,badge_3,mrp,discounted_price,discount,rating,rating_count,link
"Ventuos- Floor Lamp USB Battery-Operated Desk Lamp Pearl Tree Table Lamp Bonsai Tree LED Lights Lamps for Bedroom Home,Office Decor Floor Lamps for Living Room Adjustable Lamp with 36 LED Beads  ",,,,"₹1,349","₹1,299",Save ₹50 (4%),,,https://www.amazon.in/Ventuos-Battery-Operated-Bonsai-Bedroom-Adjustable/dp/B09B516D6Y/ref=sr_1_57?dchild=1&keywords=table+lamp&qid=1628087337&sr=8-57
Diving Deep Table Lamp with 9W LED Bulb Table Lamp Study Lamp Adjustable Table Lamp Round Doctor Flexible Lamp Bulb Adjustable Electric lamp (Black)  ,,,,₹999,₹325,Save ₹674 (67%),,,https://www.amazon.in/Diving-Adjustable-Doctor-Flexible-Electric/dp/B099NW33Y1/ref=sr_1_58?dchild=1&keywords=table+lamp&qid=1628087337&sr=8-58
"VEWIKZY | Smart Study Desk/Table LED Touch On/Off Switch Desk Light | Children Eye Protection Student Study Reading Dimmer Rechargeable Led Table Lamps, USB Charging Touch Dimmer | White | Pack of 1  ",,,,₹999,₹399,Save ₹600 (60%),,,https://www.amazon.in/VEWIKZY-Children-Protection-Rechargeable-Charging/dp/B099ZZ29JZ/ref=sr_1_49?dchild=1&keywords=table+lamp&qid=1628087337&sr=8-49
"Diving Deep Stainless Steel Table Lamp (50 cm, Silver) with Bulb Book Reading Light Desk Lamps for Study Flexible Table lamp lamp Adjustable Reading and Studying Table Lamp  ",,,,₹849,₹499,Save ₹350 (41%),4.0 out of 5 stars,1,https://www.amazon.in/Diving-Deep-Table-Lamp-Adjustable/dp/B097YCDD9Q/ref=sr_1_50?dchild=1&keywords=table+lamp&qid=1628087337&sr=8-50
TECHTOP Student Study Desk/Table Lamp Led lamp with Touch Rechargeable Control Light Touch On/Off Switch Desk Lamp Children Eye Protection Student Study Reading Dimmer  ,,,,₹899,₹379,Save ₹520 (58%),,,https://www.amazon.in/TECHTOP-Student-Rechargeable-Children-Protection/dp/B098ZCMYM2/ref=sr_1_51?dchild=1&keywords=table+lamp&qid=1628087337&sr=8-51
SAMVARDHAN Rechargeable LED Touch On/Off Switch Desk Lamp Children Eye Protection Student Study Reading Dimmer Rechargeable Led Table Lamps USB Charging Touch _ Pack of 1 Multicolor  ,,,,₹899,₹398,Save ₹501 (56%),,,https://www.amazon.in/SAMVARDHAN-Rechargeable-Children-Protection-Multicolor/dp/B097DRDMZ8/ref=sr_1_52?dchild=1&keywords=table+lamp&qid=1628087337&sr=8-52
Astrometric Clip Flexible Desk Lamp with USB Led Table Lamp Eye Protection 14 LEDs for Bedside Book Reading Study Office Work Kids Night Light Study Lamp  ,,,,₹999,₹499,Save ₹500 (50%),4.0 out of 5 stars,1,https://www.amazon.in/Astrometric-Flexible-Protection-Bedside-Reading/dp/B099FD5DJ2/ref=sr_1_53?dchild=1&keywords=table+lamp&qid=1628087337&sr=8-53
"Home Centre Ceramic Table Lamp, Blue, 1 Piece  ",,,,,₹499,,4.1 out of 5 stars,38,https://www.amazon.in/Home-Centre-Ambrose-Corienth-Solid/dp/B089ZCYKY9/ref=sr_1_54?dchild=1&keywords=table+lamp&qid=1628087337&sr=8-54
TECHTOP Student Rechargeable Table Desk Study Led Light/Lights lamp with Touch Control Light Touch On/Off Switch Desk Lamp Children Eye Protection Student Study Reading Dimmer  ,,,,₹899,₹379,Save ₹520 (58%),,,https://www.amazon.in/TECHTOP-Student-Rechargeable-Children-Protection/dp/B099Z96644/ref=sr_1_55?dchild=1&keywords=table+lamp&qid=1628087337&sr=8-55
Vikas Enterprise Ceramic White Rechargeable Led Touch On Off Switch Desk Lamp Children Eye Protection Student Study Reading Dimmer Rechargeable Led Table Lamps  ,,,,"₹1,000",₹369,Save ₹631 (63%),,,https://www.amazon.in/Vikas-Enterprise-Rechargeable-Children-Protection/dp/B099PWRKF5/ref=sr_1_56?dchild=1&keywords=table+lamp&qid=1628087337&sr=8-56
TECHTOP Student Study/Book Reading Desk/Table lamp Rechargeable Led Touch On Off Switch Study Reading Dimmer Led Table Lamps White Desk Light lamp(White)  ,,,,₹899,₹379,Save ₹520 (58%),,,https://www.amazon.in/TECHTOP-Student-Reading-Rechargeable-Switch/dp/B099QG2G3X/ref=sr_1_57?dchild=1&keywords=table+lamp&qid=1628087337&sr=8-57
"Rural Kart 1-2 Kg Natural Air Purifier Ionizer Himalayan Salt Lamp - Organic Pink Rock Salt Table Lamp Electric - Vastu, Feng Shui, Home Decor  ",,,,"₹1,999",₹630,"Save ₹1,369 (68%)",4.4 out of 5 stars,182,https://www.amazon.in/Rural-Natural-Purifier-Ionizer-Himalayan/dp/B08V22Q9QH/ref=sr_1_58?dchild=1&keywords=table+lamp&qid=1628087337&sr=8-58
"Smartway ® - Silver Sleek Design Table lamp Led , White  ",,Sponsored,,"₹3,499","₹2,299","Save ₹1,200 (34%)",,,https://www.amazon.in/gp/slredirect/picassoRedirect.html/ref=pa_sp_mtf_aps_sr_pg2_1?ie=UTF8&adId=A00253402JLZZC0DBPYDK&url=%2FSmartway-Silver-Sleek-Design-Table%2Fdp%2FB0922LFXGQ%2Fref%3Dsr_1_59_sspa%3Fdchild%3D1%26keywords%3Dtable%2Blamp%26qid%3D1628087337%26sr%3D8-59-spons%26psc%3D1&qualifier=1628087337&id=8907076288515441&widgetName=sp_mtf
"ExclusiveLane 'Paisley-Carved' Bedside Lamp Side Table Lamp for Living Room & Bedroom in Mango Wood (14 Inch, Without Bulb)  ",,Sponsored,Only 1 left in stock.,"₹2,185","₹1,662",Save ₹523 (24%),,,https://www.amazon.in/gp/slredirect/picassoRedirect.html/ref=pa_sp_mtf_aps_sr_pg2_1?ie=UTF8&adId=A05884831CY53TTWFDOZO&url=%2FExclusiveLane-Paisley-Carved-Bedside-Bedroom-Without%2Fdp%2FB097LF8GGY%2Fref%3Dsr_1_60_sspa%3Fdchild%3D1%26keywords%3Dtable%2Blamp%26qid%3D1628087337%26sr%3D8-60-spons%26psc%3D1&qualifier=1628087337&id=8907076288515441&widgetName=sp_mtf
"MARIAS KOMMERCE IKEA ARSTID Table lamp, Brass/White  ",,Sponsored,,"₹2,999","₹2,899",Save ₹100 (3%),5.0 out of 5 stars,2,https://www.amazon.in/gp/slredirect/picassoRedirect.html/ref=pa_sp_mtf_aps_sr_pg2_1?ie=UTF8&adId=A01303601XCM1GIYA4DKZ&url=%2FMARIAS-KOMMERCE-ARSTID-Table-Brass%2Fdp%2FB0963L4YMN%2Fref%3Dsr_1_61_sspa%3Fdchild%3D1%26keywords%3Dtable%2Blamp%26qid%3D1628087337%26sr%3D8-61-spons%26psc%3D1&qualifier=1628087337&id=8907076288515441&widgetName=sp_mtf
"Smartway ® Monkey Table Lamp ,Resin , Warm White  ",,Sponsored,Only 2 left in stock.,"₹9,999","₹5,999","Save ₹4,000 (40%)",,,https://www.amazon.in/gp/slredirect/picassoRedirect.html/ref=pa_sp_mtf_aps_sr_pg2_1?ie=UTF8&adId=A0024996H6ZVN2E41EJI&url=%2FSmartway-Monkey-Table-Resin-White%2Fdp%2FB08XQV45S5%2Fref%3Dsr_1_62_sspa%3Fdchild%3D1%26keywords%3Dtable%2Blamp%26qid%3D1628087337%26sr%3D8-62-spons%26psc%3D1&qualifier=1628087337&id=8907076288515441&widgetName=sp_mtf
"HELICON Table Lamp, Silver- Chrome Finished, Round, Pack of 1  ",,,,₹650,₹579,Save ₹71 (11%),3.7 out of 5 stars,581,https://www.amazon.in/HELICON-Strong-Stainless-reading-working/dp/B071WC7HXZ/ref=sr_1_63?dchild=1&keywords=table+lamp&qid=1628087337&sr=8-63
IDOLESHOP® Desk Light with 3 Shades Touch Control Light and Mobile Holder Design with Night Light Study Lamp (5 in One (Round)  ,,,,"₹1,899",₹629,"Save ₹1,270 (67%)",4.2 out of 5 stars,365,https://www.amazon.in/IDOLESHOP-Shades-Control-Mobile-Holder/dp/B08KKZBY1T/ref=sr_1_64?dchild=1&keywords=table+lamp&qid=1628087337&sr=8-64
"make in modern Wood Table Lamp, Black  ",,,,"₹2,299",₹939,"Save ₹1,360 (59%)",4.3 out of 5 stars,420,https://www.amazon.in/Inches-Pyramid-Wooden-Modern-Finish/dp/B073WGHJ9B/ref=sr_1_65?dchild=1&keywords=table+lamp&qid=1628087337&sr=8-65
"hayden Plastic Desk Lamp With Pen/Phone Holder, Multicolour,Pack of 1  ",,,,₹999,₹789,Save ₹210 (21%),4.2 out of 5 stars,844,https://www.amazon.in/Rechargeable-Control-360%C2%B0Flexible-Charging-Students/dp/B08M679DY7/ref=sr_1_66?dchild=1&keywords=table+lamp&qid=1628087337&sr=8-66
Azacus 360 Adjustable Study Lamp for Student with 3 Different Lights and Touch Control ON-Off & Brightness Adjustments (Pen Stand+Mobile Stand+Drawer+Night Light) (Warm Yellow Colour for Study at Night)  ,,,,"₹1,299",₹685,Save ₹614 (47%),4.6 out of 5 stars,22,https://www.amazon.in/Azacus-Adjustable-Different-Brightness-Adjustments/dp/B08YZ1RRHV/ref=sr_1_67?dchild=1&keywords=table+lamp&qid=1628087337&sr=8-67
"Sunsenses Black 23"" Doctor Table Lamp for Reading / Study / Learning / Work with Free Shipping & COD  ",,,,"₹1,245",₹978,Save ₹267 (21%),4.4 out of 5 stars,447,https://www.amazon.in/Sunsenses-Doctor-Reading-Learning-Available/dp/B071RJRJBV/ref=sr_1_68?dchild=1&keywords=table+lamp&qid=1628087337&sr=8-68
Kavana™ Rechargeable Desk/Study Lamp Touch Led On/Off Switch Desk Table Lamp Office Desk lamp for Students Touch Reading Dimmer Childeren Eye Safety Protection (White)  ,,,,₹699,₹399,Save ₹300 (43%),4.1 out of 5 stars,196,https://www.amazon.in/KavanaTM-Rechargeable-lamp-Childeren-Protection/dp/B08VD4P7MP/ref=sr_1_69?dchild=1&keywords=table+lamp&qid=1628087337&sr=8-69
Homenique Orange Flower Shade Traditional Farmhouse Table Lamps with Fabric Shade for Living Room Bedroom House Bedside Nightstand Home Office (Bulb not Included)  ,,,,₹980,₹540,Save ₹440 (45%),4.3 out of 5 stars,13,https://www.amazon.in/Homenique-Traditional-Farmhouse-Table-Nightstand/dp/B091182B6Q/ref=sr_1_70?dchild=1&keywords=table+lamp&qid=1628087337&sr=8-70
Wipro Symphony 6-Watt Rechargeable LED Table Lamp (White)  ,,,,"₹1,500",₹899,Save ₹601 (40%),4.1 out of 5 stars,"1,337",https://www.amazon.in/Wipro-Symphony-6-Watt-Rechargeable-Table/dp/B07DYFBMCQ/ref=sr_1_71?dchild=1&keywords=table+lamp&qid=1628087337&sr=8-71
T TOPLINE Moon Lamp Color Changing Decoration Ball Night with Wooden Stand Lamps for Bedroom Night lamp Bedroom Lights for Table  ,,,,₹699,₹580,Save ₹119 (17%),5.0 out of 5 stars,1,https://www.amazon.in/TOPLINE-Changing-Decoration-Wooden-Bedroom/dp/B098LN461Z/ref=sr_1_72?dchild=1&keywords=table+lamp&qid=1628087337&sr=8-72
"SearchandFound Alliance Deal LED loft Study Table lamp with Marble Base, Red  ",,,,₹999,₹305,Save ₹694 (69%),4.4 out of 5 stars,6,https://www.amazon.in/SearchandFound-Alliance-Study-Table-Marble/dp/B08XPSF4P5/ref=sr_1_73?dchild=1&keywords=table+lamp&qid=1628087337&sr=8-73
Vivan Creation Ceramic White Rechargeable Led Touch On Off Switch Desk Lamp Children Eye Protection Student Study Reading Dimmer Rechargeable Led Table Lamps  ,,,,"₹1,000",₹300,Save ₹700 (70%),,,https://www.amazon.in/Vivan-Creation-Rechargeable-Children-Protection/dp/B09BLWM35Y/ref=sr_1_74?dchild=1&keywords=table+lamp&qid=1628087337&sr=8-74
"DIVING DEEP Vintage Style Round Doctor Flexible with Branded 9W LED Bulb Table Lamp  (48 cm, Black)  ",,,,"₹1,999",₹699,"Save ₹1,300 (65%)",2.1 out of 5 stars,4,https://www.amazon.in/DIVING-DEEP-Vintage-Flexible-Branded/dp/B0947F6CPS/ref=sr_1_75?dchild=1&keywords=table+lamp&qid=1628087337&sr=8-75
krit enterprise Study lamp Rechargeable Led Touch On Off Switch Student Study Reading Dimmer Led Table Lamps White Desk Light lamp  ,,,,"₹1,099",₹299,Save ₹800 (73%),,,https://www.amazon.in/krit-enterprise-Rechargeable-Student-Reading/dp/B09B5BPRHV/ref=sr_1_76?dchild=1&keywords=table+lamp&qid=1628087337&sr=8-76
echargeable New Light Study Table Lamp Desk Light Touch Model with Touch Control Very Useful Night lamp & Pen Stand Study Table Lamp  ,,,,"₹1,399",₹649,Save ₹750 (54%),,,https://www.amazon.in/echargeable-Light-Study-Control-Useful/dp/B08XJMZHKY/ref=sr_1_77?dchild=1&keywords=table+lamp&qid=1628087337&sr=8-77
"PHILIPS Plastic Table Lamp, White  ",,,,"₹1,499","₹1,199",Save ₹300 (20%),3.9 out of 5 stars,5,https://www.amazon.in/PHILIPS-Plastic-Table-Lamp-White/dp/B096XSGV54/ref=sr_1_78?dchild=1&keywords=table+lamp&qid=1628087337&sr=8-78
