name,badge_1,badge_2,badge_3,mrp,discounted_price,discount,rating,rating_count,link
"LuvLap Sunshine Stroller/Pram, Easy Fold, for Newborn Baby/Kids, 0-3 Years (Navy Blue)  ",Best seller,Sponsored,,"₹5,299","₹3,800","Save ₹1,499 (28%)",4.1 out of 5 stars,"8,718",https://www.amazon.in/gp/bestsellers/baby/1953483031/ref=sr_bs_0_1953483031_1
"Chicco Cortina CX Stroller with 8-Reclining Positions, Pram for boys and girls, For babies 0-4 years (Lava, Red)  ",,Sponsored,,"₹18,990","₹15,688","Save ₹3,302 (17%)",4.5 out of 5 stars,95,https://www.amazon.in/gp/slredirect/picassoRedirect.html/ref=pa_sp_atf_aps_sr_pg1_1?ie=UTF8&adId=A05498691DAAHRBWENTEH&url=%2FChicco-Lava-Cortina-Stroller-Multicolor%2Fdp%2FB06XYMNWCR%2Fref%3Dsr_1_2_sspa%3Fdchild%3D1%26keywords%3Dstroller%26qid%3D1628356019%26sr%3D8-2-spons%26psc%3D1&qualifier=1628356019&id=571592872688594&widgetName=sp_atf
"Luvlap Starshine Stroller/Pram, Easy Fold for Newborn Baby/Kids, 0-3 Years (Red) (18135)  ",Amazon's Choice,,,"₹4,399","₹3,079","Save ₹1,320 (30%)",4.2 out of 5 stars,"4,249",https://www.amazon.in/LuvLap-StarShine-Baby-Stroller-Red/dp/B00JIS7986/ref=ice_ac_b_dpb?dchild=1&keywords=stroller&qid=1628356019&sr=8-3
"LuvLap Sunshine Stroller/Pram, Easy Fold, for Newborn Baby/Kids, 0-3 Years (Orange)  ",Best seller,,,"₹4,499","₹3,429","Save ₹1,070 (24%)",4.1 out of 5 stars,"8,718",https://www.amazon.in/gp/bestsellers/baby/1953483031/ref=sr_bs_3_1953483031_1
"LuvLap Galaxy Stroller/Pram, Extra Large Seating Space, Easy Fold, for Newborn Baby/Kids, 0-3 Years (Green/Black)  ",,,,"₹7,799","₹6,199","Save ₹1,600 (21%)",4.2 out of 5 stars,"3,385",https://www.amazon.in/LuvLap-Galaxy-Stroller-Green-Black/dp/B01MZB0JOO/ref=sr_1_5?dchild=1&keywords=stroller&qid=1628356019&sr=8-5
"LuvLap Joy Stroller/Pram, Compact and Easy Fold, for Newborn Baby/Kids, 0-3 Years (Black)  ",,,,"₹5,999","₹4,199","Save ₹1,800 (30%)",4.0 out of 5 stars,"1,621",https://www.amazon.in/Luvlap-Joy-Baby-Stroller-Black/dp/B06WP9LFYS/ref=sr_1_6?dchild=1&keywords=stroller&qid=1628356019&sr=8-6
R for Rabbit Lollipop Lite Colorful Stroller & Pram with Easy Fold for Newborn Baby | Kids of 0 to 3 Years (Rainbow Multi Color)  ,Deal of the Day ,,,"₹4,995","₹3,338","Save ₹1,657 (33%)",4.2 out of 5 stars,"1,101",https://www.amazon.in/Rabbit-Lollipop-Colourful-Stroller-Rainbow/dp/B079282QXR/ref=sr_1_7?dchild=1&keywords=stroller&qid=1628356019&sr=8-7
R for Rabbit Chocolate Ride - The Designer Baby Stroller and Pram  ,Deal of the Day ,,,"₹8,991","₹6,420","Save ₹2,571 (29%)",4.4 out of 5 stars,501,https://www.amazon.in/Rabbit-Chocolate-Ride-Designer-Stroller/dp/B0155JXKPC/ref=sr_1_8?dchild=1&keywords=stroller&qid=1628356019&sr=8-8
"LuvLap City Stroller/Buggy, Compact & Travel Friendly, for Baby/Kids, 6-36 Months (Black)  ",,,,"₹4,199","₹3,039","Save ₹1,160 (28%)",4.2 out of 5 stars,707,https://www.amazon.in/LuvLap-City-Stroller-Buggy-Black/dp/B01N23NTUP/ref=sr_1_9?dchild=1&keywords=stroller&qid=1628356019&sr=8-9
"StarAndDaisy Ultra Multi-Purpose, Multi-Adjustment Stroller pram Travel Friendly, Broad seat & Bed Buggy for 0-36 Months (Blue)  ",,,,"₹10,999","₹6,199","Save ₹4,800 (44%)",4.3 out of 5 stars,91,https://www.amazon.in/StarAndDaisy-Multi-Purpose-Multi-Adjustment-Stroller-Friendly/dp/B08K7TKY6N/ref=sr_1_10?dchild=1&keywords=stroller&qid=1628356019&sr=8-10
R for Rabbit Hokey Pokey Lite Luxurious Baby Stroller and Pram for Kids|New Born|Infants of 0 to 3 Years (Blue)  ,,Sponsored,,"₹13,995","₹8,796","Save ₹5,199 (37%)",3.5 out of 5 stars,11,https://www.amazon.in/gp/slredirect/picassoRedirect.html/ref=pa_sp_mtf_aps_sr_pg1_1?ie=UTF8&adId=A0131463397U8JMB418GY&url=%2FRabbit-Hokey-Luxurious-Stroller-Infants%2Fdp%2FB083LQH9DP%2Fref%3Dsr_1_11_sspa%3Fdchild%3D1%26keywords%3Dstroller%26qid%3D1628356019%26sr%3D8-11-spons%26psc%3D1&qualifier=1628356019&id=571592872688594&widgetName=sp_mtf
R for Rabbit Street Smart Stroller and Pram with Auto Fold for Kids | Infants | Newborn Boy & Girl of 0 to 3 Years (Black)  ,Deal of the Day ,Sponsored,,"₹12,996","₹9,580","Save ₹3,416 (26%)",4.0 out of 5 stars,2,https://www.amazon.in/gp/slredirect/picassoRedirect.html/ref=pa_sp_mtf_aps_sr_pg1_1?ie=UTF8&adId=A0647955GAX15S91YI10&url=%2FRabbit-Street-Stroller-Infants-Newborn%2Fdp%2FB08Q7N77Z7%2Fref%3Dsr_1_12_sspa%3Fdchild%3D1%26keywords%3Dstroller%26qid%3D1628356019%26sr%3D8-12-spons%26psc%3D1&qualifier=1628356019&id=571592872688594&widgetName=sp_mtf
"LuvLap Tutti Frutti Stroller/Buggy, Compact & Travel Friendly, for Baby/Kids, 6-36 Months (Printed Black)  ",,,,"₹2,599","₹2,185",Save ₹414 (16%),4.2 out of 5 stars,"1,122",https://www.amazon.in/LuvLap-Tutti-Frutti-Stroller-Printed/dp/B01N23C9Y1/ref=sr_1_13?dchild=1&keywords=stroller&qid=1628356019&sr=8-13
Little Pumpkin - Baby Stroller and Pram for Baby/Newborn/Kids - Buggy for Kids | Easy Foldable and Carry |Kids Age 0-3 Years (Blue)  ,Deal of the Day ,,,"₹2,790","₹1,755","Save ₹1,035 (37%)",4.6 out of 5 stars,570,https://www.amazon.in/Little-Pumpkin-Baby-Stroller-Buggy/dp/B079L7R7Q4/ref=sr_1_14?dchild=1&keywords=stroller&qid=1628356019&sr=8-14
"Little kids® Presents Stroller with Rocker Function, Rotating Wheels and Adjustable Seat(Blue)  ",,,,"₹9,999","₹3,499","Save ₹6,500 (65%)",4.9 out of 5 stars,10,https://www.amazon.in/Little-Presents-Stroller-Function-Adjustable/dp/B08X2CHYVN/ref=sr_1_15?dchild=1&keywords=stroller&qid=1628356019&sr=8-15
R For Rabbit Cutie Pie Baby Stroller | Portable Baby Stroller and Pram for Baby/Kids/Infants/Newborn | Boy & Girl of Age 0 to 3 Years (Green Black)  ,,,,"₹6,399","₹5,191","Save ₹1,208 (19%)",5.0 out of 5 stars,1,https://www.amazon.in/Rabbit-Stroller-Portable-Infants-Newborn/dp/B098XNBBD3/ref=sr_1_16?dchild=1&keywords=stroller&qid=1628356019&sr=8-16
"LuvLap Apollo Stroller/Pram, Easy Fold, for Newborn Baby/Kids, 0-3 Years (Black)  ",Deal of the Day ,,,"₹3,199","₹2,403",Save ₹796 (25%),3.8 out of 5 stars,992,https://www.amazon.in/LuvLap-Apollo-Baby-Stroller-Black/dp/B078KX23T4/ref=sr_1_17?dchild=1&keywords=stroller&qid=1628356019&sr=8-17
R for Rabbit Pocket Stroller Lite Portable Travel Friendly Pre Installed Baby Stroller and Pram for Baby/Kids/Infants/Newborn | Stroller for Baby Boys & Girls of Age 0 to 3 Years (Grey)  ,Deal of the Day ,,,"₹7,794","₹5,069","Save ₹2,725 (35%)",4.4 out of 5 stars,271,https://www.amazon.in/Rabbit-Pocket-Stroller-Lite-Installation/dp/B07GSY5TPX/ref=sr_1_18?dchild=1&keywords=stroller&qid=1628356019&sr=8-18
"StarAndDaisy Multi-Purpose, Multi-Adjustment Stroller pram Travel Friendly, Broad seat & Bed Buggy for 0-36 Months (Brown)  ",,,,"₹10,999","₹6,199","Save ₹4,800 (44%)",,,https://www.amazon.in/StarAndDaisy-Multi-Purpose-Multi-Adjustment-Stroller-Friendly/dp/B09B9N3Q27/ref=sr_1_19?dchild=1&keywords=stroller&qid=1628356019&sr=8-19
Little kids® Presents Stroller Rotating Wheels and Adjustable Seat(Blue)  ,,,,"₹4,499","₹1,999","Save ₹2,500 (56%)",4.3 out of 5 stars,3,https://www.amazon.in/Little-Presents-Stroller-Rotating-Adjustable/dp/B08X253BV8/ref=sr_1_20?dchild=1&keywords=stroller&qid=1628356019&sr=8-20
R For Rabbit Cutie Pie Baby Stroller | Portable Baby Stroller and Pram for Baby/Kids/Infants/Newborn | Boy & Girl of Age 0 to 3 Years (Green Black)  ,,Sponsored,,"₹6,399","₹5,191","Save ₹1,208 (19%)",5.0 out of 5 stars,1,https://www.amazon.in/gp/slredirect/picassoRedirect.html/ref=pa_sp_btf_aps_sr_pg1_1?ie=UTF8&adId=A02590018RQMT49EWFBG&url=%2FRabbit-Stroller-Portable-Infants-Newborn%2Fdp%2FB098XNBBD3%2Fref%3Dsr_1_21_sspa%3Fdchild%3D1%26keywords%3Dstroller%26qid%3D1628356019%26sr%3D8-21-spons%26psc%3D1&qualifier=1628356019&id=571592872688594&widgetName=sp_btf
R for Rabbit Chocolate Ride - The Designer Baby Stroller and Pram  ,Deal of the Day ,Sponsored,,"₹8,991","₹6,420","Save ₹2,571 (29%)",4.4 out of 5 stars,501,https://www.amazon.in/gp/slredirect/picassoRedirect.html/ref=pa_sp_btf_aps_sr_pg1_1?ie=UTF8&adId=A0771705N2DDKXHYX0SJ&url=%2FRabbit-Chocolate-Ride-Designer-Stroller%2Fdp%2FB0155JXKPC%2Fref%3Dsr_1_22_sspa%3Fdchild%3D1%26keywords%3Dstroller%26qid%3D1628356019%26sr%3D8-22-spons%26psc%3D1&qualifier=1628356019&id=571592872688594&widgetName=sp_btf
"Chicco Ohlalà 2 Stroller, Pram for boys and girls, Light weight & Easy to carry, For babies 0-4 years (Black Night)  ",,Sponsored,,"₹12,990","₹10,392","Save ₹2,598 (20%)",4.3 out of 5 stars,616,https://www.amazon.in/gp/slredirect/picassoRedirect.html/ref=pa_sp_atf_next_aps_sr_pg2_1?ie=UTF8&adId=A055694515P0Q6M07ZR72&url=%2FChicco-Ohlala-Stroller-Black-Night%2Fdp%2FB07G36P8HK%2Fref%3Dsr_1_17_sspa%3Fdchild%3D1%26keywords%3Dstroller%26qid%3D1628356041%26sr%3D8-17-spons%26psc%3D1&qualifier=1628356041&id=7412381745445610&widgetName=sp_atf_next
"Chicco Simplicity Plus Stroller with Five-point safety harness system, Pram for boys and girls, For babies 0-4 years (Scarlet, Red)  ",,Sponsored,,"₹14,490","₹11,322","Save ₹3,168 (22%)",4.4 out of 5 stars,62,https://www.amazon.in/gp/slredirect/picassoRedirect.html/ref=pa_sp_atf_next_aps_sr_pg2_1?ie=UTF8&adId=A0549433NMTJ52KR1POT&url=%2FChicco-Simplicity-Plus-Stroller-Scarlet%2Fdp%2FB07P5MLBPD%2Fref%3Dsr_1_18_sspa%3Fdchild%3D1%26keywords%3Dstroller%26qid%3D1628356041%26sr%3D8-18-spons%26psc%3D1&qualifier=1628356041&id=7412381745445610&widgetName=sp_atf_next
"Chicco Cortina CX Stroller with 8-Reclining Positions, Pram for boys and girls, For babies 0-4 years (Lava, Red)  ",,,,"₹18,990","₹15,688","Save ₹3,302 (17%)",4.5 out of 5 stars,95,https://www.amazon.in/Chicco-Lava-Cortina-Stroller-Multicolor/dp/B06XYMNWCR/ref=sr_1_19?dchild=1&keywords=stroller&qid=1628356041&sr=8-19
R for Rabbit Ginny and Johnny – Baby Twin Stroller and Pram Easy Foldable with Adjustable Seating Positions with Huge Storage Basket (Blue Black)  ,Deal of the Day ,,,"₹9,999","₹7,030","Save ₹2,969 (30%)",4.2 out of 5 stars,102,https://www.amazon.in/Rabbit-Ginny-Johnny-Stroller-Black/dp/B07HQSQFTL/ref=sr_1_20?dchild=1&keywords=stroller&qid=1628356041&sr=8-20
Maanit Stroller Cum Swing for Newborn Baby 0-3 Years Old Kids (Pink)  ,,,,"₹1,299",₹999,Save ₹300 (23%),2.9 out of 5 stars,13,https://www.amazon.in/Maanit-Stroller-Swing-Newborn-Years/dp/B0843QTJW3/ref=sr_1_21?dchild=1&keywords=stroller&qid=1628356041&sr=8-21
R For Rabbit Pixie Buggy & Stroller | Baby Stroller and Pram for Baby/Newborn/Kids - Buggy for Kids | Easy Foldable and Carry | Kids Age 6 Months -3 Years (Black Grey)  ,,,,"₹3,699","₹2,991",Save ₹708 (19%),4.5 out of 5 stars,2,https://www.amazon.in/Rabbit-Pixie-Buggy-Stroller-Newborn/dp/B09B2J5PJV/ref=sr_1_17?dchild=1&keywords=stroller&qid=1628356041&sr=8-17
"Baby Stroller/Pram, Easy Fold, for New Born Baby/Kids, 0-3 Years (Red)  ",,,,"₹2,499","₹1,399","Save ₹1,100 (44%)",3.3 out of 5 stars,14,https://www.amazon.in/Baby-Stroller-Pram-Easy-Years/dp/B08XPGKC22/ref=sr_1_18?dchild=1&keywords=stroller&qid=1628356041&sr=8-18
Little Pumpkin Kiddie Kingdom Stroller and Pram for Baby | Kids | Infants | Newborn |Boy & Girl of 0 to 3 Years((Green Black)  ,Deal of the Day ,,,"₹2,790","₹1,755","Save ₹1,035 (37%)",4.5 out of 5 stars,234,https://www.amazon.in/Little-Pumpkin-Stroller-Buggy-Green/dp/B079L5S4SH/ref=sr_1_19?dchild=1&keywords=stroller&qid=1628356041&sr=8-19
"Mee Mee Baby Stroller Pram | 3 Position Seating | Reversible Handle | Fully Rotating Wheels | for Newborn Baby/Kids, 0-4 Years (Navy Blue)  ",,,,"₹4,299","₹2,649","Save ₹1,650 (38%)",3.5 out of 5 stars,72,https://www.amazon.in/Mee-Adjustable-Seating-Positions-Reversible/dp/B07XLSS16C/ref=sr_1_20?dchild=1&keywords=stroller&qid=1628356041&sr=8-20
Little Pumpkin Kiddie Kingdom Stroller and Pram for Baby | Kids | Infants | Newborn |Boy & Girl of 0 to 3 Years((Green Black)  ,Deal of the Day ,,,"₹4,500","₹2,769","Save ₹1,731 (38%)",4.3 out of 5 stars,694,https://www.amazon.in/Little-Pumpkin-Kiddie-Kingdom-Stroller/dp/B07KX2BVVH/ref=sr_1_21?dchild=1&keywords=stroller&qid=1628356041&sr=8-21
"Luvlap Starshine Stroller/Pram, Easy Fold for Newborn Baby/Kids, 0-3 Years (Red) (18135)  ",Amazon's Choice,Sponsored,,"₹4,399","₹3,079","Save ₹1,320 (30%)",4.2 out of 5 stars,"4,249",https://www.amazon.in/gp/slredirect/picassoRedirect.html/ref=pa_sp_mtf_aps_sr_pg2_1?ie=UTF8&adId=A01631001HM9V60TZAGM3&url=%2FLuvLap-StarShine-Baby-Stroller-Red%2Fdp%2FB00JIS7986%2Fref%3Dice_ac_b_dpb_sspa%3Fdchild%3D1%26keywords%3Dstroller%26qid%3D1628356041%26sr%3D8-22-spons%26psc%3D1&qualifier=1628356041&id=7412381745445610&widgetName=sp_mtf
"LuvLap Joy Stroller/Pram, Compact and Easy Fold, for Newborn Baby/Kids, 0-3 Years (Black)  ",,Sponsored,,"₹5,999","₹4,199","Save ₹1,800 (30%)",4.0 out of 5 stars,"1,621",https://www.amazon.in/gp/slredirect/picassoRedirect.html/ref=pa_sp_mtf_aps_sr_pg2_1?ie=UTF8&adId=A01552283QIUW6WKBOW7H&url=%2FLuvlap-Joy-Baby-Stroller-Black%2Fdp%2FB06WP9LFYS%2Fref%3Dsr_1_23_sspa%3Fdchild%3D1%26keywords%3Dstroller%26qid%3D1628356041%26sr%3D8-23-spons%26psc%3D1&qualifier=1628356041&id=7412381745445610&widgetName=sp_mtf
R for Rabbit Rock N Roll The Rocking Baby Stroller and Pram with Easy Fold for Newborn Baby | Kids of Age 0 to 3 Years (Black)  ,Deal of the Day ,,,"₹7,992","₹6,102","Save ₹1,890 (24%)",4.2 out of 5 stars,191,https://www.amazon.in/Rabbit-Rocking-Stroller-Newborn-Years/dp/B08N11YF7F/ref=sr_1_24?dchild=1&keywords=stroller&qid=1628356041&sr=8-24
"Chicco Echo Stroller With Bumper Bar, Pram for boys and girls, Trendy style & Safe strolling, For Babies 0-4 years (Stone, Black)  ",Deal of the Day ,,,"₹11,490","₹8,043","Save ₹3,447 (30%)",4.2 out of 5 stars,305,https://www.amazon.in/Chicco-Stroller-Stone-Bumper-Black/dp/B07576HJ25/ref=sr_1_25?dchild=1&keywords=stroller&qid=1628356041&sr=8-25
"Chicco TrolleyMe Stroller, Pram for boys and girls, Lightweight & Easy to carry with Trolley function, For babies 0m+ (Stone, Black)  ",Deal of the Day ,,,"₹13,990","₹11,191","Save ₹2,799 (20%)",4.1 out of 5 stars,73,https://www.amazon.in/Chicco-TrolleyMe-Stroller-Newborn-Toddlers/dp/B07YLXH11C/ref=sr_1_26?dchild=1&keywords=stroller&qid=1628356041&sr=8-26
"Chicco Goody Stroller, Pram for boys and girls, Auto Fold Mechanism & Premium Design, For babies 0m+ (Graphite)  ",,,,"₹19,990","₹15,706","Save ₹4,284 (21%)",4.7 out of 5 stars,25,https://www.amazon.in/Chicco-Stroller-Graphite-Toddlers-Mechanism/dp/B07YLV8MMN/ref=sr_1_27?dchild=1&keywords=stroller&qid=1628356041&sr=8-27
"Safe O Kid Stroller Seat Cover Clips, Pram Toy Holder, Buggy Accessory for Baby, Black  ",,,,₹329,₹219,Save ₹110 (33%),4.0 out of 5 stars,1,https://www.amazon.in/Stroller-Cover-Clips-Holder-Accessory/dp/B08LZF96YS/ref=sr_1_28?dchild=1&keywords=stroller&qid=1628356041&sr=8-28
"Chicco Echo Stroller With Bumper Bar, Pram for boys and girls, Trendy style & Safe strolling, For Babies 0-4 years (Scarlet, Red)  ",Deal of the Day ,,,"₹11,490","₹8,043","Save ₹3,447 (30%)",4.2 out of 5 stars,255,https://www.amazon.in/Chicco-Echo-Stroller-Bumper-Scarlet/dp/B07575QZPQ/ref=sr_1_29?dchild=1&keywords=stroller&qid=1628356041&sr=8-29
"Peg Perego Stroller Travel Bag with Wheels, Black  ",,,,,,,5.0 out of 5 stars,8,https://www.amazon.in/Peg-Perego-Stroller-Travel-Wheels/dp/B07YF8CFCK/ref=sr_1_30?dchild=1&keywords=stroller&qid=1628356041&sr=8-30
R for Rabbit Sugar Pop Baby Stroller | Pram with Auto Fold for Newborn Baby | Kids Pram and Stroller |Baby Stroller for Boy and Girl of 0 to 3 Years (Pink Grey)  ,Deal of the Day ,,,"₹6,696","₹5,068","Save ₹1,628 (24%)",4.3 out of 5 stars,38,https://www.amazon.in/Rabbit-Sugar-Stroller-Infants-Girls/dp/B08GS672ML/ref=sr_1_31?dchild=1&keywords=stroller&qid=1628356041&sr=8-31
"LuvLap Sunshine Stroller/Pram, Easy Fold, for Newborn Baby/Kids, 0-3 Years (Orange)  ",Best seller,Sponsored,,"₹5,299","₹3,429","Save ₹1,870 (35%)",4.1 out of 5 stars,"8,718",https://www.amazon.in/gp/bestsellers/baby/1953483031/ref=sr_bs_15_1953483031_1
"Chicco Echo Stroller With Bumper Bar, Pram for boys and girls, Trendy style & Safe strolling, For Babies 0-4 years (Stone, Black)  ",Deal of the Day ,Sponsored,,"₹11,490","₹8,043","Save ₹3,447 (30%)",4.2 out of 5 stars,305,https://www.amazon.in/gp/slredirect/picassoRedirect.html/ref=pa_sp_btf_aps_sr_pg2_1?ie=UTF8&adId=A08674162TG9NEZ0XLN11&url=%2FChicco-Stroller-Stone-Bumper-Black%2Fdp%2FB07576HJ25%2Fref%3Dsr_1_33_sspa%3Fdchild%3D1%26keywords%3Dstroller%26qid%3D1628356041%26sr%3D8-33-spons%26psc%3D1&qualifier=1628356041&id=7412381745445610&widgetName=sp_btf
"Chicco Simplicity Plus Stroller with Five-point safety Harness System, Pram for boys and girls, For babies 0-4 years (India Ink, Blue)  ",,Sponsored,,"₹13,490","₹12,120","Save ₹1,370 (10%)",4.4 out of 5 stars,62,https://www.amazon.in/gp/slredirect/picassoRedirect.html/ref=pa_sp_atf_next_aps_sr_pg3_1?ie=UTF8&adId=A05492773N14G5E94AU0N&url=%2FChicco-Simplicity-Plus-Stroller-India%2Fdp%2FB07P6KSWSS%2Fref%3Dsr_1_33_sspa%3Fdchild%3D1%26keywords%3Dstroller%26qid%3D1628356057%26sr%3D8-33-spons%26psc%3D1&qualifier=1628356057&id=3315685704640985&widgetName=sp_atf_next
"Chicco TrolleyMe Stroller, Pram for boys and girls, Lightweight & Easy to carry with Trolley function, For babies 0m+ (Stone, Black)  ",Deal of the Day ,Sponsored,,"₹13,990","₹11,191","Save ₹2,799 (20%)",4.1 out of 5 stars,73,https://www.amazon.in/gp/slredirect/picassoRedirect.html/ref=pa_sp_atf_next_aps_sr_pg3_1?ie=UTF8&adId=A01061482BEY2L29U96TO&url=%2FChicco-TrolleyMe-Stroller-Newborn-Toddlers%2Fdp%2FB07YLXH11C%2Fref%3Dsr_1_34_sspa%3Fdchild%3D1%26keywords%3Dstroller%26qid%3D1628356057%26sr%3D8-34-spons%26psc%3D1&qualifier=1628356057&id=3315685704640985&widgetName=sp_atf_next
"Graco Modes Nest Baby Stroller with Height Adjustable Reversible Seat, Bassinet Mode, Extra Large Storage, Nico, Self Standing Fold with Flat Recline & Lightweight Aluminum Frame  ",,,,"₹39,999","₹34,499","Save ₹5,500 (14%)",5.0 out of 5 stars,10,https://www.amazon.in/Graco-Stroller-Adjustable-Reversible-Lightweight/dp/B08K2GNY8L/ref=sr_1_35?dchild=1&keywords=stroller&qid=1628356057&sr=8-35
SHOPITRRA Baby Dolls Stroller Foldable Babies Pram Baby Age 2 Year Above (Red Colored) Multicolor…  ,,,,"₹2,999",₹899,"Save ₹2,100 (70%)",,,https://www.amazon.in/SHOPITRRA-Stroller-Foldable-Colored-Multicolor/dp/B097ZD5T5X/ref=sr_1_36?dchild=1&keywords=stroller&qid=1628356057&sr=8-36
Graco Citi Go Baby Stroller | Ultra-Lightweight & Reversible Pram Weighs Under 4 kg | Holden (Blue)  ,,,,"₹19,999","₹17,439","Save ₹2,560 (13%)",3.6 out of 5 stars,8,https://www.amazon.in/Graco-Citi-Stroller-Holden-Blue/dp/B077MCYSCW/ref=sr_1_37?dchild=1&keywords=stroller&qid=1628356057&sr=8-37
"NHR Vaux Foldable Stroller and Trike with Push Handle, Safety Footrest and Armrest for Kids (Orange, 2-7 Years)  ",,,,"₹2,400","₹2,000",Save ₹400 (17%),5.0 out of 5 stars,1,https://www.amazon.in/NHR-Foldable-Stroller-Footrest-Armrest/dp/B07YSMXJKP/ref=sr_1_33?dchild=1&keywords=stroller&qid=1628356057&sr=8-33
Tiffy & Toffee Maxtrem Buggy Stroller - Blue  ,,,,"₹2,799","₹1,669","Save ₹1,130 (40%)",5.0 out of 5 stars,3,https://www.amazon.in/Tiffy-Toffee-Maxtrem-Buggy-Stroller/dp/B085YR5NQ1/ref=sr_1_34?dchild=1&keywords=stroller&qid=1628356057&sr=8-34
"Graco Modes Duo Double Stroller | 27 Riding Options for 2 Kids from Infant to Youth, Basin  ",,,,"₹44,999","₹40,499","Save ₹4,500 (10%)",4.4 out of 5 stars,836,https://www.amazon.in/Graco-Modes-Stroller-Basin-Size/dp/B01JSC09BK/ref=sr_1_35?dchild=1&keywords=stroller&qid=1628356057&sr=8-35
Tiffy & Toffee 2 in 1 Rocking Stroller Purple  ,,,,"₹5,699","₹3,679","Save ₹2,020 (35%)",3.5 out of 5 stars,23,https://www.amazon.in/Tiffy-Toffee-Rocking-Stroller-Purple/dp/B082FGH7GY/ref=sr_1_36?dchild=1&keywords=stroller&qid=1628356057&sr=8-36
Fisher-Price Lil' Master Stroller - Multicolour  ,Deal of the Day ,,,"₹5,450","₹3,100","Save ₹2,350 (43%)",4.1 out of 5 stars,29,https://www.amazon.in/Fisher-Price-Lil-Master-Stroller-Multicolour/dp/B084VQC9TX/ref=sr_1_37?dchild=1&keywords=stroller&qid=1628356057&sr=8-37
"LuvLap Starshine Stroller/Pram, Easy Fold for Newborn Baby/Kids, 0-3 Years (Black)  ",,Sponsored,,"₹4,199","₹3,079","Save ₹1,120 (27%)",4.2 out of 5 stars,"4,249",https://www.amazon.in/gp/slredirect/picassoRedirect.html/ref=pa_sp_mtf_aps_sr_pg3_1?ie=UTF8&adId=A016341228IL8Q9OONTLY&url=%2FLuvlap-Star-Shine-Stroller-Black%2Fdp%2FB06WP9NV5F%2Fref%3Dsr_1_38_sspa%3Fdchild%3D1%26keywords%3Dstroller%26qid%3D1628356057%26sr%3D8-38-spons%26psc%3D1&qualifier=1628356057&id=3315685704640985&widgetName=sp_mtf
"LuvLap Joy Stroller/Pram, Compact and Easy Fold, for Newborn Baby/Kids, 0-3 Years (Printed Orange)  ",,Sponsored,,"₹5,495","₹4,199","Save ₹1,296 (24%)",4.0 out of 5 stars,"1,621",https://www.amazon.in/gp/slredirect/picassoRedirect.html/ref=pa_sp_mtf_aps_sr_pg3_1?ie=UTF8&adId=A01545483W0PPQK1HMEUT&url=%2FLuvlap-Joy-Baby-Stroller-Orange%2Fdp%2FB06WRWQ8LH%2Fref%3Dsr_1_39_sspa%3Fdchild%3D1%26keywords%3Dstroller%26qid%3D1628356057%26sr%3D8-39-spons%26psc%3D1&qualifier=1628356057&id=3315685704640985&widgetName=sp_mtf
"Simxen Stable and Safe Baby Strollers Lightweight Stroller One Hand, Easy Fold Stroller with Bumper Bar, Pram for Boys and Girls Easy Foldable Portable Kids Stroller Adjustable  ",,,,"₹3,199","₹2,999",Save ₹200 (6%),1.5 out of 5 stars,2,https://www.amazon.in/Simxen-Strollers-Lightweight-Stroller-Adjustable/dp/B097C1PYTR/ref=sr_1_40?dchild=1&keywords=stroller&qid=1628356057&sr=8-40
"HARISTAR® Baby Stroller/Pram, East to Move,Extra Large Seating Space,Easy Fold, for New Born Baby/Kids, 0-3 Years (RED)  ",,,,"₹4,999","₹1,399","Save ₹3,600 (72%)",4.0 out of 5 stars,3,https://www.amazon.in/HARISTAR%C2%AE-Stroller-Extra-Large-Seating/dp/B095T4HS5L/ref=sr_1_41?dchild=1&keywords=stroller&qid=1628356057&sr=8-41
"Babyzone Sunshine Stroller/Pram/Buggies Easy Fold, for New Born Baby/Kids, 0-3 Years (Blue)  ",,,,"₹2,499","₹2,199",Save ₹300 (12%),,,https://www.amazon.in/Babyzone-Sunshine-Stroller-Buggies-Years/dp/B08XWDHHHV/ref=sr_1_42?dchild=1&keywords=stroller&qid=1628356057&sr=8-42
"Sunbaby Angel Baby Stroller/Pram for New Born 0-3 Years, Extra Wide/Thick Cushion seat, Reversible Handle, Mosquito net, Best for Kids/Toddlers,Light Weight Foldable Umbrella Canopy Stroller -Multi  ",,,,"₹4,899","₹3,499","Save ₹1,400 (29%)",3.9 out of 5 stars,84,https://www.amazon.in/Sunbaby-SUNBABY-Angel-Stroller-Multi/dp/B07KTS5LZ5/ref=sr_1_43?dchild=1&keywords=stroller&qid=1628356057&sr=8-43
"Mee Mee Baby Stroller Pram |Quick One Hand Folding | Comfortable Seating | Fully Rotating Wheels | Feeding Tray| for Newborn Baby/Kids, 0-4 Years (Light Blue)  ",,,,"₹6,499","₹2,849","Save ₹3,650 (56%)",3.9 out of 5 stars,94,https://www.amazon.in/Mee-Easy-Push-Seating-Position/dp/B077XTDR36/ref=sr_1_44?dchild=1&keywords=stroller&qid=1628356057&sr=8-44
"Mee Mee Baby Pram (Shock Absorber, Blue)  ",,,,"₹7,499","₹5,059","Save ₹2,440 (33%)",3.9 out of 5 stars,18,https://www.amazon.in/Mee-Baby-Pram-Shock-Absorber/dp/B07S89QKG3/ref=sr_1_45?dchild=1&keywords=stroller&qid=1628356057&sr=8-45
"Babyzone® Pram and Stroller for New Born Baby/Baby Stroller/Extra Large Seating Space, Easy Fold, for New Born Baby/Kids, 0-3 Years/Kid pram Stroller/Stroller Baby boy  ",,,,"₹2,499","₹1,899",Save ₹600 (24%),3.8 out of 5 stars,3,https://www.amazon.in/Babyzone%C2%AE-Stroller-Extra-Large-Seating/dp/B09232HH8P/ref=sr_1_46?dchild=1&keywords=stroller&qid=1628356057&sr=8-46
"Stroller/Pram, Extra Large Seating Space, Easy Fold, for Newborn Baby/Kids, 0-3 Years  ",,,,"₹4,399","₹2,699","Save ₹1,700 (39%)",,,https://www.amazon.in/Stroller-Extra-Large-Seating-Newborn/dp/B092ZYTWH4/ref=sr_1_47?dchild=1&keywords=stroller&qid=1628356057&sr=8-47
R for Rabbit Rock N Roll The Rocking Baby Stroller and Pram with Easy Fold for Newborn Baby | Kids of Age 0 to 3 Years (Black)  ,Deal of the Day ,Sponsored,,"₹7,992","₹6,102","Save ₹1,890 (24%)",4.2 out of 5 stars,191,https://www.amazon.in/gp/slredirect/picassoRedirect.html/ref=pa_sp_btf_aps_sr_pg3_1?ie=UTF8&adId=A03192842XZB0DKH2BBR6&url=%2FRabbit-Rocking-Stroller-Newborn-Years%2Fdp%2FB08N11YF7F%2Fref%3Dsr_1_48_sspa%3Fdchild%3D1%26keywords%3Dstroller%26qid%3D1628356057%26sr%3D8-48-spons%26psc%3D1&qualifier=1628356057&id=3315685704640985&widgetName=sp_btf
"LuvLap Sunshine Stroller/Pram, Easy Fold, for Newborn Baby/Kids, 0-3 Years (Orange)  ",Best seller,Sponsored,,"₹4,499","₹3,429","Save ₹1,070 (24%)",4.1 out of 5 stars,"8,718",https://www.amazon.in/gp/bestsellers/baby/1953483031/ref=sr_bs_16_1953483031_1
"Chicco Echo Stroller With Bumper Bar, Pram for boys and girls, Trendy style & Safe strolling, For Babies 0-4 years (Scarlet, Red)  ",Deal of the Day ,Sponsored,,"₹11,490","₹8,043","Save ₹3,447 (30%)",4.2 out of 5 stars,255,https://www.amazon.in/gp/slredirect/picassoRedirect.html/ref=pa_sp_atf_next_aps_sr_pg4_1?ie=UTF8&adId=A054918930IUPYRTYFTR9&url=%2FChicco-Echo-Stroller-Bumper-Scarlet%2Fdp%2FB07575QZPQ%2Fref%3Dsr_1_49_sspa%3Fdchild%3D1%26keywords%3Dstroller%26qid%3D1628356073%26sr%3D8-49-spons%26psc%3D1&qualifier=1628356073&id=7283216680192494&widgetName=sp_atf_next
"LuvLap Starshine Stroller/Pram, Easy Fold for Newborn Baby/Kids, 0-3 Years (Blue)  ",,Sponsored,,"₹4,799","₹3,079","Save ₹1,720 (36%)",4.2 out of 5 stars,"4,249",https://www.amazon.in/gp/slredirect/picassoRedirect.html/ref=pa_sp_atf_next_aps_sr_pg4_1?ie=UTF8&adId=A0163256PU5COV0GF9ST&url=%2FLuvlap-Starshine-Baby-Pram-Stroller%2Fdp%2FB01LWBQJ11%2Fref%3Dsr_1_50_sspa%3Fdchild%3D1%26keywords%3Dstroller%26qid%3D1628356073%26sr%3D8-50-spons%26psc%3D1&qualifier=1628356073&id=7283216680192494&widgetName=sp_atf_next
