name,badge_1,badge_2,badge_3,mrp,discounted_price,discount,rating,rating_count,link
"Plutomart Delight Reversible Baby Stroller and Pram with Mosquito Net, Mama Diaper Bag and Wheel Breaks  ",,,,"₹5,800","₹4,050","Save ₹1,750 (30%)",,,https://www.amazon.in/Plutomart-Delight-Reversible-Stroller-Mosquito/dp/B092NSZJFV/ref=sr_1_51?dchild=1&keywords=stroller&qid=1628356073&sr=8-51
Kaome Stroller Hook  ,,,,"₹2,260","₹1,578",Save ₹682 (30%),4.3 out of 5 stars,28,https://www.amazon.in/Kaome-KM-SH01-Stroller-Hook/dp/B08FX4QJJQ/ref=sr_1_52?dchild=1&keywords=stroller&qid=1628356073&sr=8-52
Tiffy & Toffee Umberalla Stroller - Red  ,,,,"₹3,799","₹2,479","Save ₹1,320 (35%)",,,https://www.amazon.in/Tiffy-Toffee-Umberalla-Stroller-Red/dp/B092J5K2MJ/ref=sr_1_53?dchild=1&keywords=stroller&qid=1628356073&sr=8-53
Joie Mirus Reversible Handle Stroller (Birth to 17.5kg)  ,,,,"₹17,999","₹15,298","Save ₹2,701 (15%)",,,https://www.amazon.in/Joie-Reversible-Handle-Stroller-17-5kg/dp/B08YRBVDJT/ref=sr_1_49?dchild=1&keywords=stroller&qid=1628356073&sr=8-49
"Chicco Simplicity Plus Stroller with Five-point safety Harness System, Pram for boys and girls, For babies 0-4 years (India Ink, Blue)  ",,,,"₹13,490","₹12,120","Save ₹1,370 (10%)",4.4 out of 5 stars,62,https://www.amazon.in/Chicco-Simplicity-Plus-Stroller-India/dp/B07P6KSWSS/ref=sr_1_50?dchild=1&keywords=stroller&qid=1628356073&sr=8-50
"LuvLap Delight Stroller/Pram, with Suspension, for New Born Baby/Kids, 0-3 Years (Black)  ",Deal of the Day ,,,"₹4,599","₹2,472","Save ₹2,127 (46%)",4.0 out of 5 stars,109,https://www.amazon.in/LuvLap-Delight-Stroller-Pram-Black/dp/B078HMN2RF/ref=sr_1_51?dchild=1&keywords=stroller&qid=1628356073&sr=8-51
"GettBoles Foldable Baby Stroller for Kids-Buggy Pram for Newborn/Infants with Easy Folding, Footrest, Multi (Blue)  ",,,,"₹3,899","₹2,599","Save ₹1,300 (33%)",,,https://www.amazon.in/GettBoles-Foldable-Stroller-Kids-Buggy-Footrest/dp/B099FPDFLG/ref=sr_1_52?dchild=1&keywords=stroller&qid=1628356073&sr=8-52
"Mee Mee Baby Stroller Pram | Large Seating |Reversible Handle | Feeding Tray| Fully Rotating Wheels | for Newborn Baby/Kids, 0-5 Years (Dark Red)  ",,,,"₹7,499","₹5,076","Save ₹2,423 (32%)",3.6 out of 5 stars,23,https://www.amazon.in/Mee-Advanced-Shock-Absorber-Wheels/dp/B07HMFTDH8/ref=sr_1_53?dchild=1&keywords=stroller&qid=1628356073&sr=8-53
"Luvlap Joy Stroller/Pram, Compact and Easy Fold, for Newborn Baby/Kids, 0-3 Years (Yellow)  ",,Sponsored,,"₹5,999","₹3,846","Save ₹2,153 (36%)",4.0 out of 5 stars,"1,621",https://www.amazon.in/gp/slredirect/picassoRedirect.html/ref=pa_sp_mtf_aps_sr_pg4_1?ie=UTF8&adId=A0912332P9NSFODT5NZ4&url=%2FLuvlap-Baby-Stroller-Pram-Yellow%2Fdp%2FB079MC2PH5%2Fref%3Dsr_1_54_sspa%3Fdchild%3D1%26keywords%3Dstroller%26qid%3D1628356073%26sr%3D8-54-spons%26psc%3D1&qualifier=1628356073&id=7283216680192494&widgetName=sp_mtf
R for Rabbit Ginny and Johnny – Baby Twin Stroller and Pram Easy Foldable with Adjustable Seating Positions with Huge Storage Basket (Black Grey)  ,Deal of the Day ,Sponsored,,"₹9,999","₹7,033","Save ₹2,966 (30%)",4.2 out of 5 stars,102,https://www.amazon.in/gp/slredirect/picassoRedirect.html/ref=pa_sp_mtf_aps_sr_pg4_1?ie=UTF8&adId=A09550991EZJMA83PLL0H&url=%2FRabbit-Ginny-Johnny-Stroller-Black%2Fdp%2FB07SQJPB7W%2Fref%3Dsr_1_55_sspa%3Fdchild%3D1%26keywords%3Dstroller%26qid%3D1628356073%26sr%3D8-55-spons%26psc%3D1&qualifier=1628356073&id=7283216680192494&widgetName=sp_mtf
1st Step Yoyo Baby Stroller with 5 Point Safety Harness and Reversible Handlebar Stroller for Baby|Kids|Infants|New Born|Boys|Girls of 0 to 3 Years (Green)  ,,,,"₹5,299","₹3,458","Save ₹1,841 (35%)",4.7 out of 5 stars,9,https://www.amazon.in/Stroller-Harness-Reversible-Handlebar-Infants/dp/B08FMJS3L3/ref=sr_1_56?dchild=1&keywords=stroller&qid=1628356073&sr=8-56
"HARISTAR® Baby Stroller/Pram, East to Move,Extra Large Seating Space,Easy Fold, for New Born Baby/Kids, 0-3 Years (Blue)!  ",,,,"₹3,999","₹1,399","Save ₹2,600 (65%)",3.3 out of 5 stars,3,https://www.amazon.in/HARISTAR%C2%AE-Stroller-Extra-Large-Seating/dp/B095TNC9P5/ref=sr_1_57?dchild=1&keywords=stroller&qid=1628356073&sr=8-57
"Graco Modes Nest Stroller Baby Stroller with Height Adjustable Reversible Seat Bassinet Mode Extra Large Storage Self Standing Fold with Flat Recline and Lightweight Aluminum Frame Spencer, Black  ",Deal of the Day ,,,"₹39,999","₹34,499","Save ₹5,500 (14%)",4.7 out of 5 stars,561,https://www.amazon.in/Graco-Stroller-Adjustable-Reversible-Lightweight/dp/B07Y5VDB8T/ref=sr_1_58?dchild=1&keywords=stroller&qid=1628356073&sr=8-58
Joie Aire Twin Ultra Lightweight and One Hand-fold Stroller with Flat Reclining Seats (Birth to 15kg)  ,,,,"₹22,999","₹19,549","Save ₹3,450 (15%)",4.6 out of 5 stars,125,https://www.amazon.in/Joie-Stroller-Aire-Twin-Multicolour/dp/B07K544LWS/ref=sr_1_59?dchild=1&keywords=stroller&qid=1628356073&sr=8-59
R for Rabbit Twinkle Twinkle Stroller Compact Travel Friendly Pram for Baby | Kids | Infants |Newborn | Boys & Girls of 0 to 3 Years(Black Grey)  ,Deal of the Day ,,,"₹5,697","₹4,316","Save ₹1,381 (24%)",3.9 out of 5 stars,208,https://www.amazon.in/Rabbit-Twinkle-Baby-Stroller-Compact/dp/B07MH5TXDT/ref=sr_1_60?dchild=1&keywords=stroller&qid=1628356073&sr=8-60
Little kids® Dreams New Born Baby Stroller Rocker with Umberlla Net- Canopy and Wheels for New Born Infants(Pink)  ,,,,"₹3,999","₹1,499","Save ₹2,500 (63%)",4.6 out of 5 stars,3,https://www.amazon.in/Little-Dreams-Stroller-Umberlla-Infants/dp/B08X2D97JM/ref=sr_1_61?dchild=1&keywords=stroller&qid=1628356073&sr=8-61
Mishrit Baby Stroller Compact Travel for Baby Kids Boys & Girls of 0 to 3 Years (Pack of 1).  ,,,,"₹19,559","₹6,559","Save ₹13,000 (66%)",,,https://www.amazon.in/Mishrit-Stroller-Compact-Travel-Girls/dp/B097ZJX2SR/ref=sr_1_62?dchild=1&keywords=stroller&qid=1628356073&sr=8-62
Coballe Smart Folding Travel Luxury Stroller by StarAndDaisy (Coballe Pink)  ,,,,"₹19,999","₹11,999","Save ₹8,000 (40%)",5.0 out of 5 stars,4,https://www.amazon.in/Coballe-Folding-Travel-Stroller-StarAndDaisy/dp/B09775DFYY/ref=sr_1_63?dchild=1&keywords=stroller&qid=1628356073&sr=8-63
R for Rabbit Lollipop Lite Colorful Stroller and Pram with Easy Fold for Newborn Baby | Kids of 0 to 3 Years (Purple Grey)  ,Deal of the Day ,Sponsored,,"₹4,995","₹3,339","Save ₹1,656 (33%)",4.2 out of 5 stars,"1,101",https://www.amazon.in/gp/slredirect/picassoRedirect.html/ref=pa_sp_btf_aps_sr_pg4_1?ie=UTF8&adId=A0062104QYZGQEQYJDS0&url=%2FRabbit-Lollipop-Colorful-Stroller-Infants%2Fdp%2FB084BS465G%2Fref%3Dsr_1_64_sspa%3Fdchild%3D1%26keywords%3Dstroller%26qid%3D1628356073%26sr%3D8-64-spons%26psc%3D1&qualifier=1628356073&id=7283216680192494&widgetName=sp_btf
"LuvLap Sunshine Stroller/Pram, Easy Fold, for Newborn Baby/Kids, 0-3 Years (Multicolor)  ",Best seller,Sponsored,,"₹4,899","₹3,429","Save ₹1,470 (30%)",4.1 out of 5 stars,"8,718",https://www.amazon.in/gp/bestsellers/baby/1953483031/ref=sr_bs_16_1953483031_1
"Chicco Cortina CX Stroller with 8-Reclining Positions,Pram for boys and girls, For babies 0-4 years (Lima)  ",,Sponsored,,"₹19,990","₹16,949","Save ₹3,041 (15%)",4.1 out of 5 stars,52,https://www.amazon.in/gp/slredirect/picassoRedirect.html/ref=pa_sp_atf_next_aps_sr_pg5_1?ie=UTF8&adId=A05497451XWL9365DDAUS&url=%2FChicco-Lima-Cortina-Stroller-Multicolor%2Fdp%2FB06XYDK7LY%2Fref%3Dsr_1_65_sspa%3Fdchild%3D1%26keywords%3Dstroller%26qid%3D1628356089%26sr%3D8-65-spons%26psc%3D1&qualifier=1628356089&id=1923347168575911&widgetName=sp_atf_next
"LuvLap Joy Stroller/Pram, Compact and Easy Fold, for Newborn Baby/Kids, 0-3 Years (Printed Blue)  ",,Sponsored,,"₹5,495","₹3,846","Save ₹1,649 (30%)",4.0 out of 5 stars,"1,621",https://www.amazon.in/gp/slredirect/picassoRedirect.html/ref=pa_sp_atf_next_aps_sr_pg5_1?ie=UTF8&adId=A01549843LO2T3TJ0BKY&url=%2FLuvlap-Joy-Baby-Stroller-Blue%2Fdp%2FB06VXW9JJN%2Fref%3Dsr_1_66_sspa%3Fdchild%3D1%26keywords%3Dstroller%26qid%3D1628356089%26sr%3D8-66-spons%26psc%3D1&qualifier=1628356089&id=1923347168575911&widgetName=sp_atf_next
Tiffy & Toffee 3 in 1 Baby Stroller Grand (Dark Blue)  ,,,,"₹6,299","₹4,119","Save ₹2,180 (35%)",4.0 out of 5 stars,256,https://www.amazon.in/Tiffy-Toffee-Baby-Stroller-Grand/dp/B082FHK7X9/ref=sr_1_67?dchild=1&keywords=stroller&qid=1628356089&sr=8-67
"Chicco Goody Plus Stroller, Pram for Boys and Girls, Light Weight & Compact with Premium Design, for Babies 0m+ (Grey)  ",,,,"₹19,990","₹15,714","Save ₹4,276 (21%)",,,https://www.amazon.in/Chicco-Stroller-Weight-Compact-Premium/dp/B08XK5RNVJ/ref=sr_1_68?dchild=1&keywords=stroller&qid=1628356089&sr=8-68
Fisher-Price Explorer Steel Stroller Cum Pram (Red)  ,Deal of the Day ,,,"₹14,950","₹7,150","Save ₹7,800 (52%)",4.0 out of 5 stars,39,https://www.amazon.in/Fisher-Price-Explorer-Steel-Stroller-Pram/dp/B07NHWRC8J/ref=sr_1_69?dchild=1&keywords=stroller&qid=1628356089&sr=8-69
Evenflo Pilot Baby Black Stroller Black  ,,,,"₹21,999","₹13,199","Save ₹8,800 (40%)",,,https://www.amazon.in/Evenflo-Pilot-Baby-Black-Stroller/dp/B08TN583NJ/ref=sr_1_65?dchild=1&keywords=stroller&qid=1628356089&sr=8-65
R for Rabbit Travel System - Chocolate Ride - Baby Stroller and Pram + Infant Car seat for Kids | Newborn Boy & Girl of Age 0 to 3 Years (Grey-Multicolor)  ,Deal of the Day ,,,"₹14,994","₹11,554","Save ₹3,440 (23%)",4.3 out of 5 stars,57,https://www.amazon.in/Rabbit-Travel-System-Chocolate-Ride/dp/B01JM8DLYW/ref=sr_1_66?dchild=1&keywords=stroller&qid=1628356089&sr=8-66
"La Millou - Reversible Stroller Pad - Car Seat Liner,Soft, Thick Hypoallergenic Filling (Doggy Unicorn - Dark Grey)  ",,,,"₹12,000","₹8,398","Save ₹3,602 (30%)",,,https://www.amazon.in/Millou-Reversible-Stroller-Hypoallergenic-Filling/dp/B07F25JQVZ/ref=sr_1_67?dchild=1&keywords=stroller&qid=1628356089&sr=8-67
"Mee Mee Twin Baby Stroller Pram | 3 Position Seating | Fully Rotating Wheels | for Newborn Baby/Kids, 0-4 Years (Orange)  ",,,,"₹10,999","₹6,934","Save ₹4,065 (37%)",3.2 out of 5 stars,23,https://www.amazon.in/Mee-Comfortable-Seating-Position-Orange/dp/B077XVSVF6/ref=sr_1_68?dchild=1&keywords=stroller&qid=1628356089&sr=8-68
R for Rabbit Cuppy Cake Grand Stroller/Pram for Baby/Kids/Infants/Newborn | Baby Stroller for Boy & Girl of 0 to 3 Years (Red Black)  ,Deal of the Day ,,,"₹8,298","₹5,275","Save ₹3,023 (36%)",4.2 out of 5 stars,148,https://www.amazon.in/Rabbit-Cuppy-Grand-Stroller-Infants/dp/B0899LDY8V/ref=sr_1_69?dchild=1&keywords=stroller&qid=1628356089&sr=8-69
"LuvLap Starshine Stroller / Pram, Easy Fold for Newborn Baby / Kids, 0-3 Years (Light Red)  ",,Sponsored,,"₹4,799","₹3,079","Save ₹1,720 (36%)",4.2 out of 5 stars,"4,249",https://www.amazon.in/gp/slredirect/picassoRedirect.html/ref=pa_sp_mtf_aps_sr_pg5_1?ie=UTF8&adId=A01556031GY2CD8URZXCN&url=%2FLuvLap-Baby-Stroller-Starshine-Light%2Fdp%2FB00PZLCMIM%2Fref%3Dsr_1_70_sspa%3Fdchild%3D1%26keywords%3Dstroller%26qid%3D1628356089%26sr%3D8-70-spons%26psc%3D1&qualifier=1628356089&id=1923347168575911&widgetName=sp_mtf
"LuvLap Sunshine Stroller/Pram, Easy Fold, for Newborn Baby/Kids, 0-3 Years (Sky Blue)  ",Best seller,Sponsored,,"₹5,299","₹3,429","Save ₹1,870 (35%)",4.1 out of 5 stars,"8,718",https://www.amazon.in/gp/bestsellers/baby/1953483031/ref=sr_bs_6_1953483031_1
