name,badge_1,badge_2,badge_3,mrp,discounted_price,discount,rating,rating_count,link
"Timberly Wooden Wall Decorative Vintage Sunburst Mirror for Living Room (16 x 16 Inch) (Brown Color) - Set of 1, Medium  ",,Sponsored,,"₹2,449","₹1,250","Save ₹1,199 (49%)",3.9 out of 5 stars,29,https://www.amazon.in/gp/slredirect/picassoRedirect.html/ref=pa_sp_atf_aps_sr_pg1_1?ie=UTF8&adId=A05067763VCU78AGKL3DJ&url=%2FTimberly-Wooden-Decorative-Vintage-Sunburst%2Fdp%2FB09298CR3N%2Fref%3Dsr_1_1_sspa%3Fdchild%3D1%26keywords%3Dwall%2Bmirror%26qid%3D1627567740%26sr%3D8-1-spons%26psc%3D1&qualifier=1627567740&id=5120479394855240&widgetName=sp_atf
Timberly Wooden Wall Decorative Wall Mirror for Living Room (24 x 24 Inch) White Color - Set of -1  ,,Sponsored,Only 1 left in stock.,"₹5,970","₹2,350","Save ₹3,620 (61%)",,,https://www.amazon.in/gp/slredirect/picassoRedirect.html/ref=pa_sp_atf_aps_sr_pg1_1?ie=UTF8&adId=A103505217PIBYU0KUQ5&url=%2FTimberly-Wooden-Decorative-Mirror-24%2Fdp%2FB095CR11JH%2Fref%3Dsr_1_2_sspa%3Fdchild%3D1%26keywords%3Dwall%2Bmirror%26qid%3D1627567740%26sr%3D8-2-spons%26psc%3D1&qualifier=1627567740&id=5120479394855240&widgetName=sp_atf
"Timberly Hand Crafted Wooden Wall Mirror Panel for Living Room | Modern Wall Panels (30 x 12 inch, White) - Pack of 2  ",,Sponsored,,"₹6,999","₹3,490","Save ₹3,509 (50%)",4.3 out of 5 stars,26,https://www.amazon.in/gp/slredirect/picassoRedirect.html/ref=pa_sp_atf_aps_sr_pg1_1?ie=UTF8&adId=A05266522P18IP1RR4WCM&url=%2FTimberly-Crafted-Wooden-Mirror-Living%2Fdp%2FB095HZNW5X%2Fref%3Dsr_1_3_sspa%3Fdchild%3D1%26keywords%3Dwall%2Bmirror%26qid%3D1627567740%26sr%3D8-3-spons%26psc%3D1&qualifier=1627567740&id=5120479394855240&widgetName=sp_atf
Timberly Wooden Wall Decorative Wall Mirror for Living Room (24 x 24 Inch) Grey Color - Set of -1  ,,Sponsored,Only 2 left in stock.,"₹6,900","₹2,450","Save ₹4,450 (64%)",,,https://www.amazon.in/gp/slredirect/picassoRedirect.html/ref=pa_sp_atf_aps_sr_pg1_1?ie=UTF8&adId=A0349767V57W5YV8TIOT&url=%2FTimberly-Wooden-Decorative-Mirror-24%2Fdp%2FB095CRCTB9%2Fref%3Dsr_1_4_sspa%3Fdchild%3D1%26keywords%3Dwall%2Bmirror%26qid%3D1627567740%26sr%3D8-4-spons%26psc%3D1&qualifier=1627567740&id=5120479394855240&widgetName=sp_atf
SEVEN HORSES Floral Design Glass Wall Mirror for Makeup Bathroom Dressing (14.5X26.5 Inch)  ,Amazon's Choice,,,"₹1,998","₹1,199",Save ₹799 (40%),4.2 out of 5 stars,279,https://www.amazon.in/SEVEN-HORSES-Bathroom-Dressing-14-5X26-5/dp/B08KHHJC98/ref=ice_ac_b_dpb?dchild=1&keywords=wall+mirror&qid=1627567740&sr=8-5
"Wall1ders - Hexagon 3D Acrylic Stickers, 3D Acrylic Wall Stickers for Living Room, Hall, Bed Room & Home with 10 Butterfly Stickers - Pack of 28 (Silver)  ",Best seller,,,₹999,₹370,Save ₹629 (63%),4.0 out of 5 stars,"3,108",https://www.amazon.in/gp/bestsellers/kitchen/1380412031/ref=sr_bs_5_1380412031_1
"Seven Horses Frame Brown Sunmica Finish Fiber Wood Wall Mirror, Dressing Mirror Solid Premium Brown Water Resistant Synthetic Fiber Wood Made (14.5X26.5 Inch)  ",,,,"₹1,998","₹1,199",Save ₹799 (40%),4.1 out of 5 stars,322,https://www.amazon.in/Sunmica-Dressing-Premium-Resistant-Synthetic/dp/B0795WCNQS/ref=sr_1_7?dchild=1&keywords=wall+mirror&qid=1627567740&sr=8-7
"Creative Arts n Frames 15 x 21 inch Wall Mirror for Bathroom, Bedroom, Drawing Room and Wash Basin (Mirror, 15 x 21 inch) (Oval)  ",,,,"₹2,999","₹1,099","Save ₹1,900 (63%)",4.2 out of 5 stars,618,https://www.amazon.in/Creative-Arts-Frames-Bathroom-Bedroom/dp/B08DL3W9VZ/ref=sr_1_8?dchild=1&keywords=wall+mirror&qid=1627567740&sr=8-8
Reflectionz Frameless Rectangle Decorative Mirror | Mirror Glass for Wall | Mirror for Bathrooms | Mirror in Home | Mirror Decor | Mirror Size : (10 X 14 Inch)  ,,,,₹799,₹480,Save ₹319 (40%),4.0 out of 5 stars,347,https://www.amazon.in/Reflectionz-Frameless-Rectangle-Decorative-Bathrooms/dp/B08T7JKT3P/ref=sr_1_9?dchild=1&keywords=wall+mirror&qid=1627567740&sr=8-9
Quality Glass Verticle Shape Frameless Decorative Mirror Mirror Glass for Wall Mirror for bathrooms Mirror in Home Mirror décor Mirror Size : 12 X 18 inch QGFL 132  ,,,,"₹1,090",₹859,Save ₹231 (21%),3.6 out of 5 stars,47,https://www.amazon.in/Quality-Glass-Frameless-Decorative-bathrooms/dp/B0928GB9KR/ref=sr_1_10?dchild=1&keywords=wall+mirror&qid=1627567740&sr=8-10
"Art Street Decorative Wall Mirror Black Flat Small Size/Looking Glass Inner Size 10 x 12 inch, Outer Size 12 x 14 inch  ",Deal of the Day ,,,"₹1,500",₹474,"Save ₹1,026 (68%)",3.7 out of 5 stars,351,https://www.amazon.in/Art-Street-Decorative-Mirror-Looking/dp/B07DWWT61F/ref=sr_1_11?dchild=1&keywords=wall+mirror&qid=1627567740&sr=8-11
Bikri Kendra Hexagon 20 Golden Acrylic Mirror Wall Stickers  ,,,,"₹1,100",₹269,Save ₹831 (76%),3.6 out of 5 stars,"2,289",https://www.amazon.in/Bikri-Kendra-Hexagon-Golden-Mirror/dp/B072Q4Y2Q8/ref=sr_1_12?dchild=1&keywords=wall+mirror&qid=1627567740&sr=8-12
"SDG Frameless Oval Mirror (18x24inch, Silver)  ",,,,"₹1,999","₹1,249",Save ₹750 (38%),4.3 out of 5 stars,535,https://www.amazon.in/SDG-Frameless-Mirror-Bathrooms-Decor/dp/B07CK3R2C6/ref=sr_1_13?dchild=1&keywords=wall+mirror&qid=1627567740&sr=8-13
"SATYAM KRAFT 1 Piece Plastic Wall Mirror (9 Inch × 9 Inch, Gold)  ",,,,"₹1,200",₹339,Save ₹861 (72%),3.7 out of 5 stars,376,https://www.amazon.in/SATYAM-KRAFT-Fibre-Wall-Mirror/dp/B084VPP133/ref=sr_1_14?dchild=1&keywords=wall+mirror&qid=1627567740&sr=8-14
Ciplaplast Strong and Heavy Rich Look Cabinet with Mirror - White  ,,,,"₹5,999","₹1,644","Save ₹4,355 (73%)",4.2 out of 5 stars,"2,796",https://www.amazon.in/Ciplaplast-Strong-Heavy-Cabinet-Mirror/dp/B083RD1Q23/ref=sr_1_15?dchild=1&keywords=wall+mirror&qid=1627567740&sr=8-15
jacky Glass RKC Brown Gold Border Mirror for Walls Decoration for Table Birthday GIF  ,,,,"₹1,298",₹349,Save ₹949 (73%),2.9 out of 5 stars,9,https://www.amazon.in/jacky-Border-Mirror-Decoration-Birthday/dp/B08HD9NB87/ref=sr_1_16?dchild=1&keywords=wall+mirror&qid=1627567740&sr=8-16
"Frameless Wall Mirror, Rectangle Bevelled Glass Mirror for Bathroom (Silver, 10 x 10 Inches)  ",,,,₹599,₹398,Save ₹201 (34%),2.5 out of 5 stars,2,https://www.amazon.in/Frameless-Mirror-Rectangle-Bevelled-Bathroom/dp/B098NVV5QW/ref=sr_1_17?dchild=1&keywords=wall+mirror&qid=1627567740&sr=8-17
AG Crafts™ Black Flat Decorative Wall Mirror/Looking Glass Inner Size 18 x 12 inch - 0022 (Black)  ,,,,"₹1,499",₹599,Save ₹900 (60%),3.5 out of 5 stars,43,https://www.amazon.in/AG-CraftsTM-Decorative-Mirror-Looking/dp/B08HJK694Y/ref=sr_1_18?dchild=1&keywords=wall+mirror&qid=1627567740&sr=8-18
Efinito 18 Inches Decorative Wall Mirror for Bathroom Wash Basin Bedroom Drawing Room Makeup Vanity Mirror  ,,,,"₹2,499",₹799,"Save ₹1,700 (68%)",,,https://www.amazon.in/Efinito-Decorative-Bathroom-Bedroom-Drawing/dp/B09B2G428S/ref=sr_1_19?dchild=1&keywords=wall+mirror&qid=1627567740&sr=8-19
"Wall1ders - 31 Hexagon & 10 Butterflies Silver (Size 10.5 x 12 cm) 3D Hexagon Wall Stickers, 3D Stickers for Wall Large Size, 3D Wall Stickers, Acrylic Sticker  ",,,,"₹1,099",₹390,Save ₹709 (65%),4.1 out of 5 stars,818,https://www.amazon.in/Wall1ders-Hexagon-Silver-Acrylic-Mirror-Stickers/dp/B07PM85JYY/ref=sr_1_20?dchild=1&keywords=wall+mirror&qid=1627567740&sr=8-20
BLUEWUD Akira Wall Mounted Dressing Mirror (Walnut)  ,,Sponsored,,"₹5,749","₹4,269","Save ₹1,480 (26%)",4.4 out of 5 stars,81,https://www.amazon.in/gp/slredirect/picassoRedirect.html/ref=pa_sp_mtf_aps_sr_pg1_1?ie=UTF8&adId=A015396937JW7HX4LLGYT&url=%2FBluewud-M-AK-BL-Dressing-Mirror-Walnut%2Fdp%2FB06WLNKN2W%2Fref%3Dsr_1_21_sspa%3Fdchild%3D1%26keywords%3Dwall%2Bmirror%26qid%3D1627567740%26sr%3D8-21-spons%26psc%3D1&qualifier=1627567740&id=5120479394855240&widgetName=sp_mtf
"KURTZY Classic Antique Style Wall Mirror, Oval Sculpt for Home Décor, Living Room, Bedroom and Bathroom (46 cm x 63 cm) (Elliptical).  ",,Sponsored,,"₹2,099","₹1,999",Save ₹100 (5%),3.9 out of 5 stars,321,https://www.amazon.in/gp/slredirect/picassoRedirect.html/ref=pa_sp_mtf_aps_sr_pg1_1?ie=UTF8&adId=A07378521KLZLEDT64MAQ&url=%2FKurtzy-Mirror-Vintage-Bathroom-Bedroom%2Fdp%2FB07NYWHZPS%2Fref%3Dsr_1_22_sspa%3Fdchild%3D1%26keywords%3Dwall%2Bmirror%26qid%3D1627567740%26sr%3D8-22-spons%26psc%3D1&qualifier=1627567740&id=5120479394855240&widgetName=sp_mtf
Anikaa Maria Engineered Wood Dressing Wall Mirrors/Wall Hanging Dressing Mirrors with Shelf/Decorative Wall Mirror/Dressing Table for Bed Room/Living Room (Walnut) Matte Finish  ,,Sponsored,,"₹2,599","₹1,799",Save ₹800 (31%),4.0 out of 5 stars,126,https://www.amazon.in/gp/slredirect/picassoRedirect.html/ref=pa_sp_mtf_aps_sr_pg1_1?ie=UTF8&adId=A04386291EAIPISZDG556&url=%2FAnikaa-Dressing-Mirrors-Hanging-Decorative%2Fdp%2FB08L7S1DVC%2Fref%3Dsr_1_23_sspa%3Fdchild%3D1%26keywords%3Dwall%2Bmirror%26qid%3D1627567740%26sr%3D8-23-spons%26psc%3D1&qualifier=1627567740&id=5120479394855240&widgetName=sp_mtf
CasaGold Round Leather Hanging Mirror - 20 Inch with Adjustable Leather Strap & Matching Wall Hook for Wall Decor l Living Room l Bedroom l Wash Basin l Bathroom  ,,Sponsored,,"₹9,999","₹3,999","Save ₹6,000 (60%)",4.2 out of 5 stars,20,https://www.amazon.in/gp/slredirect/picassoRedirect.html/ref=pa_sp_mtf_aps_sr_pg1_1?ie=UTF8&adId=A03333941UHG7LYZ1UUT7&url=%2FCasaGold-Round-Leather-Hanging-Mirror%2Fdp%2FB08SLZ9ZCF%2Fref%3Dsr_1_24_sspa%3Fdchild%3D1%26keywords%3Dwall%2Bmirror%26qid%3D1627567740%26sr%3D8-24-spons%26psc%3D1&qualifier=1627567740&id=5120479394855240&widgetName=sp_mtf
Bikri Kendra® - Hexagon 13 Silver -3D Acrylic Decorative Mirror  ,,,,"₹1,100",₹249,Save ₹851 (77%),3.7 out of 5 stars,409,https://www.amazon.in/Bikri-Kendra-Hexagon-Walldecor-Stickers/dp/B071JFMG29/ref=sr_1_25?dchild=1&keywords=wall+mirror&qid=1627567740&sr=8-25
WallDaddy - Offering 3D Large Hexagon Acrylic Stickers (Pack of 7) with 10 Butterfly Acrylic Mirror Wall Stickers for Home & Offices(Silver)  ,,,,₹999,₹179,Save ₹820 (82%),,,https://www.amazon.in/WallDaddy-Offering-Hexagon-Stickers-Butterfly/dp/B099QHJPV2/ref=sr_1_26?dchild=1&keywords=wall+mirror&qid=1627567740&sr=8-26
Atulya Arts - Offering 3D Large Hexagon Acrylic Stickers (Pack of 7) with 10 Butterfly Acrylic Mirror Wall Stickers for Home & Offices(Silver)  ,,,,₹999,₹195,Save ₹804 (80%),3.6 out of 5 stars,"1,307",https://www.amazon.in/Wall1ders-Atulya-Hexagon-Acrylic-Stickers/dp/B07JJP82L6/ref=sr_1_27?dchild=1&keywords=wall+mirror&qid=1627567740&sr=8-27
Art Street Frameless Octagon Wall Mirror 16 x 24 inch  ,,,,"₹2,500","₹1,000","Save ₹1,500 (60%)",3.8 out of 5 stars,440,https://www.amazon.in/Art-Street-Frameless-Octagon-Mirror/dp/B07NXZBKLS/ref=sr_1_28?dchild=1&keywords=wall+mirror&qid=1627567740&sr=8-28
"Hosley Decorative Square Iron Wall Mirror (15.24 cm x 29.84 cm, Black, Set of 3)  ",,,,"₹1,500",₹889,Save ₹611 (41%),4.4 out of 5 stars,188,https://www.amazon.in/Hosley-Decorative-Square-Mirror-15-24/dp/B01GHXY21G/ref=sr_1_29?dchild=1&keywords=wall+mirror&qid=1627567740&sr=8-29
"Homace Strong and Heavy Mirror Cabinet (Rich Look, White)  ",,,,"₹3,999","₹1,644","Save ₹2,355 (59%)",4.2 out of 5 stars,56,https://www.amazon.in/Homace-Strong-Heavy-Mirror-Cabinet/dp/B08L4QDLJJ/ref=sr_1_30?dchild=1&keywords=wall+mirror&qid=1627567740&sr=8-30
"WallDaddy 3D Hexagon Mirror Wall Stickers, 3D Mirror Stickers for Wall Large Size, 3D Wall Mirror Stickers - (Pack of 20, Silver, 1.5 mm, Premium Qualty, Each Hexagon Size 10.5 cm x 12.1 cm)  ",,,,₹499,₹239,Save ₹260 (52%),4.2 out of 5 stars,8,https://www.amazon.in/WallDaddy-Hexagon-Mirror-Stickers-Large/dp/B098TMZKFS/ref=sr_1_31?dchild=1&keywords=wall+mirror&qid=1627567740&sr=8-31
Atulya Arts 3D Hexagon Acrylic Decorative Wall-Stickers with 10 Butterfly Stickers (Silver) - Pack of 28  ,,,,₹999,₹360,Save ₹639 (64%),3.9 out of 5 stars,"2,252",https://www.amazon.in/Hexagon-Decorative-Wall-Stickers-Butterfly-Stickers/dp/B07BNHWDL4/ref=sr_1_32?dchild=1&keywords=wall+mirror&qid=1627567740&sr=8-32
"Dime Store Wall Mirror with Shelf for Living Room Bedroom Dressing Mirror for Wall Decor (Classic, Brown)  ",,,,"₹3,400","₹1,499","Save ₹1,901 (56%)",3.8 out of 5 stars,319,https://www.amazon.in/Dime-Store-Mirror-Shelf-Living/dp/B08YKGGPL5/ref=sr_1_33?dchild=1&keywords=wall+mirror&qid=1627567740&sr=8-33
Bikri Kendra - 28 Hexagon/Silver - 3D Decorative Mirror Acrylic Wall Stickers  ,,,,"₹1,100",₹349,Save ₹751 (68%),3.7 out of 5 stars,202,https://www.amazon.in/Bikri-Kendra-Hexagon-Stickers-Decorative/dp/B07V9S9L3B/ref=sr_1_34?dchild=1&keywords=wall+mirror&qid=1627567740&sr=8-34
"Art India Collections Decorative Hexagonal Hanging Wall Mirror, Large Vintage Mirror for Wall-9.5x11 Inch Gold Metallic Frame Mirror Material Wall Mirrors  ",,,,"₹1,249",₹729,Save ₹520 (42%),3.5 out of 5 stars,28,https://www.amazon.in/Art-India-Collections-Decorative-Wall-9-5x11/dp/B0925JJ79P/ref=sr_1_35?dchild=1&keywords=wall+mirror&qid=1627567740&sr=8-35
"Wall1ders - Plume Feather Silver 3D Mirror Stickers for Wall Large Size, 3D Wall Mirror Sticker, Mirror Wall Stickers for Living Room, Hall, Bed Room & Home. (Silver)  ",,,,"₹1,020",₹268,Save ₹752 (74%),3.8 out of 5 stars,944,https://www.amazon.in/Feather%C2%82-Silver-Acrylic-Mirror-Stickers-Office/dp/B07D39215W/ref=sr_1_36?dchild=1&keywords=wall+mirror&qid=1627567740&sr=8-36
"Art Street Decorative Wall Mirror/Makeup Mirror/Looking Glass Copper Color Flat Small Size Inner Size 10 x 12 inch, Outer Size 12 x 14 inch  ",Deal of the Day ,,,"₹1,199",₹474,Save ₹725 (60%),3.6 out of 5 stars,548,https://www.amazon.in/Art-Street-Copper-Decorative-Looking/dp/B07F3WRMFB/ref=sr_1_37?dchild=1&keywords=wall+mirror&qid=1627567740&sr=8-37
Zahab Bathroom Cabinets for Storage with Mirror Door Wall Mounted 10x4x14 Blue  ,,,,"₹1,999",₹920,"Save ₹1,079 (54%)",3.7 out of 5 stars,63,https://www.amazon.in/Bathroom-Cabinets-Storage-Mounted-10x4x14/dp/B08KS6Y4B9/ref=sr_1_38?dchild=1&keywords=wall+mirror&qid=1627567740&sr=8-38
Atulya Arts offerings 3D Acrylic Mirror Hexagon Shape Wall Stickers Decorative Stickers for Home & Offices (Gold) -(Pack of 20)  ,,,,₹999,₹269,Save ₹730 (73%),3.8 out of 5 stars,18,https://www.amazon.in/Atulya-Arts-offerings-Stickers-Decorative/dp/B092R2XLXR/ref=sr_1_39?dchild=1&keywords=wall+mirror&qid=1627567740&sr=8-39
Art Street Lotus Petal Decorative Wall Mirror (Set of 3)(Size - 9 x 9 inch)  ,Deal of the Day ,,,"₹1,500",₹758,Save ₹742 (49%),4.1 out of 5 stars,188,https://www.amazon.in/Painting-Mantra-Street-Decorative-Mirror/dp/B07954FM4N/ref=sr_1_40?dchild=1&keywords=wall+mirror&qid=1627567740&sr=8-40
"Bikri Kendra - Art BK07, Butterfly Silver - 3D Acrylic Mirror Stickers for Wall (Pack of 40)  ",,,,"₹1,100",₹299,Save ₹801 (73%),4.0 out of 5 stars,34,https://www.amazon.in/Bikri-Kendra-Butterfly-Acrylic-Stickers/dp/B08FJDQZDG/ref=sr_1_41?dchild=1&keywords=wall+mirror&qid=1627567740&sr=8-41
Bikri Kendra Sun Mirror Wall Sticker (Multi)  ,,,,"₹1,100",₹399,Save ₹701 (64%),4.2 out of 5 stars,597,https://www.amazon.in/Bikri-Kendra-Colors-Acrylic-Stickers/dp/B07WCFWDL8/ref=sr_1_42?dchild=1&keywords=wall+mirror&qid=1627567740&sr=8-42
"Art Street Wall Mirror for Bathroom/Vanity, Marble Finish Decorative Mirror for Living Room - 14.5 x 20.5 Inchs, Color -Beige  ",Limited time deal,,,"₹1,200",₹759,Save ₹441 (37%),3.7 out of 5 stars,27,https://www.amazon.in/Art-Street-Mirror-Bathroom-Decorative/dp/B08J8D3KMZ/ref=sr_1_43?dchild=1&keywords=wall+mirror&qid=1627567740&sr=8-43
"House of Quirk Acrylic, Glass Wall, Furniture Sticker Standard, Grey  ",,,,"₹2,999",₹399,"Save ₹2,600 (87%)",3.2 out of 5 stars,43,https://www.amazon.in/House-Quirk-Acrylic-Furniture-Standard/dp/B08TBK2NZS/ref=sr_1_44?dchild=1&keywords=wall+mirror&qid=1627567740&sr=8-44
Bikri Kendra - Art RTNS8 - Sun Silver with Golden Butterfly 3D Acrylic Mirror Wall Sticker  ,,,,"₹1,100",₹269,Save ₹831 (76%),4.1 out of 5 stars,329,https://www.amazon.in/Bikri-Kendra-Butterfly-Stickers-Decorative/dp/B07V65XSH8/ref=sr_1_45?dchild=1&keywords=wall+mirror&qid=1627567740&sr=8-45
Atulya Arts 3D Acrylic Mirror Hexagon Shape Wall Stickers (Gold) -(Pack of 20)  ,,,,₹999,₹269,Save ₹730 (73%),3.8 out of 5 stars,"2,318",https://www.amazon.in/Atulya-Acrylic-Mirror-Hexagon-Stickers/dp/B078LH2JR4/ref=sr_1_46?dchild=1&keywords=wall+mirror&qid=1627567740&sr=8-46
RAG28 Vintage Silver Mandala Decorative Wall Mirror (Set of 3)(Size - 12X12 Inches Each)  ,,,,"₹1,199",₹499,Save ₹700 (58%),3.0 out of 5 stars,1,https://www.amazon.in/RAG28-Vintage-Silver-Mandala-Decorative/dp/B097ZPYNYL/ref=sr_1_47?dchild=1&keywords=wall+mirror&qid=1627567740&sr=8-47
Quality Glass Round Shape Frameless Decorative Mirror Mirror Glass for Wall Mirror for bathrooms Mirror in Home Mirror Decor Mirror Size : 12X 12 inch QGFL 131  ,,,,₹699,₹569,Save ₹130 (19%),3.6 out of 5 stars,69,https://www.amazon.in/Quality-Glass-Frameless-Decorative-bathrooms/dp/B0927DWQMH/ref=sr_1_48?dchild=1&keywords=wall+mirror&qid=1627567740&sr=8-48
Quality Glass Oval Shape Frameless Decorative Mirror Mirror Glass for Wall Mirror for bathrooms Mirror in Home Mirror Decor Mirror Size : 12X 18 inch QGFL 128  ,,,,"₹1,200",₹829,Save ₹371 (31%),3.6 out of 5 stars,52,https://www.amazon.in/Quality-Glass-Frameless-Decorative-bathrooms/dp/B09139MXD2/ref=sr_1_49?dchild=1&keywords=wall+mirror&qid=1627567740&sr=8-49
"Bikri Kendra - Art BK32 , Acrylic Ganesha - 3D Acrylic Mirror Stickers for Wall (Red)  ",,,,"₹1,100",₹369,Save ₹731 (66%),4.5 out of 5 stars,9,https://www.amazon.in/Bikri-Kendra-Ganesha-Acrylic-Stickers/dp/B08FJFSQNY/ref=sr_1_50?dchild=1&keywords=wall+mirror&qid=1627567740&sr=8-50
"Wall1ders - 20 Hexagon with 10 Butterfly Golden (Each Hexagon Szie 12.1 cm x 10.5 cm) 3D Hexagon Mirror Wall Stickers, 3D Mirror Stickers for Wall Large Size, 3D Wall Mirror Stickers  ",,,,"₹1,099",₹268,Save ₹831 (76%),3.8 out of 5 stars,442,https://www.amazon.in/Wall1ders-Hexagon-Butterfly-Acrylic-Stickers/dp/B089NW7X4K/ref=sr_1_51?dchild=1&keywords=wall+mirror&qid=1627567740&sr=8-51
Bikri Kendra® - Sun Silver Model 3-3D Acrylic Decorative Mirror Wall Stickers -  ,,,,"₹1,100",₹249,Save ₹851 (77%),3.7 out of 5 stars,157,https://www.amazon.in/Bikri-Kendra-Acrylic-Stickers-B07FCJWCJY/dp/B07FCJWCJY/ref=sr_1_52?dchild=1&keywords=wall+mirror&qid=1627567740&sr=8-52
"Command Designer 2 hooks and 4 strips, Self Adhesive Plastic Hooks for wall, Medium , White, Holds Upto 1.3kg  ",Best seller,,,₹175,₹149,Save ₹26 (15%),4.0 out of 5 stars,"12,232",https://www.amazon.in/gp/bestsellers/home-improvement/4286654031/ref=sr_bs_52_4286654031_1
"Atulya Arts 24 Pieces 4inch Decorative Square Mirror Wall Sticker, 3D Acrylic Stickers for Wall, Self Adhesive Mirror Silver Wall Stickers for Bathroom Living Room Bedroom Home Decor (Silver)  ",,,,₹999,₹399,Save ₹600 (60%),3.4 out of 5 stars,5,https://www.amazon.in/Atulya-Arts-Decorative-Stickers-Adhesive/dp/B09539L7HS/ref=sr_1_54?dchild=1&keywords=wall+mirror&qid=1627567740&sr=8-54
Happer Premium Plastic Wall Mounted Mirror and Storage Cabinet (White)  ,Limited time deal,,,"₹7,000","₹1,699","Save ₹5,301 (76%)",3.7 out of 5 stars,484,https://www.amazon.in/Happer-Premium-Mounted-New-Look/dp/B08243HNTH/ref=sr_1_55?dchild=1&keywords=wall+mirror&qid=1627567740&smid=AT95IG9ONZD7S&sr=8-55
"SEVEN HORSES Glass Oval Bevelled Mirror (White, 18x 24 Inch)  ",,,,"₹1,998","₹1,388",Save ₹610 (31%),4.2 out of 5 stars,616,https://www.amazon.in/Seven-Horses-Frameless-Bevelled-Mirror/dp/B07GCJQDD6/ref=sr_1_56?dchild=1&keywords=wall+mirror&qid=1627567740&sr=8-56
CasaGold Black Round Wall Mirror - 18 Inch in Metal Frame for Wall Decor / Wash Basin / Bedroom  ,,Sponsored,,"₹5,000","₹2,199","Save ₹2,801 (56%)",4.7 out of 5 stars,8,https://www.amazon.in/gp/slredirect/picassoRedirect.html/ref=pa_sp_btf_aps_sr_pg1_1?ie=UTF8&adId=A04476641RNVMOUPZ45J5&url=%2FCasaGold-Black-Round-Wall-Mirror%2Fdp%2FB0924H8C98%2Fref%3Dsr_1_57_sspa%3Fdchild%3D1%26keywords%3Dwall%2Bmirror%26qid%3D1627567740%26sr%3D8-57-spons%26psc%3D1&qualifier=1627567740&id=5120479394855240&widgetName=sp_btf
CasaGold Decorative Genuine Leather Round Wall Mirror for Wall Decor with Golden Studs -Dark Olive Green (24 inch)  ,,Sponsored,,"₹9,999","₹6,999","Save ₹3,000 (30%)",,,https://www.amazon.in/gp/slredirect/picassoRedirect.html/ref=pa_sp_btf_aps_sr_pg1_1?ie=UTF8&adId=A07495241D5PQHF1KMNCV&url=%2FCasaGold-Decorative-Genuine-Leather-Mirror%2Fdp%2FB093SQBBJN%2Fref%3Dsr_1_58_sspa%3Fdchild%3D1%26keywords%3Dwall%2Bmirror%26qid%3D1627567740%26sr%3D8-58-spons%26psc%3D1&qualifier=1627567740&id=5120479394855240&widgetName=sp_btf
"AmazonBasics Rectangular Wall Mirror 41 x 51 CM - Standard Trim, Walnut  ",Deal of the Day ,Sponsored,,"₹2,300","₹1,189","Save ₹1,111 (48%)",4.6 out of 5 stars,104,https://www.amazon.in/gp/slredirect/picassoRedirect.html/ref=pa_sp_btf_aps_sr_pg1_1?ie=UTF8&adId=A0264774QCOSRQJNSZBY&url=%2FAmazonBasics-Rectangular-Wall-Mirror-16x20%2Fdp%2FB07RQMRXQW%2Fref%3Dsr_1_59_sspa%3Fdchild%3D1%26keywords%3Dwall%2Bmirror%26qid%3D1627567740%26smid%3DAT95IG9ONZD7S%26sr%3D8-59-spons%26psc%3D1&qualifier=1627567740&id=5120479394855240&widgetName=sp_btf
Efinito 18 Inches Decorative Wall Mirror for Bathroom Wash Basin Bedroom Drawing Room Makeup Vanity Mirror  ,,Sponsored,,"₹2,499",₹799,"Save ₹1,700 (68%)",,,https://www.amazon.in/gp/slredirect/picassoRedirect.html/ref=pa_sp_btf_aps_sr_pg1_1?ie=UTF8&adId=A0795448WY2NLR1YH5N6&url=%2FEfinito-Decorative-Bathroom-Bedroom-Drawing%2Fdp%2FB09B2G428S%2Fref%3Dsr_1_60_sspa%3Fdchild%3D1%26keywords%3Dwall%2Bmirror%26qid%3D1627567740%26sr%3D8-60-spons%26psc%3D1&qualifier=1627567740&id=5120479394855240&widgetName=sp_btf
"Timberly Hand Crafted Wooden Wall Mirror Panel for Living Room | Modern Wall Panels (30 x 12 inch, White) - Pack of 3  ",,Sponsored,,"₹9,999","₹4,490","Save ₹5,509 (55%)",4.3 out of 5 stars,26,https://www.amazon.in/gp/slredirect/picassoRedirect.html/ref=pa_sp_atf_next_aps_sr_pg2_1?ie=UTF8&adId=A0547676107VQ9GJNFWI6&url=%2FTimberly-Crafted-Wooden-Mirror-Living%2Fdp%2FB095HXM1B6%2Fref%3Dsr_1_49_sspa%3Fdchild%3D1%26keywords%3Dwall%2Bmirror%26qid%3D1627567763%26sr%3D8-49-spons%26psc%3D1&qualifier=1627567763&id=8912503076602776&widgetName=sp_atf_next
CasaGold Black Round Wall Mirror - 18 Inch in Metal Frame with 2 Black Wall Hanging Candle Stands for Wall Decor / Wash Basin / Bedroom  ,,Sponsored,,"₹5,000","₹2,699","Save ₹2,301 (46%)",4.7 out of 5 stars,8,https://www.amazon.in/gp/slredirect/picassoRedirect.html/ref=pa_sp_atf_next_aps_sr_pg2_1?ie=UTF8&adId=A08728093CKBKQGDZW0SP&url=%2FCasaGold-Black-Round-Wall-Mirror%2Fdp%2FB095X282RS%2Fref%3Dsr_1_50_sspa%3Fdchild%3D1%26keywords%3Dwall%2Bmirror%26qid%3D1627567763%26sr%3D8-50-spons%26psc%3D1&qualifier=1627567763&id=8912503076602776&widgetName=sp_atf_next
CasaGold Tan Brown Leather Hanging Round Mirror - 18 Inch in Genuine Leather with Broad Adjustable Leather Strap for Wall Decor l Living Room l Bedroom l Wash Basin l Bathroom  ,,Sponsored,,"₹10,000","₹5,499","Save ₹4,501 (45%)",3.5 out of 5 stars,2,https://www.amazon.in/gp/slredirect/picassoRedirect.html/ref=pa_sp_atf_next_aps_sr_pg2_1?ie=UTF8&adId=A07251042LPBFQC1OC8HX&url=%2FCasaGold-Brown-Leather-Hanging-Mirror%2Fdp%2FB093SQMKPZ%2Fref%3Dsr_1_51_sspa%3Fdchild%3D1%26keywords%3Dwall%2Bmirror%26qid%3D1627567763%26sr%3D8-51-spons%26psc%3D1&qualifier=1627567763&id=8912503076602776&widgetName=sp_atf_next
Papdiwal Industries MIRRORNOW'S Imported Touch Sensor Glass LED Bathroom Mirror (27 x18 Inches)  ,,Sponsored,,,,,,,https://www.amazon.in/gp/slredirect/picassoRedirect.html/ref=pa_sp_atf_next_aps_sr_pg2_1?ie=UTF8&adId=A06463952FJL5NBQJQ6EM&url=%2FPapdiwal-Industries-MIRRORNOWS-Sensor-Bathroom%2Fdp%2FB08C9NPVZ2%2Fref%3Dsr_1_52_sspa%3Fdchild%3D1%26keywords%3Dwall%2Bmirror%26qid%3D1627567763%26sr%3D8-52-spons%26psc%3D1&qualifier=1627567763&id=8912503076602776&widgetName=sp_atf_next
Bikri Kendra® 200 Golden Square - 3D Acrylic Mirror Wall Stickers for Home & Office  ,,,,"₹1,100",₹299,Save ₹801 (73%),4.1 out of 5 stars,338,https://www.amazon.in/Bikri-Kendra-200-Golden-Square/dp/B075RTCN7L/ref=sr_1_53?dchild=1&keywords=wall+mirror&qid=1627567763&sr=8-53
"Atulya Arts 3D Hexagon Acrylic Mirror Wall Sticker (Pack of 28) with 10 Butterfly Decorative Mirror Wall Stickers Set for Home Living Room Bedroom Office (Silver, Size, 12.1 cm X 10.5 cm)  ",,,,₹999,₹319,Save ₹680 (68%),3.8 out of 5 stars,60,https://www.amazon.in/Atulya-Arts-Butterfly-Decorative-Stickers/dp/B08TVYQS2D/ref=sr_1_54?dchild=1&keywords=wall+mirror&qid=1627567763&sr=8-54
Solid Base Big Wall Hanging Mirror 65X34 cm for Living Room Decoration Bathroom Bedroom Wash Basin Shelf Oval Shape Decor (Flowery Wenge)  ,,,,"₹1,999","₹1,199",Save ₹800 (40%),4.4 out of 5 stars,9,https://www.amazon.in/Hanging-Decoration-Bathroom-Bedroom-Flowery/dp/B08YKGLLH6/ref=sr_1_55?dchild=1&keywords=wall+mirror&qid=1627567763&sr=8-55
Quality Glass Square Shape Frameless Decorative Mirror Mirror Glass for Wall Mirror for bathrooms Mirror in Home Mirror Decor Mirror Size : 12 X 12 inch QGFL 126  ,,,,"₹1,000",₹589,Save ₹411 (41%),3.1 out of 5 stars,31,https://www.amazon.in/Quality-Glass-Frameless-Decorative-bathrooms/dp/B09139VHV9/ref=sr_1_56?dchild=1&keywords=wall+mirror&qid=1627567763&sr=8-56
"Decals Design 'Hanging Birds Cage with Flowers' Wall Sticker (PVC Vinyl, 50 cm x 70 cm)  ",,,,₹664,₹135,Save ₹529 (80%),4.4 out of 5 stars,"3,400",https://www.amazon.in/Decals-Design-Hanging-Flowers-Sticker/dp/B078BDF3VM/ref=sr_1_57?dchild=1&keywords=wall+mirror&qid=1627567763&sr=8-57
