name,badge_1,badge_2,badge_3,mrp,discounted_price,discount,rating,rating_count,link
Atulya Arts 3D Acrylic Stickers Mirror Silver Hexagon Wall Sticker with 10 Butterflies Decorative Sticker - (Pack of 28) (10.5 cm X 12.1 cm) for Home Living Room Bedroom Office Décor  ,,,,₹999,₹319,Save ₹680 (68%),3.9 out of 5 stars,134,https://www.amazon.in/Atulya-Arts-Stickers-Butterflies-Decorative/dp/B08TVYTG96/ref=sr_1_58?dchild=1&keywords=wall+mirror&qid=1627567763&sr=8-58
"Art Street Decorative Wall Mirror Marble Finish for Home and Bathroom - 15X21 Inchs, Color -White  ",,,,"₹1,200",₹799,Save ₹401 (33%),3.3 out of 5 stars,11,https://www.amazon.in/Art-Street-Marble-Decorative-Bathroom/dp/B08C36FVSD/ref=sr_1_49?dchild=1&keywords=wall+mirror&qid=1627567763&sr=8-49
Brizzio C505 Elegant Bathroom Wall Mirror  ,,,Only 2 left in stock.,"₹1,490","₹1,290",Save ₹200 (13%),,,https://www.amazon.in/Brizzio-C505-Elegant-Bathroom-Mirror/dp/B09B282JP7/ref=sr_1_50?dchild=1&keywords=wall+mirror&qid=1627567763&sr=8-50
"Excellent Plastic Makeup, Shaving Mirror (10 x 7 x 2-Inches)  ",,,,₹450,₹349,Save ₹101 (22%),3.9 out of 5 stars,222,https://www.amazon.in/Excellent-Premium-Quality-Plastic-Cosmetic/dp/B079ZQH8BW/ref=sr_1_51?dchild=1&keywords=wall+mirror&qid=1627567763&sr=8-51
"Lukzer 1PC Mirror Sticker for Home, Bedroom, Kitchen, Bathroom Acrylic Self Adhesive Flexible Portable Fancy Self Adhesive Wall Mirror (Oval Shape / 60 x 40 cm)  ",,,,₹899,₹799,Save ₹100 (11%),,,https://www.amazon.in/Lukzer-Mirror-Bathroom-Adhesive-Oval/dp/B09BBF2XW3/ref=sr_1_52?dchild=1&keywords=wall+mirror&qid=1627567763&sr=8-52
"Bikri Kendra - Art BK01, 200 Square Black - 3D Acrylic Mirror Stickers for Wall (Black)  ",,,,"₹1,100",₹299,Save ₹801 (73%),3.6 out of 5 stars,11,https://www.amazon.in/Bikri-Kendra-Square-Acrylic-Stickers/dp/B08FJGGK76/ref=sr_1_53?dchild=1&keywords=wall+mirror&qid=1627567763&sr=8-53
WallWear Hexagon 20 Silver - 3D Acrylic Decorative Mirror Wall Stickers for Home & Office  ,,,,₹599,₹249,Save ₹350 (58%),5.0 out of 5 stars,1,https://www.amazon.in/WallWear-Hexagon-20-Silver-Decorative/dp/B099KV1GFW/ref=sr_1_54?dchild=1&keywords=wall+mirror&qid=1627567763&sr=8-54
"Home and Bazaar Traditional Elegant & Ethnic Designer Unique Wooden Peacock Wall Mirror Frame 12x1x16 Inch, Mirror Size 6"" Dia  ",,,,"₹1,999",₹799,"Save ₹1,200 (60%)",4.1 out of 5 stars,29,https://www.amazon.in/Home-Bazaar-Traditional-Elegant-Designer/dp/B07QX814RQ/ref=sr_1_55?dchild=1&keywords=wall+mirror&qid=1627567763&sr=8-55
CasaGold Black Round Wall Mirror - 18 Inch in Metal Frame for Wall Decor / Wash Basin / Bedroom  ,,,,"₹5,000","₹2,199","Save ₹2,801 (56%)",4.7 out of 5 stars,8,https://www.amazon.in/CasaGold-Black-Round-Wall-Mirror/dp/B0924H8C98/ref=sr_1_56?dchild=1&keywords=wall+mirror&qid=1627567763&sr=8-56
"GIG Handicrafts Balls Iron Decorative Wall Mounted Hanging Mirror Sculpture Metal Glass Modern Art Gifts Home Decor Wall Mirror (56 cm x 4 cm x 56 cm, Gold)  ",,,,"₹3,499","₹2,578",Save ₹921 (26%),4.3 out of 5 stars,116,https://www.amazon.in/GIG-Handicrafts-Decorative-Mounted-Sculpture/dp/B07SCVLWGT/ref=sr_1_57?dchild=1&keywords=wall+mirror&qid=1627567763&sr=8-57
"Wall1ders - Dakshita Decor 28 Hexagon Silver (10.5 x 12.1 cm) 3D Acrylic Sticker, 3D Acrylic Stickers for Wall, 3D Mirror Wall Stickers, 3D Mirror Stickers Wall Decor Items for Home and Office.  ",,,,"₹1,099",₹332,Save ₹767 (70%),3.8 out of 5 stars,419,https://www.amazon.in/Dakshita-Acrylic-Hexagon-Stickers-inch-each/dp/B0713V9GJJ/ref=sr_1_58?dchild=1&keywords=wall+mirror&qid=1627567763&sr=8-58
"Timberly Wooden Wall Decorative Vintage Sunburst Mirror for Living Room (16 x 16 Inch, Color RED) - Set of 1  ",,Sponsored,Only 2 left in stock.,"₹2,449","₹1,250","Save ₹1,199 (49%)",3.9 out of 5 stars,29,https://www.amazon.in/gp/slredirect/picassoRedirect.html/ref=pa_sp_mtf_aps_sr_pg2_1?ie=UTF8&adId=A0506876283V2FMOX7O63&url=%2FTimberly-Wooden-Decorative-Vintage-Sunburst%2Fdp%2FB08RMXJ4FB%2Fref%3Dsr_1_59_sspa%3Fdchild%3D1%26keywords%3Dwall%2Bmirror%26qid%3D1627567763%26sr%3D8-59-spons%26psc%3D1&qualifier=1627567763&id=8912503076602776&widgetName=sp_mtf
Anikaa Mavis Dressing Wall Mirror with Shelves/ Wall Hanging Dressing Mirrors with Shelf for Living Room Bedroom / Wall Mounted Dressing Mirror for Wall Decor (Wenge)  ,,Sponsored,,"₹5,999","₹3,099","Save ₹2,900 (48%)",4.0 out of 5 stars,302,https://www.amazon.in/gp/slredirect/picassoRedirect.html/ref=pa_sp_mtf_aps_sr_pg2_1?ie=UTF8&adId=A04383172FD1J3H6QHWDR&url=%2FAnikaa-Mavis-Dressing-Mirror%25C2%2582-Shelves%2Fdp%2FB07FQHWBYF%2Fref%3Dsr_1_60_sspa%3Fdchild%3D1%26keywords%3Dwall%2Bmirror%26qid%3D1627567763%26sr%3D8-60-spons%26psc%3D1&qualifier=1627567763&id=8912503076602776&widgetName=sp_mtf
AG Crafts™ Black Flat Decorative Wall Mirror/Looking Glass Inner Size 18 x 12 inch - 0022 (Black)  ,,Sponsored,,"₹1,499",₹599,Save ₹900 (60%),3.5 out of 5 stars,43,https://www.amazon.in/gp/slredirect/picassoRedirect.html/ref=pa_sp_mtf_aps_sr_pg2_1?ie=UTF8&adId=A09346574K5RH0T2T10G&url=%2FAG-CraftsTM-Decorative-Mirror-Looking%2Fdp%2FB08HJK694Y%2Fref%3Dsr_1_61_sspa%3Fdchild%3D1%26keywords%3Dwall%2Bmirror%26qid%3D1627567763%26sr%3D8-61-spons%26psc%3D1&qualifier=1627567763&id=8912503076602776&widgetName=sp_mtf
"Quality Glass Frameless Decorative Mirror Glass for Wall Mirror Bathrooms Home Decor (Silver, Size : 18 X 24 Inch)  ",,Sponsored,,"₹2,500","₹1,400","Save ₹1,100 (44%)",3.6 out of 5 stars,11,https://www.amazon.in/gp/slredirect/picassoRedirect.html/ref=pa_sp_mtf_aps_sr_pg2_1?ie=UTF8&adId=A075664610QNFK9WDCX5E&url=%2FQuality-Glass-Frameless-Decorative-Bathrooms%2Fdp%2FB08JVH1XNH%2Fref%3Dsr_1_62_sspa%3Fdchild%3D1%26keywords%3Dwall%2Bmirror%26qid%3D1627567763%26sr%3D8-62-spons%26psc%3D1&qualifier=1627567763&id=8912503076602776&widgetName=sp_mtf
Quality Glass Square Shape Frameless Decorative Mirror Mirror Glass for Wall Mirror for bathrooms Mirror in Home Mirror Decor Mirror Size : 12X 12 inch QGFL 130  ,,,,"₹1,000",₹589,Save ₹411 (41%),3.3 out of 5 stars,25,https://www.amazon.in/Quality-Glass-Frameless-Decorative-bathrooms/dp/B0913BQ7SC/ref=sr_1_63?dchild=1&keywords=wall+mirror&qid=1627567763&sr=8-63
"zahab Single Door Virgin plastic Bathroom Cabinet with Mirror, 10x4x14 inches, Pink  ",,,,"₹1,999",₹925,"Save ₹1,074 (54%)",4.0 out of 5 stars,254,https://www.amazon.in/Zahab-Single-Bathroom-Cabinet-Mirror/dp/B07JHMZ44H/ref=sr_1_64?dchild=1&keywords=wall+mirror&qid=1627567763&sr=8-64
Art Street Decorative Wall Mirror Block Design Brown Set of 3 Square Shape Mirror for Home Decoration & Wall Decoration- Size-13.2 X 13.2 Inches  ,,,Only 2 left in stock.,"₹1,500",₹899,Save ₹601 (40%),5.0 out of 5 stars,3,https://www.amazon.in/Art-Street-Decorative-Decoration-Decoration/dp/B092983PDY/ref=sr_1_65?dchild=1&keywords=wall+mirror&qid=1627567763&sr=8-65
"GIG Handicrafts Decorative Iron Wall Mounted Hanging Mirror Sculpture Metal Glass Leaf Design Modern Art Gifts Home Decor (60 cm x 3 cm x 60 cm, Gold)  ",,,,"₹2,499","₹1,588",Save ₹911 (36%),3.9 out of 5 stars,58,https://www.amazon.in/GIG-Handicrafts-Mounted-Hanging-Sculpture/dp/B07PFWMLWX/ref=sr_1_66?dchild=1&keywords=wall+mirror&qid=1627567763&sr=8-66
AERINA 6Pcs/Set DIY Removable Home Room Wall Mirror Sticker Art Decor Decoration Wall Stickers Bathroom Mirror Sticker Decoration (GOLD)  ,,,,₹599,₹199,Save ₹400 (67%),2.2 out of 5 stars,18,https://www.amazon.in/AERINA-Removable-Decoration-Stickers-Bathroom/dp/B08TQT1VFR/ref=sr_1_67?dchild=1&keywords=wall+mirror&qid=1627567763&sr=8-67
"Atulya Arts 6 Pieces 6inch Decorative Square Mirror Wall Sticker, 3D Acrylic Stickers for Wall, Self Adhesive Mirror Silver Wall Stickers for Bathroom Living Room Bedroom Home Decor (Silver)  ",,,,₹999,₹299,Save ₹700 (70%),4.6 out of 5 stars,3,https://www.amazon.in/Atulya-Arts-Decorative-Stickers-Adhesive/dp/B09537CLQX/ref=sr_1_68?dchild=1&keywords=wall+mirror&qid=1627567763&sr=8-68
Walltech Hexagon 31 Silver 3D Mirror Acrylic Wall Sticker for Home Decor  ,,,,₹999,₹299,Save ₹700 (70%),3.0 out of 5 stars,21,https://www.amazon.in/Walltech-Hexagon-Silver-Acrylic-Sticker/dp/B08GG8K8CY/ref=sr_1_69?dchild=1&keywords=wall+mirror&qid=1627567763&sr=8-69
"Atulya Arts Mirror Hexagon Decorative Wall Sticker (Pack of 7) with 10 Butterfly Sticker 3D Acrylic Stickers Mirror Wall Stickers for Living Room Bedroom Home & Office (Silver, 10.5 cm x 12.1 cm) ..  ",,,,₹999,₹199,Save ₹800 (80%),3.3 out of 5 stars,104,https://www.amazon.in/Atulya-Arts-Decorative-Butterfly-Stickers/dp/B092TL4B34/ref=sr_1_70?dchild=1&keywords=wall+mirror&qid=1627567763&sr=8-70
Tinitalo Frameless Decorative Mirror Glass for Wall Mirror Bathrooms Home Mirror Decor Size : 12 x 18 Inch QG 138  ,,,,"₹2,449",₹949,"Save ₹1,500 (61%)",5.0 out of 5 stars,1,https://www.amazon.in/Tinitalo-Frameless-Decorative-Mirror-Bathrooms/dp/B096XCXVCT/ref=sr_1_71?dchild=1&keywords=wall+mirror&qid=1627567763&sr=8-71
Anikaa Maria Engineered Wood Dressing Wall Mirrors/Wall Hanging Dressing Mirrors with Shelf/Decorative Wall Mirror/Dressing Table for Bed Room/Living Room (Walnut) Matte Finish  ,,,,"₹2,599","₹1,799",Save ₹800 (31%),4.0 out of 5 stars,126,https://www.amazon.in/Anikaa-Dressing-Mirrors-Hanging-Decorative/dp/B08L7S1DVC/ref=sr_1_72?dchild=1&keywords=wall+mirror&qid=1627567763&sr=8-72
"AmazonBasics Rectangular Wall Mirror 41 x 51 CM - Standard Trim, Walnut  ",Deal of the Day ,,,"₹2,300","₹1,189","Save ₹1,111 (48%)",4.6 out of 5 stars,104,https://www.amazon.in/AmazonBasics-Rectangular-Wall-Mirror-16x20/dp/B07RQMRXQW/ref=sr_1_73?dchild=1&keywords=wall+mirror&qid=1627567763&smid=AT95IG9ONZD7S&sr=8-73
Bikri Kendra - Ganesha Silver - 3D Acrylic Decorative Mirror  ,,,,"₹1,100",₹369,Save ₹731 (66%),4.3 out of 5 stars,145,https://www.amazon.in/Bikri-Kendra-Ganesha-Acrylic-Stickers/dp/B07WLNPX61/ref=sr_1_74?dchild=1&keywords=wall+mirror&qid=1627567763&sr=8-74
Atulya Arts offering- Sun Wall Sticker (1.5ft Size) 3D Acrylic Stickers for Wall Decorative Mirror Wall Stickers (Silver)  ,,,,₹999,₹199,Save ₹800 (80%),4.0 out of 5 stars,1,https://www.amazon.in/Atulya-Arts-offering-Stickers-Decorative/dp/B092R3HVFC/ref=sr_1_75?dchild=1&keywords=wall+mirror&qid=1627567763&sr=8-75
Creative Arts n Frames Synthetic Fiber Wood Wall Mirror (10 x 14 inch) (Brown)  ,,,,"₹1,000",₹499,Save ₹501 (50%),3.5 out of 5 stars,142,https://www.amazon.in/Creative-Frames-Synthetic-Framed-Mirror/dp/B07CVXJ3KG/ref=sr_1_76?dchild=1&keywords=wall+mirror&qid=1627567763&sr=8-76
Quality Glass Frameless Round Mirror | Brown and Silver | Mirror for Wall | Mirror for Bathrooms | Mirror for Home | Mirror Decor | Mirror Size : 24 X24 inch.  ,,,,"₹2,500","₹2,100",Save ₹400 (16%),4.0 out of 5 stars,16,https://www.amazon.in/Quality-Glass-Frameless-Mirror-Bathrooms/dp/B07HHHBK6J/ref=sr_1_77?dchild=1&keywords=wall+mirror&qid=1627567763&sr=8-77
"creatick studio Acrylic Abstract Wall 3D Sticker, 27 x 27 cm, Silver  ",,,,₹799,₹239,Save ₹560 (70%),3.9 out of 5 stars,18,https://www.amazon.in/Creatick-Acrylic-Abstract-Decorative-Sticker/dp/B07XLCG5XK/ref=sr_1_78?dchild=1&keywords=wall+mirror&qid=1627567763&sr=8-78
