name,badge_1,badge_2,badge_3,mrp,discounted_price,discount,rating,rating_count,link
"AmazonBasics Rectangular Wall Mirror 41 x 51 cm - Standard Trim, Black  ",,Sponsored,,"₹2,300","₹1,249","Save ₹1,051 (46%)",4.4 out of 5 stars,252,https://www.amazon.in/gp/slredirect/picassoRedirect.html/ref=pa_sp_atf_aps_sr_pg1_1?ie=UTF8&adId=A026493029CBOANU39VKX&url=%2FAmazonBasics-Rectangular-Wall-Mirror-16x20%2Fdp%2FB07RSSZTRL%2Fref%3Dsr_1_1_sspa%3Fdchild%3D1%26keywords%3Dwall%2Bmirror%26qid%3D1628355088%26sr%3D8-1-spons%26psc%3D1&qualifier=1628355088&id=7467621013222152&widgetName=sp_atf
"AmazonBasics Rectangular Wall Mirror 41 x 51 CM - Standard Trim, Walnut  ",,Sponsored,,"₹2,300","₹1,249","Save ₹1,051 (46%)",4.6 out of 5 stars,112,https://www.amazon.in/gp/slredirect/picassoRedirect.html/ref=pa_sp_atf_aps_sr_pg1_1?ie=UTF8&adId=A0264774QCOSRQJNSZBY&url=%2FAmazonBasics-Rectangular-Wall-Mirror-16x20%2Fdp%2FB07RQMRXQW%2Fref%3Dsr_1_2_sspa%3Fdchild%3D1%26keywords%3Dwall%2Bmirror%26qid%3D1628355088%26sr%3D8-2-spons%26psc%3D1&qualifier=1628355088&id=7467621013222152&widgetName=sp_atf
CasaGold Round Leather Hanging Mirror - 16 Inch with Adjustable Leather Strap & Matching Wall Hook for Wall Decor l Living Room l Bedroom l Wash Basin l Bathroom  ,,Sponsored,,"₹9,999","₹3,499","Save ₹6,500 (65%)",3.7 out of 5 stars,5,https://www.amazon.in/gp/slredirect/picassoRedirect.html/ref=pa_sp_atf_aps_sr_pg1_1?ie=UTF8&adId=A03332382Q9JQFQGEWW1J&url=%2FCasaGold-Antique-Wall-Mounted-Hanging-Leather%2Fdp%2FB08LKTS42M%2Fref%3Dsr_1_3_sspa%3Fdchild%3D1%26keywords%3Dwall%2Bmirror%26qid%3D1628355088%26sr%3D8-3-spons%26psc%3D1&qualifier=1628355088&id=7467621013222152&widgetName=sp_atf
Anikaa Maria Engineered Wood Dressing Wall Mirrors/Wall Hanging Dressing Mirrors with Shelf/Decorative Wall Mirror/Dressing Table for Bed Room/Living Room (Walnut) Matte Finish  ,,Sponsored,,"₹2,599","₹1,799",Save ₹800 (31%),4.0 out of 5 stars,136,https://www.amazon.in/gp/slredirect/picassoRedirect.html/ref=pa_sp_atf_aps_sr_pg1_1?ie=UTF8&adId=A04386291EAIPISZDG556&url=%2FAnikaa-Dressing-Mirrors-Hanging-Decorative%2Fdp%2FB08L7S1DVC%2Fref%3Dsr_1_4_sspa%3Fdchild%3D1%26keywords%3Dwall%2Bmirror%26qid%3D1628355088%26sr%3D8-4-spons%26psc%3D1&qualifier=1628355088&id=7467621013222152&widgetName=sp_atf
SEVEN HORSES Floral Design Glass Wall Mirror for Makeup Bathroom Dressing (14.5X26.5 Inch)  ,,,,"₹1,998","₹1,199",Save ₹799 (40%),4.2 out of 5 stars,298,https://www.amazon.in/SEVEN-HORSES-Bathroom-Dressing-14-5X26-5/dp/B08KHHJC98/ref=sr_1_5?dchild=1&keywords=wall+mirror&qid=1628355088&sr=8-5
"Wall1ders - Hexagon 3D Acrylic Stickers, 3D Acrylic Wall Stickers for Living Room, Hall, Bed Room & Home with 10 Butterfly Stickers - Pack of 28 (Silver)  ",Best seller,,,₹999,₹370,Save ₹629 (63%),4.0 out of 5 stars,"3,252",https://www.amazon.in/gp/bestsellers/kitchen/1380412031/ref=sr_bs_5_1380412031_1
Reflectionz Frameless Rectangle Decorative Mirror | Mirror Glass for Wall | Mirror for Bathrooms | Mirror in Home | Mirror Decor | Mirror Size : (10 X 14 Inch)  ,,,,₹799,₹500,Save ₹299 (37%),4.0 out of 5 stars,369,https://www.amazon.in/Reflectionz-Frameless-Rectangle-Decorative-Bathrooms/dp/B08T7JKT3P/ref=sr_1_7?dchild=1&keywords=wall+mirror&qid=1628355088&sr=8-7
"Creative Arts n Frames 15 x 21 inch Wall Mirror for Bathroom, Bedroom, Drawing Room and Wash Basin (Mirror, 15 x 21 inch) (Oval)  ",,,,"₹2,999","₹1,099","Save ₹1,900 (63%)",4.2 out of 5 stars,650,https://www.amazon.in/Creative-Arts-Frames-Bathroom-Bedroom/dp/B08DL3W9VZ/ref=sr_1_8?dchild=1&keywords=wall+mirror&qid=1628355088&sr=8-8
"Dime Store Wall Mirror with Shelf for Living Room Bedroom Dressing Mirror for Wall Decor (Classic, Brown)  ",,,,"₹3,400","₹1,499","Save ₹1,901 (56%)",3.8 out of 5 stars,339,https://www.amazon.in/Dime-Store-Mirror-Shelf-Living/dp/B08YKGGPL5/ref=sr_1_9?dchild=1&keywords=wall+mirror&qid=1628355088&sr=8-9
Bikri Kendra Hexagon 20 Golden Acrylic Mirror Wall Stickers  ,,,,"₹1,199",₹269,Save ₹930 (78%),3.7 out of 5 stars,"2,364",https://www.amazon.in/Bikri-Kendra-Hexagon-Golden-Mirror/dp/B072Q4Y2Q8/ref=sr_1_10?dchild=1&keywords=wall+mirror&qid=1628355088&sr=8-10
"Art India Collections Decorative Hexagonal Hanging Wall Mirror, Large Vintage Mirror for Wall-9.5x11 Inch Gold Metallic Frame Mirror Material Wall Mirrors  ",,,,"₹1,249",₹721,Save ₹528 (42%),3.5 out of 5 stars,32,https://www.amazon.in/Art-India-Collections-Decorative-Wall-9-5x11/dp/B0925JJ79P/ref=sr_1_11?dchild=1&keywords=wall+mirror&qid=1628355088&sr=8-11
Anikaa Maria Engineered Wood Dressing Wall Mirrors/Wall Hanging Dressing Mirrors with Shelf/Decorative Wall Mirror/Dressing Table for Bed Room/Living Room (Walnut) Matte Finish  ,,,,"₹2,599","₹1,799",Save ₹800 (31%),4.0 out of 5 stars,136,https://www.amazon.in/Anikaa-Dressing-Mirrors-Hanging-Decorative/dp/B08L7S1DVC/ref=sr_1_12?dchild=1&keywords=wall+mirror&qid=1628355088&sr=8-12
999Store Printed Basin Mirror Wall Mirrors Decorative Wood Small washroom Bathroom Mirror (MDF_7X9 Inches) MirrorXSP94  ,,,,₹499,₹399,Save ₹100 (20%),5.0 out of 5 stars,1,https://www.amazon.in/999Store-Decorative-washroom-Bathroom-MirrorXSP94/dp/B09BNNDBLZ/ref=sr_1_13?dchild=1&keywords=wall+mirror&qid=1628355088&sr=8-13
RAG28 Vintage Silver Mandala Decorative Wall Mirror (Set of 3)(Size - 12X12 Inches Each)  ,,,,"₹1,199",₹499,Save ₹700 (58%),4.3 out of 5 stars,5,https://www.amazon.in/RAG28-Vintage-Silver-Mandala-Decorative/dp/B097ZPYNYL/ref=sr_1_14?dchild=1&keywords=wall+mirror&qid=1628355088&sr=8-14
Efinito 18 Inches Decorative Wall Mirror for Bathroom Wash Basin Bedroom Drawing Room Makeup Vanity Mirror  ,,,,"₹2,499",₹794,"Save ₹1,705 (68%)",5.0 out of 5 stars,2,https://www.amazon.in/Efinito-Decorative-Bathroom-Bedroom-Drawing/dp/B09B2G428S/ref=sr_1_15?dchild=1&keywords=wall+mirror&qid=1628355088&sr=8-15
Atulya Arts 3D Hexagon Acrylic Decorative Wall-Stickers with 10 Butterfly Stickers (Silver) - Pack of 28  ,,,,₹999,₹360,Save ₹639 (64%),3.9 out of 5 stars,"2,307",https://www.amazon.in/Hexagon-Decorative-Wall-Stickers-Butterfly-Stickers/dp/B07BNHWDL4/ref=sr_1_16?dchild=1&keywords=wall+mirror&qid=1628355088&sr=8-16
Atulya Arts - Offering 3D Large Hexagon Acrylic Stickers (Pack of 7) with 10 Butterfly Acrylic Mirror Wall Stickers for Home & Offices(Silver)  ,,,,₹999,₹195,Save ₹804 (80%),3.6 out of 5 stars,"1,360",https://www.amazon.in/Wall1ders-Atulya-Hexagon-Acrylic-Stickers/dp/B07JJP82L6/ref=sr_1_17?dchild=1&keywords=wall+mirror&qid=1628355088&sr=8-17
"Wall1ders - 20 Hexagon with 10 Butterfly Golden (Each Hexagon Szie 12.1 cm x 10.5 cm) 3D Hexagon Mirror Wall Stickers, 3D Mirror Stickers for Wall Large Size, 3D Wall Mirror Stickers  ",,,,"₹1,099",₹268,Save ₹831 (76%),3.8 out of 5 stars,479,https://www.amazon.in/Wall1ders-Hexagon-Butterfly-Acrylic-Stickers/dp/B089NW7X4K/ref=sr_1_18?dchild=1&keywords=wall+mirror&qid=1628355088&sr=8-18
WallDaddy - Offering 3D Large Hexagon Acrylic Stickers (Pack of 7) with 10 Butterfly Acrylic Mirror Wall Stickers for Home & Offices(Silver)  ,,,,₹999,₹179,Save ₹820 (82%),2.5 out of 5 stars,2,https://www.amazon.in/WallDaddy-Offering-Hexagon-Stickers-Butterfly/dp/B099QHJPV2/ref=sr_1_19?dchild=1&keywords=wall+mirror&qid=1628355088&sr=8-19
"WallDaddy 3D Hexagon Mirror Wall Stickers, 3D Mirror Stickers for Wall Large Size, 3D Wall Mirror Stickers - (Pack of 20, Silver, 1.5 mm, Premium Qualty, Each Hexagon Size 10.5 cm x 12.1 cm)  ",,,,₹499,₹239,Save ₹260 (52%),4.2 out of 5 stars,13,https://www.amazon.in/WallDaddy-Hexagon-Mirror-Stickers-Large/dp/B098TMZKFS/ref=sr_1_20?dchild=1&keywords=wall+mirror&qid=1628355088&sr=8-20
"Timberly Wooden Wall Decorative Vintage Sunburst Mirror for Living Room (16 x 16 Inch) (Brown Color) - Set of 1, Medium  ",,Sponsored,,"₹2,449","₹1,250","Save ₹1,199 (49%)",4.0 out of 5 stars,31,https://www.amazon.in/gp/slredirect/picassoRedirect.html/ref=pa_sp_mtf_aps_sr_pg1_1?ie=UTF8&adId=A10120762CIP8J7K1J060&url=%2FTimberly-Wooden-Decorative-Vintage-Sunburst%2Fdp%2FB09298CR3N%2Fref%3Dsr_1_21_sspa%3Fdchild%3D1%26keywords%3Dwall%2Bmirror%26qid%3D1628355088%26sr%3D8-21-spons%26psc%3D1%26smid%3DA2OZAWQIRC0RFQ&qualifier=1628355088&id=7467621013222152&widgetName=sp_mtf
BLUEWUD Akira Wall Mounted Dressing Mirror (Walnut)  ,Deal of the Day ,Sponsored,,"₹5,749","₹4,139","Save ₹1,610 (28%)",4.4 out of 5 stars,82,https://www.amazon.in/gp/slredirect/picassoRedirect.html/ref=pa_sp_mtf_aps_sr_pg1_1?ie=UTF8&adId=A015396937JW7HX4LLGYT&url=%2FBluewud-M-AK-BL-Dressing-Mirror-Walnut%2Fdp%2FB06WLNKN2W%2Fref%3Dsr_1_22_sspa%3Fdchild%3D1%26keywords%3Dwall%2Bmirror%26qid%3D1628355088%26sr%3D8-22-spons%26psc%3D1&qualifier=1628355088&id=7467621013222152&widgetName=sp_mtf
RJKart Iron Handcrafted Wired Flower Design Golden Decorative Wall Mirror for Living Room (30 x 30 in) - by Elegante HOMEZ  ,,Sponsored,,"₹9,999","₹4,990","Save ₹5,009 (50%)",4.3 out of 5 stars,13,https://www.amazon.in/gp/slredirect/picassoRedirect.html/ref=pa_sp_mtf_aps_sr_pg1_1?ie=UTF8&adId=A0746931CO3OZOGD6A9J&url=%2FRJKart-Handcrafted-Flower-Design-Decorative%2Fdp%2FB08SMFLN21%2Fref%3Dsr_1_23_sspa%3Fdchild%3D1%26keywords%3Dwall%2Bmirror%26qid%3D1628355088%26sr%3D8-23-spons%26psc%3D1&qualifier=1628355088&id=7467621013222152&widgetName=sp_mtf
"Timberly Decorative Hand Crafted Wooden Wall Mirror Panel for Living Room | Modern Wall Panels | Wall Décor - Pack of 2 (30 x 12 inch, Brown)  ",,Sponsored,,"₹6,999","₹3,490","Save ₹3,509 (50%)",4.3 out of 5 stars,28,https://www.amazon.in/gp/slredirect/picassoRedirect.html/ref=pa_sp_mtf_aps_sr_pg1_1?ie=UTF8&adId=A084316034AAD5WJTDYWO&url=%2FTimberly-Decorative-Crafted-Wooden-Mirror%2Fdp%2FB08ZKX49X3%2Fref%3Dsr_1_24_sspa%3Fdchild%3D1%26keywords%3Dwall%2Bmirror%26qid%3D1628355088%26sr%3D8-24-spons%26psc%3D1&qualifier=1628355088&id=7467621013222152&widgetName=sp_mtf
"Quality Glass Glass Wall Mirror (18 X 36 Inch, Silver).  ",,,,"₹3,000","₹1,799","Save ₹1,201 (40%)",2.8 out of 5 stars,33,https://www.amazon.in/Quality-Glass-Frameless-Decorative-bathrooms/dp/B07NWDZGFC/ref=sr_1_25?dchild=1&keywords=wall+mirror&qid=1628355088&sr=8-25
WallWear - Offering Attractive 3D Large Hexagon Acrylic Stickers (Pack of 7) with 10 Butterfly Acrylic Mirror Wall Stickers for Home & Offices(Silver)  ,,,,₹599,₹179,Save ₹420 (70%),,,https://www.amazon.in/WallWear-Offering-Attractive-Stickers-Butterfly/dp/B09B42GPLW/ref=sr_1_26?dchild=1&keywords=wall+mirror&qid=1628355088&sr=8-26
"Art Street Frameless Wall Mirrors for Bathroom, Bevelled Frameless Wall Mirror (16 x 24 Inches, Silver)  ",Limited time deal,,,"₹2,500","₹1,082","Save ₹1,418 (57%)",3.8 out of 5 stars,459,https://www.amazon.in/Art-Street-Bathroom-Frameless-Horizontal/dp/B07NYZYY46/ref=sr_1_27?dchild=1&keywords=wall+mirror&qid=1628355088&smid=AT95IG9ONZD7S&sr=8-27
CasaGold Black Round Wall Mirror - 18 Inch in Metal Frame for Wall Decor / Wash Basin / Bedroom  ,,,,"₹5,000","₹2,199","Save ₹2,801 (56%)",4.5 out of 5 stars,10,https://www.amazon.in/CasaGold-Black-Round-Wall-Mirror/dp/B0924H8C98/ref=sr_1_28?dchild=1&keywords=wall+mirror&qid=1628355088&sr=8-28
"Wall1ders - Plume Feather Silver 3D Mirror Stickers for Wall Large Size, 3D Wall Mirror Sticker, Mirror Wall Stickers for Living Room, Hall, Bed Room & Home. (Silver)  ",,,,"₹1,020",₹268,Save ₹752 (74%),3.8 out of 5 stars,975,https://www.amazon.in/Feather%C2%82-Silver-Acrylic-Mirror-Stickers-Office/dp/B07D39215W/ref=sr_1_29?dchild=1&keywords=wall+mirror&qid=1628355088&sr=8-29
"Seven Horses Frame Brown Sunmica Finish Fiber Wood Wall Mirror, Dressing Mirror Solid Premium Brown Water Resistant Synthetic Fiber Wood Made (14.5X26.5 Inch)  ",Amazon's Choice,,,"₹1,998","₹1,199",Save ₹799 (40%),4.1 out of 5 stars,328,https://www.amazon.in/Sunmica-Dressing-Premium-Resistant-Synthetic/dp/B0795WCNQS/ref=ice_ac_b_dpb?dchild=1&keywords=wall+mirror&qid=1628355088&sr=8-30
999Store Printed Bath Room Mirror mirors for Wall Brown Wooden Small washroom Bathroom Mirror (MDF_7X9 Inches) MirrorXSP307  ,,,,₹499,₹399,Save ₹100 (20%),4.5 out of 5 stars,2,https://www.amazon.in/999Store-Printed-washroom-Bathroom-MirrorXSP307/dp/B09BNP5TJD/ref=sr_1_31?dchild=1&keywords=wall+mirror&qid=1628355088&sr=8-31
"Art Street Decorative Wall Mirror Black Flat Small Size/Looking Glass Inner Size 10 x 12 inch, Outer Size 12 x 14 inch  ",Limited time deal,,,"₹1,500",₹462,"Save ₹1,038 (69%)",3.7 out of 5 stars,364,https://www.amazon.in/Art-Street-Decorative-Mirror-Looking/dp/B07DWWT61F/ref=sr_1_32?dchild=1&keywords=wall+mirror&qid=1628355088&smid=AT95IG9ONZD7S&sr=8-32
Art Street Lotus Petal Decorative Wall Mirror (Set of 3)(Size - 9 x 9 inch)  ,,,,"₹1,500",₹715,Save ₹785 (52%),4.1 out of 5 stars,190,https://www.amazon.in/Painting-Mantra-Street-Decorative-Mirror/dp/B07954FM4N/ref=sr_1_33?dchild=1&keywords=wall+mirror&qid=1628355088&sr=8-33
Art Street Decorative Wall Mirror Set of 4 Grey Brown Triangular Shape for Home Decoration & Wall Decoration- Size-10x10 Inch  ,,,,"₹1,500",₹735,Save ₹765 (51%),4.5 out of 5 stars,12,https://www.amazon.in/Art-Street-Decorative-Triangular-Decoration/dp/B08Z43S8CP/ref=sr_1_34?dchild=1&keywords=wall+mirror&qid=1628355088&sr=8-34
"Wall1ders - 31 Hexagon & 10 Butterflies Silver (Size 10.5 x 12 cm) 3D Hexagon Wall Stickers, 3D Stickers for Wall Large Size, 3D Wall Stickers, Acrylic Sticker  ",,,,"₹1,099",₹360,Save ₹739 (67%),4.1 out of 5 stars,856,https://www.amazon.in/Wall1ders-Hexagon-Silver-Acrylic-Mirror-Stickers/dp/B07PM85JYY/ref=sr_1_35?dchild=1&keywords=wall+mirror&qid=1628355088&sr=8-35
"Quality Glass Glass Mirror for Wall (18 X 24 Inch, Silver)  ",,,,"₹2,500","₹1,299","Save ₹1,201 (48%)",4.1 out of 5 stars,79,https://www.amazon.in/Quality-Glass-Frameless-Decorative-bathrooms/dp/B07HHG9BVS/ref=sr_1_36?dchild=1&keywords=wall+mirror&qid=1628355088&sr=8-36
999Store Printed Mirror for Wall Decoration Living Room Small Decorative Mirrors for Wall White Stone Rustic Small washroom Bathroom Mirror (MDF_7X9 Inches) MirrorXSP104  ,,,,₹499,₹399,Save ₹100 (20%),5.0 out of 5 stars,1,https://www.amazon.in/999Store-Decoration-Decorative-washroom-MirrorXSP104/dp/B09BNMB7D6/ref=sr_1_37?dchild=1&keywords=wall+mirror&qid=1628355088&sr=8-37
Atulya Arts Angel and Butterfly Mirror Wall Stickers Silver 3D Decorative Acrylic Sticker for Bedroom Living Room Home Decor and Office -(Silver)  ,,,,₹999,₹249,Save ₹750 (75%),5.0 out of 5 stars,1,https://www.amazon.in/Atulya-Arts-Butterfly-Stickers-Decorative/dp/B094W28MYY/ref=sr_1_38?dchild=1&keywords=wall+mirror&qid=1628355088&sr=8-38
jacky Glass RKC Brown Gold Border Mirror for Walls Decoration for Table Birthday GIF  ,,,,"₹1,879",₹399,"Save ₹1,480 (79%)",2.9 out of 5 stars,9,https://www.amazon.in/jacky-Border-Mirror-Decoration-Birthday/dp/B08HD9NB87/ref=sr_1_39?dchild=1&keywords=wall+mirror&qid=1628355088&sr=8-39
AG Crafts™ Black Flat Decorative Wall Mirror/Looking Glass Inner Size 18 x 12 inch - 0022 (Black)  ,,,,"₹1,499",₹599,Save ₹900 (60%),3.3 out of 5 stars,46,https://www.amazon.in/AG-CraftsTM-Decorative-Mirror-Looking/dp/B08HJK694Y/ref=sr_1_40?dchild=1&keywords=wall+mirror&qid=1628355088&sr=8-40
Efinito 18 Inches Decorative Wall Mirror for Bathroom Wash Basin Bedroom Drawing Room Makeup Vanity Mirror  ,,,,"₹2,499",₹789,"Save ₹1,710 (68%)",,,https://www.amazon.in/Efinito-Decorative-Bathroom-Bedroom-Drawing/dp/B09BL9Y278/ref=sr_1_41?dchild=1&keywords=wall+mirror&qid=1628355088&sr=8-41
Bikri Kendra® - Hexagon 13 Silver -3D Acrylic Decorative Mirror  ,,,,"₹1,100",₹229,Save ₹871 (79%),3.8 out of 5 stars,472,https://www.amazon.in/Bikri-Kendra-Hexagon-Walldecor-Stickers/dp/B071JFMG29/ref=sr_1_42?dchild=1&keywords=wall+mirror&qid=1628355088&sr=8-42
"Atulya Arts 3D Hexagon Acrylic Mirror Wall Sticker (Pack of 28) with 10 Butterfly Decorative Mirror Wall Stickers Set for Home Living Room Bedroom Office (Silver, Size, 12.1 cm X 10.5 cm)  ",,,,₹999,₹319,Save ₹680 (68%),3.6 out of 5 stars,67,https://www.amazon.in/Atulya-Arts-Butterfly-Decorative-Stickers/dp/B08TVYQS2D/ref=sr_1_43?dchild=1&keywords=wall+mirror&qid=1628355088&sr=8-43
Atulya Arts 3D Acrylic Mirror Hexagon Shape Wall Stickers (Gold) -(Pack of 20)  ,,,,₹999,₹269,Save ₹730 (73%),3.8 out of 5 stars,"2,396",https://www.amazon.in/Atulya-Acrylic-Mirror-Hexagon-Stickers/dp/B078LH2JR4/ref=sr_1_44?dchild=1&keywords=wall+mirror&qid=1628355088&sr=8-44
Quality Glass Verticle Shape Frameless Decorative Mirror Mirror Glass for Wall Mirror for bathrooms Mirror in Home Mirror décor Mirror Size : 12 X 18 inch QGFL 132  ,,,,"₹2,449",₹889,"Save ₹1,560 (64%)",3.7 out of 5 stars,65,https://www.amazon.in/Quality-Glass-Frameless-Decorative-bathrooms/dp/B0928GB9KR/ref=sr_1_45?dchild=1&keywords=wall+mirror&qid=1628355088&sr=8-45
Happer Premium Plastic Wall Mounted Mirror and Storage Cabinet (White)  ,Limited time deal,,,"₹7,000","₹1,399","Save ₹5,601 (80%)",3.7 out of 5 stars,507,https://www.amazon.in/Happer-Premium-Mounted-New-Look/dp/B08243HNTH/ref=sr_1_46?dchild=1&keywords=wall+mirror&qid=1628355088&smid=AT95IG9ONZD7S&sr=8-46
WallWear Hexagon 20 Silver - 3D Acrylic Decorative Mirror Wall Stickers for Home & Office  ,,,,₹599,₹249,Save ₹350 (58%),5.0 out of 5 stars,1,https://www.amazon.in/WallWear-Hexagon-20-Silver-Decorative/dp/B099KV1GFW/ref=sr_1_47?dchild=1&keywords=wall+mirror&qid=1628355088&sr=8-47
999Store Printed Mirrors for wash Basin Mirror for Bathroom Wall Blue Marvel Small washroom Bathroom Mirror (MDF_7X9 Inches) MirrorXSP88  ,,,,₹499,₹399,Save ₹100 (20%),,,https://www.amazon.in/999Store-Printed-Bathroom-washroom-MirrorXSP88/dp/B09BNN8V8F/ref=sr_1_48?dchild=1&keywords=wall+mirror&qid=1628355088&sr=8-48
999Store Printed Wall Mirrors for Bathroom washbasin Mirror Wall Pink and Black Strips Small washroom Bathroom Mirror (MDF_7X9 Inches) MirrorXSP329  ,,,,₹499,₹399,Save ₹100 (20%),,,https://www.amazon.in/999Store-Bathroom-washbasin-washroom-MirrorXSP329/dp/B09BNPQ472/ref=sr_1_49?dchild=1&keywords=wall+mirror&qid=1628355088&sr=8-49
"Steven Quartz Beautiful Elegance Designer Frame Wall Mirror (Size 40cm x 40cm) (16 Inch, Golden)  ",,,,"₹1,980",₹720,"Save ₹1,260 (64%)",3.7 out of 5 stars,49,https://www.amazon.in/Steven-Quartz-Beautiful-Elegance-Designer/dp/B08QH853V7/ref=sr_1_50?dchild=1&keywords=wall+mirror&qid=1628355088&sr=8-50
Quality Glass Oval Shape Frameless Decorative Mirror Mirror Glass for Wall Mirror for bathrooms Mirror in Home Mirror Decor Mirror Size : 12X 18 inch QGFL 128  ,,,,"₹1,200",₹889,Save ₹311 (26%),3.6 out of 5 stars,58,https://www.amazon.in/Quality-Glass-Frameless-Decorative-bathrooms/dp/B09139MXD2/ref=sr_1_51?dchild=1&keywords=wall+mirror&qid=1628355088&sr=8-51
Ghar Kraft Square Mosaic 24 Silver Acrylic Mirror Like Wall Sticker|Wall Sticker Decor|3D Wall Stickers for Home Decoration|Wall Sticker 3D for Hall|  ,,,,"₹1,099",₹329,Save ₹770 (70%),3.1 out of 5 stars,21,https://www.amazon.in/Ghar-Kraft-Square-24-Stickers-Decoration/dp/B08V4SYX5H/ref=sr_1_52?dchild=1&keywords=wall+mirror&qid=1628355088&sr=8-52
"SATYAM KRAFT 1 Piece Plastic Wall Mirror (9 Inch × 9 Inch, Gold)  ",,,,"₹1,200",₹339,Save ₹861 (72%),3.7 out of 5 stars,395,https://www.amazon.in/SATYAM-KRAFT-Fibre-Wall-Mirror/dp/B084VPP133/ref=sr_1_53?dchild=1&keywords=wall+mirror&qid=1628355088&sr=8-53
Quality Glass Round Shape Frameless Decorative Mirror Mirror Glass for Wall Mirror for bathrooms Mirror in Home Mirror Decor Mirror Size : 12X 12 inch QGFL 131  ,,,,₹699,₹535,Save ₹164 (23%),3.6 out of 5 stars,81,https://www.amazon.in/Quality-Glass-Frameless-Decorative-bathrooms/dp/B0927DWQMH/ref=sr_1_54?dchild=1&keywords=wall+mirror&qid=1628355088&sr=8-54
"BIGMALL Silver Mirror Acrylic (Non Glass - Not Real Mirror - Art Decor Mirror) 2 mm 6 inch X 6 inch/pack of 4pcs (Acrylic, 6X6X4PCS): without any adhesive tape  ",,,,₹950,₹368,Save ₹582 (61%),3.2 out of 5 stars,95,https://www.amazon.in/BIGMALL-Silver-Mirror-Acrylic-6X6X4PCS/dp/B07WNXXWD6/ref=sr_1_55?dchild=1&keywords=wall+mirror&qid=1628355088&sr=8-55
Seven Horses Wooden Dressing Wall Mirrors/Wall Hanging Dressing Mirrors/Plain Decorative Wall Mirror/Dressing Table for Bed Room/ Wall Mounted Dressing Mirror for Living Room (Size 15X36 Inch)  ,,,,"₹4,998","₹1,998","Save ₹3,000 (60%)",3.7 out of 5 stars,11,https://www.amazon.in/Dressing-Mirrors-Hanging-Decorative-Mounted/dp/B08VN6J5N8/ref=sr_1_56?dchild=1&keywords=wall+mirror&qid=1628355088&sr=8-56
AG Crafts Frame Sober Wood Wall Mirror- ||- Size - 18 X 12 Inch -||- Solid Water Resistant Synthetic Wood Medin in India -|| (White)  ,,Sponsored,,"₹1,499",₹599,Save ₹900 (60%),3.3 out of 5 stars,79,https://www.amazon.in/gp/slredirect/picassoRedirect.html/ref=pa_sp_btf_aps_sr_pg1_1?ie=UTF8&adId=A09351573LCR48NZA5VVX&url=%2FAG-Crafts-Frame-Sober-Mirror%2Fdp%2FB08FH8KL3Z%2Fref%3Dsr_1_57_sspa%3Fdchild%3D1%26keywords%3Dwall%2Bmirror%26qid%3D1628355088%26sr%3D8-57-spons%26psc%3D1&qualifier=1628355088&id=7467621013222152&widgetName=sp_btf
RJKart Iron Handcrafted Sunflower Design Gold Decorative Wall Mirror for Living Room (28 x 28 in) - by Elegante HOMEZ  ,,Sponsored,,"₹5,590","₹2,790","Save ₹2,800 (50%)",,,https://www.amazon.in/gp/slredirect/picassoRedirect.html/ref=pa_sp_btf_aps_sr_pg1_1?ie=UTF8&adId=A07476111N3QKQ7IBJLA9&url=%2FRJKart-Handcrafted-Sunflower-Design-Decorative%2Fdp%2FB08SMFJR1D%2Fref%3Dsr_1_58_sspa%3Fdchild%3D1%26keywords%3Dwall%2Bmirror%26qid%3D1628355088%26sr%3D8-58-spons%26psc%3D1&qualifier=1628355088&id=7467621013222152&widgetName=sp_btf
CasaGold Decorative Genuine Leather Round Wall Mirror for Wall Decor with Golden Studs -Dark Olive Green (24 inch)  ,,Sponsored,,"₹9,999","₹6,999","Save ₹3,000 (30%)",,,https://www.amazon.in/gp/slredirect/picassoRedirect.html/ref=pa_sp_btf_aps_sr_pg1_1?ie=UTF8&adId=A07495241D5PQHF1KMNCV&url=%2FCasaGold-Decorative-Genuine-Leather-Mirror%2Fdp%2FB093SQBBJN%2Fref%3Dsr_1_59_sspa%3Fdchild%3D1%26keywords%3Dwall%2Bmirror%26qid%3D1628355088%26sr%3D8-59-spons%26psc%3D1&qualifier=1628355088&id=7467621013222152&widgetName=sp_btf
RJKART Iron Decorative Round Wall Mirror for Bathroom Living Room Hall Bedroom Home Vintage Wall Décor Mirror for Wash Basin (Gold) - by Elegante HOMEZ  ,,Sponsored,,"₹11,790","₹5,890","Save ₹5,900 (50%)",,,https://www.amazon.in/gp/slredirect/picassoRedirect.html/ref=pa_sp_btf_aps_sr_pg1_1?ie=UTF8&adId=A0745983PY765SP41DQB&url=%2FRJKART-Decorative-Bathroom-Bedroom-Vintage%2Fdp%2FB08Z3BSXLL%2Fref%3Dsr_1_60_sspa%3Fdchild%3D1%26keywords%3Dwall%2Bmirror%26qid%3D1628355088%26sr%3D8-60-spons%26psc%3D1&qualifier=1628355088&id=7467621013222152&widgetName=sp_btf
CasaGold Black Round Wall Mirror - 18 Inch in Metal Frame with 2 Black Wall Hanging Candle Stands for Wall Decor / Wash Basin / Bedroom  ,,Sponsored,,"₹5,000","₹2,699","Save ₹2,301 (46%)",4.5 out of 5 stars,10,https://www.amazon.in/gp/slredirect/picassoRedirect.html/ref=pa_sp_atf_next_aps_sr_pg2_1?ie=UTF8&adId=A08728093CKBKQGDZW0SP&url=%2FCasaGold-Black-Round-Wall-Mirror%2Fdp%2FB095X282RS%2Fref%3Dsr_1_49_sspa%3Fdchild%3D1%26keywords%3Dwall%2Bmirror%26qid%3D1628355112%26sr%3D8-49-spons%26psc%3D1&qualifier=1628355112&id=3226349639598068&widgetName=sp_atf_next
"Timberly Wooden Wall Decorative Vintage Sunburst Mirror for Living Room (16 x 16 Inch, Blue Color) - Set of 1  ",,Sponsored,,"₹2,449","₹1,250","Save ₹1,199 (49%)",4.0 out of 5 stars,31,https://www.amazon.in/gp/slredirect/picassoRedirect.html/ref=pa_sp_atf_next_aps_sr_pg2_1?ie=UTF8&adId=A0202101KQWNBRQHSWCG&url=%2FTimberly-Decorative-Vintage-Sunburst-Blue%2Fdp%2FB08TC9RCX9%2Fref%3Dsr_1_50_sspa%3Fdchild%3D1%26keywords%3Dwall%2Bmirror%26qid%3D1628355112%26sr%3D8-50-spons%26psc%3D1&qualifier=1628355112&id=3226349639598068&widgetName=sp_atf_next
Efinito 18 Inches Decorative Wall Mirror for Bathroom Wash Basin Bedroom Drawing Room Makeup Vanity Mirror  ,,Sponsored,,"₹2,499",₹794,"Save ₹1,705 (68%)",5.0 out of 5 stars,2,https://www.amazon.in/gp/slredirect/picassoRedirect.html/ref=pa_sp_atf_next_aps_sr_pg2_1?ie=UTF8&adId=A0795448WY2NLR1YH5N6&url=%2FEfinito-Decorative-Bathroom-Bedroom-Drawing%2Fdp%2FB09B2G428S%2Fref%3Dsr_1_51_sspa%3Fdchild%3D1%26keywords%3Dwall%2Bmirror%26qid%3D1628355112%26sr%3D8-51-spons%26psc%3D1%26smid%3DA3IK2G3TMMPEP&qualifier=1628355112&id=3226349639598068&widgetName=sp_atf_next
CasaGold Tan Brown Leather Hanging Round Mirror - 18 Inch in Genuine Leather with Broad Adjustable Leather Strap for Wall Decor l Living Room l Bedroom l Wash Basin l Bathroom  ,,Sponsored,,"₹10,000","₹5,499","Save ₹4,501 (45%)",3.5 out of 5 stars,2,https://www.amazon.in/gp/slredirect/picassoRedirect.html/ref=pa_sp_atf_next_aps_sr_pg2_1?ie=UTF8&adId=A07251042LPBFQC1OC8HX&url=%2FCasaGold-Brown-Leather-Hanging-Mirror%2Fdp%2FB093SQMKPZ%2Fref%3Dsr_1_52_sspa%3Fdchild%3D1%26keywords%3Dwall%2Bmirror%26qid%3D1628355112%26sr%3D8-52-spons%26psc%3D1&qualifier=1628355112&id=3226349639598068&widgetName=sp_atf_next
Quality Glass Square Shape Frameless Decorative Mirror Mirror Glass for Wall Mirror for bathrooms Mirror in Home Mirror Decor Mirror Size : 12 X 12 inch QGFL 126  ,,,,"₹1,000",₹589,Save ₹411 (41%),3.2 out of 5 stars,34,https://www.amazon.in/Quality-Glass-Frameless-Decorative-bathrooms/dp/B09139VHV9/ref=sr_1_53?dchild=1&keywords=wall+mirror&qid=1628355112&sr=8-53
"Furnish Craft Sparkling Sun Designed Wall Mirror (28 x 28 inch, Golden)  ",,,,,,,4.2 out of 5 stars,68,https://www.amazon.in/Furnish-Craft-Steel-Mirror-Gold_28/dp/B082XC6R1Y/ref=sr_1_54?dchild=1&keywords=wall+mirror&qid=1628355112&sr=8-54
