name,badge_1,badge_2,badge_3,mrp,discounted_price,discount,rating,rating_count,link
"Timberly Wooden Wall Decorative Vintage Sunburst Mirror for Living Room (16 x 16 Inch) (Brown Color) - Set of 1, Medium  ",,Sponsored,,"₹2,449","₹1,250","Save ₹1,199 (49%)",3.8 out of 5 stars,27,https://www.amazon.in/gp/slredirect/picassoRedirect.html/ref=pa_sp_atf_aps_sr_pg1_1?ie=UTF8&adId=A05067763VCU78AGKL3DJ&url=%2FTimberly-Wooden-Decorative-Vintage-Sunburst%2Fdp%2FB09298CR3N%2Fref%3Dsr_1_1_sspa%3Fdchild%3D1%26keywords%3Dwall%2Bmirror%26qid%3D1626887607%26sr%3D8-1-spons%26psc%3D1&qualifier=1626887607&id=3377408705617182&widgetName=sp_atf
Anikaa Sofi Engineered Wood Dressing Wall Mirrors Wall Hanging Dressing Mirrors/Plain Decorative Wall Mirror/Full Length Mirror for Bedroom/Wall Mounted Dressing Mirror for Living Room (Wenge Big)  ,,Sponsored,,,,,3.3 out of 5 stars,8,https://www.amazon.in/gp/slredirect/picassoRedirect.html/ref=pa_sp_atf_aps_sr_pg1_1?ie=UTF8&adId=A04294451UTDE083DWDVO&url=%2FAnikaa-Mirrors-Hanging-Dressing-Decorative%2Fdp%2FB07Y79KFPW%2Fref%3Dsr_1_2_sspa%3Fdchild%3D1%26keywords%3Dwall%2Bmirror%26qid%3D1626887607%26sr%3D8-2-spons%26psc%3D1&qualifier=1626887607&id=3377408705617182&widgetName=sp_atf
Papdiwal Industries MIRRORNOW'S Glass Imported Touch Sensor LED Bathroom Mirror (30X24 Inches)  ,,Sponsored,,,,,,,https://www.amazon.in/gp/slredirect/picassoRedirect.html/ref=pa_sp_atf_aps_sr_pg1_1?ie=UTF8&adId=A06410591SG6SYUAIOB8K&url=%2FPapdiwal-Industries-MIRRORNOWS-Sensor-Bathroom%2Fdp%2FB08CB8Y9KB%2Fref%3Dsr_1_3_sspa%3Fdchild%3D1%26keywords%3Dwall%2Bmirror%26qid%3D1626887607%26sr%3D8-3-spons%26psc%3D1&qualifier=1626887607&id=3377408705617182&widgetName=sp_atf
Anikaa Maria Engineered Wood Dressing Wall Mirrors/Wall Hanging Dressing Mirrors with Shelf/Decorative Wall Mirror/Dressing Table for Bed Room/Living Room (Walnut) Matte Finish  ,,Sponsored,,"₹2,599","₹1,799",Save ₹800 (31%),4.0 out of 5 stars,123,https://www.amazon.in/gp/slredirect/picassoRedirect.html/ref=pa_sp_atf_aps_sr_pg1_1?ie=UTF8&adId=A04386291EAIPISZDG556&url=%2FAnikaa-Dressing-Mirrors-Hanging-Decorative%2Fdp%2FB08L7S1DVC%2Fref%3Dsr_1_4_sspa%3Fdchild%3D1%26keywords%3Dwall%2Bmirror%26qid%3D1626887607%26sr%3D8-4-spons%26psc%3D1&qualifier=1626887607&id=3377408705617182&widgetName=sp_atf
SEVEN HORSES Floral Design Glass Wall Mirror for Makeup Bathroom Dressing (14.5X26.5 Inch)  ,Amazon's Choice,,,"₹1,998","₹1,199",Save ₹799 (40%),4.3 out of 5 stars,266,https://www.amazon.in/SEVEN-HORSES-Bathroom-Dressing-14-5X26-5/dp/B08KHHJC98/ref=ice_ac_b_dpb?dchild=1&keywords=wall+mirror&qid=1626887607&sr=8-5
"Seven Horses Frame Brown Sunmica Finish Fiber Wood Wall Mirror, Dressing Mirror Solid Premium Brown Water Resistant Synthetic Fiber Wood Made (14.5X26.5 Inch)  ",,,,"₹1,998","₹1,199",Save ₹799 (40%),4.1 out of 5 stars,313,https://www.amazon.in/Sunmica-Dressing-Premium-Resistant-Synthetic/dp/B0795WCNQS/ref=sr_1_6?dchild=1&keywords=wall+mirror&qid=1626887607&sr=8-6
Quality Glass Verticle Shape Frameless Decorative Mirror Mirror Glass for Wall Mirror for bathrooms Mirror in Home Mirror décor Mirror Size : 12 X 18 inch QGFL 132  ,,,,"₹2,449",₹889,"Save ₹1,560 (64%)",3.7 out of 5 stars,43,https://www.amazon.in/Quality-Glass-Frameless-Decorative-bathrooms/dp/B0928GB9KR/ref=sr_1_7?dchild=1&keywords=wall+mirror&qid=1626887607&sr=8-7
"Wall1ders - Hexagon 3D Acrylic Stickers, 3D Acrylic Wall Stickers for Living Room, Hall, Bed Room & Home with 10 Butterfly Stickers - Pack of 28 (Silver)  ",Best seller,,,₹999,₹370,Save ₹629 (63%),4.0 out of 5 stars,"2,983",https://www.amazon.in/gp/bestsellers/kitchen/5554172031/ref=sr_bs_7_5554172031_1
"Art Street Decorative Wall Mirror Black Flat Small Size/Looking Glass Inner Size 10 x 12 inch, Outer Size 12 x 14 inch  ",Deal of the Day ,,,"₹1,500",₹474,"Save ₹1,026 (68%)",3.7 out of 5 stars,341,https://www.amazon.in/Art-Street-Decorative-Mirror-Looking/dp/B07DWWT61F/ref=sr_1_9?dchild=1&keywords=wall+mirror&qid=1626887607&sr=8-9
Art Street Lotus Petal Decorative Wall Mirror (Set of 3)(Size - 9 x 9 inch)  ,Deal of the Day ,,,"₹1,500",₹719,Save ₹781 (52%),4.1 out of 5 stars,184,https://www.amazon.in/Painting-Mantra-Street-Decorative-Mirror/dp/B07954FM4N/ref=sr_1_10?dchild=1&keywords=wall+mirror&qid=1626887607&sr=8-10
Quality Glass Oval Shape Frameless Decorative Mirror Mirror Glass for Wall Mirror for bathrooms Mirror in Home Mirror Decor Mirror Size : 12X 18 inch QGFL 128  ,,,,"₹1,200",₹849,Save ₹351 (29%),3.7 out of 5 stars,49,https://www.amazon.in/Quality-Glass-Frameless-Decorative-bathrooms/dp/B09139MXD2/ref=sr_1_11?dchild=1&keywords=wall+mirror&qid=1626887607&sr=8-11
Bikri Kendra Hexagon 20 Golden Acrylic Mirror Wall Stickers  ,,,,"₹1,100",₹269,Save ₹831 (76%),3.6 out of 5 stars,"1,738",https://www.amazon.in/Bikri-Kendra-Hexagon-Golden-Mirror/dp/B072Q4Y2Q8/ref=sr_1_12?dchild=1&keywords=wall+mirror&qid=1626887607&sr=8-12
"Hosley Decorative Square Iron Wall Mirror (15.24 cm x 29.84 cm, Black, Set of 3)  ",,,,"₹1,500",₹889,Save ₹611 (41%),4.4 out of 5 stars,183,https://www.amazon.in/Hosley-Decorative-Square-Mirror-15-24/dp/B01GHXY21G/ref=sr_1_13?dchild=1&keywords=wall+mirror&qid=1626887607&sr=8-13
jacky Glass RKC Brown Gold Border Mirror for Walls Decoration for Table Birthday GIF  ,,,,"₹1,298",₹349,Save ₹949 (73%),2.7 out of 5 stars,8,https://www.amazon.in/jacky-Border-Mirror-Decoration-Birthday/dp/B08HD9NB87/ref=sr_1_14?dchild=1&keywords=wall+mirror&qid=1626887607&sr=8-14
"SATYAM KRAFT 1 Piece Plastic Wall Mirror (9 Inch × 9 Inch, Gold)  ",,,,"₹1,200",₹339,Save ₹861 (72%),3.7 out of 5 stars,367,https://www.amazon.in/SATYAM-KRAFT-Fibre-Wall-Mirror/dp/B084VPP133/ref=sr_1_15?dchild=1&keywords=wall+mirror&qid=1626887607&sr=8-15
"SDG Frameless Oval Mirror (18x24inch, Silver)  ",,,,"₹1,999","₹1,249",Save ₹750 (38%),4.3 out of 5 stars,511,https://www.amazon.in/SDG-Frameless-Mirror-Bathrooms-Decor/dp/B07CK3R2C6/ref=sr_1_16?dchild=1&keywords=wall+mirror&qid=1626887607&sr=8-16
AG Crafts™ Black Flat Decorative Wall Mirror/Looking Glass Inner Size 18 x 12 inch - 0022 (Black)  ,,,,"₹1,499",₹599,Save ₹900 (60%),3.5 out of 5 stars,41,https://www.amazon.in/AG-CraftsTM-Decorative-Mirror-Looking/dp/B08HJK694Y/ref=sr_1_17?dchild=1&keywords=wall+mirror&qid=1626887607&sr=8-17
"Wall1ders - 31 Hexagon & 10 Butterflies Silver (Size 10.5 x 12 cm) 3D Hexagon Wall Stickers, 3D Stickers for Wall Large Size, 3D Wall Stickers, Acrylic Sticker  ",,,,"₹1,099",₹390,Save ₹709 (65%),4.1 out of 5 stars,788,https://www.amazon.in/Wall1ders-Hexagon-Silver-Acrylic-Mirror-Stickers/dp/B07PM85JYY/ref=sr_1_18?dchild=1&keywords=wall+mirror&qid=1626887607&sr=8-18
"WallDaddy 3D Hexagon Mirror Wall Stickers, 3D Mirror Stickers for Wall Large Size, 3D Wall Mirror Stickers - (Pack of 20, Silver, 1.5 mm, Premium Qualty, Each Hexagon Size 10.5 cm x 12.1 cm)  ",,,,₹499,₹239,Save ₹260 (52%),4.0 out of 5 stars,3,https://www.amazon.in/WallDaddy-Hexagon-Mirror-Stickers-Large/dp/B098TMZKFS/ref=sr_1_19?dchild=1&keywords=wall+mirror&qid=1626887607&sr=8-19
Atulya Arts 3D Hexagon Acrylic Decorative Wall-Stickers with 10 Butterfly Stickers (Silver) - Pack of 28  ,,,,₹999,₹360,Save ₹639 (64%),3.9 out of 5 stars,"2,218",https://www.amazon.in/Hexagon-Decorative-Wall-Stickers-Butterfly-Stickers/dp/B07BNHWDL4/ref=sr_1_20?dchild=1&keywords=wall+mirror&qid=1626887607&sr=8-20
BLUEWUD Akira Wall Mounted Dressing Mirror (Walnut)  ,,Sponsored,,"₹5,749","₹4,499","Save ₹1,250 (22%)",4.4 out of 5 stars,80,https://www.amazon.in/gp/slredirect/picassoRedirect.html/ref=pa_sp_mtf_aps_sr_pg1_1?ie=UTF8&adId=A015396937JW7HX4LLGYT&url=%2FBluewud-M-AK-BL-Dressing-Mirror-Walnut%2Fdp%2FB06WLNKN2W%2Fref%3Dsr_1_21_sspa%3Fdchild%3D1%26keywords%3Dwall%2Bmirror%26qid%3D1626887607%26sr%3D8-21-spons%26psc%3D1&qualifier=1626887607&id=3377408705617182&widgetName=sp_mtf
"KURTZY Classic Antique Style Wall Mirror, Oval Sculpt for Home Décor, Living Room, Bedroom and Bathroom (46 cm x 63 cm) (Elliptical).  ",,Sponsored,,"₹2,099","₹1,999",Save ₹100 (5%),3.9 out of 5 stars,310,https://www.amazon.in/gp/slredirect/picassoRedirect.html/ref=pa_sp_mtf_aps_sr_pg1_1?ie=UTF8&adId=A03569549CEFUVRGSS1E&url=%2FKurtzy-Mirror-Vintage-Bathroom-Bedroom%2Fdp%2FB07NYWHZPS%2Fref%3Dsr_1_22_sspa%3Fdchild%3D1%26keywords%3Dwall%2Bmirror%26qid%3D1626887607%26sr%3D8-22-spons%26psc%3D1&qualifier=1626887607&id=3377408705617182&widgetName=sp_mtf
"Dime Store Wall Mirror with Shelf for Living Room Bedroom Dressing Mirror for Wall Decor (Classic, Brown)  ",,Sponsored,,"₹3,400","₹1,499","Save ₹1,901 (56%)",3.8 out of 5 stars,299,https://www.amazon.in/gp/slredirect/picassoRedirect.html/ref=pa_sp_mtf_aps_sr_pg1_1?ie=UTF8&adId=A0610274322Y3Q1JL7AII&url=%2FDime-Store-Mirror-Shelf-Living%2Fdp%2FB08YKGGPL5%2Fref%3Dsr_1_23_sspa%3Fdchild%3D1%26keywords%3Dwall%2Bmirror%26qid%3D1626887607%26sr%3D8-23-spons%26psc%3D1&qualifier=1626887607&id=3377408705617182&widgetName=sp_mtf
"AG Crafts™ 0016(1.5"")-Brown Gold Decorative Mirror (Rectangle) (Brown-Gold)  ",,Sponsored,,"₹1,999",₹599,"Save ₹1,400 (70%)",3.4 out of 5 stars,14,https://www.amazon.in/gp/slredirect/picassoRedirect.html/ref=pa_sp_mtf_aps_sr_pg1_1?ie=UTF8&adId=A09351811T73XD14PHDJ&url=%2FAG-CraftsTM-Decorative-Rectangle-Brown-Gold%2Fdp%2FB08LZCNJWD%2Fref%3Dsr_1_24_sspa%3Fdchild%3D1%26keywords%3Dwall%2Bmirror%26qid%3D1626887607%26sr%3D8-24-spons%26psc%3D1&qualifier=1626887607&id=3377408705617182&widgetName=sp_mtf
Atulya Arts - Offering 3D Large Hexagon Acrylic Stickers (Pack of 7) with 10 Butterfly Acrylic Mirror Wall Stickers for Home & Offices(Silver)  ,Best seller,,,₹999,₹195,Save ₹804 (80%),3.6 out of 5 stars,"1,272",https://www.amazon.in/gp/bestsellers/kitchen/1380412031/ref=sr_bs_24_1380412031_1
Bikri Kendra® - Hexagon 13 Silver -3D Acrylic Decorative Mirror  ,,,,"₹1,100",₹229,Save ₹871 (79%),3.7 out of 5 stars,402,https://www.amazon.in/Bikri-Kendra-Hexagon-Walldecor-Stickers/dp/B071JFMG29/ref=sr_1_26?dchild=1&keywords=wall+mirror&qid=1626887607&sr=8-26
Bikri Kendra - 28 Hexagon/Silver - 3D Decorative Mirror Acrylic Wall Stickers  ,,,,"₹1,100",₹349,Save ₹751 (68%),3.7 out of 5 stars,193,https://www.amazon.in/Bikri-Kendra-Hexagon-Stickers-Decorative/dp/B07V9S9L3B/ref=sr_1_27?dchild=1&keywords=wall+mirror&qid=1626887607&sr=8-27
"SUNBIRD Mirror Wall Decals Acrylic Wall Stickers | Mirror Wrap Sticker Decals for Home Art Decoration Bathroom, Living Room, Bedroom (60 x 121 cm)  ",,,,"₹1,299",₹753,Save ₹546 (42%),1.0 out of 5 stars,1,https://www.amazon.in/SUNBIRD-Acrylic-Stickers-Decoration-Bathroom/dp/B098T9R99X/ref=sr_1_28?dchild=1&keywords=wall+mirror&qid=1626887607&sr=8-28
"Creative Arts n Frames 15 x 21 inch Wall Mirror for Bathroom, Bedroom, Drawing Room and Wash Basin (Mirror, 15 x 21 inch) (Oval)  ",,,,"₹2,999","₹1,099","Save ₹1,900 (63%)",4.2 out of 5 stars,585,https://www.amazon.in/Creative-Arts-Frames-Bathroom-Bedroom/dp/B08DL3W9VZ/ref=sr_1_29?dchild=1&keywords=wall+mirror&qid=1626887607&sr=8-29
"Homace Strong and Heavy Mirror Cabinet (Rich Look, White)  ",,,,"₹3,999","₹1,624","Save ₹2,375 (59%)",4.2 out of 5 stars,52,https://www.amazon.in/Homace-Strong-Heavy-Mirror-Cabinet/dp/B08L4QDLJJ/ref=sr_1_30?dchild=1&keywords=wall+mirror&qid=1626887607&sr=8-30
Zahab Bathroom Cabinets for Storage with Mirror Door Wall Mounted 10x4x14 Blue  ,,,,"₹1,999",₹920,"Save ₹1,079 (54%)",3.8 out of 5 stars,60,https://www.amazon.in/Bathroom-Cabinets-Storage-Mounted-10x4x14/dp/B08KS6Y4B9/ref=sr_1_31?dchild=1&keywords=wall+mirror&qid=1626887607&sr=8-31
"Nac Global® 30 x 45 cm Bathroom Self-Adhesive Removeable Oval Mirror Wall Sticker Home Decor,Big Oval Shaped Clear Mirror Wall Sticker Bathroom Decoration Adhesive Decor Wall Mirror Sticker  ",,,,"₹1,399",₹499,Save ₹900 (64%),1.0 out of 5 stars,1,https://www.amazon.in/Bathroom-Self-Adhesive-Removeable-Decoration-Adhesive/dp/B098P3GL8T/ref=sr_1_32?dchild=1&keywords=wall+mirror&qid=1626887607&sr=8-32
"Art Street Decorative Wall Mirror/Makeup Mirror/Looking Glass Copper Color Flat Small Size Inner Size 10 x 12 inch, Outer Size 12 x 14 inch  ",Deal of the Day ,,,"₹1,199",₹474,Save ₹725 (60%),3.6 out of 5 stars,542,https://www.amazon.in/Art-Street-Copper-Decorative-Looking/dp/B07F3WRMFB/ref=sr_1_33?dchild=1&keywords=wall+mirror&qid=1626887607&sr=8-33
"Dime Store Wall Mirror with Shelf for Living Room Bedroom Dressing Mirror for Wall Decor (Standard, Brown)  ",,,,"₹2,499","₹2,295",Save ₹204 (8%),3.8 out of 5 stars,300,https://www.amazon.in/Dime-Store-Mirror-Shelf-Living/dp/B08NPZBRG8/ref=sr_1_34?dchild=1&keywords=wall+mirror&qid=1626887607&sr=8-34
"Wall1ders - Plume Feather Silver 3D Mirror Stickers for Wall Large Size, 3D Wall Mirror Sticker, Mirror Wall Stickers for Living Room, Hall, Bed Room & Home. (Silver)  ",,,,"₹1,020",₹289,Save ₹731 (72%),3.8 out of 5 stars,916,https://www.amazon.in/Feather%C2%82-Silver-Acrylic-Mirror-Stickers-Office/dp/B07D39215W/ref=sr_1_35?dchild=1&keywords=wall+mirror&qid=1626887607&sr=8-35
Quality Glass Round Shape Frameless Decorative Mirror Mirror Glass for Wall Mirror for bathrooms Mirror in Home Mirror Decor Mirror Size : 12X 12 inch QGFL 131  ,,,,"₹1,300",₹589,Save ₹711 (55%),3.6 out of 5 stars,62,https://www.amazon.in/Quality-Glass-Frameless-Decorative-bathrooms/dp/B0927DWQMH/ref=sr_1_36?dchild=1&keywords=wall+mirror&qid=1626887607&sr=8-36
"Wall1ders - 3D Hexagon Mirror Wall Stickers, 3D Mirror Stickers for Wall Large Size, 3D Wall Mirror Stickers with 10 Butterfly Stickers - Pack of 30 (Brown, Each Hexagon Size 10.5 cm x 12.1 cm cm)  ",,,,"₹1,099",₹379,Save ₹720 (66%),4.1 out of 5 stars,373,https://www.amazon.in/Wall1ders-Hexagon-Mirror-Stickers-Butterfly/dp/B096ZFCQB6/ref=sr_1_37?dchild=1&keywords=wall+mirror&qid=1626887607&sr=8-37
"Bikri Kendra - Art BK07, Butterfly Silver - 3D Acrylic Mirror Stickers for Wall (Pack of 40)  ",,,,"₹1,100",₹299,Save ₹801 (73%),4.0 out of 5 stars,33,https://www.amazon.in/Bikri-Kendra-Butterfly-Acrylic-Stickers/dp/B08FJDQZDG/ref=sr_1_38?dchild=1&keywords=wall+mirror&qid=1626887607&sr=8-38
WallDaddy - Offering 3D Large Hexagon Acrylic Stickers (Pack of 7) with 10 Butterfly Acrylic Mirror Wall Stickers for Home & Offices(Silver)  ,,,,₹999,₹165,Save ₹834 (83%),,,https://www.amazon.in/WallDaddy-Offering-Hexagon-Stickers-Butterfly/dp/B099QHJPV2/ref=sr_1_39?dchild=1&keywords=wall+mirror&qid=1626887607&sr=8-39
"Bikri Kendra - Art BK32 , Acrylic Ganesha - 3D Acrylic Mirror Stickers for Wall (Red)  ",,,,"₹1,100",₹349,Save ₹751 (68%),4.4 out of 5 stars,8,https://www.amazon.in/Bikri-Kendra-Ganesha-Acrylic-Stickers/dp/B08FJFSQNY/ref=sr_1_40?dchild=1&keywords=wall+mirror&qid=1626887607&sr=8-40
"Hosley Decorative Round Iron Wall Mirror (20.32 cm x 30.48 cm, Black, Set of 2) for Home  ",,,,₹999,₹649,Save ₹350 (35%),4.0 out of 5 stars,17,https://www.amazon.in/Hosley-Decorative-Round-Mirror-20-32/dp/B08W1ZZXDW/ref=sr_1_41?dchild=1&keywords=wall+mirror&qid=1626887607&sr=8-41
"Wall1ders - 20 Hexagon with 10 Butterfly Golden (Each Hexagon Szie 12.1 cm x 10.5 cm) 3D Hexagon Mirror Wall Stickers, 3D Mirror Stickers for Wall Large Size, 3D Wall Mirror Stickers  ",,,,"₹1,099",₹278,Save ₹821 (75%),3.8 out of 5 stars,423,https://www.amazon.in/Wall1ders-Hexagon-Butterfly-Acrylic-Stickers/dp/B089NW7X4K/ref=sr_1_42?dchild=1&keywords=wall+mirror&qid=1626887607&sr=8-42
Smera 40 x 40 cm Beautiful Elegance Designer Plastic Frame Wall Mirror for Home (Golden Color)  ,,,,"₹1,399",₹639,Save ₹760 (54%),3.5 out of 5 stars,87,https://www.amazon.in/Smera-Beautiful-Elegance-Designer-Mirror/dp/B08B4T7VVG/ref=sr_1_43?dchild=1&keywords=wall+mirror&qid=1626887607&sr=8-43
Ciplaplast Strong and Heavy Rich Look Cabinet with Mirror - White  ,,,,"₹5,500","₹1,499","Save ₹4,001 (73%)",4.2 out of 5 stars,"2,724",https://www.amazon.in/Ciplaplast-Strong-Heavy-Cabinet-Mirror/dp/B083RD1Q23/ref=sr_1_44?dchild=1&keywords=wall+mirror&qid=1626887607&sr=8-44
Atulya Arts 3D Acrylic Mirror Hexagon Shape Wall Stickers (Gold) -(Pack of 20)  ,,,,₹999,₹269,Save ₹730 (73%),3.8 out of 5 stars,"2,268",https://www.amazon.in/Atulya-Acrylic-Mirror-Hexagon-Stickers/dp/B078LH2JR4/ref=sr_1_45?dchild=1&keywords=wall+mirror&qid=1626887607&sr=8-45
"Frameless Wall Mirror, Rectangle Bevelled Glass Mirror for Bathroom (Silver, 10 x 10 Inches)  ",,,,₹599,₹398,Save ₹201 (34%),,,https://www.amazon.in/Frameless-Mirror-Rectangle-Bevelled-Bathroom/dp/B098NVV5QW/ref=sr_1_46?dchild=1&keywords=wall+mirror&qid=1626887607&sr=8-46
Art Street Frameless Octagon Wall Mirror 16 x 24 inch  ,,,,"₹2,500","₹1,000","Save ₹1,500 (60%)",3.9 out of 5 stars,426,https://www.amazon.in/Art-Street-Frameless-Octagon-Mirror/dp/B07NXZBKLS/ref=sr_1_47?dchild=1&keywords=wall+mirror&qid=1626887607&sr=8-47
Solid Base Big Wall Hanging Mirror 65X34 cm for Living Room Decoration Bathroom Bedroom Wash Basin Shelf Oval Shape Decor (Flowery Wenge)  ,,,,"₹1,999","₹1,199",Save ₹800 (40%),4.4 out of 5 stars,7,https://www.amazon.in/Hanging-Decoration-Bathroom-Bedroom-Flowery/dp/B08YKGLLH6/ref=sr_1_48?dchild=1&keywords=wall+mirror&qid=1626887607&sr=8-48
Bikri Kendra® - Sun Silver Model 3-3D Acrylic Decorative Mirror Wall Stickers -  ,,,,"₹1,100",₹219,Save ₹881 (80%),3.7 out of 5 stars,150,https://www.amazon.in/Bikri-Kendra-Acrylic-Stickers-B07FCJWCJY/dp/B07FCJWCJY/ref=sr_1_49?dchild=1&keywords=wall+mirror&qid=1626887607&sr=8-49
"WallDaddy 3D Hexagon Mirror Wall Stickers, 3D Mirror Stickers for Wall Large Size, 3D Wall Mirror Stickers - (Pack of 20, Gold, 1.5 mm, Each Hexagon Size 10.5 cm x 12.1 cm)  ",,,,₹499,₹249,Save ₹250 (50%),,,https://www.amazon.in/WallDaddy-Hexagon-Mirror-Stickers-Large/dp/B098TLM3NV/ref=sr_1_50?dchild=1&keywords=wall+mirror&qid=1626887607&sr=8-50
CasaGold Black Round Wall Mirror - 18 Inch in Metal Frame for Wall Decor / Wash Basin / Bedroom  ,,,,"₹5,000","₹1,999","Save ₹3,001 (60%)",4.6 out of 5 stars,5,https://www.amazon.in/CasaGold-Black-Round-Wall-Mirror/dp/B0924H8C98/ref=sr_1_51?dchild=1&keywords=wall+mirror&qid=1626887607&sr=8-51
"Art Street Wall Mirror for Bathroom/Vanity, Marble Finish Decorative Mirror for Living Room - 14.5 x 20.5 Inchs, Color -Beige  ",Limited time deal,,,"₹1,200",₹759,Save ₹441 (37%),3.7 out of 5 stars,25,https://www.amazon.in/Art-Street-Mirror-Bathroom-Decorative/dp/B08J8D3KMZ/ref=sr_1_52?dchild=1&keywords=wall+mirror&qid=1626887607&sr=8-52
Quality Glass Square Shape Frameless Decorative Mirror Mirror Glass for Wall Mirror for bathrooms Mirror in Home Mirror Decor Mirror Size : 12 X 12 inch QGFL 126  ,,,,"₹1,000",₹589,Save ₹411 (41%),3.1 out of 5 stars,26,https://www.amazon.in/Quality-Glass-Frameless-Decorative-bathrooms/dp/B09139VHV9/ref=sr_1_53?dchild=1&keywords=wall+mirror&qid=1626887607&sr=8-53
Bikri Kendra - Sun 4 Colors Combo - 3D Mirror Decorative Acrylic Wall Stickers  ,,,,"₹1,100",₹399,Save ₹701 (64%),4.1 out of 5 stars,98,https://www.amazon.in/Bikri-Kendra-Colors-Acrylic-Stickers/dp/B07WCFWDL8/ref=sr_1_54?dchild=1&keywords=wall+mirror&qid=1626887607&sr=8-54
Quality Glass Square Shape Frameless Decorative Mirror Mirror Glass for Wall Mirror for bathrooms Mirror in Home Mirror Decor Mirror Size : 12X 12 inch QGFL 130  ,,,,"₹1,000",₹589,Save ₹411 (41%),3.3 out of 5 stars,23,https://www.amazon.in/Quality-Glass-Frameless-Decorative-bathrooms/dp/B0913BQ7SC/ref=sr_1_55?dchild=1&keywords=wall+mirror&qid=1626887607&sr=8-55
"Home and Bazaar Traditional Elegant & Ethnic Designer Unique Wooden Peacock Wall Mirror Frame 12x1x16 Inch, Mirror Size 6"" Dia  ",,,,"₹1,999",₹799,"Save ₹1,200 (60%)",4.2 out of 5 stars,28,https://www.amazon.in/Home-Bazaar-Traditional-Elegant-Designer/dp/B07QX814RQ/ref=sr_1_56?dchild=1&keywords=wall+mirror&qid=1626887607&sr=8-56
AG Crafts Frame Sober Wood Wall Mirror- ||- Size - 18 X 12 Inch -||- Solid Water Resistant Synthetic Wood Medin in India -|| (Pale White)  ,,Sponsored,,"₹1,499",₹599,Save ₹900 (60%),3.2 out of 5 stars,72,https://www.amazon.in/gp/slredirect/picassoRedirect.html/ref=pa_sp_btf_aps_sr_pg1_1?ie=UTF8&adId=A09350011NTTYC036WDLU&url=%2FAG-Crafts-Frame-Sober-Mirror%2Fdp%2FB08FH72T32%2Fref%3Dsr_1_57_sspa%3Fdchild%3D1%26keywords%3Dwall%2Bmirror%26qid%3D1626887607%26sr%3D8-57-spons%26psc%3D1&qualifier=1626887607&id=3377408705617182&widgetName=sp_btf
"AG Crafts™ 004(2"")-Brown Bathroom Mirror (Rectangle) (Brown)  ",,Sponsored,,"₹1,999",₹599,"Save ₹1,400 (70%)",3.8 out of 5 stars,14,https://www.amazon.in/gp/slredirect/picassoRedirect.html/ref=pa_sp_btf_aps_sr_pg1_1?ie=UTF8&adId=A09350573HL881WJYD7NI&url=%2FAG-CraftsTM-Brown-Bathroom-Rectangle%2Fdp%2FB08LZ7PC7R%2Fref%3Dsr_1_58_sspa%3Fdchild%3D1%26keywords%3Dwall%2Bmirror%26qid%3D1626887607%26sr%3D8-58-spons%26psc%3D1&qualifier=1626887607&id=3377408705617182&widgetName=sp_btf
Anikaa Mason Engineered Wood Dressing Wall Mirrors/Wall Hanging Dressing Mirrors/Decorative Wall Mirror/Dressing Table for Bedroom/Wall Mounted Dressing Mirror for Living Room/Wall Mirror with 2 Shelves(Wenge)  ,,Sponsored,,"₹2,599","₹1,699",Save ₹900 (35%),3.7 out of 5 stars,21,https://www.amazon.in/gp/slredirect/picassoRedirect.html/ref=pa_sp_btf_aps_sr_pg1_1?ie=UTF8&adId=A10233153U1HRD4R94ENN&url=%2FAnikaa-Dressing-Mirrors-Hanging-Decorative%2Fdp%2FB08L7PFCTV%2Fref%3Dsr_1_59_sspa%3Fdchild%3D1%26keywords%3Dwall%2Bmirror%26qid%3D1626887607%26sr%3D8-59-spons%26psc%3D1&qualifier=1626887607&id=3377408705617182&widgetName=sp_btf
AG Crafts™ Black Flat Decorative Wall Mirror/Looking Glass Inner Size 18 x 12 inch - 0022 (Black)  ,,Sponsored,,"₹1,499",₹599,Save ₹900 (60%),3.5 out of 5 stars,41,https://www.amazon.in/gp/slredirect/picassoRedirect.html/ref=pa_sp_btf_aps_sr_pg1_1?ie=UTF8&adId=A09346574K5RH0T2T10G&url=%2FAG-CraftsTM-Decorative-Mirror-Looking%2Fdp%2FB08HJK694Y%2Fref%3Dsr_1_60_sspa%3Fdchild%3D1%26keywords%3Dwall%2Bmirror%26qid%3D1626887607%26sr%3D8-60-spons%26psc%3D1&qualifier=1626887607&id=3377408705617182&widgetName=sp_btf
"Timberly Wooden Wall Decorative Vintage Sunburst Mirror for Living Room (16 x 16 Inch, Color RED) - Set of 1  ",,Sponsored,,"₹2,449","₹1,250","Save ₹1,199 (49%)",3.8 out of 5 stars,27,https://www.amazon.in/gp/slredirect/picassoRedirect.html/ref=pa_sp_atf_next_aps_sr_pg2_1?ie=UTF8&adId=A0506876283V2FMOX7O63&url=%2FTimberly-Wooden-Decorative-Vintage-Sunburst%2Fdp%2FB08RMXJ4FB%2Fref%3Dsr_1_49_sspa%3Fdchild%3D1%26keywords%3Dwall%2Bmirror%26qid%3D1626887625%26sr%3D8-49-spons%26psc%3D1&qualifier=1626887625&id=4219538583490946&widgetName=sp_atf_next
"NAVRANG INNOVATIONS NEO Mini Mirror/bathroom Cabinet with shelves, white (12.5 X 17inches)  ",,Sponsored,,"₹2,250","₹1,499",Save ₹751 (33%),4.4 out of 5 stars,120,https://www.amazon.in/gp/slredirect/picassoRedirect.html/ref=pa_sp_atf_next_aps_sr_pg2_1?ie=UTF8&adId=A08022163ME7EZJJR3NQE&url=%2FNAVRANG-INNOVATIONS-Mini-Mirror-Cabinet%2Fdp%2FB081QJLN3B%2Fref%3Dsr_1_50_sspa%3Fdchild%3D1%26keywords%3Dwall%2Bmirror%26qid%3D1626887625%26sr%3D8-50-spons%26psc%3D1&qualifier=1626887625&id=4219538583490946&widgetName=sp_atf_next
"Quality Glass Frameless Decorative Mirror Glass for Wall Mirror Bathrooms Home Decor (Silver, Size : 18 X 24 Inch)  ",,Sponsored,,"₹2,500","₹1,400","Save ₹1,100 (44%)",3.4 out of 5 stars,9,https://www.amazon.in/gp/slredirect/picassoRedirect.html/ref=pa_sp_atf_next_aps_sr_pg2_1?ie=UTF8&adId=A075664610QNFK9WDCX5E&url=%2FQuality-Glass-Frameless-Decorative-Bathrooms%2Fdp%2FB08JVH1XNH%2Fref%3Dsr_1_51_sspa%3Fdchild%3D1%26keywords%3Dwall%2Bmirror%26qid%3D1626887625%26sr%3D8-51-spons%26psc%3D1&qualifier=1626887625&id=4219538583490946&widgetName=sp_atf_next
ExclusiveLane 'Oasis Reflection' Hand Carved Wall Mounted Mirror for Living Room & Dressing (Mango Wood) - Decorative Looking Mirror for Wall Mirror for Bedroom Wash Basin Bathroom Wall Makeup Mirror  ,,Sponsored,Only 2 left in stock.,"₹1,999","₹1,599",Save ₹400 (20%),,,https://www.amazon.in/gp/slredirect/picassoRedirect.html/ref=pa_sp_atf_next_aps_sr_pg2_1?ie=UTF8&adId=A0587351UV3J5X10FGQ9&url=%2FExclusiveLane-Reflection-Carved-Mounted-Dressing%2Fdp%2FB084TN7QL3%2Fref%3Dsr_1_52_sspa%3Fdchild%3D1%26keywords%3Dwall%2Bmirror%26qid%3D1626887625%26sr%3D8-52-spons%26psc%3D1&qualifier=1626887625&id=4219538583490946&widgetName=sp_atf_next
"Command Designer 2 hooks and 4 strips, Self Adhesive Plastic Hooks for wall, Medium , White, Holds Upto 1.3kg  ",Best seller,,,₹175,₹140,Save ₹35 (20%),4.0 out of 5 stars,"12,122",https://www.amazon.in/gp/bestsellers/home-improvement/4286654031/ref=sr_bs_4_4286654031_1
Seven Horses Small Frameless Rectangle Wall Mirror  ,,,,"₹1,500",₹444,"Save ₹1,056 (70%)",3.1 out of 5 stars,11,https://www.amazon.in/Seven-Horses-Frameless-Rectangle-Mirror/dp/B08YWHZSW1/ref=sr_1_54?dchild=1&keywords=wall+mirror&qid=1626887625&sr=8-54
"SEVEN HORSES Glass Oval Bevelled Mirror (White, 18x 24 Inch)  ",,,,"₹1,998","₹1,388",Save ₹610 (31%),4.2 out of 5 stars,600,https://www.amazon.in/Seven-Horses-Frameless-Bevelled-Mirror/dp/B07GCJQDD6/ref=sr_1_55?dchild=1&keywords=wall+mirror&qid=1626887625&sr=8-55
"Wall1ders - 3D Hexagon Mirror Wall Stickers, 3D Mirror Stickers for Wall Large Size, 3D Wall Mirror Stickers with 10 Butterfly Stickers - Pack of 28 (Brown, Each Hexagon Size 10.5 cm x 12.1 cm)  ",Best seller,,,"₹1,099",₹398,Save ₹701 (64%),4.0 out of 5 stars,"2,982",https://www.amazon.in/gp/bestsellers/kitchen/5554172031/ref=sr_bs_7_5554172031_1
Bikri Kendra - Art RTNS8 - Sun Silver with Golden Butterfly 3D Acrylic Mirror Wall Sticker  ,,,,"₹1,100",₹219,Save ₹881 (80%),4.1 out of 5 stars,327,https://www.amazon.in/Bikri-Kendra-Butterfly-Stickers-Decorative/dp/B07V65XSH8/ref=sr_1_57?dchild=1&keywords=wall+mirror&qid=1626887625&sr=8-57
