name,badge_1,badge_2,badge_3,mrp,discounted_price,discount,rating,rating_count,link
Furnish Craft Beautiful Modern Designed Sunflower Iron Decorative Wall Mirror for Living Room (24 Inches / 61 CMs)  ,,Sponsored,,"₹4,999","₹1,872","Save ₹3,127 (63%)",4.3 out of 5 stars,291,https://www.amazon.in/gp/slredirect/picassoRedirect.html/ref=pa_sp_atf_aps_sr_pg1_1?ie=UTF8&adId=A0156793N5U5F8APVZDH&url=%2FFurnish-Craft-Sunflower-Decorative-21-inch%2Fdp%2FB0893G2JLZ%2Fref%3Dsr_1_1_sspa%3Fdchild%3D1%26keywords%3Dwall%2Bmirror%26qid%3D1625201196%26sr%3D8-1-spons%26psc%3D1%26smid%3DA3582W5ILF3Y6W&qualifier=1625201196&id=2323158827117032&widgetName=sp_atf
CasaGold 18” Wall Round Black Mirror for Washroom / Wall Decor / Make Up Vanity/ Entryway Mirror |Black-(18inch)  ,Limited time deal,Sponsored,,"₹5,000","₹1,804","Save ₹3,196 (64%)",4.5 out of 5 stars,2,https://www.amazon.in/gp/slredirect/picassoRedirect.html/ref=pa_sp_atf_aps_sr_pg1_1?ie=UTF8&adId=A04476641RNVMOUPZ45J5&url=%2FCasaGold-Mirror-Washroom-Vanity-Entryway%2Fdp%2FB0924H8C98%2Fref%3Dsr_1_2_sspa%3Fdchild%3D1%26keywords%3Dwall%2Bmirror%26qid%3D1625201196%26smid%3DA1VOTY6L97BPGK%26sr%3D8-2-spons%26psc%3D1&qualifier=1625201196&id=2323158827117032&widgetName=sp_atf
CasaGold: Beautiful Round Wall-Mounted / Hanging Mirror with Adjustable Leather Strap / Matching Wall Hook & Fitting Assembly(20*20 Inch)  ,Limited time deal,Sponsored,,"₹9,999","₹3,799","Save ₹6,200 (62%)",4.2 out of 5 stars,18,https://www.amazon.in/gp/slredirect/picassoRedirect.html/ref=pa_sp_atf_aps_sr_pg1_1?ie=UTF8&adId=A03333941UHG7LYZ1UUT7&url=%2FCasaGold-Beautiful-Wall-Mounted-Adjustable-Matching%2Fdp%2FB08SLZ9ZCF%2Fref%3Dsr_1_3_sspa%3Fdchild%3D1%26keywords%3Dwall%2Bmirror%26qid%3D1625201196%26smid%3DA1VOTY6L97BPGK%26sr%3D8-3-spons%26psc%3D1&qualifier=1625201196&id=2323158827117032&widgetName=sp_atf
Papdiwal Industries Glass Mirrornow's Imported Touch Sensor LED Bathroom Mirror (27 x 18 Inch)  ,,Sponsored,,,,,,,https://www.amazon.in/gp/slredirect/picassoRedirect.html/ref=pa_sp_atf_aps_sr_pg1_1?ie=UTF8&adId=A0646575262RRA2KE7CW&url=%2FPapdiwal-Industries-Mirrornows-Sensor-Bathroom%2Fdp%2FB08C9M49Y9%2Fref%3Dsr_1_4_sspa%3Fdchild%3D1%26keywords%3Dwall%2Bmirror%26qid%3D1625201196%26sr%3D8-4-spons%26psc%3D1&qualifier=1625201196&id=2323158827117032&widgetName=sp_atf
"Wall1ders - Hexagon 3D Acrylic Stickers, 3D Acrylic Wall Stickers for Living Room, Hall, Bed Room & Home with 10 Butterfly Stickers - Pack of 28 (Silver)  ",Best seller,,,"₹1,099",₹370,Save ₹729 (66%),3.9 out of 5 stars,"2,708",https://www.amazon.in/gp/bestsellers/kitchen/5554172031/ref=sr_bs_4_5554172031_1
"Steven Quartz Beautiful Elegance Designer Frame Wall Mirror (Size 40cm x 40cm) (16 Inch, Golden)  ",,,,"₹1,980",₹590,"Save ₹1,390 (70%)",3.6 out of 5 stars,26,https://www.amazon.in/Steven-Quartz-Beautiful-Elegance-Designer/dp/B08QH853V7/ref=sr_1_6?dchild=1&keywords=wall+mirror&qid=1625201196&sr=8-6
Quality Glass Verticle Shape Frameless Decorative Mirror Mirror Glass for Wall Mirror for bathrooms Mirror in Home Mirror décor Mirror Size : 12 X 18 inch QGFL 132  ,,,,"₹2,449",₹799,"Save ₹1,650 (67%)",3.6 out of 5 stars,17,https://www.amazon.in/Quality-Glass-Frameless-Decorative-bathrooms/dp/B0928GB9KR/ref=sr_1_7?dchild=1&keywords=wall+mirror&qid=1625201196&sr=8-7
SEVEN HORSES Floral Design Glass Wall Mirror for Makeup Bathroom Dressing (14.5X26.5 Inch)  ,,,,"₹1,998","₹1,099",Save ₹899 (45%),4.3 out of 5 stars,247,https://www.amazon.in/SEVEN-HORSES-Bathroom-Dressing-14-5X26-5/dp/B08KHHJC98/ref=sr_1_8?dchild=1&keywords=wall+mirror&qid=1625201196&sr=8-8
"Seven Horses Frame Brown Sunmica Finish Fiber Wood Wall Mirror, Dressing Mirror Solid Premium Brown Water Resistant Synthetic Fiber Wood Made (14.5X26.5 Inch)  ",,,,"₹1,998","₹1,099",Save ₹899 (45%),4.1 out of 5 stars,299,https://www.amazon.in/Sunmica-Dressing-Premium-Resistant-Synthetic/dp/B0795WCNQS/ref=sr_1_9?dchild=1&keywords=wall+mirror&qid=1625201196&sr=8-9
Ciplaplast Strong and Heavy Rich Look Cabinet with Mirror - White  ,,,,"₹5,999","₹1,644","Save ₹4,355 (73%)",4.2 out of 5 stars,"2,538",https://www.amazon.in/Ciplaplast-Strong-Heavy-Cabinet-Mirror/dp/B083RD1Q23/ref=sr_1_10?dchild=1&keywords=wall+mirror&qid=1625201196&sr=8-10
"Wall1ders - 31 Hexagon & 10 Butterflies Silver (Size 10.5 x 12 cm) 3D Hexagon Wall Stickers, 3D Stickers for Wall Large Size, 3D Wall Stickers, Acrylic Sticker  ",Amazon's Choice,,,"₹1,099",₹390,Save ₹709 (65%),4.1 out of 5 stars,697,https://www.amazon.in/Wall1ders-Hexagon-Silver-Acrylic-Mirror-Stickers/dp/B07PM85JYY/ref=ice_ac_b_dpb?dchild=1&keywords=wall+mirror&qid=1625201196&sr=8-11
"Art Street Decorative Wall Mirror/Makeup Mirror/Looking Glass Copper Color Flat Small Size Inner Size 10 x 12 inch, Outer Size 12 x 14 inch  ",Deal of the Day ,,,"₹1,500",₹474,"Save ₹1,026 (68%)",3.6 out of 5 stars,511,https://www.amazon.in/Art-Street-Copper-Decorative-Looking/dp/B07F3WRMFB/ref=sr_1_12?dchild=1&keywords=wall+mirror&qid=1625201196&sr=8-12
Zahab Bathroom Cabinets for Storage with Mirror Door Wall Mounted 10x4x14 Blue  ,,,,"₹1,999",₹920,"Save ₹1,079 (54%)",3.6 out of 5 stars,51,https://www.amazon.in/Bathroom-Cabinets-Storage-Mounted-10x4x14/dp/B08KS6Y4B9/ref=sr_1_13?dchild=1&keywords=wall+mirror&qid=1625201196&sr=8-13
"Art India Collections Decorative Hexagonal Hanging Wall Mirror, Large Vintage Mirror for Wall-9.5x11 Inch Gold Metallic Frame Mirror Material Wall Mirrors  ",,,,"₹1,249",₹729,Save ₹520 (42%),3.6 out of 5 stars,13,https://www.amazon.in/Art-India-Collections-Decorative-Wall-9-5x11/dp/B0925JJ79P/ref=sr_1_14?dchild=1&keywords=wall+mirror&qid=1625201196&sr=8-14
Reflectionz Frameless Rectangle Decorative Mirror | Mirror Glass for Wall | Mirror for Bathrooms | Mirror in Home | Mirror Decor | Mirror Size : (12 X 12 Inch)  ,,,,₹499,₹490,Save ₹9 (2%),4.1 out of 5 stars,280,https://www.amazon.in/Reflectionz-Frameless-Rectangle-Decorative-Bathrooms/dp/B08T7J14PZ/ref=sr_1_15?dchild=1&keywords=wall+mirror&qid=1625201196&sr=8-15
"Dime Store Wall Mirror with Shelf for Living Room Bedroom Dressing Mirror for Wall Decor (Standard, Brown)  ",,,,"₹2,499","₹2,295",Save ₹204 (8%),3.9 out of 5 stars,252,https://www.amazon.in/Dime-Store-Mirror-Shelf-Living/dp/B08NPZBRG8/ref=sr_1_16?dchild=1&keywords=wall+mirror&qid=1625201196&sr=8-16
"Creative Arts n Frames 15 x 21 inch Wall Mirror for Bathroom, Bedroom, Drawing Room and Wash Basin (Mirror, 15 x 21 inch) (Oval)  ",,,,"₹2,999","₹1,099","Save ₹1,900 (63%)",4.2 out of 5 stars,511,https://www.amazon.in/Creative-Arts-Frames-Bathroom-Bedroom/dp/B08DL3W9VZ/ref=sr_1_17?dchild=1&keywords=wall+mirror&qid=1625201196&sr=8-17
"Round Wall Mirror for Home Decoration,Set of 3 Decorative Wall hangnig Mirror, Wall Mirror for Living Room (10 x 10 Inchs) by Art Street  ",,,,"₹1,500",₹799,Save ₹701 (47%),4.2 out of 5 stars,72,https://www.amazon.in/Art-Street-Decorative-Mirror-Living/dp/B07VC9DC8L/ref=sr_1_18?dchild=1&keywords=wall+mirror&qid=1625201196&sr=8-18
Bikri Kendra Hexagon 20 Golden Acrylic Mirror Wall Stickers  ,,,,,₹299,,3.6 out of 5 stars,"1,639",https://www.amazon.in/Bikri-Kendra-Hexagon-Golden-Mirror/dp/B072Q4Y2Q8/ref=sr_1_19?dchild=1&keywords=wall+mirror&qid=1625201196&sr=8-19
Quality Glass Square Shape Frameless Decorative Mirror Mirror Glass for Wall Mirror for bathrooms Mirror in Home Mirror Decor Mirror Size : 12 X 12 inch QGFL 126  ,,,,"₹1,000",₹489,Save ₹511 (51%),3.3 out of 5 stars,19,https://www.amazon.in/Quality-Glass-Frameless-Decorative-bathrooms/dp/B09139VHV9/ref=sr_1_20?dchild=1&keywords=wall+mirror&qid=1625201196&sr=8-20
Quality Mirrors Border Wood Frame Large Round Vanity Wall Art Frame Less Hanging Mirrors for Entryways Washroom Living Room Bedroom Bathroom | Room Decor Mirror| Fancy Mirror  ,,Sponsored,,"₹6,899","₹4,999","Save ₹1,900 (28%)",,,https://www.amazon.in/gp/slredirect/picassoRedirect.html/ref=pa_sp_mtf_aps_sr_pg1_1?ie=UTF8&adId=A0256962Z3UZUY0ASHO8&url=%2FQuality-Mirrors-Entryways-Washroom-Bathroom%2Fdp%2FB09769QGSP%2Fref%3Dsr_1_21_sspa%3Fdchild%3D1%26keywords%3Dwall%2Bmirror%26qid%3D1625201196%26sr%3D8-21-spons%26psc%3D1&qualifier=1625201196&id=2323158827117032&widgetName=sp_mtf
BLUEWUD Akira Wall Mounted Dressing Mirror (Walnut)  ,Deal of the Day ,Sponsored,,"₹5,749","₹4,199","Save ₹1,550 (27%)",4.4 out of 5 stars,78,https://www.amazon.in/gp/slredirect/picassoRedirect.html/ref=pa_sp_mtf_aps_sr_pg1_1?ie=UTF8&adId=A015396937JW7HX4LLGYT&url=%2FBluewud-M-AK-BL-Dressing-Mirror-Walnut%2Fdp%2FB06WLNKN2W%2Fref%3Dsr_1_22_sspa%3Fdchild%3D1%26keywords%3Dwall%2Bmirror%26qid%3D1625201196%26sr%3D8-22-spons%26psc%3D1&qualifier=1625201196&id=2323158827117032&widgetName=sp_mtf
GIG Handicrafts Decorative Iron Wall Mounted Hanging Mirror Sculpture Metal Glass Leaf Design Modern Art Gifts Home Decor (64 cm x 3 cm x 64 cm)  ,,Sponsored,,"₹2,499","₹1,799",Save ₹700 (28%),4.1 out of 5 stars,34,https://www.amazon.in/gp/slredirect/picassoRedirect.html/ref=pa_sp_mtf_aps_sr_pg1_1?ie=UTF8&adId=A0716620RADKOOG7F7IJ&url=%2FGIG-Decorative-Mounted-Hanging-Sculpture%2Fdp%2FB07PFVR3VL%2Fref%3Dsr_1_23_sspa%3Fdchild%3D1%26keywords%3Dwall%2Bmirror%26qid%3D1625201196%26sr%3D8-23-spons%26psc%3D1&qualifier=1625201196&id=2323158827117032&widgetName=sp_mtf
Quality Mirrors| Round Wooden Wall Mirrors |Decorative Big Large Living Room | Royal Mirror |Modern Mirror | 24*24 inches | Round Decorative Mirror  ,,Sponsored,Only 1 left in stock.,"₹2,999","₹2,499",Save ₹500 (17%),4.0 out of 5 stars,1,https://www.amazon.in/gp/slredirect/picassoRedirect.html/ref=pa_sp_mtf_aps_sr_pg1_1?ie=UTF8&adId=A025647033T6HUZDKI0D6&url=%2FQuality-Mirrors-Wooden-Decorative-Living%2Fdp%2FB095HTGC3G%2Fref%3Dsr_1_24_sspa%3Fdchild%3D1%26keywords%3Dwall%2Bmirror%26qid%3D1625201196%26sr%3D8-24-spons%26psc%3D1&qualifier=1625201196&id=2323158827117032&widgetName=sp_mtf
"SATYAM KRAFT 1 Piece Plastic Wall Mirror (9 Inch × 9 Inch, Gold)  ",,,,,₹339,,3.7 out of 5 stars,335,https://www.amazon.in/SATYAM-KRAFT-Fibre-Wall-Mirror/dp/B084VPP133/ref=sr_1_25?dchild=1&keywords=wall+mirror&qid=1625201196&sr=8-25
"Art Street Frameless Wall Mirrors for Bathroom, Bevelled Frameless Wall Mirror (16 x 24 Inches, Silver)  ",Limited time deal,,,"₹2,500","₹1,139","Save ₹1,361 (54%)",3.9 out of 5 stars,384,https://www.amazon.in/Art-Street-Bathroom-Frameless-Horizontal/dp/B07NYZYY46/ref=sr_1_26?dchild=1&keywords=wall+mirror&qid=1625201196&sr=8-26
"Wall1ders - 28 Hexagon & 10 Butterflies Blue (Each Hexagon Size 10.5 cm x 12.1 cm) 3D Hexagon Mirror Wall Stickers, 3D Mirror Stickers for Wall Large Size, 3D Wall Mirror Stickers  ",Best seller,,,"₹1,099",₹370,Save ₹729 (66%),3.9 out of 5 stars,"2,708",https://www.amazon.in/gp/bestsellers/kitchen/5554172031/ref=sr_bs_26_5554172031_1
Atulya Arts 3D Hexagon Acrylic Decorative Wall-Stickers with 10 Butterfly Stickers (Silver) - Pack of 28  ,,,,₹999,₹360,Save ₹639 (64%),3.9 out of 5 stars,"2,102",https://www.amazon.in/Hexagon-Decorative-Wall-Stickers-Butterfly-Stickers/dp/B07BNHWDL4/ref=sr_1_28?dchild=1&keywords=wall+mirror&qid=1625201196&sr=8-28
Bikri Kendra® - Hexagon 13 Silver -3D Acrylic Decorative Mirror  ,,,,,₹249,,3.7 out of 5 stars,382,https://www.amazon.in/Bikri-Kendra-Hexagon-Walldecor-Stickers/dp/B071JFMG29/ref=sr_1_29?dchild=1&keywords=wall+mirror&qid=1625201196&sr=8-29
AG Crafts™ Black Flat Decorative Wall Mirror/Looking Glass Inner Size 18 x 12 inch - 0022 (Black)  ,,,,"₹1,499",₹599,Save ₹900 (60%),3.3 out of 5 stars,39,https://www.amazon.in/AG-CraftsTM-Decorative-Mirror-Looking/dp/B08HJK694Y/ref=sr_1_30?dchild=1&keywords=wall+mirror&qid=1625201196&sr=8-30
"Atulya Arts Mirror Hexagon Decorative Wall Sticker (Pack of 7) with 10 Butterfly Sticker 3D Acrylic Stickers Mirror Wall Stickers for Living Room Bedroom Home & Office (Silver, 10.5 cm x 12.1 cm) ..  ",,,,₹999,₹199,Save ₹800 (80%),3.4 out of 5 stars,49,https://www.amazon.in/Atulya-Arts-Decorative-Butterfly-Stickers/dp/B092TL4B34/ref=sr_1_31?dchild=1&keywords=wall+mirror&qid=1625201196&sr=8-31
Quality Glass Round Shape Frameless Decorative Mirror Mirror Glass for Wall Mirror for bathrooms Mirror in Home Mirror Decor Mirror Size : 12X 12 inch QGFL 131  ,,,,"₹1,300",₹489,Save ₹811 (62%),3.5 out of 5 stars,41,https://www.amazon.in/Quality-Glass-Frameless-Decorative-bathrooms/dp/B0927DWQMH/ref=sr_1_32?dchild=1&keywords=wall+mirror&qid=1625201196&sr=8-32
Smera 40 x 40 cm Beautiful Elegance Designer Plastic Frame Wall Mirror for Home (Golden Color)  ,,,,"₹1,980",₹590,"Save ₹1,390 (70%)",3.6 out of 5 stars,79,https://www.amazon.in/Smera-Beautiful-Elegance-Designer-Mirror/dp/B08B4T7VVG/ref=sr_1_33?dchild=1&keywords=wall+mirror&qid=1625201196&sr=8-33
Bikri Kendra - 28 Hexagon/Silver - 3D Decorative Mirror Acrylic Wall Stickers  ,,,,"₹1,100",₹349,Save ₹751 (68%),3.7 out of 5 stars,173,https://www.amazon.in/Bikri-Kendra-Hexagon-Stickers-Decorative/dp/B07V9S9L3B/ref=sr_1_34?dchild=1&keywords=wall+mirror&qid=1625201196&sr=8-34
"SDG Frameless Oval Mirror (18x24inch, Silver)  ",,,,"₹1,999","₹1,249",Save ₹750 (38%),4.3 out of 5 stars,461,https://www.amazon.in/SDG-Frameless-Mirror-Bathrooms-Decor/dp/B07CK3R2C6/ref=sr_1_35?dchild=1&keywords=wall+mirror&qid=1625201196&sr=8-35
Atulya Arts offering 3D Large Hexagon Acrylic Stickers (Pack of 7) with 10 Butterfly Acrylic Mirror Wall Stickers for Home & Offices(Silver)  ,,,,₹999,₹199,Save ₹800 (80%),4.0 out of 5 stars,5,https://www.amazon.in/Atulya-Arts-offering-Stickers-Butterfly/dp/B092R2DVNH/ref=sr_1_36?dchild=1&keywords=wall+mirror&qid=1625201196&sr=8-36
Bikri Kendra® - Sun Silver Model 3-3D Acrylic Decorative Mirror Wall Stickers -  ,,,,,₹224,,3.7 out of 5 stars,137,https://www.amazon.in/Bikri-Kendra-Acrylic-Stickers-B07FCJWCJY/dp/B07FCJWCJY/ref=sr_1_37?dchild=1&keywords=wall+mirror&qid=1625201196&sr=8-37
"VSA OLLIVANDERS 7 Hexagon 3D Acrylic Stickers for Wall, 3D Mirror Wall Stickers, 3D Mirror Stickers Wall Decor Items for Home and Office.  ",,,,₹999,₹155,Save ₹844 (84%),3.9 out of 5 stars,6,https://www.amazon.in/VSA-OLLIVANDERS-Hexagon-Acrylic-Stickers/dp/B093DFFGYF/ref=sr_1_38?dchild=1&keywords=wall+mirror&qid=1625201196&sr=8-38
Art Street Sun Streek Decorative Wall Mirror (Set of 3)(Size - 9 x 9 inch)  ,,,,"₹2,000",₹799,"Save ₹1,201 (60%)",4.2 out of 5 stars,188,https://www.amazon.in/Painting-Mantra-Street-Decorative-Mirror/dp/B079556R74/ref=sr_1_39?dchild=1&keywords=wall+mirror&qid=1625201196&sr=8-39
Quality Glass Square Shape Frameless Decorative Mirror Mirror Glass for Wall Mirror for bathrooms Mirror in Home Mirror Decor Mirror Size : 12X 12 inch QGFL 130  ,,,,"₹1,000",₹489,Save ₹511 (51%),3.3 out of 5 stars,17,https://www.amazon.in/Quality-Glass-Frameless-Decorative-bathrooms/dp/B0913BQ7SC/ref=sr_1_40?dchild=1&keywords=wall+mirror&qid=1625201196&sr=8-40
"SEVEN HORSES Glass Black Wall Mirror , Size 14.5X26.5 Inch  ",,,,"₹1,998","₹1,049",Save ₹949 (47%),5.0 out of 5 stars,1,https://www.amazon.in/SEVEN-HORSES-Glass-Mirror-14-5X26-5/dp/B08KHH5T67/ref=sr_1_41?dchild=1&keywords=wall+mirror&qid=1625201196&sr=8-41
Atulya Arts 3D Acrylic Mirror Hexagon Shape Wall Stickers (Gold) -(Pack of 20)  ,,,,₹999,₹269,Save ₹730 (73%),3.8 out of 5 stars,"2,108",https://www.amazon.in/Atulya-Acrylic-Mirror-Hexagon-Stickers/dp/B078LH2JR4/ref=sr_1_42?dchild=1&keywords=wall+mirror&qid=1625201196&sr=8-42
Twinkling Parrots Silver Mirror Acrylic | Circle | 3mm | 7 Inch x 7 Inch | Pack of 2 | Plexiglass |  ,Best seller,,Only 1 left in stock.,₹430,₹347,Save ₹83 (19%),3.9 out of 5 stars,194,https://www.amazon.in/gp/bestsellers/kitchen/3591654031/ref=sr_bs_42_3591654031_1
"Bikri Kendra - Art BK32, Ganesha Red - 3D Acrylic Mirror Stickers for Wall  ",,,,,₹359,,4.3 out of 5 stars,7,https://www.amazon.in/Bikri-Kendra-Ganesha-Acrylic-Stickers/dp/B08FJFSQNY/ref=sr_1_44?dchild=1&keywords=wall+mirror&qid=1625201196&sr=8-44
"Wall1ders 1Store - Big Square 30 Silver 4 inch (Each Piece Size 10 cm) 3D Acrylic Stickers, 3D Acrylic Mirror Wall Stickers, 3D Mirror Stickers for Wall, 3D Wall Mirror Stickers for Home & Offices.  ",,,,₹999,₹479,Save ₹520 (52%),,,https://www.amazon.in/Wall1ders-1Store-Acrylic-Stickers-Offices/dp/B096MN21S9/ref=sr_1_45?dchild=1&keywords=wall+mirror&qid=1625201196&sr=8-45
SEVEN HORSES Round Wall Mirror (12 Inch)  ,,,,"₹1,998",₹599,"Save ₹1,399 (70%)",4.0 out of 5 stars,42,https://www.amazon.in/SEVEN-HORSES-Round-Wall-Mirror/dp/B08B4MK38W/ref=sr_1_46?dchild=1&keywords=wall+mirror&qid=1625201196&sr=8-46
"Art Street Decorative Wall Mirror Black Flat Small Size/Looking Glass Inner Size 10 x 12 inch, Outer Size 12 x 14 inch  ",,,,"₹1,500",₹500,"Save ₹1,000 (67%)",3.7 out of 5 stars,311,https://www.amazon.in/Art-Street-Decorative-Mirror-Looking/dp/B07DWWT61F/ref=sr_1_47?dchild=1&keywords=wall+mirror&qid=1625201196&sr=8-47
"Bikri Kendra - Art BK07, Butterfly Silver - 3D Acrylic Mirror Stickers for Wall (Pack of 40)  ",,,,,₹269,,4.1 out of 5 stars,29,https://www.amazon.in/Bikri-Kendra-Butterfly-Acrylic-Stickers/dp/B08FJDQZDG/ref=sr_1_48?dchild=1&keywords=wall+mirror&qid=1625201196&sr=8-48
"Wall1ders - 3D Hexagon Mirror Wall Stickers, 3D Mirror Stickers for Wall Large Size, 3D Wall Mirror Stickers - (Pack of 28, Silver, 1.5 mm, Premium Qualty, Each Hexagon Size 10.5 cm x 12.1 cm)  ",Best seller,,,"₹1,099",₹599,Save ₹500 (45%),3.9 out of 5 stars,"2,708",https://www.amazon.in/gp/bestsellers/kitchen/5554172031/ref=sr_bs_48_5554172031_1
Happy payal Traders™ Macrame Mirror Wall Hanging with Fringe Round Mirror Art Boho Decor Entryways Gift.  ,,,,"₹1,999",₹999,"Save ₹1,000 (50%)",2.0 out of 5 stars,1,https://www.amazon.in/TradersTM-Macrame-Mirror-Hanging-Entryways/dp/B091N95X2V/ref=sr_1_50?dchild=1&keywords=wall+mirror&qid=1625201196&sr=8-50
Bikri Kendra - Sun 4 Colors Combo - 3D Mirror Decorative Acrylic Wall Stickers  ,,,,,₹359,,4.2 out of 5 stars,90,https://www.amazon.in/Bikri-Kendra-Colors-Acrylic-Stickers/dp/B07WCFWDL8/ref=sr_1_51?dchild=1&keywords=wall+mirror&qid=1625201196&sr=8-51
"Wall1ders - Plume Feather Silver 3D Mirror Stickers for Wall Large Size, 3D Wall Mirror Sticker, Mirror Wall Stickers for Living Room, Hall, Bed Room & Home. (Silver)  ",,,,"₹1,020",₹289,Save ₹731 (72%),3.8 out of 5 stars,851,https://www.amazon.in/Feather%C2%82-Silver-Acrylic-Mirror-Stickers-Office/dp/B07D39215W/ref=sr_1_52?dchild=1&keywords=wall+mirror&qid=1625201196&sr=8-52
999Store Printed Blue Yellow Abstract Pattern Mirror  ,,,,"₹3,999",₹799,"Save ₹3,200 (80%)",3.9 out of 5 stars,155,https://www.amazon.in/999Store-Printed-Yellow-Abstract-Pattern/dp/B07MNRPSBH/ref=sr_1_53?dchild=1&keywords=wall+mirror&qid=1625201196&sr=8-53
"Quality Glass Glass Frameless Round Mirror for Wall Bathrooms Home (24 X 24 Inch, Silver)  ",,,,"₹2,500","₹1,649",Save ₹851 (34%),4.2 out of 5 stars,318,https://www.amazon.in/Quality-Glass-Frameless-Mirror-Bathrooms/dp/B07HHJ23HD/ref=sr_1_54?dchild=1&keywords=wall+mirror&qid=1625201196&sr=8-54
"Home and Bazaar Traditional Elegant & Ethnic Designer Unique Wooden Peacock Wall Mirror Frame 12x1x16 Inch, Mirror Size 6"" Dia  ",,,,,₹799,,4.2 out of 5 stars,25,https://www.amazon.in/Home-Bazaar-Traditional-Elegant-Designer/dp/B07QX814RQ/ref=sr_1_55?dchild=1&keywords=wall+mirror&qid=1625201196&sr=8-55
Solid Base Big Wall Hanging Mirror 65X34 cm for Living Room Decoration Bathroom Bedroom Wash Basin Shelf Oval Shape Decor (Flowery Wenge)  ,,,,"₹1,999","₹1,199",Save ₹800 (40%),4.5 out of 5 stars,7,https://www.amazon.in/Hanging-Decoration-Bathroom-Bedroom-Flowery/dp/B08YKGLLH6/ref=sr_1_56?dchild=1&keywords=wall+mirror&qid=1625201196&sr=8-56
Quality Mirrors Decorative Frameless Mirror/Glass for Wall Home/Hotel Room Decor Wood Mirror (Size : 18 X 24 inch )  ,,Sponsored,,"₹2,999","₹2,300",Save ₹699 (23%),,,https://www.amazon.in/gp/slredirect/picassoRedirect.html/ref=pa_sp_btf_aps_sr_pg1_1?ie=UTF8&adId=A0256650X7VHKQ5WKGSM&url=%2FQuality-Mirrors-Decorative-Frameless-Mirror%2Fdp%2FB096GBY5JQ%2Fref%3Dsr_1_57_sspa%3Fdchild%3D1%26keywords%3Dwall%2Bmirror%26qid%3D1625201196%26sr%3D8-57-spons%26psc%3D1&qualifier=1625201196&id=2323158827117032&widgetName=sp_btf
Seven Horses Wooden Dressing Wall Mirrors/Wall Hanging Dressing Mirrors/Plain Decorative Wall Mirror/Dressing Table for Bed Room/ Wall Mounted Dressing Mirror for Living Room (Size 15X36 Inch)  ,,Sponsored,,"₹4,998","₹1,998","Save ₹3,000 (60%)",4.4 out of 5 stars,6,https://www.amazon.in/gp/slredirect/picassoRedirect.html/ref=pa_sp_btf_aps_sr_pg1_1?ie=UTF8&adId=A1011751363CS6XNRF5JM&url=%2FDressing-Mirrors-Hanging-Decorative-Mounted%2Fdp%2FB08VN6J5N8%2Fref%3Dsr_1_58_sspa%3Fdchild%3D1%26keywords%3Dwall%2Bmirror%26qid%3D1625201196%26sr%3D8-58-spons%26psc%3D1&qualifier=1625201196&id=2323158827117032&widgetName=sp_btf
RJKart Iron Handcrafted Wired Flower Design Golden Decorative Wall Mirror for Living Room (30 x 30 in) - by Elegante HOMEZ  ,,Sponsored,,"₹9,999","₹4,990","Save ₹5,009 (50%)",4.2 out of 5 stars,9,https://www.amazon.in/gp/slredirect/picassoRedirect.html/ref=pa_sp_btf_aps_sr_pg1_1?ie=UTF8&adId=A0746931CO3OZOGD6A9J&url=%2FRJKart-Handcrafted-Flower-Design-Decorative%2Fdp%2FB08SMFLN21%2Fref%3Dsr_1_59_sspa%3Fdchild%3D1%26keywords%3Dwall%2Bmirror%26qid%3D1625201196%26sr%3D8-59-spons%26psc%3D1&qualifier=1625201196&id=2323158827117032&widgetName=sp_btf
"GIG Handicrafts Balls Iron Decorative Wall Mounted Hanging Mirror Sculpture Metal Glass Modern Art Gifts Home Decor Wall Mirror (56 cm x 4 cm x 56 cm, Gold)  ",,Sponsored,,"₹3,499","₹2,579",Save ₹920 (26%),4.3 out of 5 stars,104,https://www.amazon.in/gp/slredirect/picassoRedirect.html/ref=pa_sp_btf_aps_sr_pg1_1?ie=UTF8&adId=A07159402IYEJT6E8ZGXB&url=%2FGIG-Handicrafts-Decorative-Mounted-Sculpture%2Fdp%2FB07SCVLWGT%2Fref%3Dsr_1_60_sspa%3Fdchild%3D1%26keywords%3Dwall%2Bmirror%26qid%3D1625201196%26sr%3D8-60-spons%26psc%3D1&qualifier=1625201196&id=2323158827117032&widgetName=sp_btf
Quality Mirrors| Round Wooden Wall Mirrors | Royal Mirror |Modern Mirror | 30*20 inches | Round Decorative Mirror ||Venetian Mirror  ,,Sponsored,,"₹7,500","₹5,999","Save ₹1,501 (20%)",,,https://www.amazon.in/gp/slredirect/picassoRedirect.html/ref=pa_sp_atf_next_aps_sr_pg2_1?ie=UTF8&adId=A025715021X4QWM1A9PYE&url=%2FQuality-Mirrors-Wooden-Decorative-Venetian%2Fdp%2FB097699DVC%2Fref%3Dsr_1_49_sspa%3Fdchild%3D1%26keywords%3Dwall%2Bmirror%26qid%3D1625201219%26sr%3D8-49-spons%26psc%3D1&qualifier=1625201219&id=5448724608472667&widgetName=sp_atf_next
CasaGold Black Round Metal Frame Wall Mirror with 2 Black Wall Hanging Candle Stands-(18inch)  ,Limited time deal,Sponsored,,"₹5,000","₹2,374","Save ₹2,626 (53%)",4.5 out of 5 stars,2,https://www.amazon.in/gp/slredirect/picassoRedirect.html/ref=pa_sp_atf_next_aps_sr_pg2_1?ie=UTF8&adId=A08728093CKBKQGDZW0SP&url=%2FCasaGold-Black-Mirror-Hanging-Stands%2Fdp%2FB095X282RS%2Fref%3Dsr_1_50_sspa%3Fdchild%3D1%26keywords%3Dwall%2Bmirror%26qid%3D1625201219%26smid%3DA1VOTY6L97BPGK%26sr%3D8-50-spons%26psc%3D1&qualifier=1625201219&id=5448724608472667&widgetName=sp_atf_next
Quality Mirrors| Round Wooden Wall Mirrors | Royal Mirror |Modern Mirror | 24*24 inches | Round Decorative Mirror  ,,Sponsored,,"₹7,500","₹2,499","Save ₹5,001 (67%)",,,https://www.amazon.in/gp/slredirect/picassoRedirect.html/ref=pa_sp_atf_next_aps_sr_pg2_1?ie=UTF8&adId=A0256314YC0YG4SVXPJO&url=%2FQuality-Mirrors-Wooden-Mirror-Decorative%2Fdp%2FB095HV58PP%2Fref%3Dsr_1_51_sspa%3Fdchild%3D1%26keywords%3Dwall%2Bmirror%26qid%3D1625201219%26sr%3D8-51-spons%26psc%3D1&qualifier=1625201219&id=5448724608472667&widgetName=sp_atf_next
RJKart Iron Handcrafted Leaf Design Gold Decorative Wall Mirror for Living Room (26 x 26 in) - by Elegante HOMEZ  ,Limited time deal,Sponsored,,"₹9,990","₹3,939","Save ₹6,051 (61%)",,,https://www.amazon.in/gp/slredirect/picassoRedirect.html/ref=pa_sp_atf_next_aps_sr_pg2_1?ie=UTF8&adId=A07472111BNNG20MNQHHA&url=%2FRJKart-Handcrafted-Design-Decorative-Mirror%2Fdp%2FB08SMFC3HW%2Fref%3Dsr_1_52_sspa%3Fdchild%3D1%26keywords%3Dwall%2Bmirror%26qid%3D1625201219%26smid%3DAI7SWDJIMCXF%26sr%3D8-52-spons%26psc%3D1&qualifier=1625201219&id=5448724608472667&widgetName=sp_atf_next
"Atulya Arts 12 Pieces 6inch Square Mirror Wall Sticker, Self Adhesive 3D Acrylic Stickers for Wall, Mirror Silver Decorative Wall Stickers for Bathroom Living Room Bedroom Home Decor (Silver)  ",,,,₹999,₹499,Save ₹500 (50%),,,https://www.amazon.in/Atulya-Arts-Adhesive-Stickers-Decorative/dp/B09538RHG6/ref=sr_1_53?dchild=1&keywords=wall+mirror&qid=1625201219&sr=8-53
Baal Wall And Vanity Mirror For Makeup Pack Of 1  ,,,,₹499,₹392,Save ₹107 (21%),4.0 out of 5 stars,2,https://www.amazon.in/Baal-Wall-Vanity-Mirror-Makeup/dp/B08PVP6DRY/ref=sr_1_54?dchild=1&keywords=wall+mirror&qid=1625201219&sr=8-54
Art Street Lotus Petal Decorative Wall Mirror (Set of 3)(Size - 9 x 9 inch)  ,Deal of the Day ,,,"₹1,500",₹758,Save ₹742 (49%),4.1 out of 5 stars,173,https://www.amazon.in/Painting-Mantra-Street-Decorative-Mirror/dp/B07954FM4N/ref=sr_1_55?dchild=1&keywords=wall+mirror&qid=1625201219&sr=8-55
"Homace Strong and Heavy Mirror Cabinet (Rich Look, White)  ",,,,"₹3,999","₹1,644","Save ₹2,355 (59%)",4.3 out of 5 stars,46,https://www.amazon.in/Homace-Strong-Heavy-Mirror-Cabinet/dp/B08L4QDLJJ/ref=sr_1_56?dchild=1&keywords=wall+mirror&qid=1625201219&sr=8-56
Quality Mirrors Decorative Frameless Round Mirror/Glass for Wall Home/Hotel Room Decor (Size : 12*12 inches)  ,,,,,,,,,https://www.amazon.in/Quality-Mirrors-Decorative-Frameless-Mirror/dp/B094GB9ZQC/ref=sr_1_57?dchild=1&keywords=wall+mirror&qid=1625201219&sr=8-57
