name,badge_1,badge_2,badge_3,mrp,discounted_price,discount,rating,rating_count,link
Anikaa Sofi Engineered Wood Dressing Wall Mirrors Wall Hanging Dressing Mirrors/Plain Decorative Wall Mirror/Full Length Mirror for Bedroom/Wall Mounted Dressing Mirror for Living Room (Wenge Big)  ,,Sponsored,,,,,3.3 out of 5 stars,8,https://www.amazon.in/gp/slredirect/picassoRedirect.html/ref=pa_sp_atf_aps_sr_pg1_1?ie=UTF8&adId=A00174181AUZ0XSWHTS9A&url=%2FAnikaa-Mirrors-Hanging-Dressing-Decorative%2Fdp%2FB07Y79KFPW%2Fref%3Dsr_1_1_sspa%3Fdchild%3D1%26keywords%3Dwall%2Bmirror%26qid%3D1625667855%26sr%3D8-1-spons%26psc%3D1&qualifier=1625667855&id=1571444465700936&widgetName=sp_atf
Papdiwal Industries Glass Mirrornow's Imported Touch Sensor LED Bathroom Vertical Mirror (27x18 Inches)  ,,Sponsored,,,,,,,https://www.amazon.in/gp/slredirect/picassoRedirect.html/ref=pa_sp_atf_aps_sr_pg1_1?ie=UTF8&adId=A06468871ON39J0Z3Q5OS&url=%2FPapdiwal-Industries-Mirrornows-Bathroom-Vertical%2Fdp%2FB08C9V9QKX%2Fref%3Dsr_1_2_sspa%3Fdchild%3D1%26keywords%3Dwall%2Bmirror%26qid%3D1625667855%26sr%3D8-2-spons%26psc%3D1&qualifier=1625667855&id=1571444465700936&widgetName=sp_atf
Anikaa Maria Engineered Wood Dressing Wall Mirrors/Wall Hanging Dressing Mirrors with Shelf/Decorative Wall Mirror/Dressing Table for Bed Room/Living Room (Walnut) Matte Finish  ,,Sponsored,,"₹2,599","₹1,799",Save ₹800 (31%),4.0 out of 5 stars,107,https://www.amazon.in/gp/slredirect/picassoRedirect.html/ref=pa_sp_atf_aps_sr_pg1_1?ie=UTF8&adId=A10229152JSE8KOJE47FI&url=%2FAnikaa-Dressing-Mirrors-Hanging-Decorative%2Fdp%2FB08L7S1DVC%2Fref%3Dsr_1_3_sspa%3Fdchild%3D1%26keywords%3Dwall%2Bmirror%26qid%3D1625667855%26sr%3D8-3-spons%26psc%3D1&qualifier=1625667855&id=1571444465700936&widgetName=sp_atf
Quality Glass Frameless Wall Mirror (Glass_Silver_18 X 24 Inch)  ,,Sponsored,,"₹2,999","₹1,799","Save ₹1,200 (40%)",3.4 out of 5 stars,2,https://www.amazon.in/gp/slredirect/picassoRedirect.html/ref=pa_sp_atf_aps_sr_pg1_1?ie=UTF8&adId=A0443262D0ZMC1HTUAUB&url=%2FQuality-Glass-Frameless-Decorative-bathrooms%2Fdp%2FB07HHFKBQK%2Fref%3Dsr_1_4_sspa%3Fdchild%3D1%26keywords%3Dwall%2Bmirror%26qid%3D1625667855%26sr%3D8-4-spons%26psc%3D1%26smid%3DA2T0PW94YKLRRP&qualifier=1625667855&id=1571444465700936&widgetName=sp_atf
"Wall1ders - Hexagon 3D Acrylic Stickers, 3D Acrylic Wall Stickers for Living Room, Hall, Bed Room & Home with 10 Butterfly Stickers - Pack of 28 (Silver)  ",Amazon's Choice,,,"₹1,099",₹370,Save ₹729 (66%),4.0 out of 5 stars,"2,764",https://www.amazon.in/Wall1ders-Hexagon-Silver-Acrylic-Mirror-Stickers/dp/B07PM4BJ42/ref=ice_ac_b_dpb?dchild=1&keywords=wall+mirror&qid=1625667855&sr=8-5
"Steven Quartz Beautiful Elegance Designer Frame Wall Mirror (Size 40cm x 40cm) (16 Inch, Golden)  ",,,,"₹1,980",₹590,"Save ₹1,390 (70%)",3.5 out of 5 stars,27,https://www.amazon.in/Steven-Quartz-Beautiful-Elegance-Designer/dp/B08QH853V7/ref=sr_1_6?dchild=1&keywords=wall+mirror&qid=1625667855&sr=8-6
SEVEN HORSES Floral Design Glass Wall Mirror for Makeup Bathroom Dressing (14.5X26.5 Inch)  ,,,,"₹1,998","₹1,099",Save ₹899 (45%),4.3 out of 5 stars,255,https://www.amazon.in/SEVEN-HORSES-Bathroom-Dressing-14-5X26-5/dp/B08KHHJC98/ref=sr_1_7?dchild=1&keywords=wall+mirror&qid=1625667855&sr=8-7
Quality Glass Verticle Shape Frameless Decorative Mirror Mirror Glass for Wall Mirror for bathrooms Mirror in Home Mirror décor Mirror Size : 12 X 18 inch QGFL 132  ,,,,"₹2,449",₹889,"Save ₹1,560 (64%)",3.8 out of 5 stars,23,https://www.amazon.in/Quality-Glass-Frameless-Decorative-bathrooms/dp/B0928GB9KR/ref=sr_1_8?dchild=1&keywords=wall+mirror&qid=1625667855&sr=8-8
Ciplaplast Strong and Heavy Rich Look Cabinet with Mirror - White  ,,,,"₹5,999","₹1,644","Save ₹4,355 (73%)",4.2 out of 5 stars,"2,579",https://www.amazon.in/Ciplaplast-Strong-Heavy-Cabinet-Mirror/dp/B083RD1Q23/ref=sr_1_9?dchild=1&keywords=wall+mirror&qid=1625667855&sr=8-9
"Wall1ders - 31 Hexagon & 10 Butterflies Silver (Size 10.5 x 12 cm) 3D Hexagon Wall Stickers, 3D Stickers for Wall Large Size, 3D Wall Stickers, Acrylic Sticker  ",,,,"₹1,099",₹390,Save ₹709 (65%),4.1 out of 5 stars,717,https://www.amazon.in/Wall1ders-Hexagon-Silver-Acrylic-Mirror-Stickers/dp/B07PM85JYY/ref=sr_1_10?dchild=1&keywords=wall+mirror&qid=1625667855&sr=8-10
"Round Wall Mirror for Home Decoration,Set of 3 Decorative Wall hangnig Mirror, Wall Mirror for Living Room (10 x 10 Inchs) by Art Street  ",Limited time deal,,,"₹1,500",₹738,Save ₹762 (51%),4.1 out of 5 stars,80,https://www.amazon.in/Art-Street-Decorative-Mirror-Living/dp/B07VC9DC8L/ref=sr_1_11?dchild=1&keywords=wall+mirror&qid=1625667855&sr=8-11
Reflectionz Frameless Rectangle Decorative Mirror | Mirror Glass for Wall | Mirror for Bathrooms | Mirror in Home | Mirror Decor | Mirror Size : (10 X 14 Inch)  ,,,,₹799,₹480,Save ₹319 (40%),4.1 out of 5 stars,290,https://www.amazon.in/Reflectionz-Frameless-Rectangle-Decorative-Bathrooms/dp/B08T7JKT3P/ref=sr_1_12?dchild=1&keywords=wall+mirror&qid=1625667855&sr=8-12
"Art Street Decorative Wall Mirror/Makeup Mirror/Looking Glass Copper Color Flat Small Size Inner Size 10 x 12 inch, Outer Size 12 x 14 inch  ",Deal of the Day ,,,"₹1,199",₹474,Save ₹725 (60%),3.6 out of 5 stars,515,https://www.amazon.in/Art-Street-Copper-Decorative-Looking/dp/B07F3WRMFB/ref=sr_1_13?dchild=1&keywords=wall+mirror&qid=1625667855&sr=8-13
"Seven Horses Frame Brown Sunmica Finish Fiber Wood Wall Mirror, Dressing Mirror Solid Premium Brown Water Resistant Synthetic Fiber Wood Made (14.5X26.5 Inch)  ",,,,"₹1,998","₹1,099",Save ₹899 (45%),4.1 out of 5 stars,302,https://www.amazon.in/Sunmica-Dressing-Premium-Resistant-Synthetic/dp/B0795WCNQS/ref=sr_1_14?dchild=1&keywords=wall+mirror&qid=1625667855&sr=8-14
Zahab Bathroom Cabinets for Storage with Mirror Door Wall Mounted 10x4x14 Blue  ,,,,"₹1,999",₹920,"Save ₹1,079 (54%)",3.7 out of 5 stars,54,https://www.amazon.in/Bathroom-Cabinets-Storage-Mounted-10x4x14/dp/B08KS6Y4B9/ref=sr_1_15?dchild=1&keywords=wall+mirror&qid=1625667855&sr=8-15
Quality Glass Round Shape Frameless Decorative Mirror Mirror Glass for Wall Mirror for bathrooms Mirror in Home Mirror Decor Mirror Size : 12X 12 inch QGFL 131  ,,,,"₹1,300",₹589,Save ₹711 (55%),3.5 out of 5 stars,47,https://www.amazon.in/Quality-Glass-Frameless-Decorative-bathrooms/dp/B0927DWQMH/ref=sr_1_16?dchild=1&keywords=wall+mirror&qid=1625667855&sr=8-16
Bikri Kendra Hexagon 20 Golden Acrylic Mirror Wall Stickers  ,,,,,₹269,,3.6 out of 5 stars,"1,661",https://www.amazon.in/Bikri-Kendra-Hexagon-Golden-Mirror/dp/B072Q4Y2Q8/ref=sr_1_17?dchild=1&keywords=wall+mirror&qid=1625667855&sr=8-17
"Art India Collections Decorative Hexagonal Hanging Wall Mirror, Large Vintage Mirror for Wall-9.5x11 Inch Gold Metallic Frame Mirror Material Wall Mirrors  ",,,,"₹1,249",₹729,Save ₹520 (42%),3.6 out of 5 stars,18,https://www.amazon.in/Art-India-Collections-Decorative-Wall-9-5x11/dp/B0925JJ79P/ref=sr_1_18?dchild=1&keywords=wall+mirror&qid=1625667855&sr=8-18
Quality Glass Square Shape Frameless Decorative Mirror Mirror Glass for Wall Mirror for bathrooms Mirror in Home Mirror Decor Mirror Size : 12 X 12 inch QGFL 126  ,,,,"₹1,000",₹589,Save ₹411 (41%),3.3 out of 5 stars,21,https://www.amazon.in/Quality-Glass-Frameless-Decorative-bathrooms/dp/B09139VHV9/ref=sr_1_19?dchild=1&keywords=wall+mirror&qid=1625667855&sr=8-19
"Creative Arts n Frames 15 x 21 inch Wall Mirror for Bathroom, Bedroom, Drawing Room and Wash Basin (Mirror, 15 x 21 inch) (Oval)  ",,,,"₹2,999","₹1,099","Save ₹1,900 (63%)",4.2 out of 5 stars,531,https://www.amazon.in/Creative-Arts-Frames-Bathroom-Bedroom/dp/B08DL3W9VZ/ref=sr_1_20?dchild=1&keywords=wall+mirror&qid=1625667855&sr=8-20
BLUEWUD Akira Wall Mounted Dressing Mirror (Walnut)  ,,Sponsored,,"₹5,749","₹4,499","Save ₹1,250 (22%)",4.4 out of 5 stars,78,https://www.amazon.in/gp/slredirect/picassoRedirect.html/ref=pa_sp_mtf_aps_sr_pg1_1?ie=UTF8&adId=A015396937JW7HX4LLGYT&url=%2FBluewud-M-AK-BL-Dressing-Mirror-Walnut%2Fdp%2FB06WLNKN2W%2Fref%3Dsr_1_21_sspa%3Fdchild%3D1%26keywords%3Dwall%2Bmirror%26qid%3D1625667855%26sr%3D8-21-spons%26psc%3D1&qualifier=1625667855&id=1571444465700936&widgetName=sp_mtf
"Timberly Wooden Wall Decorative Vintage Sunburst Mirror for Living Room (16 x 16 Inch) (Brown Color) - Set of 1, Medium  ",,Sponsored,,,"₹1,250",,3.8 out of 5 stars,22,https://www.amazon.in/gp/slredirect/picassoRedirect.html/ref=pa_sp_mtf_aps_sr_pg1_1?ie=UTF8&adId=A008722797DAS7OW6L36&url=%2FTimberly-Wooden-Decorative-Vintage-Sunburst%2Fdp%2FB09298CR3N%2Fref%3Dsr_1_22_sspa%3Fdchild%3D1%26keywords%3Dwall%2Bmirror%26qid%3D1625667855%26sr%3D8-22-spons%26psc%3D1&qualifier=1625667855&id=1571444465700936&widgetName=sp_mtf
"AG Crafts™ 0016(1.5"")-Brown Gold Decorative Mirror (Rectangle) (Brown-Gold)  ",,Sponsored,,"₹1,999",₹599,"Save ₹1,400 (70%)",3.4 out of 5 stars,14,https://www.amazon.in/gp/slredirect/picassoRedirect.html/ref=pa_sp_mtf_aps_sr_pg1_1?ie=UTF8&adId=A09351811T73XD14PHDJ&url=%2FAG-CraftsTM-Decorative-Rectangle-Brown-Gold%2Fdp%2FB08LZCNJWD%2Fref%3Dsr_1_23_sspa%3Fdchild%3D1%26keywords%3Dwall%2Bmirror%26qid%3D1625667855%26sr%3D8-23-spons%26psc%3D1&qualifier=1625667855&id=1571444465700936&widgetName=sp_mtf
Anikaa Mason Engineered Wood Dressing Wall Mirrors/Wall Hanging Dressing Mirrors/Decorative Wall Mirror/Dressing Table for Bedroom/Wall Mounted Dressing Mirror for Living Room/Wall Mirror with 2 Shelves(Wenge)  ,,Sponsored,,"₹2,599","₹1,699",Save ₹900 (35%),3.6 out of 5 stars,17,https://www.amazon.in/gp/slredirect/picassoRedirect.html/ref=pa_sp_mtf_aps_sr_pg1_1?ie=UTF8&adId=A10233153U1HRD4R94ENN&url=%2FAnikaa-Dressing-Mirrors-Hanging-Decorative%2Fdp%2FB08L7PFCTV%2Fref%3Dsr_1_24_sspa%3Fdchild%3D1%26keywords%3Dwall%2Bmirror%26qid%3D1625667855%26sr%3D8-24-spons%26psc%3D1&qualifier=1625667855&id=1571444465700936&widgetName=sp_mtf
"SATYAM KRAFT 1 Piece Plastic Wall Mirror (9 Inch × 9 Inch, Gold)  ",,,,,₹339,,3.7 out of 5 stars,345,https://www.amazon.in/SATYAM-KRAFT-Fibre-Wall-Mirror/dp/B084VPP133/ref=sr_1_25?dchild=1&keywords=wall+mirror&qid=1625667855&sr=8-25
"Art Street Frameless Wall Mirrors for Bathroom, Bevelled Frameless Wall Mirror (16 x 24 Inches, Silver)  ",Limited time deal,,,"₹2,500","₹1,139","Save ₹1,361 (54%)",3.9 out of 5 stars,401,https://www.amazon.in/Art-Street-Bathroom-Frameless-Horizontal/dp/B07NYZYY46/ref=sr_1_26?dchild=1&keywords=wall+mirror&qid=1625667855&sr=8-26
Bikri Kendra® - Hexagon 13 Silver -3D Acrylic Decorative Mirror  ,,,,"₹1,100",₹249,Save ₹851 (77%),3.7 out of 5 stars,387,https://www.amazon.in/Bikri-Kendra-Hexagon-Walldecor-Stickers/dp/B071JFMG29/ref=sr_1_27?dchild=1&keywords=wall+mirror&qid=1625667855&sr=8-27
Quality Glass Oval Shape Frameless Decorative Mirror Mirror Glass for Wall Mirror for bathrooms Mirror in Home Mirror Decor Mirror Size : 12X 18 inch QGFL 128  ,,,,"₹1,200",₹849,Save ₹351 (29%),3.6 out of 5 stars,43,https://www.amazon.in/Quality-Glass-Frameless-Decorative-bathrooms/dp/B09139MXD2/ref=sr_1_28?dchild=1&keywords=wall+mirror&qid=1625667855&sr=8-28
"Dime Store Wall Mirror with Shelf for Living Room Bedroom Dressing Mirror for Wall Decor (Standard, Brown)  ",,,,"₹2,499","₹2,295",Save ₹204 (8%),3.9 out of 5 stars,267,https://www.amazon.in/Dime-Store-Mirror-Shelf-Living/dp/B08NPZBRG8/ref=sr_1_29?dchild=1&keywords=wall+mirror&qid=1625667855&sr=8-29
Atulya Arts 3D Hexagon Acrylic Decorative Wall-Stickers with 10 Butterfly Stickers (Silver) - Pack of 28  ,,,,₹999,₹360,Save ₹639 (64%),3.9 out of 5 stars,"2,128",https://www.amazon.in/Hexagon-Decorative-Wall-Stickers-Butterfly-Stickers/dp/B07BNHWDL4/ref=sr_1_30?dchild=1&keywords=wall+mirror&qid=1625667855&sr=8-30
AG Crafts™ Black Flat Decorative Wall Mirror/Looking Glass Inner Size 18 x 12 inch - 0022 (Black)  ,,,,"₹1,499",₹599,Save ₹900 (60%),3.3 out of 5 stars,39,https://www.amazon.in/AG-CraftsTM-Decorative-Mirror-Looking/dp/B08HJK694Y/ref=sr_1_31?dchild=1&keywords=wall+mirror&qid=1625667855&sr=8-31
jacky Glass RKC Brown Gold Border Mirror for Walls Decoration for Table Birthday GIF  ,,,,"₹1,879",₹349,"Save ₹1,530 (81%)",3.0 out of 5 stars,5,https://www.amazon.in/jacky-Border-Mirror-Decoration-Birthday/dp/B08HD9NB87/ref=sr_1_32?dchild=1&keywords=wall+mirror&qid=1625667855&sr=8-32
"Bikri Kendra - Art BK32, Ganesha Red - 3D Acrylic Mirror Stickers for Wall  ",,,,,₹299,,4.3 out of 5 stars,7,https://www.amazon.in/Bikri-Kendra-Ganesha-Acrylic-Stickers/dp/B08FJFSQNY/ref=sr_1_33?dchild=1&keywords=wall+mirror&qid=1625667855&sr=8-33
Baal Wall And Vanity Mirror For Makeup Pack Of 1  ,,,,₹499,₹392,Save ₹107 (21%),4.0 out of 5 stars,2,https://www.amazon.in/Baal-Wall-Vanity-Mirror-Makeup/dp/B08PVP6DRY/ref=sr_1_34?dchild=1&keywords=wall+mirror&qid=1625667855&sr=8-34
"Art Street Wall Mirror for Bathroom/Vanity, Marble Finish Decorative Mirror for Living Room - 14.5 x 20.5 Inchs, Color -Beige  ",Limited time deal,,,"₹1,200",₹759,Save ₹441 (37%),3.6 out of 5 stars,24,https://www.amazon.in/Art-Street-Mirror-Bathroom-Decorative/dp/B08J8D3KMZ/ref=sr_1_35?dchild=1&keywords=wall+mirror&qid=1625667855&sr=8-35
Art Street Sun Streek Decorative Wall Mirror (Set of 3)(Size - 9 x 9 inch)  ,Deal of the Day ,,,"₹2,000",₹758,"Save ₹1,242 (62%)",4.2 out of 5 stars,191,https://www.amazon.in/Painting-Mantra-Street-Decorative-Mirror/dp/B079556R74/ref=sr_1_36?dchild=1&keywords=wall+mirror&qid=1625667855&sr=8-36
"Hosley Decorative Square Iron Wall Mirror (15.24 cm x 29.84 cm, Black, Set of 3)  ",,,,"₹1,500",₹889,Save ₹611 (41%),4.4 out of 5 stars,167,https://www.amazon.in/Hosley-Decorative-Square-Mirror-15-24/dp/B01GHXY21G/ref=sr_1_37?dchild=1&keywords=wall+mirror&qid=1625667855&sr=8-37
"Homace Strong and Heavy Mirror Cabinet (Rich Look, White)  ",,,,"₹3,999","₹1,644","Save ₹2,355 (59%)",4.3 out of 5 stars,47,https://www.amazon.in/Homace-Strong-Heavy-Mirror-Cabinet/dp/B08L4QDLJJ/ref=sr_1_38?dchild=1&keywords=wall+mirror&qid=1625667855&sr=8-38
"Wall1ders - 3D Hexagon Mirror Wall Stickers, 3D Mirror Stickers for Wall Large Size, 3D Wall Mirror Stickers - (Pack of 28, Silver, 1.5 mm, Premium Qualty, Each Hexagon Size 10.5 cm x 12.1 cm)  ",Best seller,,,"₹1,099",₹599,Save ₹500 (45%),4.0 out of 5 stars,"2,764",https://www.amazon.in/gp/bestsellers/kitchen/5554172031/ref=sr_bs_38_5554172031_1
Atulya Arts offering 3D Large Hexagon Acrylic Stickers (Pack of 7) with 10 Butterfly Acrylic Mirror Wall Stickers for Home & Offices(Silver)  ,,,,₹999,₹199,Save ₹800 (80%),4.0 out of 5 stars,5,https://www.amazon.in/Atulya-Arts-offering-Stickers-Butterfly/dp/B092R2DVNH/ref=sr_1_40?dchild=1&keywords=wall+mirror&qid=1625667855&sr=8-40
Smera 40 x 40 cm Beautiful Elegance Designer Plastic Frame Wall Mirror for Home (Golden Color)  ,,,,"₹1,980",₹590,"Save ₹1,390 (70%)",3.6 out of 5 stars,81,https://www.amazon.in/Smera-Beautiful-Elegance-Designer-Mirror/dp/B08B4T7VVG/ref=sr_1_41?dchild=1&keywords=wall+mirror&qid=1625667855&sr=8-41
Bikri Kendra® - Sun Silver Model 3-3D Acrylic Decorative Mirror Wall Stickers -  ,,,,"₹1,100",₹249,Save ₹851 (77%),3.7 out of 5 stars,143,https://www.amazon.in/Bikri-Kendra-Acrylic-Stickers-B07FCJWCJY/dp/B07FCJWCJY/ref=sr_1_42?dchild=1&keywords=wall+mirror&qid=1625667855&sr=8-42
"SDG Frameless Oval Mirror (18x24inch, Silver)  ",,,,"₹1,999","₹1,249",Save ₹750 (38%),4.3 out of 5 stars,473,https://www.amazon.in/SDG-Frameless-Mirror-Bathrooms-Decor/dp/B07CK3R2C6/ref=sr_1_43?dchild=1&keywords=wall+mirror&qid=1625667855&sr=8-43
"DWH Deluxe Wood Handicrafts Round Shape Wooden Antique Frame with Mirror for Wall Decor, Living Room Decor  ",,,,₹599,₹349,Save ₹250 (42%),4.0 out of 5 stars,1,https://www.amazon.in/DWH-Deluxe-Handicrafts-Wooden-Antique/dp/B08PSJ979J/ref=sr_1_44?dchild=1&keywords=wall+mirror&qid=1625667855&sr=8-44
Art Street Lotus Petal Decorative Wall Mirror (Set of 3)(Size - 9 x 9 inch)  ,Deal of the Day ,,,"₹1,500",₹758,Save ₹742 (49%),4.1 out of 5 stars,173,https://www.amazon.in/Painting-Mantra-Street-Decorative-Mirror/dp/B07954FM4N/ref=sr_1_45?dchild=1&keywords=wall+mirror&qid=1625667855&sr=8-45
Bikri Kendra - Sun 4 Colors Combo - 3D Mirror Decorative Acrylic Wall Stickers  ,,,,"₹1,100",₹399,Save ₹701 (64%),4.2 out of 5 stars,91,https://www.amazon.in/Bikri-Kendra-Colors-Acrylic-Stickers/dp/B07WCFWDL8/ref=sr_1_46?dchild=1&keywords=wall+mirror&qid=1625667855&sr=8-46
"Wall1ders - 28 Hexagon & 10 Butterflies Blue (Each Hexagon Size 10.5 cm x 12.1 cm) 3D Hexagon Mirror Wall Stickers, 3D Mirror Stickers for Wall Large Size, 3D Wall Mirror Stickers  ",Best seller,,,"₹1,099",₹370,Save ₹729 (66%),4.0 out of 5 stars,"2,763",https://www.amazon.in/gp/bestsellers/kitchen/5554172031/ref=sr_bs_46_5554172031_1
"Wall1ders 1Store - Big Square 30 Silver 4 inch (Each Piece Size 10 cm) 3D Acrylic Stickers, 3D Acrylic Mirror Wall Stickers, 3D Mirror Stickers for Wall, 3D Wall Mirror Stickers for Home & Offices.  ",,,,₹999,₹479,Save ₹520 (52%),,,https://www.amazon.in/Wall1ders-1Store-Acrylic-Stickers-Offices/dp/B096MN21S9/ref=sr_1_48?dchild=1&keywords=wall+mirror&qid=1625667855&sr=8-48
"Wall1ders - Plume Feather Silver 3D Mirror Stickers for Wall Large Size, 3D Wall Mirror Sticker, Mirror Wall Stickers for Living Room, Hall, Bed Room & Home. (Silver)  ",,,,"₹1,020",₹289,Save ₹731 (72%),3.8 out of 5 stars,867,https://www.amazon.in/Feather%C2%82-Silver-Acrylic-Mirror-Stickers-Office/dp/B07D39215W/ref=sr_1_49?dchild=1&keywords=wall+mirror&qid=1625667855&sr=8-49
Atulya Arts 3D Acrylic Mirror Hexagon Shape Wall Stickers (Gold) -(Pack of 20)  ,,,,₹999,₹269,Save ₹730 (73%),3.8 out of 5 stars,"2,144",https://www.amazon.in/Atulya-Acrylic-Mirror-Hexagon-Stickers/dp/B078LH2JR4/ref=sr_1_50?dchild=1&keywords=wall+mirror&qid=1625667855&sr=8-50
"Bikri Kendra - Art BK07, Butterfly Silver - 3D Acrylic Mirror Stickers for Wall (Pack of 40)  ",,,,"₹1,100",₹299,Save ₹801 (73%),4.1 out of 5 stars,29,https://www.amazon.in/Bikri-Kendra-Butterfly-Acrylic-Stickers/dp/B08FJDQZDG/ref=sr_1_51?dchild=1&keywords=wall+mirror&qid=1625667855&sr=8-51
"Orrda Mirror Wall Stickers | Vinyl Self Adhesive Mirror Sheets for Home Decor | Mirror Wrap Sticker Decals for Home Art Decoration Bathroom, Living Room, Bedroom (60 x 60 cm)  ",,,,₹799,₹499,Save ₹300 (38%),,,https://www.amazon.in/Orrda-Stickers-Adhesive-Decoration-Bathroom/dp/B098BD8QNV/ref=sr_1_52?dchild=1&keywords=wall+mirror&qid=1625667855&sr=8-52
"Art Street Decorative Wall Mirror Black Flat Small Size/Looking Glass Inner Size 10 x 12 inch, Outer Size 12 x 14 inch  ",Deal of the Day ,,,"₹1,500",₹474,"Save ₹1,026 (68%)",3.7 out of 5 stars,317,https://www.amazon.in/Art-Street-Decorative-Mirror-Looking/dp/B07DWWT61F/ref=sr_1_53?dchild=1&keywords=wall+mirror&qid=1625667855&sr=8-53
"Home and Bazaar Traditional Elegant & Ethnic Designer Unique Wooden Peacock Wall Mirror Frame 12x1x16 Inch, Mirror Size 6"" Dia  ",,,,,₹799,,4.2 out of 5 stars,25,https://www.amazon.in/Home-Bazaar-Traditional-Elegant-Designer/dp/B07QX814RQ/ref=sr_1_54?dchild=1&keywords=wall+mirror&qid=1625667855&sr=8-54
Solid Base Big Wall Hanging Mirror 65X34 cm for Living Room Decoration Bathroom Bedroom Wash Basin Shelf Oval Shape Decor (Flowery Wenge)  ,,,,"₹1,999","₹1,199",Save ₹800 (40%),4.5 out of 5 stars,7,https://www.amazon.in/Hanging-Decoration-Bathroom-Bedroom-Flowery/dp/B08YKGLLH6/ref=sr_1_55?dchild=1&keywords=wall+mirror&qid=1625667855&sr=8-55
Atulya Arts - Offering 3D Large Hexagon Acrylic Stickers (Pack of 7) with 10 Butterfly Acrylic Mirror Wall Stickers for Home & Offices(Silver)  ,,,,₹999,₹195,Save ₹804 (80%),3.7 out of 5 stars,"1,183",https://www.amazon.in/Wall1ders-Atulya-Hexagon-Acrylic-Stickers/dp/B07JJP82L6/ref=sr_1_56?dchild=1&keywords=wall+mirror&qid=1625667855&sr=8-56
GIG Handicrafts Decorative Iron Wall Mounted Hanging Mirror Sculpture Metal Glass Leaf Design Modern Art Gifts Home Decor (64 cm x 3 cm x 64 cm)  ,,Sponsored,,"₹2,499","₹1,799",Save ₹700 (28%),4.1 out of 5 stars,36,https://www.amazon.in/gp/slredirect/picassoRedirect.html/ref=pa_sp_btf_aps_sr_pg1_1?ie=UTF8&adId=A0716620RADKOOG7F7IJ&url=%2FGIG-Decorative-Mounted-Hanging-Sculpture%2Fdp%2FB07PFVR3VL%2Fref%3Dsr_1_57_sspa%3Fdchild%3D1%26keywords%3Dwall%2Bmirror%26qid%3D1625667855%26sr%3D8-57-spons%26psc%3D1&qualifier=1625667855&id=1571444465700936&widgetName=sp_btf
"GIG Handicrafts Balls Iron Decorative Wall Mounted Hanging Mirror Sculpture Metal Glass Modern Art Gifts Home Decor Wall Mirror (56 cm x 4 cm x 56 cm, Gold)  ",,Sponsored,,"₹3,499","₹2,579",Save ₹920 (26%),4.3 out of 5 stars,107,https://www.amazon.in/gp/slredirect/picassoRedirect.html/ref=pa_sp_btf_aps_sr_pg1_1?ie=UTF8&adId=A07159402IYEJT6E8ZGXB&url=%2FGIG-Handicrafts-Decorative-Mounted-Sculpture%2Fdp%2FB07SCVLWGT%2Fref%3Dsr_1_58_sspa%3Fdchild%3D1%26keywords%3Dwall%2Bmirror%26qid%3D1625667855%26sr%3D8-58-spons%26psc%3D1%26smid%3DA33N7BHEVBH8FW&qualifier=1625667855&id=1571444465700936&widgetName=sp_btf
"AG Crafts™ 004(2"")-Brown Bathroom Mirror (Rectangle) (Brown)  ",,Sponsored,,"₹1,999",₹599,"Save ₹1,400 (70%)",3.8 out of 5 stars,14,https://www.amazon.in/gp/slredirect/picassoRedirect.html/ref=pa_sp_btf_aps_sr_pg1_1?ie=UTF8&adId=A09350573HL881WJYD7NI&url=%2FAG-CraftsTM-Brown-Bathroom-Rectangle%2Fdp%2FB08LZ7PC7R%2Fref%3Dsr_1_59_sspa%3Fdchild%3D1%26keywords%3Dwall%2Bmirror%26qid%3D1625667855%26sr%3D8-59-spons%26psc%3D1&qualifier=1625667855&id=1571444465700936&widgetName=sp_btf
Seven Horses 24 Inch Round Wall Mirror (Size 24 Inch Round)  ,,Sponsored,,"₹3,998","₹1,699","Save ₹2,299 (58%)",4.1 out of 5 stars,7,https://www.amazon.in/gp/slredirect/picassoRedirect.html/ref=pa_sp_btf_aps_sr_pg1_1?ie=UTF8&adId=A073667922MCGBRAIY29J&url=%2FSeven-Horses-Inch-Round-Mirror%2Fdp%2FB08S7DD3T5%2Fref%3Dsr_1_60_sspa%3Fdchild%3D1%26keywords%3Dwall%2Bmirror%26qid%3D1625667855%26sr%3D8-60-spons%26psc%3D1&qualifier=1625667855&id=1571444465700936&widgetName=sp_btf
Papdiwal Industries Imported Touch Sensor LED Vertical Bathroom Mirror (30X24 Inch)  ,,Sponsored,,,,,,,https://www.amazon.in/gp/slredirect/picassoRedirect.html/ref=pa_sp_atf_next_aps_sr_pg2_1?ie=UTF8&adId=A065211526RFY18RLGUND&url=%2FPapdiwal-Industries-Sensor-Vertical-Bathroom%2Fdp%2FB08C9S4QSZ%2Fref%3Dsr_1_49_sspa%3Fdchild%3D1%26keywords%3Dwall%2Bmirror%26qid%3D1625667877%26sr%3D8-49-spons%26psc%3D1&qualifier=1625667877&id=6438112468299976&widgetName=sp_atf_next
ExclusiveLane Warli Handpainted Decorative Mirrors for Living Room Wall Bedroom Home Decoration & Looking Mirror for Wall Wooden Mirror in Pine Wood (10 Inch) (EL-023-027_25.7 cm x 3.3 cm x 35.8 cm)  ,,Sponsored,,"₹1,999","₹1,615",Save ₹384 (19%),4.6 out of 5 stars,3,https://www.amazon.in/gp/slredirect/picassoRedirect.html/ref=pa_sp_atf_next_aps_sr_pg2_1?ie=UTF8&adId=A058710727EODFM8WYZKR&url=%2FExclusiveLane-Handpainted-Decorative-Mirrors-Decoration%2Fdp%2FB086RQSY53%2Fref%3Dsr_1_50_sspa%3Fdchild%3D1%26keywords%3Dwall%2Bmirror%26qid%3D1625667877%26sr%3D8-50-spons%26psc%3D1&qualifier=1625667877&id=6438112468299976&widgetName=sp_atf_next
ExclusiveLane 'Oasis Reflection' Hand Carved Wall Mounted Mirror for Living Room & Dressing (Mango Wood) - Decorative Looking Mirror for Wall Mirror for Bedroom Wash Basin Bathroom Wall Makeup Mirror  ,,Sponsored,Only 2 left in stock.,"₹1,999","₹1,599",Save ₹400 (20%),,,https://www.amazon.in/gp/slredirect/picassoRedirect.html/ref=pa_sp_atf_next_aps_sr_pg2_1?ie=UTF8&adId=A0587351UV3J5X10FGQ9&url=%2FExclusiveLane-Reflection-Carved-Mounted-Dressing%2Fdp%2FB084TN7QL3%2Fref%3Dsr_1_51_sspa%3Fdchild%3D1%26keywords%3Dwall%2Bmirror%26qid%3D1625667877%26sr%3D8-51-spons%26psc%3D1&qualifier=1625667877&id=6438112468299976&widgetName=sp_atf_next
"NAVRANG INNOVATIONS NEO Mini Mirror/bathroom Cabinet with shelves, white (12.5 X 17inches)  ",,Sponsored,,"₹2,250","₹1,499",Save ₹751 (33%),4.4 out of 5 stars,109,https://www.amazon.in/gp/slredirect/picassoRedirect.html/ref=pa_sp_atf_next_aps_sr_pg2_1?ie=UTF8&adId=A08022163ME7EZJJR3NQE&url=%2FNAVRANG-INNOVATIONS-Mini-Mirror-Cabinet%2Fdp%2FB081QJLN3B%2Fref%3Dsr_1_52_sspa%3Fdchild%3D1%26keywords%3Dwall%2Bmirror%26qid%3D1625667877%26sr%3D8-52-spons%26psc%3D1&qualifier=1625667877&id=6438112468299976&widgetName=sp_atf_next
Quality Glass Square Shape Frameless Decorative Mirror Mirror Glass for Wall Mirror for bathrooms Mirror in Home Mirror Decor Mirror Size : 12X 12 inch QGFL 130  ,,,,"₹1,000",₹589,Save ₹411 (41%),3.3 out of 5 stars,17,https://www.amazon.in/Quality-Glass-Frameless-Decorative-bathrooms/dp/B0913BQ7SC/ref=sr_1_53?dchild=1&keywords=wall+mirror&qid=1625667877&sr=8-53
"Command Designer Plastic pack of 2 hooks and 4 strips, Self Adhesive Plastic Hooks for wall, Medium, White, Holds Upto 1.3kg  ",Best seller,,,₹175,₹159,Save ₹16 (9%),4.0 out of 5 stars,"2,992",https://www.amazon.in/gp/bestsellers/home-improvement/4286654031/ref=sr_bs_5_4286654031_1
"VSA OLLIVANDERS 7 Hexagon 3D Acrylic Stickers for Wall, 3D Mirror Wall Stickers, 3D Mirror Stickers Wall Decor Items for Home and Office.  ",,,,₹999,₹155,Save ₹844 (84%),3.2 out of 5 stars,9,https://www.amazon.in/VSA-OLLIVANDERS-Hexagon-Acrylic-Stickers/dp/B093DFFGYF/ref=sr_1_55?dchild=1&keywords=wall+mirror&qid=1625667877&sr=8-55
999Store Printed Bath Mirror Mirrors for Bathroom Brown Wooden Flower washroom Bathroom Mirror (MDF_14X20 Inches) MirrorSMP271  ,,,,"₹3,999",₹799,"Save ₹3,200 (80%)",3.6 out of 5 stars,114,https://www.amazon.in/999Store-Printed-Wooden-Flower-Pattern/dp/B07MNRNYTN/ref=sr_1_56?dchild=1&keywords=wall+mirror&qid=1625667877&sr=8-56
"SEVEN HORSES Glass Black Wall Mirror , Size 14.5X26.5 Inch  ",,,,"₹1,998","₹1,049",Save ₹949 (47%),5.0 out of 5 stars,1,https://www.amazon.in/SEVEN-HORSES-Glass-Mirror-14-5X26-5/dp/B08KHH5T67/ref=sr_1_57?dchild=1&keywords=wall+mirror&qid=1625667877&sr=8-57
