name,badge_1,badge_2,badge_3,mrp,discounted_price,discount,rating,rating_count,link
"COLOFLY 2 Inch 4 Fold Dual Comfort Reversible Foldable EPE Foam Single Bed Mattress, Red & Black  ",,,,"₹1,499",₹949,Save ₹550 (37%),3.0 out of 5 stars,7,https://www.amazon.in/COLOFLY-Comfort-Reversible-Foldable-Mattress/dp/B08W531CLY/ref=sr_1_51?dchild=1&keywords=mattress&qid=1626789096&sr=8-51
Brownie Pure Pu Foam Mattresses 2 inch Single PU Foam Mattress (Extremely Soft Cum Foldable) (72x35x2 (Single Bed))  ,,,,"₹1,999","₹1,199",Save ₹800 (40%),3.1 out of 5 stars,8,https://www.amazon.in/Brownie-Mattresses-Mattress-Extremely-Foldable/dp/B096B3BTXH/ref=sr_1_52?dchild=1&keywords=mattress&qid=1626789096&sr=8-52
"ATOOTFUSION Soft Cotton Rectangle Box Deewan Bed Mattress/Gadda (Multicolour, 72X48X4 Inches Box Mattress)  ",,,,"₹4,998","₹1,199","Save ₹3,799 (76%)",3.4 out of 5 stars,78,https://www.amazon.in/ATOOTFUSION-Rectangle-Mattress-Multicolour-72X48X4/dp/B08THW44QP/ref=sr_1_53?dchild=1&keywords=mattress&qid=1626789096&sr=8-53
Rajasthan Handloom Primium Quality Soft Cotton Multicolour Mattress | Cotton Gadda (Box Rectangle Type 4 x 6 ft OR 72 x 48 inch)- 8kg  ,,,,"₹2,050",₹985,"Save ₹1,065 (52%)",3.8 out of 5 stars,137,https://www.amazon.in/Rajasthan-Handloom-Multicolour-Mattress-Rectangle/dp/B08M47RHHZ/ref=sr_1_54?dchild=1&keywords=mattress&qid=1626789096&sr=8-54
Coir on® Slim Foldable Travel Mattress- 72X48X1- inch (Maroon)  ,,,,"₹2,200","₹1,849",Save ₹351 (16%),4.1 out of 5 stars,253,https://www.amazon.in/Coiron-Foldable-Travel-Mattress-72X48-inch/dp/B07ZFVWZXD/ref=sr_1_55?dchild=1&keywords=mattress&qid=1626789096&sr=8-55
"ATOOTFUSION Cotton Single Bed Folding Pure EPE Foam 3 Fold Mattress for Travel, Picnic (Mattresses 2 inch Single Bed, Multicolour, 72x35x2)  ",,,,"₹2,998",₹798,"Save ₹2,200 (73%)",3.6 out of 5 stars,162,https://www.amazon.in/Atootfusion-EPE-Foam-Mattress-Fold/dp/B08QJQGBXP/ref=sr_1_56?dchild=1&keywords=mattress&qid=1626789096&sr=8-56
"Morofeel Soft Cotton Multicolour Mattress/Gadda (6x6) Double Bed, Pink Multicolor  ",,,,"₹2,399","₹1,199","Save ₹1,200 (50%)",3.5 out of 5 stars,229,https://www.amazon.in/Morofeel-Cotton-Multicolour-Mattress-Multicolor/dp/B08G83L4S9/ref=sr_1_57?dchild=1&keywords=mattress&qid=1626789096&sr=8-57
Sleepwell Starlite Splendor Medium Firm Foam Mattress (72x36x5)  ,,,,"₹5,666","₹5,193",Save ₹473 (8%),4.2 out of 5 stars,449,https://www.amazon.in/Sleepwell-Starlite-Splendor-Mattress-72x36x5/dp/B07SMJYG9X/ref=sr_1_58?dchild=1&keywords=mattress&qid=1626789096&sr=8-58
"Zone8: 9"" Pocketed Spring Mattress| India's First Rolled Spring Mattress  ",,Sponsored,,"₹12,297","₹7,686","Save ₹4,611 (37%)",4.8 out of 5 stars,6,https://www.amazon.in/gp/slredirect/picassoRedirect.html/ref=pa_sp_mtf_aps_sr_pg2_1?ie=UTF8&adId=A0724542KO3K1NO45RDW&url=%2FZone8-Pocketed-Spring-Mattress-Indias%2Fdp%2FB084H9PLDD%2Fref%3Dsr_1_59_sspa%3Fdchild%3D1%26keywords%3Dmattress%26qid%3D1626789096%26sr%3D8-59-spons%26psc%3D1&qualifier=1626789096&id=1968730816335002&widgetName=sp_mtf
"Sleep Ayurveda Reversible Orthopaedic Gel Memory Foam Mattress | Infused with Neem (Single, 72x30x4)  ",Limited time deal,Sponsored,,"₹8,461","₹5,077","Save ₹3,384 (40%)",,,https://www.amazon.in/gp/slredirect/picassoRedirect.html/ref=pa_sp_mtf_aps_sr_pg2_1?ie=UTF8&adId=A0344086UVO65DSSRC9Z&url=%2FSleep-Ayurveda-Reversible-Orthopaedic-Mattress%2Fdp%2FB095M8DSKX%2Fref%3Dsr_1_60_sspa%3Fdchild%3D1%26keywords%3Dmattress%26qid%3D1626789096%26smid%3DA3R2NDQMUR5HBO%26sr%3D8-60-spons%26psc%3D1&qualifier=1626789096&id=1968730816335002&widgetName=sp_mtf
The Sleep Company SmartGRID Medium Firm Orthopedic 6 inch Queen Size Bed Mattress (75x60x6 inch)  ,,Sponsored,,"₹27,900","₹20,925","Save ₹6,975 (25%)",4.5 out of 5 stars,320,https://www.amazon.in/gp/slredirect/picassoRedirect.html/ref=pa_sp_mtf_aps_sr_pg2_1?ie=UTF8&adId=A07796742HFUQBWPNYU28&url=%2FSleep-Company-Smart-75x60x6-Mattress%2Fdp%2FB07QC3RQ92%2Fref%3Dsr_1_61_sspa%3Fdchild%3D1%26keywords%3Dmattress%26qid%3D1626789096%26sr%3D8-61-spons%26psc%3D1&qualifier=1626789096&id=1968730816335002&widgetName=sp_mtf
SleepX Ortho Memory Foam - Single Bed Size Mattress - (72*36*6 inches)  ,Limited time deal,Sponsored,,"₹9,800","₹7,450","Save ₹2,350 (24%)",4.2 out of 5 stars,"2,200",https://www.amazon.in/gp/slredirect/picassoRedirect.html/ref=pa_sp_mtf_aps_sr_pg2_1?ie=UTF8&adId=A02675093PNXQW9J5JFSR&url=%2FSleepX-Presented-Sleepwell-Ortho-mattress%2Fdp%2FB07RSFC7CG%2Fref%3Dsr_1_62_sspa%3Fdchild%3D1%26keywords%3Dmattress%26qid%3D1626789096%26sr%3D8-62-spons%26psc%3D1&qualifier=1626789096&id=1968730816335002&widgetName=sp_mtf
Coirfit 1-inch Medium Double Size Mattress (72X48X1_Foam)  ,,,,"₹2,915","₹1,749","Save ₹1,166 (40%)",3.2 out of 5 stars,70,https://www.amazon.in/INNOMAT-Packed-Double-Mattress-72X48X1/dp/B083QP8CNM/ref=sr_1_63?dchild=1&keywords=mattress&qid=1626789096&sr=8-63
"ATOOTFUSION Pure EPE Foam 2 inch Single Bed 4 Fold Mattress for Travel, Picnic (72x35x2)  ",,,,"₹2,499",₹898,"Save ₹1,601 (64%)",3.7 out of 5 stars,193,https://www.amazon.in/ATOOTFUSION-Folding-Mattress-72x35x2-Multicolor/dp/B08HX3ZPB8/ref=sr_1_64?dchild=1&keywords=mattress&qid=1626789096&sr=8-64
"Duroflex LiveIn - Pressure Relieving, Memory Foam, Roll Pack, 6 Inch Queen Size Medium Firm Mattress with Superior Comfort and Anti Microbial Fabric (78 X 60 X 6 Inches)  ",Limited time deal,,,"₹17,999","₹12,599","Save ₹5,400 (30%)",4.3 out of 5 stars,"1,557",https://www.amazon.in/Duroflex-Livein-Microbial-Fabric-Mattress/dp/B0892SXBV3/ref=sr_1_65?dchild=1&keywords=mattress&qid=1626789096&sr=8-65
"COLOFLY Soft Cotton Multicolour Gadda Double Bed Dual Comfort Mattress, Pink , 6x6 Feet  ",,,,"₹2,399","₹1,299","Save ₹1,100 (46%)",3.6 out of 5 stars,163,https://www.amazon.in/COLOFLY-Cotton-Multicolour-Comfort-Mattress/dp/B08SPYD6Z2/ref=sr_1_66?dchild=1&keywords=mattress&qid=1626789096&sr=8-66
Anand Textile Comfy 4-inch with Pillow Medium Firm Single Size Cotton Mattress (72x36x4_Swiss Cotton)  ,,,,"₹2,999","₹1,149","Save ₹1,850 (62%)",3.2 out of 5 stars,11,https://www.amazon.in/Anand-Textile-4-inch-Mattress-72x36x4_Swiss/dp/B09644JTTK/ref=sr_1_67?dchild=1&keywords=mattress&qid=1626789096&sr=8-67
Padam Shree EPE Foam Mattresses 4 inch Single Bed 4 Fold (EPE Mattress Cum Foldable)(72x35x4 inch)  ,,,,"₹2,999","₹1,299","Save ₹1,700 (57%)",3.1 out of 5 stars,9,https://www.amazon.in/Padam-Shree-Mattresses-Mattress-Foldable/dp/B08W9WQJJP/ref=sr_1_68?dchild=1&keywords=mattress&qid=1626789096&sr=8-68
"Dr Smith Orthopaedic Back Pain Relief Memory Foam Mattress, King Bed Size (78x72x6)  ",,,,"₹18,999","₹6,573","Save ₹12,426 (65%)",,,https://www.amazon.in/Orthopaedic-Relief-Memory-Mattress-78x72x6/dp/B085B3726Q/ref=sr_1_69?dchild=1&keywords=mattress&qid=1626789096&sr=8-69
"Padam Shree Single Bed 4 Folding Pure EPE Foam Extremely EPE Mattress for Travel, Picnic (Mattresses 2 inch Single Bed) (4-Fold 72x35x2)  ",,,,"₹2,800",₹799,"Save ₹2,001 (71%)",3.2 out of 5 stars,22,https://www.amazon.in/Padam-Shree-Extremely-Mattress-Mattresses/dp/B08NX8FVF1/ref=sr_1_70?dchild=1&keywords=mattress&qid=1626789096&sr=8-70
"Padam Shree Single Bed Folding Pure EPE Foam Mattress for Travel, Picnic (Mattresses 2 inch Single Bed)(72x35x2) - 4 FOLD Mattress  ",,,,"₹1,999",₹799,"Save ₹1,200 (60%)",5.0 out of 5 stars,1,https://www.amazon.in/Padam-Shree-Folding-Mattress-Mattresses/dp/B08P7JXBC2/ref=sr_1_71?dchild=1&keywords=mattress&qid=1626789096&sr=8-71
ATOOTFUSION Primium Qulaity Black Hosiery Soft Cotton Multicolour Mattress | Cotton Gadda Box Pattern 4ft x 6ft (48 Inch X 72 Inch) Box Mattress with Pillow ((4 x 6 Box Mattress with Fiber Pillow))  ,,,,"₹5,998","₹1,298","Save ₹4,700 (78%)",3.8 out of 5 stars,79,https://www.amazon.in/ATOOTFUSION-Primium-Qulaity-Multicolour-Mattress/dp/B08DXDZK9L/ref=sr_1_72?dchild=1&keywords=mattress&qid=1626789096&sr=8-72
"Springtek Folding Soft Foam Mattress (4-inch, Single Size)  ",,,,"₹4,999","₹4,499",Save ₹500 (10%),4.4 out of 5 stars,831,https://www.amazon.in/Springtek-Folding-4-inch-Single-Mattress/dp/B07XJWZLLW/ref=sr_1_73?dchild=1&keywords=mattress&qid=1626789096&sr=8-73
"MOROFEEL 3 Inch 4 Fold Dual Comfort Reversible Foldable EPE Foam Single Bed Mattress, Blue Multicolor  ",,,,"₹2,999","₹1,499","Save ₹1,500 (50%)",4.0 out of 5 stars,1,https://www.amazon.in/MOROFEEL-Reversible-Foldable-Mattress-Multicolor/dp/B08RZ47SKC/ref=sr_1_74?dchild=1&keywords=mattress&qid=1626789096&sr=8-74
Soft Single Size Cotton Mattress (72X36X6_Cotton)  ,,,,"₹1,999",₹699,"Save ₹1,300 (65%)",3.8 out of 5 stars,11,https://www.amazon.in/Soft-Single-Cotton-Mattress-72X36X6_Cotton/dp/B08XJZY1WZ/ref=sr_1_75?dchild=1&keywords=mattress&qid=1626789096&sr=8-75
- Anand Textile Comfy 5-inch Medium Firm Single Size Cotton Mattress (72x48x4_Swiss Cotton)  ,,,,"₹4,999","₹1,999","Save ₹3,000 (60%)",5.0 out of 5 stars,2,https://www.amazon.in/Anand-Textile-5-inch-Mattress-72x48x4_Swiss/dp/B095WS622F/ref=sr_1_76?dchild=1&keywords=mattress&qid=1626789096&sr=8-76
"AnuAshi 4x6 Pure White Natural Cotton Filled Mattress (48x72x3-inch, Medium, Multicolour )  ",,,,"₹2,500",₹699,"Save ₹1,801 (72%)",3.2 out of 5 stars,37,https://www.amazon.in/AnuAshi-Natural-Mattress-48x72x3-inch-Multicolour/dp/B092CSK8DV/ref=sr_1_77?dchild=1&keywords=mattress&qid=1626789096&sr=8-77
"Sleepyhead Original - 3 Layered Medium Firm Orthopedic Memory Foam Mattress, 78x60x6 inches (Queen Size)  ",,,,"₹15,999","₹11,999","Save ₹4,000 (25%)",4.5 out of 5 stars,"10,364",https://www.amazon.in/Sleepyhead-6-inch-Memory-Mattress-78x60x6/dp/B077XC36BH/ref=sr_1_78?dchild=1&keywords=mattress&qid=1626789096&sr=8-78
MOROFEEL Soft Cotton Multicolour Dual Comfort Mattress Gadda Single Bed 3x6 Feet Dark Blue  ,,,,"₹1,299",₹749,Save ₹550 (42%),3.7 out of 5 stars,47,https://www.amazon.in/MOROFEEL-Cotton-Multicolour-Comfort-Mattress/dp/B08SQ64YNQ/ref=sr_1_79?dchild=1&keywords=mattress&qid=1626789096&sr=8-79
