name,badge_1,badge_2,badge_3,mrp,discounted_price,discount,rating,rating_count,link
"Duroflex LiveIn - Pressure Relieving, Memory Foam, Roll Pack, 6 Inch Queen Size Medium Firm Mattress with Superior Comfort and Anti Microbial Fabric (78 X 60 X 6 Inches)  ",Limited time deal,Sponsored,,"₹17,999","₹12,599","Save ₹5,400 (30%)",4.3 out of 5 stars,"1,557",https://www.amazon.in/gp/slredirect/picassoRedirect.html/ref=pa_sp_atf_aps_sr_pg1_1?ie=UTF8&adId=A05955833OE61LLP4SG4A&url=%2FDuroflex-Livein-Microbial-Fabric-Mattress%2Fdp%2FB0892SXBV3%2Fref%3Dsr_1_1_sspa%3Fdchild%3D1%26keywords%3Dmattress%26qid%3D1626789078%26sr%3D8-1-spons%26psc%3D1&qualifier=1626789078&id=6383734900875750&widgetName=sp_atf
"Duroflex Back Magic - Doctor Recommended Orthopaedic High Density Coir, 5 Inch Double Size Firm Mattress for Back Support and Posture Alignment (72 X 48 X 5 Inches)  ",,Sponsored,,"₹14,919","₹12,979","Save ₹1,940 (13%)",4.3 out of 5 stars,999,https://www.amazon.in/gp/slredirect/picassoRedirect.html/ref=pa_sp_atf_aps_sr_pg1_1?ie=UTF8&adId=A059490324XFHKAHWU8L2&url=%2FDuroflex-Back-Magic-Orthopedic-Certified%2Fdp%2FB07QFDWWGJ%2Fref%3Dsr_1_2_sspa%3Fdchild%3D1%26keywords%3Dmattress%26qid%3D1626789078%26sr%3D8-2-spons%26psc%3D1&qualifier=1626789078&id=6383734900875750&widgetName=sp_atf
Duroflex Durobond NXT Double Size Double Sided High Density Coir Mattress (75 * 48 * 5 Inches)  ,,Sponsored,,"₹12,688","₹11,419","Save ₹1,269 (10%)",4.1 out of 5 stars,202,https://www.amazon.in/gp/slredirect/picassoRedirect.html/ref=pa_sp_atf_aps_sr_pg1_1?ie=UTF8&adId=A06182433QFUAW37RD659&url=%2FDuroflex-Durobond-NXT-Density-Mattress%2Fdp%2FB081RHY67F%2Fref%3Dsr_1_3_sspa%3Fdchild%3D1%26keywords%3Dmattress%26qid%3D1626789078%26sr%3D8-3-spons%26psc%3D1&qualifier=1626789078&id=6383734900875750&widgetName=sp_atf
"SleepX Dual Comfort Mattress - Medium Soft and Hard - Queen Bed Size (Orange, 72*36*5)  ",Limited time deal,Sponsored,,"₹6,500","₹5,469","Save ₹1,031 (16%)",4.3 out of 5 stars,"4,124",https://www.amazon.in/gp/slredirect/picassoRedirect.html/ref=pa_sp_atf_aps_sr_pg1_1?ie=UTF8&adId=A01466952VUI7P85BXS2B&url=%2FSleepX-Presented-Sleepwell-Dual-mattress%2Fdp%2FB07RVLYB6M%2Fref%3Dsr_1_4_sspa%3Fdchild%3D1%26keywords%3Dmattress%26qid%3D1626789078%26sr%3D8-4-spons%26psc%3D1&qualifier=1626789078&id=6383734900875750&widgetName=sp_atf
Sleepwell Starlite Discover 4-inch Firm Single Size Foam Mattress (72*36*4 Inches)  ,,,,"₹3,357","₹3,189",Save ₹168 (5%),4.0 out of 5 stars,"3,868",https://www.amazon.in/Sleepwell-Starlite-Discover-Mattress-72x36x4/dp/B07SLDL15B/ref=sr_1_5?dchild=1&keywords=mattress&qid=1626789078&sr=8-5
"SleepX Dual Comfort Mattress - Medium Soft & Hard - Queen Bed Size (Orange, 78x60x5)  ",Limited time deal,,,"₹13,540","₹8,149","Save ₹5,391 (40%)",4.3 out of 5 stars,"4,124",https://www.amazon.in/SleepX-Presented-Sleepwell-Dual-mattress/dp/B07RRCFH9Q/ref=sr_1_6?dchild=1&keywords=mattress&qid=1626789078&sr=8-6
"Wakewell Cotton Single Bed, Foldable, Light Weight Mattress Soft Medium Gadda (Multicolour, 1 Sleeping Capacity, 3 x 6 ft or 72 x 36 Inch)  ",,,,"₹1,599",₹546,"Save ₹1,053 (66%)",3.6 out of 5 stars,400,https://www.amazon.in/Wakewell-Cotton-Foldable-Mattress-Multicolour/dp/B0918Y7WSN/ref=sr_1_7?dchild=1&keywords=mattress&qid=1626789078&sr=8-7
"SUGANDHA Large Soft Cotton Single Mattress with 2 Sleeping Capacity (72X48X4-Inch, Multicolour)  ",,,,₹799,₹599,Save ₹200 (25%),3.7 out of 5 stars,"1,465",https://www.amazon.in/SUGANDHA-Multicolour-Mattress-Sleeping-_72X48X4-Inch/dp/B07YZ7WYDG/ref=sr_1_8?dchild=1&keywords=mattress&qid=1626789078&sr=8-8
AnuAshi (3x6) Soft Cotton Tuffed Multicolor Heavy Mattress/gadda 72x36x5  ,,,,"₹2,500",₹895,"Save ₹1,605 (64%)",3.9 out of 5 stars,10,https://www.amazon.in/AnuAshi-Cotton-Multicolor-Mattress-72x36x5/dp/B0968M6QKC/ref=sr_1_9?dchild=1&keywords=mattress&qid=1626789078&sr=8-9
Padam Shree Soft Foldable EPE Foam 4 Fold 2 inch Single Bed Mattress (72x35x2 inch)  ,,,,"₹3,100",₹799,"Save ₹2,301 (74%)",3.6 out of 5 stars,105,https://www.amazon.in/Padam-Shree-Foldable-Mattress-72x35x2/dp/B08JCZT6FF/ref=sr_1_10?dchild=1&keywords=mattress&qid=1626789078&sr=8-10
"SUGANDHA 2 inch Single Bed Folding Pure EPE Foam Mattress for Travel, Picnic (72X35X2, Medium)  ",,,,"₹1,499",₹830,Save ₹669 (45%),3.5 out of 5 stars,100,https://www.amazon.in/SUGANDHA-Single-Folding-Mattress-72X35X2/dp/B08VRCRRQY/ref=sr_1_11?dchild=1&keywords=mattress&qid=1626789078&sr=8-11
"AnuAshi Box Soft Cotton Filled Cheque Style Mattress for Good Sleeping Experience (Multicolour , 6x3 ft )  ",,,,"₹3,000",₹889,"Save ₹2,111 (70%)",3.5 out of 5 stars,111,https://www.amazon.in/AnuAshi-Mattress-Sleeping-Experience-Multicolour/dp/B08YXMM9YP/ref=sr_1_12?dchild=1&keywords=mattress&qid=1626789078&sr=8-12
"Padam Shree Extremely Soft Cum Foldable Pure 2 Inch Single PU Foam Orthopaedic Mattress (Medium, Multicolour, 72x35x2)  ",,,,"₹2,999","₹1,099","Save ₹1,900 (63%)",2.6 out of 5 stars,34,https://www.amazon.in/Padam-Shree-Extremely-Orthopaedic-Multicolour/dp/B08P7MWYYQ/ref=sr_1_13?dchild=1&keywords=mattress&qid=1626789078&sr=8-13
"ATOOTFUSION Soft Cotton Foldable Light Weight Filled Single Firm Mattress| Gadda (Multicoloured, 1 Sleeping Capacity, 3 x 6 ft or 72 x 36 Inches)  ",,,,"₹1,998",₹598,"Save ₹1,400 (70%)",3.8 out of 5 stars,"1,177",https://www.amazon.in/ATOOTFUSION-Multicolour-Mattress-Sleeping-Capacity/dp/B084T34SN9/ref=sr_1_14?dchild=1&keywords=mattress&qid=1626789078&sr=8-14
"BROWNIE Pure EPE Foam Single Bed Folding Medium Mattress for Travel, Picnic (Multicolor, 72x35x2)  ",,,,"₹1,599",₹750,Save ₹849 (53%),3.5 out of 5 stars,3,https://www.amazon.in/BROWNIE-Folding-Mattress-Multicolor-72x35x2/dp/B096VK6MDJ/ref=sr_1_15?dchild=1&keywords=mattress&qid=1626789078&sr=8-15
Padam Shree Epe Foam 3 Folding Mattress (6x3)(Multi)  ,,,,"₹3,200",₹749,"Save ₹2,451 (77%)",3.6 out of 5 stars,5,https://www.amazon.in/Padam-Shree-Folding-Mattress-Multi/dp/B097FC365H/ref=sr_1_16?dchild=1&keywords=mattress&qid=1626789078&sr=8-16
"Padam Shree Soft Cotton Filled Mattress Gadda (1 Sleeping Capacity - 3 x 6 ft or 72 x 36 Inch), Multi Colour Available  ",,,,"₹1,150",₹499,Save ₹651 (57%),2.9 out of 5 stars,7,https://www.amazon.in/Padam-Shree-Mattress-Sleeping-Capacity/dp/B096QHC55K/ref=sr_1_17?dchild=1&keywords=mattress&qid=1626789078&sr=8-17
"PumPum Cotton Single Bed, Foldable, Light Weight Mattress Soft Medium Gadda (Multicolour, 1 Sleeping Capacity, 3 x 6 ft or 72 x 36 Inch)  ",,,Only 2 left in stock.,₹999,₹499,Save ₹500 (50%),,,https://www.amazon.in/Cotton-Single-Bed-Mattress-Multicolour/dp/B0995VMC3T/ref=sr_1_18?dchild=1&keywords=mattress&qid=1626789078&sr=8-18
"Yesh Zone Single Bed Folding Pure EPE Foam 4 Folding Medium Mattress for Travel, Picnic  ",,,,"₹1,999",₹799,"Save ₹1,200 (60%)",5.0 out of 5 stars,2,https://www.amazon.in/Single-Folding-Medium-Mattress-Travel/dp/B097M9R8T5/ref=sr_1_19?dchild=1&keywords=mattress&qid=1626789078&sr=8-19
Padam Shree 2 Inch Dual Comfort Reversible Foldable EPE Foam Single 4 Fold Bed Mattress (72 x 35 x 2 Inch)  ,,,,"₹3,100",₹749,"Save ₹2,351 (76%)",5.0 out of 5 stars,1,https://www.amazon.in/Padam-Shree-Reversible-Foldable-Mattress/dp/B097L7763X/ref=sr_1_20?dchild=1&keywords=mattress&qid=1626789078&sr=8-20
AMORE Medico 6 Inch Eurotop Bonnell Spring & HR Foam King Size Mattress (72x72x6 Inch)  ,Limited time deal,Sponsored,,"₹26,549","₹12,611","Save ₹13,938 (52%)",4.3 out of 5 stars,994,https://www.amazon.in/gp/slredirect/picassoRedirect.html/ref=pa_sp_mtf_aps_sr_pg1_1?ie=UTF8&adId=A063900518QN7DX6B6JKA&url=%2FInternational-Eurotop-Bonnell-Mattress-72x72x6%2Fdp%2FB07VMSPRCF%2Fref%3Dsr_1_21_sspa%3Fdchild%3D1%26keywords%3Dmattress%26qid%3D1626789078%26smid%3DA2IAXX6JU4LOXT%26sr%3D8-21-spons%26psc%3D1&qualifier=1626789078&id=6383734900875750&widgetName=sp_mtf
Livpure Smart Vital 5'' Reversible Dual Comfort Foam Mattress Twin Size (72x48x5 Inches)  ,,Sponsored,,"₹9,799","₹5,829","Save ₹3,970 (41%)",4.4 out of 5 stars,3,https://www.amazon.in/gp/slredirect/picassoRedirect.html/ref=pa_sp_mtf_aps_sr_pg1_1?ie=UTF8&adId=A0815193GIG3IXU0OERK&url=%2FLivpure-Reversible-Comfort-Mattress-72x48x5%2Fdp%2FB08HK4TYM1%2Fref%3Dsr_1_22_sspa%3Fdchild%3D1%26keywords%3Dmattress%26qid%3D1626789078%26sr%3D8-22-spons%26psc%3D1&qualifier=1626789078&id=6383734900875750&widgetName=sp_mtf
"Spinecure Dual Feel - Firm and Medium Soft Mattress, 72 X 48 X 5 inches (Double Size, Blue)  ",,Sponsored,,"₹8,927","₹6,849","Save ₹2,078 (23%)",4.3 out of 5 stars,35,https://www.amazon.in/gp/slredirect/picassoRedirect.html/ref=pa_sp_mtf_aps_sr_pg1_1?ie=UTF8&adId=A08772773TIXROETKYUJF&url=%2FSpinecure-Dual-Feel-Medium-Mattress%2Fdp%2FB08P7FRJMW%2Fref%3Dsr_1_23_sspa%3Fdchild%3D1%26keywords%3Dmattress%26qid%3D1626789078%26sr%3D8-23-spons%26psc%3D1&qualifier=1626789078&id=6383734900875750&widgetName=sp_mtf
STRAIGHT8 Comfort Foam Single Size Mattress (84 x 36 x 6 inches) 7 Years Warranty  ,,Sponsored,,"₹9,289","₹8,018","Save ₹1,271 (14%)",,,https://www.amazon.in/gp/slredirect/picassoRedirect.html/ref=pa_sp_mtf_aps_sr_pg1_1?ie=UTF8&adId=A00476041O83IUBMIW713&url=%2FSTRAIGHT8-Comfort-Single-Mattress-Warranty%2Fdp%2FB09271XGS2%2Fref%3Dsr_1_24_sspa%3Fdchild%3D1%26keywords%3Dmattress%26qid%3D1626789078%26sr%3D8-24-spons%26psc%3D1&qualifier=1626789078&id=6383734900875750&widgetName=sp_mtf
Springtek Amaze Eco 4 inch Single Bed High Density (HD) Foam Mattress (72x36x4 inches)  ,,,,"₹3,999","₹2,999","Save ₹1,000 (25%)",4.3 out of 5 stars,520,https://www.amazon.in/Springtek-Amaze-Eco-Density-Mattress/dp/B08427XSCY/ref=sr_1_25?dchild=1&keywords=mattress&qid=1626789078&sr=8-25
"SUGANDHA Large Soft Cotton Single Mattress, 1 Sleeping Capacity (Multicolour, 72X36X4-Inch)  ",,,,₹799,₹480,Save ₹319 (40%),3.4 out of 5 stars,516,https://www.amazon.in/Sugandha-Multicolour-Mattress-Sleeping-_72X36X4-Inch/dp/B07TQMP3X6/ref=sr_1_26?dchild=1&keywords=mattress&qid=1626789078&sr=8-26
"winifred 2 Inch Dual Comfort Reversible Foldable EPE Foam Single 3 Fold Bed Mattress (Medium, 72 x 35 x 2 Inch)  ",,,,"₹3,100",₹799,"Save ₹2,301 (74%)",3.7 out of 5 stars,35,https://www.amazon.in/winifred-Comfort-Reversible-Foldable-Mattress/dp/B08ZJRWD69/ref=sr_1_27?dchild=1&keywords=mattress&qid=1626789078&sr=8-27
"Padam Shree Pure Soft Cotton and PU Foam 2 inch Foldable Single Mattress , 72x35x2 inch  ",,,,"₹3,200","₹1,099","Save ₹2,101 (66%)",3.5 out of 5 stars,213,https://www.amazon.in/Padam-Shree-Mattresses-Mattress-Extremely/dp/B08JKPQC34/ref=sr_1_28?dchild=1&keywords=mattress&qid=1626789078&sr=8-28
"Ponperi Soft Cotton Box Rectangle Type Mattress/Gadda (Multicolor, 3 X 6ft or 72 X 36 Inch)  ",,,,"₹2,500",₹875,"Save ₹1,625 (65%)",3.6 out of 5 stars,"1,169",https://www.amazon.in/Ponperi-Cotton-Multicolour-Mattress-Rectangle/dp/B084MFR4RS/ref=sr_1_29?dchild=1&keywords=mattress&qid=1626789078&sr=8-29
Wakefit Orthopedic Memory Foam 8-inch Queen Mattress (78x60x8 inches)  ,Best seller,,,"₹16,283","₹13,027","Save ₹3,256 (20%)",4.6 out of 5 stars,"24,941",https://www.amazon.in/gp/bestsellers/kitchen/5689374031/ref=sr_bs_29_5689374031_1
Rajasthan Handloom Primium Quality Soft Cotton Multicolour Queen Gadda (Box Rectangle Type 4 x 6 ft OR 72 x 48 inch)-8kg  ,,,,"₹3,000","₹1,095","Save ₹1,905 (64%)",3.9 out of 5 stars,37,https://www.amazon.in/Rajasthan-Handloom-Primium-Multicolour-Rectangle/dp/B091J79B1G/ref=sr_1_31?dchild=1&keywords=mattress&qid=1626789078&sr=8-31
Padam Shree Pure Pu Foam Mattresses 2 inch Single PU Foam Mattress (Feel Extremely Soft Cum Foldable)(72x48x2 inch)  ,,,,"₹3,500","₹1,399","Save ₹2,101 (60%)",4.0 out of 5 stars,2,https://www.amazon.in/Padam-Shree-Foam-Mattresses-inch/dp/B08W4JY4M3/ref=sr_1_32?dchild=1&keywords=mattress&qid=1626789078&sr=8-32
"SUGANDHA 2 inch Single Folding Pure EPE Foam Mattress Bed for Travel, Picnic (Medium, 72X35X2)  ",,,,"₹1,499",₹830,Save ₹669 (45%),3.6 out of 5 stars,174,https://www.amazon.in/Sugandha-Single-Folding-Mattress-Mattresses/dp/B082VXKBPL/ref=sr_1_33?dchild=1&keywords=mattress&qid=1626789078&sr=8-33
"winifred 2 Inch Dual Comfort Reversible Foldable EPE Foam Single 4 Fold Bed Mattress (Medium, 72 x 35 x 2 Inch 2 inch)  ",,,,"₹3,100",₹819,"Save ₹2,281 (74%)",4.2 out of 5 stars,11,https://www.amazon.in/winifred-Comfort-Reversible-Foldable-Mattress/dp/B08ZJR6PXP/ref=sr_1_34?dchild=1&keywords=mattress&qid=1626789078&sr=8-34
"CHILLI BILLI Extra Soft Single Bed Folding Pure EPE Foam Mattress 3 Fold Mattress for Travel, Picnic (Mattresses 2 inch, Multicolor, 72x35x2)  ",,,,"₹2,750",₹799,"Save ₹1,951 (71%)",3.0 out of 5 stars,2,https://www.amazon.in/CHILLI-BILLI-Mattress-Mattresses-Multicolor/dp/B08X7L7LNL/ref=sr_1_35?dchild=1&keywords=mattress&qid=1626789078&sr=8-35
Anand Textile Comfy 4-inch Medium Firm Single Size Cotton Mattress (72x36x4_Swiss Cotton)  ,,,,"₹2,999",₹949,"Save ₹2,050 (68%)",3.5 out of 5 stars,18,https://www.amazon.in/Anand-Textile-4-inch-Mattress-72x36x4_Swiss/dp/B095WV1LL7/ref=sr_1_36?dchild=1&keywords=mattress&qid=1626789078&sr=8-36
Wakefit Dual Comfort 6-inch Diwan Size Mattress (72x48x6 inches)  ,,,,"₹8,522","₹6,818","Save ₹1,704 (20%)",4.5 out of 5 stars,"13,031",https://www.amazon.in/Wakefit-Dual-Comfort-Mattress-6inch/dp/B00RACACNG/ref=sr_1_37?dchild=1&keywords=mattress&qid=1626789078&sr=8-37
"PumPum Single Bed Multicolor Super Soft Cotton Mattress (72 * 36 * 3 Inch, Multicolor)  ",,,Only 1 left in stock.,"₹1,299",₹499,Save ₹800 (62%),3.2 out of 5 stars,15,https://www.amazon.in/PumPum-Single-Multicolor-Cotton-Mattress/dp/B08XXWC5P2/ref=sr_1_38?dchild=1&keywords=mattress&qid=1626789078&sr=8-38
"Rajasthan Handloom Large 2-Sleeping Capacity- Soft Cotton Mattress (Multicolour , 72 X 48 X 4)  ",,,,₹999,₹690,Save ₹309 (31%),3.7 out of 5 stars,82,https://www.amazon.in/Rajasthan-Handloom-Multicolour-2-Sleeping-Capacity-72/dp/B08GNCNQ5B/ref=sr_1_39?dchild=1&keywords=mattress&qid=1626789078&sr=8-39
"Nilkamal Soft One Inch Foam Mattresses for Room, Balcony, Playard, Picnic or Any Other Activity, (Maroon, 72 X 36 X 1 Inch)  ",,,,"₹1,590","₹1,490",Save ₹100 (6%),4.1 out of 5 stars,403,https://www.amazon.in/Nilkamal-Mattresses-Balcony-Playard-Activity/dp/B089Y8KGYQ/ref=sr_1_40?dchild=1&keywords=mattress&qid=1626789078&sr=8-40
Easy Shopping Soft Cotton Filled Multicolour Mattress Gadda (1 Sleeping Capacity - 4 x 6 ft or 72 x 42 Inch)  ,,,,"₹1,998",₹650,"Save ₹1,348 (67%)",5.0 out of 5 stars,1,https://www.amazon.in/Shopping-Multicolour-Mattress-Sleeping-Capacity/dp/B0974L7LV2/ref=sr_1_41?dchild=1&keywords=mattress&qid=1626789078&sr=8-41
Padam Shree Epe Foam 4 Folding Mattress (6x3)(Multi)  ,,,,"₹3,200",₹749,"Save ₹2,451 (77%)",4.0 out of 5 stars,1,https://www.amazon.in/Padam-Shree-Folding-Mattress-Multi/dp/B097F9253V/ref=sr_1_42?dchild=1&keywords=mattress&qid=1626789078&sr=8-42
ATOOTFUSION Deewan Size Large Soft Cotton Foldable Movable Mattress (2 Sleeping Capacity)_72X48-Inch-MultiColor  ,,,,"₹2,998",₹698,"Save ₹2,300 (77%)",3.7 out of 5 stars,470,https://www.amazon.in/Mattress-Sleeping-Capacity-_72X48-Inch-MultiColor-Atootfusion/dp/B07XX33WJ2/ref=sr_1_43?dchild=1&keywords=mattress&qid=1626789078&sr=8-43
"Padam Shree 2 Inches 4 Folding Pure EPE Foam Extra Soft Single Bed Mattress (Multicolour, Medium/6x3ft)  ",,,,"₹3,100",₹789,"Save ₹2,311 (75%)",,,https://www.amazon.in/Padam-Shree-Folding-Mattress-Multicolour/dp/B097L6ZQQV/ref=sr_1_44?dchild=1&keywords=mattress&qid=1626789078&sr=8-44
"duroflex Flexi - Double Sided Usage Multi-Purpose Travel Friendly, Outdoor Camping, Lightweight, Single Size Soft Foam Slim Mattress (78 X 36 X 1 Inches)  ",,,,"₹2,530","₹2,149",Save ₹381 (15%),4.4 out of 5 stars,99,https://www.amazon.in/Duroflex-Double-Multi-Purpose-Friendly-Mattress/dp/B08F7TQJ4X/ref=sr_1_45?dchild=1&keywords=mattress&qid=1626789078&sr=8-45
Rajasthan Handloom Premium Quality Soft Cotton Multicolour Mattress | Cotton Gadda (Box Rectangle Type 3 x 6 ft OR 72 x 36 inch)-6kg  ,,,,"₹2,500",₹955,"Save ₹1,545 (62%)",4.4 out of 5 stars,11,https://www.amazon.in/Rajasthan-Handloom-Multicolour-Mattress-Rectangle/dp/B091J5JPBS/ref=sr_1_46?dchild=1&keywords=mattress&qid=1626789078&sr=8-46
Padam Shree 2 Inch Dual Comfort Reversible Foldable EPE Foam Single Bed Mattress 3 Fold Blue & Black  ,,,,"₹1,499",₹799,Save ₹700 (47%),,,https://www.amazon.in/Padam-Shree-Reversible-Foldable-Mattress/dp/B097L6DQWX/ref=sr_1_47?dchild=1&keywords=mattress&qid=1626789078&sr=8-47
"winifred 2 Inches 4 Folding Pure EPE Foam Extra Soft Single Bed Mattress (Multicolour, Medium/6x3ft)  ",,,,"₹3,100",₹799,"Save ₹2,301 (74%)",3.5 out of 5 stars,55,https://www.amazon.in/winifred-Inches-Folding-Mattress-Multicolour/dp/B08ZC7V6MH/ref=sr_1_48?dchild=1&keywords=mattress&qid=1626789078&sr=8-48
"Padam Shree 4 Inch Dual Comfort Reversible Foldable EPE Foam Single Bed Mattress for Travel, Picnic 3x6 (Premium Brown)  ",,,,"₹4,999","₹1,939","Save ₹3,060 (61%)",3.0 out of 5 stars,10,https://www.amazon.in/Padam-Shree-Reversible-Foldable-Mattress/dp/B0966XMGXZ/ref=sr_1_49?dchild=1&keywords=mattress&qid=1626789078&sr=8-49
BROWNIE Cotton Medium Firm Single 3 Fold Mattress (72x35x2)  ,,,,"₹1,499",₹799,Save ₹700 (47%),3.7 out of 5 stars,206,https://www.amazon.in/BROWNIE-Cotton-Folding-Mattress-72x35x2/dp/B08L61YJ23/ref=sr_1_50?dchild=1&keywords=mattress&qid=1626789078&sr=8-50
"CHILLI BILLI Single Bed Folding EPE Foam Mattress 3 Fold Mattress for Travel, Picnic (Mattresses 2 inch Single Bed) Multicolor ((Single Bed)(72x35x2)) - 3 FOLD  ",,,,"₹2,750",₹799,"Save ₹1,951 (71%)",3.5 out of 5 stars,3,https://www.amazon.in/CHILLI-BILLI-Mattress-Mattresses-Multicolor/dp/B08X8GSXSP/ref=sr_1_51?dchild=1&keywords=mattress&qid=1626789078&sr=8-51
"JY AMI Double Bed Black Cotton Single Folding Mattress/Gadda for Students, PG, Hostel, Picnic - 4 x 6 feet, (Medium, Multicolour)  ",,,,"₹2,998",₹649,"Save ₹2,349 (78%)",3.9 out of 5 stars,39,https://www.amazon.in/JY-Double-Folding-Mattress-Students/dp/B09477TG2D/ref=sr_1_52?dchild=1&keywords=mattress&qid=1626789078&sr=8-52
CHILLI BILLI 2 Inch Dual Comfort Reversible Foldable EPE Foam Single Bed Mattress 3 Fold Blue & 6X4 Ft  ,,,,"₹1,499","₹1,249",Save ₹250 (17%),,,https://www.amazon.in/CHILLI-BILLI-Reversible-Foldable-Mattress/dp/B0989SDZG2/ref=sr_1_53?dchild=1&keywords=mattress&qid=1626789078&sr=8-53
COLOFLY 3 Inch Three Fold Dual Comfort Reversible EPE Foam Single Bed Mattress Blue & White  ,,,,"₹2,999","₹1,499","Save ₹1,500 (50%)",3.4 out of 5 stars,88,https://www.amazon.in/COLOFLY-Comfort-Reversible-Single-Mattress/dp/B08RNQGVDJ/ref=sr_1_54?dchild=1&keywords=mattress&qid=1626789078&sr=8-54
"AMI Soft Cotton Filled 1 Sleeping Capacity Medium Mattress/Gadda (Multicolour, 3 x 6 ft or 72 x 36 Inch)  ",,,,"₹1,998",₹549,"Save ₹1,449 (73%)",3.7 out of 5 stars,104,https://www.amazon.in/AMI-Sleeping-Capacity-Mattress-Multicolour/dp/B08SMGDZGR/ref=sr_1_55?dchild=1&keywords=mattress&qid=1626789078&sr=8-55
AnuAshi (3x6) 100% Pure White Cotton 6 kg Fluffy Mattress/gadda (Clean and hygienic) 72x36x5  ,,,,"₹3,000","₹1,149","Save ₹1,851 (62%)",3.9 out of 5 stars,23,https://www.amazon.in/AnuAshi-Cotton-Mattress-hygienic-72x36x5/dp/B095P7438H/ref=sr_1_56?dchild=1&keywords=mattress&qid=1626789078&sr=8-56
"Sleep Ayurveda Reversible Orthopaedic Gel Memory Foam Mattress | Infused with Neem (Single, 75x36x4)  ",Limited time deal,Sponsored,,"₹9,501","₹5,706","Save ₹3,795 (40%)",,,https://www.amazon.in/gp/slredirect/picassoRedirect.html/ref=pa_sp_btf_aps_sr_pg1_1?ie=UTF8&adId=A035222221HSUO013DJ7I&url=%2FSleep-Ayurveda-Reversible-Orthopaedic-Mattress%2Fdp%2FB095M6XMZS%2Fref%3Dsr_1_57_sspa%3Fdchild%3D1%26keywords%3Dmattress%26qid%3D1626789078%26smid%3DA3R2NDQMUR5HBO%26sr%3D8-57-spons%26psc%3D1&qualifier=1626789078&id=6383734900875750&widgetName=sp_btf
"SleepyCat Original Orthopedic Gel Memory Foam Mattress, Double Bed Size, Medium Firm (72x48x6 Inches)  ",Limited time deal,Sponsored,,"₹14,489","₹10,340","Save ₹4,149 (29%)",4.6 out of 5 stars,"4,170",https://www.amazon.in/gp/slredirect/picassoRedirect.html/ref=pa_sp_btf_aps_sr_pg1_1?ie=UTF8&adId=A03867663JDA9G2X3ZWZD&url=%2FSleepyCat-Memory-Mattress-72x48x6-inches%2Fdp%2FB077Q9YRMY%2Fref%3Dsr_1_58_sspa%3Fdchild%3D1%26keywords%3Dmattress%26qid%3D1626789078%26smid%3DA2CJ2XQ57TN217%26sr%3D8-58-spons%26psc%3D1&qualifier=1626789078&id=6383734900875750&widgetName=sp_btf
"The Sleep Company SmartGRID Luxe 10"" Mattress King Size - (78x72x10 inches)  ",Limited time deal,Sponsored,,"₹54,900","₹32,940","Save ₹21,960 (40%)",4.7 out of 5 stars,587,https://www.amazon.in/gp/slredirect/picassoRedirect.html/ref=pa_sp_btf_aps_sr_pg1_1?ie=UTF8&adId=A058308821XIY09NJES0A&url=%2FSleep-Company-SmartGRID-Luxe-Mattress%2Fdp%2FB084HFHXB5%2Fref%3Dsr_1_59_sspa%3Fdchild%3D1%26keywords%3Dmattress%26qid%3D1626789078%26smid%3DA1Y39PCFBV6X3X%26sr%3D8-59-spons%26psc%3D1&qualifier=1626789078&id=6383734900875750&widgetName=sp_btf
AMORE Medico 6 Inch Eurotop Bonnell Spring & HR Foam Single Size Mattress (75x42x6 Inch)  ,,Sponsored,,"₹16,446","₹8,223","Save ₹8,223 (50%)",4.3 out of 5 stars,994,https://www.amazon.in/gp/slredirect/picassoRedirect.html/ref=pa_sp_atf_next_aps_sr_pg2_1?ie=UTF8&adId=A06448012G11DPNI87PX4&url=%2FInternational-Eurotop-Bonnell-Mattress-75x42x6%2Fdp%2FB07VR1564J%2Fref%3Dsr_1_49_sspa%3Fdchild%3D1%26keywords%3Dmattress%26qid%3D1626789096%26sr%3D8-49-spons%26psc%3D1&qualifier=1626789096&id=1968730816335002&widgetName=sp_atf_next
"Duroflex LiveIn - Pressure Relieving, Memory Foam, Roll Pack, 6 Inch Double Size Medium Firm Mattress with Superior Comfort and Anti Microbial Fabric (78 X 48 X 6 Inches)  ",Limited time deal,Sponsored,,"₹14,999","₹10,499","Save ₹4,500 (30%)",4.3 out of 5 stars,"1,557",https://www.amazon.in/gp/slredirect/picassoRedirect.html/ref=pa_sp_atf_next_aps_sr_pg2_1?ie=UTF8&adId=A05956392RBAC87UHM499&url=%2FDuroflex-Livein-Microbial-Fabric-Mattress%2Fdp%2FB08932XNBL%2Fref%3Dsr_1_50_sspa%3Fdchild%3D1%26keywords%3Dmattress%26qid%3D1626789096%26sr%3D8-50-spons%26psc%3D1&qualifier=1626789096&id=1968730816335002&widgetName=sp_atf_next
"SleepX Dual Comfort Mattress - Medium Soft & Hard - Queen Bed Size (Orange, 78x60x6)  ",Limited time deal,Sponsored,,"₹15,346","₹8,809","Save ₹6,537 (43%)",4.3 out of 5 stars,"4,124",https://www.amazon.in/gp/slredirect/picassoRedirect.html/ref=pa_sp_atf_next_aps_sr_pg2_1?ie=UTF8&adId=A01463592J4NR2N77OZFK&url=%2FSleepX-Presented-Sleepwell-Dual-mattress%2Fdp%2FB07RN7T9LQ%2Fref%3Dsr_1_51_sspa%3Fdchild%3D1%26keywords%3Dmattress%26qid%3D1626789096%26sr%3D8-51-spons%26psc%3D1&qualifier=1626789096&id=1968730816335002&widgetName=sp_atf_next
"Duroflex Back Magic - Doctor Recommended Orthopaedic High Density Coir, 5 Inch King Size Firm Mattress for Back Support and Posture Alignment (72 X 72 X 5 Inches)  ",,Sponsored,,"₹22,378","₹17,490","Save ₹4,888 (22%)",4.3 out of 5 stars,999,https://www.amazon.in/gp/slredirect/picassoRedirect.html/ref=pa_sp_atf_next_aps_sr_pg2_1?ie=UTF8&adId=A05945032B9FNGJDQRTFB&url=%2FDuroflex-Back-Magic-Orthopedic-Certified%2Fdp%2FB07QBC8GYK%2Fref%3Dsr_1_52_sspa%3Fdchild%3D1%26keywords%3Dmattress%26qid%3D1626789096%26sr%3D8-52-spons%26psc%3D1&qualifier=1626789096&id=1968730816335002&widgetName=sp_atf_next
"MOROFEEL 2 Inch Dual Comfort Reversible Foldable EPE Foam Single Bed Mattress 3 Fold Navy Blue (Medium, 72X35X2)  ",,,,"₹1,499",₹849,Save ₹650 (43%),3.4 out of 5 stars,198,https://www.amazon.in/MOROFEEL-Comfort-Reversible-Foldable-Mattress/dp/B08RNTCB44/ref=sr_1_53?dchild=1&keywords=mattress&qid=1626789096&sr=8-53
"Sleepyhead Flip - Dual Sided High Density Foam Mattress with Firm & Soft Sides, (72x36x5 inches, Single Size)  ",,,,"₹7,999","₹5,999","Save ₹2,000 (25%)",4.5 out of 5 stars,"3,702",https://www.amazon.in/Sleepyhead-Flip-Density-Mattress-72x36x5/dp/B084QFRTDB/ref=sr_1_54?dchild=1&keywords=mattress&qid=1626789096&sr=8-54
"AnuAshi Soft Cotton Filled Classic Mattress/Gadda (Multicolour, Medium, 72X36X6, 3x6 Box, fit 4 inch)  ",,,,"₹1,500",₹899,Save ₹601 (40%),3.1 out of 5 stars,57,https://www.amazon.in/AnuAshi-Classic-Mattress-Multicolour-72X36X6/dp/B092TDR34Y/ref=sr_1_55?dchild=1&keywords=mattress&qid=1626789096&sr=8-55
AnuAshi Soft Cotton Filled Multicolor Cheque Style Mattress | Gadda with Soft Pillow  ,,,,"₹1,900",₹625,"Save ₹1,275 (67%)",3.3 out of 5 stars,27,https://www.amazon.in/AnuAshi-Cotton-Filled-Multicolor-Mattress/dp/B091J3Q9HL/ref=sr_1_56?dchild=1&keywords=mattress&qid=1626789096&sr=8-56
"RAVI Enterprises Soft Cozy 100% Cotton Cover Striped Mattress Gadda (Multicolor 03, Double)  ",,,,"₹1,499",₹499,"Save ₹1,000 (67%)",,,https://www.amazon.in/Soft-Cotton-Striped-Mattress-Gadda/dp/B0978G57P8/ref=sr_1_57?dchild=1&keywords=mattress&qid=1626789096&sr=8-57
Padam Shree Extremely Soft Cum Foldable Pure 2 Inches Single PU Foam Mattress (72x48x2 Inches)  ,,,,"₹3,400","₹1,349","Save ₹2,051 (60%)",3.0 out of 5 stars,40,https://www.amazon.in/Padam-Shree-Mattress-Extremely-Foldable/dp/B08JKP6J1B/ref=sr_1_58?dchild=1&keywords=mattress&qid=1626789096&sr=8-58
"winifred 2 Inch Dual Comfort Reversible Foldable EPE Foam Single 3 Fold Bed Mattress (Medium, 72 x 47 x 2 Inch, Navy Blue)  ",,,,"₹4,100","₹1,249","Save ₹2,851 (70%)",5.0 out of 5 stars,1,https://www.amazon.in/winifred-Comfort-Reversible-Foldable-Mattress/dp/B08ZJQWPRZ/ref=sr_1_49?dchild=1&keywords=mattress&qid=1626789096&sr=8-49
"CHILLI BILLI Extra Soft Cotton Filled Mattress (2 Sleeping Capacity, 4 x 6 ft or 72 x 47 Inch, Multicolour)  ",,,,"₹1,550",₹549,"Save ₹1,001 (65%)",4.6 out of 5 stars,3,https://www.amazon.in/CHILLI-BILLI-Mattress-Sleeping-Multicolour/dp/B08X7KMYP3/ref=sr_1_50?dchild=1&keywords=mattress&qid=1626789096&sr=8-50
