name,badge_1,badge_2,badge_3,badge_4,mrp,discounted_price,discount,rating,rating_count,link
"Swiss Beauty Waterproof, Non-Transfer Lipstick (Wine Blush), 2gm",,,63 orders in last 7 days,,Rs. 299,Rs.  277,7% Off,4.200000000000001,(30),https://www.snapdeal.com/product/swiss-beauty-waterproof-nontransfer-lipstick/7061644857386538390#bcrumbSearch:blush
Miss Rose All In One 78 Color Eyeshadow Matte Look Makeup Palette(60 shade Eyeshadow+12 Lipstick+3 Blush+3 Compact Eyes Cream-to-powder Colours),,,,,"Rs. 1,746",Rs.  898,49% Off,4.1,(34),https://www.snapdeal.com/product/miss-rose-60-color-eyeshadow12/672904206346#bcrumbSearch:blush
Colors Queen Cream Foundation Rose Blush Light 50 g,,,,,Rs. 249,Rs.  235,6% Off,5.0,(2),https://www.snapdeal.com/product/colors-queen-cream-foundation-rose/642823780583#bcrumbSearch:blush
"Swiss Beauty Waterproof, Non-Transfer Lipstick (Mauve Blush), 2gm",,,63 orders in last 7 days,,Rs. 299,Rs.  277,7% Off,4.200000000000001,(30),https://www.snapdeal.com/product/swiss-beauty-waterproof-nontransfer-lipstick/6052838540855547286#bcrumbSearch:blush
Sivanna Colors In the Peach Pro Cheek Blusher Pressed Powder Blush Rose Pink 8.5 g,,2 left!,,,Rs. 775,Rs.  489,37% Off,,,https://www.snapdeal.com/product/sivanna-colors-in-the-peach/660838865516#bcrumbSearch:blush
Colors Queen Cream Foundation Rose Blush Fair 65 g,,,,,Rs. 325,Rs.  325,,4.0,(2),https://www.snapdeal.com/product/colors-queen-cream-foundation-rose/643485311487#bcrumbSearch:blush
"Swiss Beauty HD Matte Lipstick (Mauve Blush), 3.5gm",,,,,Rs. 299,Rs.  284,5% Off,4.1,(16),https://www.snapdeal.com/product/swiss-beauty-hd-matte-lipstick/8214566345946671209#bcrumbSearch:blush
"Swiss Beauty HD Matte Lipstick (Wine Blush), 3.5gm",,,,,Rs. 299,Rs.  286,4% Off,4.1,(16),https://www.snapdeal.com/product/swiss-beauty-hd-matte-lipstick/8935142286325950569#bcrumbSearch:blush
"Swiss Beauty Miracle Touch Cover Base Liquid Foundation (Rose Blush), 45ml",,2 left!,,,Rs. 349,Rs.  282,19% Off,3.5999999999999996,(21),https://www.snapdeal.com/product/swiss-beatuy-miracle-touch-cover/7493990430627189215#bcrumbSearch:blush
Incolor Pressed Powder Blush Symphony Blusher 2 Gold SPF 12 9 g,,,,,Rs. 245,Rs.  199,19% Off,,,https://www.snapdeal.com/product/incolor-pressed-powder-blush-symphony/628883081151#bcrumbSearch:blush
Chariot New York Cream Blush Marsh Mellow Matte Rose Pink 10 g,,,,,Rs. 749,Rs.  299,60% Off,4.9,(7),https://www.snapdeal.com/product/chariot-new-york-cream-blush/674672074628#bcrumbSearch:blush
Basicare Stick Blush SILVER 1 l,,,,,Rs. 220,Rs.  220,,3.0,(1),https://www.snapdeal.com/product/basicare-stick-blush-silver-1/636387961690#bcrumbSearch:blush
"Swiss Beatuy Primer Mousse Foundation (Rose Blush), 40gm",,,,,Rs. 399,Rs.  353,12% Off,4.5,(2),https://www.snapdeal.com/product/swiss-beauty-primer-mousse-foundation/628764635625#bcrumbSearch:blush
Chariot New York Cream Blush Glorious Matte Nude 10 g,,,,,Rs. 749,Rs.  299,60% Off,,,https://www.snapdeal.com/product/chariot-new-york-cream-blush/630347364604#bcrumbSearch:blush
Miss Rose Pressed Powder Blush PINK 3 gm,,,,,Rs. 565,Rs.  269,52% Off,4.699999999999999,(3),https://www.snapdeal.com/product/miss-rose-pressed-powder-blush/681726440340#bcrumbSearch:blush
Incolor Blushing Cheeks Highlight Blusher 14 Cherry 9 Gms,,,,,Rs. 275,Rs.  245,11% Off,5.0,(1),https://www.snapdeal.com/product/incolor-pressed-powder-blush-cherry/627681433355#bcrumbSearch:blush
Cameleon Pressed Powder Blush Red Plum 14 gm,,1 left!,,,Rs. 499,Rs.  374,25% Off,4.8,(4),https://www.snapdeal.com/product/cameleon-pressed-powder-blush-red/631892859118#bcrumbSearch:blush
Cameleon Pressed Powder Blush 03 100 gm,,,,,Rs. 799,Rs.  574,28% Off,3.8,(35),https://www.snapdeal.com/product/cameleon-6-in-1-blusher/1508608862#bcrumbSearch:blush
DERMACOL Stick Blush Hot Pink BLUSH-5 7 g,,1 left!,,,"Rs. 1,999","Rs.  1,598",20% Off,,,https://www.snapdeal.com/product/dermacol-stick-blush-hot-pink/681132971308#bcrumbSearch:blush
Chariot New York Lip and Cheek Cream Blush Vegan Peach 10 g,,,,,Rs. 749,Rs.  400,47% Off,4.3,(3),https://www.snapdeal.com/product/chariot-new-york-cream-blush/625482430850#bcrumbSearch:blush
Incolor Pressed Powder Blush Cherry 9 g,,3 left!,,,Rs. 275,Rs.  275,,3.0,(2),https://www.snapdeal.com/product/incolor-pressed-powder-blush-cherry/626119339235
Miss Rose Pressed Powder Blush PINK 3 gm,,,,,Rs. 565,Rs.  269,52% Off,4.3,(4),https://www.snapdeal.com/product/miss-rose-pressed-powder-blush/628858210060
Meilin Pressed Powder Blush,,,,,Rs. 799,Rs.  485,39% Off,4.1,(15),https://www.snapdeal.com/product/meilin-blusher-palette/972008158
Mars Good Choice Free Kajal With  Pressed Powder Blush Rose Pink 50 g,,,,,Rs. 374,Rs.  284,24% Off,3.8,(32),https://www.snapdeal.com/product/mars-good-choice-free-kajal/624811092034
Colors Queen Cream Foundation Rose Blush Light 50 g,,,,,Rs. 299,Rs.  296,1% Off,,,https://www.snapdeal.com/product/colors-queen-cream-foundation-rose/635246712342
"Swiss Beauty Ultra Blush Palette (Shade-01), 16gm",,,,,Rs. 499,Rs.  443,11% Off,3.5,(4),https://www.snapdeal.com/product/swiss-beatuy-ultra-blush-palette/650629545206
"Swiss Beauty Ultra Blush Palette (Shade-04), 16gm",,,,,Rs. 499,Rs.  420,16% Off,5.0,(1),https://www.snapdeal.com/product/swiss-beauty-ultra-blush-palette/656266283827
Sivanna Colors Matte Blusher Pressed Powder Blush Rose Pink 8.5 g,,1 left!,,,Rs. 650,Rs.  327,50% Off,5.0,(1),https://www.snapdeal.com/product/sivanna-colors-matte-blusher-pressed/648256149235
Incolor Pressed Powder Blush Shade 15 Copper SPF 12 9 g,,,,,Rs. 249,Rs.  249,,4.0,(1),https://www.snapdeal.com/product/incolor-pressed-powder-blush-shade/656819930213
Sivanna Colors Matte Flower Blush Pressed Powder Blush Multi 8.5 g,,2 left!,,,Rs. 850,Rs.  559,34% Off,,,https://www.snapdeal.com/product/sivanna-colors-matte-flower-blush/672449248147
Chariot New York Shimmer Hot Pink And Matte Nude Cream Blush Hot Pink 10 g,,,,,"Rs. 1,498",Rs.  400,73% Off,3.7,(3),https://www.snapdeal.com/product/chariot-new-york-matte-peach/6341068900414810902
O.TWO.O Liquid Blush Rose Pink 15 g,,4 left!,,,Rs. 799,Rs.  623,22% Off,3.2,(6),https://www.snapdeal.com/product/otwoo-liquid-blush-rose-pink/665696702284
Incolor Pressed Powder Blush Bronze 9 g,,,,,Rs. 275,Rs.  250,9% Off,5.0,(1),https://www.snapdeal.com/product/incolor-pressed-powder-blush-bronze/670921226964
ELEANOR Powder Blush  Pressed Powder Blush B01 Spring Rose 4 gm,,,,,Rs. 695,Rs.  694,,,,https://www.snapdeal.com/product/eleanor-powder-blush-pressed-powder/665111047949
Miss Rose Pressed Powder Blush Peach 10 g,,,,,Rs. 565,Rs.  269,52% Off,3.5,(2),https://www.snapdeal.com/product/miss-rose-pressed-powder-blush/5764608173720868236
Incolor Pressed Powder Blush Cherry 9 g,,,,,Rs. 275,Rs.  275,,5.0,(1),https://www.snapdeal.com/product/incolor-pressed-powder-blush-cherry/622797819452
Incolor Pressed Powder Blush 21 Rose SPF 11 9 g,,,,,Rs. 249,Rs.  249,,5.0,(1),https://www.snapdeal.com/product/incolor-pressed-powder-blush-21/655216646664
Cameleon Pressed Powder Blush Orange Gold 14 gm,,,,,Rs. 499,Rs.  349,30% Off,3.2,(23),https://www.snapdeal.com/product/cameleon-pressed-powder-blush-orange/624123726774
Sivanna Colors Professional makeup Shinning Pressed Powder Blush Star Shimmer Bricks Multi 8.5 g,,2 left!,,,"Rs. 1,025",Rs.  790,23% Off,,,https://www.snapdeal.com/product/sivanna-colors-professional-makeup-shinning/681942735597
Miss Rose Pressed Powder Blush Rose Pink 10 g,,,,,Rs. 565,Rs.  269,52% Off,3.5,(2),https://www.snapdeal.com/product/miss-rose-pressed-powder-blush/5476377797569156492
Cameleon Pressed Powder Blush,,1 left!,,,Rs. 500,Rs.  291,42% Off,4.0,(18),https://www.snapdeal.com/product/cameleon-2-in-1-blusher/1656777305
Mars Pressed Powder Blush,,,,,Rs. 575,Rs.  302,47% Off,3.5,(165),https://www.snapdeal.com/product/mars-waterproof-five-colour-24/663585937279
Miss Rose Pressed Powder Blush Bronze 10 g,,,,,Rs. 565,Rs.  284,50% Off,3.5,(2),https://www.snapdeal.com/product/miss-rose-pressed-powder-blush/8646911935237985676
Miss Rose Pressed Powder Blush Rouge 8 g,,,,,Rs. 565,Rs.  273,52% Off,4.0,(3),https://www.snapdeal.com/product/miss-rose-pressed-powder-blush/5764608159551513478
Sivanna Colors Fall in Love Blush Pressed Powder Blush Rose Pink 8.5 g,,2 left!,,,Rs. 850,Rs.  559,34% Off,,,https://www.snapdeal.com/product/sivanna-colors-fall-in-love/680364409133
Chariot New York Lip and Cheek Vegan Cream Blush Nude 6 g,,,,,Rs. 799,Rs.  500,37% Off,5.0,(1),https://www.snapdeal.com/product/chariot-new-york-lip-and/6917529712608041214
Miss Rose Pressed Powder Blush Nude 10 g,,,,,Rs. 565,Rs.  269,52% Off,3.5,(2),https://www.snapdeal.com/product/miss-rose-pressed-powder-blush/4899917045265733004
O.TWO.O Liquid Blush Rose 15 g,,,,,Rs. 799,Rs.  675,16% Off,3.9000000000000004,(9),https://www.snapdeal.com/product/otwoo-liquid-blush-rust-15/7493990405522227976
Sivanna Colors Matte Blusher Pressed Powder Blush Rose Pink 8.5 g,,,,,Rs. 650,Rs.  327,50% Off,5.0,(1),https://www.snapdeal.com/product/sivanna-colors-matte-blusher-pressed/662329129559
Incolor Artist's Highlighter 04 Pressed Powder Blush 04 Multi 9 g,,,,,Rs. 449,Rs.  348,22% Off,,,https://www.snapdeal.com/product/incolor-pressed-powder-blush-multi/632109587725
Cameleon Sivanna Loose Powder Blush 02 Multicolor 0.2 gm,,,,,Rs. 499,Rs.  373,25% Off,4.1,(70),https://www.snapdeal.com/product/cameleon-sivanna-loose-powder-blush/648570968931
Miss Rose Pressed Powder Blush Gold 10 g,,,,,Rs. 565,Rs.  269,52% Off,3.5,(2),https://www.snapdeal.com/product/miss-rose-pressed-powder-blush/7493990430631138700
Miss Rose Pressed Powder Blush Nude 8 g,,,,,Rs. 499,Rs.  260,48% Off,4.0,(3),https://www.snapdeal.com/product/miss-rose-pressed-powder-blush/5188147407248089990
Sivanna Colors You Meet Love Blusher Pressed Powder Blush Multi 8.5 g,,,,,"Rs. 2,599","Rs.  2,336",10% Off,,,https://www.snapdeal.com/product/sivanna-colors-you-meet-love/658338449956
Miss Rose Pressed Powder Blush Peach 8 g,,,,,Rs. 499,Rs.  260,48% Off,4.0,(3),https://www.snapdeal.com/product/miss-rose-pressed-powder-blush/8070451168765207430
Miss Rose Pressed Powder Blush Rouge 10 g,,,,,Rs. 565,Rs.  284,50% Off,3.5,(2),https://www.snapdeal.com/product/miss-rose-pressed-powder-blush/8070451182934562188
Chariot New York Matte Nude And Shimmer Hot pink Cream Blush Copper 10 g,,,,,"Rs. 1,498",Rs.  400,73% Off,3.7,(3),https://www.snapdeal.com/product/chariot-new-york-matte-peach/5188147395807963926
Incolor Pressed Powder Blush Bronze 9 g,,,,,Rs. 275,Rs.  275,,5.0,(1),https://www.snapdeal.com/product/incolor-pressed-powder-blush-bronze/645295485969
Incolor Artist's Highlighter 03 Pressed Powder Blush 03 Multi 9 g,,7 left!,,,Rs. 449,Rs.  348,22% Off,,,https://www.snapdeal.com/product/incolor-pressed-powder-blush-multi/676598054688
Chariot New York Matte Peach And Shimmer Gold Cream Blush Peach 10 g,,,,,"Rs. 1,498",Rs.  400,73% Off,3.7,(3),https://www.snapdeal.com/product/chariot-new-york-matte-peach/6052838524263099158
Miss Rose Pressed Powder Blush Cherry 8 g,,,,,Rs. 499,Rs.  260,48% Off,4.0,(3),https://www.snapdeal.com/product/miss-rose-pressed-powder-blush/6917529664158360454
O.TWO.O Liquid Blush Nude 15 g,,2 left!,,,Rs. 799,Rs.  675,16% Off,3.9000000000000004,(9),https://www.snapdeal.com/product/otwoo-liquid-blush-rust-15/5188147396308534024
Cameleon Pressed Powder Blush 01 40 gm,,4 left!,,,Rs. 799,Rs.  403,50% Off,3.1,(10),https://www.snapdeal.com/product/cameleon-blusher-palette/702471247
O.TWO.O Liquid Blush Rouge 15 g,,2 left!,,,Rs. 799,Rs.  699,13% Off,3.9000000000000004,(9),https://www.snapdeal.com/product/otwoo-liquid-blush-rust-15/5764608148611957512
Sivanna Colors Automatic Face Colour Blusher Pressed Powder Blush Pro Makeup Rose Pink 8.5 g,,1 left!,,,Rs. 900,Rs.  635,29% Off,,,https://www.snapdeal.com/product/sivanna-colors-automatic-face-colour/620937552647
Chariot New York Lip and Cheek Vegan Cream Blush Hot Pink 6 g,,,,,Rs. 799,Rs.  500,37% Off,5.0,(1),https://www.snapdeal.com/product/chariot-new-york-lip-and/5764608208001194238
Miss Rose Pressed Powder Blush Silver 4 g,,,,,Rs. 399,Rs.  205,49% Off,3.5999999999999996,(12),https://www.snapdeal.com/product/miss-rose-pressed-powder-blush/8070451190332769571
Cameleon Pressed Powder Blush Gold 14 gm,,3 left!,,,Rs. 599,Rs.  316,47% Off,3.4000000000000004,(5),https://www.snapdeal.com/product/cameleon-pressed-powder-blush-gold/659089002170
Incolor Pressed Powder Blush Silver 9 g,,,,,Rs. 275,Rs.  226,18% Off,3.5,(2),https://www.snapdeal.com/product/incolor-pressed-powder-blush-silver/629662045259
Incolor Pressed Powder Blush Gold 9 g,,,,,Rs. 275,Rs.  275,,,,https://www.snapdeal.com/product/incolor-pressed-powder-blush-gold/626618707837
Incolor Pressed Powder Blush 14 Peach SPF 12 9 g,,,,,Rs. 249,Rs.  249,,5.0,(1),https://www.snapdeal.com/product/incolor-pressed-powder-blush-14/679797254345
Cameleon Pressed Powder Blush gm,,3 left!,,,Rs. 599,Rs.  380,37% Off,4.1,(19),https://www.snapdeal.com/product/cameleon-pressed-powder-blush-white/633165639460
O.TWO.O Liquid Blush Peach 15 g,,2 left!,,,Rs. 799,Rs.  675,16% Off,3.9000000000000004,(9),https://www.snapdeal.com/product/otwoo-liquid-blush-rust-15/6917529653218804488
Sivanna Colors Automatic Face Colour Blusher Pressed Powder Blush Pro Makeup Rose Pink 8.5 g,,2 left!,,,Rs. 900,Rs.  635,29% Off,,,https://www.snapdeal.com/product/sivanna-colors-automatic-face-colour/667859306592
GlamGals HOLLYWOOD-U.S.A Pressed Powder Blush Rose Pink 5.8 g,,,,,Rs. 560,Rs.  460,18% Off,4.0,(2),https://www.snapdeal.com/product/glamgals-pressed-powder-blush-salmon/663863619836
Incolor Pressed Powder Blush Hot Pink 9 g,,,,,Rs. 275,Rs.  250,9% Off,4.5,(2),https://www.snapdeal.com/product/incolor-pressed-powder-blush-hot/680250886976
Miss Rose Pressed Powder Blush Copper 10 g,,,,,Rs. 565,Rs.  269,52% Off,3.5,(2),https://www.snapdeal.com/product/miss-rose-pressed-powder-blush/6341068926024291724
Miss Rose Pressed Powder Blush Red 10 g,,,,,Rs. 565,Rs.  284,50% Off,3.5,(2),https://www.snapdeal.com/product/miss-rose-pressed-powder-blush/5188147421417444748
DERMACOL Loose Powder Blush Bronze 9 g,,2 left!,,,"Rs. 1,349","Rs.  1,080",20% Off,,,https://www.snapdeal.com/product/dermacol-loose-powder-blush-bronze/666163890486
Miss Rose Pressed Powder Blush Mauve 4 g,,,,,Rs. 612,Rs.  313,49% Off,3.5999999999999996,(12),https://www.snapdeal.com/product/miss-rose-pressed-powder-blush/5188147428815652131
Miss Rose Pressed Powder Blush Red 10 g,,,,,Rs. 565,Rs.  284,50% Off,3.5,(2),https://www.snapdeal.com/product/miss-rose-pressed-powder-blush/5188147421417444748
Miss Rose Pressed Powder Blush Mauve 4 g,,,,,Rs. 612,Rs.  313,49% Off,3.5999999999999996,(12),https://www.snapdeal.com/product/miss-rose-pressed-powder-blush/5188147428815652131
Miss Rose Pressed Powder Blush Rouge 4 g,,,,,Rs. 399,Rs.  205,49% Off,3.5999999999999996,(12),https://www.snapdeal.com/product/miss-rose-pressed-powder-blush/6917529685725922595
Incolor Pressed Powder Blush Gold 9 g,,,,,Rs. 275,Rs.  275,,,,https://www.snapdeal.com/product/incolor-pressed-powder-blush-gold/626618707837
Cameleon Pressed Powder Blush Baby Pink 14 gm,,1 left!,,,Rs. 499,Rs.  499,,5.0,(1),https://www.snapdeal.com/product/cameleon-pressed-powder-blush-baby/655359476923
Cameleon Pressed Powder Blush gm,,,,,Rs. 599,Rs.  324,46% Off,3.9000000000000004,(56),https://www.snapdeal.com/product/cameleon-pressed-powder-blush-pink/677511818684
Miss Rose Pressed Powder Blush PINK 3 gm,,,,,Rs. 519,Rs.  247,52% Off,5.0,(1),https://www.snapdeal.com/product/miss-rose-pressed-powder-blush/685698674108
Chariot New York Shimmer Sliver And Matte Rose Pink Cream Blush Silver 10 g,,,,,"Rs. 1,498",Rs.  400,73% Off,3.7,(3),https://www.snapdeal.com/product/chariot-new-york-matte-peach/7205760028869946134
Sivanna Colors Automatic Face Colour Blusher Pressed Powder Blush Pro Makeup Rose Pink 8.5 g,,2 left!,,,Rs. 900,Rs.  635,29% Off,,,https://www.snapdeal.com/product/sivanna-colors-automatic-face-colour/667859306592
Chariot New York Shimmer Gold And Shimmer Hot Pink Cream Blush Gold 10 g,,,,,"Rs. 1,498",Rs.  400,73% Off,3.7,(3),https://www.snapdeal.com/product/chariot-new-york-matte-peach/8358681533476793110
Chariot New York Shimmer Sliver And Matte Peach Cream Blush Rouge 10 g,,,,,"Rs. 1,498",Rs.  400,73% Off,3.7,(3),https://www.snapdeal.com/product/chariot-new-york-matte-peach/7493990405021657878
Incolor Pressed Powder Blush Gold 9 g,,,,,Rs. 275,Rs.  275,,5.0,(1),https://www.snapdeal.com/product/incolor-pressed-powder-blush-gold/621315199989
Miss Rose Pressed Powder Blush Cherry 10 g,,,,,Rs. 565,Rs.  269,52% Off,3.5,(2),https://www.snapdeal.com/product/miss-rose-pressed-powder-blush/6917529678327715212
DERMACOL Loose Powder Blush Bronze 9 g,,2 left!,,,"Rs. 1,349","Rs.  1,080",20% Off,,,https://www.snapdeal.com/product/dermacol-loose-powder-blush-bronze/666163890486
Miss Rose Pressed Powder Blush Mauve 8 g,,,,,Rs. 499,Rs.  260,48% Off,4.0,(3),https://www.snapdeal.com/product/miss-rose-pressed-powder-blush/7493990416461783942
Miss Rose Pressed Powder Blush ORANGE 3 gm,,,,,Rs. 565,Rs.  269,52% Off,3.4000000000000004,(5),https://www.snapdeal.com/product/miss-rose-pressed-powder-blush/633285649975
Chariot New York Matte Nude And Matte Peach Cream Blush Rust 10 g,,,,,"Rs. 1,498",Rs.  400,73% Off,3.7,(3),https://www.snapdeal.com/product/chariot-new-york-matte-peach/8070451157325081366
Sivanna Colors Multi Shimmer Blusher Brick Pressed Powder Blush Multi 8.5 g,,2 left!,,,"Rs. 1,025",Rs.  790,23% Off,,,https://www.snapdeal.com/product/sivanna-colors-multi-shimmer-blusher/665481049744
Miss Rose Pressed Powder Blush Rose 10 g,,,,,Rs. 565,Rs.  269,52% Off,3.5,(2),https://www.snapdeal.com/product/miss-rose-pressed-powder-blush/6052838549872579980
Miss Rose Pressed Powder Blush Rose 8 g,,,,,Rs. 499,Rs.  260,48% Off,4.0,(3),https://www.snapdeal.com/product/miss-rose-pressed-powder-blush/6341068911854936966
