name,badge_1,badge_2,badge_3,mrp,discounted_price,discount,rating,rating_count,link
"Benign Facial Cleansing Brush Made with Ultra Hygienic Soft Silicone, Waterproof Vibrating Face Brush for Deep Cleansing, Gentle Exfoliating and Inductive Charging Cable (Random Color) (1 pcs )  ",,,,₹699,₹399,Save ₹300 (43%),2.5 out of 5 stars,8,https://www.amazon.in/Benign-Cleansing-Waterproof-Vibrating-Exfoliating/dp/B08VNQP7ZM/ref=sr_1_52?dchild=1&keywords=face+brush&qid=1624530116&sr=8-52
URBANMAC Diamond Handle Synthetic Fiber Makeup Brushes Set with Big Fish Tail for Foundation Eyeshadow Face Kit -10 Pieces  ,,,,₹999,₹399,Save ₹600 (60%),4.0 out of 5 stars,24,https://www.amazon.in/URBANMAC-Diamond-Synthetic-Foundation-Eyeshadow/dp/B07VQTVPXP/ref=sr_1_53?dchild=1&keywords=face+brush&qid=1624530116&sr=8-53
Faces Eye Shadow Brush  ,,,Only 1 left in stock.,₹449,₹269,Save ₹180 (40%),4.2 out of 5 stars,174,https://www.amazon.in/Faces-Eye-Shadow-Brush/dp/B00E5V1XHY/ref=sr_1_54?dchild=1&keywords=face+brush&qid=1624530116&sr=8-54
ASGTRADE Silicone Face Cleansing Brush Electric Machine Sonic Silicone Scrubber Vibrating Massager IPX7 Waterproof Rechargeable Deep Cleaning for All Skins - Multi color  ,,,,₹899,₹345,Save ₹554 (62%),5.0 out of 5 stars,3,https://www.amazon.in/ASGTRADE-Cleansing-Vibrating-Waterproof-Rechargeable/dp/B08ZLZNQQX/ref=sr_1_55?dchild=1&keywords=face+brush&qid=1624530116&sr=8-55
Nyamah Sales Women Face Pack Brush with Headband and Face Cleaning Sponge Combo Beauty Tools Set for Home and Salon Use (Pack of 4)  ,,,,₹499,₹224,Save ₹275 (55%),,,https://www.amazon.in/Nyamah-Sales-Headband-Cleaning-Sponge/dp/B09687F5GC/ref=sr_1_56?dchild=1&keywords=face+brush&qid=1624530116&sr=8-56
Adbeni Face Makeup Combo of Makeup Brush Pack of 7pc With 2pc Beauty Blander + 2 type Makeup Foundation Brush and a Eyelashes Curler  ,,,,₹599,₹364,Save ₹235 (39%),4.5 out of 5 stars,2,https://www.amazon.in/Adbeni-Makeup-Blander-Foundation-Eyelashes/dp/B08TQH5G9F/ref=sr_1_57?dchild=1&keywords=face+brush&qid=1624530116&sr=8-57
"Amazon Brand - Solimo Face Powder Blush Brush, Black  ",,,,₹399,₹239,Save ₹160 (40%),4.6 out of 5 stars,16,https://www.amazon.in/Solimo-Powder-Blush-Brush-Black/dp/B07J24X4SP/ref=sr_1_58?dchild=1&keywords=face+brush&qid=1624530116&sr=8-58
"GUBB USA Oil Absorbing Sheets For Face Pack of 2, Blotting Paper For Oily Skin - 50 Sheets Each  ",,Sponsored,,₹258,₹209,Save ₹49 (19%),4.4 out of 5 stars,13,https://www.amazon.in/gp/slredirect/picassoRedirect.html/ref=pa_sp_mtf_aps_sr_pg2_1?ie=UTF8&adId=A0542237260KAU2WYION1&url=%2FGUBB-Absorbing-Sheets-Blotting-Paper%2Fdp%2FB08R8Z1BHP%2Fref%3Dsr_1_59_sspa%3Fdchild%3D1%26keywords%3Dface%2Bbrush%26qid%3D1624530116%26sr%3D8-59-spons%26psc%3D1&qualifier=1624530116&id=7622404050149998&widgetName=sp_mtf
Glam Vista Professional Multi function Pro Make-up Brush set (18 Brush) Face & Eye Brush Set  ,,Sponsored,,"₹1,999","₹1,299",Save ₹700 (35%),,,https://www.amazon.in/gp/slredirect/picassoRedirect.html/ref=pa_sp_mtf_aps_sr_pg2_1?ie=UTF8&adId=A09389791OVQN6OAEXSDM&url=%2FVista-Professional-Multi-function-Make-up%2Fdp%2FB097Q7WRBD%2Fref%3Dsr_1_60_sspa%3Fdchild%3D1%26keywords%3Dface%2Bbrush%26qid%3D1624530116%26sr%3D8-60-spons%26psc%3D1&qualifier=1624530116&id=7622404050149998&widgetName=sp_mtf
PROSFIA Makeup Brush Cleaner & Dryer Machine for all Size Makeup Brushes from Eyeshadow Brush to Makeup Powder Brush-Professional Makeup Brush Cleaning Tool to Fast Clean & Dry Makeup Brushes  ,,Sponsored,Only 2 left in stock.,"₹5,099","₹2,499","Save ₹2,600 (51%)",,,https://www.amazon.in/gp/slredirect/picassoRedirect.html/ref=pa_sp_mtf_aps_sr_pg2_1?ie=UTF8&adId=A044627917OD5LIKAM71C&url=%2FPROSFIA-Cleaner-Eyeshadow-Brush-Professional-Cleaning%2Fdp%2FB08TVHY7D1%2Fref%3Dsr_1_61_sspa%3Fdchild%3D1%26keywords%3Dface%2Bbrush%26qid%3D1624530116%26sr%3D8-61-spons%26psc%3D1&qualifier=1624530116&id=7622404050149998&widgetName=sp_mtf
"Deborah Milano Extra Mat Perfection Foundation, Apricot, 30ml  ",,Sponsored,,"₹1,295",₹837,Save ₹458 (35%),,,https://www.amazon.in/gp/slredirect/picassoRedirect.html/ref=pa_sp_mtf_aps_sr_pg2_1?ie=UTF8&adId=A01481761NRZZTGVCWSAI&url=%2FDeborah-Milano-Perfection-Foundation-Apricot%2Fdp%2FB076FWWMKR%2Fref%3Dsr_1_62_sspa%3Fdchild%3D1%26keywords%3Dface%2Bbrush%26qid%3D1624530116%26sr%3D8-62-spons%26psc%3D1&qualifier=1624530116&id=7622404050149998&widgetName=sp_mtf
Face Massager Brush Head 5 in 1 Cleanser Face Wash Facial Soft Cleansing Electric Massager for Women  ,,,,₹999,₹349,Save ₹650 (65%),5.0 out of 5 stars,1,https://www.amazon.in/Massager-Cleanser-Facial-Cleansing-Electric/dp/B08GQ9H4VB/ref=sr_1_63?dchild=1&keywords=face+brush&qid=1624530116&sr=8-63
"YOLO Facial Cleansing Brush, Sonic Silicone Scrubber, Face Vibrating Massager, IPX7 Waterproof, Rechargeable, Deep Cleaning for All Skins- (multi color)  ",,,,"₹1,299",₹299,"Save ₹1,000 (77%)",3.6 out of 5 stars,15,https://www.amazon.in/YOLO-Cleansing-Vibrating-Waterproof-Rechargeable/dp/B08R5MX78F/ref=sr_1_64?dchild=1&keywords=face+brush&qid=1624530116&sr=8-64
"Face Brush -Manual Facial Cleansing, 1Pcs Double Side Skin Care Facial Cleaning Brush, silicone facial scrubber Manual Dual Face Wash Brush for Deep Pore Exfoliation Makeup Massaging (Pack Of-1, Pink)  ",,,,₹599,₹299,Save ₹300 (50%),,,https://www.amazon.in/Cleansing-Cleaning-silicone-Exfoliation-Massaging/dp/B096Y58JR4/ref=sr_1_65?dchild=1&keywords=face+brush&qid=1624530116&sr=8-65
"WOW Skin Science Ubtan Foaming Face Wash with Built-In Face Brush for Deep Cleansing - No Parabens, Sulphate, Silicones & Color, 150 mL  ",Limited time deal,,,₹399,₹359,Save ₹40 (10%),4.1 out of 5 stars,"3,854",https://www.amazon.in/WOW-Science-Foaming-Built-Cleansing/dp/B083DJCQDS/ref=sr_1_66?dchild=1&keywords=face+brush&qid=1624530116&smid=A2WK4OB3ROODF0&sr=8-66
Ghelonadi Face Pack Brush and Face Cleaning Sponge Combo Facial Mask Brush Facemask Applicator Brush Cosmetic Foundation Makeup Brush for Men and Women (White Brush and Sponge)  ,,,,₹399,₹154,Save ₹245 (61%),3.2 out of 5 stars,8,https://www.amazon.in/Ghelonadi-Cleaning-Facemask-Applicator-Foundation/dp/B093GK6ZW4/ref=sr_1_67?dchild=1&keywords=face+brush&qid=1624530116&sr=8-67
NKV'S Professional Face Pack and Facial Bleach Brush (Pack of 2)  ,,,,,₹99,,4.6 out of 5 stars,3,https://www.amazon.in/Professional-Face-Pack-Facial-Bleach/dp/B091NJBQM4/ref=sr_1_68?dchild=1&keywords=face+brush&qid=1624530116&sr=8-68
FOK Soft Silicone Facial Applicator Hairless Silicone Brush Facial Mask Mud Mask Brush-13.9 x 3.2 x 1.5 cms  ,,,,₹391,₹176,Save ₹215 (55%),4.2 out of 5 stars,256,https://www.amazon.in/Silicone-Facial-Applicator-Hairless-Brush-13-9/dp/B072VQCN6H/ref=sr_1_69?dchild=1&keywords=face+brush&qid=1624530116&sr=8-69
Foolzy 11Pcs Makeup Brush Set Professional Kabuki Foundation Blending Blush Concealer Eye Face Liquid Powder Cream Cosmetics Brushes Kit  ,,,,₹899,₹349,Save ₹550 (61%),4.0 out of 5 stars,640,https://www.amazon.in/Foolzy-Professional-Foundation-Concealer-Cosmetics/dp/B079CDSL1J/ref=sr_1_70?dchild=1&keywords=face+brush&qid=1624530116&sr=8-70
P P Enterprise Facial Kit // Multifunction Beauty Care Brush Deep Clean 5 in 1 Portable Facial Cleaner Relief Face Massager/Blackhead Remover Facial Cleanser // facial massager  ,,,Only 2 left in stock.,"₹1,199",₹299,Save ₹900 (75%),,,https://www.amazon.in/Enterprise-Multifunction-Portable-Massager-Blackhead/dp/B096SZHPTJ/ref=sr_1_71?dchild=1&keywords=face+brush&qid=1624530116&sr=8-71
"LeZoir Octopus Design Silicone Facial Cleansing Brush Face Exfoliate Massage Beauty Tool & Loofah For Bath Sponge,Bathing Scrub - 1 piece (Random colour)  ",,,,₹499,₹149,Save ₹350 (70%),3.7 out of 5 stars,24,https://www.amazon.in/Octopus-Silicone-Cleansing-Exfoliate-Massage/dp/B08MV62J4H/ref=sr_1_72?dchild=1&keywords=face+brush&qid=1624530116&sr=8-72
"DATNASAYAD Black Color Fan Brush Professional Face Makeup Highlighter, Wooden Makeup Brush (Pack of 1)  ",,,,₹299,₹99,Save ₹200 (67%),,,https://www.amazon.in/DATNASAYAD-Professional-Makeup-Highlighter-Wooden/dp/B095PWML63/ref=sr_1_73?dchild=1&keywords=face+brush&qid=1624530116&sr=8-73
"Rsentera Facial Tool for Washing & Cleaning your Face, Face Care tool I Face Wash Brush I Face Scrub Brush , Soft Pink, (Pack of 1)  ",,,,₹299,₹99,Save ₹200 (67%),4.0 out of 5 stars,4,https://www.amazon.in/Rsentera-Facial-Washing-Cleaning-Brush/dp/B08ZDBTX8Q/ref=sr_1_74?dchild=1&keywords=face+brush&qid=1624530116&sr=8-74
Welocity Professional Flat Face Pack Brush  ,,,,₹250,₹99,Save ₹151 (60%),3.6 out of 5 stars,40,https://www.amazon.in/Welocity-Professional-Flat-Face-Brush/dp/B08CY1VZVK/ref=sr_1_75?dchild=1&keywords=face+brush&qid=1624530116&sr=8-75
LYFteco 5 in 1 Multifunctional Face Massager or Beauty Care Brush for Facial Scrub Massage Blackhead Remover and Deep Face Cleaning for Men and Women (Pink White)  ,,,,₹599,₹239,Save ₹360 (60%),3.4 out of 5 stars,19,https://www.amazon.in/LYFteco-Multifunctional-Massager-Blackhead-Cleaning/dp/B08XNNHQBR/ref=sr_1_76?dchild=1&keywords=face+brush&qid=1624530116&sr=8-76
MINISO Crystal Makeup Brush Kit 3 PCS for Face Foundation Blush & Powder  ,Deal of the Day ,,,₹490,₹416.50,Save ₹73.50 (15%),4.5 out of 5 stars,40,https://www.amazon.in/MINISO-Crystal-Makeup-Foundation-Powder/dp/B084KJXR3J/ref=sr_1_77?dchild=1&keywords=face+brush&qid=1624530116&sr=8-77
Horlite Facial Kit // Multifunctional Beauty Care Brush Deep Clean 5 in 1 Facial Cleaner Relief Face Massager (Pink)  ,,,,₹999,₹329,Save ₹670 (67%),3.1 out of 5 stars,497,https://www.amazon.in/Horlite-Facial-Multifunctional-Cleaner-Massager/dp/B08B8DF3YF/ref=sr_1_78?dchild=1&keywords=face+brush&qid=1624530116&sr=8-78
