name,badge_1,badge_2,badge_3,mrp,discounted_price,discount,rating,rating_count,link
"GUBB USA Blush Brush For Face Makeup, Professional Wooden Makeup Brush Single  ",,Sponsored,,₹199,₹179,Save ₹20 (10%),4.2 out of 5 stars,347,https://www.amazon.in/gp/slredirect/picassoRedirect.html/ref=pa_sp_atf_aps_sr_pg1_1?ie=UTF8&adId=A0361392XPO6BHPTLON5&url=%2FGUBB-Brush-Professional-Blending-Makeup%2Fdp%2FB0811RN6HT%2Fref%3Dsr_1_1_sspa%3Fdchild%3D1%26keywords%3Dface%2Bbrush%26qid%3D1624530098%26sr%3D8-1-spons%26psc%3D1&qualifier=1624530098&id=3699490247886998&widgetName=sp_atf
"GUBB USA Professional Makeup Brush Set Surprise, 8 Makeup Brushes Kit For Girls/Women  ",,Sponsored,,"₹1,500","₹1,199",Save ₹301 (20%),4.3 out of 5 stars,226,https://www.amazon.in/gp/slredirect/picassoRedirect.html/ref=pa_sp_atf_aps_sr_pg1_1?ie=UTF8&adId=A0120267TRSX2S7164M6&url=%2FGUBB-Professional-Synthetic-Foundation-Brushes%2Fdp%2FB0825RH8K9%2Fref%3Dsr_1_2_sspa%3Fdchild%3D1%26keywords%3Dface%2Bbrush%26qid%3D1624530098%26sr%3D8-2-spons%26psc%3D1&qualifier=1624530098&id=3699490247886998&widgetName=sp_atf
"WISESHE PRO Foundation Liquid, Cream, and Powder Buffing, Blending Full Coverage Synthetic Fibre Face Brush with Brush Guard  ",,Sponsored,,"₹1,200","₹1,000",Save ₹200 (17%),4.7 out of 5 stars,55,https://www.amazon.in/gp/slredirect/picassoRedirect.html/ref=pa_sp_atf_aps_sr_pg1_1?ie=UTF8&adId=A05820113NDC4GUKI50RA&url=%2FWISESHE-Foundation-Buffing-Blending-Coverage%2Fdp%2FB07W6X5V85%2Fref%3Dsr_1_3_sspa%3Fdchild%3D1%26keywords%3Dface%2Bbrush%26qid%3D1624530098%26sr%3D8-3-spons%26psc%3D1&qualifier=1624530098&id=3699490247886998&widgetName=sp_atf
"MINISO 6 PCs Set DIY Facial Face Mask Bowl Brush, Spoon, Stick Kit, Blue  ",Deal of the Day ,Sponsored,,₹200,₹190,Save ₹10 (5%),4.4 out of 5 stars,"1,430",https://www.amazon.in/gp/slredirect/picassoRedirect.html/ref=pa_sp_atf_aps_sr_pg1_1?ie=UTF8&adId=A02020893IFP6KR95VWUZ&url=%2FMINISO-Facial-Brush-Spoon-Stick%2Fdp%2FB086Z3QSRK%2Fref%3Dsr_1_4_sspa%3Fdchild%3D1%26keywords%3Dface%2Bbrush%26qid%3D1624530098%26sr%3D8-4-spons%26psc%3D1&qualifier=1624530098&id=3699490247886998&widgetName=sp_atf
"Ear Lobe & Accessories Face Pack Brush, Brown (Pack of 2)  ",Best seller,,Only 2 left in stock.,₹300,₹99,Save ₹201 (67%),4.2 out of 5 stars,814,https://www.amazon.in/gp/bestsellers/beauty/10850769031/ref=sr_bs_4_10850769031_1
MINISO Facial Cleansing Brush Facial Wash Massage  ,Deal of the Day ,,,₹260,₹234,Save ₹26 (10%),4.3 out of 5 stars,"1,886",https://www.amazon.in/MINISO-Facial-Cleansing-Brush-Massage/dp/B0885ZC5VY/ref=sr_1_6?dchild=1&keywords=face+brush&qid=1624530098&sr=8-6
"Authentic Store Facial Cleansing Brush,Soft Silicone Face Scrubber,Facial Exfoliation Scrub for Massage Pore Cleansing Blackhead Removing Deep Scrubbing for All Kinds of Skins (MultiColor)  ",,,,₹299,₹85,Save ₹214 (72%),3.7 out of 5 stars,46,https://www.amazon.in/Authentic-Store-Cleansing-Exfoliation-MultiColor/dp/B08T641GF2/ref=sr_1_7?dchild=1&keywords=face+brush&qid=1624530098&sr=8-7
FSFTTRAD Face Brush for Cleansing and Exfoliating - Double Sided Facial Cleaning Brush with Soft Bristles Scrubber to Massage and Scrub Your Skin  ,Amazon's Choice,,,₹999,₹299,Save ₹700 (70%),4.1 out of 5 stars,80,https://www.amazon.in/FSFTTRAD-Face-Brush-Cleansing-Exfoliating/dp/B08LK1SM7F/ref=ice_ac_b_dpb?dchild=1&keywords=face+brush&qid=1624530098&sr=8-8
Rsentera Profesional Face Pack and Facial Bleach Brush ( Pack of 2)  ,,,,₹299,₹95,Save ₹204 (68%),4.5 out of 5 stars,9,https://www.amazon.in/Rsentera-Profesional-Facial-Bleach-Brush/dp/B08VH61S9Q/ref=sr_1_9?dchild=1&keywords=face+brush&qid=1624530098&sr=8-9
TWIREY Personal/Professional Face Pack Cleaning Sponge with Face Pack Brush (1 PCS EACH)  ,,,,₹299,₹75,Save ₹224 (75%),5.0 out of 5 stars,3,https://www.amazon.in/TWIREY-Personal-Professional-Face-Cleaning-Sponge/dp/B0957RRB6R/ref=sr_1_10?dchild=1&keywords=face+brush&qid=1624530098&sr=8-10
"MINISO 4 PCs DIY Facial Face Mask Bowl Brush, Spoon, Stick Kit  ",Deal of the Day ,,,₹190,₹180.50,Save ₹9.50 (5%),4.4 out of 5 stars,"1,430",https://www.amazon.in/MINISO-Facial-Brush-Spoon-Stick/dp/B08867NW4Z/ref=sr_1_11?dchild=1&keywords=face+brush&qid=1624530098&sr=8-11
"TREXEE 2 in 1 Facial Cleansing Brush, 3D Double Manual Silicone & Soft Bristles Face Brush Face Cleansing Brush Exfoliating Grease Removal Massage Tool Wash Makeup, Massaging, Acne (White)  ",,,,₹599,₹149,Save ₹450 (75%),4.1 out of 5 stars,34,https://www.amazon.in/TREXEE-Cleansing-Silicone-Exfoliating-Massaging/dp/B08NWHBSVQ/ref=sr_1_12?dchild=1&keywords=face+brush&qid=1624530098&sr=8-12
ClubBeauty Professional Long Lasting Flat Face Pack Brush  ,,,,₹199,₹55,Save ₹144 (72%),3.8 out of 5 stars,4,https://www.amazon.in/ClubBeauty-Professional-Long-Lasting-Brush/dp/B0924G84T2/ref=sr_1_13?dchild=1&keywords=face+brush&qid=1624530098&sr=8-13
TWIREY Women's Polycotton Stretchable Elasticized Adjustable Facial Headbands and Face Pack Brush and Face Cleaning Sponges (1PCS EACH COMBO)  ,,,,₹399,₹199,Save ₹200 (50%),4.2 out of 5 stars,54,https://www.amazon.in/TWIREY-Polycotton-Stretchable-Elasticized-Adjustable/dp/B094G2TVBK/ref=sr_1_14?dchild=1&keywords=face+brush&qid=1624530098&sr=8-14
"KYLIE Premium Synthetic Kabuki Foundation Face Powder Blush Eyeshadow Brush Makeup Brush Kit with Blender Sponge and Brush Cleaner - Makeup Brushes Set (10pcs, Black/Silver)  ",Deal of the Day ,,,₹989,₹295,Save ₹694 (70%),3.8 out of 5 stars,"3,709",https://www.amazon.in/KYLIE-Brushes-Synthetic-Foundation-Eyeshadow/dp/B07RZG9HD1/ref=sr_1_15?dchild=1&keywords=face+brush&qid=1624530098&sr=8-15
"MINISO Makeup Brush Set 7PCS Foundation Brush Set for Face Makeup, Pale Turquoise  ",Best seller,,,,₹260,,4.3 out of 5 stars,"2,181",https://www.amazon.in/gp/bestsellers/beauty/10850776031/ref=sr_bs_15_10850776031_1
CETC Professional Flat Face Pack Brush (1)  ,,,,₹149,₹65,Save ₹84 (56%),3.8 out of 5 stars,72,https://www.amazon.in/CETC-Professional-Flat-Face-Brush/dp/B07RXK2NSN/ref=sr_1_17?dchild=1&keywords=face+brush&qid=1624530098&sr=8-17
Futurekart Deep Pore Cleaning Face Cleansing Exfoliating Brush Facial Wash Massage Soft Scrubber Bamboo Fiber Double Sided  ,,,,₹599,₹299,Save ₹300 (50%),3.9 out of 5 stars,332,https://www.amazon.in/Futurekart-Cleaning-Cleansing-Exfoliating-Scrubber/dp/B07FYB6246/ref=sr_1_18?dchild=1&keywords=face+brush&qid=1624530098&sr=8-18
FreShine Multifunctional Beauty Care Brush Deep Clean 5 in 1 Blackhead Remover Facial Scrubs & Polishes Massager | Pink  ,,,,₹999,₹299,Save ₹700 (70%),3.3 out of 5 stars,644,https://www.amazon.in/FreShine-Facial-Multifunction-Massager-Blackhead/dp/B083KLC76P/ref=sr_1_19?dchild=1&keywords=face+brush&qid=1624530098&sr=8-19
Ocean Professional Face Pack Brush (White)  ,,,,₹180,₹90,Save ₹90 (50%),3.8 out of 5 stars,297,https://www.amazon.in/Ocean-Professional-Face-Pack-Brush/dp/B01LGY2XBC/ref=sr_1_20?dchild=1&keywords=face+brush&qid=1624530098&sr=8-20
Vega Mascara Brush  ,Limited time deal,Sponsored,,₹80,₹75,Save ₹5 (6%),4.3 out of 5 stars,878,https://www.amazon.in/gp/slredirect/picassoRedirect.html/ref=pa_sp_mtf_aps_sr_pg1_1?ie=UTF8&adId=A0012129YUKHQEU97ZFH&url=%2FVega-EV-10-Mascara-Brush%2Fdp%2FB008TO89F2%2Fref%3Dsr_1_21_sspa%3Fdchild%3D1%26keywords%3Dface%2Bbrush%26qid%3D1624530098%26smid%3DAT95IG9ONZD7S%26sr%3D8-21-spons%26psc%3D1&qualifier=1624530098&id=3699490247886998&widgetName=sp_mtf
Gubb USA Eyelash Curler For Women  ,,Sponsored,,₹199,₹197,Save ₹2 (1%),4.1 out of 5 stars,539,https://www.amazon.in/gp/slredirect/picassoRedirect.html/ref=pa_sp_mtf_aps_sr_pg1_1?ie=UTF8&adId=A074379746AYTA4QZWW5&url=%2FGubb-USA-Eyelash-Curler-Women%2Fdp%2FB01A0PQD64%2Fref%3Dsr_1_22_sspa%3Fdchild%3D1%26keywords%3Dface%2Bbrush%26qid%3D1624530098%26sr%3D8-22-spons%26psc%3D1&qualifier=1624530098&id=3699490247886998&widgetName=sp_mtf
"Brain Freezer Face Powder Makeup Brush, Single Large Blush Brush for Blending Makeup Black Golden  ",,Sponsored,,₹298,₹171,Save ₹127 (43%),4.2 out of 5 stars,194,https://www.amazon.in/gp/slredirect/picassoRedirect.html/ref=pa_sp_mtf_aps_sr_pg1_1?ie=UTF8&adId=A05054843I8IBC14E6HNN&url=%2FBrain-Freezer-Makeup-Cosmetic-Powder%2Fdp%2FB07JRFCBLJ%2Fref%3Dsr_1_23_sspa%3Fdchild%3D1%26keywords%3Dface%2Bbrush%26qid%3D1624530098%26sr%3D8-23-spons%26psc%3D1&qualifier=1624530098&id=3699490247886998&widgetName=sp_mtf
"CETC ® Complete Makeup Mini Brush Kit with Storage Box and Sponge Puff Set of 7 Pieces Sponge Puff (Colour may vary, Black)  ",,Sponsored,,₹399,₹179,Save ₹220 (55%),3.4 out of 5 stars,89,https://www.amazon.in/gp/slredirect/picassoRedirect.html/ref=pa_sp_mtf_aps_sr_pg1_1?ie=UTF8&adId=A05233013KGT8BNP592CK&url=%2FCETC-Complete-Makeup-Storage-Sponge%2Fdp%2FB07RYLGWS9%2Fref%3Dsr_1_24_sspa%3Fdchild%3D1%26keywords%3Dface%2Bbrush%26qid%3D1624530098%26sr%3D8-24-spons%26psc%3D1%26smid%3DA3OEXI315WT271&qualifier=1624530098&id=3699490247886998&widgetName=sp_mtf
"TREXEE Octopus Design Silicone Facial Cleansing Brush Face Exfoliator Massager Beauty Tool All in One Deep Pore Cleansing Sponge & Brush, For Exfoliating, Massage, Cleansing Soft Brush (pink)  ",,,,₹499,₹105,Save ₹394 (79%),4.2 out of 5 stars,147,https://www.amazon.in/TREXEE-Silicone-Cleansing-Exfoliator-Exfoliating/dp/B08NPRHY21/ref=sr_1_25?dchild=1&keywords=face+brush&qid=1624530098&sr=8-25
Nyamah Sales Face Pack Brush with Facial Spa Headband Adjustable Makeup Tools for Home and Salon Multicolor  ,,,,₹399,₹199,Save ₹200 (50%),1.0 out of 5 stars,1,https://www.amazon.in/Nyamah-Sales-Headband-Adjustable-Multicolor/dp/B09687FXFJ/ref=sr_1_26?dchild=1&keywords=face+brush&qid=1624530098&sr=8-26
Action Pro Cleaning Pad Wash Face Facial Exfoliating Brush SPA Skin Scrub Cleanser Tool Face Massager (Pink)  ,,,,₹199,₹159,Save ₹40 (20%),3.9 out of 5 stars,351,https://www.amazon.in/Action-Pro-Cleaning-Exfoliating-Cleanser/dp/B07HP44RL4/ref=sr_1_27?dchild=1&keywords=face+brush&qid=1624530098&sr=8-27
Face Pack And Facial Bleach Makeup Brush Multicolor 1 pcs  ,,,,₹199,₹75,Save ₹124 (62%),4.2 out of 5 stars,33,https://www.amazon.in/Facial-Bleach-Makeup-Brush-Multicolor/dp/B08V9CBQKQ/ref=sr_1_28?dchild=1&keywords=face+brush&qid=1624530098&sr=8-28
QKYPZO Women's Polycotton Stretchable Elasticized Adjustable Facial Headbands and Face Pack Brush and Face Cleaning Sponges (Colour May Vary)  ,,,,₹399,₹199,Save ₹200 (50%),4.8 out of 5 stars,22,https://www.amazon.in/QKYPZO-Polycotton-Stretchable-Elasticized-Adjustable/dp/B0965GLXNY/ref=sr_1_29?dchild=1&keywords=face+brush&qid=1624530098&sr=8-29
ClubBeauty Professional Flat Face Pack Brush Combo of 2Pcs  ,,,,₹199,₹74,Save ₹125 (63%),5.0 out of 5 stars,1,https://www.amazon.in/ClubBeauty-Professional-Flat-Brush-Combo/dp/B0924DRQ9V/ref=sr_1_30?dchild=1&keywords=face+brush&qid=1624530098&sr=8-30
Colour Blast Women's Polycotton Stretchable Elasticized Adjustable Facial Headbands and Face Pack Brush and Face Cleaning Sponges Combo (Colour May Vary)  ,,,,₹499,₹199,Save ₹300 (60%),3.6 out of 5 stars,543,https://www.amazon.in/Colour-Blast-Polycotton-Stretchable-Elasticized/dp/B07NBPH85G/ref=sr_1_31?dchild=1&keywords=face+brush&qid=1624530098&sr=8-31
"ELIBLISS Brightening Vitamin C Foaming Face Wash With Built-In Face Cleanser Brush For Deep Cleansing, Bright Beauty Spot-less Glow - No Parabens, Sulphate, Silicones, 150 ml  ",,,,₹499,₹199,Save ₹300 (60%),4.3 out of 5 stars,6,https://www.amazon.in/ELIBLISS-Brightening-Cleanser-Cleansing-Spot-less/dp/B095RP8MZ2/ref=sr_1_32?dchild=1&keywords=face+brush&qid=1624530098&sr=8-32
Elecsera Face Pack Brush - Pack of 2  ,,,,₹199,₹80,Save ₹119 (60%),4.0 out of 5 stars,131,https://www.amazon.in/Elecsera-Face-Pack-Brush/dp/B07Z3YYX98/ref=sr_1_33?dchild=1&keywords=face+brush&qid=1624530098&sr=8-33
"Brushman Facial Cleansing Brush,Soft Silicone Face Scrubber,Facial Exfoliation Scrub for Massage Pore Cleansing Blackhead Removing Deep Scrubbing for All Kinds of Skins (2ed-Pink+Purple)  ",,,,,₹199,,3.8 out of 5 stars,48,https://www.amazon.in/Brushman-Cleansing-Exfoliation-Blackhead-Scrubbing/dp/B08ML417SV/ref=sr_1_34?dchild=1&keywords=face+brush&qid=1624530098&sr=8-34
SK TRADING 1 bath belt + 1 body brush back scrubber cleanser shower loofah best for face skin cleansing soft silicone handle scrub cleaner for men women (Combo pack with bath brush) (Multicolor)04  ,,,,₹999,₹220,Save ₹779 (78%),,,https://www.amazon.in/scrubber-cleanser-cleansing-silicone-Multicolor/dp/B0965LFLST/ref=sr_1_35?dchild=1&keywords=face+brush&qid=1624530098&sr=8-35
FOK 1 PC Octopus Design Silicone Facial Cleansing Brush Face Exfoliator Massager Beauty Tool - Pink  ,,,,,₹189,,4.1 out of 5 stars,198,https://www.amazon.in/FOK-Silicone-Cleansing-Exfoliator-Massager/dp/B07R1WHDKX/ref=sr_1_36?dchild=1&keywords=face+brush&qid=1624530098&sr=8-36
"Facial Cleansing Brush, Sonic Silicone Scrubber, Face Vibrating Massager, IPX7 Waterproof, Rechargeable, Deep Cleaning for All Skins- multi color  ",,,,₹599,₹239,Save ₹360 (60%),4.1 out of 5 stars,15,https://www.amazon.in/Cleansing-Silicone-Vibrating-Waterproof-Rechargeable/dp/B08Y74RD8N/ref=sr_1_37?dchild=1&keywords=face+brush&qid=1624530098&sr=8-37
MACPLUS Makeup Powder Brush (Black Color)  ,Best sellerDeal of the Day ,,,₹599,₹238,Save ₹361 (60%),4.4 out of 5 stars,87,https://www.amazon.in/gp/bestsellers/beauty/10850770031/ref=sr_bs_37_10850770031_1
"Welocity Professional Face Massager For Women , scrubber ,Facial Brush, style 2 Speeds With 5 Brush Heads Facial Beauty Brush  ",,,,₹499,₹265,Save ₹234 (47%),3.4 out of 5 stars,18,https://www.amazon.in/Welocity-Professional-Massager-scrubber-Facial/dp/B08QRFN3DD/ref=sr_1_39?dchild=1&keywords=face+brush&qid=1624530098&sr=8-39
"BeautyQua Face Pack , bleach Brush Clear Handel Brush  (Pack of 1)  ",,,Only 2 left in stock.,₹199,₹96,Save ₹103 (52%),,,https://www.amazon.in/BeautyQua-bleach-Brush-Handel-Brush/dp/B0949H6V15/ref=sr_1_40?dchild=1&keywords=face+brush&qid=1624530098&sr=8-40
Swiss Beauty Professional Face & Eye Brush Set  ,,,,₹799,₹610,Save ₹189 (24%),4.5 out of 5 stars,279,https://www.amazon.in/Swiss-Beauty-Professional-Face-Brush/dp/B08MQKXPQT/ref=sr_1_41?dchild=1&keywords=face+brush&qid=1624530098&sr=8-41
RUSTIC RITUALS best of nature for you! Men's/Women's Face Cleansing Brush with Wooden Handle  ,,,,,₹349,,4.0 out of 5 stars,93,https://www.amazon.in/Cleansing-Brushing-Scrubbing-Exfoliating-Cleaning/dp/B07YDTNF6Z/ref=sr_1_42?dchild=1&keywords=face+brush&qid=1624530098&sr=8-42
"Okayji Cleansing Pads, Silicone Face Scrubbers Soft Exfoliates Cleansing Tool Massage Blackhead Removing Baby Pet Shower (Blue)  ",,,,₹299,₹170,Save ₹129 (43%),4.2 out of 5 stars,"1,784",https://www.amazon.in/Okayji-Cleansing-Scrubbers-Exfoliates-Blackhead/dp/B078JL22FL/ref=sr_1_43?dchild=1&keywords=face+brush&qid=1624530098&sr=8-43
"Synaty Multifunctional Silicone Face Mask Brush, One Head Face Pack Applicator Tool, One Head Face Cleansing, For Mud Clay Charcoal Mixed Face Pack (Pink)  ",Limited time deal,,,,₹284,,4.4 out of 5 stars,137,https://www.amazon.in/Synaty-Multifunctional-Silicone-Applicator-Cleansing/dp/B0894ZVH9K/ref=sr_1_44?dchild=1&keywords=face+brush&qid=1624530098&sr=8-44
Angelie Foundation Makeup Cosmetic Brush (Natural White Colour)  ,Best seller,,,₹199,₹155,Save ₹44 (22%),4.0 out of 5 stars,408,https://www.amazon.in/gp/bestsellers/beauty/10850773031/ref=sr_bs_44_10850773031_1
Face Pack Brush 2 pcs 1 pointed blackheadpin free  ,,,,₹150,₹72,Save ₹78 (52%),4.7 out of 5 stars,4,https://www.amazon.in/Face-Pack-Brush-pointed-blackheadpin/dp/B08YKHTMZL/ref=sr_1_46?dchild=1&keywords=face+brush&qid=1624530098&sr=8-46
ayushicreationa Professional Flat Face Pack Brush Cosmetic Makeup Brush Set for Men and Women (2 PCS Plastic Brush)  ,,,,₹349,₹159,Save ₹190 (54%),,,https://www.amazon.in/ayushicreationa-Professional-Cosmetic-Makeup-Plastic/dp/B093L2SZQM/ref=sr_1_47?dchild=1&keywords=face+brush&qid=1624530098&sr=8-47
Miss & Mam Makeup Brush Set of 7(Colour May Vary) with Storage box + sponge puff(Colour May Vary)  ,Deal of the Day ,,,₹794,₹194,Save ₹600 (76%),3.6 out of 5 stars,"3,558",https://www.amazon.in/MISS-MAM-Hilary-Makeup-Storage/dp/B07K6JJKTV/ref=sr_1_48?dchild=1&keywords=face+brush&qid=1624530098&sr=8-48
"Kylie Mini Vegan Face Pack Brush For Face Mask For Women & Men, Pack,of 2 Hair plastic Brush  ",,,,₹398,₹179,Save ₹219 (55%),4.1 out of 5 stars,102,https://www.amazon.in/Kylie-Animal-Natural-Wooden-Handle/dp/B07X9BK4TD/ref=sr_1_49?dchild=1&keywords=face+brush&qid=1624530098&sr=8-49
"Syga 1 Pieces Facial Cleansing Pads, Soft Silicone Face Scrubbers Exfoliators Face Blackhead Removing Massage Tool (Assorted Color)  ",,,,₹350,₹105,Save ₹245 (70%),3.9 out of 5 stars,649,https://www.amazon.in/SYGA-Cleansing-Scrubbers-Exfoliators-Blackhead/dp/B07NC21YMC/ref=sr_1_50?dchild=1&keywords=face+brush&qid=1624530098&sr=8-50
Zureni Makeup Brush for Facial & Face Pack Mask Cream Applicator Beauty Tool with Ultrasoft Bristles (Pack of 2)  ,,,,₹699,₹219,Save ₹480 (69%),,,https://www.amazon.in/Zureni-Makeup-Applicator-Ultrasoft-Bristles/dp/B09653RNCH/ref=sr_1_51?dchild=1&keywords=face+brush&qid=1624530098&sr=8-51
EAYIRA Facial Kit // Multifunction Beauty Care Brush Deep Clean 5 in 1 Portable Facial Cleaner Relief Face Massager/Blackhead Remover Facial Cleanser // facial massager (Multi)  ,,,,₹499,₹349,Save ₹150 (30%),3.0 out of 5 stars,47,https://www.amazon.in/EAYIRA-Multifunction-Portable-Massager-Blackhead/dp/B08T9PS4CB/ref=sr_1_52?dchild=1&keywords=face+brush&qid=1624530098&sr=8-52
Angelie Professional Flat Face Pack Brush Combo of 3Pcs  ,,,,₹299,₹175,Save ₹124 (41%),4.0 out of 5 stars,90,https://www.amazon.in/Angelie-Professional-Flat-Brush-Combo/dp/B08HZBV5CJ/ref=sr_1_53?dchild=1&keywords=face+brush&qid=1624530098&sr=8-53
Jellyfish Silicone Facial Cleansing Brush Makeup Removers Face Exfoliator Deep Pore Blackheads Removing Cleansing Sponge Massager Beauty Tool (Pack of Two Pink)  ,,,,₹499,₹130,Save ₹369 (74%),4.3 out of 5 stars,23,https://www.amazon.in/Jellyfish-Silicone-Cleansing-Exfoliator-Blackheads/dp/B08RBTY88Y/ref=sr_1_54?dchild=1&keywords=face+brush&qid=1624530098&sr=8-54
"KYLIE Makeup Brushes Set Premium Synthetic Kabuki Foundation Face Powder Blush Eye shadow Brush Makeup Brush Kit with Blender Sponge and Brush Cleaner (10pcs,Pink/Silver)  ",,,,₹989,₹290,Save ₹699 (71%),3.8 out of 5 stars,687,https://www.amazon.in/KYLIE-Brushes-Synthetic-Foundation-Eyeshadow/dp/B07S92N87D/ref=sr_1_55?dchild=1&keywords=face+brush&qid=1624530098&sr=8-55
"AY Double Sided Deep Pore Cleaning Facial Cleansing Portable Brush For Face Cleaning,  ",,,,₹599,₹275,Save ₹324 (54%),4.1 out of 5 stars,126,https://www.amazon.in/AY-Double-Cleaning-Cleansing-Portable/dp/B07MLD582V/ref=sr_1_56?dchild=1&keywords=face+brush&qid=1624530098&sr=8-56
CETC® Makeup Brushes -Set of 10 Pieces (Black)  ,,Sponsored,,₹499,₹249,Save ₹250 (50%),3.7 out of 5 stars,80,https://www.amazon.in/gp/slredirect/picassoRedirect.html/ref=pa_sp_btf_aps_sr_pg1_1?ie=UTF8&adId=A00379533OUI3ZJI0KVHJ&url=%2FCETC-Makeup-Brushes-Pieces-Black%2Fdp%2FB07S2QY12H%2Fref%3Dsr_1_57_sspa%3Fdchild%3D1%26keywords%3Dface%2Bbrush%26qid%3D1624530098%26sr%3D8-57-spons%26psc%3D1%26smid%3DA3OEXI315WT271&qualifier=1624530098&id=3699490247886998&widgetName=sp_btf
CETC® Makeup Brushes with Foundation/Blush Brush -(Set of 11 Pieces) (Pink)  ,,Sponsored,,₹599,₹299,Save ₹300 (50%),3.5 out of 5 stars,16,https://www.amazon.in/gp/slredirect/picassoRedirect.html/ref=pa_sp_btf_aps_sr_pg1_1?ie=UTF8&adId=A08601243DIYKT3R7B8PB&url=%2FCETC-Makeup-Brushes-Foundation-Pieces%2Fdp%2FB07TDZSCCY%2Fref%3Dsr_1_58_sspa%3Fdchild%3D1%26keywords%3Dface%2Bbrush%26qid%3D1624530098%26sr%3D8-58-spons%26psc%3D1%26smid%3DA3OEXI315WT271&qualifier=1624530098&id=3699490247886998&widgetName=sp_btf
Ankita Make - Up - Brush with Wooden Handle and Natural Animal/Synthetic Hair (Blusher Brush)  ,,Sponsored,,,₹180,,,,https://www.amazon.in/gp/slredirect/picassoRedirect.html/ref=pa_sp_btf_aps_sr_pg1_1?ie=UTF8&adId=A02788372TTITB1NDP8VJ&url=%2FAnkita-Make-Natural-Synthetic-Blusher%2Fdp%2FB08HJ5P8K4%2Fref%3Dsr_1_59_sspa%3Fdchild%3D1%26keywords%3Dface%2Bbrush%26qid%3D1624530098%26sr%3D8-59-spons%26psc%3D1&qualifier=1624530098&id=3699490247886998&widgetName=sp_btf
"CETC® Complete Makeup Mini Brush Kit with Storage Box, Black (Set of 7 Pieces)  ",,Sponsored,,₹399,₹99,Save ₹300 (75%),3.3 out of 5 stars,137,https://www.amazon.in/gp/slredirect/picassoRedirect.html/ref=pa_sp_btf_aps_sr_pg1_1?ie=UTF8&adId=A0523981JSL706Q3UT67&url=%2FCETC-Complete-Makeup-Storage-Pieces%2Fdp%2FB07RXJQ252%2Fref%3Dsr_1_60_sspa%3Fdchild%3D1%26keywords%3Dface%2Bbrush%26qid%3D1624530098%26sr%3D8-60-spons%26psc%3D1%26smid%3DA3OEXI315WT271&qualifier=1624530098&id=3699490247886998&widgetName=sp_btf
"GUBB USA HD Foundation Brush For Face Makeup, Professional Wooden Makeup Brush Single - Brown  ",,Sponsored,,₹199,₹159,Save ₹40 (20%),4.2 out of 5 stars,347,https://www.amazon.in/gp/slredirect/picassoRedirect.html/ref=pa_sp_atf_next_aps_sr_pg2_1?ie=UTF8&adId=A0225353367JVWGFFT0ZQ&url=%2FGUBB-Foundation-Makeup-Blending-Professional%2Fdp%2FB07ZXCRQXY%2Fref%3Dsr_1_49_sspa%3Fdchild%3D1%26keywords%3Dface%2Bbrush%26qid%3D1624530116%26sr%3D8-49-spons%26psc%3D1&qualifier=1624530116&id=7622404050149998&widgetName=sp_atf_next
"GUBB USA Professional Makeup Sponge Beauty Blender For Blending Face Makeup, Pink Face Sponge Puff  ",,Sponsored,,₹249,₹200,Save ₹49 (20%),4.1 out of 5 stars,248,https://www.amazon.in/gp/slredirect/picassoRedirect.html/ref=pa_sp_atf_next_aps_sr_pg2_1?ie=UTF8&adId=A09945583BLE2NKIOTS0W&url=%2FGUBB-Beauty-Blender-Professional-Makeup%2Fdp%2FB07JLZR89G%2Fref%3Dsr_1_50_sspa%3Fdchild%3D1%26keywords%3Dface%2Bbrush%26qid%3D1624530116%26sr%3D8-50-spons%26psc%3D1&qualifier=1624530116&id=7622404050149998&widgetName=sp_atf_next
"Deborah Milano 24 Ore Perfect Foundation, 1  ",Limited time deal,Sponsored,,"₹1,400","₹1,120",Save ₹280 (20%),,,https://www.amazon.in/gp/slredirect/picassoRedirect.html/ref=pa_sp_atf_next_aps_sr_pg2_1?ie=UTF8&adId=A0149192FE2AO24N0WLU&url=%2FDeborah-Milano-Ore-Perfect-Foundation%2Fdp%2FB0079Z3Q8W%2Fref%3Dsr_1_51_sspa%3Fdchild%3D1%26keywords%3Dface%2Bbrush%26qid%3D1624530116%26smid%3DA1KANBEPNRVS3J%26sr%3D8-51-spons%26psc%3D1&qualifier=1624530116&id=7622404050149998&widgetName=sp_atf_next
Dr. Browns Deluxe Makeup Brush  ,,Sponsored,,,₹449,,,,https://www.amazon.in/gp/slredirect/picassoRedirect.html/ref=pa_sp_atf_next_aps_sr_pg2_1?ie=UTF8&adId=A03942772PSNI7NGQQ7AH&url=%2FDr-Browns-Deluxe-Makeup-Brush%2Fdp%2FB07N63BB1Q%2Fref%3Dsr_1_52_sspa%3Fdchild%3D1%26keywords%3Dface%2Bbrush%26qid%3D1624530116%26sr%3D8-52-spons%26psc%3D1&qualifier=1624530116&id=7622404050149998&widgetName=sp_atf_next
JERN Professional Makeup Face Blush Powder Brush Tool  ,,,,₹400,₹239,Save ₹161 (40%),4.4 out of 5 stars,331,https://www.amazon.in/JERN-Professional-Makeup-Blush-Powder/dp/B083P3XC5G/ref=sr_1_53?dchild=1&keywords=face+brush&qid=1624530116&sr=8-53
"Kri N Sha S.K.SALES Facial Cleansing Brush, Sonic Silicone Scrubber, Face Vibrating Massager, IPX7 Waterproof, Rechargeable, Deep Cleaning for All Skins- multicolour  ",,,,₹999,₹340,Save ₹659 (66%),3.7 out of 5 stars,309,https://www.amazon.in/S-K-SALES-Cleansing-Waterproof-Rechargeable-Skins-Rose/dp/B081Z68CBR/ref=sr_1_54?dchild=1&keywords=face+brush&qid=1624530116&sr=8-54
"WOW Skin Science Apple Cider Vinegar Foaming Face Wash - with Organic Certified Himalayan Apple Cider Vinegar - No Parabens, Sulphate, Silicones & Color (with Built-in Brush),150ml  ",,,,₹389,₹359,Save ₹30 (8%),4.1 out of 5 stars,"18,488",https://www.amazon.in/WOW-Organic-Vinegar-Foaming-Built/dp/B07SQXPW35/ref=sr_1_55?dchild=1&keywords=face+brush&qid=1624530116&sr=8-55
INENCE Professional 15 Makeup Brush Set Black II Makeup Brushes Set Premium Foundation Face Powder Blush Eyeshadow Brush Makeup Brush Kit  ,,,,"₹1,999",₹499,"Save ₹1,500 (75%)",5.0 out of 5 stars,2,https://www.amazon.in/INENCE-Professional-Brushes-Foundation-Eyeshadow/dp/B08V5LJ2QW/ref=sr_1_56?dchild=1&keywords=face+brush&qid=1624530116&sr=8-56
"Bella Vita Organic Glowey Face Pack, Scrub & Face Wash 3 in 1 for Glowing Skin & Radiance Unisex Ayurveda With Free Face Pack Applicator Brush (Brushes - Pack of 2)  ",,,,₹499,₹225,Save ₹274 (55%),4.2 out of 5 stars,644,https://www.amazon.in/Bella-Vita-Organic-Animal-Natural/dp/B07TGDTXPW/ref=sr_1_57?dchild=1&keywords=face+brush&qid=1624530116&sr=8-57
Face Pack Brush 1 pcs  ,,,,₹199,₹151,Save ₹48 (24%),4.3 out of 5 stars,269,https://www.amazon.in/Ear-Lobe-Accessories-Brown-Brush/dp/B0791HJF3C/ref=sr_1_58?dchild=1&keywords=face+brush&qid=1624530116&sr=8-58
Caresmith Sonic Facial Cleansing Massager Brush (Pink Taffy)  ,,,,"₹2,000",₹699,"Save ₹1,301 (65%)",4.0 out of 5 stars,"2,144",https://www.amazon.in/Caresmith-Ultrasonic-Facial-Cleansing-Massager/dp/B07RJSJHR3/ref=sr_1_49?dchild=1&keywords=face+brush&qid=1624530116&sr=8-49
Regular face pack brush set of 2  ,,,,₹198,₹95,Save ₹103 (52%),5.0 out of 5 stars,1,https://www.amazon.in/Regular-face-pack-brush-set/dp/B08RJM1D4X/ref=sr_1_50?dchild=1&keywords=face+brush&qid=1624530116&sr=8-50
"MACPLUS Premium Quality Makeup Brush Set, 24 Pieces Set with Black Leather Case  ",Deal of the Day ,,,"₹1,599",₹399,"Save ₹1,200 (75%)",4.0 out of 5 stars,"2,696",https://www.amazon.in/MACPLUS-Premium-Quality-Makeup-Leather/dp/B07JJLQT8Z/ref=sr_1_51?dchild=1&keywords=face+brush&qid=1624530116&sr=8-51
