name,badge_1,badge_2,badge_3,mrp,discounted_price,discount,rating,rating_count,link
Caresmith Sonic Facial Cleansing Massager Brush (Blue Arctic)  ,Limited time deal,Sponsored,,"₹2,000",₹689,"Save ₹1,311 (66%)",3.9 out of 5 stars,"2,452",https://www.amazon.in/gp/slredirect/picassoRedirect.html/ref=pa_sp_atf_aps_sr_pg1_1?ie=UTF8&adId=A07785721P3TXEGX0LWQO&url=%2FCaresmith-Ultrasonic-Facial-Cleansing-Massager%2Fdp%2FB07RLMNJM9%2Fref%3Dsr_1_1_sspa%3Fdchild%3D1%26keywords%3Dface%2Bbrush%26qid%3D1627877544%26smid%3DAN4SOXCEZC9R7%26sr%3D8-1-spons%26psc%3D1&qualifier=1627877544&id=4868768847737469&widgetName=sp_atf
Braun Face 810 – Facial Epilator and Facial Cleansing Brush with Micro-Oscillations (White)  ,,Sponsored,,"₹4,309","₹3,619",Save ₹690 (16%),3.8 out of 5 stars,"12,097",https://www.amazon.in/gp/slredirect/picassoRedirect.html/ref=pa_sp_atf_aps_sr_pg1_1?ie=UTF8&adId=A09610172RA65JQ9G554Q&url=%2FBraun-Face-810-Cleansing-Micro-Oscillations%2Fdp%2FB00LZPLRCE%2Fref%3Dsr_1_2_sspa%3Fdchild%3D1%26keywords%3Dface%2Bbrush%26qid%3D1627877544%26sr%3D8-2-spons%26psc%3D1&qualifier=1627877544&id=4868768847737469&widgetName=sp_atf
"HealthSense Pure-Skin FB 09 Facial Cleansing Brush with 2 Brush Heads, Waterproof IPX7 & 1 year warranty  ",,Sponsored,,"₹1,600",₹799,Save ₹801 (50%),3.6 out of 5 stars,453,https://www.amazon.in/gp/slredirect/picassoRedirect.html/ref=pa_sp_atf_aps_sr_pg1_1?ie=UTF8&adId=A08896123KC2RJ7NJIJPF&url=%2FHealthSense-Electric-Facial-Cleansing-Brush%2Fdp%2FB079W9FHWM%2Fref%3Dsr_1_3_sspa%3Fdchild%3D1%26keywords%3Dface%2Bbrush%26qid%3D1627877544%26sr%3D8-3-spons%26psc%3D1&qualifier=1627877544&id=4868768847737469&widgetName=sp_atf
"Lafz Apple Cider Vinegar Foaming Face Wash With Built-In Face Brush To Exfoliate & Deep Cleanse. With Acv, Aloe Vera & Basil For Clear, Moisturized Skin. Vegetarian, Ph Neutral, Paraben Free, 100 ml  ",,Sponsored,,₹299,₹279,Save ₹20 (7%),,,https://www.amazon.in/gp/slredirect/picassoRedirect.html/ref=pa_sp_atf_aps_sr_pg1_1?ie=UTF8&adId=A0427938OSLD4WKWZNAW&url=%2FVinegar-Exfoliate-Cleanse-Moisturized-Vegetarian%2Fdp%2FB0977DYNFY%2Fref%3Dsr_1_4_sspa%3Fdchild%3D1%26keywords%3Dface%2Bbrush%26qid%3D1627877544%26sr%3D8-4-spons%26psc%3D1&qualifier=1627877544&id=4868768847737469&widgetName=sp_atf
"Ear Lobe & Accessories Face Pack Brush, Brown (Pack of 2)  ",Best seller,,,₹249,₹175,Save ₹74 (30%),4.2 out of 5 stars,"1,057",https://www.amazon.in/gp/bestsellers/beauty/10850769031/ref=sr_bs_4_10850769031_1
FreShine Multifunctional Beauty Care Brush Deep Clean 5 in 1 Blackhead Remover Facial Scrubs & Polishes Massager | Pink  ,,,,₹999,₹299,Save ₹700 (70%),3.3 out of 5 stars,707,https://www.amazon.in/FreShine-Facial-Multifunction-Massager-Blackhead/dp/B083KLC76P/ref=sr_1_6?dchild=1&keywords=face+brush&qid=1627877544&sr=8-6
"KYLIE Premium Synthetic Kabuki Foundation Face Powder Blush Eyeshadow Brush Makeup Brush Kit with Blender Sponge and Brush Cleaner - Makeup Brushes Set (10pcs, Black/Silver)  ",Limited time deal,,,₹989,₹249,Save ₹740 (75%),3.8 out of 5 stars,"4,356",https://www.amazon.in/KYLIE-Brushes-Synthetic-Foundation-Eyeshadow/dp/B07RZG9HD1/ref=sr_1_7?dchild=1&keywords=face+brush&qid=1627877544&smid=A36SBMT5ON572M&sr=8-7
"TREXEE Octopus Design Silicone Facial Cleansing Brush Face Exfoliator Massager Beauty Tool All in One Deep Pore Cleansing Sponge & Brush, For Exfoliating, Massage, Cleansing Soft Brush (pink)  ",,,,₹499,₹107,Save ₹392 (79%),4.2 out of 5 stars,196,https://www.amazon.in/TREXEE-Silicone-Cleansing-Exfoliator-Exfoliating/dp/B08NPRHY21/ref=sr_1_8?dchild=1&keywords=face+brush&qid=1627877544&sr=8-8
ClubBeauty Professional Long Lasting Flat Face Pack Brush  ,,,,₹199,₹54,Save ₹145 (73%),4.3 out of 5 stars,7,https://www.amazon.in/ClubBeauty-Professional-Long-Lasting-Brush/dp/B0924G84T2/ref=sr_1_9?dchild=1&keywords=face+brush&qid=1627877544&sr=8-9
TWIREY Personal/Professional Face Pack Cleaning Sponge with Face Pack Brush (1 PCS EACH)  ,,,,₹299,₹89,Save ₹210 (70%),5.0 out of 5 stars,14,https://www.amazon.in/TWIREY-Personal-Professional-Face-Cleaning-Sponge/dp/B0957RRB6R/ref=sr_1_10?dchild=1&keywords=face+brush&qid=1627877544&sr=8-10
TWIREY Women's Polycotton Stretchable Elasticized Adjustable Facial Headbands and Face Pack Brush and Face Cleaning Sponges (1PCS EACH COMBO)  ,Deal of the Day ,,,₹399,₹185,Save ₹214 (54%),4.1 out of 5 stars,142,https://www.amazon.in/TWIREY-Polycotton-Stretchable-Elasticized-Adjustable/dp/B094G2TVBK/ref=sr_1_11?dchild=1&keywords=face+brush&qid=1627877544&sr=8-11
"MINISO Makeup Brush Set 7PCS Foundation Brush Set for Face Makeup, Pale Turquoise  ",Best seller,,,,₹260,,4.3 out of 5 stars,"2,868",https://www.amazon.in/gp/bestsellers/beauty/10850757031/ref=sr_bs_11_10850757031_1
QKYPZO Women's Polycotton Stretchable Elasticized Adjustable Facial Headbands and Face Pack Brush and Face Cleaning Sponges (Colour May Vary)  ,,,,₹399,₹169,Save ₹230 (58%),4.1 out of 5 stars,63,https://www.amazon.in/QKYPZO-Polycotton-Stretchable-Elasticized-Adjustable/dp/B0965GLXNY/ref=sr_1_13?dchild=1&keywords=face+brush&qid=1627877544&sr=8-13
Rsentera Profesional Face Pack and Facial Bleach Brush ( Pack of 2)  ,,,,₹299,₹95,Save ₹204 (68%),4.1 out of 5 stars,28,https://www.amazon.in/Rsentera-Profesional-Facial-Bleach-Brush/dp/B08VH61S9Q/ref=sr_1_14?dchild=1&keywords=face+brush&qid=1627877544&sr=8-14
"Authentic Store Facial Cleansing Brush,Soft Silicone Face Scrubber,Facial Exfoliation Scrub for Massage Pore Cleansing Blackhead Removing Deep Scrubbing for All Kinds of Skins (MultiColor)  ",,,,,₹199,,3.9 out of 5 stars,73,https://www.amazon.in/Authentic-Store-Cleansing-Exfoliation-MultiColor/dp/B08T641GF2/ref=sr_1_15?dchild=1&keywords=face+brush&qid=1627877544&sr=8-15
ClubBeauty Professional Flat Face Pack Brush Combo of 2Pcs  ,,,,₹199,₹74,Save ₹125 (63%),5.0 out of 5 stars,5,https://www.amazon.in/ClubBeauty-Professional-Flat-Brush-Combo/dp/B0924DRQ9V/ref=sr_1_16?dchild=1&keywords=face+brush&qid=1627877544&sr=8-16
"Brushman Facial Cleansing Brush,Soft Silicone Face Scrubber,Facial Exfoliation Scrub for Massage Pore Cleansing Blackhead Removing Deep Scrubbing for All Kinds of Skins (2ed-Pink+Purple)  ",,,,,₹199,,3.6 out of 5 stars,78,https://www.amazon.in/Brushman-Cleansing-Exfoliation-Blackhead-Scrubbing/dp/B08ML417SV/ref=sr_1_17?dchild=1&keywords=face+brush&qid=1627877544&sr=8-17
Zureni Facial Mask Applicator Brush for Face Pack Cream Makeup Brush Beauty Tool with Ultrasoft Bristles (2 Pcs)  ,,,,₹699,₹219,Save ₹480 (69%),4.8 out of 5 stars,18,https://www.amazon.in/Zureni-Facial-Applicator-Ultrasoft-Bristles/dp/B09653RNCH/ref=sr_1_18?dchild=1&keywords=face+brush&qid=1627877544&sr=8-18
"MINISO 6 PCs Set DIY Facial Face Mask Bowl Brush, Spoon, Stick Kit, Blue  ",,,,₹200,₹190,Save ₹10 (5%),4.3 out of 5 stars,"1,962",https://www.amazon.in/MINISO-Facial-Brush-Spoon-Stick/dp/B086Z3QSRK/ref=sr_1_19?dchild=1&keywords=face+brush&qid=1627877544&sr=8-19
Action Pro Cleaning Pad Wash Face Facial Exfoliating Brush SPA Skin Scrub Cleanser Tool Face Massager (Pink)  ,,,,₹199,₹159,Save ₹40 (20%),3.9 out of 5 stars,413,https://www.amazon.in/Action-Pro-Cleaning-Exfoliating-Cleanser/dp/B07HP44RL4/ref=sr_1_20?dchild=1&keywords=face+brush&qid=1627877544&sr=8-20
MINISO Cushion Square Hair Brush  ,,Sponsored,,₹200,₹190,Save ₹10 (5%),4.7 out of 5 stars,24,https://www.amazon.in/gp/slredirect/picassoRedirect.html/ref=pa_sp_mtf_aps_sr_pg1_1?ie=UTF8&adId=A0071876M1OTHPJPMBJF&url=%2FMINISO-Cushion-Square-Hair-Brush%2Fdp%2FB097SS4MHP%2Fref%3Dsr_1_21_sspa%3Fdchild%3D1%26keywords%3Dface%2Bbrush%26qid%3D1627877544%26sr%3D8-21-spons%26psc%3D1&qualifier=1627877544&id=4868768847737469&widgetName=sp_mtf
Vega Mascara Brush  ,,Sponsored,,,₹80,,4.3 out of 5 stars,"1,098",https://www.amazon.in/gp/slredirect/picassoRedirect.html/ref=pa_sp_mtf_aps_sr_pg1_1?ie=UTF8&adId=A0012129YUKHQEU97ZFH&url=%2FVega-EV-10-Mascara-Brush%2Fdp%2FB008TO89F2%2Fref%3Dsr_1_22_sspa%3Fdchild%3D1%26keywords%3Dface%2Bbrush%26qid%3D1627877544%26sr%3D8-22-spons%26psc%3D1&qualifier=1627877544&id=4868768847737469&widgetName=sp_mtf
"Mom & World Neem & Aloe Vera Foaming Face Wash With Built-In Brush - No Parabens, Silicones, 120 ml  ",Limited time deal,Sponsored,,₹375,₹225,Save ₹150 (40%),4.7 out of 5 stars,82,https://www.amazon.in/gp/slredirect/picassoRedirect.html/ref=pa_sp_mtf_aps_sr_pg1_1?ie=UTF8&adId=A00304891ON5GI3NVC0B1&url=%2FMom-World-Foaming-Built-Brush%2Fdp%2FB08LNTTKNC%2Fref%3Dsr_1_23_sspa%3Fdchild%3D1%26keywords%3Dface%2Bbrush%26qid%3D1627877544%26smid%3DA13KD517MP86YA%26sr%3D8-23-spons%26psc%3D1&qualifier=1627877544&id=4868768847737469&widgetName=sp_mtf
Vega Cellulite Bristle Bath Brush  ,Limited time deal,Sponsored,,₹550,₹510,Save ₹40 (7%),4.0 out of 5 stars,523,https://www.amazon.in/gp/slredirect/picassoRedirect.html/ref=pa_sp_mtf_aps_sr_pg1_1?ie=UTF8&adId=A021612636FVZ2WBOMMAY&url=%2FVega-Cellulite-Bristle-Bath-Brush%2Fdp%2FB007E9LDVA%2Fref%3Dsr_1_24_sspa%3Fdchild%3D1%26keywords%3Dface%2Bbrush%26qid%3D1627877544%26smid%3DAT95IG9ONZD7S%26sr%3D8-24-spons%26psc%3D1&qualifier=1627877544&id=4868768847737469&widgetName=sp_mtf
"Facial Cleansing Brush, Sonic Silicone Scrubber, Face Vibrating Massager, IPX7 Waterproof, Rechargeable, Deep Cleaning for All Skins- multi color  ",,,,₹599,₹243,Save ₹356 (59%),3.9 out of 5 stars,30,https://www.amazon.in/Cleansing-Silicone-Vibrating-Waterproof-Rechargeable/dp/B08Y74RD8N/ref=sr_1_25?dchild=1&keywords=face+brush&qid=1627877544&sr=8-25
Elecsera Face Pack Brush - Pack of 2  ,,,,₹199,₹80,Save ₹119 (60%),4.0 out of 5 stars,157,https://www.amazon.in/Elecsera-Face-Pack-Brush/dp/B07Z3YYX98/ref=sr_1_26?dchild=1&keywords=face+brush&qid=1627877544&sr=8-26
RUSTIC RITUALS best of nature for you! Men's/Women's Face Cleansing Brush with Wooden Handle  ,,,,₹999,₹299,Save ₹700 (70%),4.1 out of 5 stars,121,https://www.amazon.in/Cleansing-Brushing-Scrubbing-Exfoliating-Cleaning/dp/B07YDTNF6Z/ref=sr_1_27?dchild=1&keywords=face+brush&qid=1627877544&sr=8-27
Nyamah Sales Face Pack Brush with Facial Spa Headband Adjustable Makeup Tools for Home and Salon Multicolor  ,,,,₹399,₹199,Save ₹200 (50%),3.3 out of 5 stars,7,https://www.amazon.in/Nyamah-Sales-Headband-Adjustable-Multicolor/dp/B09687FXFJ/ref=sr_1_28?dchild=1&keywords=face+brush&qid=1627877544&sr=8-28
"Synaty Multifunctional Silicone Face Mask Brush, One Head Face Pack Applicator Tool, One Head Face Cleansing, For Mud Clay Charcoal Mixed Face Pack (Pink)  ",,,,₹450,₹299,Save ₹151 (34%),4.5 out of 5 stars,171,https://www.amazon.in/Synaty-Multifunctional-Silicone-Applicator-Cleansing/dp/B0894ZVH9K/ref=sr_1_29?dchild=1&keywords=face+brush&qid=1627877544&sr=8-29
Perfect Pricee Octopus Design Silicone Facial Cleansing Brush Face Exfoliator Massager Beauty Tool - Pink(1 Piece)  ,,,,₹499,₹179,Save ₹320 (64%),4.5 out of 5 stars,15,https://www.amazon.in/Perfect-Pricee-Silicone-Cleansing-Exfoliator/dp/B08X7CMVGW/ref=sr_1_30?dchild=1&keywords=face+brush&qid=1627877544&sr=8-30
Angelie Foundation Makeup Cosmetic Brush (Natural White Colour)  ,Best seller,,,₹199,₹155,Save ₹44 (22%),4.0 out of 5 stars,510,https://www.amazon.in/gp/bestsellers/beauty/10850773031/ref=sr_bs_30_10850773031_1
"Elibliss Charcoal Foaming Face Wash with Built-In Face Brush for Deep Cleansing - No Parabens, Sulphate, Silicones & Color  ",,,,₹499,₹169,Save ₹330 (66%),,,https://www.amazon.in/Elibliss-Charcoal-Foaming-Built-Cleansing/dp/B07L62J89C/ref=sr_1_32?dchild=1&keywords=face+brush&qid=1627877544&sr=8-32
TWIREY Face pack Brush Synthetic Hair Beauty Cosmetic Tool For Home Use/Beauty Parlor/Salon Use- Pack of 1 Pcs  ,,,,₹199,₹65,Save ₹134 (67%),,,https://www.amazon.in/TWIREY-Synthetic-Beauty-Cosmetic-Parlor/dp/B097T9W8B4/ref=sr_1_33?dchild=1&keywords=face+brush&qid=1627877544&sr=8-33
"TWIREY Face Wash Brush, Soft Pink, Daily use Facial Tool for Washing & Cleaning your Face, Face Care tool (PACK OF 1)  ",,,,₹600,₹149,Save ₹451 (75%),2.7 out of 5 stars,5,https://www.amazon.in/TWIREY-Brush-Facial-Washing-Cleaning/dp/B0957RF46M/ref=sr_1_34?dchild=1&keywords=face+brush&qid=1627877544&sr=8-34
Allin Exporters Soft Facial Applicator Mask Brush Hairless Silicone For Mud Mask Face Pack Cream Makeup Beauty Tool With Ultrasoft Bristles (2 Pcs)  ,,,,,₹199,,,,https://www.amazon.in/Allin-Exporters-Applicator-Hairless-Ultrasoft/dp/B098TT56DV/ref=sr_1_35?dchild=1&keywords=face+brush&qid=1627877544&sr=8-35
Colour Blast Women's Polycotton Stretchable Elasticized Adjustable Facial Headbands and Face Pack Brush and Face Cleaning Sponges Combo (Colour May Vary)  ,,,,₹299,₹199,Save ₹100 (33%),3.6 out of 5 stars,628,https://www.amazon.in/Colour-Blast-Polycotton-Stretchable-Elasticized/dp/B07NBPH85G/ref=sr_1_36?dchild=1&keywords=face+brush&qid=1627877544&sr=8-36
Kamz Beauty Face Wash Brush Daily use Facial Tool Face Care tool I Face Wash Brush I Face Scrub Brush I Soft Face Cleaning Brush I Face Clean up Tool (Pack of 1)  ,,,,₹199,₹89,Save ₹110 (55%),,,https://www.amazon.in/Kamz-Beauty-Brush-Facial-Cleaning/dp/B09B4Z72G3/ref=sr_1_37?dchild=1&keywords=face+brush&qid=1627877544&sr=8-37
S K Leather12 PCS Makeup Brush Set Premium Synthetic Silver Foundation Blending Blush Face Powder Brush Makeup Brush Kit  ,,,,₹599,₹199,Save ₹400 (67%),,,https://www.amazon.in/Leather12-Premium-Synthetic-Foundation-Blending/dp/B09BCYGBF9/ref=sr_1_38?dchild=1&keywords=face+brush&qid=1627877544&sr=8-38
MACPLUS Makeup Powder Brush (Black Color)  ,Best seller,,,₹599,₹249,Save ₹350 (58%),4.3 out of 5 stars,135,https://www.amazon.in/gp/bestsellers/beauty/10850770031/ref=sr_bs_38_10850770031_1
Ronzille Makeup Brushes Set Tool Pro Foundation Blending Blush Eyeliner Face Powder Brush Kit (Silver Black Grey)  ,,,,₹399,₹180,Save ₹219 (55%),3.9 out of 5 stars,6,https://www.amazon.in/Ronzille-Brushes-Foundation-Blending-Eyeliner/dp/B07PQLZBMB/ref=sr_1_40?dchild=1&keywords=face+brush&qid=1627877544&sr=8-40
Swiss Beauty Professional Face & Eye Brush Set  ,,,,₹699,₹690,Save ₹9 (1%),4.5 out of 5 stars,466,https://www.amazon.in/Swiss-Beauty-Professional-Face-Brush/dp/B08MQKXPQT/ref=sr_1_41?dchild=1&keywords=face+brush&qid=1627877544&sr=8-41
Face Pack And Facial Bleach Makeup Brush Multicolor 1 pcs  ,,,,₹199,₹75,Save ₹124 (62%),4.2 out of 5 stars,49,https://www.amazon.in/Facial-Bleach-Makeup-Brush-Multicolor/dp/B08V9CBQKQ/ref=sr_1_42?dchild=1&keywords=face+brush&qid=1627877544&sr=8-42
Bella Vita Organic Mini Face Pack Brush Set with Wooden Handle for Women & Men - Pack of 2  ,,,,₹499,₹225,Save ₹274 (55%),4.2 out of 5 stars,691,https://www.amazon.in/Bella-Vita-Organic-Animal-Natural/dp/B07TGDTXPW/ref=sr_1_43?dchild=1&keywords=face+brush&qid=1627877544&sr=8-43
CETC Professional Flat Face Pack Brush (1)  ,,,,₹149,₹65,Save ₹84 (56%),3.8 out of 5 stars,101,https://www.amazon.in/CETC-Professional-Flat-Face-Brush/dp/B07RXK2NSN/ref=sr_1_44?dchild=1&keywords=face+brush&qid=1627877544&sr=8-44
"Amazon Brand - Solimo Face Powder Blush Brush, Black  ",,,,₹399,₹239,Save ₹160 (40%),4.3 out of 5 stars,30,https://www.amazon.in/Solimo-Powder-Blush-Brush-Black/dp/B07J24X4SP/ref=sr_1_45?dchild=1&keywords=face+brush&qid=1627877544&sr=8-45
"Syga 1 Pieces Facial Cleansing Pads, Soft Silicone Face Scrubbers Exfoliators Face Blackhead Removing Massage Tool (Assorted Color)  ",,,,₹250,₹159,Save ₹91 (36%),3.9 out of 5 stars,791,https://www.amazon.in/SYGA-Cleansing-Scrubbers-Exfoliators-Blackhead/dp/B07NC21YMC/ref=sr_1_46?dchild=1&keywords=face+brush&qid=1627877544&sr=8-46
"MACPLUS Premium Quality Makeup Brush Set, 24 Pieces Set with Black Leather Case  ",Limited time deal,,,₹989,₹399,Save ₹590 (60%),4.0 out of 5 stars,"3,261",https://www.amazon.in/MACPLUS-Premium-Quality-Makeup-Leather/dp/B07JJLQT8Z/ref=sr_1_47?dchild=1&keywords=face+brush&qid=1627877544&smid=A36SBMT5ON572M&sr=8-47
MINISO Leopard Tail Exclusive Designed Deep Cleansing Facial Cleansing Brush Face Pore Skin Care Soft Bristle Scrubber  ,,,,₹260,₹234,Save ₹26 (10%),4.4 out of 5 stars,56,https://www.amazon.in/MINISO-Exclusive-Designed-Cleansing-Scrubber/dp/B0885TL94Y/ref=sr_1_48?dchild=1&keywords=face+brush&qid=1627877544&sr=8-48
Ross Hair Scalp Massager Shampoo Brush  ,Best sellerLimited time deal,,,₹599,₹299,Save ₹300 (50%),4.3 out of 5 stars,"10,242",https://www.amazon.in/gp/bestsellers/beauty/1374347031/ref=sr_bs_48_1374347031_1
"Mapperz Bleach Brush with soft bristle Color | Face Pack Brush For Face Mask | Hair plastic Brush | Face Mask And Bleach Apply Brush For Woman,Girls and Men  ",,,,₹199,₹99,Save ₹100 (50%),,,https://www.amazon.in/Mapperz-Bleach-Brush-bristle-plastic/dp/B09BCZB6L2/ref=sr_1_50?dchild=1&keywords=face+brush&qid=1627877544&sr=8-50
"PANACHE Face Wash Brush, Soft Pink, Daily use Facial Tool for Washing & Cleaning your Face, Face Care tool.  ",,,,,₹199,,3.7 out of 5 stars,138,https://www.amazon.in/Panache-Soft-Face-Wash-Brush/dp/B071CDJKH2/ref=sr_1_51?dchild=1&keywords=face+brush&qid=1627877544&sr=8-51
Ocean Professional Face Pack Brush (White)  ,,,,₹180,₹100,Save ₹80 (44%),3.8 out of 5 stars,336,https://www.amazon.in/Ocean-Professional-Face-Pack-Brush/dp/B01LGY2XBC/ref=sr_1_52?dchild=1&keywords=face+brush&qid=1627877544&sr=8-52
Angelie Professional Flat Face Pack Brush Combo of 3Pcs  ,,,,₹299,₹175,Save ₹124 (41%),4.1 out of 5 stars,116,https://www.amazon.in/Angelie-Professional-Flat-Brush-Combo/dp/B08HZBV5CJ/ref=sr_1_53?dchild=1&keywords=face+brush&qid=1627877544&sr=8-53
LYFteco 5 in 1 Multifunctional Face Massager or Beauty Care Brush for Facial Scrub Massage Blackhead Remover and Deep Face Cleaning for Men and Women (Pink White)  ,,,,₹599,₹229,Save ₹370 (62%),3.5 out of 5 stars,32,https://www.amazon.in/LYFteco-Multifunctional-Massager-Blackhead-Cleaning/dp/B08XNNHQBR/ref=sr_1_54?dchild=1&keywords=face+brush&qid=1627877544&sr=8-54
FOK 1 PC Octopus Design Silicone Facial Cleansing Brush Face Exfoliator Massager Beauty Tool - Pink  ,,,Only 1 left in stock.,₹415,₹209,Save ₹206 (50%),4.1 out of 5 stars,231,https://www.amazon.in/FOK-Silicone-Cleansing-Exfoliator-Massager/dp/B07R1WHDKX/ref=sr_1_55?dchild=1&keywords=face+brush&qid=1627877544&sr=8-55
"KYLIE Makeup Brushes Set Premium Synthetic Kabuki Foundation Face Powder Blush Eye shadow Brush Makeup Brush Kit with Blender Sponge and Brush Cleaner (10pcs,Pink/Silver)  ",,,,₹989,₹290,Save ₹699 (71%),3.8 out of 5 stars,772,https://www.amazon.in/KYLIE-Brushes-Synthetic-Foundation-Eyeshadow/dp/B07S92N87D/ref=sr_1_56?dchild=1&keywords=face+brush&qid=1627877544&sr=8-56
"Mom & World Kids Face Wash Tear Free (No Sls, Paraben) - With Argan Oil, Aloevera, 120 ml  ",Limited time deal,Sponsored,,₹249,₹225,Save ₹24 (10%),4.2 out of 5 stars,332,https://www.amazon.in/gp/slredirect/picassoRedirect.html/ref=pa_sp_btf_aps_sr_pg1_1?ie=UTF8&adId=A0742022B01HC6U05R4C&url=%2FMom-World-Kids-120ml-Paraben%2Fdp%2FB07MR7Z5YJ%2Fref%3Dsr_1_57_sspa%3Fdchild%3D1%26keywords%3Dface%2Bbrush%26qid%3D1627877544%26smid%3DA13KD517MP86YA%26sr%3D8-57-spons%26psc%3D1&qualifier=1627877544&id=4868768847737469&widgetName=sp_btf
MINISO 800 Count Wooden Stick Cotton Swabs[200 Count X4](White)  ,,Sponsored,,₹150,₹140,Save ₹10 (7%),4.4 out of 5 stars,35,https://www.amazon.in/gp/slredirect/picassoRedirect.html/ref=pa_sp_btf_aps_sr_pg1_1?ie=UTF8&adId=A0520597JG407G1P37NJ&url=%2FMINISO-Count-Wooden-Stick-Cotton%2Fdp%2FB0963JJQYQ%2Fref%3Dsr_1_58_sspa%3Fdchild%3D1%26keywords%3Dface%2Bbrush%26qid%3D1627877544%26sr%3D8-58-spons%26psc%3D1&qualifier=1627877544&id=4868768847737469&widgetName=sp_btf
"Good Vibes Tea Tree Foaming Face Wash - 150 ml - Treats Acne, Pimples and Blemishes with Oil Controlling Properties - Paraben and Cruelty Free  ",,Sponsored,,₹235,₹197,Save ₹38 (16%),4.0 out of 5 stars,"4,392",https://www.amazon.in/gp/slredirect/picassoRedirect.html/ref=pa_sp_btf_aps_sr_pg1_1?ie=UTF8&adId=A10302771GMR1A0DM8ZOF&url=%2FGood-Vibes-Tree-Foaming-Face%2Fdp%2FB084GQGNNQ%2Fref%3Dsr_1_59_sspa%3Fdchild%3D1%26keywords%3Dface%2Bbrush%26qid%3D1627877544%26sr%3D8-59-spons%26psc%3D1&qualifier=1627877544&id=4868768847737469&widgetName=sp_btf
"JIHB Bath Sponge, Skin Exfoliator, Face Scrubber and Dead Skin Remover for Women and Men (multicolor)  ",,Sponsored,,₹999,₹209,Save ₹790 (79%),4.5 out of 5 stars,2,https://www.amazon.in/gp/slredirect/picassoRedirect.html/ref=pa_sp_btf_aps_sr_pg1_1?ie=UTF8&adId=A09656631NWR1MMOOHGLO&url=%2FJIHB-Exfoliator-Scrubber-Remover-multicolor%2Fdp%2FB0993LDF54%2Fref%3Dsr_1_60_sspa%3Fdchild%3D1%26keywords%3Dface%2Bbrush%26qid%3D1627877544%26sr%3D8-60-spons%26psc%3D1&qualifier=1627877544&id=4868768847737469&widgetName=sp_btf
Caresmith Sonic Facial Cleansing Massager Brush (Lavender Spunk)  ,,Sponsored,,"₹2,000",₹749,"Save ₹1,251 (63%)",3.9 out of 5 stars,"2,452",https://www.amazon.in/gp/slredirect/picassoRedirect.html/ref=pa_sp_atf_next_aps_sr_pg2_1?ie=UTF8&adId=A07782923P5B8DJO3SPD&url=%2FCaresmith-Ultrasonic-Cleansing-Massager-Lavender%2Fdp%2FB07Q1JYCYL%2Fref%3Dsr_1_49_sspa%3Fdchild%3D1%26keywords%3Dface%2Bbrush%26qid%3D1627877567%26sr%3D8-49-spons%26psc%3D1&qualifier=1627877567&id=3896528407185998&widgetName=sp_atf_next
Prolixr Sea Algae Face Mask | Pore Minimizer & Pore Cleaner with Face Mask Brush Applicator | No Parabens  ,,Sponsored,,₹999,₹749,Save ₹250 (25%),4.0 out of 5 stars,704,https://www.amazon.in/gp/slredirect/picassoRedirect.html/ref=pa_sp_atf_next_aps_sr_pg2_1?ie=UTF8&adId=A100660783XLHWGG1L9W&url=%2FProlixr-Detoxifying-Sea-Algae-Mask%2Fdp%2FB07N1NC7WR%2Fref%3Dsr_1_50_sspa%3Fdchild%3D1%26keywords%3Dface%2Bbrush%26qid%3D1627877567%26sr%3D8-50-spons%26psc%3D1&qualifier=1627877567&id=3896528407185998&widgetName=sp_atf_next
Miniso Natural Face Wash for All Skin Type Deep Cleansing(Charcoal)  ,,Sponsored,,,₹160,,4.4 out of 5 stars,18,https://www.amazon.in/gp/slredirect/picassoRedirect.html/ref=pa_sp_atf_next_aps_sr_pg2_1?ie=UTF8&adId=A02784693R4NSVUSFMAJ5&url=%2FMiniso-Natural-Face-Cleansing-Charcoal%2Fdp%2FB08V8HZN7X%2Fref%3Dsr_1_51_sspa%3Fdchild%3D1%26keywords%3Dface%2Bbrush%26qid%3D1627877567%26sr%3D8-51-spons%26psc%3D1&qualifier=1627877567&id=3896528407185998&widgetName=sp_atf_next
MINISO 8-inch Elliptic Grid Mirror  ,,Sponsored,,,₹150,,4.7 out of 5 stars,4,https://www.amazon.in/gp/slredirect/picassoRedirect.html/ref=pa_sp_atf_next_aps_sr_pg2_1?ie=UTF8&adId=A00531723J8AI06A93SOC&url=%2FMINISO-8-inch-Elliptic-Grid-Mirror%2Fdp%2FB096ZV2LDC%2Fref%3Dsr_1_52_sspa%3Fdchild%3D1%26keywords%3Dface%2Bbrush%26qid%3D1627877567%26sr%3D8-52-spons%26psc%3D1&qualifier=1627877567&id=3896528407185998&widgetName=sp_atf_next
LeToZa Facial Kit // Multifunction Beauty Care Brush Deep Clean 5 in 1 Portable Facial Cleaner Relief Face Massager/Blackhead Remover Facial Cleanser // facial massager  ,,,,₹999,₹295,Save ₹704 (70%),4.2 out of 5 stars,46,https://www.amazon.in/LeToZa-Multifunction-Portable-Massager-Blackhead/dp/B095NTMP2M/ref=sr_1_53?dchild=1&keywords=face+brush&qid=1627877567&sr=8-53
"Welocity Professional Face Massager For Women , scrubber ,Facial Brush, style 2 Speeds With 5 Brush Heads Facial Beauty Brush  ",,,,₹499,₹265,Save ₹234 (47%),3.4 out of 5 stars,25,https://www.amazon.in/Welocity-Professional-Massager-scrubber-Facial/dp/B08QRFN3DD/ref=sr_1_54?dchild=1&keywords=face+brush&qid=1627877567&sr=8-54
Face Pack Brush 1 pcs  ,,,,₹199,₹151,Save ₹48 (24%),4.4 out of 5 stars,303,https://www.amazon.in/Ear-Lobe-Accessories-Brown-Brush/dp/B0791HJF3C/ref=sr_1_55?dchild=1&keywords=face+brush&qid=1627877567&sr=8-55
"Kri N Sha S.K.SALES Facial Cleansing Brush, Sonic Silicone Scrubber, Face Vibrating Massager, IPX7 Waterproof, Rechargeable, Deep Cleaning for All Skins- multicolour  ",,,,₹999,₹340,Save ₹659 (66%),3.7 out of 5 stars,374,https://www.amazon.in/S-K-SALES-Cleansing-Waterproof-Rechargeable-Skins-Rose/dp/B081Z68CBR/ref=sr_1_56?dchild=1&keywords=face+brush&qid=1627877567&sr=8-56
Pappilio Makeup Brushes Set Tool Pro Foundation Blending Blush Eyeliner Face Powder Brush Kit (Silver Black Grey)  ,,,,₹399,₹149,Save ₹250 (63%),,,https://www.amazon.in/Pappilio-Brushes-Foundation-Blending-Eyeliner/dp/B099S861J2/ref=sr_1_57?dchild=1&keywords=face+brush&qid=1627877567&sr=8-57
"Beauty Tool DIY Facial Face Mask (Small) Bowl Brush Set for Girls, Multicolor, Pack of 3 Set (3 Items in The Set)(Water Proof Spa Shower Cap (1pcs Free) Sold by Beauty Tool Enterprises)  ",,,,₹350,₹195,Save ₹155 (44%),5.0 out of 5 stars,1,https://www.amazon.in/Beauty-Facial-Multicolor-Shower-Enterprises/dp/B0922BKRVZ/ref=sr_1_58?dchild=1&keywords=face+brush&qid=1627877567&sr=8-58
"WOW Skin Science Brightening Vitamin C Foaming Face Wash with Built-In Face Brush for Deep Cleansing - No Parabens, Sulphate, Silicones & Color, 150 ml  ",Limited time deal,,,₹399,₹359,Save ₹40 (10%),4.1 out of 5 stars,"10,109",https://www.amazon.in/WOW-Science-Brightening-Vitamin-Cleansing/dp/B083BVKZ8X/ref=sr_1_49?dchild=1&keywords=face+brush&qid=1627877567&smid=AT95IG9ONZD7S&sr=8-49
LUPBON Aloe Vera Foaming Face Wash with Tulsi and Built-in Face Brush -150 ml  ,,,,₹599,₹359,Save ₹240 (40%),5.0 out of 5 stars,26,https://www.amazon.in/LUPBON-Foaming-Tulsi-Built-Brush/dp/B095KLQQSS/ref=sr_1_50?dchild=1&keywords=face+brush&qid=1627877567&sr=8-50
Jellyfish Silicone Facial Cleansing Brush Makeup Removers Face Exfoliator Deep Pore Blackheads Removing Cleansing Sponge Massager Beauty Tool (Pack of Two Pink)  ,,,,₹499,₹130,Save ₹369 (74%),4.3 out of 5 stars,32,https://www.amazon.in/Jellyfish-Silicone-Cleansing-Exfoliator-Blackheads/dp/B08RBTY88Y/ref=sr_1_51?dchild=1&keywords=face+brush&qid=1627877567&sr=8-51
