name,badge_1,badge_2,badge_3,mrp,discounted_price,discount,rating,rating_count,link
Elecsera Facial Mask Brush Face Applicator (Pack of 1)  ,,,,₹199,₹80,Save ₹119 (60%),4.2 out of 5 stars,3,https://www.amazon.in/Elecsera-Facial-Mask-Brush-Applicator/dp/B08X1GH8FL/ref=sr_1_52?dchild=1&keywords=face+brush&qid=1626887123&sr=8-52
"Amazon Brand - Solimo Face Powder Blush Brush, Black  ",,,,₹399,₹207,Save ₹192 (48%),4.6 out of 5 stars,23,https://www.amazon.in/Solimo-Powder-Blush-Brush-Black/dp/B07J24X4SP/ref=sr_1_53?dchild=1&keywords=face+brush&qid=1626887123&sr=8-53
"Facial Cleansing Brush, Sonic Silicone Scrubber, Face Vibrating Massager, IPX7 Waterproof, Rechargeable, Deep Cleaning for All Skins- multi color  ",,,,₹599,₹243,Save ₹356 (59%),4.0 out of 5 stars,25,https://www.amazon.in/Cleansing-Silicone-Vibrating-Waterproof-Rechargeable/dp/B08Y74RD8N/ref=sr_1_54?dchild=1&keywords=face+brush&qid=1626887123&sr=8-54
P P Enterprise Facial Kit // Multifunction Beauty Care Brush Deep Clean 5 in 1 Portable Facial Cleaner Relief Face Massager/Blackhead Remover Facial Cleanser // facial massager  ,,,Only 2 left in stock.,"₹1,199",₹325,Save ₹874 (73%),,,https://www.amazon.in/Enterprise-Multifunction-Portable-Massager-Blackhead/dp/B096SZHPTJ/ref=sr_1_55?dchild=1&keywords=face+brush&qid=1626887123&sr=8-55
Miss & Mam Makeup Brush Set of 7(Colour May Vary) with Storage box + sponge puff(Colour May Vary)  ,,,,₹794,₹194,Save ₹600 (76%),3.6 out of 5 stars,"3,899",https://www.amazon.in/MISS-MAM-Hilary-Makeup-Storage/dp/B07K6JJKTV/ref=sr_1_56?dchild=1&keywords=face+brush&qid=1626887123&sr=8-56
Caresmith Sonic Facial Cleansing Massager Brush (Pink Taffy)  ,Deal of the Day ,,,"₹2,000",₹689,"Save ₹1,311 (66%)",3.9 out of 5 stars,"2,359",https://www.amazon.in/Caresmith-Ultrasonic-Facial-Cleansing-Massager/dp/B07RJSJHR3/ref=sr_1_57?dchild=1&keywords=face+brush&qid=1626887123&sr=8-57
Women Facial Headbands and Facemask Applicator Brush and Face Cleaning Sponges Combo Set for Salon Multi-color_4 Pieces  ,,,,₹599,₹349,Save ₹250 (42%),,,https://www.amazon.in/Headbands-Facemask-Applicator-Cleaning-Multi-color_4/dp/B096B8HPMD/ref=sr_1_58?dchild=1&keywords=face+brush&qid=1626887123&sr=8-58
VINAURA (1pc) Clean Make Up Remover Towel / Sponge / Cloth / Pad / Wipes (Reusable) Chemical Free 100% Skin Friendly | Sweat Absorbent Microfiber Make up Cleansing Cloth Sponge | Reusable upto 1000 times | Remove make up instantly with just water | Make-up Removal Pad Wipe  ,,Sponsored,,₹500,₹449,Save ₹51 (10%),4.7 out of 5 stars,5,https://www.amazon.in/gp/slredirect/picassoRedirect.html/ref=pa_sp_mtf_aps_sr_pg2_1?ie=UTF8&adId=A01075671543CB8YBIPT5&url=%2FVINAURA-Absorbent-Microfiber-Cleansing-instantly%2Fdp%2FB08W5CJHNQ%2Fref%3Dsr_1_59_sspa%3Fdchild%3D1%26keywords%3Dface%2Bbrush%26qid%3D1626887123%26sr%3D8-59-spons%26psc%3D1&qualifier=1626887123&id=335064204662480&widgetName=sp_mtf
Amazon Brand - Solimo Luxury Soft Sponge Bath Brush  ,,Sponsored,,₹550,₹330,Save ₹220 (40%),4.4 out of 5 stars,6,https://www.amazon.in/gp/slredirect/picassoRedirect.html/ref=pa_sp_mtf_aps_sr_pg2_1?ie=UTF8&adId=A030612434XA599T3GD53&url=%2FSolimo-Luxury-Soft-Sponge-brush%2Fdp%2FB08GLHC5DD%2Fref%3Dsr_1_60_sspa%3Fdchild%3D1%26keywords%3Dface%2Bbrush%26qid%3D1626887123%26sr%3D8-60-spons%26psc%3D1&qualifier=1626887123&id=335064204662480&widgetName=sp_mtf
"Colorbar Cheekillusion Blush, Coral Craving  ",,Sponsored,,₹675,₹472,Save ₹203 (30%),4.1 out of 5 stars,182,https://www.amazon.in/gp/slredirect/picassoRedirect.html/ref=pa_sp_mtf_aps_sr_pg2_1?ie=UTF8&adId=A09279161O9FVVDGMWKBW&url=%2FColorbar-Cheekillusion-Blush-Coral-Craving%2Fdp%2FB00CP3FUGE%2Fref%3Dsr_1_61_sspa%3Fdchild%3D1%26keywords%3Dface%2Bbrush%26qid%3D1626887123%26sr%3D8-61-spons%26psc%3D1&qualifier=1626887123&id=335064204662480&widgetName=sp_mtf
"Man Arden De Tan Brightening Face Scrub - De-Tans & Exfoliates Skin - With Vitamin C, 100 ml (MNARDN275)  ",,Sponsored,,,₹299,,4.1 out of 5 stars,437,https://www.amazon.in/gp/slredirect/picassoRedirect.html/ref=pa_sp_mtf_aps_sr_pg2_1?ie=UTF8&adId=A0859738GR4CXQNM4JMR&url=%2FMan-Arden-Brightening-Scrub-100ml%2Fdp%2FB07KPC6J7X%2Fref%3Dsr_1_62_sspa%3Fdchild%3D1%26keywords%3Dface%2Bbrush%26qid%3D1626887123%26sr%3D8-62-spons%26psc%3D1&qualifier=1626887123&id=335064204662480&widgetName=sp_mtf
LYFteco 5 in 1 Multifunctional Face Massager or Beauty Care Brush for Facial Scrub Massage Blackhead Remover and Deep Face Cleaning for Men and Women (Pink White)  ,,,,₹599,₹249,Save ₹350 (58%),3.5 out of 5 stars,28,https://www.amazon.in/LYFteco-Multifunctional-Massager-Blackhead-Cleaning/dp/B08XNNHQBR/ref=sr_1_63?dchild=1&keywords=face+brush&qid=1626887123&sr=8-63
"MACPLUS Premium Quality Makeup Brush Set, 24 Pieces Set with Black Leather Case  ",,,,₹989,₹399,Save ₹590 (60%),4.0 out of 5 stars,"3,086",https://www.amazon.in/MACPLUS-Premium-Quality-Makeup-Leather/dp/B07JJLQT8Z/ref=sr_1_64?dchild=1&keywords=face+brush&qid=1626887123&sr=8-64
Ghelonadi Face Pack Brush and Face Cleaning Sponge Combo Facial Mask Brush Facemask Applicator Brush Cosmetic Foundation Makeup Brush for Men and Women (White Brush and Sponge)  ,,,,₹399,₹154,Save ₹245 (61%),3.5 out of 5 stars,10,https://www.amazon.in/Ghelonadi-Cleaning-Facemask-Applicator-Foundation/dp/B093GK6ZW4/ref=sr_1_65?dchild=1&keywords=face+brush&qid=1626887123&sr=8-65
"HealthSense Pure-Skin FB 09 Facial Cleansing Brush with 2 Brush Heads, Waterproof IPX7 & 1 year warranty  ",Limited time deal,,,"₹1,600",₹699,Save ₹901 (56%),3.6 out of 5 stars,440,https://www.amazon.in/HealthSense-Electric-Facial-Cleansing-Brush/dp/B079W9FHWM/ref=sr_1_66?dchild=1&keywords=face+brush&qid=1626887123&smid=AT95IG9ONZD7S&sr=8-66
MISS & MAM Cosmetic Foundation Makeup Face Blush Powder Brush Tool  ,,,,₹599,₹219,Save ₹380 (63%),3.8 out of 5 stars,27,https://www.amazon.in/MISS-MAM-Cosmetic-Foundation-Makeup/dp/B08346BHLL/ref=sr_1_67?dchild=1&keywords=face+brush&qid=1626887123&sr=8-67
"BS Packaging Facial Cleansing Brush, Sonic Silicone Scrubber, Face Vibrating Massager, IPX7 Waterproof, Rechargeable, Deep Cleaning for All Skins- multi color  ",,,,₹499,₹299,Save ₹200 (40%),5.0 out of 5 stars,3,https://www.amazon.in/Packaging-Cleansing-Vibrating-Waterproof-Rechargeable/dp/B08YKCRCSG/ref=sr_1_68?dchild=1&keywords=face+brush&qid=1626887123&sr=8-68
Face Pack Brush 1 pcs  ,,,,₹199,₹151,Save ₹48 (24%),4.3 out of 5 stars,294,https://www.amazon.in/Ear-Lobe-Accessories-Brown-Brush/dp/B0791HJF3C/ref=sr_1_69?dchild=1&keywords=face+brush&qid=1626887123&sr=8-69
Foolzy 11Pcs Makeup Brush Set Professional Kabuki Foundation Blending Blush Concealer Eye Face Liquid Powder Cream Cosmetics Brushes Kit  ,,,,₹899,₹349,Save ₹550 (61%),4.0 out of 5 stars,692,https://www.amazon.in/Foolzy-Professional-Foundation-Concealer-Cosmetics/dp/B079CDSL1J/ref=sr_1_70?dchild=1&keywords=face+brush&qid=1626887123&sr=8-70
Elecsera Professional Face Pack and Facial Bleach Brush (Pack of 6)  ,,,,₹299,₹150,Save ₹149 (50%),,,https://www.amazon.in/Elecsera-Professional-Facial-Bleach-Brush/dp/B09842L15N/ref=sr_1_71?dchild=1&keywords=face+brush&qid=1626887123&sr=8-71
MINISO Leopard Tail Exclusive Designed Deep Cleansing Facial Cleansing Brush Face Pore Skin Care Soft Bristle Scrubber  ,,,,₹260,₹221,Save ₹39 (15%),4.3 out of 5 stars,50,https://www.amazon.in/MINISO-Exclusive-Designed-Cleansing-Scrubber/dp/B0885TL94Y/ref=sr_1_72?dchild=1&keywords=face+brush&qid=1626887123&sr=8-72
"Okayji Cleansing Pads, Silicone Face Scrubbers Soft Exfoliates Cleansing Tool Massage Blackhead Removing Baby Pet Shower (Orange)  ",,,,₹299,₹170,Save ₹129 (43%),4.2 out of 5 stars,"1,936",https://www.amazon.in/Okayji-Cleansing-Scrubbers-Exfoliates-Blackhead/dp/B07BRW3Q93/ref=sr_1_73?dchild=1&keywords=face+brush&qid=1626887123&sr=8-73
EAYIRA Facial Kit // Multifunction Beauty Care Brush Deep Clean 5 in 1 Portable Facial Cleaner Relief Face Massager/Blackhead Remover Facial Cleanser // facial massager (Multi)  ,,,,₹499,₹349,Save ₹150 (30%),3.0 out of 5 stars,51,https://www.amazon.in/EAYIRA-Multifunction-Portable-Massager-Blackhead/dp/B08T9PS4CB/ref=sr_1_74?dchild=1&keywords=face+brush&qid=1626887123&sr=8-74
MISS & MAM Makeup Brush Set Professional Kabuki Foundation Blending Blush Concealer Eye Face Liquid Powder Cream Cosmetics Brushes Kit (Pack Of 24) PINK  ,,,,"₹1,599",₹399,"Save ₹1,200 (75%)",3.9 out of 5 stars,296,https://www.amazon.in/MISS-MAM-Professional-Foundation-Concealer/dp/B07MW26157/ref=sr_1_75?dchild=1&keywords=face+brush&qid=1626887123&sr=8-75
"DRIXTY Darbar Online Silicone Face Cleanser and Exfoliator Portable and Personalized Facial Cleansing Brush Silicone Scrubber, Face Vibrating Massager ilicone Scrubber, Face Vibrater (Multicolor)  ",,,,"₹1,299",₹349,Save ₹950 (73%),,,https://www.amazon.in/DRIXTY-Exfoliator-Personalized-Cleansing-Multicolor/dp/B098XMP9RK/ref=sr_1_76?dchild=1&keywords=face+brush&qid=1626887123&sr=8-76
"Massive Reckon Facial Cleansing Brush made with Ultra Hygienic Soft Silicone, Waterproof Vibrating Face Brush for Deep Cleansing, Gentle Exfoliating and Inductive charging Cable (Random Color) (1 pcs )  ",,,,₹749,₹429,Save ₹320 (43%),3.5 out of 5 stars,23,https://www.amazon.in/Massive-Reckon-Cleansing-Waterproof-Exfoliating/dp/B08TC6TC2P/ref=sr_1_77?dchild=1&keywords=face+brush&qid=1626887123&sr=8-77
Regular face pack brush set of 2  ,,,,₹198,₹95,Save ₹103 (52%),4.5 out of 5 stars,4,https://www.amazon.in/Regular-face-pack-brush-set/dp/B08RJM1D4X/ref=sr_1_78?dchild=1&keywords=face+brush&qid=1626887123&sr=8-78
