name,badge_1,badge_2,badge_3,mrp,discounted_price,discount,rating,rating_count,link
"Vega Face Pack Brush, 1 Piece  ",Best seller,Sponsored,,,₹150,,4.1 out of 5 stars,"2,538",https://www.amazon.in/gp/bestsellers/beauty/10850769031/ref=sr_bs_0_10850769031_1
"WOW Skin Science Apple Cider Vinegar Foaming Face Wash - with Organic Certified Himalayan Apple Cider Vinegar - No Parabens, Sulphate, Silicones & Color (with Built-in Brush) - 150mL  ",Limited time deal,Sponsored,,₹389,₹359,Save ₹30 (8%),4.1 out of 5 stars,"24,196",https://www.amazon.in/gp/slredirect/picassoRedirect.html/ref=pa_sp_atf_aps_sr_pg1_1?ie=UTF8&adId=A07169152UHYAJAKPD476&url=%2FWOW-Organic-Vinegar-Foaming-Built%2Fdp%2FB07SQXPW35%2Fref%3Dsr_1_2_sspa%3Fdchild%3D1%26keywords%3Dface%2Bbrush%26qid%3D1626887105%26smid%3DAT95IG9ONZD7S%26sr%3D8-2-spons%26psc%3D1&qualifier=1626887105&id=2271122935920667&widgetName=sp_atf
"WOW Skin Science Brightening Vitamin C Foaming Face Wash with Built-In Face Brush for Deep Cleansing - No Parabens, Sulphate, Silicones & Color, 150 ml  ",Limited time deal,Sponsored,,₹399,₹359,Save ₹40 (10%),4.1 out of 5 stars,"9,487",https://www.amazon.in/gp/slredirect/picassoRedirect.html/ref=pa_sp_atf_aps_sr_pg1_1?ie=UTF8&adId=A03168642AGJRD8K8J8XN&url=%2FWOW-Science-Brightening-Vitamin-Cleansing%2Fdp%2FB083BVKZ8X%2Fref%3Dsr_1_3_sspa%3Fdchild%3D1%26keywords%3Dface%2Bbrush%26qid%3D1626887105%26smid%3DA2WK4OB3ROODF0%26sr%3D8-3-spons%26psc%3D1&qualifier=1626887105&id=2271122935920667&widgetName=sp_atf
"Lafz Apple Cider Vinegar Foaming Face Wash With Built-In Face Brush To Exfoliate & Deep Cleanse. With Acv, Aloe Vera & Basil For Clear, Moisturized Skin. Vegetarian, Ph Neutral, Paraben Free, 100 ml  ",,Sponsored,,₹299,₹279,Save ₹20 (7%),,,https://www.amazon.in/gp/slredirect/picassoRedirect.html/ref=pa_sp_atf_aps_sr_pg1_1?ie=UTF8&adId=A0427938OSLD4WKWZNAW&url=%2FVinegar-Exfoliate-Cleanse-Moisturized-Vegetarian%2Fdp%2FB0977DYNFY%2Fref%3Dsr_1_4_sspa%3Fdchild%3D1%26keywords%3Dface%2Bbrush%26qid%3D1626887105%26sr%3D8-4-spons%26psc%3D1&qualifier=1626887105&id=2271122935920667&widgetName=sp_atf
"Vega Face Pack Brush, 1 Piece  ",Best seller,,,,₹150,,4.1 out of 5 stars,"2,538",https://www.amazon.in/gp/bestsellers/beauty/10850769031/ref=sr_bs_4_10850769031_1
FSFTTRAD Face Brush for Cleansing and Exfoliating - Double Sided Facial Cleaning Brush with Soft Bristles Scrubber to Massage and Scrub Your Skin  ,Amazon's Choice,,,₹999,₹299,Save ₹700 (70%),4.0 out of 5 stars,122,https://www.amazon.in/FSFTTRAD-Face-Brush-Cleansing-Exfoliating/dp/B08LK1SM7F/ref=ice_ac_b_dpb?dchild=1&keywords=face+brush&qid=1626887105&sr=8-6
FreShine Multifunctional Beauty Care Brush Deep Clean 5 in 1 Blackhead Remover Facial Scrubs & Polishes Massager | Pink  ,,,,₹999,₹299,Save ₹700 (70%),3.3 out of 5 stars,688,https://www.amazon.in/FreShine-Facial-Multifunction-Massager-Blackhead/dp/B083KLC76P/ref=sr_1_7?dchild=1&keywords=face+brush&qid=1626887105&sr=8-7
"Ear Lobe & Accessories Face Pack Brush, Brown (Pack of 2)  ",,,,₹399,₹148,Save ₹251 (63%),4.2 out of 5 stars,998,https://www.amazon.in/Ear-Lobe-Accessories-Face-Brush/dp/B0791GVB2J/ref=sr_1_8?dchild=1&keywords=face+brush&qid=1626887105&sr=8-8
"TREXEE 2 in 1 Facial Cleansing Brush, 3D Double Manual Silicone & Soft Bristles Face Brush Face Cleansing Brush Exfoliating Grease Removal Massage Tool Wash Makeup, Massaging, Acne (White)  ",,,,₹599,₹155,Save ₹444 (74%),3.9 out of 5 stars,44,https://www.amazon.in/TREXEE-Cleansing-Silicone-Exfoliating-Massaging/dp/B08NWHBSVQ/ref=sr_1_9?dchild=1&keywords=face+brush&qid=1626887105&sr=8-9
"TREXEE Octopus Design Silicone Facial Cleansing Brush Face Exfoliator Massager Beauty Tool All in One Deep Pore Cleansing Sponge & Brush, For Exfoliating, Massage, Cleansing Soft Brush (pink)  ",,,,₹499,₹107,Save ₹392 (79%),4.2 out of 5 stars,182,https://www.amazon.in/TREXEE-Silicone-Cleansing-Exfoliator-Exfoliating/dp/B08NPRHY21/ref=sr_1_10?dchild=1&keywords=face+brush&qid=1626887105&sr=8-10
"MINISO Makeup Brush Set 7PCS Foundation Brush Set for Face Makeup, Pale Turquoise  ",Best seller,,,,₹260,,4.3 out of 5 stars,"2,609",https://www.amazon.in/gp/bestsellers/beauty/10850757031/ref=sr_bs_10_10850757031_1
TWIREY Women's Polycotton Stretchable Elasticized Adjustable Facial Headbands and Face Pack Brush and Face Cleaning Sponges (1PCS EACH COMBO)  ,,,,₹399,₹199,Save ₹200 (50%),4.1 out of 5 stars,113,https://www.amazon.in/TWIREY-Polycotton-Stretchable-Elasticized-Adjustable/dp/B094G2TVBK/ref=sr_1_12?dchild=1&keywords=face+brush&qid=1626887105&sr=8-12
ClubBeauty Professional Long Lasting Flat Face Pack Brush  ,,,,₹199,₹54,Save ₹145 (73%),4.1 out of 5 stars,6,https://www.amazon.in/ClubBeauty-Professional-Long-Lasting-Brush/dp/B0924G84T2/ref=sr_1_13?dchild=1&keywords=face+brush&qid=1626887105&sr=8-13
Rsentera Profesional Face Pack and Facial Bleach Brush ( Pack of 2)  ,,,,₹299,₹95,Save ₹204 (68%),4.2 out of 5 stars,25,https://www.amazon.in/Rsentera-Profesional-Facial-Bleach-Brush/dp/B08VH61S9Q/ref=sr_1_14?dchild=1&keywords=face+brush&qid=1626887105&sr=8-14
Zureni Facial Mask Applicator Brush for Face Pack Cream Makeup Brush Beauty Tool with Ultrasoft Bristles (2 Pcs)  ,,,,₹699,₹219,Save ₹480 (69%),4.8 out of 5 stars,14,https://www.amazon.in/Zureni-Facial-Applicator-Ultrasoft-Bristles/dp/B09653RNCH/ref=sr_1_15?dchild=1&keywords=face+brush&qid=1626887105&sr=8-15
TWIREY Personal/Professional Face Pack Cleaning Sponge with Face Pack Brush (1 PCS EACH)  ,,,,₹299,₹89,Save ₹210 (70%),5.0 out of 5 stars,11,https://www.amazon.in/TWIREY-Personal-Professional-Face-Cleaning-Sponge/dp/B0957RRB6R/ref=sr_1_16?dchild=1&keywords=face+brush&qid=1626887105&sr=8-16
"Authentic Store Facial Cleansing Brush,Soft Silicone Face Scrubber,Facial Exfoliation Scrub for Massage Pore Cleansing Blackhead Removing Deep Scrubbing for All Kinds of Skins (MultiColor)  ",,,,₹299,₹85,Save ₹214 (72%),3.9 out of 5 stars,67,https://www.amazon.in/Authentic-Store-Cleansing-Exfoliation-MultiColor/dp/B08T641GF2/ref=sr_1_17?dchild=1&keywords=face+brush&qid=1626887105&sr=8-17
"MINISO 4 PCs DIY Facial Face Mask Bowl Brush, Spoon, Stick Kit  ",,,Only 2 left in stock.,,₹190,,4.4 out of 5 stars,"1,788",https://www.amazon.in/MINISO-Facial-Brush-Spoon-Stick/dp/B08867NW4Z/ref=sr_1_18?dchild=1&keywords=face+brush&qid=1626887105&sr=8-18
QKYPZO Women's Polycotton Stretchable Elasticized Adjustable Facial Headbands and Face Pack Brush and Face Cleaning Sponges (Colour May Vary)  ,,,,₹399,₹169,Save ₹230 (58%),4.2 out of 5 stars,46,https://www.amazon.in/QKYPZO-Polycotton-Stretchable-Elasticized-Adjustable/dp/B0965GLXNY/ref=sr_1_19?dchild=1&keywords=face+brush&qid=1626887105&sr=8-19
"Brushman Facial Cleansing Brush,Soft Silicone Face Scrubber,Facial Exfoliation Scrub for Massage Pore Cleansing Blackhead Removing Deep Scrubbing for All Kinds of Skins (2ed-Pink+Purple)  ",,,,,₹199,,3.7 out of 5 stars,65,https://www.amazon.in/Brushman-Cleansing-Exfoliation-Blackhead-Scrubbing/dp/B08ML417SV/ref=sr_1_20?dchild=1&keywords=face+brush&qid=1626887105&sr=8-20
"Mom & World Neem & Aloe Vera Foaming Face Wash With Built-In Brush - No Parabens, Silicones, 120 ml  ",,Sponsored,,₹375,₹275,Save ₹100 (27%),4.7 out of 5 stars,78,https://www.amazon.in/gp/slredirect/picassoRedirect.html/ref=pa_sp_mtf_aps_sr_pg1_1?ie=UTF8&adId=A0944323274JXNYULXWPI&url=%2FMom-World-Foaming-Built-Brush%2Fdp%2FB08LNTTKNC%2Fref%3Dsr_1_21_sspa%3Fdchild%3D1%26keywords%3Dface%2Bbrush%26qid%3D1626887105%26sr%3D8-21-spons%26psc%3D1&qualifier=1626887105&id=2271122935920667&widgetName=sp_mtf
Vega Cellulite Bristle Bath Brush  ,,Sponsored,,,₹550,,4.0 out of 5 stars,502,https://www.amazon.in/gp/slredirect/picassoRedirect.html/ref=pa_sp_mtf_aps_sr_pg1_1?ie=UTF8&adId=A021612636FVZ2WBOMMAY&url=%2FVega-Cellulite-Bristle-Bath-Brush%2Fdp%2FB007E9LDVA%2Fref%3Dsr_1_22_sspa%3Fdchild%3D1%26keywords%3Dface%2Bbrush%26qid%3D1626887105%26sr%3D8-22-spons%26psc%3D1&qualifier=1626887105&id=2271122935920667&widgetName=sp_mtf
Prolixr Sea Algae Face Mask | Pore Minimizer & Pore Cleaner with Face Mask Brush Applicator | No Parabens  ,,Sponsored,,₹999,₹799,Save ₹200 (20%),4.0 out of 5 stars,679,https://www.amazon.in/gp/slredirect/picassoRedirect.html/ref=pa_sp_mtf_aps_sr_pg1_1?ie=UTF8&adId=A100660783XLHWGG1L9W&url=%2FProlixr-Detoxifying-Sea-Algae-Mask%2Fdp%2FB07N1NC7WR%2Fref%3Dsr_1_23_sspa%3Fdchild%3D1%26keywords%3Dface%2Bbrush%26qid%3D1626887105%26sr%3D8-23-spons%26psc%3D1&qualifier=1626887105&id=2271122935920667&widgetName=sp_mtf
Vega Mascara Brush  ,Limited time deal,Sponsored,,₹80,₹75,Save ₹5 (6%),4.3 out of 5 stars,"1,032",https://www.amazon.in/gp/slredirect/picassoRedirect.html/ref=pa_sp_mtf_aps_sr_pg1_1?ie=UTF8&adId=A0012129YUKHQEU97ZFH&url=%2FVega-EV-10-Mascara-Brush%2Fdp%2FB008TO89F2%2Fref%3Dsr_1_24_sspa%3Fdchild%3D1%26keywords%3Dface%2Bbrush%26qid%3D1626887105%26smid%3DAT95IG9ONZD7S%26sr%3D8-24-spons%26psc%3D1&qualifier=1626887105&id=2271122935920667&widgetName=sp_mtf
Action Pro Cleaning Pad Wash Face Facial Exfoliating Brush SPA Skin Scrub Cleanser Tool Face Massager (Pink)  ,,,,₹199,₹159,Save ₹40 (20%),3.9 out of 5 stars,391,https://www.amazon.in/Action-Pro-Cleaning-Exfoliating-Cleanser/dp/B07HP44RL4/ref=sr_1_25?dchild=1&keywords=face+brush&qid=1626887105&sr=8-25
RUSTIC RITUALS best of nature for you! Men's/Women's Face Cleansing Brush with Wooden Handle  ,,,,₹999,₹349,Save ₹650 (65%),4.0 out of 5 stars,112,https://www.amazon.in/Cleansing-Brushing-Scrubbing-Exfoliating-Cleaning/dp/B07YDTNF6Z/ref=sr_1_26?dchild=1&keywords=face+brush&qid=1626887105&sr=8-26
"KYLIE Premium Synthetic Kabuki Foundation Face Powder Blush Eyeshadow Brush Makeup Brush Kit with Blender Sponge and Brush Cleaner - Makeup Brushes Set (10pcs, Black/Silver)  ",,,,₹989,₹295,Save ₹694 (70%),3.8 out of 5 stars,"4,177",https://www.amazon.in/KYLIE-Brushes-Synthetic-Foundation-Eyeshadow/dp/B07RZG9HD1/ref=sr_1_27?dchild=1&keywords=face+brush&qid=1626887105&sr=8-27
Futurekart Deep Pore Cleaning Face Cleansing Exfoliating Brush Facial Wash Massage Soft Scrubber Bamboo Fiber Double Sided  ,,,,₹599,₹299,Save ₹300 (50%),3.9 out of 5 stars,355,https://www.amazon.in/Futurekart-Cleaning-Cleansing-Exfoliating-Scrubber/dp/B07FYB6246/ref=sr_1_28?dchild=1&keywords=face+brush&qid=1626887105&sr=8-28
ClubBeauty Professional Flat Face Pack Brush Combo of 2Pcs  ,,,,₹199,₹74,Save ₹125 (63%),5.0 out of 5 stars,5,https://www.amazon.in/ClubBeauty-Professional-Flat-Brush-Combo/dp/B0924DRQ9V/ref=sr_1_29?dchild=1&keywords=face+brush&qid=1626887105&sr=8-29
Elecsera Face Pack Brush - Pack of 2  ,,,,₹199,₹80,Save ₹119 (60%),4.0 out of 5 stars,148,https://www.amazon.in/Elecsera-Face-Pack-Brush/dp/B07Z3YYX98/ref=sr_1_30?dchild=1&keywords=face+brush&qid=1626887105&sr=8-30
QKYPZO Professional Face Pack Brush (White)  ,,,,₹499,₹109,Save ₹390 (78%),4.5 out of 5 stars,5,https://www.amazon.in/QKYPZO-Professional-Face-Brush-White/dp/B08LSL17XQ/ref=sr_1_31?dchild=1&keywords=face+brush&qid=1626887105&sr=8-31
Face Pack Brush (Pack of 3)  ,,,,₹299,₹100,Save ₹199 (67%),4.2 out of 5 stars,3,https://www.amazon.in/Face-Pack-Brush-3/dp/B08VQJ4KRQ/ref=sr_1_32?dchild=1&keywords=face+brush&qid=1626887105&sr=8-32
TWIREY Face pack Brush Synthetic Hair Beauty Cosmetic Tool For Home Use/Beauty Parlor/Salon Use- Pack of 1 Pcs  ,,,,₹199,₹65,Save ₹134 (67%),,,https://www.amazon.in/TWIREY-Synthetic-Beauty-Cosmetic-Parlor/dp/B097T9W8B4/ref=sr_1_33?dchild=1&keywords=face+brush&qid=1626887105&sr=8-33
Brightening Vitamin C Face Wash with Built-In Foaming Face Brush - 150 ml  ,,,Only 1 left in stock.,₹399,₹330,Save ₹69 (17%),,,https://www.amazon.in/Brightening-Vitamin-Built-Foaming-Brush/dp/B0965CCVMM/ref=sr_1_34?dchild=1&keywords=face+brush&qid=1626887105&sr=8-34
"TWIREY Face Wash Brush, Soft Pink, Daily use Facial Tool for Washing & Cleaning your Face, Face Care tool (PACK OF 1)  ",,,,₹600,₹149,Save ₹451 (75%),2.9 out of 5 stars,4,https://www.amazon.in/TWIREY-Brush-Facial-Washing-Cleaning/dp/B0957RF46M/ref=sr_1_35?dchild=1&keywords=face+brush&qid=1626887105&sr=8-35
Colour Blast Women's Polycotton Stretchable Elasticized Adjustable Facial Headbands and Face Pack Brush and Face Cleaning Sponges Combo (Colour May Vary)  ,,,,₹499,₹199,Save ₹300 (60%),3.6 out of 5 stars,600,https://www.amazon.in/Colour-Blast-Polycotton-Stretchable-Elasticized/dp/B07NBPH85G/ref=sr_1_36?dchild=1&keywords=face+brush&qid=1626887105&sr=8-36
"Synaty Multifunctional Silicone Face Mask Brush, One Head Face Pack Applicator Tool, One Head Face Cleansing, For Mud Clay Charcoal Mixed Face Pack (Pink)  ",Limited time deal,,,₹450,₹299,Save ₹151 (34%),4.5 out of 5 stars,163,https://www.amazon.in/Synaty-Multifunctional-Silicone-Applicator-Cleansing/dp/B0894ZVH9K/ref=sr_1_37?dchild=1&keywords=face+brush&qid=1626887105&sr=8-37
Nyamah Sales Face Pack Brush with Facial Spa Headband Adjustable Makeup Tools for Home and Salon Multicolor  ,,,,₹399,₹199,Save ₹200 (50%),3.0 out of 5 stars,5,https://www.amazon.in/Nyamah-Sales-Headband-Adjustable-Multicolor/dp/B09687FXFJ/ref=sr_1_38?dchild=1&keywords=face+brush&qid=1626887105&sr=8-38
AY Double Sided Deep Pore Cleaning Facial Cleansing Portable Brush For Face Cleaning  ,,,,₹599,₹275,Save ₹324 (54%),4.1 out of 5 stars,140,https://www.amazon.in/AY-Double-Cleaning-Cleansing-Portable/dp/B07MLD582V/ref=sr_1_39?dchild=1&keywords=face+brush&qid=1626887105&sr=8-39
Angelie Foundation Makeup Cosmetic Brush (Natural White Colour)  ,Best seller,,,₹199,₹155,Save ₹44 (22%),4.0 out of 5 stars,478,https://www.amazon.in/gp/bestsellers/beauty/10850773031/ref=sr_bs_39_10850773031_1
"Syga 1 Pieces Facial Cleansing Pads, Soft Silicone Face Scrubbers Exfoliators Face Blackhead Removing Massage Tool (Assorted Color)  ",,,,₹250,₹159,Save ₹91 (36%),3.9 out of 5 stars,751,https://www.amazon.in/SYGA-Cleansing-Scrubbers-Exfoliators-Blackhead/dp/B07NC21YMC/ref=sr_1_41?dchild=1&keywords=face+brush&qid=1626887105&sr=8-41
Face Pack And Facial Bleach Makeup Brush Multicolor 1 pcs  ,,,,₹199,₹75,Save ₹124 (62%),4.2 out of 5 stars,46,https://www.amazon.in/Facial-Bleach-Makeup-Brush-Multicolor/dp/B08V9CBQKQ/ref=sr_1_42?dchild=1&keywords=face+brush&qid=1626887105&sr=8-42
"Rsentera Facial Tool for Washing & Cleaning your Face, Face Care tool I Face Wash Brush I Face Scrub Brush , Soft Pink, (Pack of 1)  ",,,,₹299,₹99,Save ₹200 (67%),3.4 out of 5 stars,9,https://www.amazon.in/Rsentera-Facial-Washing-Cleaning-Brush/dp/B08ZDBTX8Q/ref=sr_1_43?dchild=1&keywords=face+brush&qid=1626887105&sr=8-43
MACPLUS Makeup Powder Brush (Black Color)  ,Best seller,,,₹599,₹238,Save ₹361 (60%),4.2 out of 5 stars,119,https://www.amazon.in/gp/bestsellers/beauty/10850770031/ref=sr_bs_43_10850770031_1
CETC Professional Flat Face Pack Brush (1)  ,,,,₹149,₹65,Save ₹84 (56%),3.8 out of 5 stars,95,https://www.amazon.in/CETC-Professional-Flat-Face-Brush/dp/B07RXK2NSN/ref=sr_1_45?dchild=1&keywords=face+brush&qid=1626887105&sr=8-45
ClubComfort White and Oval Black Professional Foundation Brush - Pack of 2  ,,,,₹249,₹169,Save ₹80 (32%),4.1 out of 5 stars,557,https://www.amazon.in/ClubComfort-Professional-Foundation-Brush-Oval/dp/B07X95ZLTV/ref=sr_1_46?dchild=1&keywords=face+brush&qid=1626887105&sr=8-46
"WOW Skin Science Brightening Vitamin C Foaming Face Wash with Built-In Face Brush for Deep Cleansing - No Parabens, Sulphate, Silicones & Color, 150 ml  ",Limited time deal,,,₹399,₹359,Save ₹40 (10%),4.1 out of 5 stars,"9,487",https://www.amazon.in/WOW-Science-Brightening-Vitamin-Cleansing/dp/B083BVKZ8X/ref=sr_1_47?dchild=1&keywords=face+brush&qid=1626887105&smid=A2WK4OB3ROODF0&sr=8-47
LeToZa Facial Kit // Multifunction Beauty Care Brush Deep Clean 5 in 1 Portable Facial Cleaner Relief Face Massager/Blackhead Remover Facial Cleanser // facial massager  ,,,,₹999,₹295,Save ₹704 (70%),4.1 out of 5 stars,40,https://www.amazon.in/LeToZa-Multifunction-Portable-Massager-Blackhead/dp/B095NTMP2M/ref=sr_1_48?dchild=1&keywords=face+brush&qid=1626887105&sr=8-48
Bella Vita Organic Mini Face Pack Brush Set with Wooden Handle for Women & Men - Pack of 2  ,,,,₹499,₹225,Save ₹274 (55%),4.2 out of 5 stars,676,https://www.amazon.in/Bella-Vita-Organic-Animal-Natural/dp/B07TGDTXPW/ref=sr_1_49?dchild=1&keywords=face+brush&qid=1626887105&sr=8-49
Kamz Beauty Face Pack Brush (Pack of 3)  ,,,,₹199,₹99,Save ₹100 (50%),3.6 out of 5 stars,6,https://www.amazon.in/Kamz-Beauty-Face-Pack-Brush/dp/B08X1HS67X/ref=sr_1_50?dchild=1&keywords=face+brush&qid=1626887105&sr=8-50
Swiss Beauty Professional Face & Eye Brush Set  ,,,,₹699,₹690,Save ₹9 (1%),4.5 out of 5 stars,403,https://www.amazon.in/Swiss-Beauty-Professional-Face-Brush/dp/B08MQKXPQT/ref=sr_1_51?dchild=1&keywords=face+brush&qid=1626887105&sr=8-51
"Wiffy PROFECSSIONAL MAKEUP COMBO KIT FIT ME MATTE+PORELESS LIQUID TUBE FOUNDATION. FIT ME PRESSED POWDER COMPACT ( CAPPUCCINO, 8.5 G ) AND FIT ME CONCEALER (36 GOLDEN CARAMEL, 6.8 ML). MAKEUP COSMETIC FACE POWDER, FOUNDATION/BLUSH BRUSH(WHT) BEST BEAUTY MAKEUP (4 Items in the set)  ",,,,"₹1,499",₹499,"Save ₹1,000 (67%)",5.0 out of 5 stars,2,https://www.amazon.in/Wiffy-PROFECSSIONAL-FOUNDATION-CAPPUCCINO-FOUNDATION/dp/B0977BQDVJ/ref=sr_1_52?dchild=1&keywords=face+brush&qid=1626887105&sr=8-52
Jellyfish Silicone Facial Cleansing Brush Makeup Removers Face Exfoliator Deep Pore Blackheads Removing Cleansing Sponge Massager Beauty Tool (Pack of Two Pink)  ,,,,₹499,₹130,Save ₹369 (74%),4.2 out of 5 stars,30,https://www.amazon.in/Jellyfish-Silicone-Cleansing-Exfoliator-Blackheads/dp/B08RBTY88Y/ref=sr_1_53?dchild=1&keywords=face+brush&qid=1626887105&sr=8-53
Angelie Professional Flat Face Pack Brush Combo of 3Pcs  ,,,,₹299,₹175,Save ₹124 (41%),4.1 out of 5 stars,108,https://www.amazon.in/Angelie-Professional-Flat-Brush-Combo/dp/B08HZBV5CJ/ref=sr_1_54?dchild=1&keywords=face+brush&qid=1626887105&sr=8-54
Ocean Professional Face Pack Brush (White)  ,,,,₹180,₹100,Save ₹80 (44%),3.8 out of 5 stars,327,https://www.amazon.in/Ocean-Professional-Face-Pack-Brush/dp/B01LGY2XBC/ref=sr_1_55?dchild=1&keywords=face+brush&qid=1626887105&sr=8-55
FOK Soft Silicone Facial Applicator Hairless Silicone Brush Facial Mask Mud Mask Brush-13.9 x 3.2 x 1.5 cms  ,,,,₹391,₹176,Save ₹215 (55%),4.2 out of 5 stars,289,https://www.amazon.in/Silicone-Facial-Applicator-Hairless-Brush-13-9/dp/B072VQCN6H/ref=sr_1_56?dchild=1&keywords=face+brush&qid=1626887105&sr=8-56
"WOW Skin Science Vitamin C Serum - Skin Clearing Serum - Brightening, Anti-Aging Skin Repair, Supercharged Face Serum, Dark Circle, Fine Line & Sun Damage Corrector, Genuine 20% - 30ml  ",Limited time deal,Sponsored,,₹699,₹525,Save ₹174 (25%),4.0 out of 5 stars,"7,006",https://www.amazon.in/gp/slredirect/picassoRedirect.html/ref=pa_sp_btf_aps_sr_pg1_1?ie=UTF8&adId=A00935513J6TDADSJIDI7&url=%2FWOW-Skin-Science-Vitamin-Serum%2Fdp%2FB085T9LGFV%2Fref%3Dsr_1_57_sspa%3Fdchild%3D1%26keywords%3Dface%2Bbrush%26qid%3D1626887105%26smid%3DAT95IG9ONZD7S%26sr%3D8-57-spons%26psc%3D1&qualifier=1626887105&id=2271122935920667&widgetName=sp_btf
"KWT Beautiful Skin Care Expert Acne Pore Cleaner Vacuum Blackhead Remover Kit Skin Cleaner, Pimple Removal Tool, Acne Removal Tool, Blackhead Remover Tool . (White)  ",,Sponsored,,₹899,₹489,Save ₹410 (46%),4.9 out of 5 stars,73,https://www.amazon.in/gp/slredirect/picassoRedirect.html/ref=pa_sp_btf_aps_sr_pg1_1?ie=UTF8&adId=A0019448J6HW1LEF5M7F&url=%2FKWT-Beautiful-Cleaner-Blackhead-Remover%2Fdp%2FB0992GS8DH%2Fref%3Dsr_1_58_sspa%3Fdchild%3D1%26keywords%3Dface%2Bbrush%26qid%3D1626887105%26sr%3D8-58-spons%26psc%3D1&qualifier=1626887105&id=2271122935920667&widgetName=sp_btf
"Good Vibes Rose and Geranium Skin Tightening Face Scrub - 50 g - Anti-Ageing and Skin Firming Formula, Helps Reduce Wrinkles - Cruelty Free  ",,Sponsored,,₹195,₹177,Save ₹18 (9%),3.9 out of 5 stars,65,https://www.amazon.in/gp/slredirect/picassoRedirect.html/ref=pa_sp_btf_aps_sr_pg1_1?ie=UTF8&adId=A04895651ZYTI5T1UPAUJ&url=%2FGood-Vibes-Geranium-Tightening-Scrub%2Fdp%2FB084GQLQ8Z%2Fref%3Dsr_1_59_sspa%3Fdchild%3D1%26keywords%3Dface%2Bbrush%26qid%3D1626887105%26sr%3D8-59-spons%26psc%3D1&qualifier=1626887105&id=2271122935920667&widgetName=sp_btf
"Oriental Botanics Rivayat Ubtan Foaming Face Wash With Built-In Brush, For Clear and Radiant Skin - With Saffron, Rose and Turmeric Extract, 120 ml  ",Deal of the Day ,Sponsored,,₹499,₹449,Save ₹50 (10%),4.6 out of 5 stars,147,https://www.amazon.in/gp/slredirect/picassoRedirect.html/ref=pa_sp_btf_aps_sr_pg1_1?ie=UTF8&adId=A06497383LN57D36650VA&url=%2FOriental-Botanics-Rivayat-Foaming-Radiant%2Fdp%2FB08LBNC219%2Fref%3Dsr_1_60_sspa%3Fdchild%3D1%26keywords%3Dface%2Bbrush%26qid%3D1626887105%26sr%3D8-60-spons%26psc%3D1&qualifier=1626887105&id=2271122935920667&widgetName=sp_btf
Man Arden Anti Acne Neem Foaming Face Wash With Brush 120ml + Face Scrub 100g  ,,Sponsored,,₹698,₹628,Save ₹70 (10%),4.1 out of 5 stars,52,https://www.amazon.in/gp/slredirect/picassoRedirect.html/ref=pa_sp_atf_next_aps_sr_pg2_1?ie=UTF8&adId=A09484052R1S28ZSX1FKF&url=%2FMan-Arden-Foaming-Brush-120ml%2Fdp%2FB08S6Y4YGY%2Fref%3Dsr_1_49_sspa%3Fdchild%3D1%26keywords%3Dface%2Bbrush%26qid%3D1626887123%26sr%3D8-49-spons%26psc%3D1&qualifier=1626887123&id=335064204662480&widgetName=sp_atf_next
MINISO 800 Count Wooden Stick Cotton Swabs[200 Count X4](White)  ,,Sponsored,,₹150,₹140,Save ₹10 (7%),4.4 out of 5 stars,23,https://www.amazon.in/gp/slredirect/picassoRedirect.html/ref=pa_sp_atf_next_aps_sr_pg2_1?ie=UTF8&adId=A0520597JG407G1P37NJ&url=%2FMINISO-Count-Wooden-Stick-Cotton%2Fdp%2FB0963JJQYQ%2Fref%3Dsr_1_50_sspa%3Fdchild%3D1%26keywords%3Dface%2Bbrush%26qid%3D1626887123%26sr%3D8-50-spons%26psc%3D1&qualifier=1626887123&id=335064204662480&widgetName=sp_atf_next
AmbiTech 2 In 1 Steam Vaporizer Steam Inhaler Facial Vaporizer for Cold & Cough (Multi Coloured) (Made in India)(1 YEAR WARRANTY)  ,Deal of the Day ,Sponsored,,₹349,₹275,Save ₹74 (21%),3.6 out of 5 stars,490,https://www.amazon.in/gp/slredirect/picassoRedirect.html/ref=pa_sp_atf_next_aps_sr_pg2_1?ie=UTF8&adId=A05739723QDJ5AYM9BV26&url=%2FAmbiTech-Vaporizer-Inhaler-Facial-Coloured%2Fdp%2FB08KTHH4PS%2Fref%3Dsr_1_51_sspa%3Fdchild%3D1%26keywords%3Dface%2Bbrush%26qid%3D1626887123%26sr%3D8-51-spons%26psc%3D1&qualifier=1626887123&id=335064204662480&widgetName=sp_atf_next
Amazon Brand - Solimo Bath Brush with Wooden Handle  ,,Sponsored,,₹350,₹211,Save ₹139 (40%),4.2 out of 5 stars,20,https://www.amazon.in/gp/slredirect/picassoRedirect.html/ref=pa_sp_atf_next_aps_sr_pg2_1?ie=UTF8&adId=A0306000JVXNUZKO9LRA&url=%2FSolimo-Wooden-Handle-Bath-brsuh%2Fdp%2FB08GLK2XM1%2Fref%3Dsr_1_52_sspa%3Fdchild%3D1%26keywords%3Dface%2Bbrush%26qid%3D1626887123%26sr%3D8-52-spons%26psc%3D1&qualifier=1626887123&id=335064204662480&widgetName=sp_atf_next
JERN Professional Makeup Face Blush Powder Brush Tool  ,,,,₹600,₹239,Save ₹361 (60%),4.4 out of 5 stars,380,https://www.amazon.in/JERN-Professional-Makeup-Blush-Powder/dp/B083P3XC5G/ref=sr_1_53?dchild=1&keywords=face+brush&qid=1626887123&sr=8-53
"KYLIE Makeup Brushes Set Premium Synthetic Kabuki Foundation Face Powder Blush Eye shadow Brush Makeup Brush Kit with Blender Sponge and Brush Cleaner (10pcs,Pink/Silver)  ",,,,₹989,₹288,Save ₹701 (71%),3.8 out of 5 stars,740,https://www.amazon.in/KYLIE-Brushes-Synthetic-Foundation-Eyeshadow/dp/B07S92N87D/ref=sr_1_54?dchild=1&keywords=face+brush&qid=1626887123&sr=8-54
Welocity Professional Flat Face Pack Brush  ,,,,₹250,₹99,Save ₹151 (60%),3.6 out of 5 stars,42,https://www.amazon.in/Welocity-Professional-Flat-Face-Brush/dp/B08CY1VZVK/ref=sr_1_55?dchild=1&keywords=face+brush&qid=1626887123&sr=8-55
FOK 1 PC Octopus Design Silicone Facial Cleansing Brush Face Exfoliator Massager Beauty Tool - Pink  ,,,,₹415,₹203,Save ₹212 (51%),4.1 out of 5 stars,222,https://www.amazon.in/FOK-Silicone-Cleansing-Exfoliator-Massager/dp/B07R1WHDKX/ref=sr_1_56?dchild=1&keywords=face+brush&qid=1626887123&sr=8-56
MINISO Deep Cleansing Facial Cleansing Brush Face Pore Skin Care Soft Bristle Scrubber  ,,,,₹250,₹212,Save ₹38 (15%),4.2 out of 5 stars,"2,483",https://www.amazon.in/MINISO-Cleansing-Facial-Bristle-Scrubber/dp/B07THLRG4L/ref=sr_1_57?dchild=1&keywords=face+brush&qid=1626887123&sr=8-57
"WOW Skin Science Apple Cider Vinegar Foaming Face Wash - with Organic Certified Himalayan Apple Cider Vinegar - No Parabens, Sulphate, Silicones & Color (with Built-in Brush) - 150mL  ",Limited time deal,,,₹389,₹359,Save ₹30 (8%),4.1 out of 5 stars,"24,196",https://www.amazon.in/WOW-Organic-Vinegar-Foaming-Built/dp/B07SQXPW35/ref=sr_1_58?dchild=1&keywords=face+brush&qid=1626887123&smid=AT95IG9ONZD7S&sr=8-58
"LeZoir Octopus Design Silicone Facial Cleansing Brush Face Exfoliate Massage Beauty Tool & Loofah For Bath Sponge,Bathing Scrub - 1 piece (Random colour)  ",,,,₹499,₹149,Save ₹350 (70%),3.6 out of 5 stars,30,https://www.amazon.in/Octopus-Silicone-Cleansing-Exfoliate-Massage/dp/B08MV62J4H/ref=sr_1_49?dchild=1&keywords=face+brush&qid=1626887123&sr=8-49
Ronzille Makeup Brushes Set Tool Pro Foundation Blending Blush Eyeliner Face Powder Brush Kit (Silver Black Grey)  ,,,,₹399,₹180,Save ₹219 (55%),4.5 out of 5 stars,5,https://www.amazon.in/Ronzille-Brushes-Foundation-Blending-Eyeliner/dp/B07PQLZBMB/ref=sr_1_50?dchild=1&keywords=face+brush&qid=1626887123&sr=8-50
shrajs Women Facial Sponges Wipes Brush and katori Combo For Cleansing Face Reusable Face Pack Brush and Face Cleaning Sponges Combo  ,,,,₹499,₹169,Save ₹330 (66%),,,https://www.amazon.in/shrajs-Sponges-Cleansing-Reusable-Cleaning/dp/B099NM4TWW/ref=sr_1_51?dchild=1&keywords=face+brush&qid=1626887123&sr=8-51
