name,badge_1,badge_2,badge_3,mrp,discounted_price,discount,rating,rating_count,link
Amazon Brand - Jam & Honey Baby-Boy's Cotton Clothing Set  ,,Sponsored,,"₹1,999",₹825,"Save ₹1,174 (59%)",4.5 out of 5 stars,32,https://www.amazon.in/gp/slredirect/picassoRedirect.html/ref=pa_sp_atf_aps_sr_pg1_1?ie=UTF8&adId=A0442073330O2FQOV82D2&url=%2FAmazon-Brand-Cotton-Clothing-BGP8-01_Multicolor%2Fdp%2FB08NYCHS4X%2Fref%3Dsr_1_1_sspa%3Fdchild%3D1%26keywords%3Dbaby%2Bboy%2Bclothes%26qid%3D1627657375%26sr%3D8-1-spons%26psc%3D1&qualifier=1627657375&id=5393504640363906&widgetName=sp_atf
Toddylon Toddylon Baby Clothing Set Soft Hosiery Cotton Printed T Shirt and Nappy Set for 0-6 Months Infant Boys and Girls (Pack of 3)  ,Deal of the Day ,Sponsored,,₹899,₹379,Save ₹520 (58%),3.3 out of 5 stars,34,https://www.amazon.in/gp/slredirect/picassoRedirect.html/ref=pa_sp_atf_aps_sr_pg1_1?ie=UTF8&adId=A0646409ZC4WA9B4GC5L&url=%2FToddylon%25C2%25AE-Sleeveless-Tshirt-Quotes-Months%2Fdp%2FB07Q28WRFB%2Fref%3Dsr_1_2_sspa%3Fdchild%3D1%26keywords%3Dbaby%2Bboy%2Bclothes%26qid%3D1627657375%26sr%3D8-2-spons%26psc%3D1&qualifier=1627657375&id=5393504640363906&widgetName=sp_atf
"Toddylon New Born Baby Boy's and Baby Girl's Clothes T-Shirt and Nappy Set (0-6 Months) Combo Pack of 6, Multicolour  ",Deal of the Day ,Sponsored,,₹899,₹664,Save ₹235 (26%),4.1 out of 5 stars,117,https://www.amazon.in/gp/slredirect/picassoRedirect.html/ref=pa_sp_atf_aps_sr_pg1_1?ie=UTF8&adId=A06469651H69YGCU88GRP&url=%2FToddylon%25C2%25AE-Sleeveless-Tshirt-Cotton-Nappies%2Fdp%2FB07PZCWLZ4%2Fref%3Dsr_1_3_sspa%3Fdchild%3D1%26keywords%3Dbaby%2Bboy%2Bclothes%26qid%3D1627657375%26sr%3D8-3-spons%26psc%3D1&qualifier=1627657375&id=5393504640363906&widgetName=sp_atf
CUBS & HUGS Cubs & HUGSNew Born Baby Clothes Set 0-3 Months Woollen Sweater Born Baby  ,Best seller,Sponsored,,₹999,₹449,Save ₹550 (55%),4.0 out of 5 stars,19,https://www.amazon.in/gp/bestsellers/apparel/1953168031/ref=sr_bs_3_1953168031_1
Bold N Elegant - Be Bold Inside & Elegant Outside Baby Girl's T-Shirt Knee Length Dress  ,Best seller,,,"₹1,999",₹599,"Save ₹1,400 (70%)",3.7 out of 5 stars,698,https://www.amazon.in/gp/bestsellers/apparel/1953173031/ref=sr_bs_4_1953173031_1
TENDERCARE Baby boy & Baby Girl Teddy Bear Dungaree Set with Tshirt 0-1 Year || Baby Boy Dresses for 0-6 Months || Clothes for Baby boy and Girl  ,,,,₹999,₹369,Save ₹630 (63%),3.9 out of 5 stars,899,https://www.amazon.in/Tendercare-Dungaree-Tshirt-Dresses-Clothes/dp/B091BHVT4Q/ref=sr_1_6?dchild=1&keywords=baby+boy+clothes&qid=1627657375&sr=8-6
minicult Baby Boys Cotton All Over Print Pajama Bottom (Pack of 6)  ,Best seller,,,"₹1,299",₹699,Save ₹600 (46%),4.0 out of 5 stars,"12,751",https://www.amazon.in/gp/bestsellers/apparel/1953178031/ref=sr_bs_6_1953178031_1
Mothercare Baby-Boy's VG553 Relaxed Cotton Shorts Set  ,,,,₹799,₹639,Save ₹160 (20%),4.5 out of 5 stars,5,https://www.amazon.in/Mothercare-Baby-Boys-Relaxed-Cotton-VG553-1_Multicolored_3-6/dp/B08DZKG7WD/ref=sr_1_8?dchild=1&keywords=baby+boy+clothes&qid=1627657375&sr=8-8
EIO New Born Baby Multi-Color Long Sleeve Cotton Sleep Suit Romper for Boys and Girls Set of 3  ,,,,"₹1,200",₹649,Save ₹551 (46%),4.1 out of 5 stars,"5,089",https://www.amazon.in/Multi-Color-Sleeve-Cotton-Romper-Months/dp/B07H4RLN5F/ref=sr_1_9?dchild=1&keywords=baby+boy+clothes&qid=1627657375&sr=8-9
Superminis Baby Boys and Baby Girls Super Warm Milanch Thermal Set for Winters  ,,,,"₹1,499",₹699,Save ₹800 (53%),3.9 out of 5 stars,404,https://www.amazon.in/Superminis-Girls-Milanch-Thermal-Winters/dp/B07YJ7ZRXB/ref=sr_1_10?dchild=1&keywords=baby+boy+clothes&qid=1627657375&sr=8-10
TENDERCARE Baby boy & Baby Girl Teddy Bear Dungaree Set with Tshirt 0-1 Year || Baby Boy Dresses for 0-6 Months || Clothes for Baby boy and Girl  ,,,,₹750,₹379,Save ₹371 (49%),3.9 out of 5 stars,899,https://www.amazon.in/Tendercare-Dungaree-Tshirt-Clothes-White-Blue/dp/B08D8M6M61/ref=sr_1_11?dchild=1&keywords=baby+boy+clothes&qid=1627657375&sr=8-11
TENDERCARE Baby boy & Baby Girl Teddy Bear Dungaree Set with Tshirt 0-1 Year || Baby Boy Dresses for 0-6 Months || Clothes for Baby boy and Girl  ,,,,₹750,₹379,Save ₹371 (49%),3.9 out of 5 stars,899,https://www.amazon.in/Tendercare-Dungaree-Tshirt-Clothes-White-Blue/dp/B08D8NMMJ2/ref=sr_1_12?dchild=1&keywords=baby+boy+clothes&qid=1627657375&sr=8-12
"Jimmy Jammy Unisex Clothing Set for Baby Boy and Baby Girl 100% Cotton Tshirt and Shorts Set | Pack of 10 (5 Tshirt + 5 Shorts), Multi Colored, Size from 0 Months Up to 2 Year)  ",,,,"₹1,299",₹399,Save ₹900 (69%),3.4 out of 5 stars,73,https://www.amazon.in/Jimmy-Jammy-Clothing-Cotton-Colored/dp/B08VNH1913/ref=sr_1_13?dchild=1&keywords=baby+boy+clothes&qid=1627657375&sr=8-13
MINI KLUB Boy's Regular fit T-Shirt (Pack of 2)  ,,,,₹599,₹240,Save ₹359 (60%),4.1 out of 5 stars,49,https://www.amazon.in/Mini-Plain-Regular-T-Shirt-97NBTS640-ON_Multi/dp/B08H677HP3/ref=sr_1_14?dchild=1&keywords=baby+boy+clothes&qid=1627657375&sr=8-14
"Little hub 6 pcs New Born Unisex Baby Gift Set (Green, 0-3 months)  ",,,,₹300,₹290,Save ₹10 (3%),4.0 out of 5 stars,254,https://www.amazon.in/Little-Hub-Unisex-Green-months/dp/B07C97BH83/ref=sr_1_15?dchild=1&keywords=baby+boy+clothes&qid=1627657375&sr=8-15
EASYBUY baby-boys T-Shirt  ,Amazon's Choice,,,,₹169,,4.0 out of 5 stars,41,https://www.amazon.in/Easybuy-Baby-Boys-Regular-T-Shirt-SU21FS66BZ_Orange/dp/B08ZJHC8D8/ref=ice_ac_b_dpb?dchild=1&keywords=baby+boy+clothes&qid=1627657375&sr=8-16
EIO New-Born Baby Boys and Baby Girls Kids Combo Packs  ,,,,₹649,₹449,Save ₹200 (31%),4.0 out of 5 stars,"1,957",https://www.amazon.in/Newborn-Multi-Color-Jumpsuit-Bodysuit-Outfits/dp/B07QHWBVFV/ref=sr_1_17?dchild=1&keywords=baby+boy+clothes&qid=1627657375&sr=8-17
Bold N Elegant - Be Bold Inside & Elegant Outside Bold N Elegant Sky Blue n Grey Cute Elephant Tail 2pc Baby Boy Girl Clothing Set Wednesday Smile Ganesha Full Length Set Tshirt Pant Set for Infant Toddler Kids  ,,,,"₹2,499",₹799,"Save ₹1,700 (68%)",4.2 out of 5 stars,"1,140",https://www.amazon.in/Bold-Elegant-Clothing-Bnekd10007-D_Sea-Black_18-24/dp/B07CT3J9S4/ref=sr_1_18?dchild=1&keywords=baby+boy+clothes&qid=1627657375&sr=8-18
Bold N Elegant - Be Bold Inside & Elegant Outside Bold N Elegant Cool Printed Bear Giraffe Car Cartoon Printed Baby Boy Girl Two Piece Clothing Set Full Length Tshirt Pant Set for Infant Toddler Kids  ,,,,"₹1,999",₹619,"Save ₹1,380 (69%)",3.7 out of 5 stars,"1,080",https://www.amazon.in/Bold-Elegant-Printed-Scooby-Cartoon/dp/B07CW1KBKM/ref=sr_1_19?dchild=1&keywords=baby+boy+clothes&qid=1627657375&sr=8-19
Hopscotch Boys Red Cotton Blazer Style Shirt & Pant Set with Bowtie  ,,,,"₹1,049",₹699,Save ₹350 (33%),4.2 out of 5 stars,"3,705",https://www.amazon.in/Si-Noir-Hopscotch-Cotton-Applique/dp/B07K1RJ888/ref=sr_1_20?dchild=1&keywords=baby+boy+clothes&qid=1627657375&sr=8-20
Sale Mart Boy's Regular Shorts (Pack of 10)  ,Best seller,Sponsored,,"₹1,099",₹649,Save ₹450 (41%),4.3 out of 5 stars,444,https://www.amazon.in/gp/bestsellers/apparel/1953176031/ref=sr_bs_20_1953176031_1
Jimmy Jammy Baby Boy & Girl Dress Soft Hosiery Cotton Blend T-shirt and Shorts Pack 4 T-shirt + 4 Shorts Multi colored  ,,Sponsored,,"₹1,299",₹359,Save ₹940 (72%),3.2 out of 5 stars,59,https://www.amazon.in/gp/slredirect/picassoRedirect.html/ref=pa_sp_mtf_aps_sr_pg1_1?ie=UTF8&adId=A057887530B2PSL6RLNRF&url=%2FJimmy-Jammy-Hosiery-T-shirt-colored%2Fdp%2FB096WH78DT%2Fref%3Dsr_1_22_sspa%3Fdchild%3D1%26keywords%3Dbaby%2Bboy%2Bclothes%26qid%3D1627657375%26sr%3D8-22-spons%26psc%3D1&qualifier=1627657375&id=5393504640363906&widgetName=sp_mtf
Pink Kites Baby Boy/ Baby Girl cloths Flannel Jumpsuit Quit Duck Style Clothes for baby Clothing Hooded Romper Outwear - (6months To 15 months)  ,,Sponsored,,"₹1,999",₹999,"Save ₹1,000 (50%)",5.0 out of 5 stars,2,https://www.amazon.in/gp/slredirect/picassoRedirect.html/ref=pa_sp_mtf_aps_sr_pg1_1?ie=UTF8&adId=A0007223A13LIW6ANSJK&url=%2FPink-Kites-Flannel-Jumpsuit-Clothing%2Fdp%2FB094NXP2VJ%2Fref%3Dsr_1_23_sspa%3Fdchild%3D1%26keywords%3Dbaby%2Bboy%2Bclothes%26qid%3D1627657375%26sr%3D8-23-spons%26psc%3D1&qualifier=1627657375&id=5393504640363906&widgetName=sp_mtf
MINITATU Boy's Half Sleeves Unisex Bodysuit/Onesies Pack of 5  ,Limited time deal,Sponsored,,"₹1,499",₹659,Save ₹840 (56%),3.4 out of 5 stars,38,https://www.amazon.in/gp/slredirect/picassoRedirect.html/ref=pa_sp_mtf_aps_sr_pg1_1?ie=UTF8&adId=A01312463BDIUIHC5SCYO&url=%2FMINITATU-Sleeves-Bodysuit-Onesies-Peb205864_Multicolor_9-12%2Fdp%2FB0922V14G4%2Fref%3Dsr_1_24_sspa%3Fdchild%3D1%26keywords%3Dbaby%2Bboy%2Bclothes%26qid%3D1627657375%26sr%3D8-24-spons%26psc%3D1&qualifier=1627657375&id=5393504640363906&widgetName=sp_mtf
Cool Baby 5 Shirts & Matching Shorts (COOL-004)  ,,,,₹778,₹370,Save ₹408 (52%),3.8 out of 5 stars,"1,803",https://www.amazon.in/Cool-Baby-Cotton-Matching-Multicolour/dp/B00VHTRL0U/ref=sr_1_25?dchild=1&keywords=baby+boy+clothes&qid=1627657375&sr=8-25
Jimmy Jammy New Born Baby Boys & Girls Clothes Dress Soft Hosiery Cotton Blend Unisex T-Shirt and Shorts Pack of 4 T-Shirt + 4 Shorts Multi Colored | Size 0 Months Up to 12 Months  ,,,,"₹1,399",₹379,"Save ₹1,020 (73%)",3.5 out of 5 stars,2,https://www.amazon.in/Jimmy-Jammy-Clothes-Hosiery-T-Shirt/dp/B098XWP2WQ/ref=sr_1_26?dchild=1&keywords=baby+boy+clothes&qid=1627657375&sr=8-26
"Infantbond Infantbond Baby Boy's & Baby Girl's Half Sleeves T-Shirt | Touch Button T-Shirts (Pack of 5)(Yellow,Red,Grey,Blue,White P) (18-24 Months)  ",Deal of the Day ,,,"₹1,299",₹664,Save ₹635 (49%),4.0 out of 5 stars,122,https://www.amazon.in/Infantbond-Sleeves-T-Shirt-Button-T-Shirts/dp/B08VJ3LWG3/ref=sr_1_27?dchild=1&keywords=baby+boy+clothes&qid=1627657375&sr=8-27
Fareto Born Baby Boy & Girl Hospital Essential Clothing Set Combo(0-3 Months)(Assorted)(Pack of 18)  ,Deal of the Day ,,,"₹1,299",₹474,Save ₹825 (64%),3.7 out of 5 stars,30,https://www.amazon.in/Fareto-Hospital-Essential-Clothing-Assorted/dp/B08KD742RZ/ref=sr_1_28?dchild=1&keywords=baby+boy+clothes&qid=1627657375&sr=8-28
"Fareto Baby Boy's Cotton Mittens & Socks (Multicolour, 0-6 Months) - Set of 12  ",Deal of the Day ,,,"₹1,299",₹418,Save ₹881 (68%),3.9 out of 5 stars,610,https://www.amazon.in/FARETO-Cotton-Mittens-Multicolour-Months/dp/B072C7SBTQ/ref=sr_1_29?dchild=1&keywords=baby+boy+clothes&qid=1627657375&sr=8-29
"KIDS PARYANIS KIDS PARYANIS Baby Boy and Girl Full Sleeves Soft Hosiery Vests,Jhabla T-Shirt with Pyjama Pants Dress for Kids Infant Toddler New Born Clothes (Pack of 5) (3-6 Months)  ",,,,₹999,₹409,Save ₹590 (59%),4.1 out of 5 stars,20,https://www.amazon.in/KIDS-PARYANIS-Sleeves-Hosiery-T-Shirt/dp/B092RF3C6Y/ref=sr_1_30?dchild=1&keywords=baby+boy+clothes&qid=1627657375&sr=8-30
Elk Baby Boys' & Baby Girls' T-Shirt (Pack of 6)  ,,,,"₹1,799",₹649,"Save ₹1,150 (64%)",4.2 out of 5 stars,564,https://www.amazon.in/Elk-Girls-T-Shirt-SB71-INF-HS-Combo-06_Multicolored_18-24-Months/dp/B081F7SNXW/ref=sr_1_31?dchild=1&keywords=baby+boy+clothes&qid=1627657375&sr=8-31
"TENDERCARE Tendercare Baby boy & Baby Girl Half Sleeves Printed Cotton Dungaree Set with Tshirt (0-2 Year, Pack of 1),(Check Size Chart) (Yellow, 6-12 Months)  ",,,,₹999,₹299,Save ₹700 (70%),4.1 out of 5 stars,60,https://www.amazon.in/TENDERCARE-Sleeves-Printed-Cotton-Dungaree/dp/B083RVYMHS/ref=sr_1_32?dchild=1&keywords=baby+boy+clothes&qid=1627657375&sr=8-32
minicult Baby Boy's & Baby Girl's T Shirt (Pack of 5)  ,,,,"₹1,299",₹599,Save ₹700 (54%),3.5 out of 5 stars,"1,040",https://www.amazon.in/MiniCult-Cotton-Unisex-T-Shirt-Buttons/dp/B07DYVG8YD/ref=sr_1_33?dchild=1&keywords=baby+boy+clothes&qid=1627657375&sr=8-33
"Cool Baby Baby's Cotton Silk 5 Shirts and Matching Shorts (Multicolour, 0-6 Months)  ",,,,₹699,₹329,Save ₹370 (53%),3.8 out of 5 stars,464,https://www.amazon.in/Cool-Baby-Cotton-Matching-Multicolour/dp/B00VHTRFO2/ref=sr_1_34?dchild=1&keywords=baby+boy+clothes&qid=1627657375&sr=8-34
Kiddeo Baby Boy's and Baby Girl's Cotton Bodysuits Pack of 5  ,Best seller,,,"₹1,299",₹699,Save ₹600 (46%),4.2 out of 5 stars,"4,165",https://www.amazon.in/gp/bestsellers/apparel/1953156031/ref=sr_bs_34_1953156031_1
Bold N Elegant - Be Bold Inside & Elegant Outside Bold N Elegant Cool Printed Bear Cartoon Printed Little Boy Girl Baby Clothing Set Highwaist Stripe Pyjama Tshirt Pant Set for Baby Kids  ,,,,"₹1,999",₹619,"Save ₹1,380 (69%)",3.8 out of 5 stars,"1,342",https://www.amazon.in/Bold-Elegant-Cartoon-Printed-High-waist/dp/B07MXBL35C/ref=sr_1_36?dchild=1&keywords=baby+boy+clothes&qid=1627657375&sr=8-36
Fancy Walas Presents New Born Baby Winter Wear Keep Warm Baby Clothes 5Pcs Sets Cotton Baby Boys Girls Unisex Baby Fleece/Falalen or Flannel Suit Infant Clothes First Gift  ,,,,₹999,₹375,Save ₹624 (62%),4.0 out of 5 stars,2,https://www.amazon.in/Fancy-Walas-Presents-Clothes-Falalen/dp/B097MMTSK8/ref=sr_1_37?dchild=1&keywords=baby+boy+clothes&qid=1627657375&sr=8-37
Roble Baby Boy's and Baby Girl's Romper Baba Suit Dungaree 6 Months -2 Years  ,,,,"₹1,599",₹499,"Save ₹1,100 (69%)",4.2 out of 5 stars,"1,029",https://www.amazon.in/Roble-Dungree-Jumpsuit-Outfits-Newbron/dp/B07FZS88CM/ref=sr_1_38?dchild=1&keywords=baby+boy+clothes&qid=1627657375&sr=8-38
Jimmy Jammy Baby Boys & Girls Dress Soft Cotton Blend Unisex T-shirts and Pyjama Pants Pack of 4 Full sleeves T-shirt + 4 Pyjama Pants Multi colored Size 0 Months up to 18 Months  ,,,,"₹1,399",₹399,"Save ₹1,000 (71%)",3.3 out of 5 stars,5,https://www.amazon.in/Cotton-T-shirts-sleeves-T-shirt-colored/dp/B098BM7JXG/ref=sr_1_39?dchild=1&keywords=baby+boy+clothes&qid=1627657375&sr=8-39
Kuchipoo Unisex Assorted Print Pajama Bottom (Pack of 5)  ,,,,₹899,₹399,Save ₹500 (56%),4.2 out of 5 stars,"2,263",https://www.amazon.in/Kuchipoo-Baby-Pyjama-Pack-Months/dp/B072J9C6MR/ref=sr_1_40?dchild=1&keywords=baby+boy+clothes&qid=1627657375&sr=8-40
Jimmy Jammy Baby Boys & Girls Dress Soft Cotton Blend Unisex T-shirts and Pyjama Pants Pack of 4 Full sleeves T-shirt + 4 Pyjama Pants Multi colored Size 0 Months up to 18 Months  ,,,,"₹1,399",₹379,"Save ₹1,020 (73%)",3.3 out of 5 stars,5,https://www.amazon.in/Cotton-T-shirts-sleeves-T-shirt-colored/dp/B098BMXZPW/ref=sr_1_41?dchild=1&keywords=baby+boy+clothes&qid=1627657375&sr=8-41
Bold N Elegant - Be Bold Inside & Elegant Outside Bold N Elegant Solid Full Sleeve Jacket Coat Blazer with T-Shirt and Denim Blue Trouser Pant 3 Pc Party Suit Set for Little Boys  ,Best seller,,,"₹2,999",₹949,"Save ₹2,050 (68%)",3.7 out of 5 stars,212,https://www.amazon.in/gp/bestsellers/apparel/1967916031/ref=sr_bs_41_1967916031_1
Fancy Walas Presents New Born Baby Summer Wear Baby Clothes 5Pcs Sets 100% Cotton Baby Boys Girls Unisex Baby Cotton/Summer Suit Infant Clothes First Gift for New Born Baby  ,,,,₹999,₹375,Save ₹624 (62%),5.0 out of 5 stars,1,https://www.amazon.in/Fancy-Walas-Presents-Summer-Clothes/dp/B097PWHK3J/ref=sr_1_43?dchild=1&keywords=baby+boy+clothes&qid=1627657375&sr=8-43
"Shyamcollections Shyamcollections Baby Boy and Baby Girl's Fabulous Collection of Printed Full Sleeves Soft Hosiery Cotton Vests,Jhabla T-Shirt with Pyjama Pants Dress for Kids Infant Toddler Ser of 6 (6-9 Months)  ",,,,"₹1,199",₹469,Save ₹730 (61%),3.8 out of 5 stars,51,https://www.amazon.in/Shyamcollections-Fabulous-Collection-Printed-Sleeves/dp/B093TC17SK/ref=sr_1_44?dchild=1&keywords=baby+boy+clothes&qid=1627657375&sr=8-44
LITTLE HUB New Born 6 pcs Unisex Baby Gift Set  ,,,,₹310,₹300,Save ₹10 (3%),4.1 out of 5 stars,459,https://www.amazon.in/Little-Hub-Cotton-Clothing-months/dp/B07BPZLL51/ref=sr_1_45?dchild=1&keywords=baby+boy+clothes&qid=1627657375&sr=8-45
Fancy Walas Presents New Born Baby Winter Wear Keep Warm Baby Clothes 5Pcs Sets Cotton Baby Boys Girls Unisex Baby Fleece/Falalen or Flannel Suit Infant Clothes First Gift  ,,,,₹999,₹375,Save ₹624 (62%),5.0 out of 5 stars,1,https://www.amazon.in/Fancy-Walas-Presents-Clothes-Falalen/dp/B097MK545Q/ref=sr_1_46?dchild=1&keywords=baby+boy+clothes&qid=1627657375&sr=8-46
GigglePlum Baby Boys and Girls Cotton Blazer Style Shirt and Pant Set  ,,,,"₹1,699",₹649,"Save ₹1,050 (62%)",4.3 out of 5 stars,74,https://www.amazon.in/GigglePlum-Cotton-Blazer-Months-GP-CS-001-Red-00051/dp/B091B9ZBY3/ref=sr_1_47?dchild=1&keywords=baby+boy+clothes&qid=1627657375&sr=8-47
Tinchuk Baby Boy's & Baby Girl's Jhabla Vest  ,,,,"₹1,999",₹699,"Save ₹1,300 (65%)",4.1 out of 5 stars,796,https://www.amazon.in/Tinchuk-Cotton-Sleeves-Tshirt-Months/dp/B07BZWPD9H/ref=sr_1_48?dchild=1&keywords=baby+boy+clothes&qid=1627657375&sr=8-48
YUV Baby Boys & Girls Printed T-Shirt (Pack of 5) with Shoulder Poppers for 0 to 24 Months  ,,,,"₹1,699",₹649,"Save ₹1,050 (62%)",4.1 out of 5 stars,"2,374",https://www.amazon.in/YUV-Printed-T-Shirt-Shoulder-Poppers/dp/B07PCRXPXV/ref=sr_1_49?dchild=1&keywords=baby+boy+clothes&qid=1627657375&sr=8-49
Manraj Collection Baby Boy Girl Cotton Hosiery Dungaree Set (3-6 Months)  ,,,,₹899,₹349,Save ₹550 (61%),3.4 out of 5 stars,42,https://www.amazon.in/Manraj-Collection-Cotton-Hosiery-Dungaree/dp/B08L9Q5LYT/ref=sr_1_50?dchild=1&keywords=baby+boy+clothes&qid=1627657375&sr=8-50
BabyMart Baby Boy Cotton Dungaree  ,Best seller,,,₹999,₹374,Save ₹625 (63%),3.9 out of 5 stars,"1,464",https://www.amazon.in/gp/bestsellers/apparel/1953174031/ref=sr_bs_50_1953174031_1
Roble Baby Boy's and Baby Girl's Romper Baba Suit Dungaree 6 Months -2 Years  ,,,,"₹1,599",₹499,"Save ₹1,100 (69%)",4.2 out of 5 stars,"1,029",https://www.amazon.in/Roble-Dungree-Jumpsuit-Outfits-Newbron/dp/B07FZVFXQ2/ref=sr_1_52?dchild=1&keywords=baby+boy+clothes&qid=1627657375&sr=8-52
"Fareto New Born Baby Gift Pack Combo of 3pcs Baby Suit with Front Open Shirt Nappy and Cap(0-3 Months,Multi Colors)  ",,,,₹999,₹499,Save ₹500 (50%),3.7 out of 5 stars,64,https://www.amazon.in/Fareto-Hosiery-Cotton-Months-Multicolour/dp/B07CWVQ8M5/ref=sr_1_53?dchild=1&keywords=baby+boy+clothes&qid=1627657375&sr=8-53
Tendercare Baby Girl's & Baby Boy's Knee Length Dungaree  ,,,,,₹299,,3.5 out of 5 stars,11,https://www.amazon.in/Tendercare-sleeves-printed-cotton-dungaree/dp/B08CBXRYFR/ref=sr_1_54?dchild=1&keywords=baby+boy+clothes&qid=1627657375&sr=8-54
"Fareto New Born Baby Boy's & Baby Girls 8 Front Open Jhabla with 8 Cloth Single Layer Nappies(0-6 Months, Multicolored)  ",Deal of the Day ,,,"₹1,299",₹474,Save ₹825 (64%),3.8 out of 5 stars,890,https://www.amazon.in/Fareto-Jhabla-Single-Nappies-Multicolored/dp/B07QGBQKCD/ref=sr_1_55?dchild=1&keywords=baby+boy+clothes&qid=1627657375&sr=8-55
"Shyamcollections Shyamcollections Baby Boy and Baby Girl's Fabulous Collection of Printed Full Sleeves Soft Hosiery Cotton Vests,Jhabla T-Shirt with Pyjama Pants Dress for Kids Infant Toddler Ser of 6 (9-12 Months)  ",,,,"₹1,199",₹489,Save ₹710 (59%),3.8 out of 5 stars,51,https://www.amazon.in/Shyamcollections-Fabulous-Collection-Printed-Sleeves/dp/B093TBHRC2/ref=sr_1_56?dchild=1&keywords=baby+boy+clothes&qid=1627657375&sr=8-56
BUMZEE Baby-Boys Baby and Toddler Sleepers  ,Limited time deal,Sponsored,Only 5 left in stock.,₹899,₹639,Save ₹260 (29%),5.0 out of 5 stars,1,https://www.amazon.in/gp/slredirect/picassoRedirect.html/ref=pa_sp_btf_aps_sr_pg1_1?ie=UTF8&adId=A08352712UJXMMU6IF2V0&url=%2FBUMZEE-Sleepsuit-Regular-Sleepers-Peb25059B_Navy-Grey_3-6%2Fdp%2FB094H3RZFB%2Fref%3Dsr_1_57_sspa%3Fdchild%3D1%26keywords%3Dbaby%2Bboy%2Bclothes%26qid%3D1627657375%26sr%3D8-57-spons%26psc%3D1&qualifier=1627657375&id=5393504640363906&widgetName=sp_btf
"Jimmy Jammy Unisex Clothing Set for Baby Boy and Baby Girl 100% Cotton Tshirt and Short (Pack of 10 | 5 T-Shirts & 5Shorts | Multi Colored, Size from 0 Months Upto 6 Years)  ",,Sponsored,,"₹1,299",₹369,Save ₹930 (72%),3.6 out of 5 stars,138,https://www.amazon.in/gp/slredirect/picassoRedirect.html/ref=pa_sp_btf_aps_sr_pg1_1?ie=UTF8&adId=A0195853N8OAQ8LIXCOA&url=%2FJimmy-Jammy-Unisex-Clothing-Colored%2Fdp%2FB08VDVHF2L%2Fref%3Dsr_1_58_sspa%3Fdchild%3D1%26keywords%3Dbaby%2Bboy%2Bclothes%26qid%3D1627657375%26sr%3D8-58-spons%26psc%3D1&qualifier=1627657375&id=5393504640363906&widgetName=sp_btf
Max Baby-Boy's Regular Shirt  ,,Sponsored,,,₹399,,4.5 out of 5 stars,2,https://www.amazon.in/gp/slredirect/picassoRedirect.html/ref=pa_sp_btf_aps_sr_pg1_1?ie=UTF8&adId=A06438181QJ1T96IK4NGC&url=%2FMax-Baby-Boys-Regular-Shirt-M21BSH23NAVY_Navy%2Fdp%2FB091FY18M8%2Fref%3Dsr_1_59_sspa%3Fdchild%3D1%26keywords%3Dbaby%2Bboy%2Bclothes%26qid%3D1627657375%26sr%3D8-59-spons%26psc%3D1&qualifier=1627657375&id=5393504640363906&widgetName=sp_btf
Gilli Shopee Unisex Regular Fit Vest (Pack of 6)  ,,Sponsored,,₹799,₹499,Save ₹300 (38%),4.5 out of 5 stars,166,https://www.amazon.in/gp/slredirect/picassoRedirect.html/ref=pa_sp_btf_aps_sr_pg1_1?ie=UTF8&adId=A02983062GC8XCK6LO9GC&url=%2FGilli-Shopee-Printed-Cotton-Regular%2Fdp%2FB0862C6SPP%2Fref%3Dsr_1_60_sspa%3Fdchild%3D1%26keywords%3Dbaby%2Bboy%2Bclothes%26qid%3D1627657375%26sr%3D8-60-spons%26psc%3D1&qualifier=1627657375&id=5393504640363906&widgetName=sp_btf
Hopscotch Baby Boys 100% Cotton Animal Print Full Sleeves Romper in Yellow Colour  ,,Sponsored,,₹999,₹950,Save ₹49 (5%),4.3 out of 5 stars,35,https://www.amazon.in/gp/slredirect/picassoRedirect.html/ref=pa_sp_atf_next_aps_sr_pg2_1?ie=UTF8&adId=A01604661RBWJWVYLP0NO&url=%2FHopscotch-Cotton-Animal-Sleeves-Romper%2Fdp%2FB083KNPXLK%2Fref%3Dsr_1_49_sspa%3Fdchild%3D1%26keywords%3Dbaby%2Bboy%2Bclothes%26qid%3D1627657398%26sr%3D8-49-spons%26psc%3D1&qualifier=1627657398&id=6471935177368290&widgetName=sp_atf_next
MINITATU Blue.White Half Sleeves Unisex Baby T-Shirt & Pajamas Set Pack of 2  ,Best sellerLimited time deal,Sponsored,,"₹1,099",₹499,Save ₹600 (55%),3.6 out of 5 stars,321,https://www.amazon.in/gp/bestsellers/apparel/1953235031/ref=sr_bs_1_1953235031_1
MINITATU White Half Sleeves Unisex Baby T-Shirt & Pajamas Set Pack of 2  ,Limited time deal,Sponsored,,"₹1,099",₹499,Save ₹600 (55%),3.9 out of 5 stars,145,https://www.amazon.in/gp/slredirect/picassoRedirect.html/ref=pa_sp_atf_next_aps_sr_pg2_1?ie=UTF8&adId=A0234632MVEYOZIDVU5P&url=%2FMINITATU-Sleeves-Unisex-T-Shirt-Pajamas%2Fdp%2FB0922S785S%2Fref%3Dsr_1_51_sspa%3Fdchild%3D1%26keywords%3Dbaby%2Bboy%2Bclothes%26qid%3D1627657398%26sr%3D8-51-spons%26psc%3D1&qualifier=1627657398&id=6471935177368290&widgetName=sp_atf_next
BUMZEE Baby-Boys Baby and Toddler Sleepers  ,Limited time deal,Sponsored,Only 5 left in stock.,₹899,₹639,Save ₹260 (29%),4.0 out of 5 stars,1,https://www.amazon.in/gp/slredirect/picassoRedirect.html/ref=pa_sp_atf_next_aps_sr_pg2_1?ie=UTF8&adId=A08349591KHNW52BEB40Y&url=%2FBUMZEE-Sleepsuit-Regular-Sleepers-Peb25059G_Blue-White_9-12%2Fdp%2FB094H4GFF5%2Fref%3Dsr_1_52_sspa%3Fdchild%3D1%26keywords%3Dbaby%2Bboy%2Bclothes%26qid%3D1627657398%26sr%3D8-52-spons%26psc%3D1&qualifier=1627657398&id=6471935177368290&widgetName=sp_atf_next
Bold N Elegant - Be Bold Inside & Elegant Outside Bold N Elegant Cool Printed Bear Giraffe Car Cartoon Printed Baby Boy Girl Two Piece Clothing Set Full Length Tshirt Pant Set for Infant Toddler Kids  ,,,,"₹1,999",₹619,"Save ₹1,380 (69%)",3.7 out of 5 stars,"1,080",https://www.amazon.in/Bold-Elegant-Outside-Printed-Cartoon/dp/B07GR6M476/ref=sr_1_53?dchild=1&keywords=baby+boy+clothes&qid=1627657398&sr=8-53
"V.B.K V.B.K Baby Boy and Baby Girl Cloth Set Combo Pack of Jhabla, Mittens, Booties and Cap, Pure Hosiery Soft Fabric, 0-4 Months  ",,,,₹999,₹585,Save ₹414 (41%),4.4 out of 5 stars,23,https://www.amazon.in/V-B-K-Jhabla-Mittens-Booties-Hosiery/dp/B08WKZY1QW/ref=sr_1_54?dchild=1&keywords=baby+boy+clothes&qid=1627657398&sr=8-54
Fancy Walas Presents New Born Baby Summer Wear Baby Clothes 5Pcs Sets 100% Cotton Baby Boys Girls Unisex Baby Cotton/Summer Suit Infant Clothes First Gift for New Born Baby  ,,,,₹999,₹375,Save ₹624 (62%),3.8 out of 5 stars,268,https://www.amazon.in/Fancy-Walas-Presents-Summer-Clothes/dp/B08WX8JVGW/ref=sr_1_55?dchild=1&keywords=baby+boy+clothes&qid=1627657398&sr=8-55
ANGAAKAR CLOTHINGS Printed Baby Vest for Kids Cotton Sleeveless Sando Baniyan Toddler Innerwear Baby Cloth for Boys & Girls Pack of 6  ,,,,₹690,₹499,Save ₹191 (28%),4.4 out of 5 stars,"1,047",https://www.amazon.in/ANGAAKAR-CLOTHINGS-Printed-baniyan-Multicolor-1/dp/B07WN7NZNB/ref=sr_1_56?dchild=1&keywords=baby+boy+clothes&qid=1627657398&sr=8-56
"KIFAYATI BAZAR KIFAYATI BAZAR Baby Boy's and Baby Girl's Cotton Bottom Wear Pyjama (Multicolour, 0-3 Months) - Pack of 12  ",,,,₹899,₹430,Save ₹469 (52%),3.6 out of 5 stars,448,https://www.amazon.in/KIFAYATI-BAZAR-Kids-Cotton-Multicolour_Small/dp/B01N12KV5V/ref=sr_1_57?dchild=1&keywords=baby+boy+clothes&qid=1627657398&sr=8-57
Kuchipoo Boys 100% Cotton T-Shirt - Combo of 3 (KUC-TSHRT-150)  ,,,,"₹1,899",₹399,"Save ₹1,500 (79%)",3.9 out of 5 stars,96,https://www.amazon.in/Kuchipoo-Cotton-T-Shirt-KUC-TSHRT-150-12-18-Multi-Colored/dp/B08XZMJBLQ/ref=sr_1_58?dchild=1&keywords=baby+boy+clothes&qid=1627657398&sr=8-58
"Sathiyas Set of 5 Printed Cotton Shirts and Shorts for 0-6 Months Babies (Multicolour, 0-6 Months,GW4Prnt)  ",,,,₹946,₹489,Save ₹457 (48%),3.8 out of 5 stars,371,https://www.amazon.in/Sathiyas-Printed-Cotton-Multicolour-GW4Prnt/dp/B07MY2MN46/ref=sr_1_49?dchild=1&keywords=baby+boy+clothes&qid=1627657398&sr=8-49
"First Kids Step FARETO Unisex Baby Clothing Set/6 Front Open Shirts/6 Single Layer Nappies/6 Caps, 0-3 Months (Assorted)(L-10 Inchs, B-9Inchs)  ",Best sellerDeal of the Day ,,,"₹1,299",₹569,Save ₹730 (56%),3.7 out of 5 stars,366,https://www.amazon.in/gp/bestsellers/apparel/1953175031/ref=sr_bs_1_1953175031_1
