name,badge_1,badge_2,badge_3,badge_4,mrp,discounted_price,discount,rating,rating_count,link
"Swiss Beauty 2 in 1 Eyebrow & Gel Eyeliner (Black), 7gm",,,,,Rs. 299,Rs.  219,27% Off,4.3,(386),https://www.snapdeal.com/product/swiss-beauty-2-in-1/672710637013#bcrumbSearch:eyeliner
ADS Colossal 6 Pencil Kajal Pencil Eyeliner + 3 36Hr Sketch Eye Liner 3.2 gm,,,60 orders in last 7 days,,Rs. 600,Rs.  215,64% Off,3.8,(203),https://www.snapdeal.com/product/ads-colossal-6-pencil-kajal/628543689788#bcrumbSearch:eyeliner
Miss Rose Gel Eyeliner | Shade - Black & Brown,,,,,Rs. 547,Rs.  209,62% Off,3.9000000000000004,(164),https://www.snapdeal.com/product/miss-rose-intense-black-and/624385647035#bcrumbSearch:eyeliner
Miss Rose Long Wearing Gel Eyeliner Kajal Black 3 gm,,,,,Rs. 499,Rs.  149,70% Off,3.9000000000000004,(47),https://www.snapdeal.com/product/miss-rose-kajal-stick-black/659522031535#bcrumbSearch:eyeliner
Yanqina Black color 36 hrs Liquid Eyeliner | Pack of 6,,,,,Rs. 499,Rs.  239,52% Off,4.0,(398),https://www.snapdeal.com/product/ads-yanqina-36-hrs-liquid/661538656266#bcrumbSearch:eyeliner
Miss Rose Pencil Eyeliner Black 3.5 ml,,,,,Rs. 499,Rs.  289,42% Off,3.9000000000000004,(265),https://www.snapdeal.com/product/miss-rose-pencil-eyeliner-black/657362007080#bcrumbSearch:eyeliner
MN Pencil Eyeliner black Pack of 2 6,,,,,Rs. 399,Rs.  259,35% Off,3.9000000000000004,(107),https://www.snapdeal.com/product/mn-pencil-eyeliner-dynamic-black/641778982395#bcrumbSearch:eyeliner
ADS Eyelashes+ Glue+ 36 hrs black eyeliner+ Eyelash Curler | Combo of 4,,,13 orders in last 1 day,,Rs. 799,Rs.  239,70% Off,3.8,(115),https://www.snapdeal.com/product/ads-eyelashes-glue-36-hrs/670287864649#bcrumbSearch:eyeliner
Volo Waterproof Glitter Eyeliner (Olive Green & Sky Blue),,,,,Rs. 399,Rs.  369,8% Off,3.9000000000000004,(114),https://www.snapdeal.com/product/volo-waterproof-sky-blue-liquid/676471685189#bcrumbSearch:eyeliner
Miss Rose Pencil Eyeliner Black 0.018,,,,,Rs. 659,Rs.  229,65% Off,3.9000000000000004,(74),https://www.snapdeal.com/product/miss-rose-professional-waterproof-black/670477220733#bcrumbSearch:eyeliner
"Swiss Beauty Bold Liquid Eyeliner (Black) | Pack of 2, 1.2ml each",,,,,Rs. 498,Rs.  379,24% Off,4.4,(22),https://www.snapdeal.com/product/swiss-beauty-pencil-eyeliner-jet/674310788060#bcrumbSearch:eyeliner
Colors Queen Gel Kajal & Cake Eye liner Kajal Gel Black 7 g,,,,,Rs. 349,Rs.  299,14% Off,4.5,(10),https://www.snapdeal.com/product/colors-queen-gel-kajal-cake/623307753260#bcrumbSearch:eyeliner
ADS Liquid Eyeliner Black Pack of 3 3 g,,,,,Rs. 685,Rs.  279,59% Off,4.5,(17),https://www.snapdeal.com/product/ads-liquid-eyeliner-black-12/661546789460#bcrumbSearch:eyeliner
"Lenon Beauty Gel Eyeliner, False Eyelash, Eyelash Glue & Eyelash Curler Pack of 8 50",,,,,Rs. 699,Rs.  369,47% Off,4.5,(2),https://www.snapdeal.com/product/lenon-beauty-gel-eyeliner-false/669644608740#bcrumbSearch:eyeliner
Swiss Beauty Pencil Eyeliner Black 3 mL,,,,,Rs. 249,Rs.  219,12% Off,5.0,(4),https://www.snapdeal.com/product/swiss-beauty-pencil-eyeliner-black/656736993870#bcrumbSearch:eyeliner
" Seven Seas Professional Makeup Combo kit (Kajal,Mascara,Eyeliner,Face Mask) | Pack of 4",,,,,Rs. 720,Rs.  499,31% Off,4.0,(2),https://www.snapdeal.com/product/seven-seas-professional-makeup-combo/669213266807#bcrumbSearch:eyeliner
Colors Queen Ske Eyes Glitter Liquid Eyeliner White 5 mL,,,,,Rs. 199,Rs.  169,15% Off,5.0,(1),https://www.snapdeal.com/product/colors-queen-ske-eyes-glitter/631543597837#bcrumbSearch:eyeliner
"VOLO WATERPROOF Golden, Copper Liquid Eyeliner Navy Pack of 3 15 mL",,,,,Rs. 567,Rs.  419,26% Off,5.0,(1),https://www.snapdeal.com/product/volo-waterproof-golden-copper-liquid/650912111346#bcrumbSearch:eyeliner
"Kremlin BRS Liquid Eyeliner (BLUE, DARK PINK, GOLDEN, SILVER)-6 ml (Set of 4)",,,,,"Rs. 1,060",Rs.  229,78% Off,,,https://www.snapdeal.com/product/kremlin-liquid-eyeliner-black-pack/647408083131#bcrumbSearch:eyeliner
ADS Eyeliner With Mascara Mascara Black with free Kajal .09 gm Pack of 2,,,,,Rs. 499,Rs.  249,50% Off,3.0,(8),https://www.snapdeal.com/product/ads-mascara-black-09-gm/684583685594#bcrumbSearch:eyeliner
Kremlin Liquid Eyeliner Black Pack of 6 6 mL,,,,,"Rs. 1,590",Rs.  289,82% Off,5.0,(2),https://www.snapdeal.com/product/kremlin-liquid-eyeliner-black-pack/664095120638
"Kremlin BRS Liquid Eyeliner (BLACK, BLUE, DARK PINK, GREEN)-6 ml (Set of 4)",,,,,"Rs. 1,060",Rs.  229,78% Off,4.0,(1),https://www.snapdeal.com/product/kremlin-liquid-eyeliner-black-pack/640614896778
Mn Extreme Curls Mascara And Eyeliner 2.5ml X 2,,,,,Rs. 999,Rs.  339,66% Off,4.3,(6),https://www.snapdeal.com/product/mn-extreme-curls-mascara-and/629952649
"Swiss Beauty HD Stroke Eyeliner Pen Black, 1ml",,,,,Rs. 299,Rs.  229,23% Off,4.3,(4),https://www.snapdeal.com/product/swiss-beauty-hd-stroke-pencil/676681317506
Colors Queen Sky Eye Glitter Liquid Eyeliner Green 5 mL,,,,,Rs. 199,Rs.  159,20% Off,,,https://www.snapdeal.com/product/colors-queen-sky-eye-glitter/628806006937
Miss Rose Long Lasting Liquid Eyeliner Black 20 g,,,,,Rs. 499,Rs.  219,56% Off,4.0,(1),https://www.snapdeal.com/product/miss-rose-long-lasting-liquid/642649125691
Incolor Hi Tech Black Eye liner | Pack of 2,,,,,Rs. 350,Rs.  259,26% Off,3.8,(20),https://www.snapdeal.com/product/incolor-hi-tech-eye-liner/131461
Colors Queen Sky Eyes Glitter Liquid Eyeliner Silver 5 mL,,,,,Rs. 199,Rs.  169,15% Off,4.5,(2),https://www.snapdeal.com/product/colors-queen-sky-eyes-glitter/683797737500
ADS Good Choice india Liquid Eyeliner Black 3.5 g,,,,,Rs. 263,Rs.  179,32% Off,4.5,(2),https://www.snapdeal.com/product/ads-good-choice-india-liquid/624013988306
Seven Seas Eye Catching Sketch Pencil Eyeliner Black 100 g,,,,,Rs. 185,Rs.  149,19% Off,,,https://www.snapdeal.com/product/seven-seas-eye-catching-sketch/621512161074
ADS Good Choice india Pencil Eyeliner Black 3.5 g,,,,,Rs. 539,Rs.  229,58% Off,3.0,(6),https://www.snapdeal.com/product/ads-good-choice-india-pencil/626849721647
Incolor Pencil Eyeliner Black 6 mL,,,,,Rs. 199,Rs.  199,,4.0,(1),https://www.snapdeal.com/product/incolor-pencil-eyeliner-black-6/646231524036
Colors Queen Waterproof Pencil Eyeliner Black 2 g,,,,,Rs. 249,Rs.  219,12% Off,3.0,(7),https://www.snapdeal.com/product/colors-queen-waterproof-pencil-eyeliner/674142332562
Miss Rose Cake Eyeliner Kajal Gel Black 6 g,,,,,Rs. 499,Rs.  219,56% Off,,,https://www.snapdeal.com/product/miss-rose-cake-eyeliner-kajal/622325338323
ADS Pencil Eyeliner Black 3.5 g,,,,,Rs. 510,Rs.  239,53% Off,3.1,(13),https://www.snapdeal.com/product/ads-roiumising-eyeliner-water-prrof/1978854651
ADS Dazzle Multicolor Pencil Eyeliner Black 12 g,,,,,Rs. 399,Rs.  219,45% Off,4.0,(5),https://www.snapdeal.com/product/ads-dazzle-multicolor-pencil-eyeliner/636785495069
ADS 2IN1 Longer Waterproof  Liquid Eyeliner Black 20 g,,,,,Rs. 400,Rs.  249,38% Off,3.2,(74),https://www.snapdeal.com/product/ads-2in1-longer-waterproof-liquid/667741731906
Incolor Eyeliner & Mascara Combo Liquid Eyeliner Black Pack of 2 6 mL,,,,,Rs. 354,Rs.  279,21% Off,5.0,(1),https://www.snapdeal.com/product/incolor-liquid-eyeliner-black-pack/642173483944
Colors Queen Sky Eyes Glitter Liquid Eyeliner Silver 5 mL,,,,,Rs. 199,Rs.  169,15% Off,,,https://www.snapdeal.com/product/colors-queen-sky-eyes-glitter/658028670167
Miss Rose Miss Rose Cream Eyeliner Black and Brown 0.05 kg,,,,,Rs. 499,Rs.  199,60% Off,4.5,(2),https://www.snapdeal.com/product/miss-rose-miss-rose-cream/652654683178
"Kremlin BRS Liquid Eyeliner (BLACK, COPPER, GOLDEN, SILVER)-6 ml (Set of 4)",,,,,"Rs. 1,060",Rs.  229,78% Off,5.0,(1),https://www.snapdeal.com/product/kremlin-liquid-eyeliner-black-pack/647586655042
Miss Rose Cake Eyeliner Kajal Gel Black 6 g,,,,,Rs. 499,Rs.  219,56% Off,,,https://www.snapdeal.com/product/miss-rose-cake-eyeliner-kajal/622325338323
Laperla Liquid Eyeliner Black Pack of 2 6 mL,,,,,Rs. 510,Rs.  159,69% Off,4.0,(2),https://www.snapdeal.com/product/laperla-liquid-eyeliner-black-pack/645228496835
EOD Shimmer Long Lasting Pencils Liquid Eyeliner Green Pack of 2 2 mL,,6 left!,,,Rs. 898,Rs.  575,36% Off,5.0,(1),https://www.snapdeal.com/product/eod-shimmer-long-lasting-pencils/628902487158
Miss Rose Long Lasting Liquid Eyeliner Black 20 g,,,,,Rs. 699,Rs.  219,69% Off,5.0,(1),https://www.snapdeal.com/product/miss-rose-long-lasting-liquid/625912204675
Mn Extreme Curls Mascara And Eyeliner 2.5ml X 2,,,,,Rs. 999,Rs.  339,66% Off,4.3,(6),https://www.snapdeal.com/product/mn-extreme-curls-mascara-and/629952649
"La Perla BSI Liquid Eyeliner (BLUE, COPPER, DARK PINK)-5.5 ml (Set of 3)",,,,,Rs. 735,Rs.  226,69% Off,,,https://www.snapdeal.com/product/laperla-liquid-eyeliner-black-pack/646322722306
Miss Rose Gel Eyeliner Black 10 g,,,,,Rs. 494,Rs.  229,54% Off,3.5999999999999996,(21),https://www.snapdeal.com/product/miss-rose-gel-eyeliner-black/680614294799
"Incolor Exposed 2 in 1 Gel Eyeliner & Smudger, Black & Brown, 5 g",,,,,Rs. 295,Rs.  259,12% Off,4.0,(2),https://www.snapdeal.com/product/incolor-exposed-2-in-1/686337691859
Mars Waterproof Lip & Pencil Eyeliner Black 0.35 g,,,,,Rs. 499,Rs.  259,48% Off,3.2,(27),https://www.snapdeal.com/product/mars-waterproof-lip-pencil-eyeliner/675625081312
Glam 21 Pencil Eyeliner Black 6 g,,,,,Rs. 596,Rs.  405,32% Off,3.0,(1),https://www.snapdeal.com/product/glam-21-pencil-eyeliner-blue/643998090980
Miss Rose Long Lasting Liquid Eyeliner Black 20 g,,,,,Rs. 549,Rs.  329,40% Off,,,https://www.snapdeal.com/product/miss-rose-long-lasting-liquid/662019488650
MN Pencil Eyeliner BLACK 15 gm,,,,,Rs. 599,Rs.  389,35% Off,4.0,(4),https://www.snapdeal.com/product/mn-pencil-eyeliner-black-15/671883555488
ADS Liquid Eyeliner Black 10 g,,,,,"Rs. 1,136",Rs.  279,75% Off,3.5,(72),https://www.snapdeal.com/product/ads-good-choice-india-kajal/677498974538
Colors Queen Stick Eyeliner Black 8 mL,,,,,Rs. 179,Rs.  145,19% Off,3.0,(2),https://www.snapdeal.com/product/colors-queen-stick-eyeliner-black/621081264698
Kremlin Liquid Eyeliner Black Pack of 2 6 mL,,,,,Rs. 510,Rs.  159,69% Off,,,https://www.snapdeal.com/product/kremlin-liquid-eyeliner-black-pack/635175712184
Miss Rose Long Lasting Liquid Eyeliner Black 20 g,,6 left!,,,Rs. 599,Rs.  369,38% Off,4.5,(2),https://www.snapdeal.com/product/miss-rose-long-lasting-liquid/619207626632
Miss Rose Gel Eyeliner | Shade - Black & Brown,,,,,Rs. 499,Rs.  219,56% Off,3.7,(30),https://www.snapdeal.com/product/miss-rose-gel-eyeliner-black/623269424677
"Kremlin BRS Liquid Eyeliner (BLACK, BLUE, COPPER, DARK PINK, GREEN, SILVER)-6 ml (Set of 6)",,,,,"Rs. 1,590",Rs.  299,81% Off,3.0,(2),https://www.snapdeal.com/product/kremlin-liquid-eyeliner-black-pack/639758664063
"La Perla BRS Liquid Eyeliner (BLACK, BLUE, DARK PINK, GOLDEN, GREEN)-6 ml (Set of 5)",,,,,"Rs. 1,325",Rs.  295,78% Off,,,https://www.snapdeal.com/product/laperla-liquid-eyeliner-black-pack/643994047180
Incolor Maxi Blue Gel Eyeliner Navy 2 g,,,,,Rs. 250,Rs.  209,16% Off,3.9000000000000004,(7),https://www.snapdeal.com/product/incolor-pencil-eyeliner-navy-2/620264689427
Incolor Master Stroke Eyeliner Shade 10 Extreme Gold | 6 ml,,,,,Rs. 239,Rs.  199,17% Off,5.0,(2),https://www.snapdeal.com/product/incolor-liquid-eyeliner-gold-6/657965239101
Music Flower Gel Eyeliner Black & Brown 6,,,,,Rs. 600,Rs.  349,42% Off,3.5999999999999996,(804),https://www.snapdeal.com/product/music-flower-gel-eyeliner-black/635446884317
Colors Queen Pencil Eyeliner Black 8 mL,,,,,Rs. 229,Rs.  179,22% Off,4.0,(1),https://www.snapdeal.com/product/colors-queen-pencil-eyeliner-black/638277771622
"VOLO WATERPROOF Green, Gold Liquid Eyeliner White Pack of 3 15 mL",,,,,Rs. 567,Rs.  419,26% Off,,,https://www.snapdeal.com/product/volo-waterproof-green-gold-liquid/627552205099
Miss Rose 2 in 1 Eyebrow & Gel Eyeliner Black 7 g,,,,,Rs. 499,Rs.  229,54% Off,4.0,(2),https://www.snapdeal.com/product/miss-rose-2-in-1/650988506000
Colors Queen Eyeliner & Mascara Black,,,,,Rs. 360,Rs.  309,14% Off,4.3,(3),https://www.snapdeal.com/product/colors-queen-eyeliner-mascara-black/660846275905
"VOLO WATERPROOF Golden, Copper Liquid Eyeliner Green Pack of 3 15 mL",,,,,Rs. 567,Rs.  419,26% Off,5.0,(1),https://www.snapdeal.com/product/volo-waterproof-golden-copper-liquid/618857048042
"Kremlin BSI Liquid Eyeliner (BLACK, BLUE, DARK PINK, GREEN)-5.5 ml (Set of 4)",,,,,Rs. 980,Rs.  262,73% Off,,,https://www.snapdeal.com/product/kremlin-liquid-eyeliner-black-pack/648685510732
Colors Queen Ultra Finish Pencil Eyeliner Black 2 g,,,,,Rs. 225,Rs.  189,16% Off,4.699999999999999,(3),https://www.snapdeal.com/product/colors-queen-ultra-finish-pencil/639827595001
Miss Rose Long Lasting Liquid Eyeliner Beige 20 g,,,,,Rs. 399,Rs.  229,43% Off,5.0,(1),https://www.snapdeal.com/product/miss-rose-long-lasting-liquid/684331462348
Miss Rose Long Lasting Liquid Eyeliner Black 20 g,,,,,Rs. 414,Rs.  209,50% Off,4.8,(5),https://www.snapdeal.com/product/miss-rose-long-lasting-liquid/679552073094
Iba Halal Long Stay Liquid Eyeliner Black 6.5 mL,,,,,Rs. 325,Rs.  299,8% Off,3.8,(69),https://www.snapdeal.com/product/iba-halal-long-stay-liquid/667614522901
Seven Seas ULTRA Liquid Eyeliner Black 8 mL,,,,,Rs. 175,Rs.  140,20% Off,,,https://www.snapdeal.com/product/seven-seas-ultra-liquid-eyeliner/644427363303
ADS Eyeliner Single,,,,,Rs. 675,Rs.  439,35% Off,3.5,(23),https://www.snapdeal.com/product/ads-eye-care-liner/1474239263
"ADS Waterproof Eye Pencil(Black,6 Pencil Eyeliner Black 0.25 g",,,,,Rs. 499,Rs.  209,58% Off,3.5,(281),https://www.snapdeal.com/product/ads-france-long-lasting-sparkle/602130762
Incolor master Stroke Eyeliner Shade 05 Blue Shapphire | 6 ml,,,,,Rs. 239,Rs.  199,17% Off,4.3,(4),https://www.snapdeal.com/product/incolor-liquid-eyeliner-navy-6/639675087317
Meilin Shimmer Glam Shine Liquid Eyeliner Silver+ Gold Pack of 2 4.2,,,,,Rs. 799,Rs.  419,48% Off,5.0,(2),https://www.snapdeal.com/product/meilin-shimmer-glam-shine-liquid/670663617271
Incolor Pencil Eyeliner Black 2 g,,,,,Rs. 210,Rs.  199,5% Off,,,https://www.snapdeal.com/product/incolor-pencil-eyeliner-black-2/680128809978
VOLO Waterproof Sky Blue Liquid Eyeliner Copper Pack of 2 10 mL,,,,,Rs. 399,Rs.  369,8% Off,4.3,(3),https://www.snapdeal.com/product/volo-waterproof-sky-blue-liquid/627122956758
Mars Mn Dynamic Liquid Eyeliner 1,,,,,Rs. 399,Rs.  199,50% Off,4.0,(22),https://www.snapdeal.com/product/mars-mn-dynamic-liquid-eyeliner/627147533816
VOLO Waterproof Copper Liquid Eyeliner White Pack of 2 10 mL,,,,,Rs. 399,Rs.  369,8% Off,5.0,(1),https://www.snapdeal.com/product/volo-waterproof-copper-liquid-eyeliner/686562168927
"Kremlin BRS Liquid Eyeliner (BLACK, DARK PINK, SILVER)-6 ml (Set of 3)",,,,,Rs. 795,Rs.  226,72% Off,,,https://www.snapdeal.com/product/kremlin-liquid-eyeliner-black-pack/661283747537
Incolor Maxi pen Eyeliner Shade Brown | 2 gm,,,,,Rs. 250,Rs.  209,16% Off,5.0,(1),https://www.snapdeal.com/product/incolor-pencil-eyeliner-brown-2/628169752974
"VOLO Waterproof Copper, Green, Blue Liquid Eyeliner White Pack of 4 20 mL",,,,,Rs. 756,Rs.  489,35% Off,3.0,(1),https://www.snapdeal.com/product/volo-waterproof-copper-green-blue/622199951208
Incolor Gel Eyeliner brown black 6 gm Combo Pack of 2,,,,,Rs. 299,Rs.  249,17% Off,3.9000000000000004,(102),https://www.snapdeal.com/product/incolor-gel-eyeliner-brown-black/682880326675
ADS Gel Eyeliner Powder & Gel Black,,,,,Rs. 899,Rs.  269,70% Off,3.5,(4),https://www.snapdeal.com/product/ads-gel-eyeliner-powder-gel/620022351495
Miss Rose Long Lasting Liquid Eyeliner Black 0 g,,,,,Rs. 599,Rs.  340,43% Off,,,https://www.snapdeal.com/product/miss-rose-long-lasting-liquid/631371526728
"VOLO Waterproof Blue, Gold, Copper Liquid Eyeliner Silver Pack of 4 20 mL",,,,,Rs. 756,Rs.  489,35% Off,5.0,(1),https://www.snapdeal.com/product/volo-waterproof-blue-gold-copper/682445003572
ADS Good Choice Free Kajal With  Gel Eyeliner Black 3.5 g,,,,,Rs. 775,Rs.  289,63% Off,3.299999999999999,(4),https://www.snapdeal.com/product/ads-good-choice-free-kajal/630823717977
"VOLO WATERPROOF Golden, Gold Liquid Eyeliner White Pack of 3 15 mL",,,,,Rs. 567,Rs.  419,26% Off,4.0,(2),https://www.snapdeal.com/product/volo-waterproof-golden-gold-liquid/640485663120
Music Flower Liquid Eyeliner,,,,,Rs. 585,Rs.  489,16% Off,3.8,(117),https://www.snapdeal.com/product/music-flower-liquid-eyeliner-black/676578837456
"La Perla BSI Liquid Eyeliner (BLACK, BLUE, DARK PINK, GOLDEN, GREEN, SILVER)-5.5 ml (Set of 6)",,,,,"Rs. 1,470",Rs.  362,75% Off,,,https://www.snapdeal.com/product/laperla-liquid-eyeliner-black-pack/650773467057
KISS BEAUTY music flower Gel Eyeliner BLACK 3 gm,,,,,Rs. 508,Rs.  385,24% Off,3.5999999999999996,(59),https://www.snapdeal.com/product/kiss-beauty-music-flower-gel/633515131384
Cameleon Pencil Eyeliner Navy 3.6 g,,6 left!,,,Rs. 298,Rs.  169,43% Off,3.0,(3),https://www.snapdeal.com/product/cameleon-pencil-eyeliner-navy-36/650304394646
Meilin Powder Eyeliner Single,,6 left!,,,Rs. 499,Rs.  279,44% Off,3.5,(49),https://www.snapdeal.com/product/meilin-professional-cake-eyeliner-black/1659708099
Laperla Liquid Eyeliner Black Pack of 2 6 mL,,,,,Rs. 510,Rs.  159,69% Off,,,https://www.snapdeal.com/product/laperla-liquid-eyeliner-black-pack/669418432144
EOD Shimmer Long Lasting Pencils Liquid Eyeliner Purple Pack of 2 2 mL,,,,,Rs. 898,Rs.  575,36% Off,4.0,(1),https://www.snapdeal.com/product/eod-shimmer-long-lasting-pencils/638696465408
Incolor Master Stroke Eyeliner Shade 09 Envy Green | 6 ml,,,,,Rs. 239,Rs.  199,17% Off,4.3,(4),https://www.snapdeal.com/product/incolor-liquid-eyeliner-green-6/685331046188
Mars 2in1 Eyebrow Pencil-01-02 Gel Eyeliner Black Pack of 2 3.5 g,,,,,Rs. 738,Rs.  369,50% Off,4.0,(1),https://www.snapdeal.com/product/mars-2in1-eyebrow-pencil0102-gel/642447570205
