name,badge_1,badge_2,badge_3,badge_4,mrp,discounted_price,discount,rating,rating_count,link
COLORS QUEEN 2 In 1 Matte Lip Gloss and Lipstick | Shimmer Mehroon Shade,,,22 orders in last 1 day,,Rs. 249,Rs.  239,4% Off,3.9000000000000004,(2099),https://www.snapdeal.com/product/colors-queen-creme-lipstick-maroon/656240704030#bcrumbSearch:lipstick
Iba Halal Multi shade Creme Lipstick | Pack of 3,,4 left!,,,Rs. 630,Rs.  489,22% Off,3.7,(448),https://www.snapdeal.com/product/iba-halal-creme-lipstick-red/669817810650#bcrumbSearch:lipstick
Miss Rose Professional kiss me stupid Lipstick Wine 3.4 g,,,43 orders in last 1 day,,Rs. 399,Rs.  179,55% Off,4.0,(85),https://www.snapdeal.com/product/miss-rose-professional-makeup-matte/671276752092#bcrumbSearch:lipstick
ADS Multicolor Creme Lipstick | Set of 12,,,43 orders in last 1 day,,Rs. 499,Rs.  249,50% Off,3.8,(128),https://www.snapdeal.com/product/ads-creme-lipstick-multi-37/628889169234#bcrumbSearch:lipstick
"Swiss Beauty Waterproof, Non-Transfer Lipstick (Dark Brown), 2gm",,,,,Rs. 299,Rs.  259,13% Off,4.1,(46),https://www.snapdeal.com/product/swiss-beauty-waterproof-nontransfer-lipstick/4755801848172844438#bcrumbSearch:lipstick
Miss Rose Creme Lipstick | Shade No 49(Chii),,,18 orders in last 1 day,,Rs. 399,Rs.  179,55% Off,3.9000000000000004,(593),https://www.snapdeal.com/product/miss-rose-creme-lipstick-oval49/656534513151#bcrumbSearch:lipstick
ADS Ultra Ceramide Matte Lipstick Multicolor,,,11 orders in last 1 day,,Rs. 399,Rs.  269,33% Off,3.299999999999999,(1225),https://www.snapdeal.com/product/ads-ultra-ceramide-matte-lipstick/632499977994#bcrumbSearch:lipstick
Colors Queen Matte Me Liquid Lipstick Maroon 6 mL,,,,,Rs. 199,Rs.  189,5% Off,4.3,(7),https://www.snapdeal.com/product/colors-queen-matte-me-liquid/628874363557#bcrumbSearch:lipstick
Miss Rose pigment 2in1 lipstick lipliner Lipstick Show girl 01 Light Nude 2.1 g,,,,,Rs. 499,Rs.  209,58% Off,3.9000000000000004,(37),https://www.snapdeal.com/product/miss-rose-pigment-2in1-lipstick/667906639617#bcrumbSearch:lipstick
COLORS QUEEN Bride Red shade 2 In 1 Matte Lip Gloss and Lipstick ,,,80 orders in last 7 days,,Rs. 249,Rs.  239,4% Off,4.0,(451),https://www.snapdeal.com/product/colors-queen-liquid-lipstick-red/685924568346#bcrumbSearch:lipstick
"bq BLAQUE Matte Liquid Lipstick Lip Color 4ml, Waterproof - Purple Affair",,,,,Rs. 325,Rs.  169,48% Off,3.8,(67),https://www.snapdeal.com/product/bq-blaque-longlasting-matte-lipstick/668228126580#bcrumbSearch:lipstick
COLORS QUEEN 2 In 1 Matte Lip Gloss and Lipstick | Shimmer Mehroon Shade,,,61 orders in last 7 days,,Rs. 249,Rs.  239,4% Off,3.9000000000000004,(499),https://www.snapdeal.com/product/colors-queen-liquid-lipstick-maroon/676999074503#bcrumbSearch:lipstick
Miss Rose Matte Lipstick Red 20 g,,,,,Rs. 399,Rs.  179,55% Off,4.200000000000001,(27),https://www.snapdeal.com/product/miss-rose-matte-lipstick-red/661752969683#bcrumbSearch:lipstick
Iba Halal Pure Lips Long Stay Matte Lipstick M17 Apricot Blush,,,,,Rs. 350,Rs.  336,4% Off,4.3,(27),https://www.snapdeal.com/product/iba-halal-pure-lips-long/674817708552#bcrumbSearch:lipstick
COLORS QUEEN 2 In 1 Matte Lip Gloss and Lipstick | Shade Bride Red ,,,,,Rs. 249,Rs.  239,4% Off,4.1,(225),https://www.snapdeal.com/product/colors-queen-indian-red-lipstick/631101919254#bcrumbSearch:lipstick
COLORS QUEEN 2 In 1 Matte Lip Gloss and Lipstick | Shimmer Mehroon Shade,,,,,Rs. 249,Rs.  239,4% Off,3.7,(174),https://www.snapdeal.com/product/colour-queen-lip-gloss-liquid/685350028942#bcrumbSearch:lipstick
"Miss Rose Professional Bullet Matte Lipstick - Iris, Brown, 3.4 gm",,,,,Rs. 399,Rs.  179,55% Off,3.8,(221),https://www.snapdeal.com/product/miss-rose-lipstick-professional-matte/673823450740#bcrumbSearch:lipstick
"MI Fashion High Pigmented Bold Colors Lipsticks Crème Matte Combo Set of 2 ( Magenta, Pink )",,,,,Rs. 398,Rs.  379,5% Off,4.200000000000001,(22),https://www.snapdeal.com/product/mi-fashion-100-veg-soft/621876481817#bcrumbSearch:lipstick
Miss Rose Creme Lipstick Coral 10 g,,,,,Rs. 399,Rs.  179,55% Off,4.1,(53),https://www.snapdeal.com/product/miss-rose-creme-lipstick-light/8935142284713868035#bcrumbSearch:lipstick
Colors Queen Red Orange Lipstick Red 10 g,,,,,Rs. 249,Rs.  239,4% Off,4.0,(32),https://www.snapdeal.com/product/colors-queen-red-orange-lipstick/675515342572#bcrumbSearch:lipstick
"Swiss Beauty Waterproof, Non-Transfer Lipstick (Bold Wine), 2gm",,,,,Rs. 299,Rs.  259,13% Off,4.1,(46),https://www.snapdeal.com/product/swiss-beauty-waterproof-nontransfer-lipstick/5908723352779691414
Miss Rose Creme Lipstick Hot Pink 10 g,,,,,Rs. 299,Rs.  179,40% Off,4.1,(53),https://www.snapdeal.com/product/miss-rose-creme-lipstick-light/7061644839727741699
"Swiss Beauty 12Hrs. Stay Matte Lip Crayon Lipstick (Dynamite Berry), 3gm",,,,,Rs. 299,Rs.  269,10% Off,4.3,(16),https://www.snapdeal.com/product/swiss-beauty-12hrs-stay-matte/6629299331890662756
"Swiss Beauty HD Matte Lipstick (Hot Cherry), 3.5gm",,,,,Rs. 299,Rs.  269,10% Off,4.200000000000001,(20),https://www.snapdeal.com/product/swiss-beauty-hd-matte-lipstick/8358681534022527081
Miss Rose Matt Lipstick | Shade No 34(Marjorie),,,12 orders in last 1 day,,Rs. 399,Rs.  169,58% Off,3.9000000000000004,(501),https://www.snapdeal.com/product/miss-rose-lipstick-marjori-3gm/629952893192
Colors Queen Matte Me Liquid Lipstick Sexy Orange 6 mL,,,,,Rs. 199,Rs.  189,5% Off,4.200000000000001,(5),https://www.snapdeal.com/product/colors-queen-matte-me-liquid/637939253780
ADS Good Choice Pack Of 12 Lipstick With Kajal Multi 1.2 g,,,,,Rs. 480,Rs.  209,56% Off,2.7,(23),https://www.snapdeal.com/product/ads-good-choice-pack-of/658145582051
 Volo Perfect Creamy with Matte Lipstick Combo | Pack of 5,,,,,Rs. 995,Rs.  499,50% Off,3.5999999999999996,(9),https://www.snapdeal.com/product/volo-creme-matte-smooth-bold/679326856475
Miss Rose Creme Lipstick oval-45 times square - 3 gm,,,,,Rs. 399,Rs.  179,55% Off,3.2,(57),https://www.snapdeal.com/product/miss-rose-creme-lipstick-oval45/645423937767
Miss Rose Professional Matte Dark Pink Color Lipstick 3g,TRENDING,,,,Rs. 399,Rs.  179,55% Off,3.299999999999999,(603),https://www.snapdeal.com/product/miss-rose-lipstick-pink-professional/681245618670
Colors Queen Velvet Texture Non Transfer Lipstick Nude 4 g,,,,,Rs. 249,Rs.  239,4% Off,3.0,(2),https://www.snapdeal.com/product/colors-queen-velvet-texture-non/671758493938
Miss Rose Long Lasting Matte Lipstick Nude 3 g,,,,,Rs. 399,Rs.  189,53% Off,,,https://www.snapdeal.com/product/miss-rose-long-lasting-matte/682459027086
"Miss Rose Matte (Shade 33, Orchid Lipstick 3 gm)",,,,,Rs. 299,Rs.  179,40% Off,3.5999999999999996,(353),https://www.snapdeal.com/product/miss-rose-lipstick-nude-professional/686680264853
Colors Queen Matte Me Liquid Lipstick Dark Coral 6 mL,,,,,Rs. 199,Rs.  189,5% Off,3.8,(5),https://www.snapdeal.com/product/colors-queen-matte-me-liquid/679283680041
"MI FASHION Liquid Lipstick Shimmer Cherry ,Peach Bae 3 ml Pack of 2",,,,,Rs. 598,Rs.  469,22% Off,4.5,(2),https://www.snapdeal.com/product/mi-fashion-liquid-lipstick-shimmer/629249641563
Miss Rose kachabros miss rose Lipstick 47 20 SPF 25 20 kg,,,,,Rs. 299,Rs.  169,43% Off,3.1,(25),https://www.snapdeal.com/product/miss-rose-kachabros-miss-rose/653266795781
ADS 5in1 Matte Mini Girls Lipstick Multi 7.5 g,,,,,Rs. 599,Rs.  239,60% Off,,,https://www.snapdeal.com/product/ads-5in1-matte-mini-girls/626294175787
Iba Halal Maxx Matte Liquid Lipstick Joyful Pink L05 6 mL,,,,,Rs. 599,Rs.  480,20% Off,4.699999999999999,(12),https://www.snapdeal.com/product/iba-halal-maxx-matte-liquid/633974354439
Miss Rose Lipstick PINK,,,,,Rs. 299,Rs.  179,40% Off,3.5999999999999996,(14),https://www.snapdeal.com/product/miss-rose-lipstick-pink-34/658469325964
Miss Rose waterproof & long lasting Creme Lipstick multicolor 3 gm,,,,,Rs. 399,Rs.  239,40% Off,3.5,(89),https://www.snapdeal.com/product/miss-rose-waterproof-long-lasting/639108922048
Colors Queen Non Transfer Pure Matte Lipstick Russian Red 3.8 g,,,,,Rs. 299,Rs.  279,7% Off,5.0,(1),https://www.snapdeal.com/product/colors-queen-non-transfer-pure/686361732663
"Miss Rose 2 In 1 Matte Finish Lipstick with Lip Liner (Flash of Pink Shade - 03, 2.1 gm)",,,,,Rs. 599,Rs.  219,63% Off,3.299999999999999,(200),https://www.snapdeal.com/product/miss-rose-creme-lipstick-2in1/663690458058
Colors Queen Matte Me Liquid Lipstick Baby Pink 6 mL,,,,,Rs. 199,Rs.  189,5% Off,5.0,(1),https://www.snapdeal.com/product/colors-queen-matte-me-liquid/654064385053
"bq BLAQUE Matte Liquid Lipstick Lip Color 4ml, Waterproof - Dark Pinkish Red",,,,,Rs. 325,Rs.  189,42% Off,4.0,(20),https://www.snapdeal.com/product/bq-blaque-longlasting-matte-lipstick/672903173389
"Zayn & Myza Transfer-Proof Power Matte Lipstick Selfie Red, Red 3.2 g",,,,,Rs. 599,Rs.  449,25% Off,,,https://www.snapdeal.com/product/zayn-myza-transferproof-power-matte/635133789459
Miss Rose Lipstick Chocolate,,,,,Rs. 399,Rs.  179,55% Off,3.299999999999999,(13),https://www.snapdeal.com/product/miss-rose-lipstick-chocolate-34g/653591386257
Miss Rose Creme Matte Lipstick Shade Oval 35 - Passion,,,,,Rs. 399,Rs.  179,55% Off,3.299999999999999,(82),https://www.snapdeal.com/product/miss-rose-creme-lipstick-shade/634337826940
Colors Queen Liquid Lipstick 2in1 Pink Crush Pink 8 g,,,,,Rs. 249,Rs.  239,4% Off,3.7,(36),https://www.snapdeal.com/product/colors-queen-liquid-lipstick-2in1/629121440710
Miss Rose Lipstick Angelique-37 Brown,,,,,Rs. 299,Rs.  179,40% Off,3.9000000000000004,(102),https://www.snapdeal.com/product/miss-rose-lipstick-angelique37-brown/625059468439
orsense Creme Lipstick Multi Pack of 4 200 g,,,,,Rs. 519,Rs.  354,32% Off,,,https://www.snapdeal.com/product/orsense-creme-lipstick-multi-pack/632202335139
" MI FASHION Liquid Lipstick (Shade - Eagle Red,Spring Pink) | Pack of 2",,,,,Rs. 598,Rs.  469,22% Off,4.0,(5),https://www.snapdeal.com/product/mi-fashion-liquid-lipstick-eagle/647612885373
ADS Lipstick Waterproof  Multicolour Set of-24 3.5 gm,,,,,Rs. 899,Rs.  575,36% Off,3.299999999999999,(172),https://www.snapdeal.com/product/ads-lipstick-waterproof-multicolour-set/680798541852
Miss Rose pigment 2in1 lipstick lipliner Lipstick Chicful 41 Dark Nude 2.1 g,,,,,Rs. 499,Rs.  209,58% Off,4.0,(14),https://www.snapdeal.com/product/miss-rose-pigment-2in1-lipstick/662417986407
Colors Queen Matte Me Liquid Lipstick Nude Peach 6 mL,,,,,Rs. 199,Rs.  189,5% Off,,,https://www.snapdeal.com/product/colors-queen-matte-me-liquid/668525201660
Miss Rose kachabros miss rose Lipstick 35 20 SPF 25 26 gm,,,,,Rs. 399,Rs.  179,55% Off,3.8,(8),https://www.snapdeal.com/product/miss-rose-kachabros-miss-rose/678323155239
Colors Queen Long Lasting Matte Lipstick Ice Nude 100 g,,,,,Rs. 249,Rs.  239,4% Off,4.0,(11),https://www.snapdeal.com/product/colors-queen-long-lasting-matte/625074087859
Miss Rose kachabros miss rose Lipstick 33 20 SPF 25,,,,,Rs. 299,Rs.  179,40% Off,4.0,(9),https://www.snapdeal.com/product/miss-rose-kachabros-miss-rose/618567222060
"EOD Soft Matte Kiss Proof Vegan Liquid Lipstick Red,  Wine Pack of 2 6 mL",,,,,Rs. 650,Rs.  519,20% Off,,,https://www.snapdeal.com/product/eod-soft-matte-kiss-proof/644994094376
Miss Rose Creme Lipstick brown 3.4 gm,,,,,Rs. 399,Rs.  179,55% Off,3.5999999999999996,(19),https://www.snapdeal.com/product/miss-rose-creme-lipstick-brown/620004414944
Miss Rose Lip Gloss Liquid Metro Metallic Lipstick Shade30 - 3 gm,,,,,Rs. 399,Rs.  199,50% Off,3.299999999999999,(163),https://www.snapdeal.com/product/miss-rose-lip-gloss-liquid/655115117880
ADS Lipstick Multicolour,,,,,Rs. 999,Rs.  575,42% Off,3.299999999999999,(252),https://www.snapdeal.com/product/ads-lipstick-multicolour-15-ml/665947552052
Miss Rose Lipstick & Lip Liner 2 in 1,,,,,Rs. 599,Rs.  219,63% Off,3.5999999999999996,(149),https://www.snapdeal.com/product/miss-rose-lipstick-lip-liner/677187583765
Miss Rose Long Lasting Matte Lipstick Nude Pack of 2 10.5 g,,,,,Rs. 450,Rs.  399,11% Off,,,https://www.snapdeal.com/product/miss-rose-long-lasting-matte/648726066695
Miss Rose Creme Lipstick Multicolor Pack of 2 6 g,,,,,Rs. 598,Rs.  269,55% Off,3.299999999999999,(4),https://www.snapdeal.com/product/miss-rose-creme-lipstick-multicolor/620710897671
Colors Queen Matte Me Liquid Lipstick Russian Red 6 mL,,,,,Rs. 199,Rs.  189,5% Off,5.0,(1),https://www.snapdeal.com/product/colors-queen-matte-me-liquid/626593006838
Miss Rose Lipstick Pink Rose 4 g,,,,,Rs. 399,Rs.  179,55% Off,3.4000000000000004,(23),https://www.snapdeal.com/product/miss-rose-lipstick-pink-rose/629218417922
orsense Creme Lipstick Magenta 3 g,,,,,Rs. 225,Rs.  216,4% Off,,,https://www.snapdeal.com/product/orsense-creme-lipstick-magenta-3/643106085434
"MI FASHION Liquid Lipstick Magenta,Light Chocolate  3 ml Pack of 2",,,,,Rs. 598,Rs.  469,22% Off,4.0,(1),https://www.snapdeal.com/product/mi-fashion-liquid-lipstick-magentalight/647585898677
Miss Rose Lipstick Professional Matte,,,,,Rs. 299,Rs.  179,40% Off,3.5999999999999996,(302),https://www.snapdeal.com/product/miss-rose-lipstick-professional-matte/619069759644
Iba Halal Pure Lips Long-Stay Matte Lipstick M08 Burgundy Red,,,,,Rs. 350,Rs.  298,15% Off,3.9000000000000004,(82),https://www.snapdeal.com/product/iba-halal-pure-lips-longstay/659770208969
Miss Rose kachabros miss rose Lipstick 42 20 SPF 25,,,,,Rs. 299,Rs.  169,43% Off,3.8,(13),https://www.snapdeal.com/product/miss-rose-kachabros-miss-rose/631060540888
"MI FASHION 100% Veg Soft Matte Long Stay Lipstick Combo Orange,Mauve Multi Pack of 2 7 g",,,,,Rs. 398,Rs.  379,5% Off,,,https://www.snapdeal.com/product/mi-fashion-100-veg-soft/656759741039
ADS Lipstick set of 24 multicolor 3.5 gm,,,,,Rs. 799,Rs.  419,48% Off,3.7,(129),https://www.snapdeal.com/product/ads-lipstick-multi-35-gm/661514597053
Miss Rose Creme Lipstick plum 3 gm,,,,,Rs. 599,Rs.  239,60% Off,3.1,(141),https://www.snapdeal.com/product/miss-rose-creme-lipstick-plum/620821117406
Mars Mini Lipstick Pack10 Free Kajal Multicolour 3X10 gm Pack of 10,,,,,Rs. 759,Rs.  249,67% Off,3.2,(155),https://www.snapdeal.com/product/mars-mini-lipstick-pack10-free/647606568183
Miss Rose Lipstick Matte Red Color,,,,,Rs. 399,Rs.  179,55% Off,3.4000000000000004,(16),https://www.snapdeal.com/product/miss-rose-lipstick-matte-red/633184086202
Mars GCI Free Kajal With Lipstick Berry Red 3.5 g,,,,,Rs. 299,Rs.  209,30% Off,,,https://www.snapdeal.com/product/mars-gci-free-kajal-with/657852898258
"bq BLAQUE Matte Liquid Lipstick Combo of 3 Lip Color 4ml each, Waterproof - Red, Ruby Red, Dark Pinkish Red",,,,,Rs. 975,Rs.  289,70% Off,3.4000000000000004,(26),https://www.snapdeal.com/product/bq-blaque-matte-lipstick-combo/639570385816
Miss Rose Professional Makeup Matte Lipstick Magenta 3.4 g,,,,,Rs. 399,Rs.  179,55% Off,4.3,(3),https://www.snapdeal.com/product/miss-rose-professional-makeup-matte/654626851414
Iba Halal Pure Lips Moisture Rich Combo Creme Lipstick Brown Pack of 3,,7 left!,,,Rs. 630,Rs.  489,22% Off,4.0,(199),https://www.snapdeal.com/product/iba-halal-pure-lips-moisture/664776817110
Colors Queen Non Transfer Pure Matte Lipstick Honey Peach 3.2 g,,,,,Rs. 299,Rs.  279,7% Off,,,https://www.snapdeal.com/product/colors-queen-non-transfer-pure/677448551406
"EOD Soft Matte Kiss Proof Vegan Liquid Lipstick Wine,  Maroon Pack of 2 6 mL",,,,,Rs. 650,Rs.  519,20% Off,4.200000000000001,(29),https://www.snapdeal.com/product/eod-soft-matte-kiss-proof/652750020295
Miss Rose Lip Gloss Liquid Metro Metallic Lipstick Shade 36 - 3 gm,,,,,Rs. 399,Rs.  199,50% Off,4.0,(11),https://www.snapdeal.com/product/miss-rose-lip-gloss-liquid/669983427813
ADS PRO True Matte Nude Shade Lipstick Pack 6 With Kajal-A Multicolour,,,,,"Rs. 2,640",Rs.  949,64% Off,3.4000000000000004,(30),https://www.snapdeal.com/product/ads-pro-true-matte-nude/645373036970
Miss Rose Mimosa Lipstick Pink 20 g,,,,,Rs. 399,Rs.  179,55% Off,3.0,(2),https://www.snapdeal.com/product/miss-rose-mimosa-lipstick-pink/667691696841
Mars Mars  Mini Waterproof Matte Creme Lipstick & Fabia Nail Polish Multi Pack of 10 6 g,,,,,Rs. 699,Rs.  339,52% Off,,,https://www.snapdeal.com/product/mars-mars-mini-waterproof-matte/635975430487
Colors Queen Matte Me Liquid Lipstick Bridal Red 6 mL,,,,,Rs. 199,Rs.  189,5% Off,4.0,(2),https://www.snapdeal.com/product/colors-queen-matte-me-liquid/673282019622
Iba Halal Pure Lips Long-Stay Matte Lipstick M07 Red Velvet,,,,,Rs. 350,Rs.  300,14% Off,3.7,(64),https://www.snapdeal.com/product/iba-halal-pure-lips-longstay/677610990348
Colors Queen Velvet Texture Non Transfer Lipstick (Falsa) Purple 4 g,,,,,Rs. 249,Rs.  239,4% Off,3.0,(2),https://www.snapdeal.com/product/colors-queen-velvet-texture-non/661063291225
Miss Rose Creme Lipstick | Brown Shade ,,,,,Rs. 399,Rs.  179,55% Off,3.9000000000000004,(99),https://www.snapdeal.com/product/miss-rose-lipstick-brown-34/677776453504
"MI FASHION 100% Veg Soft Matte Long Stay Lipstick Combo Red,Brown Multi Pack of 2 7 g",,,,,Rs. 398,Rs.  379,5% Off,,,https://www.snapdeal.com/product/mi-fashion-100-veg-soft/668383099868
Colors Queen 2 In 1 Long Lasting Matte Lipstick (Hot Red & Mahroon) Multi Pack of 2 16 g,,,,,Rs. 450,Rs.  339,25% Off,4.5,(4),https://www.snapdeal.com/product/colors-queen-2-in-1/625902537783
Laperla Silver Sparkle Nail Paint &Red Lipstick Multicolor 55 gm Pack of 2,,,,,Rs. 275,Rs.  179,35% Off,3.1,(7),https://www.snapdeal.com/product/laperla-silver-sparkle-nail-paint/685834254803
orsense Lipstick Multi Pack of 3 10 g,,,,,Rs. 675,Rs.  229,66% Off,,,https://www.snapdeal.com/product/orsense-lipstick-multi-pack-of/649275889304
Miss Rose Professional Makeup Matte Lipstick Brown 3.4 g,,,,,Rs. 399,Rs.  179,55% Off,3.8,(5),https://www.snapdeal.com/product/miss-rose-professional-makeup-matte/650684669879
Colors Queen Matte Long Stay Lipstick Magenta 5 g,,,,,Rs. 249,Rs.  229,8% Off,4.0,(3),https://www.snapdeal.com/product/colors-queen-matte-long-stay/672955612832
Miss Rose Lipstick Red 3 g,,,,,Rs. 399,Rs.  209,48% Off,3.299999999999999,(3),https://www.snapdeal.com/product/miss-rose-lipstick-red-3/644772538402
Colors Queen Lip Matte Lipstick Collage Girl Pink Pack of 2 12 g,,,,,Rs. 295,Rs.  279,5% Off,5.0,(1),https://www.snapdeal.com/product/colors-queen-lip-matte-lipstick/645329598175
"MI FASHION Matte Lip Waterproof Long Stay Liquid Lipstick Reddish Brown,Nude Peach Pack of 3 9 mL",,,,,Rs. 897,Rs.  599,33% Off,,,https://www.snapdeal.com/product/mi-fashion-matte-lip-waterproof/665120220697
Colors Queen Lipstick Apple Red SPF 15 4 g,,,,,Rs. 249,Rs.  239,4% Off,4.200000000000001,(62),https://www.snapdeal.com/product/colors-queen-lipstick-rich-red/660676216503
