name,badge_1,badge_2,mrp,discounted_price,discount,rating,rating_count,link
Babyhug 100% Cotton Sleeveless Onesie Floral Print - Yellow,,,,349,,,,https://www.firstcry.com//www.firstcry.com/babyhug/babyhug-100-cotton-sleeveless-onesie-floral-print-yellow/9055452/product-detail
Babyhug 100% Cotton Sleeveless Onesie Floral Print - Blue,,,,349,,,,https://www.firstcry.com//www.firstcry.com/babyhug/babyhug-100-cotton-sleeveless-onesie-floral-print-blue/9055447/product-detail
Baby Naturelle Sleeveless Jumpsuit Allover Flower Print - White,,1 Left ,315,258.3,(upto 19% Off),,,https://www.firstcry.com//www.firstcry.com/baby-naturelle-and-me/baby-naturelle-sleeveless-jumpsuit-allover-flower-print-white/8947645/product-detail
Babyhug 100% Cotton Short Sleeves Romper Polka Dot Print - Pink,,,,449,,,,https://www.firstcry.com//www.firstcry.com/babyhug/babyhug-100-cotton-short-sleeves-romper-polka-dot-print-pink/9054957/product-detail
Babyhug Sleeveless Jumpsuit Polka Dot Print - Peach,,,,599,,,,https://www.firstcry.com//www.firstcry.com/babyhug/babyhug-sleeveless-jumpsuit-polka-dot-print-peach/8601426/product-detail
Mini Taurus Party Wear Half Sleeves Romper with Bow - Blue,,,,549,,,,https://www.firstcry.com//www.firstcry.com/mini-taurus/mini-taurus-party-wear-half-sleeves-romper-with-bow-blue/9234081/product-detail
Mini Taurus Party Wear Half Sleeves Romper with Bow - Yellow,,,,549,,,,https://www.firstcry.com//www.firstcry.com/mini-taurus/mini-taurus-party-wear-half-sleeves-romper-with-bow-yellow/9234080/product-detail
LilSoft Full Sleeves Paper Planes Print Romper - Peach,,,999,799.2,(20% Off),,,https://www.firstcry.com//www.firstcry.com/lilsoft/lilsoft-full-sleeves-paper-planes-print-romper-peach/9402798/product-detail
Babyhug Sleeveless Jumpsuit Floral Print - Blue,,,,699,(upto 19% Off),,,https://www.firstcry.com//www.firstcry.com/babyhug/babyhug-sleeveless-jumpsuit-floral-print-blue/9024618/product-detail
ToffyHouse Sleeveless Dungarees With Tee Stripes - Red,,1 Left ,,595,,,,https://www.firstcry.com//www.firstcry.com/toffyhouse/toffyhouse-sleeveless-dungarees-with-tee-stripes-red/9101361/product-detail
LilSoft Full Sleeves Unicorn Print Romper - Peach,,,999,799.2,(20% Off),,,https://www.firstcry.com//www.firstcry.com/lilsoft/lilsoft-full-sleeves-unicorn-print-romper-peach/9402797/product-detail
LilSoft Full Sleeves Clouds Print Romper - Pink,,,999,799.2,(20% Off),,,https://www.firstcry.com//www.firstcry.com/lilsoft/lilsoft-full-sleeves-clouds-print-romper-pink/9402796/product-detail
LilSoft Full Sleeves Floral Print Romper - Pink,,,999,799.2,(20% Off),,,https://www.firstcry.com//www.firstcry.com/lilsoft/lilsoft-full-sleeves-floral-print-romper-pink/9402795/product-detail
LilSoft Full Sleeves Paper Planes Print Romper - Grey,,,949,759.2,(20% Off),,,https://www.firstcry.com//www.firstcry.com/lilsoft/lilsoft-full-sleeves-paper-planes-print-romper-grey/9402794/product-detail
LilSoft Full Sleeves Ocean Print Romper - Green,,,949,759.2,(20% Off),,,https://www.firstcry.com//www.firstcry.com/lilsoft/lilsoft-full-sleeves-ocean-print-romper-green/9402793/product-detail
LilSoft Full Sleeves Animals Print Romper - Grey,,,949,759.2,(20% Off),,,https://www.firstcry.com//www.firstcry.com/lilsoft/lilsoft-full-sleeves-animals-print-romper-grey/9402792/product-detail
Enfance Core Cap Sleeves Tee With Bird Embroidery Detailing...,,,1045,909.15,(13% Off),,,https://www.firstcry.com//www.firstcry.com/enfance-core/enfance-core-cap-sleeves-tee-with-bird-embroidery-detailing-dungaree-yellow-and-blue/9287834/product-detail
Enfance Core Cap Sleeves Tee With Bird Embroidery Detailing...,,,1045,909.15,(13% Off),,,https://www.firstcry.com//www.firstcry.com/enfance-core/enfance-core-cap-sleeves-tee-with-bird-embroidery-detailing-dungaree-red-and-blue/9287828/product-detail
Kookie Kids Short Sleeves Onesie with Dungaree Style Skirt &...,,2 Left ,1032,856.56,(17% Off),,,https://www.firstcry.com//www.firstcry.com/kookie-kids/kookie-kids-short-sleeves-onesie-with-dungaree-style-skirt-and-headband-floral-print-black/9002986/product-detail
Enfance Core Sleeveless Checks & Hearts Printed Jumpsuit - Red,,,745,648.15,(13% Off),,,https://www.firstcry.com//www.firstcry.com/enfance-core/enfance-core-sleeveless-checks-and-hearts-printed-jumpsuit-red/9287674/product-detail
MOMISY Half Sleeves Onesie & Tutu Skirt with Booties & Tiara -...,,,2450,1256.61,(49% Off),,,https://www.firstcry.com/momisy/momisy-half-sleeves-onesie-and-tutu-skirt-with-booties-and-tiara-multicolor/9458665/product-detail
Momisy Half Sleeves Onesie & Tutu Skirt 1st Birthday Design - Pink,,,2450,931.74,(62% Off),,,https://www.firstcry.com/momisy/momisy-half-sleeves-onesie-and-tutu-skirt-1st-birthday-design-pink/9458660/product-detail
Baby Naturelle Sleeveless Jumpsuit Allover Teddy Print - Green,,1 Left,315,264.6,(upto 19% Off),,,https://www.firstcry.com/baby-naturelle-and-me/baby-naturelle-sleeveless-jumpsuit-allover-teddy-print-green/8947648/product-detail
Kookie Kids Half Sleeves Stripes Print Romper - Blue,,1 Left,774,642.42,(17% Off),,,https://www.firstcry.com/kookie-kids/kookie-kids-half-sleeves-stripes-print-romper-blue/9023177/product-detail
Baby Naturelle & Me Singlet Jumpsuit Text Print - Red,,1 Left,310,260.4,(upto 17% Off),,,https://www.firstcry.com/baby-naturelle-and-me/baby-naturelle-and-me-singlet-jumpsuit-text-print-red/8947615/product-detail
Nino Bambino 100% Organic Cotton Sleeveless Fruit Print Jumpsuit -...,,,1199,1019.15,(upto 15% Off),,,https://www.firstcry.com/nino-bambino/nino-bambino-100-organic-cotton-sleeveless-fruit-print-jumpsuit-blue/9386784/product-detail
Enfance Core Sleeveless Rose Printed Jump Suit - White & Red,,1 Left,795,691.65,(13% Off),,,https://www.firstcry.com/enfance-core/enfance-core-sleeveless-rose-printed-jump-suit-white-and-red/9068124/product-detail
Babyhug Singlet Jumpsuit Polka Dot Print - Navy Blue,,2 Left,499,364.27,(27% Off),,,https://www.firstcry.com/babyhug/babyhug-singlet-jumpsuit-polka-dot-print-navy-blue/3309470/product-detail
Kookie Kids Half Sleeves Romper Crocodile Print - Green,,1 Left,774,626.94,(19% Off),,,https://www.firstcry.com/kookie-kids/kookie-kids-half-sleeves-romper-crocodile-print-green/8946939/product-detail
Babyhug Sleeveless Romper Flower Print - Pink,,1 Left,449,368.18,(upto 19% Off),,,https://www.firstcry.com/babyhug/babyhug-sleeveless-romper-flower-print-pink/8622259/product-detail
Kookie Kids Short Sleeves Onesies Multiprint Pack of 5 - Multicolour,,1 Left,1720,1393.2,(19% Off),,,https://www.firstcry.com/kookie-kids/kookie-kids-short-sleeves-onesies-multiprint-pack-of-5-multicolour/8685921/product-detail
Wow Dungaree With Half Sleeves T-Shirt Monkey Face - Yellow,,1 Left,810,656.1,(19% Off),,,https://www.firstcry.com/wow-clothes/wow-dungaree-with-half-sleeves-t-shirt-monkey-face-yellow/8976614/product-detail
Babyhug Sleeveless Rompers Strawberry Print Pack of 2 -...,,1 Left,749,659.12,(12% Off),,,https://www.firstcry.com/babyhug/babyhug-sleeveless-rompers-strawberry-print-pack-of-2-multicolour/8634021/product-detail
Babyhug Single Sleeves Pom Pom Lace One Shoulder Jumpsuit Butterfly...,,2 Left,499,409.18,(upto 21% Off),,,https://www.firstcry.com/babyhug/babyhug-single-sleeves-pom-pom-lace-one-shoulder-jumpsuit-butterfly-print-blue/8476207/product-detail
Jb Club Short Sleeves Striped Tee With Palm Tree Patch Dungaree - Red,,2 Left,620,508.4,(18% Off),,,https://www.firstcry.com/jb-club/jb-club-short-sleeves-striped-tee-with-palm-tree-patch-dungaree-red/9230463/product-detail
Little Folks Striped Dungaree Romper with Tee - Green,,1 Left,649,538.67,(17% Off),,,https://www.firstcry.com/little-folks/little-folks-striped-dungaree-romper-with-tee-green/8667476/product-detail
Jb Club Half Sleeves Tee With Bear Pattern Dungaree - Grey,,2 Left,620,539.4,(upto 18% Off),,,https://www.firstcry.com/jb-club/jb-club-half-sleeves-tee-with-bear-pattern-dungaree-grey/9230499/product-detail
Babyhug 100% Cotton Flutter Sleeves Romper Rose Print - Pink,,1 Left,449,354.71,(upto 21% Off),,,https://www.firstcry.com/babyhug/babyhug-100-cotton-flutter-sleeves-romper-rose-print-pink/3439584/product-detail
Kookie Kids Half Sleeves Romper Dino Print - Yellow,,1 Left,774,626.94,(19% Off),,,https://www.firstcry.com/kookie-kids/kookie-kids-half-sleeves-romper-dino-print-yellow/8946932/product-detail
Babyhug 100% Cotton Half Sleeves Onsie - White Black,,1 Left,299,245.18,(upto 19% Off),,,https://www.firstcry.com/babyhug/babyhug-100-cotton-half-sleeves-onsie-white-black/3279513/product-detail
I Bears Full Sleeves Footed Rompers Pack of 3 - White Red Blue,,1 Left,990,801.9,(19% Off),,,https://www.firstcry.com/i-bears/i-bears-full-sleeves-footed-rompers-pack-of-3-white-red-blue/3247713/product-detail
Wonderchild Half Sleeves Striped Tee With Teddy Dungaree - Blue,,2 Left,575,500.25,(13% Off),,,https://www.firstcry.com/wonderchild/wonderchild-half-sleeves-striped-tee-with-teddy-dungaree-blue/9182251/product-detail
Jb Club Short Sleeves Striped Tee with Dungaree - Red,,1 Left,720,590.4,(18% Off),,,https://www.firstcry.com/jb-club/jb-club-short-sleeves-striped-tee-with-dungaree-red/9230470/product-detail
Babyhug Dungaree with Half Sleeves Striped Tee - Blue,,1 Left,699,573.18,(18% Off),,,https://www.firstcry.com/babyhug/babyhug-dungaree-with-half-sleeves-striped-tee-blue/8890850/product-detail
Babyhug 100% Cotton Flutter Sleeves Romper Strawberry Print - Pink,,1 Left,399,331.17,(upto 18% Off),,,https://www.firstcry.com/babyhug/babyhug-100-cotton-flutter-sleeves-romper-strawberry-print-pink/3322501/product-detail
Fox Baby Onesie Pooh Bear Print - Grey,,1 Left,699,566.19,(19% Off),,,https://www.firstcry.com/fox-baby/fox-baby-onesie-pooh-bear-print-grey/9078781/product-detail
Kidi Wav Full Sleeves Print Detailing Romper - Navy Blue,,1 Left,250,232.5,(upto 8% Off),,,https://www.firstcry.com/kidi-wav/kidi-wav-full-sleeves-print-detailing-romper-navy-blue/9151143/product-detail
Jb Club Half Sleeves Tee With Attached Bow Tie & Abstract Print...,,2 Left,470,437.1,(7% Off),,,https://www.firstcry.com/jb-club/jb-club-half-sleeves-tee-with-attached-bow-tie-and-abstract-print-dungaree-blue/9088907/product-detail
Jb Club Half Sleeves Tee With Attached Bow Tie & Abstract Print...,,2 Left,470,437.1,(7% Off),,,https://www.firstcry.com/jb-club/jb-club-half-sleeves-tee-with-attached-bow-tie-and-abstract-print-dungaree-purple/9088910/product-detail
Babyhug Animal Printed Dungaree with Half Sleeves Tee - Blue,,1 Left,799,639.2,(20% Off),,,https://www.firstcry.com/babyhug/babyhug-animal-printed-dungaree-with-half-sleeves-tee-blue/8828657/product-detail
ToffyHouse Dungaree Romper with Half Sleeves Striped Tee - White Black,,1 Left,895,742.85,(17% Off),,,https://www.firstcry.com/toffyhouse/toffyhouse-dungaree-romper-with-half-sleeves-striped-tee-white-black/8788679/product-detail
Babyhug Denim Dungaree With Half Sleeves Tee Allover Print - Blue,,3 Left,,1049,,,,https://www.firstcry.com/babyhug/babyhug-denim-dungaree-with-half-sleeves-tee-allover-print-blue/2936790/product-detail
Kookie Kids Full Sleeves Polka Dot Footed Romper Car Embroidery - White,,1 Left,839,679.59,(upto 19% Off),,,https://www.firstcry.com/kookie-kids/kookie-kids-full-sleeves-polka-dot-footed-romper-car-embroidery-white/8588965/product-detail
Bumzee Full Sleeves Jingle Bells Printed Romper - Red,,1 Left,1099,516.53,(53% Off),,,https://www.firstcry.com/bumzee/bumzee-full-sleeves-jingle-bells-printed-romper-red/3815745/product-detail
Jo&Bo Half Sleeves Shirt Style Romper - Grey,,1 Left,549,450.18,(18% Off),,,https://www.firstcry.com/joandbo/joandbo-half-sleeves-shirt-style-romper-grey/9074185/product-detail
Babyhug Dungaree with Half Sleeves Inner Tee Music Print - Navy Blue,,1 Left,999,839.16,(upto 17% Off),,,https://www.firstcry.com/babyhug/babyhug-dungaree-with-half-sleeves-inner-tee-music-print-navy-blue/8849755/product-detail
Dapper Dudes Half Sleeves Printed Tee With Animal Patch Dungaree  -...,,1 Left,599,521.13,(13% Off),,,https://www.firstcry.com/dapper-dudes/dapper-dudes-half-sleeves-printed-tee-with-animal-patch-dungaree-pink/9021672/product-detail
Babyhug Singlet Jumpsuit - Yellow,,1 Left,799,655.18,(18% Off),,,https://www.firstcry.com/babyhug/babyhug-singlet-jumpsuit-yellow/8472730/product-detail
Kookie Kids Raglan Sleeves Romper - Navy Blue,,1 Left,774,626.94,(19% Off),,,https://www.firstcry.com/kookie-kids/kookie-kids-raglan-sleeves-romper-navy-blue/8597707/product-detail
Dapper Dudes Half Sleeves Abstract Print Tee With Dungaree - Red,,1 Left,699,608.13,(13% Off),,,https://www.firstcry.com/dapper-dudes/dapper-dudes-half-sleeves-abstract-print-tee-with-dungaree-red/9021814/product-detail
Dapper Dudes Half Sleeves Abstract Print Tee With Dungaree - Green,,1 Left,699,608.13,(13% Off),,,https://www.firstcry.com/dapper-dudes/dapper-dudes-half-sleeves-abstract-print-tee-with-dungaree-green/9021787/product-detail
Dapper Dudes Half Sleeves Printed Tee With Animal Patch Dungaree  -...,,2 Left,599,521.13,(13% Off),,,https://www.firstcry.com/dapper-dudes/dapper-dudes-half-sleeves-printed-tee-with-animal-patch-dungaree-blue/9021676/product-detail
Dapper Dudes Half Sleeve Tee With Teddy Patch Dungaree - Yellow,,1 Left,599,521.13,(13% Off),,,https://www.firstcry.com/dapper-dudes/dapper-dudes-half-sleeve-tee-with-teddy-patch-dungaree-yellow/9021714/product-detail
Dapper Dudes Half Sleeves Printed Tee With Animal Patch Dungaree  -...,,1 Left,599,521.13,(13% Off),,,https://www.firstcry.com/dapper-dudes/dapper-dudes-half-sleeves-printed-tee-with-animal-patch-dungaree-green/9021682/product-detail
Dapper Dudes Half Sleeve Tee With Animal Patch Dungaree - Light Green,,1 Left,599,521.13,(13% Off),,,https://www.firstcry.com/dapper-dudes/dapper-dudes-half-sleeve-tee-with-animal-patch-dungaree-light-green/9021669/product-detail
Dapper Dudes  Short Sleeves Teddy Patch Tee With Dungaree - Blue,,1 Left,649,564.63,(13% Off),,,https://www.firstcry.com/dapper-dudes/dapper-dudes-short-sleeves-teddy-patch-tee-with-dungaree-blue/9021581/product-detail
Child World Dungaree Style Romper with Half Sleeves Inner Tee Puppy...,,1 Left,799,647.19,(upto 19% Off),,,https://www.firstcry.com/child-world/child-world-dungaree-style-romper-with-half-sleeves-inner-tee-puppy-patch-orange-white/3443377/product-detail
Child World Dungaree Style Romper with Half Sleeves Inner Tee Puppy...,,1 Left,799,647.19,(upto 19% Off),,,https://www.firstcry.com/child-world/child-world-dungaree-style-romper-with-half-sleeves-inner-tee-puppy-patch-navy-white/3443381/product-detail
Dapper Dudes Half Sleeves Abstract Print Tee With Dungaree - Navy Blue,,1 Left,699,608.13,(13% Off),,,https://www.firstcry.com/dapper-dudes/dapper-dudes-half-sleeves-abstract-print-tee-with-dungaree-navy-blue/9021780/product-detail
Kiddopanti Sleeveless Logo Design Dungaree - Dark Blue,,1 Left,999,669.33,(33% Off),,,https://www.firstcry.com/kiddopanti/kiddopanti-sleeveless-logo-design-dungaree-dark-blue/9133056/product-detail
Brats and Dolls Dungaree Style Romper with Half Sleeves Inner...,,1 Left,599,485.19,(upto 19% Off),,,https://www.firstcry.com/brats-and-dolls/brats-and-dolls-dungaree-style-romper-with-half-sleeves-inner-tee-pink/8949811/product-detail
Babyhug Sleeveless Jumpsuit Butterfly Print - Pink,,1 Left,699,545.22,(upto 24% Off),,,https://www.firstcry.com/babyhug/babyhug-sleeveless-jumpsuit-butterfly-print-pink/3545711/product-detail
Jo&Bo Half Sleeves Solid Color Romper - Green,,1 Left,549,450.18,(18% Off),,,https://www.firstcry.com/joandbo/joandbo-half-sleeves-solid-color-romper-green/8966674/product-detail
Babyhug 100% Cotton Full Length Romper - Navy Blue,,1 Left,549,444.69,(19% Off),,,https://www.firstcry.com/babyhug/babyhug-100-cotton-full-length-romper-navy-blue/8058682/product-detail
Carter's Hummingbird Snap up Romper - Yellow,,2 Left,799,575.28,(28% Off),,,https://www.firstcry.com/carters/carters-hummingbird-snap-up-romper-yellow/8014558/product-detail
Babyhug 100% Cotton Full Sleeves Onesies Pack of 3 - Blue White,,1 Left,749,644.14,(14% Off),,,https://www.firstcry.com/babyhug/babyhug-100-cotton-full-sleeves-onesies-pack-of-3-blue-white/2843764/product-detail
Babyhug Sleeveless Full Length Jumpsuit Floral Print - Green,,3 Left,699,482.31,(31% Off),,,https://www.firstcry.com/babyhug/babyhug-sleeveless-full-length-jumpsuit-floral-print-green/8444257/product-detail
Babyhug Full Length Dungaree With Inner T-Shirt Floral Print -...,,1 Left,799,607.24,(upto 25% Off),,,https://www.firstcry.com/babyhug/babyhug-full-length-dungaree-with-inner-t-shirt-floral-print-white-navy/8236798/product-detail
Little Folks Half Sleeves Party Suit Romper - Red,,1 Left,599,497.17,(upto 17% Off),,,https://www.firstcry.com/little-folks/little-folks-half-sleeves-party-suit-romper-red/8667723/product-detail
Wow Clothes Half Sleeves Printed Romper with Tie - Blue,,1 Left,660,547.8,(17% Off),,,https://www.firstcry.com/wow-clothes/wow-clothes-half-sleeves-printed-romper-with-tie-blue/8976679/product-detail
Cucumber Half Sleeves Romper Printed - Red,,2 Left,440,369.6,(upto 21% Off),,,https://www.firstcry.com/cucumber/cucumber-half-sleeves-romper-printed-red/8999046/product-detail
Wonderchild Elephant Patch Dungaree Style Romper With Short Sleeves...,,1 Left,545,501.4,(8% Off),,,https://www.firstcry.com/wonderchild/wonderchild-elephant-patch-dungaree-style-romper-with-short-sleeves-tee-blue/9004735/product-detail
Keebee Organic Cotton Sleeveless Breathable Romper - Yellow,,2 Left,625,575,(8% Off),,,https://www.firstcry.com/keebee-organics/keebee-organic-cotton-sleeveless-breathable-romper-yellow/9183205/product-detail
Keebee Organic Cotton Sleeveless Solid Breathable Romper - Peach,,2 Left,625,575,(8% Off),,,https://www.firstcry.com/keebee-organics/keebee-organic-cotton-sleeveless-solid-breathable-romper-peach/9183200/product-detail
Keebee Organic Cotton Sleeveless Solid Breathable Romper - Blue,,2 Left,625,575,(8% Off),,,https://www.firstcry.com/keebee-organics/keebee-organic-cotton-sleeveless-solid-breathable-romper-blue/9183198/product-detail
Carter's 2-Piece Car Tee & Shortall Set - Navy Blue,,1 Left,1499,1079.28,(28% Off),,,https://www.firstcry.com/carters/carters-2-piece-car-tee-and-shortall-set-navy-blue/8013637/product-detail
Babyhug 100% Cotton Hooded  Onesie  Strawberry Print - Pink,,1 Left,349,296.65,(15% Off),,,https://www.firstcry.com/babyhug/babyhug-100-cotton-hooded--onesie--strawberry-print-pink/8130344/product-detail
Babyhug 100% Cotton Full Length Romper With Hairband Cherry Print...,,1 Left,549,422.73,(23% Off),,,https://www.firstcry.com/babyhug/babyhug-100-cotton-full-length-romper-with-hairband-cherry-print-pink/8193635/product-detail
Babyhug 100% Cotton Full Sleeves Frock Style Romper Little...,,1 Left,549,389.79,(29% Off),,,https://www.firstcry.com/babyhug/babyhug-100-cotton-full-sleeves-frock-style-romper-little-princess-print-with-headband-pink/8133239/product-detail
Babyhug Full Sleeves 100% Cotton Onesie Floral Print - Navy Blue,,1 Left,299,209.3,(upto 37% Off),,,https://www.firstcry.com/babyhug/babyhug-full-sleeves-100-cotton-onesie-floral-print-navy-blue/3686978/product-detail
Jb Club Half Sleeves T-Shirt With Bear Patch Dungaree - Red,,1 Left,580,475.6,(18% Off),,,https://www.firstcry.com/jb-club/jb-club-half-sleeves-t-shirt-with-bear-patch-dungaree-red/8813011/product-detail
Kookie Kids Sleeveless Romper Dino Print - White,,2 Left,731,592.11,(19% Off),,,https://www.firstcry.com/kookie-kids/kookie-kids-sleeveless-romper-dino-print-white/8480312/product-detail
Jo&Bo Half Sleeves Mock Suspender Style Romper - Yellow,,1 Left,549,450.18,(18% Off),,,https://www.firstcry.com/joandbo/joandbo-half-sleeves-mock-suspender-style-romper-yellow/8911618/product-detail
Jo&Bo Half Sleeves Checked Romper With Bow - Yellow,,1 Left,599,521.13,(upto 18% Off),,,https://www.firstcry.com/joandbo/joandbo-half-sleeves-checked-romper-with-bow-yellow/8911624/product-detail
Babyoye Short Sleeves Cotton Blend Jumpsuit with Embroidered Hem - Blue,,1 Left,999,839.16,(upto 17% Off),,,https://www.firstcry.com/babyoye/babyoye-short-sleeves-cotton-blend-jumpsuit-with-embroidered-hem-blue/8513978/product-detail
Li'L tomatoes Half Sleeves T-Shirt Striped Dungaree Set With A...,,1 Left,999,469.53,(53% Off),,,https://www.firstcry.com/lil-tomatoes/lil-tomatoes-half-sleeves-t-shirt-striped-dungaree-set-with-a-surprise-gift-royal-white/9074567/product-detail
Babyhug 100% Cotton Full Length Romper Dino  Print - Blue,,1 Left,549,417.24,(24% Off),,,https://www.firstcry.com/babyhug/babyhug-100-cotton-full-length-romper-dino--print-blue/8059668/product-detail
Babyoye Sleeveless Dungaree With Tee Floral Print - Pink,,1 Left,999,799.2,(upto 20% Off),,,https://www.firstcry.com/babyoye/babyoye-sleeveless-dungaree-with-tee-floral-print-pink/8275136/product-detail
Fox Baby Frill Sleeves Solid Color Jumpsuit - Navy,,1 Left,1299,1078.17,(upto 20% Off),,,https://www.firstcry.com/fox-baby/fox-baby-frill-sleeves-solid-color-jumpsuit-navy/8771452/product-detail
Babyoye Sleeveless Striped Jumpsuit with Bow - White Pink,,1 Left,899,728.19,(19% Off),,,https://www.firstcry.com/babyoye/babyoye-sleeveless-striped-jumpsuit-with-bow-white-pink/8633682/product-detail
