name,badge_1,badge_2,mrp,discounted_price,discount,rating,rating_count,link
Carter's  Fox Original Bodysuit - Maroon,,,,799,,,,https://www.firstcry.com//www.firstcry.com/carters/carters-fox-original-bodysuit-maroon/3396649/product-detail
ToffyHouse Sleeveless Dungarees With Tee Stripes - Red,,1 Left ,,595,,,,https://www.firstcry.com//www.firstcry.com/toffyhouse/toffyhouse-sleeveless-dungarees-with-tee-stripes-red/9101362/product-detail
Mini Taurus Party Wear Half Sleeves Checks Romper with Bow - White...,,,,539,,,,https://www.firstcry.com//www.firstcry.com/mini-taurus/mini-taurus-party-wear-half-sleeves-checks-romper-with-bow-white-cream/9293415/product-detail
Wow Clothes Half Sleeves Onesie Bow Print - Yellow,,,,620,,,,https://www.firstcry.com//www.firstcry.com/wow-clothes/wow-clothes-half-sleeves-onesie-bow-print-yellow/8978995/product-detail
Wow Clothes Half Sleeves Embroidered Onesie - Navy Blue,,,,620,,,,https://www.firstcry.com//www.firstcry.com/wow-clothes/wow-clothes-half-sleeves-embroidered-onesie-navy-blue/8978994/product-detail
Kiddopanti Flower Printed Sleeveless Dungaree - Navy Blue,,,,1049,,,,https://www.firstcry.com//www.firstcry.com/kiddopanti/kiddopanti-flower-printed-sleeveless-dungaree-navy-blue/9459333/product-detail
Kiddopanti Sleeveless Flower Lace Denim Dungaree - Blue,,,,1049,,,,https://www.firstcry.com//www.firstcry.com/kiddopanti/kiddopanti-sleeveless-flower-lace-denim-dungaree-blue/9459322/product-detail
Kiddopanti Sleeveless Heart Patch Denim Dungaree - Blue,,,,1049,,,,https://www.firstcry.com//www.firstcry.com/kiddopanti/kiddopanti-sleeveless-heart-patch-denim-dungaree-blue/9459315/product-detail
Kiddopanti Sleeveless Sun Embroidery Denim Dungaree - Blue,,,,1049,,,,https://www.firstcry.com//www.firstcry.com/kiddopanti/kiddopanti-sleeveless-sun-embroidery-denim-dungaree-blue/9459306/product-detail
Mark & Mia Sleeveless Star Printed Frock Style Onesie - Light Pink,,1 Left ,1515,893.85,(upto 44% Off),,,https://www.firstcry.com//www.firstcry.com/mark-and-mia/mark-and-mia-sleeveless-star-printed-frock-style-onesie-light-pink/8761696/product-detail
Mark & Mia Short Sleeves Embroidered Frock Style Onesie - Pink,,1 Left ,1385,844.85,(39% Off),,,https://www.firstcry.com//www.firstcry.com/mark-and-mia/mark-and-mia-short-sleeves-embroidered-frock-style-onesie-pink/8761735/product-detail
Babyhug 100% Cotton Half Sleeves Romper Hippo Patch - Dark Red,,2 Left ,449,368.18,(upto 19% Off),,,https://www.firstcry.com//www.firstcry.com/babyhug/babyhug-100-cotton-half-sleeves-romper-hippo-patch-dark-red/9025776/product-detail
Global Desi Girl Sleeveless Printed Jumpsuit - Yellow,,1 Left ,1499,779.48,(48% Off),,,https://www.firstcry.com//www.firstcry.com/global-desi-girl/global-desi-girl-sleeveless-printed-jumpsuit-yellow/8343185/product-detail
Natilene Sleeveless Striped Polyester Jumpsuit - Multicolor,,,1499,779.48,(48% Off),,,https://www.firstcry.com//www.firstcry.com/natilene/natilene-sleeveless-striped-polyester-jumpsuit-multicolor/9373752/product-detail
Babyhug Half Sleeves Jumpsuit Striped - Blue,,1 Left ,799,647.19,(19% Off),,,https://www.firstcry.com//www.firstcry.com/babyhug/babyhug-half-sleeves-jumpsuit-striped-blue/8793530/product-detail
Babyhug Sleeveless Cotton Onesie - Blue,,1 Left ,349,286.18,(upto 19% Off),,,https://www.firstcry.com//www.firstcry.com/babyhug/babyhug-sleeveless-cotton-onesie-blue/8502941/product-detail
Babyhug 100% Cotton Flutter Sleeves Romper Rose Print - Pink,,2 Left ,449,354.71,(upto 21% Off),,,https://www.firstcry.com//www.firstcry.com/babyhug/babyhug-100-cotton-flutter-sleeves-romper-rose-print-pink/3439586/product-detail
Babyhug Half Sleeves 100% Cotton Onesies Stars & Space Print Pack...,,1 Left ,749,591.71,(upto 21% Off),,,https://www.firstcry.com//www.firstcry.com/babyhug/babyhug-half-sleeves-100-cotton-onesies-stars-and-space-print-pack-of-3-orange-blue/3257670/product-detail
Wonderchild Half Sleeves Striped Tee With Teddy Dungaree - Blue,,1 Left ,575,500.25,(13% Off),,,https://www.firstcry.com//www.firstcry.com/wonderchild/wonderchild-half-sleeves-striped-tee-with-teddy-dungaree-blue/9182252/product-detail
Babyhug Sleeveless Jumpsuit Floral Print - Blue,,1 Left ,499,404.19,(upto 20% Off),,,https://www.firstcry.com//www.firstcry.com/babyhug/babyhug-sleeveless-jumpsuit-floral-print-blue/8935975/product-detail
Beebay Sleeveless Solid Cut-Out Detail Jumpsuit - Green,,3 Left,895,644.4,(upto 28% Off),,,https://www.firstcry.com/beebay/beebay-sleeveless-solid-cut-out-detail-jumpsuit-green/9330876/product-detail
Babyhug Flutter Sleeves Jumpsuit Floral Print - White Pink,,1 Left,599,479.2,(20% Off),,,https://www.firstcry.com/babyhug/babyhug-flutter-sleeves-jumpsuit-floral-print-white-pink/8604247/product-detail
Babyhug Party Wear 100% Cotton Full Sleeves Stripe Romper With Bow -...,,1 Left,549,450.18,(upto 20% Off),,,https://www.firstcry.com/babyhug/babyhug-party-wear-100-cotton-full-sleeves-stripe-romper-with-bow-navy-blue-grey/8058670/product-detail
Child World Dungaree Style Romper With Half Sleeves Tee Vehicle...,,1 Left,799,647.19,(upto 19% Off),,,https://www.firstcry.com/child-world/child-world-dungaree-style-romper-with-half-sleeves-tee-vehicle-print-white-blue/8757046/product-detail
Babyhug Short Sleeves Romper Elephant Embroidery - White Red,,1 Left,399,339.15,(upto 17% Off),,,https://www.firstcry.com/babyhug/babyhug-short-sleeves-romper-elephant-embroidery-white-red/3166765/product-detail
Kookie Kids Half Sleeves Romper Kitty Print - Pink,,1 Left,817,669.94,(upto 18% Off),,,https://www.firstcry.com/kookie-kids/kookie-kids-half-sleeves-romper-kitty-print-pink/8657622/product-detail
Babyhug Sleeveless Romper Floral Embroidery - Blue,,1 Left,699,580.17,(upto 18% Off),,,https://www.firstcry.com/babyhug/babyhug-sleeveless-romper-floral-embroidery-blue/3810540/product-detail
Babyoye Cotton Flutter Sleeves & Singlet Rompers Fruits Print Pack...,,1 Left,999,859.14,(14% Off),,,https://www.firstcry.com/babyoye/babyoye-cotton-flutter-sleeves-and-singlet-rompers-fruits-print-pack-of-2-coral-yellow/8410512/product-detail
Babyhug Full Sleeves 100% Cotton Printed Onesie - Navy Blue,,2 Left,349,286.18,(upto 20% Off),,,https://www.firstcry.com/babyhug/babyhug-full-sleeves-100-cotton-printed-onesie-navy-blue/3794080/product-detail
Babyhug 100% Cotton Full Sleeves Romper Giraffe Patch - Yellow,,1 Left,399,335.16,(16% Off),,,https://www.firstcry.com/babyhug/babyhug-100-cotton-full-sleeves-romper-giraffe-patch-yellow/8488794/product-detail
Jo&Bo Half Sleeves Striped Romper - Black,,1 Left,599,521.13,(upto 18% Off),,,https://www.firstcry.com/joandbo/joandbo-half-sleeves-striped-romper-black/8966669/product-detail
Jo&Bo Half Sleeves Striped Romper - Grey,,1 Left,599,521.13,(upto 18% Off),,,https://www.firstcry.com/joandbo/joandbo-half-sleeves-striped-romper-grey/8966666/product-detail
Jo&Bo Half Sleeves Solid Color Romper - Green,,1 Left,549,450.18,(18% Off),,,https://www.firstcry.com/joandbo/joandbo-half-sleeves-solid-color-romper-green/8966674/product-detail
Babyhug 100% Cotton Singlet Striped Romper Whale Patch - White Navy Blue,,1 Left,399,327.18,(upto 18% Off),,,https://www.firstcry.com/babyhug/babyhug-100-cotton-singlet-striped-romper-whale-patch-white-navy-blue/3326205/product-detail
Jo&Bo Half Sleeves Striped Romper - Black,,1 Left,599,491.18,(18% Off),,,https://www.firstcry.com/joandbo/joandbo-half-sleeves-striped-romper-black/8966663/product-detail
The Mom Store Short Sleeves Hello World Print Onesie - White,,,799,655.18,(18% Off),,,https://www.firstcry.com/the-mom-store/the-mom-store-short-sleeves-hello-world-print-onesie-white/9282849/product-detail
The Mom Store  Short Sleeves I Have Arrived Print Onesie - White,,,799,655.18,(18% Off),,,https://www.firstcry.com/the-mom-store/the-mom-store-short-sleeves-i-have-arrived-print-onesie-white/9282846/product-detail
Carter's Cotton Romper - Pink,,1 Left,899,647.28,(28% Off),,,https://www.firstcry.com/carters/carters-cotton-romper-pink/8012839/product-detail
Dapper Dudes Checkered & Teddy Patch Dungaree With Half Sleeves Tee -...,,1 Left,599,521.13,(13% Off),,,https://www.firstcry.com/dapper-dudes/dapper-dudes-checkered-and-teddy-patch-dungaree-with-half-sleeves-tee-yellow/8662901/product-detail
Cucumber Half Sleeves Romper Printed - Red,,3 Left,440,365.2,(upto 21% Off),,,https://www.firstcry.com/cucumber/cucumber-half-sleeves-romper-printed-red/8999045/product-detail
Carter's 2-Pack Romper & Dress Set - Yellow,,1 Left,1649,1154.3,(upto 30% Off),,,https://www.firstcry.com/carters/carters-2-pack-romper-and-dress-set-yellow/8014838/product-detail
Carter's 2-Piece Tiger Tee & Shortall Set - Green,,1 Left,1499,1079.28,(28% Off),,,https://www.firstcry.com/carters/carters-2-piece-tiger-tee-and-shortall-set-green/8013627/product-detail
Carter's 2-Piece Car Tee & Shortall Set - Navy Blue,,1 Left,1499,1079.28,(28% Off),,,https://www.firstcry.com/carters/carters-2-piece-car-tee-and-shortall-set-navy-blue/8013637/product-detail
Babyhug Sleeveless Jumpsuit Floral Print - Yellow White,,1 Left,499,399.2,(20% Off),,,https://www.firstcry.com/babyhug/babyhug-sleeveless-jumpsuit-floral-print-yellow-white/3293202/product-detail
Babyoye Short Sleeves Cotton Blend Jumpsuit with Embroidered Hem - Blue,,2 Left,999,839.16,(upto 17% Off),,,https://www.firstcry.com/babyoye/babyoye-short-sleeves-cotton-blend-jumpsuit-with-embroidered-hem-blue/8513978/product-detail
Beebay Sleeveless Skate Board Print Dungaree - Orange,,3 Left,1045,752.4,(28% Off),,,https://www.firstcry.com/beebay/beebay-sleeveless-skate-board-print-dungaree-orange/9041985/product-detail
Babyhug Full Length Jumpsuit Floral Print - Pink,,2 Left,699,538.23,(upto 25% Off),,,https://www.firstcry.com/babyhug/babyhug-full-length-jumpsuit-floral-print-pink/3801137/product-detail
Ed-a-Mamma Short Sleeves Floral Embroidered Knit Jumpsuit - Pink,,1 Left,699,643.08,(8% Off),,,https://www.firstcry.com/ed-a-mamma/ed-a-mamma-short-sleeves-floral-embroidered-knit-jumpsuit-pink/8904973/product-detail
COCOON ORGANICS Short Sleeves Bug Printed Onesie With Diaper Pyjama...,,,999,619.38,(38% Off),,,https://www.firstcry.com/cocoon-organics/cocoon-organics-short-sleeves-bug-printed-onesie-with-diaper-pyjama-pink-and-white/8859502/product-detail
COCOON ORGANICS Full Sleeves Solid Colour Mock Waistcoat & Bow Tie...,,,1499,779.48,(48% Off),,,https://www.firstcry.com/cocoon-organics/cocoon-organics-full-sleeves-solid-colour-mock-waistcoat-and-bow-tie-detailing-footed-romper-grey-and-black/8859484/product-detail
COCOON ORGANICS Full Sleeves Solid Colour Mock Waistcoat & Bow Tie...,,,1199,623.48,(48% Off),,,https://www.firstcry.com/cocoon-organics/cocoon-organics-full-sleeves-solid-colour-mock-waistcoat-and-bow-tie-detailing-onesie-black-and-white/8859476/product-detail
COCOON ORGANICS Half Sleeves Solid Colour Kimono Style Onesie -...,,,799,455.43,(43% Off),,,https://www.firstcry.com/cocoon-organics/cocoon-organics-half-sleeves-solid-colour-kimono-style-onesie-light-grey/8859571/product-detail
COCOON ORGANICS Half Sleeves Solid Colour Kimono Style Onesie - Sky...,,,799,455.43,(43% Off),,,https://www.firstcry.com/cocoon-organics/cocoon-organics-half-sleeves-solid-colour-kimono-style-onesie-sky-blue/8859553/product-detail
COCOON ORGANICS Half Sleeves Solid Colour Kimono Style Onesie - Violet,,,799,455.43,(43% Off),,,https://www.firstcry.com/cocoon-organics/cocoon-organics-half-sleeves-solid-colour-kimono-style-onesie-violet/8859546/product-detail
COCOON ORGANICS Short Sleeves Bug Printed Onesie - White,,,799,455.43,(43% Off),,,https://www.firstcry.com/cocoon-organics/cocoon-organics-short-sleeves-bug-printed-onesie-white/8859541/product-detail
COCOON ORGANICS Pack Of 3 Solid Colour Half Sleeves Onesie - Navy...,,,1999,1039.48,(48% Off),,,https://www.firstcry.com/cocoon-organics/cocoon-organics-pack-of-3-solid-colour-half-sleeves-onesie-navy-blue-pink-white/8859469/product-detail
COCOON ORGANICS Short Sleeves Bug Printed Onesie With Diaper Pyjama...,,,999,619.38,(38% Off),,,https://www.firstcry.com/cocoon-organics/cocoon-organics-short-sleeves-bug-printed-onesie-with-diaper-pyjama-white/8859457/product-detail
COCOON ORGANICS Full Sleeves Solid Colour Kimono Style Onesie -...,,,799,455.43,(43% Off),,,https://www.firstcry.com/cocoon-organics/cocoon-organics-full-sleeves-solid-colour-kimono-style-onesie-light-blue/8859447/product-detail
COCOON ORGANICS Full Sleeves Solid Colour Kimono Style Onesie - Violet,,,799,455.43,(43% Off),,,https://www.firstcry.com/cocoon-organics/cocoon-organics-full-sleeves-solid-colour-kimono-style-onesie-violet/8859440/product-detail
COCOON ORGANICS Full Sleeves Solid Colour Kimono Style Onesie - Red,,,799,455.43,(43% Off),,,https://www.firstcry.com/cocoon-organics/cocoon-organics-full-sleeves-solid-colour-kimono-style-onesie-red/8859434/product-detail
COCOON ORGANICS Full Sleeves Printed Kimono Style Onesie - Beige,,,799,455.43,(43% Off),,,https://www.firstcry.com/cocoon-organics/cocoon-organics-full-sleeves-printed-kimono-style-onesie-beige/8859427/product-detail
COCOON ORGANICS Pack Of 2 Full Sleeves Polka Dot Printed Onesie...,,,1499,779.48,(48% Off),,,https://www.firstcry.com/cocoon-organics/cocoon-organics-pack-of-2-full-sleeves-polka-dot-printed-onesie-yellow-and-green/8859420/product-detail
COCOON ORGANICS Full Sleeves Little Princess Printed Onesie - Light Blue,,,899,467.48,(48% Off),,,https://www.firstcry.com/cocoon-organics/cocoon-organics-full-sleeves-little-princess-printed-onesie-light-blue/8859418/product-detail
COCOON ORGANICS Full Sleeves Solid Colour Kimono Style Onesie - Navy...,,,799,455.43,(43% Off),,,https://www.firstcry.com/cocoon-organics/cocoon-organics-full-sleeves-solid-colour-kimono-style-onesie-navy-blue-and-white/8859408/product-detail
COCOON ORGANICS Full Sleeves Solid Colour Kimono Style Onesie - Navy...,,,799,455.43,(43% Off),,,https://www.firstcry.com/cocoon-organics/cocoon-organics-full-sleeves-solid-colour-kimono-style-onesie-navy-blue-and-yellow/8859402/product-detail
Kookie Kids Full Sleeves Hooded Footed Romper - Blue,,1 Left,860,662.2,(upto 28% Off),,,https://www.firstcry.com/kookie-kids/kookie-kids-full-sleeves-hooded-footed-romper-blue/8265342/product-detail
Babyhug Checked Sleeveless Jumpsuit Bow Applique - Red Blue,,1 Left,699,454.35,(35% Off),,,https://www.firstcry.com/babyhug/babyhug-checked-sleeveless-jumpsuit-bow-applique-red-blue/3467051/product-detail
Kooka Kids Full Sleeves Jet Patch Jumpsuit With Printed Tee - Navy...,,,1860,1320.6,(29% Off),,,https://www.firstcry.com/kooka-kids/kooka-kids-full-sleeves-jet-patch-jumpsuit-with-printed-tee-navy-blue/8618662/product-detail
ROYAL BRATS Full Sleeves Aeroplane Print Romper - Dark Blue,,3 Left,799,695.13,(13% Off),,,https://www.firstcry.com/royal-brats/royal-brats-full-sleeves-aeroplane-print-romper-dark-blue/8680167/product-detail
Mark & Mia Half Sleeves Checks Party Wear Romper - Yellow White,,1 Left,1235,716.3,(upto 47% Off),,,https://www.firstcry.com/mark-and-mia/mark-and-mia-half-sleeves-checks-party-wear-romper-yellow-white/8487505/product-detail
Game Begins Singlet Sleeves Jumpsuit Floral Print - Red Pink,,1 Left,399,299.25,(upto 27% Off),,,https://www.firstcry.com/game-begins/game-begins-singlet-sleeves-jumpsuit-floral-print-red-pink/3372126/product-detail
Game Begins Printed Singlet Sleeves Jumpsuit - Lemon Yellow,,1 Left,399,291.27,(upto 29% Off),,,https://www.firstcry.com/game-begins/game-begins-printed-singlet-sleeves-jumpsuit-lemon-yellow/3372136/product-detail
UPTOWNIE Solid Colour Half Sleeves Jumpsuit - Maroon,,1 Left,1599,831.48,(upto 50% Off),,,https://www.firstcry.com/uptownie/uptownie-solid-colour-half-sleeves-jumpsuit-maroon/8556087/product-detail
Jb Club Dog Print Full Sleeves Onesie With Cap & Bottom - Blue,,1 Left,599,491.18,(18% Off),,,https://www.firstcry.com/jb-club/jb-club-dog-print-full-sleeves-onesie-with-cap-and-bottom-blue/8334014/product-detail
Cucumber Sleeveless Romper Heart Print - White,,1 Left,330,264,(20% Off),,,https://www.firstcry.com/cucumber/cucumber-sleeveless-romper-heart-print-white/8392520/product-detail
Beebay Sleeveless Dinosaur Embroidery Detailing Dungaree -...,,2 Left,1295,738.15,(43% Off),,,https://www.firstcry.com/beebay/beebay-sleeveless-dinosaur-embroidery-detailing-dungaree-black/8493293/product-detail
Ed-a-Mamma Carrot Printed Half Sleeves Cotton Jumpsuit With...,,1 Left,999,769.23,(upto 23% Off),,,https://www.firstcry.com/ed-a-mamma/ed-a-mamma-carrot-printed-half-sleeves-cotton-jumpsuit-with-front-tie-up-detail-teal/3766334/product-detail
Olele Sleeveless Solid Colour Dungaree - Red,,1 Left,1998,1038.96,(48% Off),,,https://www.firstcry.com/olele/olele-sleeveless-solid-colour-dungaree-red/8407603/product-detail
Kookie Kids Full Sleeves Romper Bear Print - Yellow,,1 Left,774,518.58,(33% Off),,,https://www.firstcry.com/kookie-kids/kookie-kids-full-sleeves-romper-bear-print-yellow/3683699/product-detail
Mark & Mia Frock Style Onesie Sequin Floral Embroidered - Light Pink,,1 Left,1125,652.5,(upto 48% Off),,,https://www.firstcry.com/mark-and-mia/mark-and-mia-frock-style-onesie-sequin-floral-embroidered-light-pink/3694162/product-detail
Mark & Mia Sleeveless Party Wear Frock style Onesie Floral Lace...,,1 Left,1355,785.9,(upto 46% Off),,,https://www.firstcry.com/mark-and-mia/mark-and-mia-sleeveless-party-wear-frock-style-onesie-floral-lace-embellishment-pink/3377184/product-detail
Olele Camouflage Print Sleeveless Dungaree - Multi Color,,1 Left,2499,949.62,(upto 64% Off),,,https://www.firstcry.com/olele/olele-camouflage-print-sleeveless-dungaree-multi-color/3707224/product-detail
Game Begins Singlet Sleeves Jumpsuit Butterfly Print - Blue,,1 Left,399,243.39,(upto 44% Off),,,https://www.firstcry.com/game-begins/game-begins-singlet-sleeves-jumpsuit-butterfly-print-blue/3372123/product-detail
Nino Bambino Singlet Style Sleeveless Floral Printed...,,1 Left,1199,659.45,(upto 45% Off),,,https://www.firstcry.com/nino-bambino/nino-bambino-singlet-style-sleeveless-floral-printed-jumpsuit-pink/3594556/product-detail
ROYAL BRATS Striped Full Sleeves Onesie & Romper Set - Blue & White,,2 Left,1199,1019.15,(15% Off),,,https://www.firstcry.com/royal-brats/royal-brats-striped-full-sleeves-onesie-and-romper-set-blue-and-white/3573111/product-detail
Carter's Striped Floral Jersey Sunsuit - Blue,,1 Left,899,494.45,(45% Off),,,https://www.firstcry.com/carters/carters-striped-floral-jersey-sunsuit-blue/2924015/product-detail
Carter's Striped Henley Bodysuit - Blue,,1 Left,749,344.54,(upto 54% Off),,,https://www.firstcry.com/carters/carters-striped-henley-bodysuit-blue/2922650/product-detail
Naughty Ninos Floral Printed Dungaree With Sleeveless Top - Peach,,1 Left,1699,968.43,(43% Off),,,https://www.firstcry.com/naughty-ninos/naughty-ninos-floral-printed-dungaree-with-sleeveless-top-peach/3416615/product-detail
Baby Go Half Sleeves Romper Leaf Print - Blue,,1 Left,,499,,,,https://www.firstcry.com/baby-go/baby-go-half-sleeves-romper-leaf-print-blue/3358747/product-detail
Mini Taurus Full Sleeves Romper Animal Print - Blue,,1 Left,439,338.03,(23% Off),,,https://www.firstcry.com/mini-taurus/mini-taurus-full-sleeves-romper-animal-print-blue/2869738/product-detail
Babyoye Full Sleeves Striped & Multi Printed Cotton Onesies Pack of 3...,,1 Left,999,509.49,(49% Off),,,https://www.firstcry.com/babyoye/babyoye-full-sleeves-striped-and-multi-printed-cotton-onesies-pack-of-3-red-green/2988288/product-detail
Carter's 2-Piece Animal Bodysuit Pant Set - Green Blue,,1 Left,1199,611.49,(49% Off),,,https://www.firstcry.com/carters/carters-2-piece-animal-bodysuit-pant-set-green-blue/2530814/product-detail
Beebay Solid Sleeveless Dungaree - Red,,2 Left,1045,595.65,(43% Off),,,https://www.firstcry.com/beebay/beebay-solid-sleeveless-dungaree-red/2636432/product-detail
Lilpicks Couture Floral Print Three Fourth Sleeves Jumpsuit - Sky Blue,,2 Left,699,643.08,(8% Off),,,https://www.firstcry.com/lilpicks-couture/lilpicks-couture-floral-print-three-fourth-sleeves-jumpsuit-sky-blue/2718782/product-detail
Carter's 2-Piece Foil Cat Bodysuit & Tutu Pant Set - White Black,,1 Left,1089,326.7,(70% Off),,,https://www.firstcry.com/carters/carters-2-piece-foil-cat-bodysuit-and-tutu-pant-set-white-black/2194259/product-detail
Olele Solid Half Sleeves Tee With Dungaree - Black & Blue,,1 Left,1799,1439.2,(20% Off),,,https://www.firstcry.com/olele/olele-solid-half-sleeves-tee-with-dungaree-black-and-blue/2646727/product-detail
Kicks & Crawl Striped Sleeveless Jumpsuit - Blue,,,1299,1065.18,(18% Off),,,https://www.firstcry.com/kicks-and-crawl/kicks-and-crawl-striped-sleeveless-jumpsuit-blue/9402322/product-detail
Babyoye Half Sleeves Onesie Pack of 7 - Multicolor,,,2299,1862.19,(19% Off),,,https://www.firstcry.com/babyoye/babyoye-half-sleeves-onesie-pack-of-7-multicolor/8388298/product-detail
Kookie Kids Singlet Sleeves Jumpsuit Polka Dot Print - Blue,,,903,749.49,(17% Off),,,https://www.firstcry.com/kookie-kids/kookie-kids-singlet-sleeves-jumpsuit-polka-dot-print-blue/9023195/product-detail
Babyhug Dungaree With Half Sleeves Tee Printed - Yellow,,,799,647.19,(19% Off),,,https://www.firstcry.com/babyhug/babyhug-dungaree-with-half-sleeves-tee-printed-yellow/8581727/product-detail
