name,badge_1,badge_2,mrp,discounted_price,discount,rating,rating_count,link
Carter's Fox Original Bodysuit - Brown,,,,799,,,,https://www.firstcry.com//www.firstcry.com/carters/carters-fox-original-bodysuit-brown/3396569/product-detail
Carter's 2-Piece Daddy's Little Princess Bodysuit & Tutu Pant Set...,,,,1349,,,,https://www.firstcry.com//www.firstcry.com/carters/carters-2-piece-daddys-little-princess-bodysuit-and-tutu-pant-set-white-pink/3229887/product-detail
Wonderchild Full Sleeves Sunglasses Patch Detailed Romper - Blue,,1 Left ,595,416.5,(30% Off),,,https://www.firstcry.com//www.firstcry.com/wonderchild/wonderchild-full-sleeves-sunglasses-patch-detailed-romper-blue/3366578/product-detail
Babyhug Full Length Half Sleeves Jumpsuit - Red,,1 Left ,,699,(upto 23% Off),,,https://www.firstcry.com//www.firstcry.com/babyhug/babyhug-full-length-half-sleeves-jumpsuit-red/3684690/product-detail
Lilpicks Couture Half Sleeves Polka Dots Print Cold Shoulder Jumpsuit...,,,,849,,,,https://www.firstcry.com//www.firstcry.com/lilpicks-couture/lilpicks-couture-half-sleeves-polka-dots-print-cold-shoulder-jumpsuit-brown/9404531/product-detail
Lilpicks Couture Half Sleeves Polka Dots Print Cold Shoulder Jumpsuit...,,,,899,,,,https://www.firstcry.com//www.firstcry.com/lilpicks-couture/lilpicks-couture-half-sleeves-polka-dots-print-cold-shoulder-jumpsuit-yellow/9404530/product-detail
Nauti Nati Short Sleeves Design Print Jumpsuit - Blue,,,1149,597.48,(48% Off),,,https://www.firstcry.com//www.firstcry.com/nauti-nati/nauti-nati-short-sleeves-design-print-jumpsuit-blue/9374432/product-detail
Jb Club Short Sleeves Striped Tee with Dungaree - Red,,1 Left ,720,590.4,(18% Off),,,https://www.firstcry.com//www.firstcry.com/jb-club/jb-club-short-sleeves-striped-tee-with-dungaree-red/9230470/product-detail
Wonderchild Half Sleeves Striped Tee With Teddy Dungaree - Blue,,1 Left ,575,500.25,(13% Off),,,https://www.firstcry.com//www.firstcry.com/wonderchild/wonderchild-half-sleeves-striped-tee-with-teddy-dungaree-blue/9182254/product-detail
Kidi Wav Multi Print 3/4Th- Pack Of 3 - Navy (6 to 9 Month),,2 Left ,250,232.5,(7% Off),,,https://www.firstcry.com//www.firstcry.com/kidi-wav/kidi-wav-multi-print-3-4th-pack-of-3-navy-6-to-9-month/9151115/product-detail
Babyoye Dungaree with Half Sleeves Inner Tee Hot Air Balloon Print -...,,1 Left ,999,809.19,(upto 21% Off),,,https://www.firstcry.com//www.firstcry.com/babyoye/babyoye-dungaree-with-half-sleeves-inner-tee-hot-air-balloon-print-blue-yellow/8494615/product-detail
Babyhug Sleeveless Romper Floral Embroidery - Blue,,1 Left ,699,566.19,(upto 19% Off),,,https://www.firstcry.com//www.firstcry.com/babyhug/babyhug-sleeveless-romper-floral-embroidery-blue/3810544/product-detail
Nino Bambino Sleeveless Self Design Jumpsuit - Grey,,1 Left ,1499,929.38,(38% Off),,,https://www.firstcry.com//www.firstcry.com/nino-bambino/nino-bambino-sleeveless-self-design-jumpsuit-grey/9196096/product-detail
Kiddopanti Cool Attitude Printed Sleeveless Knee Length Dungaree -...,,2 Left ,999,669.33,(33% Off),,,https://www.firstcry.com//www.firstcry.com/kiddopanti/kiddopanti-cool-attitude-printed-sleeveless-knee-length-dungaree-blue/9133052/product-detail
Kiddopanti Sleeveless Knee Length Number Patch Dungaree - Navy Blue,,2 Left ,999,819.18,(18% Off),,,https://www.firstcry.com//www.firstcry.com/kiddopanti/kiddopanti-sleeveless-knee-length-number-patch-dungaree-navy-blue/9133048/product-detail
Kookie Kids Half Sleeves Romper Bunny Patch - Red,,1 Left ,774,626.94,(upto 21% Off),,,https://www.firstcry.com//www.firstcry.com/kookie-kids/kookie-kids-half-sleeves-romper-bunny-patch-red/8597753/product-detail
Kookie Kids Half Sleeves Romper Stripes - Blue,,1 Left ,731,592.11,(upto 21% Off),,,https://www.firstcry.com//www.firstcry.com/kookie-kids/kookie-kids-half-sleeves-romper-stripes-blue/8615708/product-detail
Natilene Sleeveless Flower Printed Polyester Jumpsuit - Multicolor,,,1249,711.93,(43% Off),,,https://www.firstcry.com//www.firstcry.com/natilene/natilene-sleeveless-flower-printed-polyester-jumpsuit-multicolor/9206038/product-detail
Cutecumber Three Fourth Sleeves Fringes Detailing Jumpsuit - Blue,,,1990,1432.8,(28% Off),,,https://www.firstcry.com//www.firstcry.com/cutecumber/cutecumber-three-fourth-sleeves-fringes-detailing-jumpsuit-blue/9205493/product-detail
Little Folks Dungaree Style Romper with Half Sleeves Inner Tee Frog...,,1 Left ,549,444.69,(19% Off),,,https://www.firstcry.com//www.firstcry.com/little-folks/little-folks-dungaree-style-romper-with-half-sleeves-inner-tee-frog-print-green/8970687/product-detail
ToffyHouse Half Sleeves Tee With Dungaree Stripes - Blue,,1 Left,675,560.25,(17% Off),,,https://www.firstcry.com/toffyhouse/toffyhouse-half-sleeves-tee-with-dungaree-stripes-blue/8655064/product-detail
Babyoye Flutter Sleeves Frock Style Onesie Floral Print - Navy,,2 Left,499,409.18,(upto 20% Off),,,https://www.firstcry.com/babyoye/babyoye-flutter-sleeves-frock-style-onesie-floral-print-navy/8275117/product-detail
Kookie Kids Half Sleeves Striped Onesie - White,,1 Left,602,499.66,(upto 19% Off),,,https://www.firstcry.com/kookie-kids/kookie-kids-half-sleeves-striped-onesie-white/8657490/product-detail
Babyhug Sleeveless Jumpsuit Floral Print - Yellow White,,2 Left,499,414.17,(upto 20% Off),,,https://www.firstcry.com/babyhug/babyhug-sleeveless-jumpsuit-floral-print-yellow-white/3293203/product-detail
Carter's Twill Cotton Romper - Brown,,1 Left,1399,1007.28,(28% Off),,,https://www.firstcry.com/carters/carters-twill-cotton-romper-brown/8014580/product-detail
Enfance Sleeveless Rose Printed Jumpsuit - Grey & Pink,,1 Left,745,648.15,(13% Off),,,https://www.firstcry.com/enfance/enfance-sleeveless-rose-printed-jumpsuit-grey-and-pink/8936926/product-detail
Li'L tomatoes Half Sleeves T-Shirt Striped Dungaree Set With A...,,1 Left,999,569.43,(43% Off),,,https://www.firstcry.com/lil-tomatoes/lil-tomatoes-half-sleeves-t-shirt-striped-dungaree-set-with-a-surprise-gift-red-white/9074571/product-detail
Babyoye Cotton Flutter Romper Allover Polka Dot Print Pack of 2...,,1 Left,999,839.16,(16% Off),,,https://www.firstcry.com/babyoye/babyoye-cotton-flutter-romper-allover-polka-dot-print-pack-of-2-blue-pink/8410360/product-detail
Little Folks Denim Dungaree with Half Sleeves Striped Tee - Blue,,1 Left,799,679.15,(upto 17% Off),,,https://www.firstcry.com/little-folks/little-folks-denim-dungaree-with-half-sleeves-striped-tee-blue/8667483/product-detail
Babyhug Full Length Jumpsuit With Belt Minnie Mouse Print - Navy...,,1 Left,799,615.23,(23% Off),,,https://www.firstcry.com/babyhug/babyhug-full-length-jumpsuit-with-belt-minnie-mouse-print-navy-blue-pink/8084038/product-detail
COCOON ORGANICS Short Sleeves Bug Printed Onesie With Diaper Pyjama...,,,999,819.18,(18% Off),,,https://www.firstcry.com/cocoon-organics/cocoon-organics-short-sleeves-bug-printed-onesie-with-diaper-pyjama-pink-and-white/8859504/product-detail
COCOON ORGANICS Half Sleeves Solid Colour Kimono Style Onesie - Violet,,,799,655.18,(18% Off),,,https://www.firstcry.com/cocoon-organics/cocoon-organics-half-sleeves-solid-colour-kimono-style-onesie-violet/8859548/product-detail
COCOON ORGANICS Short Sleeves Bug Printed Onesie With Diaper Pyjama...,,,999,819.18,(18% Off),,,https://www.firstcry.com/cocoon-organics/cocoon-organics-short-sleeves-bug-printed-onesie-with-diaper-pyjama-white/8859456/product-detail
COCOON ORGANICS Full Sleeves Solid Colour Kimono Style Onesie -...,,,799,655.18,(18% Off),,,https://www.firstcry.com/cocoon-organics/cocoon-organics-full-sleeves-solid-colour-kimono-style-onesie-light-blue/8859446/product-detail
COCOON ORGANICS Full Sleeves Solid Colour Kimono Style Onesie - Violet,,,799,655.18,(18% Off),,,https://www.firstcry.com/cocoon-organics/cocoon-organics-full-sleeves-solid-colour-kimono-style-onesie-violet/8859440/product-detail
COCOON ORGANICS Full Sleeves Solid Colour Kimono Style Onesie - Red,,,799,655.18,(18% Off),,,https://www.firstcry.com/cocoon-organics/cocoon-organics-full-sleeves-solid-colour-kimono-style-onesie-red/8859433/product-detail
COCOON ORGANICS Full Sleeves Printed Kimono Style Onesie - Beige,,,799,655.18,(18% Off),,,https://www.firstcry.com/cocoon-organics/cocoon-organics-full-sleeves-printed-kimono-style-onesie-beige/8859426/product-detail
COCOON ORGANICS Pack Of 2 Full Sleeves Polka Dot Printed Onesie...,,,1499,1229.18,(18% Off),,,https://www.firstcry.com/cocoon-organics/cocoon-organics-pack-of-2-full-sleeves-polka-dot-printed-onesie-yellow-and-green/8859424/product-detail
COCOON ORGANICS Full Sleeves Little Princess Printed Onesie - Light Blue,,,899,737.18,(18% Off),,,https://www.firstcry.com/cocoon-organics/cocoon-organics-full-sleeves-little-princess-printed-onesie-light-blue/8859418/product-detail
COCOON ORGANICS Full Sleeves Solid Colour Kimono Style Onesie - Navy...,,,799,655.18,(18% Off),,,https://www.firstcry.com/cocoon-organics/cocoon-organics-full-sleeves-solid-colour-kimono-style-onesie-navy-blue-and-white/8859409/product-detail
Little Folks Cold Shoulder Jumpsuit Floral Embroidery - Blue,,1 Left,599,509.15,(upto 17% Off),,,https://www.firstcry.com/little-folks/little-folks-cold-shoulder-jumpsuit-floral-embroidery-blue/8667464/product-detail
Babyhug Half Sleeves Jumpsuit Floral Print - Blue,,1 Left,599,461.23,(23% Off),,,https://www.firstcry.com/babyhug/babyhug-half-sleeves-jumpsuit-floral-print-blue/3749050/product-detail
Babyhug Singlet Sleeves Denim Jumpsuit Floral Print - Blue,,1 Left,699,503.28,(upto 29% Off),,,https://www.firstcry.com/babyhug/babyhug-singlet-sleeves-denim-jumpsuit-floral-print-blue/3444820/product-detail
Little Folks Cap Sleeves Jumpsuit Floral Embroidery -  Peach,,1 Left,599,509.15,(upto 19% Off),,,https://www.firstcry.com/little-folks/little-folks-cap-sleeves-jumpsuit-floral-embroidery-peach/8667592/product-detail
Carter's Lion Snap-Front Romper - Light Grey,,1 Left,799,559.3,(30% Off),,,https://www.firstcry.com/carters/carters-lion-snap-front-romper-light-grey/8014423/product-detail
Nauti Nati Full Sleeves Tee With Stars Glitter Print Dungaree -...,,,1699,883.48,(48% Off),,,https://www.firstcry.com/nauti-nati/nauti-nati-full-sleeves-tee-with-stars-glitter-print-dungaree-navy-blue/8865115/product-detail
Kookie Kids Full Sleeves Hooded Footed Romper Bunny Embroidery -...,,1 Left,860,731,(upto 17% Off),,,https://www.firstcry.com/kookie-kids/kookie-kids-full-sleeves-hooded-footed-romper-bunny-embroidery-white/8265393/product-detail
Kookie Kids Full Sleeve Polka Dotted Footed Romper Kitty Patch - Pink,,1 Left,817,629.09,(23% Off),,,https://www.firstcry.com/kookie-kids/kookie-kids-full-sleeve-polka-dotted-footed-romper-kitty-patch-pink/3730508/product-detail
Babyoye 100% Cotton Full Length Romper Penguin Print Pack of 2 -...,,1 Left,999,629.37,(upto 42% Off),,,https://www.firstcry.com/babyoye/babyoye-100-cotton-full-length-romper-penguin-print-pack-of-2-blue-red/8045377/product-detail
Cucumber Half Sleeves Dungaree With Inner T-Shirt Floral Print - Peach,,1 Left,640,537.6,(16% Off),,,https://www.firstcry.com/cucumber/cucumber-half-sleeves-dungaree-with-inner-t-shirt-floral-print-peach/8532248/product-detail
Nauti Nati Full Bell Sleeves Heart Print Top With Dungaree - Blue,,,2299,1195.48,(48% Off),,,https://www.firstcry.com/nauti-nati/nauti-nati-full-bell-sleeves-heart-print-top-with-dungaree-blue/8470441/product-detail
Mark & Mia  Half Sleeves Party Wear Romper - Grey,,1 Left,1235,691.6,(upto 49% Off),,,https://www.firstcry.com/mark-and-mia/mark-and-mia-half-sleeves-party-wear-romper-grey/8487311/product-detail
Mark & Mia Half Sleeves Romper with Mock Waistcoat - Grey,,1 Left,1235,741,(upto 45% Off),,,https://www.firstcry.com/mark-and-mia/mark-and-mia-half-sleeves-romper-with-mock-waistcoat-grey/8487566/product-detail
Carter's Sloth Snap-Up Romper - Red,,1 Left,849,568.83,(upto 33% Off),,,https://www.firstcry.com/carters/carters-sloth-snap-up-romper-red/2923820/product-detail
Carter's Polo-Style Jersey Romper - Grey Blue,,1 Left,899,602.33,(upto 33% Off),,,https://www.firstcry.com/carters/carters-polo-style-jersey-romper-grey-blue/2923634/product-detail
Carter's 5-Pack Whale Tank Bodysuits - Multicolour,,1 Left,1699,1308.23,(upto 25% Off),,,https://www.firstcry.com/carters/carters-5-pack-whale-tank-bodysuits-multicolour/2922891/product-detail
Kookie Kids Full Sleeves Stripe Romper Bow Applique - Blue White,,2 Left,839,646.03,(upto 30% Off),,,https://www.firstcry.com/kookie-kids/kookie-kids-full-sleeves-stripe-romper-bow-applique-blue-white/3742223/product-detail
ToffyHouse Full Sleeves Winter Wear Romper Owl Print - Off White,,1 Left,745,588.55,(21% Off),,,https://www.firstcry.com/toffyhouse/toffyhouse-full-sleeves-winter-wear-romper-owl-print-off-white/8359521/product-detail
Kookie Kids Full Sleeves Winter Wear Romper Strawberry Print - Pink,,1 Left,1075,881.5,(upto 25% Off),,,https://www.firstcry.com/kookie-kids/kookie-kids-full-sleeves-winter-wear-romper-strawberry-print-pink/3752347/product-detail
Carter's Banana Poplin Romper - Blue,,1 Left,899,629.3,(upto 42% Off),,,https://www.firstcry.com/carters/carters-banana-poplin-romper-blue/2923575/product-detail
Nauti Nati Half Sleeves Striped Jumpsuit - Peach,,,1449,825.93,(43% Off),,,https://www.firstcry.com/nauti-nati/nauti-nati-half-sleeves-striped-jumpsuit-peach/8521536/product-detail
Nauti Nati Sleeveless Dots Print Dungaree - White,,,1149,654.93,(43% Off),,,https://www.firstcry.com/nauti-nati/nauti-nati-sleeveless-dots-print-dungaree-white/8521095/product-detail
Nauti Nati Printed Short Sleeves Top With Dungaree - White,,3 Left,1949,1110.93,(43% Off),,,https://www.firstcry.com/nauti-nati/nauti-nati-printed-short-sleeves-top-with-dungaree-white/8478260/product-detail
Nauti Nati Short Sleeves Tee With Floral Print Dungaree - Navy Blue,,,1939,1105.23,(43% Off),,,https://www.firstcry.com/nauti-nati/nauti-nati-short-sleeves-tee-with-floral-print-dungaree-navy-blue/8478112/product-detail
Nauti Nati Short Sleeves Polka Dots Print Tee With Rainbow Patch...,,,1399,797.43,(43% Off),,,https://www.firstcry.com/nauti-nati/nauti-nati-short-sleeves-polka-dots-print-tee-with-rainbow-patch-dungaree-blue/8477993/product-detail
Natilene Cap Sleeves Flower Print Jumpsuit - White,,,1499,779.48,(48% Off),,,https://www.firstcry.com/natilene/natilene-cap-sleeves-flower-print-jumpsuit-white/8443655/product-detail
Nauti Nati Sleeveless Embroidered Jumpsuit - Navy Blue,,,1049,597.93,(43% Off),,,https://www.firstcry.com/nauti-nati/nauti-nati-sleeveless-embroidered-jumpsuit-navy-blue/8470248/product-detail
Nauti Nati Striped Sleeveless Jumpsuit - Blue,,,1499,854.43,(43% Off),,,https://www.firstcry.com/nauti-nati/nauti-nati-striped-sleeveless-jumpsuit-blue/8443782/product-detail
Simply Half Sleeves Onesie Heart Print Pack of 3 - Red White,,1 Left,585,479.7,(18% Off),,,https://www.firstcry.com/simply/simply-half-sleeves-onesie-heart-print-pack-of-3-red-white/3585647/product-detail
Olele Sleeveless Solid Colour Dungaree - Red,,1 Left,1998,1038.96,(48% Off),,,https://www.firstcry.com/olele/olele-sleeveless-solid-colour-dungaree-red/8407607/product-detail
A Little Fable Sleeveless Checked Jumpsuit - Multi Colour,,1 Left,1490,581.1,(upto 61% Off),,,https://www.firstcry.com/a-little-fable/a-little-fable-sleeveless-checked-jumpsuit-multi-colour/8354832/product-detail
Cherry Crumble By Nitt Hyman Sleeveless Floral Print Jumpsuit...,,1 Left,2199,923.58,(58% Off),,,https://www.firstcry.com/cherry-crumble-by-nitt-hyman/cherry-crumble-by-nitt-hyman-sleeveless-floral-print-jumpsuit-sky-blue/8224704/product-detail
Mark & Mia Sleeveless Frock Style Onesie Floral Embellishment -...,,1 Left,1355,826.55,(39% Off),,,https://www.firstcry.com/mark-and-mia/mark-and-mia-sleeveless-frock-style-onesie-floral-embellishment-navy-blue/2895208/product-detail
Baby Go Full Sleeves Footed Romper - Cream Brown,,1 Left,599,431.28,(upto 30% Off),,,https://www.firstcry.com/baby-go/baby-go-full-sleeves-footed-romper-cream-brown/3766039/product-detail
Nauti Nati Sleeveless Embroidery Detailing Jumpsuit - Navy Blue,,,1049,545.48,(48% Off),,,https://www.firstcry.com/nauti-nati/nauti-nati-sleeveless-embroidery-detailing-jumpsuit-navy-blue/3773049/product-detail
Nauti Nati Short Sleeves Top With Star Printed Dungaree - Orange,,,1299,675.48,(48% Off),,,https://www.firstcry.com/nauti-nati/nauti-nati-short-sleeves-top-with-star-printed-dungaree-orange/3773044/product-detail
Mark & Mia Cap Sleeves Party Wear Frock Style Onesie - Pink,,1 Left,1385,844.85,(upto 49% Off),,,https://www.firstcry.com/mark-and-mia/mark-and-mia-cap-sleeves-party-wear-frock-style-onesie-pink/3377196/product-detail
Carter's 3-Pack Clouds Side-Snap Bodysuits - Blue White,,1 Left,1799,935.48,(upto 53% Off),,,https://www.firstcry.com/carters/carters-3-pack-clouds-side-snap-bodysuits-blue-white/3393842/product-detail
Carter's 3-Piece Koala Little Character Set - Pink Blue,,1 Left,1579,1121.09,(29% Off),,,https://www.firstcry.com/carters/carters-3-piece-koala-little-character-set-pink-blue/3393948/product-detail
Carter's 2-Pack Zip-Up Cotton Sleep & Plays - Blue White,,1 Left,1899,1348.29,(upto 31% Off),,,https://www.firstcry.com/carters/carters-2-pack-zip-up-cotton-sleep-and-plays-blue-white/3393804/product-detail
Carter's 3-Piece Tiger Little Character Set - Rust Orange Navy...,,1 Left,1579,1057.93,(33% Off),,,https://www.firstcry.com/carters/carters-3-piece-tiger-little-character-set-rust-orange-navy-blue/3393956/product-detail
Carter's 3-Piece Bear Little Character Set - Blue Grey,,1 Left,1579,1215.83,(upto 34% Off),,,https://www.firstcry.com/carters/carters-3-piece-bear-little-character-set-blue-grey/3393949/product-detail
Carter's 3-Piece Animals Little Jacket Set - Navy White,,1 Left,,1649,(upto 28% Off),,,https://www.firstcry.com/carters/carters-3-piece-animals-little-jacket-set-navy-white/3393991/product-detail
ToffyHouse Dungaree Style Romper With Full Sleeves Tee Honey Bee...,,1 Left,695,479.55,(31% Off),,,https://www.firstcry.com/toffyhouse/toffyhouse-dungaree-style-romper-with-full-sleeves-tee-honey-bee-embroidery-yellow-white/8039219/product-detail
Carter's 3-Piece Dinosaur Bodysuit & Footed Pant Set - Yellow White,,1 Left,1749,1206.81,(31% Off),,,https://www.firstcry.com/carters/carters-3-piece-dinosaur-bodysuit-and-footed-pant-set-yellow-white/3396678/product-detail
Carter's 2-Pack Zip-Up Cotton Sleep & Plays - Grey Blue,,1 Left,1899,1253.34,(upto 47% Off),,,https://www.firstcry.com/carters/carters-2-pack-zip-up-cotton-sleep-and-plays-grey-blue/3394023/product-detail
Carter's 3-Piece Bear Little Jacket Set - Blue,,1 Left,1899,1462.23,(23% Off),,,https://www.firstcry.com/carters/carters-3-piece-bear-little-jacket-set-blue/3393913/product-detail
Piccolo Half Sleeves Tee With Checkered Dungaree - Grey & Black,,,899,827.08,(8% Off),,,https://www.firstcry.com/piccolo/piccolo-half-sleeves-tee-with-checkered-dungaree-grey-and-black/3703824/product-detail
Nauti Nati Half Sleeves Tee With Flower Printed Dungaree - Off...,,,1399,699.5,(50% Off),,,https://www.firstcry.com/nauti-nati/nauti-nati-half-sleeves-tee-with-flower-printed-dungaree-off-white-and-sea-green/3712401/product-detail
Nauti Nati Sleeveless Floral Print Jumpsuit - Navy Blue,,,849,441.48,(48% Off),,,https://www.firstcry.com/nauti-nati/nauti-nati-sleeveless-floral-print-jumpsuit-navy-blue/3712378/product-detail
Kiddopanti Sleeveless Solid Denim Dungaree - Grey,,1 Left,899,629.3,(30% Off),,,https://www.firstcry.com/kiddopanti/kiddopanti-sleeveless-solid-denim-dungaree-grey/3637318/product-detail
Nauti Nati Full Sleeves Top With Checked Dungaree - White Blue,,,1499,854.43,(43% Off),,,https://www.firstcry.com/nauti-nati/nauti-nati-full-sleeves-top-with-checked-dungaree-white-blue/3517301/product-detail
Nauti Nati Cold Shoulder Half Sleeves Checkered Jumpsuit - Black,,,999,499.5,(upto 50% Off),,,https://www.firstcry.com/nauti-nati/nauti-nati-cold-shoulder-half-sleeves-checkered-jumpsuit-black/3517253/product-detail
Nauti Nati Flowers Embroidered Neckline Sleeveless Jumpsuit - Blue,,,899,512.43,(upto 45% Off),,,https://www.firstcry.com/nauti-nati/nauti-nati-flowers-embroidered-neckline-sleeveless-jumpsuit-blue/3517155/product-detail
Nauti Nati Sleeveless Checkered Jumpsuit - Black,,3 Left,1299,675.48,(upto 50% Off),,,https://www.firstcry.com/nauti-nati/nauti-nati-sleeveless-checkered-jumpsuit-black/3517113/product-detail
Carter's Striped Ruffle Jersey Romper - Blue Pink,,1 Left,899,548.39,(upto 39% Off),,,https://www.firstcry.com/carters/carters-striped-ruffle-jersey-romper-blue-pink/2923678/product-detail
Carter's 2-Piece Floral Tee & Cat Shortalls Set - Grey,,1 Left,,1499,,,,https://www.firstcry.com/carters/carters-2-piece-floral-tee-and-cat-shortalls-set-grey/2922991/product-detail
Carter's 2-Piece Striped Tee & Animals Shortalls Set - Green...,,1 Left,1499,1154.23,(23% Off),,,https://www.firstcry.com/carters/carters-2-piece-striped-tee-and-animals-shortalls-set-green-navy-blue/2922937/product-detail
Carter's Strawberry Snap Up Romper - Blue,,1 Left,849,441.48,(upto 48% Off),,,https://www.firstcry.com/carters/carters-strawberry-snap-up-romper-blue/2924300/product-detail
Carter's Dinosaur Snap-Up Romper - Navy Blue,,1 Left,,849,,,,https://www.firstcry.com/carters/carters-dinosaur-snap-up-romper-navy-blue/2923799/product-detail
