name,badge_1,badge_2,mrp,discounted_price,discount,rating,rating_count,link
Mark & Mia  Half Sleeves Party Wear Striped Romper - Black,,1 Left ,1235,728.65,(upto 46% Off),,,https://www.firstcry.com//www.firstcry.com/mark-and-mia/mark-and-mia-half-sleeves-party-wear-striped-romper-black/8487341/product-detail
ToffyHouse Sleeveless Dungarees With Tee Stripes - Red,,1 Left ,,595,,,,https://www.firstcry.com//www.firstcry.com/toffyhouse/toffyhouse-sleeveless-dungarees-with-tee-stripes-red/9101361/product-detail
ToffyHouse Dungaree Style Romper with Short Sleeves Inner Tee...,,1 Left ,,675,,,,https://www.firstcry.com//www.firstcry.com/toffyhouse/toffyhouse-dungaree-style-romper-with-short-sleeves-inner-tee-heart-print-red/9100999/product-detail
Babyhug Short Sleeves Romper Tie Print - White Blue,,,399,327.18,(18% Off),,,https://www.firstcry.com//www.firstcry.com/babyhug/babyhug-short-sleeves-romper-tie-print-white-blue/3166762/product-detail
ToffyHouse Sleeveless Dungarees With Tee Stripes - Blue,,1 Left ,,895,,,,https://www.firstcry.com//www.firstcry.com/toffyhouse/toffyhouse-sleeveless-dungarees-with-tee-stripes-blue/9010075/product-detail
M'andy Bird Print Short Sleeves Top With Dungaree - Blue,,,899,782.13,(13% Off),,,https://www.firstcry.com//www.firstcry.com/mandy/mandy-bird-print-short-sleeves-top-with-dungaree-blue/8792659/product-detail
Babyhug 100% Cotton Half Sleeves Romper Hippo Patch - Dark Red,,3 Left ,449,368.18,(18% Off),,,https://www.firstcry.com//www.firstcry.com/babyhug/babyhug-100-cotton-half-sleeves-romper-hippo-patch-dark-red/9025776/product-detail
Mark & Mia Short Sleeves Frock Style Onesie Unicorn Print - Light Pink,,1 Left ,1225,686,(44% Off),,,https://www.firstcry.com//www.firstcry.com/mark-and-mia/mark-and-mia-short-sleeves-frock-style-onesie-unicorn-print-light-pink/8760922/product-detail
Global Desi Girl Short Sleeves Tribal Print Jumpsuit - Blue,,,1899,987.48,(48% Off),,,https://www.firstcry.com//www.firstcry.com/global-desi-girl/global-desi-girl-short-sleeves-tribal-print-jumpsuit-blue/8343207/product-detail
Kookie Kids Half Sleeves Printed Onesie with Dungaree - Blue,,1 Left ,903,749.49,(17% Off),,,https://www.firstcry.com//www.firstcry.com/kookie-kids/kookie-kids-half-sleeves-printed-onesie-with-dungaree-blue/9002857/product-detail
Enfance Core Sleeveless Rose Printed Jump Suit - White & Red,,1 Left ,695,604.65,(13% Off),,,https://www.firstcry.com//www.firstcry.com/enfance-core/enfance-core-sleeveless-rose-printed-jump-suit-white-and-red/9068121/product-detail
Babyhug Sleeveless Jumpsuit Bird Print - Yellow,,3 Left ,499,409.18,(18% Off),,,https://www.firstcry.com//www.firstcry.com/babyhug/babyhug-sleeveless-jumpsuit-bird-print-yellow/9089238/product-detail
Kookie Kids Half Sleeves Romper Crocodile Print - Green,,1 Left ,774,611.46,(upto 21% Off),,,https://www.firstcry.com//www.firstcry.com/kookie-kids/kookie-kids-half-sleeves-romper-crocodile-print-green/8946943/product-detail
Nauti Nati Sleeveless Aztec Print Jumpsuit - Black,,,999,569.43,(43% Off),,,https://www.firstcry.com//www.firstcry.com/nauti-nati/nauti-nati-sleeveless-aztec-print-jumpsuit-black/9374407/product-detail
Natilene Sleeveless Striped Jumpsuit - Multi Colour,,,1149,654.93,(43% Off),,,https://www.firstcry.com//www.firstcry.com/natilene/natilene-sleeveless-striped-jumpsuit-multi-colour/9374397/product-detail
Natilene Sleeveless Striped Jumpsuit - Multi Colour,,,1499,854.43,(43% Off),,,https://www.firstcry.com//www.firstcry.com/natilene/natilene-sleeveless-striped-jumpsuit-multi-colour/9374365/product-detail
Nauti Nati Sleeveless Striped Jumpsuit - Multi Colour,,,1249,711.93,(43% Off),,,https://www.firstcry.com//www.firstcry.com/nauti-nati/nauti-nati-sleeveless-striped-jumpsuit-multi-colour/9374145/product-detail
Natilene Half Sleeves Design Printed Jumpsuit - Multi Colour,,,1199,623.48,(48% Off),,,https://www.firstcry.com//www.firstcry.com/natilene/natilene-half-sleeves-design-printed-jumpsuit-multi-colour/9374132/product-detail
Natilene Half Sleeves Pineapple Print Jumpsuit - Purple,,,1249,711.93,(43% Off),,,https://www.firstcry.com//www.firstcry.com/natilene/natilene-half-sleeves-pineapple-print-jumpsuit-purple/9374104/product-detail
Nauti Nati Cap Sleeves Geometric Printed Polyester Jumpsuit -...,,,1049,597.93,(43% Off),,,https://www.firstcry.com//www.firstcry.com/nauti-nati/nauti-nati-cap-sleeves-geometric-printed-polyester-jumpsuit-multicolor/9373813/product-detail
Babyhug Half Sleeves Jumpsuit Striped - Blue,,1 Left,799,647.19,(19% Off),,,https://www.firstcry.com/babyhug/babyhug-half-sleeves-jumpsuit-striped-blue/8793534/product-detail
Babyhug Sleeveless Rompers Strawberry Print Pack of 2 -...,,1 Left,749,606.69,(upto 19% Off),,,https://www.firstcry.com/babyhug/babyhug-sleeveless-rompers-strawberry-print-pack-of-2-multicolour/8634020/product-detail
Babyhug Single Sleeves Pom Pom Lace One Shoulder Jumpsuit Butterfly...,,1 Left,499,409.18,(upto 20% Off),,,https://www.firstcry.com/babyhug/babyhug-single-sleeves-pom-pom-lace-one-shoulder-jumpsuit-butterfly-print-blue/8476205/product-detail
Babyhug Sleeveless Cotton Onesie - Blue,,1 Left,349,286.18,(18% Off),,,https://www.firstcry.com/babyhug/babyhug-sleeveless-cotton-onesie-blue/8502942/product-detail
I Bears Full Sleeves Rompers Multi Print Pack of 3 - White Red,,1 Left,990,821.7,(17% Off),,,https://www.firstcry.com/i-bears/i-bears-full-sleeves-rompers-multi-print-pack-of-3-white-red/8030053/product-detail
I Bears Full Sleeves Footed Romper Christmas Print Pack of 2 - Red...,,1 Left,990,801.9,(upto 19% Off),,,https://www.firstcry.com/i-bears/i-bears-full-sleeves-footed-romper-christmas-print-pack-of-2-red-white/3247709/product-detail
Kidi Wav Full Sleeves Ship Printed Romper - Red,,1 Left,250,232.5,(7% Off),,,https://www.firstcry.com/kidi-wav/kidi-wav-full-sleeves-ship-printed-romper-red/9151107/product-detail
Blue Giraffe Sleeveless Printed Jumpsuit - Navy Blue,,1 Left,1799,1295.28,(upto 28% Off),,,https://www.firstcry.com/blue-giraffe/blue-giraffe-sleeveless-printed-jumpsuit-navy-blue/9297143/product-detail
Babyhug Animal Printed Dungaree with Half Sleeves Tee - Blue,,1 Left,799,639.2,(20% Off),,,https://www.firstcry.com/babyhug/babyhug-animal-printed-dungaree-with-half-sleeves-tee-blue/8828657/product-detail
Kookie Kids Short Sleeves Romper Floral Print - Pink,,1 Left,817,669.94,(upto 19% Off),,,https://www.firstcry.com/kookie-kids/kookie-kids-short-sleeves-romper-floral-print-pink/8657635/product-detail
Brats & Dolls Dungaree with Flutter Sleeves Inner Tee Bunny Patch - Pink,,1 Left,599,497.17,(upto 19% Off),,,https://www.firstcry.com/brats-and-dolls/brats-and-dolls-dungaree-with-flutter-sleeves-inner-tee-bunny-patch-pink/8949827/product-detail
Babyhug Party Wear 100% Cotton Full Sleeves Stripe Romper With Bow -...,,1 Left,549,455.67,(upto 20% Off),,,https://www.firstcry.com/babyhug/babyhug-party-wear-100-cotton-full-sleeves-stripe-romper-with-bow-navy-blue-grey/8058669/product-detail
Kookie Kids Short Sleeves Romper Fruits Print - Green,,1 Left,817,653.6,(upto 21% Off),,,https://www.firstcry.com/kookie-kids/kookie-kids-short-sleeves-romper-fruits-print-green/8657644/product-detail
Kookie Kids Half Sleeves Romper Text Print - Blue,,1 Left,774,626.94,(upto 19% Off),,,https://www.firstcry.com/kookie-kids/kookie-kids-half-sleeves-romper-text-print-blue/8635973/product-detail
ToffyHouse Dungaree Romper with Half Sleeves Tee Boat Embroidery - Brown,,1 Left,845,701.35,(upto 17% Off),,,https://www.firstcry.com/toffyhouse/toffyhouse-dungaree-romper-with-half-sleeves-tee-boat-embroidery-brown/9010005/product-detail
Jo&Bo Half Sleeves Striped Romper With Tie - Black,,1 Left,599,491.18,(18% Off),,,https://www.firstcry.com/joandbo/joandbo-half-sleeves-striped-romper-with-tie-black/9106961/product-detail
Babyhug Dungaree with Half Sleeves Inner Tee Music Print - Navy Blue,,1 Left,999,839.16,(upto 17% Off),,,https://www.firstcry.com/babyhug/babyhug-dungaree-with-half-sleeves-inner-tee-music-print-navy-blue/8849755/product-detail
Babyhug Full Sleeves 100% Cotton Printed Onesie - Navy Blue,,1 Left,349,293.16,(upto 19% Off),,,https://www.firstcry.com/babyhug/babyhug-full-sleeves-100-cotton-printed-onesie-navy-blue/3794081/product-detail
Kookie Kids Sleeveless Stripe Onesie - Blue White,,3 Left,645,522.45,(upto 21% Off),,,https://www.firstcry.com/kookie-kids/kookie-kids-sleeveless-stripe-onesie-blue-white/8269936/product-detail
Dapper Dudes Half Sleeves Tee With Striped & Bear Patch Dungaree  -...,,1 Left,599,521.13,(13% Off),,,https://www.firstcry.com/dapper-dudes/dapper-dudes-half-sleeves-tee-with-striped-and-bear-patch-dungaree-green/9021729/product-detail
Tambourine Sleeveless Striped Jumpsuit - White,,,449,417.57,(7% Off),,,https://www.firstcry.com/tambourine/tambourine-sleeveless-striped-jumpsuit-white/9292590/product-detail
Babyhug 100 % Cotton Full Sleeves Romper Unicorn Patch - Blue,,1 Left,499,419.16,(upto 19% Off),,,https://www.firstcry.com/babyhug/babyhug-100-cotton-full-sleeves-romper-unicorn-patch--blue/8133117/product-detail
Babyhug Half Sleeves Cotton Romper Zebra Print - Orange,,1 Left,449,377.16,(upto 19% Off),,,https://www.firstcry.com/babyhug/babyhug-half-sleeves-cotton-romper-zebra-print-orange/8460864/product-detail
Brats and Dolls Dungaree Style Romper with Half Sleeves Inner...,,1 Left,599,485.19,(upto 21% Off),,,https://www.firstcry.com/brats-and-dolls/brats-and-dolls-dungaree-style-romper-with-half-sleeves-inner-tee-pink/8949804/product-detail
Vitamins Half Sleeves Jumpsuit Floral Print - Pink,,1 Left,1049,891.65,(upto 17% Off),,,https://www.firstcry.com/vitamins/vitamins-half-sleeves-jumpsuit-floral-print-pink/8936898/product-detail
Babyhug 100%Cotton Full Sleeves Romper Rocket Embroidery - Royal...,,1 Left,499,364.27,(upto 35% Off),,,https://www.firstcry.com/babyhug/babyhug-100-cotton-full-sleeves-romper-rocket-embroidery-royal-blue/8133126/product-detail
Jb Club Baby Duck Patch Dungaree With Half Sleeves Tee - Green,,1 Left,620,508.4,(18% Off),,,https://www.firstcry.com/jb-club/jb-club-baby-duck-patch-dungaree-with-half-sleeves-tee-green/9088942/product-detail
Babyhug Dungarees with Short Sleeves Inner Tee Floral Print - Pink White,,1 Left,799,663.17,(17% Off),,,https://www.firstcry.com/babyhug/babyhug-dungarees-with-short-sleeves-inner-tee-floral-print-pink-white/8444843/product-detail
Babyhug 100% Cotton Singlet Striped Romper Whale Patch - White Navy Blue,,1 Left,399,335.16,(16% Off),,,https://www.firstcry.com/babyhug/babyhug-100-cotton-singlet-striped-romper-whale-patch-white-navy-blue/3326207/product-detail
Brats and Dolls Denim Dungaree Style Romper with Half Sleeves Inner...,,1 Left,699,580.17,(upto 21% Off),,,https://www.firstcry.com/brats-and-dolls/brats-and-dolls-denim-dungaree-style-romper-with-half-sleeves-inner-tee-white/8949791/product-detail
Baby Naturelle & Me Half Sleeves Romper Duck Print - Green,,1 Left,370,307.1,(upto 17% Off),,,https://www.firstcry.com/baby-naturelle-and-me/baby-naturelle-and-me-half-sleeves-romper-duck-print-green/8953583/product-detail
Babyhug 100% Cotton Half Sleeves Onesie Cool Print - Blue,,1 Left,299,191.36,(upto 36% Off),,,https://www.firstcry.com/babyhug/babyhug-100-cotton-half-sleeves-onesie-cool-print-blue/3241695/product-detail
Babyoye Full Sleeves Hooded Romper Penguin Print - Orange,,2 Left,649,447.81,(upto 40% Off),,,https://www.firstcry.com/babyoye/babyoye-full-sleeves-hooded-romper-penguin-print-orange/8056727/product-detail
Babyhug Full Sleeves Cotton Romper Bear Print Pack of 2 - Red White,,1 Left,849,687.69,(19% Off),,,https://www.firstcry.com/babyhug/babyhug-full-sleeves-cotton-romper-bear-print-pack-of-2-red-white/2351482/product-detail
Babyhug Sleeveless Full Length Jumpsuit Floral Print - Green,,1 Left,699,580.17,(upto 31% Off),,,https://www.firstcry.com/babyhug/babyhug-sleeveless-full-length-jumpsuit-floral-print-green/8444260/product-detail
Babyhug 100%  Full Sleeves Cotton Romper Star Print - Red Blue,,1 Left,499,354.29,(upto 33% Off),,,https://www.firstcry.com/babyhug/babyhug-100-full-sleeves-cotton-romper-star-print--red-blue/8059657/product-detail
Nauti Nati Sleeveless Floral Print Asymmetrical Neck Detailing...,,3 Left,1299,675.48,(48% Off),,,https://www.firstcry.com/nauti-nati/nauti-nati-sleeveless-floral-print-asymmetrical-neck-detailing-jumpsuit-multi-colour/9205984/product-detail
Nauti Nati Sleeveless All Over Printed Jumpsuit - Grey,,,1199,623.48,(48% Off),,,https://www.firstcry.com/nauti-nati/nauti-nati-sleeveless-all-over-printed-jumpsuit-grey/9205977/product-detail
Little Folks Half sleeves Romper Dungaree - Purple,,1 Left,599,491.18,(upto 19% Off),,,https://www.firstcry.com/little-folks/little-folks-half-sleeves-romper-dungaree-purple/8970540/product-detail
Babyoye Half Sleeves Cotton Blend Romper Bear Print - Blue,,1 Left,699,552.21,(upto 21% Off),,,https://www.firstcry.com/babyoye/babyoye-half-sleeves-cotton-blend-romper-bear-print-blue/8388310/product-detail
Babyhug Full Sleeves 100% Cotton Onesie - White,,1 Left,229,160.3,(upto 37% Off),,,https://www.firstcry.com/babyhug/babyhug-full-sleeves-100-cotton-onesie-white/8254021/product-detail
Babyhug 100% Cotton Full Sleeves Onesies Pack of 3 - Red Navy Blue...,,1 Left,799,639.2,(20% Off),,,https://www.firstcry.com/babyhug/babyhug-100-cotton-full-sleeves-onesies-pack-of-3-red-navy-blue-light-grey/3626842/product-detail
Babyhug 100% Organic Cotton Full Sleeves Romper Animal Print - Sea...,,1 Left,499,404.19,(upto 27% Off),,,https://www.firstcry.com/babyhug/babyhug-100-organic-cotton-full-sleeves-romper-animal-print-sea-blue/3698085/product-detail
Jo&Bo Half Sleeves Mock Waistcoat Pattern Romper With Bow - Yellow,,1 Left,599,521.13,(upto 18% Off),,,https://www.firstcry.com/joandbo/joandbo-half-sleeves-mock-waistcoat-pattern-romper-with-bow-yellow/8911631/product-detail
Li'L tomatoes Half Sleeves Tee With Animal Print Detailing Dungaree &...,,2 Left,999,569.43,(43% Off),,,https://www.firstcry.com/lil-tomatoes/lil-tomatoes-half-sleeves-tee-with-animal-print-detailing-dungaree-and-surprise-gift-red/9074584/product-detail
Li'L tomatoes Half Sleeves Scooter Print Detailing Tee With Dungaree...,,1 Left,1149,654.93,(43% Off),,,https://www.firstcry.com/lil-tomatoes/lil-tomatoes-half-sleeves-scooter-print-detailing-tee-with-dungaree-and-surprise-gift-red/9074578/product-detail
Li'L tomatoes Striped Half Sleeves Tee With Dungaree & Gift - White...,,1 Left,1099,626.43,(43% Off),,,https://www.firstcry.com/lil-tomatoes/lil-tomatoes-striped-half-sleeves-tee-with-dungaree-and-gift-white-and-green/9074577/product-detail
Kookie Kids Sleeveless Jumpsuit With Half Sleeves Inner Tee Pineapple...,,1 Left,989,791.2,(upto 20% Off),,,https://www.firstcry.com/kookie-kids/kookie-kids-sleeveless-jumpsuit-with-half-sleeves-inner-tee-pineapple-print-yellow/8476069/product-detail
Babyhug 100% Cotton Full Length Romper Dino Embroidered - Blue,,2 Left,499,384.23,(23% Off),,,https://www.firstcry.com/babyhug/babyhug-100-cotton-full-length-romper-dino-embroidered-blue/3702778/product-detail
Babyoye Flutter Sleeves Jumpsuit with Belt - Pink,,1 Left,899,728.19,(upto 19% Off),,,https://www.firstcry.com/babyoye/babyoye-flutter-sleeves-jumpsuit-with-belt-pink/8513985/product-detail
Nauti Nat0i Sleeveless Striped Polyester Jumpsuit - Multicolor,,,1049,597.93,(43% Off),,,https://www.firstcry.com/nauti-nati/nauti-nat0i-sleeveless-striped-polyester-jumpsuit-multicolor/9051707/product-detail
Little Folks Denim Dungaree Style Romper with Half Sleeves Inner...,,1 Left,749,636.65,(upto 23% Off),,,https://www.firstcry.com/little-folks/little-folks-denim-dungaree-style-romper-with-half-sleeves-inner-tee-animal-embroidery-blue/8667489/product-detail
Babyhug Dungaree Style Romper with Full Sleeves Striped Tee - Pink,,1 Left,699,538.23,(upto 24% Off),,,https://www.firstcry.com/babyhug/babyhug-dungaree-style-romper-with-full-sleeves-striped-tee-pink/8049112/product-detail
Dapper Dudes Half Sleeves Tee With Striped Teddy Patch Detailing...,,2 Left,649,564.63,(13% Off),,,https://www.firstcry.com/dapper-dudes/dapper-dudes-half-sleeves-tee-with-striped-teddy-patch-detailing-dungaree-blue-and-red/8798927/product-detail
Naughty Ninos Sleeveless Solid T-Shirt With Checked Dungaree  - Red,,,1999,1139.43,(upto 43% Off),,,https://www.firstcry.com/naughty-ninos/naughty-ninos-sleeveless-solid-t-shirt-with-checked-dungaree-red/8956695/product-detail
Child World Full Sleeves Romper Giraffe Patch - White Blue,,1 Left,599,443.26,(upto 27% Off),,,https://www.firstcry.com/child-world/child-world-full-sleeves-romper-giraffe-patch-white-blue/8613633/product-detail
Ed-a-Mamma Sleeveless Printed Strappy Jumpsuit - Aqua,,1 Left,1199,923.23,(upto 25% Off),,,https://www.firstcry.com/ed-a-mamma/ed-a-mamma-sleeveless-printed-strappy-jumpsuit-aqua/3768139/product-detail
Ikeda Designs Floral Print Sleeveless Jumpsuit - Multicolor,,1 Left,1200,984,(18% Off),,,https://www.firstcry.com/ikeda-designs/ikeda-designs-floral-print-sleeveless-jumpsuit-multicolor/8946256/product-detail
Babyhug Short Sleeves Jumpsuit - White Multicolor,,1 Left,699,489.3,(upto 42% Off),,,https://www.firstcry.com/babyhug/babyhug-short-sleeves-jumpsuit-white-multicolor/3705716/product-detail
Kookie Kids Dungaree with Full Sleeves Striped Inner Tee - Yellow,,1 Left,1333,1079.73,(19% Off),,,https://www.firstcry.com/kookie-kids/kookie-kids-dungaree-with-full-sleeves-striped-inner-tee-yellow/3742956/product-detail
Nauti Nati Full Sleeves Tee With Checkered Jumpsuit - White,,,2399,1367.43,(43% Off),,,https://www.firstcry.com/nauti-nati/nauti-nati-full-sleeves-tee-with-checkered-jumpsuit-white/8865347/product-detail
Nauti Nati Full Sleeves Tee With Unicorn Patch Dungaree - Blue & Red,,,1699,883.48,(48% Off),,,https://www.firstcry.com/nauti-nati/nauti-nati-full-sleeves-tee-with-unicorn-patch-dungaree-blue-and-red/8865107/product-detail
Mark & Mia Flutter Sleeves Frock style Onesie Floral Embroidery -...,,1 Left,1515,893.85,(upto 41% Off),,,https://www.firstcry.com/mark-and-mia/mark-and-mia-flutter-sleeves-frock-style-onesie-floral-embroidery-pink/8761616/product-detail
Nauti Nati Half Sleeves Cold Shoulder Checked Cotton Jumpsuit...,,,899,512.43,(43% Off),,,https://www.firstcry.com/nauti-nati/nauti-nati-half-sleeves-cold-shoulder-checked-cotton-jumpsuit-black/8785621/product-detail
Kookie Kids Full Sleeves Checks Shirt with Dungaree - Orange Beige,,1 Left,1290,1019.1,(21% Off),,,https://www.firstcry.com/kookie-kids/kookie-kids-full-sleeves-checks-shirt-with-dungaree-orange-beige/8316725/product-detail
Kookie Kids Full Sleeves Hooded Footed Romper Bird Patch - Blue,,1 Left,1032,763.68,(upto 33% Off),,,https://www.firstcry.com/kookie-kids/kookie-kids-full-sleeves-hooded-footed-romper-bird-patch-blue/3649621/product-detail
Naughty Ninos Sleeveless Checked Jumpsuit - Red,,1 Left,1499,779.48,(upto 48% Off),,,https://www.firstcry.com/naughty-ninos/naughty-ninos-sleeveless-checked-jumpsuit-red/8712617/product-detail
Bodycare Half Sleeves Rompers - Royal Blue,,1 Left,425,357,(16% Off),,,https://www.firstcry.com/bodycare/bodycare-half-sleeves-rompers-royal-blue/8557325/product-detail
Nottie Planet Baby Elephant Print Full Sleeves Romper - Red,,1 Left,350,273,(22% Off),,,https://www.firstcry.com/nottie-planet/nottie-planet-baby-elephant-print-full-sleeves-romper-red/8694328/product-detail
Nottie Planet Baby Elephant Print Full Sleeves Romper - Blue,,1 Left,350,273,(22% Off),,,https://www.firstcry.com/nottie-planet/nottie-planet-baby-elephant-print-full-sleeves-romper-blue/8694326/product-detail
Nottie Planet Full Sleeves Tee With Striped Romper - Red,,1 Left,450,337.5,(upto 25% Off),,,https://www.firstcry.com/nottie-planet/nottie-planet-full-sleeves-tee-with-striped-romper-red/8694322/product-detail
Ed-a-Mamma Carrot Printed Half Sleeves Cotton Jumpsuit With...,,1 Left,999,969.03,(3% Off),,,https://www.firstcry.com/ed-a-mamma/ed-a-mamma-carrot-printed-half-sleeves-cotton-jumpsuit-with-front-tie-up-detail-mustard/3766322/product-detail
Jb Club Striped Full Sleeves Romper - Black,,1 Left,620,496,(upto 20% Off),,,https://www.firstcry.com/jb-club/jb-club-striped-full-sleeves-romper-black/3701197/product-detail
UPTOWNIE Sleeveless Solid Colour Jumpsuit - Maroon,,,1599,831.48,(48% Off),,,https://www.firstcry.com/uptownie/uptownie-sleeveless-solid-colour-jumpsuit-maroon/8556022/product-detail
UPTOWNIE Solid Colour Half Sleeves Jumpsuit - Black,,1 Left,1599,831.48,(48% Off),,,https://www.firstcry.com/uptownie/uptownie-solid-colour-half-sleeves-jumpsuit-black/8556109/product-detail
UPTOWNIE Sleeveless Floral Print Jumpsuit - Yellow,,,1599,831.48,(48% Off),,,https://www.firstcry.com/uptownie/uptownie-sleeveless-floral-print-jumpsuit-yellow/8556075/product-detail
UPTOWNIE Sleeveless Floral Print Jumpsuit - Black,,1 Left,1599,831.48,(48% Off),,,https://www.firstcry.com/uptownie/uptownie-sleeveless-floral-print-jumpsuit-black/8556067/product-detail
UPTOWNIE Sleeveless Solid Colour Jumpsuit - Navy Blue,,1 Left,1599,831.48,(48% Off),,,https://www.firstcry.com/uptownie/uptownie-sleeveless-solid-colour-jumpsuit-navy-blue/8556037/product-detail
UPTOWNIE Three Fourth Sleeves Floral Print Jumpsuit - Black,,,1599,831.48,(48% Off),,,https://www.firstcry.com/uptownie/uptownie-three-fourth-sleeves-floral-print-jumpsuit-black/8556001/product-detail
Kookie Kids Full Sleeves Romper Bear Patch Print - Orange,,1 Left,731,504.39,(upto 36% Off),,,https://www.firstcry.com/kookie-kids/kookie-kids-full-sleeves-romper-bear-patch-print-orange/3689346/product-detail
