name,badge_1,badge_2,mrp,discounted_price,discount,rating,rating_count,link
Wow Clothes Dungaree with Half Sleeves Inner Tee Doll Applique -...,,,750,592.5,(upto 21% Off),,,https://www.firstcry.com//www.firstcry.com/wow-clothes/wow-clothes-dungaree-with-half-sleeves-inner-tee-doll-applique-white/9055554/product-detail
Mini Taurus Full Sleeves Romper Vehicle Print - Maroon,,,449,390.63,(13% Off),,,https://www.firstcry.com//www.firstcry.com/mini-taurus/mini-taurus-full-sleeves-romper-vehicle-print-maroon/9403967/product-detail
Cucumber Full Sleeves Animals Print  Rompers - Red,,,,520,,,,https://www.firstcry.com//www.firstcry.com/cucumber/cucumber-full-sleeves-animals-print-rompers-red/9247297/product-detail
Babyhug Flutter Sleeves Romper Floral Print - Navy Blue,,,499,394.21,(21% Off),,,https://www.firstcry.com//www.firstcry.com/babyhug/babyhug-flutter-sleeves-romper-floral-print-navy-blue/8763050/product-detail
Babyoye Singlet Stripe Romper Floral Embroidery - Blue White,,,899,710.21,(upto 23% Off),,,https://www.firstcry.com//www.firstcry.com/babyoye/babyoye-singlet-stripe-romper-floral-embroidery-blue-white/8727327/product-detail
Babyhug Short Sleeves 100% Cotton Romper Floral Print - White,,,449,354.71,(21% Off),,,https://www.firstcry.com//www.firstcry.com/babyhug/babyhug-short-sleeves-100-cotton-romper-floral-print-white/3439579/product-detail
Babyhug Sleeveless Dungarees With Tee Sharks Print  - Blue,,,799,631.21,(21% Off),,,https://www.firstcry.com//www.firstcry.com/babyhug/babyhug-sleeveless-dungarees-with-tee-sharks-print-blue/8829851/product-detail
Babyhug Dungaree Style Romper With Half Sleeves Stripe Tee Mickey...,,,999,759.24,(upto 24% Off),,,https://www.firstcry.com//www.firstcry.com/babyhug/babyhug-dungaree-style-romper-with-half-sleeves-stripe-tee-mickey-mouse-print-blue/8556599/product-detail
I Bears Half Sleeves Onesies Pack of 3 - Multicolor,,,660,521.4,(21% Off),,,https://www.firstcry.com//www.firstcry.com/i-bears/i-bears-half-sleeves-onesies-pack-of-3-multicolor/9169562/product-detail
Pine Kids Sleeveless Striped Jumpsuit - Yellow,,,899,710.21,(21% Off),,,https://www.firstcry.com//www.firstcry.com/pine-kids/pine-kids-sleeveless-striped-jumpsuit-yellow/9108387/product-detail
Babyhug Flutter Sleeves Jumpsuit Floral Print - Navy Blue,,,499,394.21,(21% Off),,,https://www.firstcry.com//www.firstcry.com/babyhug/babyhug-flutter-sleeves-jumpsuit-floral-print-navy-blue/9041990/product-detail
Babyhug 100% Cotton Short Sleeves Romper Polka Dot Print - Pink,,,449,354.71,(21% Off),,,https://www.firstcry.com//www.firstcry.com/babyhug/babyhug-100-cotton-short-sleeves-romper-polka-dot-print-pink/9054956/product-detail
Babyhug Sleeveless Jumpsuit Fruits Print - Yellow,,,499,394.21,(21% Off),,,https://www.firstcry.com//www.firstcry.com/babyhug/babyhug-sleeveless-jumpsuit-fruits-print-yellow/8499243/product-detail
I Bears Half Sleeves Onesies Pack of 3 - Multicolor,,,660,521.4,(21% Off),,,https://www.firstcry.com//www.firstcry.com/i-bears/i-bears-half-sleeves-onesies-pack-of-3-multicolor/9169557/product-detail
Babyhug Singlet Tie & Dye Jumpsuit - Pink White,,,499,394.21,(21% Off),,,https://www.firstcry.com//www.firstcry.com/babyhug/babyhug-singlet-tie-and-dye-jumpsuit-pink-white/9024632/product-detail
Babyhug Knee Length Dungaree with Half Sleeves Inner Tee Tiger...,,,799,631.21,(21% Off),,,https://www.firstcry.com//www.firstcry.com/babyhug/babyhug-knee-length-dungaree-with-half-sleeves-inner-tee-tiger-print-yellow-blue/8581733/product-detail
I Bears Full Sleeves Footed Romper Christmas Print Pack of 2 - Red...,,,990,782.1,(21% Off),,,https://www.firstcry.com//www.firstcry.com/i-bears/i-bears-full-sleeves-footed-romper-christmas-print-pack-of-2-red-white/3247710/product-detail
Babyhug Sleeveless Jumpsuit  - Multicolour,,,599,473.21,(21% Off),,,https://www.firstcry.com//www.firstcry.com/babyhug/babyhug-sleeveless-jumpsuit-multicolour/9024624/product-detail
I Bears Half Sleeves Printed Onesies Pack of 3 - Blue,,,,630,,,,https://www.firstcry.com//www.firstcry.com/i-bears/i-bears-half-sleeves-printed-onesies-pack-of-3-blue/9109880/product-detail
Babyhug 100% Cotton Flutter Sleeves Onesie Bug Print - Red,,,349,275.71,(21% Off),,,https://www.firstcry.com//www.firstcry.com/babyhug/babyhug-100-cotton-flutter-sleeves-onesie-bug-print-red/8502912/product-detail
M'andy Half Sleeves Butterfly Printed Jumpsuit - Navy Blue,,,,799,(upto 13% Off),,,https://www.firstcry.com/mandy/mandy-half-sleeves-butterfly-printed-jumpsuit-navy-blue/8691787/product-detail
I Bears Full Sleeves Footed Rompers Pack of 3 - Purple White,,,1140,1003.2,(12% Off),,,https://www.firstcry.com/i-bears/i-bears-full-sleeves-footed-rompers-pack-of-3-purple-white/8884342/product-detail
Babyhug Flutter Sleeves Jumpsuit with Bow - Pink,,,799,631.21,(21% Off),,,https://www.firstcry.com/babyhug/babyhug-flutter-sleeves-jumpsuit-with-bow-pink/9166835/product-detail
Babyhug Sleeveless Jumpsuit Floral Print - Pink,,,499,379.24,(upto 24% Off),,,https://www.firstcry.com/babyhug/babyhug-sleeveless-jumpsuit-floral-print-pink/9058825/product-detail
Babyhug Flutter Sleeves Jumpsuit Floral Print - Pink,,,499,394.21,(21% Off),,,https://www.firstcry.com/babyhug/babyhug-flutter-sleeves-jumpsuit-floral-print-pink/9180104/product-detail
Babyhug Cotton Sleeveless Jumpsuit - Multicolo,,,699,552.21,(upto 22% Off),,,https://www.firstcry.com/babyhug/babyhug-cotton-sleeveless-jumpsuit-multicolo/8999709/product-detail
Babyhug Sleeveless Striped Jumpsuit - Blue,,,799,631.21,(21% Off),,,https://www.firstcry.com/babyhug/babyhug-sleeveless-striped-jumpsuit-blue/9011058/product-detail
Babyhug Full Sleeves Cotton Onesie with Legging Bunny Print - Pink,,,499,384.23,(upto 23% Off),,,https://www.firstcry.com/babyhug/babyhug-full-sleeves-cotton-onesie-with-legging-bunny-print-pink/3603211/product-detail
Babyhug 100% Cotton Puff Sleeves Onesies Pack of 5 - Multicolour,,,1199,947.21,(21% Off),,,https://www.firstcry.com/babyhug/babyhug-100-cotton-puff-sleeves-onesies-pack-of-5-multicolour/8502806/product-detail
Babyhug Cap Sleeves Jumpsuit Floral Embroidery - Light  Blue,,,599,473.21,(upto 21% Off),,,https://www.firstcry.com/babyhug/babyhug-cap-sleeves-jumpsuit-floral-embroidery-light-blue/9255473/product-detail
Babyoye Sleeveless Jumpsuit - White,,,899,710.21,(upto 23% Off),,,https://www.firstcry.com/babyoye/babyoye-sleeveless-jumpsuit-white/8727318/product-detail
Babyhug Cold Shoulder Jumpsuit Polka Dot Print - Navy Blue,,,699,538.23,(upto 23% Off),,,https://www.firstcry.com/babyhug/babyhug-cold-shoulder-jumpsuit-polka-dot-print-navy-blue/3467044/product-detail
Dew Drops Half Sleeves Jumpsuit Bird Print - Dark Blue,,,499,434.13,(13% Off),,,https://www.firstcry.com/dew-drops/dew-drops-half-sleeves-jumpsuit-bird-print-dark-blue/9210799/product-detail
Babyhug Polka Dot 100% Cotton Onesie - Red,,,349,279.2,(20% Off),,,https://www.firstcry.com/babyhug/babyhug-polka-dot-100-cotton-onesie-red/8502905/product-detail
Babyhug Half Sleeves Onesies Multiprint Pack of 3 - Yellow...,,,749,591.71,(21% Off),,,https://www.firstcry.com/babyhug/babyhug-half-sleeves-onesies-multiprint-pack-of-3-yellow-light-grey-navy-blue/9360146/product-detail
Babyoye Cotton  Dungaree Style Romper With Half Sleeves Tee...,,,1199,947.21,(21% Off),,,https://www.firstcry.com/babyoye/babyoye-cotton-dungaree-style-romper-with-half-sleeves-tee-shell-embroidery-pink-blue/8716493/product-detail
Babyhug 100% Cotton Singlet Stripe Onesie Heart Embroidery - Navy Blue,,,229,176.33,(upto 25% Off),,,https://www.firstcry.com/babyhug/babyhug-100-cotton-singlet-stripe-onesie-heart-embroidery-navy-blue/9084750/product-detail
Babyhug 100% Cotton Full Sleeves Romper - Blue,,,499,379.24,(upto 25% Off),,,https://www.firstcry.com/babyhug/babyhug-100-cotton-full-sleeves-romper-blue/3640015/product-detail
Babyoye Sleeveless Onesies Printed Pack of 3 - Multicolour,,,1199,947.21,(21% Off),,,https://www.firstcry.com/babyoye/babyoye-sleeveless-onesies-printed-pack-of-3-multicolour/8410482/product-detail
Babyoye 100%Cotton Cap Sleeves Printed Romper - Pink,,,799,607.24,(upto 25% Off),,,https://www.firstcry.com/babyoye/babyoye-100-cotton-cap-sleeves-printed-romper-pink/8514131/product-detail
Babyhug 100% Cotton Sleeveless Onesie Roar Print - Blue,,,249,179.28,(upto 28% Off),,,https://www.firstcry.com/babyhug/babyhug-100-cotton-sleeveless-onesie-roar-print-blue/8634077/product-detail
Babyhug Dungaree with Cap Sleeves Inner Tee Polka Dot Print - White...,,,899,710.21,(upto 24% Off),,,https://www.firstcry.com/babyhug/babyhug-dungaree-with-cap-sleeves-inner-tee-polka-dot-print-white-pink/8766199/product-detail
Pine Kids Sleeveless Jumpsuit Floral Embroidery - Pink,,,899,701.22,(upto 23% Off),,,https://www.firstcry.com/pine-kids/pine-kids-sleeveless-jumpsuit-floral-embroidery-pink/8875216/product-detail
Babyhug Sleeveless Jumpsuit Floral Print - Blue,,,699,552.21,(21% Off),,,https://www.firstcry.com/babyhug/babyhug-sleeveless-jumpsuit-floral-print-blue/9024618/product-detail
Babyhug Dungaree With Half Sleeves Tee Printed - Yellow,,,799,631.21,(21% Off),,,https://www.firstcry.com/babyhug/babyhug-dungaree-with-half-sleeves-tee-printed-yellow/8581726/product-detail
Babyhug Half Sleeves T-shirt and Dungaree Set - Orange,,,999,779.22,(22% Off),,,https://www.firstcry.com/babyhug/babyhug-half-sleeves-t-shirt-and-dungaree-set-orange/8849757/product-detail
Wow Flutter Sleeves Striped Jumpsuit - Yellow,,,560,442.4,(21% Off),,,https://www.firstcry.com/wow-clothes/wow-flutter-sleeves-striped-jumpsuit-yellow/9055470/product-detail
I Bears Half Sleeves Onesie Llama Print Pack of 3 - Peach Blue,,,660,521.4,(21% Off),,,https://www.firstcry.com/i-bears/i-bears-half-sleeves-onesie-llama-print-pack-of-3-peach-blue/8980839/product-detail
Babyhug 100% Cotton Sleeveless Onesie Floral Print - Blue,,,349,275.71,(21% Off),,,https://www.firstcry.com/babyhug/babyhug-100-cotton-sleeveless-onesie-floral-print-blue/9055446/product-detail
Babyhug 100% Cotton Sleeveless Onesie Floral Print - Yellow,,,349,275.71,(21% Off),,,https://www.firstcry.com/babyhug/babyhug-100-cotton-sleeveless-onesie-floral-print-yellow/9055450/product-detail
I Bears Full Sleeves Multi Printed Onesies Pack of 3 - Red Black Grey,,,720,568.8,(21% Off),,,https://www.firstcry.com/i-bears/i-bears-full-sleeves-multi-printed-onesies-pack-of-3-red-black-grey/8499664/product-detail
Babyhug 100% Cotton Half Sleeves Romper Car Print - White,,,399,311.22,(upto 24% Off),,,https://www.firstcry.com/babyhug/babyhug-100-cotton-half-sleeves-romper-car-print-white/9025786/product-detail
Babyhug Cold Shoulder Jumpsuit Floral Print - Yellow,,,599,473.21,(upto 24% Off),,,https://www.firstcry.com/babyhug/babyhug-cold-shoulder-jumpsuit-floral-print-yellow/9042986/product-detail
Babyhug Half Sleeves Onesie Stripes - Blue,,,299,236.21,(21% Off),,,https://www.firstcry.com/babyhug/babyhug-half-sleeves-onesie-stripes-blue/8462637/product-detail
Babyhug 100% Cotton Singlet Romper Floral Print - Pink White,,,399,315.21,(21% Off),,,https://www.firstcry.com/babyhug/babyhug-100-cotton-singlet-romper-floral-print-pink-white/3439561/product-detail
I Bears Half Sleeves Onesies Pack of 3 - Multicolor,,,930,734.7,(21% Off),,,https://www.firstcry.com/i-bears/i-bears-half-sleeves-onesies-pack-of-3-multicolor/9169560/product-detail
Babyoye Full Sleeves Striped & Printed Romper Pack of 2 - Orange,,,1399,1105.21,(21% Off),,,https://www.firstcry.com/babyoye/babyoye-full-sleeves-striped-and-printed-romper-pack-of-2-orange/8390983/product-detail
Babyhug Denim Dungaree with Striped Inner Tee - Blue Multicolor,,,999,709.29,(upto 31% Off),,,https://www.firstcry.com/babyhug/babyhug-denim-dungaree-with-striped-inner-tee-blue-multicolor/8290614/product-detail
Babyhug Dungaree with Striped Inner Tee Vehicle Print - Beige & Red,,,999,789.21,(upto 25% Off),,,https://www.firstcry.com/babyhug/babyhug-dungaree-with-striped-inner-tee-vehicle-print-beige-and-red/8597512/product-detail
Babyhug Half Sleeves Romper Animals Print - White,,,399,315.21,(21% Off),,,https://www.firstcry.com/babyhug/babyhug-half-sleeves-romper-animals-print-white/8914342/product-detail
Babyhug Knee Length Dungaree With Inner T-Shirt - Red,,,999,789.21,(upto 23% Off),,,https://www.firstcry.com/babyhug/babyhug-knee-length-dungaree-with-inner-t-shirt-red/8556591/product-detail
Pine Kids Full Length Jumpsuit - Yellow,,,1099,868.21,(21% Off),,,https://www.firstcry.com/pine-kids/pine-kids-full-length-jumpsuit-yellow/9108384/product-detail
Babyhug Half Sleeves Dungaree with Inner Tee - Pink,,,699,552.21,(21% Off),,,https://www.firstcry.com/babyhug/babyhug-half-sleeves-dungaree-with-inner-tee-pink/8564870/product-detail
Babyhug Knee Length Dungaree With Inner T-Shirt - Blue,,,999,789.21,(upto 23% Off),,,https://www.firstcry.com/babyhug/babyhug-knee-length-dungaree-with-inner-t-shirt-blue/8819215/product-detail
Babyhug Sleeveless Jumpsuit Striped - Red,,,699,552.21,(21% Off),,,https://www.firstcry.com/babyhug/babyhug-sleeveless-jumpsuit-striped-red/9111249/product-detail
Babyhug 100% Cotton Onesie Pack of 5 - White,,,1149,988.14,(14% Off),,,https://www.firstcry.com/babyhug/babyhug-100-cotton-onesie-pack-of-5-white/8265420/product-detail
Babyoye Sleeveless Jumpsuits Dots Print - Red,,1 Left,899,710.21,(upto 23% Off),,,https://www.firstcry.com/babyoye/babyoye-sleeveless-jumpsuits-dots-print-red/8748345/product-detail
Babyhug 100% Cotton Onesie Mommy's Girl Print - Peach,,,299,236.21,(21% Off),,,https://www.firstcry.com/babyhug/babyhug-100-cotton-onesie-mommys-girl-print-peach/3029899/product-detail
Babyhug Singlet Tie Knot Style Jumpsuit - Peach,,,799,631.21,(upto 24% Off),,,https://www.firstcry.com/babyhug/babyhug-singlet-tie-knot-style-jumpsuit-peach/8763287/product-detail
I Bears Half Sleeves Onesies Pack of 3 - Pink Green,,,570,450.3,(upto 23% Off),,,https://www.firstcry.com/i-bears/i-bears-half-sleeves-onesies-pack-of-3-pink-green/3664385/product-detail
Babyhug  Sleeveless Polka Dot Jumpsuit  Bow Applique - Navy Blue,,,499,389.22,(upto 23% Off),,,https://www.firstcry.com/babyhug/babyhug-sleeveless-polka-dot-jumpsuit--bow-applique-navy-blue/8601431/product-detail
Babyhug Half Sleeves 100% Cotton Romper Polka Dot Print - Navy Blue,,,449,354.71,(21% Off),,,https://www.firstcry.com/babyhug/babyhug-half-sleeves-100-cotton-romper-polka-dot-print-navy-blue/9054948/product-detail
I Bears Half Sleeves Striped Romper Boat Print Pack of 3 - Blue White,,,600,474,(upto 23% Off),,,https://www.firstcry.com/i-bears/i-bears-half-sleeves-striped-romper-boat-print-pack-of-3-blue-white/3356102/product-detail
Babyhug 100% Cotton Sleeveless Frock style Onesie - Pink,,,299,236.21,(21% Off),,,https://www.firstcry.com/babyhug/babyhug-100-cotton-sleeveless-frock-style-onesie-pink/9084740/product-detail
I Bears Half Sleeves Printed Onesies Pack of 3 - Multicolour,,,630,497.7,(21% Off),,,https://www.firstcry.com/i-bears/i-bears-half-sleeves-printed-onesies-pack-of-3-multicolour/9109872/product-detail
Babyhug Dungaree with Cap Sleeves Striped Inner Tee Cherry...,,,999,789.21,(21% Off),,,https://www.firstcry.com/babyhug/babyhug-dungaree-with-cap-sleeves-striped-inner-tee-cherry-embroidery-red-blue/8819219/product-detail
I Bears Full Sleeves Striped Romper Floral Print Pack of 3 - Pink White,,,930,716.1,(upto 23% Off),,,https://www.firstcry.com/i-bears/i-bears-full-sleeves-striped-romper-floral-print-pack-of-3-pink-white/3356145/product-detail
Babyhug 100% Cotton Sleeveless Onesie - Blue,,,229,180.91,(21% Off),,,https://www.firstcry.com/babyhug/babyhug-100-cotton-sleeveless-onesie-blue/9084734/product-detail
Babyhug Dungaree Style Romper With Half Sleeves Stripe Tee Winnie...,,,999,789.21,(upto 24% Off),,,https://www.firstcry.com/babyhug/babyhug-dungaree-style-romper-with-half-sleeves-stripe-tee-winnie-the-pooh-print-blue-multicolour/8556604/product-detail
Babyhug Full Sleeves 100% Cotton Romper Animal Print - White Orange,,,499,394.21,(21% Off),,,https://www.firstcry.com/babyhug/babyhug-full-sleeves-100-cotton-romper-animal-print-white-orange/8634100/product-detail
Pine Kids Singlet Sleeves Striped Jumpsuit - Pink,,,1299,1026.21,(21% Off),,,https://www.firstcry.com/pine-kids/pine-kids-singlet-sleeves-striped-jumpsuit-pink/9108043/product-detail
Babyhug Sleeveless Jumpsuit Striped Print - Multicolor,,,499,384.23,(upto 25% Off),,,https://www.firstcry.com/babyhug/babyhug-sleeveless-jumpsuit-striped-print-multicolor/9093324/product-detail
Babyhug Sleeveless Dungarees With Tee Checks - Grey Navy Blue,,,999,789.21,(upto 22% Off),,,https://www.firstcry.com/babyhug/babyhug-sleeveless-dungarees-with-tee-checks-grey-navy-blue/8936078/product-detail
Babyhug Dungaree with Short Sleeves Inner Tee - Pink,,,999,789.21,(21% Off),,,https://www.firstcry.com/babyhug/babyhug-dungaree-with-short-sleeves-inner-tee-pink/8789249/product-detail
Babyhug Cotton Half Sleeves Romper Crab Print - Light Grey,,,499,394.21,(upto 22% Off),,,https://www.firstcry.com/babyhug/babyhug-cotton-half-sleeves-romper-crab-print-light-grey/8976275/product-detail
Babyhug Half Sleeves Onesies Tiger Print Pack of 3 - Orange Grey,,,749,591.71,(21% Off),,,https://www.firstcry.com/babyhug/babyhug-half-sleeves-onesies-tiger-print-pack-of-3-orange-grey/9360142/product-detail
Babyoye Singlet Sleeves Cotton Blend Woven Jumpsuit Ice Cream Print -...,,,899,710.21,(21% Off),,,https://www.firstcry.com/babyoye/babyoye-singlet-sleeves-cotton-blend-woven-jumpsuit-ice-cream-print-pink/8953007/product-detail
Babyhug Sleeveless Ankle Length Jumpsuit Floral Print - Red,,,699,552.21,(21% Off),,,https://www.firstcry.com/babyhug/babyhug-sleeveless-ankle-length-jumpsuit-floral-print-red/9166854/product-detail
Babyhug Short Sleeves Dungarees With Tee Stripes  - Blue Pink,,,899,710.21,(21% Off),,,https://www.firstcry.com/babyhug/babyhug-short-sleeves-dungarees-with-tee-stripes-blue-pink/8444870/product-detail
Babyhug 100% Cotton Half Sleeves Onesie Text Embroidery - Red,,,299,236.21,(21% Off),,,https://www.firstcry.com/babyhug/babyhug-100-cotton-half-sleeves-onesie-text-embroidery-red/8462642/product-detail
Babyhyg Sleeveless Jumpsuit Dragonfly Print - Blue,,,699,552.21,(upto 22% Off),,,https://www.firstcry.com/babyhug/babyhyg-sleeveless-jumpsuit-dragonfly-print-blue/8936026/product-detail
I Bears Half Sleeves Printed Onesies Pack of 3 - Multicolour,,,630,497.7,(upto 21% Off),,,https://www.firstcry.com/i-bears/i-bears-half-sleeves-printed-onesies-pack-of-3-multicolour/9109877/product-detail
I Bears Half Sleeves Rompers Pack of 3 - Multicolour,,,,930,,,,https://www.firstcry.com/i-bears/i-bears-half-sleeves-rompers-pack-of-3-multicolour/9109866/product-detail
I Bears Full Sleeves Rompers Multiprint Pack of 3 - Red Blue,,,990,782.1,(21% Off),,,https://www.firstcry.com/i-bears/i-bears-full-sleeves-rompers-multiprint-pack-of-3-red-blue/3498131/product-detail
I Bears Half Sleeves Onesies Pack of 3 - Multicolor,,,660,521.4,(upto 21% Off),,,https://www.firstcry.com/i-bears/i-bears-half-sleeves-onesies-pack-of-3-multicolor/9169553/product-detail
I Bears Half Sleeves Printed Onesies Pack of 3 - Multicolour,,,630,497.7,(21% Off),,,https://www.firstcry.com/i-bears/i-bears-half-sleeves-printed-onesies-pack-of-3-multicolour/9109867/product-detail
I Bears Full Sleeves Checks & Multi Printed Footed Rompers Set of 3 -...,,,990,782.1,(21% Off),,,https://www.firstcry.com/i-bears/i-bears-full-sleeves-checks-and-multi-printed-footed-rompers-set-of-3-pink-white/8196598/product-detail
Babyhug Flutter Sleeves Jumpsuit Floral Print - Navy Blue,,,499,394.21,(21% Off),,,https://www.firstcry.com/babyhug/babyhug-flutter-sleeves-jumpsuit-floral-print-navy-blue/9089565/product-detail
Babyhug Singlet Sleeves Jumpsuit Floral Print - Pink,,,599,473.21,(21% Off),,,https://www.firstcry.com/babyhug/babyhug-singlet-sleeves-jumpsuit-floral-print-pink/9042979/product-detail
Babyhug 100% Cotton Half Sleeves Onesie Mickey Mouse & Friends...,,,349,275.71,(21% Off),,,https://www.firstcry.com/babyhug/babyhug-100-cotton-half-sleeves-onesie-mickey-mouse-and-friends-print-yellow/8502880/product-detail
