name,badge_1,badge_2,mrp,discounted_price,discount,rating,rating_count,link
I Bears Full Sleeves Striped Romper Floral Print Pack of 3 - Pink White,,,930,716.1,(upto 23% Off),,,https://www.firstcry.com//www.firstcry.com/i-bears/i-bears-full-sleeves-striped-romper-floral-print-pack-of-3-pink-white/3356143/product-detail
Babyoye Singlet Stripe Romper Floral Embroidery - Blue White,,,899,710.21,(21% Off),,,https://www.firstcry.com//www.firstcry.com/babyoye/babyoye-singlet-stripe-romper-floral-embroidery-blue-white/8727326/product-detail
I Bears Half Sleeves Onesies Pack of 3 - Multicolor,,,930,734.7,(21% Off),,,https://www.firstcry.com//www.firstcry.com/i-bears/i-bears-half-sleeves-onesies-pack-of-3-multicolor/9169560/product-detail
Babyhug Flutter Sleeves Romper Floral Print - Navy Blue,,,499,394.21,(21% Off),,,https://www.firstcry.com//www.firstcry.com/babyhug/babyhug-flutter-sleeves-romper-floral-print-navy-blue/8763050/product-detail
I Bears Half Sleeves Onesies Pack of 3 - Multicolor,,,660,521.4,(21% Off),,,https://www.firstcry.com//www.firstcry.com/i-bears/i-bears-half-sleeves-onesies-pack-of-3-multicolor/9169553/product-detail
Babyhug Short Sleeves 100% Cotton Romper Floral Print - White,,,449,354.71,(21% Off),,,https://www.firstcry.com//www.firstcry.com/babyhug/babyhug-short-sleeves-100-cotton-romper-floral-print-white/3439578/product-detail
Babyhug Dungaree with Cap Sleeves Striped Inner Tee Cherry...,,,999,789.21,(21% Off),,,https://www.firstcry.com//www.firstcry.com/babyhug/babyhug-dungaree-with-cap-sleeves-striped-inner-tee-cherry-embroidery-pink/8819218/product-detail
I Bears Half Sleeves Printed Onesies Pack of 3 - Blue,,,630,497.7,(21% Off),,,https://www.firstcry.com//www.firstcry.com/i-bears/i-bears-half-sleeves-printed-onesies-pack-of-3-blue/9109880/product-detail
Babyhug Dungaree Style Romper With Half Sleeves Stripe Tee Winnie...,,,999,789.21,(21% Off),,,https://www.firstcry.com//www.firstcry.com/babyhug/babyhug-dungaree-style-romper-with-half-sleeves-stripe-tee-winnie-the-pooh-print-blue-multicolour/8556604/product-detail
Babyhug Sleeveless Jumpsuit Striped Print - Multicolor,,,499,394.21,(21% Off),,,https://www.firstcry.com//www.firstcry.com/babyhug/babyhug-sleeveless-jumpsuit-striped-print-multicolor/9093328/product-detail
Babyhug Dungaree Style Romper With Half Sleeves Stripe Tee Mickey...,,,999,789.21,(upto 23% Off),,,https://www.firstcry.com//www.firstcry.com/babyhug/babyhug-dungaree-style-romper-with-half-sleeves-stripe-tee-mickey-mouse-print-blue/8556597/product-detail
Babyhug Sleeveless Striped Jumpsuit - Yellow,,,899,710.21,(21% Off),,,https://www.firstcry.com//www.firstcry.com/pine-kids/babyhug-sleeveless-striped-jumpsuit-yellow/9108387/product-detail
Babyhug Flutter Sleeves Jumpsuit Floral Print - Navy Blue,,,499,394.21,(21% Off),,,https://www.firstcry.com//www.firstcry.com/babyhug/babyhug-flutter-sleeves-jumpsuit-floral-print-navy-blue/9041990/product-detail
Babyhug Sleeveless Dungarees With Tee Sharks Print  - Blue,,,799,631.21,(21% Off),,,https://www.firstcry.com//www.firstcry.com/babyhug/babyhug-sleeveless-dungarees-with-tee-sharks-print-blue/8829849/product-detail
Babyhug Short Sleeves Dungarees With Tee Stripes  - Blue Pink,,,899,710.21,(upto 21% Off),,,https://www.firstcry.com//www.firstcry.com/babyhug/babyhug-short-sleeves-dungarees-with-tee-stripes-blue-pink/8444869/product-detail
I Bears Half Sleeves Onesies Pack of 3 - Multicolor,,,660,521.4,(upto 21% Off),,,https://www.firstcry.com//www.firstcry.com/i-bears/i-bears-half-sleeves-onesies-pack-of-3-multicolor/9169563/product-detail
ToffyHouse Half Sleeves Dungarees With Printed Tee  - Grey White,,,795,683.7,(14% Off),,,https://www.firstcry.com//www.firstcry.com/toffyhouse/toffyhouse-half-sleeves-dungarees-with-printed-tee-grey-white/9009952/product-detail
Babyhug Sleeveless Jumpsuit Fruits Print - Yellow,,,499,394.21,(21% Off),,,https://www.firstcry.com//www.firstcry.com/babyhug/babyhug-sleeveless-jumpsuit-fruits-print-yellow/8499240/product-detail
Babyhug Flutter Sleeves Jumpsuit Floral Print - Navy Blue,,,499,394.21,(21% Off),,,https://www.firstcry.com//www.firstcry.com/babyhug/babyhug-flutter-sleeves-jumpsuit-floral-print-navy-blue/9089568/product-detail
Babyhug 100% Cotton Short Sleeves Romper Polka Dot Print - Pink,,,449,354.71,(21% Off),,,https://www.firstcry.com//www.firstcry.com/babyhug/babyhug-100-cotton-short-sleeves-romper-polka-dot-print-pink/9054956/product-detail
Babyhug Singlet Tie & Dye Jumpsuit - Pink White,,,499,394.21,(21% Off),,,https://www.firstcry.com/babyhug/babyhug-singlet-tie-and-dye-jumpsuit-pink-white/9024635/product-detail
Babyhug Knee Length Dungaree with Half Sleeves Inner Tee Tiger...,,,799,631.21,(21% Off),,,https://www.firstcry.com/babyhug/babyhug-knee-length-dungaree-with-half-sleeves-inner-tee-tiger-print-yellow-blue/8581732/product-detail
Babyhug Sleeveless Jumpsuit  - Multicolour,,,599,473.21,(21% Off),,,https://www.firstcry.com/babyhug/babyhug-sleeveless-jumpsuit-multicolour/9024628/product-detail
Babyhug Flutter Sleeves Jumpsuit with Bow - Pink,,,799,631.21,(21% Off),,,https://www.firstcry.com/babyhug/babyhug-flutter-sleeves-jumpsuit-with-bow-pink/9166835/product-detail
Babyhug Cap Sleeves Jumpsuit Floral Embroidery - Light  Blue,,,599,473.21,(21% Off),,,https://www.firstcry.com/babyhug/babyhug-cap-sleeves-jumpsuit-floral-embroidery-light-blue/9255473/product-detail
Babyhug Sleeveless Striped Jumpsuit - Blue,,,799,631.21,(21% Off),,,https://www.firstcry.com/babyhug/babyhug-sleeveless-striped-jumpsuit-blue/9011061/product-detail
Babyhug Half Sleeves Printed 100 % Cotton Onesie - Blue,,,299,236.21,(21% Off),,,https://www.firstcry.com/babyhug/babyhug-half-sleeves-printed-100-cotton-onesie--blue/8465475/product-detail
Babyhug 100% Cotton Sleeveless Frock style Onesie - Pink,,,,299,,,,https://www.firstcry.com/babyhug/babyhug-100-cotton-sleeveless-frock-style-onesie-pink/9084742/product-detail
Babyhug Flutter Sleeves Jumpsuit Floral Print - Pink,,,499,394.21,(21% Off),,,https://www.firstcry.com/babyhug/babyhug-flutter-sleeves-jumpsuit-floral-print-pink/9180106/product-detail
ToffyHouse Corduroy Dungaree Style Romper with Half Sleeves Inner...,,,845,726.7,(14% Off),,,https://www.firstcry.com/toffyhouse/toffyhouse-corduroy-dungaree-style-romper-with-half-sleeves-inner-tee-toucan-print-beige/9010004/product-detail
Babyhug 100% Cotton Half Sleeves Romper Hippo Patch - Dark Red,,,449,354.71,(upto 21% Off),,,https://www.firstcry.com/babyhug/babyhug-100-cotton-half-sleeves-romper-hippo-patch-dark-red/9025778/product-detail
Babyhug 100% Cotton Singlet Frock Style Onesie Text Print - Navy Blue,,,299,236.21,(21% Off),,,https://www.firstcry.com/babyhug/babyhug-100-cotton-singlet-frock-style-onesie-text-print-navy-blue/9084729/product-detail
Babyoye Half Sleeves Biowash Onesie Pack of 7 - Multicolor,,,2299,1816.21,(21% Off),,,https://www.firstcry.com/babyoye/babyoye-half-sleeves-biowash-onesie-pack-of-7-multicolor/8388299/product-detail
Kookie Kids Singlet Sleeves Jumpsuit Polka Dot Print - Blue,,,903,713.37,(21% Off),,,https://www.firstcry.com/kookie-kids/kookie-kids-singlet-sleeves-jumpsuit-polka-dot-print-blue/9023194/product-detail
Babyhug Cotton Sleeveless Jumpsuit Polka Dot Print - Pink,,,499,394.21,(21% Off),,,https://www.firstcry.com/babyhug/babyhug-cotton-sleeveless-jumpsuit-polka-dot-print-pink/8935989/product-detail
Babyoye Cotton Dungaree Style Romper With Half Sleeves Stripe Tee -...,,,1199,947.21,(21% Off),,,https://www.firstcry.com/babyoye/babyoye-cotton-dungaree-style-romper-with-half-sleeves-stripe-tee-navy-orange/8576712/product-detail
Babyhug Singlet Sleeves Jumpsuit Floral Print - Green,,,599,473.21,(21% Off),,,https://www.firstcry.com/babyhug/babyhug-singlet-sleeves-jumpsuit-floral-print-green/3640994/product-detail
Babyhug 100% Cotton Singlet Printed Onesie Butterfly Patch - White...,,,229,180.91,(21% Off),,,https://www.firstcry.com/babyhug/babyhug-100-cotton-singlet-printed-onesie-butterfly-patch-white-orange/9084759/product-detail
I Bears Full Sleeves Onesies Pack Of 3 - Multicolor,,,720,568.8,(21% Off),,,https://www.firstcry.com/i-bears/i-bears-full-sleeves-onesies-pack-of-3-multicolor/8701388/product-detail
Babyhug Sleeveless Jumpsuit Floral Print - Blue,,,599,473.21,(21% Off),,,https://www.firstcry.com/babyhug/babyhug-sleeveless-jumpsuit-floral-print-blue/8602071/product-detail
Babyoye Biowash Sleeveless Onesies Printed Pack of 3 - Multicolour,,,1199,947.21,(21% Off),,,https://www.firstcry.com/babyoye/babyoye-biowash-sleeveless-onesies-printed-pack-of-3-multicolour/8410485/product-detail
Babyhug 100% Cotton Singlet Stripe Onesie Heart Embroidery - Navy Blue,,,229,180.91,(21% Off),,,https://www.firstcry.com/babyhug/babyhug-100-cotton-singlet-stripe-onesie-heart-embroidery-navy-blue/9084750/product-detail
Natilene Sleeveless Striped Jumpsuit - Multi Colour,,,1149,631.95,(45% Off),,,https://www.firstcry.com/natilene/natilene-sleeveless-striped-jumpsuit-multi-colour/9374396/product-detail
Babyoye Cotton  Dungaree Style Romper With Half Sleeves Tee...,,,1199,947.21,(21% Off),,,https://www.firstcry.com/babyoye/babyoye-cotton-dungaree-style-romper-with-half-sleeves-tee-shell-embroidery-pink-blue/8716496/product-detail
Babyhug 100% Cotton Singlet Stripe Onesie Whale Print - Red White,,,229,180.91,(21% Off),,,https://www.firstcry.com/babyhug/babyhug-100-cotton-singlet-stripe-onesie-whale-print-red-white/9084746/product-detail
ToffyHouse Dungaree Style Romper with Half Sleeves Striped Inner...,,,745,640.7,(14% Off),,,https://www.firstcry.com/toffyhouse/toffyhouse-dungaree-style-romper-with-half-sleeves-striped-inner-tee-beige/8655101/product-detail
Babyhug 100% Cotton Full Sleeves Romper - Blue,,,499,394.21,(21% Off),,,https://www.firstcry.com/babyhug/babyhug-100-cotton-full-sleeves-romper-blue/3640017/product-detail
Babyhug 100% Cotton Cap Sleeves Onesie Dot Print - Yellow,,,299,236.21,(21% Off),,,https://www.firstcry.com/babyhug/babyhug-100-cotton-cap-sleeves-onesie-dot-print-yellow/8502856/product-detail
Babyoye 100%Cotton Cap Sleeves Printed Romper - Pink,,,799,631.21,(21% Off),,,https://www.firstcry.com/babyoye/babyoye-100-cotton-cap-sleeves-printed-romper-pink/8514133/product-detail
ToffyHouse Flutter Sleeves Jumpsuit - White & Navy,,,595,511.7,(14% Off),,,https://www.firstcry.com/toffyhouse/toffyhouse-flutter-sleeves-jumpsuit-white-and-navy/9016096/product-detail
Babyoye Cotton Blend Half Sleeves Striped Romper - Orange,,,699,552.21,(21% Off),,,https://www.firstcry.com/babyoye/babyoye-cotton-blend-half-sleeves-striped-romper-orange/8390931/product-detail
I Bears Half Sleeves Rompers Pack of 3 - Multicolour,,,930,734.7,(21% Off),,,https://www.firstcry.com/i-bears/i-bears-half-sleeves-rompers-pack-of-3-multicolour/9109864/product-detail
I Bears Half Sleeves Printed Onesies Pack of 3 - Multicolour,,,630,497.7,(21% Off),,,https://www.firstcry.com/i-bears/i-bears-half-sleeves-printed-onesies-pack-of-3-multicolour/9109872/product-detail
Babyhug 100% Cotton Sleeveless Onesie Roar Print - Blue,,,249,196.71,(upto 24% Off),,,https://www.firstcry.com/babyhug/babyhug-100-cotton-sleeveless-onesie-roar-print-blue/8634073/product-detail
I Bears Full Sleeves Footed Romper Christmas Print Pack of 2 - Red...,,,990,782.1,(21% Off),,,https://www.firstcry.com/i-bears/i-bears-full-sleeves-footed-romper-christmas-print-pack-of-2-red-white/3247710/product-detail
I Bears Half Sleeves Onesies Space Print Pack of 3 - Red Black Grey,,,,660,(upto 21% Off),,,https://www.firstcry.com/i-bears/i-bears-half-sleeves-onesies-space-print-pack-of-3-red-black-grey/8646855/product-detail
Babyhug Dungaree with Flutter Sleeves Striped Inner Tee - Yellow,,,999,789.21,(21% Off),,,https://www.firstcry.com/babyhug/babyhug-dungaree-with-flutter-sleeves-striped-inner-tee-yellow/8819212/product-detail
Babyoye Cotton Dungaree Style Romper With Puff Sleeves Tee Bow...,,,999,789.21,(21% Off),,,https://www.firstcry.com/babyoye/babyoye-cotton-dungaree-style-romper-with-puff-sleeves-tee-bow-applique-pink-white/8514106/product-detail
Babyhug Dungaree With Half Sleeves Tee Printed - Yellow,,,799,631.21,(21% Off),,,https://www.firstcry.com/babyhug/babyhug-dungaree-with-half-sleeves-tee-printed-yellow/8581727/product-detail
Babyhug Full Sleeves Winter Wear Romper Penguin Patch - Grey,,,999,789.21,(21% Off),,,https://www.firstcry.com/babyhug/babyhug-full-sleeves-winter-wear-romper-penguin-patch-grey/9269009/product-detail
Babyhug 100% Cotton Sleeveless Onesie Floral Print - Blue,,,349,275.71,(21% Off),,,https://www.firstcry.com/babyhug/babyhug-100-cotton-sleeveless-onesie-floral-print-blue/9055448/product-detail
Babyhug Cotton Short Sleeves Onesie Bird Print Pack of 5 - Multicolor,,,1149,907.71,(21% Off),,,https://www.firstcry.com/babyhug/babyhug-cotton-short-sleeves-onesie-bird-print-pack-of-5-multicolor/3523332/product-detail
Babyhug Singlet Sleeves Jumpsuit Apple Print - Peach,,,499,394.21,(21% Off),,,https://www.firstcry.com/babyhug/babyhug-singlet-sleeves-jumpsuit-apple-print-peach/8965110/product-detail
Babyhug 100% Cotton Singlet Romper Floral Print - Pink White,,,399,315.21,(21% Off),,,https://www.firstcry.com/babyhug/babyhug-100-cotton-singlet-romper-floral-print-pink-white/3439558/product-detail
Babyhug 100% Cotton Sleeveless Onesie Floral Print - Yellow,,,349,275.71,(21% Off),,,https://www.firstcry.com/babyhug/babyhug-100-cotton-sleeveless-onesie-floral-print-yellow/9055450/product-detail
I Bears Full Sleeves Multi Printed Onesies Pack of 3 - Red Black Grey,,,720,568.8,(21% Off),,,https://www.firstcry.com/i-bears/i-bears-full-sleeves-multi-printed-onesies-pack-of-3-red-black-grey/8499665/product-detail
Babyhug Dungaree with Cap Sleeves Inner Tee Polka Dot Print - White...,,,899,710.21,(21% Off),,,https://www.firstcry.com/babyhug/babyhug-dungaree-with-cap-sleeves-inner-tee-polka-dot-print-white-pink/8766197/product-detail
Babyhug Denim Dungaree With Short Sleeves Tee Butterfly Print -...,,,999,789.21,(21% Off),,,https://www.firstcry.com/babyhug/babyhug-denim-dungaree-with-short-sleeves-tee-butterfly-print-blue-yellow/8789234/product-detail
Babyhug Dungaree with Striped Inner Tee Vehicle Print - Beige & Red,,,999,789.21,(21% Off),,,https://www.firstcry.com/babyhug/babyhug-dungaree-with-striped-inner-tee-vehicle-print-beige-and-red/8597511/product-detail
Babyhug 100% Cotton Half Sleeves Romper Car Print - White,,,399,315.21,(21% Off),,,https://www.firstcry.com/babyhug/babyhug-100-cotton-half-sleeves-romper-car-print-white/9025787/product-detail
Babyhug Sleeveless Jumpsuit Polka Dot Print - Coral,,,799,631.21,(21% Off),,,https://www.firstcry.com/babyhug/babyhug-sleeveless-jumpsuit-polka-dot-print-coral/8763274/product-detail
Pine Kids Full Length Jumpsuit - Yellow,,,999,789.21,(21% Off),,,https://www.firstcry.com/pine-kids/pine-kids-full-length-jumpsuit-yellow/9108380/product-detail
Babyoye Full Sleeves Striped & Printed Romper Pack of 2 - Orange,,,1399,1049.25,(upto 25% Off),,,https://www.firstcry.com/babyoye/babyoye-full-sleeves-striped-and-printed-romper-pack-of-2-orange/8390984/product-detail
Babyhug 100% Cotton Onesie Pack of 5 - White,,,1149,988.14,(upto 23% Off),,,https://www.firstcry.com/babyhug/babyhug-100-cotton-onesie-pack-of-5-white/8265419/product-detail
Babyhug Half Sleeves Dungarees With Tee Star Print  - Blue,,,999,789.21,(21% Off),,,https://www.firstcry.com/babyhug/babyhug-half-sleeves-dungarees-with-tee-star-print-blue/8953915/product-detail
Babyhug 100% Cotton Half Sleeves Rompers Pack of 2 - Blue White,,,699,629.1,(10% Off),,,https://www.firstcry.com/babyhug/babyhug-100-cotton-half-sleeves-rompers-pack-of-2-blue-white/8524631/product-detail
Babyhug Half Sleeves Onesie Stripes - Blue,,,299,236.21,(21% Off),,,https://www.firstcry.com/babyhug/babyhug-half-sleeves-onesie-stripes-blue/8462634/product-detail
Babyhug Half Sleeves Romper Animals Print - White,,,399,315.21,(21% Off),,,https://www.firstcry.com/babyhug/babyhug-half-sleeves-romper-animals-print-white/8914342/product-detail
Babyoye Sleeveless Jumpsuits Dots Print - Red,,,899,710.21,(21% Off),,,https://www.firstcry.com/babyoye/babyoye-sleeveless-jumpsuits-dots-print-red/8748349/product-detail
Babyhug Singlet Tie Knot Style Jumpsuit - Peach,,,799,631.21,(21% Off),,,https://www.firstcry.com/babyhug/babyhug-singlet-tie-knot-style-jumpsuit-peach/8763290/product-detail
Babyhug Knee Length Dungaree With Inner T-Shirt - Pink,,,999,789.21,(21% Off),,,https://www.firstcry.com/babyhug/babyhug-knee-length-dungaree-with-inner-t-shirt-pink/8766205/product-detail
I Bears Half Sleeves Printed Onesies Pack of 3 - Multicolour,,,630,497.7,(21% Off),,,https://www.firstcry.com/i-bears/i-bears-half-sleeves-printed-onesies-pack-of-3-multicolour/9109869/product-detail
I Bears Half Sleeves Onesies Pack of 3 - Multicolor,,,660,521.4,(21% Off),,,https://www.firstcry.com/i-bears/i-bears-half-sleeves-onesies-pack-of-3-multicolor/9169558/product-detail
Babyhug Sleeveless Jumpsuit Striped - Red,,,699,552.21,(21% Off),,,https://www.firstcry.com/babyhug/babyhug-sleeveless-jumpsuit-striped-red/9111247/product-detail
Babyhug Denim Dungaree with Striped Inner Tee - Blue Multicolor,,,999,619.38,(upto 38% Off),,,https://www.firstcry.com/babyhug/babyhug-denim-dungaree-with-striped-inner-tee-blue-multicolor/8290615/product-detail
Babyhug Sleeveless Jumpsuit Floral Print - Blue,,,699,552.21,(21% Off),,,https://www.firstcry.com/babyhug/babyhug-sleeveless-jumpsuit-floral-print-blue/9024618/product-detail
Babyhug Cotton Sleeveless Jumpsuit - Multicolo,,,699,552.21,(21% Off),,,https://www.firstcry.com/babyhug/babyhug-cotton-sleeveless-jumpsuit-multicolo/8999707/product-detail
I Bears Half Sleeves Checks & Koala Printed Onesies Pack of 3 - Pink...,,,,570,,,,https://www.firstcry.com/i-bears/i-bears-half-sleeves-checks-and-koala-printed-onesies-pack-of-3-pink-sea-green/3584931/product-detail
Babyhug Floral Printed Corduroy Dungaree & Full Sleeves Top -...,,,1199,755.37,(upto 42% Off),,,https://www.firstcry.com/babyhug/babyhug-floral-printed-corduroy-dungaree-and-full-sleeves-top-pink-blue/8197562/product-detail
Babyhug 100% Cotton Onesie Mommy's Girl Print - Peach,,,299,236.21,(21% Off),,,https://www.firstcry.com/babyhug/babyhug-100-cotton-onesie-mommys-girl-print-peach/3029900/product-detail
Pine Kids Singlet Sleeves Striped Jumpsuit - Pink,,,1199,947.21,(21% Off),,,https://www.firstcry.com/pine-kids/pine-kids-singlet-sleeves-striped-jumpsuit-pink/9108042/product-detail
Babyhug 100% Cotton Flutter Sleeves Onesie Bug Print - Red,,,,349,,,,https://www.firstcry.com/babyhug/babyhug-100-cotton-flutter-sleeves-onesie-bug-print-red/8502915/product-detail
Babyhug Knee Length Dungaree With Inner T-Shirt - Red,,,999,789.21,(21% Off),,,https://www.firstcry.com/babyhug/babyhug-knee-length-dungaree-with-inner-t-shirt-red/8556594/product-detail
Mark & Mia Sleeveless Frock style Onesie Bead Embellished - White,,,1495,1181.05,(21% Off),,,https://www.firstcry.com/mark-and-mia/mark-and-mia-sleeveless-frock-style-onesie-bead-embellished-white/9179780/product-detail
I Bears Full Sleeves Footed Rompers Pack of 3 - Purple White,,,1140,900.6,(21% Off),,,https://www.firstcry.com/i-bears/i-bears-full-sleeves-footed-rompers-pack-of-3-purple-white/8884343/product-detail
I Bears Half Sleeves Onesie Llama Print Pack of 3 - Peach Blue,,,660,521.4,(21% Off),,,https://www.firstcry.com/i-bears/i-bears-half-sleeves-onesie-llama-print-pack-of-3-peach-blue/8980838/product-detail
I Bears Half Sleeves Onesie Vehicle & Star Print Pack of 3 - Blue,,,660,521.4,(21% Off),,,https://www.firstcry.com/i-bears/i-bears-half-sleeves-onesie-vehicle-and-star-print-pack-of-3-blue/8947290/product-detail
Babyhug Full Sleeves 100% Cotton Romper Animal Print - White Orange,,,499,394.21,(21% Off),,,https://www.firstcry.com/babyhug/babyhug-full-sleeves-100-cotton-romper-animal-print-white-orange/8634103/product-detail
Babyhug Sleeveless Dungarees With Tee Checks - Grey Navy Blue,,,999,789.21,(21% Off),,,https://www.firstcry.com/babyhug/babyhug-sleeveless-dungarees-with-tee-checks-grey-navy-blue/8936079/product-detail
Babyhug Half Sleeves 100% Cotton Romper Polka Dot Print - Navy Blue,,,449,354.71,(21% Off),,,https://www.firstcry.com/babyhug/babyhug-half-sleeves-100-cotton-romper-polka-dot-print-navy-blue/9054946/product-detail
