name,badge_1,badge_2,mrp,discounted_price,discount,rating,rating_count,link
Babyhug Full Sleeves 100% Cotton Onesie Mickey Mouse Print - Blue,,,349,275.71,(21% Off),,,https://www.firstcry.com//www.firstcry.com/babyhug/babyhug-full-sleeves-100-cotton-onesie-mickey-mouse-print-blue/9441826/product-detail
Wow Clothes Denim Dungaree with Half Sleeves Inner Tee Bird Print -...,,,910,718.9,(21% Off),,,https://www.firstcry.com//www.firstcry.com/wow-clothes/wow-clothes-denim-dungaree-with-half-sleeves-inner-tee-bird-print-white/9055612/product-detail
Babyhug Half Sleeves 100% Cotton Onesie Car Print - Red White,,,299,236.21,(21% Off),,,https://www.firstcry.com//www.firstcry.com/babyhug/babyhug-half-sleeves-100-cotton-onesie-car-print-red-white/9441818/product-detail
Wow Clothes Denim Dungaree with Half Sleeves Inner Tee Bird Print - Pink,,,910,718.9,(21% Off),,,https://www.firstcry.com//www.firstcry.com/wow-clothes/wow-clothes-denim-dungaree-with-half-sleeves-inner-tee-bird-print-pink/9055615/product-detail
First Smile Dungaree Style Romper with Half Sleeve Inner Tee Bear...,,,549,433.71,(21% Off),,,https://www.firstcry.com//www.firstcry.com/first-smile/first-smile-dungaree-style-romper-with-half-sleeve-inner-tee-bear-print-blue/9107166/product-detail
First Smile Dungaree Style Romper with Half Sleeve Inner Tee Bear...,,,549,433.71,(21% Off),,,https://www.firstcry.com//www.firstcry.com/first-smile/first-smile-dungaree-style-romper-with-half-sleeve-inner-tee-bear-print-pink/9107164/product-detail
Babyhug 100% Cotton Short Sleeves Romper Polka Dot Print - Pink,,,449,354.71,(21% Off),,,https://www.firstcry.com//www.firstcry.com/babyhug/babyhug-100-cotton-short-sleeves-romper-polka-dot-print-pink/9054955/product-detail
Babyhug Short Sleeves Dungarees With Tee Stripes  - Blue Pink,,,899,710.21,(21% Off),,,https://www.firstcry.com//www.firstcry.com/babyhug/babyhug-short-sleeves-dungarees-with-tee-stripes-blue-pink/8444866/product-detail
Pine Kids Sleeveless Striped Jumpsuit - Yellow,,,999,789.21,(21% Off),,,https://www.firstcry.com//www.firstcry.com/pine-kids/pine-kids-sleeveless-striped-jumpsuit-yellow/9108392/product-detail
Babyhug Sleeveless Jumpsuit Fruits Print - Yellow,,,499,394.21,(21% Off),,,https://www.firstcry.com//www.firstcry.com/babyhug/babyhug-sleeveless-jumpsuit-fruits-print-yellow/8499241/product-detail
Babyhug Knee Length Dungaree with Half Sleeves Inner Tee Tiger...,,,799,631.21,(21% Off),,,https://www.firstcry.com//www.firstcry.com/babyhug/babyhug-knee-length-dungaree-with-half-sleeves-inner-tee-tiger-print-yellow-blue/8581733/product-detail
I Bears Half Sleeves Onesies Pack of 3 - Multicolor,,,660,521.4,(21% Off),,,https://www.firstcry.com//www.firstcry.com/i-bears/i-bears-half-sleeves-onesies-pack-of-3-multicolor/9169558/product-detail
I Bears Half Sleeves Onesies Pack of 3 - Multicolor,,,660,521.4,(21% Off),,,https://www.firstcry.com//www.firstcry.com/i-bears/i-bears-half-sleeves-onesies-pack-of-3-multicolor/9169564/product-detail
Babyoye Half Sleeves Party Romper - Multiicolor,,,799,631.21,(21% Off),,,https://www.firstcry.com//www.firstcry.com/babyoye/babyoye-half-sleeves-party-romper-multiicolor/8573780/product-detail
I Bears Half Sleeves Printed Onesies Pack of 3 - Blue,,,630,497.7,(21% Off),,,https://www.firstcry.com//www.firstcry.com/i-bears/i-bears-half-sleeves-printed-onesies-pack-of-3-blue/9109881/product-detail
Babyhug Singlet Tie & Dye Jumpsuit - Pink White,,,499,394.21,(21% Off),,,https://www.firstcry.com//www.firstcry.com/babyhug/babyhug-singlet-tie-and-dye-jumpsuit-pink-white/9024632/product-detail
Babyhug Flutter Sleeves Jumpsuit with Bow - Pink,,,799,631.21,(21% Off),,,https://www.firstcry.com//www.firstcry.com/babyhug/babyhug-flutter-sleeves-jumpsuit-with-bow-pink/9166835/product-detail
Babyoye Full Length Dungaree With Inner T-Shirt - Red White,,,1099,868.21,(21% Off),,,https://www.firstcry.com//www.firstcry.com/babyoye/babyoye-full-length-dungaree-with-inner-t-shirt-red-white/9237630/product-detail
Babyoye Dungaree with Half Sleeves Striped Inner Tee Koala Print -...,,,999,789.21,(21% Off),,,https://www.firstcry.com//www.firstcry.com/babyoye/babyoye-dungaree-with-half-sleeves-striped-inner-tee-koala-print-yellow/9039589/product-detail
I Bears Full Sleeves Footed Romper Christmas Print Pack of 2 - Red...,,,990,782.1,(21% Off),,,https://www.firstcry.com//www.firstcry.com/i-bears/i-bears-full-sleeves-footed-romper-christmas-print-pack-of-2-red-white/3247709/product-detail
Babyhug Short Sleeves Frock Style Onesie Minnie Mouse Print - Pink,,,449,354.71,(21% Off),,,https://www.firstcry.com/babyhug/babyhug-short-sleeves-frock-style-onesie-minnie-mouse-print-pink/9173789/product-detail
Babyhug Half Sleeves Onesies Multiprint Pack of 3 - Yellow...,,,749,591.71,(21% Off),,,https://www.firstcry.com/babyhug/babyhug-half-sleeves-onesies-multiprint-pack-of-3-yellow-light-grey-navy-blue/9360144/product-detail
I Bears Full Sleeves Checks & Multi Printed Footed Rompers Set of 3 -...,,,990,782.1,(21% Off),,,https://www.firstcry.com/i-bears/i-bears-full-sleeves-checks-and-multi-printed-footed-rompers-set-of-3-pink-white/8196598/product-detail
Babyhug Flutter Sleeves Jumpsuit Floral Print - Pink,,,499,394.21,(21% Off),,,https://www.firstcry.com/babyhug/babyhug-flutter-sleeves-jumpsuit-floral-print-pink/9180107/product-detail
Babyoye Sleeveless Jumpsuit - White,,,899,710.21,(upto 23% Off),,,https://www.firstcry.com/babyoye/babyoye-sleeveless-jumpsuit-white/8727320/product-detail
I Bears Full Sleeves Rompers Multiprint Pack of 3 - Red Blue,,,990,782.1,(21% Off),,,https://www.firstcry.com/i-bears/i-bears-full-sleeves-rompers-multiprint-pack-of-3-red-blue/3498130/product-detail
Babyhug Sleeveless Jumpsuit Floral Print - Pink,,,499,389.22,(upto 24% Off),,,https://www.firstcry.com/babyhug/babyhug-sleeveless-jumpsuit-floral-print-pink/9058822/product-detail
I Bears Full Sleeves Footed Rompers Pack of 3 - Purple White,,,1140,900.6,(21% Off),,,https://www.firstcry.com/i-bears/i-bears-full-sleeves-footed-rompers-pack-of-3-purple-white/8884343/product-detail
Babyhug Cotton Sleeveless Jumpsuit - Multicolo,,,699,545.22,(upto 22% Off),,,https://www.firstcry.com/babyhug/babyhug-cotton-sleeveless-jumpsuit-multicolo/8999710/product-detail
Babyhug Cap Sleeves Jumpsuit Floral Embroidery - Light  Blue,,,599,473.21,(21% Off),,,https://www.firstcry.com/babyhug/babyhug-cap-sleeves-jumpsuit-floral-embroidery-light-blue/9255476/product-detail
Babyhug Full Sleeves 100% Cotton Romper Elephant Patch - Blue,,,499,394.21,(21% Off),,,https://www.firstcry.com/babyhug/babyhug-full-sleeves-100-cotton-romper-elephant-patch-blue/8976282/product-detail
Babyhug Sleeveless Striped Jumpsuit - Blue,,,799,631.21,(21% Off),,,https://www.firstcry.com/babyhug/babyhug-sleeveless-striped-jumpsuit-blue/9011060/product-detail
Babyhug Half Sleeves 100% Cotton Onesies Animal Print Pack of 5 -...,,,1199,947.21,(21% Off),,,https://www.firstcry.com/babyhug/babyhug-half-sleeves-100-cotton-onesies-animal-print-pack-of-5-multiprint/8988524/product-detail
Babyhug Cold Shoulder Jumpsuit Polka Dot Print - Navy Blue,,,699,538.23,(upto 23% Off),,,https://www.firstcry.com/babyhug/babyhug-cold-shoulder-jumpsuit-polka-dot-print-navy-blue/3467042/product-detail
Babyhug 100% Cotton Full Sleeves Romper - Blue,,,499,374.25,(upto 25% Off),,,https://www.firstcry.com/babyhug/babyhug-100-cotton-full-sleeves-romper-blue/3640019/product-detail
Babyhug 100% Cotton Sleeveless Onesie Roar Print - Blue,,,249,179.28,(upto 28% Off),,,https://www.firstcry.com/babyhug/babyhug-100-cotton-sleeveless-onesie-roar-print-blue/8634077/product-detail
Babyhug Dungaree With Half Sleeves Tee Printed - Yellow,,,799,631.21,(21% Off),,,https://www.firstcry.com/babyhug/babyhug-dungaree-with-half-sleeves-tee-printed-yellow/8581727/product-detail
Babyhug Sleeveless Jumpsuit Floral Print - Blue,,,699,552.21,(21% Off),,,https://www.firstcry.com/babyhug/babyhug-sleeveless-jumpsuit-floral-print-blue/9024618/product-detail
Babyhug Flutter Sleeves Romper Floral Print - Navy Blue,,,499,394.21,(21% Off),,,https://www.firstcry.com/babyhug/babyhug-flutter-sleeves-romper-floral-print-navy-blue/8763046/product-detail
Babyhug Half Sleeves Printed 100 % Cotton Onesie - Blue,,,299,236.21,(21% Off),,,https://www.firstcry.com/babyhug/babyhug-half-sleeves-printed-100-cotton-onesie--blue/8465473/product-detail
Pine Kids Sleeveless Jumpsuit Floral Embroidery - Pink,,,899,710.21,(upto 23% Off),,,https://www.firstcry.com/pine-kids/pine-kids-sleeveless-jumpsuit-floral-embroidery-pink/8875218/product-detail
Babyhug Denim Dungaree with Striped Inner Tee - Blue Multicolor,,,999,689.31,(upto 31% Off),,,https://www.firstcry.com/babyhug/babyhug-denim-dungaree-with-striped-inner-tee-blue-multicolor/8290615/product-detail
Babyhug Sleeveless Dungarees With Tee Sharks Print  - Blue,,,799,631.21,(21% Off),,,https://www.firstcry.com/babyhug/babyhug-sleeveless-dungarees-with-tee-sharks-print-blue/8829851/product-detail
Babyoye Full Sleeves Striped & Printed Romper Pack of 2 - Orange,,,1399,1105.21,(21% Off),,,https://www.firstcry.com/babyoye/babyoye-full-sleeves-striped-and-printed-romper-pack-of-2-orange/8390979/product-detail
Babyhug 100% Cotton Sleeveless Onesie Floral Print - Yellow,,,349,275.71,(21% Off),,,https://www.firstcry.com/babyhug/babyhug-100-cotton-sleeveless-onesie-floral-print-yellow/9055452/product-detail
Babyhug Short Sleeves 100% Cotton Romper Floral Print - White,,,449,354.71,(21% Off),,,https://www.firstcry.com/babyhug/babyhug-short-sleeves-100-cotton-romper-floral-print-white/3439578/product-detail
Babyhug 100% Cotton Sleeveless Onesie Floral Print - Blue,,,349,275.71,(21% Off),,,https://www.firstcry.com/babyhug/babyhug-100-cotton-sleeveless-onesie-floral-print-blue/9055448/product-detail
Babyhug 100% Cotton Singlet Romper Floral Print - Pink White,,,399,315.21,(21% Off),,,https://www.firstcry.com/babyhug/babyhug-100-cotton-singlet-romper-floral-print-pink-white/3439560/product-detail
Babyoye Singlet Stripe Romper Floral Embroidery - Blue White,,,899,710.21,(upto 23% Off),,,https://www.firstcry.com/babyoye/babyoye-singlet-stripe-romper-floral-embroidery-blue-white/8727328/product-detail
Babyhug Half Sleeves T-shirt and Dungaree Set - Orange,,,999,779.22,(22% Off),,,https://www.firstcry.com/babyhug/babyhug-half-sleeves-t-shirt-and-dungaree-set-orange/8849759/product-detail
I Bears Full Sleeves Multi Printed Onesies Pack of 3 - Red Black Grey,,,720,568.8,(21% Off),,,https://www.firstcry.com/i-bears/i-bears-full-sleeves-multi-printed-onesies-pack-of-3-red-black-grey/8499664/product-detail
Dew Drops Half Sleeves Jumpsuit Bird Print - Blue,,,499,434.13,(13% Off),,,https://www.firstcry.com/dew-drops/dew-drops-half-sleeves-jumpsuit-bird-print-blue/9210804/product-detail
Babyhug Floral Printed Corduroy Dungaree & Full Sleeves Top -...,,,1199,839.3,(upto 31% Off),,,https://www.firstcry.com/babyhug/babyhug-floral-printed-corduroy-dungaree-and-full-sleeves-top-pink-blue/8197560/product-detail
Babyhug Half Sleeves Romper Animals Print - White,,,399,315.21,(21% Off),,,https://www.firstcry.com/babyhug/babyhug-half-sleeves-romper-animals-print-white/8914339/product-detail
Babyhug Half Sleeves Dungarees With Tee Star Print  - Blue,,,999,789.21,(21% Off),,,https://www.firstcry.com/babyhug/babyhug-half-sleeves-dungarees-with-tee-star-print-blue/8953918/product-detail
Babyhug Full Sleeves 100% Cotton Romper Animal Print - White Orange,,,499,394.21,(21% Off),,,https://www.firstcry.com/babyhug/babyhug-full-sleeves-100-cotton-romper-animal-print-white-orange/8634102/product-detail
Babyhug 100% Cotton Onesie Pack of 5 - White,,,1149,988.14,(14% Off),,,https://www.firstcry.com/babyhug/babyhug-100-cotton-onesie-pack-of-5-white/8265420/product-detail
Babyhug 100% Cotton Onesie Mommy's Girl Print - Peach,,,299,236.21,(21% Off),,,https://www.firstcry.com/babyhug/babyhug-100-cotton-onesie-mommys-girl-print-peach/3029901/product-detail
Babyhug Cold Shoulder Jumpsuit Floral Print - Yellow,,,599,473.21,(upto 24% Off),,,https://www.firstcry.com/babyhug/babyhug-cold-shoulder-jumpsuit-floral-print-yellow/9042984/product-detail
Babyhug Half Sleeves Dungaree with Inner Tee - Pink,,,699,552.21,(21% Off),,,https://www.firstcry.com/babyhug/babyhug-half-sleeves-dungaree-with-inner-tee-pink/8564872/product-detail
Babyhug Half Sleeves 100% Cotton Romper Polka Dot Print - Navy Blue,,,449,354.71,(21% Off),,,https://www.firstcry.com/babyhug/babyhug-half-sleeves-100-cotton-romper-polka-dot-print-navy-blue/9054948/product-detail
Pine Kids Full Length Jumpsuit - Yellow,,,1099,868.21,(21% Off),,,https://www.firstcry.com/pine-kids/pine-kids-full-length-jumpsuit-yellow/9108382/product-detail
Babyoye Sleeveless Jumpsuits Dots Print - Red,,,899,692.23,(upto 23% Off),,,https://www.firstcry.com/babyoye/babyoye-sleeveless-jumpsuits-dots-print-red/8748351/product-detail
Babyhug 100% Cotton Sleeveless Frock style Onesie - Pink,,,299,236.21,(21% Off),,,https://www.firstcry.com/babyhug/babyhug-100-cotton-sleeveless-frock-style-onesie-pink/9084743/product-detail
Babyhug Knee Length Dungaree With Inner T-Shirt - Blue,,,999,769.23,(upto 23% Off),,,https://www.firstcry.com/babyhug/babyhug-knee-length-dungaree-with-inner-t-shirt-blue/8819214/product-detail
Babyhug Sleeveless Jumpsuit Striped - Red,,,699,552.21,(21% Off),,,https://www.firstcry.com/babyhug/babyhug-sleeveless-jumpsuit-striped-red/9111248/product-detail
Babyoye Full Sleeves Rompers Unicorn Print Pack of 2 - Navy Blue Pink,,,1199,803.33,(33% Off),,,https://www.firstcry.com/babyoye/babyoye-full-sleeves-rompers-unicorn-print-pack-of-2-navy-blue-pink/8112389/product-detail
I Bears Half Sleeves Romper Rainbow Print Pack of 3 - Pink,,,930,734.7,(21% Off),,,https://www.firstcry.com/i-bears/i-bears-half-sleeves-romper-rainbow-print-pack-of-3-pink/8980847/product-detail
Babyhug Denim Dungaree With Short Sleeves Tee Butterfly Print -...,,,999,789.21,(21% Off),,,https://www.firstcry.com/babyhug/babyhug-denim-dungaree-with-short-sleeves-tee-butterfly-print-blue-yellow/8789235/product-detail
I Bears Full Sleeves Onesies Pack Of 3 - Multicolor,,,720,568.8,(21% Off),,,https://www.firstcry.com/i-bears/i-bears-full-sleeves-onesies-pack-of-3-multicolor/8701388/product-detail
Babyoye Full Sleeves Embroidered Onesie with Skeggings - Pink,,,999,649.35,(35% Off),,,https://www.firstcry.com/babyoye/babyoye-full-sleeves-embroidered-onesie-with-skeggings-pink/8153481/product-detail
Babyhug Singlet Tie Knot Style Jumpsuit - Peach,,,799,607.24,(upto 24% Off),,,https://www.firstcry.com/babyhug/babyhug-singlet-tie-knot-style-jumpsuit-peach/8763288/product-detail
Babyhug  Sleeveless Polka Dot Jumpsuit  Bow Applique - Navy Blue,,,499,389.22,(upto 23% Off),,,https://www.firstcry.com/babyhug/babyhug-sleeveless-polka-dot-jumpsuit--bow-applique-navy-blue/8601429/product-detail
Babyhug Dungaree Style Romper With Half Sleeves Stripe Tee Winnie...,,,999,789.21,(upto 24% Off),,,https://www.firstcry.com/babyhug/babyhug-dungaree-style-romper-with-half-sleeves-stripe-tee-winnie-the-pooh-print-blue-multicolour/8556602/product-detail
Babyhug 100% Cotton Sleeveless Onesie - Blue,,,229,180.91,(21% Off),,,https://www.firstcry.com/babyhug/babyhug-100-cotton-sleeveless-onesie-blue/9084738/product-detail
I Bears Full Sleeves Striped Romper Floral Print Pack of 3 - Pink White,,,930,734.7,(upto 23% Off),,,https://www.firstcry.com/i-bears/i-bears-full-sleeves-striped-romper-floral-print-pack-of-3-pink-white/3356144/product-detail
Babyhug Dungaree with Cap Sleeves Striped Inner Tee Cherry...,,,999,789.21,(21% Off),,,https://www.firstcry.com/babyhug/babyhug-dungaree-with-cap-sleeves-striped-inner-tee-cherry-embroidery-red-blue/8819219/product-detail
Babyhug Cotton Half Sleeves Romper Crab Print - Light Grey,,,499,394.21,(upto 22% Off),,,https://www.firstcry.com/babyhug/babyhug-cotton-half-sleeves-romper-crab-print-light-grey/8976276/product-detail
I Bears Half Sleeves Onesie Llama Print Pack of 3 - Peach Blue,,,660,521.4,(21% Off),,,https://www.firstcry.com/i-bears/i-bears-half-sleeves-onesie-llama-print-pack-of-3-peach-blue/8980840/product-detail
Babyhug Sleeveless Dungarees With Tee Checks - Grey Navy Blue,,,999,789.21,(upto 22% Off),,,https://www.firstcry.com/babyhug/babyhug-sleeveless-dungarees-with-tee-checks-grey-navy-blue/8936081/product-detail
Dew Drops Half Sleeves Jumpsuit Bird Print - Dark Blue,,,499,434.13,(13% Off),,,https://www.firstcry.com/dew-drops/dew-drops-half-sleeves-jumpsuit-bird-print-dark-blue/9210801/product-detail
Babyhug Sleeveless Jumpsuit Striped Print - Multicolor,,,499,394.21,(upto 25% Off),,,https://www.firstcry.com/babyhug/babyhug-sleeveless-jumpsuit-striped-print-multicolor/9093328/product-detail
I Bears Half Sleeves Printed Onesies Pack of 3 - Multicolour,,,630,497.7,(21% Off),,,https://www.firstcry.com/i-bears/i-bears-half-sleeves-printed-onesies-pack-of-3-multicolour/9109878/product-detail
Pine Kids Singlet Sleeves Striped Jumpsuit - Pink,,,1199,947.21,(21% Off),,,https://www.firstcry.com/pine-kids/pine-kids-singlet-sleeves-striped-jumpsuit-pink/9108041/product-detail
I Bears Full Sleeves Romper Pack of 2 - Black Blue,,,800,632,(21% Off),,,https://www.firstcry.com/i-bears/i-bears-full-sleeves-romper-pack-of-2-black-blue/9381807/product-detail
I Bears Half Sleeves Printed Onesies Pack of 3 - Multicolour,,,630,497.7,(21% Off),,,https://www.firstcry.com/i-bears/i-bears-half-sleeves-printed-onesies-pack-of-3-multicolour/9109871/product-detail
Babyhug Half Sleeves Onesies Tiger Print Pack of 3 - Orange Grey,,,749,591.71,(21% Off),,,https://www.firstcry.com/babyhug/babyhug-half-sleeves-onesies-tiger-print-pack-of-3-orange-grey/9360139/product-detail
Babyhug Dungaree with Short Sleeves Inner Tee - Pink,,,999,789.21,(21% Off),,,https://www.firstcry.com/babyhug/babyhug-dungaree-with-short-sleeves-inner-tee-pink/8789249/product-detail
I Bears Half Sleeves Striped Romper Boat Print Pack of 3 - Blue White,,,600,474,(upto 23% Off),,,https://www.firstcry.com/i-bears/i-bears-half-sleeves-striped-romper-boat-print-pack-of-3-blue-white/3356102/product-detail
I Bears Half Sleeves Rompers Pack of 3 - Multicolour,,,930,734.7,(21% Off),,,https://www.firstcry.com/i-bears/i-bears-half-sleeves-rompers-pack-of-3-multicolour/9109866/product-detail
Babyhug 100% Cotton Cap Sleeves Onesies Multiprint Pack of 3 -...,,,749,591.71,(upto 23% Off),,,https://www.firstcry.com/babyhug/babyhug-100-cotton-cap-sleeves-onesies-multiprint-pack-of-3-blue-pink-white/3439614/product-detail
Babyhug 100% Cotton Half Sleeves Onesie Text Embroidery - Red,,,299,236.21,(21% Off),,,https://www.firstcry.com/babyhug/babyhug-100-cotton-half-sleeves-onesie-text-embroidery-red/8462640/product-detail
Babyhug 100% Cotton Half Sleeves Onesie Mickey Mouse & Friends...,,,349,275.71,(21% Off),,,https://www.firstcry.com/babyhug/babyhug-100-cotton-half-sleeves-onesie-mickey-mouse-and-friends-print-yellow/8502885/product-detail
Babyoye Striped Biowash Dungaree with Full Sleeves Inner Tee Palm...,,,1099,846.23,(upto 28% Off),,,https://www.firstcry.com/babyoye/babyoye-striped-biowash-dungaree-with-full-sleeves-inner-tee-palm-tree-print-blue-orange/8391107/product-detail
Babyhug 100% Cotton Sleeveless Romper Polka Dot Print - Pink,,,449,354.71,(upto 22% Off),,,https://www.firstcry.com/babyhug/babyhug-100-cotton-sleeveless-romper-polka-dot-print-pink/9054792/product-detail
Babyoye Singlet Sleeves Cotton Blend Woven Jumpsuit Ice Cream Print -...,,,899,710.21,(21% Off),,,https://www.firstcry.com/babyoye/babyoye-singlet-sleeves-cotton-blend-woven-jumpsuit-ice-cream-print-pink/8953007/product-detail
I Bears Full Sleeves Onesies Pack of 3 - Blue White Orange,,,720,568.8,(21% Off),,,https://www.firstcry.com/i-bears/i-bears-full-sleeves-onesies-pack-of-3-blue-white-orange/9381804/product-detail
Babyhug Half Sleeves Onesie Mickey Mouse Print - Blue Grey,,,399,315.21,(21% Off),,,https://www.firstcry.com/babyhug/babyhug-half-sleeves-onesie-mickey-mouse-print-blue-grey/9173784/product-detail
Babyhug 100% Cotton Puff Sleeves Onesies Pack of 5 - Multicolour,,,1199,947.21,(21% Off),,,https://www.firstcry.com/babyhug/babyhug-100-cotton-puff-sleeves-onesies-pack-of-5-multicolour/8502806/product-detail
I Bears Half Sleeves Printed Onesies Pack of 3 - Multicolour,,,630,497.7,(21% Off),,,https://www.firstcry.com/i-bears/i-bears-half-sleeves-printed-onesies-pack-of-3-multicolour/9109868/product-detail
