name,badge_1,badge_2,mrp,discounted_price,discount,rating,rating_count,link
Baby Naturelle & Me Sleeveless Jumpsuit Dragonfly Print - Blue,,1 Left ,380,307.8,(19% Off),,,https://www.firstcry.com//www.firstcry.com/baby-naturelle-and-me/baby-naturelle-and-me-sleeveless-jumpsuit-dragonfly-print-blue/8953465/product-detail
Little Kangaroos Dungaree with Half Sleeves Inner Tee - Light Blue,,1 Left ,,1199,,,,https://www.firstcry.com//www.firstcry.com/little-kangaroos/little-kangaroos-dungaree-with-half-sleeves-inner-tee-light-blue/9194395/product-detail
Jb Club Half Sleeves Tee With Bear Pattern Dungaree - Grey,,1 Left ,620,527,(15% Off),,,https://www.firstcry.com//www.firstcry.com/jb-club/jb-club-half-sleeves-tee-with-bear-pattern-dungaree-grey/9230500/product-detail
I Bears Full Sleeves Footed Romper Unicorn Print Pack of 3 - Pink Blue,,2 Left ,990,801.9,(19% Off),,,https://www.firstcry.com//www.firstcry.com/i-bears/i-bears-full-sleeves-footed-romper-unicorn-print-pack-of-3-pink-blue/3105600/product-detail
Kidi Wav Full Sleeves Elephant Rider Printed Romper - Dark Pink,,1 Left ,250,225,(10% Off),,,https://www.firstcry.com//www.firstcry.com/kidi-wav/kidi-wav-full-sleeves-elephant-rider-printed-romper-dark-pink/9151129/product-detail
Babyhug Singlet Sleeves Off Shoulder Jumpsuit Polka Dot Print - Yellow,,1 Left ,599,485.19,(upto 19% Off),,,https://www.firstcry.com//www.firstcry.com/babyhug/babyhug-singlet-sleeves-off-shoulder-jumpsuit-polka-dot-print-yellow/8935982/product-detail
Kidi Wav Full Sleeves Space Theme Romper - Blue,,2 Left ,250,225,(10% Off),,,https://www.firstcry.com//www.firstcry.com/kidi-wav/kidi-wav-full-sleeves-space-theme-romper-blue/9151135/product-detail
Babyhug 100% Cotton Half Sleeves Romper Fish Print - Blue,,1 Left ,399,311.22,(22% Off),,,https://www.firstcry.com//www.firstcry.com/babyhug/babyhug-100-cotton-half-sleeves-romper-fish-print-blue/3322498/product-detail
Baby Naturelle & Me Sleeveless Jumpsuit Bunny Print - Blue,,1 Left ,330,267.3,(19% Off),,,https://www.firstcry.com//www.firstcry.com/baby-naturelle-and-me/baby-naturelle-and-me-sleeveless-jumpsuit-bunny-print-blue/8947626/product-detail
Kookie Kids Half Sleeves Romper- Red,,2 Left ,860,679.4,(21% Off),,,https://www.firstcry.com//www.firstcry.com/kookie-kids/kookie-kids-half-sleeves-romper-red/8597774/product-detail
Jo&Bo Half Sleeves Striped Romper - Black,,1 Left ,599,509.15,(15% Off),,,https://www.firstcry.com//www.firstcry.com/joandbo/joandbo-half-sleeves-striped-romper-black/8966668/product-detail
Stylo Bug Sleeveless Floral Print Jumpsuit - Purple,,1 Left ,2330,815.5,(65% Off),,,https://www.firstcry.com//www.firstcry.com/stylo-bug/stylo-bug-sleeveless-floral-print-jumpsuit-purple/9249696/product-detail
Kookie Kids Half Sleeves Romper with Bow - Red,,1 Left ,774,611.46,(21% Off),,,https://www.firstcry.com//www.firstcry.com/kookie-kids/kookie-kids-half-sleeves-romper-with-bow-red/8597721/product-detail
Babyhug Sleeveless Jumpsuit Summer Print - White,,1 Left ,499,399.2,(20% Off),,,https://www.firstcry.com//www.firstcry.com/babyhug/babyhug-sleeveless-jumpsuit-summer-print-white/3399864/product-detail
Babyhug Singlet Jumpsuit Polka Dot Print - Pink,,1 Left ,499,394.21,(21% Off),,,https://www.firstcry.com//www.firstcry.com/babyhug/babyhug-singlet-jumpsuit-polka-dot-print-pink/3309465/product-detail
Jb Club Striped Half Sleeves Tee With Bear Embroidery Dungaree -...,,1 Left ,720,576,(20% Off),,,https://www.firstcry.com//www.firstcry.com/jb-club/jb-club-striped-half-sleeves-tee-with-bear-embroidery-dungaree-navy-blue/9088868/product-detail
Carter's 2-Piece Slub Jersey Tee & Chambray Shortall Set - Blue,,1 Left ,1949,1364.3,(30% Off),,,https://www.firstcry.com//www.firstcry.com/carters/carters-2-piece-slub-jersey-tee-and-chambray-shortall-set-blue/8014159/product-detail
Babyhug Sleeveless Jumpsuit Floral Design - Navy,,1 Left ,499,399.2,(20% Off),,,https://www.firstcry.com//www.firstcry.com/babyhug/babyhug-sleeveless-jumpsuit-floral-design-navy/3467026/product-detail
Babyhug 100% Cotton Full Sleeves Frock Style Romper Little...,,1 Left ,549,378.81,(31% Off),,,https://www.firstcry.com//www.firstcry.com/babyhug/babyhug-100-cotton-full-sleeves-frock-style-romper-little-princess-print-with-headband-pink/8133239/product-detail
Babyhug Dungaree with Short Sleeves Tee Floral Print - Yellow Blue,,1 Left ,799,647.19,(19% Off),,,https://www.firstcry.com//www.firstcry.com/babyhug/babyhug-dungaree-with-short-sleeves-tee-floral-print-yellow-blue/8119185/product-detail
Jb Club Half Sleeves T-Shirt With Elephant Patch Dungaree - Blue,,1 Left,580,493,(15% Off),,,https://www.firstcry.com/jb-club/jb-club-half-sleeves-t-shirt-with-elephant-patch-dungaree-blue/8813006/product-detail
Jo&Bo Half Sleeves Mock Waistcoat Pattern Romper With Bow - Blue,,1 Left,599,509.15,(15% Off),,,https://www.firstcry.com/joandbo/joandbo-half-sleeves-mock-waistcoat-pattern-romper-with-bow-blue/8911636/product-detail
Jo&Bo Half Sleeves Checked Romper - Beige,,1 Left,599,509.15,(15% Off),,,https://www.firstcry.com/joandbo/joandbo-half-sleeves-checked-romper-beige/8928832/product-detail
Wonderchild Half Sleeves Striped T-Shirt With Romper - Red,,1 Left,575,517.5,(10% Off),,,https://www.firstcry.com/wonderchild/wonderchild-half-sleeves-striped-t-shirt-with-romper-red/8845333/product-detail
Kookie Kids Singlet Polka Dot Jumpsuit - Blue,,1 Left,903,731.43,(19% Off),,,https://www.firstcry.com/kookie-kids/kookie-kids-singlet-polka-dot-jumpsuit-blue/3304662/product-detail
Cucumber Half Sleeves Dungaree with Inner Tee Lion Print - Blue Yellow,,1 Left,640,524.8,(upto 19% Off),,,https://www.firstcry.com/cucumber/cucumber-half-sleeves-dungaree-with-inner-tee-lion-print-blue-yellow/8392460/product-detail
Carter's 5-Pack Animal Original Bodysuits - White Black,,1 Left,1699,1070.37,(37% Off),,,https://www.firstcry.com/carters/carters-5-pack-animal-original-bodysuits-white-black/2922858/product-detail
Carter's Floral Tulip Back Romper - Light Pink,,1 Left,1399,419.7,(70% Off),,,https://www.firstcry.com/carters/carters-floral-tulip-back-romper-light-pink/2528012/product-detail
612 League Cap Sleeves Tee With Butterfly Patch Dot Print...,,1 Left,1145,687,(40% Off),,,https://www.firstcry.com/612-league/612-league-cap-sleeves-tee-with-butterfly-patch-dot-print-dungaree-blue-and-pink/2686034/product-detail
612 League Printed Sleeveless Jumpsuit - Blue & White,,1 Left,995,597,(40% Off),,,https://www.firstcry.com/612-league/612-league-printed-sleeveless-jumpsuit-blue-and-white/2685858/product-detail
Babyhug 100% Cotton Romper Floral Print - Pink,,,499,394.21,(21% Off),,,https://www.firstcry.com/babyhug/babyhug-100-cotton-romper-floral-print-pink/8976264/product-detail
Babyhug 100% Cotton Half Sleeves Stripe Romper Ship Patch - Blue,,,449,354.71,(21% Off),,,https://www.firstcry.com/babyhug/babyhug-100-cotton-half-sleeves-stripe-romper-ship-patch-blue/9054791/product-detail
Babyhug 100% Cotton Half Sleeves Romper Car Print - White,,,399,315.21,(21% Off),,,https://www.firstcry.com/babyhug/babyhug-100-cotton-half-sleeves-romper-car-print-white/9025787/product-detail
Simply Half Sleeves Onesie Pack of 3 - Pink White Blue,,,660,594,(10% Off),,,https://www.firstcry.com/simply/simply-half-sleeves-onesie-pack-of-3-pink-white-blue/9264558/product-detail
Babyhug 100% Cotton Singlet Romper Floral Print - Pink White,,,399,315.21,(21% Off),,,https://www.firstcry.com/babyhug/babyhug-100-cotton-singlet-romper-floral-print-pink-white/3439562/product-detail
I Bears Half Sleeves Onesies Pack of 3 - Multicolor,,,660,534.6,(19% Off),,,https://www.firstcry.com/i-bears/i-bears-half-sleeves-onesies-pack-of-3-multicolor/9169558/product-detail
I Bears Half Sleeves Printed Onesies Pack of 3 - Blue,,,630,510.3,(19% Off),,,https://www.firstcry.com/i-bears/i-bears-half-sleeves-printed-onesies-pack-of-3-blue/9109881/product-detail
Babyoye Half Sleeves Onesie Pack of 7 - Multicolor,,,2299,1816.21,(21% Off),,,https://www.firstcry.com/babyoye/babyoye-half-sleeves-onesie-pack-of-7-multicolor/8388298/product-detail
Babyhug Sleeveless 100% Cotton Onesie - Purple,,,349,275.71,(21% Off),,,https://www.firstcry.com/babyhug/babyhug-sleeveless-100-cotton-onesie-purple/8502937/product-detail
Babyhug 100% Cotton Half Sleeves Romper Hippo Patch - Dark Red,,,449,354.71,(21% Off),,,https://www.firstcry.com/babyhug/babyhug-100-cotton-half-sleeves-romper-hippo-patch-dark-red/9025778/product-detail
I Bears Half Sleeves Onesies Pack of 3 - Multicolor,,,660,534.6,(19% Off),,,https://www.firstcry.com/i-bears/i-bears-half-sleeves-onesies-pack-of-3-multicolor/9169558/product-detail
I Bears Half Sleeves Printed Onesies Pack of 3 - Blue,,,630,510.3,(19% Off),,,https://www.firstcry.com/i-bears/i-bears-half-sleeves-printed-onesies-pack-of-3-blue/9109881/product-detail
Babyoye Half Sleeves Onesie Pack of 7 - Multicolor,,,2299,1816.21,(21% Off),,,https://www.firstcry.com/babyoye/babyoye-half-sleeves-onesie-pack-of-7-multicolor/8388298/product-detail
Babyhug Sleeveless 100% Cotton Onesie - Purple,,,349,275.71,(21% Off),,,https://www.firstcry.com/babyhug/babyhug-sleeveless-100-cotton-onesie-purple/8502937/product-detail
Babyhug 100% Cotton Half Sleeves Romper Hippo Patch - Dark Red,,,449,354.71,(21% Off),,,https://www.firstcry.com/babyhug/babyhug-100-cotton-half-sleeves-romper-hippo-patch-dark-red/9025778/product-detail
Babyhug  Sleeveless Polka Dot Jumpsuit  Bow Applique - Navy Blue,,,499,394.21,(21% Off),,,https://www.firstcry.com/babyhug/babyhug-sleeveless-polka-dot-jumpsuit--bow-applique-navy-blue/8601430/product-detail
Babyhug Dungaree With Half Sleeves Tee Printed - Yellow,,,799,631.21,(21% Off),,,https://www.firstcry.com/babyhug/babyhug-dungaree-with-half-sleeves-tee-printed-yellow/8581729/product-detail
Babyhug Sleeveless Jumpsuit Bird Print - Yellow,,,499,394.21,(21% Off),,,https://www.firstcry.com/babyhug/babyhug-sleeveless-jumpsuit-bird-print-yellow/9089240/product-detail
Babyhug Dungaree with Cap Sleeves Inner Tee Polka Dot Print - White...,,,899,710.21,(21% Off),,,https://www.firstcry.com/babyhug/babyhug-dungaree-with-cap-sleeves-inner-tee-polka-dot-print-white-pink/8766198/product-detail
Babyhug Singlet Sleeves Jumpsuit Floral Print - Green,,,599,473.21,(21% Off),,,https://www.firstcry.com/babyhug/babyhug-singlet-sleeves-jumpsuit-floral-print-green/3640996/product-detail
Kookie Kids Singlet Sleeves Jumpsuit Polka Dot Print - Blue,,,903,731.43,(19% Off),,,https://www.firstcry.com/kookie-kids/kookie-kids-singlet-sleeves-jumpsuit-polka-dot-print-blue/9023197/product-detail
Babyhug Cotton Sleeveless Jumpsuit - Multicolo,,,699,552.21,(21% Off),,,https://www.firstcry.com/babyhug/babyhug-cotton-sleeveless-jumpsuit-multicolo/8999705/product-detail
Babyhug Sleeveless Striped Jumpsuit - Blue,,,799,631.21,(21% Off),,,https://www.firstcry.com/babyhug/babyhug-sleeveless-striped-jumpsuit-blue/9011057/product-detail
Pine Kids Singlet Sleeves Striped Jumpsuit - Pink,,,1199,947.21,(21% Off),,,https://www.firstcry.com/pine-kids/pine-kids-singlet-sleeves-striped-jumpsuit-pink/9108039/product-detail
Cucumber Sleeveless Jumpsuit Animals Print - Blue,,,,320,,,,https://www.firstcry.com/cucumber/cucumber-sleeveless-jumpsuit-animals-print-blue/8724053/product-detail
Babyoye Singlet Sleeves Cotton Blend Woven Jumpsuit Ice Cream Print -...,,,899,710.21,(21% Off),,,https://www.firstcry.com/babyoye/babyoye-singlet-sleeves-cotton-blend-woven-jumpsuit-ice-cream-print-pink/8953009/product-detail
Babyhug Embroidered Denim Dungarees with Half Sleeves Inner Tee - Blue,,,999,789.21,(21% Off),,,https://www.firstcry.com/babyhug/babyhug-embroidered-denim-dungarees-with-half-sleeves-inner-tee-blue/8914337/product-detail
Babyhyg Sleeveless Jumpsuit Dragonfly Print - Blue,,,699,552.21,(21% Off),,,https://www.firstcry.com/babyhug/babyhyg-sleeveless-jumpsuit-dragonfly-print-blue/8936029/product-detail
Babyhug 100% Cotton Singlet Stripe Onesie Whale Print - Red White,,,229,180.91,(21% Off),,,https://www.firstcry.com/babyhug/babyhug-100-cotton-singlet-stripe-onesie-whale-print-red-white/9084747/product-detail
Babyhug Dungaree Style Romper With Half Sleeves Stripe Tee Mickey...,,,999,789.21,(21% Off),,,https://www.firstcry.com/babyhug/babyhug-dungaree-style-romper-with-half-sleeves-stripe-tee-mickey-mouse-print-blue/8556598/product-detail
Babyhug Dungaree Style Romper With Half Sleeves Stripe Tee Mickey...,,,999,789.21,(21% Off),,,https://www.firstcry.com/babyhug/babyhug-dungaree-style-romper-with-half-sleeves-stripe-tee-mickey-mouse-print-blue/8556598/product-detail
Babyhug Short Sleeves 100% Cotton Romper Floral Print - White,,,449,354.71,(21% Off),,,https://www.firstcry.com/babyhug/babyhug-short-sleeves-100-cotton-romper-floral-print-white/3439581/product-detail
Babyoye Singlet Stripe Romper Floral Embroidery - Blue White,,,899,710.21,(21% Off),,,https://www.firstcry.com/babyoye/babyoye-singlet-stripe-romper-floral-embroidery-blue-white/8727328/product-detail
Babyhug Knee Length Dungaree With Inner T-Shirt - Pink,,,999,789.21,(21% Off),,,https://www.firstcry.com/babyhug/babyhug-knee-length-dungaree-with-inner-t-shirt-pink/8766201/product-detail
Babyhug Sleeveless Jumpsuit Floral Print - Blue,,,599,473.21,(21% Off),,,https://www.firstcry.com/babyhug/babyhug-sleeveless-jumpsuit-floral-print-blue/8602072/product-detail
Babyhug Dungaree Style Romper With Half Sleeves Stripe Tee Winnie...,,,999,789.21,(21% Off),,,https://www.firstcry.com/babyhug/babyhug-dungaree-style-romper-with-half-sleeves-stripe-tee-winnie-the-pooh-print-blue-multicolour/8556601/product-detail
Babyhug Sleeveless Striped Jumpsuit - Yellow,,,999,789.21,(21% Off),,,https://www.firstcry.com/pine-kids/babyhug-sleeveless-striped-jumpsuit-yellow/9108392/product-detail
Babyhug Knee Length Dungaree With Inner T-Shirt - Red,,,999,789.21,(21% Off),,,https://www.firstcry.com/babyhug/babyhug-knee-length-dungaree-with-inner-t-shirt-red/8556591/product-detail
Babyhug Knee Length Dungaree With Inner T-Shirt - Blue,,,999,789.21,(21% Off),,,https://www.firstcry.com/babyhug/babyhug-knee-length-dungaree-with-inner-t-shirt-blue/8819217/product-detail
Babyhug Sleeveless Jumpsuit Striped Print - Multicolor,,,499,394.21,(21% Off),,,https://www.firstcry.com/babyhug/babyhug-sleeveless-jumpsuit-striped-print-multicolor/9093326/product-detail
Babyhug 100% Cotton Singlet Frock Style Onesie Text Print - Navy Blue,,,299,236.21,(21% Off),,,https://www.firstcry.com/babyhug/babyhug-100-cotton-singlet-frock-style-onesie-text-print-navy-blue/9084732/product-detail
ToffyHouse Half Sleeves Stripe Romper Bear Embroidery - Blue White,,,,645,,,,https://www.firstcry.com/toffyhouse/toffyhouse-half-sleeves-stripe-romper-bear-embroidery-blue-white/8655083/product-detail
Babyoye Full Sleeves Romper Bow Appliques - Pink White,,,799,631.21,(21% Off),,,https://www.firstcry.com/babyoye/babyoye-full-sleeves-romper-bow-appliques-pink-white/8112733/product-detail
Babyhug Sleeveless Jumpsuit Floral Print - Blue,,,499,389.22,(22% Off),,,https://www.firstcry.com/babyhug/babyhug-sleeveless-jumpsuit-floral-print-blue/8935974/product-detail
Babyhug Dungaree with Half Sleeves Striped Tee - Blue,,,699,552.21,(upto 21% Off),,,https://www.firstcry.com/babyhug/babyhug-dungaree-with-half-sleeves-striped-tee-blue/8828661/product-detail
ToffyHouse Dungaree With Half Sleeves Printed Tee - Red,,,,795,,,,https://www.firstcry.com/toffyhouse/toffyhouse-dungaree-with-half-sleeves-printed-tee-red/9010018/product-detail
Babyoye Half Sleeves Onesie Pack of 7 - Multicolor,,,2299,1816.21,(21% Off),,,https://www.firstcry.com/babyoye/babyoye-half-sleeves-onesie-pack-of-7-multicolor/8388286/product-detail
I Bears Half Sleeves Printed Onesies Pack of 3 - Multicolour,,,630,510.3,(19% Off),,,https://www.firstcry.com/i-bears/i-bears-half-sleeves-printed-onesies-pack-of-3-multicolour/9109869/product-detail
Carter's 2-Piece Bodysuit & Short Set - Blue,,,1049,734.3,(30% Off),,,https://www.firstcry.com/carters/carters-2-piece-bodysuit-and-short-set-blue/8432194/product-detail
I Bears Half Sleeves Rompers Pack of 3 - Multicolour,,,930,753.3,(19% Off),,,https://www.firstcry.com/i-bears/i-bears-half-sleeves-rompers-pack-of-3-multicolour/9109865/product-detail
I Bears Half Sleeves Onesies Pack of 3 - Multicolor,,,660,534.6,(19% Off),,,https://www.firstcry.com/i-bears/i-bears-half-sleeves-onesies-pack-of-3-multicolor/9169554/product-detail
Babyhug Half Sleeves 100% Cotton Romper Polka Dot Print - Navy Blue,,,449,354.71,(21% Off),,,https://www.firstcry.com/babyhug/babyhug-half-sleeves-100-cotton-romper-polka-dot-print-navy-blue/9054947/product-detail
Babyhug 100% Cotton Full Sleeves Onesies Multiprint Pack of 7 -...,,,1699,1342.21,(21% Off),,,https://www.firstcry.com/babyhug/babyhug-100-cotton-full-sleeves-onesies-multiprint-pack-of-7-multicolour/8265650/product-detail
Baby Naturelle Sleeveless Jumpsuit Allover Flower Print - White,,,315,255.15,(19% Off),,,https://www.firstcry.com/baby-naturelle-and-me/baby-naturelle-sleeveless-jumpsuit-allover-flower-print-white/8947644/product-detail
I Bears Half Sleeves Onesies Pack of 3 - Multicolor,,,930,753.3,(19% Off),,,https://www.firstcry.com/i-bears/i-bears-half-sleeves-onesies-pack-of-3-multicolor/9169560/product-detail
Babyoye Cotton Dungaree Style Romper With Short Sleeves Tee Multiprint...,,,999,789.21,(21% Off),,,https://www.firstcry.com/babyoye/babyoye-cotton-dungaree-style-romper-with-short-sleeves-tee-multiprint-blue-yellow/8465900/product-detail
Babyhug 100% Cotton Short Sleeves Onesie Pack of 3 - Pink,,,799,623.22,(upto 22% Off),,,https://www.firstcry.com/babyhug/babyhug-100-cotton-short-sleeves-onesie-pack-of-3-pink/3639770/product-detail
I Bears Half Sleeves Printed Onesies Pack of 3 - Multicolour,,,630,510.3,(19% Off),,,https://www.firstcry.com/i-bears/i-bears-half-sleeves-printed-onesies-pack-of-3-multicolour/9109871/product-detail
I Bears Half Sleeves Onesies Pack of 3 - Multicolor,,,660,534.6,(19% Off),,,https://www.firstcry.com/i-bears/i-bears-half-sleeves-onesies-pack-of-3-multicolor/9169564/product-detail
Carter's Chambray Romper - Blue,,,999,699.3,(30% Off),,,https://www.firstcry.com/carters/carters-chambray-romper-blue/8432550/product-detail
Babyoye Full Length Cotton Romper Panda Print Striped - Blue,,,599,335.44,(upto 44% Off),,,https://www.firstcry.com/babyoye/babyoye-full-length-cotton-romper-panda-print-striped-blue/8212452/product-detail
Babyoye Full Sleeves Striped & Printed Romper Pack of 2 - Orange,,,1399,1105.21,(21% Off),,,https://www.firstcry.com/babyoye/babyoye-full-sleeves-striped-and-printed-romper-pack-of-2-orange/8390980/product-detail
Babyoye Flutter Sleeves Romper Butterfly Print Pack of 2 - Pink,,,1199,947.21,(21% Off),,,https://www.firstcry.com/babyoye/babyoye-flutter-sleeves-romper-butterfly-print-pack-of-2-pink/8514964/product-detail
Babyoye Dungaree Style Romper with Cap Sleeves Inner Tee Butterfly...,,,899,710.21,(21% Off),,,https://www.firstcry.com/babyoye/babyoye-dungaree-style-romper-with-cap-sleeves-inner-tee-butterfly-print-pink/8341697/product-detail
Babyhug Sleeveless Cotton Romper Animals Print Pack of 2 - Multicolor,,,699,552.21,(21% Off),,,https://www.firstcry.com/babyhug/babyhug-sleeveless-cotton-romper-animals-print-pack-of-2-multicolor/9025797/product-detail
Babyhug 100% Cotton Full Sleeves Onesie Polka Dot Print - Blue,,,299,236.21,(21% Off),,,https://www.firstcry.com/babyhug/babyhug-100-cotton-full-sleeves-onesie-polka-dot-print-blue/3029891/product-detail
Babyhug Full Sleeves Onesie with Leggings Heart & Cutie Print -...,,,549,433.71,(21% Off),,,https://www.firstcry.com/babyhug/babyhug-full-sleeves-onesie-with-leggings-heart-and-cutie-print-red-grey/8059558/product-detail
Dew Drops Short Sleeves Striped Jumpsuit Fruit Print - Dark Blue,,,,399,,,,https://www.firstcry.com/dew-drops/dew-drops-short-sleeves-striped-jumpsuit-fruit-print-dark-blue/8950866/product-detail
Pine Kids Sleeveless Jumpsuit Floral Embroidery - Pink,,,899,710.21,(21% Off),,,https://www.firstcry.com/pine-kids/pine-kids-sleeveless-jumpsuit-floral-embroidery-pink/8875218/product-detail
Babyhug Flutter Sleeves 100% Cotton Onesie Polka Dot Print - Pink,,,299,218.27,(upto 27% Off),,,https://www.firstcry.com/babyhug/babyhug-flutter-sleeves-100-cotton-onesie-polka-dot-print-pink/8502862/product-detail
