name,badge_1,badge_2,mrp,discounted_price,discount,rating,rating_count,link
Mini Taurus Mini Taurus Full Sleeves 3 Piece Part Suit Bow Print - Brown,,,559,486.33,(13% Off),,,https://www.firstcry.com//www.firstcry.com/mini-taurus/mini-taurus-mini-taurus-full-sleeves-3-piece-part-suit-bow-print-brown/9406824/product-detail
Mini Taurus Mini Taurus Full Sleeves 3 Piece Part Suit Bow Print - Green,,,559,486.33,(13% Off),,,https://www.firstcry.com//www.firstcry.com/mini-taurus/mini-taurus-mini-taurus-full-sleeves-3-piece-part-suit-bow-print-green/9406821/product-detail
Babyhug 100% Cotton Short Sleeves Romper Polka Dot Print - Pink,,,449,354.71,(21% Off),,,https://www.firstcry.com//www.firstcry.com/babyhug/babyhug-100-cotton-short-sleeves-romper-polka-dot-print-pink/9054955/product-detail
Babyoye Full Length Dungaree With Inner T-Shirt - Red White,,,1099,868.21,(21% Off),,,https://www.firstcry.com//www.firstcry.com/babyoye/babyoye-full-length-dungaree-with-inner-t-shirt-red-white/9237629/product-detail
Babyoye Dungaree with Half Sleeves Striped Inner Tee Koala Print -...,,,999,789.21,(21% Off),,,https://www.firstcry.com//www.firstcry.com/babyoye/babyoye-dungaree-with-half-sleeves-striped-inner-tee-koala-print-yellow/9039589/product-detail
Babyhug Short Sleeves Dungarees With Tee Stripes  - Blue Pink,,,899,710.21,(21% Off),,,https://www.firstcry.com//www.firstcry.com/babyhug/babyhug-short-sleeves-dungarees-with-tee-stripes-blue-pink/8444865/product-detail
Babyhug Full Sleeves 100% Cotton Romper Elephant Patch - Blue,,,499,394.21,(21% Off),,,https://www.firstcry.com//www.firstcry.com/babyhug/babyhug-full-sleeves-100-cotton-romper-elephant-patch-blue/8976278/product-detail
Babyhug Flutter Sleeves Jumpsuit with Bow - Pink,,,799,631.21,(21% Off),,,https://www.firstcry.com//www.firstcry.com/babyhug/babyhug-flutter-sleeves-jumpsuit-with-bow-pink/9166835/product-detail
Babyhug Knee Length Dungaree with Half Sleeves Inner Tee Tiger...,,,799,631.21,(21% Off),,,https://www.firstcry.com//www.firstcry.com/babyhug/babyhug-knee-length-dungaree-with-half-sleeves-inner-tee-tiger-print-yellow-blue/8581734/product-detail
I Bears Half Sleeves Onesies Pack of 3 - Multicolor,,,660,521.4,(21% Off),,,https://www.firstcry.com//www.firstcry.com/i-bears/i-bears-half-sleeves-onesies-pack-of-3-multicolor/9169557/product-detail
I Bears Half Sleeves Printed Onesies Pack of 3 - Blue,,,630,497.7,(21% Off),,,https://www.firstcry.com//www.firstcry.com/i-bears/i-bears-half-sleeves-printed-onesies-pack-of-3-blue/9109879/product-detail
Babyhug Flutter Sleeves Jumpsuit Floral Print - Pink,,,499,394.21,(21% Off),,,https://www.firstcry.com//www.firstcry.com/babyhug/babyhug-flutter-sleeves-jumpsuit-floral-print-pink/9180105/product-detail
Babyhug Singlet Tie & Dye Jumpsuit - Pink White,,,499,394.21,(21% Off),,,https://www.firstcry.com//www.firstcry.com/babyhug/babyhug-singlet-tie-and-dye-jumpsuit-pink-white/9024634/product-detail
I Bears Half Sleeves Striped Romper Boat Print Pack of 3 - Blue White,,,600,474,(21% Off),,,https://www.firstcry.com//www.firstcry.com/i-bears/i-bears-half-sleeves-striped-romper-boat-print-pack-of-3-blue-white/3356101/product-detail
I Bears Half Sleeves Onesies Pack of 3 - Multicolor,,,660,521.4,(21% Off),,,https://www.firstcry.com//www.firstcry.com/i-bears/i-bears-half-sleeves-onesies-pack-of-3-multicolor/9169564/product-detail
Babyhug Half Sleeves Onesies Multiprint Pack of 3 - Yellow...,,,749,591.71,(21% Off),,,https://www.firstcry.com//www.firstcry.com/babyhug/babyhug-half-sleeves-onesies-multiprint-pack-of-3-yellow-light-grey-navy-blue/9360146/product-detail
I Bears Full Sleeves Checks & Multi Printed Footed Rompers Set of 3 -...,,,990,782.1,(21% Off),,,https://www.firstcry.com//www.firstcry.com/i-bears/i-bears-full-sleeves-checks-and-multi-printed-footed-rompers-set-of-3-pink-white/8196596/product-detail
Babyoye Sleeveless Jumpsuit - White,,,899,710.21,(21% Off),,,https://www.firstcry.com//www.firstcry.com/babyoye/babyoye-sleeveless-jumpsuit-white/8727324/product-detail
Babyhug Short Sleeves Frock Style Onesie Minnie Mouse Print - Pink,,,449,354.71,(21% Off),,,https://www.firstcry.com//www.firstcry.com/babyhug/babyhug-short-sleeves-frock-style-onesie-minnie-mouse-print-pink/9173786/product-detail
Babyhug Cap Sleeves Jumpsuit Floral Embroidery - Light  Blue,,,599,473.21,(21% Off),,,https://www.firstcry.com//www.firstcry.com/babyhug/babyhug-cap-sleeves-jumpsuit-floral-embroidery-light-blue/9255477/product-detail
I Bears Full Sleeves Rompers Multiprint Pack of 3 - Red Blue,,,990,782.1,(21% Off),,,https://www.firstcry.com/i-bears/i-bears-full-sleeves-rompers-multiprint-pack-of-3-red-blue/3498132/product-detail
I Bears Full Sleeves Footed Romper Christmas Print Pack of 2 - Red...,,,990,782.1,(21% Off),,,https://www.firstcry.com/i-bears/i-bears-full-sleeves-footed-romper-christmas-print-pack-of-2-red-white/3247710/product-detail
I Bears Full Sleeves Footed Rompers Pack of 3 - Purple White,,,1140,900.6,(21% Off),,,https://www.firstcry.com/i-bears/i-bears-full-sleeves-footed-rompers-pack-of-3-purple-white/8884343/product-detail
Babyhug Sleeveless Striped Jumpsuit - Blue,,,799,631.21,(21% Off),,,https://www.firstcry.com/babyhug/babyhug-sleeveless-striped-jumpsuit-blue/9011061/product-detail
Babyhug Sleeveless Jumpsuit Floral Print - Pink,,,499,379.24,(upto 24% Off),,,https://www.firstcry.com/babyhug/babyhug-sleeveless-jumpsuit-floral-print-pink/9058825/product-detail
Babyhug Cotton Sleeveless Jumpsuit - Multicolo,,,699,552.21,(upto 22% Off),,,https://www.firstcry.com/babyhug/babyhug-cotton-sleeveless-jumpsuit-multicolo/8999709/product-detail
Babyhug Cold Shoulder Jumpsuit Polka Dot Print - Navy Blue,,,699,538.23,(upto 23% Off),,,https://www.firstcry.com/babyhug/babyhug-cold-shoulder-jumpsuit-polka-dot-print-navy-blue/3467044/product-detail
Babyhug Half Sleeves 100% Cotton Romper Fire Truck Print - Red,,,449,354.71,(21% Off),,,https://www.firstcry.com/babyhug/babyhug-half-sleeves-100-cotton-romper-fire-truck-print-red/9025760/product-detail
Babyhug Flutter Sleeves Polka Dotted 100% Cotton Onesie Floral...,,,349,275.71,(21% Off),,,https://www.firstcry.com/babyhug/babyhug-flutter-sleeves-polka-dotted-100-cotton-onesie-floral-embroidery-navy-blue/8988507/product-detail
Babyhug Dungaree Style Romper with Half Sleeves Inner Tee Butterfly...,,,699,552.21,(21% Off),,,https://www.firstcry.com/babyhug/babyhug-dungaree-style-romper-with-half-sleeves-inner-tee-butterfly-print-pink/9132667/product-detail
Babyhug 100% Cotton Sleeveless Onesie Roar Print - Blue,,,249,184.26,(upto 28% Off),,,https://www.firstcry.com/babyhug/babyhug-100-cotton-sleeveless-onesie-roar-print-blue/8634075/product-detail
Babyhug Sleeveless Dungarees With Tee Sharks Print  - Blue,,,799,631.21,(21% Off),,,https://www.firstcry.com/babyhug/babyhug-sleeveless-dungarees-with-tee-sharks-print-blue/8829849/product-detail
Babyhug Denim Dungaree with Striped Inner Tee - Blue Multicolor,,,999,709.29,(upto 31% Off),,,https://www.firstcry.com/babyhug/babyhug-denim-dungaree-with-striped-inner-tee-blue-multicolor/8290614/product-detail
Babyhug Half Sleeves Printed 100 % Cotton Onesie - Blue,,,299,236.21,(21% Off),,,https://www.firstcry.com/babyhug/babyhug-half-sleeves-printed-100-cotton-onesie--blue/8465473/product-detail
Pine Kids Sleeveless Jumpsuit Floral Embroidery - Pink,,,899,710.21,(upto 23% Off),,,https://www.firstcry.com/pine-kids/pine-kids-sleeveless-jumpsuit-floral-embroidery-pink/8875221/product-detail
Dew Drops Half Sleeves Jumpsuit Bird Print - Dark Blue,,,499,434.13,(13% Off),,,https://www.firstcry.com/dew-drops/dew-drops-half-sleeves-jumpsuit-bird-print-dark-blue/9210801/product-detail
Babyhug Sleeveless Jumpsuit Floral Print - Blue,,,699,552.21,(21% Off),,,https://www.firstcry.com/babyhug/babyhug-sleeveless-jumpsuit-floral-print-blue/9024618/product-detail
Babyhug 100% Cotton Singlet Romper Floral Print - Pink White,,,399,315.21,(21% Off),,,https://www.firstcry.com/babyhug/babyhug-100-cotton-singlet-romper-floral-print-pink-white/3439558/product-detail
Babyoye Full Sleeves Striped & Printed Romper Pack of 2 - Orange,,,1399,1105.21,(21% Off),,,https://www.firstcry.com/babyoye/babyoye-full-sleeves-striped-and-printed-romper-pack-of-2-orange/8390981/product-detail
Babyhug Floral Printed Corduroy Dungaree & Full Sleeves Top -...,,,1199,839.3,(upto 31% Off),,,https://www.firstcry.com/babyhug/babyhug-floral-printed-corduroy-dungaree-and-full-sleeves-top-pink-blue/8197560/product-detail
I Bears Full Sleeves Multi Printed Onesies Pack of 3 - Red Black Grey,,,720,568.8,(21% Off),,,https://www.firstcry.com/i-bears/i-bears-full-sleeves-multi-printed-onesies-pack-of-3-red-black-grey/8499665/product-detail
Babyhug 100% Cotton Onesie Pack of 5 - White,,,1149,988.14,(14% Off),,,https://www.firstcry.com/babyhug/babyhug-100-cotton-onesie-pack-of-5-white/8265416/product-detail
Babyhug Half Sleeves T-shirt and Dungaree Set - Orange,,,999,779.22,(22% Off),,,https://www.firstcry.com/babyhug/babyhug-half-sleeves-t-shirt-and-dungaree-set-orange/8849759/product-detail
First Smile Dungaree Style Romper with Half Sleeve Inner Tee Bear...,,,549,433.71,(21% Off),,,https://www.firstcry.com/first-smile/first-smile-dungaree-style-romper-with-half-sleeve-inner-tee-bear-print-blue/9107167/product-detail
Babyhug 100% Cotton Sleeveless Onesie Floral Print - Yellow,,,349,275.71,(21% Off),,,https://www.firstcry.com/babyhug/babyhug-100-cotton-sleeveless-onesie-floral-print-yellow/9055453/product-detail
Babyhug Half Sleeves Dungarees With Tee Star Print  - Blue,,,999,789.21,(21% Off),,,https://www.firstcry.com/babyhug/babyhug-half-sleeves-dungarees-with-tee-star-print-blue/8953919/product-detail
Babyhug Cold Shoulder Jumpsuit Floral Print - Yellow,,,599,473.21,(upto 24% Off),,,https://www.firstcry.com/babyhug/babyhug-cold-shoulder-jumpsuit-floral-print-yellow/9042981/product-detail
Babyhug 100% Cotton Sleeveless Onesie Floral Print - Blue,,,349,275.71,(21% Off),,,https://www.firstcry.com/babyhug/babyhug-100-cotton-sleeveless-onesie-floral-print-blue/9055447/product-detail
Babyhug Half Sleeves Dungaree with Inner Tee - Pink,,,699,552.21,(21% Off),,,https://www.firstcry.com/babyhug/babyhug-half-sleeves-dungaree-with-inner-tee-pink/8564873/product-detail
Babyhug Half Sleeves 100% Cotton Romper Polka Dot Print - Navy Blue,,,449,354.71,(21% Off),,,https://www.firstcry.com/babyhug/babyhug-half-sleeves-100-cotton-romper-polka-dot-print-navy-blue/9054948/product-detail
Cucumber Full Sleeves Animals Print  Rompers - Red,,,520,452.4,(13% Off),,,https://www.firstcry.com/cucumber/cucumber-full-sleeves-animals-print-rompers-red/9247297/product-detail
Babyhug 100% Cotton Flutter Sleeves Onesie Bug Print - Red,,,349,275.71,(21% Off),,,https://www.firstcry.com/babyhug/babyhug-100-cotton-flutter-sleeves-onesie-bug-print-red/8502912/product-detail
I Bears Half Sleeves Romper Rainbow Print Pack of 3 - Pink,,,930,734.7,(21% Off),,,https://www.firstcry.com/i-bears/i-bears-half-sleeves-romper-rainbow-print-pack-of-3-pink/8980849/product-detail
Babyhug 100% Cotton Sleeveless Frock style Onesie - Pink,,,299,236.21,(21% Off),,,https://www.firstcry.com/babyhug/babyhug-100-cotton-sleeveless-frock-style-onesie-pink/9084742/product-detail
I Bears Full Sleeves Onesies Pack Of 3 - Multicolor,,,720,568.8,(21% Off),,,https://www.firstcry.com/i-bears/i-bears-full-sleeves-onesies-pack-of-3-multicolor/8701388/product-detail
Babyoye Full Sleeves Embroidered Onesie with Skeggings - Pink,,,999,629.37,(37% Off),,,https://www.firstcry.com/babyoye/babyoye-full-sleeves-embroidered-onesie-with-skeggings-pink/8153481/product-detail
Babyhug Dungaree Style Romper With Half Sleeves Stripe Tee Winnie...,,,999,789.21,(upto 24% Off),,,https://www.firstcry.com/babyhug/babyhug-dungaree-style-romper-with-half-sleeves-stripe-tee-winnie-the-pooh-print-blue-multicolour/8556602/product-detail
Babyhug Singlet Tie Knot Style Jumpsuit - Peach,,,799,623.22,(upto 24% Off),,,https://www.firstcry.com/babyhug/babyhug-singlet-tie-knot-style-jumpsuit-peach/8763289/product-detail
Babyhug Knee Length Dungaree With Inner T-Shirt - Blue,,,999,789.21,(upto 23% Off),,,https://www.firstcry.com/babyhug/babyhug-knee-length-dungaree-with-inner-t-shirt-blue/8819215/product-detail
Babyhug 100% Cotton Sleeveless Onesie - Blue,,,229,180.91,(21% Off),,,https://www.firstcry.com/babyhug/babyhug-100-cotton-sleeveless-onesie-blue/9084733/product-detail
Babyhug Cotton Half Sleeves Romper Crab Print - Light Grey,,,499,394.21,(upto 22% Off),,,https://www.firstcry.com/babyhug/babyhug-cotton-half-sleeves-romper-crab-print-light-grey/8976276/product-detail
I Bears Full Sleeves Striped Footed Romper Plane Print Pack of 2 - Pink,,,660,521.4,(21% Off),,,https://www.firstcry.com/i-bears/i-bears-full-sleeves-striped-footed-romper-plane-print-pack-of-2-pink/3356140/product-detail
Babyhug Dungaree with Cap Sleeves Striped Inner Tee Cherry...,,,999,789.21,(21% Off),,,https://www.firstcry.com/babyhug/babyhug-dungaree-with-cap-sleeves-striped-inner-tee-cherry-embroidery-red-blue/8819220/product-detail
Babyhug Denim Dungaree With Short Sleeves Tee Butterfly Print -...,,,999,789.21,(21% Off),,,https://www.firstcry.com/babyhug/babyhug-denim-dungaree-with-short-sleeves-tee-butterfly-print-blue-yellow/8789236/product-detail
Babyoye Half Sleeves Party Romper - Multiicolor,,,799,631.21,(21% Off),,,https://www.firstcry.com/babyoye/babyoye-half-sleeves-party-romper-multiicolor/8573780/product-detail
I Bears Half Sleeves Printed Onesies Pack of 3 - Multicolour,,,630,497.7,(21% Off),,,https://www.firstcry.com/i-bears/i-bears-half-sleeves-printed-onesies-pack-of-3-multicolour/9109876/product-detail
I Bears Half Sleeves Rompers Pack of 3 - Multicolour,,,930,734.7,(21% Off),,,https://www.firstcry.com/i-bears/i-bears-half-sleeves-rompers-pack-of-3-multicolour/9109866/product-detail
Babyhug Sleeveless Jumpsuit Striped Print - Multicolor,,,499,389.22,(upto 25% Off),,,https://www.firstcry.com/babyhug/babyhug-sleeveless-jumpsuit-striped-print-multicolor/9093325/product-detail
Babyhug 100% Cotton Sleeveless Romper Polka Dot Print - Pink,,,449,350.22,(upto 22% Off),,,https://www.firstcry.com/babyhug/babyhug-100-cotton-sleeveless-romper-polka-dot-print-pink/9054793/product-detail
I Bears Half Sleeves Checks & Koala Printed Onesies Pack of 3 - Pink...,,,570,450.3,(21% Off),,,https://www.firstcry.com/i-bears/i-bears-half-sleeves-checks-and-koala-printed-onesies-pack-of-3-pink-sea-green/3584931/product-detail
Babyoye Striped Biowash Dungaree with Full Sleeves Inner Tee Palm...,,,1099,846.23,(upto 28% Off),,,https://www.firstcry.com/babyoye/babyoye-striped-biowash-dungaree-with-full-sleeves-inner-tee-palm-tree-print-blue-orange/8391107/product-detail
Babyhug Sleeveless Dungarees With Tee Checks - Grey Navy Blue,,,999,789.21,(upto 22% Off),,,https://www.firstcry.com/babyhug/babyhug-sleeveless-dungarees-with-tee-checks-grey-navy-blue/8936078/product-detail
Babyhug Polka Dot 100% Cotton Onesie - Red,,,349,275.71,(21% Off),,,https://www.firstcry.com/babyhug/babyhug-polka-dot-100-cotton-onesie-red/8502902/product-detail
Babyhug Half Sleeves Onesies Tiger Print Pack of 3 - Orange Grey,,,749,591.71,(21% Off),,,https://www.firstcry.com/babyhug/babyhug-half-sleeves-onesies-tiger-print-pack-of-3-orange-grey/9360142/product-detail
I Bears Half Sleeves Onesie Llama Print Pack of 3 - Peach Blue,,,660,521.4,(21% Off),,,https://www.firstcry.com/i-bears/i-bears-half-sleeves-onesie-llama-print-pack-of-3-peach-blue/8980840/product-detail
Pine Kids Singlet Sleeves Striped Jumpsuit - Pink,,,1199,947.21,(21% Off),,,https://www.firstcry.com/pine-kids/pine-kids-singlet-sleeves-striped-jumpsuit-pink/9108041/product-detail
Babyhug 100% Cotton Cap Sleeves Onesies Multiprint Pack of 3 -...,,,749,576.73,(upto 23% Off),,,https://www.firstcry.com/babyhug/babyhug-100-cotton-cap-sleeves-onesies-multiprint-pack-of-3-blue-pink-white/3439613/product-detail
Babyhug 100% Cotton Half Sleeves Onesie Text Embroidery - Red,,,299,236.21,(21% Off),,,https://www.firstcry.com/babyhug/babyhug-100-cotton-half-sleeves-onesie-text-embroidery-red/8462643/product-detail
Babyhug Dungaree with Short Sleeves Inner Tee - Pink,,,999,789.21,(21% Off),,,https://www.firstcry.com/babyhug/babyhug-dungaree-with-short-sleeves-inner-tee-pink/8789250/product-detail
Babyoye Singlet Sleeves Cotton Blend Woven Jumpsuit Ice Cream Print -...,,,899,710.21,(21% Off),,,https://www.firstcry.com/babyoye/babyoye-singlet-sleeves-cotton-blend-woven-jumpsuit-ice-cream-print-pink/8953007/product-detail
Babyhug Cotton Half Sleeves Stripe Onesie Fire Brigade Embroidery -...,,,299,236.21,(21% Off),,,https://www.firstcry.com/babyhug/babyhug-cotton-half-sleeves-stripe-onesie-fire-brigade-embroidery-light-grey/8502851/product-detail
Babyhug 100% Cotton Onesie Mommy's Girl Print - Peach,,,299,236.21,(21% Off),,,https://www.firstcry.com/babyhug/babyhug-100-cotton-onesie-mommys-girl-print-peach/3029896/product-detail
Pine Kids Sleeveless Striped Jumpsuit - Yellow,,,999,789.21,(21% Off),,,https://www.firstcry.com/pine-kids/pine-kids-sleeveless-striped-jumpsuit-yellow/9108392/product-detail
I Bears Half Sleeves Printed Onesies Pack of 3 - Multicolour,,,630,497.7,(21% Off),,,https://www.firstcry.com/i-bears/i-bears-half-sleeves-printed-onesies-pack-of-3-multicolour/9109867/product-detail
I Bears Half Sleeves Onesies Pack of 3 - Multicolor,,,660,521.4,(21% Off),,,https://www.firstcry.com/i-bears/i-bears-half-sleeves-onesies-pack-of-3-multicolor/9169555/product-detail
Babyhug Half Sleeves Onesie Mickey Mouse Print - Blue Grey,,,399,315.21,(21% Off),,,https://www.firstcry.com/babyhug/babyhug-half-sleeves-onesie-mickey-mouse-print-blue-grey/9173783/product-detail
Babyhug Sleeveless Jumpsuit Fruits Print - Yellow,,,499,394.21,(21% Off),,,https://www.firstcry.com/babyhug/babyhug-sleeveless-jumpsuit-fruits-print-yellow/8499241/product-detail
I Bears Half Sleeves Onesie Vehicle & Star Print Pack of 3 - Blue,,,660,521.4,(21% Off),,,https://www.firstcry.com/i-bears/i-bears-half-sleeves-onesie-vehicle-and-star-print-pack-of-3-blue/8947290/product-detail
Babyhyg Sleeveless Jumpsuit Dragonfly Print - Blue,,,699,552.21,(upto 22% Off),,,https://www.firstcry.com/babyhug/babyhyg-sleeveless-jumpsuit-dragonfly-print-blue/8936031/product-detail
M'andy Half Sleeves Butterfly Printed Jumpsuit - Navy Blue,,,,849,(upto 13% Off),,,https://www.firstcry.com/mandy/mandy-half-sleeves-butterfly-printed-jumpsuit-navy-blue/8691789/product-detail
ToffyHouse Corduroy Dungaree Style Romper With Half Sleeves Stripe...,,,795,683.7,(14% Off),,,https://www.firstcry.com/toffyhouse/toffyhouse-corduroy-dungaree-style-romper-with-half-sleeves-stripe-tee-bear-embroidery-green-white/8662289/product-detail
Babyhug Flutter Sleeves Jumpsuit Floral Print - Navy Blue,,,499,394.21,(21% Off),,,https://www.firstcry.com/babyhug/babyhug-flutter-sleeves-jumpsuit-floral-print-navy-blue/9041991/product-detail
Babyhug Flutter Sleeves Jumpsuit Floral Print - Navy Blue,,,499,394.21,(21% Off),,,https://www.firstcry.com/babyhug/babyhug-flutter-sleeves-jumpsuit-floral-print-navy-blue/9089567/product-detail
Babyhug Sleeveless Jumpsuit  - Multicolour,,,599,473.21,(21% Off),,,https://www.firstcry.com/babyhug/babyhug-sleeveless-jumpsuit-multicolour/9024628/product-detail
I Bears Full Sleeves Rompers Pack of 3 - Blue White,,,990,782.1,(21% Off),,,https://www.firstcry.com/i-bears/i-bears-full-sleeves-rompers-pack-of-3-blue-white/8030049/product-detail
I Bears Full Sleeves Striped Romper Floral Print Pack of 3 - Pink White,,,930,734.7,(21% Off),,,https://www.firstcry.com/i-bears/i-bears-full-sleeves-striped-romper-floral-print-pack-of-3-pink-white/3356143/product-detail
Babyhug Half Sleeves 100% Cotton Onesies Animal Print Pack of 5 -...,,,1199,947.21,(21% Off),,,https://www.firstcry.com/babyhug/babyhug-half-sleeves-100-cotton-onesies-animal-print-pack-of-5-multiprint/8988525/product-detail
Babyhug Singlet Sleeves Jumpsuit Floral Print - Pink,,,599,473.21,(21% Off),,,https://www.firstcry.com/babyhug/babyhug-singlet-sleeves-jumpsuit-floral-print-pink/9042978/product-detail
I Bears Half Sleeves Printed Onesies Pack of 3 - Multicolour,,,630,497.7,(21% Off),,,https://www.firstcry.com/i-bears/i-bears-half-sleeves-printed-onesies-pack-of-3-multicolour/9109872/product-detail
Babyhug Sleeveless Ankle Length Jumpsuit Floral Print - Red,,,699,552.21,(21% Off),,,https://www.firstcry.com/babyhug/babyhug-sleeveless-ankle-length-jumpsuit-floral-print-red/9166858/product-detail
