name,badge_1,badge_2,mrp,discounted_price,discount,rating,rating_count,link
Carter's 2-Piece Berry Bodysuit Pant Set - PInk White,,,,1349,,,,https://www.firstcry.com//www.firstcry.com/carters/carters-2-piece-berry-bodysuit-pant-set-pink-white/3229906/product-detail
Little Kangaroos Half Sleeves Denim Romper- Blue,,,,1049,,,,https://www.firstcry.com//www.firstcry.com/little-kangaroos/little-kangaroos-half-sleeves-denim-romper-blue/9258469/product-detail
Mini Taurus Half Sleeves Romper Tortoise Print - Yellow,,,,349,,,,https://www.firstcry.com//www.firstcry.com/mini-taurus/mini-taurus-half-sleeves-romper-tortoise-print-yellow/9234162/product-detail
Mini Taurus Half Sleeves Romper Bear Print - Green,,,,419,,,,https://www.firstcry.com//www.firstcry.com/mini-taurus/mini-taurus-half-sleeves-romper-bear-print-green/9234166/product-detail
Mini Taurus Half Sleeves Romper Tortoise Print - Orange,,,,349,,,,https://www.firstcry.com//www.firstcry.com/mini-taurus/mini-taurus-half-sleeves-romper-tortoise-print-orange/9234164/product-detail
Mini Taurus Half Sleeves Romper Bear Print - Blue,,,,419,,,,https://www.firstcry.com//www.firstcry.com/mini-taurus/mini-taurus-half-sleeves-romper-bear-print-blue/9234170/product-detail
Mini Taurus Half Sleeves Checked Romper - Red,,,,539,,,,https://www.firstcry.com//www.firstcry.com/mini-taurus/mini-taurus-half-sleeves-checked-romper-red/9234175/product-detail
Mini Taurus Half Sleeves Checked Romper - Black,,,,539,,,,https://www.firstcry.com//www.firstcry.com/mini-taurus/mini-taurus-half-sleeves-checked-romper-black/9234174/product-detail
Kicks & Crawl Striped Sleeveless Jumpsuit - Blue,,,,1299,,,,https://www.firstcry.com//www.firstcry.com/kicks-and-crawl/kicks-and-crawl-striped-sleeveless-jumpsuit-blue/9402325/product-detail
Nino Bambino 100% Organic Cotton Sleeveless Polka Dotted Gift Set...,,,,949,,,,https://www.firstcry.com//www.firstcry.com/nino-bambino/nino-bambino-100-organic-cotton-sleeveless-polka-dotted-gift-set-romper-with-onesie-and-vest-with-pajama-white/9387223/product-detail
Nino Bambino 100% Organic Cotton Sleeveless Floral Print Jumpsuit...,,,,799,,,,https://www.firstcry.com//www.firstcry.com/nino-bambino/nino-bambino-100-organic-cotton-sleeveless-floral-print-jumpsuit-multi-color/9386865/product-detail
Nino Bambino 100% Organic Cotton Striped Full Sleeves Onesie - Cream,,,,849,,,,https://www.firstcry.com//www.firstcry.com/nino-bambino/nino-bambino-100-organic-cotton-striped-full-sleeves-onesie-cream/9386821/product-detail
Carter's Whale Original Bodysuit - White,,1 Left ,749,561.75,(upto 25% Off),,,https://www.firstcry.com//www.firstcry.com/carters/carters-whale-original-bodysuit-white/8014300/product-detail
Kookie Kids Half Sleeves Romper Lemon Print - Yellow,,1 Left ,817,678.11,(17% Off),,,https://www.firstcry.com//www.firstcry.com/kookie-kids/kookie-kids-half-sleeves-romper-lemon-print-yellow/9022736/product-detail
Nino Bambino 100% Organic Cotton Short Sleeves  Strawberry Print...,,,,999,,,,https://www.firstcry.com//www.firstcry.com/nino-bambino/nino-bambino-100-organic-cotton-short-sleeves-strawberry-print-romper-white/9386813/product-detail
Nino Bambino 100% Organic Cotton Full Sleeves Striped Onesie - Cream,,,,799,,,,https://www.firstcry.com//www.firstcry.com/nino-bambino/nino-bambino-100-organic-cotton-full-sleeves-striped-onesie-cream/9386804/product-detail
Nino Bambino 100% Organic Cotton Flower Print Strap Jumpsuit With...,,,,1599,,,,https://www.firstcry.com//www.firstcry.com/nino-bambino/nino-bambino-100-organic-cotton-flower-print-strap-jumpsuit-with-hat-pink/9386789/product-detail
Nino Bambino 100% Organic Cotton Fruit Print Strap Jumpsuit With...,,,,1599,,,,https://www.firstcry.com//www.firstcry.com/nino-bambino/nino-bambino-100-organic-cotton-fruit-print-strap-jumpsuit-with-hat-white/9386785/product-detail
Nino Bambino 100% Organic Cotton Sleeveless Fruit Print Jumpsuit -...,,,,1199,,,,https://www.firstcry.com//www.firstcry.com/nino-bambino/nino-bambino-100-organic-cotton-sleeveless-fruit-print-jumpsuit-blue/9386783/product-detail
Babyhug 100% Cotton Full Sleeves Onesie Polka Dot Print - Blue,,2 Left ,299,245.18,(18% Off),,,https://www.firstcry.com//www.firstcry.com/babyhug/babyhug-100-cotton-full-sleeves-onesie-polka-dot-print-blue/3029894/product-detail
Bumzee Full Sleeves Dino Patch Romper - Pink,,,999,619.38,(38% Off),,,https://www.firstcry.com/bumzee/bumzee-full-sleeves-dino-patch-romper-pink/8693267/product-detail
Bumzee Full Sleeves Giraffe Applique Romper - Orange,,,999,519.48,(upto 58% Off),,,https://www.firstcry.com/bumzee/bumzee-full-sleeves-giraffe-applique-romper-orange/8693274/product-detail
Global Desi Girl Flower Print Sleeveless Jumpsuit - Pink,,2 Left,1499,779.48,(48% Off),,,https://www.firstcry.com/global-desi-girl/global-desi-girl-flower-print-sleeveless-jumpsuit-pink/3819347/product-detail
Global Desi Girl Sleeveless Leaves Embroidered Front Buttoned...,,,1999,1039.48,(upto 48% Off),,,https://www.firstcry.com/global-desi-girl/global-desi-girl-sleeveless-leaves-embroidered-front-buttoned-jumpsuit-navy-blue/8279300/product-detail
Global Desi Girl Short Sleeves Button Down Jumpsuit - Blue,,,1699,883.48,(48% Off),,,https://www.firstcry.com/global-desi-girl/global-desi-girl-short-sleeves-button-down-jumpsuit-blue/8359245/product-detail
Babyhug Dungaree With Half Sleeves Tee Printed - Yellow,,1 Left,799,647.19,(19% Off),,,https://www.firstcry.com/babyhug/babyhug-dungaree-with-half-sleeves-tee-printed-yellow/8581730/product-detail
Nauti Nati Sleeveless Design Print Jumpsuit - Multi Colour,,,1399,727.48,(48% Off),,,https://www.firstcry.com/nauti-nati/nauti-nati-sleeveless-design-print-jumpsuit-multi-colour/9374446/product-detail
Nauti Nati Sleeveless Aztec Print Jumpsuit - Black,,,999,569.43,(43% Off),,,https://www.firstcry.com/nauti-nati/nauti-nati-sleeveless-aztec-print-jumpsuit-black/9374406/product-detail
Nauti Nati Sleeveless Striped Cotton Jumpsuit - Multicolor,,,999,519.48,(48% Off),,,https://www.firstcry.com/nauti-nati/nauti-nati-sleeveless-striped-cotton-jumpsuit-multicolor/9374293/product-detail
Nauti Nati Sleeveless Triangle Printed Polyester Jumpsuit - Pink,,,999,569.43,(43% Off),,,https://www.firstcry.com/nauti-nati/nauti-nati-sleeveless-triangle-printed-polyester-jumpsuit-pink/9374219/product-detail
Nauti Nati Sleeveless Floral Print Jumpsuit - Multi Colour,,,1199,623.48,(48% Off),,,https://www.firstcry.com/nauti-nati/nauti-nati-sleeveless-floral-print-jumpsuit-multi-colour/9374153/product-detail
Nauti Nati Half Sleeves Floral Printed Jumpsuit - Multi Colour,,,999,569.43,(43% Off),,,https://www.firstcry.com/nauti-nati/nauti-nati-half-sleeves-floral-printed-jumpsuit-multi-colour/9374134/product-detail
Natilene Sleeveless Printed Jumpsuit - Multi Colour,,,1049,597.93,(43% Off),,,https://www.firstcry.com/natilene/natilene-sleeveless-printed-jumpsuit-multi-colour/9374107/product-detail
Nauti Nati Sleeveless Printed Polyester Jumpsuit - Multicolor,,,1049,597.93,(43% Off),,,https://www.firstcry.com/nauti-nati/nauti-nati-sleeveless-printed-polyester-jumpsuit-multicolor/9373856/product-detail
Nauti Nati Sleeveless Tiny Flower Print Jumpsuit - Blue,,,999,519.48,(48% Off),,,https://www.firstcry.com/nauti-nati/nauti-nati-sleeveless-tiny-flower-print-jumpsuit-blue/9373840/product-detail
Nauti Nati Half Sleeves Printed Polyester Jumpsuit - Multicolor,,,999,519.48,(48% Off),,,https://www.firstcry.com/nauti-nati/nauti-nati-half-sleeves-printed-polyester-jumpsuit-multicolor/9373819/product-detail
Nauti Nati Sleeveless Tiny Flower Printed Viscose Jumpsuit - Blue,,,999,519.48,(48% Off),,,https://www.firstcry.com/nauti-nati/nauti-nati-sleeveless-tiny-flower-printed-viscose-jumpsuit-blue/9373791/product-detail
Natilene Sleeveless Striped Polyester Jumpsuit - Multicolor,,,1499,779.48,(48% Off),,,https://www.firstcry.com/natilene/natilene-sleeveless-striped-polyester-jumpsuit-multicolor/9373751/product-detail
Babyhug Single Sleeves Pom Pom Lace One Shoulder Jumpsuit Butterfly...,,1 Left,499,399.2,(upto 20% Off),,,https://www.firstcry.com/babyhug/babyhug-single-sleeves-pom-pom-lace-one-shoulder-jumpsuit-butterfly-print-blue/8476208/product-detail
Babyhug Half Sleeves T-shirt and Dungaree Set - Orange,,1 Left,999,809.19,(19% Off),,,https://www.firstcry.com/babyhug/babyhug-half-sleeves-t-shirt-and-dungaree-set-orange/8849761/product-detail
Little Kangaroos Denim Dungaree with Half Sleeves Inner Tee Tree Print...,,1 Left,,1149,,,,https://www.firstcry.com/little-kangaroos/little-kangaroos-denim-dungaree-with-half-sleeves-inner-tee-tree-print-blue/9191929/product-detail
I Bears Full Sleeves Footed Romper Christmas Print Pack of 2 - Red...,,1 Left,990,801.9,(19% Off),,,https://www.firstcry.com/i-bears/i-bears-full-sleeves-footed-romper-christmas-print-pack-of-2-red-white/3247709/product-detail
ToffyHouse Dungaree Romper with Half Sleeves Tee Boat Embroidery - Brown,,1 Left,,845,,,,https://www.firstcry.com/toffyhouse/toffyhouse-dungaree-romper-with-half-sleeves-tee-boat-embroidery-brown/9010009/product-detail
Jo&Bo Short Sleeves Mock Waistcoat Romper With Bow Tie - Maroon,,1 Left,649,532.18,(18% Off),,,https://www.firstcry.com/joandbo/joandbo-short-sleeves-mock-waistcoat-romper-with-bow-tie-maroon/9106985/product-detail
Babyhug Full Sleeves 100% Cotton Printed Onesie - Navy Blue,,1 Left,349,293.16,(upto 19% Off),,,https://www.firstcry.com/babyhug/babyhug-full-sleeves-100-cotton-printed-onesie-navy-blue/3794081/product-detail
Dapper Dudes Half Sleeves Abstract Print Tee With Dungaree - Navy Blue,,1 Left,699,608.13,(13% Off),,,https://www.firstcry.com/dapper-dudes/dapper-dudes-half-sleeves-abstract-print-tee-with-dungaree-navy-blue/9021812/product-detail
Babyhug Dungaree Style Romper and Half Sleeves Striped Inner Tee -...,,1 Left,699,587.16,(16% Off),,,https://www.firstcry.com/babyhug/babyhug-dungaree-style-romper-and-half-sleeves-striped-inner-tee-pink/8444980/product-detail
Kiddopanti Sleeveless Logo Design Dungaree - Dark Blue,,1 Left,999,669.33,(upto 33% Off),,,https://www.firstcry.com/kiddopanti/kiddopanti-sleeveless-logo-design-dungaree-dark-blue/9133056/product-detail
Jo&Bo Half Sleeves Solid Color Romper - Burgundy,,1 Left,649,532.18,(18% Off),,,https://www.firstcry.com/joandbo/joandbo-half-sleeves-solid-color-romper-burgundy/8966651/product-detail
Babyoye Cotton Dungaree Style Romper With Short Sleeves Tee Multiprint...,,1 Left,1199,971.19,(19% Off),,,https://www.firstcry.com/babyoye/babyoye-cotton-dungaree-style-romper-with-short-sleeves-tee-multiprint-green/8576720/product-detail
Carter's Floral Sunsuit - Blue,,1 Left,899,647.28,(28% Off),,,https://www.firstcry.com/carters/carters-floral-sunsuit-blue/8013756/product-detail
Nauti Nati Sleeveless All Over Printed Jumpsuit - Black,,,1049,597.93,(43% Off),,,https://www.firstcry.com/nauti-nati/nauti-nati-sleeveless-all-over-printed-jumpsuit-black/9206079/product-detail
Babyoye Biowash Flutter Sleeves Onesie Floral Print - Navy,,1 Left,499,409.18,(18% Off),,,https://www.firstcry.com/babyoye/babyoye-biowash-flutter-sleeves-onesie-floral-print-navy/8275118/product-detail
Babyoye Short Sleeves Cotton Blend Jumpsuit with Embroidered Hem - Blue,,1 Left,999,839.16,(upto 17% Off),,,https://www.firstcry.com/babyoye/babyoye-short-sleeves-cotton-blend-jumpsuit-with-embroidered-hem-blue/8513977/product-detail
Nottie Planet Short Sleeves Tee With Printed Dungaree - Pink,,1 Left,999,819.18,(18% Off),,,https://www.firstcry.com/nottie-planet/nottie-planet-short-sleeves-tee-with-printed-dungaree-pink/9090086/product-detail
Nottie Planet Short Sleeves Tee With Printed Dungaree - Blue,,2 Left,999,819.18,(18% Off),,,https://www.firstcry.com/nottie-planet/nottie-planet-short-sleeves-tee-with-printed-dungaree-blue/9090076/product-detail
I Bears Half sleeves Onesies Floral Print Pack of 3 - Pink,,1 Left,630,535.5,(upto 17% Off),,,https://www.firstcry.com/i-bears/i-bears-half-sleeves-onesies-floral-print-pack-of-3-pink/8947287/product-detail
Li'L tomatoes Half Sleeves Tee With Animal Print Detailing Dungaree &...,,1 Left,999,569.43,(43% Off),,,https://www.firstcry.com/lil-tomatoes/lil-tomatoes-half-sleeves-tee-with-animal-print-detailing-dungaree-and-surprise-gift-yellow/9074589/product-detail
Li'L tomatoes Striped Half Sleeves Tee With Dungaree & Gift - White...,,1 Left,1099,626.43,(43% Off),,,https://www.firstcry.com/lil-tomatoes/lil-tomatoes-striped-half-sleeves-tee-with-dungaree-and-gift-white-and-green/9074576/product-detail
Li'L tomatoes Half Sleeves T-Shirt Striped Dungaree Set With A...,,2 Left,999,569.43,(43% Off),,,https://www.firstcry.com/lil-tomatoes/lil-tomatoes-half-sleeves-t-shirt-striped-dungaree-set-with-a-surprise-gift-red-white/9074569/product-detail
Nauti Nati Half Sleeves Embroidery Cotton Jumpsuit - Orange,,,1099,626.43,(43% Off),,,https://www.firstcry.com/nauti-nati/nauti-nati-half-sleeves-embroidery-cotton-jumpsuit-orange/9051706/product-detail
Babyoye Cotton Half Sleeves Romper Kitty Face Print - Pink,,1 Left,699,587.16,(upto 17% Off),,,https://www.firstcry.com/babyoye/babyoye-cotton-half-sleeves-romper-kitty-face-print-pink/8709669/product-detail
Babyoye Singlet Sleeves Onesie Floral Print Pack of 3 - Pink Blue,,1 Left,1099,890.19,(upto 21% Off),,,https://www.firstcry.com/babyoye/babyoye-singlet-sleeves-onesie-floral-print-pack-of-3-pink-blue/8275103/product-detail
M'andy Strawberry Print Short Sleeves Top With Dungaree - Pink,,1 Left,849,738.63,(13% Off),,,https://www.firstcry.com/mandy/mandy-strawberry-print-short-sleeves-top-with-dungaree-pink/8792648/product-detail
VParents Full Sleeves Foooted Rompers Elephant Print Pack of 3...,,,1499,824.45,(45% Off),,,https://www.firstcry.com/vparents/vparents-full-sleeves-foooted-rompers-elephant-print-pack-of-3-white-sea-green/8549054/product-detail
Carter's Pocket Snap-Front Romper - Navy Blue,,1 Left,799,559.3,(30% Off),,,https://www.firstcry.com/carters/carters-pocket-snap-front-romper-navy-blue/8014409/product-detail
Nauti Nati Half Sleeves Tee With Flower Print Dungaree - Multicolor,,3 Left,1499,854.43,(43% Off),,,https://www.firstcry.com/nauti-nati/nauti-nati-half-sleeves-tee-with-flower-print-dungaree-multicolor/8785884/product-detail
Nauti Nati Printed Dungaree With Half Sleeves T-Shirt - Blue,,,1399,797.43,(43% Off),,,https://www.firstcry.com/nauti-nati/nauti-nati-printed-dungaree-with-half-sleeves-t-shirt-blue/8785715/product-detail
Kiddopanti Sleeveless All Over Printed Dungaree - Dark Grey,,2 Left,899,782.13,(13% Off),,,https://www.firstcry.com/kiddopanti/kiddopanti-sleeveless-all-over-printed-dungaree-dark-grey/8754284/product-detail
Babyoye Full Sleeves Frock Style Onesie Butterfly Print - Navy Blue,,1 Left,599,377.37,(upto 44% Off),,,https://www.firstcry.com/babyoye/babyoye-full-sleeves-frock-style-onesie-butterfly-print-navy-blue/8112676/product-detail
Kookie Kids Winter Wear Footed Romper Construction Vehicle Print...,,1 Left,946,766.26,(upto 31% Off),,,https://www.firstcry.com/kookie-kids/kookie-kids-winter-wear-footed-romper-construction-vehicle-print-white-pink/8232368/product-detail
Carter's 3 Piece Gingham Dress Me Up Set - Pink,,1 Left,,2399,,,,https://www.firstcry.com/carters/carters-3-piece-gingham-dress-me-up-set-pink/2922458/product-detail
UPTOWNIE Sleeveless Solid Colour Jumpsuit - Navy Blue,,1 Left,1599,831.48,(48% Off),,,https://www.firstcry.com/uptownie/uptownie-sleeveless-solid-colour-jumpsuit-navy-blue/8556037/product-detail
Nauti Nati Full Sleeves Watermelon Printed Top With Dungaree - White,,,1399,727.48,(48% Off),,,https://www.firstcry.com/nauti-nati/nauti-nati-full-sleeves-watermelon-printed-top-with-dungaree-white/8477425/product-detail
Nauti Nati Sleeveless All Over Printed Jumpsuit - Multi Colour,,3 Left,995,517.4,(48% Off),,,https://www.firstcry.com/nauti-nati/nauti-nati-sleeveless-all-over-printed-jumpsuit-multi-colour/8477109/product-detail
Mark & Mia Party Wear Short Sleeves Frock Style Onesie Crown Print -...,,1 Left,1095,678.9,(38% Off),,,https://www.firstcry.com/mark-and-mia/mark-and-mia-party-wear-short-sleeves-frock-style-onesie-crown-print-white/3813492/product-detail
Babyoye Full Sleeves Cotton Romper Animal Print Pack of 2 - White Peach,,1 Left,999,829.17,(upto 26% Off),,,https://www.firstcry.com/babyoye/babyoye-full-sleeves-cotton-romper-animal-print-pack-of-2-white-peach/3643056/product-detail
Carter's Hooded Sherpa Pram - Brown,,1 Left,2299,1540.33,(33% Off),,,https://www.firstcry.com/carters/carters-hooded-sherpa-pram-brown/3394156/product-detail
A Little Fable Sleeveless Checked Jumpsuit - Multi Colour,,,1490,581.1,(upto 61% Off),,,https://www.firstcry.com/a-little-fable/a-little-fable-sleeveless-checked-jumpsuit-multi-colour/8354833/product-detail
Wonderchild Full Sleeves Flower Printed Footed Romper - Peach,,1 Left,595,547.4,(8% Off),,,https://www.firstcry.com/wonderchild/wonderchild-full-sleeves-flower-printed-footed-romper-peach/3770839/product-detail
JusCubs Full Sleeves Striped Romper With Cap - Navy Blue,,1 Left,999,369.63,(upto 65% Off),,,https://www.firstcry.com/juscubs/juscubs-full-sleeves-striped-romper-with-cap-navy-blue/3760133/product-detail
JusCubs Hello Tiger Sleeveless Romper - Beige,,2 Left,999,349.65,(65% Off),,,https://www.firstcry.com/juscubs/juscubs-hello-tiger-sleeveless-romper-beige/3760122/product-detail
JusCubs Half Sleeve Animal Printed Onesie - Yellow,,2 Left,799,295.63,(63% Off),,,https://www.firstcry.com/juscubs/juscubs-half-sleeve-animal-printed-onesie-yellow/3760115/product-detail
Carter's 2 Pack Animal Jumpsuits - Blue,,1 Left,1649,1137.81,(upto 31% Off),,,https://www.firstcry.com/carters/carters-2-pack-animal-jumpsuits-blue/3393986/product-detail
Carter's 3-Piece Dog Little Jacket Set - Blue,,1 Left,,1649,(upto 32% Off),,,https://www.firstcry.com/carters/carters-3-piece-dog-little-jacket-set-blue/3393984/product-detail
Carter's 3-Piece Bunny Little Cardigan Set - Pink White,,1 Left,1649,1088.34,(upto 34% Off),,,https://www.firstcry.com/carters/carters-3-piece-bunny-little-cardigan-set-pink-white/3393830/product-detail
Carter's 3-Piece Sun Little Jacket Set - Pink,,1 Left,,1899,(upto 34% Off),,,https://www.firstcry.com/carters/carters-3-piece-sun-little-jacket-set-pink/3393924/product-detail
Carter's 2-Pack Cotton Zip-Up Sleep & Play - Pink,,1 Left,,1899,,,,https://www.firstcry.com/carters/carters-2-pack-cotton-zip-up-sleep-and-play-pink/3393805/product-detail
Carter's 3-Piece Cloud Little Jacket Set - White,,1 Left,,1899,,,,https://www.firstcry.com/carters/carters-3-piece-cloud-little-jacket-set-white/3393915/product-detail
Babyoye Cotton Stripe Dungaree with Half Sleeves Inner Tee - Blue Green,,1 Left,1199,851.29,(29% Off),,,https://www.firstcry.com/babyoye/babyoye-cotton-stripe-dungaree-with-half-sleeves-inner-tee-blue-green/3669291/product-detail
Tiny Girl Sleeveless Short Length Denim Dungaree - Black,,,1895,985.4,(48% Off),,,https://www.firstcry.com/tiny-girl/tiny-girl-sleeveless-short-length-denim-dungaree-black/8106231/product-detail
Nauti Nati Cap Sleeves Chevron Print Detailing Jumpsuit - Multi Colour,,,1199,623.48,(48% Off),,,https://www.firstcry.com/nauti-nati/nauti-nati-cap-sleeves-chevron-print-detailing-jumpsuit-multi-colour/3712380/product-detail
Nauti Nati Half Sleeves Embroidered Pom Pom Lace Detailing Jumpsuit -...,,,1049,545.48,(48% Off),,,https://www.firstcry.com/nauti-nati/nauti-nati-half-sleeves-embroidered-pom-pom-lace-detailing-jumpsuit-blue/3712349/product-detail
Nino Bambino Sleeveless Flowers Printed Onesie Style Dress - Black,,1 Left,999,519.48,(48% Off),,,https://www.firstcry.com/nino-bambino/nino-bambino-sleeveless-flowers-printed-onesie-style-dress-black/3594546/product-detail
Carter's Polka Dot Chambray Romper - Blue,,1 Left,,899,,,,https://www.firstcry.com/carters/carters-polka-dot-chambray-romper-blue/2923671/product-detail
Carter's Butterfly Snap-Up Romper - Blue,,1 Left,849,500.91,(upto 44% Off),,,https://www.firstcry.com/carters/carters-butterfly-snap-up-romper-blue/2923873/product-detail
Carter's 3 Piece Plaid Dress Me Up Set - Blue,,1 Left,2399,1511.37,(upto 37% Off),,,https://www.firstcry.com/carters/carters-3-piece-plaid-dress-me-up-set-blue/2922452/product-detail
Carter's Gingham Jersey Jumpsuit - Pink,,1 Left,,1099,,,,https://www.firstcry.com/carters/carters-gingham-jersey-jumpsuit-pink/2924149/product-detail
Carter's Baseball Snap-Up Romper - Grey,,1 Left,,849,,,,https://www.firstcry.com/carters/carters-baseball-snap-up-romper-grey/2923809/product-detail
Carter's Striped Crab Jersey Romper - Red,,1 Left,,899,,,,https://www.firstcry.com/carters/carters-striped-crab-jersey-romper-red/2923574/product-detail
