name,badge_1,badge_2,badge_3,mrp,discounted_price,discount,rating,rating_count,link
"Arata Natural Lip balm (10 gm) for dry, chapped lips with Intense Moisturizing || Power of Cardamom oil || Cocoa & Mango butter  ",Limited time deal,Sponsored,,₹249,₹186.75,Save ₹62.25 (25%),3.7 out of 5 stars,"2,084",https://www.amazon.in/gp/slredirect/picassoRedirect.html/ref=pa_sp_atf_aps_sr_pg1_1?ie=UTF8&adId=A0329045PHKT1Y9PGTET&url=%2FArata-Zero-Chemicals-Lip-Balm%2Fdp%2FB0797LJBBX%2Fref%3Dsr_1_1_sspa%3Fdchild%3D1%26keywords%3Dlip%2Bbalm%26qid%3D1627656039%26smid%3DAJZVRGJTZSSIP%26sr%3D8-1-spons%26psc%3D1&qualifier=1627656039&id=1054522685117068&widgetName=sp_atf
"ENN Pucker Hydrating Lip Balm , 15gm  ",,Sponsored,,₹900,₹680,Save ₹220 (24%),4.3 out of 5 stars,180,https://www.amazon.in/gp/slredirect/picassoRedirect.html/ref=pa_sp_atf_aps_sr_pg1_1?ie=UTF8&adId=A05247522N1CLFLCVME01&url=%2FENN-Pucker-Hydrating-Mask-Hyaluronic%2Fdp%2FB087TYHT7P%2Fref%3Dsr_1_2_sspa%3Fdchild%3D1%26keywords%3Dlip%2Bbalm%26qid%3D1627656039%26sr%3D8-2-spons%26psc%3D1&qualifier=1627656039&id=1054522685117068&widgetName=sp_atf
"Juicy Chemistry Organic Lip Balm, Blood Orange & Rosehip Lip Care for Dry and Chapped Lips, 5 gm Moisturizing Natural Lip Butter for Men & Women  ",Limited time deal,Sponsored,,₹350,₹263,Save ₹87 (25%),4.3 out of 5 stars,"1,231",https://www.amazon.in/gp/slredirect/picassoRedirect.html/ref=pa_sp_atf_aps_sr_pg1_1?ie=UTF8&adId=A0029258SDG65EYX175D&url=%2FJuicy-Chemistry-Organic-Rosehip-Orange%2Fdp%2FB01N2LYRWX%2Fref%3Dsr_1_3_sspa%3Fdchild%3D1%26keywords%3Dlip%2Bbalm%26qid%3D1627656039%26smid%3DA78ZYFRN07QE5%26sr%3D8-3-spons%26psc%3D1&qualifier=1627656039&id=1054522685117068&widgetName=sp_atf
"TNW-The Natural Wash Herbal Beetroot Lip Balm For Dry Damaged and Chapped Lips | An Ayurvedic Lip Moisturizer LipBalm Enriched with Cocoa Butter, Shea Butter & Essential Oils (Paraben-free) - 5 gm  ",,Sponsored,,₹260,₹199,Save ₹61 (23%),4.0 out of 5 stars,"1,561",https://www.amazon.in/gp/slredirect/picassoRedirect.html/ref=pa_sp_atf_aps_sr_pg1_1?ie=UTF8&adId=A02259001UFCF86EQBNW2&url=%2FTNW-Natural-Herbal-Beetroot-Paraben-free%2Fdp%2FB07YQZJWBY%2Fref%3Dsr_1_4_sspa%3Fdchild%3D1%26keywords%3Dlip%2Bbalm%26qid%3D1627656039%26sr%3D8-4-spons%26psc%3D1&qualifier=1627656039&id=1054522685117068&widgetName=sp_atf
"Maybelline New York Baby Lips Lip Balm, Pink Lolita, 4g  ",Best seller,,,₹175,₹101,Save ₹74 (42%),4.2 out of 5 stars,"11,603",https://www.amazon.in/gp/bestsellers/beauty/1374439031/ref=sr_bs_4_1374439031_1
"Biotique Bio Fruit Whitening Lip Balm, 12g  ",Amazon's Choice,,,₹175,₹131,Save ₹44 (25%),4.3 out of 5 stars,"11,533",https://www.amazon.in/Biotique-Fruit-Whitening-Lightens-Evens-Out/dp/B008TO6I1E/ref=ice_ac_b_dpb?dchild=1&keywords=lip+balm&qid=1627656039&sr=8-6
"NIVEA Lip Balm, Fruity Cherry Shine, 4.8g  ",,,,₹185,₹138,Save ₹47 (25%),4.3 out of 5 stars,"5,940",https://www.amazon.in/Nivea-Care-Fruity-Shine-Cherry/dp/B00791D3QG/ref=sr_1_7?dchild=1&keywords=lip+balm&qid=1627656039&sr=8-7
"NIVEA Lip Balm, Fruity Berry Shine, 4.8g  ",,,,₹185,₹104,Save ₹81 (44%),4.3 out of 5 stars,"6,522",https://www.amazon.in/Nivea-Care-Fruity-Shine-Blackberry/dp/B01LXLSEE6/ref=sr_1_8?dchild=1&keywords=lip+balm&qid=1627656039&sr=8-8
"Organic Harvest Lily Flavour Pink Lip Balm With Benefits of Jojoba Oil & Shea Butter For Women Dark Lips to Lighten | Kids/ Girls Lip Care for Dry & Chapped Lips | 100% Organic, Paraben & Sulphate Free Lip Gloss - 10 gm  ",Best sellerLimited time deal,,,₹249,₹199,Save ₹50 (20%),3.8 out of 5 stars,"4,642",https://www.amazon.in/gp/bestsellers/beauty/9530430031/ref=sr_bs_8_9530430031_1
"NIVEA Lip Balm, Original Care, 4.8g  ",,,,₹140,₹112,Save ₹28 (20%),4.3 out of 5 stars,"4,194",https://www.amazon.in/Nivea-Lip-Balm-Original-Care/dp/B007E9JC7W/ref=sr_1_10?dchild=1&keywords=lip+balm&qid=1627656039&sr=8-10
"Vaadi Herbals Lip Balm, Strawberry And Honey, 10g (Pack Of 4)  ",,,,₹272,₹170,Save ₹102 (38%),4.2 out of 5 stars,"1,878",https://www.amazon.in/Vaadi-Herbals-Balm-Strawberry-Honey/dp/B01B43ICG0/ref=sr_1_11?dchild=1&keywords=lip+balm&qid=1627656039&sr=8-11
"The Man Company Lightening Lip Balm | Vitamin E, Liquorice & Coconut Oil | Provides Lip Care to Dry, Chapped & Dark Lips | Moisturizes, Nourishes, Softens Lips - 4gm  ",,,,₹249,₹192,Save ₹57 (23%),3.8 out of 5 stars,"1,252",https://www.amazon.in/Man-Company-Lightening-Vitamin-Liquorice/dp/B08PBY7L13/ref=sr_1_12?dchild=1&keywords=lip+balm&qid=1627656039&sr=8-12
"SUGAR Cosmetics SUGAR Tipsy Lips Moisturizing Balm - 07 Bramble Relieves Dry, Chapped Lips, Protection From Sun Damage, Enriched With Vitamin E, Shea Butter And Jojoba Oil  ",,,,,₹199,,4.2 out of 5 stars,"2,074",https://www.amazon.in/SUGAR-Cosmetics-Tipsy-Lips-Moisturizing/dp/B08J43LF5N/ref=sr_1_13?dchild=1&keywords=lip+balm&qid=1627656039&sr=8-13
"Biotique Bio Berry Plumping Lip Balm Smoothes & Swells Lips, 12G  ",,,,₹175,₹114,Save ₹61 (35%),4.2 out of 5 stars,"2,264",https://www.amazon.in/Biotique-Berry-Plumping-Smoothes-Swells/dp/B004WSWCNE/ref=sr_1_14?dchild=1&keywords=lip+balm&qid=1627656039&sr=8-14
"TNW-The Natural Wash Herbal Beetroot Lip Balm For Dry Damaged and Chapped Lips | An Ayurvedic Lip Moisturizer LipBalm Enriched with Cocoa Butter, Shea Butter & Essential Oils (Paraben-free) - 5 gm  ",,,,₹260,₹199,Save ₹61 (23%),4.0 out of 5 stars,"1,561",https://www.amazon.in/TNW-Natural-Herbal-Beetroot-Paraben-free/dp/B07YQZJWBY/ref=sr_1_15?dchild=1&keywords=lip+balm&qid=1627656039&sr=8-15
"NIVEA Lip Balm, Fruity Strawberry Shine, 4.8g  ",,,,₹185,₹138,Save ₹47 (25%),4.2 out of 5 stars,"2,665",https://www.amazon.in/Nivea-Care-Fruity-Shine-Strawberry/dp/B007E9JFK6/ref=sr_1_16?dchild=1&keywords=lip+balm&qid=1627656039&sr=8-16
"Maybelline New York Baby Lips Color Changing Lip Balm, Peach Blossom, 1.7g  ",,,,₹180,₹144,Save ₹36 (20%),4.2 out of 5 stars,"6,225",https://www.amazon.in/Maybelline-Color-Changing-Peach-Blossom/dp/B01FFDTM6O/ref=sr_1_17?dchild=1&keywords=lip+balm&qid=1627656039&sr=8-17
"Himalaya Rich Cocoa Butter Lip Care, 4.5g  ",,,,₹150,₹120,Save ₹30 (20%),4.2 out of 5 stars,582,https://www.amazon.in/Himalaya-Rich-Cocoa-Butter-Care/dp/B01BNMIN2U/ref=sr_1_18?dchild=1&keywords=lip+balm&qid=1627656039&sr=8-18
"NIVEA Lip Balm, Soft Rose, 4.8g  ",,,,₹185,₹139,Save ₹46 (25%),4.1 out of 5 stars,"3,316",https://www.amazon.in/Nivea-Lip-Care-Soft-Rose/dp/B000KUAKS2/ref=sr_1_19?dchild=1&keywords=lip+balm&qid=1627656039&sr=8-19
"Leaf Roots Nature's Science Beetroot Lip Balm,100% Organic Lip Balm With Shea Butter, Cocoa Butter & Almond Oil, For Both Men & Women,8gm  ",,,,₹499,₹229,Save ₹270 (54%),4.8 out of 5 stars,17,https://www.amazon.in/Leaf-Roots-Natures-Science-Beetroot/dp/B097DT9NPJ/ref=sr_1_20?dchild=1&keywords=lip+balm&qid=1627656039&sr=8-20
"Organic Harvest Green Tea Flavour Lip Balm With Benefits of Jojoba Oil, Vitamin E, Green Tea Oil, For Women Dark Lips to Lighten | Kids/ Girls Lip Care for Dry & Chapped Lips | 100% Organic, Paraben & Sulphate Free Lip Gloss - 10 gm  ",Best sellerLimited time deal,Sponsored,,₹249,₹199,Save ₹50 (20%),3.8 out of 5 stars,"4,642",https://www.amazon.in/gp/bestsellers/beauty/9530430031/ref=sr_bs_20_9530430031_1
"Organic Harvest Strawberry Flavour Non Colored Lip Balm Enriched With Shea Butter & Lanolin, For Dark Lips to Lighten, Lip Care for Dry & Chapped Lips, 100% Organic, Paraben & Sulphate Free For Girls & Women - 8gm  ",Limited time deal,Sponsored,,₹249,₹199,Save ₹50 (20%),4.1 out of 5 stars,"1,306",https://www.amazon.in/gp/slredirect/picassoRedirect.html/ref=pa_sp_mtf_aps_sr_pg1_1?ie=UTF8&adId=A071610214N4MP3GXPYMP&url=%2FOrganic-Harvest-Strawberry-Lip-Balm%2Fdp%2FB01ARQGR2Q%2Fref%3Dsr_1_22_sspa%3Fdchild%3D1%26keywords%3Dlip%2Bbalm%26qid%3D1627656039%26smid%3DAMUQ56Q1P787N%26sr%3D8-22-spons%26psc%3D1&qualifier=1627656039&id=1054522685117068&widgetName=sp_mtf
"Organic Harvest Lily Lip Butter (Rose, Pack of 1)  ",,Sponsored,,,₹199,,3.8 out of 5 stars,"1,770",https://www.amazon.in/gp/slredirect/picassoRedirect.html/ref=pa_sp_mtf_aps_sr_pg1_1?ie=UTF8&adId=A06322632CZYQGXAMKQLT&url=%2FOrganic-Harvest-Chapped-Certified-Sulphate%2Fdp%2FB07Z23NGTL%2Fref%3Dsr_1_23_sspa%3Fdchild%3D1%26keywords%3Dlip%2Bbalm%26qid%3D1627656039%26sr%3D8-23-spons%26psc%3D1&qualifier=1627656039&id=1054522685117068&widgetName=sp_mtf
"The Man Company Nourishing Lip Balm | Vitamin E, Almond & Olive Oil | Soft, Supple, Moisturizes | Hydrates | Free from Dry, Chapped Lips | Natural Essential Oils - 4gm  ",,Sponsored,,₹199,₹155,Save ₹44 (22%),3.7 out of 5 stars,504,https://www.amazon.in/gp/slredirect/picassoRedirect.html/ref=pa_sp_mtf_aps_sr_pg1_1?ie=UTF8&adId=A031236122XKBGOPJGTMZ&url=%2FMan-Company-Nourishing-Vitamin-Almond%2Fdp%2FB08P7PZTDM%2Fref%3Dsr_1_24_sspa%3Fdchild%3D1%26keywords%3Dlip%2Bbalm%26qid%3D1627656039%26sr%3D8-24-spons%26psc%3D1%26smid%3DA3OULVKAFTD7K5&qualifier=1627656039&id=1054522685117068&widgetName=sp_mtf
The Moms Co. Natural Lip Balm I Non Sticky I Protects & Nourishes Dry Chapped Lips I Shea & Cocoa Butter( 5gm) (Vanilla)  ,,,,₹199,₹169,Save ₹30 (15%),3.8 out of 5 stars,62,https://www.amazon.in/Moms-Natural-Protects-Nourishes-Chapped/dp/B092R4KXYF/ref=sr_1_25?dchild=1&keywords=lip+balm&qid=1627656039&sr=8-25
Plum Candy Melts Vegan Lip Balm for Softer Lips | Red Velvet Love | With Natural UV Protection | Enriched with Shea Butter | 100% Cruelty Free | 12g  ,,,,₹295,₹250,Save ₹45 (15%),4.3 out of 5 stars,558,https://www.amazon.in/Plum-Velvet-Tinted-Fruity-Cruelty/dp/B08MC5MJ33/ref=sr_1_26?dchild=1&keywords=lip+balm&qid=1627656039&sr=8-26
"The Body Shop SPF 15 Vitamin E Lip Care, 4.2 g  ",,,,,₹395,,4.3 out of 5 stars,681,https://www.amazon.in/Body-Shop-Spf15-Vitamin-Care/dp/B074MFPP5W/ref=sr_1_27?dchild=1&keywords=lip+balm&qid=1627656039&sr=8-27
"Iba Halal Care Moisture Rich Lip Balm - Strawberry, 4.5 g  ",,,,,₹150,,4.1 out of 5 stars,657,https://www.amazon.in/Iba-Halal-Care-Moisture-Rich/dp/B07MDFBQYF/ref=sr_1_28?dchild=1&keywords=lip+balm&qid=1627656039&sr=8-28
"Nivea Original Care Lip Balm, 4.8g  ",,,,₹140,₹112,Save ₹28 (20%),4.4 out of 5 stars,985,https://www.amazon.in/Nivea-Original-Care-Balm-4-8g/dp/B074N8YFD3/ref=sr_1_29?dchild=1&keywords=lip+balm&qid=1627656039&sr=8-29
"Blue Heaven Lip Bomb (Strawberry, Clear, 8g)  ",,,,₹85,₹84,Save ₹1 (1%),3.7 out of 5 stars,63,https://www.amazon.in/Blue-Heaven-Bomb-Strawberry-Clear/dp/B07JBMQYHV/ref=sr_1_30?dchild=1&keywords=lip+balm&qid=1627656039&sr=8-30
Plum Candy Melts Vegan Lip Balm for Softer Lips | Berry Feast | With Natural UV Protection | Enriched with Shea Butter | 100% Cruelty Free | 12g  ,,,,₹295,₹250,Save ₹45 (15%),4.4 out of 5 stars,295,https://www.amazon.in/Plum-Candy-Melts-Tinted-Cruelty/dp/B08MC3CBZ9/ref=sr_1_31?dchild=1&keywords=lip+balm&qid=1627656039&sr=8-31
"Lakmé Lip Love Gelato Chapstick, Moisturizing Tinted Lip Balm With Spf 15, Crème Finish, 4.5g - Berry Mint  ",,,,,₹150,,4.1 out of 5 stars,180,https://www.amazon.in/LAKM%C3%89-Love-Gelato-Chapstick-Berry/dp/B08HSRQDHY/ref=sr_1_32?dchild=1&keywords=lip+balm&qid=1627656039&sr=8-32
"Organic Harvest Lily Lip Butter Enriched With Vitamin E & Benefits Of Mango Butter, For Dark Lips to Lighten, Lip Care for Dry & Chapped Lips, 100% Organic, Paraben & Sulphate Free For Girls & Women - 4 gm  ",,,,₹249,₹199,Save ₹50 (20%),3.8 out of 5 stars,"1,770",https://www.amazon.in/Organic-Harvest-Chapped-Certified-Sulphate/dp/B07Z23JD99/ref=sr_1_33?dchild=1&keywords=lip+balm&qid=1627656039&sr=8-33
"The Body Shop Born Lippy Pot Lip Balm, Strawberry, 10ml  ",,,,,₹295,,4.5 out of 5 stars,511,https://www.amazon.in/Body-Shop-Born-Lippy-Strawberry/dp/B074MGXM74/ref=sr_1_34?dchild=1&keywords=lip+balm&qid=1627656039&sr=8-34
"The Man Company Nourishing Lip Balm | Vitamin E, Almond & Olive Oil | Soft, Supple, Moisturizes | Hydrates | Free from Dry, Chapped Lips | Natural Essential Oils - 4gm  ",,,,₹199,₹155,Save ₹44 (22%),3.7 out of 5 stars,504,https://www.amazon.in/Man-Company-Nourishing-Vitamin-Almond/dp/B08P7PZTDM/ref=sr_1_35?dchild=1&keywords=lip+balm&qid=1627656039&sr=8-35
"Juicy Chemistry Organic Lip Balm, Blood Orange & Rosehip Lip Care for Dry and Chapped Lips, 5 gm Moisturizing Natural Lip Butter for Men & Women  ",Limited time deal,,,₹350,₹263,Save ₹87 (25%),4.3 out of 5 stars,"1,231",https://www.amazon.in/Juicy-Chemistry-Organic-Rosehip-Orange/dp/B01N2LYRWX/ref=sr_1_36?dchild=1&keywords=lip+balm&qid=1627656039&smid=A78ZYFRN07QE5&sr=8-36
"Blue Heaven lip balm bubblegum (Pack of: 2, 8 g)  ",,,,,₹170,,3.7 out of 5 stars,16,https://www.amazon.in/Blue-Heaven-balm-bubblegum-Pack/dp/B091DYTJX3/ref=sr_1_37?dchild=1&keywords=lip+balm&qid=1627656039&sr=8-37
"SebaMed SPF 30 Lip Defense Stick, 4.8g  ",,,,₹427,₹333,Save ₹94 (22%),4.3 out of 5 stars,"1,466",https://www.amazon.in/SebaMed-Defense-Stick-Chapped-Lips/dp/B00DRE5HGS/ref=sr_1_38?dchild=1&keywords=lip+balm&qid=1627656039&sr=8-38
"Beardo Bubblegum Lip Balm for Men 7 gm | for soft Kissable lips | Lip Care For Dry, Cracked and Chapped lips | Lip Repair & Protection  ",,,,₹250,₹175,Save ₹75 (30%),3.9 out of 5 stars,198,https://www.amazon.in/Bubblegum-Kissable-Cracked-Chapped-Protection/dp/B08PD4S9FG/ref=sr_1_39?dchild=1&keywords=lip+balm&qid=1627656039&sr=8-39
"Lotus Herbals Lip Balm, Raspberry, 5g  ",,,,₹175,₹171,Save ₹4 (2%),4.3 out of 5 stars,"2,562",https://www.amazon.in/Lotus-Herbals-Lip-Balm-Raspberry/dp/B007E9FBKE/ref=sr_1_40?dchild=1&keywords=lip+balm&qid=1627656039&sr=8-40
"Himalaya Peach Shine Lip Care, 4.5g  ",,,,₹134,₹112,Save ₹22 (16%),4.0 out of 5 stars,570,https://www.amazon.in/Himalaya-Peach-Shine-Care-4-5g/dp/B018FUFNTE/ref=sr_1_41?dchild=1&keywords=lip+balm&qid=1627656039&sr=8-41
"Namyaa Natural Lip Serum/Balm/Lightener/Moisturizer For Lip Lightening/Brightening/Toning/Moisturizing, 30 g  ",,,,₹240,₹168,Save ₹72 (30%),3.8 out of 5 stars,"4,038",https://www.amazon.in/Namyaa-Natural-Lightening-Brightening-Moisturizing/dp/B07NWGHQFN/ref=sr_1_42?dchild=1&keywords=lip+balm&qid=1627656039&sr=8-42
Plum Candy Melts Vegan Lip Balm for Softer Lips | Melon Bubble-yum | With Natural UV Protection | Enriched with Shea Butter |100% Cruelty Free | 12g  ,,,,₹295,₹250,Save ₹45 (15%),4.0 out of 5 stars,254,https://www.amazon.in/Plum-Bubble-yum-Tinted-Fruity-Cruelty/dp/B08MC5GLG4/ref=sr_1_43?dchild=1&keywords=lip+balm&qid=1627656039&sr=8-43
Good Vibes Lip Balm - Lemon 8 g  ,,,,₹150,₹134,Save ₹16 (11%),3.6 out of 5 stars,33,https://www.amazon.in/Good-Vibes-Lip-Balm-Lemon/dp/B08TBJZD5D/ref=sr_1_44?dchild=1&keywords=lip+balm&qid=1627656039&sr=8-44
"Lakmé Lip Love Gelato Chapstick, Moisturizing Tinted Lip Balm With Spf 15, Crème Finish, 4.5 g - Bubblegum  ",,,,₹150,₹145,Save ₹5 (3%),4.2 out of 5 stars,103,https://www.amazon.in/LAKM%C3%89-Love-Gelato-Chapstick-Bubblegum/dp/B08HSST61W/ref=sr_1_45?dchild=1&keywords=lip+balm&qid=1627656039&sr=8-45
"Lotus Herbals Lip Balm, Fruity Fusion, 5g  ",,,,,₹155,,4.3 out of 5 stars,849,https://www.amazon.in/Lotus-Herbals-Balm-Fruity-Fusion/dp/B006QKBCNC/ref=sr_1_46?dchild=1&keywords=lip+balm&qid=1627656039&sr=8-46
Callesta Pink Lips - Beet Root Lip Balm - Lip Lightening (Smokers Choice)  ,,,,₹299,₹140,Save ₹159 (53%),3.6 out of 5 stars,30,https://www.amazon.in/Callesta-Pink-Lips-Lightening-Smokers/dp/B08Q9ZLM6G/ref=sr_1_47?dchild=1&keywords=lip+balm&qid=1627656039&sr=8-47
"Himalaya Litchi Shine Lip Care, 4.5g  ",,,,₹150,₹120,Save ₹30 (20%),4.0 out of 5 stars,268,https://www.amazon.in/Himalaya-Litchi-Shine-Care-4-5g/dp/B018FUFMSG/ref=sr_1_48?dchild=1&keywords=lip+balm&qid=1627656039&sr=8-48
"Himalaya Coco Butter Lip Balm, 10g  ",,,Only 1 left in stock.,₹70,₹40,Save ₹30 (43%),4.0 out of 5 stars,16,https://www.amazon.in/Dummy-Oct-October385/dp/B07J2NZF3X/ref=sr_1_49?dchild=1&keywords=lip+balm&qid=1627656039&sr=8-49
"NIVEA Lip Balm, Pomegranate Shine, 4.8g  ",,,,₹185,₹157,Save ₹28 (15%),4.4 out of 5 stars,948,https://www.amazon.in/NIVEA-Balm-Pomegranate-Shine-4-8g/dp/B07JMZ33JQ/ref=sr_1_50?dchild=1&keywords=lip+balm&qid=1627656039&sr=8-50
"Organic Harvest Strawberry Flavour Lip Balm Enriched With Vitamin E & Benefits Of Mango Butter, For Dark Lips to Lighten, Lip Care for Dry & Chapped Lips, 100% Organic, Paraben & Sulphate Free For Girls & Women - 3 gm  ",,,,₹175,₹135,Save ₹40 (23%),3.7 out of 5 stars,348,https://www.amazon.in/Organic-Harvest-Strawberry-Certified-Sulphate/dp/B07Z23X3V3/ref=sr_1_51?dchild=1&keywords=lip+balm&qid=1627656039&sr=8-51
Arcelia Watermelon Fizz Red Lip Balm (4 gm)  ,,,,,₹95,,3.9 out of 5 stars,86,https://www.amazon.in/Arcelia-Watermelon-Fizz-Red-Balm/dp/B08QS2MN31/ref=sr_1_52?dchild=1&keywords=lip+balm&qid=1627656039&sr=8-52
Burt's Bees Beeswax Lip Balm with Vitamin E & Peppermint 0.15 oz  ,,,,₹799,₹599,Save ₹200 (25%),4.5 out of 5 stars,"7,015",https://www.amazon.in/Burts-Bees-Beeswax-Tube-15-sticks/dp/B002VFAV6U/ref=sr_1_53?dchild=1&keywords=lip+balm&qid=1627656039&sr=8-53
Hilary Rhoda Natural moisture magic change color with 6hrs continuous moisture lip balm  ,,,,₹149,₹109,Save ₹40 (27%),4.1 out of 5 stars,206,https://www.amazon.in/Hilary-Rhoda-Natural-moisture-continuous/dp/B07P54M7LZ/ref=sr_1_54?dchild=1&keywords=lip+balm&qid=1627656039&sr=8-54
"Beardo Lip Lightener for Men, 7g | Dark Lips Lightening and Brightening Lip balm| For Dry, Chapped, darkened lips | Lip Care and Protection for Smokers  ",,,,₹550,₹385,Save ₹165 (30%),3.7 out of 5 stars,910,https://www.amazon.in/BEARDO-Lip-Lightener-Men-Brown/dp/B07NJ6QTLC/ref=sr_1_55?dchild=1&keywords=lip+balm&qid=1627656039&sr=8-55
"Arata Natural Lip balm (10 gm) for dry, chapped lips with Intense Moisturizing || Power of Cardamom oil || Cocoa & Mango butter  ",Limited time deal,,,₹249,₹186.75,Save ₹62.25 (25%),3.7 out of 5 stars,"2,084",https://www.amazon.in/Arata-Zero-Chemicals-Lip-Balm/dp/B0797LJBBX/ref=sr_1_56?dchild=1&keywords=lip+balm&qid=1627656039&smid=AJZVRGJTZSSIP&sr=8-56
"Organic Harvest Rose Lip Butter Enriched With Vitamin E & Benefits Of Mango Butter, For Dark Lips to Lighten, Lip Care for Dry & Chapped Lips, 100% Organic, For Girls & Women - 4 gm  ",,Sponsored,,₹249,₹199,Save ₹50 (20%),,,https://www.amazon.in/gp/slredirect/picassoRedirect.html/ref=pa_sp_btf_aps_sr_pg1_1?ie=UTF8&adId=A02060142CBVTSAJ0EE6P&url=%2FOrganic-Harvest-Enriched-Vitamin-Benefits%2Fdp%2FB09B53779X%2Fref%3Dsr_1_57_sspa%3Fdchild%3D1%26keywords%3Dlip%2Bbalm%26qid%3D1627656039%26sr%3D8-57-spons%26psc%3D1&qualifier=1627656039&id=1054522685117068&widgetName=sp_btf
"The Man Company Lightening Lip Balm | Vitamin E, Liquorice & Coconut Oil | Provides Lip Care to Dry, Chapped & Dark Lips | Moisturizes, Nourishes, Softens Lips - 4gm  ",,Sponsored,,₹249,₹192,Save ₹57 (23%),3.8 out of 5 stars,"1,252",https://www.amazon.in/gp/slredirect/picassoRedirect.html/ref=pa_sp_btf_aps_sr_pg1_1?ie=UTF8&adId=A0312517H95ZQXXWGDU9&url=%2FMan-Company-Lightening-Vitamin-Liquorice%2Fdp%2FB08PBY7L13%2Fref%3Dsr_1_58_sspa%3Fdchild%3D1%26keywords%3Dlip%2Bbalm%26qid%3D1627656039%26sr%3D8-58-spons%26psc%3D1%26smid%3DA3OULVKAFTD7K5&qualifier=1627656039&id=1054522685117068&widgetName=sp_btf
The Moms Co. Natural Cherry Lip Balm I Non Sticky I Protects & Nourishes Dry Chapped Lips I Shea & Cocoa Butter( 5gm) (Cherry)  ,,Sponsored,,₹199,₹169,Save ₹30 (15%),3.8 out of 5 stars,62,https://www.amazon.in/gp/slredirect/picassoRedirect.html/ref=pa_sp_btf_aps_sr_pg1_1?ie=UTF8&adId=A0100592209GKCO59ZI6A&url=%2FMoms-Natural-Protects-Nourishes-Chapped%2Fdp%2FB092R8G7NH%2Fref%3Dsr_1_59_sspa%3Fdchild%3D1%26keywords%3Dlip%2Bbalm%26qid%3D1627656039%26sr%3D8-59-spons%26psc%3D1&qualifier=1627656039&id=1054522685117068&widgetName=sp_btf
Organic Harvest High Gloss Green Tea Flavour With Non Coloured Strawberry Flavour Lip Balm 10gm Each Combo of 100% Organic Lip Care for Dry & Chapped Lips | Paraben & Sulphate Free (Pack of 2)  ,,Sponsored,,₹498,₹299,Save ₹199 (40%),3.6 out of 5 stars,11,https://www.amazon.in/gp/slredirect/picassoRedirect.html/ref=pa_sp_btf_aps_sr_pg1_1?ie=UTF8&adId=A061073612J26VWTIGYWL&url=%2FOrganic-Harvest-Coloured-Strawberry-Sulphate%2Fdp%2FB08R669ZZ3%2Fref%3Dsr_1_60_sspa%3Fdchild%3D1%26keywords%3Dlip%2Bbalm%26qid%3D1627656039%26sr%3D8-60-spons%26psc%3D1&qualifier=1627656039&id=1054522685117068&widgetName=sp_btf
"DAUGHTER EARTH Antioxidant Lipbalm, 6g  ",,Sponsored,,,₹475,,4.4 out of 5 stars,37,https://www.amazon.in/gp/slredirect/picassoRedirect.html/ref=pa_sp_atf_next_aps_sr_pg2_1?ie=UTF8&adId=A08035971CYE2QC5UDOKJ&url=%2FDAUGHTER-EARTH-Antioxidant-Lipbalm-6g%2Fdp%2FB0895D75P2%2Fref%3Dsr_1_49_sspa%3Fdchild%3D1%26keywords%3Dlip%2Bbalm%26qid%3D1627656062%26sr%3D8-49-spons%26psc%3D1&qualifier=1627656062&id=8659802399632209&widgetName=sp_atf_next
TNW-The Natural Wash Lip Care Combo of Beetroot Lip Balm and Lip Scrub| Herbal Lip Balm Moisturizer For Dry Damaged & Chapped Lips Lip Lightening & Brightening Lip Scrub for Tanned & Darkened Lips.  ,,Sponsored,,₹700,₹503,Save ₹197 (28%),4.0 out of 5 stars,"1,561",https://www.amazon.in/gp/slredirect/picassoRedirect.html/ref=pa_sp_atf_next_aps_sr_pg2_1?ie=UTF8&adId=A09010781JJUL8COW8LYG&url=%2FTNW-NATURAL-WASH-Turmeric-Lightening%2Fdp%2FB089KGQYTJ%2Fref%3Dsr_1_50_sspa%3Fdchild%3D1%26keywords%3Dlip%2Bbalm%26qid%3D1627656062%26sr%3D8-50-spons%26psc%3D1&qualifier=1627656062&id=8659802399632209&widgetName=sp_atf_next
"Organic Harvest Red Hibiscus Flavour Lip Balm With Benefits of Hibiscus, Jojoba Oil & Shea Butter, For Dark Lips to Lighten, Lip Care for Dry & Chapped Lips, 100% Organic, Paraben & Sulphate Free For Girls & Women - 10 gm  ",Best seller,Sponsored,,₹199,₹189,Save ₹10 (5%),3.8 out of 5 stars,"4,642",https://www.amazon.in/gp/bestsellers/beauty/9530430031/ref=sr_bs_2_9530430031_1
"Organic Harvest Lily Lavender & Rose Lip Butter Enriched With Vitamin E & Benefits Of Mango Butter, For Dark Lips to Lighten, Lip Care for Dry & Chapped Lips, 100% Organic, Paraben & Sulphate Free For Girls & Women - 4 gm Each  ",Limited time deal,Sponsored,,₹747,₹448,Save ₹299 (40%),3.8 out of 5 stars,"1,768",https://www.amazon.in/gp/slredirect/picassoRedirect.html/ref=pa_sp_atf_next_aps_sr_pg2_1?ie=UTF8&adId=A05597282OPAFN6AUU4N6&url=%2FOrganic-Harvest-Lavender-Chapped-Sulphate%2Fdp%2FB08S6Q245X%2Fref%3Dsr_1_52_sspa%3Fdchild%3D1%26keywords%3Dlip%2Bbalm%26qid%3D1627656062%26smid%3DAMUQ56Q1P787N%26sr%3D8-52-spons%26psc%3D1&qualifier=1627656062&id=8659802399632209&widgetName=sp_atf_next
"Elecsera Crazy Lip Balm MULTI (Pack of: 12, 48 g)  ",,,,₹299,₹100,Save ₹199 (67%),3.1 out of 5 stars,21,https://www.amazon.in/Elecsera-Crazy-Balm-MULTI-Pack/dp/B0831DC731/ref=sr_1_53?dchild=1&keywords=lip+balm&qid=1627656062&sr=8-53
"Organic Harvest Strawberry Flavour Non Colored Lip Balm Enriched With Shea Butter & Lanolin, For Dark Lips to Lighten, Lip Care for Dry & Chapped Lips, 100% Organic, Paraben & Sulphate Free For Girls & Women - 8gm  ",Limited time deal,,,₹249,₹199,Save ₹50 (20%),4.1 out of 5 stars,"1,306",https://www.amazon.in/Organic-Harvest-Strawberry-Lip-Balm/dp/B01ARQGR2Q/ref=sr_1_54?dchild=1&keywords=lip+balm&qid=1627656062&smid=AMUQ56Q1P787N&sr=8-54
"Mars Rosy Lips LIP BALM FRUIT (Pack of: 3, 13.2 g)  ",,,,₹299,₹99,Save ₹200 (67%),4.5 out of 5 stars,2,https://www.amazon.in/Mars-Rosy-UNDER-CREAM-FRUIT/dp/B084DNJNVS/ref=sr_1_55?dchild=1&keywords=lip+balm&qid=1627656062&sr=8-55
Kaumudi Handmade & Natural 3 in 1 Lip Balm (Cheek Tint & Eye Shadow) With blend of Rose Damascena & Saffron Essential oil (Cherry Lip)  ,,,,₹290,₹246,Save ₹44 (15%),4.2 out of 5 stars,"2,797",https://www.amazon.in/Kaumudi-Handmade-Natural-Damascena-Essential/dp/B0837PJVRH/ref=sr_1_56?dchild=1&keywords=lip+balm&qid=1627656062&sr=8-56
"NIVEA Lip Balm, Fruity Berry Shine, 4.8g (Pack of 3)  ",,,,₹555,₹376,Save ₹179 (32%),4.0 out of 5 stars,2,https://www.amazon.in/NIVEA-Balm-Fruity-Berry-Shine/dp/B092W5VKLP/ref=sr_1_57?dchild=1&keywords=lip+balm&qid=1627656062&sr=8-57
"Himalaya Lip Balm, 10 grams  ",,,,₹35,₹30,Save ₹5 (14%),4.3 out of 5 stars,471,https://www.amazon.in/Himalaya-Herbals-Lip-Balm-grams/dp/B003Q8RTAW/ref=sr_1_58?dchild=1&keywords=lip+balm&qid=1627656062&sr=8-58
"Dot & Key LIP PLUMPING SLEEPING MASK Vitamin C + E MINI, 15ml, Lip mask for dry lips  ",,,,₹395,₹337,Save ₹58 (15%),3.9 out of 5 stars,583,https://www.amazon.in/Dot-Key-PLUMPING-SLEEPING-Vitamin/dp/B08RX6S5D1/ref=sr_1_49?dchild=1&keywords=lip+balm&qid=1627656062&sr=8-49
"Azani Active Care 100% Natural Beeswax Lip Balm for Dry & Chapped Lips | Moisturizing Lip Care with Beeswax, Vitamin E & Shea Butter | Women & Men, 10 g  ",Deal of the Day ,,,₹229,₹189,Save ₹40 (17%),4.3 out of 5 stars,83,https://www.amazon.in/Azani-Active-Care-Natural-Moisturizing/dp/B09293D91X/ref=sr_1_50?dchild=1&keywords=lip+balm&qid=1627656062&sr=8-50
"Himalaya Natural Soft Vanilla Lip Care, 4.5g  ",,,,₹150,₹120,Save ₹30 (20%),4.2 out of 5 stars,321,https://www.amazon.in/Himalaya-Natural-Soft-Vanilla-Care/dp/B01BNMIMNA/ref=sr_1_51?dchild=1&keywords=lip+balm&qid=1627656062&sr=8-51
"NIVEA Lip Balm, Pink Guava Shine, 4.8g  ",,,,₹185,₹176,Save ₹9 (5%),4.3 out of 5 stars,665,https://www.amazon.in/NIVEA-Balm-Guava-Shine-4-8g/dp/B07JN342KH/ref=sr_1_52?dchild=1&keywords=lip+balm&qid=1627656062&sr=8-52
"Lakme Lip Love Chapstick, Insta Pink, 4.5g and Lakme Lip Love Chapstick, Apricot, 4.5 g  ",,,,₹300,₹235,Save ₹65 (21%),4.0 out of 5 stars,22,https://www.amazon.in/Lakme-Love-Chapstick-Insta-Apricot/dp/B08PDBZN3V/ref=sr_1_53?dchild=1&keywords=lip+balm&qid=1627656062&sr=8-53
