name,badge_1,badge_2,badge_3,mrp,discounted_price,discount,rating,rating_count,link
Men White AOP Slim Fit Casual Shirt,,,,1299,₹455,,,,
Men's Printed Manadarin Collar Black Shirt,,,,1299,₹499,,,,
Dark Blue Poplin Print Shirt,,,,1399,₹649,,,,
Maroon Poplin Print Slim Fit Shirt,,,,1399,₹699,,,,
Mens Checks Double Pocket Shirt,,,,1799,₹699,,,,
Blue Poplin Print Shirt,,,,1399,₹649,,,,
Men's Printed Indigo Shirt,BUY 2 GET 1,,,1399,₹899,,,,
Beach Blue Comfort Stretch Pique Shirt,BUY 2 GET 1,,,1299,₹699,,,,
Navy AOP Blue Shirt,,,,1499,₹662,,,,
Light Blue Cotton Melange Shirt,,,,1499,₹646,,,,
Men's Yellow Slim Fit Casual Indigo Shirt,BUY 2 GET 1,,,1299,₹799,,,,
Men's Printed Mandarin Collar T-Shirt,,,,1199,₹499,,,,
Bubble Gum Shirt,,,,1599,₹799,,,,
Mens Checks Double Pocket Shirt,,,,1799,₹699,,,,
Black Mandarin Collar Half Sleeve Shirt,BUY 1 GET 1,,,1249,₹799,,,,
Men's Printed Indigo Shirt,BUY 2 GET 1,,,1399,₹899,,,,
Blue Seersucker Slim Fit Casual Shirt,,,,1299,₹799,,,,
Mens Sleeveless Checks Hoodie Shirt,,,,1399,₹638,,,,
Men Maroon Seersucker Slim Fit Casual Shirt,BUY 2 GET 1,,,1299,₹999,,,,
Men's Printed Indigo Shirt,BUY 2 GET 1,,,1399,₹899,,,,
White Prnt Twill Lycra Print Shirt,,,,1499,₹646,,,,
Beige Cotton Melange Shirt,,,,1499,₹646,,,,
Men Checks Casual Spread Shirt,,,,1399,₹769,,,,
Men's Teal Slim Fit Casual Oxford Shirt,,FLASH SALE,,1299,₹549,,,,
AOP Satin Print Half Sleeve Shirt,,,,1449,₹629,,,,
Men Checks Casual Spread Shirt,,,,1499,₹674,,,,
Men's Blue Slim Fit Casual Melange Shirt,,,,1299,₹699,,,,
Men Solid Stylish New Trends Casual Spread Shirt,,,,1599,₹799,,,,
Yolo Yellow Stripe Shirt,,,,1399,₹599,,,,
Gibral Tar Sea Mandarin Collar Half Sleeve Shirt,BUY 1 GET 1,,,1249,₹799,,,,
White Mandrin CollarPique Half Sleeve Shirt,BUY 1 GET 1,,,1249,₹799,,,,
Mens Checks Hoodie Shirt,,,,1799,₹699,,,,
Men's Lt Blue Casual Slim Fit Over Dyed Shirt,BUY 2 GET 1,,,1299,₹749,,,,
Snitch Elitist Black Shirt,,,,1099,₹999,,,,
Mens Checks Pocket Casual Shirt,,,,1499,₹662,,,,
Light Blue Twill Lycra Print Shirt,,,,1499,₹646,,,,
Mens Checks Hoodie Shirt,,,,1799,₹699,,,,
Dark Blue Casual Over Dyed Shirt,,,,1299,₹849,,,,
AOP Satin Print Half Sleeve Shirt,,,,1449,₹629,,,,
White SLUB Shirt,BUY 1 GET 1,,,1399,₹999,,,,
Mens Sleeveless Checks Hoodie Shirt,,,,1399,₹638,,,,
Men's Solid Sky Yellow Tape Shirt,,,,1499,₹499,,,,
Pink Blue Cotton Melange Shirt,,,,1499,₹646,,,,
Men's Black Slim Fit Casual Oxford Shirt,BUY 2 GET 1,,,1299,₹999,,,,
Snitch Curvet Blue Shirt,,,,699,₹649,,,,
White Twill Lycra Print Shirt,,,,1499,₹646,,,,
White Twill Lycra Print Shirt,,,,1499,₹599,,,,
Mens Sleeveless Checks Hoodie Shirt,,,,1399,₹649,,,,
Men's Navy Slim Fit Casual Oxford Shirt,,,,1299,₹677,,,,
Comfort Stretch Pique Knit Mustard Shirt,,,,1299,₹599,,,,
Heather Rose Mandarin Collar Half Sleeve Shirt,BUY 1 GET 1,,,1249,₹799,,,,
Men's Slim Fit Casual Cotton Indigo Shirt,,,,1299,₹615,,,,
Citron Solid Half Sleeve Shirt,BUY 2 GET 1,,,1249,₹799,,,,
Pink Cotton Melange Shirt,,,,1499,₹646,,,,
Men Checks Stylish New Trends Spread Casual Shirt,,,,1499,₹749,,,,
Comfort Pique Knit Navy Shirt,,,,1299,₹599,,,,
Men's Linen Mandarin Collar Pocket Full Sleeves Shirt,,,,1799,₹999,,,,
Retro Red Stripe Shirt,BUY 2 GET 1,,,1299,₹749,,,,
Men's Lt Blue Slim Fit Casual Oxford Shirt,,,,1299,₹699,,,,
Seashell Pink Solid Half Sleeve Shirt,BUY 2 GET 1,,,1249,₹799,,,,
Men's Printed Ethnic Half Sleeves Maroon Shirt,,,FEW LEFT,1399,₹499,,,,
Mens Checks Pocket Casual Shirt,,,,1499,₹699,,,,
Comfort Stretch Pique Knit White Shirt,,,,1299,₹599,,,,
Men's Dk Olive Slim Fit Casual Oxford Shirt,,,,1299,₹649,,,,
Tusok Men Short Sleeve Cotton Printed Sea Wave Graphics on Blue Shirt,,,FEW LEFT,949,₹759,,,,
Tusok Men Short Sleeve Cotton Printed Turquoise White Shirt,,,FEW LEFT,949,₹799,,,,
Arcade Green Mandarin Collor Pique Shirt,BUY 2 GET 1,,FEW LEFT,1299,₹849,,,,
Ceylon Yellow Mandarin Collar Half Sleeve Shirt,BUY 1 GET 1,,,1249,₹799,,,,
Men's Linen Color Block Half Sleeves Shirt,,,,1599,₹899,,,,
Black Solid Half Sleeve Shirt,BUY 2 GET 1,,,1249,₹799,,,,
Grey Print AOP Shirt,,,,1399,₹608,,,,
Men Dk Grey Poplin Lycra Slim Fit Casual Shirt,BUY 2 GET 1,,,1299,₹799,,,,
Shaded Spurce Solid Half Sleeve Shirt,BUY 2 GET 1,,,1249,₹799,,,,
Men AOP Slim Fit Casual Shirt,BUY 2 GET 1,,,1299,₹749,,,,
Arcade Green Checks Casual Shirt,BUY 2 GET 1,,,1299,₹899,,,,
Men White AOP Slim Fit Casual Shirt,BUY 2 GET 1,,,1299,₹799,,,,
Men's Dark Grey Casual Twill Over Dyed Slim Fit Shirts,,,,1299,₹799,,,,
Mens Checks Hoodie Shirt,,,,1399,₹699,,,,
Olive Madarin Collar Print Shirt,BUY 1 GET 1,,,1399,₹999,,,,
School Ruined My Life Shirt,,,,1399,₹599,,,,
Men AOP Slim Fit Casual Shirt,,,,1299,₹499,,,,
Snitch Florite Purple Shirt,,,,699,₹649,,,,
Mens Checks Pocket Casual Shirt,,,,1499,₹699,,,,
Men's Slim Fit Casual Indigo Shirt,,,,1299,₹649,,,,
White Poplin Print Shirt,BUY 2 GET 1,,,1399,₹899,,,,
Men Navy AOP Slim Fit Casual Shirt,BUY 2 GET 1,,,1299,₹699,,,,
White Pique Half Sleeve Shirt,BUY 2 GET 1,,,1249,₹799,,,,
Green Cotton Melange Shirt,,,,1499,₹599,,,,
The Bear House Men'S Short Sleeves Printed Shirt,,,,1995,₹997,,,,
Men's Navy Casual Slim Fit Corduroy Shirts,,FLASH SALE,,1299,₹599,,,,
The Bear House Cotton-Linen Button-Down Shirt,,,,2295,₹573,,,,
The Bear House Printed Casual Shirt,,,,1995,₹897,,,,
Men Solid Stylish New Trends Casual Spread Shirt,,,,1599,₹799,,,,
Olive Camo Full Sleeve Camo Shirt,BUY 2 GET 1,,FEW LEFT,1049,₹799,,,,
Campus Sutra Cotton Shirt for men,,,,1399,₹699,,,,
Campus Sutra Men Stylish Casual Shirt,,,,1499,₹824,,,,
Men Navy AOP Slim Fit Casual Shirt,,,,1299,₹499,,,,
White Seersucker Slim Fit Casual Shirt,,,,1299,₹799,,,,
Mens Checks Pocket Casual Shirt,,,,1499,₹699,,,,
Campus Sutra Men Stylish Casual Shirt,,,,1499,₹674,,,,
