name,badge_1,badge_2,badge_3,badge_4,mrp,discounted_price,discount,rating,rating_count,link
FUNKkY Leather Recliner Bean Bag Cover Without Beans XXL - Black,,,,,"Rs. 1,999",Rs.  675,66% Off,4.0,(14),https://www.snapdeal.com/product/funkky-leather-recliner-bean-bag/680947190165#bcrumbSearch:chair|bcrumbLabelId:580
Office Chair Hydraulic Gas Lift Cylinder Replacement - Universal Size - 120mm - Suites All Types of Office High Back and Low Back Chairs,,,,,Rs. 999,Rs.  399,60% Off,5.0,(1),https://www.snapdeal.com/product/office-chair-hydraulic-gas-lift/686031796900#bcrumbSearch:chair|bcrumbLabelId:580
PRIMIUM QUALITY DP Styles XXXL Chaise Lounge with foot rest ( No Fillers),,4 left!,,,"Rs. 3,999","Rs.  1,799",55% Off,5.0,(3),https://www.snapdeal.com/product/dp-styles-xxxl-chaise-lounge/663432900339#bcrumbSearch:chair|bcrumbLabelId:580
The Bean Bag Theory Premium Fabric Black Sofa Chair Jumbo Bean Bag Cover ( Without Beans ),,,,,"Rs. 2,299","Rs.  1,649",28% Off,5.0,(1),https://www.snapdeal.com/product/the-bean-bag-theory-premium/673413584290#bcrumbSearch:chair|bcrumbLabelId:580
Sun Wood Art Rocking Chair/Colonial Rocking Chair/Traditional Rocking Armchair/Tropical Exotic Sheesham Wood/Antique Rocking Chair/Modern Appearance Chairs Seating Color Beige,,,,,"Rs. 45,800","Rs.  22,500",51% Off,,,https://www.snapdeal.com/product/sun-wood-art-rocking-chaircolonial/675032964099#bcrumbSearch:chair|bcrumbLabelId:580
DuraComf Hydraulic Gas Lift Cylinder for Office Chairs (Chrome) 120mm,,,,,Rs. 899,Rs.  488,46% Off,5.0,(1),https://www.snapdeal.com/product/duracomf-hydraulic-gas-lift-cylinder/672589551452#bcrumbSearch:chair|bcrumbLabelId:580
Dolphin XXL Bean Bag Cover- Orange and Black,,,,,"Rs. 1,299",Rs.  675,48% Off,3.4000000000000004,(101),https://www.snapdeal.com/product/dolphin-xxl-original-bean-bag/81684277#bcrumbSearch:chair|bcrumbLabelId:580
PRIMIUM QUALITY Tan XXXL  Cool Chair bean Bag Cover ( No Fillers),,5 left!,,,"Rs. 2,499","Rs.  1,299",48% Off,5.0,(2),https://www.snapdeal.com/product/primium-quality-brown-xxxl-mudda/628201428919#bcrumbSearch:chair|bcrumbLabelId:580
Prominent Living Room Chair Combo (Set of 2),,,,,"Rs. 3,999","Rs.  2,999",25% Off,3.8,(6),https://www.snapdeal.com/product/cello-prominent-set-of-2/397271092#bcrumbSearch:chair|bcrumbLabelId:580
Office Chair Wheels (Caster) set of 5,,,,,Rs. 599,Rs.  399,33% Off,,,https://www.snapdeal.com/product/office-chair-wheels-caster-set/678154974935#bcrumbSearch:chair|bcrumbLabelId:580
Supreme web chairs,,,,,"Rs. 5,600","Rs.  3,847",31% Off,4.6000000000000005,(7),https://www.snapdeal.com/product/supreme-web-chairs/7493990417741533338#bcrumbSearch:chair|bcrumbLabelId:580
Supreme Diva chair (Set of 4) - Green & Light Green,,1 left!,,,"Rs. 16,000","Rs.  14,271",11% Off,5.0,(1),https://www.snapdeal.com/product/supreme-diva-chair-set-of/1351636646#bcrumbSearch:chair|bcrumbLabelId:580
Supreme lumina chairs,,1 left!,,,"Rs. 11,200","Rs.  7,286",35% Off,4.0,(1),https://www.snapdeal.com/product/supreme-lumina-chairs/6341068935605076088#bcrumbSearch:chair|bcrumbLabelId:580
Arm Chairs,,,,,"Rs. 2,000","Rs.  1,499",25% Off,,,https://www.snapdeal.com/product/arm-chairs/638819349136#bcrumbSearch:chair|bcrumbLabelId:580
Supreme lumina chairs,,1 left!,,,"Rs. 5,600","Rs.  3,930",30% Off,4.0,(1),https://www.snapdeal.com/product/supreme-lumina-chairs/6917529687908499576#bcrumbSearch:chair|bcrumbLabelId:580
NILKAMAL PLASTIC CHAIR 2155,,6 left!,,,"Rs. 2,800","Rs.  2,400",14% Off,3.299999999999999,(3),https://www.snapdeal.com/product/nilkamal-plastic-chair-2155/6917529653283831855#bcrumbSearch:chair|bcrumbLabelId:580
Supreme web chairs,,,,,"Rs. 11,200","Rs.  7,394",34% Off,4.6000000000000005,(7),https://www.snapdeal.com/product/supreme-web-chairs/6341068913134686362#bcrumbSearch:chair|bcrumbLabelId:580
Supreme web chairs,,,,,"Rs. 16,800","Rs.  10,228",39% Off,4.6000000000000005,(7),https://www.snapdeal.com/product/supreme-web-chairs/6917529665438109850#bcrumbSearch:chair|bcrumbLabelId:580
XXL Chair Bean Bag Cover (Without Beans),,,,,"Rs. 1,999","Rs.  1,799",10% Off,,,https://www.snapdeal.com/product/xxl-chair-bean-bag-cover/622504605081#bcrumbSearch:chair|bcrumbLabelId:580
Supreme lumina chairs,,1 left!,,,"Rs. 5,600","Rs.  4,066",27% Off,4.0,(1),https://www.snapdeal.com/product/supreme-lumina-chairs/7493990440211923064#bcrumbSearch:chair|bcrumbLabelId:580
Supreme Web Chair (Set Of 4) - Soft Blue,,2 left!,,,"Rs. 10,000","Rs.  6,973",30% Off,4.699999999999999,(6),https://www.snapdeal.com/product/supreme-web-chair-set-of/1234867361#bcrumbSearch:chair|bcrumbLabelId:580
Nilkamal Plastic Premium Chair Set of 2 ( Brown),,1 left!,,,"Rs. 3,000","Rs.  2,800",7% Off,3.5,(4),https://www.snapdeal.com/product/nilkamal-plastic-premium-chair-set/661670283797#bcrumbSearch:chair|bcrumbLabelId:580
ROCKING CHAIR,,,,,"Rs. 15,000","Rs.  12,501",17% Off,4.0,(1),https://www.snapdeal.com/product/rocking-chair/663873565161#bcrumbSearch:chair|bcrumbLabelId:580
Sun Wood Art Beautiful Wooden & Rocking Chair for Grand Parents Sheesham Wood,,,,,"Rs. 33,999","Rs.  16,990",50% Off,,,https://www.snapdeal.com/product/sun-wood-art-beautiful-wooden/671710523207#bcrumbSearch:chair|bcrumbLabelId:580
Supreme web chairs,,,,,"Rs. 2,800","Rs.  2,161",23% Off,4.6000000000000005,(7),https://www.snapdeal.com/product/supreme-web-chairs/5764608160831262874#bcrumbSearch:chair|bcrumbLabelId:580
Homegenic National Tub Chair with Complimentary Cotton Cushions,,,,,"Rs. 3,999","Rs.  3,499",13% Off,5.0,(2),https://www.snapdeal.com/product/homegenic-national-tub-chair-with/5188147442546587861#bcrumbSearch:chair|bcrumbLabelId:580
XXL Chair Bean Bag Cover (Without Beans),,,,,"Rs. 1,999","Rs.  1,799",10% Off,,,https://www.snapdeal.com/product/xxl-chair-bean-bag-cover/618655159053#bcrumbSearch:chair|bcrumbLabelId:580
Supreme lumina chairs,,,,,"Rs. 2,800","Rs.  2,270",19% Off,4.0,(1),https://www.snapdeal.com/product/supreme-lumina-chairs/5188147430998229112#bcrumbSearch:chair|bcrumbLabelId:580
Supreme Web Chair (Set Of 6) - Red,,2 left!,,,"Rs. 11,000","Rs.  10,715",3% Off,5.0,(1),https://www.snapdeal.com/product/supreme-web-chair-set-of/1624291988#bcrumbSearch:chair|bcrumbLabelId:580
Supreme web chairs,,,,,"Rs. 16,800","Rs.  9,204",45% Off,4.6000000000000005,(7),https://www.snapdeal.com/product/supreme-web-chairs/8070451170044956826#bcrumbSearch:chair|bcrumbLabelId:580
Supreme Web chair (set of 4) -Globus Brown,,4 left!,,,"Rs. 8,000","Rs.  7,558",6% Off,4.3,(4),https://www.snapdeal.com/product/supreme-web-chair-set-of/1623033389#bcrumbSearch:chair|bcrumbLabelId:580
The Bean Bag Theory Premium Fabric Red Sofa Chair Jumbo Bean Bag Cover ( Without Beans ),,,,,"Rs. 5,500","Rs.  1,649",70% Off,,,https://www.snapdeal.com/product/the-bean-bag-theory-premium/644727231775#bcrumbSearch:chair|bcrumbLabelId:580
Home Story Modern Mooda Rocker XXL Size Grey Color Cover Only,,1 left!,,,"Rs. 2,399",Rs.  999,58% Off,3.0,(1),https://www.snapdeal.com/product/home-story/619735108590#bcrumbSearch:chair|bcrumbLabelId:580
Home Story Modern Mooda Rocker Cover Without Beans- XXXL Size- Tan (Only Cover- Fillers NOT Included),,2 left!,,,"Rs. 2,599","Rs.  1,249",52% Off,3.5,(4),https://www.snapdeal.com/product/home-story/676683731997#bcrumbSearch:chair|bcrumbLabelId:580
Home Story Mambo Bean Bag XL Size Maroon Cover Only,,1 left!,,,"Rs. 1,499",Rs.  999,33% Off,4.0,(1),https://www.snapdeal.com/product/home-story/632605083173#bcrumbSearch:chair|bcrumbLabelId:580
Home Story Chair Style Bean Bag Cover Without Beans- XL Size - Tan (Only Cover- Fillers NOT Included),,5 left!,,,"Rs. 1,399",Rs.  749,46% Off,4.0,(3),https://www.snapdeal.com/product/home-story/647881816408#bcrumbSearch:chair|bcrumbLabelId:580
XXL Chair Bean Bag Cover (Without Beans),,,,,"Rs. 1,999","Rs.  1,999",,,,https://www.snapdeal.com/product/xxl-chair-bean-bag-cover/671197638569#bcrumbSearch:chair|bcrumbLabelId:580
Traveler Folding Chair Red,,,,,"Rs. 2,000","Rs.  1,849",8% Off,2.0,(5),https://www.snapdeal.com/product/majestic-folding-chair-with-fabric/1826469212#bcrumbSearch:chair|bcrumbLabelId:580
Kawachi Portable Reclining Yoga Chair With 6 Adjustable Positions And Shoulder Strap - Red,,1 left!,,,"Rs. 2,500","Rs.  2,091",16% Off,1.0,(1),https://www.snapdeal.com/product/kawachi-portable-reclining-yoga-chair/629974144147#bcrumbSearch:chair|bcrumbLabelId:580
"Style Homez Premium Leatherette Classic Bean Bag XL Size Maroon Color, Cover Only",,,,,"Rs. 1,199",Rs.  899,25% Off,5.0,(1),https://www.snapdeal.com/product/style-homez-premium-leatherette-classic/648448191444#bcrumbSearch:chair|bcrumbLabelId:580
The Bean Bag Theory Premium Fabric Blue Sofa Chair Jumbo Bean Bag Cover ( Without Beans ),,,,,"Rs. 5,500","Rs.  1,649",70% Off,,,https://www.snapdeal.com/product/the-bean-bag-theory-premium/683204354678#bcrumbSearch:chair|bcrumbLabelId:580
Style Homez Mambo Lounger XXL Bean Bag Maroon Color Filled with Beans,,,,,"Rs. 3,490","Rs.  2,799",20% Off,1.0,(1),https://www.snapdeal.com/product/style-homez-mambo-lounger-xxl/673473783243#bcrumbSearch:chair|bcrumbLabelId:580
XXL Chair Bean Bag Cover (Without Beans),,,,,"Rs. 1,999","Rs.  1,799",10% Off,1.0,(1),https://www.snapdeal.com/product/xxl-chair-bean-bag-cover/677968338349#bcrumbSearch:chair|bcrumbLabelId:580
The Bean Bag Theory Premium Fabric Black Beach Chair Jumbo Bean Bag Cover ( Without Beans ),,,,,"Rs. 5,500","Rs.  1,749",68% Off,1.0,(1),https://www.snapdeal.com/product/the-bean-bag-theory-premium/623357608259#bcrumbSearch:chair|bcrumbLabelId:580
Home Story Modern Mooda Rocker Cover Without Beans- XXXL Size- Brown (Only Cover- Fillers NOT Included),,1 left!,,,"Rs. 2,599","Rs.  1,099",58% Off,1.0,(1),https://www.snapdeal.com/product/home-story/641372126299#bcrumbSearch:chair|bcrumbLabelId:580
XXL Chair Bean Bag Cover (Without Beans),,,,,"Rs. 1,999","Rs.  1,999",,,,https://www.snapdeal.com/product/xxl-chair-bean-bag-cover/650811842791#bcrumbSearch:chair|bcrumbLabelId:580
Style Homez Mambo Lounger XXL Bean Bag Maroon Color Cover Only,,,,,"Rs. 2,199","Rs.  1,549",30% Off,1.0,(1),https://www.snapdeal.com/product/style-homez-mambo-lounger-xxl/636746285305#bcrumbSearch:chair|bcrumbLabelId:580
Style Homez Urban Design Denim Canvas Stripes Printed Chair Bean Bag XXL Size Filled with Beans Fillers,,,,,"Rs. 3,990","Rs.  3,199",20% Off,,,https://www.snapdeal.com/product/style-homez-urban-design-denim/673926437238#bcrumbSearch:chair|bcrumbLabelId:580
Home Story Chair Bean Bag L Size Black Color Cover Only,,5 left!,,,"Rs. 1,199",Rs.  725,40% Off,,,https://www.snapdeal.com/product/home-story/677353149264#bcrumbSearch:chair|bcrumbLabelId:580
Home Story Video Rocker Lounger Bean Bag XXXL Size Red Color Cover Only,,1 left!,,,"Rs. 2,999","Rs.  1,449",52% Off,,,https://www.snapdeal.com/product/home-story/628870284297#bcrumbSearch:chair|bcrumbLabelId:580
Style Homez Urban Design Denim Canvas Abstract Printed Chair Bean Bag XXL Size Cover Only,,,,,"Rs. 2,499","Rs.  1,799",28% Off,,,https://www.snapdeal.com/product/style-homez-urban-design-denim/631589074629#bcrumbSearch:chair|bcrumbLabelId:580
Style Homez Chair Classic Cotton Canvas Floral Printed Bean Bag XXL Size Cover Only,,,,,"Rs. 2,499","Rs.  1,849",26% Off,,,https://www.snapdeal.com/product/style-homez-chair-classic-cotton/661508945042#bcrumbSearch:chair|bcrumbLabelId:580
Style Homez Mambo XL Bean Bag Lounger Black Color Cover Only,,,,,"Rs. 1,799","Rs.  1,249",31% Off,,,https://www.snapdeal.com/product/style-homez-mambo-xl-bean/642861797172#bcrumbSearch:chair|bcrumbLabelId:580
Style Homez Chair Classic Cotton Canvas Polka Dots Printed Bean Bag XXL Size Cover Only,,,,,"Rs. 2,499","Rs.  1,849",26% Off,,,https://www.snapdeal.com/product/style-homez-chair-classic-cotton/626656876693#bcrumbSearch:chair|bcrumbLabelId:580
Style Homez Chair Classic Cotton Canvas Geometric Printed Bean Bag XXL Size Cover Only,,,,,"Rs. 2,499","Rs.  1,849",26% Off,,,https://www.snapdeal.com/product/style-homez-chair-classic-cotton/641012102090#bcrumbSearch:chair|bcrumbLabelId:580
Style Homez Chair Classic Cotton Canvas Abstract Printed Bean Bag XXL Size Cover Only,,,,,"Rs. 2,499","Rs.  1,849",26% Off,,,https://www.snapdeal.com/product/style-homez-chair-classic-cotton/634416031274#bcrumbSearch:chair|bcrumbLabelId:580
Style Homez Urban Design Denim Canvas Floral Printed Chair Bean Bag XXL Size Cover Only,,,,,"Rs. 2,499","Rs.  1,799",28% Off,,,https://www.snapdeal.com/product/style-homez-urban-design-denim/646724995402#bcrumbSearch:chair|bcrumbLabelId:580
Style Homez Mambo Lounger XXXL Bean Bag TAN Color Cover Only,,,,,"Rs. 2,499","Rs.  1,849",26% Off,,,https://www.snapdeal.com/product/style-homez-mambo-lounger-xxxl/636477655690#bcrumbSearch:chair|bcrumbLabelId:580
Home Story Modern Mooda Rocker XXL Size Red Color Cover Only,,2 left!,,,"Rs. 2,399","Rs.  1,249",48% Off,,,https://www.snapdeal.com/product/home-story/645975519664#bcrumbSearch:chair|bcrumbLabelId:580
Supreme diva chairs,,,,,"Rs. 4,000","Rs.  3,142",21% Off,,,https://www.snapdeal.com/product/supreme-diva-chairs/7493990451063838733#bcrumbSearch:chair|bcrumbLabelId:580
Supreme diva chairs,,,,,"Rs. 4,000","Rs.  3,142",21% Off,,,https://www.snapdeal.com/product/supreme-diva-chairs/7493990451063838733#bcrumbSearch:chair|bcrumbLabelId:580
Home Story Chair Bean Bag L Size Grey Color Cover Only,,3 left!,,,"Rs. 1,199",Rs.  649,46% Off,,,https://www.snapdeal.com/product/home-story/669943791261#bcrumbSearch:chair|bcrumbLabelId:580
Style Homez Mambo Lounger XXXL Bean Bag Green Color Cover Only,,,,,"Rs. 2,499","Rs.  1,849",26% Off,,,https://www.snapdeal.com/product/style-homez-mambo-lounger-xxxl/677057669943#bcrumbSearch:chair|bcrumbLabelId:580
Style Homez Urban Design Denim Canvas Polka Dots Printed Chair Bean Bag XXL Size Cover Only,,,,,"Rs. 2,499","Rs.  1,799",28% Off,,,https://www.snapdeal.com/product/style-homez-urban-design-denim/629861432191#bcrumbSearch:chair|bcrumbLabelId:580
Style Homez Mambo Lounger XXL Bean Bag Blue Color Cover Only,,,,,"Rs. 2,199","Rs.  1,549",30% Off,,,https://www.snapdeal.com/product/style-homez-mambo-lounger-xxl/638216299516#bcrumbSearch:chair|bcrumbLabelId:580
Style Homez Urban Design Denim Canvas Abstract Printed Chair Bean Bag XXL Size Cover Only,,,,,"Rs. 2,499","Rs.  1,799",28% Off,,,https://www.snapdeal.com/product/style-homez-urban-design-denim/633583989278#bcrumbSearch:chair|bcrumbLabelId:580
Style Homez Urban Design Denim Canvas Abstract Printed Chair Bean Bag XXL Size Cover Only,,,,,"Rs. 2,499","Rs.  1,849",26% Off,,,https://www.snapdeal.com/product/style-homez-urban-design-denim/652746695264#bcrumbSearch:chair|bcrumbLabelId:580
Style Homez Mambo Lounger XXXL Bean Bag White Color Cover Only,,,,,"Rs. 2,499","Rs.  1,849",26% Off,,,https://www.snapdeal.com/product/style-homez-mambo-lounger-xxxl/683740019971#bcrumbSearch:chair|bcrumbLabelId:580
Style Homez Urban Design Denim Canvas Floral Printed Chair Bean Bag XXL Size Filled with Beans Fillers,,,,,"Rs. 3,990","Rs.  3,199",20% Off,,,https://www.snapdeal.com/product/style-homez-urban-design-denim/668942346902#bcrumbSearch:chair|bcrumbLabelId:580
Style Homez Urban Design Denim Canvas Geometric Printed Chair Bean Bag XXL Size Cover Only,,,,,"Rs. 2,499","Rs.  1,799",28% Off,,,https://www.snapdeal.com/product/style-homez-urban-design-denim/671772334971#bcrumbSearch:chair|bcrumbLabelId:580
Style Homez Mambo Lounger XXL Bean Bag Black Color Cover Only,,,,,"Rs. 2,199","Rs.  1,549",30% Off,,,https://www.snapdeal.com/product/style-homez-mambo-lounger-xxl/647109038083#bcrumbSearch:chair|bcrumbLabelId:580
Style Homez Urban Design Denim Canvas Geometric Printed Chair Bean Bag XXL Size Cover Only,,,,,"Rs. 2,499","Rs.  1,799",28% Off,,,https://www.snapdeal.com/product/style-homez-urban-design-denim/619526086997#bcrumbSearch:chair|bcrumbLabelId:580
Home Story Chair Bean Bag L Size Red Color Cover Only,,2 left!,,,"Rs. 1,199",Rs.  625,48% Off,,,https://www.snapdeal.com/product/home-story/646908944259#bcrumbSearch:chair|bcrumbLabelId:580
Style Homez Mambo XL Bean Bag Yellow Color Filled with Beans,,,,,"Rs. 2,990","Rs.  2,399",20% Off,,,https://www.snapdeal.com/product/style-homez-mambo-xl-bean/682111338724#bcrumbSearch:chair|bcrumbLabelId:580
Style Homez Urban Design Denim Canvas Stripes Printed Chair Bean Bag XXL Size Cover Only,,,,,"Rs. 2,499","Rs.  1,799",28% Off,,,https://www.snapdeal.com/product/style-homez-urban-design-denim/682279949450#bcrumbSearch:chair|bcrumbLabelId:580
Style Homez Mambo Lounger XXL Bean Bag White Color Cover Only,,,,,"Rs. 2,199","Rs.  1,549",30% Off,,,https://www.snapdeal.com/product/style-homez-mambo-lounger-xxl/622419491195#bcrumbSearch:chair|bcrumbLabelId:580
Style Homez Mambo XL Bean Bag Lounger Yellow Color Cover Only,,,,,"Rs. 1,799","Rs.  1,249",31% Off,,,https://www.snapdeal.com/product/style-homez-mambo-xl-bean/686712574835#bcrumbSearch:chair|bcrumbLabelId:580
Style Homez Mambo XL Bean Bag Lounger Red Color Cover Only,,,,,"Rs. 1,799","Rs.  1,249",31% Off,,,https://www.snapdeal.com/product/style-homez-mambo-xl-bean/671059278422#bcrumbSearch:chair|bcrumbLabelId:580
Style Homez Alexa  Lounge XXXL Bean Bag Parrot Green Color Cover Only,,,,,"Rs. 2,990","Rs.  1,399",53% Off,,,https://www.snapdeal.com/product/style-homez-alexa-lounge-xxxl/676869903267#bcrumbSearch:chair|bcrumbLabelId:580
Home Story Chair Style Bean Bag Cover Without Beans- XL Size - Brown (Only Cover- Fillers NOT Included),,2 left!,,,"Rs. 1,399",Rs.  699,50% Off,,,https://www.snapdeal.com/product/home-story/680891240191#bcrumbSearch:chair|bcrumbLabelId:580
Style Homez Urban Design Denim Canvas Polka Dots Printed Chair Bean Bag XXL Size Cover Only,,,,,"Rs. 2,499","Rs.  1,799",28% Off,,,https://www.snapdeal.com/product/style-homez-urban-design-denim/623820125453#bcrumbSearch:chair|bcrumbLabelId:580
Style Homez Mambo Lounger XXXL Bean Bag Chocolate Brown Color Cover Only,,,,,"Rs. 2,499","Rs.  1,849",26% Off,,,https://www.snapdeal.com/product/style-homez-mambo-lounger-xxxl/659729514269#bcrumbSearch:chair|bcrumbLabelId:580
Style Homez Alexa Lounge XXXL Bean Bag Yellow Color Cover Only,,,,,"Rs. 2,990","Rs.  1,399",53% Off,,,https://www.snapdeal.com/product/style-homez-alexa-lounge-xxxl/672713606753#bcrumbSearch:chair|bcrumbLabelId:580
Style Homez Urban Design Denim Canvas Floral Printed Chair Bean Bag XXL Size Cover Only,,,,,"Rs. 2,499","Rs.  1,799",28% Off,,,https://www.snapdeal.com/product/style-homez-urban-design-denim/684995274489#bcrumbSearch:chair|bcrumbLabelId:580
Style Homez Chair Cotton Canvas Abstract Printed Bean Bag XXL Size with Fillers,,,,,"Rs. 3,990","Rs.  3,014",24% Off,,,https://www.snapdeal.com/product/style-homez-chair-cotton-canvas/680461861289#bcrumbSearch:chair|bcrumbLabelId:580
Style Homez Urban Design Denim Canvas Stripes Printed Chair Bean Bag XXL Size Cover Only,,,,,"Rs. 2,499","Rs.  1,799",28% Off,,,https://www.snapdeal.com/product/style-homez-urban-design-denim/671941617567#bcrumbSearch:chair|bcrumbLabelId:580
Style Homez Chair Classic Cotton Canvas Stripes Printed Bean Bag XXL Size Cover Only,,,,,"Rs. 2,499","Rs.  1,849",26% Off,,,https://www.snapdeal.com/product/style-homez-chair-classic-cotton/644567733243#bcrumbSearch:chair|bcrumbLabelId:580
Style Homez Mambo Lounger XXXL Bean Bag Black Color Filled with Beans,,,,,"Rs. 3,990","Rs.  3,014",24% Off,,,https://www.snapdeal.com/product/style-homez-mambo-lounger-xxxl/665502387440#bcrumbSearch:chair|bcrumbLabelId:580
Style Homez Mambo Lounger XXXL Bean Bag Maroon Color Filled with Beans,,,,,"Rs. 3,990","Rs.  3,199",20% Off,,,https://www.snapdeal.com/product/style-homez-mambo-lounger-xxxl/636907274070#bcrumbSearch:chair|bcrumbLabelId:580
Style Homez Urban Design Denim Canvas Stripes Printed Chair Bean Bag XXL Size Cover Only,,,,,"Rs. 2,499","Rs.  1,799",28% Off,,,https://www.snapdeal.com/product/style-homez-urban-design-denim/685635125788#bcrumbSearch:chair|bcrumbLabelId:580
Style Homez Urban Design Denim Canvas Polka Dots Printed Chair Bean Bag XXL Size Cover Only,,,,,"Rs. 2,499","Rs.  1,799",28% Off,,,https://www.snapdeal.com/product/style-homez-urban-design-denim/624135989835#bcrumbSearch:chair|bcrumbLabelId:580
Home Story Mambo Bean Bag XL Size Chocolate Brown Cover Only,,2 left!,,,"Rs. 1,499",Rs.  999,33% Off,,,https://www.snapdeal.com/product/home-story/630171190876#bcrumbSearch:chair|bcrumbLabelId:580
Home Story Chair Bean Bag XL Size Tan Color Cover Only,,1 left!,,,"Rs. 1,399",Rs.  699,50% Off,,,https://www.snapdeal.com/product/home-story/658813981140#bcrumbSearch:chair|bcrumbLabelId:580
Style Homez Chair Classic Cotton Canvas Abstract Printed Bean Bag XXL Size Cover Only,,,,,"Rs. 2,499","Rs.  1,849",26% Off,,,https://www.snapdeal.com/product/style-homez-chair-classic-cotton/643291835994#bcrumbSearch:chair|bcrumbLabelId:580
Style Homez Urban Design Denim Canvas Abstract Printed Chair Bean Bag XXL Size Cover Only,,,,,"Rs. 2,499","Rs.  1,799",28% Off,,,https://www.snapdeal.com/product/style-homez-urban-design-denim/680813214784#bcrumbSearch:chair|bcrumbLabelId:580
Home Story Modern Mooda Rocker Cover Without Beans- XXXL Size- Red (Only Cover- Fillers NOT Included),,1 left!,,,"Rs. 2,599","Rs.  1,099",58% Off,,,https://www.snapdeal.com/product/home-story/653792194947#bcrumbSearch:chair|bcrumbLabelId:580
Tofarch home office chair (model - f1m) fabric | ergonomic office chair | executive desk chair | director desk chair | manager chair,,,,,"Rs. 40,560","Rs.  19,500",52% Off,,,https://www.snapdeal.com/product/tofarch-home-office-chair-model/658914885227#bcrumbSearch:chair|bcrumbLabelId:580
Style Homez Urban Design Denim Canvas Floral Printed Chair Bean Bag XXL Size Cover Only,,,,,"Rs. 2,499","Rs.  1,799",28% Off,,,https://www.snapdeal.com/product/style-homez-urban-design-denim/646107958570#bcrumbSearch:chair|bcrumbLabelId:580
Home Story Chair Bean Bag XL Size Orange Color Cover Only,,1 left!,,,"Rs. 1,399",Rs.  699,50% Off,,,https://www.snapdeal.com/product/home-story/666286477163#bcrumbSearch:chair|bcrumbLabelId:580
Style Homez Mambo Lounger XXXL Bean Bag Blue Color Cover Only,,,,,"Rs. 2,499","Rs.  1,849",26% Off,,,https://www.snapdeal.com/product/style-homez-mambo-lounger-xxxl/633717923922#bcrumbSearch:chair|bcrumbLabelId:580
