name,badge_1,badge_2,badge_3,badge_4,mrp,discounted_price,discount,rating,rating_count,link
Akvin Stainless Steel Round Shape Money Bank Piggy Banks Antique Coin Bank Box(10*6Cm),,,,,Rs. 499,Rs.  229,54% Off,4.0,(90),https://www.snapdeal.com/product/akvin-stainless-steel-round-shape/686343045792#bcrumbSearch:baby%20toys
DINAARKAN DOREMON MUSIC MOBILE PHONE WITH BATTERIES,,6 left!,,,Rs. 499,Rs.  299,40% Off,3.0,(4),https://www.snapdeal.com/product/dinaarkan-doremon-music-mobile-phone/683812150880#bcrumbSearch:baby%20toys
"WISHKEY Plastic Battery Operated Musical Mini Mobile Phone Toy, Early Educational Miniature Model Cell Phone with Colorful Lights and Sound Effects(Pack of 1, Assorted Colors)",,,,,Rs. 549,Rs.  315,43% Off,5.0,(1),https://www.snapdeal.com/product/wishkey-plastic-battery-operated-musical/634503373230#bcrumbSearch:baby%20toys
"CHILD CHIC Silicone Finger Baby Toothbrush,Toddler Training Tooth Brushes with Hygiene case (Transparent)",,,,,Rs. 499,Rs.  169,66% Off,4.3,(24),https://www.snapdeal.com/product/child-chic-silicone-finger-baby/679768920750#bcrumbSearch:baby%20toys
Emob Launch and Go Racing Track Toy with 2 Metal Cars,,5 left!,,,Rs. 399,Rs.  349,13% Off,,,https://www.snapdeal.com/product/emob-launch-and-go-racing/625523502437#bcrumbSearch:baby%20toys
Fingerprint Sensing Money Saving Bank Toy (pink),,2 left!,,,"Rs. 1,300",Rs.  899,31% Off,4.0,(6),https://www.snapdeal.com/product/fingerprint-sensing-money-saving-bank/674133747556#bcrumbSearch:baby%20toys
LEROYAL baby love baby fruit nipple / Pacifier ( Colour may vary),,,,,Rs. 499,Rs.  199,60% Off,4.0,(6),https://www.snapdeal.com/product/leroyal-baby-love-baby-fruit/621859133865#bcrumbSearch:baby%20toys
"WISHKEY Plastic Colorful Non Toxic BPA Free 9 Shake & Grab Rattles and 3 Soothing Teethers for Babies & Infants, Early Age Toys For Kids ( Pack Of 12, Multicolor)",,,,,Rs. 599,Rs.  579,3% Off,4.5,(2),https://www.snapdeal.com/product/wishkey-plastic-colorful-non-toxic/627709658957#bcrumbSearch:baby%20toys
MaMu Shop 30 pis(made in india) Wooden Kitchen(Cooking) Playset For Girls/Shiny & Glossy Wooden Choppu Jaman / Traditional Cooking Playset / Wooden Toy Kitchen Playset For Girls/ Perfect Birthday Gift for kids,,,,,Rs. 999,Rs.  439,56% Off,3.2,(18),https://www.snapdeal.com/product/mamu-shop-30-pismade-in/621858256967#bcrumbSearch:baby%20toys
Whittlewud Wooden Alphabet Letters for DIY Craft (104 Pieces),,,,,"Rs. 1,299",Rs.  575,56% Off,,,https://www.snapdeal.com/product/whittlewud-wooden-alphabet-letters-for/673912107358#bcrumbSearch:baby%20toys
SMALL SR PIGGY BANK FOR KIDS.,,,,,Rs. 599,Rs.  219,63% Off,3.8,(5),https://www.snapdeal.com/product/small-sr-piggy-bank-for/638592635295#bcrumbSearch:baby%20toys
Trustvorth Baby fresh food pacifier (Silicon) / fruit feeder / baby teether - pacifier Baby Teether Nipple For Fruit,,,,,Rs. 499,Rs.  259,48% Off,4.0,(348),https://www.snapdeal.com/product/trustvorth-baby-fresh-food-pacifier/633307463747#bcrumbSearch:baby%20toys
Meena Pari Teether -0904 ( Multicolor ),,,,Featured,Rs. 499,Rs. 219,50% Off,0.0,,https://clk.snapdeal.biz/rtb/clickTracker/0/3853273300?slotId=19&slotName=sd-cr-198X232-1-4&campaignId=1298569&websiteId=1&position=&trackerId=10.70.96.26:edf9fe65-0f5f-4363-af5d-82ed7225c846:1&category=generic_search&supcCat=kids-toys-baby-theethers-soothers&page=slp&accId=350536&siteId=101&sdId=162684581221305575&eId=&dId=&sellerCode=S247e9&supc=SDL297124213&pogId=675996619131&brand=ORGANIC+KIDZ&metricsType=CPC&fp=0.0&type=product&acos=0.0&exp=&billingType=prepaid&servingSystem=null&refTag=search_ad&as=300000&pr=210000&ct=https%3A%2F%2Fwww.snapdeal.com%2Fproduct%2Fmeena-pari-teether-0904-multicolor-%2F675996619131%3FvendorCode%3DS247e9%26pa%3Dtrue%26fv%3Dtrue%26supc%3DSDL297124213%26utm_campaign%3Dnull%26utm_medium%3DProductAds%26isSellerPage%3Dtrue
"Little Warriors BPA Free Squeeze Style Bottle Feeder with Dispensing Spoon and Fruit Feeder and Pacifier - Fresh Food Feeder, Infant Teether Nibbler Toys, for Toddlers & Kid- Combo of 2",,,,Featured,Rs. 599,Rs. 359,32% Off,4.200000000000001,,https://clk.snapdeal.biz/rtb/clickTracker/0/3858947729?slotId=19&slotName=sd-cr-198X232-1-4&campaignId=1314662&websiteId=1&position=&trackerId=10.70.96.26:edf9fe65-0f5f-4363-af5d-82ed7225c846:2&category=generic_search&supcCat=baby-feeding-bottle&page=slp&accId=158017&siteId=101&sdId=162684581221305575&eId=&dId=&sellerCode=Sf43d9&supc=SDL165019980&pogId=664461455611&brand=Little+Fingers&metricsType=CPC&fp=50.0&type=product&acos=0.0&exp=&billingType=prepaid&servingSystem=null&refTag=search_ad&as=400000&pr=280000&ct=https%3A%2F%2Fwww.snapdeal.com%2Fproduct%2Flittle-fingers-bpa-free-squeeze%2F664461455611%3FvendorCode%3DSf43d9%26pa%3Dtrue%26fv%3Dtrue%26supc%3DSDL165019980%26utm_campaign%3Dnull%26utm_medium%3DProductAds%26isSellerPage%3Dtrue
"Little Warriors BPA Free Squeeze Style Bottle Feeder with Dispensing Spoon and Fruit Feeder and Pacifier - Fresh Food Feeder, Infant Teether Nibbler Toys, for Toddlers & Kid- Combo of 2",,,,Featured,Rs. 699,Rs. 359,42% Off,4.0,,https://clk.snapdeal.biz/rtb/clickTracker/0/3858947696?slotId=19&slotName=sd-cr-198X232-1-4&campaignId=1314662&websiteId=1&position=&trackerId=10.70.96.26:edf9fe65-0f5f-4363-af5d-82ed7225c846:3&category=generic_search&supcCat=baby-feeding-bottle&page=slp&accId=158017&siteId=101&sdId=162684581221305575&eId=&dId=&sellerCode=Sf43d9&supc=SDL235676481&pogId=678779070896&brand=Little+Fingers&metricsType=CPC&fp=50.0&type=product&acos=0.0&exp=&billingType=prepaid&servingSystem=null&refTag=search_ad&as=400000&pr=280000&ct=https%3A%2F%2Fwww.snapdeal.com%2Fproduct%2Fbpa-free-squeeze-style-bottle%2F678779070896%3FvendorCode%3DSf43d9%26pa%3Dtrue%26fv%3Dtrue%26supc%3DSDL235676481%26utm_campaign%3Dnull%26utm_medium%3DProductAds%26isSellerPage%3Dtrue
"Little Warriors BPA Free Squeeze Style Bottle Feeder with Dispensing Spoon and Fruit Feeder and Pacifier - Fresh Food Feeder, Infant Teether Nibbler Toys, for Toddlers & Kid- Combo of 2",,,,Featured,Rs. 599,Rs. 359,32% Off,4.0,,https://clk.snapdeal.biz/rtb/clickTracker/0/3858947693?slotId=19&slotName=sd-cr-198X232-1-4&campaignId=1314662&websiteId=1&position=&trackerId=10.70.96.26:edf9fe65-0f5f-4363-af5d-82ed7225c846:4&category=generic_search&supcCat=baby-feeding-bottle&page=slp&accId=158017&siteId=101&sdId=162684581221305575&eId=&dId=&sellerCode=Sf43d9&supc=SDL905266995&pogId=647131530456&brand=Little+Fingers&metricsType=CPC&fp=50.0&type=product&acos=0.0&exp=&billingType=prepaid&servingSystem=null&refTag=search_ad&as=400000&pr=280000&ct=https%3A%2F%2Fwww.snapdeal.com%2Fproduct%2Flittle-fingers-bpa-free-squeeze%2F647131530456%3FvendorCode%3DSf43d9%26pa%3Dtrue%26fv%3Dtrue%26supc%3DSDL905266995%26utm_campaign%3Dnull%26utm_medium%3DProductAds%26isSellerPage%3Dtrue
"WISHKEY Colorful Attractive Plastic Non Toxic Set of 7 Shake & Grab Rattle and 1 Soothing Teether for New Born and Infants (Pack of 8 , Multicolor)",,,,,Rs. 599,Rs.  449,25% Off,4.0,(1),https://www.snapdeal.com/product/wishkey-colorful-attractive-plastic-non/673473799489#bcrumbSearch:baby%20toys
"WISHKEY Plastic Non Toxic BPA Free Chu Chu Colorful Squeeze Bathtub Bathing Bathtoy with Baby & Animals for Toddlers & New Born (Pack of 7, Multicolor)",,,,,Rs. 599,Rs.  329,45% Off,,,https://www.snapdeal.com/product/wishkey-plastic-non-toxic-bpa/645007824905#bcrumbSearch:baby%20toys
Toysly's Infrared Induction Helicopter,,,,,Rs. 999,Rs.  575,42% Off,4.4,(7),https://www.snapdeal.com/product/toyslys-infrared-induction-helicopter/622739532208#bcrumbSearch:baby%20toys
5 BABY STACKER JUNIOR NET (With Box) (K),,,,,Rs. 499,Rs.  279,44% Off,3.7,(3),https://www.snapdeal.com/product/5-baby-stacker-junior-net/647656099909#bcrumbSearch:baby%20toys
Agriculture Farm Tractor Truck Toy Friction Powered  for Kids,,,,,Rs. 399,Rs.  349,13% Off,3.8,(13),https://www.snapdeal.com/product/agriculture-farm-tractor-truck-toy/630097595640#bcrumbSearch:baby%20toys
"Lilliput Baby Kick and Play Gym with Mosquito Net & Hanging Toys, Foldable & Washable Baby Bedding Set for Baby (0-12 Months) Barbie Princess Print",,,,,"Rs. 1,599",Rs.  699,56% Off,4.200000000000001,(9),https://www.snapdeal.com/product/lilliput-baby-kick-and-play/672484163496#bcrumbSearch:baby%20toys
Bride And Groom With Butta Bomma,,5 left!,,,Rs. 999,Rs.  769,23% Off,,,https://www.snapdeal.com/product/bride-and-groom-with-butta/686672592700#bcrumbSearch:baby%20toys
Holy Ratna Carving Handmade Wooden Money Bank/Piggy Bank/Coin Box Size 4 Inches,,,,,Rs. 550,Rs.  369,33% Off,3.4000000000000004,(40),https://www.snapdeal.com/product/holy-ratna-carving-handmade-wooden/678534685487#bcrumbSearch:baby%20toys
Wooden baby Rattles set of 6 nos pack - Eco friendly Channapatna Toys - Baby Music makers,,,,,Rs. 999,Rs.  575,42% Off,4.3,(4),https://www.snapdeal.com/product/wooden-baby-rattles-set-of/618716276736
"SKYRISE Speaker Light Bulb, E27 & B22 LED Light Bulb With Bluetooth Speaker RGB Self Changing Color Lamp Built-In Audio Speaker by SKYRISE",,,,,"Rs. 1,200",Rs.  319,73% Off,4.4,(10),https://www.snapdeal.com/product/speaker-light-bulb-e27-b22/670850432954
Holy Ratna Brown Handmade Wooden Square Money Box Coin Bank,,,,,Rs. 550,Rs.  349,37% Off,3.0,(6),https://www.snapdeal.com/product/holy-ratna-brown-handmade-wooden/654717545355
Little Warriors Baby Teething Toys Soft and Natural Bell Teether for Baby/Toddlers/Infants/Children BPA Free/Natural/Organic-Pack of 2,,,,,Rs. 599,Rs.  299,50% Off,4.0,(1),https://www.snapdeal.com/product/little-warriors-baby-teething-toys/683698185002
"Little Warriors Infant Baby Squeeze Food Grade Silicone Bottle Feeder and Pacifier - Fresh Food Feeder, Infant Teether Nibbler Toys, for Toddlers & Kid- Combo of 2",,,,Featured,Rs. 699,Rs. 359,41% Off,0.0,,https://clk.snapdeal.biz/rtb/clickTracker/0/3858947804?slotId=19&slotName=sd-cr-198X232-2-7&campaignId=1314662&websiteId=1&position=&trackerId=10.70.96.26:345d9d5a-14b6-4253-b4b5-ea6f7eb31c5d:1&category=generic_search&supcCat=baby-feeding-bottle&page=slp&accId=158017&siteId=101&sdId=162684581221305575&eId=&dId=&sellerCode=Sf43d9&supc=SDL424676531&pogId=656354330260&brand=Little+Warriors&metricsType=CPC&fp=50.0&type=product&acos=0.0&exp=&billingType=prepaid&servingSystem=null&refTag=search_ad&as=400000&pr=280000&ct=https%3A%2F%2Fwww.snapdeal.com%2Fproduct%2Flittle-warriors-infant-baby-squeeze%2F656354330260%3FvendorCode%3DSf43d9%26pa%3Dtrue%26fv%3Dtrue%26supc%3DSDL424676531%26utm_campaign%3Dnull%26utm_medium%3DProductAds%26isSellerPage%3Dtrue
"Little Fingers BPA Free Squeeze Style Bottle Feeder with Dispensing Spoon and Fruit Feeder and Pacifier - Fresh Food Feeder, Infant Teether Nibbler Toys, for Toddlers & Kid- Combo of 2",,,,Featured,Rs. 699,Rs. 419,29% Off,4.200000000000001,,https://clk.snapdeal.biz/rtb/clickTracker/0/3858947709?slotId=19&slotName=sd-cr-198X232-2-7&campaignId=1314662&websiteId=1&position=&trackerId=10.70.96.26:345d9d5a-14b6-4253-b4b5-ea6f7eb31c5d:2&category=generic_search&supcCat=baby-feeding-bottle&page=slp&accId=158017&siteId=101&sdId=162684581221305575&eId=&dId=&sellerCode=Sf43d9&supc=SDL830773902&pogId=685612874519&brand=Little+Fingers&metricsType=CPC&fp=50.0&type=product&acos=0.0&exp=&billingType=prepaid&servingSystem=null&refTag=search_ad&as=400000&pr=280000&ct=https%3A%2F%2Fwww.snapdeal.com%2Fproduct%2Flittle-fingers-bpa-free-squeeze%2F685612874519%3FvendorCode%3DSf43d9%26pa%3Dtrue%26fv%3Dtrue%26supc%3DSDL830773902%26utm_campaign%3Dnull%26utm_medium%3DProductAds%26isSellerPage%3Dtrue
DANR Baby Pink Cute Sitting Elephant. Loveable Huggable Soft Baby Elephant Toy.(Size :- 42 cm),,,,Featured,Rs. 1199,Rs. 499,51% Off,0.0,,https://clk.snapdeal.biz/rtb/clickTracker/0/3858353775?slotId=19&slotName=sd-cr-198X232-2-7&campaignId=1312995&websiteId=1&position=&trackerId=10.70.96.26:345d9d5a-14b6-4253-b4b5-ea6f7eb31c5d:3&category=generic_search&supcCat=kids-toys-soft-toys-animal-shape&page=slp&accId=12869&siteId=101&sdId=162684581221305575&eId=&dId=&sellerCode=S80628&supc=SDL178618675&pogId=653022764332&brand=DANR&metricsType=CPC&fp=0.0&type=product&acos=0.0&exp=&billingType=prepaid&servingSystem=null&refTag=search_ad&as=3000000&pr=2100000&ct=https%3A%2F%2Fwww.snapdeal.com%2Fproduct%2Fdanr-baby-pink-cute-sitting%2F653022764332%3FvendorCode%3DS80628%26pa%3Dtrue%26fv%3Dtrue%26supc%3DSDL178618675%26utm_campaign%3Dnull%26utm_medium%3DProductAds%26isSellerPage%3Dtrue
"PANDORA 15 Supersoft material quality cute forest animal , doll Lion/Tiger stuffed toys for Baby toddlers",,,,Featured,Rs. 599,Rs. 309,45% Off,0.0,,https://clk.snapdeal.biz/rtb/clickTracker/0/3858354041?slotId=19&slotName=sd-cr-198X232-2-7&campaignId=1312995&websiteId=1&position=&trackerId=10.70.96.26:345d9d5a-14b6-4253-b4b5-ea6f7eb31c5d:4&category=generic_search&supcCat=kids-toys-soft-toys-animal-shape&page=slp&accId=12869&siteId=101&sdId=162684581221305575&eId=&dId=&sellerCode=S80628&supc=SDL192700159&pogId=640500927613&brand=DANR&metricsType=CPC&fp=0.0&type=product&acos=0.0&exp=&billingType=prepaid&servingSystem=null&refTag=search_ad&as=3000000&pr=2100000&ct=https%3A%2F%2Fwww.snapdeal.com%2Fproduct%2Fpandora-15-supersoft-material-quality%2F640500927613%3FvendorCode%3DS80628%26pa%3Dtrue%26fv%3Dtrue%26supc%3DSDL192700159%26utm_campaign%3Dnull%26utm_medium%3DProductAds%26isSellerPage%3Dtrue
Carrying on Bowling Set for Kids,,,,,Rs. 699,Rs.  349,50% Off,,,https://www.snapdeal.com/product/carrying-on-bowling-set-for/685500787673
CHILD CHIC Fruit Shape Silicone Teething toys (TEETHER)  RANDOM COLOR.(1PC),,,,,Rs. 589,Rs.  289,51% Off,3.5999999999999996,(30),https://www.snapdeal.com/product/child-chic-fruit-shape-silicone/630102296677
Mobile phone racing car ( 1 pc ),,6 left!,,,Rs. 499,Rs.  219,56% Off,4.0,(1),https://www.snapdeal.com/product/mobile-phone-racing-car-1/636816986775
Happy Baby BPA-Free Non Toxic Toddler and Infant Baby Tooth Sooter Teether Keys Teething Toys for Baby Toy Textured Silicone for Baby (Key),,,,,Rs. 699,Rs.  209,70% Off,4.0,(2),https://www.snapdeal.com/product/happy-baby-bpafree-non-toxic/669474185258
Wooden Coin bank,,,,,Rs. 650,Rs.  369,43% Off,3.9000000000000004,(20),https://www.snapdeal.com/product/wooden-coin-bank/636689961861
"WISHKEY Battery Operated Plastic Cute Attractive Crawling Baby with Bright Lights and Music, Fun Entertainment Toy for Toddler Kids ( Pack of 1, Multicolor)",,2 left!,,,Rs. 599,Rs.  489,18% Off,,,https://www.snapdeal.com/product/wishkey-battery-operated-plastic-cute/648813681660
Holy Ratna Decorative Handmade Wooden Money Bank/Piggy Bank/Coin Box in Barrel Shape Size 5 Inches,,1 left!,,,Rs. 850,Rs.  469,45% Off,5.0,(1),https://www.snapdeal.com/product/holy-ratna-decorative-handmade-wooden/667431456785
"CHILD CHIC BPA free, safe and durable MITTEN TEETHERS (BLUE SET OF 2)",,,,,Rs. 899,Rs.  329,63% Off,3.0,(2),https://www.snapdeal.com/product/child-chic-bpa-free-safe/636825620213
Happy baby Baby Friends Rattle Set Rattle (Multicolor) Rattle,,2 left!,,,Rs. 499,Rs.  339,32% Off,4.0,(1),https://www.snapdeal.com/product/happy-baby-baby-friends-rattle/651218829509
Meena Pari Silicone Teether/Mitten for Infants/Baby Silicone Teething Mitten /Teether Gloves/Tooth Glue Gloves/BPA Free Self-Soothing Pain Relief Mitten/Teething Toys/Ideal Baby Shower Gift/Package Include: 1 Piece Baby Teether Mitten,,6 left!,,,Rs. 979,Rs.  439,55% Off,,,https://www.snapdeal.com/product/meena-pari-silicone-teethermitten-for/668144898288
"Toddler Toy Kit of 3 Wooden Pull along Combo set - Ring set, Rabbit and Train",,,,,Rs. 799,Rs.  532,33% Off,4.0,(2),https://www.snapdeal.com/product/toddler-toy-kit-of-3/620428366804
BuzyKart Folk Art Classic Wooden Pecking Chickens Hen & Rooster Paddle Game Toy,,,,,"Rs. 1,200",Rs.  413,66% Off,3.0,(1),https://www.snapdeal.com/product/buzykart-folk-art-classic-wooden/629114660911
Dancing Dog with Music Flashing Lights,,5 left!,,,Rs. 699,Rs.  399,43% Off,4.0,(3),https://www.snapdeal.com/product/dancing-dog-with-music-flashing/675273751168
SR PIGGY MONEY BANK (14*12cm),,,,,Rs. 599,Rs.  249,58% Off,3.8,(196),https://www.snapdeal.com/product/sr-piggy-money-bank/628445204806
Little Warriors Baby Teething Toys Soft and Natural Fruit Teether for Baby/Toddlers/Infants/Children BPA Free/Natural/Organic,,,,,Rs. 399,Rs.  219,45% Off,,,https://www.snapdeal.com/product/little-warriors-baby-teething-toys/674612292452
Little Warriors Fruit Shape Silicone Teether for Baby (Combo Saver Pack of 2) Teether,,,,,Rs. 399,Rs.  289,28% Off,5.0,(1),https://www.snapdeal.com/product/little-fingers-fruit-shape-silicone/628558482501
"NEW BORN ""BABY GIRL"" THEMED FOIL BALLOON SET OF 5 PCS",,,,Featured,Rs. 400,Rs. 239,34% Off,0.0,,https://clk.snapdeal.biz/rtb/clickTracker/0/3833248784?slotId=19&slotName=sd-cr-198X232-3-11&campaignId=1237179&websiteId=1&position=&trackerId=10.70.96.26:dd746a47-b3f6-4d63-acf9-f67356f4724c:1&category=generic_search&supcCat=kids-toys-party-balloons&page=slp&accId=131720&siteId=101&sdId=162684581221305575&eId=&dId=&sellerCode=Sa2f41&supc=SDL456775119&pogId=636185676922&brand=GORSPL&metricsType=CPC&fp=0.0&type=product&acos=0.0&exp=&billingType=prepaid&servingSystem=null&refTag=search_ad&as=300000&pr=210000&ct=https%3A%2F%2Fwww.snapdeal.com%2Fproduct%2Fnew-born-baby-girl-themed%2F636185676922%3FvendorCode%3DSa2f41%26pa%3Dtrue%26fv%3Dtrue%26supc%3DSDL456775119%26utm_campaign%3Dnull%26utm_medium%3DProductAds%26isSellerPage%3Dtrue
"16"" PINK BABY SHOWER FOIL BALLOON COMBO SET OF 60 PCS",,,,Featured,Rs. 600,Rs. 289,47% Off,0.0,,https://clk.snapdeal.biz/rtb/clickTracker/0/3833248793?slotId=19&slotName=sd-cr-198X232-3-11&campaignId=1237179&websiteId=1&position=&trackerId=10.70.96.26:dd746a47-b3f6-4d63-acf9-f67356f4724c:2&category=generic_search&supcCat=kids-toys-party-balloons&page=slp&accId=131720&siteId=101&sdId=162684581221305575&eId=&dId=&sellerCode=Sa2f41&supc=SDL127755462&pogId=632627674588&brand=GORSPL&metricsType=CPC&fp=0.0&type=product&acos=0.0&exp=&billingType=prepaid&servingSystem=null&refTag=search_ad&as=300000&pr=210000&ct=https%3A%2F%2Fwww.snapdeal.com%2Fproduct%2F16-pink-baby-shower-foil%2F632627674588%3FvendorCode%3DSa2f41%26pa%3Dtrue%26fv%3Dtrue%26supc%3DSDL127755462%26utm_campaign%3Dnull%26utm_medium%3DProductAds%26isSellerPage%3Dtrue
"Little Warriors Infant Baby Squeeze Food Grade Silicone Bottle Feeder and Pacifier - Fresh Food Feeder, Infant Teether Nibbler Toys, for Toddlers & Kid- Combo of 2",,,,Featured,Rs. 699,Rs. 359,41% Off,0.0,,https://clk.snapdeal.biz/rtb/clickTracker/0/3858947874?slotId=19&slotName=sd-cr-198X232-3-11&campaignId=1314662&websiteId=1&position=&trackerId=10.70.96.26:dd746a47-b3f6-4d63-acf9-f67356f4724c:3&category=generic_search&supcCat=baby-feeding-bottle&page=slp&accId=158017&siteId=101&sdId=162684581221305575&eId=&dId=&sellerCode=Sf43d9&supc=SDL921635785&pogId=656802112927&brand=Little+Warriors&metricsType=CPC&fp=50.0&type=product&acos=0.0&exp=&billingType=prepaid&servingSystem=null&refTag=search_ad&as=400000&pr=280000&ct=https%3A%2F%2Fwww.snapdeal.com%2Fproduct%2Flittle-warriors-infant-baby-squeeze%2F656802112927%3FvendorCode%3DSf43d9%26pa%3Dtrue%26fv%3Dtrue%26supc%3DSDL921635785%26utm_campaign%3Dnull%26utm_medium%3DProductAds%26isSellerPage%3Dtrue
"Little Warriors Infant Baby Squeeze Food Grade Silicone Bottle Feeder and Pacifier - Fresh Food Feeder, Infant Teether Nibbler Toys, for Toddlers & Kid- Combo of 2",,,,Featured,Rs. 799,Rs. 419,38% Off,0.0,,https://clk.snapdeal.biz/rtb/clickTracker/0/3858947834?slotId=19&slotName=sd-cr-198X232-3-11&campaignId=1314662&websiteId=1&position=&trackerId=10.70.96.26:dd746a47-b3f6-4d63-acf9-f67356f4724c:4&category=generic_search&supcCat=baby-feeding-bottle&page=slp&accId=158017&siteId=101&sdId=162684581221305575&eId=&dId=&sellerCode=Sf43d9&supc=SDL625769197&pogId=640303427891&brand=Little+Warriors&metricsType=CPC&fp=50.0&type=product&acos=0.0&exp=&billingType=prepaid&servingSystem=null&refTag=search_ad&as=400000&pr=280000&ct=https%3A%2F%2Fwww.snapdeal.com%2Fproduct%2Flittle-warriors-infant-baby-squeeze%2F640303427891%3FvendorCode%3DSf43d9%26pa%3Dtrue%26fv%3Dtrue%26supc%3DSDL625769197%26utm_campaign%3Dnull%26utm_medium%3DProductAds%26isSellerPage%3Dtrue
PAXON Mini Piggy Bank Safe Box Money Coin ATM Machine Toy for Kids Gift Money Box Design May Vary,,,,,"Rs. 1,999",Rs.  949,53% Off,5.0,(2),https://www.snapdeal.com/product/daktyle-mini-piggy-bank-safe/672461945140
CHILD CHIC BABY RATTLE TEEHER IDEAL FOR BABY GUMS  (Pink),,,,,Rs. 399,Rs.  249,38% Off,4.5,(6),https://www.snapdeal.com/product/child-chic-baby-rattle-teeher/632727395823
BuzyKart Colorful Wooden Rainbow Handle Jingle Bell Rattle Toy Crib Shaker Stick,,,,,Rs. 689,Rs.  209,70% Off,4.0,(17),https://www.snapdeal.com/product/buzykart-colorful-wooden-rainbow-handle/685631947690
Wooden Rabbit pull along Animal toy and Jolly Joker Stacking Ring set of 10 nos for Kids - Set 0f 2,,,,,Rs. 699,Rs.  439,37% Off,3.0,(4),https://www.snapdeal.com/product/wooden-rabbit-pull-along-animal/680227351003
"WISHKEY Battery Operated Plastic Cute Attractive 360 Degree Rotation Dancing Dog with Bright Lights and Music, Fun Entertainment Toy for Toddler Kids ( Pack of 1, Multicolor)",,3 left!,,,Rs. 499,Rs.  419,16% Off,,,https://www.snapdeal.com/product/wishkey-battery-operated-plastic-cute/640036451294
Duck Piggy Bank,,,,,Rs. 399,Rs.  259,35% Off,5.0,(2),https://www.snapdeal.com/product/duck-piggy-bank/646822711243
Temoli Baby-Foldable-Mat,,,,,"Rs. 2,999","Rs.  1,299",57% Off,4.8,(4),https://www.snapdeal.com/product/babyfoldablemat/671906791249
"WISHKEY BPA-free Silicone Food Nibbler With Extra 2 Different Size Mesh Nipple for Fruit and Veggie with Rattle Handle for Baby 3-12 Months ( Pack Of 1, Multicolor)",,,,,Rs. 399,Rs.  259,35% Off,3.0,(2),https://www.snapdeal.com/product/wishkey-bpafree-silicone-food-nibbler/653518581227
Fingerprint Sensing Money Saving Bank Toy,,2 left!,,,"Rs. 1,200",Rs.  899,25% Off,4.5,(4),https://www.snapdeal.com/product/fingerprint-sensing-money-saving-bank/641933131888
"WISHKEY Plastic Friction Powered Press & Go Dinosaur Mini Monster Truck 4 Wheel Vehicles Toy for Toddlers, Fun Entertainment Toy For Kids 3 Years & Above (Pack Of 1, Assorted Color)",,,,,Rs. 599,Rs.  309,48% Off,,,https://www.snapdeal.com/product/wishkey-plastic-friction-powered-press/682543393398
Wooden Rabit and Airplane - Animal and Vehicle pull along Vehicle set for kids - Pack of 2,,,,,Rs. 499,Rs.  432,13% Off,4.0,(1),https://www.snapdeal.com/product/wooden-rabit-and-airplane-animal/681464892230
NILE Ice-Cream Van for kids,,,,,Rs. 699,Rs.  309,56% Off,3.5,(2),https://www.snapdeal.com/product/nile-icecream-van-for-kids/636991265816
"CHILD CHIC BPA free, safe and durable MITTEN TEETHER PURPLE (1 PC)",,,,,Rs. 499,Rs.  259,48% Off,5.0,(1),https://www.snapdeal.com/product/child-chic-bpa-free-safe/636907047499
Funskool Giggles Link Stack Nest Toy,,1 left!,,,Rs. 599,Rs.  599,,,,https://www.snapdeal.com/product/funskool-giggles-link-stack-nest/682539331947
Farlin Bunny Rattle & Teether for 3M+  Baby,,,,,Rs. 360,Rs.  309,14% Off,5.0,(2),https://www.snapdeal.com/product/farlin-bunny-rattle-teether-for/639182712820
"Wooden Coins Storage Box, Money Bank with Carving Work and Lock. Piggy Bank for Kids, Gift for Christmas Or Birthday",,,,,Rs. 799,Rs.  399,50% Off,3.2,(24),https://www.snapdeal.com/product/wooden-coins-storage-box-money/671941182589
"Meena Pari Baby safe Silicone squeeze Fresh Food Feeder Bottle with Food Dispensing Spoon, Infant Food Nibbler Teething Toy Feeding Pacifier Teether and Feeder Teether and Feeder Combo Pack of 2 ( Multicolour )",,,,Featured,Rs. 999,Rs. 439,48% Off,0.0,,https://clk.snapdeal.biz/rtb/clickTracker/0/3855143416?slotId=19&slotName=sd-cr-198X232-4-15&campaignId=1298545&websiteId=1&position=&trackerId=10.70.96.26:a4d51055-3c24-4112-b85f-43d4a4477bb0:1&category=generic_search&supcCat=baby-feeding-bottle&page=slp&accId=350536&siteId=101&sdId=162684581221305575&eId=&dId=&sellerCode=S247e9&supc=SDL166296291&pogId=682662484394&brand=Meena+Pari++Baby+safe+Silicone+Food+Feeder+Bottle+with+Food+Spoon+Pack+Of+2&metricsType=CPC&fp=0.0&type=product&acos=0.0&exp=&billingType=prepaid&servingSystem=null&refTag=search_ad&as=300000&pr=210000&ct=https%3A%2F%2Fwww.snapdeal.com%2Fproduct%2Fmeena-pari-baby-safe-silicone%2F682662484394%3FvendorCode%3DS247e9%26pa%3Dtrue%26fv%3Dtrue%26supc%3DSDL166296291%26utm_campaign%3Dnull%26utm_medium%3DProductAds%26isSellerPage%3Dtrue
COMFORT ZONE BABY COMFORT ZONE BABY SCOOTER 0002 GREEN,,,,Featured,Rs. 1999,Rs. 1349,33% Off,0.0,,https://clk.snapdeal.biz/rtb/clickTracker/0/3853098880?slotId=19&slotName=sd-cr-198X232-4-15&campaignId=1297189&websiteId=1&position=&trackerId=10.70.96.26:a4d51055-3c24-4112-b85f-43d4a4477bb0:2&category=generic_search&supcCat=kids-scooters&page=slp&accId=132186&siteId=101&sdId=162684581221305575&eId=&dId=&sellerCode=Sd3dae&supc=SDL483709496&pogId=641905749483&brand=COMFORT+ZONE&metricsType=CPC&fp=0.0&type=product&acos=0.0&exp=&billingType=prepaid&servingSystem=null&refTag=search_ad&as=390000&pr=273000&ct=https%3A%2F%2Fwww.snapdeal.com%2Fproduct%2Fcomfort-zone-baby-comfort-zone%2F641905749483%3FvendorCode%3DSd3dae%26pa%3Dtrue%26fv%3Dtrue%26supc%3DSDL483709496%26utm_campaign%3Dnull%26utm_medium%3DProductAds%26isSellerPage%3Dtrue
