name,badge_1,badge_2,badge_3,badge_4,mrp,discounted_price,discount,rating,rating_count,link
"Little Warriors Infant Baby Squeeze Food Grade Silicone Bottle Feeder and Pacifier - Fresh Food Feeder, Infant Teether Nibbler Toys, for Toddlers & Kid- Combo of 2",,,,Featured,Rs. 599,Rs. 419,17% Off,0.0,,https://clk.snapdeal.biz/rtb/clickTracker/0/3858947719?slotId=19&slotName=sd-cr-198X232-4-15&campaignId=1314662&websiteId=1&position=&trackerId=10.70.96.26:a4d51055-3c24-4112-b85f-43d4a4477bb0:3&category=generic_search&supcCat=baby-feeding-bottle&page=slp&accId=158017&siteId=101&sdId=162684581221305575&eId=&dId=&sellerCode=Sf43d9&supc=SDL855212384&pogId=672308658459&brand=Little+Warriors&metricsType=CPC&fp=50.0&type=product&acos=0.0&exp=&billingType=prepaid&servingSystem=null&refTag=search_ad&as=400000&pr=280000&ct=https%3A%2F%2Fwww.snapdeal.com%2Fproduct%2Flittle-warriors-infant-baby-squeeze%2F672308658459%3FvendorCode%3DSf43d9%26pa%3Dtrue%26fv%3Dtrue%26supc%3DSDL855212384%26utm_campaign%3Dnull%26utm_medium%3DProductAds%26isSellerPage%3Dtrue
"16"" BLUE BABY SHOWER FOIL BALLOON COMBO SET OF 60 PCS",,,,Featured,Rs. 600,Rs. 289,47% Off,0.0,,https://clk.snapdeal.biz/rtb/clickTracker/0/3833248795?slotId=19&slotName=sd-cr-198X232-4-15&campaignId=1237179&websiteId=1&position=&trackerId=10.70.96.26:a4d51055-3c24-4112-b85f-43d4a4477bb0:4&category=generic_search&supcCat=kids-toys-party-balloons&page=slp&accId=131720&siteId=101&sdId=162684581221305575&eId=&dId=&sellerCode=Sa2f41&supc=SDL147254529&pogId=668456043721&brand=GORSPL&metricsType=CPC&fp=0.0&type=product&acos=0.0&exp=&billingType=prepaid&servingSystem=null&refTag=search_ad&as=300000&pr=210000&ct=https%3A%2F%2Fwww.snapdeal.com%2Fproduct%2F16-blue-baby-shower-foil%2F668456043721%3FvendorCode%3DSa2f41%26pa%3Dtrue%26fv%3Dtrue%26supc%3DSDL147254529%26utm_campaign%3Dnull%26utm_medium%3DProductAds%26isSellerPage%3Dtrue
Little Warriors Combo Silicone Fruit Shape Teether for Baby/Toddlers/Infants/Children (Pack of 2),,,,,Rs. 399,Rs.  289,28% Off,5.0,(1),https://www.snapdeal.com/product/little-fingers-combo-silicone-fruit/656992867588
KITI KITS Electronic Piggy-Banks Cool Car Truck Password & Music Learning Educational Toys Bank Money Box Saving Password Coin Money Pot Bank Toys (Black),,2 left!,,,"Rs. 1,999","Rs.  1,549",23% Off,4.699999999999999,(6),https://www.snapdeal.com/product/kiti-kits-electronic-piggybanks-cool/672314843891
Set Of 4 Animal Shaped Colorful Baby Rattle Toys For Newborn Baby & Infants Rattle,,1 left!,,,"Rs. 1,049",Rs.  489,53% Off,,,https://www.snapdeal.com/product/set-of-4-animal-shaped/684443192344
Tejas Chu Chu Bath Toys (Duck Family),,,,,Rs. 499,Rs.  239,52% Off,4.1,(17),https://www.snapdeal.com/product/tejas-chu-chu-bath-toys/681479590438
Woodpedlar Brown Wooden Kids Toy,,,,,Rs. 699,Rs.  259,63% Off,3.5,(4),https://www.snapdeal.com/product/woodpedlar-brown-wooden-kids-toy/649346837251
Jazzup Talking Tom Cat,,,,,"Rs. 1,200",Rs.  699,42% Off,3.299999999999999,(33),https://www.snapdeal.com/product/jazzup-talking-tom-cat/1155995354
Intex Inflatable 3 Feet Baby Swimming Pool/Bath Tub.,,,,,"Rs. 1,599",Rs.  575,64% Off,3.5,(19),https://www.snapdeal.com/product/intex-inflatable-3-feet-baby/638150141131
Arty Smarty Alligator Attack Helicopter | DIY Model Airplane | Perfect to Display at Home | Ideal for Aeronautical & Military Enthusiasts,,,,,"Rs. 1,799","Rs.  1,649",8% Off,4.0,(1),https://www.snapdeal.com/product/arty-smarty-alligator-attack-helicopter/684714749967
Toy Boutique Stunt Bicycle with 360 Degree Rotation Lights and Music for kids Tricycle (Blue),,1 left!,,,"Rs. 1,299",Rs.  499,62% Off,,,https://www.snapdeal.com/product/toy-boutique-stunt-bicycle-with/666279328740
Holy Ratna WOODEN PIGY BANK / COIN BOX FOR KIDS,,6 left!,,,Rs. 550,Rs.  379,31% Off,3.5999999999999996,(30),https://www.snapdeal.com/product/holy-ratna-wooden-pigy-bank/676727295863
Tickles Double Sided Dart Board Game - with 4 Darts,,,,,"Rs. 1,330",Rs.  749,44% Off,4.0,(2),https://www.snapdeal.com/product/tickles-double-sided-dart-board/631299360019
BuzyKart Beautiful Wooden Classical Side Wheel Road Roller Toy Cum Showpiece,,,,,Rs. 799,Rs.  449,44% Off,4.3,(3),https://www.snapdeal.com/product/buzykart-beautiful-wooden-classical-side/673386161412
"WISHKEY Battery Operated Plastic Cute Attractive 360 Degree Rotation Dancing Dog with Bright Lights and Music, Fun Entertainment Toy for Toddler Kids ( Pack of 1, Multicolor)",,3 left!,,,Rs. 499,Rs.  419,16% Off,,,https://www.snapdeal.com/product/wishkey-battery-operated-plastic-cute/640036451294
"Zyka Online Services® 5 Layer Ball Drop and Roll Swirling Tower for Baby and Toddler Development Educational Toys | Stack, Drop and Go Ball Ramp",,2 left!,,,Rs. 999,Rs.  699,30% Off,5.0,(1),https://www.snapdeal.com/product/zyka-online-services-5-layer/673061493802
Fastdeal Inflatable Round Swimming Pool 2 Feet Bath Tub With Hand Air Pump For Kids,,,,,"Rs. 1,599",Rs.  749,53% Off,4.200000000000001,(5),https://www.snapdeal.com/product/fastdeal-inflatable-round-swimming-pool/661842297825
Wooden Handmade Dumru - Sound makers for baby - Toy for kids,,,,,Rs. 299,Rs.  225,25% Off,5.0,(4),https://www.snapdeal.com/product/wooden-handmade-dumru-sound-makers/654360007929
God Devotee Intex Inflatable 3 Feet Baby Swimming Pool/Bath Tub.,,,,,Rs. 999,Rs.  519,48% Off,3.2,(21),https://www.snapdeal.com/product/god-devotee-intex-inflatable-3/631089380804
Inllo Wooden Duck Toy For kids,,,,,Rs. 499,Rs.  349,30% Off,,,https://www.snapdeal.com/product/inllo-wooden-duck-toy-for/643710565944
Talking Tom Cat  (Grey),,,,,"Rs. 1,299",Rs.  539,59% Off,3.299999999999999,(3),https://www.snapdeal.com/product/talking-tom-cat-grey/630649973440
Fingerprint Sensing Money Saving Bank Toy - Yellow,,2 left!,,,"Rs. 1,499","Rs.  1,149",23% Off,3.1,(9),https://www.snapdeal.com/product/fingerprint-sensing-money-saving-bank/628131517340
Excel Karts Wooden Antique Brass Inlay Piigy/Coin Box,,4 left!,,,Rs. 750,Rs.  379,49% Off,4.5,(2),https://www.snapdeal.com/product/excel-karts-wooden-antique-brass/625714074808
Holy Ratna Coin/Money/Piggy Bank Saving Box - (Gift for Kids | Boys/Girls | Made with Rosewood | Wooden Brass Inlay Work,,7 left!,,,Rs. 550,Rs.  399,27% Off,4.5,(13),https://www.snapdeal.com/product/holy-ratna-coinmoneypiggy-bank-saving/663891543964
Holy Ratna Classics Playing Card Box with Dice  | Combo Deal | Wooden Playing Card Box,,,,,Rs. 950,Rs.  299,69% Off,,,https://www.snapdeal.com/product/holy-ratna-classics-playing-card/634749796897
"House of Quirk Baby Fresh Food Fruit Teether Feeder, Infant Fruit Teething Toy",,,,,Rs. 999,Rs.  299,70% Off,4.1,(281),https://www.snapdeal.com/product/house-of-quirk-baby-fresh/652855782848
Little Warriors Fruit Shape Silicone Teether with Baby Fruit Nibbler Pacifier for Baby (Combo Saver Pack of 2)- Fruit Teether with Fruit Nibbler,,,,,Rs. 499,Rs.  299,40% Off,4.5,(2),https://www.snapdeal.com/product/fruit-shape-silicone-teether-with/651247621275
Funskool Giggles Gift Set,,2 left!,,,Rs. 760,Rs.  675,11% Off,3.5,(4),https://www.snapdeal.com/product/funskool/1689781052
"Futurez Key®  Wooden Month's Name Multicolour Kids Jigsaw Puzzle Tray Game, Educational Learning Toy for Children",,,,,Rs. 945,Rs.  499,47% Off,,,https://www.snapdeal.com/product/futurez-key-wooden-months-name/641890802661
PALLANGULI WITH SHELL / Back to the 90s/ 90s kids toys/ Pallanguzhi,,,,,Rs. 999,Rs.  439,56% Off,4.8,(4),https://www.snapdeal.com/product/pallanguli-with-shell-pachikalu-pasa/676984482851
