name,badge_1,badge_2,badge_3,mrp,discounted_price,discount,rating,rating_count,link
ZIXAD 4 in 1 Multi-function Blackhead Remover Tool | Electric Derma suction Machine - Acne Pimple Pore Cleaner Vacuum tools - Facial Cleanser Device for Nose & Skin Care  ,,,,₹999,₹479,Save ₹520 (52%),4.1 out of 5 stars,14,https://www.amazon.in/ZIXAD-Multi-function-Blackhead-Remover-Electric/dp/B09764RLW4/ref=sr_1_50?dchild=1&keywords=cleanser&qid=1626022195&sr=8-50
"Plum E-Luminence Simply Supple Cleansing Balm | Hydrating Cleanser| For Normal, Dry, Combination Skin | 90g  ",,,,₹550,₹333,Save ₹217 (39%),4.2 out of 5 stars,216,https://www.amazon.in/Plum-Luminence-Simply-Supple-Cleansing/dp/B08423CWXC/ref=sr_1_51?dchild=1&keywords=cleanser&qid=1626022195&sr=8-51
"Bioderma Pigmentbio Foaming Cream Brightening Exfoliating Cleanser (Face & Body Wash) For Brightened Skin, 200 ml  ",,,,,"₹1,590",,4.4 out of 5 stars,165,https://www.amazon.in/Bioderma-Pigmentbio-Brightening-Exfoliating-Brightened/dp/B07VMBN63R/ref=sr_1_52?dchild=1&keywords=cleanser&qid=1626022195&sr=8-52
VRJ Enterprise Schloka Cleanser For All Skin Types  ,,,,₹445,₹244,Save ₹201 (45%),4.3 out of 5 stars,131,https://www.amazon.in/VRJ-ENTERPRISE-SCHLOKA-CLEANSER/dp/B0793ZGG6Q/ref=sr_1_53?dchild=1&keywords=cleanser&qid=1626022195&sr=8-53
Regaliz Brilante Intense Brightening Cleanser  ,,,,₹339,₹253,Save ₹86 (25%),4.1 out of 5 stars,69,https://www.amazon.in/Regaliz-Brilante-Intense-Brightening-Cleanser/dp/B07KQ9RNRV/ref=sr_1_54?dchild=1&keywords=cleanser&qid=1626022195&sr=8-54
"Kama Ayurveda Rose Jasmine Face Cleanser, 50ml  ",,,,₹550,₹531,Save ₹19 (3%),4.3 out of 5 stars,358,https://www.amazon.in/Kama-Ayurveda-Rose-Jasmine-Cleanser/dp/B01N2TWC58/ref=sr_1_55?dchild=1&keywords=cleanser&qid=1626022195&sr=8-55
LANEIGE Multi Deep-Clean Cleanser_50ml  ,Limited time deal,,,₹550,₹522.50,Save ₹27.50 (5%),4.0 out of 5 stars,2,https://www.amazon.in/LANEIGE-111975437-Multi-Deep-Clean-Cleanser_50ml/dp/B08KR5WWKM/ref=sr_1_56?dchild=1&keywords=cleanser&qid=1626022195&sr=8-56
Avon Whitening Papaya Cleanser For Bright & Soft Skin 100g set of 2  ,,,,₹599,₹338,Save ₹261 (44%),4.0 out of 5 stars,1,https://www.amazon.in/Avon-Whitening-Papaya-Cleanser-Bright/dp/B08LDP4P9C/ref=sr_1_57?dchild=1&keywords=cleanser&qid=1626022195&sr=8-57
"KHADI NATURAL Cucumber and Aloevera Cleansing Milk Cream with Shea/Kokum Butter, 210ml  ",,,,₹175,₹146,Save ₹29 (17%),4.2 out of 5 stars,669,https://www.amazon.in/Khadi-Natural-Cucumber-Cleansing-Sheabutter/dp/B00AF5XJ12/ref=sr_1_58?dchild=1&keywords=cleanser&qid=1626022195&sr=8-58
"Dermafique Absolute Detox Facial Cleanser for Normal To Dry Skin, Dermatologist Tested, Soap Free (100 ml)  ",,Sponsored,,₹208,₹195.62,Save ₹12.38 (6%),4.2 out of 5 stars,347,https://www.amazon.in/gp/slredirect/picassoRedirect.html/ref=pa_sp_mtf_aps_sr_pg2_1?ie=UTF8&adId=A01317073RMAMBKN7WJ3T&url=%2FDermafique-Absolute-Detox-Facial-Cleanser%2Fdp%2FB07DDQ6QH2%2Fref%3Dsr_1_59_sspa%3Fdchild%3D1%26keywords%3Dcleanser%26qid%3D1626022195%26sr%3D8-59-spons%26psc%3D1&qualifier=1626022195&id=8792964784504850&widgetName=sp_mtf
"Kaya Clinic Intense Clarity System, (3 Step Brightening Kit) Brightening Cleanser / Face Wash + Pigmentation Reducing Cream + Day Cream with SPF, 180 Ml  ",,Sponsored,,"₹1,940","₹1,261",Save ₹679 (35%),3.8 out of 5 stars,166,https://www.amazon.in/gp/slredirect/picassoRedirect.html/ref=pa_sp_mtf_aps_sr_pg2_1?ie=UTF8&adId=A006391619USWVBIOCBAF&url=%2FKaya-Skin-Clinic-Intense-Clarity%2Fdp%2FB00VE7HMPO%2Fref%3Dsr_1_60_sspa%3Fdchild%3D1%26keywords%3Dcleanser%26qid%3D1626022195%26sr%3D8-60-spons%26psc%3D1&qualifier=1626022195&id=8792964784504850&widgetName=sp_mtf
"Kaya Clinic Soothing Cleansing Gel, Soap free & gentle face wash with Niacinamide for daily use, all skin types 50 ml  ",,Sponsored,,₹150,₹105,Save ₹45 (30%),4.1 out of 5 stars,386,https://www.amazon.in/gp/slredirect/picassoRedirect.html/ref=pa_sp_mtf_aps_sr_pg2_1?ie=UTF8&adId=A0585676369DMJ6QJSRFF&url=%2FKaya-Clinic-Soothing-Cleansing-White%2Fdp%2FB07MWNN23X%2Fref%3Dsr_1_61_sspa%3Fdchild%3D1%26keywords%3Dcleanser%26qid%3D1626022195%26sr%3D8-61-spons%26psc%3D1&qualifier=1626022195&id=8792964784504850&widgetName=sp_mtf
"Kaya Clinic Brightening Beads Cleanser, With AHA, Niacinamide, Vitamin E daily use exfoliating & brightening face wash, all skin types 100 ml  ",,Sponsored,,₹380,₹266,Save ₹114 (30%),4.0 out of 5 stars,819,https://www.amazon.in/gp/slredirect/picassoRedirect.html/ref=pa_sp_mtf_aps_sr_pg2_1?ie=UTF8&adId=A044856513XWLMLL2SP3C&url=%2FKaya-Skin-Clinic-Brightening-Cleanser%2Fdp%2FB01MYZ7S50%2Fref%3Dsr_1_62_sspa%3Fdchild%3D1%26keywords%3Dcleanser%26qid%3D1626022195%26sr%3D8-62-spons%26psc%3D1&qualifier=1626022195&id=8792964784504850&widgetName=sp_mtf
Cosrx 150ml Low PH Good Morning Gel Cleanser  ,,,,₹850,₹700,Save ₹150 (18%),4.5 out of 5 stars,"6,908",https://www.amazon.in/Cosrx-150ml-Good-Morning-Cleanser/dp/B016NRXO06/ref=sr_1_63?dchild=1&keywords=cleanser&qid=1626022195&sr=8-63
Cestia Gentle Skin Cleanser  ,,,,₹230,₹207,Save ₹23 (10%),5.0 out of 5 stars,2,https://www.amazon.in/EWP-Cestia-Gentle-Skin-Cleanser/dp/B091P1BRH5/ref=sr_1_64?dchild=1&keywords=cleanser&qid=1626022195&sr=8-64
"Plum Chamomile & White Tea Revival Face Wash | Mild Cleanser | For Normal, Combination Skin | 100% Vegan, Cruelty Free | 120ml  ",,,,₹495,₹321,Save ₹174 (35%),4.3 out of 5 stars,627,https://www.amazon.in/Plum-Chamomile-Revival-Cleanser-Combination/dp/B08PQ8MH6D/ref=sr_1_65?dchild=1&keywords=cleanser&qid=1626022195&sr=8-65
"Regaliz Brilante Intense Brightening Cleanser, White, 100 gram  ",,,,₹549,₹399,Save ₹150 (27%),4.2 out of 5 stars,104,https://www.amazon.in/Regaliz-Brilante-Intense-Brightening-Cleanser/dp/B07V5ZG88T/ref=sr_1_66?dchild=1&keywords=cleanser&qid=1626022195&sr=8-66
"Garnier Skin Naturals, Micellar Oil-Infused Cleansing Water, 125ml  ",Best seller,,,₹225,₹146,Save ₹79 (35%),4.5 out of 5 stars,"4,450",https://www.amazon.in/gp/bestsellers/beauty/1374387031/ref=sr_bs_18_1374387031_1
DOERSHAPPY ® derma suction machine Blackhead vacuum acne cleaner remover pore for nose pimple cleaning device cleanser pores  ,,,,₹999,₹299,Save ₹700 (70%),,,https://www.amazon.in/DOERSHAPPY-suction-Blackhead-cleaning-cleanser/dp/B09373642C/ref=sr_1_68?dchild=1&keywords=cleanser&qid=1626022195&sr=8-68
"Bombay Shaving Company Anti-Acne Face Cleanser, With Salyclic Acid For Oily Skin, 100g | Paraben, SLS, SLES Free  ",Limited time deal,,,₹295,₹210,Save ₹85 (29%),4.2 out of 5 stars,273,https://www.amazon.in/Bombay-Shaving-Company-Control-Cleanser/dp/B0788V87XT/ref=sr_1_69?dchild=1&keywords=cleanser&qid=1626022195&smid=AT95IG9ONZD7S&sr=8-69
"Conscious Chemist Ritual Face Cleanser With Matcha Green Tea & Hemp Seed Oil, 120 Ml  ",,,,₹875,₹599,Save ₹276 (32%),4.1 out of 5 stars,134,https://www.amazon.in/Conscious-Chemist-Ritual-Cleanser-Matcha/dp/B07SQFKNHB/ref=sr_1_70?dchild=1&keywords=cleanser&qid=1626022195&sr=8-70
ZOXAR Multi-functional Vacuum Acne Pore Cleaner | Blackhead Remover Vacuum Kit | Facial Skin Cleaner For Men & Women | Pimple Removal Tool | Acne Removal Tool | Blackhead Remover Tool | Vacuum Suction Tool  ,,,,,,,,,https://www.amazon.in/ZOXAR-Multi-functional-Cleaner-Blackhead-Remover/dp/B097PTTD46/ref=sr_1_71?dchild=1&keywords=cleanser&qid=1626022195&sr=8-71
P P Enterprise Facial Kit // Multifunction Beauty Care Brush Deep Clean 5 in 1 Portable Facial Cleaner Relief Face Massager/Blackhead Remover Facial Cleanser // facial massager  ,,,Only 2 left in stock.,"₹1,199",₹295,Save ₹904 (75%),,,https://www.amazon.in/Enterprise-Multifunction-Portable-Massager-Blackhead/dp/B096SZHPTJ/ref=sr_1_72?dchild=1&keywords=cleanser&qid=1626022195&sr=8-72
The Indie Earth Nimbadi Facewash withNeem & 5 Type of Tulsi Anti Acne and Pimple Control Face Cleanser for Both Men and Women  ,,,,,₹495,,4.2 out of 5 stars,15,https://www.amazon.in/Indie-Earth-Facewash-withNeem-Cleanser/dp/B08K48L88D/ref=sr_1_73?dchild=1&keywords=cleanser&qid=1626022195&sr=8-73
O3+ Vitamin - C Cleanser Foaming wash Deep Cleanses Full of Antioxidants Combination Skin 120ML  ,,,,₹650,₹585,Save ₹65 (10%),,,https://www.amazon.in/O3-Vitamin-Cleanser-Antioxidants-Combination/dp/B097PV6MLB/ref=sr_1_74?dchild=1&keywords=cleanser&qid=1626022195&sr=8-74
"Kaya Clinic Brightening Beads Cleanser, With AHA, Niacinamide, Vitamin E daily use exfoliating & brightening face wash, all skin types 100 ml  ",,,,₹380,₹266,Save ₹114 (30%),4.0 out of 5 stars,819,https://www.amazon.in/Kaya-Skin-Clinic-Brightening-Cleanser/dp/B01MYZ7S50/ref=sr_1_75?dchild=1&keywords=cleanser&qid=1626022195&sr=8-75
D DERCLEAN HYDRO-GEL CLEANSER - 50 GMS  ,,,,,,,4.5 out of 5 stars,16,https://www.amazon.in/DERCLEAN-HYDRO-GEL-CLEANSER-50-GMS/dp/B01N4QHNV3/ref=sr_1_76?dchild=1&keywords=cleanser&qid=1626022195&sr=8-76
"Crystal soap free cleanser face wash gel for normal to oily skin, milk glow bowls For extra glow face wash gel 120g (Pack of 1, Aloe & Tea Tree)  ",,,,₹150,₹100,Save ₹50 (33%),5.0 out of 5 stars,2,https://www.amazon.in/Crystal-cleanser-normal-bowls-extra/dp/B08PFWCX1W/ref=sr_1_77?dchild=1&keywords=cleanser&qid=1626022195&sr=8-77
"The Beauty Co. Wash-free Face Cleanser, 100 gm | Made in India  ",,,,₹390,₹215,Save ₹175 (45%),3.4 out of 5 stars,15,https://www.amazon.in/Beauty-Co-Wash-free-Cleanser-India/dp/B08KLTQYV6/ref=sr_1_78?dchild=1&keywords=cleanser&qid=1626022195&sr=8-78
