name,badge_1,badge_2,badge_3,mrp,discounted_price,discount,rating,rating_count,link
Swisse Skincare Bamboo Skin Refining Exfoliator for with Witch Hazel & Rice Bran Water - 125g for oily & combination skin types  ,,Sponsored,,₹799,₹400,Save ₹399 (50%),4.2 out of 5 stars,9,https://www.amazon.in/gp/slredirect/picassoRedirect.html/ref=pa_sp_atf_aps_sr_pg1_1?ie=UTF8&adId=A02843632DMOYN57SNPRM&url=%2FSwisse-Skincare-Bamboo-Refining-Exfoliator%2Fdp%2FB089RS5PFD%2Fref%3Dsr_1_1_sspa%3Fdchild%3D1%26keywords%3Dcleanser%26qid%3D1626022171%26sr%3D8-1-spons%26psc%3D1&qualifier=1626022171&id=2141313304574964&widgetName=sp_atf
"Minimalist 2% Salicylic Acid Face Wash for Oily, Acne Prone Skin (100 ml) | Sulphate free, Anti Acne Face Cleanser With LHA & Zinc For Men & Women  ",,Sponsored,,,₹299,,3.6 out of 5 stars,4,https://www.amazon.in/gp/slredirect/picassoRedirect.html/ref=pa_sp_atf_aps_sr_pg1_1?ie=UTF8&adId=A03794442TSWANJXSB8JU&url=%2FMinimalist-Salicylic-Prone-Sulphate-Cleanser%2Fdp%2FB096PJMGPL%2Fref%3Dsr_1_2_sspa%3Fdchild%3D1%26keywords%3Dcleanser%26qid%3D1626022171%26sr%3D8-2-spons%26psc%3D1&qualifier=1626022171&id=2141313304574964&widgetName=sp_atf
Episoft Cleansing Lotion for Sensitive & Dry Skin I Gentle Cleanser removes Excess oil I Moisturises and Makes Skin Soft and Glowing I Removes Makeup I Free of SLS & Paraben 250ml  ,,Sponsored,,₹550,₹395,Save ₹155 (28%),4.5 out of 5 stars,44,https://www.amazon.in/gp/slredirect/picassoRedirect.html/ref=pa_sp_atf_aps_sr_pg1_1?ie=UTF8&adId=A012675029HYV3R3RPE7W&url=%2FEpisoft-Cleansing-Lotion-Sensitive-Skin%2Fdp%2FB08H636F4F%2Fref%3Dsr_1_3_sspa%3Fdchild%3D1%26keywords%3Dcleanser%26qid%3D1626022171%26sr%3D8-3-spons%26psc%3D1&qualifier=1626022171&id=2141313304574964&widgetName=sp_atf
"Neutrogena Liquid Mild Facial Cleanser, 150ml  ",,Sponsored,,₹360,₹335,Save ₹25 (7%),4.3 out of 5 stars,"1,350",https://www.amazon.in/gp/slredirect/picassoRedirect.html/ref=pa_sp_atf_aps_sr_pg1_1?ie=UTF8&adId=A0853706E19JPBYFBW0J&url=%2FNeutrogena-Liquid-Facial-Cleanser-150ml%2Fdp%2FB006LX962S%2Fref%3Dsr_1_4_sspa%3Fdchild%3D1%26keywords%3Dcleanser%26qid%3D1626022171%26sr%3D8-4-spons%26psc%3D1&qualifier=1626022171&id=2141313304574964&widgetName=sp_atf
"Biotique Bio Honey Gel Refreshing Foaming Face Cleanser, 120ml  ",,,,₹149,₹97,Save ₹52 (35%),4.2 out of 5 stars,"3,699",https://www.amazon.in/Biotique-Honey-Refreshing-Foaming-Cleanser/dp/B00791D13Q/ref=sr_1_5?dchild=1&keywords=cleanser&qid=1626022171&sr=8-5
"Cetaphil Gentle Skin Cleanser, 125ml  ",,,,₹255,₹252,Save ₹3 (1%),4.4 out of 5 stars,"8,179",https://www.amazon.in/Cetaphil-Gentle-Skin-Cleanser-125ml/dp/B01CCGW4OE/ref=sr_1_6?dchild=1&keywords=cleanser&qid=1626022171&sr=8-6
"Biotique Bio Berberry Hydrating Cleanser For All Skin Types, 120Ml  ",Amazon's Choice,,,₹170,₹111,Save ₹59 (35%),4.1 out of 5 stars,"1,959",https://www.amazon.in/Biotique-Berberry-Hydrating-Cleanser-Types/dp/B00791CR9U/ref=ice_ac_b_dpb?dchild=1&keywords=cleanser&qid=1626022171&sr=8-7
"Lakme Gentle & Soft Deep Pore Cleanser, With Avocado, Removes Makeup And Impurities, Cleansing Milk For Soft And Glowing Skin, 60 ml  ",,,,₹140,₹98,Save ₹42 (30%),4.2 out of 5 stars,"1,802",https://www.amazon.in/Lakme-Gentle-Soft-Deep-Cleanser/dp/B00CS1J5FA/ref=sr_1_8?dchild=1&keywords=cleanser&qid=1626022171&sr=8-8
"Neutrogena Deep Clean Foaming Cleanser For Normal To Oily Skin, 100g  ",,,,,₹219,,4.3 out of 5 stars,"3,617",https://www.amazon.in/Neutrogena-Deep-Clean-Foaming-Cleanser/dp/B006LXDPOI/ref=sr_1_9?dchild=1&keywords=cleanser&qid=1626022171&sr=8-9
"Kaya Clinic Acne Free Purifying Cleanser, Salicylic Acid face wash for pimple-prone, combination, oily skin 50 ml  ",,,,₹150,₹112,Save ₹38 (25%),4.0 out of 5 stars,"1,191",https://www.amazon.in/Kaya-Clinic-Purifying-Cleanser-50/dp/B07PC72VZY/ref=sr_1_10?dchild=1&keywords=cleanser&qid=1626022171&sr=8-10
"Neutrogena Deep Clean Facial Cleanser For Normal To Oily Skin, 200ml  ",,,,₹399,₹374,Save ₹25 (6%),4.3 out of 5 stars,"4,268",https://www.amazon.in/Neutrogena-Clean-Facial-Cleanser-200ml/dp/B006LXDQRY/ref=sr_1_11?dchild=1&keywords=cleanser&qid=1626022171&sr=8-11
"Minimalist 2% Salicylic Acid Face Wash for Oily, Acne Prone Skin (100 ml) | Sulphate free, Anti Acne Face Cleanser With LHA & Zinc For Men & Women  ",,,,,₹299,,3.6 out of 5 stars,4,https://www.amazon.in/Minimalist-Salicylic-Prone-Sulphate-Cleanser/dp/B096PJMGPL/ref=sr_1_12?dchild=1&keywords=cleanser&qid=1626022171&sr=8-12
"CleanseMe Gentle Skin Cleansing Lotion for All Types of Skin Enriched with Allantoin, Colloidal Oatmeal, pH 5.5 (125 Ml)  ",,,,₹199,₹190,Save ₹9 (5%),4.2 out of 5 stars,852,https://www.amazon.in/CleanseMe-Cleansing-Enriched-Allantoin-Colloidal/dp/B07VX3R5VF/ref=sr_1_13?dchild=1&keywords=cleanser&qid=1626022171&sr=8-13
"Kaya Clinic Brightening Beads Cleanser, With AHA, Niacinamide, Vitamin E daily use exfoliating & brightening face wash, all skin types 50 ml  ",,,,₹150,₹105,Save ₹45 (30%),3.8 out of 5 stars,298,https://www.amazon.in/Kaya-Clinic-Brightening-Cleanser-brightening/dp/B07RC5T8WV/ref=sr_1_14?dchild=1&keywords=cleanser&qid=1626022171&sr=8-14
The Derma Co Creamy Face Cleanser for Sensitive Skin - 100 ml(dermaco)  ,Limited time deal,,,₹249,₹236,Save ₹13 (5%),4.1 out of 5 stars,34,https://www.amazon.in/Derma-Co-Creamy-Cleanser-Sensitive/dp/B08TRFVNVD/ref=sr_1_15?dchild=1&keywords=cleanser&qid=1626022171&smid=A61C6NUFGVGS7&sr=8-15
"Kaya Clinic Acne Free Purifying Cleanser, Salicylic Acid face wash for pimple-prone, combination, oily skin, 100 ml  ",,,,₹380,₹228,Save ₹152 (40%),4.1 out of 5 stars,"1,370",https://www.amazon.in/Kaya-Skin-Clinic-Purifying-Cleanser/dp/B008KH67ZM/ref=sr_1_16?dchild=1&keywords=cleanser&qid=1626022171&sr=8-16
"Cetaphil Oily Skin Cleanser, 125ml  ",,,,,₹460,,4.3 out of 5 stars,"1,886",https://www.amazon.in/Cetaphil-Cleanser-Oily-Skin-125ml/dp/B01CCGW732/ref=sr_1_17?dchild=1&keywords=cleanser&qid=1626022171&sr=8-17
"Garnier Skin Naturals, Micellar Cleansing Water, 125ml  ",Best seller,,Only 2 left in stock.,₹175,₹120,Save ₹55 (31%),4.4 out of 5 stars,"10,850",https://www.amazon.in/gp/bestsellers/beauty/1374420031/ref=sr_bs_17_1374420031_1
"Biotique Bio Orris Root Lightening Face Cleanser for Men, 100% Soap Free, 120ml  ",,,,₹150,₹90,Save ₹60 (40%),4.2 out of 5 stars,847,https://www.amazon.in/Biotique-Bio-Orris-Men-120ml/dp/B00BBF6ATI/ref=sr_1_19?dchild=1&keywords=cleanser&qid=1626022171&sr=8-19
"Neutrogena Liquid Mild Facial Cleanser, 150ml  ",,,,₹360,₹335,Save ₹25 (7%),4.3 out of 5 stars,"1,350",https://www.amazon.in/Neutrogena-Liquid-Facial-Cleanser-150ml/dp/B006LX962S/ref=sr_1_20?dchild=1&keywords=cleanser&qid=1626022171&sr=8-20
"Neutrogena Hydro Boost Water Gel Cleanser, Transparent, 145 ml  ",,Sponsored,,₹900,₹895,Save ₹5 (1%),4.3 out of 5 stars,48,https://www.amazon.in/gp/slredirect/picassoRedirect.html/ref=pa_sp_mtf_aps_sr_pg1_1?ie=UTF8&adId=A08323941CLTOFC429J6G&url=%2FNeutrogena-Hydro-Boost-Cleanser-Transparent%2Fdp%2FB077NXTT3Q%2Fref%3Dsr_1_21_sspa%3Fdchild%3D1%26keywords%3Dcleanser%26qid%3D1626022171%26sr%3D8-21-spons%26psc%3D1&qualifier=1626022171&id=2141313304574964&widgetName=sp_mtf
"WOW Skin Science Apple Cider Vinegar Face Wash - No Parabens, Sulphate, Silicones & Color (200mL)  ",Limited time deal,Sponsored,,₹399,₹309,Save ₹90 (23%),4.3 out of 5 stars,460,https://www.amazon.in/gp/slredirect/picassoRedirect.html/ref=pa_sp_mtf_aps_sr_pg1_1?ie=UTF8&adId=A078613739V7IAM35YDGX&url=%2FWOW-Science-Apple-Cider-Vinegar%2Fdp%2FB08CTC9VQL%2Fref%3Dsr_1_22_sspa%3Fdchild%3D1%26keywords%3Dcleanser%26qid%3D1626022171%26smid%3DA2WK4OB3ROODF0%26sr%3D8-22-spons%26psc%3D1&qualifier=1626022171&id=2141313304574964&widgetName=sp_mtf
"Kaya Clinic Acne Free Purifying Cleanser, Salicylic Acid face wash for pimple-prone, combination, oily skin 50 ml  ",,Sponsored,,₹150,₹112,Save ₹38 (25%),4.0 out of 5 stars,"1,191",https://www.amazon.in/gp/slredirect/picassoRedirect.html/ref=pa_sp_mtf_aps_sr_pg1_1?ie=UTF8&adId=A0948614NFVZLMK8IUVQ&url=%2FKaya-Clinic-Purifying-Cleanser-50%2Fdp%2FB07PC72VZY%2Fref%3Dsr_1_23_sspa%3Fdchild%3D1%26keywords%3Dcleanser%26qid%3D1626022171%26sr%3D8-23-spons%26psc%3D1&qualifier=1626022171&id=2141313304574964&widgetName=sp_mtf
"WOW Skin Science Apple Cider Vinegar Foaming Face Wash - with Organic Certified Himalayan Apple Cider Vinegar - No Parabens, Sulphate, Silicones & Color (with Built-in Brush),150ml  ",Limited time deal,Sponsored,,₹389,₹359,Save ₹30 (8%),4.1 out of 5 stars,"19,813",https://www.amazon.in/gp/slredirect/picassoRedirect.html/ref=pa_sp_mtf_aps_sr_pg1_1?ie=UTF8&adId=A0786193390PLISBXCJM5&url=%2FWOW-Organic-Vinegar-Foaming-Built%2Fdp%2FB07SQXPW35%2Fref%3Dsr_1_24_sspa%3Fdchild%3D1%26keywords%3Dcleanser%26qid%3D1626022171%26smid%3DAT95IG9ONZD7S%26sr%3D8-24-spons%26psc%3D1&qualifier=1626022171&id=2141313304574964&widgetName=sp_mtf
"Brinton Doux Deep Cleanser, Face Cleansing Cream, 125 ml  ",Deal of the Day ,,,₹254,₹187,Save ₹67 (26%),4.4 out of 5 stars,101,https://www.amazon.in/Brinton-Doux-Deep-Cleanser-125ml/dp/B07558D89H/ref=sr_1_25?dchild=1&keywords=cleanser&qid=1626022171&sr=8-25
"Ozone D-Tan Facial Cleanser with 100% Natural Extracts for Tan Removal, Sun Damage Protection and Skin Whitening - 250 G  ",,,,₹600,₹480,Save ₹120 (20%),4.0 out of 5 stars,551,https://www.amazon.in/Ozone-De-Tan-Cleanser-250G/dp/B07D9BD3K3/ref=sr_1_26?dchild=1&keywords=cleanser&qid=1626022171&sr=8-26
"Cetaphil Gentle Skin Cleanser, 250ml  ",,,,₹515,₹388,Save ₹127 (25%),4.5 out of 5 stars,467,https://www.amazon.in/Cetaphil-Gentle-Skin-Cleanser-250ml/dp/B0792Y9B9X/ref=sr_1_27?dchild=1&keywords=cleanser&qid=1626022171&sr=8-27
"Phace Non Drying & Fully Hydrating Cleanser, 175 ml  ",Limited time deal,,,₹700,₹560,Save ₹140 (20%),5.0 out of 5 stars,3,https://www.amazon.in/Phace-Drying-Fully-Hydrating-Cleanser/dp/B08VG3Q27V/ref=sr_1_28?dchild=1&keywords=cleanser&qid=1626022171&sr=8-28
"Forest Essentials Delicate Facial Cleanser, Saffron and Neem, 50ml  ",,,,,₹350,,4.3 out of 5 stars,"1,005",https://www.amazon.in/Forest-Essentials-Delicate-Cleanser-Saffron/dp/B009VELS34/ref=sr_1_29?dchild=1&keywords=cleanser&qid=1626022171&sr=8-29
"The Face Shop Rice Water Bright Cleansing foam, 150ml  ",,,,₹650,₹618,Save ₹32 (5%),4.4 out of 5 stars,509,https://www.amazon.in/Faceshop-Water-Bright-Cleansingfoam-150ml/dp/B00FJ2LU2Q/ref=sr_1_30?dchild=1&keywords=cleanser&qid=1626022171&sr=8-30
Aroma Magic Mint Cleanser (100 gm)  ,,,,₹285,₹217,Save ₹68 (24%),4.2 out of 5 stars,274,https://www.amazon.in/Aroma-Magic-Mint-Cleanser-Refreshes/dp/B00ZRG0HAU/ref=sr_1_31?dchild=1&keywords=cleanser&qid=1626022171&sr=8-31
"Qraa Men De-Tan Cleanser For Men For Skin Lightening/Brightening, 100 g  ",,,,₹350,₹227,Save ₹123 (35%),3.6 out of 5 stars,705,https://www.amazon.in/Qraa-Men-Cleanser-Lightening-Brightening/dp/B07NVKT7Z6/ref=sr_1_32?dchild=1&keywords=cleanser&qid=1626022171&sr=8-32
SkinKraft Syndet Face Cleanser -Customized Face Wash For Normal to Oily and Normal to Dry Skin - Hydrates To Protect Skin’s Natural Moisture Barrier - Reduces Skin Sensitivity - Non-comedogenic & Non-drying - 60ml  ,Deal of the Day ,,,₹499,₹349,Save ₹150 (30%),3.9 out of 5 stars,88,https://www.amazon.in/SkinKraft-Syndet-Cleanser-Customized-Normal/dp/B091Y3L898/ref=sr_1_33?dchild=1&keywords=cleanser&qid=1626022171&sr=8-33
"Aroma Magic Turmeric Cleanser and Soothes For Combination Skin, 100g  ",,,,₹310,₹217,Save ₹93 (30%),4.2 out of 5 stars,155,https://www.amazon.in/Aroma-Magic-Turmeric-Cleanser-Combination/dp/B00ZRG15OM/ref=sr_1_34?dchild=1&keywords=cleanser&qid=1626022171&sr=8-34
"Dabur Gulabari Rose Glow Face Cleanser, 100ml  ",,,,₹75,₹65,Save ₹10 (13%),4.1 out of 5 stars,"1,290",https://www.amazon.in/Dabur-Gulabari-Rose-Glow-Cleanser/dp/B01CGEOO18/ref=sr_1_35?dchild=1&fpw=pantry&keywords=cleanser&qid=1626022171&s=pantry&sr=8-35
LUMISE CLEANSER 100GM  ,,,,₹400,₹350,Save ₹50 (13%),4.4 out of 5 stars,26,https://www.amazon.in/Generic-LUMISE-CLEANSER-100GM/dp/B08FD59HLT/ref=sr_1_36?dchild=1&keywords=cleanser&qid=1626022171&sr=8-36
"Dermafique Absolute Detox Facial Cleanser for Normal To Dry Skin, Dermatologist Tested, Soap Free (100 ml)  ",,,,₹208,₹195.62,Save ₹12.38 (6%),4.2 out of 5 stars,347,https://www.amazon.in/Dermafique-Absolute-Detox-Facial-Cleanser/dp/B07DDQ6QH2/ref=sr_1_37?dchild=1&keywords=cleanser&qid=1626022171&sr=8-37
Biotique Bio Pineapple Oil Control Foaming Face Cleanser Normal to Oily Skin (120 ml)  ,,,,₹149,₹97,Save ₹52 (35%),4.3 out of 5 stars,366,https://www.amazon.in/Biotique-Pineapple-Control-Foaming-Cleanser/dp/B00791CR0Y/ref=sr_1_38?dchild=1&keywords=cleanser&qid=1626022171&sr=8-38
Recast 2% BHA Liquid Salicylic Acid Cleanser--Dermipure Face Cleanser for Blackheads | Enlarged Pores | sebum control | Wrinkles | Fine Lines - 200ml  ,,,,₹499,₹449,Save ₹50 (10%),4.1 out of 5 stars,239,https://www.amazon.in/Salicylic-Cleanser-Dermipure-Cleanser-Blackheads-Enlarged/dp/B08MWV9D2B/ref=sr_1_39?dchild=1&keywords=cleanser&qid=1626022171&sr=8-39
"The Derma Co 3% AHA-BHA Foaming Face Wash, Anti Acne Foaming Cleanser for Face- 100 ml(dermaco)  ",Limited time deal,,,₹349,₹331,Save ₹18 (5%),4.2 out of 5 stars,287,https://www.amazon.in/Derma-Co-AHA-BHA-Foaming-Cleanser/dp/B08TRCJZLP/ref=sr_1_40?dchild=1&keywords=cleanser&qid=1626022171&smid=A61C6NUFGVGS7&sr=8-40
"Forest Essentials Delicate Facial Cleanser Mashobra Honey, Lemon and Rosewater 50ml  ",,,,,₹350,,4.3 out of 5 stars,469,https://www.amazon.in/Forest-Essentials-Travel-Cleanser-Rosewater/dp/B009VFVRMK/ref=sr_1_41?dchild=1&keywords=cleanser&qid=1626022171&sr=8-41
FCL C Scape Cleanser for Gentle Exfoliation and a Brightening Face Wash For Unevenly Pigmented Skin 75ml  ,,,,₹450,₹396,Save ₹54 (12%),4.2 out of 5 stars,33,https://www.amazon.in/FCL-Cleanser-Exfoliation-Brightening-Pigmented/dp/B089NNDN43/ref=sr_1_42?dchild=1&keywords=cleanser&qid=1626022171&sr=8-42
"Azani Active Care Acne Clarifying Cleanser with 1% Salicylic Acid & 0.5% Glycolic Acid | Face Wash for Acne & Oily Skin | Removes Dirt, Oil & Makeup Without Over Drying - Women & Men - 100 ml  ",,,,₹495,₹349,Save ₹146 (29%),5.0 out of 5 stars,3,https://www.amazon.in/Azani-Active-Care-Clarifying-Salicylic/dp/B097LVB2FC/ref=sr_1_43?dchild=1&keywords=cleanser&qid=1626022171&sr=8-43
"Plum Hello Aloe Gentle Cleansing Lotion | For Dry, Very Dry Skin | Hydrates the Skin | Argan Oil | 100% Vegan | Paraben Free | 200ml  ",,,,₹390,₹312,Save ₹78 (20%),4.2 out of 5 stars,278,https://www.amazon.in/Plum-Hello-Gentle-Cleansing-Lotion/dp/B00OCJ4W5O/ref=sr_1_44?dchild=1&keywords=cleanser&qid=1626022171&sr=8-44
"Biumark Dermaceuticals Pvt Ltd Biutox Vitamin C Cleanser | Lightens the skin | Pore reduction T Zone Oiliness | Dermatologist Tested, Non-Comedogenic Hypoallergenic  ",,,,,,,4.7 out of 5 stars,5,https://www.amazon.in/Biumark-Dermaceuticals-Pvt-Ltd-Non-Comedogenic/dp/B08DSDWYC4/ref=sr_1_45?dchild=1&keywords=cleanser&qid=1626022171&sr=8-45
"ELIBLISS Brightening Vitamin C Foaming Face Wash With Built-In Face Cleanser Brush For Deep Cleansing, Bright Beauty Spot-less Glow - No Parabens, Silicones, 150 ml  ",,,,₹499,₹249,Save ₹250 (50%),4.0 out of 5 stars,12,https://www.amazon.in/ELIBLISS-Brightening-Cleanser-Cleansing-Spot-less/dp/B095RP8MZ2/ref=sr_1_46?dchild=1&keywords=cleanser&qid=1626022171&sr=8-46
"Neutrogena Extra Gentle Facial Cleanser, 200ml  ",,,,₹600,₹572,Save ₹28 (5%),4.2 out of 5 stars,422,https://www.amazon.in/Neutrogena-Extra-Gentle-Cleanser-200ml/dp/B000052ZB2/ref=sr_1_47?dchild=1&keywords=cleanser&qid=1626022171&sr=8-47
"Organic Harvest Vitamin A Face Cleanser with Broccoli & Aloe Vera Ideal for Dry Skin, Reverse Signs of Ageing, Provides Youthful Skin, for Women & Girls, 100% Organic, Paraben & Sulphate Free – 100ml  ",,,,₹495,₹470,Save ₹25 (5%),4.9 out of 5 stars,84,https://www.amazon.in/Organic-Harvest-Cleanser-Broccoli-Provides/dp/B0963XG3DV/ref=sr_1_48?dchild=1&keywords=cleanser&qid=1626022171&sr=8-48
Episoft Cleansing Lotion for Sensitive & Dry Skin I Gentle Cleanser removes Excess oil I Moisturises and Makes Skin Soft and Glowing I Removes Makeup I Free of SLS & Paraben 250ml  ,,,,₹550,₹395,Save ₹155 (28%),4.5 out of 5 stars,44,https://www.amazon.in/Episoft-Cleansing-Lotion-Sensitive-Skin/dp/B08H636F4F/ref=sr_1_49?dchild=1&keywords=cleanser&qid=1626022171&sr=8-49
Mamaearth Vitamin C Face Wash with Foaming Silicone Cleanser Brush Powered by Vitamin C & Turmeric - 150ml  ,Limited time deal,,,₹399,₹358,Save ₹41 (10%),4.2 out of 5 stars,"7,864",https://www.amazon.in/Mamaearth-Vitamin-Silicone-Cleanser-Turmeric/dp/B08HYWPLL8/ref=sr_1_50?dchild=1&keywords=cleanser&qid=1626022171&smid=A61C6NUFGVGS7&sr=8-50
"Lotus Herbals Lemonpure Turmeric And Lemon Cleansing Milk, 170ml  ",Limited time deal,,,₹375,₹270,Save ₹105 (28%),4.3 out of 5 stars,"1,218",https://www.amazon.in/Lotus-Herbals-Lemonpure-Turmeric-Cleansing/dp/B006QKBHZ0/ref=sr_1_51?dchild=1&keywords=cleanser&qid=1626022171&smid=AT95IG9ONZD7S&sr=8-51
"Olay Face Wash Total Effects 7 in 1 Exfoliating Cleanser, 100g  ",,,,₹269,₹252,Save ₹17 (6%),4.3 out of 5 stars,"1,270",https://www.amazon.in/Olay-Total-Effects-Ageing-Cleanser/dp/B00G4UDQJW/ref=sr_1_52?dchild=1&keywords=cleanser&qid=1626022171&sr=8-52
"Kaya Clinic Soothing Cleansing Gel, Soap free & gentle face wash with Niacinamide for daily use, all skin types 100 ml  ",Limited time deal,,,₹290,₹218,Save ₹72 (25%),4.4 out of 5 stars,145,https://www.amazon.in/Kaya-Clinic-Soothing-Cleansing-Gel/dp/B082VL4PYF/ref=sr_1_53?dchild=1&keywords=cleanser&qid=1626022171&smid=AT95IG9ONZD7S&sr=8-53
SR TRADERS 4 in 1 Multi-function Blackhead and Whitehead Remover Vacuum Suction Device Skin Cleaner Device Acne Cleaner Pore Cleaner Facial Beauty Kit For Men And Women  ,,,,₹969,₹247,Save ₹722 (75%),1.6 out of 5 stars,3,https://www.amazon.in/SR-TRADERS-Multi-function-Blackhead-Whitehead/dp/B08NHBMD4W/ref=sr_1_54?dchild=1&keywords=cleanser&qid=1626022171&sr=8-54
"Organic Harvest Vitamin B Face Cleanser with Spinach & Niacinamide for Oily & Combination Skin, Fights Pimples & Painful Acne, 100% Organic, Paraben & Sulphate Free – 100ml  ",Limited time deal,,,₹495,₹446,Save ₹49 (10%),4.8 out of 5 stars,141,https://www.amazon.in/Organic-Harvest-Cleanser-Niacinamide-Combination/dp/B094DF49TX/ref=sr_1_55?dchild=1&keywords=cleanser&qid=1626022171&smid=AMUQ56Q1P787N&sr=8-55
DAUGHTER EARTH AHA BHA PHA Exfoliating Cleanser - Daily Face Wash with Fruit Enzymes and Red Algae Extracts- 100ml  ,Deal of the Day ,,,₹875,₹831,Save ₹44 (5%),4.5 out of 5 stars,38,https://www.amazon.in/DAUGHTER-EARTH-AHA-Exfoliating-Cleanser/dp/B08XBQCB9Z/ref=sr_1_56?dchild=1&keywords=cleanser&qid=1626022171&sr=8-56
"Neutrogena Deep Clean Facial Cleanser For Normal To Oily Skin, 200ml  ",,Sponsored,,₹399,₹374,Save ₹25 (6%),4.3 out of 5 stars,"4,268",https://www.amazon.in/gp/slredirect/picassoRedirect.html/ref=pa_sp_btf_aps_sr_pg1_1?ie=UTF8&adId=A00219151BEOVQQOD7DLN&url=%2FNeutrogena-Clean-Facial-Cleanser-200ml%2Fdp%2FB006LXDQRY%2Fref%3Dsr_1_57_sspa%3Fdchild%3D1%26keywords%3Dcleanser%26qid%3D1626022171%26sr%3D8-57-spons%26psc%3D1&qualifier=1626022171&id=2141313304574964&widgetName=sp_btf
"Organic Harvest Vitamin A Face Cleanser with Broccoli & Aloe Vera Ideal for Dry Skin, Reverse Signs of Ageing, Provides Youthful Skin, for Women & Girls, 100% Organic, Paraben & Sulphate Free – 100ml  ",,Sponsored,,₹495,₹470,Save ₹25 (5%),4.9 out of 5 stars,84,https://www.amazon.in/gp/slredirect/picassoRedirect.html/ref=pa_sp_btf_aps_sr_pg1_1?ie=UTF8&adId=A05308811FWNJUR4QZ4W6&url=%2FOrganic-Harvest-Cleanser-Broccoli-Provides%2Fdp%2FB0963XG3DV%2Fref%3Dsr_1_58_sspa%3Fdchild%3D1%26keywords%3Dcleanser%26qid%3D1626022171%26sr%3D8-58-spons%26psc%3D1&qualifier=1626022171&id=2141313304574964&widgetName=sp_btf
"Organic Harvest 3 In 1 Premium Face Wash For Oily Skin, Cleanser For Women Daily Use With Benefits of Cleansing, Scrubbing, Whitening, Paraben & Sulphate Free - 100gm  ",Limited time deal,Sponsored,,₹395,₹308,Save ₹87 (22%),4.5 out of 5 stars,833,https://www.amazon.in/gp/slredirect/picassoRedirect.html/ref=pa_sp_btf_aps_sr_pg1_1?ie=UTF8&adId=A10330612AVJ0PKZ02102&url=%2FOrganic-Harvest-Face-Wash-100ml%2Fdp%2FB00IT0QQVU%2Fref%3Dsr_1_59_sspa%3Fdchild%3D1%26keywords%3Dcleanser%26qid%3D1626022171%26smid%3DAMUQ56Q1P787N%26sr%3D8-59-spons%26psc%3D1&qualifier=1626022171&id=2141313304574964&widgetName=sp_btf
"Organic Harvest Skin Illuminate Vitamin C Cleanser for Tightening, Whitening & Brightening Skin, Infused With Acai Berry and Daisy Flower, 100% Organic, Paraben & Sulphate Free – 100ml  ",Limited time deal,Sponsored,,₹495,₹449,Save ₹46 (9%),4.5 out of 5 stars,154,https://www.amazon.in/gp/slredirect/picassoRedirect.html/ref=pa_sp_btf_aps_sr_pg1_1?ie=UTF8&adId=A06164563FV83U1YDVLLA&url=%2FOrganic-Harvest-Illuminate-Tightening-Brightening%2Fdp%2FB08ZC5C5SS%2Fref%3Dsr_1_60_sspa%3Fdchild%3D1%26keywords%3Dcleanser%26qid%3D1626022171%26smid%3DAMUQ56Q1P787N%26sr%3D8-60-spons%26psc%3D1&qualifier=1626022171&id=2141313304574964&widgetName=sp_btf
Swisse Skincare Olive Leaf Deep Cleansing Gel Face Wash for Glowing Skin- 125ml  ,,Sponsored,,₹799,₹487,Save ₹312 (39%),4.4 out of 5 stars,20,https://www.amazon.in/gp/slredirect/picassoRedirect.html/ref=pa_sp_atf_next_aps_sr_pg2_1?ie=UTF8&adId=A0709520B398X9VEIMZ0&url=%2FSwisse-Skincare-Olive-Cleansing-125ml%2Fdp%2FB089R873KY%2Fref%3Dsr_1_49_sspa%3Fdchild%3D1%26keywords%3Dcleanser%26qid%3D1626022195%26sr%3D8-49-spons%26psc%3D1&qualifier=1626022195&id=8792964784504850&widgetName=sp_atf_next
Swisse Skincare Manuka Honey Daily Glow Foaming Cleanser Face Wash for Glowing Skin with Vitamin C and Papaya Enzymes - 120 ml (Normal Skin)  ,,Sponsored,,₹799,₹439,Save ₹360 (45%),4.3 out of 5 stars,104,https://www.amazon.in/gp/slredirect/picassoRedirect.html/ref=pa_sp_atf_next_aps_sr_pg2_1?ie=UTF8&adId=A07090642D1ZIUG9XDLCK&url=%2FSwisse-Skincare-Foaming-Cleanser-Vitamin%2Fdp%2FB084M6JT69%2Fref%3Dsr_1_50_sspa%3Fdchild%3D1%26keywords%3Dcleanser%26qid%3D1626022195%26sr%3D8-50-spons%26psc%3D1&qualifier=1626022195&id=8792964784504850&widgetName=sp_atf_next
"Dr. Sheth's Vitamin E Basic Brightening Daily Face Cleanser - Vegan with Rosehip Seed Extract & Almond Oil, 50ml  ",Deal of the Day ,Sponsored,,₹375,₹337.50,Save ₹37.50 (10%),4.0 out of 5 stars,56,https://www.amazon.in/gp/slredirect/picassoRedirect.html/ref=pa_sp_atf_next_aps_sr_pg2_1?ie=UTF8&adId=A04477663EFLTPL0X2P4A&url=%2FDr-Sheths-Basic-Brightening-Cleanser%2Fdp%2FB07G24FWTT%2Fref%3Dsr_1_51_sspa%3Fdchild%3D1%26keywords%3Dcleanser%26qid%3D1626022195%26sr%3D8-51-spons%26psc%3D1&qualifier=1626022195&id=8792964784504850&widgetName=sp_atf_next
"Vedix Vibha Refreshing Face Wash For Oily Skin With Daruharidra, Sariva and Arishtaka l Customized Ayurvedic Facial Cleanser For Oily Skin - 100 ml  ",,Sponsored,,₹899,₹699,Save ₹200 (22%),,,https://www.amazon.in/gp/slredirect/picassoRedirect.html/ref=pa_sp_atf_next_aps_sr_pg2_1?ie=UTF8&adId=A02007702M7T2B3NA1AVB&url=%2FVedix-Refreshing-Daruharidra-Arishtaka-Customized%2Fdp%2FB098LHQGVL%2Fref%3Dsr_1_52_sspa%3Fdchild%3D1%26keywords%3Dcleanser%26qid%3D1626022195%26sr%3D8-52-spons%26psc%3D1&qualifier=1626022195&id=8792964784504850&widgetName=sp_atf_next
"Organic Harvest Skin Illuminate Vitamin C Cleanser for Tightening, Whitening & Brightening Skin, Infused With Acai Berry and Daisy Flower, 100% Organic, Paraben & Sulphate Free – 100ml  ",Limited time deal,,,₹495,₹449,Save ₹46 (9%),4.5 out of 5 stars,154,https://www.amazon.in/Organic-Harvest-Illuminate-Tightening-Brightening/dp/B08ZC5C5SS/ref=sr_1_53?dchild=1&keywords=cleanser&qid=1626022195&smid=AMUQ56Q1P787N&sr=8-53
The Tribe Concepts Face Brightening Daily cleanser 100g  ,,,,₹549,₹519,Save ₹30 (5%),4.1 out of 5 stars,382,https://www.amazon.in/Tribe-Concepts-Brightening-Daily-cleanser/dp/B08QGVYNT4/ref=sr_1_54?dchild=1&keywords=cleanser&qid=1626022195&sr=8-54
Frado Blackhead Remover Pore Vacuum - Electric Microdermabrasion Machine Black Head Cleaning Tool Pimple Sucker & Facial Cleanser Device for Pores Acne Nose Skin (White)  ,,,,"₹1,599",₹399,"Save ₹1,200 (75%)",,,https://www.amazon.in/Frado-Blackhead-Remover-Vacuum-Microdermabrasion/dp/B097RYGBSY/ref=sr_1_55?dchild=1&keywords=cleanser&qid=1626022195&sr=8-55
Fixderma Non Drying Cleansing Lotion 60gm  ,,,,,₹195,,4.3 out of 5 stars,55,https://www.amazon.in/Fixderma-Drying-Cleansing-Lotion-60gm/dp/B089RKVXNX/ref=sr_1_56?dchild=1&keywords=cleanser&qid=1626022195&sr=8-56
"Aroma Magic Aloe Vera Cleanser, 100g  ",,,,₹310,₹217,Save ₹93 (30%),4.1 out of 5 stars,95,https://www.amazon.in/Aroma-Magic-Aloe-Vera-Cleanser/dp/B015GYPDB0/ref=sr_1_57?dchild=1&keywords=cleanser&qid=1626022195&sr=8-57
"Kaya Clinic Soothing Cleansing Gel, Soap free & gentle face wash with Niacinamide for daily use, all skin types 50 ml  ",,,,₹150,₹105,Save ₹45 (30%),4.1 out of 5 stars,386,https://www.amazon.in/Kaya-Clinic-Soothing-Cleansing-White/dp/B07MWNN23X/ref=sr_1_58?dchild=1&keywords=cleanser&qid=1626022195&sr=8-58
"TIMESOON Beautiful Skin Care Expert Acne Pore Cleaner Vacuum Blackhead Remover Kit Skin Cleaner, Pimple Removal Tool, Acne Removal Tool, Blackhead Remover Tool (WHITE)  ",,,,"₹1,499",₹399,"Save ₹1,100 (73%)",5.0 out of 5 stars,16,https://www.amazon.in/TIMESOON-Beautiful-Cleaner-Blackhead-Remover/dp/B098QV73TX/ref=sr_1_49?dchild=1&keywords=cleanser&qid=1626022195&sr=8-49
